paivamaara,otsikko,tiivistelma,kuva
2019-09-26T07:56:16.000Z,"Uskomaton selviytymistarina: Siivooja-Tomppa, 44, sijoittaa 300 euroa kuussa, vaikka ulosotto vie osan palkasta","Tomppa Koponen joi 30 vuotta ennen raitistumistaan. Hän on nyt mukana Nuorten Osakesäästäjien Talous haltuun -kampanjassa, jonka tarkoitus on viestiä, että sijoittaminen on mahdollista ihan kaikille.",https://img.ilcdn.fi/XbokaTCSOKk24KfplQ_gIRdGOZ0=/510x318/top/img-s3.ilcdn.fi/0bcad2434a347495a1a7943a09fd61b739d03dc0156ebedc8cdd195b56f63f89.jpg
2019-09-26T07:57:18.000Z,"Opiskelijan ruumis löytyi asuntolasta Uudessa-Seelannissa, oli ollut kuolleena kaksi kuukautta eikä kukaan huomannut mitään","Lopulta haju paljasti, että jotain on pielessä.",https://img.ilcdn.fi/Rd4fra9Jo2NLlwmNOItghEAZYsM=/510x318/top/img-s3.ilcdn.fi/ad94adaaca78b306fa737c8f8321494c909d07b8f4225e394b405807fb3d732a.jpg
2019-09-26T08:04:22.000Z,"IL-Arvio: Mika Kaurismäen uutuusfilmi Mestari Cheng on hämmentävä pannukakku, jota edes sivuroolissa haahuileva Vesa-Matti Loiri ei pelasta",Onko kyseessä elokuva vai kiinalaisille suunnattu parituntinen Suomen matkailumainos?,https://img.ilcdn.fi/gMP1-wHxCbNWzHu0BeQKv5S_bSE=/510x318/top/img-s3.ilcdn.fi/aed9869ae9afc8551c0933e3c26f691b3b94833d8c9560e071eacca224cbe688.jpg
2019-09-26T08:16:18.000Z,Kissan allerginen reaktio on surkuhupaisan näköistä: kuin huuli olisi täyteaineella pumpattu,Kissa sai epätavalliseen infektioonsa lääkehoitoa.,https://img.ilcdn.fi/gb06wd9ahgIqkj_ZYHrLJhflB7E=/510x318/top/img-s3.ilcdn.fi/8eded0fa20a098103b225392597ab4f21ec505595c7f36acb8d1f3f84fd3c412.jpg
2019-09-26T08:19:50.000Z,Moshtagh Yaghoubin SJK-sopimus purettiin - ”kärsii ylirasituksesta”,Moshtagh ”Mosa ”Yaghoubi ei jatka SJK:ssa.,https://img.ilcdn.fi/8_uK5-vzaq55qaD-TJSlluFo_To=/510x318/top/img-s3.ilcdn.fi/3ae0097c92d2d04c04498c038d63f17cc06ebfa745e346109ac91d2a5ecd37ef.jpg
2019-09-26T08:30:27.000Z,3-vuotiaan tyttärensä leikkikentällä Porvoossa murhanneen isän elinkautinen tuomio pysyy voimassa – Korkein oikeus ei antanut valituslupaa,Korkein oikeus on torstaina evännyt valitusluvan Porvoossa lapsensa tappaneelta Nicolas Mathieu Chercheliltä.,https://img.ilcdn.fi/22clGS43MECLIabyvnroDIVN7N8=/510x318/top/img-s3.ilcdn.fi/e84a813bef7f426dec9ce5efcdf3dbc8390448faf36ee37ed84a2b986e506a3a.jpg
2019-09-26T08:32:11.000Z,Mitä tapahtui Leijonien sankarille Marko ”Mörkö” Anttilalle? ”Ei tämä selittelemällä parane”,Leijonien kapteeni oli neljä kuukautta sitten juhlittu sankari.,https://img.ilcdn.fi/4Y4vKpEVsZRp_yQHQzKZyAxll5I=/510x318/top/img-s3.ilcdn.fi/b70a2fe915eaabb7c60d0412f4845aaad9d5a6747868e82ff0a925e848e7aa00.jpg
2019-09-26T08:39:38.000Z,"TIS: Viivin ja Lancen suhde alkoi Amarillosta, suudelma osuikin suulle: ”Hän oli vähän, että mitäs perkelettä”",Tempation Island Suomi -ohjelman kuudennelle tuotantokaudelle osallistuneet Viivi ja Lance kertovat ohjelmaan hakeutumisesta ohjelman pressitilaisuudessa.,https://img.ilcdn.fi/FcLUoc-2NSnJ5YhxLXP1Fw5jSeU=/510x318/top/img-s3.ilcdn.fi/2738cee8a223406c6b74990b2b537853e25aa65c8e8587f2e67adddd4cb28661.jpg
2019-09-26T08:48:16.000Z,Saudi-Arabian kruununprinssi puhuu ensimmäistä kertaa Jamal Khashoggin paloittelumurhasta: Otan siitä vastuun,Murhaa käsitellään lokakuun 1. päivä ilmestyvässä dokumentissa.,https://img.ilcdn.fi/b9hceYOeC4I6DRtV97vDPyi_MOE=/510x318/top/img-s3.ilcdn.fi/023e1eeab35bbabdf038a05de1c3880e00abd9cd2a6b7e97b312cb7e0b9f5a51.jpg
2019-09-26T09:02:46.000Z,Kimmo Tiilikaisen uhkapeli kävi veronmaksajille kalliiksi – Metsähallituksen pääjohtaja itketti alaisiaan,"Kimmo Tiilikainen nosti ministerinä opiskelukaverinsa Metsähallituksen pääjohtajaksi. Se oli virhe, kirjoittaa Iltalehden politiikan ja talouden toimittaja Marko-Oskari Lehtonen.",https://img.ilcdn.fi/TFQSJKNHyL7vkSNFf-0miyom5uU=/510x318/top/img-s3.ilcdn.fi/22f824bce3b914674686379c03f4dde731cb7512d5bb8c56ba50d97d66b731c1.jpg
2019-09-26T09:10:30.000Z,Sydäntäsärkevä video: uhanalainen liemikilpikonna etsii ravintonsa jätevesiputkesta ,Sukeltajat huolestuivat näkemästään.,https://img.ilcdn.fi/q_Dpv4Kn1WTI9-kO6gCP1oXFEIA=/510x318/top/img-s3.ilcdn.fi/562e0f358f3cebc08d7f93172090a4e69b008f4558e297e6d6a47ba50e030a0f.png
2019-09-26T09:15:46.000Z,Boris Johnsonilla kaksi viikkoa aikaa antaa selvitys suhteestaan ex-malliin ja tankotanssijaan - USA:ssa Jennifer Arcurilta peritään 95 000 euron opintolainoja,Britannian pääministeri Boris Johnson on joutunut ahtaalle pormestariaikaisen suhteensa takia.,https://img.ilcdn.fi/7Uh7qf8Bw-NpjTtlj-7jMaiOchY=/510x318/top/img-s3.ilcdn.fi/7c974b0096b3456e442fd45ef2570f21964240512ccc775d3d0e27551bd6ffbf.jpg
2019-09-26T09:23:03.000Z,Leikkasi rakastajansa peniksen puutarhasaksilla - argentiinalaisnainen sai 13 vuoden vankeustuomion,Nainen oli peittänyt miehen silmät ja tarttunut sitten puutarhasaksiin.,https://img.ilcdn.fi/tH8z9Y7b2t_r_cx124-mfRQLWHI=/510x318/top/img-s3.ilcdn.fi/d3cb0cf7d94b9f4113ada24fe7408d010fb2ce60fdf67a0e061dfaac42acd003.jpg
2019-09-26T09:23:09.000Z,Pertti Salolainen kihlasi rakkaansa Niinan vuosi sitten – ei kiirettä naimisiin: ”Tämä on hyvä näin”,"Pitkän linjan poliitikko on löytänyt rinnalleen pysyvän rakkauden, mutta häitä ei ole vielä suunnitteilla.",https://img.ilcdn.fi/NdN33ULPGL3f5lDvbTVSsiziHbU=/510x318/top/img-s3.ilcdn.fi/69b999f0148d939c8e05a227461ffe6d0a59659dd004841d03ceb45fb63fb906.jpg
2019-09-26T09:40:31.000Z,Kuvat kertovat iskun voimasta: Veturi törmäsi traktoriin Etelä-Pohjanmaalla – yksi kuoli,Onnettomuus tapahtui vartioimattomassa tasoristeyksessä.,https://img.ilcdn.fi/jA2KgJ2ixUYiwOV9l4ojfYoVdKw=/510x318/top/img-s3.ilcdn.fi/aba1ae17c879cd05a12abf43acb39d55f5e8ae681572dd0760cef55191aa1f4d.jpg
2019-09-26T09:41:16.000Z,"”Olisin todella huolissani” - brutaalissa ilmastossa kilpaillut juoksija pitää MM-maratonin olosuhteita hengenvaarallisina, IAAF-pomo lupaa erikoisjärjestelyitä",Qatarin yleisurheilun MM-kilpailujen avauspäivän päättää naisten maraton. ,https://img.ilcdn.fi/krWMb2zqM91xz0MFRMKR2ehdySU=/510x318/top/img-s3.ilcdn.fi/74e2cc1cead67cf9ddfd7c1758ca906e478394fe2b3222207311bb0ba6d002bc.jpg
2019-09-26T10:01:35.000Z,Ikinuori Kaunarit-Brooke sädehti punaisella matolla – uskoisitko 58-vuotiaaksi?,Kauniit ja rohkeat -tähti viihtyi Daytime Beauty Awards -gaalassa viime viikolla.,https://img.ilcdn.fi/q3JDlJrqw33USWLosWTmp1Kipww=/510x318/top/img-s3.ilcdn.fi/6aba7b042277910e72221e89a0e8fde795358a3244fcaa7eb480f58545e0ba2a.jpg
2019-09-26T10:08:22.000Z,Matti Nykänen ei suhtautunut suopeasti Tapio Suomisen lähestymisyritykseen: ”Kopsahti aivan pääni yläpuolelle”,Tapio Suominen sai tehtäväkseen haastatella Matti Nykästä.,https://img.ilcdn.fi/9vsk6wT2vXCtIkTwr_VbGEv-IP8=/510x318/top/img-s3.ilcdn.fi/0e20a1ca1194ba7be6b180c3ff708d58c67cd16c07aac073c6fee799a389af4c.jpg
2019-09-26T10:09:48.000Z,Perhekodin ex-omistaja käytti törkeästi hyväkseen alaikäistä tyttöä – selvisi ehdollisella,Perhekodin työntekijäksi jäänyt entinen omistaja käytti törkeästi hyväkseen 15-vuotiasta tyttöä kodin sohvalla. Rikostutkinnassa miehen tietokoneelta löytyi myös lapsipornoon liittyviä hakuja.,https://img.ilcdn.fi/mlXktLKfUM-urG62xPM75-WHLPQ=/510x318/top/img-s3.ilcdn.fi/5186e55dc39de62ae4b8bc5a4b1279082c7670f4233c58d56e350881348e61c0.jpg
2019-09-26T10:12:15.000Z,Ilmiantaja raportissaan Trumpin puhelusta: ”Valkoinen talo yritti peitellä ja ymmärsi asian vakavuuden” - USA:n kongressi grillaa tiedustelujohtajaa,Ilmianto koskee Donald Trumpin puhelua Ukrainan uudelle presidentille.,https://img.ilcdn.fi/nvrPwRS5EaeNZIGmhJK9SZKyiKg=/510x318/top/img-s3.ilcdn.fi/cdc04762d84d94b11cf962a40ef972c5196c323b99295bbf6698735cf6c8ac35.jpg
2019-09-26T10:30:42.000Z,"Finanssialan Piia-Noora Kauppi: Suomalainen panee rahansa Veikkauksen peleihin, ei sijoita eikä säästä - Varallisuutta keskimäärin vain 30 000 euroa","Finanssialan (FA) toimitusjohtaja Piia-Noora Kauppi harmittelee sitä, että suomalaiset eivät sijoita eikä säästä - eivätkä vaurastu.",https://img.ilcdn.fi/8n8pEV6VoFQDfdP6axHWIVtYqYo=/510x318/top/img-s3.ilcdn.fi/3f4f21818db68873fe0115f9889ab700841cc12f113decc00b2f3548d26090ee.jpg
2019-09-26T10:35:44.000Z,Onko sinullakin someniska ja toimistokyhmy? Fysioterapeutin yksinkertainen sääntö auttaa,"Älypuhelimet ja päätetyö ovat muuttaneet ryhtimme, mutta tilanteeseen ei tarvitse alistua.",https://img.ilcdn.fi/SZ1xpnQh3y2zdLB1i8s99xjsx48=/510x318/top/img-s3.ilcdn.fi/c65f953a386f96f5b530e533f273c41baaaeef63edaeef771205e2c7dfbf2d4b.jpg
2019-09-26T10:41:53.000Z,Sukkahousukikka huijaa sääristä pidemmät – toimii joka kropalla,Muglerin näytös Pariisin muotiviikolla esitteli ensi kevään sensuellit trendit.,https://img.ilcdn.fi/5NVkIGRaigk7lX6Zjiirm-sQ_u0=/510x318/top/img-s3.ilcdn.fi/7f887217ef24fe3fddd664b29de2bfb80f620499e7517be1b3f394a5560770af.jpg
2019-09-26T10:43:50.000Z,Nolo moka oli lähellä F1-kisassa: Turva-autosta meinasi loppua bensa kesken kaiken!,Turva-auto tuli radalle peräti kolmeen eri otteeseen Singaporen GP:ssä.,https://img.ilcdn.fi/yP8XytDbuw-mSKoNYG6lxZut2ew=/510x318/top/img-s3.ilcdn.fi/90b98dea9754a9f7439360279ef2777b4cf42c84c80f63dc350c66f51c0ca372.jpg
2019-09-26T10:43:59.000Z,Prinsessa Beatrice kihloihin – kuninkaalliset häät luvassa ensi vuonna,Prinsessa Beatrice ja Edoardo Mapelli Mozzi ovat menossa naimisiin.,https://img.ilcdn.fi/FN1kG99fwdZSRNTjPgY5eeVZplw=/510x318/top/img-s3.ilcdn.fi/a17f34d6bf06f301feb3b92c666e9c9384d81011bb77d24c069cc5ffadd53de9.jpg
2019-09-26T11:14:17.000Z,Hallitukselta esitys eduskunnalle: Kevytautolain voimaantuloa siirretään vuoden päähän,Hallitus on antanut odotetusti eduskunnalle esityksen kevytautolain lykkäämisestä ensi vuoden marraskuuhun.,https://img.ilcdn.fi/XyI3TkRjvnJ9MxUb5ZqchMWt4Vo=/510x318/top/img-s3.ilcdn.fi/9e3a0e3a498e020fa3bbb17fd2c45f071a86c61fd0b854785482ae9f59e89b9e.jpg
2019-09-26T11:21:20.000Z,Markus Selin aiheutti pahennusta Hollywood-väen Karibian-risteilyllä – uhattiin heittää ulos: ”Markuksella lähti mopo käsistä”,Elokuvatuottajan kepposet eivät olleet Hollywoodin kermalle mieleen.,https://img.ilcdn.fi/5UiVaAWjt99XUEh7Iv2VKDT1Y90=/510x318/top/img-s3.ilcdn.fi/1526e47227a0020a23c1fb9103b0123f61da2e5115c88c7ed76666b69aa13854.jpg
2019-09-26T11:29:44.000Z,"Luksusristeilijää häirinneet aktivistit vetosivat ympäristöön – näin paljon saastutat oikeasti, jos lähdet ruotsinlaivalle","Liikennevälineiden päästömäärät puhuttavat. Iltalehti listasi 10 pointtia, joiden perusteella risteilyiden ilmastovaikutuksia voi arvioida.",https://img.ilcdn.fi/Lm22EAZYZpRiXOmS8ecb633j6ys=/510x318/top/img-s3.ilcdn.fi/1c35cad66c3ed9225390e1a141139a94962e4a4c4bec1b677062dcb10015bed8.jpg
2019-09-26T11:42:35.000Z,"Kirsi Salo, 52, viihtyy sinkkuna: ”Saman arvomaailman jakavia ikäisiäni miehiä on hyvin vähän”","Kahden pojan äiti elää tällä hetkellä sinkkuna. Hän on huomannut, että samanlaiset arvot ja elämänilon jakavia miehiä on hänen ikäluokassaan varsin vähän sinkkuina.",https://img.ilcdn.fi/N5DfsnnH4oOTg5NNkqYBMweQZHw=/510x318/top/img-s3.ilcdn.fi/2ccd769422f461aff6daadedb8cd87770cce71b071cc3b0700cdca99967caa68.jpg
2019-09-26T11:49:55.000Z,Kylmä suihku Venäjän GP:n kotiyleisölle – Kimi Räikköseen Singaporessa törmännyt kuski tiputetaan viimeiseen lähtöruutuun,Hondan voimayksikköä käyttävät F1-kuskit saavat uuden moottorin ja lähtöruuturangaistuksen Venäjän GP:hen. ,https://img.ilcdn.fi/YHkPcF54Tw6iMPPwBHYSuUEbEZw=/510x318/top/img-s3.ilcdn.fi/753224ae85fc9aeb8871836c2590e870a317e33ba6c5ae7f2be582fd4de4eadd.jpg
2019-09-26T12:17:03.000Z,Taksikuskin huolestuttava video Helsingistä: mies matkusti bussin takapuskurissa ,Iltalehti otti yhteyttä myös Helsingin poliisiin asiaan liittyen.,https://img.ilcdn.fi/LNAhIULMAIpsCL1ku-Mr3NmwDSc=/510x318/top/img-s3.ilcdn.fi/2f47b715f60493986ee596d4ca1e752dd2fb573cbf63677b58a71625af7ce976.jpg
2019-09-26T12:17:28.000Z,Vanhus jäi kuorma-auton alle ja kuoli Oulussa: Poliisi epäilee rikoksia,"Poliisi tutkii torstaina sattunutta liikenneonnettomuutta, jossa kuoli iäkäs mies.",https://img.ilcdn.fi/FYf7bIfa47xrI7xXXfDFk8MvX-o=/510x318/top/img-s3.ilcdn.fi/ca467d7e549e49ae1c6655812a6ed7ae6a4be4d84bc00519f4d1dfb5c990a63c.jpg
2019-09-26T12:22:45.000Z,"Seppo Taalasmaa, Saku Salin vai ehkä Jacques Jardin? Äänestä, kenet legendaarisista roolihahmoista haluaisit takaisin Salkkareihin","Salatut elämät -ohjelmasta on poistunut vuosien varrella yli 60 Pihlajakadun juonen kannalta oleellista hahmoa. Iltalehti haluaa selvittää, kenet juuri sinä haluaisit takaisin sarjaan. ",https://img.ilcdn.fi/pjt6d6RsVrAfl3z05oI_5lf5CEU=/510x318/top/img-s3.ilcdn.fi/93553302cb7d4be889627a080185d7e205dd7451e0b2f2a9d21ceadd0962a22b.jpg
2019-09-26T12:24:58.000Z,"Kuvat: Osa suomalaisurheilijoista pöyristyi kisahotellista – paksuja pölykerroksia, tupakankäryä ja hometta: ”Onhan se kämänen, yök”",Suomalaisten majapaikka Dohan MM-kisoissa ei ole kovin laadukas.,https://img.ilcdn.fi/VYo1yLckEbE0DsDvi-gxIMis-HA=/510x318/top/img-s3.ilcdn.fi/b60c86850a4281b786bc2a724b10ff7dab18ad756fc751431ee4650c8ef8fe07.jpg
2019-09-26T12:48:17.000Z,Viirupöllön traaginen törmäys sai onnellisen lopun – pelastuslaitos jakoi liikuttavan videon,Pekka-pöllö palasi luontoon saatuaan hoitoa törmäämisen jälkeen.,https://img.ilcdn.fi/xT3_aiYcXAtpN5jn-ZJ1JyjKsG0=/510x318/top/img-s3.ilcdn.fi/8b754ef6dd996506b6f2d351f28ad45df54aa171332b3720fb44363e14cc4ed0.jpg
2019-09-26T12:50:53.000Z,"Folke West, 71, palaa ruutuun vuosien jälkeen - uusi ohjelma vie jälleen maailmalle",Folke Westiltä tulee seuraavaksi vastuullista matkailua käsittelevä televisiosarja.,https://img.ilcdn.fi/gdCkkeePKUiztfSwnnwQq1viL6Y=/510x318/top/img-s3.ilcdn.fi/4f2bb2daf1e232079c4c280d3a8ef7e64eb69db82b21664ff4755be9d16386b4.jpg
2019-09-26T12:58:52.000Z,Epäilty henkirikos Turussa – useita vangittu,"Turun Luolavuoressa sijaitsevasta yksityisasunnosta löytyi sunnuntaina mies, joka menehtyi sairaalassa",https://img.ilcdn.fi/LXpVT3zqjbqgaOcY-LfqXDf5x-E=/510x318/top/img-s3.ilcdn.fi/b5f4dbd3232e585b1db133bb07d27baed7db28b5da454eb6a4a8eb782a761815.jpg
2019-09-26T13:17:22.000Z,Mika Salo on ottanut FIA-tuomarina yhteen Kimi Räikkösen kanssa – Jäämieheltä ropisee armotonta palautetta: ”Aina kun sinä saatana olet siellä”,FIAn tuomariston kuljettajajäsenenä vaikuttava Mika Salo nähdään F1-osakilpailuissa varsin usein kattojärjestön valkoisessa kauluspaidassa.,https://img.ilcdn.fi/8kKM5bjWFFuw6GcGpRrOjFKGC7Y=/0x0:3000x1876/510x318/top/img-s3.ilcdn.fi/9c8b469fa7a0a06aa1499f8f3f3a79769bf11874b029c1dc4d55a77547d0cbe0.jpg
2019-09-26T13:21:48.000Z,Airiston Helmen kohteet ilmestyivät nettiin myyntiin – näin hulppeat tilat saisi kolmella miljoonalla,Airiston Helmi asetti itsensä kesällä selvitystilaan. Liiketoiminta loppui ja kiinteistöt ovat tulleet myyntiin.,https://img.ilcdn.fi/3h7axQpIrObTn4LXBEN1s54s5Pg=/510x318/top/img-s3.ilcdn.fi/1a43e169d9549f0e5df2f0d63ff6bf9adc43cd006d0293174c02d04d891aef59.jpg
2019-09-26T13:22:11.000Z,Sarah Ferguson riemuissaan tyttärensä kihlautumisesta: ”Minä ja Andrew olemme maailman onnekkaimmat ihmiset”,Prinsessa Beatrice ja Edoardo Mapelli Mozzi menevät naimisiin vuonna 2020.,https://img.ilcdn.fi/HOLKQMlC8ACkKj8WFseg0KT_TEw=/297x177:1543x956/510x318/top/img-s3.ilcdn.fi/897a71c3d00ecdca8f3c9ee880867e86e49fe334b9f1eb8ae9f8094152ca54b8.jpg
2019-09-26T13:24:09.000Z,"Amazon esitteli älysormuksen ja älylasit, joilla voi soittaa puheluita","Verkkokauppajätti Amazon on julkistanut liudan uutuuksia. Niin Echo-, Eero- kuin Ring-tuoteperheet saivat uusia jäseniä.",https://img.ilcdn.fi/EuovAfvgbu6e-BMua_vmCo_2cmo=/510x318/top/img-s3.ilcdn.fi/59d3a821a6e1183a337e5548e3b0fbc2b71db0976d378188bbd9f8600f3ef967.jpg
2019-09-26T13:29:24.000Z,Seksiä Big Brother -talossa harrastanut Jukka joutui häätöäänestykseen - Millakin lähettämässä miestä kotimatkalle,Big Brotherista lähetetään sunnuntaina taas joku kotiin. ,https://img.ilcdn.fi/vvZu6xfMTnKi6A1y1GiJVtojjC8=/510x318/top/img-s3.ilcdn.fi/9d133da674296a79aa0779b8eacf38c66d5241fd817ceaa6fa3304bca48a26e3.jpg
2019-09-26T13:35:38.000Z,Suuritehoinen moottoripyörä lähti käsistä ensimmäisellä ajotunnilla – oppilaalle vammoja,Nuori kuljettaja oli lähtenyt ensimmäiselle ajotunnille.,https://img.ilcdn.fi/5OCbxLMlByAzfgMFHDXWQKOK4ko=/510x318/top/img-s3.ilcdn.fi/1f16f04728a9b2e8937db3bd2b26f93bd689278374f6fe731c2803299f81f23d.jpg
2019-09-26T13:52:07.000Z,"2-vuotias tepasteli talon katolla, isä nokosilla – hyytävä video Yhdysvalloista leviää",Poliisit ehtivät paikalle ennen kuin suurempaa vahinkoa ehti tapahtua.,https://img.ilcdn.fi/0EHGsJjO2g2SIovRGpOkyuT9vak=/510x318/top/img-s3.ilcdn.fi/52ca09ada01c8c90ccf1073d86a3ebbf1b442a47002895819293bc55e24d1bef.jpg
2019-09-26T13:56:09.000Z,"Vakava kuolonkolari Kotkassa: Henkilöauto jäi puristuksiin kuorma-auton alle, valtatie suljettiin",Yksi ihminen kuoli kuorma-auton ja henkilöauton kolarissa valtatie 15:llä.,https://img.ilcdn.fi/wkDT1jlFsVfvZiWzbvOYsHNUXEs=/510x318/top/img-s3.ilcdn.fi/18f45e81377a989139fb5a7d39e62300d84e581aa11d4a9167774a0a6cb7ed1d.jpg
2019-09-26T13:58:20.000Z,"Purjehtiiko Greta Thunberg, 16, kotiin? – lähetti karut terveiset vihaajilleen ja alaikäisiä uhkaileville aikuisille: ”Erilaisuus ei ole sairaus”",Ruotsalaisen ilmastoaktivistin Great Thunbergin puhe Yhdistyneiden kansakuntien ilmastokokouksessa herätti erittäin voimakkaita reaktioita puolesta ja vastaan.,https://img.ilcdn.fi/BZvm_zboJVu070UDot328xc3WbM=/510x318/top/img-s3.ilcdn.fi/244ba323ae757f0bfe048626273ad8e7c78013c1890a0b4ff768da065aeba3e8.jpg
2019-09-26T14:11:59.000Z,Onko tässä mitään järkeä? FC Barcelona huijasi 80 miljoonan euron alennuksen supertähdestä – sai rangaistukseksi naurettavan pienen sanktion,300 euron sakko on FC Barcelonalle käytännössä mitätön summa.,https://img.ilcdn.fi/i4FH8Av2k0yonBU114RSGTsqKqc=/510x318/top/img-s3.ilcdn.fi/266d3c09a8e3d221dfead15c3aaa969bc11fa5f8ae4e5e8d01d6972d6939b8f4.jpg
2019-09-26T14:15:07.000Z,"Markus Selin kommentoi viimein Juha Veijosen Vares-kohupotkuja: ”Oli vaikutelma, että Vexi ei selviä”",Veli-Pekka Lehtosen Markus Selin – Perustuu tositapahtumiin -elämäkerrassa kerrotaan näyttelijän Vares-roolia ei jatkettu alkoholiongelmien takia.,https://img.ilcdn.fi/QSq0179vTR8cShTvD79_tX3QTfY=/510x318/top/img-s3.ilcdn.fi/797166da4b74b66907cf8f79479d1445fa9e0302e302031d85014fd2464419f6.jpg
2019-09-26T14:18:55.000Z,"Liiton piikki aukeaa, jos suomalaisurheilijat haluavat pois kohuhotellista: ”Hajut on yleisin ongelma”",Urheiluliiton valmennusjohtaja Kari Niemi-Nikkola selventää suomalaisten toimintasuunnitelmaa.,https://img.ilcdn.fi/VYo1yLckEbE0DsDvi-gxIMis-HA=/510x318/top/img-s3.ilcdn.fi/b60c86850a4281b786bc2a724b10ff7dab18ad756fc751431ee4650c8ef8fe07.jpg
2019-09-26T14:24:32.000Z,"Trump aktiivisena Twitterissä: ""Demokraatit yrittävät tuhota republikaanit” – lähetti reilussa tunnissa liki 40 tviittiä",Virkasyytetutkinnan kohteeksi joutunut presidentti Donald Trump on ollut aamun aikana aktiivinen sosiaalisessa mediassa. ,https://img.ilcdn.fi/4yPIaHtmhph3QcNN7aFmAQe2H1I=/510x318/top/img-s3.ilcdn.fi/51f4b3226e790a91a080c4439936238ca2d4fc8f823d22b87ae4eeeef317a48a.jpg
2019-09-26T14:40:10.000Z,"”Älä lyö, älä lyö”, äiti rukoili vieressä – Murhaajapoika lävisti uhrin 61 kertaa ja kommentoi tekonsa tulosta häiriintyneellä tavalla",Silmitön hyökkäys tuotti elinkautisen vankeustuomion. Tekijä oli syyntakeinen.,https://img.ilcdn.fi/JGUnypt5pl4U9i7OCyOCd9gvKrw=/510x318/top/img-s3.ilcdn.fi/bdf53d756c6eb8c6b0f2946fb9f369d4d9e3f38db893a2c563398b6664bf5fcd.jpg
2019-09-26T14:49:26.000Z,Kimi Räikkönen ohittaa jo Michael Schumacherin - ”Asiat menivätkin vähän eri tavalla”,Kimi Räikkönen ohittaa Sotshissa jälleen yhden merkittävän rajapyykin. ,https://img.ilcdn.fi/7W0EnEXPHDQ9Vop5wncYeXmLOeE=/510x318/top/img-s3.ilcdn.fi/ad694bb0b0ac98015bca82ca0c5a5f9a2346e6a6b971db707f12bbe1a7799ca7.jpg
2019-09-26T14:54:25.000Z,Pelitestissä The Legend of Zelda: Link’s Awakening – uusittu versio yli 20 vuotta vanhasta klassikosta,Nintendo on herättänyt henkiin vuonna 1993 julkaistun Zelda-pelin.,https://img.ilcdn.fi/_41i5erVbnlHKGHBF5Lk_jFqXgE=/510x318/top/img-s3.ilcdn.fi/5c030de247bc95492f518c85caaeb1ff39c6587fe7f664b2ddd9cd6d8d22b49e.jpg
2019-09-26T15:00:56.000Z,"Olut pääsee pikkuhiljaa huonosta maineestaan: ”Pitäisi tajuta, ettei ole pelkkä alkoholiprosentti”",Olutasiantuntija iloitsee suomalaisen olutkulttuurin kehityksestä ja monipuolistuneesta valikoimasta. Samalla alkoholiprosenttiin keskittynyt keskustelu harmittaa.,https://img.ilcdn.fi/FnWGvYpkix10lEU2yifF-SlhG5M=/510x318/top/img-s3.ilcdn.fi/ecda9246abb2401e3d705bc9610a503cd26929baeecf137be86223c648d7964d.jpg
2019-09-26T15:12:48.000Z,Oneplus esitteli uuden puhelimensa: kehuttu näyttö sekä kolmoiskamera – hinta yhä mysteeri,Oneplus on julkaissut Oneplus 7T -puhelimensa Intiassa. ,https://img.ilcdn.fi/oN3uVIyNLBoxPm2dghBOksI2Va4=/510x318/top/img-s3.ilcdn.fi/a3ff3a1923b3e9851e84f644445b59d104577ade4f722567bc25d6497c181269.jpg
2019-09-26T15:13:39.000Z,Aivoinfarktin saanut Piia Koriseva taisteli jaloilleen tylystä tuomiosta huolimatta: ”Lääkäreiden sanat soivat takaraivossa”,"Kuntoutuminen aivoinfarktista muutti juontajan elämän, ja nyt hän kannustaa muita terveemmän elämän pariin personal trainerina.",https://img.ilcdn.fi/ZCLYC138wKrDlWOq7z70ej7_8_A=/510x318/top/img-s3.ilcdn.fi/c6294b5de64e0efe573ff291b3551ba154c619bcf9cdf84c03a5d8818d74ca85.jpg
2019-09-26T15:15:15.000Z,"Video: Kohuhotelli avasi ovensa Iltalehdelle – pomot häkeltyivät murskakritiikistä ja Norjan tempusta: ”Hän ei selitellyt, vaan poistui 10 minuutissa joukkueensa kanssa”","Dohan hotelli Ezdanin johtajat kertovat, miten norjalaiset poistuivat majapaikasta.",https://img.ilcdn.fi/POIQRbJAqfBB7YVzWqW01Fk7HNc=/510x318/top/img-s3.ilcdn.fi/a80aef9d462bdf4c7750c84ab11281a8dfb4f97a7c1aee608721ffdd25ceaffa.jpg
2019-09-26T15:33:26.000Z,Archien ensimmäinen julkinen esiintyminen – mukana tapaamassa Desmond Tutua Etelä-Afrikassa,Prinssi Harry ja Meghan Markle ovat poikansa Archien kanssa edustusmatkalla.,https://img.ilcdn.fi/k4kcsV9zB062HSURig83t2PmZGo=/510x318/top/img-s3.ilcdn.fi/891de03666d6c19be4668a7e3efbcb5fbb06e052cd1be279702b8c8bd57c5a5f.jpg
2019-09-26T15:36:13.000Z,"Video ja kuvat: Kajakkiselkkaus siirtyi Helsingin ytimeen – mielenosoittajat heittäytyivät Esplanadille, 9 niskuroijaa kiinni",Ilmastoviikko jatkuu mielenosoitusten merkeissä Helsingin keskustassa.,https://img.ilcdn.fi/wtLEEvl0RhBJzXRxdXJp7n8dA1A=/510x318/top/img-s3.ilcdn.fi/ad30f02aa534ff493e237398498f0f947ca1cad206fbdcfa7e20824df18acde0.jpg
2019-09-26T15:41:02.000Z,Naiset vaarassa: Tunteiden tukahduttaminen voi saada valtimot tukkoon -  4 keinoa päästää ärsytys ulos,Kielteisten tunteiden nieleminen ja omien tarpeiden sivuuttaminen voi olla haitaksi sydän- ja verisuoniterveydelle.,https://img.ilcdn.fi/5HOhdpSCrL2ykga3qaI8tc-OGLY=/510x318/top/img-s3.ilcdn.fi/db6371490def1ffbebd8e905818f984e3d5aa401239f3073c6fadf8e31672c64.jpg
2019-09-26T15:50:26.000Z,Celine Dion palaa Suomeen yli kymmenen vuoden tauon jälkeen – tuo jättikiertueensa Helsinkiin elokuussa,Supertähti esiintyy elokuussa Hartwall-areenalla.,https://img.ilcdn.fi/ZlDBEo1m3RgjRc-HH8oEpJor2Fo=/510x318/top/img-s3.ilcdn.fi/53bc6b30a2368561de418bd38b868bec460665cd358783fb43497e7ca82c355d.jpg
2019-09-26T15:57:13.000Z,USA:n tiedustelujohtaja: Valkoinen talo ei painostanut minua pimittämään ilmiantoa - ”Tätä ei lakaistu maton alle”,"Amerikan ykkösvakooja sanoo mielestään toimineensa lain mukaisesti, eikä häntä ole yritetty painostaa peittelemään ilmiantoa. ",https://img.ilcdn.fi/nlIvC4bGMM6ywODNgaETmj2eAeY=/510x318/top/img-s3.ilcdn.fi/662aceb575ef9bf14f0137a8a329834e3aba19194ed4d7c84465bdf1d63170da.jpg
2019-09-26T15:58:48.000Z,"Trump etenee kohusta toiseen, mutta ne eivät johda mihinkään - kulmikkaan johtajan motiivit jäävät yleisen syvän paheksunnan varjoon","Trumpin härskin kulmikas tyyli nähdään usein impulsiivisena ja vailla järkeä, eikä mietitä käytöksen taustalla mahdollisesti olevia motiiveja. ",https://img.ilcdn.fi/b8EgAa4e0GIUP4RFJ4KuD-ASntw=/510x318/top/img-s3.ilcdn.fi/3401c9bd71fadab3bbcf051782d32466feeff74c17d52615821ce8fa7b8b737d.jpg
2019-09-26T16:03:22.000Z,"Mikko Rantasen tilanteessa hyvä käänne, arvostettu kiekkotoimittaja uskoo: ”Sopimus syntyy parin seuraavan päivän aikana”",Colorado Avalanchen suomalaistähteä odottaa jättipalkka.,https://img.ilcdn.fi/W9Akglj8vaDVnpVKBSN87jENhBA=/510x318/top/img-s3.ilcdn.fi/30089afccdab41b3f4a265aefeb729af33186b87a6c9a19895733ebf83b247f6.jpg
2019-09-26T16:08:07.000Z,Lyhyen matikan hämmentävä yo-tehtävä herätti suositun suomalaiskuoron mielenkiinnon – onko oikea vastaus sittenkään oikein?,Lyhyen matematiikan yo-kokeessa kysyttiin kuoron jäsenten vähenemisen vaikutusta esitettävän kappaleen kestoon. Aventur-kuoron taiteellisen johtajan mukaan esimerkkitapauksessa vaikutus voi olla jopa puolitoista minuuttia.,https://img.ilcdn.fi/BUEwqM28pWJWlDVvFyWVeQpQIrY=/510x318/top/img-s3.ilcdn.fi/8821c8c329ededc96a18bd1cb3bbb27cf38c83026a529422d0dbadfb4880283b.jpg
2019-09-26T16:26:01.000Z,Maisa Torppa kiistää suhdekriisin – herkkä pusukuva Jari-Matti Latvalan kanssa,Jari-Matti muiskauttaa suukon Maisan poskeelle tors,https://img.ilcdn.fi/Pqj7mWET4lim442ktQqV4xZvpTk=/510x318/top/img-s3.ilcdn.fi/2542dd02b804d23973e7d9f0bdfd03342e1fc2fd09e6b68e605ef29c9666f7d8.jpg
