paivamaara,otsikko,tiivistelma,kuva,id
2025-03-30T00:34:21.000Z,"Trump autojen hintojen noususta: ""Ei voisi vähempää kiinnostaa""",Donald Trumpin määräämät tullit ulkomaisille autoille astuvat voimaan ensi viikolla. Niiden odotetaan vaikuttavan autojen hintoihin.,https://img.ilcdn.fi/Kq8EKWZtfq4TXLt0twxuT5K-FA0=/510x318/top/img-s3.ilcdn.fi/751a3675c341322054392a55cb232da4e21a3f0f15afd5f198b6a3d6b5d82655.jpg,37748C269D32454CBE1A73F877461D4B
2025-03-30T02:09:52.000Z,Nauti kevätpäivistä nyt: Kohta tulee tyly lämpöpudotus,"Lähipäivät jatkuvat keväisissä merkeissä, sitten lämpötila putoaa roimasti.",https://img.ilcdn.fi/FCaRidN1xSvR8p2b_363cQAFnxA=/510x318/top/img-s3.ilcdn.fi/65558f28607ab122217d0730911ecf196f4587f882f3793a6d28ff48d14cd419.jpg,D2A3AEC2D2454DF6AB0E2B6A703D93D1
2025-03-30T03:00:01.000Z,"Leniielle, 24, tehtiin hirveitä asioita Venäjän vankeudessa – ”Minun on todella kivuliasta puhua niistä”","Tuhannet ukrainalaiset siviilit ovat joutuneet Venäjän sotavangeiksi. Leniie Umerova kertoo Iltalehdelle, miten hän selvisi painajaisesta. ",https://img.ilcdn.fi/bSL4LzAeHzzCDQMdqrofimroD-A=/510x318/top/img-s3.ilcdn.fi/435ee8db848247b81c7a766aaeb9611aade1bbbcc1716b10eb2b64b128ba1341.jpg,489CA46476AD4791ADC4A7455D9A451D
2025-03-30T03:00:46.000Z,Aavemainen hiljaisuus,"Kuhmossa käytiin armottomia taisteluja talvi­sodan viime hetkille saakka. Ei oltu vain vaara­maisemissa, vaan myös hengen­vaarallisissa. Sota päättyi kuoleman­hiljaisuuteen.",https://img.ilcdn.fi/vkYWuT3-WSvC8gSV64Ue65bbXII=/510x318/top/img-s3.ilcdn.fi/ac32e76ffeaf494b451d45f7945c98917102d202329567a8eccba8dd0401ef78.jpg,73A432E6E4964A2BA15A1C9981510792
2025-03-30T03:31:07.000Z,Nastarengaskielto laajenee Helsingissä – Ylikomisario muistuttaa kääntöpuolesta,Lönnrotinkadun nastarengaskielto jatkuu ensi syksynä ja mukaan tulee toinenkin katu. Kolmas katu tulee harkintaan kokeilun edistyessä.,https://img.ilcdn.fi/a_5ZEw0WvdkoWftZbkcRwSQJ-8Y=/0x188:3000x2063/510x318/top/img-s3.ilcdn.fi/0e1a5ef1951d91125c0cc991a7f5c8fd8e066ba58ce55f35e72a34753357c21e.jpg,95F019B6C79243C68DE5A3A7949EC239
2025-03-30T04:03:28.000Z,"Oiva, 2, tunsi itsensä väsyneeksi – Lääkärin sanoista alkoi koettelemus, jossa aika uhkaa nyt loppua kesken",2-vuotias Oiva taistelee harvinaisen aggressiivista syöpää vastaan. Pienen pojan ainoa toivo on saada kiireellinen kantasolusiirto.,https://img.ilcdn.fi/4RJiy3OvT7heTttbCQOeuvRPWZg=/510x318/top/img-s3.ilcdn.fi/a4ac171961ed801a1cbca3c8d907ff3e77a340840f175a71f28969b499808282.png,22640C72ED0C4B44A4537AD008472FCB
2025-03-30T04:05:09.000Z,"”Tuntui, että olen kuolemaisillani” – Sean Bergenheim kertoo avoimesti kurimuksestaan",Entinen NHL-kiekkoilija Sean Bergenheim kävi pitkän kamppailun vastustajanaan long covid eli pitkäkestoinen koronatauti.,https://img.ilcdn.fi/IxLc3sTWQmBg7z0Si27vMkcnCnY=/510x318/top/img-s3.ilcdn.fi/b306d10477061e9ffbdf520e3981b2a6aff9c5912948edfcffd5ccfd78e41c4a.jpg,33C5162692264C6AA00370CB39FEC1A1
2025-03-30T04:15:00.000Z,Sähköpyöräkauppa käy kuumana – Katso millaisen pyörän saa nyt alle 1000 eurolla: ”Uskomaton hinta-laatusuhde”,"Sähköpyörää pidetään usein kalliina hankintana, mutta hyvästä tarjouksesta voi löytää laadukkaan pyörän edulliseen hintaan.",https://img.ilcdn.fi/m3M1Am811K4JQ7-HnIDGa0_zLVw=/510x318/top/img-s3.ilcdn.fi/ed578d297efd72451950a77cc4df27e841c8a6420a4c0a7d304a32a3a9b319f5.jpg,11FF48F9B7AB4DB8B72DD2FF6A4C7BA2
2025-03-30T04:22:27.000Z,Jalankulkija jäi auton alle suojatiellä,Jalankulkija loukkaantui törmäyksessä.,https://img.ilcdn.fi/VmP718hYLeMD6e2crrvpzrjQ-Fo=/510x318/top/img-s3.ilcdn.fi/14341abe7f382e99ae62a3224042bb4a74f611500db622ea2ef1716e82d742ee.jpg,7BF117ABC5C042D7BB1264BA643EE3DA
2025-03-30T04:30:00.000Z,”Näillä välineillä ei tarvitse tyytyä perinteiseen jyystöön!” Suositut Sohimit nyt -20 %!,"Sohimi-seksivälinesarja yhdistää nerokkaasti maailmanluokan suunnittelutyön, teknologian, kekseliäisyyden sekä huokean hinnan. Nyt kaikki sähäkät Sohimit saat Kaalimadolta 20 prosentin alennuksella!",https://img.ilcdn.fi/hwBgq58EP-V4VY96UQIAp3ELm2c=/510x318/top/img-s3.ilcdn.fi/12bcd5929870d0c6016609d0839c543f2e03e0969c542267079d42d024811e54.jpg,D78F6328E9814F72BE34E3898DB88ABF
2025-03-30T04:30:34.000Z,"Näin kävi, kun Sauli Niinistö tapasi Jenni Haukion – Paljastus tv:ssä",Presidentti on juhlavieraana Itse asiassa kuultuna -ohjelmassa.,https://img.ilcdn.fi/VOzFGKYgTNmzVT4eDAIcB9pjpOg=/510x318/top/img-s3.ilcdn.fi/a62410136df8e52b54cfeb22b273e6ed6f123a64b175d6069eca71daad2a535f.jpg,C7B489B1A8D046778D3CE0CE8343E769
2025-03-30T04:42:25.000Z,MM-hopeaa Suomeen!,Elias Syrjä loisti Engadissa.,https://img.ilcdn.fi/w0Db1XipBXQTGF6Sk3urh81-EMc=/0x64:3000x1940/510x318/top/img-s3.ilcdn.fi/994892d1767439f50f80e5302b14de2fc355b0f9996a04cfc5bdb378eca86014.jpg,94E1B0F9137B42A3A8E1314AA4DBDCA5
2025-03-30T05:00:06.000Z,Yksi alue yllättää Etuovi.comin datassa – ”Kohteet olleet spesiaaleja”,Andrei Koivumäen mukaan asunnon oikea hinnoittelu on nyt tärkeää.,https://img.ilcdn.fi/APbJzmBfDK24ifsfodC4sT4prQQ=/510x318/top/img-s3.ilcdn.fi/f67fc97077f48cf15453cd48b43c6da0fdc9f766ff083926906b39316de95ab1.jpg,B167EBBE66C04859980E2B1BF876D1BF
2025-03-30T05:10:52.000Z,"Pulmuset-näyttelijä, 58, on kuollut",Näyttelijä Cindyana Santangelo kuoli 58-vuotiaana.,https://img.ilcdn.fi/JqtrLBkKSPVtCLozcLDIQQUEZFU=/510x318/top/img-s3.ilcdn.fi/8259e97611f94cbe59a478a492082257a5f825dc5a53f253e60f331f7186504d.jpg,725F1D3054D6448ABFF588C85968D68C
2025-03-30T05:23:31.000Z,Nyt kulkee! Mikko Rantanen rohmusi komeat tehot,Tähtipaitojen ykkösketju oli taas iskussa.,https://img.ilcdn.fi/XGEAAmOmI4EA2DhwwT_4h1oDNC8=/0x64:3000x1940/510x318/top/img-s3.ilcdn.fi/1a91ca6b2620109b1474f2aa97fb981b3a56272497b6502d2e64eb54580590c1.jpg,595F586C98824E33A978B984C117F4BB
2025-03-30T05:40:31.000Z,Monopoly-lautapeliin historiallinen muutos,Monopolyn uudessa erikoisversiossa setelit on korvattu ensimmäistä kertaa mobiilisovelluksella.,https://img.ilcdn.fi/71Zz6O1-CVUb88KUns7H7QzXEuQ=/510x318/top/img-s3.ilcdn.fi/273c38b1844699422ef71e9d4bee21c76bbcf399a403f914a6fbe853cf008ec3.jpg,068483019E4F490D94B038BFCD56978C
2025-03-30T05:57:10.000Z,Tuomas Iisalo väisti tiukan kysymyksen,Tuomas Iisalon ensimmäinen peli Memphis Grizzliesin päävalmentajana päättyi tappioon.,https://img.ilcdn.fi/5JLtkcVTlS5kkvG2XrJa_84FOjM=/0x64:3000x1938/510x318/top/img-s3.ilcdn.fi/9dc438bd333424f7b9d3b76ad7f8e1a998c2a643e0bbc98d21ef6fb364be6452.jpg,E781B748765F44579CD8CA290C4181E2
2025-03-30T06:00:48.000Z,Konkarisotilas vaatii kutsuntoihin suurta mullistusta – Muuten tapahtuu tämä ,Pääesikunnan entinen suunnittelupäällikkö haluaisi kutsunnoissa sivuun jääville nuorukaisille uuden tehtävän ja ”kotirintaman” kuntoon.,https://img.ilcdn.fi/Q3BGR1mvwNhbmwdL_Wo92gzeobk=/510x318/top/img-s3.ilcdn.fi/1632cb1667a2de523eb9c7f70c1c350f8dfa4cc570dd5c5dd4be5b335570fe31.jpg,4E89917FA4A34AAA8569CAD42F5656B8
2025-03-30T06:05:36.000Z,Kuoleman kahvila,"Moni ei pystyisi osallistumaan sykähdyttävään tilaisuuteen Lahden keskustassa. ”Kahvilassa” puhutaan avoimesti sellaisista asioista, jotka yleensä kierretään kaukaa.",https://img.ilcdn.fi/DPGziSrBl4e1vF65ZR9vzsGjdSU=/0x0:3000x1876/510x318/top/img-s3.ilcdn.fi/478ff45ad34581b0eceeaffcf42fe685eebc3c7e455bdeb5a8f50c64e8f417e5.jpg,6E5454D49DAD46E48E8412088DCF7B7E
2025-03-30T06:15:05.000Z,Tänään tv:ssä: Jorma Uotinen laukoo kaksimielisyyksiä,Jorma Uotinen nähdään Pitääkö olla huolissaan -tv-paneelissa.,https://img.ilcdn.fi/msmIpBasfLqXe7OnFtyEs6So-Ts=/510x318/top/img-s3.ilcdn.fi/1f26ccee02f332900b05db13bfca4fbc524d0d11a6a55da9782bbe57d49a522b.jpg,98F854AC6B7D47FB8083A41CBEF294D8
2025-03-30T06:22:12.000Z,NBC haastatteli Trumpia – Trump ojensi puhelimen Stubbille,Presidentin Alexander Stubbin kommentteja NBC:lle ei ole julkaistu. ,https://img.ilcdn.fi/sde77Vxf8JSdS5NnsRi6-pSbKhQ=/510x318/top/img-s3.ilcdn.fi/15d9d60fe2c7f7a67e3cbfa8f467387ab2cfcea0456caea03d83f697a69c3d2c.jpg,007B207986F644F085681DFC1E2C8E23
2025-03-30T06:30:42.000Z,Täältä löytyy hiihdon uusi päävalmentaja,"Hiihtomaajoukkueeseen kannattaisi valita norjalainen luotsi ampumahiihdon tapaan, kirjoittaa Santtu Silvennoinen.",https://img.ilcdn.fi/zNfVDCdEyXxcuYAxS-kdBPsybwU=/510x318/top/img-s3.ilcdn.fi/c3705287e4d67bce151cf38f84ab10e8ddf30f0c19fbaaa94ea41d171599fda0.jpg,8942D9270D3C45619F7568A067790157
2025-03-30T06:31:17.000Z,Oletko kasvattanut tomaatin tai avokadon kotioloissa? Ei olisi kannattanut,Monissa elintarvikekäyttöön tarkoitetuissa kasveissa on suurempi tautiriski kuin siementuotannosta peräisin olevissa siemenissä.,https://img.ilcdn.fi/jrku_KFQ6W21y2DQtzqjtIXmhZ8=/510x318/top/img-s3.ilcdn.fi/96ab454786a33c7a1692603c7832171001beaf1ca256547e8c5f1da5859bc60e.jpg,1CA5959BE5924F48B61DD71D25B9DF60
2025-03-30T06:46:51.000Z,Video: Tämä kissa on todellinen draamakuningatar,"Pickle ja Gouda-kissat ihastuttavat somekansaa Tiktokissa, jossa niitä seuraa jo yli 23 tuhatta käyttäjää. Videot kissojen edesottamuksista ovat keränneet miljoonia näyttökertoja.",https://img.ilcdn.fi/YtnCxiRerPwaZVXYEPjldsJppYk=/510x318/top/img-s3.ilcdn.fi/17c4a644b262acc162076e3d73a800f1e0c5c9b912913a240507ac0d2c7118ef.jpg,A2BEAB058A8E4893A95B070A6EF77F01
2025-03-30T07:00:21.000Z,"Lidlille tapahtui jotain, mikä yllätti tutkijankin – IL kysyi, mikä asiakkaita närästää",Markkinaosuuttaan menettänyt Lidl saa asiakkailtaan sekä risuja että ruusuja. Kriittisissä kommenteissa esiin nousee erityisesti Lidlin tarjoussovellus. ,https://img.ilcdn.fi/nFvTr0iKVGnzZgez13TBN4KsiQ0=/510x318/top/img-s3.ilcdn.fi/26ebc969c6f42176354e40126ea34ea7a7976677f6e96f1d88ba4e82c9672fd0.jpg,6ECDEF21D75546BA8F94A09773F03D99
2025-03-30T07:00:29.000Z,Tuukka Taponen sai 13-vuotiaan kirittäjän,"Noah Baglin, 13, on Ferrarin junioriohjelman uusin jäsen.",https://img.ilcdn.fi/gSuVioLYeRQawRhSxSV-VZ5aK0Y=/510x318/top/img-s3.ilcdn.fi/3f06cf170581239f2892703c11849e5c5daad3ae142ce1b3277301a0ea13a726.jpg,A4431F79D0134FB3BCD3A3EA1D99B780
2025-03-30T07:13:53.000Z,Yle: Sauli Niinistö paljastaa pahimman uhkakuvansa Venäjästä,Sauli Niinistö käy läpi Suomen Nato-tietä Itse asiassa kuultuna -ohjelman juhlalähetyksessä.,https://img.ilcdn.fi/_VIhWwM0T2CEDvEQL9uOVb_HGhg=/510x318/top/img-s3.ilcdn.fi/c3aabc993834774a8cf2b357d33e34b14be875f0ce357adde210ce36f7ce3da4.jpg,507A88BD9F054BB78CAAFE7C8C354597
2025-03-30T07:28:28.000Z,”Loistava uutinen Suomelle” – Näin poliitikot kommentoivat Stubbin ja Trumpin yllätys­tapaamista,Tasavallan presidentti Alexander Stubb tapasi Yhdysvaltain presidentin Donald Trumpin Floridassa.,https://img.ilcdn.fi/lFwpIujM5NATTeiL1QqPyn2o0cs=/510x318/top/img-s3.ilcdn.fi/86b4aa81b28d4675efe6a6c683ebc0a02aaabef002ba858777b4f00f2704aeb7.jpg,218E986F9FCB4ED880347E527A23B689
2025-03-30T07:40:05.000Z,Pystyttekö puhumaan puolisosi kanssa politiikasta? Vastaa kyselyymme,Politiikka voi kuumentaa tunteita myös kotioloissa. Pystyttekö puhumaan puolisosi kanssa sulassa sovussa politiikasta vai tuleeko teille riitaa? Edustatteko erilaisia näkemyksiä? Kerro meille tilanteestasi.,https://img.ilcdn.fi/_LHKftbYgrlECXGnkZWw_iTPhyE=/510x318/top/img-s3.ilcdn.fi/7ae0210a7e3630ad82839423f71af2745bceecebd4f93ed52f77c1fe4d48e6d3.jpg,7B77D0AFDE2D480382782B675BD79295
2025-03-30T07:43:55.000Z,Veikkausliigan kapteenit asettuivat ryhmäpotrettiin – Yksi mies varastaa huomion,Veikkausliigan avajaistilaisuus järjestettiin keskiviikkona Vallilassa.,https://img.ilcdn.fi/GX_lQGPBKlxpF4r12bHnl6aDyh0=/510x318/top/img-s3.ilcdn.fi/be55283fb28cedf384b040c67de490ec108f1012ba82ab2e82b9f2d9379574a8.jpg,7A70440277604962A80A7977145D8790
2025-03-30T07:48:20.000Z,"Aleksi, 24, on kadonnut",Poliisi etsii Pohjanmaalla kadonnutta nuorta miestä.,https://img.ilcdn.fi/aZCK3-Nacjps9aCz2Om8Lff_n54=/510x318/top/img-s3.ilcdn.fi/f79fc6a5cdf9407a90058322df6f003068f175e80286fe53af647e838c05570c.jpg,9F945173867D4B87BC826339FA3D105F
2025-03-30T07:59:09.000Z,Podcast: TIS-Vilma potki puolisonsa pihalle suhdekriisin helpottuessa – Järkyttyi seurauksesta,Vilma Karjalainen kertoo Mamma Mia -podcastissa hänen ja avopuolisonsa kriiseistä.,https://img.ilcdn.fi/WVyrVIWcgx9sR3j-FY_onTYzIxk=/510x318/top/img-s3.ilcdn.fi/249a4545da2f5ad341addd82dd47ea961f80539fcc9df35a8ba5fbe33a897245.jpg,9E83748AE07E44BE9086D5714E767082
2025-03-30T08:00:23.000Z,Venäjällä kiinnosti eräs tietty aihe Stubbin ja Trumpin yllätystapaamisessa,Stubbin ja Trumpin vierailu kiinnosti ulkomaita myöten. Venäjän mediassa kiinnostivat erityisesti Yhdysvaltojen tulevat hankinnat.,https://img.ilcdn.fi/lld_W9qu-U_ZHrOkzagHqbSZwu0=/510x318/top/img-s3.ilcdn.fi/f809e5e04eae480f7e6be923938b30981017e8f7de9876e9444b3ec87a5a2bc7.png,DC76FB9C6979464198FB980663008D7A
2025-03-30T08:15:46.000Z,NHL-legenda Kimmo Timosen poika sai kovan pelikiellon,IPK:n kipparia ei välttämättä nähdä enää tällä kaudella peleissä.,https://img.ilcdn.fi/NXuGxHDFFKL93EEgXmLWSAiL5o0=/0x0:3000x1876/510x318/top/img-s3.ilcdn.fi/be2d8b74aaaae1531ea59fc3a95cab2dda4d71bc8e47ec6540a6851602620b36.jpg,A0D675C334AA411F8BFB84866F0AC47F
2025-03-30T08:39:50.000Z,Tämä mies tietää kaiken Kiinan autoteollisuudesta ja nyt hän varoittaa länsimaita: ”Vallankumouksen aalto on tulossa”,"Chryslerillä kannuksensa hankkinut, nykyinen autoalan konsultti Bill Russo latoo pöytään kylmät luvut siitä, miten ja miksi kiinalainen autoteollisuus on kasvanut räjähdysmäisesti.",https://img.ilcdn.fi/4WqT2RNapUEOGRT6L8Z3q2i4Zk8=/510x318/top/img-s3.ilcdn.fi/8ed675cb95a1a070290ea0527e09dc5c6c44baa157be3d10236cbc16be33c3c6.jpg,2148BF86B4744AA5924419AE27FF4E7F
2025-03-30T08:50:22.000Z,"Pia valmistui huippuammattiin – Sitten hän tajusi, että kuolema kiehtoo: Tällaista on työ, jota tekee Suomessa vain 30 ihmistä","Kun poliisi tarvitsee oikeuslääketieteellistä apua, paikalle singahtaa Pia Wahlsten – jopa kesken jouluaterian.",https://img.ilcdn.fi/aqkbBsymW0YtGeTH8XcGJEt3Kck=/510x318/top/img-s3.ilcdn.fi/b879697736e4c1cdaa82cb61eb3b6a602164b6a50dd7a46ccb1a9f9aa8fde4cd.jpg,8D361029B602415CAC94048929644E3C
2025-03-30T09:05:09.000Z,Perintöveron poiston vaiettu porsaanreikä,Perintöveron poistossa piilee vaiettu seuraus.,https://img.ilcdn.fi/VMc7o8GOMKcrRj7UeufDlP0ju2Y=/510x318/top/img-s3.ilcdn.fi/aaa7187a038f018cc905cc7d782129a412ba8a315d46d3e5929970cf3bfa078d.jpg,D32F47EF97EB4488AE5C7F49D3C69B46
2025-03-30T09:05:16.000Z,Ruotsin hiihtäjä pimahti,Max Novakin kisa meni pipariksi.,https://img.ilcdn.fi/i235VG7YXStYFwrnALlH0cSZkGw=/0x64:3000x1940/510x318/top/img-s3.ilcdn.fi/545a6bb7de1ce950ad3afb28f3dd25d1afd6dc5d9ea94f3d92872b5a6ae56c3b.jpg,8B05DAB37D5F4D11964939811CF6A4A3
2025-03-30T09:10:20.000Z,Muistatko Tapani Kansan rakastetut hitit? Vain todellinen biisikärpänen saa 10/10,Tapani Kansan kuolema kosketti hiljattain monia suomalaisia. Testaa tietämyksesi Kansan lukuisista hiteistä. ,https://img.ilcdn.fi/B6x20_JuaKj9ZEF6b-e8YezsW7s=/510x318/top/img-s3.ilcdn.fi/0183d60ebba0b643478a9ec5e629461815ceaeccd053830a875d502d550cf2c8.jpg,E8224DEB91354B09BBA4145B049B5778
2025-03-30T09:26:26.000Z,Laiton johtajanimitys VTV:ssä,"Korkein hallinto-oikeus katsoi, että valtiontalouden tarkastusviraston pääjohtajan tekemä päätös oli lainvastainen.",https://img.ilcdn.fi/bGS6ptuczfkl6ZKAxG5DBUxx4S4=/510x318/top/img-s3.ilcdn.fi/0023cc12ae1b8cd2f21135f50d9555ddb5269ef98f26f44b627b9dccc9409c93.jpg,01F3AEE3C4C746B8B77D4FF8A54635B8
2025-03-30T09:45:37.000Z,130 000 euron pyöräilykurssit tyrmistyttävät Vantaalla: Ihmiset mylvivät – Hanke meni jäihin,Vantaa hankki aikuisten pyöräilykursseja 130 000 eurolla. Nyt asia on vedetty takaisin kaupunginjohtajan pöydälle.,https://img.ilcdn.fi/VbUMunrAmAVuiK2vZAZX10YzSag=/510x318/top/img-s3.ilcdn.fi/ac2809dc83f6b065c626f2f4fc106775429d150dfe751d6fa4c756e56b4713aa.jpg,DBFEF81AEF134CAEB6733C6D62AF896E
2025-03-30T09:53:29.000Z,Nyt jysähti! Mäkihypyssä tehtiin uusi maailmanennätys,Domen Prevc liiteli huiman ME:n Planicassa.,https://img.ilcdn.fi/wDcBaMjkZQsnyXPlNOsDCOV_o2w=/60x0:2940x1799/510x318/top/img-s3.ilcdn.fi/7234253be86ca39697f78ec3f8278203cc8b2397c4a5e2f8da3ed7dd450e41b0.jpg,D36D018E80624548A8D7FB7BB89DAF54
2025-03-30T10:03:45.000Z,Kerttu Niskanen ladulla! Iisalmessa ratkotaan viestit,Iisalmessa kisataan sunnuntaina hiihdon Suomen cupissa perinteisen tyylin viestit.,https://img.ilcdn.fi/5mvoxaS4kx2gBRFXVtosR7fRbUY=/510x318/top/img-s3.ilcdn.fi/61d81eb0bbe9d04b22b912562acbd8d2fa46969a274c9935a17e82f46f355de0.jpg,47694CA67216466D813BF952ED7E1BD9
2025-03-30T10:07:19.000Z,"Orpo lyttäsi Lindtmanin: ”Lienet harvoja ihmisiä, joka ei ymmärrä”",Kokoomuksen ja SDP:n puheenjohtajilla sanailivat kiivaasti toistensa epäonnistumisesta talouspolitiikassa Iltalehden Suoraan asiaan -ohjelmassa.,https://img.ilcdn.fi/eVjU2ZATn057uz84QuWl4EShxOc=/510x318/top/img-s3.ilcdn.fi/8a7ca7d11516195b6cd96c7faf45f23a006669a2c81da91b766f22f4f4ffb082.jpg,4BF2FD2183D04FE2BCF8488A3A8AC0E8
2025-03-30T10:07:21.000Z,Älä pilaa parsaa – Varo kriittistä virhettä,"Kevään herkullisin sesonki, parsasesonki on alkamassa. Mutta mitä eroa eri värisillä parsoilla oikeastaan on?",https://img.ilcdn.fi/6AQck3Zb7mHYRsYyxOUXxfEAIn8=/510x318/top/img-s3.ilcdn.fi/a824f75113e95f3c4b8364e11460977718a13f6709636b349a758ec9a6f5fd42.jpg,A42F31963EF84FB281EAF8519B6CB8E0
2025-03-30T10:27:05.000Z,Karahtiko herttuatar Meghanin ja Gwyneth Paltrow’n ystävyys karille? Tyhjentävä video,Meghan ja näyttelijä Gwyneth Paltrow haluavat leikata huhuilta siivet.,https://img.ilcdn.fi/4pkYOlSIphehZd6yeG8xSdZovqA=/510x318/top/img-s3.ilcdn.fi/d7b3462a61fbabf3acc6bf65cc21b949070d5ca37dc374600b4b53967c4eb08e.jpg,ACB47410DB2542FEAAB2E605BAEE03EB
2025-03-30T10:43:18.000Z,Playboy-mallin kanssa seurustellut Kylian Mbappé pomppii kohusta kohuun ,"Kylian Mbappé on paljon muutakin kuin futari. Hän on poliittinen mielipidevaikuttaja, seurapomo ja kohusta kohuun pomppiva älykkö. Johdattaako supertähti Real Madridin Espanjan cupin finaaliin?",https://img.ilcdn.fi/iyp9_pEZDdViVTQizAQJi_xI8vE=/0x64:3000x1939/510x318/top/img-s3.ilcdn.fi/9d54894438316ec79ffaa21360b0fb2fe5cc7ea517469e35417c48432aeb4442.jpg,C4B651AA1D804A76969C88766B397AB3
2025-03-30T11:16:32.000Z,Maailman vahvin mies tykitti huiman juoksuajan,Mitchell Hooper esitteli nopeuttaan.,https://img.ilcdn.fi/rT4nahj1FW2r4UbJd6WJ8_dSsD0=/0x212:2418x1723/510x318/top/img-s3.ilcdn.fi/bb83701b3788e5bdb02706bb325629a59097db2045b5f20119ca28d4ac6486b4.jpg,88292F50EA7B4B5DAD6564CB1049539D
2025-03-30T11:34:04.000Z,Bruce Glover on kuollut,Yhdysvaltalainen näyttelijä Bruce Glover on kuollut 92-vuotiaana.,https://img.ilcdn.fi/TVGRFY2Dhmgq2-jMtz291bbZlro=/510x318/top/img-s3.ilcdn.fi/8b57ba4250404eb329421c222f2ee4c455b129bba8ef60cbff370fa6a4317cec.jpg,B33BE1FEA2C34FFD80FC4EF290916668
2025-03-30T11:40:21.000Z,"Tapani Kansa kuoli rutiinileikkauksen jälkeen – Ylilääkäri kertoo, mikä kaikki voi mennä pieleen","Sappirakon poistoleikkaus on rutiininomainen toimenpide, mutta leikkaukseen liittyy aina riskejä.",https://img.ilcdn.fi/p3893-MveQxIeH5CIm1QR1BCwFc=/510x318/top/img-s3.ilcdn.fi/f78cbdaff4ad7d3f02fc7308b0446abf94be755aab91d0e5656f590f4ac128e0.jpg,BCEF18711C5B41D1B1F0F3F2B92AE953
2025-03-30T11:55:26.000Z,14-vuotias Bianca hämmästyttää koollaan – Kenkä numeroa 46,Bianca Cucusta povataan lentopallon huippunimeä.,https://img.ilcdn.fi/i5xWvNg8XaGnv3tuWuUvkCy3SeM=/510x318/top/img-s3.ilcdn.fi/76ee2b89ca661fabc0e2c910d8fd4c60acbd3b32879b868a549e9082c57c92fe.jpg,F8103A1247E1482599A7F13DD7727267
2025-03-30T12:05:46.000Z,Gugi Kokljuschkinin herkkä kuolinilmoitus julkaistiin HS:ssä,Maaliskuun alussa kuolleen Gugi Kokljuschkinin kuolinilmoitus julkaistiin tänään sunnuntaina Helsingin Sanomissa.,https://img.ilcdn.fi/ZFgFBnp6_8qeJx0TmqfRzIx_4cc=/510x318/top/img-s3.ilcdn.fi/971853fcaf9928cb9bb3e9665b88713550828d36a971b776c13917e782e29a77.jpg,3F8A21E594924BFABE9E7DB2AA5E24D3
2025-03-30T12:29:21.000Z,Juulia Turkkila ja Matthias Versluis: Huikea pomppu MM-kisoissa,Turkkila ja Versluis nollasivat perjantain epäonnistumisen.,https://img.ilcdn.fi/BfpUdnj9YhBOPbQuagNLwmrx3bU=/510x318/top/img-s3.ilcdn.fi/45f737cf56e4be46e680a70bf712dea54a16f585d6a1e819e9cc6fe6c8831a86.jpg,74BDC83C8E844EB0BA193FFBB954A698
2025-03-30T12:29:51.000Z,Autot Suomessa alkavat hidastaa itsestään – Traficom saanut ilmoituksia autojen älytekniikan häiriöistä,Et voi täysin luottaa autosi tekniikkaan ajon aikana.,https://img.ilcdn.fi/BL27rpg8Nn_1I-P-X6lfelELxjc=/510x318/top/img-s3.ilcdn.fi/8c69a0bb04d67981931c95cc8802eaaf9d2f51b942807849af4b757a9e0604a1.jpg,B3720139C2DF41489E0C329D287388BB
2025-03-30T12:53:19.000Z,Richard Chamberlain on kuollut,Näyttelijä Richard Chamberlain kuoli 90-vuotiaana.,https://img.ilcdn.fi/jj6TEVlgnII2nzCbaggHry_3U2E=/510x318/top/img-s3.ilcdn.fi/6c469497cfdc8c6da14dff19d2921c78d83d0953c100142189677dc55ee9ceb7.jpg,23EB9CD1AA0740658559D17AF6966AFB
2025-03-30T12:55:59.000Z,”Henkisesti hirveätä”,"Suomalaisasiantuntija lataa harvinaisen suorat sanat brittihovin tilanteesta. Tämä kaikki perheessä menee pieleen jo pikkulapsivaiheesta lähtien. ”Näihin avautumisiin on reagoitu julkisesti vähän niin, että nyt puhuu hemmoteltu kakkiainen.”",https://img.ilcdn.fi/0u7PrTQPc67Jr_LCTLMGTtEMLIo=/510x318/top/img-s3.ilcdn.fi/5f2a5a00690714da4c75e1123b0f5cd5293f6ee445d3261568d271887d27614d.jpg,6D2A0A5EC53B4333BF065C8796D60889
2025-03-30T12:57:05.000Z,Helsingissä tänään tunnin ajan hyvä terassikeli? Tästä kyse,Helsingin seudun täsmäsäässä näkyi noin tunnin terassikelit.,https://img.ilcdn.fi/Kbf2IZj8O315xytunz_HmQeyjsA=/510x318/top/img-s3.ilcdn.fi/99557952f70b3d75d7b9ecac26b79c15f6a2fb9670975a6677e9fa584c280c9c.jpg,DB471BF98751497F87EBF20A5087E968
2025-03-30T13:01:36.000Z,"Ilmoita poliisille, jos näit tätä munien heittelyä ja vasarointia",Aiemmin viikolla rukoushuonetta heiteltiin kananmunilla ja nyt ikkunoita hajotettiin.,https://img.ilcdn.fi/qFi_2Fio6FOjqzPW1duwX1Mz88I=/510x318/top/img-s3.ilcdn.fi/d55a0562090b776acaed631490dc89527e445cc85cb63ba4ae86ec642adc2baa.jpg,07CB19DC0F7D4BBB94ECD1F2875856A6
2025-03-30T13:15:22.000Z,Yleisurheilutähti tuli kaapista,Yared Nuguse haluaa olla oma itsensä.,https://img.ilcdn.fi/0QOeq6jlbxBGnUlLOo7jPzrjwGc=/510x318/top/img-s3.ilcdn.fi/56c7cf6b58e890ec85efc0409f5b526a688fe1a5c54586e2ab5b1732f3719df9.jpg,026A6B894E644962A4A0F7A11B44CAA0
2025-03-30T13:26:31.000Z,"Likaista peliä Microsoftilta: Näin käy, jos et päivitä Windowsia uuteen","Microsoft on päättänyt, että ihmiset täytyy siirtää Windows 11:n pariin vaikka yksi sovellus kerrallaan.",https://img.ilcdn.fi/WHRfT6BohZgXbR7H_GVxtqJ-93g=/510x318/top/img-s3.ilcdn.fi/00e2131bb360cefc6732839a456821f0d10108d3b47ef19722cb6e654e03a41e.jpg,D860E78CE6F3434A9C75AB9E13233476
2025-03-30T13:27:15.000Z,Ensi yönä alkaa uusi leipomolakko,Suomen elintarviketyöläisten liitto on hylännyt kolmannen sovintoesityksen.,https://img.ilcdn.fi/ICLKlTVDRCiOqjhBE1stYs1JkHY=/510x318/top/img-s3.ilcdn.fi/a4b5165ece144ae06ec942e06faaa2660f388e0bb2c9a419242c2f13bcbe2942.jpg,C98964B6458B4BB6BCEA854EE1A1A7F5
2025-03-30T13:41:16.000Z,Tyynellämerellä iso maanjäristys ja tsunamivaroitus,Tongan saarivaltiossa on annettu tsunamivaroitus.,https://img.ilcdn.fi/9lY69OGx1nvb7isG7u49-NPH6LQ=/510x318/top/img-s3.ilcdn.fi/b2bf301632d24e2fcb92ff35db6c4f58e1da6b68a19e7a655c912e8de3dd02de.jpg,85C77FFBBB6442DD8AC3112E52D01C73
2025-03-30T13:46:46.000Z,Stubb kommentoi yllätystapaamista Trumpin kanssa – IL seuraa,Iltalehti seuraa hetki hetkeltä tasavallan presidentin tiedotustilaisuutta Lontoossa.,https://img.ilcdn.fi/RS6nx4LSWi8fmkcpRpkoR59tjtI=/0x64:3000x1940/510x318/top/img-s3.ilcdn.fi/462b9c4b54fd5f02d9d97f2b434cf65fa91410d53b7880803f71102f1f8754ae.jpg,EC181CD8851C438A9C93C582DEFED274
2025-03-30T13:52:41.000Z,Loukkaantuminen The Summit Suomessa: ”Veri roiskui”,Tuotannon reittivalinta ei ole The Summit Suomen kilpailijan mukaan turvallinen. ,https://img.ilcdn.fi/FF0crvpmIfdNJ27qbHfzVW-iAkA=/510x318/top/img-s3.ilcdn.fi/7130bece34cdf162055f3ae31d70866d1d7f0e2255e7248890462f151785496b.jpg,2A44DE83EE104388B4FB06CDF1411BD5
2025-03-30T14:20:29.000Z,Poltti risuja – Oli polttaa omakotitalon,"Päivystävä palomestari huomauttaa, että avotulen tekeminen on kielletty maastopalovaroituksen ollessa voimassa.",https://img.ilcdn.fi/qCXHJMiFeW9BNkWH-2BMn4yGBRo=/510x318/top/img-s3.ilcdn.fi/b9b322a70c813ed09b448f186dfc06976184b904eedde110bdca046d7e1f4de4.jpg,82E570701ABB423DA4422FD7E5B0FB71
2025-03-30T14:33:00.000Z,Kolme vajosi jäihin – Yksi kuoli,Poliisi selvittää kuolemantapauksen olosuhteita ja tiedottaa asiasta lisää maanantaina.,https://img.ilcdn.fi/WmwaO0Tz6wWZMWDJM8lt3vmhWec=/510x318/top/img-s3.ilcdn.fi/174566c584a43d6133e661c9feeba47135180d145ed29c90fe9f78d053ac44ab.jpg,3CD4D2E0E1884490BE84AEB3BE2FE5F5
2025-03-30T14:47:22.000Z,Putous-ohjaaja lähti lätkimään,Antti Tuomas Heikkinen jättää Putouksen.,https://img.ilcdn.fi/sk5iByeGP4iebeVkz2DaO5Sxc5g=/510x318/top/img-s3.ilcdn.fi/bc2913be4fc60b82f9f350fb81a4a241e33589f3b43887a972ba209457cae40d.jpg,3A7E4F308DF44686BE5044A7B36C0209
2025-03-30T14:48:01.000Z,Michael Schumacherista kerrottiin karu tieto – Tämä paljastui taustalta,F1-legendasta revitellään hurjia otsikoita.,https://img.ilcdn.fi/eq2wIt0MeYA0QfpaokykTt8qsZQ=/510x318/top/img-s3.ilcdn.fi/d89a9f0a1efebd2adde5bbc5613e234e620d5f33fe0a3cd311caa1f4c43de635.jpg,42B52ACAFE674E9BAE98144D636EEE09
2025-03-30T15:05:30.000Z,Tunnetko sivistyssanat? Armoton testi paljastaa yleissivistyksesi tason,"Jos luulet hallitsevasi sivistyssanat ja yleistietosi on hyvällä tasolla, tämä testi on sinulle.",https://img.ilcdn.fi/bcnMZun4TJvxn8srSCY4e2AV7uI=/510x318/top/img-s3.ilcdn.fi/28dfdcfcf592c9e49edbc4daf45334515168bd3bc0d6dc0044cb19a12ed0c1f3.jpg,1703323DEEF6401FAC38FEA28A02426C
