paivamaara,otsikko,tiivistelma,kuva,id
2024-01-28T15:37:45.000Z,"Alppihiihtotähti kaatui 120 kilometrin tuntinopeudessa – Järkyttävät vammat, istuu nyt pyörätuolissa",Aleksander Kilde pääsi suihkuun vasta vajaat kaksi viikkoa kaatumisen jälkeen. Seuraavat viikot menevät pyörätuolissa.,https://img.ilcdn.fi/j7x1qi0XaRYoH6xwT--aYaeCDUo=/510x318/top/img-s3.ilcdn.fi/252228620c86b0e0c0187e8c3e6f21c92d49a654ee31fd797a8f8d97b82e6f73.jpg,FD86F11FE05C476590CDB064DFBEFF3C
2024-01-28T15:58:42.000Z,Harvinaiset kuvat: Tältä näytti herttuatar Meghanin ensimmäisissä häissä,Prinssi Harryn puoliso Meghan on ollut naimisissa aiemminkin.,https://img.ilcdn.fi/WZcVzAKDIY9SdhtM8Qk_8bTQU84=/510x318/top/img-s3.ilcdn.fi/09503b38773d12463604ac58fb67c4f9648830ee73bf1a3e2bf8739bc53db2cb.jpg,D0DB01E5891F401088E653DE00C78B1C
2024-01-28T16:21:15.000Z,Sebastien Ogier itki suorassa lähetyksessä – Kertoo nyt traagisen syyn,"Sebastien Ogier saalisti hyvän tuloksen Monte Carlon MM-rallista, mutta kisaviikko oli hänelle henkisesti äärimmäisen raskas.",https://img.ilcdn.fi/bJ-K0k_JL_Jf-jzM9MPL2eDRbP0=/510x318/top/img-s3.ilcdn.fi/fce0311be7680055f85510b88ae1844f8b39c656035cf36e059806f25d989b27.jpg,675DB69186C64775AF7D1A411927CF13
2024-01-28T16:28:50.000Z,Alexander Stubbin vaalivalvojaiset: Kestääkö gallup-suosikki kärjessä? ,Suora lähetys alkaa kello 18.50. Kokoomuksen presidenttiehdokas Alexander Stubb nousi kannatusmittausten ykkössijalle loppuvuodesta.,https://img.ilcdn.fi/nJfV8SvdsJva0LtxRdSmYUWieqk=/510x318/top/img-s3.ilcdn.fi/42a7ee116c35ce928e8d246b7a290eaaee1a515515ab9c1adefb1d24002ea515.jpg,71C5F64A61EE4D7886E24A5B33AF7161
2024-01-28T16:30:35.000Z,Jussi Halla-ahon vaalivalvojaiset: Jysäyttääkö gallupien nousija jo ennakkoäänissä? ,Suora lähetys alkaa kello 19. Tammikuussa vahvaa nousua gallupeissa tehnyt perussuomalaisten ehdokas Jussi Halla-aho tavoittelee toisen kierroksen paikkaa.,https://img.ilcdn.fi/oe5dPM7JaEhvWJ7M300b7D1Xw1s=/0x64:3000x1937/510x318/top/img-s3.ilcdn.fi/693da7526d9293661fceb0c65eeff73f45ac9f385343e5f6480da2b33ee3cb77.jpg,840D4A30F619425390659FB678595D7C
2024-01-28T16:33:51.000Z,Haaviston vaalivalvojaiset: Kerääkö Haavisto vihervasemmiston äänet?,Suora lähetys alkaa kello 19. Iltalehti seuraa tässä jutussa Pekka Haaviston vaalivalvojaisia. Haaviston odotetaan saapuvan Iltalehden haastatteluun kello 19.30. ,https://img.ilcdn.fi/iFt6yd92MyCPGQ3LLOP_jG73o6M=/510x318/top/img-s3.ilcdn.fi/4eb7bbb307ddde8684c3a1cc41be2755f75ec8b6eea38cf6b4916c232d572550.jpg,66D5066F30BF47A79825B9AE999A13D7
2024-01-28T16:37:28.000Z,Suomeen saapuu poikkeuksellinen lämpöaalto – Taivas voi värjäytyä punaiseksi,Alkuviikon aikana ulkona on poikkeuksellisen lämmin. Oman värinsä tuovat myös ilmavirran kuljettamat hiekanjyvät Saharasta.,https://img.ilcdn.fi/YoAvEFp1BCgfuQs7KBz2f3dE5l0=/510x318/top/img-s3.ilcdn.fi/014980834cec399a10bb00c3c917c34e3343502fa4ce1ae4da9bd960b7670ae7.jpg,2E06A32DEA374044884D3865139926F7
2024-01-28T16:57:59.000Z,"Rumpali Juppo Paavola, 49, on kuollut",Jussipekka ”Juppo” Paavola on siirtynyt ajasta ikuisuuteen.,https://img.ilcdn.fi/jyf1L6B1AjS5nYIHTsT7cJQo4kA=/510x318/top/img-s3.ilcdn.fi/3986f826b6eb40e9430c3594c14d62ce459f29e3fef216667354a627931c20b1.jpg,88C1E39215764253953BF539FBC43826
2024-01-28T17:10:41.000Z,Tässä kiidätetään Markus Vuorelaa pelastuskopterilla sairaalaan: ”Hän oli tuskainen”,Silminnäkijähavaintojen mukaan rajusti ulos laskenut suomalaishiihtäjä pystyi liikuttamaan raajojaan.,https://img.ilcdn.fi/gSh8blLyn-3XS-6UtfecxDmWF-M=/510x318/top/img-s3.ilcdn.fi/0d09d0146d245dc58910f77900a25278ade6925e5cf6ba031f96f957cb0128a9.jpg,BCE04E8CEF2A4FFBA029B9DA78793DC5
2024-01-28T17:44:59.000Z,Jari-Matti Latvala joutui pettymään: ”Lopulta se suli käsistä”,Rallin MM-sarjan uusi pistejärjestelmä oli ensimmäistä kertaa testissä sunnuntaina päättyneessä Monte Carlon MM-rallissa.,https://img.ilcdn.fi/nYhK8EaSRxREENgfsmy1b3tPaa8=/510x318/top/img-s3.ilcdn.fi/94ca002068ada3c07c8e871b9398f18ec8a6ea2a65c9013257624e28c8f8db41.jpg,55FC2B0A0F554B7298E01DA0CC681BEC
2024-01-28T17:58:45.000Z,Gogi Mavromichalis tahtoo opettaa tyttärelleen kaksi asiaa: ”Kuningatarkin pyyhkii oman pyllynsä” ,Juontaja Gogi Mavromichalis kertoi perhearjestaan Kultainen Venla -gaalan punaisella matolla.,https://img.ilcdn.fi/dZmkmhSFcSoEr8IAZKia9U5CXBM=/510x318/top/img-s3.ilcdn.fi/7f93bdd40c8ce941909bc3204b78b81d808c248c1fc6fa689b0c8cdff394688e.jpg,B653F8545AFB405788B6B787CA2DE3B9
2024-01-28T18:02:58.000Z,Katso presidentinvaalien kaikki tulokset Iltalehden tulospalvelusta,Iltalehden vaalitulospalvelu kertoo presidentinvaalien tulokset.,https://img.ilcdn.fi/vEoCYlACJioE02k1hKylNof1KiE=/510x318/top/img-s3.ilcdn.fi/3693336e709daf33ca33c8b4a78766890fbef907c8dfff1f0856e0dc5fd02f93.jpg,8AEA5BB07B17476EAC3801D05E27F841
2024-01-28T18:07:43.000Z,Sanna Ukkola antoi pusuäänen – Somekansalta raivoreaktio,Sanna Ukkola selitti äänestysratkaisuaan halulla pysytellä puolueettomana politiikan toimittajana.,https://img.ilcdn.fi/_iIeRhFAXHWrPCvammzTILWiCyE=/510x318/top/img-s3.ilcdn.fi/0f76ed03fac0be34591f67ac3321dab6c76775bbe2839a655788608f49fcb97e.jpg,D01CBA422E0540D18529C51E2AF53899
2024-01-28T18:13:40.000Z,IL:n ennuste: Haavisto voittamassa niukasti Stubbin ,Tulossa on vielä toinen Iltalehden ennuste ääntenlaskennan edetessä.,https://img.ilcdn.fi/s25a0ppi3OOyC5QGfzsIUrmI3bY=/510x318/top/img-s3.ilcdn.fi/0ad7327a64cd01d515842bb3f135782df85c2205c2a4b31df38509f2197cdfff.jpg,BC4D8F3E091142C2992C2405DADC7928
2024-01-28T18:18:52.000Z,Näin Mika Aaltola reagoi ennakkoääniin – Paljasti tulevaisuuden suunnitelmansa,Mika Aaltolan vaalivalvojaisia vietetään riehakkaissa tunnelmissa. ,https://img.ilcdn.fi/L8_L3hhdvIzL8P0b-2OkDw05Tyk=/510x318/top/img-s3.ilcdn.fi/372d42e745911e8fb7eb7745e9cc16b31e9f90947820b644949ec4ce98550cf4.jpg,20917B6BBCDA45348C91C2D57CBB173C
2024-01-28T18:31:41.000Z,Kuva: ”Puolen Suomen” Alexander Stubb – Tämä kartta kertoo paljon äänten jakautumisesta,"Pohjoisin kunta, jossa Alexander Stubb oli suosituin ehdokas, oli Kokkola.",https://img.ilcdn.fi/tIjoA_L95-iLqBWz-lSejRXR9Ac=/510x318/top/img-s3.ilcdn.fi/95c8875f52c70d609e572891aa2d88cce7b636062820ffd168a65c8fbbbbae75.jpg,6412E955455F451A96BC292930D096DB
2024-01-28T18:34:21.000Z,Katastrofi tuhoaa rallin klassikon – Nämä kuvat eivät koskaan palaa,Iltalehti kokoaa Monte Carlon MM-rallista kolme kiinnostavinta pointtia.,https://img.ilcdn.fi/APZ7M0GvP8dFGkosetZQZ2ghpro=/510x318/top/img-s3.ilcdn.fi/b2beae93e864bbbaf42fd838fb852fd541514d6f98949f91b87f4ca255dfd143.jpg,963C850E3D1240589DAF2DE93D787B68
2024-01-28T18:34:55.000Z,"Stubb räjäytti ennakkopankin, vasemmistolaiset pysäyttivät Halla-ahon nousun","Kävi sittenkin niin, että vasemmistolaiset päättivät äänestää Pekka Haaviston toiselle kierrokselle ja estää Jussi Halla-ahon pääsyn vaalin loppuhuipennukseen, Iltalehden politiikan toimittaja Lauri Nurmi kirjoittaa.",https://img.ilcdn.fi/DPix7peyOAGeqsxqoEQdt_sChOQ=/510x318/top/img-s3.ilcdn.fi/78e9aefddcff55aa359b32ddd61e62ca0d0f7de452ceff77c47297b96ab2dfa4.jpg,F5A1F95028C04080AE82FA1A201A754A
2024-01-28T18:35:38.000Z,Tähtihyökkääjä yökerhokohun keskellä – Manchester United takelteli alasarjajoukkueen vieraana,Manchester United löi Newport Countyn sunnuntaina osumin 4–2.,https://img.ilcdn.fi/K6_CQiTvB3zQkwfNgqVWwkxP05c=/0x34:3000x1908/510x318/top/img-s3.ilcdn.fi/b048ecacb23613ad35195694a45249ec7ce5a5dccb9246bd22ae55418a6eafb5.jpg,98A6FEE8381243A99CE98AB2970597E7
2024-01-28T18:36:23.000Z,Ennakkoäänet: Tässä Suomen kunnassa äänestettiin Halla-ahoa eniten,"Jussi Halla-aho keräsi Karvialla 30,5 prosenttia ennakkoäänistä.",https://img.ilcdn.fi/2b5NewxY5nefhBUWqcMgnECIajM=/510x318/top/img-s3.ilcdn.fi/693da7526d9293661fceb0c65eeff73f45ac9f385343e5f6480da2b33ee3cb77.jpg,440ACED6531C48F6B756661170502CCE
2024-01-28T18:45:21.000Z,Olli Rehn kiskaisi yhdessä kunnassa jättipotin ennakkoäänistä,Olli Rehn keräsi Oulun vaalipiirissä eniten ennakkoääniä.,https://img.ilcdn.fi/hc--2yvHJbblbl8VLvHtBfTC1q0=/510x318/top/img-s3.ilcdn.fi/3c9ede5ad1c592eb57d4649da9bab92562dc7b64420f2dac5f73abf81803b1b9.jpg,0C3A3B1A4F7E4B8284DBB5FF872C442D
2024-01-28T18:51:45.000Z,Marin ei osallistunut Urpilaisen vaalivalvojaisiin – ”Miksi hän olisi täällä”,Entinen pääministeri ja SDP:n presidenttiehdokas Jutta Urpilaisen tukija Sanna Marin ei osallistunut vaalivalvojaisiin. ,https://img.ilcdn.fi/melwQVkWCVhfaybab7lDVF9i0xk=/510x318/top/img-s3.ilcdn.fi/be503d0c5fcf91868555a7fe878f6656e791d591235ded29cde79cde0d02ebd5.jpg,9E9642E98BAA445B861703687F4A8C81
2024-01-28T18:55:16.000Z,Patrik Laine hakeutui hoitoon,Blue Jacketsin GM Jarmo Kekäläinen kommentoi Laineen tilannetta lyhyesti.,https://img.ilcdn.fi/bLOzLwtwjNUwc7o_RIAVC-wxHNw=/510x318/top/img-s3.ilcdn.fi/11a339b7e4c6d68a50ac5e6a9e2c6ed4052506f9ebd669950fae58eb62b761fd.jpg,43B69DA33E04461488AF1D9D27C3963E
2024-01-28T18:56:27.000Z,Olli Rehn ennakkoäänistä: ”Meillä oli erittäin vahva loppukiri”,Olli Rehn on ennakkoäänten tulosten ilmoittamisen jälkeen neljännellä sijalla presidentinvaaleissa.,https://img.ilcdn.fi/PUTOCBSLHvv50D4KnpbkWpIeDPk=/510x318/top/img-s3.ilcdn.fi/22920106689bdcb93aa4f93b32aac79a5d0dbbaf555ba6addb91857d89e86929.jpg,5D7C593ECB7D41479A9AB0101BB5DE8C
2024-01-28T19:00:05.000Z,Haavisto keräämässä kovan äänisaaliin yllättävältä alueelta,Ennakkoäänten perusteella Pekka Haavisto on saanut hyvin kannatusta Pohjois-Suomesta.,https://img.ilcdn.fi/yYWw7RAnQ0YJBjjxWDUGQ4iMtds=/510x318/top/img-s3.ilcdn.fi/b1ca655591993199b296b6271404a9243d66910f22fc1996fa761a17c327071a.jpg,42B0AC470C4C45858F51338D3177EC1F
2024-01-28T19:15:06.000Z,Sofia Richie on raskaana,Viime kesänä avioitunut Sofia Richie odottaa esikoistaan.,https://img.ilcdn.fi/9n9Zuu38frMkd72dVjBw-G6bD1g=/510x318/top/img-s3.ilcdn.fi/1fe7fb4d99c4d88d0271790b79b5bd0e35c66775fe72e221785440e748abffef.jpg,9136CE03AC48411C9F5B68017B5A5269
2024-01-28T19:16:13.000Z,Mika Aaltolan kannatus lässähti – Näissä paikoissa häntä äänestettiin eniten,Ennakkoäänten perusteella Mika Aaltolan (sit) suosio oli suurinta hänen vanhassa kotikunnassaan Petäjävedellä. ,https://img.ilcdn.fi/puz8Fj31WTOWjPA_dNrQgAse62Y=/510x318/top/img-s3.ilcdn.fi/821efcdfc0ba1096744ea28a7e7e933c7a9e211c01948c7bf454377b5d9c0e7b.jpg,1E6168A9981140C58BAD3286EA4CAB20
2024-01-28T19:22:52.000Z,"Venäläismedia lyttää kaikki Suomen presidenttiehdokkaat – ”Kilpailevat siitä, kuka on russofobisin”","Venäjän hallituksen virallisen lehden mukaan on selvää, että riippumatta siitä kuka voittaa, Suomen suhde Venäjään ei tule muuttumaan. ",https://img.ilcdn.fi/LS58o7IzKQ9PLYJ_Wzenq4yvYIE=/510x318/top/img-s3.ilcdn.fi/590baeea60048234a91e69d925c6c5395ca0de204393a6b9f75d714db1f86c52.jpg,1F753A60CE624AECA8EF1F25F5356A28
2024-01-28T19:33:19.000Z,Hjallis Harkimolle surkea äänisaalis – Nollan äänestäjän kuntia pitkä liuta,Liike Nytin ehdokas on jäämässä presidentinvaalien viimeiselle sijalle.,https://img.ilcdn.fi/RJB8rhYdI760nNQTuHNOwY0kMLA=/510x318/top/img-s3.ilcdn.fi/f2a8603062c43bc833d3abb80710d233d2152372a6e2dfdf28441b94eb82eaeb.jpg,FC1056443F3A4FACBBC1AC06822BD701
2024-01-28T19:35:10.000Z,Taktinen äänestäminen teki vaaleista jännittävät ja se on hyväksi demokratialle ,"Halla-ahon vastainen taktikointi nosti Haaviston ensimmäisen kierroksen yllättäjäksi, kirjoittaa vastaava päätoimittaja Perttu Kauppinen.",https://img.ilcdn.fi/5sMO35DVEJraMzqW1vW0pjBmm-8=/510x318/top/img-s3.ilcdn.fi/c5423a1daf7abb099d6a50e04e26294ffb051d834c9156cb0005fafc755414b0.jpg,D8E71CA802E44153BE8D3D0E8ED0B347
2024-01-28T19:38:23.000Z,Patrik Laine hakeutui hoito-ohjelmaan – Tätä se tarkoittaa,Hoito-ohjelmaan on osallistunut useita NHL-pelaajia viime vuosina.,https://img.ilcdn.fi/9EcPEPeFqpsQ8RO0ftc0K5fL468=/510x318/top/img-s3.ilcdn.fi/d8257c5dbacb825ce31ee23453409a4c965f3ce2b204f95121be7a7e5581c8b0.jpg,1AF4AD7FD46F43AD87C2B0807937CAB8
2024-01-28T19:42:03.000Z,Sari Essayah keräsi kovan äänisaaliin pienestä pohjalaiskunnasta ,Sari Essayah sai prosentuaalisesti suurimman äänipottinsa Luodon kunnasta.,https://img.ilcdn.fi/ILMkc_pWKT7h3uUJd4pqIwOnoAI=/510x318/top/img-s3.ilcdn.fi/dc663b5e182655d88dcdd7b64b73c35dc27cf7ecc39f87be8e251acf0b630739.jpg,B23940FF371842FC8DF918AEB48DFD79
2024-01-28T19:50:13.000Z,Harkimon kumppani: ”Odotan normaalia arkea”,Hjallis Harkimo ei halunnut asettaa liian suuria paineita vaali-illalle.,https://img.ilcdn.fi/eic-xc3YU82r63alJCr7vo2UyDg=/510x318/top/img-s3.ilcdn.fi/43e0e60cabbb7cc1eddafa335dd2623d43d89475d0efdb66dcecaa9faed23764.jpg,BB81CD9F1B8D43FBAE4D31E024CFC888
2024-01-28T20:06:10.000Z,Halla-ahon hurja loppukiri: Jyrää voittoon kahdessa vaalipiirissä,Halla-aho nousee vaalipäivän äänillä Lapin ja Satakunnan vaalipiirien voittajaksi.,https://img.ilcdn.fi/TEhUVLELDsAlXqD9Sz6obeeKJRw=/510x318/top/img-s3.ilcdn.fi/6ddf09003ac6b7a23d90204387766d4b45fef9e8a940af033458854f9291c4b5.jpg,3E92A317355647E49F7487B143AC3B28
2024-01-28T20:13:27.000Z,Kumpaa ehdokasta Halla-aho äänestää toisella kierroksella? Näin hän vastasi,"Jussi Halla-aho ei aio ohjeistaa äänestäjiään, että kumpaa kärkiehdokasta toisella kierroksella pitäisi tukea.",https://img.ilcdn.fi/wrnr08hU0NHAo8HyuwH5DCkQqM4=/510x318/top/img-s3.ilcdn.fi/0ae5c0e6449121f0cdaa72ecd8c97532dd6b1da0b162e603a0ca9e29ca6d6131.jpg,37AD8631A02F485CAD58333E9BF385C3
2024-01-28T20:23:08.000Z,Haavisto rohmusi vasemmiston äänet – Näin kävi Anderssonin ja Urpilaisen ,Li Andersson (vas) ja ja Jutta Urpilainen (sd) keräsivät ennakkoäänistä yhteensä vain reilut kymmenen prosenttia.,https://img.ilcdn.fi/u1yOnzDeRkK3VpfI2bqr-NYYs_I=/510x318/top/img-s3.ilcdn.fi/a626738b9b14cb4f7e806f680c6923832ab715af86cdd5ef702f000d8f7bc054.jpg,F222D7DFD6BC4CF5ABA0E0D7D60CDA6A
2024-01-28T20:27:34.000Z,Näin suuri oli Suomen äänestysprosentti – Valtava hyppy ylöspäin,Äänestysprosentti jäi niukasti maagisesta 75 prosentin rajasta.,https://img.ilcdn.fi/I_3PaK2F8Wt4VjtLyrjPevSj1Jk=/510x318/top/img-s3.ilcdn.fi/acbf81f9eb7c00098bfe20545a1a35aacaf74e01f9b1fe8b0b83d291c1a95dd4.jpg,F1E977B261BA4412868C6EFD65767F97
2024-01-28T20:27:48.000Z,Netflix-tähden outo paita vilautti runsaasti kameroille: Vahinko vai tyylivalinta?,Netflix-sarja Selling Sunsetin tähdet ovat tunnettuja erikoisista ja paljastavista asuvalinnoistaan.,https://img.ilcdn.fi/7jmad5xi16TLxRlDr0NfFcbqY5U=/510x318/top/img-s3.ilcdn.fi/6378c53147f2cb18f8b1c4524cce75d5ddc827fa38266164974b3ed7530d7ec7.png,3E8B3779F25A4A3BA46BED7445D9BF06
2024-01-28T20:43:03.000Z,Puolityhjä yökerho ja pettymys Urpilaisen vaalivalvojaisissa: ”Ei voi olla tyytyväinen”,SDP:n surkeus presidentinvaaleissa sai jatkoa.,https://img.ilcdn.fi/Ri2DfvCtJAt-2fJL6JCvGZzFAak=/510x318/top/img-s3.ilcdn.fi/a90e03293372facb62497934cbd453a235b33009b8e6f1f1376cb016517e57a5.jpg,AF241FF9516142449B280CD36176F358
2024-01-28T20:52:21.000Z,"Maalitykki Luis Tejada, 41, on kuollut – Sydänkohtaus kentällä",Huippuhyökkääjä esiintyi vuoden 2018 MM-kisoissa.,https://img.ilcdn.fi/yfTgMrcURyeyZ96FJRpLYFFm5to=/510x318/top/img-s3.ilcdn.fi/fbc8808bd381c3c78a63144e40b85470437365545ec566c933ac8784459f80c9.jpg,DE31ABAFB355468AA7D1FB5A71FE8212
2024-01-28T20:54:28.000Z,"Kapellimestari Hannu Lintu rikkoi hiljaisuuden: Kertoo ex-puoliso Pekka Mattilan, 45, viimeisistä hetkistä",Ex-puoliso kertoo vain 45-vuotiaana kuolleen Pekka Mattilan viimeisistä hetkistä.,https://img.ilcdn.fi/g4-6n6U2YGYfyBscgrkORWFaplU=/510x318/top/img-s3.ilcdn.fi/d8bb34261db9b304a84591ff02b8df932779001b64b167fe9b6e4c2224954b17.png,CAD2F9827BCC4C1BA98B68AE43BE8E1F
2024-01-28T20:55:39.000Z,"Frontera palaa Suomeen – Muistatko, mikä on automerkki? ",Opelin tuleva täyssähköinen katumaasturi on nimeltään Frontera. ,https://img.ilcdn.fi/OTfNo82MsEJvYCNXUKbifqOryLo=/510x318/top/img-s3.ilcdn.fi/b0b686f1bc1f6da6baa10dd6c33aab8546be707be9a9cb85a716347526d9f67d.jpg,D24BCFA6C76646D2995AFE0F47B6AFB6
2024-01-28T21:30:04.000Z,Haavisto voitti Stubbin vaalipäivän äänissä,"Pekka Haavisto keräsi vaalipäivänä suurimman äänisaaliin, vaikka myös ennakkoäänet huomioiden Alexander Stubb oli ykkönen.",https://img.ilcdn.fi/VUtLG5q6exNkDxMtb7-BMpS4YJo=/510x318/top/img-s3.ilcdn.fi/0a081fe822b14ecb92a569207f6502d1a88cc50abb61c4daeb4f248bbdf94f62.jpg,B885BF5527B345DCB64432E7EAC0220E
2024-01-28T21:32:50.000Z,Kaleva: Nick Ritchie löysi uuden seuran,Kärppien kohupelaaja siirtyy Saksaan.,https://img.ilcdn.fi/pbZo-J500-oFaIfLItcAg9VqPFQ=/0x15:3000x1888/510x318/top/img-s3.ilcdn.fi/b46ec1b37c738481cac904ba524f0aa5f17a1ea8ba9c1afa326b6e72aeaf0d57.jpg,A6095098B7E34D859AA30F28FB2B2686
2024-01-28T21:36:18.000Z,Ukrainan asevoimissa paljastui valtava korruptiovyyhti,Tähän juttuun on koottu Venäjän hyökkäyssodan keskeisimmät tapahtumat 28. tammikuuta 2024. Kyseessä on sodan 704. päivä. ,https://img.ilcdn.fi/XSA2f93HqSAfnlVePcCFl_Yl9hc=/510x318/top/img-s3.ilcdn.fi/ec9f9b0758a9a5dfadbdc83de85867e74378815453cc8435dc10c4a23f090038.jpg,755AE21347F64424B70024B2A000A4DD
2024-01-28T21:37:02.000Z,Kummalle äänet jakautuvat toisella kierroksella? Testaa Iltalehden vaalipelillä,"Iltalehden vaalipelillä voit kokeilla, miten ensimmäisellä kierroksella annetut äänet voisivat jakautua Alexander Stubbin ja Pekka Haaviston kesken.",https://img.ilcdn.fi/D-VY_GnV2_85p7YB9T8kIClO0hA=/510x318/top/img-s3.ilcdn.fi/661704a0ca025dbd1fa65fdc5cc768471ff5fddbf1a62040c22b502400cf33b7.jpg,13F3027586194CB4BDD2BB67E51FF55C
2024-01-28T21:55:22.000Z,PS:n ryhmäpomo vaalituloksesta: ”Miellyttämisemme kannattaa aloittaa pikaisesti”,"Perussuomalaisten Jani Mäkelä huomauttaa, että Jussi Halla-ahon äänestäjät ovat toisella kierroksella ratkaisijan asemassa.",https://img.ilcdn.fi/jtFHrHv6sU_SNfnbBkoPWQhtISI=/510x318/top/img-s3.ilcdn.fi/e541002373696d26f2f7b0e9b273a7da4577d9050c81cdb3c8acd27f7c2b4f2a.jpg,D35BE5122F164059A86FC6CBAC3F1E5E
2024-01-28T22:20:51.000Z,”Bosslady” Li Andersson: ”En ole pettynyt”,Li Andersson otti vastaan viidennen sijan iloiten ja jatkaa suoraan ensi viikon poliittisiin taistoihin. ,https://img.ilcdn.fi/R24v-VU161IssEcd9pUxNW4r2Qw=/510x318/top/img-s3.ilcdn.fi/bc6f5aa5bbaee94b971af8f5f3dabda972a9096db918a84dbd201cd373862785.jpg,D91697B2216A463DBAB7F07BC4AA0EAF
2024-01-28T22:40:03.000Z,Suukkoja ja suuria tunteita,Iltalehti seurasi jännittävää vaali-iltaa ehdokkaiden vaalivalvojaisissa sekä kaupungintalolla.,https://img.ilcdn.fi/ZFMec6et6MHMtAqZ0FrSzUTGSmg=/510x318/top/img-s3.ilcdn.fi/41c671d7614cefddeab7393fea02b092ece3a90ab0772c4fb65f14f3c587423d.jpg,FD485FE176A848C186654D30E5188987
2024-01-28T22:49:33.000Z,”Matkalla kohti vaalivoittoa” – Näin Suomen vaalit puhuttavat ulkomailla,Suomen presidentinvaalien ensimmäinen kierros on kiinnostanut myös maailmalla. ,https://img.ilcdn.fi/0HN5n5gvgdKnmhwWLsy7gDLjn58=/510x318/top/img-s3.ilcdn.fi/367d88e1641658d8555fd369fee2417ccf2c60943607533ab9f55e1b4f46f8c3.jpg,375AD808DB8C40079CA35105D339D337
2024-01-28T23:07:46.000Z,Toinen heistä on Suomen seuraava presidentti – Nämä ovat Haaviston ja Stubbin suurimmat erot ,Iltalehden vaalikonevastaukset paljastavat neljä erottavaa kysymystä.,https://img.ilcdn.fi/ce_FKix7zKG7eArt20NE964zC2U=/510x318/top/img-s3.ilcdn.fi/21fc3a6eb1dcdbf1099271ba27aabb1f6e37c5f3c86131e1724300437b0b6c40.jpg,A10B6D25AE374617902EEEB86A137330
2024-01-28T23:10:36.000Z,"Venäjän ilmavoimille uusi MiG – ""Teemme niin halvan kuin mahdollista”",Ikääntyvä L-39-kalusto alkaa olla korvaajan tarpeessa.,https://img.ilcdn.fi/QDkGLpPIQ_WgIFebiqE1q--V6VQ=/510x318/top/img-s3.ilcdn.fi/1e961880f2444f709058e6135096a2be5c21caf4e2c701308f6a7de837e98303.jpg,2860AF46BBEF4FE4A339085F2DAC0F6E
2024-01-29T00:00:17.000Z,Horoskooppi,NULL,https://img.ilcdn.fi/ZJX2nPQHLedeTO4nOGca4bZ5URo=/510x318/top/img-s3.ilcdn.fi/0e855f41645f17dbb2436f21bf69f40ac48d1971a147578985e2c64c1fb985d3.jpg,3E40FC2AA54F4F23B25CAB1F717F507F
2024-01-29T01:44:08.000Z,"Patrik Laine kertoo osallistumisestaan hoito-ohjelmaan: ”Jääkiekko on ollut intohimoni ja elämäni, mutta...”","Suomalaishyökkääjä kertoo tarvitsevansa tauon jäältä, jotta pääsee taas parhaaseen mahdolliseen pelikuntoon.",https://img.ilcdn.fi/oT2IXuXDbq-zhMPQzcPWKurYWyY=/510x318/top/img-s3.ilcdn.fi/f84d876f15c6f12208577295c5023f6bc31ca27b179065976c0b40ddc2451737.jpg,643F45C6CA5B4B9DB3A442A7F955BB4C
2024-01-29T03:00:03.000Z,Tositarina kuin kauhuelokuvasta tänään tv:ssä: ”Aikuisen lapsen” oikea ikä paljastuu vihdoin,Natalia Grace Barnettin todellinen ikä paljastuu vihdoin dokumenttisarjassa Curious Case of Natalia Grace: Natalia Speaks.,https://img.ilcdn.fi/6B21ijbsxFplwGS0XF0SfJsqdtQ=/510x318/top/img-s3.ilcdn.fi/3382d4297a4098cd7dd2e79ee45a8b2355b282707da266e5f8e6795ffc6064cc.jpg,62C756E307154A129AE0691901D11A46
2024-01-29T03:12:03.000Z,Meteorologi jakaa tutun vinkin: ”Kannattaa varautua”,Maanantaina säässä tapahtuu kummia. Oranssi lumikaan ei ole poissuljettua.,https://img.ilcdn.fi/WIzkvdv42yoMps30G7tKlbgsIzY=/510x318/top/img-s3.ilcdn.fi/9f6215be344d9300b7f07f7c495d9b44b1b66c278c01dec8745b4d5f0c8f37c7.jpg,FD9C198CF3504F62B79264CC56E6669C
2024-01-29T03:30:07.000Z,Googlella katas­trofaalinen puhelinongelma – Älä vain asenna päivitystä,Googlen Pixel-puhelimiin tammikuussa julkaistua päivitystä ei toistaiseksi kannata asentaa.,https://img.ilcdn.fi/bafEuTOUCc_I8Ll27FehOeODqOI=/510x318/top/img-s3.ilcdn.fi/ae7fa46f9dfd78ba6e0bfd7b4712f16d2d9c289991f4775dd92914d7fece91c3.jpg,1FC1DB203FF047A39EA8292B732A1DA6
2024-01-29T03:47:46.000Z,Pori sen ratkaisi: Jussi Halla-aho mursi Alexander Stubbin ja Pekka Haaviston dominanssin yhdessä paikassa,Valtaosa äänistä jakautui suurissa kaupungeissa kärkikolmikolle.,https://img.ilcdn.fi/s1um80AkNqiSF0eD4p1sl6MWJBU=/510x318/top/img-s3.ilcdn.fi/3d81bd48d510a0d4a8d4ec56e910b5ac869addb71f178eeb89179a525d05f42b.jpg,4613E502C05D48848E3FBFF45C58E39B
2024-01-29T04:00:02.000Z,Liksa kuntoon,Eri puolilla Suomea on mahdollisuus päästä huipputienesteihin. Paikoin on huutava pula jopa yli 7 000 euroa tienaavista ammattilaisista. ,https://img.ilcdn.fi/Lk0zIKpfRIY0kp1GRBHOPJthjf8=/510x318/top/img-s3.ilcdn.fi/8faa8c82837a7f3adeff8394f366bdaae8c0ae88c3a2c67b96b2a6495c07aba3.jpg,9A71770B62384F229CEAA0418665358F
2024-01-29T04:06:01.000Z,Maria Huntington on raskaana!,Maria Huntingtonilla on iloisia uutisia.,https://img.ilcdn.fi/XrRt_LBBkhoORcadOmA_4DIMAV8=/510x318/top/img-s3.ilcdn.fi/2554aba386c9a857c47299a052a071cced9c9062a1ae095555b707d29f151e51.jpg,EAB0F01C656D46138506EA598905FDA7
2024-01-29T04:31:00.000Z,"Perhe etsii Floralle, 6, hautapaikkaa tv:ssä: ”Toivotetaan viimeisen kerran hyvää yötä”",Kuusivuotias Flora kuolee Lasten saattohoito -sarjan päätösjaksossa.,https://img.ilcdn.fi/D_OOcuoG7edfb0b5ODaNt0cv85o=/510x318/top/img-s3.ilcdn.fi/f29331665b4aebe86c5173d331ec9a09800475cf0c65fc9229cb584cadfa2fb9.jpg,0F87B7D114814609B2D3CA8D9F35420D
2024-01-29T04:35:16.000Z,Columbus sai lisää huonoja uutisia,Adam Fantilli jätti pelin kesken.,https://img.ilcdn.fi/YKbA2Gank1ielLizytROW6Cgql0=/0x64:3000x1938/510x318/top/img-s3.ilcdn.fi/453ece2242ad4c0530f29970bf1c27484a97bff289dcfca5526077e4615061b4.jpg,9149F62CC5D44C70840CECA2CF001D3C
2024-01-29T05:00:33.000Z,Perheenäiti sai pelottavan viestin päiväkodista – Ex-mies koetti lavastaa hirveästä teosta,"”Joku päiväkoti tulee räjäytetyksi”, uhkasi nelikymppinen mies entisen puolisonsa nimissä.",https://img.ilcdn.fi/6oRhkEz1lt1dgt63GUZq4IfIaQ8=/510x318/top/img-s3.ilcdn.fi/6845513aa59e9dc0913edfa57bcb1be28a36ae0b09c758975ff4da04058a34c6.jpg,F6ED048BB259405D92AF6E83D5D7B0F6
2024-01-29T05:01:05.000Z,Krista Pärmäkoski on uransa surkeimmassa jamassa: ”Se oli luovuttamista”,Suomalaishiihtäjän edellisestä kansainvälisestä onnistumisesta on yli vuosi. Mitä on tapahtunut?,https://img.ilcdn.fi/Df2dnoAopZBCkLh1fdMtW_GYM8E=/510x318/top/img-s3.ilcdn.fi/e28c6f4de30f41e623477632e8c11b1cd4b26bf2e72167f2d35843852ba65f69.jpg,0F9F09225A3A4979A3C0F09836D88CA1
2024-01-29T05:32:12.000Z,Bensiini- ja dieselautot pelastuvat?,"Porschen talousjohtaja Lutz Meschke ennustaa, että EU saattaa joutua myöhäistämään vuodelle 2035 jo päätettyä uusien polttomoottoriautojen myyntikieltoa.",https://img.ilcdn.fi/8W6CxsAEkKJbqp70EPrOe4QUHEs=/510x318/top/img-s3.ilcdn.fi/ea93bf12360a80c55d2b60a49b976ae2226b73a1ed81b77fd0186702a4912a95.jpg,3BE284B997C74A28B21EFCDDBAB67A6B
2024-01-29T05:32:44.000Z,Patrik Laineen naisystävä kommentoi kiekkotähden ratkaisua,Jordan Leigh jakoi Instagramissa tiedon Patrik Laineen tilanteesta.,https://img.ilcdn.fi/unoVLI7WY6tWo5r4HCNX_Ns2TrM=/510x318/top/img-s3.ilcdn.fi/0f636ed206d80c0a0a61ed22e6ea50619fe8d70a714048732ae7070ded3f0165.jpg,E9DF687DBC52451B89E7B3F9EF8D9E00
2024-01-29T05:45:00.000Z,"”Rahanarvoinen etu, joka voi lisätä kodin ostajan mielenrauhaa melkoisesti” – YIT:n kädenojennus asunnon ostajille","Hintojen ja korkojen heilahtelu on saattanut huolestuttaa asunnon ostajaa viime aikoina. YIT haluaa poistaa epävarmuutta ja tarjoaa kodin ostajille korkokaton kaupan päälle 29.1.–30.4.2024. Korkokatto takaa, että asuntolainan viitekorko on enintään kaksi prosenttia seuraavat viisi vuotta.",https://img.ilcdn.fi/X372mttFOCgQ3AZm_sv9TEs_tzE=/510x318/top/img-s3.ilcdn.fi/b2eb0c50f59f6d60f51db5f3e6f0ce03162ef0b8bc5f268bf32543aa5b986f50.jpg,50A75F8950C9427BAC7F215A133897AD
2024-01-29T05:52:02.000Z,Tilanne autohuollossa sai Oona Airolan vihaiseksi: ”Se on outoa”,"Ohjus-elokuvan päätähti Oona Airolasta on hyvä, että teos tuo esille rajateemaa myös sukupuolinormeihin liittyen.",https://img.ilcdn.fi/vCZs-UERveD-6VIM4JpRpoxW-h4=/510x318/top/img-s3.ilcdn.fi/437714a8f940828a6659c0175b4c929c8ec926fb4969f26cbc1e7033b96616dd.jpg,10AD3668E19142B7B0DF8F60EE76C725
