paivamaara,otsikko,tiivistelma,kuva,id
2023-10-14T21:26:17.000Z,Tältä auringonpimennys näytti Amerikassa – Katso mykistävät kuvat,Tämänpäiväistä auringonpimennystä ei voi nähdä Suomessa. Amerikassa sen sijaan auringonpimennys sai ihmiset suuntaamaan katseensa taivaalle.,https://img.ilcdn.fi/dFc1YGge7UvVEhuMkfnC3GQVCFw=/510x318/top/img-s3.ilcdn.fi/6c9ebe4605a2ce76f39088a0f5a6057144c80b0498a6cf23a7e3af547999db33.jpg,525E80A3D6EE4A1189DF663CF8AF80CC
2023-10-14T23:18:28.000Z,Tämä nimi esiintyy viikinkien riimukivissä usein – Oliko hän vaikutusvaltainen kuningatar?,"Thyra-nimi esiintyy useissa tanskalaisissa riimukivissä. Epäillään, että kyseessä on ollut vaikutusvaltainen viikinkikuningatar.",https://img.ilcdn.fi/cY_Y2BFzjoRu4iTuiN06-_X5MHI=/510x318/top/img-s3.ilcdn.fi/09d7d653c74817a7bd8a34129aab5acc19655e3e7b8efd2300660aedd26e5223.jpg,A782E6E77EC546B1AD180153D97875CB
2023-10-14T23:45:21.000Z,Twin Peaks -näyttelijä Piper Laurie on kuollut,Näyttelijä Piper Laurie on kuollut 91-vuotiaana.,https://img.ilcdn.fi/pVZCD-pYILi-GoS6Zrs3l3rwOXw=/510x318/top/img-s3.ilcdn.fi/f3742add5d6167d0d0dd126f6d130e59615ee2b3ecfd439b82ff802e3afb9408.jpg,CA054CF97ADE4F8D859E974D369E205F
2023-10-15T00:35:11.000Z,Michael Caine lopettaa näyttelemisen,Oscar-palkittu näyttelijä Michael Caine on vahvistanut jäävänsä eläkkeelle.,https://img.ilcdn.fi/7jZEYFPRPNkiWjfpdVg4le9WF2I=/510x318/top/img-s3.ilcdn.fi/fe4dcecaa590f819de82058dc57660f6ccd8942875fc500d6686597422ebdbf1.jpg,7F539D46E87340B8BF47EFB1EC90B072
2023-10-15T01:04:07.000Z,Tällä helpolla vinkillä nukut paremmin,"Tutkimukset ovat osoittaneet, että ne, jotka käyttävät sukkia sängyssä nukahtivat nopeammin.",https://img.ilcdn.fi/BNpjj8QAJrBq45GKkEt9A8WQmcs=/510x318/top/img-s3.ilcdn.fi/b71e15fe5ad961eb682a747ac30883074ad9097d8df0ce96d6ab143035f30e96.jpg,322382019D8D41119F8AD94FCBE7A69E
2023-10-15T01:35:17.000Z,Sää jatkuu tuulisena – Syyslomakausi käynnistyy koleana,Sunnuntaina myrskytuulet ovat vielä mahdollisia. Sää pysyttelee koleana vielä ensi viikollakin.,https://img.ilcdn.fi/kr2YICguKUq0fby92FcCzyHRy4c=/510x318/top/img-s3.ilcdn.fi/ec298f9587a692248a787f53473118216d4e2d39abb0f70bf67eb51ac60cf351.jpg,AEB2C86E69484F9D80D78CAA9F5DBF98
2023-10-15T02:30:00.000Z,Näin löydät parhaat tarjoukset ja reissuvinkit – voita 4 x 100 € matkalahjakortti!,Rantapallon sosiaalisen median kanavissa arvotaan neljä matkalahjakorttia.,https://img.ilcdn.fi/tsRPVdwRcbt_WVu4nAV85gETGFo=/510x318/top/img-s3.ilcdn.fi/1cd860548dbe22044742fb1c6651dfc6f8ea3b2655f8d3c8ee65f75899e4ce05.jpg,A9A61DB578D643ABA249E2597E3EDA60
2023-10-15T03:00:04.000Z,Alaikäinen tyttö sai vastuullisen tehtävän Postilla – Lopulta kaapista paljastui härski teko,Tyttö aloitti postin piilottamisen 14-vuotiaana.,https://img.ilcdn.fi/DD2wXcNOWPWMSqmNqnx_Ixb-lvI=/510x318/top/img-s3.ilcdn.fi/31b296af85f554f09f0e0325630cce73ad73f7f5a1d5d2619e750039680a7272.jpg,058A0323F0184386AB5B376CCF989DE5
2023-10-15T03:02:03.000Z,Pelastusta ei tullut,"Neuvostosukellusvene upposi tuhoisassa onnettomuudessa Itämerellä. Tapahtumien järkyttävyys paljastui kunnolla vasta, kun sukellusvene nostettiin syvyyksistä.",https://img.ilcdn.fi/vERj2Osr9vOkHh46uWkFtRUOwcA=/510x318/top/img-s3.ilcdn.fi/f47d6206ab933445cb8c3fc45d94d50c9c5d343cde086d16d7d33b40bf9041c5.jpg,7BC2A5CEDD2A4547A1FDB3D5B75C85FB
2023-10-15T03:38:03.000Z,"Aamutee voi alentaa verenpainetta – Katso, mitä teetä kannattaa juoda!",Tee voi alentaa verenpainetta. ,https://img.ilcdn.fi/7pzGBp-i2THC11IrlwFtjGW5ZIs=/510x318/top/img-s3.ilcdn.fi/ae20be4dfa7e0c5e23ca9a06550e0a88e64c1c7fee09689248692ddbdb8e6438.jpg,BACAE26811D04E45A224ECF6176931BE
2023-10-15T04:00:20.000Z,"Miksi Jutta Urpilainen ei vieläkään kerro, pyrkiikö hän Suomen presidentiksi? Nyt hän vastaa kuumaan kysymykseen","Komissaari Jutta Urpilaisen nimi toistuu SDP:n varmana tulevana presidenttiehdokkaana. Kampanjaorganisaatiota rakennetaan jo, ja vaalipäällikkökin on nimetty. ",https://img.ilcdn.fi/XChkxOBu0Uh4qDNvRG7TbOd9zYA=/510x318/top/img-s3.ilcdn.fi/faf4dea0caf0ab9aa690e819b5d0a04c0567f0763da3ab836126be5f1b5958c5.jpg,07F5245338A44B738D76D848712EAF6D
2023-10-15T04:07:56.000Z,Jokerien legenda paljasti järisyttävät voimansa: ”En pidä yhtään huijauksena”,Jokerilegenda Jani Ritan uskomattomista jalkavoimista liikkuu yhä myyttisiä tarinoita.,https://img.ilcdn.fi/kVplwR2LlP-GRLWXXy5_ji5HTIc=/510x318/top/img-s3.ilcdn.fi/d0e29066fe0e33a7da963a1b81c1477164e8e3a74f7306c3dd430f5f6111e61e.png,6F8BC1A46E6E452F98E11BEFE893737E
2023-10-15T04:30:47.000Z,Ilves teki jättiliikkeen – Lähti mukaan riskibisnekseen,"Kuusi vuotta sitten Ilveksen SM-liigajoukkueen omistava Ilves-Hockey Oy oli konkurssin partaalla. Nyt liiketoiminta on saatu kannattavaksi, mutta yhtiö siirtyy riskibisnekseen. Miksi se ryhtyi Ilves Edustus Oy:n pääomistajaksi?",https://img.ilcdn.fi/g_R0OHIn4acRvJQowAtWw6BMumU=/510x318/top/img-s3.ilcdn.fi/e856a953dbb8c51a555a7c8493f880af2d71cf7fe4c2b5980f58c48aeb9a47f2.jpg,1ED5BA00E84743998E6985CCC5B71CD0
2023-10-15T04:50:28.000Z,Yksi uskomaton hetki pilasi Huuhkajien mahdollisuuden Sloveniassa: ”Olisi pitänyt”,Daniel Håkans harmitteli hukattua maalipaikkaa.,https://img.ilcdn.fi/c35B_egM7icJF3jPdpTTVqZ_rgE=/510x318/top/img-s3.ilcdn.fi/d27575b98242787ccda99fdff86158f9faffa2328809f4bf0262c0db29fd419f.jpg,2034B52902774B95BBFFD24214D83D27
2023-10-15T05:00:00.000Z,24 askelta nautintoon – kruunaa joulunodotuksesi Kaalimadon upouudella joulukalenterilla!,"Odotus palkitaan, nimittäin Kaalimato.comin uunituore joulukalenteri on nyt ilmestynyt. Ole nopea, sillä kalenteri on aiempinakin vuosina myyty nopeasti loppuun!",https://img.ilcdn.fi/bvw3gCerZxIhG9jcCozH7PjN--A=/510x318/top/img-s3.ilcdn.fi/a3b6406524169229bf8dd936bbd3efc0ee281bf4e3dda8945a1f27fc8c1fb1ed.jpg,1864C6EA8EB1478D91ADB13365C05D0A
2023-10-15T05:02:52.000Z,"Suomalainen Arttu teki avaruudesta havainnon, joka pudotti tähtitieteilijöiden leuat lattiaan: ”Ensimmäinen kerta”","Tutkijat uskovat 1 800 valovuoden päässä tapahtuneen massiivisen räjähdyksen olleen seurausta kahden planeetan yhteentörmäyksestä. Kyseessä olisi ensimmäinen kerta, kun planetaarista kolaria on päästy todistamaan tällä tavalla.",https://img.ilcdn.fi/bT5LPEpv_RllKvJl-e3OyiBGxN8=/510x318/top/img-s3.ilcdn.fi/7ad7c7d9ba146f84f2c2fa2bc8deef764e0ce3e79542e1bad6ef9e219e804b07.jpg,292CF853A2AC4F43AD5001355FFD9BA4
2023-10-15T05:07:27.000Z,"Niko Saarisen Masked Singer Suomi -asun takana koskettava tarina: ”Kiinnyin""","Niko Saarinen kertoo kiintyneensä Nöpö-hahmoon niin paljon, että hänestä tuntui haikealta jättää asu ohjelman pukuhuoneeseen.",https://img.ilcdn.fi/P6GskQfrDU44OwUsImT50YpM_yk=/510x318/top/img-s3.ilcdn.fi/cdea69dae4786fda5dd682a6c49a285b15adaf5921672c607b85ee4294d31de2.jpg,606D5C2BE8D14426AB031FCDF553E29A
2023-10-15T05:17:04.000Z,Uskomaton pelastus! Patrik Laineelta ryöstettiin maali viime hetkellä,Columbuksen päävalmentaja Pascal Vincent sai viime yönä ensimmäisen W-merkinnän tilastoihinsa NHL-tasolla.,https://img.ilcdn.fi/7JtZjMEbeM1NawUtD3pDKSlLeiM=/0x64:3000x1937/510x318/top/img-s3.ilcdn.fi/e1609f5d62222325c8b167a166a019dce9066957825a6dad23e60d2fce108eb9.jpg,E6BA3CF764EB4A3BA744C4C53D66EFF6
2023-10-15T05:22:37.000Z,Lotta Hintsa julkaisi verisen kuvan vuorilta - Ei herkille!,Vuorikiipeilijä Lotta Hintsa joutui tiukan paikan eteen Nepalissa.,https://img.ilcdn.fi/2V8jpXcrj5bbmrYhN-ZGuYhS8Fo=/510x318/top/img-s3.ilcdn.fi/431b061ad00dd55f3a39d18939d2b096ff053c179f23f96df5cec893ae8e31ee.jpg,67642AFAD3E840C5B80E651635D42AE9
2023-10-15T05:41:08.000Z,Yksi vaate ei petä: Syyspukeutumisen kulmakivi,Tämä vaatekaapin moniottelija sopii täydellisesti viilenevään syyskauteen.,https://img.ilcdn.fi/1inXGXskVstrRqEEqh3Xj3Dxf0E=/510x318/top/img-s3.ilcdn.fi/f299b89f3ee89500f9d076a12a1d741997510facc24b16adc8b29182d9bf5dd8.jpg,C08A54FFA8544F91A6383A14FE553622
2023-10-15T05:51:07.000Z,Silmäkarkkia: Mikko Rantanen ja Sebastian Aho iskivät komeat maalit rankkarikisoissa,Mikko Rantanen ratkaisi rankkarillaan voiton Coloradolle.,https://img.ilcdn.fi/fPJynsl3g-0VPa9eYPR_lADrPxk=/0x64:3000x1937/510x318/top/img-s3.ilcdn.fi/ae1cbc846bb0d30d41a17d06ace72c007743c37965e9973d6fdef7457596c426.jpg,089D1DF82FB54B8193362E0418A4A045
2023-10-15T05:51:08.000Z,90 päivää morsiamena -tähti paljasti totuuden kahden vuoden jälkeen – Suhde päättyi: ”Miten sinä olet voinut valehdella minulle?”,Tänään käynnistyy 90 päivää morsiamena -realityn uusi kausi.,https://img.ilcdn.fi/Ve1u_7nd3mvcKFMjI8RjqtTd5HA=/510x318/top/img-s3.ilcdn.fi/d8f08064f0eb130362efa93535a4b95873da11a42d9e34db4830e9954dd44e43.jpg,E0F3C68DABD4403E8123B1A886FC7E2F
2023-10-15T06:00:31.000Z,"Euroopan uusi supervalta valitsee idän ja lännen välillä: ""Kukaan ei tiedä, mitä Putinilla pyörii päässä""",Taloudelliseksi ja sotilaalliseksi suurmahdiksi hiljaa kiivennyt Puola valitsee sunnuntaina uuden parlamentin. Hallituksen kohtalo ratkeaa kärkikaksikon takana.,https://img.ilcdn.fi/y7pHD8ESvyegAtOYZSSnzCUJ008=/510x318/top/img-s3.ilcdn.fi/30cd9e51a49d654a6d8d3daab1df73f68f8d811363c87ff2c8f01d24f4e8b374.jpg,E10FB26558FA4D3E85CD11C3B4254D2F
2023-10-15T06:01:09.000Z,"Kotibileet lähtivät lapasesta Oulussa – Satapäin nuorisoa hillui kaduilla, poliisin Facebook-jyrähdys tehosi","Poliisi vetosi vanhempiin Facebookissa, että nämä hakisivat jälkikasvunsa kotiin.",https://img.ilcdn.fi/k4D_kIhUyCQ_EGPeJinGU9gtmW8=/510x318/top/img-s3.ilcdn.fi/e45cd0f19edd7c4ad12e475844d5f27ff381182880aa111d9105a87221cf9a0f.jpg,DD568F48C3E7485D9A91749473F6F7C9
2023-10-15T06:15:13.000Z,Tanssikulissien takana,Tanssii tähtien kanssa -ohjelma perustuu kansainväliseen formaattiin. Pääsimme ainutlaatuiselle kurkistusmatkalle live-sunnuntain tapahtumiin studiolle. Viihdettä ja glamouria tuottava koneisto on huippuunsa hiottu. Pienikin virheliike tai odottamaton tilanne voisi kaataa suoran lähetyksen.,https://img.ilcdn.fi/IIuH2qEwVedaHnXGsU0vtDEJAxg=/510x318/top/img-s3.ilcdn.fi/c58bc22fecaf1271448198e33aa10ccf438eb1a927975b2cc6995b856afc83bd.jpg,2B1401FBE2EB4DC481039DFF01708000
2023-10-15T06:21:35.000Z,Suomi tavoittelee yleisurheilun EM-kisoja Olympiastadionille: ”Olemme päättäneet”,"Urheiluliitto yrittää saada asiat sille mallille, että hakupaperit voidaan lähettää viimeistään keväällä.",https://img.ilcdn.fi/J8zGIZAGyqx1_mqOR1EEgurRrPA=/510x318/top/img-s3.ilcdn.fi/a97f4b48b51152809ee9404c514c02bb2c316e80a378086a9c97ca93b1ee61b2.jpg,03F15BBCAAB64C7B95017E42530CCA05
2023-10-15T06:26:54.000Z,Arto Nyberg oli pitkään poissa tv:stä – Tekee nyt paluun,Arto Nybergin keskusteluohjelma on ollut tauolla suurimman osan vuotta.,https://img.ilcdn.fi/QHQgByrRRc7LbIkmHvStg_5Cfc4=/510x318/top/img-s3.ilcdn.fi/eabfe11e276bce540185cff73c2915648f0d6f12458b48a6b4a1c6d898741a9e.jpg,1BAF905DA3E14A41BC4AE51DE0803005
2023-10-15T06:39:23.000Z,Upouusi ruotsinlaiva! Finnsirius vie turistit huippunopeasti Ruotsiin,Naantalista Kapellskäriin kulkeva Finnsirius on vesiemme uusin ruotsinlaiva.,https://img.ilcdn.fi/qvSg0IWclKB5YIJnm3hgtGlrGf0=/510x318/top/img-s3.ilcdn.fi/d0229365ad8d9448a4d949b0e6d62cc4c8c07954becf081732f4c74e03e40a7e.jpg,1F544B099B2E42558E7A86EC3CAFB704
2023-10-15T07:00:37.000Z,Vastenmielinen painajainen – Nämä kiekkotapahtumat eivät unohdu: ”Aivan sairasta”,Ässien ja Sportin välinen karsintasarja oli täynnä draamaa. Alpo Suhonen pitää sitä yli kymmenen vuoden jälkeen yhtenä elämänsä vastenmielisimmistä kokemuksista.,https://img.ilcdn.fi/ssKI2SdeO1BEwcGp9crrpldH25c=/510x318/top/img-s3.ilcdn.fi/7712900ba2ee1bf48f0fd2bc8fe27d7fd68c06dc1242ff5a6ca13fffeead3ead.jpg,931AA6AD7A55470E9E3C8A1FAC850AB9
2023-10-15T07:01:45.000Z,Robin Packalenin laivakeikka peruuntui yllättäen – Näin kommentoi laivayhtiö,Laulaja Robin Packalenin keikka Viking Line Gabriellalla peruuntui yllättäen. ,https://img.ilcdn.fi/2AvJdH9vPYgKkM4tTBO5AzDorHo=/510x318/top/img-s3.ilcdn.fi/a412193b47d39beacef92adf6c17b975f765695d2a1f41cacb662c1c8fbe5755.jpg,509E59A58599427AA9387D259F7F4E4E
2023-10-15T07:15:00.000Z,"Helsinki keksi ”liikennemerkin”, jota laki ei tunne eikä liikenne noudata",Vilkkaan liikenneväylän varrella Helsingissä on liikennemerkiltä näyttävä kyltti.,https://img.ilcdn.fi/D2AOntJnMUxAcuwlpqe1XcmkUFk=/510x318/top/img-s3.ilcdn.fi/de6340a2b2ef425366dc00a96ed42cb2950e341920920fb6dff4b0de2085d3ff.jpg,1F5B14ABBF5C42C9ABC0991A4C460E4E
2023-10-15T07:23:51.000Z,Gazassa on yhä muutamia suomalaisia – Näin heille käy seuraavaksi,Ramallahin-yhteystoimiston suurlähettilään mukaan Gazassa olevilla suomalaisilla ei tällä hetkellä ole akuuttia hätää. ,https://img.ilcdn.fi/3lgvLaAFkf3ocLvOZ02kDpAGy2M=/510x318/top/img-s3.ilcdn.fi/9ed53525b9efcdcc48077038010c5eb970a7444df00f814e13132faa7f05b645.png,CF2EA77BDB3A424A848742D33E0DAD65
2023-10-15T07:43:34.000Z,Salaiset seksibileet 5 tähden hotellissa – Naisilta vietiin puhelimetkin pois urheilutähden synttärijuhlissa Lontoossa,"Valioliigatähti järjesti viiden tähden hotellissa salaiset seksijuhlat, joissa vieraina olleet mallit joutuivat allekirjoittamaan salassapitosopimuksen.",https://img.ilcdn.fi/waMdI3g4feDHuMf61k5u_9c9ZzI=/510x318/top/img-s3.ilcdn.fi/719ac3863a39987074a0f2cc583e04477144bb83084faf261fac52a6f83d65b5.jpg,5B75E6ACD66349209665D36C64370796
2023-10-15T07:44:55.000Z,"Jonna teki itse himoitun valaisimen, joka oli kaikkialta loppu","Sienistä tuli sisustushitti. Sosiaalisessa mediassa suosituilla tee-se-itse-videoilla näytetään, miten sienilampun voi tehdä itse. ",https://img.ilcdn.fi/mByn2EGkJeW716gYmBgIHrUDvdc=/510x318/top/img-s3.ilcdn.fi/9e611083aee303eebe6791a62d24b6bf85ed3c8c6b817c064730419b85fb0f35.jpg,2FB8156867D7458A9800B73AC6BA01A2
2023-10-15T08:01:29.000Z,Nyt se on varmaa: Li Andersson ehdolle Suomen presidentiksi – Tiukka kuitti ”liian nuori” -väitteistä,"Vasemmistoliiton presidenttiehdokkaaksi nimitetyn Li Anderssonin mukaan on tärkeää, miten Suomi Nato-maana toimii kansainvälisillä areenoilla.",https://img.ilcdn.fi/mCf9w6Vr010Z-omuqUQ7nYLdHqY=/510x318/top/img-s3.ilcdn.fi/c2edd6158b3c57cd0ad3d76f309562b998428d6ea37a3f4ce5b6fbb22b743e12.jpg,045B9F115B7B49979A4B855BB69D21BC
2023-10-15T08:11:11.000Z,Expressen: NHL:stä pudonnut hyökkääjä menossa Kärppiin,"Noel Gunler on matkalla Kärppiin, mikäli Expressenin tiedot pitävät kutinsa.",https://img.ilcdn.fi/6rTJdt2qKpDcDe462jlA8CgPQeM=/0x64:3000x1937/510x318/top/img-s3.ilcdn.fi/399a385569324d29792e0c4a2120bdf39d67f2c8426ac19194c71ce8f59d0a11.jpg,DCDCBE829E2F4554932A7095B884FB05
2023-10-15T08:29:49.000Z,Jymy-yllätys! Prinssi Harry ja Meghan pyyhkäisivät salaiselle lemmenlomalle ökykohteeseen,Sussexin herttuapari matkusti lomailemaan luksuskohteeseen.,https://img.ilcdn.fi/XxPxMN9ehwBnDiN6OkhHLgPneWM=/510x318/top/img-s3.ilcdn.fi/6ce86fc3dea0ca21e4e31c6e47b983db18e5c0dbb2f0eca918399721a0e5b47f.jpg,7DA9BC3A06574A85A0842AD4517BC827
2023-10-15T08:32:14.000Z,HJK:sta potkut saanut Toni Koskela saamassa töitä ulkomailta,Toni Koskela on matkalla Kyprokselle.,https://img.ilcdn.fi/4B393nqbo4-hdNUuZyLvGuvICdg=/0x64:3000x1937/510x318/top/img-s3.ilcdn.fi/7dc89f29c4a973a2d619856b24ef904b79790b108da1cc5d6cf8898e00c392f6.jpg,DAE46C4E8BF14DE691E97D24F4666FAF
2023-10-15T08:44:21.000Z,Siitä oikeasta Jeepistä tuli lataushybridi – Tästä olisi Ihmemieskin ihmeissään,"Jeep tekee uutta tulemista Suomeen ja Eurooppaan, vaikka ei varsinaisesti koskaan poistunutkaan. Pienen täyssähköauto Avengerin ohella sillä on mallistossaan myös ihan oikeita maastoautoja – kuten Wrangler. ",https://img.ilcdn.fi/0Ob6lFNhxsqdWuszmfb2YBRNwP4=/510x318/top/img-s3.ilcdn.fi/7f8f8adace7f57a61484250881d2e753ee025cda93b9fe084bcc4399c173f502.jpg,A13533B1D3D34EC692845C7FF75FDDDA
2023-10-15T09:00:06.000Z,Järisyttävä ero! Näin Conor McGregor on muuttunut 10 vuodessa,Conor McGregor on noussut jälleen otsikoihin. ,https://img.ilcdn.fi/ukvLF5k0oJ_hebxCmqUQSzuzG54=/510x318/top/img-s3.ilcdn.fi/8f8d4425162ac690c6167d18e7d18b52228ba00f8e3ce8ce562e3270d547e40f.jpg,67C0E82A6FE74DD48F7987D5ED9D7FE2
2023-10-15T09:14:00.000Z,Japanilaiset ”ihmejauhot” tekevät kaikesta vielä rapeampaa,Joko olet kuullut pankojauhosta? Kannattaa testata. ,https://img.ilcdn.fi/L3ViHk0a0LXN9BXb4d1rLulldEo=/510x318/top/img-s3.ilcdn.fi/15ff25a6b94c6c9ba0803bcc3fe9907d0cd6f244add770d845b70141b8bc92a4.jpeg,E6F8B595F3DE47F5B3205A9BF8819370
2023-10-15T09:14:08.000Z,Toni Nieminen keskellä huutoriitaa Lahden torilla – Näin hurja tilanne eteni,Toni Niemisen hevoskärryajelusta syntyi ilmiriita Lahden torilla.,https://img.ilcdn.fi/zThiqZnVKfTYxPWul6aQU55Jnls=/510x318/top/img-s3.ilcdn.fi/a98a25610220d10af57dab7be6132af41f8e7e3a10a4072001644c586301928e.jpg,3A39B3291C704EF7A70774512B1081F3
2023-10-15T09:38:40.000Z,Arvostettu lehti vertaili EU:n taloudet – Yksi murska-arvio romahdutti Suomen 14:nneksi,Suomi sijoittui 27 EU-maan ”kisassa” jaetulle sijalle 14.,https://img.ilcdn.fi/8HRhywi4M6LdEg2HJhBV6mHznNE=/510x318/top/img-s3.ilcdn.fi/8e29ddcf666ea1a121467978fdf95f5bf9506ee7b76ffb689afe5c340d97e08a.jpg,2921DB3C2BBE4BA39492A54761B3CEBE
2023-10-15T09:43:28.000Z,Pistetili auki ensi yönä? Suomalaistulokas on esiintynyt vahvasti NHL:ssä,Waltteri Merelä on ottanut pelipaikan Tampan Bayn laadukkaassa hyökkäyksessä.,https://img.ilcdn.fi/ET74lRLArV6hbIKwdu96AYuaMZ0=/510x318/top/img-s3.ilcdn.fi/9c499157afc9f4ed688f6903a8cdf29bac8405c1706023d25f2433e7cf28f162.jpg,7C8FABF67FF248D1A3075F4B137F79A4
2023-10-15T09:44:13.000Z,"Jan Dalgic, 25, kuoli",Jan Dalgic menehtyi aivosyöpään.,https://img.ilcdn.fi/yxBW8RrMXsx-gyg8tMvsXMtLCnI=/510x318/top/img-s3.ilcdn.fi/2b564ac5c66cc9d66f1fc15743a3ef4ec6f767d9f7888bd167fc0a3ac0e668b1.jpg,BA540F5AFBFC43CCB19500A4F6C0D73D
2023-10-15T09:50:41.000Z,Karita Mattila tylyttää varattuja miehiä: ”Mä en halua teitä”,Oopperalaulajalla on suorasanainen viesti häntä liehitteleville varatuille miehille.,https://img.ilcdn.fi/OPKjuNVANhOi7HT2P9wgLzQDmcU=/510x318/top/img-s3.ilcdn.fi/150e1003ae600f2951ae3d6338c8ade1764b6bfbbd1675a6f128b3765ddbcc2a.jpg,CAEA1CB132A846E1B9231F307201AC84
2023-10-15T10:23:57.000Z,Järkyttävä kolari Seinäjoella: Humalaiselle bemarikuskille kovat syytteet,Humalassa ajanutta miestä syytetään törkeistä liikennerikoksista ja neljästä tapon yrityksestä.,https://img.ilcdn.fi/aoxXoL18wrA0eRIqvCNWUTTIItI=/510x318/top/img-s3.ilcdn.fi/df1fa371197441637ba880d8dab79c2e42bdcd018e4039d091d35b587749dc41.png,4B5D596121F7488A82808EDEE32193C0
2023-10-15T10:30:09.000Z,Kuva paljastaa totuuden: Tommy Furyn kohuottelussa julistettiin väärä lopputulos,"Tommy Fury julistettiin voittajaksi hajaäänituomiolla, mutta se oli virhe.",https://img.ilcdn.fi/8qP6pzqnT0ElkYwuBopGbRF_jE0=/0x296:3000x2171/510x318/top/img-s3.ilcdn.fi/7df4d9b0ca0dea9a3860756d0a08811cd74c19650688f68918ecabe7cb9f1e7b.jpg,98CDA3D8DC574B85B2354D7317BCC7D2
2023-10-15T10:43:49.000Z,Putin pilkkasi Ukrainan vastahyökkäystä: ”Epäonnistunut täysin”,"Putinin mukaan venäläisjoukkojen toimia rintamalla voi kutsua ”aktiiviseksi puolustamiseksi”. Hän kommentoi asiaa sunnuntaina ""Moskova. Kreml. Putin"" -ohjelmassa.",https://img.ilcdn.fi/b0E2KFr-RFn8ldj7yQnUNUDtfkY=/510x318/top/img-s3.ilcdn.fi/0ef9430864e8434e52283c209e1a8588de57190bfca3cdf931d6aac3ad940707.jpg,472A6207AF0B41719CD357609399FB71
2023-10-15T10:44:26.000Z,IS: Petri Kontiola palaa SM-liigaan,Ilta-Sanomien mukaan Petri Kontiola nähdään tällä kaudella Tapparan paidassa.,https://img.ilcdn.fi/KEyFp7xTVlTG_KuF0Ija2S616ww=/0x75:3000x1948/510x318/top/img-s3.ilcdn.fi/345768cd47fdbf44eb9720b01d12b524656c26fae597de2ca602a4581641c1d4.jpg,2BA361CB0F0D41B89DBDB37E350D3151
2023-10-15T10:44:47.000Z,Tällainen on prinsessa Catherinen traaginen perhetilanne – Vanhemmat elävät ahdistuksen vallassa,Walesin prinsessan vanhemmat ovat joutuneet törkeän vihakampanjan kohteiksi kotiseudullaan.,https://img.ilcdn.fi/l09pt2zXe-HFt0XT5Ok4dF0DuQ8=/510x318/top/img-s3.ilcdn.fi/751f8883342b3007a955a9eb6035cd5f35e8197a4b6efeea02de6e11a48a82fc.jpg,AB3A4A3B2F6542CFADC6FCED650463EE
2023-10-15T11:37:08.000Z,Tätä et nähnyt tv:ssä – Markku Kanervalta tuima purkaus: ”Meni vähän överiksi”,Suomi päästi täysin turhan takaiskun.,https://img.ilcdn.fi/wjmyRWZapmwk_lN4sqpp03Zyo_U=/510x318/top/img-s3.ilcdn.fi/cb3bb5a05d64f1f6245fc7d6c1d4c2c43f9f05d49374a4ceb160d31db982897d.jpg,7F65DB78D2FE45E0BD8E4282B2413727
2023-10-15T11:41:21.000Z,Viking Grace joutui poikkeukselliseen onnettomuuteen,Lauantai-iltana tapahtuneen onnettomuuden seurauksena kaatui 24 metriä korkea valaisinmasto.,https://img.ilcdn.fi/YuK715nDYEsihgHyi9vXzCuFrHc=/510x318/top/img-s3.ilcdn.fi/ae2eb16f825b561ae1c053da9ac108e56e0f50463922c9ba0bc511738915bc76.jpg,C64D4A0B458F485FAC86E5ECB709A363
2023-10-15T11:43:02.000Z,Uutta tietoa onnettomuuteen joutuneen Lotta Hintsan voinnista,Vuorikiipeilijä Lotta Hintsa kertoo Iltalehdelle voinnistaan.,https://img.ilcdn.fi/DgQUSpeutyACuAnGBxdBNBVKXKU=/510x318/top/img-s3.ilcdn.fi/710d8d5618f910c20571f445e45edd8ddf89f9fdc74c0172fec5741a0ef05081.jpg,DA462E53028E43679CA442A0B0D83623
2023-10-15T12:18:16.000Z,Jenni Kokander kiitti koskettavasti aviomiestään Elämäni biisi -ohjelmassa,Jenni Kokander kertoi ääni väristen valitsemastaan elämänsä biisistä.,https://img.ilcdn.fi/8S8tmvS8Ye74p-v-By4-Bw0_y-4=/510x318/top/img-s3.ilcdn.fi/4f9e464204d4242c832d3528218a762f43401e60ee1c18a93df38fa1b0f5a764.jpg,D92A02C0B61C48F18CED1F53FDF10725
2023-10-15T12:29:04.000Z,Kovat pisteet! Lauri Markkanen löysi huippuvireen,Lauri Markkanen alkaa olla valmis tulevaan NBA-kauteen. ,https://img.ilcdn.fi/vuOJCDyvvxp5ZLqms00pedIqU1c=/510x318/top/img-s3.ilcdn.fi/784a5e6b2d0c21f6ab36001c07e8c738e52e4d26e9db6e4f5dbe2dc862a0c7ca.jpg,B271FEE8FED14A2DBEE5C6B963D1F266
2023-10-15T12:34:07.000Z,Isyystaistelua käynyt ”Risto” sai kesällä huojentavan tiedon – Piina ei loppunutkaan siihen,”Riston” kanne elatusmaksuista on vireillä Helsingin käräjäoikeudessa.,https://img.ilcdn.fi/mLRlo0ltjNkWUluLfJ7ZqpU_JTM=/510x318/top/img-s3.ilcdn.fi/fc36b422f3ebe70aff718c239a5c8ae749ef00b35d3d6ede10ad0af8290d5ee9.jpg,FCC449121FBF4A21A6920DF2C65E94BE
2023-10-15T12:45:08.000Z,Tv-tähden asuvalinta loksautti leuat – Kukat peittävät strategisia paikkoja,Tv-tähti Maura Higginsin villi asuvalinta tyrmättiin sosiaalisessa mediassa. ,https://img.ilcdn.fi/gGu2scStaFRqwsxzFJNwhJ9_Ghs=/510x318/top/img-s3.ilcdn.fi/312ab98cc78038dc3d9304fab37c4dd987030a75b2f9170e941c75c4aeb151ad.jpg,6F40EF95FD8F4A54BABD55CDF2650DD4
2023-10-15T13:01:27.000Z,Lääke ja sen haitat,"Suomessa on valtava määrä lapsia ja nuoria, jotka syövät ADHD-lääkkeitä. Kerromme, millaista lääkehoitoa on tarjolla ja miten lääkkeet toimivat. Lastenpsykiatri kertoo myös, mikä häntä huolestuttaa.",https://img.ilcdn.fi/XaupCqnwG6gUBPTDvcnJcOGZ2f8=/510x318/top/img-s3.ilcdn.fi/45f72ed40034f2b75363fb5e29da15d208c0a04fe8104aec4aa62cd33b6e2f67.png,57EBFF0E049C410DAEE11896E55160FC
2023-10-15T13:12:25.000Z,"Mari Eder, 35, aloitti uuden uran: ”Tämä on ollut kaaosta”",Ederit pykäsivät Itävaltaan urheiluvälinekaupan.,https://img.ilcdn.fi/khqN1zBHp2onrOpsouTNLA1xbFs=/510x318/top/img-s3.ilcdn.fi/2d9cfe87b9686edde2a12e9320e5dac1fca7531d250fc8c9c83f600912c1467c.jpg,5E637DCDFF3B47788A56BC922BAE43F4
2023-10-15T13:25:48.000Z,"Mikä on nato? Entä kyty? Testaa, tunnetko sukulaisuuden oudot sanat!",Suomen kieleen on siunautunut erikoisia sukulaisuuteen liittyviä termejä.,https://img.ilcdn.fi/BoJ-dyhtUGubQz9EFrbUKpCVmog=/510x318/top/img-s3.ilcdn.fi/ac844e1a0b90b3ff310ef38222a1e66b7b4945f167e6bc48064615e7756702e2.jpg,DC113A6273FC44DDB9A43DFA2C682135
2023-10-15T13:26:44.000Z,Lumiyllätys!,Meteorologin mukaan Suomessa ollaan lumitilanteen osalta hieman etuajassa.,https://img.ilcdn.fi/FnUzM7NWtkwi_81tBCa7i9729a0=/510x318/top/img-s3.ilcdn.fi/d3aa7afa9656d0949647d8d300d318f4a9c2e51445e33d734c384b07c941103d.jpg,88BB39FB91D94782859A346CC7ABAE9E
2023-10-15T13:27:28.000Z,Elämäni biisin yllätyshuipennus kerää suitsutusta: ”Yksi parhaista jaksoista ikinä”,Lauantain Elämäni biisi huipentui Bumtsibum-tunnelmointiin.,https://img.ilcdn.fi/nMTMX-5hEYGoQJKGfECxuQMDJXA=/510x318/top/img-s3.ilcdn.fi/5537cd6353e41032d33bf624d3824a022c61cb1966051c2f74eaec453f6d4c07.jpg,B99B19D80572429484475EEF00B066A7
2023-10-15T13:57:24.000Z,Kuvasitko jotain kiinnostavaa? Lähetä videosi meille,Iltalehti julkaisee päivittäin lukijoiden videoita. Maksamme julkaistuista videoista vähintään 60 euroa.,https://img.ilcdn.fi/pzUc6gcZSXHz5qmKutueR9WtDK4=/510x318/top/img-s3.ilcdn.fi/444a2daad9cab9dec579a2fac105d31d96893e0b510bcf7b87ba859ffc88b960.jpg,D9838BA3AD6C48FD9EB13688B469AD4F
2023-10-15T14:01:04.000Z,Suuri petolintu lensi Kampin kauppakeskukseen: ”Kunnon kopsahduksella lasiin”,Suuri petolintu aiheutti hämmennystä kesken ostospäivän Helsingissä.,https://img.ilcdn.fi/GZyh5DJBKJes4AkVDv_FxF8HQ-c=/510x318/top/img-s3.ilcdn.fi/dbfc1c1785cb070be7d6d8ed3ccd41cf6e5677fe7ad5b9c65af3b5e8ee441244.jpg,91762B451A584A2A9428E576D2F26304
2023-10-15T14:01:49.000Z,Täyskaaos! Logan Paulin ottelu päättyi sekoiluun – Conor McGregor pilkkasi,Logan Paul kohtasi Dillon Danisin nyrkkeilykehässä. ,https://img.ilcdn.fi/PmIQG00zchi1_R-IulTdU4Azn9o=/510x318/top/img-s3.ilcdn.fi/fa4b236f5b47d34ada75f156c759fa9cb68d59bc8bbf48085f9913d8c8c1ae64.jpg,520A4554634443BBB084D70BBE44E876
2023-10-15T14:14:53.000Z,"Miss Maailma -kilpailija Sherika de Armas, 26, on kuollut","Vuoden 2015 Miss Uruguay Sherika de Armas on kuollut, kertoo Mirror.",https://img.ilcdn.fi/5OdTxpqcX7SdiX51zBHqKjf8rNY=/510x318/top/img-s3.ilcdn.fi/8fc8d54de3df7a4dc4f55cba65ee0ec764d69c9cf5a99190a7a44a835d495456.jpg,1D3229BCA4E845F5A5B9804CCBC7FE74
