paivamaara,otsikko,tiivistelma,kuva
2020-02-27T09:58:06.000Z,Asiakas höynäytti ravintolan henkilökuntaa ja hyppäsi tiskin taakse Yhdysvalloissa – katso tilanne videolta,Teini esitti ravintolatyöntekijää ja aloitti asiakkaiden palvelemisen asiantuntevaan tyyliin.,https://img.ilcdn.fi/7sq5j31V8nYK6GF3yCQxgFtI9i8=/510x318/top/img-s3.ilcdn.fi/d846e59a20add237555ef82738ffae9621665cfb5931db6dbf14db1c1dacab91.jpg
2020-02-27T10:03:32.000Z,Nuorten naisten työkyvyttömyyseläkkeet yleistyneet – syytä ei tiedetä,NULL,https://img.ilcdn.fi/Kyc8nU8WiH5y4ml3Qe1z-d9RevI=/510x318/top/img-s3.ilcdn.fi/b36c69cbd104b13392f07be24ce0a172e1f397bf61da9b74c4b25ce4053d507c.jpg
2020-02-27T10:11:46.000Z,Kymmenien miljoonien tili MM-ottelusta – upporikas Tyson Fury bongattiin alelaareilta,Tyson Fury ja  Deontay Wilder tekivät tuhdin tilin MM-titteliottelusta.,https://img.ilcdn.fi/2B_80WDUoTWGys-Ll2vYVnk1xfQ=/510x318/top/img-s3.ilcdn.fi/98bcdc1a4e6a503212ca207c6feac20a3e674155e8073eb9c61e8afa66abcad1.jpg
2020-02-27T10:13:47.000Z,Hoitajat virittävät kehysriiheen vaatimusgiljotiinin Marinin hallitukselle - tekeekö koronavirus lakot mahdottomiksi?,"Hoitajat pelaavat työmarkkinapokeria, jossa kaikki panokset on lyöty yhden korttikäden varaan. ",https://img.ilcdn.fi/9oSftY96Wx7Fcm_JqdH03-zZ1kk=/510x318/top/img-s3.ilcdn.fi/1c57306f1db31207322799ffa53a0cb34c8a19dabf56b5cdd3a671823112daa1.jpg
2020-02-27T10:17:28.000Z,"Päivän ravivihje: Toto4, Kouvola 27.2.",Adrienne's Amille kaveri.,NULL
2020-02-27T10:18:14.000Z,Koronavaara prinssi Georgen ja prinsessa Charlotten koulussa - lähetti oppilaita kotiin,"Britannian pikkukuninkaallisten koulu, St. Thomas Battersea, patisti neljä oppilasta kotiin koronavirustartunnan uhan vuoksi.",https://img.ilcdn.fi/zjCAb3ICRvN9j9A4AxvagoeVNzk=/510x318/top/img-s3.ilcdn.fi/a2249d95d9a774e1aa9f3b8968406d4c7f4e799416d5a7dc9895e1ce05aa3d9c.jpg
2020-02-27T10:21:18.000Z,Manchester Unitedilla täysi latinki Club Bruggeä vastaan – punapaidat saavat tärkeitä pelaajia takaisin,Torstain mielenkiintoisin peli löytyy Eurooppa-liigan pudotuspeleistä.,https://img.ilcdn.fi/sNcrdY95TfXhdyRZFmfaMbNBIOg=/0x57:2700x1746/510x318/top/img-s3.ilcdn.fi/39ba8c864b134dae07ffa2f414fc7edf97ceb33f538c3dc38db9419ad603c3a1.jpg
2020-02-27T10:35:43.000Z,"Hylkeiden ""baletti"" on vuoden vedenalainen kuva - palkittujen joukossa myös suomalainen",Voittajakuva on otettu lähellä etelänapamannerta.,https://img.ilcdn.fi/2nHbR1lwHuqAivqmjY-0GW2tvlo=/510x318/top/img-s3.ilcdn.fi/a9f9fe267c91406885a94016aaa2dee17f38b55340b9f09875be450ac0eebb33.jpg
2020-02-27T10:49:10.000Z,Näin paljon pitää pulittaa ateriasta Michelin-tason ravintolassa,"Michelin-oppaaseen pääsee, vaikkei ravintola olisikaan saanut Michelin-tähteä.",https://img.ilcdn.fi/-RllYkeExtK_v2QoJLP13W1sPZo=/510x318/top/img-s3.ilcdn.fi/08cb4a15a272fc7f70d920ed91ca9f587e5e7d0c34e873a814811ff6df86c625.jpg
2020-02-27T10:58:32.000Z,"Pääministeri puhui eduskunnalle koronaviruksesta - hallitus rauhoittelee kansalaisia: ""Väärä tieto ja epävarmuus leviävät itse epidemiaa nopeammin""","Terveydenhuollon henkilökunnalle on varattu 400 000 hengityssuojainta. Budjetissa on 8,9 miljoonan euron vara koronaviruksen kaltaisiin tilanteisiin. ",https://img.ilcdn.fi/CxTL7wJ8zI-vHcjNQzid8mBvfNU=/510x318/top/img-s3.ilcdn.fi/7492cfdb616732d6ae0a9456788ba6d127eab66b257ed589a3b1f6460640710e.jpg
2020-02-27T11:05:44.000Z,Seppo Rädyn ennätysheitossa tapahtui jotain mystistä: ”Jostain syystä se lähti leijailemaan”,Heli Rantanen muistaa hyvin Seppo Rädyn ME-heiton vuodelta 1991.,https://img.ilcdn.fi/w8mNPOomu-A3haU9eyREZNWUknI=/0x34:3000x1912/510x318/top/img-s3.ilcdn.fi/bec4247489fc5c5297b05ae5cc0e2d7c76d38b1ae6c5ef6de14efe146e33d915.jpg
2020-02-27T11:12:07.000Z,Presidentti Niinistö lopetti spekulaatiot: Ei halua kolmannelle kaudelle,Presidentti Sauli Niinistö on lopettanut osaltaan puheet hänen toimikausiensa mahdollisesta jatkosta.,https://img.ilcdn.fi/-HXfAa88NZTFiODUAhJ-a_GqDVg=/510x318/top/img-s3.ilcdn.fi/772a69b75ea1b071a39128b98876226217f35f80673e0e67e94c8a39f1bcb55f.jpg
2020-02-27T11:27:26.000Z,Kolme lasta poltti vahingossa koulun Mikkelissä – lasku: kolme miljoonaa euroa,"Vaikka asia ei etene syyteharkintaan, kolmella palon sytyttäneellä lapsella on edelleen vahingonkorvausvastuu.",https://img.ilcdn.fi/vAxMKt5ImNAVCqJ39Y9jWXKuKoQ=/510x318/top/img-s3.ilcdn.fi/cd9e2d155e42c1974811e2b9780fffcce29018e21d4633f8665fe78e25fdd050.jpg
2020-02-27T11:31:55.000Z,Harri Säteri teki jatkosopimuksen KHL:ssä,Jatkosopimus on yhden vuoden mittainen.,https://img.ilcdn.fi/ixagVkcEjDnHUEnPCe_go1gDtWM=/510x318/top/img-s3.ilcdn.fi/7de5a09ea91fce2fc5deab8babeebca46b77fd8b21b9fb85e0858cfd18db0e8a.jpg
2020-02-27T11:57:42.000Z,EK:n ex-pomo Laatunen: Nämä henkilöt olivat syypäitä Rinteen eroon,"Entinen EK-pomo Lasse Laatunen nimeää EK:n ohella kaksi keskeistä henkilöä, jotka hänen mukaansa olivat syypäitä pääministeri Antti Rinteen (sd) eroon.",https://img.ilcdn.fi/6XvgI2FTzTFWjoEdY9OJF1QW5Cw=/510x318/top/img-s3.ilcdn.fi/af34840cf300f4508a18969ba77d1461ae29d447be766a5bf1d559316255ee97.jpg
2020-02-27T12:07:36.000Z,Jari Aarnio syytteeseen murhasta,Asiasta kertoo valtakunnansyyttäjän toimisto.,https://img.ilcdn.fi/xqR8y5pG_09ZkqGhhdiq2zTNPms=/510x318/top/img-s3.ilcdn.fi/f11ea2a692f0fefa73b8b1e1d4594e99d9bb618c2821b13fb373b5595d8bb449.jpeg
2020-02-27T12:11:49.000Z,Viron koronapotilas tuli Tallinnaan linja-autolla – mahdollisista suomalaisista kanssamatkustajista ei tietoa,Tartunnan saanut henkilö on 34-vuotias iranilaismies. ,https://img.ilcdn.fi/5ld25G8-H2LrRZD2P2qORjY9Di0=/510x318/top/img-s3.ilcdn.fi/90c08cf91f6c19668b571f53feaa1a81f17e58c88d07d53a913d209be5c29a1e.jpg
2020-02-27T12:25:36.000Z,Oikeus torppasi Lontoon Heathrow’n lentokentän laajennussuunnitelman – rikkoo Pariisin ilmastosopimusta,Päätös voi muodostua jopa maailmanlaajuiseksi ennakkotapaukseksi.,https://img.ilcdn.fi/ugKIOtA0kHmFnpNX2TW0RnIHViI=/510x318/top/img-s3.ilcdn.fi/0426b00a83fc3cbc3e122735a55fdc6156b00605a0f663eb86eee68961da1d17.jpg
2020-02-27T12:31:51.000Z,"Keihäänheiton olympiafinalisti Braian Toledo, 26, kuoli traagisessa onnettomuudessa",Braian Toledo on kuollut liikenneonnettomuudessa.,https://img.ilcdn.fi/sDlE6SjIR3pEnbEmXsH48ybOCF8=/0x304:2342x1767/510x318/top/img-s3.ilcdn.fi/7c386affc4061193a2af8bc6d100923444f44b21a9a80daa7bf7eac6c34d5541.jpg
2020-02-27T12:44:48.000Z,"EastEnders-näyttelijä joutui vakavaan onnettomuuteen lomallaan: ”Olen onnekas, että olen vielä elossa” ",EastEnders-tähti Sid Owenin joutui golfonnettomuuten Thaimaan lomallaan. ,https://img.ilcdn.fi/qJGZC2Xox0Cd5no8F-eImL3Kniw=/510x318/top/img-s3.ilcdn.fi/45eb92f51c3bdc9f44e29a82240a53eef5099de77b9ac8de5c9fa838b26d7971.jpg
2020-02-27T12:57:47.000Z,"Boris Johnson pisti kovat piippuun - uhkaa kävellä ulos brexit-neuvotteluista, jos ei saa vaatimuksiaan läpi",Britannia valmistautuu jo sopimuksettomaan eroon.,https://img.ilcdn.fi/8UP_rhL1MgBhycIZFcyOWeS5TFQ=/510x318/top/img-s3.ilcdn.fi/713136f637b6211d4a47e93d1b1e38c7f8b91b09b5642d41e6bc811d912f9062.jpg
2020-02-27T13:07:49.000Z,Stockmann uudistuu: houkuttelee laatutietoisia uusilla merkkilaukuilla ja lasten luksusvaatteilla,"Stockmann tiedottaa uudistavansa Helsingin tavaratalon naistenmuodin ja kauneuden osastoja, ja laukkupuoli on jo saanut uuden ilmeen. Myös brändivalikoima laajenee: uusia tulokkaita ovat luksusmerkit Marni, A.P.C ja Zadig&Voltaire.",https://img.ilcdn.fi/ZBCl_qdCJej-5UEIbg2ohpv_i_8=/510x318/top/img-s3.ilcdn.fi/a7d162b9935b28119537881b29e6926d5eccec956d0c192c0ee533d30cfbb62c.jpg
2020-02-27T13:14:14.000Z,Vuosaaren palkkamurhasta tuomittu Janne Raninen pääsee vapaaksi,Ranisen pääsee vapaaksi ensi vuoden maaliskuussa.,https://img.ilcdn.fi/SSKGbcUx-4_hxDbgzAafvOm6vqc=/510x318/top/img-s3.ilcdn.fi/908600f441463237162df5ee4eb6a4e7772e2faf23a19bf67472cc28a07ce441.png
2020-02-27T13:37:10.000Z,Upea tempaus poiki 110 kiloa käsitöitä – tällaista apua Australian palojen uhrit saivat Suomesta,Suomesta lähtee perjantaina 1 600  lahjaa Australian paloissa kärsineille eläimille.,https://img.ilcdn.fi/VLVl2q3n6vEwy9GbmT-AkhT-52s=/510x318/top/img-s3.ilcdn.fi/ae17b6fd31d9ca2ca9a6b585e5ba2c79fa49e6dd941a25f5ad058ae0f4d0c4b5.jpg
2020-02-27T13:38:21.000Z,"Karut kuvat onnettomuuspaikalta – suomalaisillekin tuttu keihäänheittäjä Braian Toledo, 26, menehtyi traagisesti: ”Kaipaamme sinua todella paljon”",Keihäänheittäjä Braian Toledo menehtyi keskiviikkoiltana.,https://img.ilcdn.fi/55YBRJMFoSDTrqsAQsBf3o3001E=/0x60:3000x1937/510x318/top/img-s3.ilcdn.fi/0b195dedc57ab3b855164906e2d85294e51b90176306a99be50504cfd16676aa.jpg
2020-02-27T13:40:00.000Z,Jari Sillanpää näytti tekevän pilkkaa puistattavista syytteistään – kuinka holtiton käytös vielä menee läpi?,"Asianajaja Riitta Leppiniemi joutui työskentelemään kovaa pelastaakseen Jari Sillanpään uusilta katastrofeilta, kirjoittaa rikos- ja oikeustoimittaja Solmu Salminen.",https://img.ilcdn.fi/T9h1zU-zDXewprC5vCcie1SvuDA=/510x318/top/img-s3.ilcdn.fi/d23fb51f80dae29a3db5a67430fcc62cce2a2238c4d17c6e5b9d3527a731d616.jpg
2020-02-27T14:17:29.000Z,Vikoja nolla! Lexus läpäisi ainoana automerkkinä ensikatsastukset täydellisesti,"Lexuksen puhtaat paperit ensikatsastuksissa vuonna 2019 ilahduttavat maahantuojaa, mutta tiedossa on, että Suomen keliolot eivät päästä autoja helpolla.",https://img.ilcdn.fi/EZVi5KoULWzkxBUp9_k7BYlt0Qs=/510x318/top/img-s3.ilcdn.fi/f78c4345d986fdb0245c75f72314dae63b8999d95c86851ead12b3da0be670b7.jpg
2020-02-27T14:33:01.000Z,Sydänkohtauksen saaneen NHL-pelaajan kausi ohi – kertoo vaarallisista hetkistään: ”Lopputulos olisi voinut olla todella erilainen”,Jay Bouwmeester sai sydänkohtauksen kesken ottelun. Pelille on löydetty uusi ajankohta.,https://img.ilcdn.fi/s6pqXTtaI-CbnbpxErLFKV0NNwE=/510x318/top/img-s3.ilcdn.fi/759810ef57e56d687432436572df8f029db69421c2af29addc5300592fb740f9.jpg
2020-02-27T14:43:13.000Z,"Annimari Korte julkaisi koskettavan kuvan – muistelee onnettomuudessa kuollutta keihäsmiestä: ”Se oli yksi viimeisistä asioista, joita sanoit minulle”","Annimari Korte muistelee Twitterissä Braian Toledoa, joka kuoli moottoripyöräonnettomuudessa.",https://img.ilcdn.fi/SYUQZVP4aUplafhGKQQifWaIjpc=/510x318/top/img-s3.ilcdn.fi/f7a64e8c4087bf88563997a672be8f067e272c42df37e0e0c7dc40d72b396335.jpg
2020-02-27T14:44:14.000Z,Uskoisitko? Kokonainen liuta Suomi-räpin ykkösnimiä on lähtöisin samasta junnujääkiekkojoukkueesta,Jääkiekkoseura Oulunkylän Kiekko-Kerhon kasvateista moni luo Suomessa uraa muusikkona.,https://img.ilcdn.fi/PzXOutEVP2Ew2P85WnCZI3nMKcE=/510x318/top/img-s3.ilcdn.fi/01ba34700d8a16f3049277a81a4894dad0f4374cd0c44f6d7d157d91437101a0.jpg
2020-02-27T14:48:19.000Z,"Näin tiedät, kannattaako kasvin multa jo vaihtaa - floristin niksillä vältyt sotkusormilta","Sormien upottaminen multaan on terapeuttista, mutta se tietää myös sotkua. Floristin niksillä vältät inhottavat multakynnet!",https://img.ilcdn.fi/MTgitRXJL9OFu1go2TofoA7Qa68=/510x318/top/img-s3.ilcdn.fi/8ff102c1239e3e9d30ce27ca3d77d76f7c92c8a25f855518ec034f73622f9c55.jpg
2020-02-27T14:51:02.000Z,"USA:n koronavarautuminen herättää kysymyksiä – vastuun saaneella Pencellä kyseenalainen tausta, asiantuntija tuomitsi Trumpin puheet sekaviksi",Presidentti Trump vakuuttelee amerikkalaisten olevan turvassa taudilta.,https://img.ilcdn.fi/yBikzoR_bVF6Sgc1cZolnz5YW90=/510x318/top/img-s3.ilcdn.fi/835803a51280317a8b13654bd1750fefcd80debe7b91f4455fe31140e32eadc1.jpg
2020-02-27T15:00:00.000Z,"Miten tästä voi selvitä hengissä? Tarja oli työkoneen päällä avaamassa tukosta, sitten työkaveri painoi nappia…","Tarja Vesanen kertoo Sensuroimaton Päivärinta -ohjelmassa, miten hän joutui sahalla työkoneen imaisemaksi.",https://img.ilcdn.fi/kcQafcZfhZ27iqZuvbSrXr2lbP0=/510x318/top/img-s3.ilcdn.fi/87b4f85fa952fc19d8d50ed11860ea34bdb9c4404a207a7115b1f2e1b904b6f0.jpg
2020-02-27T15:00:00.000Z,Maksuhäiriöisen asukkaan tarina saa vuokraemännänkin itkemään: ”Ei ole koskaan pystynyt töitä tekemään”,Tarja Vesanen vuokraa asuntojaan vain luottotietonsa menettäneille ja puolustaa kaikkia maksuhäiriöisiä.,https://img.ilcdn.fi/ov891cpQiL4LWarDDPAOWZ34sU8=/510x318/top/img-s3.ilcdn.fi/60c953715e9d55f18b9af3e38da0679a4385b820744652f85181a70730b21451.jpg
2020-02-27T15:06:09.000Z,"Ruotsalaisen Wilman, 17, etsinnät lopetettu - vain yksi ruumiinosa löytynyt",Entistä poikaystävää epäillään tytön murhaajaksi.,https://img.ilcdn.fi/ALPdw0pzie0Jn4hn90V5yauUjXg=/510x318/top/img-s3.ilcdn.fi/837fff079ffd1529a41427f7631f164df7b50891d7d55f086f12221e515fa6f9.jpeg
2020-02-27T15:07:28.000Z,Sebastian Vettel toi Ferrarille kauden ensimmäisen ”ykköstilan” – tekniikkamurheet varjostivat Mercedeksen päivää,Sebastian Vettel oli toiseksi viimeisen testipäivän nopein. ,https://img.ilcdn.fi/nZsTVttXTCDG03rfLXFmn3vE-yc=/510x318/top/img-s3.ilcdn.fi/8ce267297bd57bf034d9f27863462525d680a29fee9d49b1779515b7dc85b4ac.jpg
2020-02-27T15:15:19.000Z,Poikamiehen yksiö täynnä roskaa ja virtsapulloja – Löytyikö kaikkien aikojen epäsiistein vuokralainen Thaimaasta?,Vuokralainen sai Chonburissa sijaitsevan yksiön käsittämättömään kuntoon puolessa vuodessa.,https://img.ilcdn.fi/9peyM3lEJ-SJUdSR1cj4BXD__4I=/510x318/top/img-s3.ilcdn.fi/48151795bddc2669633e95357c43c5e3df30e60baa16390fa26400b9ee308a8a.jpg
2020-02-27T15:17:24.000Z,"Norjalaisnainen sairastui koronavirukseen ilman oireita – Lääkäri vastaa, miksi Suomi ei testaa lentokoneella tulijoita","Muutama oireeton tartunta voisi löytyä, mutta laajojen joukkojen testaus Suomen tilanteessa olisi resurssien hukkaa, sanoo HUS:in lääkäri Asko Järvinen.",https://img.ilcdn.fi/mouLAoTIqeiYrSCE9W9EL8f9GLQ=/510x318/top/img-s3.ilcdn.fi/28f448b339040821ce38255dd20c3344821ff719c43ed6b2fe70bb66187a4746.jpg
2020-02-27T15:30:59.000Z,Ihmis-Keninä tunnettu Roddy Alves ei peittele kauneusleikkauksiaan - nenässä ja rinnassa hurjat jäljet ,"Roddy Alves, joka aiemmin tunnettiin ihmis-Keninä, on käynyt lukuisissa kauneusleikkauksissa.",https://img.ilcdn.fi/vpdjwbRLEeIKaUMDhW4YoscqIOA=/510x318/top/img-s3.ilcdn.fi/2b9b76105f6c547929603d83c760665d2b7f6ba5904384769fa74a28e92f92b0.jpg
2020-02-27T15:46:54.000Z,Satu Tuomisto löysi uuden rakkaan – ”Kyseessä tuore tuttavuus”,Kesällä eronnut Satu Tuomisto hehkuu ihastuneena naisena.,https://img.ilcdn.fi/L0IXWPTZ_5XsC4DZZzP4xXprX6g=/510x318/top/img-s3.ilcdn.fi/48fab7e1740a14c3eda52c35eba5c09d01f19a5e8617387244444ec24c168b7b.jpg
2020-02-27T15:50:38.000Z,Poliisi Lohjan murhasta: Kolmaskin nuori mies vangittava raskaimmalla epäilyllä,"Poliisi vahvistaa, että huumeet liittyivät epäiltyyn henkirikokseen.",https://img.ilcdn.fi/F6j7l6lzPo5d3vTVHxt_Y7fbNew=/510x318/top/img-s3.ilcdn.fi/c57e81fde23ccb30f78860518be955b6aace410c9adb6a6933bf5661050cdc58.jpg
2020-02-27T16:00:10.000Z,Koska leivoit viimeksi teeleipiä? Köksän tunnilta tuttu klassikko on superhelppo iltapala,Tuoretta leipää mahdollisimman pienellä vaivalla! Tomaattiset teeleivät onnistuvat jokaiselta.,https://img.ilcdn.fi/_ktVet2hv5Wx0A5oSOzKsYjDgG8=/510x318/top/img-s3.ilcdn.fi/18fc7f8d4b85a8534cefbd558ab2c37aba6efb41e625018c5012d4db0c052ec2.jpg
2020-02-27T16:10:03.000Z,Luovuttiko Edmonton Oilers Jesse Puljujärven suhteen? Asiantuntija arvioi yllättävää kauppaa ,The Athletic -lehden kiekkotoimittaja Allan Mitchell arvioi Jesse Puljujärven tilannetta Edmontonissa.,https://img.ilcdn.fi/wLiqGTnsJUJa_6izkRaCXL9hU00=/0x64:3000x1940/510x318/top/img-s3.ilcdn.fi/05be5a8e2468bab522bfff760014e974d2f8d1b469bd486d16dbeb5f8d2f8c3d.jpg
2020-02-27T16:16:42.000Z,Kansanedustajat kirjastoihin tapaamaan kansalaisia - haluavat lisää aikaa ajatteluun: ”Ei mahdollisuutta ruokatunnin pitämiseen”,Tuore selvitys kertoo eduskunnan ja kansanedustajien työtapojen vanhentuneen - kansanedustajat valittavat kiireen lisääntyneen. ,https://img.ilcdn.fi/f2C5K1b87CckmeX-5ziY6Ff5bdU=/0x15:5911x3709/510x318/top/img-s3.ilcdn.fi/52f0eae8bcd4313d65aa163ab7c4c670f3dfea1ff1e2ad2a9cee799707cdc3f4.jpeg
2020-02-27T16:29:58.000Z,Toinen Kauniiden ja rohkeiden luojista on kuollut ,Lee Philip Bell on kuollut.,https://img.ilcdn.fi/nwAAuujLW5tLEMeLl1Bd4i3s248=/510x318/top/img-s3.ilcdn.fi/839c026d27cf0786345711b615e94fe670f4181c14fb5560b697a7c96913cbdd.jpg
2020-02-27T16:33:20.000Z,Muistatko Olivia Palermon? Tältä 2000-luvun alun tyyli-ikoni näyttää nyt,"Olivia Palermo nousi pinnalle jo 10 vuotta sitten, ja fashionista lukeutuu edelleen maailman parhaiten pukeutuviin naisiin. ",https://img.ilcdn.fi/AeOKGtxH_nviG4A0YstYA9XeAbc=/328x70:1746x960/510x318/top/img-s3.ilcdn.fi/6108187922475285ce18f7f135f23c4550f53c338791d5da53efa10305d3a1a3.jpg
2020-02-27T16:36:52.000Z,Kuusikymppinen mies lähti luisteluretkelle Siilinjärvellä – Poliisin kuvauskopteri löysi hukkuneena,"Poliisin tietoihin ei ole kirjattu mainintaa, että luistelijalla olisi ollut jäänaskalit mukanaan.",https://img.ilcdn.fi/-yXGgFuOBuY8lNCm3ghgF4PYtMA=/510x318/top/img-s3.ilcdn.fi/66ed2ddd69088579f96b6981e3356b79193cc6b4179b5051bdbff6fcd7473d8b.jpg
2020-02-27T16:38:36.000Z,"Koronariski on Suomessa yhä pieni, mutta huoli kasvaa ","Jokainen voi omilla toimillaan vaikuttaa siihen, ettei pahin koronaskenaario Suomessa toteudu, kirjoittaa Kreeta Karvala.",https://img.ilcdn.fi/36JzjMetPnN-efT3yYWY5YjPfEU=/510x318/top/img-s3.ilcdn.fi/952ee5e434ce2e4095dea7c4de8b3313862f7b62a18b1358f79d29316ef99ec3.jpeg
2020-02-27T16:49:55.000Z,Miten käärmeet parittelevat? Juhani sai tallennettua kobrien hypnoottisen lemmenhetken,Juhani Efraimsson bongasi kobraparin lemmenleikeissään talvikotinsa takapihalla Sri Lankassa.,https://img.ilcdn.fi/mzcaYtU-UAex6EFvwF8Fo-W-MDQ=/510x318/top/img-s3.ilcdn.fi/b9cea1bf12d38aa1e456a5294c47f9ecb33ac6a47ea72455bcb16c90ceafd3f0.jpg
2020-02-27T16:50:42.000Z,Yritykset seuraavat koronaviruksen leviämistä – OP ohjeisti epidemia-alueelta palaavia etätöihin,Yritykset ovat ottaneet käyttöön erilaisia ohjeistuksia koronaviruksen leviämisen ehkäisemiseksi.,https://img.ilcdn.fi/Mm_KJLLQN8HyFa_XEqrDJxL9qzU=/510x318/top/img-s3.ilcdn.fi/b3f91f92ff28be9c017d1148f2a4ea5f209d41cba1fd54a37d23c79a2f89ba90.jpg
2020-02-27T17:04:52.000Z,Lääke koronavirukseen voi olla jo olemassa – suomalaisprofessori: ”Lupaavia kandidaatteja”,"Vaikka koronaviruksen aiheuttamaan tautiin ei ole vielä uusia täsmälääkkeitä, siihen voivat tepsiä jo olemassa olevat lääkkeet. ",https://img.ilcdn.fi/1HK02B9riNeaAJVfO4cjzaPxVto=/150x0:2850x1688/510x318/top/img-s3.ilcdn.fi/551f538256f25aa2edac3e86f6f6f48b73891873ff3a1ae291fbacd64b24a632.jpg
2020-02-27T17:07:40.000Z,Antaisitko tekoälyn päättää työpaikastasi? Tietokone saattaa tunnistaa pian myös irtisanoutumisaikeet,Tekoäly voi olla tulevaisuudessa avuksi rekrytoinnissa.,https://img.ilcdn.fi/qEhKaqaXqgL_8fzY9apDAxnPuvE=/510x318/top/img-s3.ilcdn.fi/442d94685c1b948bf90f0721e5e411609a90715205cf5ccf290cf62fcfe53997.jpg
2020-02-27T17:15:14.000Z,19-vuotias hyökkääjä nöyryytti Tapparaa: ratkaisumaali vain 11 sekuntia ennen loppua – Ässien hurja nousu ei riittänyt voittoon,SM-liigan illan molemmat ottelut olivat erittäin tasaisia. ,https://img.ilcdn.fi/7M0VJlOjdgllDTYreDdKZQTgWzs=/510x318/top/img-s3.ilcdn.fi/6a8721b14b72bbfe2afe4bf70af9d2f6aab503941d4e499ef3623e3673b0e955.jpg
2020-02-27T17:22:09.000Z,Ransu Karvakuono -ääni Pertti Nättilä päätyi kahvittelemaan presidenttiparin kanssa - vaimolta omaperäinen lahja Jenni Haukiolle: ”Mielenkiintoinen hetki”,Näyttelijä Pertti Nättilä on suomalaisille Pikku Kakkosessa nähdyn Ransu-koirahahmon äänenä.,https://img.ilcdn.fi/Ki2-g2KVI4lHsHYXA8gD7kozwaM=/510x318/top/img-s3.ilcdn.fi/1db3944faf6a84403a0799cb773f7555f3c47efecb35142427b5212b3e9b9341.jpg
2020-02-27T17:22:17.000Z,Nainenkin saa kosia!,"Tiia, Suvi ja Laura kosivat miehiään karkauspäivänä – ja kehottavat muitakin naisia tarttumaan toimeen, joko karkauspäivänä tai milloin tahansa.",https://img.ilcdn.fi/PYD-5vZkv5vMvR5BuHYrLTSg5mI=/510x318/top/img-s3.ilcdn.fi/7a1d5c18428c9df9f8b585991977a10a006293c929355fd07e2f105dc697a7ca.jpg
2020-02-27T17:35:12.000Z,Ennustiko yhdysvaltalaiskirjailija koronaepidemian? Viruksella villejä yhtymäkohtia vuoden 1981 trilleriin,Liki 40 vuotta sitten kirjoitettu romaani herätti salaliittoteoreetikot.,https://img.ilcdn.fi/9NlOJJ1ZNc7v2C_1UacQha2dprc=/510x318/top/img-s3.ilcdn.fi/9ff697697bed02080695425a0ab6af6bc51ba0ead3dcfc2786e734da299d1ce4.jpg
2020-02-27T17:46:44.000Z,Krista Pärmäkosken vauhti hyytyy: ”Hän ei ole missään nimessä sellaisessa kunnossa kuin aiemmin”,Toni Roponen ruotii Krista Pärmäkosken tilannetta.,https://img.ilcdn.fi/NJWOpBNs0M65y_NbpNzRrij9lYE=/510x318/top/img-s3.ilcdn.fi/e4e3f4525a8f193a6556eb45588b668588698c75c4c4356979afa2a5a7d21785.jpeg
2020-02-27T18:05:52.000Z,"Hengityssuojaimet koko ajan loppu apteekeista, vaikka ne eivät pidä koronavirusta loitolla – joillakin suojain voi lisätä ongelmia ",Apteekeista myydään kaikki hengityssuojaimet heti kun apteekit onnistuvat niitä varastoihinsa hankkimaan.,https://img.ilcdn.fi/4XzZQpSvcH7wssKOwc-VcTqOq1I=/510x318/top/img-s3.ilcdn.fi/27a3b1752d74b36eaecfd3368e36b846d46aca99b7ff252385ccbad62ac833ac.jpg
2020-02-27T18:27:50.000Z,"”Katiskan” Jatimatic-mies vaikuttui poliisin työstä, murtui ja selvitti kaiken – ”Henkinen takaisku”",Tamperelaisen teollisuussuvun jälkeläinen tienasi poliisin laskujen mukaan yli 225 000 euroa Katiska-huumekaupalla.,https://img.ilcdn.fi/Z5oAHYsVSRa1evm6K1Z1qy3s6FY=/510x318/top/img-s3.ilcdn.fi/5ab2cadc3ac2a5d196d8e5101e41a1218770b0f8ffcc7946ddaa6e80a3b2351c.jpg
2020-02-27T18:28:41.000Z,Vieläkin epäselvää: Kuka maksaa Harryn ja Meghanin turvamiehet?,Kanadalaiset eivät haluaisi raotella kukkaronnyörejään ex-kuninkaallisten vuoksi.,https://img.ilcdn.fi/JWe6lx2yA6wvdQjxLTRhV8TlsgA=/510x318/top/img-s3.ilcdn.fi/ab1e6d284a6788486282e214c792261229720e5bd270a37b7e48fa317eb8902e.jpg
2020-02-27T18:57:49.000Z,Ruotsissa viisi uutta koronavirustartuntaa,Tartunnan saaneet ovat vierailleet ainakin Italiassa ja Iranissa.,https://img.ilcdn.fi/smeJFOyeEiwbGTpDjqs6qj9yCfU=/510x318/top/img-s3.ilcdn.fi/83148024256774b06c2e6fc15c5b65b9bcbc301735266a12beef9a9c7fe44ed3.jpg
2020-02-27T18:58:52.000Z,"Näin puhut lasten kanssa koronaviruksen uhasta: ”Tärkeää on, ettei lapsi joudu kantamaan aikuisten pelkoja”","Aikuisen tehtävä on vastata kysymyksiin ja rauhoitella, jos lapsella herää kysymyksiä koronaviruksesta.",https://img.ilcdn.fi/aIOd7DnWhfGmJAVMEUlxpEy5Nn4=/510x318/top/img-s3.ilcdn.fi/d3e2d27721ea38ca9094a7e7f872f953e28e1187da6e53aa7e5f12fbd3cfb517.jpg
2020-02-27T18:59:29.000Z,Yle: Vasemmistoliiton toiminnanjohtajan perustama sometili kannatti ilmastonmuutoksen kieltäjien ampumista,Puolueen mukaan läntisen alueen toiminnanjohtaja oli luovuttanut tilin kahdelle muulle henkilölle. ,https://img.ilcdn.fi/iq-86M3R2-X3NTOlukT_Ocj_lYY=/510x318/top/img-s3.ilcdn.fi/6f4314009a9116040381fcd828983914d0f1f9e9a7054546109f37cabc6d8d19.jpg
2020-02-27T19:06:32.000Z,"Volkan Ünsalista löytyi vain verijälkiä: Vuosaaren palkkamurha liittää Jari Aarnion, Janne Ranisen, ”Metsurin” ja liivijengipomon toisiinsa – näin kaikki tapahtui",Ruotsinturkkilainen Volkan Ünsal murhattiin Helsingin Vuosaaressa 16. lokakuuta 2003. Tapaus on yhä ajankohtainen.,https://img.ilcdn.fi/HEBMkN-wKuPn4wKUyxWETqsfsDA=/510x318/top/img-s3.ilcdn.fi/132582ebf789e5e29edc9b93d22774563b3fd73be1c8e065b23a60dc5cb718c9.png
2020-02-27T19:09:48.000Z,Hävisikö Jokereiden kilpailija tahallaan? Narreille vaikeampi vastus pudotuspeleihin – tässä ovat KHL:n playoff-parit,Jokerit saa vastaansa Lokomotivin.,https://img.ilcdn.fi/BmALbuT-MwmpLfBsz6SEeygOPco=/510x318/top/img-s3.ilcdn.fi/01987a6f847a7026a89fcb479578684244eaeba9967776d9c597afbd49313570.jpg
2020-02-27T19:29:40.000Z,Niko Ranta-ahon sisko yritti suojella Janne ”Nacci” Tranbergia kuulusteluissa – olivat yhteydessä lähes päivittäin,"Poliisin esitutkinta paljastaa, että Niko Ranta-ahon sisko ei olisi halunnut luovuttaa poliisille puhelimensa avauskoodia, koska se sisälsi tietoja etsintäkuulutetusta Janne Tranbergista.",https://img.ilcdn.fi/6s3khCAMCoKPjswN7C5Z-ShjRCg=/510x318/top/img-s3.ilcdn.fi/0d7b7fa5c82a3768fe5dccf21dee17d7ee9979f46dd04d4e3ce9ea9a7aef359b.jpg
2020-02-27T19:31:08.000Z,Tuntemattoman häissä bestmanina ollut Ylex:n Köpi mokasi alttarilla: ”Mun koko elämä pysähtyi siihen”,"Ylex:n juontaja Juuso ”Köpi” Kallio kertoi radiossa, miten pahasti hän mokasi häissä.",https://img.ilcdn.fi/8pUjasPVc2x0c_918vAcyXn5DRc=/510x318/top/img-s3.ilcdn.fi/b0055c342c4e9aeb830f9dbeb21b7e26149ee1331c7cfa0985c81b2a74d130c3.jpg
2020-02-27T19:37:28.000Z,Ville Peltonen sai potkut!,HC Lausanne erotti Ville Peltosen.,https://img.ilcdn.fi/JRTgsAb3rzrIRG9wOTRqeuJHD4g=/510x318/top/img-s3.ilcdn.fi/964c09c35154acb413ffcd625be7ce698ce36a7a3553cc8acbfe528781f095ee.jpg
2020-02-27T19:48:42.000Z,"Pandemia voisi pidentää leikkausjonoja – kiireettömiä operaatioita saatettaisiin siirtää, jotta tehohoitopaikkoja riittäisi koronapotilaille",Esimerkiksi tiettyjä suuria verisuonileikkauksia voitaisiin siirtää myöhemmäksi. ,https://img.ilcdn.fi/yQKEBP3ogNlc9ZMyRbHuGScwzsg=/510x318/top/img-s3.ilcdn.fi/d9758e5b3f239b53085b744891b777945e0b777d78cad5be5d65102c8d40dbca.jpg
2020-02-27T19:50:53.000Z,”Suomalaisseurat” jatkoon Eurooppa-liigassa – Lukas Hradecky torjui upean vierasvoiton Portossa,Bayer Leverkusen varmisti paikkansa Eurooppa-liigan neljännesvälierissä 3-1-vierasvoitolla Portosta. ,https://img.ilcdn.fi/pl3QxtTn6R6KONY0azHrsviZ7J8=/510x318/top/img-s3.ilcdn.fi/c771f9078d0c494c425a824bdf4d4c213baae0ef0401b8e1ed953416e1551761.jpg
