paivamaara,otsikko,tiivistelma,kuva,id
2025-07-23T17:21:22.000Z,Tuomitut miehet ,IL paljastaa karuja tietoja Helsingin jäähallin kohuillan osallistujista. ,https://img.ilcdn.fi/Uw1M_z-FvUw3El8-rIBRhlKAzb4=/510x318/top/img-s3.ilcdn.fi/3de8cd6735bb04ec67c236879e1712463f2c8c57cda3e9ade8a0742c5d539240.jpg,A1A03CD15B4348058C9C79EE042B2C26
2025-07-23T17:30:56.000Z,Suomalaisjohtajalta painavaa puhetta USA:n ja EU:n tullisopimuksesta,EK:n Timo Vuori: Lääketeollisuus haastavan tilanteen edessä.,https://img.ilcdn.fi/05A5ERqLgP3CH98K--KEzfYCo3U=/510x318/top/img-s3.ilcdn.fi/e3dbdb7de2db5d0f0dfc0542b92f395e201812a2ecf9391fee2835f98ddf62dd.jpg,39733710D2F04F4D815B87CD680A7151
2025-07-23T17:38:06.000Z,"Monet eivät ole tekemisissä sisaruksensa kanssa ollenkaan – Katso, mistä se useimmiten johtuu","Sisarussuhde on erityinen ja usein koko elämän pisin ihmissuhde. Joskus sisarusten välillä on kateutta, ärsyyntymistä tai muita vaikeita tunteita. Vastaa kyselyyn ja kerro kokemuksistasi.",https://img.ilcdn.fi/P9qsXh1qopP1i8Rf0Ml12aslne4=/510x318/top/img-s3.ilcdn.fi/9d8d76fe48251b8f0427cedb2cf3390301d23bfbe7d67d4875fe34b39a19da97.jpg,75C0002C71374863A0CA8C9C6C0F4279
2025-07-23T17:40:21.000Z,Kolari pisti Kehä I:n täysin tukkoon: ”Oli umpihässäkkä”,Kolari ruuhkautti idän suuntaan kulkevaa liikennettä keskiviikkona alkuillasta.,https://img.ilcdn.fi/2mVZRs4xDQzarRSY9JaNmWRsT78=/510x318/top/img-s3.ilcdn.fi/3971201e7883fd59a987adf29a36bd008de8fada542e59474df62b322775c124.jpg,8E0AC348B0C34693BE85EEFF091E89A2
2025-07-23T18:01:19.000Z,Kim Kardashian ikonisessa korsetissa – Katso kuva,Kim Kardashianin korsettiasu säväyttää ja hänen kapea vyötärön uuma puhuttaa.,https://img.ilcdn.fi/hoaXVoU7dnpHdfQd4X85MwXEit4=/510x318/top/img-s3.ilcdn.fi/8b75b2389aa948c8ad99a92a1d11c62ae3e178450d9f9b43f9880e2b7372da80.jpg,6CB39D70B5284F1AB1FD1A2B21C2028C
2025-07-23T18:08:56.000Z,"Toimitusjohtaja rääkkäsi rauhoitettua eläintä videolla – Kun Iltalehti otti yhteyttä, alkoi tapahtua","Mies ajoi vesiskootterilla takaa kyhmyjoutsenta, joka on Suomessa rauhoitettu laji. Eläinfilosofin mukaan tilanne aiheutti linnulle stressiä ja pelkoa.",https://img.ilcdn.fi/yI_uYL5sbEsSD3xAHKs83UMv-EM=/510x318/top/img-s3.ilcdn.fi/70513fab16dc34c8d3d0fd9c0149d6fb4bb278ba36da9c20735e12f73c872fcf.png,A946A9EDAD794947B24CA3AAF72F1C66
2025-07-23T18:18:08.000Z,Superpesis-ottelussa pelottava tilanne,Manse PP:n pelaaja romahti.,https://img.ilcdn.fi/7wOZejLgsSMahb8zrpF4TcFbojE=/0x0:3000x1876/510x318/top/img-s3.ilcdn.fi/21e5b5c7933f04e0b7ea42f97dbe9b756e70b338d78efe9a16b0f1678ca91583.jpg,FA9E6BA992934C0BB1787CC36A030EE9
2025-07-23T18:21:06.000Z,Raiskaus uimarannalla – Tällaisia miehiä poliisi etsii,Poliisi kaipaa yhä havaintoja kolmesta nuoresta suomalaismiehestä.,https://img.ilcdn.fi/DcGc2MHijtnw04339RQWydMNqCE=/510x318/top/img-s3.ilcdn.fi/094610381dd16f6f5343549cb340d9904614521db12c80dd393cfb8e047e2f50.jpg,A7AC2CD283674B0F94614B4081E631BA
2025-07-23T18:28:01.000Z,Matthew Perryn kuolemaan liittynyt lääkäri myöntää syyllisyytensä,Lääkäri Salvador Plasencia tunnustaa antaneensa näyttelijä Matthew Perrylle ketamiinia.,https://img.ilcdn.fi/pwByvMtylBrXmRejERA2ZKQgcdQ=/510x318/top/img-s3.ilcdn.fi/7cdc109f6f63404d7ea111effd4a952840ff4cef2c3634ed17a114c8a92449fb.jpg,8698F4FF270644119365AF6FFD9D9B33
2025-07-23T18:40:17.000Z,Hillitön lopetus 46 sekunnissa! Suomen vapaaottelutähden potku ällistyttää,Omran Chaaban nappasi huiman voiton UAE Warriorsissa.,https://img.ilcdn.fi/0MwdfNcDfwZX_WmgepDr-NPOz0U=/510x318/top/img-s3.ilcdn.fi/090a071f539e4c0869bde02f59a0a3bca671febd0b0d8cda10ba16fa7f5ed9b1.jpg,EA1C98D8D56044F484D967A524722AC1
2025-07-23T18:49:38.000Z,HU: Lidlin kolmen euron autotarvike meni kuin kuumille kiville,Lidlin kolmen euron autopuhdistuslima on myyty monessa paikkaa loppuun.,https://img.ilcdn.fi/75PJMpw6duZIqN6BHHZuRlJmKeo=/510x318/top/img-s3.ilcdn.fi/4377309a67e815fe2d24c88f47e20b3caa91f0bc3c56e8e57f8c785241a6f5d3.jpg,D610CD5B2218492BA670FD17E96E2B57
2025-07-23T18:54:15.000Z,Samppa Lappalainen ja Jenni Janakka: Ero,Race Across The World Suomi -ohjelmassa kilpaillut pariskunta Samppa Lappalainen ja Jenni Janakka ovat ilmoittaneet eroavansa.,https://img.ilcdn.fi/7A0-IJckMoscaGXXpiSsmGTV9Rc=/510x318/top/img-s3.ilcdn.fi/38d7302899d8d81afe11627b25103f8bf79d99be926d35f2ccb86a12f969af49.jpg,191F61C396764FF38028BE38E7215E0C
2025-07-23T18:58:00.000Z,Lotta Haralan toiminta herätti huomiota festareilla,Harala ei ole festari-ihmisiä.,https://img.ilcdn.fi/hu6fOSmYMLkoji585bBqYeKvzpw=/510x318/top/img-s3.ilcdn.fi/0a8813d001b156ef239688df2504f9464ab3da7c4199c54dd93e55881ee7fe00.jpg,E813AA0ACD5047588E9187DB6E82999E
2025-07-23T19:17:38.000Z,Oletko nähnyt tätä naista? Soita 112,Poliisi etsii kadonnutta naista Vantaalla.,https://img.ilcdn.fi/kgBzfdR9hd2GuAYXB3XoWI4ET30=/510x318/top/img-s3.ilcdn.fi/7138c9887760918c52315580c1ae02dbc702e01c5b449b9768458a3c0bdf4685.jpg,AD6C3DAACF364C59800AEDFBA7833B36
2025-07-23T19:19:04.000Z,Lordilla erikoinen kohtaaminen pukuhuoneessa Ozzy Osbournen kanssa – Kuva julki,Lordi muistelee edesmenneen rocklegenda Ozzy Osbournen kohtaamista. ,https://img.ilcdn.fi/U44xABevaDCUJ-pz7j-UVgbQ_5w=/510x318/top/img-s3.ilcdn.fi/62f13330f85ddd397f51441fc3c95b4ee8f70942240ee8e9f6ac39ad073720ed.jpg,19E2C55FE1364E0CBD6603B628F91344
2025-07-23T19:25:45.000Z,Paljastiko kohuottelija huumeluolan Kontulassa? Poliisi: Asia on käsittelyssä ,"Sosiaalisessa mediassa mietitään, paljastiko kohu-urheilija huumeluolan Kontulassa. Helsingin poliisi selvittää asiaa. ",https://img.ilcdn.fi/sfJ1LBr2evVHiUPleaExI3mFWIU=/510x318/top/img-s3.ilcdn.fi/eddc7acc2057613e45429798fd80aef52674b749f2d7372296402681a7997bf4.png,E6ABC065F9634A99AD217B17C0B114A9
2025-07-23T19:33:38.000Z,Reetta Hurske kyyristyi telineisiin – Sitten tapahtui jotain röyhkeää,Pika-aitojen lähtöprosessi ei mennyt aivan putkeen.,https://img.ilcdn.fi/qjg1Ta18ny6C4ngx4YuFlJluphk=/510x318/top/img-s3.ilcdn.fi/f106572cddaf85f3dc886246e852b532294eac4f8bcf6a2161cbfa8bdcd73bae.jpg,72B7DCE713AE447986F54FAAA52B50D9
2025-07-23T19:49:46.000Z,Tuntematon nainen hipsutti Alexantrosia – Hetken päästä nyrkki heilahti,"Alexantrosin video on kerännyt vain kahdessa päivässä jo 2,2 miljoonaa näyttökertaa. Videon tapahtumaketju on Alexantrosin mukaan yhä mysteeri hänelle. ",https://img.ilcdn.fi/rLBxp_hsak7u8dgOUSz9xWH8YBI=/510x318/top/img-s3.ilcdn.fi/71fc8a5b1cc96d829058a37558c071b7fed4125bb32ee7217be0fcf99b0e0b04.png,41439A752CBA4C0BBC703348EFF1A848
2025-07-23T19:52:13.000Z,Trumpin hallinto jyrähti: Rajuja syytöksiä Euroopasta,Yhdysvaltain ulkoministeriön mukaan Eurooppa rajoittaa sananvapautta ja vangitsee toisinajattelijoita.,https://img.ilcdn.fi/2Yr4DiPBpIT4geZgfOj86Gs3_D4=/510x318/top/img-s3.ilcdn.fi/4bb0a405c44a070e9f58fdd98bb0a8a85973af33d3fa0b97826e45c442b7c9f0.jpg,F937C8E5FDD04F778489F314ABF2D087
2025-07-23T19:53:38.000Z,Asemasota Zürichissä – Espanja haluaa rikkoa lasikattonsa,EM-välierän avausjaksolla ei nähty maaleja.,https://img.ilcdn.fi/qVFkI9J-krLbqOUXg9ZiJsGnHjU=/510x318/top/img-s3.ilcdn.fi/9da329d4aef40dd02a871199e206262f5ebc1301fec53f05490baecbcebb9455.jpg,A8A492D64C624DFD8781B294525F84C8
2025-07-23T19:54:33.000Z,Ozzy Osbournen kuolinilmoituksessa hämmentävä yksityiskohta – Kaksi lasta puuttuu,"Ozzy Osbournea jäi kaipaamaan kuusi lasta, joista vain neljä on allekirjoittanut kuolinilmoituksen.",https://img.ilcdn.fi/md6eRl375DscSVe8jzpZxnNGDU0=/510x318/top/img-s3.ilcdn.fi/c08126eecf5eea96e079bfd3e06ca2df17399c8f5248d47f63f47e2d5a25662d.jpg,8AE7FCD96758471BA00FE467D99795D4
2025-07-23T19:55:33.000Z,Tennistähti laittoi talonsa myyntiin: Järisyttävä hintalappu,Marija Šarapova myy Los Angelesin asuntoaan.,https://img.ilcdn.fi/kWhAnjin80Eagqf99kDCuaLenps=/510x318/top/img-s3.ilcdn.fi/d40f667ea615941bccae765101611eef25aa168d556c2593f510fc3e5116a294.jpg,C21E7971DFB448469CFCB46087C25B6C
2025-07-23T20:00:50.000Z,Rikolliset soittivat it-tukeen ja saivat haluamansa – Katastrofi,Kyberhyökkäys aiheutti yhtiölle 380 miljoonan dollarin vahingot.,https://img.ilcdn.fi/MMJsy7XdH_4gt8g5W_4yh01TcV4=/510x318/top/img-s3.ilcdn.fi/2749dcd323f64acb03dc8da79419a59707dfd4cc9400230fba4b8d34173f771a.jpg,58611F2B2C0D47C89C8619DE10C96D5B
2025-07-23T20:19:47.000Z,Tyly arvio Venäjästä,"Venäjä-asiantuntija valottaa, kuinka Venäjän suhteet sen liittolaisiin ovat erittäin jännitteisiä. ",https://img.ilcdn.fi/B38SetI79n0EDMuuNEqCnLBgxIo=/510x318/top/img-s3.ilcdn.fi/1d93d524d52edc68f7e47875fb09cf758a11875c51d36ba46e87bff958e2bcff.jpg,FFD6B10039E54714AB73CCD1C427EE2A
2025-07-23T20:34:54.000Z,Zelenskyi myöntyi kritiikin edessä,Tähän artikkeliin on koottu Ukrainan sodan keskeisimmät tapahtumat keskiviikolta 23. heinäkuuta 2025. Kyseessä on sodan 1246. päivä.,https://img.ilcdn.fi/OJBW1UVffaZx04e8R0aDLMYgH6s=/510x318/top/img-s3.ilcdn.fi/b8560412f472fabb9cbc9f3c0880fe79b517083fff41908e1aa3a55204d05650.jpg,95167325737B4384B85D2CBB0654515F
2025-07-23T21:50:32.000Z,Poliisi juoksi skuuttia kiinni Helsingissä ,Helsingin Hakaniemessä nähtiin keskiviikkoiltana erikoinen takaa-ajotilanne.,https://img.ilcdn.fi/Gk-KVOWQ8UbtoBrr-Rh0z86NlGU=/510x318/top/img-s3.ilcdn.fi/d7c4c5919e3e8c8c147f7d942d2fdec9521492a236884fdbf8314e49d6c8291b.jpg,A5728B410D4E47118CF011A4F35D877D
2025-07-23T22:59:13.000Z,Horoskooppi,NULL,https://img.ilcdn.fi/jm9wPlnoWFx5jhlXkB6i6JzE1x4=/510x318/top/img-s3.ilcdn.fi/8d5c61e8c61ff106bc8907444720fdd5e3bdfa0bdec71d9ddc943f19d86978bd.jpg,FFA68A5ECED644DA9ABE96CBEB384759
2025-07-24T00:12:58.000Z,Suosikkinäyttelijä: Söin kokonaisen perheen edestä,Hollywood-tähti Benedict Cumberbatch avautuu aiheesta podcastissa. ,https://img.ilcdn.fi/36lbToM2syIw939JqGmSR5MGqpc=/510x318/top/img-s3.ilcdn.fi/2803f16b4ee0894fd2945069baa00e8e2fe491e29330acbd5d20313dd5b5dc90.jpg,AFF058C9B6504E318BE5E93AB3F2A0F3
2025-07-24T02:25:49.000Z,Trumpille huolestuttavia tietoja jo toukokuussa,Lähteet puhuvat kohutusta tutkinnasta amerikkalaismedialle.,https://img.ilcdn.fi/lOLP3iZ4Hsn1WhjaSOmBGpP5EkE=/510x318/top/img-s3.ilcdn.fi/3e1cd62b761d09820d9e683670e923a51009cda61d52dbef55c23f9d8813b6a8.jpg,FE673F6C3CE1402D84CC8E129F10AA1C
2025-07-24T03:00:15.000Z,Analyysi: Vyyhti paisuu Trumpin ympärillä,"Jeffrey Epsteinia koskevien dokumenttien julkaisusta on tullut Yhdysvalloissa avoimuuden symboli. Mutta mitä tiedämme Epsteinin taustavoimista? Oliko itsemurhan tehnyt mies niin suuri vallankäyttäjä kuin uskotaan ja millainen rooli ”parittajana” työskennelleelle naisella oli, kysyy toimittaja Pekka Virkki.",https://img.ilcdn.fi/TySZ4HOBrf4HrWG9Kd1ID6fLZLw=/510x318/top/img-s3.ilcdn.fi/10c5c347338b372ad6985778dfedd2f2ba62d08a4f22f2b323bf17f90187668c.jpg,7BFE5AF6A783469AAC4C152EFD5777F7
2025-07-24T03:00:33.000Z,Podcast: Kerttu Rissanen etsii kumppania – Yksi pulma,Kerttu Rissanen seurusteli näyttelijä Sami Uotilan kanssa kuusi vuotta.,https://img.ilcdn.fi/tIJJ1arkI4oDuU5WSG9cdjqR7jg=/510x318/top/img-s3.ilcdn.fi/5a318659e657d19fa63171ecf2c51ef72e1198e5d670a16d198f75af479b6c42.jpg,328E89AEEC804229B737B56814F9F938
2025-07-24T03:31:01.000Z,Yhdysvaltalaispelaaja istui yksin suomalaisessa saunassa – Hetken päästä hän järkyttyi: ”Mitä olen mennyt tekemään”,Iltalehti esitti HJK:n yhdysvaltalaislaiturille Benji Michelille kymmenen kysymystä Suomesta.,https://img.ilcdn.fi/vrc5MgVoLZywaZPIt4-DZf3DATU=/510x318/top/img-s3.ilcdn.fi/0b6f2998b893d254c3e3d6afbf49da8c5c876a125d7de5d7c669e23834c579d4.jpg,824BAE2B82924E1F857E250D5F6A776E
2025-07-24T03:31:03.000Z,Suomen oudoimmat matkakohteet tulevat tässä ,"Kesäisestä Suomesta löytyy monenlaista nähtävää, ja osan erikoisuuksista voi kokea jopa ilmaiseksi.",https://img.ilcdn.fi/Fsx2eX7nbSY9XccVFa-DZZgpVHM=/510x318/top/img-s3.ilcdn.fi/a583296b383ad36265e7922ef06d444811bed2f7b91bb26c02fc817e7019ff76.jpg,42C258A41F1C48BBA9BF76E3F986EA51
2025-07-24T03:32:01.000Z,Tänään tv:ssä: Isä saattoi tyttärensä raskaaksi – Siskon elämä päättyi epätoivoiseen tekoon,Ruth Ellisin tarina -draamasarja perustuu tositarinaan Britannian viimeisestä kuolemanrangaistuksen saaneesta naisesta.,https://img.ilcdn.fi/f3y8JNB5or98uZ3-C4vh0-MNgl4=/510x318/top/img-s3.ilcdn.fi/991c670d2c095d381a527f82b2e8911757ac94894bfce2664e7229800bf89129.jpg,C46C1C4466AA466A81132FAD37F9B707
2025-07-24T03:49:54.000Z,Puutteita pelaajalle,Manjaro on tavallisesti hyvä valinta peli-pc:hen. Se kuitenkin häviää kilpailijoilleen parilla osa-alueella.,https://img.ilcdn.fi/786cviwjpFmBV3G3tcgZ_Ci6H2c=/510x318/top/img-s3.ilcdn.fi/4db7f7074edbaf26ca2ffe4f0939b880a0f6824ad366deb243d2ba76ab32cdb6.png,153AB37A906C4056892D197FC67BF13C
2025-07-24T04:00:16.000Z,Näin Venäjällä rummutetaan uutta sotaa,"Kazakstanin lentoturma laittoi liikkeelle geopoliittisen pelin, jota pelataan kovilla panoksilla. ",https://img.ilcdn.fi/nquGaEl-9UUWxZ8KJq5mSWrdE3A=/510x318/top/img-s3.ilcdn.fi/920912a7010c69babc24818de9b3385fa9e7dc042221b1924e0cbb2d370f3156.jpg,1237C33857C5449AB7892981808F8D22
2025-07-24T04:02:07.000Z,Nämä puheet menivät yli – Veikkausliigan päävalmentaja pelikieltoon,Andy Smithin sarkastiset kommentit johtivat rangaistukseen.,https://img.ilcdn.fi/AA4U5EMlZAZITefGm_Bix0LBhdg=/510x318/top/img-s3.ilcdn.fi/39fe29a414c71014c4c2261224a7af84cf0ebe2336f428e4308e7a8010aeb848.jpg,07424625E3B042FD8202CC109BA729F9
2025-07-24T04:07:10.000Z,Hollywood-tähti hukkui – Näin tilanne eteni,Malcolm-Jamal Warner kuoli 54-vuotiaana.,https://img.ilcdn.fi/Od6rq9WUSjk1sBe-4r26_JqyqP8=/510x318/top/img-s3.ilcdn.fi/90f0d3e6b1a4bbb0abc648c1e30840b56a5c15124f2722d4b0d914eebd218f44.jpg,30B1DC4D0BA945BBA0BC8DCC8BB944DE
2025-07-24T04:30:51.000Z,Suuri kolmiodraama: EU punnitsee kahden välillä,"EU ja Kiina tapaavat torstaina, mutta odotukset ovat alhaiset. Suhtautuminen Kiinaan on epäselvä Yhdysvaltojen kauppapolitiikan muutosten takia.",https://img.ilcdn.fi/v2izTrELCIvZV5c4F__g9vFBByA=/510x318/top/img-s3.ilcdn.fi/26bedccfd5bc985164512604af2f359928ea6f6a962cd4e91c586164732d5c3b.jpg,75B41C4C496D4637A0736F09AF52E727
2025-07-24T04:32:36.000Z,Podcast: Immu ei ole tekemisissä vanhemman poikansa kanssa – ”Olen epäonnistunut”,Mika Ilmén kertoi Puheenaihe-podcastissa olevansa esimerkki sekä huonosta että hyvästä isästä.,https://img.ilcdn.fi/oEjxbVj31RMG_u9-WW7o3qGdYR0=/510x318/top/img-s3.ilcdn.fi/ca4fab5338d904aec10e508ca9168f539a606081984f6083b23e5ec437acda55.jpg,3AB672EEA8BD41FFA991CC246E5287AE
2025-07-24T04:33:06.000Z,"Podcast: Pernilla Böckermanin seksikysymys suututti miehiä: ”Se on sinun asiasi, hoida sinä”","Pernilla Böckerman paljastaa podcastissaan, miten miehet reagoivat kysymykseen ehkäisykulujen jakamisesta. ",https://img.ilcdn.fi/1GboNxBnrMIkxWDfSO8hpJkie3g=/510x318/top/img-s3.ilcdn.fi/328a7b4b31bb79d0ba0c980b2a77b6c86d1c78645747ea64ad0c805e6416343c.png,04261AA711854F2F84488559B96957DF
2025-07-24T04:48:41.000Z,Steve Jobsin tyttären häistä uskomaton paljastus,Apple-perustajan tyttären suhde paljastui vasta viime kesänä.,https://img.ilcdn.fi/RTHQxhZY2jk6Y3S4wYdoX7ODT_Y=/510x318/top/img-s3.ilcdn.fi/7caa4b2d03d4259687fcf0629f8a5a090a7ecc31f60eb73cb9888b83e9448742.jpg,1D0F2061ACC046529DDE77628DCA1DEF
2025-07-24T04:56:25.000Z,Uutta tietoa Ozzy Osbournen viimeisistä hetkistä  ,Osbournen talolle saapui pelastushelikopteri hetki ennen rock-legendan kuolemaa.,https://img.ilcdn.fi/Bm71Me7TdUwtJ5xLjsDSW_vI_kE=/510x318/top/img-s3.ilcdn.fi/055311990843b94800299c4ed735478fa433fd5b009ab55ee6ab6b132394bb5d.jpg,6D2793941E3B496C8BBBB6EF8E6460FD
2025-07-24T05:00:38.000Z,"Jätkäsaaresta leviää kikka, joka altistaisi nuoret jopa kuolemanvaaralle – IL testasi, onko oikeasti syytä olla huolissaan","Iltalehti kokeili somessa levinnyttä kikkaa, jonka mukaan sähkölukitusta ovesta pääsee kulkemaan ilman avainta. Ylläpitopäällikön mukaan luvatonta liikkumista rakennuksissa pyritään estämään erilaisilla turvatoimilla.",https://img.ilcdn.fi/HYu_64JKp1m22CCfQl8MjK6zr7A=/510x318/top/img-s3.ilcdn.fi/06a2d057aa4e0be38edfa407b490ea468dc58cab8707a03910cbbd4296585c3c.jpg,98F6D857DE684AF8AF2D9DEA2D66FAA2
2025-07-24T05:22:57.000Z,F1-kuskilta kitkerää tekstiä,"Carlos Sainz uskoo, että olisi Max Verstappenille oikea tallikaveri.",https://img.ilcdn.fi/8hDPv42JBdxzWVkeBZvrPg6do4M=/510x318/top/img-s3.ilcdn.fi/54256146aa91e7914eb6cabee44f411cb76b75a55ff55352a67faafa6e9acaeb.jpg,89E80027FED348CCA98412CBB45426D7
2025-07-24T05:32:51.000Z,Huh järvihellettä!,Paahtava hellejakso on lämmittänyt uimavedet.,https://img.ilcdn.fi/B9rFf3xbyk8a5HKAFoTQsN0cXGw=/510x318/top/img-s3.ilcdn.fi/6d6065992848dee78a0b651c65d3740026fdfb6fbb918cfc8d24a5c3e70cd477.jpg,A0FCE871D5934AD19913FE4692C07F2B
2025-07-24T05:35:16.000Z,Christoffer Strandberg ja Janne-puoliso pohtivat seuraavaa suuntaa elämässään – ”Kaivataan tilaa ja aikaa muille asioille”,Christoffer Strandberg ja Janne-puoliso viettävät Siuntion-kodissaan viidettä kesää. ,https://img.ilcdn.fi/knHSYIEEOr4mL6nJAwOsKg0TMSw=/510x318/top/img-s3.ilcdn.fi/437268e8f0091f3460318346b8e49ad98165b142b5f1fc913283c5dadd479827.jpg,1117D7AD1FC7488989061EE8135CA8D6
2025-07-24T05:45:53.000Z,Mitä suomalaiset pelkäävät eniten liikenteessä? Rattijuoppo jäi nyt toiseksi,Suomalaisten liikenneturvallisuutta ja liikennekäyttäytymistä mittaavassa tutkimuksessa koettiin muutos viime vuodesta.,https://img.ilcdn.fi/3SsxJFqQNIHNsVxBULUwz7K0FBI=/510x318/top/img-s3.ilcdn.fi/d51a550d74d24c3d6940187cbd3b2f11944389b286a5871a23926c8cf541374d.jpg,BA5A27CFF97645638101680E7F08F58E
2025-07-24T05:47:08.000Z,Monella kesämökillä on tämä Henri Alénin vihaama keittiöväline – ”Susipaska”,Huippukokki Henri Alénilta ei heru ymmärrystä muovisille leikkuulaudoille. ,https://img.ilcdn.fi/WYoaIWpiFoH84Y7EeiUAmupuYXg=/510x318/top/img-s3.ilcdn.fi/65aca05f49f6e5d08b9244ba450142e1564d0a96ad0a360bb99a170a759a1623.jpg,6B23FA9932D24BE88B66A2C9E65F188F
2025-07-24T05:54:28.000Z,Nokia: Heikot luvut ,Tiistai-iltana tulosvaroituksen antaneen Nokian liikevoitto alitti ennusteet huhti-kesäkuussa.,https://img.ilcdn.fi/N-e1IxC6EAOHn5QXH-VyW08gLRc=/0x64:3000x1938/510x318/top/img-s3.ilcdn.fi/974646d5509462462f6b2b71f8ae48fa8af95d67d641b47909dd2a4a39933f49.jpg,0230DE586F14430EAC3ADFBE73AC1FE0
2025-07-24T05:54:30.000Z,Yöllä puhkesi tappelu,Poliisin mukaan useamman henkilön välille oli tullut riitaa keskiviikkoiltana.,https://img.ilcdn.fi/uI056sbHHBI8yeys6N98xUvWwhE=/510x318/top/img-s3.ilcdn.fi/37329add1d88731a2b599223739a40af9882dd4cae20274002b9fce161752635.jpg,92148A3A2D8F4FAC9200D12D1CE756E9
2025-07-24T06:01:57.000Z,Äiti pakotti 12-vuotiaan lapsensa raatamaan kotitöitä  – Joutuu vuosiksi vankilaan,Nainen pakotti ja kiristi alakoulutytön tekemään päivät pitkät kotitöitä.,https://img.ilcdn.fi/uvVLzhBkCmJWmn3E-bwev8qbVJQ=/510x318/top/img-s3.ilcdn.fi/bb61321db8682b5265a8f525242d8a70e473944588f8211b978c463a4ea5a0e2.jpg,4E19B911AA694942B4ADB4AF1007C103
2025-07-24T06:12:25.000Z,Yhdysvalloissa iso transpäätös – Taustalla Trump,Yhdysvaltain olympia- ja paralympiakomitea laittoi transurheilijoiden oven kiinni.,https://img.ilcdn.fi/Hl3sUNpnOoIu9I1BjIkOc4UtQoY=/510x318/top/img-s3.ilcdn.fi/c52a7103220caee72ce14e17c1e3aa7bf4e34498f7ac15d09cc82eeed7e1f007.jpg,B7FCEA3709F348DBADC2C57A8D99D595
2025-07-24T06:26:17.000Z,Thaimaan ja Kambodžan välillä sotilaallinen yhteenotto,Konflikti leimahti maiden välisellä kiistanalaisella raja-alueella.,https://img.ilcdn.fi/AkvsiSrVBkn45wEBNXcOtfDwWBY=/510x318/top/img-s3.ilcdn.fi/1a723753af2df72c7c483d9fdb50fc171603a0dce9e702d2549cb5b1efaf0045.jpg,B58A652F4B33437694CC0C1F32779C9C
2025-07-24T06:29:33.000Z,Muistatko 90-luvulla villinneen Mascaran? Yksi alkuperäisistä jäsenistä tekee näyttävän paluun yhtyeeseen,Katri Somerjoki on palannut keikkalavoille Mascara-yhtyeen kanssa.,https://img.ilcdn.fi/iVI8lmvbgW5XXS0uemtrsUlyrCs=/510x318/top/img-s3.ilcdn.fi/34fd213a862ff903492ab287dd9cea19fd7d42996653fb578cf97b2a741a1b77.jpg,A71CCBD5C2DE4BCFAC1DEC909ACE8A6F
2025-07-24T06:30:29.000Z,Kristillinen neuvontapuhelin aborttikohun keskellä – Päivi Räsänen puolustaa toimintaa,Neuvontapuhelimen väitetään antavan harhaanjohtavaa tietoa abortista. Päivi Räsänen näkee palvelun tukevan naisia vaikeissa tilanteissa.,https://img.ilcdn.fi/zrZ3NFBO0L0EC6xdVtlih5UU4Qs=/510x318/top/img-s3.ilcdn.fi/5046205d208777e1cd1176ea8fd6c39217f713be84e7e3d300938898ea0fbe0e.jpg,BB4D1B7957B74A208C786B6570EE1ACC
2025-07-24T06:39:53.000Z,Toni Kohonen: Potkut,Superpesiksen kyntäjä reagoi. ,https://img.ilcdn.fi/2E1kkm0riB58ADl2GSj8wAsMnno=/510x318/top/img-s3.ilcdn.fi/ec4bf3f1e126abc76018157dc95336c031692c39efb720c437b1c5301e3bbb5a.jpg,C71C0AAD31644506ABBC3F741489E1DA
2025-07-24T06:40:29.000Z,Helsinkiläiskoulu suree kahden oppilaansa kuolemaa,Helsingin saksalainen koulu kunnioittaa kahden oppilaansa muistoa.,https://img.ilcdn.fi/2z8tXz4Cj5iJihl92UNNAoY6FFs=/510x318/top/img-s3.ilcdn.fi/e7ca3c1bb04e732f54e76727f99c37c747d70e58dd0a6a6d04140e419c2896d5.jpg,199AB641F9194803A4367D67A381128B
2025-07-24T06:44:56.000Z,”Katastrofia koko ajan”,"Julkkispari Ilkka Lääverin ja Sari Helinin kesäravintolassa työskennelleet kertovat useista epäkohdista työpaikalla. ”Epäkohtiin puuttumisesta hyökättiin heti päälle”, yksi lopputilin ottaneista sanoo. Yrittäjäpariskunta kiistää ongelmat.",https://img.ilcdn.fi/7hN05DR6S5vudTMBFyFDDiM9j8I=/510x318/top/img-s3.ilcdn.fi/1f8a528c6055d5a8b321369a60eca9d6697427cd171062021428d05dd5ce2844.jpg,C3B4FDFDA67D45B9A89BEF1463070112
2025-07-24T06:51:13.000Z,Lentoturma Venäjällä – 49 ihmistä kyydissä,Matkustajien tarkka lukumäärä on yhä epäselvä. ,https://img.ilcdn.fi/8DGMBkCpP9OIsaQK287y-JhYfRY=/510x318/top/img-s3.ilcdn.fi/6fa5f869f51eac342c7d1cb47c9c9ccb8676940aaaf13b4adb28ddce5b6a0b92.jpg,BD526960FBC24037B3EC5467A538F053
2025-07-24T06:54:51.000Z,UPM suunnittelee lopettavansa paperituotannon Lappeenrannassa,UPM suunnittelee Kaukaan paperitehtaan sulkemista. Noin 220 työntekijän työpaikat vaarassa.,null,C473B6CC93004653AEE5CA09D31D799E
2025-07-24T07:08:48.000Z,Oireena usein pelkkä patti – Pään alueen syövät lisääntyvät rajusti,"Uusi läpimurto paljastaa, mitkä pään ja kaulan alueen syöpää sairastavat potilaat voidaan parantaa pelkällä leikkauksella.",https://img.ilcdn.fi/GsVgaV7_Evems_fIG2O0ZxeCEnU=/510x318/top/img-s3.ilcdn.fi/c7739cf883c4ab7594bf294b5cd7db5b2e3267b365cb36a6d76364fb42e72fc9.jpg,31461EAE5FB34999913E4E8D94DB4AE7
2025-07-24T07:08:49.000Z,Miss Suomen suunnitelmat kariutuivat – Raju tilitys,"Paula Joukanen kertoo Instagramissa, että hänen oleskelulupahakemuksensa on hylätty. ",https://img.ilcdn.fi/EYi-bv5cbB__IXXEjjgDPuOJcdA=/510x318/top/img-s3.ilcdn.fi/9d68f2ceaee765344a0a91c95129a4e9d59ef90bbc77a33f365128c73bbae033.jpg,566CFFC84D2C486DB525F46CA1AF24C8
2025-07-24T07:21:09.000Z,"Poliisi: Lopeta puhelu välittömästi, jos kuulet tämän sanan",Poliisi varoittaa sen nimissä soitetuista huijauspuheluista.,https://img.ilcdn.fi/zyab4sKESX-u-FH1AOaze1ZZpiI=/510x318/top/img-s3.ilcdn.fi/c5201e99feb14f71502968c9edf730b1b81d4c867d8334270a0e7685ca9bfb37.jpg,D52081521C174C5C95BECAAE7C637B04
2025-07-24T07:29:47.000Z,Raju välikohtaus kuvissa: Mies syöksyi asfalttiin,Raju välikohtaus tallentui kuviin.,https://img.ilcdn.fi/eGS3tJ3jbkqZffu8HFH5T5d6NQg=/510x318/top/img-s3.ilcdn.fi/9992148cbc6269311b7e5d861ea4fa717208f0449198131355653b232075f613.jpg,174D6AAB294F4E0F93B2B716433A4D3F
2025-07-24T07:39:43.000Z,Äijien reisikesä alkoi – Katso kuvat,"Salishortsit voi tänä kesänä heittää huolettomasti päälle, sillä ne ovat juuri nyt trenditietoisen housuvalinta.",https://img.ilcdn.fi/INz55OWWBtg3HO-UhGnXDJQDZP0=/510x318/top/img-s3.ilcdn.fi/1875500dfcbbf6a86d478561ef932ffe14bf938fae74df047128abc4f392a0d7.jpg,202DB0ACC89342E3813D76909F96CA19
2025-07-24T07:46:35.000Z,"Keski-ikäisillä miehillä on yksi supervoima, joka on ylitse muiden","Keski-ikäisenä naiset haluavat tasavertaisen kumppanin, eivät mitään passattavaa lapsimiestä. Myöskään viinaa juovat tai naisiin menevät renttumiehet eivät enää kiinnosta, kirjoittaa Iltalehden kolumnisti Anne Moilanen.",https://img.ilcdn.fi/u8pR22Vu1Is8jtZHJsYvzOzs4VI=/510x318/top/img-s3.ilcdn.fi/c324939f4966b4a0e1f3c23f347edc92a44e197ebf9201dc07aa6011b00be1eb.jpg,FCCCC264577447B9A2BE3585B3E4FCE4
2025-07-24T07:51:59.000Z,Itämerellä sensaatiolöytö – Suomalainen tohtori ei pidä juuri minään,Puolan öljyesiintymä riittäisi vastaamaan maailman öljynkulutukseen noin kahdeksi päiväksi.,https://img.ilcdn.fi/CZkZIg8lKBlxQAAXyB1M-YB7b_E=/510x318/top/img-s3.ilcdn.fi/d8970eb4b310cd1a11cf312ae62ea555680ee5d685e10505d14ce5783ebd9836.jpg,4D60A73AA6204022B23570D7808A1798
2025-07-24T07:52:48.000Z,Meghan ja Harry menettävät Netflix-sopimuksensa – ”Kova isku Harrylle”,Herttuatar Meghanin ja prinssi Harryn sopimukselle Netflixin kanssa ei ole tulossa jatkoa.,https://img.ilcdn.fi/9qP69E402lEMsnmVwaReLr1A8cw=/510x318/top/img-s3.ilcdn.fi/ea11f3c91c30de30f04e5945625e5374cb3f2f326ef6d5bc5565cb88ac017057.jpg,7EA9DE131B0C4720869955C6B3039784
2025-07-24T08:02:39.000Z,Maailmaa järkyttänyt urheilija saa taas kilpailla,Charlotte Dujardinin kilpailukielto päättyi.,https://img.ilcdn.fi/W6Xop5kY1C2q0T_AAhTjH7aOLIw=/0x0:3000x1876/510x318/top/img-s3.ilcdn.fi/15fb2a4c7fe5f533a1f7bef0254c5fc45162bf5735963ca3931ea663606dec1c.jpg,E5E3335A03D646B3A3060F965B78111E
2025-07-24T08:19:09.000Z,Ennätysauto ensikoeajossa – Mersu laittoi kaiken uusiksi,Sähköauto Mercedes-Benz CLA räväyttää merkilleen kaiken uusiksi ja se on hyvä asia.,https://img.ilcdn.fi/n7Q2WfIHTu7n7LWXeFygZuJVNAg=/510x318/top/img-s3.ilcdn.fi/d0edb80260a9b3c58b91a6c733b5443c7dba6ff790997346bd7d7ca5c3a1984e.jpg,1EF64F56CE344C96B56268F1FDA13C4E
