paivamaara,otsikko,tiivistelma,kuva,id
2022-09-19T11:32:32.000Z,KHL-maalikuningas huomasi SM-liigassa selkeän eron: ”Kyllä tämä on aika oma sarjansa”,Niko Ojamäki oli yksi tämän kauden kovimpia paluumuuttajia SM-liigaan. Viime kaudella KHL:ssä säväyttänyt laitahyökkääjä arvostaa pelin tasoa Suomessa.,https://img.ilcdn.fi/UBC_qzVcUdgLKOXz6-bbvB965IM=/510x318/top/img-s3.ilcdn.fi/cfcdef0aa4cca6fdffde79d9e5b9bd3c400ba404ae927f79e0098c57799cceae.jpg,30045F2AA5484A9584D3461B5EF8609A
2022-09-19T12:42:03.000Z,Unkaria uhkaa hurja sanktio – EU-varoja jäädytetään miljardien edestä ,Euroopan komission ehdotuksen taustalla on Unkarin tekemät oikeusvaltiorikkomukset.,https://img.ilcdn.fi/hjD4eIiLS3Ds708qOpBvufK3Ujc=/510x318/top/img-s3.ilcdn.fi/cf0b3fefe55f44c294be33b01517f8c77dc418ff36fd28bf6d3124d3e01f81ff.jpg,D2230D6C3B5D4A119809BA60F163F351
2022-09-19T12:44:28.000Z,Huuhkajakonkari Jukka Raitala päättää maajoukkueuransa,Raitala pelasi 64 A-maaottelua.,https://img.ilcdn.fi/mMwtWuaGJypNttVPUuosLCDYP-o=/510x318/top/img-s3.ilcdn.fi/9147690300975d5dd1b5e4497046dccab4635a71c4396f4596128d48541a7643.jpg,7213CF63081F4B138C3BB91F168A65BD
2022-09-19T12:51:09.000Z,Lontoossa on nyt suurimmat koskaan nähdyt turvajärjestelyt  Isossa-Britanniassa,Turvallisuudesta vastaavat tuhannet poliisit ja sotilaat.,https://img.ilcdn.fi/xJA0zuGMade5_L-O1dGX2jowBf0=/510x318/top/img-s3.ilcdn.fi/25a2962ed0b3840101dd47cbe3daebdb8d43a82ab6d30c4a2dbd185c2ff9b400.jpg,6DFB27318E794C17AA50D21095B79CD3
2022-09-19T12:55:56.000Z,Lapset löysivät vainajan maastosta kesken koulupäivän,Suunnistamassa olleet lapset löysivät ruumiin Tampereen Kaukajärven alueella.,https://img.ilcdn.fi/9jInFiz_OxOab489dHSYUKv9JXw=/510x318/top/img-s3.ilcdn.fi/60cab55c801fdd65e5d9b8702a701c2e7d0544b453a6d4d3d6eb4855d98c0261.jpg,7ED5F4AADDF942B59755D44A0D19F56F
2022-09-19T12:57:59.000Z,Turun kuolonkolarin esitutkinta valmistui: 18-vuotiasta nuorta epäillään törkeästä kuolemantuottamuksesta,Kahden nuoren kuolemaan johtanut kolari sattui Turussa kesäkuun alussa.,https://img.ilcdn.fi/0Mgk_LkJLUOo4L_0QK6RPoesZww=/510x318/top/img-s3.ilcdn.fi/34440ec3aa5b504ae6c0e1d43c2713bb2fe4088a84812132d0afb8a7e12ba0b6.jpg,81C9A04A0296469797B4F5B8A95DE671
2022-09-19T13:14:33.000Z,Nasa haluaa tutkia Kuuta suomalaiskeksinnön avulla,"Nasa haluaa kartoittaa Kuun pintaa suomalaisen innovaation, laserkeilausrepun avulla.",https://img.ilcdn.fi/AZM9m0ajicQkbHiLSY9_YTRK4Io=/510x318/top/img-s3.ilcdn.fi/d1ed1678c703b1a4e17b6323429b4f547462485f99e92c3c610da9a05f935161.jpeg,C726C432859D4D439D9B4B549E72EB55
2022-09-19T13:16:34.000Z,"Prinsessa Charlottelta, 7, koskettava ele isoisoäiti Elisabetille – rintaneula muistutti kuningattaren rakkaasta harrastuksesta",Prinsessa Charlotte kunnioitti rintaneulallaan isoisoäitinsä muistoa.,https://img.ilcdn.fi/n9IxUvSwNcriJYqabojpq3i9Df4=/510x318/top/img-s3.ilcdn.fi/ad97bc41b579640f3396ded29505e22747bb0ec5d453a9135cf3a58547619d45.jpg,D9B183F576DA4F89BD92EE3B8ED8A093
2022-09-19T13:22:16.000Z,Näin kotihoidon lakkoon on  valmistauduttu – vanhuksia on jo siirretty seniorikeskuksiin ,Helsingin käräjäoikeus kielsi kotihoitoon kohdistuvan lakon. Hoitajajärjestöt eivät ole vielä kertoneet peruvatko sen.,https://img.ilcdn.fi/eifdaeC-25d6UjX8ebVF6kcjDU0=/510x318/top/img-s3.ilcdn.fi/3c7ce82bf4e8ca5d5cd2d25e7b1031ec9a2c1cd11b52ae24968fa796f553f6bf.jpeg,73B5FFD6B38445F5A3A31E8DA6934C93
2022-09-19T13:29:45.000Z,Elämän ideaali on 8-8-8 – Tasapainon voi saavuttaa yhdellä keinolla: ”Rohkeinta ikinä”,"Kun työn, unen ja vapaa-ajan suhde menee pahasti vinksalleen, voi siitä seurata muun muassa suuria vaikeuksia tehdä päätöksiä. ",https://img.ilcdn.fi/pYoyViLSMJOFJbW0sECcS3-kr_Q=/510x318/top/img-s3.ilcdn.fi/3bc0cfb08e602909e5d4c3a8dd89e90c423a2ef71e8fde1a1dc026757e31feb5.jpg,5D93DFBF75694437B04224DCD1333DB6
2022-09-19T13:36:51.000Z,Näin Euroopan kuninkaalliset edustivat Elisabetin hautajaisissa: mukana Monacon Charlene ja maanpaossa oleva Espanjan Juan Carlos,Kuninkaalliset ympäri maailman kokoontuivat ottamaan osaa kuningatar Elisabetin hautajaisiin.,https://img.ilcdn.fi/L2apEIkQJkZR_diI-xLW0_NpTqk=/510x318/top/img-s3.ilcdn.fi/9758b775abd4bf64ee29f3afe42a45fc4452670b0a24c9cd7012052249f904f5.png,22E74940200A489B8B2F66463D58AC01
2022-09-19T13:39:58.000Z,Poliisiautoja ammuskeltiin – kuopiolaismies pidätetty,Keskiviikkona 15.9. sattuneen ampumatapauksen johdosta on vangittu teosta epäilty mies. Tapauksessa ei aiheutunut henkilövahinkoja.,https://img.ilcdn.fi/epadJ6N6xLmLKSlIgDqUegBgxow=/510x318/top/img-s3.ilcdn.fi/2c4871fcd2791cae54f52160157510d03517bd5a7fd43056dd787d41af5f529e.jpg,14BC89F6510E465B8541830F9B3602EA
2022-09-19T13:47:18.000Z,Poistuivatko prinsessat Beatrice ja Eugenie kesken siunaustilaisuuden? ,Kuningatar Elisabetin lapsenlapsien prinsessa Beatricen ja prinsessa Eugenien uskotaan lähteneen hautajaisista ennen muita kuninkaallisen perheen jäseniä.,https://img.ilcdn.fi/K2KoQ2Ff8VNFhBkzX34Gr15xysY=/510x318/top/img-s3.ilcdn.fi/fcde4608edb8113fc6d77c0e56e19859d471dd31fb03d83df8c0d6fb80686ad9.jpg,76483157C386455C8FB5871BFD93C17A
2022-09-19T13:47:30.000Z,Nyt se tapahtui! Dieselin litrahinta vihdoin alle 2 euroa,Dieselpolttoaineen litrahinta on jatkanut laskuaan. Kaikki kymmenen halvinta hintaa löytyvät yhden ketjun asemilta.,https://img.ilcdn.fi/jX-QljNK3v-lcGAbXNnPp8nXO7c=/0x13:2048x1292/510x318/top/img-s3.ilcdn.fi/bdfd3c975741ebef10234cb55280d11feb0c9bc1865dafccee71754b7cb09213.jpg,85B895E6913D48D08F1D2BA0674DD4C5
2022-09-19T14:00:35.000Z,Soitellen sotaan ,"Koko maailma on seurannut henkeään pidätellen tapahtumia Harkovassa: Venäjä yllätettiin suorastaan housut kintuissa. Tämä ei ollut ensimmäinen kerta Ukrainassa. Venäjän joukot ja Vladimir Putin ovat tehneet karkeita virheitä sodassa. Putin itse on vannonut, ettei koskaan kadu mitään. ”Jos virheisiin jumittuu, sotaa ei voi voittaa.”",https://img.ilcdn.fi/sUfV-pHl2xBbgd8pEwZWn5VqRhQ=/510x318/top/img-s3.ilcdn.fi/38ff9e847149392bd3487d7cc48221166074dd8b51ed27a990eda43e0034e0f8.jpg,6B00942F869843C2AD47B316CE0968E5
2022-09-19T14:03:22.000Z,Urheilucast: Suomen maajoukkuetähti ajautui itsetuhoisiin ajatuksiin ,"Krister Savonen puhuu Urheilucastin haastattelussa avoimesti mielenterveysongelmistaan ja aivotärähdyksestä, joka päätti uran.",https://img.ilcdn.fi/2HFGafCOP4aDBvNJHGil6Jh2gpo=/510x318/top/img-s3.ilcdn.fi/04448ecdcacf150e1f98b141c8c30cb3ae0d03d3b1128e5a27126c9a9296efbc.jpg,162A65E281EE4B79B336F3DEE1498CC6
2022-09-19T14:06:39.000Z,IL:n tiedot: Suomi harkitsee maajoukkojen lähettämistä taistelujoukkoihin Baltiaan – Ruotsi jo valmis osallistumaan Naton eFP-operaatioon,"Ulko- ja turvallisuuspolitiikan lähteet vahvistavat Iltalehdelle, että Suomessa on edessä harkinta maavoimien sotilaiden lähettämisestä Naton uusiin eFP-prikaateihin Baltiaan.",https://img.ilcdn.fi/ssRA8CS-OzPixeOeuAWz7j-RtaE=/510x318/top/img-s3.ilcdn.fi/d8f2f4d8323427f64ecc209b82d3da96ff41a01b50e9a64237a0ddd85818332e.jpg,67DAF0BD455F48718DEF37057CA6AB50
2022-09-19T14:12:59.000Z,IL Lontoossa: Festaritunnelma Hyde Parkissa loppui äkisti ,Kymmenet tuhannet ihmiset seurasivat Lontoon Hyde Parkissa kuningatar Elisabetin hautajaisia.,https://img.ilcdn.fi/TaMZh0dYVEyfYzVO-AgR-HbTPFc=/510x318/top/img-s3.ilcdn.fi/90459b59fe034d597e666b9b27c4e3c1f8add08fe962699774d8fd42848288e4.jpg,0FE8E9750E974DD49FFEE88C1589B718
2022-09-19T14:25:51.000Z,Meghan lohdutti hautajaisissa tunteikasta prinssi Harrya,Prinssi Harry jätti tunteikkaat jäähyväiset isoäidilleen kuningatar Elisabetille.,https://img.ilcdn.fi/vRwYjIuGR8hVI239g9ky2rLZC1Y=/510x318/top/img-s3.ilcdn.fi/f1c6ae39ec6ec93af15469c36d19165cc7afa31a4bb386c8c5bc6ab5fb279f24.jpg,2B0EAB3C4B4741ACA6F28022E364AAD6
2022-09-19T14:44:45.000Z,Ilman pätevyyttä toiminut lastenlääkäri pitää potkujaan laittomina,"Kanta-Hämeen keskussairaalassa oli toiminut vuodesta 2008 alkaen lastenlääkärinä mies, jolla ei ollut todellisuudessa erikoislääkärin ammattioikeuksia. ",https://img.ilcdn.fi/_6LHBTLVUkcikalPogIBSTzt610=/510x318/top/img-s3.ilcdn.fi/37958b0e10661f15942f6c63bfd7ddd629cc1d18ad5c4133e12b7cce08239f93.jpeg,79E650E56C944D2A876C5CE6FBD4B5CB
2022-09-19T15:04:30.000Z,"""Ihmiset juonittelevat, puukottavat selkään” – Mikkelin demarit sanasodassa, ex-kansanedustajasta tehty rikosilmoitus",SDP:n valtuustoryhmän puheenjohtaja Satu Taavitsainen erosi valtuustoryhmästä. SDP:n valtuustoryhmä on hajonnut osiin. Taavitsaista epäillään myös kunnianloukkauksesta.,https://img.ilcdn.fi/FBqK_XpeuNcpXUZXgmrGjEfVmBU=/510x318/top/img-s3.ilcdn.fi/d203d424501abb816b346880b2ad6b9325966b1d30fce0622c0af3700423f29a.jpg,CDD6DC480A9444B481E0C9B84712ECFF
2022-09-19T15:04:34.000Z,"Venäläisessä vankilassa viruvasta Brittney Grinerista huolestuttavia tietoja – ""Hän ei voi hyvin""",Brittney Griner kärsii yhdeksän vuoden vankeusrangaistusta Venäjällä. ,https://img.ilcdn.fi/DF9PjlZlViRB85AOE8E5JSIr-EQ=/510x318/top/img-s3.ilcdn.fi/244388b8c19fdd6bfca2a0383af1cc32072c52c8b2e14f96cf3558f93e2a4081.jpg,F367A41BC75944BD8A8684C492201495
2022-09-19T15:06:32.000Z,"Tehyn Rytkönen potilasturvallisuuslaista: ”Olen surullinen, vihainen ja pettynyt”","Tehy: Hoitajat eivät unohda, pakkotyölaki jättää syvät haavat",https://img.ilcdn.fi/Cgjjz-fakWLiZ3kvUC9g81mfrRI=/510x318/top/img-s3.ilcdn.fi/9a62424e55b3737b333f4f4b0ea30a3a467b18f2efd1c1a7a034955cc4dab746.jpg,FCB08109A20F499B81DC58F949F39192
2022-09-19T15:16:12.000Z,Elisabetin corgit surkeana Windsorin linnan edustalla – prinssi Andrew lohdutti rapsutuksin ,Kuningatar Elisabetin corgit Muick ja Sandy nähtiin hautajaisten aikaan Windsorin linnan edustalla. ,https://img.ilcdn.fi/EZ0Wu2w0ua1fQbGlumTnfGk0jjo=/510x318/top/img-s3.ilcdn.fi/6cab5aff645420012eaa7034edf14bd0d062065dfdea6f86112ccba3b86af050.jpg,1E01C47480BD47EFAC3CCCED0F948959
2022-09-19T15:30:07.000Z,Yrittäjien eläkemenot paisuvat – valtion osuus nousee jo puoleen miljardiin euroon,Ensi vuoden valtion talousarvioesitys povaa karuja näkymiä yrittäjien ja maatalousyrittäjien rahoitukselle. Menot kasvavat yli sadalla miljoonalla eurolla.,https://img.ilcdn.fi/VRRN0O7tkj_jPc7ZVxCrJnhvK5Q=/510x318/top/img-s3.ilcdn.fi/c05db07dd0afa8bc69ed2474bc62df9651f4ae95c5fce555f43ae2d31a2582fc.jpg,0370CCF03D28480F82D1BB24AB3F9E99
2022-09-19T15:37:04.000Z,"Jos Putin-syndrooma leviää Kiinaan, maailma repeää – ja suomalaiset kärsivät","Yhdysvaltojen, EU-maiden ja Nato-maiden on osoitettava Kiinalle, että sotiminen vie hulluuden tielle, kirjoittaa Iltalehden Lauri Nurmi.",https://img.ilcdn.fi/trRUFBulWIY7tma8HAZliIMfu_Q=/510x318/top/img-s3.ilcdn.fi/e85fb0676ee3562cbdb5a6b402e22f56b7b431850f151fb295ce617f9d9c1b61.jpg,F81BA55641F348BBBE3ACDFF85887305
2022-09-19T15:38:15.000Z,Maatalousyrittäjien eläkkeisiin uppoaa ensi vuonna lähes 800 miljoonaa euroa,Taustalla vaikuttaa maatalouden voimakas rakennemuutos.,https://img.ilcdn.fi/K1LT8MP4Z6R59gTMd4VSb1kb-Y0=/510x318/top/img-s3.ilcdn.fi/53d25998760cbcdf27e7fb7925ee9b7d504f381c9171c4f28013ade4c90b5444.jpg,D4754BEAF77244CD8CE85CC8AC9BAAD1
2022-09-19T15:49:41.000Z,SM-liigaottelussa puhkesi yleisötappelu – poliisi tutkii,Raumalla lauantaina Lukko–TPS-ottelun yhteydessä tapahtunut väkivaltainen välikohtaus on edennyt poliisitutkintaan.,https://img.ilcdn.fi/e-z0yFX-1ll7rMD1jfrlpu3crKA=/510x318/top/img-s3.ilcdn.fi/5cf9d38af785d6007c2b2dde4d6b532e053eed91ce7e50f251a3eeac5df626bf.jpg,6F73505A51994DF992CD63EDA8E791D8
2022-09-19T16:03:58.000Z,Kansalaisaloite venäläisten viisumien kieltämiseksi kerää kovaa tahtia kannatusta,"Tietoa aloitteesta ovat jakaneet esimerkiksi useat tunnetut sotilasasiantuntijat, sekä opposition kansanedustajat.",https://img.ilcdn.fi/4izyVUZmWQplXFf3UuGSp49PCDc=/510x318/top/img-s3.ilcdn.fi/75bb4f09f899b427ec6eb9da11d25aa0272af877471eea2e21c8ff7e993d418b.jpg,DB8D5CA4C4054CAFAFD3D4B54317D577
2022-09-19T16:04:53.000Z,Elisabet sai vaikuttaa jumalanpalveluksensa yksityiskohtiin – musiikki peräisin kuningattaren pianonsoiton opettajalta ,Kuningatar Elisabetin jumalanpalvelus järjestettiin Pyhän Yrjön kappelissa. ,https://img.ilcdn.fi/9WF3KD3A897bAxsLgb8ktQhjAIg=/510x318/top/img-s3.ilcdn.fi/7ca10118fcba645522eff60b0a0ff86479df0fadb6cba6a32b35270d74ac05b4.jpg,06ACDBE01F554B699B7AC58E8D0E5D28
2022-09-19T16:20:32.000Z,Venäjän ohjus osui lähelle ukrainalaista ydinvoimalaa – tämä iskusta tiedetään,Ukrainan ydinvoimayhtiön mukaan reaktorit toimivat edelleen normaalisti. ,https://img.ilcdn.fi/IQtDcQNOtaxRGPYrXbEPN7ky_vM=/510x318/top/img-s3.ilcdn.fi/50f5c17ec2ee2a9f9db652b994579cee0606196d7e3e5c59a5f8c42c2eba888c.jpg,9BE7750E9CB547B194F994CD6151BE6A
2022-09-19T16:23:07.000Z,TPS hankki vankkaa kokemusta: ”Paljon nähnyt”,Hyökkääjä Jasse Ikonen liittyy TPS:aan kuukauden mittaisella sopimuksella.,https://img.ilcdn.fi/3mSHOt8DMhPRsE65JFGNwzT-nn4=/510x318/top/img-s3.ilcdn.fi/3b5fc027188909400929c71fc75146b58dc3ee49c19a5a34cd91905cab379365.jpg,292F3A35A6014180830AD876D19F8EEE
2022-09-19T16:28:34.000Z,"Kemikaalipilvi Järvenpäässä, ihmisiä kehotetaan suojautumaan sisälle","Vaaratiedotteessa Saunakallion ja Jampan alueen asukkaita kehotetaan suojautumaan sisälle, sulkemaan ilmastoinnin sekä seuraamaan radiota ja TV:tä.",https://img.ilcdn.fi/kVNvnLyVLB4uqBjY1M1nZfCwzNE=/510x318/top/img-s3.ilcdn.fi/48b734d88f34e7a8ad59d148991e6fd77d581939a019dcb3109b0e89cfabc1cf.jpg,558827BA72D1439CADEFC3EB00A41FF8
2022-09-19T16:34:11.000Z,Kuningatar Elisabetia muistettiin myös Tukholmassa: Ritarikilpi siirrettiin juhlavin menoin ,Kuningatar Elisabet oli serafiimiritarikunnan 722. ritari.,https://img.ilcdn.fi/7eZ1iFupW3O5iHNDwwsFQAv4C20=/510x318/top/img-s3.ilcdn.fi/fb704fb1430a6deb8766c80113663cf9dcbf92fb11026c9931eae43f28b0bf39.jpg,AEDA1A50E613467EBDBC76E517F6E85C
2022-09-19T16:51:40.000Z,Tällainen oli kuningatar Elisabetin viimeinen matka: katso kuvakooste,Kuningatar Elisabetin hautajaisia vietettiin maanantaina.,https://img.ilcdn.fi/3wKOkjQGndZl-r2P-TzlU-8Ueto=/510x318/top/img-s3.ilcdn.fi/7e54f32128e1ebc9806b6bc0316a6a8c1768e1624ad48b8cd2070238786c8950.jpg,9FA6A97778C04ED89B773210526DFE9E
2022-09-19T16:59:48.000Z,Koeajossa uusi DS 7 – puskurin läpi hohtavat valot kiinnittävät huomion,Ranskalaista luksusta edustavan katumaasturin kasvoja kohotettiin ja uusi voimalinja esiteltiin. Hinnat osuvat 59 000 ja 79 000 euron väliin.,https://img.ilcdn.fi/xxf7HpHi6Ezyus7bcMzpX_eUS4s=/162x91:1811x1116/510x318/top/img-s3.ilcdn.fi/4c855f00b734cf3e3cff505a5fb13cb5189bcdd292ec1630ff0a10888cd2d481.jpg,27B32B6FE53741F3908871BEBBD944FD
2022-09-19T17:12:11.000Z,Ensin äitiyslomat järkyttivät – kustannukset yllättivät Iidan täysin,Yrittäjä Iida Saloranta ja hänen työntekijänsä jäivät äitiyslomalle suunnilleen samaan aikaan.,https://img.ilcdn.fi/ZP2uXljF--0LEHGCV5eJ_IP3yQU=/510x318/top/img-s3.ilcdn.fi/6a5fcc598a788b687b4c0ed0b6d3d8674383babe7ad477c405ac6db4b495c8dd.jpg,034A76E14DBD4727832D2FF642553CF5
2022-09-19T17:13:39.000Z,"Venäläisten paluuta suunnitellaan kulisseissa – kansanedustajalta täystyrmäys, näin kommentoi Jan Vapaavuori",Kansainvälinen olympiakomitea miettii Venäjän ja Valko-Venäjän urheilijoiden hyväksymistä takaisin kilpailuihin.,https://img.ilcdn.fi/t40ZOxSdt31Eb-EE9pJHwC6kL1Q=/510x318/top/img-s3.ilcdn.fi/cb32a9c1a826ea4d1680edf7d8c04d04749ecf31fcd2b8948e081e33e31a8076.jpg,A510F47FF28E4F7EB47542749B41374C
2022-09-19T17:15:52.000Z,Tämän takia Putinia työnnetään nyt syrjään Venäjän mediasta,"Pienet halkeamat Venäjän yhtenäisessä tiedotusrintamassa ovat toistaiseksi vain merkki siitä, että kokonaista tarinaa on mahdotonta ylläpitää muuttuvan valheen avulla, kirjoittaa Jarmo Koponen.",https://img.ilcdn.fi/smQEEo17G63Pgmr71yhFMp6gdwk=/510x318/top/img-s3.ilcdn.fi/eedefd057c7530e36afa7d99a8752ef13d28d33d49dc3cc1818f451a8beca2e3.jpg,DFEF490F497C443B83885944EA5C8E41
2022-09-19T17:36:47.000Z,Camilla puhui tunteikkaasti kuningattaresta: ”Tulen aina muistamaan hänen hymynsä”,Camillan ja kuningatar Elisabetin välit eivät aina olleet täysin mutkattomat.,https://img.ilcdn.fi/y4wFj8aSGVTcK_bdKJSFATf1sR4=/510x318/top/img-s3.ilcdn.fi/f4e0b17178f0d505cc733d2b70ee2506e628303af8a183eb7e31d179368c7dd9.jpg,CC930EFCBDEA42C8BD9B1CBD2F057565
2022-09-19T18:04:13.000Z,FC Inter antoi potkut päävalmentajalleen,Inter oli Veikkausliigan runkosarjan viides. Nyt valmentaja vaihtuu.,https://img.ilcdn.fi/LjDy8pMRgtbf_OXZ_kBkB5ZvO-s=/510x318/top/img-s3.ilcdn.fi/18d28582e7e85eec1d5a550a6d55bc9608059b3637a283abe2f8c22d384e67c9.jpg,F992F395B9B04B058AF5E84136FFE0F5
2022-09-19T18:04:24.000Z,Nyt puhuu 18 pakettia Juhla Mokkaa ostanut Marianne: ”Varmistin vielä myyjältä.. ”,"Myllyn Prismassa Raisiossa oli viime viikolla poikkeuksellinen kahvitarjous, joka sai tarjoushaukat liikkeelle.",https://img.ilcdn.fi/4Ko93j9Ol7Ghg36IZQKttGlBeKs=/510x318/top/img-s3.ilcdn.fi/2d8cc5b21edf72a825be6636e7d0dbbdf79ced26d6f06d0303bccc3858dcb67f.jpg,677CF6EB1EC742FF96AAD2FF34CB3E0C
2022-09-19T18:07:06.000Z,Škodalta tulossa halpa sähköauto – hinta vain 20 000 euroa,"Škoda on myllerryksessä. Muutokset eivät näy vain autoissa, vaan myös merkin logossa, kirjoitusasussa ja yhtiön johdossa, kun ohjaimiin on tarttunut Klaus Zellmer.",https://img.ilcdn.fi/hE_RjiB_j38gqxR2bXEQP5tVJN4=/0x64:3000x1938/510x318/top/img-s3.ilcdn.fi/0ebc96591e27d21f373c35c1d1a42f3cf23fd3046cc30c16f957a63516526c9d.jpg,DAE72B9CCC664F778A32CF2655DCD4BB
2022-09-19T18:17:15.000Z,Leo Komarov jätti heti jäljen Ruotsissa – Juhani Tyrväinen vinoili välittömästi,Leo Komarov oli elementissään Ruotsin SHL:ssä. ,https://img.ilcdn.fi/EwS-zj-kvBkkgk-s8R0Wghq3JFg=/510x318/top/img-s3.ilcdn.fi/ac1b319da0b221f946ca66cc4c22423ba324d2aa3e1accd6b0d1eeacb250b3a6.jpg,72700CEDB36E47C881E8F28DBF1930B9
2022-09-19T18:23:34.000Z,Katso kuvat: Elisabetin hautajaisten työntekijöitä pyörtyi kesken työtehtäviensä – poliisi kuljetettiin pois paareilla ,Pyörtymisten syyt eivät ole tiedossa. ,https://img.ilcdn.fi/H2I1jIc-SC5ZEOJ1YGUozfduGNw=/510x318/top/img-s3.ilcdn.fi/a45b9de38818fb2d937dc701c998229e431878a28067d30b7cba0d511813b276.jpg,564E70CD2E354FE4B16087229FA5C79C
2022-09-19T18:54:35.000Z,Länsi-Meksikossa voimakas maanjäristys,Meksiko on erittäin maanjäristysherkkää aluetta. ,https://img.ilcdn.fi/0VWYon9JB6eUs-iPWTyuu8M6ShY=/510x318/top/img-s3.ilcdn.fi/5d5bc42265ca186dd7d545856b8aa2ea62c507d252f16d0dda381707e7a6fd32.jpg,01A6C09D5B4C4D3CBF27D7753E20DCC0
2022-09-19T19:03:05.000Z,Liiga-joukkueella heti loukkaantumissuma – tuore vahvistuskin sivussa: ”Ei näytä hyvältä”,Pelicansin sairastuvalta kantautuu heti liigakauden kärkeen ikäviä uutisia.,https://img.ilcdn.fi/mNL_RCrIMZkYUCfa8xXJ4xCf_9c=/510x318/top/img-s3.ilcdn.fi/47e9583ee0e0a8a2d4f6257ce8afc3cda611672e9a16cb1a22a1281f451ae034.jpg,019813D786214FD4AC7983B6D6BAD4EE
2022-09-19T19:06:16.000Z,Kuningattaren hautajaisissa nähtiin erikoinen perinne: tätä puisen sauvan katkaisu tarkoittaa,Perinnettä ei oltu nähty sitten vuoden 1952.,https://img.ilcdn.fi/KtKkppr5cEliY3FuuDw6nM8F-ow=/510x318/top/img-s3.ilcdn.fi/ab3f2d5df73ba4cc883bfd49641941bd5cae3a349524937d68b960467c7c12e4.jpg,509962A9D16C4EC28277169E94E9239A
2022-09-19T19:28:41.000Z,Kostonhimoinen hakkeripariskunta poisti hotelliketjun tiedot huvikseen – naurettavan helppo salasana avasi ovet,Hakkerit pääsivät käsiksi Holiday Inn -hotelliketjun tietoihin.,https://img.ilcdn.fi/xMV32rrVDxuN2OUB2bC0aMNbojg=/510x318/top/img-s3.ilcdn.fi/02a962c98e8e77fe9c633290221bbee88c7792ee2f8c2e5d54e89c9600ddca8d.jpg,ADFCF01CA8F64DA7858162977CBF3CEC
2022-09-19T19:29:01.000Z,"Aamuöinen sekoilija hajotti sprinklerin Silja Serenadella – vettä pääsi kolmelle kannelle, tuhansien eurojen vahingot",Laiva oli tapahtumahetkellä matkalla Tukholmaan. Viestintäjohtajan mukaan vahingot lasketaan tuhansissa euroissa.,https://img.ilcdn.fi/0E3z2dy_j0vBB73tUzQXQM6gE8A=/510x318/top/img-s3.ilcdn.fi/48337ed0338fd4ff4239ffbedfc4e63c1ee8e34737ebddb0ad7bde79df89107d.jpg,A3B2C083B0F44E9EBCC9BC72BE5F2CF5
2022-09-19T19:30:25.000Z,F1-sensaatiotulokas sekoitti  kuskimarkkinat päälaelleen – näihin talleihin häntä ollaan viemässä,Nyck de Vries sekoitti debyyttikisallaan kuskimarkkinoita. ,https://img.ilcdn.fi/z9yAbmv7knjdWeAAY1J7b-d6D_g=/510x318/top/img-s3.ilcdn.fi/23208ef0eaeb035a19a75070e4f8f72cafc358a91fb024e3f326aeac0b5d3af8.jpg,43CEA2CF24AF4505A22847F1F60950A5
2022-09-19T19:46:43.000Z,Roman Rotenberg venäläisten osallistumisesta huipputurnaukseen: ”NHL voi nimetä valmentajan”,Roman Rotenberg kertoo keskustelleensa World Cupista NHL:n kanssa.,https://img.ilcdn.fi/9GOMAsW7KpQxuh6gN9YK-llMvMk=/510x318/top/img-s3.ilcdn.fi/7540ae95fe73af8e33da3d01ac9af0b6a388c91173d570a2317d2ec5b691ed9b.jpg,CECB51647549405AA77ABF90AFD0A3E1
2022-09-19T19:51:30.000Z,Sydäntä riipaisevat kuvat Elisabetin hautajaisista: Emma-poni hyvästeli omistajansa ,Kuningatar Elisabet oli koko elämänsä ajan hyvin eläinrakas. ,https://img.ilcdn.fi/a-QudqDE8RzhkpIgLnrBOzcbv6o=/510x318/top/img-s3.ilcdn.fi/2048ef967b5cdfba2c2a3165446cfbc7a0ab98fa3f8e6def8e98ddd7ccfc93c1.jpg,F1A4623C71E04B73AE2A0B52D8EF4122
2022-09-19T20:00:10.000Z,Teinipojalle lähestymiskielto – epäiltiin 13-vuotiaan raiskauksesta mutta oli itsekin vasta lapsi,Pikkukaupungissa asuvien yläkouluikäisten nuorten seurustelu johti raiskaustutkintaan.,https://img.ilcdn.fi/kxkT5dhjJ6D27Q4xrOtk3Ek0uKU=/510x318/top/img-s3.ilcdn.fi/ca3d08d7a2588f2d93fde4e7d858d00b4e20d13a59594393e97008fd4703dcfa.jpg,86844D48D9BF422BAC5708ED7BFF71D9
2022-09-19T20:26:56.000Z,Hevonen kärsi ilmavaivoista – omistajan antama vatsahieronta toi äänekkään avun,"Tässä kuussa Italiassa kuvatulla videolla nähdään, kuinka vatsakivuista kärsivä hevonen löytää helpotuksen oloonsa omistajansa antamasta hieronnasta.",https://img.ilcdn.fi/WosNGNEiUgL7gkGKBLdDRocBQfU=/510x318/top/img-s3.ilcdn.fi/aa5443ce40e7e31349c864fba743472a3895730e6b596b5f36fc5dc2abc0f403.jpg,D5EBE0D4005C459EB7000AF852D601CA
2022-09-19T21:00:39.000Z,Kirjaväite: Liiton tyly temppu Kaisa Mäkäräiselle – ”Tilillä ei enää ollutkaan rahaa”,Harri Halme perkaa tuoreessa kirjassa uraansa ja manageroimiaan urheilijoita.,https://img.ilcdn.fi/MWsL5DVIInpRAo7p_HWea2Z24NE=/0x64:3000x1936/510x318/top/img-s3.ilcdn.fi/8b1ebd67f117d387b237018efdc73a634cdbdc0d713e65b2dd36e27210f5cf44.jpg,7DBF0D3354504A09B30F49FBAFA5DB2C
2022-09-19T21:06:40.000Z,"Ukrainan sota, päivä 208: Izjumin kaivaukset edenneet, suurin osa ruumiista siviilejä",Tähän juttuun on koottu Ukrainan hyökkäyssodan tärkeimmät tapahtumat maanantailta. ,https://img.ilcdn.fi/ym8y28gbwo0mMbhhexPklWxDdj4=/510x318/top/img-s3.ilcdn.fi/021010154d64c69146a2fc6d87b2c0c178fa9328f466188237b124d8c4f5985e.jpg,D813203C5C2C48CAB6012A43EBED1B45
2022-09-19T23:11:36.000Z,Horoskooppi,NULL,https://img.ilcdn.fi/ZJX2nPQHLedeTO4nOGca4bZ5URo=/510x318/top/img-s3.ilcdn.fi/0e855f41645f17dbb2436f21bf69f40ac48d1971a147578985e2c64c1fb985d3.jpg,1EB2B9FF58E54301BD58A4E6D6C5836B
2022-09-19T23:21:20.000Z,Paljastus: Näin Trump uskoi voivansa estää Bidenin presidenttiyden,"Donald Trumpin avustajat paljastavat uudessa kirjassa, kuinka Trump yritti viimeiseen asti pitää kätensä vallankahvassa.",https://img.ilcdn.fi/FT--GlkJqG6afOy4srbq0nZcwXc=/510x318/top/img-s3.ilcdn.fi/82878c65427fd359989f38f5d7d630ca2c2858d6f689250cf41b685563822fd1.jpg,6570473AF8C14600A353CE61EE7BB4C3
2022-09-20T00:45:10.000Z,Jeff Bezos ei ole enää maailman toiseksi rikkain: yllätysnimi tuplasi omaisuutensa käsittämättömällä vauhdilla,Intialainen Gautam Adani on ensimmäinen aasialainen liikemies kolmen varakkaimman ihmisen joukossa.,https://img.ilcdn.fi/TXAOGA786sQW0vqw6fTpieGvyrg=/510x318/top/img-s3.ilcdn.fi/07d9aad5c370fed8d24be31d9e00e773c81610bb388b93bebbe31dc3dbdd81a4.jpg,624D871C8208448DA8CF5EA8A7828748
2022-09-20T01:26:17.000Z,Maailmankuulussa murhajutussa yllätyskäänne: 20 vuotta vangittuna ollut mies vapautettiin,Hittipodcast auttoi vuonna 2000 vangittua miestä pääsemään vapauteen.,https://img.ilcdn.fi/EbqJvs4UHKAyoeJ5oxLCKdUUjms=/510x318/top/img-s3.ilcdn.fi/7e22bfec385809ef73ce3b7bdd2458bcc4e77fe91055d14298d0809fb6b31fc9.jpg,0C05F62FEC0748488313C35C5044E8F6
2022-09-20T02:00:05.000Z,Hanna Sumari neuvoo asukasta Suomen kauneimmassa kodissa: ”Olisi pitänyt aloittaa alusta”,"Hanna Sumari muistuttaa, että perusteista pitäisi aina aloittaa.",https://img.ilcdn.fi/1td49fItWHHiroui7Q72gCQ9pGk=/510x318/top/img-s3.ilcdn.fi/3da5922a26a4f5ade72a4c5d14bb53c559199f4233439c2c7a4149d544e872a1.jpg,202C30AF47324EFB946B61067B615204
2022-09-20T02:32:43.000Z,Henna katuu kauneusleikkausta: ”En olisi voinut kuvitella puolentoista vuoden helvettiä”,Vuonna 2020 Henna Havila suuntasi kauneusleikkaukseen Viroon. Siitä alkoi puolentoista vuoden helvetti. ,https://img.ilcdn.fi/jGV4FJcMmDgBKlSDMxNh6lqDLRI=/510x318/top/img-s3.ilcdn.fi/41da7c546ab63cae036aa0621b7f18dd9597aa501b5c2eeb5cdd74d0393c4bdf.jpg,3E00C708FC8144E1A441641A9939B5B6
2022-09-20T02:45:00.000Z,Mikä MLB-seura isännöi Minute Maid Parkia Teksasin osavaltiossa?,Iltalehden perinteinen urheiluvisa on myös verkossa. Montako tiedät?,https://img.ilcdn.fi/PzGoFHbd-PTn-BWIKH2cgylKMiA=/510x318/top/img-s3.ilcdn.fi/2f890ec74599a48c0220331ae9910a968a69b22f7f95bbab841a7bc14fac60bb.jpg,28D7F0C0E61A41748B82710BF07D7565
2022-09-20T03:00:59.000Z,"Karmea bugi: Forexin automaatit veloittivat nostot tileiltä moninkertaisesti – Helena huomasi lomakohteessa, että tili on miinuksella",Forexin automaatteja vaivannut vika koski yhtiön kaikkia automaatteja Pohjoismaissa. Rahojen on määrä palata tileille muutamassa päivässä.,https://img.ilcdn.fi/w60BHdECMbwOrdajTb-mP1zzymg=/510x318/top/img-s3.ilcdn.fi/baae1e6313510ad192bff48613be19e4b3f50a1ccdf515b1971be9b49ddd9274.jpg,2141B70457804F4CAC27E88AEB647599
