paivamaara,otsikko,tiivistelma,kuva,id
2025-03-24T15:36:11.000Z,IL seuraa: Tässä Huuhkajien kokoonpano MM-karsintaotteluun,IL seuraa Huuhkajien MM-karsintaottelua tässä artikkelissa.,https://img.ilcdn.fi/sGrPsVU23uWmp4OfilsNyJl3gG4=/0x0:3000x1876/510x318/top/img-s3.ilcdn.fi/6e7c19a2679b0dc6ae47c211ecced8b960cdd51715df60aa12614b02a6ec73cc.jpg,F91BB143C02445A5A18C54F69ADE5798
2025-03-24T15:49:25.000Z,"Jos väsyttää, tämä sairaus on jo pitkällä ","Kilpirauhasen vajaatoiminnan oireet ilmaantuvat usein salakavalasti niin, ettei oireita osaa liittää sairauteen.",https://img.ilcdn.fi/T3tUxu_y_dxLVuINSeul9VmrLKQ=/510x318/top/img-s3.ilcdn.fi/f9fe8114362aa3009156b2222a593e11e8e81a59f13ab1d50d1a1ceedeb20b64.jpg,5BAF8B174A5646E688D07FF48BDB7BA5
2025-03-24T15:59:10.000Z,Putin lähetti Trumpille henkilökohtaisen lahjan,Putin antoi Trumpin erityisedustajalle lahjan toimitettavaksi Yhdysvaltain presidentille.,https://img.ilcdn.fi/hVhRAbAfR4eTtbNBYPha-AQvjTY=/510x318/top/img-s3.ilcdn.fi/990eb1c7eb47e5daa03f13a6918e8d3a972afa1a1d5a07eb154311198e934e22.jpg,C087827CECCD451CBD69E583D6FF6324
2025-03-24T15:59:56.000Z,Artisti Ramses II teki jättihitin ja keikkoja riitti – Sitten hiljeni: ”Olisi koppavaa sanoa”,"Ramses II kertoo Iltalehdelle nykykuulumisiaan, kun Villieläin-ilmiö on taantunut.",https://img.ilcdn.fi/9bvD06Cd7XsoCHlIPLzCTwXRbQM=/510x318/top/img-s3.ilcdn.fi/f0a63f5b37fd9e90760446bbccffc6a33aec80beb3e93c091f95f06a92241693.jpg,D6282E17269A4ECB9F3E1C592673AEE4
2025-03-24T16:04:25.000Z,Kutsu kävi – Suomalaishyökkääjä NHL:ään,Aatu Räty pääsee NHL:n puolelle näyttämään taitojaan.,https://img.ilcdn.fi/0av3d_kOIr4IP3iXUBNYfPiLUIg=/0x0:3000x1875/510x318/top/img-s3.ilcdn.fi/58d36646d7f450777f0efe2df0ca6b927bdf0e510ab54944bd441f2354713814.jpg,DFF49E7EF9C74C4CB7F5BA6C5656C170
2025-03-24T16:13:07.000Z,Janni Hussilta tyhjentävä kirjoitus ,Janni Hussi julkaisi Instagram-tilillään pitkän kirjoituksen viime päivien somehuhuihin ja otsikointiin liittyen. ,https://img.ilcdn.fi/ynl6upVB-G5_6rE649ePA8a0s7U=/510x318/top/img-s3.ilcdn.fi/0aa93af9ab81c8811817ec4c179a530c3a9fad3f23cb2532922727d1b230ead2.jpg,3FE0BAA7ECBE4490AE9390691D66F606
2025-03-24T16:28:21.000Z,IL seuraa: Kiekko-Espoo täräytti jo toisen Tapparan verkkoon – Lappeenrannassa salama-alku,Maanantai-iltana ratkaistaan kotimaan kaukaloissa jo isoja asioita.,https://img.ilcdn.fi/Y0IC4TXirOfiEgyEUhcRYFNpNBM=/510x318/top/img-s3.ilcdn.fi/4fef0f2f02ab932a68381a1d9f919b4a837f9adc19aaf54708e703c48c5c22d6.jpg,FD5A7F90A73C4BC8B015ED983FE4D62C
2025-03-24T16:29:43.000Z,Venäjä syyttää Suomea kyberhyökkäyksestä,Venäjän sensuuriviranomainen syyttää Suomea ja useaa muuta maata kyberhyökkäyksestä.,https://img.ilcdn.fi/YieiUIgIZ1sfy4iTCYl2g2q_mjU=/510x318/top/img-s3.ilcdn.fi/2af2ae0e333416d1191f09f58ca49021dd091088aaad99b95ce32fd34a7692fd.jpg,4F7986C66FD440FC9A3EDD5CC7A52E42
2025-03-24T16:55:23.000Z,"Sometähti tilasi auton yli 7 vuotta sitten, mutta odottaa aina vain: ”Ikääntyi kuin maito”",Vuonna 2017 varattu Tesla Roadster antaa odottaa. ,https://img.ilcdn.fi/FuDEzOBHSMEQm_8N95FYgpovbEk=/510x318/top/img-s3.ilcdn.fi/757f1c843add27838d236b3509a1eea3d244cfa6c2e861389de6e4c073c9d882.jpg,B7B0274CEED545BCB232DDB5FC192741
2025-03-24T17:04:07.000Z,Kissan vapaa ulkoilu tulkittiin rikokseksi – Nyt puhuvat suomalaiset: ”Sairaaksi mennyt touhu”,Nyt puhuvat kissojaan vapaana ulkoiluttavat omistajat.,https://img.ilcdn.fi/nbMzY7tUCEqiPaoVKdY1qeBaRhI=/510x318/top/img-s3.ilcdn.fi/ee950f08d526289ff06131e84bb2c5ef2b50d22f23dae72eb7e8dd52d6b40c63.jpg,A9C5F18C2A2345A18FA96B1DFF8344F2
2025-03-24T17:36:51.000Z,"Tuuletus aiheutti ison kohun – ”Lapset, älkää ikinä tehkö tätä”","Mitchell Voit, 20, nousi otsikoihin tuuletuksellaan.",https://img.ilcdn.fi/RmSKglLb4vRQtQC_1pLMfWpqSNQ=/35x0:942x567/510x318/top/img-s3.ilcdn.fi/e07dfaf16e28938a4037f5c54faf58c4d13e196988d78f5d673c88dfc023688d.jpg,1BF1A77C5E1E4AC3B4727C9CA180019C
2025-03-24T17:39:32.000Z,Podcast: Heikki Paasonen sai Marita-vaimoltaan tiukan kiellon,"Heikki ja Marita Paasonen sopivat, ettei Heikki saa valittaa työmatkoiltaan kotiin. Heikki kertoo podcastissaan, miksi.",https://img.ilcdn.fi/sQLOdA0lthG2UnvlpNyBA6KKGTY=/510x318/top/img-s3.ilcdn.fi/19e4081fcb5baad153b92f20d765f6754f0f26cf128aa25dc20e8ef03ab0d89b.jpg,00039890623D4D5DAC7DDF9FE091F5C8
2025-03-24T17:39:50.000Z,Vahvistus: Tämä ajoi Taivalkosken surmaajan kammottavaan tekoon – Myöntää aiheuttaneensa kuoleman,Murhasta epäiltyä miestä vaaditaan vangittavaksi tiistaina.,https://img.ilcdn.fi/10YUASs2VdsraDHbHv67K-dyxVM=/510x318/top/img-s3.ilcdn.fi/74215f7d51f54fc4c76a1149991f48512ea31ce38073225ab0698aa3ef55b4b8.jpg,E4549665D2EF4BF787A56780DDF1D5BF
2025-03-24T17:40:10.000Z,Ruumis hääpuvussa,"Amerikkalaispari vaikutti häissään iloiselta, mutta juhlien jälkeen morsian löytyi kylpyammeesta raa’asti murhattuna. Karmea totuus paljastui vasta 12 vuoden jälkeen.",https://img.ilcdn.fi/T8DN_u3AU15VsL5NBu6SC4r8f5k=/510x318/top/img-s3.ilcdn.fi/ff15fda09a08ca1b1040d86d042dea8bc2041a18b3b95e136068496c3d1debce.jpg,BECA9024C07A4FEBA5AE54AE958744AD
2025-03-24T17:56:02.000Z,Puheenjohtajilla kovaa vääntöä leikkauksista – Harkimo haluaa viisi hyvinvointialuetta,"Iltalehden Suoraan asiaan -vaaliohjelmassa vasemmistoliiton, RKP:n ja Liike Nytin puheenjohtajat olivat eri mieltä niin verotuksesta kuin sote-säästöistä.",https://img.ilcdn.fi/6-FqVmU7GdaHXmllFMJzoYhCc18=/510x318/top/img-s3.ilcdn.fi/77f0d6e6290d160e347f528b1a009125e01b2fcaf39d525ac19a0a705d348619.jpg,7751865012034707ABEC1E135B2D4B3D
2025-03-24T18:10:29.000Z,"”Lääkäriin ei pääse yöllä, mutta olutta saa halvalla” – Vaaleissa muhii yllätys","Nykymenolla arviolta viittätoista – siis joka kolmatta – perussuomalaisten kansanedustajaa uhkaa putoaminen eduskunnasta, Iltalehden Lauri Nurmi kirjoittaa.",https://img.ilcdn.fi/Ow99-gM9RiLe2UDhQny6Ym3ofZQ=/510x318/top/img-s3.ilcdn.fi/f6a20ce13986fc5f957f18340a1747fd47c563dcfb7ae553325f096cd326f03b.jpg,DAD51606FED042C4B894AE1582289596
2025-03-24T18:38:50.000Z,Mr. Lordi sanoo suorat sanat Erika Vikmanin euroviisusta,Mr. Lordi ei säästele kirosanojaan avatessaan tuntojaan Erika Vikmanin viisukappaleen kohtaamasta kritiikistä.,https://img.ilcdn.fi/7emShLXqDvJPNxTbB-5W6A-WGiQ=/510x318/top/img-s3.ilcdn.fi/7c30168429681adb56c0fb9a5ffa0a6af831fd0d31ebc7aa510dd9f6c62ec955.jpg,79D8EC781CD844E2978E4B5D91A4643F
2025-03-24T18:45:13.000Z,Hurja takaa-ajo Pariisissa – Loppu ei mennyt kuten elokuvissa,Varastetulla BMW:llä hurjastellut kuski ei suostunut pysähtymään poliisin käskystä huolimatta.,https://img.ilcdn.fi/6cEea-dp_B3QPHqfXTMw6p9J18w=/510x318/top/img-s3.ilcdn.fi/bf69fc728f97370787921c6b4119cc8f47ddf8ad285d55528360aac9458d2d18.jpg,64EA63C91C24404E8DA0A0C32FDD3D1A
2025-03-24T18:55:13.000Z,Kisaunelma karkasi hetken nukahdukseen,"Suomella ei ollut varaa menettää kahden maalin johtoa, kirjoittaa Janne Palomäki Kaunasista. ",https://img.ilcdn.fi/pzuXFrTFGEf0XRZN_gI8g0rMfaU=/510x318/top/img-s3.ilcdn.fi/4e9610418cee033ddf25e47551e4cc57cf8a4befe1ceb2b8f26e220ad6095fe5.jpg,4237FC59022C4F568F98DD333AB86071
2025-03-24T18:58:49.000Z,Jaakon kahden euron kirppislöytö voi tuoda satakertaisen voiton – ”Ostin saman tien”,Jaakko kuvailee pihakirppikseltä tekemäänsä ostosta elämänsä parhaaksi kirpputorilöydöksi.,https://img.ilcdn.fi/Qb0LgO--yNuhM9SnAUxeOSKNB6I=/510x318/top/img-s3.ilcdn.fi/e4c544f56005fd53fc28acc84bc13d5ce212217b5dce98be146afdd3c7df822e.jpg,D0370B795DE3499D9B04F1BB77655F23
2025-03-24T19:19:55.000Z,Huono viesti uudelle päävalmentajalle – Tässä Liettua–Suomi-ottelun Leijonat & lampaat,Liettua–Suomi 2–2.,https://img.ilcdn.fi/yhUxUE6aOGOD5hm4Shgt8Ovh4g0=/510x318/top/img-s3.ilcdn.fi/73639acb64118476c35a467fea683bdaee185587f5799a6e50a95d7797b2ee8e.jpg,F3E3AF9FE7A1440D86A2DBA3160E26B1
2025-03-24T19:23:58.000Z,KSML: Näin Suomen huutokauppakeisari voi nyt,Aki Palsanmäki kertoo Keskisuomalaiselle palanneensa töiden pariin.,https://img.ilcdn.fi/wgVVJ3ZVIX9_GFG6k4wV-rxvPls=/510x318/top/img-s3.ilcdn.fi/c9f8645c15feddc2062599dbbb40f47df6c244a7da6c5ad4feacf5949b94401e.jpg,B78ADA55BBEB4505B45FA716E12F8B08
2025-03-24T19:24:45.000Z,Janne Puhakan ja Rolf Nordmon asunto ilmestyi myyntiin,Nordmo ja Puhakka omistivat paritalon puolikkaan yhdessä.,https://img.ilcdn.fi/DyKR9jcf9XBt5s6F2KUnKQX7zc8=/510x318/top/img-s3.ilcdn.fi/e6b1181e29a68ceb020226e3f1c008b7d121e309418b39ee2da388b6f65b9e82.jpg,BDEAB59E9A004E13B493A0FE6916FD64
2025-03-24T19:25:37.000Z,Tässä ovat SM-liigan puolivälieräparit,SM-liigan puolivälierät käynnistyvät keskiviikkona.,https://img.ilcdn.fi/GrIyz5I6mggTqFQ7VhUeC6KhMzg=/510x318/top/img-s3.ilcdn.fi/8beec0cfdd515ed4bec4e357697a29daeb07ebc3e6b9beee1c6a22c4054446eb.jpg,99EE22F50F544EB6B807C79EFD4C7704
2025-03-24T19:36:30.000Z,"Naisten ja miesten seksifantasiat voivat erota suuresti – Nainen, vastaa pieneen seksikyselyymme","Naisten ja miesten seksifantasiat voivat poiketa toisistaan suurestikin. Nainen, kerro meille, mitä ajattelet seksin tai itsetyydytyksen aikana.",https://img.ilcdn.fi/MkA_1n1t3nw8x3cB6VgvdmNTsyA=/510x318/top/img-s3.ilcdn.fi/a33639901fb7fb78ac319865ae1dcf6cf2c3b40f733db06de1ed52bcd376a809.jpg,5A16ED4E4CDB46DEB5FA5CB113429482
2025-03-24T19:38:12.000Z,"Näin käy Venäjän sotataloudelle, jos Ukrainaan tulee aselepo ","Aselepo Ukrainassa antaisi Venäjälle aikaa varustautua, Suomen Pankki varoittaa.",https://img.ilcdn.fi/Ggi0mQrzgNdjMDP5O7PFB5_c308=/510x318/top/img-s3.ilcdn.fi/b59eaa09f13e072277ea4aeab82e44713d13b9ca1f62a6244081c894ed07f6eb.jpg,59CEE19734B34EEEB9E90EA0FCC89A58
2025-03-24T19:50:44.000Z,ChatGPT pilasi norjalaismiehen päivän – Järkyttävästä vastauksesta kansainvälinen uutinen,ChatGPT väitti syyttömän norjalaismiehen murhanneen lapsensa. Asiasta on tehty valitus Norjan tietosuojaviranomaiselle.,https://img.ilcdn.fi/emAZlmHZF8r3T28ChadekYILghY=/0x124:3000x1997/510x318/top/img-s3.ilcdn.fi/5b573291c03c1dd7654871ee54f9499aee434da9d4a1ed77e9fc84c931aeb316.jpg,4CCE02ACBD7A46888967C970D75CCB93
2025-03-24T20:06:05.000Z,Kuvat: Tällaista metsää murhasta epäilty palkittu poromies omistaa – Hakkuut näkyvät selkeästi,"Murhasta epäilty omistaa metsiä, uhri työskenteli metsäalalla.",https://img.ilcdn.fi/f8VFit7oFft45mLplAqgGBN466k=/510x318/top/img-s3.ilcdn.fi/d8496a43092fba168838ec65e0807d2afce25340a7252bbc933c9c5187b414c2.jpg,DBCAA3913CCC4503B12428C66D5E2A22
2025-03-24T20:08:29.000Z,Eronnut Suvi Hartlin: ”Olen itkenyt paljon ja kokenut epätoivoa”,Juontaja Suvi Hartlin kertoo raadollisen rehellisesti kuulumisistaan Instagramissa.,https://img.ilcdn.fi/1-tSc6mC1nrzqrX6ssKOkpnAINg=/510x318/top/img-s3.ilcdn.fi/f3f9829f2c79e1f7129e2988e9b37c2755b2a4d6ed2354a1c9981a973d44a096.jpg,DD76AF99B65942318756F3902A7766E8
2025-03-24T20:16:40.000Z,”Jin ja jang” – Lukas Hradecky otti tasoituksen kontolleen,Suomi pelasi hyvin. Vain tulos jäi surkeaksi. ,https://img.ilcdn.fi/4eGjI3I96LLksu7_PUJCemO2cYQ=/510x318/top/img-s3.ilcdn.fi/5c1ca4c5a58babe4e36c4bbf879834c352456625a61c212d8d0f18a06999a572.jpg,A5E20AA48EA846CD9EB3986752ED6538
2025-03-24T20:20:07.000Z,Tapparan ratkaisija hehkutti MTV:llä Tampereen derbyä:  ”Varmasti ikimuistoinen sarja”,Tampereen paikallissarja Ilves–Tappara on Liigan puolivälierien todellinen herkkupala.,https://img.ilcdn.fi/wpW9uakdxcrUGktBtm7-b9F5_Zs=/510x318/top/img-s3.ilcdn.fi/5eb393dff389eb72c57f9650056295a32af9c4087afd43f7d4d8bb69f3495a23.jpg,04FF19D3287A4002990BFD688FD45290
2025-03-24T20:32:26.000Z,14-vuotias Michal tekee huiman tempun snookerissa,Michal Szubarczyk esitteli osaamistaan EM-kisoissa.,https://img.ilcdn.fi/G7kjkoI5LWN7W8MsIzWyM9-pFKQ=/510x318/top/img-s3.ilcdn.fi/1725f9c56bd6b17897ac485abb91f689166a1a0cf718e5d1734db0baf494d669.jpg,0F75CB782D1044C6878232B401692781
2025-03-24T20:41:26.000Z,Trumpin hallinnolta käsittämätön moka,"Lehden päätoimittaja lisättiin ryhmään, jossa jaettiin arkaluontoista sotilaallista tietoa Yhdysvaltain toiminnasta.",https://img.ilcdn.fi/ZJM2HzHWbuVDnhahrJf57XHHynw=/510x318/top/img-s3.ilcdn.fi/b921aa7499637b74ffe3a4ab5450b11d80ea284016e306199e75d348c78746fe.jpg,E4CCA32566E743199265488495A326FA
2025-03-24T20:46:20.000Z,Gérard Depardieu astui oikeuden eteen – Suosikkinäyttelijää syytetään seksuaalirikoksista,"Ranskalaisnäyttelijä Gérard Depardieun oikeudenkäyntiä on lykätty, mutta tänään maanantaina hän astui oikeuden eteen.",https://img.ilcdn.fi/KJLUDvHAaz8yuzrQiCZZjQbq2fM=/510x318/top/img-s3.ilcdn.fi/2d2bfb5033d5c2bee8851b48fe1ae993566673b2ae59ef2b6dab9f0669da102d.jpg,28463FB96F334BD6AD89373603A4B759
2025-03-24T20:47:59.000Z,Liettua sai kyseenalaisen avausmaalin – Jacob Friisin usko var-tuomareihin ei horju,Liettuan 2–1-kavennusmaalia edelsi selvä virhe. ,https://img.ilcdn.fi/GtuHGYyytqzS2AzL435vvY5FstY=/510x318/top/img-s3.ilcdn.fi/835a7eab3e52a7e75196ce371d163d66508c5f796523f2d75fa97c3c21cb9886.jpg,011AD6C9B1D84A47BD75FE16F30ADFD0
2025-03-24T21:03:20.000Z,Tv-juontajan kireä asu paljasti liikaa – ”Häpeäisit”,Eleonora Incardonaa verrataan Diletta Leottaan.,https://img.ilcdn.fi/Rg--2qLO4F9WNOR8m5HvoKBwrL8=/510x318/top/img-s3.ilcdn.fi/f40a33097ed1e0786dfb0d574ca65e401571fe9f1530e0c46bd3ad58f639db55.jpg,98CAE56FFE484D7293063CE568DD07C8
2025-03-24T21:04:19.000Z,IL Ukrainassa: Sotilaan asepaljastus yllättää – Tätä tieto tarkoittaa,"Venäjä moukaroi Ukrainaa Shahed-drooneilla lähes joka päivä. Missään ei ole turvallista, sanoo Iltalehden haastattelema ilmatorjuntamies.",https://img.ilcdn.fi/cSZoMdKhmvRjsMZC7nRhhjvxnPw=/510x318/top/img-s3.ilcdn.fi/7383c3b4d6e2bbe141434722ad16ff4da49add8ba9969e5a4a3b75fc9bb5b6b8.png,4B0D1ADE63674494A6F3A1271AD4150C
2025-03-24T21:17:07.000Z,Trumpin erityisedustajalta hämmentävää puhetta Ukrainasta,Tähän artikkeliin on koottu Ukrainan sodan keskeisimmät tapahtumat maanantailta 24. maaliskuuta 2025. Kyseessä on sodan 1125. päivä.,https://img.ilcdn.fi/PuEBvJINe69J8rNam_Xyhh_U5aw=/510x318/top/img-s3.ilcdn.fi/81f7cf97675294a3aa7124507d7decd5cf2bcc218c610f8278e69371d711c96c.jpg,95E7CBCB15D4436385269B905274BAA1
2025-03-24T21:31:02.000Z,Trump uhkaa uusilla tulleilla,"Trumpin mukaan tuontitullit koskevat maita, jotka ostavat öljyä tai kaasua Venezuelasta.",https://img.ilcdn.fi/gi9FwURhKVXkxXCfmgKSBdlRR0Y=/510x318/top/img-s3.ilcdn.fi/4553cd2d651618d471ba5c316d85335eabdd3a336b80ca46e32ea8805e6dd5e9.jpg,66800FE7580844FA96CA12494B9BABC0
2025-03-25T00:00:28.000Z,Horoskooppi,NULL,https://img.ilcdn.fi/jm9wPlnoWFx5jhlXkB6i6JzE1x4=/510x318/top/img-s3.ilcdn.fi/8d5c61e8c61ff106bc8907444720fdd5e3bdfa0bdec71d9ddc943f19d86978bd.jpg,1A42C81E72EF40849A63A499EC9ED215
2025-03-25T00:22:50.000Z,George Clooney avasi suunsa – Trump tulistui,Presidentti ja Oscar-palkittu näyttelijä eivät nokitelleet ensimmäistä kertaa.,https://img.ilcdn.fi/RGFPzbe3xX_ymiMMYUqvW-vumc8=/510x318/top/img-s3.ilcdn.fi/00e57ed344abe6682d99b352e6f53d4769170a5f6006c602fe4622be1170de31.jpg,24351D94228743DE94D25DC9A0791614
2025-03-25T01:19:34.000Z,Hillary Clinton pisti lusikkansa Trumpin hallinnon viestisoppaan – Näin kävi,Entinen ulkoministeri kommentoi viestisekoilua sosiaalisessa mediassa.,https://img.ilcdn.fi/eZzuvpxTQFcbxQNyRjsMyB3pcBA=/510x318/top/img-s3.ilcdn.fi/8dafa7941d814c8c00beb4093a222d062e1c63e6caa4b4774e5621f4402d4b5c.jpg,983BF5FF902B46E4B7DFC8E5A1933459
2025-03-25T03:00:02.000Z,Venäjän keskuspankilta salainen varoitus Kremlille,Keskuspankki varoitti Venäjän hallitusta öljyn hintariskeistä.,https://img.ilcdn.fi/FsSG5joZDH73jUDFeQtKH9AuaT4=/510x318/top/img-s3.ilcdn.fi/f97f2cdc53d6b5a24bf42406b34813e735f34bbb19ea57849de1a64ba1cd0abd.jpg,A50D5C63AEF941E0934F3060D16759CD
2025-03-25T03:30:01.000Z,Palovaara! Maahantuoja kieltää hybridiauton lataamisen,Korjaava päivitys on saatavilla vuoden toisella neljänneksellä. Sitä ennen autoa ei saa ladata.,https://img.ilcdn.fi/N4RoS9E9yxEgP5Ld4cIlQmX6Cdg=/0x47:2222x1436/510x318/top/img-s3.ilcdn.fi/566a890d5f0e150883baf5385402d92fb800e778ac819d101d374166fd855967.jpg,AA7B82167D5E48CE8081E0EF306BF0C0
2025-03-25T03:59:55.000Z,"Näin tylysti Jere Karalahden NHL-ura päättyi: ”Entistä ylpeämpi, etten alistunut”",Suomi-kiekon ristiriitaisin tähtipelaaja Jere Karalahti täyttää tänään 50 vuotta.,https://img.ilcdn.fi/hbgC8l9yIEiZgXCdLhWx3q6hm70=/510x318/top/img-s3.ilcdn.fi/9be77cf6709eb407a2f376a7e7ff65cb0d0ebeda703e05448ff1880d3c64fe96.jpg,D79BB951EF6D4C4AAA59F67B06D26A1B
2025-03-25T04:00:13.000Z,Podcast: Katja Ståhl kertoo masennuksestaan – Sai ensin väärän diagnoosin,"Katja Ståhlin luultiin uupuneen, mutta totuus olikin toinen. ",https://img.ilcdn.fi/6FjXqYwfK3uqLT5DNcfAUakzLOk=/510x318/top/img-s3.ilcdn.fi/cc5c1c3204eafc1c33245d957edd1e4a01628135661f668cdb8fa159ab3c39f6.jpg,1DBCFDF0CB9F402494CB693F41078987
2025-03-25T04:00:19.000Z,Lääkärin huoli herää,"Harva tietää, että työterveyslääkäri tekee potilaasta omat havaintonsa kaikessa hiljaisuudessa. Selvitimme, mitkä asiat ovat lääkärin mielestä varoitusmerkkejä. Näistä kahdesta yllättävästä merkistä lääkäri arvaa, että alkoholi saattaa olla ongelma.",https://img.ilcdn.fi/vNkc_3nWGx_snIpbeTZMmrXe_7E=/0x64:3000x1940/510x318/top/img-s3.ilcdn.fi/8ccb2dbe71ded22f4a20bd6698bd53ebf5c3ce26438ff90723a7a6eaee05a575.jpg,E1BDE962C2AD4C4587CA3701879890BC
2025-03-25T04:31:18.000Z,Kuin luuranko – Suomalaishiihtäjä järkyttyi omista kuvistaan,Ravinto-ongelmista kärsinyt Alexander Ståhlberg on saanut painoa takaisin ja rasvaprosenttia ylös.,https://img.ilcdn.fi/ciNGqA-ln89MfaWsgDXdLolwtEA=/510x318/top/img-s3.ilcdn.fi/d2322fd15431e3cbb97ce8f6c7372056d56673804541b5185fc2830d512afa7a.jpg,98132BE9481C4260AEC5C6C2D80D42E8
2025-03-25T04:43:17.000Z,"Koko halli kohahti, kun Mikko Rantanen retkahti jäälle",Dallas Starsin tähtihankinta koki kovia. ,https://img.ilcdn.fi/HILo16xTqCkYvgPG57ZyJnVga7o=/510x318/top/img-s3.ilcdn.fi/506a9a93151a76c949beb8bc45eb16f0f0a0c09ad77b7e763eaf6043805eb1ff.jpg,FE86A08BC4344FCF8D8C79DF97A32052
2025-03-25T04:49:05.000Z,Kovat syytökset varjostavat Masterchef Suomea – Kim Mikkola tänään tv:ssä,Kim Mikkola on Masterchef Suomen uusin tuomari.,https://img.ilcdn.fi/JoWqEKWqX_B36cfsP3XzuLp1zXc=/510x318/top/img-s3.ilcdn.fi/e07d7860fd8dc4f70e00a1ebca28d346a8a0c5e820546b1f6e3faec474eaca8a.jpg,A2890779EF35410AA8CE377D9C93EC16
2025-03-25T05:00:00.000Z,Tasapainotteletko kahden tai useamman lainan kanssa? Niiden yhdistäminen voi alentaa lainakorkoa ja vähentää ylimääräisiä lainakuluja,Kymmenet tuhannet suomalaiset yhdistävät vuosittain useat lainat yhdeksi aiempaa edullisemmaksi lainaksi.,https://img.ilcdn.fi/PXf1029if0U69QzZZo49je2gQN4=/510x318/top/img-s3.ilcdn.fi/b9e1066318ac169f2b29cee451e1899d8687e1ae7ac55c88f2da761c68908298.jpg,1A27AD2692A6440D8BA87759113079D6
2025-03-25T05:04:39.000Z,Trumpin ailahtelu ajoi erikoisen kolmikon yhteen – ”Pekingissä juodaan rauhassa teetä”,"Kiina näkee tilaisuutensa tulleen, kun Yhdysvaltojen horjuminen pakottaa maat etsimään uusia liittolaisia, asiantuntija sanoo. ",https://img.ilcdn.fi/GlH66PJcWapKKZN0hv3M7qs0Pbo=/510x318/top/img-s3.ilcdn.fi/fec278e8c5f2195299baf069357dbf7dd65d265dc68c2cfd2d0aee5f231c916f.jpg,B27FF2D302564F6880B3F1B1761DA688
2025-03-25T05:22:36.000Z,Supertähden joukkue potkittiin ulos huipputurnauksesta,James Rodríguezia ei näillä näkymin nähdä seurajoukkueiden maailmanmestaruuskilpailuissa. ,https://img.ilcdn.fi/oeZfpa2F3e5TMAGwuihixlzAG_Y=/510x318/top/img-s3.ilcdn.fi/ae8ed5548f389ecdb064319b628f3c966bbc43ad901ffcf2af91b2f5a295781a.jpg,D320244F31FD49B9B26D0A4A40BA34E2
2025-03-25T05:31:37.000Z,Ellen Jokikunnas vaatii tv:ssä vastauksia – Ilmiriita ja välirikko,Ellen Jokikunnaksella ja Jari Raskilla on ollut aiemminkin ongelmia arkkitehdin kanssa.,https://img.ilcdn.fi/vjQVqa4soc9MuJJkfQFlOTXHLFU=/510x318/top/img-s3.ilcdn.fi/705fcaab7d2e43a7ea79172540cd68e805d3c98265a2b4bd90cd6404ddd101a5.jpg,E78A13C27034424890D0F2BCA5072007
2025-03-25T05:37:12.000Z,Olitko tämän pankin asiakas? Verottajalla on sinulle muistutus,Sama määräpäivä koskee myös toiminimiyrittäjien ja maataloudenharjoittajien puolisoita.,https://img.ilcdn.fi/cohJ8qR1wtE-87aO_o2kRuoOSjE=/510x318/top/img-s3.ilcdn.fi/9cebe219b1a7e89c1ddbc028c03c5429f650830400ef614e6634c16b883ecb18.jpg,C639F33F107542A68D01C9B960E1E704
2025-03-25T05:54:08.000Z,Podcast: Kimmo Vehviläinen avautuu avioeron jälkeisistä synkistä hetkistä,"Kimmo Vehviläinen kertoo podcastissa hetkistä, kun hänellä on ollut suuria suruja elämässään. ",https://img.ilcdn.fi/PLSY_9_8KV5vjqyvaNvxPRR6zbs=/510x318/top/img-s3.ilcdn.fi/6431fd61dba53b8202b9c4d0e606da0472e26403b24eed69a2572fd75b48c7e8.jpg,D97F6B69A2DB40C98FEA384F592A7AE7
2025-03-25T05:56:50.000Z,Huima vauhti: Pakkien nopeusennätys murskattiin NHL:ssä,Quinn Hughesin vauhdikkaat nousut ovat myrkkyä vastustajille.,https://img.ilcdn.fi/tQozTFTd0ylvT4qEgJYwP_mebyI=/510x318/top/img-s3.ilcdn.fi/f9b6ad8ae01ca7b4220b6f518b00c3c9dd23894ec37afe7e9669d893ff227a94.jpg,B0FCFED10BD840CE90584C09594DB7E7
2025-03-25T06:06:59.000Z,Työttömyys jatkaa kasvuaan,"Tilastokeskus: 0–64-vuotiaiden työllisyysasteen trendiluku oli 76,0 %, kun tammikuussa oli 76,5 %",https://img.ilcdn.fi/5ZmTAJdtmnE5gZoLdZ3mlUzw9Bw=/510x318/top/img-s3.ilcdn.fi/e3bf79a8b85447e8ec8a6cdb0f7b42f8ec0359f69af694f864668e8fe67356f1.jpg,7071DD9DC09D43CEB1F1098CA75F83C5
2025-03-25T06:07:34.000Z,"Ensin tuli pieni kipu, sitten Antti tunsi nopeasti kasvavan patin – Syynä oli sairaus, joka yleistyy nuorilla miehillä, eikä kukaan tiedä, miksi","Antti Honkanen sai tietää sairastuneensa vakavasti samaan aikaan, kun hänen vaimonsa alkoi odottaa perheen kuopusta. ",https://img.ilcdn.fi/gCAOYhVahL5bhSkBLCmtTG0dtCE=/656x150:2254x1122/510x318/top/img-s3.ilcdn.fi/2c8b590f5a892858254ac98d9eb2a8eb7b38dfdafee9a95752cb9ca309f05330.jpg,0AD3033B2CF14A3B81A7BC3022BDB803
2025-03-25T06:22:06.000Z,Näin lämmin kevät on tulossa – Katso oma alueesi,Kuluvan viikon keskilämpötilat ovat Suomessa 3–4 astetta tavanomaista lämpimämpiä. ,https://img.ilcdn.fi/IRxSKuwLeCEutF8uzYZ1GP1YWdo=/510x318/top/img-s3.ilcdn.fi/06f5678ba19ff3c8f398891ecfea6bc3471f842c38079f62bdb297e96a2527ed.jpg,73D0D210E7D14CD583D679C8A39DAEC6
2025-03-25T06:29:36.000Z,Äitinsä murhasta syytetty 28-vuotias oikeuden eteen – Näin hän käyttäytyy,Syyttäjä vaatii 28-vuotiaalle miehelle rangaistusta murhasta.,https://img.ilcdn.fi/EygI4l2EIyQv_LN4KYvNsbjjydg=/510x318/top/img-s3.ilcdn.fi/a4a8213bc3a02e07b4522d5ee8ec1c6248e833d666e3183cec166f22e8ec7821.jpg,1C2AA340232E47EE93BA34E328A876BE
2025-03-25T06:39:50.000Z,Turvakamera paljasti: Naista syytetään toimittajan murhasta Louisianassa,Tähtitoimittajan kuolemasta tihkui uusia tietoja.,https://img.ilcdn.fi/gvObr0e9pG6Sdxng8zbYwhPiL_k=/510x318/top/img-s3.ilcdn.fi/5cbf36601c35cd4f2fc32c51cd64f4ceec4deb795babe81b668d626db9e77eda.jpg,8F0B10E80D5543CD8EFDBBC2ED08B80E
2025-03-25T07:04:42.000Z,Kissa liikkui vapaana pihalla: Rikos – Näin poliisi perustelee,"Näin poliisi perustelee päätöstään, jonka mukaan kissan omistaja syyllistyi rikokseen päästäessään kissan ulkoilemaan ilman valvontaa.",https://img.ilcdn.fi/gA8xoCTMsA9pz1GD4eIWSlF4rVI=/510x318/top/img-s3.ilcdn.fi/9ce98c5ea28949222935a69c01973e893fb5ce7b856585d894edb071ddc1d259.jpg,8BAD3AD97F03406393EFE23DF50BF6CB
2025-03-25T07:13:43.000Z,Asiantuntijalta tylyä tekstiä Patrik Laineen asusta ,P. K. Subban ei pidä Laineen pukuvalinnasta.,https://img.ilcdn.fi/vyIzVaTWLk1afLy0n_QTdZ8N6iA=/510x318/top/img-s3.ilcdn.fi/5420c07173471f23c0ec126f55fc0c9cbece3889d08b6db3087b86dfadf1522f.jpg,8A5BC26FE3384B18B8669703C51C07BB
2025-03-25T07:17:15.000Z,Oscar-palkittu ohjaaja pahoinpideltiin ja pidätettiin,Hamdan Ballal palkittiin Oscar-gaalassa dokumenttielokuvasta Ainoa kotimaa. ,https://img.ilcdn.fi/dctJyt7Nv91e-WFPCF80uVG-Vrg=/510x318/top/img-s3.ilcdn.fi/1c7a1ce528bb310a67c20cf459f01ebe6b6cd3e5e59967d19f8f80a6b727ceab.jpg,B1DA66190DC042F29C1E5DE48DC9CBCB
2025-03-25T07:26:53.000Z,Pääesikunnan entiseltä tiedustelupomolta rujo näkemys Trumpista Keskisuomalaisessa,Entinen tiedustelupäällikkö Harri Ohra-aho esitti rajuja rinnastuksia Keskisuomalaisen kolumnissaan.,https://img.ilcdn.fi/JCMNDfxEJWSqnDrt8FIZr7iBY8c=/510x318/top/img-s3.ilcdn.fi/91005f3dcef47d748f1dca2e1ab0aa70f1795a07c29f1d7cdef842d8479b2191.jpg,0D5F6CC9FBD74A089942558D05107603
2025-03-25T07:34:10.000Z,Uusi asetus tekee rahasiirroista ”nopeita ja peruuttamattomia”,Asiantuntija pelkää Euroopan unionin pikamaksuasetuksen lisäävän huijauksia.,https://img.ilcdn.fi/3d1QEY5ChVK6DckVpXoOi1DVwh4=/510x318/top/img-s3.ilcdn.fi/5e072ded306b20a679c09f0d327efc58995bb1773d175779d142e1a5f9c1236e.png,0E404212AEF9473DA2BC14A9D11B1E48
2025-03-25T07:39:19.000Z,HS: Nämä viisi ehdokasta on tuomittu lapsen hyväksikäytöstä,"Tuomituissa on kolme perussuomalaisten ehdokasta sekä yksi SDP:n ja yksi vapauden liiton ehdokas, kertoo Helsingin Sanomat.",https://img.ilcdn.fi/TjNqAAn8M3iFk6t_kYcYG6FHg9Q=/510x318/top/img-s3.ilcdn.fi/12c178d11c6b3ab4c9a09d2d79ccfd07d23b9b7f763038bdc8cd2ff36d4b5123.jpg,3F5421CBAFEF479BACE2CD9098ABA4F8
2025-03-25T07:43:38.000Z,Tapani Kansa on kuollut,"Laulaja Tapani Kansa on kuollut, puoliso Nina af Enehjelm kertoo Iltalehdelle. Kansa käytti lahjakkuuttaan moneen.",https://img.ilcdn.fi/nmgm8Fo53szJPhPwajLG2s_LVsA=/510x318/top/img-s3.ilcdn.fi/3d6704bca7cbd2cd8c97c54054faa3b29b1a381c53e3d88943525c05ad9d4375.jpg,71C95758864C4B94B4288DB49B4117F1
2025-03-25T07:50:40.000Z,Nina af Enehjelm kertoo Tapani Kansan dramaattisista viimeisistä hetkistä ,Suuri taiteilija kuoli yllättäen maanantain ja tiistain välisenä yönä. ,https://img.ilcdn.fi/o7CRXfH88i2NmXMmgXVS29B0_o8=/510x318/top/img-s3.ilcdn.fi/d77708066dc4cf0c52f7548b7ec30d428163400eac056def4894ed9c6593812c.jpg,844923871C9744DA94A13F70BC60A996
