paivamaara,otsikko,tiivistelma,kuva,id
2022-09-17T15:37:14.000Z,Ei ollutkaan katinkultaa,Lapin kallisarvoinen kulta-aarre oli vähällä jäädä löytämättä kauhean erheen vuoksi. Näin kultasuoneen lopulta iskettiin.,https://img.ilcdn.fi/LOzWX3OTB8j8VKh94PqrT6kj4NA=/510x318/top/img-s3.ilcdn.fi/a91dedd329e44ba7da1aecf3cc513b9d77663c0f801f59238ba1123d3db0efd6.jpg,C64422EEA1104521A992F7957FB4CC4C
2022-09-17T15:52:23.000Z,Jukka Gustafsson kommentoi julkista välikohtausta hoitajien kanssa: ”En koe itse huutaneeni”,"Jukka Gustafssonin mukaan ”hiljaa” -ärähdys irrotettiin mediassa kokonaisuudesta, eikä kyse ollut huutamisesta.",https://img.ilcdn.fi/u4cYM83d-zP6SkfwhA761MUgQCA=/510x318/top/img-s3.ilcdn.fi/ea8bfdfd2abe9c7ec5ccb20e848ec05b99e4618f6ec6d7223a93014907a52831.jpg,50EC38B1E24949BFBD3EC39731696686
2022-09-17T16:14:18.000Z,Hurja tilanne Olympiastadionilla: katsoja putosi katsomossa – ”Ei hengenvaaraa”,Helsingin Olympiastadionilla pelattu Suomen Cupin loppuottelu päättyi pelottavissa merkeissä.,https://img.ilcdn.fi/Z3NPllO3s5RP17uFaDygfzNJdNs=/510x318/top/img-s3.ilcdn.fi/60b5234dc2d1b59a15a3f283f729d018d7d3bbe40a4ff2d8112a30e7dbf42a7e.jpg,968B9F9F3ED348E481A7021B9D4D1DB5
2022-09-17T16:30:16.000Z,Suomessa nostaa päätään omituinen hätäännys Venäjän uhasta,"Venäjän sotilastiedustelu tuskin hankkii parhaita tietojaan Suomen sanomalehdistä, kirjoittaa uutispäällikkö Solmu Salminen.",https://img.ilcdn.fi/mXMtYHtr7TdvBAvTHiE9Y0-nOaE=/510x318/top/img-s3.ilcdn.fi/3d6e5783c703f62ad5d74606d5a1ebd23c6a39a684c93dd6c4001dea0a83bb3c.jpg,731FCE2AD33C4AC687044A883211E27A
2022-09-17T16:35:03.000Z,Suomen mestarit aloittivat railakkaat kultajuhlat: ”Maistellaan Mörkö-shottia”,"Vimpelin Veto kaappasi pesäpallon Suomen mestaruuden kaatamalla Tampereen Manse PP:n suoraan kolmessa ottelussa. Ratkaiseva kahina Saarikentällä päättyi 1–0 (3–2, 2–2).",https://img.ilcdn.fi/VSu1Gz7hk37E4vOETgrAqIU5J9A=/510x318/top/img-s3.ilcdn.fi/24e74f502d4b71383b7e4ab0b7fd5d60fb8e8cf836c62bee8a86f0fa295c6e69.jpg,79AC507D772B443DB3A28395967EBEBD
2022-09-17T16:42:43.000Z,”Mörkö” sinetöi Kärppien voiton Tapparasta – TPS tyrmättiin Raumalla,Jääkiekon SM-liigassa pelattiin seitsemän ottelun kierros.,https://img.ilcdn.fi/kE9Ns9t772lgYVPGOtZc9Ix6MYM=/510x318/top/img-s3.ilcdn.fi/85fe9667225a6ec58f5d87096e55d926aee30140ae8d1f2741068e38b55de540.jpg,01C5BB2790EC4CCFAA826DCA019F6481
2022-09-17T17:05:47.000Z,Syyte: Väkivaltainen poramies tuhosi kalastusverkotkin – palasi uhkailemaan ja sytytti paidan tuleen,"Etelä-Savon käräjäoikeudessa on luettu raskaat syytteet miehelle, joka yritti estää uhriaan todistamasta. ",https://img.ilcdn.fi/IhWDiumAWm3uCQXIvYWLNMk7G-w=/510x318/top/img-s3.ilcdn.fi/ffdb7dc53564f51247872d78dbad2674a28f5c39351a4bde2fe0db76b648b42e.jpg,FC85A9D28D41483AA7D0988C1E99753C
2022-09-17T17:12:35.000Z,Väistyvä Miss Suomi Essi Unkuri kertoo vuodestaan: ”Tämähän on vasta alkua”,Vuoden 2021 missi antaa neuvonsa kisan tuleville voittajille. ,https://img.ilcdn.fi/eujQtL6f7_fRog-8jAX0nVOX1cQ=/510x318/top/img-s3.ilcdn.fi/1ade587db75353d0545bfad4e574466cb2a53b5cb7930973dc106052eceaad6f.jpg,37774CAA113F4CB4833A16FAA89F9D77
2022-09-17T17:16:24.000Z,Kokkolan keskustassa ampumavälikohtaus – poliisi tutkii,Poliisi tutkii Kokkolan keskustassa lauantai-iltana tapahtunutta ampumavälikohtausta.,https://img.ilcdn.fi/Qemt50IeZCNT4M5IVO9PJeoKPOg=/510x318/top/img-s3.ilcdn.fi/663df261a4b69f62ddda2a902039f311cf4acf1b40b7e894de99ff7cf20ed6c6.jpg,1D31A2A80F764D83AB1EF6C354AF2AF9
2022-09-17T17:27:19.000Z,"Roman, 32, luovuttaa spermaa kerran viikossa: ”Suomi tarvitsee vauvoja”","Yrittäjä Roman Serovoi, 32, luovuttaa spermaa kerran viikossa. ”Haluan auttaa lapsettomia ja Suomi tarvitsee lisää vauvoja”, hän sanoo.",https://img.ilcdn.fi/AVqd2SN-QkztoUh3M8a4hI9GUSE=/510x318/top/img-s3.ilcdn.fi/7feee1e145f6f8f9259247da4d6cf6df9eb17688eeacb49ccec61d23632a354a.jpg,763E7DA2B8D84C4BABAA1306873C9DC0
2022-09-17T17:34:05.000Z,"Politiikan puskaradio: Epäuskottavaa, että valtiojohto ei tiennyt Uniper-kaupoista","Politiikan puskaradiossa ihmetellään valtion ylimmän johdon tietämättömyyttä vuonna 2017 tehdyistä Uniper-kaupoista. Nyt kaupat kostautuvat, kun Saksa on aikeissa kansallistaa energiayhtiön.",https://img.ilcdn.fi/9oqQKfhcvnVc4JjE7GC-MTftG7w=/510x318/top/img-s3.ilcdn.fi/c7ece343ba6228a6d1c4a69b226879dce25a3cdb2758e0651fbe2709acf9cf29.jpg,DAA2808C5D9D4EB98609F3D28D61AAAE
2022-09-17T17:42:06.000Z,HIFK:n tähtipuolustaja loukkaantui – Ville Peltoselta suora arvio joukkueen isosta ongelmasta,HIFK:n kahden ottelun viikonloppu Tampereella tuotti helsinkiläisille nolla pistettä. Päävalmentaja Ville Peltonen antoi suorat sanat joukkueensa maalinteon ongelmista.,https://img.ilcdn.fi/it37l4yg06qiIosiHkKFEGYRaUo=/510x318/top/img-s3.ilcdn.fi/c4adc7c771625841faad51b3d9ecf08d0e8006c94ad4c5281598615ce074a4d9.jpg,2FB34109E6C44EA2AEEA9EBF08812786
2022-09-17T17:51:16.000Z,"Pispalan haulitornista tehtiin kaksi base-hyppyä Tampereella – silminnäkijä: ”En olisi ikinä uskonut, että noin matalalta voi hypätä”",Hypyt tapahtuivat puolen yön aikaan perjantain ja lauantain välisenä yönä.,https://img.ilcdn.fi/fkQKcT6cp9oQYUJMx7etaHvaU48=/510x318/top/img-s3.ilcdn.fi/f9cbe590e1212ad0911181f5a72273876a7507a7d2ae7ae1997ec0b1b9222f0a.jpg,598F8140FE1546839C52B348201E59A2
2022-09-17T17:58:19.000Z,Kriisi kytee yhä voimakkaammin Bayern Münchenissä – voitoton putki jatkui tappiolla  ,Bayern München kyntää Bundesliigassa. ,https://img.ilcdn.fi/woMDu1OntTIsoHH2lEEGMs3QipU=/510x318/top/img-s3.ilcdn.fi/3e554c794cb603fb3e52e5ef02772f903c5e8a0e102447fd6ce33cff9c59070a.jpg,43A5AD44B7214BBC9D525499BE657166
2022-09-17T18:00:10.000Z,Kolmas hahmo putosi Masked Singer Suomesta: Fikkarin henkilöllisyys paljastui,Kilpailussa jatkavat ensi viikolla enää yhdeksän hahmoa. ,https://img.ilcdn.fi/g28BcOmeJFFq6qbkB5aXLr9pfPM=/510x318/top/img-s3.ilcdn.fi/18ea9f29ad74d4cd3cb4ed83288e5b118140b2d9d00f5739aba283301a401fce.jpg,7629BD1ED3D84DC9893C654655E7DE2A
2022-09-17T18:04:40.000Z,Massiiviset kalustomenetykset Harkovassa: ”Iso nöyryytys Venäjän armeijalle”,Venäjä on menettänyt valtavan määrän kalustoaan menneen viikon aikana.,https://img.ilcdn.fi/meisvCOvREHv4oYinswX7SJMG1U=/510x318/top/img-s3.ilcdn.fi/5f3f11fcd849889d4b8a971e12c86a9cfbc0716770680a1584a50cc11bbce2ca.jpg,55B8F4637FD84F4DB2158D76703DB36E
2022-09-17T18:13:16.000Z,Sami Helenius tyrmistyy heimolaistensa päätökseen Selviytyjissä: ”Oon ollut vähän liian sinisilmäinen”,Markus Pöyhösen putoaminen edellisessä heimoneuvostossa saa Sami Heleniuksen huolestumaan.,https://img.ilcdn.fi/sDn9hKzkRWVt-sSVUPZU6lV7l24=/510x318/top/img-s3.ilcdn.fi/8a9e8ac2a60989d7f3d40ff673640b6c0b3bb955f5ad7e37d32b73ecae1acdeb.jpg,63FF4507CC144FC48B8BAB7B3F47605C
2022-09-17T18:19:17.000Z,Seppo Fränti näki läheltä Brad Pittin ja Nick Caven – ”Olisin voinut koskettaa kuuluisuutta”,Brad Pitt ja Nick Cave tekivät tänään yllätysesiintymisen Tampereella.,https://img.ilcdn.fi/8IGkYEI8K6bihHUwgfUupfjNeOg=/510x318/top/img-s3.ilcdn.fi/717c9765c4e77d79e951757f9579c063cc296abf68ca3ce6bcb201c0985c0e08.jpg,B5019FF559A743319956497D2C631786
2022-09-17T18:27:18.000Z,Japani valmistautuu ennennäkemättömään hirmumyrskyyn – vuorokauden sadekertymä jopa puoli metriä,Nanmadol-taifuunin uskotaan saavuttavan Japanin eteläisin pääsaari sunnuntaina.,https://img.ilcdn.fi/00-p715VczWiM3eEz2D56KSSFnQ=/510x318/top/img-s3.ilcdn.fi/2cf9428d52ffc9ad1418d77ec42c6e5ba56c1ab1af61847c57029f669623e5a3.jpg,0B745BE290B741D8A16A69A5452C1560
2022-09-17T18:31:33.000Z,"Apulaispormestari Razmyar avaa aihetta, josta nousi kohu: ”Me päättäjät olemme epäonnistuneet”","Nasima Razmyarin mukaan inkluusio ei ole arvona epäonnistunut, mutta päättäjät ovat epäonnistuneet yhdenvertaisen koulun tarjoamisessa kaikille lapsille. ",https://img.ilcdn.fi/sj0L62ZcZZ2VYK4p41kDKGngEno=/510x318/top/img-s3.ilcdn.fi/616eb4c1f699817644afb8bb705251f2c2bf59b9cebfa60d2c5cd9c00b5f1d0f.jpg,A5B3451C20CE45A08A101C4C86AB40F8
2022-09-17T18:41:26.000Z,Vesa-Matti Loiri siunataan Johanneksenkirkossa – tältä rakennus näyttää,Johanneksenkirkko on Suomen suurin kivikirkko.,https://img.ilcdn.fi/GXKz7Okd2-o1Q_RHjyYjekF4fm4=/510x318/top/img-s3.ilcdn.fi/c264d1cfef5df3564865239d8bde359c86409dd78a046d32557c093fe6707c4f.jpg,E19F1CD5356A451F9D506D10BECD6844
2022-09-17T18:57:43.000Z,Dacia yllättää: Esitteli Mad Max -henkisen maasturin,Romanialaista Daciaa ei yleensä mielletä kovin radikaaleja automalleja tuottavaksi valmistajaksi. Olisiko tuuli kääntymässä asian suhteen?,https://img.ilcdn.fi/4DDDtaOZ0p_N2jH8LkopqorCjYg=/510x318/top/img-s3.ilcdn.fi/5c7d1d9a2f1848b2c6dc0510b1214a006e87faf578acd04f09b96726f350c339.png,31928E3CB4DD40988105E8BEBCC4C4D9
2022-09-17T19:06:01.000Z,"Päihdetyöntekijät kertovat ”oudosta vireestä” kadulla – ”Käyttäjät puhuvat, että jotain on liikkeellä”",Kohtaavat päihdetyöntekijät ovat huomanneet uudenlaista levottomuutta ja outoa virettä kadulla niin pääkaupungissa kuin muualla Suomessa.,https://img.ilcdn.fi/4q8o9jmrNCZgMeZYCSx2zANmDcM=/510x318/top/img-s3.ilcdn.fi/59d6f15245f815b7a5d0e7a00eb00f03930643c4d3502458d6f4b1b8045aa6be.jpeg,FBED260CEA3D44EAB4500E05658C19B0
2022-09-17T19:08:36.000Z,"Miehet business-luokassa, naiset tavallisessa – maajoukkueen valintoja ihmetellään Ranskassa",Ranskan pyöräilyliiton toiminta on herättänyt keskustelua Ranskassa.,https://img.ilcdn.fi/g_T0Ni05AbjLddVoaZIUQ_3AfPQ=/510x318/top/img-s3.ilcdn.fi/46c898acecb446cd5f7ca42e1cf806609586d5446dd410f97360b507de609f52.jpg,5ECD657FAC1E4686B054A13F1F6A0BF7
2022-09-17T19:19:03.000Z,Koskettava hetki Elisabetin arkulla – lapsenlapset saapuivat vartioimaan isoäitiään,Kuningattaren arkku pysyy Westminsterissä maanantaiaamuun saakka.,https://img.ilcdn.fi/S8hj10cBJJO5uOO73VqqcZiFzFo=/510x318/top/img-s3.ilcdn.fi/784864106d456d45f8112869a2c2ce439178f2a7217d866e8e234eeee1d79673.jpg,85830B48B10440B28566C4E39C4642E7
2022-09-17T19:26:24.000Z,Petra Hämäläinen on uusi Miss Suomi,Uusi Miss Suomi on kruunattu tänään Helsingissä.,https://img.ilcdn.fi/TJeRcPvWaVjhPqRJqy-Uq6dEJGY=/510x318/top/img-s3.ilcdn.fi/358456e30725cee97e5621f84c3648ae87efcebed840383f3b066a309a8247cb.jpg,FEB178F29FEB4680985AF1B916D4ED40
2022-09-17T19:51:55.000Z,"Hiihdossa historiallinen muutos – Therese Johaug ärähti: ”Kuuntelin vuosia, että pilasin lajin”",Therese Johaugin mielestä maastohiihto menee täysin väärään suuntaan. ,https://img.ilcdn.fi/y0gJAj9l0I9nwSDnNYCrHQlpSAI=/510x318/top/img-s3.ilcdn.fi/bd23a1e049bb7bbcfe35e055b3d9fe5234eee4339b318b5397bd4929dfab6e5b.jpg,7C767B630A764849AA675C4538DA13A1
2022-09-17T20:10:52.000Z,"Ukrainan sota, päivä 206: Venäjän reservien riittävyys epäilyttää,  Biden varoittaa Putinia kemiallisista aseista",Tähän juttuun on koottu Venäjän hyökkäyssodan tärkeimmät tapahtumat lauantailta.,https://img.ilcdn.fi/QyROwszi-z9KjnVTuhT7A97HoLQ=/510x318/top/img-s3.ilcdn.fi/085879b0cad197bbad73d2da1773001cb5b9bb6733595975071324498d575f91.jpg,E919876D77B64EC1B213B02B412DAE0A
2022-09-17T20:19:56.000Z,Halla-aho: Tätä Venäjän hajoaminen edellyttäisi,"Eduskunnan ulkoasiainvaliokunnan puheenjohtaja, kansanedustaja Jussi Halla-aho (ps) ei näe merkkejä Venäjän hajoamisesta. Hän muistuttaa, että hävityillä sodilla on kuitenkin ollut vaikutuksensa Venäjän kehitykseen.",https://img.ilcdn.fi/DiPk_wrDBLPdEs1XGyPdz-oeC_o=/510x318/top/img-s3.ilcdn.fi/ed79eaa76adb2bf85e73ddb948b320f0efae35b1e3e04846cff1291a2c4bc8b7.jpg,DB5D1BE4E6E641B4835D8BF6144232F2
2022-09-17T20:21:23.000Z,Umpirakastuneet Jutta ja Juha Larm kuvattiin missikisojen punaisella matolla - kertovat  suhteensa salaisuuden olevan yksinkertainen,Pariskunta on saanut runsaasti kiitosta erityisesti positiivisesta elämänasenteestaan. ,https://img.ilcdn.fi/NqQW9ErfuET63YXhJ_Xx2gd859I=/510x318/top/img-s3.ilcdn.fi/d48aee7e2847dd7fda6acc0c26f5170880c3892ce54cb21d741380585ebcbc48.jpg,D4CE9151C6034D2AA314BA211D8BADB8
2022-09-17T20:30:06.000Z,"Kaikkien aikojen suurin lottovoitto Itä-Suomeen – 15,8 miljoonaa euroa",Loton kierroksella 37/2022 arvottiin sen historian suurin voittopotti. ,https://img.ilcdn.fi/kF-9ZaAMnFw6siKT7UY-NIdfOe8=/510x318/top/img-s3.ilcdn.fi/b49b9e8c96aed1e6ee646e91f2ed5a355be5202e38babff64df55c9c306f8c27.jpeg,3184CAC66E5A4297A43C009E672A1B4C
2022-09-17T20:43:27.000Z,Miss Suomi Petra Hämäläisestä kohistiin jo vuonna 2016 – ”Odotan paljon uusia mahdollisuuksia”,"Miss Suomi Petra Hämäläisellä, 26, on vahva mallitausta. Voittohaastattelussaan hän kertoo, millaisista töistä hän haaveilee.",https://img.ilcdn.fi/_e82o4l09EFQvOioCs8ue4RZYvU=/510x318/top/img-s3.ilcdn.fi/06cbbb245d6a9c4ce87d60bf4223778192462b6a13a04012e93411965033a3bb.jpg,51684733773F48C28E74CAD0B8A09BE0
2022-09-17T23:25:34.000Z,Gepardi halutaan palauttaa osaksi Intian luontoa ,"Intiaan on vapautettu onnistuneesti kahdeksan gepardia. Aiemmin gepardeja tavattiin laajalti, mutta laji hävisi Intian luonnosta yli 75 vuotta sitten.",https://img.ilcdn.fi/TPu2ZQSBi0udziEsspgM9BmLqYU=/510x318/top/img-s3.ilcdn.fi/cfed5b5724c9a3f721111fe6d21b6e662a05a65eab4ffdd5966d98561c8b5972.jpg,33DE612E993F4AB2A26CD9874F43E2F5
2022-09-18T00:54:38.000Z,Matalapaine jatkuu – sadekuuroja koko maahan,Sunnuntaina sadekuurojen mahdollisuus on korkea koko maassa.,https://img.ilcdn.fi/LHDk4LA3sxu8RxiTLbA4tgdR2wA=/510x318/top/img-s3.ilcdn.fi/96b00ff2577cb40fad977aa96ad78ab88a46a3c14bee29c14867dfa9ef36cb1d.jpg,178C2FD0D8B04426BF450EC76047F707
2022-09-18T01:55:14.000Z,Iranilaisnaiset paljastavat päänsä Mahsa Aminin muistolle,"Laajat protestit ovat levinneet Iranissa perjantaina kuolleen Masha Aminin muistolle. Amini kuoli sen jälkeen, kun maan moraalipoliisi pidätti hänet.",https://img.ilcdn.fi/5yVGuozzXeCE1dkQxl1ANSRxo0w=/510x318/top/img-s3.ilcdn.fi/6aef63e0fb4781d1446855532017a412619fb59ed7bb40d836f2c63b48a25000.jpg,06AFD2C9CD1142E9803107A32C2EBA38
2022-09-18T02:52:57.000Z,Yölliset kokoontumisajot työllisti poliisia – aivan järjetön kokonaissaldo ,Kokoontumisajoja järjestettiin Lounais-Suomessa lauantain ja sunnuntain välisenä yönä. Sadat osallistujat työllistivät poliisia roimasti.,https://img.ilcdn.fi/aoYZWTGEaMKG1VCVY7ytAlhlxDI=/510x318/top/img-s3.ilcdn.fi/867bade2e03f5bd926fe2e5228570b5f1415d5a97b9412ae25c9f1ecdf895b81.jpg,C67F6ECDC3D54EDC84C7255EA491ED4E
2022-09-18T02:57:32.000Z,Kovan onnen laiva,Ennen puoltapäivää ihmiset shoppailivat Sally Albatrossin tax freessa normaalisti. Muutaman tunnin kuluttua tavaroita alkoi pudota hyllyltä ja baarin pulloja meni rikki. Sitten risteilyvieraita alettiin evakuoida.,https://img.ilcdn.fi/eqZSGfNpFRlNjDdi670UDgddQyI=/0x24:744x489/510x318/top/img-s3.ilcdn.fi/c1c63166f43768543c3b56f0b0035e6b29d880949c4612e67b600ffe2f2e1f9d.png,AC2235FC82DE4FEC965E64EBE93B38E0
2022-09-18T03:00:44.000Z,90 päivää morsiamena -parilla on valtava ikäero: Sam on naisystävänsä lapsia nuorempi,Pat on 68-vuotias ja Sam häntä noin 40 vuotta nuorempi.,https://img.ilcdn.fi/zgCX3lnXuFg09uhI-TYcfx_Ry3Y=/510x318/top/img-s3.ilcdn.fi/1ce14f2039d313afcc654cd2ea24abadb9fe9a1a35c59f3ac135e721e9878b89.jpg,1388C1769068430BA20B775E91B1B5CA
2022-09-18T03:30:38.000Z,Meinasitko kehua kaverin laihtunutta olemusta? Se voi olla vakava virhe,"Syömishäiriöstä kärsivän kilot eivät ole se asia, josta kannattaa puhua.",https://img.ilcdn.fi/1U_20qFdLFggYsJUVZoYx46sXd8=/510x318/top/img-s3.ilcdn.fi/a302c338efb55d77aea1240ed47ca899f1e14877d53241ba0741298a577bdcac.jpg,1D52BA62192244F1847D47FF63A642A5
2022-09-18T04:00:00.000Z,Hakudata paljastaa: nämä kokkausvälineet ja tunnelmavalot halutaan nyt omaan kotiin – ota talteen vinkit ja säästä,Syksy on innostanut suomalaiset kokkaamaan ja pelaamaan kotoisissa tunnelmissa. Hintavertailupalvelu Hintaoppaan vinkkien avulla voit säästää kokkausvälineissä tai kotiteattereissa suuriakin summia.,https://img.ilcdn.fi/bYFAvI50qxFgZze8hyDDgzXR3QM=/510x318/top/img-s3.ilcdn.fi/57b378abbe54af0744e4c7bee2da7951e3f1ab885c10d2ef07f0701b5c2c2755.jpg,FD9641751CAC4F9EA906DF04041E22EF
2022-09-18T04:00:34.000Z,Peräaukon murskaamolle oikeuden lupa – kunnanjohtaja pitää ehtoja tiukkoina,Hallinto-oikeus myönsi luvan Peräaukon murskaamolle Joutsassa. Kunnanjohtajan mukaan tontin nimi on maanomistajan keksimä.,https://img.ilcdn.fi/olWfHhE0N7-mQR_RysKSFtMTToY=/510x318/top/img-s3.ilcdn.fi/d19b1b64a1368f4c7e226bc5774d1e83bbbd90f7a69610bead9c53e6221fadf8.jpg,37ED1711423B4314984CC4BD546D4A6C
2022-09-18T04:04:19.000Z,Pekka Jormakka haluaa Jokerit Liigaan: ”Uutta sytykettä”,Laitahyökkääjä pelasi Jokereissa neljän kauden ajan.,https://img.ilcdn.fi/OWcYq6_HCQiz9k8TKVqXz_PXv2U=/510x318/top/img-s3.ilcdn.fi/068bfe6cd840dbd8978ecb828a886eed21660e299ce5ff3e6d2b693ed7e3294c.jpg,69ABC0FD52994B9F9C2CE394DF7BE124
2022-09-18T04:15:00.000Z,"""Olisinpa tajunnut tämän aiemmin"" - Näin tamperelainen Mikko, 33, säästää 350 euroa kuukaudessa","Tamperelainen Mikko, 33, päätti toteuttaa pitkään hautuneen suunnitelmansa ja vaihtoi auton sähköpyörään.",https://img.ilcdn.fi/GVA_No5DbhLJogqa6-caPD1Jk54=/510x318/top/img-s3.ilcdn.fi/8593442c3a6d5ecd197f943741b04079de47677bccb0e493a5a651b282df1375.jpg,50390115C84E4F7D81B65DC9A0D8CFFC
2022-09-18T04:30:04.000Z,Hamstrasitko AdBlueta? Saattoi olla virhe – riskinä auton vaurioituminen,"Iskikö viime keväänä paniikki, ja ostit yksityiskäyttöön 20 litran tonkan AdBlue-nestettä? Se saattoi olla vikatikki.",https://img.ilcdn.fi/Fp4VDMMZXPcmRys5BP3rHIJa-7I=/510x318/top/img-s3.ilcdn.fi/c9a9bebe2582c66feabaf4b7529b6479367a7dc715ae36c9f8e1087e19f4dd87.jpg,36AE9090114E48B29D85BD6A2E807682
2022-09-18T04:37:55.000Z,Viraalivideo: Vauvan mielestä bataatti on hauskin asia ikinä,Äidin somessa julkaisema video on kerännyt lähes 20 miljoonaa katselua.,https://img.ilcdn.fi/rYpdo8ARfXVWhRV3Q0lsFZFCho4=/510x318/top/img-s3.ilcdn.fi/a5a48c1b1a7871cd59c70263dd65823e954e2d88aa2e78833fcad42f1a9a2fa0.jpg,D289B522334A4952A76D31A9068895D1
2022-09-18T05:00:57.000Z,Raportti: Kiinan ja Venäjän armeijoilla sama heikkous,"Kiinan armeijalla on yhteinen heikkous Venäjän armeijan kanssa, tuore raportti toteaa.",https://img.ilcdn.fi/ZA4vVzOhZmUfF9ahNdVRw_rrsR4=/510x318/top/img-s3.ilcdn.fi/a76a6da650a8809ebf56dfdf07c831b62e5fcbbbd2667729c71f458f7291156d.jpg,90B86322C9EE4BA6919E4322C0701D94
2022-09-18T05:01:08.000Z,Deontay Wilder jakoi upeita sanoja Robert Heleniukselle – suomalaisen viimeinen kommentti sai tyrmäyskoneen nauramaan,Robert Helenius kertoi vievänsä suomalaisen sisun Yhdysvaltoihin.,https://img.ilcdn.fi/KO7LGiFQ7fnPpI2ua-lpfKfsOPs=/510x318/top/img-s3.ilcdn.fi/12295c0c0d4abf716b1eda6e9bd00cf14e074c05c78eccc4786ace673f7d8813.jpg,E9D1FB9BF1AF43D2AAF4F1A0F30996FE
2022-09-18T05:30:46.000Z,Ensitreffit alttarilla: yhden parin häämatkalla hermot kiristyvät – ”Ei tunnepuolella ole oikein mitään tapahtunut”,Sallan ja Laurin häämatkalla hermot kiristyvät.,https://img.ilcdn.fi/W0VndHj0BGnZv8U-sdhr19u5N4Q=/510x318/top/img-s3.ilcdn.fi/a3ef11cfbd866041481595cd8a78b28d89f4a78435adeff130e103d922735a48.jpg,ACEFF53E11EE4059A197F8ECB686AB1B
2022-09-18T06:00:49.000Z,Eläinaktivisti kritisoi kärsivän turkisalan tekohengittämistä: ”Voivatko tämän selvemmin markkinat puhua?”,"Mia Takula sanoo, että kuolevan alan keinotekoinen ""tekohengittäminen” on epäeettistä myös tarhaajia kohtaan.",https://img.ilcdn.fi/GIzBeu3ZbjviIlZm213lCs9uzw0=/510x318/top/img-s3.ilcdn.fi/3bde09cd6f8f3f67bd3faf906f74d29295e279f95dca46e8f99b16bfb20a4481.jpg,DFB522A1D76F4759B91B0479E500C713
2022-09-18T06:01:51.000Z,Huippu-urheilijan harjoitukset päättyivät odottamattomaan painiin hylkeen kanssa – ”Ajattelin vain selviytymistä”,"Vasco Vilaça pelästytti hylkeen, joka äityi aggressiiviseksi.",https://img.ilcdn.fi/zSNMmESDiooZBfO-jS2KV_96Lpk=/510x318/top/img-s3.ilcdn.fi/8abaadeb0df270119ffc3789b758b4e4ce1dd0ef6f9c1849d6a36a5cc01ff3f6.jpg,2A0A0E35700145688B2CD5A2E25E2D9C
2022-09-18T06:17:38.000Z,Kuningas Charles III voitti kansan sympatiat – löysi vihdoin onnen rakastamansa naisen rinnalla,Kuninkaallisasiantuntija analysoi Charlesin tulevaa valtakautta ja suosiota.,https://img.ilcdn.fi/0TB8-ozEtCVJ_W02lDn8UQLFMn8=/510x318/top/img-s3.ilcdn.fi/26a11d1b6385e1c6d1f622740a942c659a0244795dd1ed9780db091e1a338f50.jpg,965D4B753EE14598B1603A88B4C940CF
2022-09-18T06:19:23.000Z,"Siilinjärven R-kioskin yrittäjä Heli Kärkkäinen, voititko lotossa lähes 16 miljoonaa euroa?","Suomen historian suurin voittosumma, 15,8 miljoonan euron lottopotti osui siilinjärveläiselle voittajalle.",https://img.ilcdn.fi/kF-9ZaAMnFw6siKT7UY-NIdfOe8=/510x318/top/img-s3.ilcdn.fi/b49b9e8c96aed1e6ee646e91f2ed5a355be5202e38babff64df55c9c306f8c27.jpeg,98B4234CC1014B68B872676D58234A40
2022-09-18T06:38:30.000Z,Putinin kokki puolustaa sotilaiden värväämistä vankiloista: ”Joko vangit tai teidän lapsenne – päättäkää itse”,Palkka-armeija Wagneriin haalitaan sotilaita vankiloista.,https://img.ilcdn.fi/v3DR6kSpauczKgYx236bNjPnu24=/510x318/top/img-s3.ilcdn.fi/0b987f2bf8768f87a9411c8d7f5e95c2f2b667e912facb75aaccc1ee2861572a.jpg,4B2CDBB1007044518EE8889BAEA89A4A
2022-09-18T06:49:12.000Z,Canelo Alvarez vei nimiinsä nyrkkeilytrilogian viimeisen osan – riitapukarit kunnioittivat upeasti toisiaan,Canelo Alvarezin ja Gennadi Golovkinin taistelu sai kunniakkaan päätöksen.,https://img.ilcdn.fi/ZiQhkXPdovtp_KXe0vLYS00SnKA=/510x318/top/img-s3.ilcdn.fi/01ef9bff0d159b3cb35b2fb1f5d6f369a4fbbaef0041a79ba6659685c9c5c564.jpg,BD60FC0A900540E297F7E0E8032BDC14
2022-09-18T06:50:23.000Z,Tällaista raskaustyyliä et ole vielä nähnyt,Ajankohtaisin tapa esitellä raskauttaan on nyt vilauttaa koko mahaa.,https://img.ilcdn.fi/0QggwzexwkJj6Zg8jbwgnSUhFB8=/510x318/top/img-s3.ilcdn.fi/bbea59c5535cf97954f8126022b32c9c7a2a365887a1e34e6410417ea5c193c3.jpg,C8DD5D3025AD48D88301689BF8D669D4
2022-09-18T06:52:14.000Z,Huomasitko? Masked Singer -hahmon puku petti kesken esityksen,Party Animalin häntä putosi kesken esityksen.,https://img.ilcdn.fi/QyEj3ZMHCT6RBg8N8gJslsnfrbY=/510x318/top/img-s3.ilcdn.fi/bddde63ac9221d2322a46128f0a36390d65d43bf2030446cd780ec20607c60fd.jpg,B7E7C81ADD724EEDB180F12C7763D66A
2022-09-18T07:00:10.000Z,"”Äiti, meidän koti palaa”","”Äiti, meidän koti palaa”, toimittaja Linda Rantasen poika huusi paniikissa puhelimeen. Ne olivat kauheimmat sanat, jotka äiti voi kuulla, kun 7-vuotias on yksin kotona. Rantanen ajoi kotiin niin nopeasti kuin pystyi.",https://img.ilcdn.fi/_I2YeCiK-fDcCmrI9dtvnDbIWX8=/510x318/top/img-s3.ilcdn.fi/8a52fd63e6316a24497e913933af3f7691e1d585a9853accb2f3fb916f6ea7fb.png,40738CA28FA640E899E1EF501A2FB31A
2022-09-18T07:00:28.000Z,Pienkoneet törmäsivät ilmassa USA:ssa – kolme ihmistä kuoli,Onnettomuus tapahtui Coloradon osavaltiossa.,https://img.ilcdn.fi/EkUKhbqTau40UTmh25IQgAJIEfs=/510x318/top/img-s3.ilcdn.fi/ca358833818fbb873252cfb4d4aa29ce4e181c88b6c7103276f93579e4624807.jpg,2AF2E503D14143BE8074800C419B5781
2022-09-18T07:31:49.000Z,Yle: Venäjä rokottaa omaa ilmapuolustustaan Pietarissa sodan takia,"Ylen mukaan sen hankkimista satelliittikuvista käy ilmi, että Pietarissa sijaitsevasta tukikohdasta on siirretty runsaasti ohjuksia Ukrainaan.",https://img.ilcdn.fi/TDAsUanzQHu0IthXDV2j8RGEfl4=/510x318/top/img-s3.ilcdn.fi/a2156274b08b06fbf96c43608cceb9b5ffa37b6fe604afa12aaee2dcf50eff0d.jpg,D3C4D777E827461FB097C112FF5217CB
2022-09-18T07:36:58.000Z,Voimakas maanjäristys iski Taiwaniin – tsunamivaroitus annettu,Maanjäristyksen mahdollisista tuhoista ei vielä ole tietoa.,https://img.ilcdn.fi/w8bBLfOjoEZG-hDZS9L3jAAwVNk=/510x318/top/img-s3.ilcdn.fi/9385b78fe15192336564bab0007f1cda7807d13b6cf4b878be4f95d00fe384bb.jpg,5776F583ECD846A3B32D8F375CE2E138
2022-09-18T07:40:07.000Z,Orgiat liiton rahoilla? Espanjan futispomoa koskevasta tutkinnasta paljastui kova väite,Espanjan jalkapalloliitto joutui kohuväitteiden kohteeksi.,https://img.ilcdn.fi/r6y7x1gZDKswUV_5lngc96JOqS0=/510x318/top/img-s3.ilcdn.fi/e130ef4756e830e54e5cd820e7ebe08074e26db2c5a196274073e6daa95df283.jpg,3EA0B8BBA67F46C895E03350BC330588
2022-09-18T07:46:52.000Z,BB-asukkaat romanssihuhujen pyörteissä: ”Se katsoi silleen vau”,Asukkaat innostuivat spekuloimaan Aleksin ja Merven suhdetta.,https://img.ilcdn.fi/mdoMctJjeuCUlliain2DGolfxKM=/510x318/top/img-s3.ilcdn.fi/fbd2b81cf2cd4d27f59fdffb7527ede002fedc402cad7a528614af53e4575de9.jpg,FCA9724FECDF4189A02EC75ECC970691
2022-09-18T08:09:17.000Z,Sankaripoliisi pelasti vanhan pariskunnan läpi liekkien Kaliforniassa,Valtavat metsäpalot piinaavat taas Kaliforniaa.,https://img.ilcdn.fi/aqfBmD9l7cfZWfQWJgQECA22UP4=/510x318/top/img-s3.ilcdn.fi/d02f52ff47bafc6153502fa2ab94b3f8f4a352ff3db2a2614de5d299f3277735.jpg,EFC5247DDA6B46B49B74E69A448CC297
2022-09-18T08:28:07.000Z,Näin Niinistö ja Haukio kunnioittavat kuningatar Elisabetin muistoa – Suomen vuoro arkulla noin kello 15,Presidentti Sauli Niinistö ja rouva Jenni Haukio vierailevat kuningatar Elisabetin arkulla sunnuntaina iltapäivällä.,https://img.ilcdn.fi/3-GhcFCAvwQhCLPKiYV0HOT7jkI=/510x318/top/img-s3.ilcdn.fi/557e78b0b973f4786f9d6a464764ae8d6b8842bcff6fd270417a612943af8344.jpg,8FD4513E84234D77989A7533F5861175
2022-09-18T08:30:26.000Z,"Heidi tietää, kuka ajaa hänen bemarillaan – silti hän ei saa sitä koskaan takaisin, vaan joutuu maksamaan kymppitonneja","Huijarifirma vei Heidin auton ja myi sen heti eteenpäin, seurauksena useiden kymmenien tuhansien eurojen menetykset.",https://img.ilcdn.fi/jOHLm-oas7tN0LV2JEaO17FJq84=/510x318/top/img-s3.ilcdn.fi/cfdc00068a4b708e779ccf78b2b885bce831e4dac5dd719a72f6f404587696e0.jpg,25F4B94BF6CF488BAE10E6EE149D0BEF
