paivamaara,otsikko,tiivistelma,kuva,id
2025-07-21T15:49:13.000Z,Nauroitko Coldplay-keikan pettämiskohulle? Ole tarkkana!,"Internetissä ihmiset ottavat helposti totena sellaisia asioita, jotka eivät välttämättä pidä lainkaan paikkaansa. Siksi mediakriittisyys kannattaa pitää mielessä myös kevyemmältä tuntuvassa sisällössä, kirjoittaa Iltalehden toimittaja Niilo Helminen. ",https://img.ilcdn.fi/xrH7iDH99ygho1jAof0BUcE16eA=/510x318/top/img-s3.ilcdn.fi/976fd660a24728df1db7907ead832a0bb228e495ef0e6da64d83ad3eddb9c6eb.jpg,17091E88B8A349558017696C2CA3C1A7
2025-07-21T16:08:56.000Z,Koira puri vauvan kuoliaaksi – Asiantuntija: Tällaiset rodut useimmiten aggressiivisia,Koirankouluttaja Jenny Jalosen mukaan lapsen kimppuun käyminen ei automaattisesti kerro koiran luonneviasta.,https://img.ilcdn.fi/K4jQrAIctbF56q-M4vdKZyx71Y0=/510x318/top/img-s3.ilcdn.fi/c03b171200a3cf6db73655b719cbd69361f5fdb669f90ca8dc87c04b9e0ae6e6.jpg,E8715AE19002430C8B467D86BCE5F8E7
2025-07-21T16:21:29.000Z,Sauli Niinistöltä paljastus Aaro-pojasta,Sauli Niinistö kertoi kesäkuulumisiaan tennistapahtumassa.,https://img.ilcdn.fi/57ds_O8O1a-RcPi5BmtYeFDVDlI=/510x318/top/img-s3.ilcdn.fi/17ccd0c1595b026f3045f6264de5dfe60daad475b9c059b7b1fbd55c861aa36a.jpg,EA2DA7DC8AE54448AF794E5A8E8B0164
2025-07-21T16:31:01.000Z,Paavo Väyrynen odotti turhaan toimittajia,Paavo Väyrynen yrittää samaa temppua kuin 10 vuotta sitten.,https://img.ilcdn.fi/g1XmvOe_EQbgqO9JftH3Qjyvxak=/510x318/top/img-s3.ilcdn.fi/8ff638dd2c04a3d816399530d6286ed0173129b50a7a719d8904d568289a0463.jpg,6CB7288593AC4E49BFAEDEAAB0BDD6FF
2025-07-21T16:36:40.000Z,Turun aurinko kutisti Riian kengät,"Riia Ruottu vietti kesäpäivää Ruissalon rannalla. Lähtiessään hän huomasi, etteivät sandaalit enää mahtuneetkaan jalkaan. Hänen mukaansa erityisesti sandaalien materiaali ja väri reagoivat auringon kuumuuteen herkästi.",https://img.ilcdn.fi/8uLyXf-qxbI5dE6Xb1AqtaJiqUo=/510x318/top/img-s3.ilcdn.fi/216fdcb26081827c27d3a9f5e7fb95542dc910a0711dfd23eabb27c6e1bc857d.jpg,65625233BE3646118CCCE5FC2E47C9CB
2025-07-21T16:39:34.000Z,Renaultin takakontista löytyy todellinen autoinsinöörien neronleimaus,"Renault 4:n irrotettava muovilokero on helppo puhdistaa, joten se soveltuu mainiosti likaisten esineiden tai vaatteiden säilytykseen. ",https://img.ilcdn.fi/Lz6VcHrv7bkiehnEi66QwIkuQFc=/510x318/top/img-s3.ilcdn.fi/31f3c93379cd9692d251713b894de456785f2a17ae2b1c6d5da8d3061ac5861c.jpg,F9A6D94BED5447709D4E039500C6129A
2025-07-21T16:42:14.000Z,Salaliittokohu Yhdysvalloissa: Trump jakoi videon Obaman ”pidätyksestä”,Yhdysvaltain tiedustelujohtajan Tulsi Gabbardin mukaan presidentti Barack Obaman aikakaudella luotu ”salaliitto” loi perustan ”vuosia kestäneelle vallankaappausyritykselle”.,https://img.ilcdn.fi/77OIyDdmDcOMx9_o7cJ2yOEfRNw=/510x318/top/img-s3.ilcdn.fi/d7cb756af3b66d180dd576e96dacc9f16e6142d30fa9294773dd41555e4f1259.jpg,6DE510FCEC3747A3A9931FCCB0CCEE82
2025-07-21T16:58:26.000Z,Prinssi Harry ja Meghan jälleen pilkan kohteena,Prinssi Harry ja hänen vaimonsa Meghan ovat jälleen pilkan kohteena.,https://img.ilcdn.fi/d1UCf8ux0ydq9DD7swmioPYMRWA=/510x318/top/img-s3.ilcdn.fi/525bb252182b6fff18e7afc1bdd4dea36c263848cd1b30ba76b7be4c4f8ed82b.jpg,9809BF00F552481291045EB97E8AAC91
2025-07-21T17:07:20.000Z,”Ei tänne nukkumaan tultu”,"Joka vuosi joukko suomalaisia kerääntyy tähän tiettyyn metsään Etelä-Savossa. Ville, Ella ja muut osallistujat kertovat nyt yksityiskohdista. ”Jengiä tulee kurkkimaan.” ",https://img.ilcdn.fi/mOk32yjJCVGgR2eCDew0mdwUVV0=/510x318/top/img-s3.ilcdn.fi/85fef1a14ad51eda2f437b52a26a889c0cf4f4241c1bdc98ed353d46d8d9bec6.jpg,CA6F1161121047238A88394928B71439
2025-07-21T17:12:47.000Z,”Tokmanniin iski ahneus” – Kyösti Kakkonen lataa täyslaidallisen,Kyösti Kakkonen: ”Tokmannin hinnat ovat nousseet paljon.”,https://img.ilcdn.fi/OesvEE7iEHJWHBddAddt2Lqv4nc=/510x318/top/img-s3.ilcdn.fi/4f3d95523ff4b55e5f02613e745d65096d44c9e4af9b4f3d739ef016cc8b9703.jpg,CC87BF86481340F7935C6BA8CD076503
2025-07-21T17:16:17.000Z,NHL:n monitoimimies Wayne Thomas on kuollut,Wayne Thomas kuoli syöpään.,https://img.ilcdn.fi/bo0cEl7bJV4eaDYGJB6JKFfyqZw=/510x318/top/img-s3.ilcdn.fi/f9b4957287b6da32280aebc187452a1a6b4fb2d37fe658cbdcaf7a8e45a3c7f2.jpg,040CF5F9283E4A2AB10A050D9BC8EE96
2025-07-21T17:26:37.000Z,Ahvenanmaalla pisteet jakoon,IFK Mariehamn ja Valkeakosken Haka olivat vastakkain Veikkausliigan maanantain ainoassa ottelussa.,https://img.ilcdn.fi/mFk_eX5gZCdpYIo1qd5qVcb8qJA=/510x318/top/img-s3.ilcdn.fi/13a60cbc81f98ebd1d46506ebbf4b5c47954198050199b5d3691bbb63766416f.jpg,91A4849739034FEBAC36AE1BC7FCA069
2025-07-21T17:35:25.000Z,Asiantuntija: Tämän takia tiejyrä voi tappaa – ”Einstein jo sen aikoinaan sanoi”,"Työturvallisuuskeskuksen Eero Honka kertoo, että tietyömaiden työturvallisuus on parantunut vuosien aikana.",https://img.ilcdn.fi/6eyBkTmTiYkyGTuO3rpiSQ851TY=/510x318/top/img-s3.ilcdn.fi/5badb60f10c45fa56ca0e54f330db6d8449015a15b35bfbb9571a3f5dd6bc53d.jpg,38C07C9D8B9A4E39BA2F7A77FDA64A2A
2025-07-21T17:37:57.000Z,Bussikuskia yritettiin puukottaa Kirkkonummella,Poliisi otti kiinni teosta epäillyn henkilön. ,https://img.ilcdn.fi/Hq4fQ4F8WfG8cGE1WbuCMXeFSEU=/510x318/top/img-s3.ilcdn.fi/c7aedd36b05ea9e1e8c490d7db03204eb45a9786bb668803f4a3bfebfcc324c2.jpg,159B70B80B13495C9412319F3A96AD2A
2025-07-21T18:02:37.000Z,Suru-uutinen SM-liigasta: Rakastettu ääni on poissa,Tapani Miettinen työskenteli KalPan kotiotteluiden kuuluttajana lähes kahden vuosikymmenen ajan.,https://img.ilcdn.fi/X4jf3u5Ow33tJUCgXSClClER3L4=/510x318/top/img-s3.ilcdn.fi/30314394766871b1c227f0f09abacc86446e6561d990000159d8fc539802fbbc.jpg,4E33DD123DF04A1B8AEF8BF00A7DA0A9
2025-07-21T18:06:23.000Z,Nainen heräsi ahdistavaan tilanteeseen – Miehen toimet eivät kestäneet päivänvaloa,"Mies ajatteli, että nukkuvaa naista saa kosketella. Käräjäoikeus tyrmäsi miehen perustelut.",https://img.ilcdn.fi/JL9jQUfA9-pyT7WyX4O1tTLXcAM=/510x318/top/img-s3.ilcdn.fi/a15b12d4fbbe1e2c0cb8e082c63017d8dfe3a11937dc35448ba10863c6a82bcb.jpg,F2FF0EF5640A4C3C9E97D59537F2403F
2025-07-21T18:12:40.000Z,Kalareissu päättyi onnettomasti Inarissa – Mökki oli palanut,Mökki tuhoutui täysin.,https://img.ilcdn.fi/WI20jbw6k3vIGVpClWWzzus0TBI=/0x64:2625x1683/510x318/top/img-s3.ilcdn.fi/17abd1f3caacfa1a06ebc82c578c97224cc056dce53409f9c9313f08968b9113.jpg,CB029D56DD9A48B08EAA72D4A9E6B5A5
2025-07-21T18:15:45.000Z,"Palomestari kätteli miestä, joka todennäköisesti pelasti kahden ihmisen hengen – ”Erittäin kova suoritus”",Kaksi nuorta miestä joutui vaaraan Oulussa.,https://img.ilcdn.fi/B5Xg6TNc_F322iSnlCGUlNvMD5c=/510x318/top/img-s3.ilcdn.fi/0a3fce7edc998a7840f207fa403dab806520ccb23a21ce27da58607788c35db1.jpg,143208BAA64D43B1998E1E32210BF331
2025-07-21T18:17:26.000Z,Järkyttävä ilmiö: Jätkäsaaren kuolleista nuorista inhottavia puheita,Kaksi 15-vuotiasta tyttöä kuoli viikonloppuna Helsingin Jätkäsaaressa. Surullinen tapaus sai pimeän käänteen verkossa.,https://img.ilcdn.fi/aayLqBIceIqlZh2rb_ZkPQx2gE0=/510x318/top/img-s3.ilcdn.fi/9b0d218326048a0631819839997220d253aa235c14c28dbf17338e2007466480.jpg,35F643DE0FCC477991DA82F9E3B01C3C
2025-07-21T18:29:43.000Z,HIFK: Rikosilmoitus,HIFK:n pelaaja on joutunut uhkaavaan tilanteeseen vapaa-ajallaan.,https://img.ilcdn.fi/yQq0YPDa0AMCmUWnakb6C-jktqM=/510x318/top/img-s3.ilcdn.fi/9a3c341aac32e160e03c7d950884eaac75d8a630d1ff43093467ac77baae57c8.jpg,76A7E7CBC42F4738B8EEAF5D94366E1D
2025-07-21T18:39:42.000Z,Teemu Laurell ja Mirella Merivirta: Vauva,Mirella Merivirta kertoo asiasta Instagramissa.,https://img.ilcdn.fi/3LAiEVf7C-fWOUBiGbeZDv2Y5KA=/510x318/top/img-s3.ilcdn.fi/c52194eea10d47ac86b5f3881b0922ba3bed8fa72b1719841b27274adbc7f315.jpg,7142448E281D426DA707AA05079162EE
2025-07-21T18:41:24.000Z,Hurja pako poliisiautosta päätyi videolle – Ei mikään normijuttu,"Poliisi kertoo, että tarve vahvistaa poliisin takaikkuna tunnistettiin jo 2016–2017.",https://img.ilcdn.fi/EoVUTi2CIJI7PO5eu08aGpuVh5s=/510x318/top/img-s3.ilcdn.fi/bb2afdadc67c879ac1ee4244069a73c5bed4d25c8b6c30ebc71f4d33fafb9ec5.jpg,D192E6C1263443089C0DE578C4DDA1E9
2025-07-21T18:50:12.000Z,Pelaajaa syytetään viidestä raiskauksesta – Valmentaja kommentoi,Mikel Artetan mukaan Arsenal toimi Thomas Parteyn kohdalla oikein.,https://img.ilcdn.fi/ESg-qxNyAdMb9n649jCh6lHLJ6Q=/510x318/top/img-s3.ilcdn.fi/0095a865e7773e2e5742ae952044d80aefbf0c735836a20cc905da8f109ea932.jpg,68B8C1EEA2CD4533A4078CBB786920F9
2025-07-21T19:13:53.000Z,Uudet kuvat: Tässä on Putinin salattu poika,10-vuotiasta Ivania nähdään vain harvoin julkisuudessa.,https://img.ilcdn.fi/f8dbsFYaC70ALEMnxhA8JYGC7oc=/510x318/top/img-s3.ilcdn.fi/00e741ca02ce2908c60fa341a78fb316759bf5e4c5435e6df83fa83e272d2d7c.jpg,E57A7FA61DAC42EB8B454C9952199CA3
2025-07-21T19:17:40.000Z,Suomalaisten entinen NHL-valmentaja olympiajoukkueeseen,Pete DeBoer on nimetty osaksi Kanadan ensi talven olympiajoukkuetta.,https://img.ilcdn.fi/xd4ugBlWHLad_TJSMqdY7c9Y2z8=/510x318/top/img-s3.ilcdn.fi/0528f41e88074c492f5d1b6c32f209afa534949ab406a6ac204a4d3ebb1d75aa.jpg,BB6FF2A8544B48DF9A9D68D1DF99B9EE
2025-07-21T19:24:21.000Z,Suositussa lomakohteessa valehotelli,"Ruotsissa sijaitseva Ikea Hotell on maailman ainoa Ikea-hotelli. Espanjassa Kanariansaarilla sijaitseva hotelli on jotain aivan muuta, mutta sitä on markkinoitu virheellisesti Ikea-hotellina.",https://img.ilcdn.fi/Ysgiok4-gxQnGrf2Hm1rffky95Q=/510x318/top/img-s3.ilcdn.fi/0efcad26c3c1e043ee59da2c1623d7d046285bbaa1b6a05311baf7a134c87459.jpg,64E953D8DFE24B8D9EF765B556C7B3FC
2025-07-21T19:28:57.000Z,Hollywood-tähti hukkui,Warner oli 54-vuotias.,https://img.ilcdn.fi/Od6rq9WUSjk1sBe-4r26_JqyqP8=/510x318/top/img-s3.ilcdn.fi/90f0d3e6b1a4bbb0abc648c1e30840b56a5c15124f2722d4b0d914eebd218f44.jpg,E61E543D79474DA4B15139AD5CCB8837
2025-07-21T19:34:53.000Z,Nuorisoporukka rajussa ulosajossa – Yksi loukkaantunut vakavasti,Yksi nuori loukkaantui vakavasti.,https://img.ilcdn.fi/z27vKQ53oZLNJ9ec3uBqMwzjJ4g=/510x318/top/img-s3.ilcdn.fi/2903c719ca4ce163ab46c00ccca197e74661b8fcd6899b7c557c3269217b5813.png,3AD2B9ECC9EF47529D8DB125742BC664
2025-07-21T19:35:05.000Z,17-vuotias ratakuski kuoli ,Ratamoottoripyöräily koki jo toisen kohtalokkaan onnettomuuden muutaman viikon sisällä. ,https://img.ilcdn.fi/f8wj2kG-n8Djwb0Aum3Chq8NUyQ=/510x318/top/img-s3.ilcdn.fi/3bb2a4d541788e87e970efc92b3347d04bbdd60397726ca363454876646c6a2f.jpg,7768D238B777430494C82420C5371A1B
2025-07-21T19:42:49.000Z,Nyt ei ole Moskovassa mukavaa,Moskovan alueella todistettiin maanantaina sateisinta päivää sitten vuoden 1879.,https://img.ilcdn.fi/vi5PeRU7smznRGEr69obYchlAwA=/510x318/top/img-s3.ilcdn.fi/27c16ee4121730a17784c63af144cd2035f53c658effe61d96cdc12948718925.jpg,9A3C6A03D0AC462B8EFB15F214E7653D
2025-07-21T19:55:48.000Z,Danielle Collins kertoo karmeasta hetkestä – Mies teki ällöttävän teon hänen kasvoilleen,Danielle Collin on paljastanut uransa alkuajoilta inhottavan välikohtauksen.,https://img.ilcdn.fi/0BInV0WYsZCVHVDMxiWvgDq7XJU=/510x318/top/img-s3.ilcdn.fi/ea3404a0a0be76d316bbca36e2ef7d8938f50892acb00afc774aafb797622c34.jpg,EA6088AFECD646FB9AE37D8F8C8A7143
2025-07-21T20:02:22.000Z,FT: USA ei taivu – Asiantuntija arvioi diilin olevan kaukana ,"Financial Times uutisoi, ettei Yhdysvallat ole valmis alentamaan EU:lle tulevia tulleja alle 15–20 prosentin. EK:n Timo Vuori arvioi Ison-Britannian kauppasopimuksen olevan tässä tilanteessa jopa ideaali. ",https://img.ilcdn.fi/6e1dh84pnMMO0HluyfBtBRHJvSQ=/510x318/top/img-s3.ilcdn.fi/dbfb7170033693d7d2061a26ce25874097c7f97dde47b4afe3fcf4f2cdfbc4ed.jpg,F914B18F9AD941C094F94D7B64845178
2025-07-21T20:15:21.000Z,Kokkolassa raju kolari – Kuljettaja lensi ulos autosta,Ensihoito vei kuljettajan sairaalaan.,https://img.ilcdn.fi/OUdjIt5cpbLGBxC0eW6URlMscOY=/510x318/top/img-s3.ilcdn.fi/6b8c61f9d222a71c5749441f5887a4ce0e6f268c0446e80a6bdc1f33d80eeb77.jpg,883DE658BC4840C6A9FE6E3BB41E8321
2025-07-21T20:22:02.000Z,Näitä asioita ei saa kertoa ilmaiselle tekoälylle,"AI Finland -yritysverkoston Iida Lähdemäki kannustaa rohkeampaan tekoälyn käyttöön, mutta muistuttaa tekoälysovelluksiin liittyvistä riskeistä, jotka moni unohtaa.",https://img.ilcdn.fi/75KckE_zsT-yn_60cjiLRt6SLUU=/510x318/top/img-s3.ilcdn.fi/3fba01e359908514a659c1211c60b69574d0a3ce191e5bd806de89b297345ca4.jpg,C7BFF3AF634E400382E56821336B6FAB
2025-07-21T20:25:10.000Z,Venäjä teki massiivisen hyökkäyksen: Nato-hävittäjät ilmaan,NULL,https://img.ilcdn.fi/j0Ij8WvnEgfYwUYXsbuO8NmkXmA=/510x318/top/img-s3.ilcdn.fi/7663c05cb39c65a5bcca8dda55871b6e4d7d9a351e2c65ab581229e7201c3eb1.jpg,64DE88DAAD864DF8AA95844D5C9A7149
2025-07-21T22:02:11.000Z,Lentokone törmäsi kouluun – Ainakin 20 kuollut Bangladeshissa,Bangladeshin asevoimien harjoituskone syöksyi maahan teknisen vian vuoksi.,https://img.ilcdn.fi/N_bBARVsydOrZkAX-rY-8iqDvPc=/510x318/top/img-s3.ilcdn.fi/4ece9874cb008ac59e8654a03f18de08f922f65f254dcab8e838ee9cc4b628d3.jpg,B6B9CF96A01D49329DDE01B7EE2FD2FB
2025-07-21T23:01:30.000Z,Horoskooppi,NULL,https://img.ilcdn.fi/jm9wPlnoWFx5jhlXkB6i6JzE1x4=/510x318/top/img-s3.ilcdn.fi/8d5c61e8c61ff106bc8907444720fdd5e3bdfa0bdec71d9ddc943f19d86978bd.jpg,76E4CC1A10014B68BF88906DBE50C909
2025-07-22T01:03:14.000Z,Martin Luther Kingin murhan asiakirjat julkistetaan,"Martin Luther Kingin murhan asiakirjojen julkaisu osui samaan ajankohtaan, kun Trump pyristelee irti Epstein-kohusta.",https://img.ilcdn.fi/jKroy59YPhUoHnMKjeCXqrKTDwI=/510x318/top/img-s3.ilcdn.fi/6a1947c07d4c1065171537c0a4b1d99e9b48e80a4b4ce8ed9ab270da3d63b435.jpg,131ED6B320AD419BA4B6CE9DA419AD8F
2025-07-22T02:19:29.000Z,Tuore kuukausiennuste julki – Nauti helteistä nyt ,Ensi viikolla matalapaineiden reitti kulkee Suomen yli.,https://img.ilcdn.fi/6JwXwVtHLAdiuiTKlCXSGseHtSc=/510x318/top/img-s3.ilcdn.fi/75ef794b0fc13bb7bab2ffe7a4d2c8d9f89dd5e681a970d311bb16b998e5bc06.jpg,A30951233B034ECD98D5AD2FBEF21D04
2025-07-22T02:58:53.000Z,Uudelle uralle,"Kaksitoista entistä kansanedustajaa kertoo Iltalehdelle, minkälaista elämä on ollut eduskunnan tai Euroopan parlamentin jälkeen.",https://img.ilcdn.fi/U8YPvH40y6BgW1xcCeRON1-mLPs=/510x318/top/img-s3.ilcdn.fi/54448e860633addd88498eb2a0228a2a40fee34cacca4a83adf0f734be177f43.jpg,B22628CAE4A74B0C9731553E4383C3FC
2025-07-22T03:01:43.000Z,"Tallinnasta löytyy alue, jonka asukkaat eivät tiedä, minkä maalaisia ovat – Nyt monelta viedään äänioikeus",Viro on tehnyt viime vuosina maan venäläisvähemmistön elämästä hankalampaa. Tänä keväänä vuorossa oli äänioikeuden poistaminen. ,https://img.ilcdn.fi/mhRpRTuPssUgorN2yfb0Fxv1zIE=/510x318/top/img-s3.ilcdn.fi/cea14be85e6b0ff76f22869f9fd94fdb9bda32b31a664eb0c2b79efd5f301a8e.jpg,E67559D0751B416C937A3B094CFEB1A3
2025-07-22T03:07:44.000Z,Teemu Selänne: Merkittävä työuutinen muhii,Teemu Selänne hamuaa takaisin NHL:n pariin. ,https://img.ilcdn.fi/Fn6gkv3hDrFv3o26Ko8QxeDBimg=/510x318/top/img-s3.ilcdn.fi/3a91f57209f98f9ef369118d39389f76d63698b65232cd73968f18a5d1b6b154.jpg,BA0816AFF37F4830B16DFD1B470B0BE1
2025-07-22T03:08:49.000Z,Prinsessa Annen onnettomuudesta paljastui uusi yksityiskohta,Prinsessa Anne joutui viime vuonna onnettomuuteen ja sai sen seurauksena aivotärähdyksen.,https://img.ilcdn.fi/Ab5ZNH7Z8-f2TEC7dWHLIJ-1Ygc=/510x318/top/img-s3.ilcdn.fi/269a2462599109d7939e2a936b26ba2897ee0fcf7a8dac9ce953750024ef8d35.jpg,DC8EE848C8774536A7E675BE8BB2F402
2025-07-22T03:30:39.000Z,Cameron Diaz jätti vuosia sitten Hollywoodin – Tältä hän näyttää nyt,Cameron Diaz on tuttu esimerkiksi ,https://img.ilcdn.fi/2rW6J14rGOZqlzVrQ6f3WvHYwtA=/510x318/top/img-s3.ilcdn.fi/0ada66f02beb210784adfa85d2a55da7f1a5fd0a9a1ba779f4d08b47b3883db7.jpg,752020B583164AD2A2CCCDACA02B130B
2025-07-22T03:34:39.000Z,Mervi Kalliolta melkoista puhetta – ”Kuulostan varmaan ylimieliseltä”,Viaplayn toimittaja on tunnettu urheilullisuudestaan.,https://img.ilcdn.fi/-jWvM4Fhrze3TcsST9nptbFmKSQ=/510x318/top/img-s3.ilcdn.fi/e8c52d5dfa08f7695f7aa4d9d703b8475813018abbfb881ae416141fb7dba56d.jpg,28149D5565C64431AC319ECA527BE7D5
2025-07-22T03:35:28.000Z,Kirkasta kuvaa ilman heijastuksia,Vanha tuttu puute harmittaa. Muuten Samsung S95F on erinomainen televisio. ,https://img.ilcdn.fi/wcNvWSH8JM0d-WbRV8F3bNz0zI8=/68x0:2937x1791/510x318/top/img-s3.ilcdn.fi/21dbcd8633938ee06cf91721ee3ebf55797bed1f571ae383fe9b23341251c764.jpg,0C39DC7BDF1843B1AC27CD9314F8F0D5
2025-07-22T03:53:36.000Z,Kuningattaren tiellä seisoo italialainen muuri,"Englanti on suuri suosikki EM-kisojen ensimmäiseen välierään, mutta läpikävelyä tuskin on luvassa.",https://img.ilcdn.fi/n2Ta60uhffNkX2_Qq1IfFAZScWM=/510x318/top/img-s3.ilcdn.fi/732d2a9edff7806c56edb4c33bbc2f95f8dd28d2216ef206d946b06be419f629.jpg,371661679FC049C1BDE2D5D27E4D9E78
2025-07-22T03:53:59.000Z,J. D. Vance suuntaa perhelomalle – Raivo heräsi,J. D. Vancen perhelomat ovat herättäneet vastustusta ennenkin.,https://img.ilcdn.fi/awh-XqDslRDEgkfADwDoPP8YJFc=/510x318/top/img-s3.ilcdn.fi/d512fbab307907b1775dd93a1b0385793755d4b0e9a16632cc37b80717f9df3f.jpg,3CAECF136D6F4276A96F540FBD70706B
2025-07-22T04:00:00.000Z,Pitkittyneet taloushuolet haastavat perheiden mielenterveyttä – jaksamista tarvitaan tilanteen muuttamiseksi,"Ylivelkaantumista ja pitkittyneitä taloudellisia haasteita ratkaistaan usein keskittymällä enimmäkseen raha-asioihin. MIELI ry:n YLVA-hanke on kammennut jo yli kolmen vuoden ajan mielenterveyttä osaksi perheellisten talouskeskusteluita, sillä ilman jaksamista taloutta on vaikea korjata. ",https://img.ilcdn.fi/0BwlCs30zAkDKoHahGJnSEUs80A=/510x318/top/img-s3.ilcdn.fi/683d493baded54e0aa1b0008dec5331b3a717ba819491a049c35def956a969f4.jpg,CE0B4E38C1EA4BB8BB7E9A397890E8DB
2025-07-22T04:01:23.000Z,Mussolinin lapsenlapsi Serie A:han,Mussolini pelaa oikealla laidalla.,https://img.ilcdn.fi/ZP6s5-BI3muUNnqKL8HaUAEp3eM=/510x318/top/img-s3.ilcdn.fi/ba28fc5761546db40b7f8bee18fb012e1f124aa8e206631decfe399c6987fdfb.jpg,3445D74C5E5A44B5B282EF19EDCD5FEA
2025-07-22T04:02:02.000Z,Video näyttää: Näin kylmänrauhallisesti 102 rikoksesta tuomittu sarjanäpistelijä hankki juoksukaljat,Miehellä on mittava rikoshistoria. Pelkästään tänä vuonna hän on saanut tuomion myös törkeästä pahoinpitelystä ja ryöstöstä.,https://img.ilcdn.fi/mj4VNvpdK65ngN87ff_JkEI8_yQ=/510x318/top/img-s3.ilcdn.fi/2f2e06ac6d5ed931ca04e4a521252985ba1d8810a261a5f68c656bdd3b245124.jpg,72982AF62E5B4AC98F9B9BA9FF342EE1
2025-07-22T04:15:43.000Z,Tapani Kansan kuolema oli šokki Nina-puolisolle: ”Minulla on vielä suruprosessi kesken”,Nina af Enehjelmin mukaan suruprosessi on vielä kesken.,https://img.ilcdn.fi/89fArXyBOIT_7PCMlelC7WbD9b4=/510x318/top/img-s3.ilcdn.fi/7b3b70d9fc55eda52e7e6fafa012961cb53073586293054ad1c3d0337abce1f4.jpg,74E19B05F903449A91C0479E918F98CA
2025-07-22T04:28:53.000Z,Suomalaiset suututtanut kohu-urheilija: Välikohtaus ravintolassa,"Magamed Gadievin striimi jäi kesken, kun ravintolakäynti päättyi nujakointiin.",https://img.ilcdn.fi/Pj72EORo_IYDhpBX6NwKeNziYnw=/510x318/top/img-s3.ilcdn.fi/33f565bbfd9cf20616e865514ace58dde3775ca3c1282f585e8ef2338e550d8b.jpg,9AD13468BD1548389500D564BFA1ADE2
2025-07-22T04:31:25.000Z,"Tee näin, kun pistät pyykinpesukoneen käyntiin seuraavan kerran – Säästät rahaa",Näillä yksinkertaisilla muutoksilla voit pestä pyykkisi halvemmalla.,https://img.ilcdn.fi/Gr4aPW57qrzAcZGdg5F94paYJyc=/510x318/top/img-s3.ilcdn.fi/b87e8353fe671882cf243c46cbd1293aff56f54616757af82faa62f74cefed1a.jpg,E9A447618B884E3583843F19964206CB
2025-07-22T04:46:50.000Z,Tänään tv:ssä: Ruotsalaismies söi tyttöystävänsä,Murhaaja kotonani: Syyllisen versio -ohjelmassa tavataan Skaran kannibaaliksi tituleerattu ruotsalainen Isakin Drabbad. Tämän jutun sisältö ei sovi herkille.,https://img.ilcdn.fi/4hwzTl47qKQ-Eb6g5xtw0MH8twc=/510x318/top/img-s3.ilcdn.fi/c6b2c09d278993d063a9f09101d6aef40ecb8e12e6f5eee25768d3b3af40dc81.jpg,57906B6669AF4743896C3200B5E991AD
2025-07-22T05:00:50.000Z,Laki muuttuu – Näissä paikoissa nikotiinipussi on jatkossa laiton,"Laki tuo uusia rajoituksia muun muassa tuotteiden myyntiin, koostumukseen, pakkauksiin ja käyttöön.",https://img.ilcdn.fi/_k2rbZEAxZmkFnops-R3y3T95is=/510x318/top/img-s3.ilcdn.fi/0c5c62e133913396669b16b38f41bc38c30d06550f4596c7ee667e76d127acd6.jpg,7476DD40B3034DE0AE9C958EA0FF79A8
2025-07-22T05:07:15.000Z,18-vuotias superlupaus meni naimisiin – Parilla erikoinen suhdesopimus,Real Madridin Endrick vietti häitään.,https://img.ilcdn.fi/9fbzXNOctY816gt2HQQzlHAYkCA=/510x318/top/img-s3.ilcdn.fi/54e4e5d7abf90774cac17b8e4d3018b173527e29c586db19305344e001ca720f.jpg,AD8FDB06606D49AA92D4EF6FE5F40C1C
2025-07-22T05:22:05.000Z,Näin 12 vuotta täyttävää prinssi Georgea valmistellaan rooliinsa kuninkaana – Sisäpiiri: Tästä asiasta William ja Catherine ovat varuillaan,Prinssi George täyttää tiistaina 22. heinäkuuta 12 vuotta. Hiljattain hän otti merkittävimmän askeleensa kohti kuninkuutta. ,https://img.ilcdn.fi/qyzyg4QWpf_cDYD_0QjD378eO9Y=/510x318/top/img-s3.ilcdn.fi/76a4a22b8beae719f138e978e349a30f2f6897310102294cdf4f1ed2213706b9.jpg,6B8F22DB198E4393AA24ECD524A6F13B
2025-07-22T05:30:36.000Z,Valtiot menettävät rahaa matkamittari­huijauksiin miljardi­kaupalla,Matkamittaripetokset ovat EU:n alueella miljardiluokan ongelma.,https://img.ilcdn.fi/GNXffbj26LLxcB-zc2333rrplG0=/510x318/top/img-s3.ilcdn.fi/8f82f28b0fafc748253eafa6eca296d1e6e2c827db008b9dd8818b6ad09c8229.jpg,6BCCA547ECFF4CECB8263A3152D77934
2025-07-22T05:43:13.000Z,Sydney Sweeney teki rajun muodon­muutoksen – Tällaisen treeniohjelman hän otti käyttöön,Näyttelijätär esittää nyrkkeilijää uudessa elokuvassa.,https://img.ilcdn.fi/a1lbv3hLyU5a0zaXoWSfBblg7fk=/510x318/top/img-s3.ilcdn.fi/b7e6e8c58755cee401c4ab720b89ffd8ccd06e90b0739604082ce6003852a327.jpg,36E41D38F7B44986AD2B5BE94C65046A
2025-07-22T05:46:07.000Z,Karut luvut julki: Työttömien määrä kasvaa,Tilastokeskuksen tuoreet luvut kertovat synkän kuvan Suomen työllisyystilanteesta.,https://img.ilcdn.fi/MuRHNRHOHfGumJNzoGLCokldHCY=/510x318/top/img-s3.ilcdn.fi/fa2a80a1ae77f600c0f785b31299b5843d4e28dafe8a27a73b6072cf0756e023.jpg,F1ACE911906E4ED18BB4B3A173290534
2025-07-22T05:53:03.000Z,Podcast: Veeti Kallion arki romahti – ”Oli pelkotiloja ja kauhea stressi koko ajan”,Veeti Kallio kertoo Janne Katajan podcastissa viiden vuoden takaisista vaikeuksistaan.,https://img.ilcdn.fi/yOLC_Y2I29_t_pcDH2TwsLiUJyA=/510x318/top/img-s3.ilcdn.fi/1d8bea1b9e621a6aa3d79478b24c0c510fcd83749790f2b288426ca8ae3a7960.jpg,8CF7B45617D8443FB86E208957B42366
2025-07-22T06:02:43.000Z,Vaarallinen hyttynen aiheutti hälytyksen lomakohteessa,Tiikerihyttyset piinaavat suomalaisten suosimassa lomakohteessa Alanyassa. Tähän vaaralliseen tautien levittäjään voi törmätä monessa muussakin Euroopan maassa. ,https://img.ilcdn.fi/MJlBod6PUw1o7goGv5dit8P1v2U=/510x318/top/img-s3.ilcdn.fi/efc28f9ada53f048c6f2d87f7d82a59167a405ba0c3cfab77f97cb47ed4d82b2.jpg,DB3C4245FCDA454596704DAF50D2DD87
2025-07-22T06:25:04.000Z,Kuninkaallista sukua kohtasi suuri suru – 20-vuotias pikkuserkku kuoli,Kuninkaallista sukua kohtasi suuri suru.,https://img.ilcdn.fi/7lfud-CaFdKrAM7qKUA79E8psso=/510x318/top/img-s3.ilcdn.fi/289f8283cb2abb89758abc400b18bf49cb15a1dee7ade7afc24755b847f63573.jpg,67CC50D52176446E8EBC04E81504FEB3
2025-07-22T06:27:40.000Z,Mestarivalmentaja siirtyy Venäjälle: Sopimuksen arvo paljastui,Kanadalaisvalmentaja siirtyy ensi kaudeksi kiinalaisjoukkueen peräsimeen.,https://img.ilcdn.fi/voTPR0dZrfSe-7QODUleKjUAWfs=/510x318/top/img-s3.ilcdn.fi/8ce002e50055af0fa4686f69532b0f009357ce77b0c513ba65313df98fd50da0.jpg,994D56E11F2442A4B4A73B651F58336E
2025-07-22T06:30:17.000Z,Pariskunta yltyi kiihkeään rakasteluun julkisella paikalla Helsingissä,Rakkaustuokio Oulunkylässä närkästytti sivullista.,https://img.ilcdn.fi/9k8yrPV3Wi1fEVkQhyfFb_l2ONk=/510x318/top/img-s3.ilcdn.fi/bfc2af27643d0b652877d1de44a295f710f860182076d7a1cc1cd51d23c94369.jpg,3E4BBB7D1E31494BB3A7507286ECA43D
2025-07-22T06:31:39.000Z,Kovaa puhetta SDP:stä: EU hajoaa ja euro oli ”vuosisadan virhe”,Sosiaalisessa mediassa tunnettu SDP-valtuutettu ryöpyttää EU:ta omien sääntöjensä rikkomisesta. ,https://img.ilcdn.fi/jfXhXRp-shSDHfE25pJ4sgGyzBM=/510x318/top/img-s3.ilcdn.fi/66e2620a91b76095193de7dfc70b4f90b5dc3b4ce96d30f447ab05d53ed4cf1b.jpg,0AE5C27B5DB044C99022CCF43B8528D2
2025-07-22T06:54:10.000Z,Muovinen elämämme,Näillä arjen valinnoilla voi vähentää mikromuovien kertymistä elimistöön.,https://img.ilcdn.fi/w_Q8zXsnA8AJ1GyVMkpwlQDFzdY=/510x318/top/img-s3.ilcdn.fi/d91ac70b82753f49de79a712a2e0c8716e971e5133714b94443090eb50db71fd.jpg,0C060BB919984B90B67C24394C971527
2025-07-22T06:57:15.000Z,Helmarit-ikoni lopettaa maajoukkuepelit: ”Kroppa ei enää meinaa pystyä”,39-vuotias Tinja-Riikka Korpela siirtyy sivuun Helmarien toiminnasta. ,https://img.ilcdn.fi/upGotcnTUSqxYkCwJDFO_fxH8tE=/510x318/top/img-s3.ilcdn.fi/b6b92d63340dd6a95ddd37c08594c0feee137cad55154d06a0a50077a387fdde.jpg,811A31A10BA24C10BD934DFE78F4DE7D
2025-07-22T07:00:03.000Z,Sannan kissa sairastui – Repi rahat seurauksista välittämättä,52-vuotias Sanna nosti 5 000 euroa kulutusluottoa eläinlääkärikulujen takia. Suomalaiset ottavat pikalainoja pakollisiin menoihin yhä enemmän.,https://img.ilcdn.fi/SZNfabaK5kzFMsPSAtwOmO2qWSU=/510x318/top/img-s3.ilcdn.fi/5bdc8ed8a69cbec2ecb383a890fd6d9fb6b980911e417dbd659494e8647ac6c9.jpg,BC4E13EE893446BBA92490F2FCCD2FA5
2025-07-22T07:00:33.000Z,OP: Varakkaat asiakkaat saattavat olla nyt erityisessä vaarassa,"OP varoittaa huijauksista, jotka voivat vaarantaa myös yritysten varat. Se pitää mahdollisena, että huijauksia on kohdistettu varakkaisiin henkilöihin.",https://img.ilcdn.fi/XzUzdw0-5u7M76cGNu3LfCLQjhY=/510x318/top/img-s3.ilcdn.fi/15f4152a6564cdb47c3da447b4bdf7c7876da8155c5ae0557a0c2968bc61f7f5.jpg,82160785111040C2B8E835972A15FEA8
