paivamaara,otsikko,tiivistelma,kuva
2020-02-25T12:29:33.000Z,”Minna oli nimenomaan persoona” – Marko Björs menetti Etelä-Afrikan ratsastusonnettomuudessa rakkaan ystävän,Marko Björs kuvailee Minna Kemppaista sydämelliseksi persoonaksi.,https://img.ilcdn.fi/BjvKmvHJj5eJrPGKY3wkb0RWYLE=/510x318/top/img-s3.ilcdn.fi/8c129fb6fe3a341b1e68dd10f04483d8fcecb98937b6caf2df26ac530cc10868.jpg
2020-02-25T12:35:24.000Z,Kansanedustaja Anna Kontula paljastaa kirjassa kohutun Gaza-pidätyksen amatöörimäiset taustat: aktivistiryhmän jäsenen SIM-kortti narautti aidanleikkaajat,"Hallituspuolueen kansanedustaja Anna Kontula kritisoi Suomen ja Israelin välistä asekauppaa. Kirjassaan hän paljastaa, että aktivistiryhmä yritti toteuttaa kansainväliseen julkisuuteen tarkoitetun aidanleikkausoperaation.",https://img.ilcdn.fi/f9_SX-v6jkVtDIDGTg3wY6enK-Y=/510x318/top/img-s3.ilcdn.fi/4dbc033ad87719c514da13269518e073f83376cf12f5c212d0281a21d51e4c79.jpeg
2020-02-25T12:46:20.000Z,Kimpassa: Reidar Palmgren avoimena suhteestaan Satu Silvoon - avautuu parin ensitapaamisesta: ”Myönnän näyttäväni hänen rinnalla uitetulta jyrsijältä”,Taiteilijapariskunta avaa arkensa salaisuuksia Kimpassa-ohjelmassa.,https://img.ilcdn.fi/KOEPUozF4ebtcpaSBv0erhz1OiM=/510x318/top/img-s3.ilcdn.fi/34f093dda4f6d85720d81495e50b844adbff1e1fcaec6c569c6eb4647ec4dc86.jpg
2020-02-25T12:53:02.000Z,Uudet managerit saaneet Napolin ja Barcelonan pelit rullaamaan - ottelun ratkaisija löytynee jälleen tutusta osoitteesta ,Tiistain pelipoiminta on Mestarien liigan Napoli-Barcelona.,https://img.ilcdn.fi/4r5vc1E3BZhKEIGQOXJKEM_5VfU=/510x318/top/img-s3.ilcdn.fi/012b5b3d54ec4616c7beed3608371a8cdbffa54904ce70de42894138cc72ee8c.jpg
2020-02-25T12:53:21.000Z,Video: Suomalaisia jumissa hotellissa Teneriffalla – tältä karanteeni näyttää hotellin sisäpuolella,Hotellin asukas taltioi tunnelmia Teneriffalta.,https://img.ilcdn.fi/UtfmfXliPY-Ueq__mQKY2gIEkao=/510x318/top/img-s3.ilcdn.fi/9d18c8d364cc02ee6ea7a7b361b636b86b8ba38cf0fd4cde671daab0797fe31e.jpg
2020-02-25T13:00:23.000Z,NHL:n suomalaispelaaja oli vähällä tehdä erikoisen oman maalin – video: Tonnin seteli -ilme on täyttä kultaa,"Markus Nutivaaran laukaus oli vaarallinen, harmittavasti oman joukkueen kannalta. ",https://img.ilcdn.fi/jZElExzg-4t4BBDSSo82L3bNtLQ=/510x318/top/img-s3.ilcdn.fi/f60e54868b0704d31439d1e47f9680c0210240240e43368170b5758dea082f28.jpg
2020-02-25T13:06:18.000Z,Maailmanhistorian kuuluisin takaa-ajoauto palaa: Tältä näyttää Mustang Bullitt 2020,"Kun Mustang Bullittin päräyttää käyntiin, niin naapurin kissa karkaa puuhun. Ärjyvä Bullitt on automaailman viimeisiä kapinallisia.",https://img.ilcdn.fi/rnQ6ppPVngBggtS7Ox6VKEEPaG8=/510x318/top/img-s3.ilcdn.fi/f7910f7508beec268f65a8d622bdc340e910769abcf6c2bcd854107b67c6741e.jpg
2020-02-25T13:16:10.000Z,Saunapalvikinkkua saa valmistaa myös jatkossa! Perinneherkulle myönnettiin poikkeuslupa,EU:n kiristyneet asetukset uhkasivat perinteikkään saunapalvin valmistamista Suomessa.,https://img.ilcdn.fi/1k0Gerxn4SqObcDkyBckJ1vgf_E=/510x318/top/img-s3.ilcdn.fi/87c642f18d95ced55e8d030986c5fcb3b8b2825f1c5b92c513f1f7aa5cba7fa0.jpg
2020-02-25T13:33:07.000Z,Seksikäs tukkakikka korostaa parhaita puolia - ja feikkaa huonot piiloon,"Siihen on syynsä, miksi seksikkyydestä tunnettu Versace kampaa malliensa tukan sensuellille sivujakaukselle. ",https://img.ilcdn.fi/zlIfN_R5T8URAsm2vS-LRR1cUpQ=/0x323:2001x1574/510x318/top/img-s3.ilcdn.fi/bdc4f83ac4467920543d03a485faba0d495f0238f02480bc91f50a8b0b9b6c49.jpg
2020-02-25T13:44:42.000Z,"Rikkoutuuko tänään SM-liigan ennätys? Kaikki tuntevat Tappara-tykin patenttivedon, harva pystyy estämään sitä",Tapparan 27-vuotias hyökkääjä Jere Karjalainen on tällä kaudella rikkonut kaikki henkilökohtaiset ennätyksensä.,https://img.ilcdn.fi/8CCivoBF5g8UbSiG7Yl-mW90GW4=/510x318/top/img-s3.ilcdn.fi/a91196ec79bc2b6501d45030a41a1c1c25256ef4efe56c49707070c6c7e8fca3.jpg
2020-02-25T13:51:08.000Z,Metallica peruu keikkojaan – James Hetfieldiltä rehellinen avautuminen tilanteesta: ”En ole laittanut terveyttäni etusijalle”,Metallican nokkamies kertoo Facebookissa yhtyeen peruvan keikkojaan.,https://img.ilcdn.fi/QX6JAE_B56J064ZMrOU-L1mYOqU=/510x318/top/img-s3.ilcdn.fi/e656a94e5307351ec6b2ad4e32a7786e723d696fd8f3126a7c9bee9f65d141f1.jpg
2020-02-25T13:54:50.000Z,"Petra Olli, 25, lopettaa uransa! ""Polte ei ole enää ennallaan”",Petra Ollin painiura on tullut päätökseen.,https://img.ilcdn.fi/xPwSQY3XKuflRLHVMMGbMbWHBAA=/510x318/top/img-s3.ilcdn.fi/3c4b52536410b7071fc8129ee92076265c9ed77eae9a82095a7eed60bcb2de43.jpg
2020-02-25T14:24:04.000Z,Tuukka Temosen uutuuselokuva tyhjensi palkintopöydän Monacossa,Tuukka Temonen on saanut kaksi arvostettua palkintoa uutuuselokuvastaan Aika jonka sain.,https://img.ilcdn.fi/gW8wML9OD9WazxVwixoIMKp3PGE=/510x318/top/img-s3.ilcdn.fi/8ab2da63978d647da9772a3e2a7feefd32ffb1ecfb88464568e2fb9102324e1a.jpg
2020-02-25T14:37:05.000Z,Iranin apulaisterveysministeri sai koronavirustartunnan - hikoilu tallentui videolle,Iranissa on todettu useita koronavirustartuntoja.,https://img.ilcdn.fi/6oABSDfHCNBOVfTRr_1El84dYyo=/510x318/top/img-s3.ilcdn.fi/5b4d10810450b6b233202225fbd44c752a295b57245b4d9cdd5a6046f3195493.jpg
2020-02-25T14:39:05.000Z,Mikä saa noitakaivon kiehumaan? Virolaisen luonnonihmeen voi nähdä vain muutamana päivänä vuodessa,Ihmeellinen virolaisnäky on nyt komeimmillaan.,https://img.ilcdn.fi/r3136Y3Gukge_3T0EnGsDEYiEBI=/510x318/top/img-s3.ilcdn.fi/ab2c655c123d236ad0a0a8f9ae59e19dd54756c5bb1aa75553f2432f63fc811d.jpg
2020-02-25T15:04:57.000Z,STM:n johtaja kertoo: Näin Suomessa on varauduttu koronaviruksen leviämiseen: ”Mahdollinen potilas ja tartuntaketjussa olevat päätyvät karanteeniin”,"Sosiaali- ja terveysministeriöstä kerrotaan, että Suomella on valmiudet toimia eri olosuhteissa. ",https://img.ilcdn.fi/6UdwbucfSdIzCQK4Fvmdy6f0Mgk=/0x64:3000x1940/510x318/top/img-s3.ilcdn.fi/efeaf1bc83a2cbc16a213e5b6a8fdb6cc569a34e19dca2d3b521e8d312bca027.jpg
2020-02-25T15:05:12.000Z,Petra Ollin valmentaja muistelee upeaa yhteistä matkaa – luotsin paniikkiratkaisu oli viedä MM-kullan: ”Kaikki olivat sekaisin”,Ahto Raska sai kuulla Ollin lopettamispäätöksestä maanantaina.,https://img.ilcdn.fi/ESIFtkHqGBdIfjQvVyKofrGIzOg=/510x318/top/img-s3.ilcdn.fi/97035faed68af472deaa221f1e6fedc9d539680fae24d5db70ecddb9eb8d4238.jpg
2020-02-25T15:08:46.000Z,Superhelppo kastike sopii minkä tahansa salaatin joukkoon: ”Saat makua ja runsautta”,Turkkilainen jogurtti tuo piristystä salaattiin.,https://img.ilcdn.fi/E-BKDouod7XDR497acQCg0HvmJE=/510x318/top/img-s3.ilcdn.fi/ec72c6bfad5c9fe3c205670725763d0af0725b955e1d3ee598154e7b55d1d190.jpg
2020-02-25T15:12:22.000Z,Mikko Lehtonen jää ilman KHL:n ennätystä – Jokerit pelaa ihan b-miehistöllä,Joekrit säästelee parhaita pelaajiaan runkosarjan viimeisessä ottelussa.,https://img.ilcdn.fi/bH1hufOGSCOzz1PLXQeof1benf0=/510x318/top/img-s3.ilcdn.fi/934c94a0be5e488b2774540e1d913af592aa62592a72ec9ea681b96d0d05f258.jpg
2020-02-25T15:16:08.000Z,Leila Palmu kärsii rankoista oireista - tajuttomuuskohtaukset pysäyttivät: ”Toivottavasti vielä ei ole lähdön aika”,Leila Palmu on viime aikoina kärsinyt muun muassa rajuista tajuttomuuskohtauksista.,https://img.ilcdn.fi/d_w_c_x9a2gL_675g1IWnMB64fo=/510x318/top/img-s3.ilcdn.fi/dcefa85996657ca76196bbcc0a0666eb72065c15b6d0448855e0836bd5b736d2.jpeg
2020-02-25T15:20:46.000Z,"Entinen jääkiekkotuomari Juha Kautto, 44, on kuollut",Entinen linjatuomari menehtyi pitkäaikaiseen sairauteen.,https://img.ilcdn.fi/11a-6j2FEcvXLCxlVTX9hm4GRDA=/510x318/top/img-s3.ilcdn.fi/120d5692c07786862383cb7b11aeff4a219d67c60ad1ee90d1a55fd2fcee022a.jpg
2020-02-25T15:27:10.000Z,"Työttömyysturvasta 10 prosenttia pois, jos kieli ei taitu? – Kaikki konstit maahanmuuttajien työllistämiseksi tutkittava","Maahanmuuttajien työttömyysongelmaan pitäisi puuttua tarmokkain keinoin, myös kielitaitoa parantamalla.",https://img.ilcdn.fi/fTXi3xzBJJGN_3aP9FlIuk5Gtvo=/510x318/top/img-s3.ilcdn.fi/fdbcb650d8d420d34580afdd915c0e81ad9841b5201ad64a7221e7bc8ff8852f.jpeg
2020-02-25T15:29:40.000Z,Sudesh Amman puukotti kahta Lontoossa päästyään juuri vankilasta - Britanniaan ennenaikaiset vapautukset estävä hätälaki ,Tuomitut on päästetty vapaaksi automaattisesti tuomion puolessa välissä. ,https://img.ilcdn.fi/a6skbgHcjeIqeOawBHkfxGNthKw=/510x318/top/img-s3.ilcdn.fi/cd4e733633f37bbec05e369737dfe0409fe2702b7be03ac2618b5cb30ec22a0c.jpg
2020-02-25T15:34:36.000Z,"Petra Ollin luottomies kertoo sokkipäätöksen taustat: ”Viimeisin vuosi ei ole ollut helppo""","Petra Olli kokee, että palo painia kohtaan on sammunut.",https://img.ilcdn.fi/NbuJEMGipzZ7m6-ZAC0Tim-cxFA=/510x318/top/img-s3.ilcdn.fi/0ceaea2762e19431f87817fcb409c5e2a895c48d4168b733830f745183fc16b2.jpg
2020-02-25T15:43:03.000Z,Isoisä kehitti hurmaavan ratkaisun polttopuille: ”En vaihtaisi sitä uuteen tai hienompaan mistään hinnasta!”,Kanisteri sai uuden elämän puunkantotelineenä.,https://img.ilcdn.fi/9SXgVpGPPVuhBXkA1ajHhaCXJy0=/510x318/top/img-s3.ilcdn.fi/7aef25152d3bc7116033295dae35fda90fbe6871789842e57575b955360c41d2.jpg
2020-02-25T15:56:58.000Z,Kova paluumuuttaja – liigamestari KuPS saa tähtensä takaisin,Urho Nissilä palaa kotikonnuilleen.,https://img.ilcdn.fi/eldK562xXIYffkbjNWp0W_6XaiY=/510x318/top/img-s3.ilcdn.fi/4e470e04c7891eb2ad96b4a3d49a7f62b6fa0269b4261cff07e3164fce0f64de.jpg
2020-02-25T15:58:20.000Z,Tältä Apollo 13 -kuulento näytti astronautin silmin – Nasa julkaisi uuden upean videon,Nasa koosti kuuluotaimen tuoreista kuvista näyttävän videon.,https://img.ilcdn.fi/UdHqXSE7QY2it1hfB6RYxHhyo2k=/510x318/top/img-s3.ilcdn.fi/fc2152272542c98e1502f17c8577235a12132e401694dcd1926200d4af632a0c.jpg
2020-02-25T16:06:38.000Z,Yllättävä käänne studiossa ennen Putouksen kuvauksia – katosta alkoi tippua vettä,Lauantain Tuuli-myrsky iski ennen Putouksen kuvauksia Angel Filmsin studioon. ,https://img.ilcdn.fi/qsgWK81LpRm7vVJ0BPFhZFcCVZE=/510x318/top/img-s3.ilcdn.fi/8b15cacf360345f82e028b1839b231092d2ad8015b43883b00c780ebb2f01db4.jpg
2020-02-25T16:16:06.000Z,Näin poliisi on eristänyt hotellin Teneriffalla – suomalaisturisti: ”Poliisi pyysi kauemmas heti”,Muissa hotelleissa majoittuvat matkailijat ovat jatkaneet lomiaan auringosta nauttien: rannat ovat täynnä yhden hotellin poikkeustilanteesta huolimatta.,https://img.ilcdn.fi/hN3kfQOJ-Rc_yXe_hiBa-A-vaYw=/510x318/top/img-s3.ilcdn.fi/d1c5d35114eba5cebf957f2378e8bf2fce8bb28e8d3c1bfcc6b286d99af05ab9.jpg
2020-02-25T16:37:06.000Z,"Juha Kauton kuolema pysäytti kollegan: ”Hyvä mies, hyviä muistoja”","Linjatuomari Juha Kautto, 44, on kuollut.",https://img.ilcdn.fi/E3tLwiIPhPCxlrcRZR39anUjvus=/510x318/top/img-s3.ilcdn.fi/570ffde793452155991829cf92e0cdb3482924746963c260374dfc2ee9009fd2.jpg
2020-02-25T16:46:47.000Z,Sanna Marin: Hallitus käy läpi koronatilannetta tarkemmin huomenna – ”Suomi on varautunut hyvin”,Hallitus käsittelee keskiviikkona Suomen varautumista uuteen koronavirukseen.,https://img.ilcdn.fi/Tg3hJuNSlg5pZtTDf7zxLwnD8j0=/510x318/top/img-s3.ilcdn.fi/c3d9883e5868aa93e7985668c1fa7473e87680029eaa61bfe8b3b1610c6f55b4.jpg
2020-02-25T16:47:27.000Z,Fasistiksi esittäytynyt PS-nuorten Jalonen eroaa tehtävästään,Toni Jalonen on toiminut Perussuomalaisten nuorten toisena varapuheenjohtajana.,https://img.ilcdn.fi/TtPd8SMwQ4kGWj6RRGpAiwGyVEM=/510x318/top/img-s3.ilcdn.fi/a2d9cb1c29b356f6f58d59d123fc73f4faf7d439a5bcf5437ac00a3f77bb8957.jpg
2020-02-25T16:47:54.000Z,Uefa varautuu pahimpaan: Vaarantaako koronavirus jalkapallon EM-kisat? ”Meidän on noudatettava ohjeita”,"Uefan varapuheenjohtaja painotti, että maiden ohjeita täytyy noudattaa.",https://img.ilcdn.fi/U4-NqvpM1AJz3pRMCh4fdihIZG0=/510x318/top/img-s3.ilcdn.fi/11ba8dd1760c4ecc22b5ae02295942d5da51109258cd529a457a0ea0103ac088.jpg
2020-02-25T16:48:34.000Z,"Jokerit ei vieläkään tiedä, mikä joukkue tulee vastaan sunnuntaina",Jokerit hävisi Nizhni Novgorodissa Torpedolle. Pudotuspelivastustaja ei ole vieläkään selvillä.,https://img.ilcdn.fi/dxA47k3x6PlrbvZe7eOWx3e4R-E=/510x318/top/img-s3.ilcdn.fi/def7121c53c408412f9c1e97e2abe07049f5fe23c590ea50d551638a6b43448f.jpg
2020-02-25T16:50:26.000Z,Heidi Pakarisen rankat ajat - paha onnettomuus lähipiirissä laittoi ajatukset uusiksi: ”Elämme päivän kerrallaan”,Heidi Pakarisella on ollut raskasta.,https://img.ilcdn.fi/bsaRThdm6Aa3VCwNwVgZF3giIF0=/510x318/top/img-s3.ilcdn.fi/f57085ef29a7290f4498cda9cf981c1e66bcf540c7cae00b0325b4cb59d44436.jpg
2020-02-25T16:59:42.000Z,Löydä uusia tapoja nauttia seksuaalielämäkerran avulla – näin opit ymmärtämään halujasi paremmin,Näin kirjoitat oman seksuaalielämäkertasi.,https://img.ilcdn.fi/pCDkKxPslaSiQ2Wq_Mno5dSj-JU=/510x318/top/img-s3.ilcdn.fi/22ea0f8e1fa9c8518af11a0c04c18197b1fb33c6dd159a3c1da28c682652b7be.jpg
2020-02-25T17:15:25.000Z,Kirvestykiltä hirmuinen lämäri! HIFK:n äijät kuluttivat jäähypenkkiä,Niko Ojamäki hyödynsi Tapparan yhden kolmesta ylivoimasta ja vei kotijoukkueen johtoon avauserässä illan ainoassa liigapelissä.,https://img.ilcdn.fi/OPM5EWVa59OXjxbjRfKfsezVakQ=/510x318/top/img-s3.ilcdn.fi/7470c5c0272460e6f8db6f2b8745981b70ca0d80c25a991707097c8d2024a2b9.jpg
2020-02-25T17:16:56.000Z,"Katso kuvat: Muumi-yhtiö hermostui, Björn Wahlroosin uutuuskirjan kansi piti vaihtaa",Björn Wahlroosin uusimman kirjan kannessa oli liikaa yhtäläisyyksiä Tove Janssonin muumikirjaan.,https://img.ilcdn.fi/opVBt-F5k1B7PDB37z31jSEiOtA=/510x318/top/img-s3.ilcdn.fi/f45d75154546cb91164b8789f8740e6953ff072a9626ffed048dcbf9618577cd.jpg
2020-02-25T17:26:24.000Z,"HS: Jasper Pääkkönen sai kokea Hollywoodin nurjan puolen, kun suuren budjetin tv-sarja vedettiin tylysti pois tuotannosta: ”Tuntuu käsittämättömältä”",Suomalaisnäyttelijän tähdittämä sarjan tie tyssäsi pilottijaksoon.,https://img.ilcdn.fi/oZviyLO9bI7vHSBV5k3w6IOACxA=/510x318/top/img-s3.ilcdn.fi/41873db93026ec6add9391c6185d4b922d7a53e7fa63c8872629bd48cd203c3e.jpg
2020-02-25T17:30:25.000Z,"Neuvostoliiton viimeinen marsalkka Dmitrii Jazov, 95, on kuollut – yritti syrjäyttää Gorbatšovin, tuomittiin sotarikoksista",Marsalkka oli korkein mahdollinen sotilasarvo Neuvostoliitossa. ,https://img.ilcdn.fi/gaKddEyktY6Mttmj_LRhKmJlklQ=/510x318/top/img-s3.ilcdn.fi/83469d46f8361313f7cb9b7aaf7a45490c44c85f4f2369e58220bf6c5de67df8.jpg
2020-02-25T17:43:09.000Z,"Erik Haula lähti Floridaan pikahälytyksellä – pääsi lapsuutensa suosikkijoukkueeseen: ”Uskoisin, että fiilis enemmän nousi kuin laski”",Erik Haula myytiin maanantaina Carolina Hurricanesista Floridaan.,https://img.ilcdn.fi/H4pEe-L_572NWPZCFOW_qm8CrEY=/510x318/top/img-s3.ilcdn.fi/079d2bfd2ffe576a6ad675e5214225301c821fb89fd5cefd69458d4d912b9e66.jpg
2020-02-25T17:59:34.000Z,Etsiikö Bayern München hyvitystä kahdeksan vuoden takaiselle ryöstölle? ”Ei sillä ottelulla ole enää mitään merkitystä”,Chelsea-manageri Frank Lampard aiheutti modernin Bayern München -historian suurimman trauman. ,https://img.ilcdn.fi/C1TZmIyFJiKjA8EfrRIWQi8qXqM=/510x318/top/img-s3.ilcdn.fi/b99189ea21a50468305052f6da7a83e5cc0f68468c159836934d4ce839d2e545.jpg
2020-02-25T18:04:53.000Z,Teemu Pulkkinen rikkoi 11 vuotta vanhan Suomi-ennätyksen KHL:ssä!,Teemu Pulkkinen ohitti Esa Pirneksen.,https://img.ilcdn.fi/DEqV2j0L4EtIsV7wOk0eyXFiZmU=/510x318/top/img-s3.ilcdn.fi/7e738829b9c1afcdd1c0cd79ee5ed9d2f87bf101f11d45c19a8415ce622c6dc0.jpg
2020-02-25T18:07:17.000Z,"Kenelle koronavirus on kohtalokkain? Kaikki, mitä sinun täytyy tietää nyt koronaviruksesta",Tuorein yhteenveto kertoo: 81 prosenttia sai koronaviruksesta lievän taudin. Vaikea tauti tuli 14 prosentille sairastuneista. ,https://img.ilcdn.fi/i71QxmjLZzH4x42ycMKw0Yc80QE=/510x318/top/img-s3.ilcdn.fi/8063b214aec00ba3d5cb3404a262699f64d4fd2fcd4afc694f23a268ddcb3854.jpg
2020-02-25T18:11:31.000Z,"Missikaunotar Essi Unkurin vuosipäiväpäivitys tihkuu rakkautta: ”Edessäni mä näen miehen, johon voin luottaa”",Vuoden 2017 Miss Suomi -finaalista tuttu Essi Unkuri seurustelee Viljami Harjuniemen kanssa.,https://img.ilcdn.fi/Po5rUzL2OPLHxbb5NscafcLS2FU=/510x318/top/img-s3.ilcdn.fi/c78a89c64f1c4ea6648da8b9ca559d50a3f62fe0a27f89febb0f9dd5e4c48820.jpg
2020-02-25T18:34:36.000Z,Yhdysvaltalaisperhe suri kuollutta lemmikkiään – päättivät kloonata koiran uudelleen henkiin,"Äidin mukaan koirilla on täysin sama persoonallisuus, jopa lempilelut ovat samoja.",https://img.ilcdn.fi/AQ4XqrV_XXGwH5k-PxQyd_kdgeg=/510x318/top/img-s3.ilcdn.fi/c3167018a253f8ac878c940460a7aa1903a02b3512b7237ca2ed904177dd1e44.jpg
2020-02-25T18:43:57.000Z,Petra Ollin äiti Päivi pyyhki kyyneleitä – oman tyttären tuskan seuraaminen oli kivuliasta: ”Onhan tämä tunteiden sekamelskaa”,Painija Petra Ollin päätös huippu-urheilijauran päätöksestä oli tunteikas paikka myös kotiväelle. Lappajärvellä on valutettu liikutuksen kyyneliä.,https://img.ilcdn.fi/5QJ5BKau-XTWmOzHMnYnIcA0348=/510x318/top/img-s3.ilcdn.fi/b04819296f36937cbad126de4d6826f3df31d7d0de07c2bf83dc59e92946420c.jpg
2020-02-25T18:54:41.000Z,Tältä prinsessa Diana näyttää The Crown -sarjassa,The Crown kertoo kuningatar Elisabetin elämästä.,https://img.ilcdn.fi/vrGZ5CYXJD74skiBbsOpFs-YK0Y=/510x318/top/img-s3.ilcdn.fi/b53b333c8626b474053acf15f17d990b0a071360bfc19cbbae98fe260bf0dc12.jpg
2020-02-25T19:02:44.000Z,Salarakkaasta tuli sydänystävä,"Sallan parisuhde meni romuksi, kun poikaystävän pettäminen paljastui. Toisesta naisesta hän sai lopulta läheisen ystävän.",https://img.ilcdn.fi/sJYmVKAvFmPqtet2orne-sO9Tuo=/510x318/top/img-s3.ilcdn.fi/7b93996d91d964dcbeeabb608b0d981c318dd36e37b34c345bcd112424c35b99.jpg
2020-02-25T19:04:52.000Z,NHL-tähden kauppaaminen vaikuttaa neljään seuraan – hirviösopimus vainoaa yhtä joukkuetta vielä vuosia,Venäläistähti Ilja Kovaltshuk tarjoaa tämän kauden joukkueilleen muutakin apua kuin tehopisteitä.,https://img.ilcdn.fi/wiSvPekzP0cbmQNTawy3klf5sdY=/510x318/top/img-s3.ilcdn.fi/63e6cc4d90d12179495f84b1df5b7f2f943ca36af042046ac8116fd3bb7df8c3.jpg
2020-02-25T19:06:16.000Z,Tupsahtiko postiluukusta vieraan ihmisen postia? Näin toimitat kirjeen oikeaan osoitteeseen,"Väärin jaettujen postien palauttamista mutkistaa se, että Suomessa kirjepostia jakaa 17 jakeluyhtiötä.",https://img.ilcdn.fi/SX-WcgQIDRzLcz8yoLU8wZXpVMY=/510x318/top/img-s3.ilcdn.fi/b4d3155f67f50a19256511bee723beb35fa13fa0bf98b059f13cdb780b196618.jpg
2020-02-25T19:10:30.000Z,"Mysteeri syvenee: Tylee, 17, ja Joshua, 7, katosivat syyskuussa – pimittääkö äidin sukulainen tietoa olinpaikasta?",Lapset on nähty viimeksi syyskuussa.,https://img.ilcdn.fi/9uxS3WtgjMvUMiFiMJ2yOoI9IuM=/510x318/top/img-s3.ilcdn.fi/e31fe38caef1cfb7652d19813c288654b52b26e3686a65911977de70f936f0ed.jpg
2020-02-25T19:14:51.000Z,THL: Suomessa testattu noin 30 ihmistä koronaviruksen varalta tähän mennessä,Testien tarkoista ajankohdista ei ole tietoa.,https://img.ilcdn.fi/9k2lyoHwWjyoe7p1KHEFwZ4r-RA=/510x318/top/img-s3.ilcdn.fi/ae98f8242aa9f3b2cf16ba2485eba8434b167594fc7ab9f1b027341c99f69319.jpg
2020-02-25T19:22:06.000Z,"Haluatko matkustaa, mutta et poistua kodistasi? Matkoille mukaan otettava koti esiteltiin Miamissa","Yritys lupaa, että kodin voi viedä lähes minne vain maailmassa.",https://img.ilcdn.fi/OYUY9E-YteSg3JTMXVjq9NkxlZA=/510x318/top/img-s3.ilcdn.fi/b5e5682f532429810fc4536609372bbf57dfe83bf57523ba089ab168f7d8521a.jpg
2020-02-25T19:27:02.000Z,Jo 11 kuollut koronavirustautiin Italiassa ,Noin 50 000 ihmistä on karanteenissa italialaiskunnissa koronaviruksen takia.,https://img.ilcdn.fi/98Arq5tCvXVZWxKi0IU0a9LlecE=/510x318/top/img-s3.ilcdn.fi/512a0ad4f550e830479e140b0204ec9c782945ab97d0683ed2a85bee3e9040a4.jpg
2020-02-25T19:43:05.000Z,"Jussi Halla-aho A-studiossa fasistikohusta: ”Minulle jää arvoitukseksi, mitä henkilö tarkoitti sanoessaan olevansa fasisti”","Perussuomalaisten puheenjohtaja Jussi Halla-aho ei vielä sanonut Ylellä, erotetaanko Toni Jalonen puolueesta vai ei.",https://img.ilcdn.fi/m8209PiR9haQEJDSAwCNFNgAmU8=/510x318/top/img-s3.ilcdn.fi/2ba89a568282de65fd5372ba51eb835af5c3977c5936e26874d19cb5023d7f74.jpg
2020-02-25T19:47:07.000Z,FBI teki ratsian Peter Nygårdin yrityksen pääkonttoriin,FBI on yhdessä New Yorkin poliisin kanssa tehnyt etsinnän Peter Nygårdin yrityksen pääkonttoriin.,https://img.ilcdn.fi/WoGK6z7f4azdjviVWV0u-0Pmu7E=/510x318/top/img-s3.ilcdn.fi/1f1babd37921116bf2ca075162de3304779e447455a0348a75a2ede734ba1b56.jpg
2020-02-25T19:49:42.000Z,"NHL-pelistä tuli farssi: Tuore hankinta saapui kesken avauserän, toisen pelikamat olivat tipotiessään",Matthew Pecan jälkeen hallille saapui vielä latvialaishyökkääjä. Pelivarusteita ei kuitenkaan näkynyt.,https://img.ilcdn.fi/NJbQDXPRwB7VdU1Luau2gqZ1PiM=/510x318/top/img-s3.ilcdn.fi/db18b49585f7945b6eb5a5fa6cec0cc8dba542c890d07fc80ca66ecf8d69f1cd.jpg
2020-02-25T19:54:50.000Z,Barcelona sai arvokkaan vierasmaalin Napolissa – Leo Messillä vaikea ilta Diego Maradonan kotona  ,Napoli ja Barcelona pelasivat 1–1-tasapelin Mestarien liigan neljännesvälierien ensimmäisessä osassa.  ,https://img.ilcdn.fi/NqNEF-JyWxy214UqYTz1BPfirjc=/510x318/top/img-s3.ilcdn.fi/0ada7100e77db3bcff01849f27059a1ef378dc71a35564e99d5cea4a0b8446cb.jpg
2020-02-25T20:06:29.000Z,Etelä-Suomikin voi saada osansa Viron lumikaaoksesta,Sateiden ennustaminen on tällä viikolla viheliäinen tehtävä jopa ammattilaiselle.,https://img.ilcdn.fi/HS3MPl_7mT8WXCLWpcKf3dSgZ2s=/510x318/top/img-s3.ilcdn.fi/e17d42b3d3e968d3b3082f4e86cd78d2bcaef72a915fbc9bb30aecd29c72467c.jpeg
2020-02-25T20:12:00.000Z,Italia ihmeissään koronaviruksen levitessä: kuka on maan ”potilas nolla”?,Leviävän taudin alkuperää ei ole edelleenkään voitu paikantaa Italiassa.,https://img.ilcdn.fi/TwXCv9-Am8ARyBU9-KKuyI-194A=/510x318/top/img-s3.ilcdn.fi/c72c724e2fa27dacbac5a5362e8fb94a29df0420cee73926dbc0e0c9fe3f4ba1.jpg
2020-02-25T20:18:20.000Z,HIFK:n pelaaja loi anovan katseen päävalmentajaan – Jarno Pikkaraiselta ratkaiseva siirto: ”Eikö tuo koutsi tajua”,Otto Paajanen halusi ottaa ratkaisun omiin käsiin rankkarikilpailussa tiistaina Tapparaa vastaan.,https://img.ilcdn.fi/Awk-2jK0TzY3cADIfVoQGsYLeZA=/510x318/top/img-s3.ilcdn.fi/687d474cfc139bd1bedf38924c8918f3c2644511264dd7205816425322caf7cd.jpg
2020-02-25T20:19:41.000Z,"Nämä ovat kokoomuksen seitsemän ehdotusta terrorismilainsäädännön kiristämiseksi: ”Kansalaisuus voitava perua, terroristijärjestöön kuuluminen rikolliseksi...”","Kokoomus kiristäisi terrorismirikosten rangaistusasteikkoja kauttaaltaan niin, että Suomen terrorismilainsäädäntö ei ole ”miltään osin muita Pohjoismaita lievempi”.",https://img.ilcdn.fi/fhlLypwlKAvDhu8EBTN7gK0S70E=/510x318/top/img-s3.ilcdn.fi/d051ef7d9bbdba55cefebe7e675178e58c9262188440f8b08a40ee1e00fa0539.png
2020-02-25T20:26:28.000Z,Conan O’Brien haluaa Ismo Leikolan taas ohjelmaansa – viimeksi ass-sanan vääntely nousi nettihitiksi,Ismo Leikola on innoissaan komediaspesiaaliin osallistumisestaan.,https://img.ilcdn.fi/_v9OASOVxjZKIk4taAZDcllMPwg=/510x318/top/img-s3.ilcdn.fi/6756bee41213e2b61e91a1f7571e3fde2b1e7d61ace32328f43a0777f6b8da5c.jpg
2020-02-25T20:43:19.000Z,Tapparalle taas karmea sulaminen – vastustaja iski jälleen ilman veskaria,"HIFK:n Jere Sallinen oli jo viides ukko kuukauteen, joka rokottaa Tapparaa ilman maalivahtia.",https://img.ilcdn.fi/BdnVmvA-dPudSazraoldyBFZnBw=/510x318/top/img-s3.ilcdn.fi/e95e0e15108ee498742f7849b7c2a973afda7efd08b44ad1f046ecc1ae350d6e.jpg
2020-02-25T20:46:53.000Z,Aleksandr Ovetshkinista tulee jälleen isä – Nastasija-vaimo julkaisi herkät perhekuvat,Kuvan perusteella perheenlisäystä voi olla tiedossa jo pian.,https://img.ilcdn.fi/i9SCVVWPVfdTa4htXcCt6AMUfZI=/510x318/top/img-s3.ilcdn.fi/0a0e46611e28ffbd63741094ecbe8602444027fc5a1f793847f7ca90face8f7c.jpg
2020-02-25T21:01:46.000Z,Mikä homma? HIFK:n pukuhuoneessa soi Hjallis Harkimon voimabiisi,Riki Sorsan Haaveissa vainko oot mun kuuluu HIFK:n tiskijukan Mikko Kousan soittolistalle. ,https://img.ilcdn.fi/4riYGZth5ZBzyaHOsID9UMoVTV4=/510x318/top/img-s3.ilcdn.fi/fe96fa44ff266a182158ea6a82ca5bb0e9d3372df3ca6355e52232856dad7f71.jpg
2020-02-25T21:03:35.000Z,Netflix uudistuu: Top 10 -listat saapuvat palveluun,"Netflix on ilmoittanut tuovansa palveluun listauksen, joka näyttää nopeasti katsojien suosituimmat nimikkeet.",https://img.ilcdn.fi/g7124RUodT_1rWvK5f5bb9UBmQQ=/510x318/top/img-s3.ilcdn.fi/5a301dc2efe99c203bba83315712baa42640327b8b86c7d42ce8ef7d223bba6a.jpg
2020-02-25T21:06:04.000Z,Älä lataa puhelintasi väärin – näillä vinkeillä varmistat akun toimivuuden,"Asiantuntijat kertovat, miten kännykkää kannattaa ladata.",https://img.ilcdn.fi/1HOSG9yCytiuh2F1dm5OeCyvR-8=/510x318/top/img-s3.ilcdn.fi/059d0cd772c42c20dbc34fdd1e23692f761f49821181c4a52cdc4de69f407a70.jpg
2020-02-25T21:10:37.000Z,Painin arvokisamitalisti näki läheltä Petra Ollin upean uran – esittää mestaripainijalle yhden toiveen: ”Kun aika on kypsä”,Lappajärvellä on eletty alavireisissä tunnelmissa Petra Ollin ura päättymisen vuoksi. Alakulo oli läsnä myös entisellä Lappajärven Veikkojen huippuvääntäjällä Jarmo Övermarkilla.,https://img.ilcdn.fi/f0-gwQ4eztu6n3FF4fs8XFvbQi0=/0x124:3000x2000/510x318/top/img-s3.ilcdn.fi/cf27fa96ea0021dd4fb8146d65a004892e6c98ab5ea8831b31f5778206924d11.jpg
2020-02-25T21:20:06.000Z,Poliisilla tänä yönä harjoitustehtävä kauppakeskus Isossa Omenassa Espoossa: ”Voi aiheutua meluhaittaa”,"Harjoitusalueella liikkuu poliisin tunnuksellisia autoja, siviiliautoja ja muuta poliisin kalustoa. ",https://img.ilcdn.fi/R4MnVE62Fni9vwDJWupxrIrT-AQ=/510x318/top/img-s3.ilcdn.fi/a90ccf780b49befc64dbfccccac94811aa04ec2c5d85a74f76b964458792f94a.jpeg
