paivamaara,otsikko,tiivistelma,kuva
2019-06-15T10:32:38.000Z,Pohjalaisnuorukaisten Planet Case -yhtye ponnahti lähes pystymetsästä ensimmäiselle areenakeikalle: ”Pääsemme näyttämään mihin meistä on”,Etelä-Pohjanmaalta ponnistava viiden nuoren miehen Planet Case -yhtye lämmittelee Sunrise Avenuen areenakeikkaa lauantaina Helsingissä.,https://img.ilcdn.fi/Bb_w1TU3bFsWoFp74j-ygMIGiGU=/510x318/top/img-s3.ilcdn.fi/054cd49cf46065851cc40e4005cce62e5b9ea154f5c6b1ea03cdad91a56e1b7d.jpg
2019-06-15T10:40:50.000Z,Saadaanko tänä vuonna toinen suomalainen Le Mans -voittaja? Uroteko nosti JJ Lehdon legendaksi: ”Totta kai minut tunnetaan siellä”,Jyrki Järvilehto on toistaiseksi ainoa suomalainen Le Mans -voittaja. ,https://img.ilcdn.fi/KVyeRfOR_gcLQSUwNL1W9CKd_ls=/510x318/top/img-s3.ilcdn.fi/feeacf779cc312b397433e8ac32441a0a7d111891690489679079255654d5e24.jpg
2019-06-15T10:48:59.000Z,"Tyypilliset mokat tyynyostoksilla - näin tunnistat, onko tyynysi vääränlainen sinulle",Vääränlainen tyyny voi pilata yöunet. Asiantuntijat auttavat löytämään sen oikean tyynyostoksilla.,https://img.ilcdn.fi/GgfKXMb5oubIJzPLcy1RJ29MHwU=/510x318/top/img-s3.ilcdn.fi/873e3bcb1dc47f9eca41141f0e001874f15c807932a13150aed4f6e2627d3aa2.jpg
2019-06-15T10:49:59.000Z,"""Hyviä asioita"" silmänkääntötempuilla",Korpilammen hengestä tuli myyttinen käsite. Palataanko nyt Korpilammen kokouksen takaiseen aikaan? kirjoittaa Iltalehden kolumnisti Jyrki Vesikansa.,https://img.ilcdn.fi/8fII_N7TF4Gb7pu6UdbRsnr8yxY=/510x318/top/img-s3.ilcdn.fi/97996c4970db556534be2b31941efbcf2a1f6f30a1a10b7cfa8e69efe1259354.jpg
2019-06-15T10:58:34.000Z,Pariskunta jätti työmiehet taloonsa - kahden miljoonan hienostotalo paloi täysin Yhdysvalloissa,Talossa olleet työmiehet kiidätettiin palopaikalta sairaalaan.,https://img.ilcdn.fi/78Az0bFArIMzbawmEMkdsDKBtsg=/510x318/top/img-s3.ilcdn.fi/a6b56fc5e48604761af86de9561c19483d6bd379ddd6ec15e22bac5b4c57385b.jpg
2019-06-15T11:03:15.000Z,"Järjestäjiltä varoituksen sana: Jukolan rastireitistä on tehty piinaavan vaikea, mutta peräpäässä on lupa peesata – ”Jokaisessa letkassa on se kaveri”",Ratamestarit ovat viritelleet Kangasala-Jukolan reittiä viiden vuoden ajan. Tuloksena on todellinen aivopähkinä.,https://img.ilcdn.fi/pEC0Q2zbzQK3CcleD2p0MRrjaQA=/510x318/top/img-s3.ilcdn.fi/d7ab8a2571fe26cc3605d65415bfd5568e9bdec9ddd803438bab5a8bb3785ada.jpg
2019-06-15T11:12:15.000Z,Rita Niemi-Manninen julkaisi kasvokuvan vastasyntyneestä pienokaisestaan: ”Voiko olla parempaa?”,Julkkispariskunnan esikoislapsi syntyi perjantaina.,https://img.ilcdn.fi/O3JKxgybxQ9PvL_I4pMgc7TIyAc=/510x318/top/img-s3.ilcdn.fi/9c240e765a892ae01a65a18a9b9e8b0eb959bc9518532588417dc161d50da86b.jpg
2019-06-15T11:12:53.000Z,"Nuoren naisen kauhunhetket bensa-asemalla: Mies uhkasi keittiöveitsellä, otti auton ja kaasutti tiehensä",Keski-ikäinen mies ryösti nuoren naisen auton ja kaahasi matkoihinsa.,https://img.ilcdn.fi/00RyHcj6QJMUeALiopGc4oXaaIM=/510x318/top/img-s3.ilcdn.fi/2daa8625bfe41b890ee862acace4c6f67717349ff7b28e817d2e672d5bede9f6.jpg
2019-06-15T11:23:01.000Z,"4-vuotias otti kaupasta nuken Yhdysvalloissa, poliisi uhkasi ampua vanhemmat","Järkyttävä video paljastaa, miten poliisit kohtelevat arizonalaisperhettä.",https://img.ilcdn.fi/tBZ058QqxvgjwVsaALKLQahFm9o=/510x318/top/img-s3.ilcdn.fi/9024caa9d4340a1f6d36be64051b4189ee26ab4f1386c989971bee8407810752.jpg
2019-06-15T11:25:47.000Z,Tv-asiantuntija kritisoi MM-kisoissa murskavoittoa tuulettaneita pelaajia – sai tappouhkauksia: ”Minua kuvottaa”,Kanadan naisten jalkapallomaajoukkueen ex-pelaaja Kaylyn Kyle kritisoi Yhdysvaltoja liiallisesta tuulettamisesta MM-kisoissa. ,https://img.ilcdn.fi/5qL5bjdK5mPFPVEFurXpL7RyRNA=/510x318/top/img-s3.ilcdn.fi/7229d793d123808ec6359a0f817d370e03dda6c3c956c3dc14f142317f45c1a1.jpg
2019-06-15T11:37:57.000Z,Niclas Grönholm palasi mahtavasti viiden viikon sairauslomalta: Tykitti heti ykköspaikalle!,Niclas Grönholm oli nopein rallicrossin Norjan MM-osakilpailun ensimmäisessä alkuerässä.,https://img.ilcdn.fi/NuFPwNYsgMPMdb9kDrZzE2xQeqA=/510x318/top/img-s3.ilcdn.fi/f794997f04c0a6b773ea4546836cf93c72262f922cbe465ac5c41f764c62c448.jpg
2019-06-15T12:02:12.000Z,Helle palaa sunnuntaina! ,Lämmintä säätä ennustetaan aina Etelä-Lapin korkeudelle asti. ,https://img.ilcdn.fi/nwzi4O59JZGrUiRRhskjLbR8Uvs=/510x318/top/img-s3.ilcdn.fi/462f68c60e83754a3d662cf8e1e7d78142890f38716a13753491e0cd3502297e.jpg
2019-06-15T12:04:27.000Z,Lastenohjelma My Little Pony juhlii Pride-kuukautta - tulevassa jaksossa esitellään samaa sukupuolta oleva pariskunta,Suomessa jakso on nähtävissä heinäkuussa.,https://img.ilcdn.fi/-O_ESWnFnZNB_rJzX8QjT9j1FTs=/510x318/top/img-s3.ilcdn.fi/bd2fe1b8a626f3b6ca6a626d39e17662638afdec137a35881c98f907f7d433af.jpg
2019-06-15T12:04:49.000Z,Hotellisiivoojat avautuvat: ”Minulle on huudettu monia kertoja” – Nämä virheet sinäkin teet hotellista lähtiessäsi,"Hotellisiivoojat eivät voi kertoa asiakkailleen suoraan mitä ajattelevat, vaikka sanottavaa olisi. ",https://img.ilcdn.fi/-LNv-uBE4wlc0Yi7n2uA4sQJkwg=/510x318/top/img-s3.ilcdn.fi/e4b240f6f6131ead9f2c62b4db7076cde2f82bffa0851c74b583323574e2d3b8.jpg
2019-06-15T12:29:58.000Z,Vihreiden puheenjohtaja Ohisalo sisäministerinä saamastaan palautteesta: ”En lähtenyt politiikkaan pelkäämään” - hallituksen päätös Isis-vaimoista työn alla,Hallitus pohtii eri vaihtoehtoja Isis-vaimojen ja näiden lasten Suomeen paluun kohdalla. ,https://img.ilcdn.fi/F6m9fVInLFKHUNsbyMZLxLHgRn8=/510x318/top/img-s3.ilcdn.fi/a9255dab0f6e90ea7cde5b2e60ff2fc4a308bc547c795e4fbd27fc8ad4d2d9a9.jpg
2019-06-15T12:30:10.000Z,Aina - myös lomalla ja viikonloppuna! - kannattaa mennä samaan aikaan nukkumaan - jo yhden tunnin heilahdus lisää vakavien sairauksien riskiä,"Terveyden puolesta oli parasta, että menisit nukkumaan joka ilta samaan aikaan ja nukkuisit aina saman tuntimäärän.",https://img.ilcdn.fi/VsqtGi6T8YV5hT20MVVgw0nCGJA=/510x318/top/img-s3.ilcdn.fi/ac6940d4ca1e70d1538bfc33cfca3aecd153040ecceb7df571ebdbe45109ecf0.jpg
2019-06-15T12:34:58.000Z,Herttuatar Catherine sädehti vaaleassa asussa hyväntekeväisyysgaalassa - sai syytöksiä mekon pukemisesta väärin päin ,"Joidenkin kommentoijien mielestä Catherine oli pukenut vaalean, 1500 punnan arvoisen mekon väärin.",https://img.ilcdn.fi/aOysh1gxy6Xy4-Yjp7GGbJQVzXE=/510x318/top/img-s3.ilcdn.fi/51f428072d73652cbd62a6a2c8fe3d436c3a734d2459893bb80afb8826c33505.jpg
2019-06-15T12:44:15.000Z,Veturinkuljettaja Marko pysäytti VR:n junan ja auttoi raiteilla haahuilleet joutsenenpoikaset turvaan - Matkustajat kuulivat erikoisen kuulutuksen,Kuljettajan Facebookissa jakama video näyttää poikasten kamppailun ylitsepääsemättömäksi muodostuneen ratakiskon kanssa. ,https://img.ilcdn.fi/U42XWWlxhiDXwyrwZbh94tpOshM=/510x318/top/img-s3.ilcdn.fi/260bcaae2f6cb91db567f54b2c7544d0ae9adeee3ec92f55723edbfe35e9af3a.jpg
2019-06-15T12:45:08.000Z,"Viikon parhaat asut – 7 ideaa, jotka haluat kopioida",Keräsimme katutyylikuvista inspiraatiota kesän pukeutumiseen. ,https://img.ilcdn.fi/Zk_l488ffptOAtOYLsb2JiTZdPg=/388x165:1643x947/510x318/top/img-s3.ilcdn.fi/f4bd57cf9c45d0b4d7b2889ab3d73c51a62d3e20d74efcedf1b83443b727f4b1.jpg
2019-06-15T12:51:40.000Z,Vain kerran suunnistanut Krista Pärmäkoski säväytti Venlojen viestissä – kipakka viesti järjestäjille: ”Pitää antaa nootti”,Hiihtäjä toi joukkueensa vaihtoon sijalla 181.,https://img.ilcdn.fi/-J9RAXlECgoA_mlfsEKF4TpaCEU=/510x318/top/img-s3.ilcdn.fi/1cb77c9a38f5836a319eeb86f09acea3c44a0674937a4c363b9a24cb927ff0a5.jpg
2019-06-15T13:04:52.000Z,Teemu Pukin Kirsikka-vaimo julkaisi tyylikkään hääkuvan – pari poseeraa onnellisena: ”Herra ja rouva Pukki”,Teemu Pukki ja Kirsikka Laurikko menivät naimisiin perjantaina.,https://img.ilcdn.fi/-XSZHenorHmZKD12BDUn-TV1HrY=/510x318/top/img-s3.ilcdn.fi/8f78f633a0c2f5f985a23a674f27154324d1729c606cb615152c3ef77bd2d2d7.jpg
2019-06-15T13:14:42.000Z,Berliinin eläintarhassa iloitaan erittäin uhanalaisen parin lisääntymisestä - bonobopariskunta sai terveen poikasen,Matayo tutustuu maailmaan emoaan seuraillen.,https://img.ilcdn.fi/l3DBpRicKFZpNEXSBihUoyOx2oY=/510x318/top/img-s3.ilcdn.fi/94f3b7274eb817caac7a8f93000d94e6865145ce88854d92eaf97ddb9ad0a109.jpg
2019-06-15T13:29:28.000Z,Vihreiden uuden puoluesihteerin setä on demarikonkari Erkki Liikanen: ”Hyödyllinen keskustelukumppani - yksi vinkki on tullut”,"Vihreiden uudeksi puoluesihteeriksi valittiin puolueen edellinen varapuheenjohtaja, mikkeliläinen nuorisotutkija ja biologi Veli Liikanen.",https://img.ilcdn.fi/qMQMVNUsZgzaOg29nVV5Tqwz8u4=/0x208:5750x3799/510x318/top/img-s3.ilcdn.fi/be8835aefcf2360e9c17f28f79b4d29819f00c33e547935c2f0abce601bc30f2.jpg
2019-06-15T13:43:51.000Z,"Ensitreffit alttarilla -pariskunta juhlii jo viidettä hääpäiväänsä: ""Ihan villi olo""",Viola Nygren tapasi puolisonsa Ensitreffit alttarilla -ohjelmassa.,https://img.ilcdn.fi/wjjoplZmW2QE3pzzs_AvD5tyCQ4=/510x318/top/img-s3.ilcdn.fi/92b06cf13c55d486a24c89b353959dea5f8be4dde3e18141fc39823d3a313d8f.jpg
2019-06-15T13:43:56.000Z,Matti Vanhasen munuainen poistettiin kasvainten vuoksi,"Puhemies Matti Vanhanen kertoo, että häneltä on poistettu munuainen kahden kasvaimen vuoksi.",https://img.ilcdn.fi/k9qMGp_vap50cOyOsQBtveZvgUc=/510x318/top/img-s3.ilcdn.fi/b91dc2427218cfe8ee24bec22f3726919ecb078cc8dd10180d57584bf133edc8.jpg
2019-06-15T14:15:26.000Z,"Toipilaana ajavalta Niclas Grönholmilta hurjaa menoa: otti päivän toisen erävoiton ja johtaa MM-osakilpailua – ”Ilmeisesti pitää jatkaa antibioottikuuria, kun noin hyvin kulkee”",Niclas Grönholm pitää tiukasti kiinni rallicrossin Norjan MM-osakilpailun kärkipaikasta.,https://img.ilcdn.fi/YgziaZxt1Xm3vNIRpqj2Czb3nP0=/510x318/top/img-s3.ilcdn.fi/013adf0a3409ed30e88679b5a7975583336fc6d36a4b0855a688c320cf5887c6.jpg
2019-06-15T14:27:48.000Z,Coldplay-laulaja Chris Martin ja ja näyttelijä Dakota Johnson ovat eronneet - ”He vaikuttivat todella onnellisilta”,Pari ehti seurustella lähes kaksi vuotta.,https://img.ilcdn.fi/JPgWxEyv8oi_-f-AdVsdynzMWPs=/510x318/top/img-s3.ilcdn.fi/29f2b17a0aa381482acbb8e64974a0530d8fe664a24a4e9e25fa411a4076d14e.jpg
2019-06-15T14:28:34.000Z,"Minna Kauppi räväytti Venloissa – Sipe-puoliso oli bänditreeneissä, kiitteli ansioistaan ex-kumppaniaan Pasia: ”Löytyi sellainen mies, joka opetti mut suunnistamaan”",Minna Kaupin ankkuroima Lahden Suunnistajat -37 oli kymmenes Venlojen viestissä Kangasalla.,https://img.ilcdn.fi/66OWxXRDP4wLmBc2vEaAYC3LIic=/510x318/top/img-s3.ilcdn.fi/dead90b17c33e9948c9ab38a543311ae0c5bfa320a5729565627fbed9a16ca0c.jpg
2019-06-15T14:29:13.000Z,Keppihevosten SM-kisoissa nähtiin hurja Suomen ennätys – mutta sitäkin hienompaa on harrastajien tiivis yhteisö: ”Tämä on se meidän juttu”,Ihan jokainen ei pysty hyppäämään lähes puolessatoista metrissä keikkuvan riman yli. Ei etenkään keppihevosen kanssa.,https://img.ilcdn.fi/yhoLDIjbw9GH7WszJgugT8F90SI=/510x318/top/img-s3.ilcdn.fi/c9078e46fae20914cc615a907bac7dd70ba1cd5cbf73cf725bbc313d7a21109c.jpg
2019-06-15T14:57:13.000Z,Surullinen käänne Chicagossa vavahduttaneessa murhassa: kuristetun Marlenin kohdusta riistetty pikkuvauva menehtyi,19-vuotias raskaana oleva Marlen Ochoa-Lopez murhattiin Yhdysvalloissa ja vauva riistettiin kohdusta. Nyt vauvakin on kuollut oltuaan kaksi kuukautta tehohoidossa.,https://img.ilcdn.fi/jKRpiJH0uRNZkZ679xNS-jbs3Jc=/510x318/top/img-s3.ilcdn.fi/38cb2b9e08bd1e0f990a00ee18505d626883d6e7bef717d25858766ea140e0cd.jpg
2019-06-15T14:58:32.000Z,EK13: Teemu Suninen on kiinni palkintopallipaikassa – Ott Tänak jatkaa kärjessä,Teemu Suninen on edelleen kiinni palkintopallipaikassa Sardinian MM-rallissa.,https://img.ilcdn.fi/-C7vVck4Bz-jDcUrgX24e6ZkU7c=/0x116:3000x1992/510x318/top/img-s3.ilcdn.fi/31c5176db3d036bafa396beb1718c664c3cd4082c57cf868b53d5b5cb56409b6.jpg
2019-06-15T15:00:00.000Z,Älä anna somen hämätä – kuvien välissä vain muutos asennossa,Näiden kuvaparien välillä on vain muutama sekunti.,https://img.ilcdn.fi/T8Kp46lH65VKNxJzavezbRr5LTk=/510x318/top/img-s3.ilcdn.fi/6d873da39283b64f6efdf6105412f232cacc841f3705deb6742688525468d5ad.jpg
2019-06-15T15:11:17.000Z,Lintu lensi hävittäjäkoneen moottoriin Turun lentonäytöksessä - pelastuslaitos hälytettiin paikalle,"Pelastuslaitos sai hälytyksen keskisuuresta ilmailuliikenteen onnettomuuden vaarasta, mutta apua ei lopulta tarvittu.",https://img.ilcdn.fi/c7EQ-dBepmkwxfyuQa98kOxmoI4=/510x318/top/img-s3.ilcdn.fi/7c7f166e300a5ac9f5306cbbd65306b199fcdc5a7073a9a22af0dcaeb2d749d9.jpg
2019-06-15T15:14:23.000Z,Herttuatar Meghanin äitiysvaatteet maksoivat satoja tuhansia euroja - hoviasiantuntija tyrmistyi: ”Hänen pitäisi olla varovainen”,"BBC:n entinen hovikirjoittaja toivoo herttuatar Meghanin, 37, hillitsevän tuhlailuaan.",https://img.ilcdn.fi/cQODtR9kzVbl3KQMz_bkRwJQuL8=/510x318/top/img-s3.ilcdn.fi/a766286ace1f89b20122c834410a0e56416338adac7b4dfc332308789be85fb4.jpg
2019-06-15T15:25:21.000Z,Karu startti mestaruusjuhlille: Ilves-fanit saivat heti pippurisumuttimesta – video,Ilves-fanien mestaruusjuhlat alkoivat karulla tavalla.,https://img.ilcdn.fi/scSMOLsJlsW0AU9Ycgo1xQ6KGLA=/510x318/top/img-s3.ilcdn.fi/69b7952d838652a6443a4e6f4a67b4a700a3fa55a54898cad994bc0a44eb2120.jpg
2019-06-15T15:33:05.000Z,"Tämä tankkeri-iskuista tiedetään nyt: Yhdysvallat on syyllisensä päättänyt, mutta tärkein kysymys vaivaa - Mikä olisi Iranin motiivi?","IL kokosi yhteen kaiken, mikä tankkeri-iskuista tulee tietää.",https://img.ilcdn.fi/JD2cWAnVNz4aLdpkvBRJ570SkEk=/510x318/top/img-s3.ilcdn.fi/096fb329bbf8e2c059fb93f63d2a0b9078b4814ed9de551b333f42413a33cfbc.jpg
2019-06-15T15:46:20.000Z,Yhdysvaltalaisnainen leipoi vaaleanpunaisen jättiläisdonitsin – tässä herkussa on yli 11 460 kaloria,Ruokabloggaaja väittää leiponeensa maailman isoimman donitsin.,https://img.ilcdn.fi/w1Y4l4Rmkw42Tm4g35gRPQS1zAc=/510x318/top/img-s3.ilcdn.fi/d6fbce5482116eed254717b2f1a44f388d991c8ca97df561b456ba39ea7b8255.jpg
2019-06-15T15:46:36.000Z,"NBA-mestaruuden karut jälkimainingit: Toronto Raptorsin toimitusjohtajaa uhkaa vankeus, syytetään poliisin pahoinpitelystä",Toimitusjohtajana ja GM:nä toimiva Masai Ujiri ryntäsi kentälle mestaruuden varmistuttua.,https://img.ilcdn.fi/FtVDUVQmRVuQGp_0ssPjXTChqig=/510x318/top/img-s3.ilcdn.fi/6efa02bba0f528b1cb83cdd0ada07e2663ff2c674b7087186d952f80c77f7a41.jpg
2019-06-15T16:08:36.000Z,Kuninkaallinen jälleen auto-onnettomuudessa - Kentin herttua aiheutti opiskelijan kolarin,Poliisi tutkii prinssi Edwardin onnettomuutta.,https://img.ilcdn.fi/5vtCOLa3Lhkb9KuqOMODMZCAIDc=/510x318/top/img-s3.ilcdn.fi/4c794ba0072dfe4da3dae909795e491b338b4976f97da4a35eaaa23ad32c928a.jpg
2019-06-15T16:08:54.000Z,EK14: Ott Tänak tykitti taas pohjat – Teemu Suninen kiinni podium-sijoituksessa,Sardinian MM-ralli on ollut lauantain osalta Ott Tänakin dominointia.,https://img.ilcdn.fi/pdmFBbQnYBWId-7EgATGZTpmpgE=/0x64:3000x1940/510x318/top/img-s3.ilcdn.fi/d203a9c05dbb2027b3167aa94159c5c46c2d46f10ec95b21cfd61798f251c642.jpg
2019-06-15T16:40:55.000Z,"”Nöyriä, sisäänpäin kääntyneitä ja analyyttisiä” – Minna Kauppi ilmoittaa, miksi Suomen huippusuunnistajat eivät kiinnostaa kansaa","Moninkertainen arvokisavoittaja oli mediatutkan alla, tämän päivän tähdet eivät ole.",https://img.ilcdn.fi/x-DnjssAn7-6MIVHq7wE2DV4KHQ=/510x318/top/img-s3.ilcdn.fi/a2d8473d10a407ca71b15d9d254aadecf54e610009bb6e3deff6312051055777.jpg
2019-06-15T16:47:11.000Z,"Hugo Häkkisen ylioppilaskuva julki, ylpeä Erja Häkkinen Instagramissa: ""Edelleen juhlatuulella!""","Erja Häkkisen ja Mika Häkkisen poika Hugo Häkkinen, 18, on ylioppilas.",https://img.ilcdn.fi/TbWGr7BS5OEq7vWHjqI-Fe0y0tQ=/510x318/top/img-s3.ilcdn.fi/e54cf14a67bacead39633c0810bea35ccf841991c7fa07e0fd5518accafefad5.jpg
2019-06-15T17:00:09.000Z,Annimari Korte moitti urheilijoita liiasta syömisestä – Krista Pärmäkoskelta viileä kuitti: ”Kyllä voi pullaakin syödä”,"Huippuhiihtäjä haluaa näyttää nuoremmille esimerkkiä, miten tärkeää ravinto on.",https://img.ilcdn.fi/WGkXUR8cqb3KlIZit_zUjhEErzs=/510x318/top/img-s3.ilcdn.fi/267b3d7f78af69b6bdbbb61784ad2dab02d87eaee0dcb7c44210f142db9f65c9.jpg
2019-06-15T17:01:51.000Z,"Kuva kertoo kaiken: Ilves-fanit kokivat kovia mestaruuden ratkettua – ""Kyllä siitä varmasti seuraamuksia tulee""",Tampereen Ilves juhlii jalkapallon Suomen cupin voittoa.,https://img.ilcdn.fi/EDqbOombKwolq-YLhGT4pk-Vt3w=/510x318/top/img-s3.ilcdn.fi/9ef3dbc3a50a01460be2e3988a52c0ae93a06e88620e5895e7f7f117a3fe4c00.jpg
2019-06-15T17:06:23.000Z,Kesän 7 kuumaa uikkaritrendiä – nyt suomalainenkin uskaltaa pukea pikkubikinit,"Ysärivaikutteet, pikku-bikinit ja ekologisuus: siinä muutama trendi, jotka leimaavat tämän kesän uikkarimuotia. ",https://img.ilcdn.fi/1glYhj_jgaLPHW7s7LOlDD38OVI=/510x318/top/img-s3.ilcdn.fi/9f0743b9c08c1e2458baf16952d9a00fbeaf29b8fff91abfe174ad8f4e7372ec.jpg
2019-06-15T17:08:31.000Z,"Seinäjoen keppihevoskisoilla jopa miljoonayleisö maailmalla - Tekeillä dokumentti Kiinaan, saksalaistoimittajat häkeltyneitä: ”Tämä on jotain erityistä”",Alkuperäisen suunnitelman mukaan myös Netflixin kuvausryhmän olisi pitänyt saapua Seinäjoelle tekemään dokumenttia keppihevosten SM-kilpailuista.,https://img.ilcdn.fi/pkF2Bx7c-j4gIxfTzpHuPvMckDY=/510x318/top/img-s3.ilcdn.fi/116087aeabe85dfd1c3989232bcd2c210a08cd4579714528f571178710b29bb6.jpg
2019-06-15T17:15:46.000Z,EK15: Ott Tänak dominoi Sardiniassa – Teemu Suninen matkalla palkintopallille,Ott Tänak johtaa Sardinian MM-rallia lauantain jälkeen.,https://img.ilcdn.fi/pdmFBbQnYBWId-7EgATGZTpmpgE=/0x64:3000x1940/510x318/top/img-s3.ilcdn.fi/d203a9c05dbb2027b3167aa94159c5c46c2d46f10ec95b21cfd61798f251c642.jpg
2019-06-15T17:18:07.000Z,"NHL-vahti Pekka Rinne myy ökykotiaan 1,5 miljoonalla eurolla – talossa oma baaritiski hanoineen",Nashville Predatorsin suomalaisvahti Pekka Rinne myy Nashvillen kotiaan.,https://img.ilcdn.fi/Besyq7kzIiRANVw0BrUWQFkbD0Y=/510x318/top/img-s3.ilcdn.fi/0bb2cfca6732fa6f83a11efd85c41cdaaf5c1c1ad60cef7ae341410355fcfba4.jpg
2019-06-15T17:32:10.000Z,Katso kuvat ja video: Kansainväliset hävittäjät upeassa lentonäytöksessä Turussa,Suomen ilmailuliiton satavuotisjuhlanäytöksessä esitellään Suomelle kaupattavia hävittäjiä ja muistetaan Juri Gagarinia.,https://img.ilcdn.fi/eQ8tPUarxdvNvfUbEcwedp8TQj4=/510x318/top/img-s3.ilcdn.fi/1902b75eb879de6833c1e6550ef280bd079c5149558008a4c9ce257afe831a54.jpg
2019-06-15T17:34:08.000Z,"Jättimäinen Rasputin-seksikartano tekee Tallinnasta Pohjolan Porno-Hollywoodin – 100 esiintyjää, 50 makuuhuonetta, nakukylpylä...",Tallinnaan puuhataan yhtä maailman suurimmista nettipornokeskuksista.,https://img.ilcdn.fi/zA6zeyT7O7rypJf-U8u1oHuiCYo=/510x318/top/img-s3.ilcdn.fi/301c2d194944115d7211717f5ccf6216e9eb3cf88582994f5c1dafcaf9a43fb7.jpg
2019-06-15T17:46:59.000Z,Kidnappausdraama Ruotsissa: Miestä pidettiin vankina asunnossa Tukholmassa - neljä pidätetty suuren poliisioperaation päätteeksi,"Perheeltä vaadittiin rahaa, mutta vankina pidetty mies onnistui pakenemaan.",https://img.ilcdn.fi/kWRrcMeLW2QsXEZ4cKorxPgI_4E=/510x318/top/img-s3.ilcdn.fi/482b414855c404217d5c459bfcef501e6868ec9517041bf8dfb52ce2dbadf657.jpg
2019-06-15T17:53:57.000Z,Prinsessa Madeleine edusti tyrmäävänä Korean presidentin vierailulla - myös aviomies Chris O’Neill ilmestyi viimein Ruotsiin,Chris O’Neill ei osallistunut edellisviikon juhlallisuuksiin.,https://img.ilcdn.fi/l4m4GpG0BBxb5vO5J5sqsp8ZIJ0=/510x318/top/img-s3.ilcdn.fi/38386c8726d4f1279c973997f6cf404924e9e2d4a39335b7dd498e46199164ac.jpg
2019-06-15T18:00:30.000Z,Kauppalehden pörröinen nimitysilmoitus saa katsomaan toisenkin kerran: Lumo-koiran toimenkuva ”on olla vaan”,Matkahaukka Kirkkonummen toimitusjohtaja Petri Pohjonen suosittelee toimistokoiraa työpaikoille varauksetta. ,https://img.ilcdn.fi/nEbIRTwCJzDmaTrIPjN7bHo7VWY=/510x318/top/img-s3.ilcdn.fi/7960b9c3da4cf825deece12f8c97a338112695937ce777448d7f3d55a6434bfb.jpg
2019-06-15T18:04:29.000Z,Iltalehti tavoitti pippurisumun keskellä olleen Ilves-kannattajan – useita viety sairaalaan: ”Ei ole tietoa onko kaverin näkö kunnossa”,"Iltalehti tavoitti Ilves-kannattajan kertomaan, mitä Suomen Cupin pippurisumutehässäkässä tapahtui.",https://img.ilcdn.fi/ntHNpw79hkZNRGPxwARjiLNgX_0=/510x318/top/img-s3.ilcdn.fi/90f484f4cbdb182aeefc3902097ac9f5765951cfc4a4544f911352711b05a06c.jpg
2019-06-15T18:06:43.000Z,Tanskalainen Amalie ei voinut sietää peilikuvaansa vuosiin – löysi elämänsä rakkauden nettipelistä,Amalie on ollut koko ikänsä ylipainoinen. Hän ei olisi ehkä koskaan lopettanut ikuista laihdutuskuuria ilman nykyisen puolisonsa tukea.,https://img.ilcdn.fi/_vuuJvHvO3ZfDDWK0QTyyQB4zVM=/510x318/top/img-s3.ilcdn.fi/009e9aa10f95bfefb18c18a8dd4424cf6f30ce71b54c5b190ae5ec62ac813cbd.jpg
2019-06-15T18:24:15.000Z,Onko maailman vanhin kannabiksenpolttoväline löytynyt? Suitsukekippoa käyttämällä pössyteltiin ehkä jo 2500 vuotta sitten Kiinassa,"Arkeologit löysivät puisen kipon, jossa on jäämiä voimakkaasta kannabiksesta.",https://img.ilcdn.fi/5-Uy8rqsW_7htrPNlvDPeCiFSzI=/510x318/top/img-s3.ilcdn.fi/34339ca24027146155577e1b2465904ebcfaaeb8e780656bc916109f7cb86a63.jpg
2019-06-15T18:41:49.000Z,Patrik Laineen Winnipeg Jets hankki lisää suomalaisia – Suomen mestaruutta juhlineelle Tappara-hyökkääjälle kolmen vuoden sopimus,Joona Luoto ja Winnipeg Jets tekivät NHL-sopimuksen.,https://img.ilcdn.fi/bMpZRRMy5D1xyIsqK1Vo0_vkwhk=/510x318/top/img-s3.ilcdn.fi/c8b9e2935471a9848abe6d4e12812cb35f3c6fb96d97b9b5ae514f7d2ecd1fcd.jpg
2019-06-15T18:44:31.000Z,Raiskauksesta epäilty mies vapautui poikkeuksellisella päätöksellä: Saattoi olla unihäiriön vallassa,Korkein oikeus on hylännyt hämeenlinnalaismiestä vastaan nostetun raiskaussyytteen poikkeuksellisella perusteella.,https://img.ilcdn.fi/w0sahJW6deTaWqA2l6sNBLZplgM=/510x318/top/img-s3.ilcdn.fi/3c8bae50d6c21fc1bac69022bd528a164ebfdd1bc382d99028fdfa71a8f9a2e1.jpg
2019-06-15T18:56:32.000Z,Julia Roberts paljastaa: Pretty Womanin alkuperäinen loppuratkaisu oli synkkä ja surullinen,Vuonna 1990 ensi-iltansa saanut Pretty Woman kuuluu kaikkien aikojen suosituimpiin romanttisiin komedioihin. ,https://img.ilcdn.fi/LxGlrkqbDkdtG0xN53E1So1Ggcs=/510x318/top/img-s3.ilcdn.fi/0ac13948a98db022ce579e953c003a27aa9a0f83163bc83ec311ec5b16ddc7b1.jpg
2019-06-15T19:06:00.000Z,Koira taklasi koulutytön maahan ja puri kasvoihin - omistajalle sakot ja tuhansien korvaukset,Tytön mukaan koira veti häntä kasvojen alueelta hampaillaan. Jälkiä tuli myös 50-kiloisen koiran kynsistä.,https://img.ilcdn.fi/SAWY3Wg5FU_NI7_2CjDUwDnVMTU=/510x318/top/img-s3.ilcdn.fi/5fbf676a56f8a340d9d499a98aece67ffa47ae5d6afa17ff6a39373fc15f8739.jpg
2019-06-15T19:14:53.000Z,Voiko enää alemmaksi vajota? Kuolleen sankarivalmentajan muistopaikka häpäistiin törkeästi,Seura joutui siirtämään muistipaikan stadionin sisälle.,https://img.ilcdn.fi/m5WGFr6g2fPAWtfdS_MFabbi5v0=/510x318/top/img-s3.ilcdn.fi/78b9d116c779f7fefe829c37b2e162f7850ac13a62f0ce427ac206f15957a65a.jpg
2019-06-15T19:31:14.000Z,Notre Damessa ensimmäinen messu sitten tuhoisan tulipalon - osallistua sai vain kypärä päässä,"Kattoon viritettiin suojaverkko, mutta kiveä saattaa yhä pudota niskaan.",https://img.ilcdn.fi/EK7jc0rYCFlLKIOC1mC3uvhEY1M=/510x318/top/img-s3.ilcdn.fi/943ce6c4f469114a689c90c90fb6c15e584964666feca1b8a11f4413baf2af07.jpg
2019-06-15T19:43:56.000Z,"Sara Sieppi juhlii syntymäpäiväänsä Selviytyjät Suomi -kuvausten jälkeen -ystäviä, poreamme ja juustohampurilaisista tehty kakku","Sara Sieppi, 28, juhli syntymäpäiväänsä vähän jälkikäteen Selviytyjät Suomi -kuvausten takia. ",https://img.ilcdn.fi/OrhsdI4VauppjyoSWBPoepFo6tk=/510x318/top/img-s3.ilcdn.fi/e228cfd8b7b4df6503da1c420a22b7d7325a3679fe3733c7bf07fb424c6a688c.jpg
2019-06-15T19:53:04.000Z,F1-kuski lataa: Kisakalenteriin palaavalla radalla mahdotonta kilpailla – ”Yhtä paha kuin Monaco”,"George Russellin mukaan Zandvoortin F1-rataa täytyy muuttaa, jos Hollannissa halutaan todella ajaa kilpaa.",https://img.ilcdn.fi/AkbG9KJkgzRE4J7j4Pp6pG1b8cI=/510x318/top/img-s3.ilcdn.fi/80b2f70534e3667bd505efa10ffdf9de340e5778fa41e9a259ad02fa00185eae.jpg
2019-06-15T19:57:21.000Z,Kuljettaja kuoli moottoripyöräkilpailussa Imatralla,Imatranajo-kilpailussa kuljettaja kuoli lauantaina.,https://img.ilcdn.fi/JchHy2kx511nE9FpnGvEmp5-t8U=/510x318/top/img-s3.ilcdn.fi/40db9818c23af31d2fe364bef7d740a1d197ea6a647b4f20153058fab436aaa5.jpg
2019-06-15T20:05:42.000Z,Nylon Beatista tuttu Jonna Geagea muuntautuu Madonnaksi - tässä esimakua,Jonna Geagea pääsee syksyllä esittämään pitkäaikaista idoliaan.,https://img.ilcdn.fi/rx57DJmjfdvm59RTxw6paFn7JMc=/440x375:1818x1235/510x318/top/img-s3.ilcdn.fi/226ed3852969fbfaaf30336f07334ae276cdeadfdd55db1720dbd308617d82bf.jpg
2019-06-15T20:27:44.000Z,Asuntoon päästetty tuntematon henkilö tyhjensi koko tilin - pankin ei tarvinnut korvata mitään ,"Kuluttajan vastuu verkkopankkitunnusten väärinkäytöksistä voi olla yllättävän suuri. Pankki ei vastaa vahingoista osaksikaan, jos kuluttaja on ollut törkeän huolimaton. ",https://img.ilcdn.fi/8m-GmIX3jX8cnZwqC_s7eGcVGnU=/510x318/top/img-s3.ilcdn.fi/114b8133fb7c0d082765f9d43e9c755ec864ef4e57b7819a0a7a93e0c10fda4c.jpg
2019-06-15T21:11:52.000Z,George Clooneyn onnettomuudella rajut seuraukset - Amal Clooney teki lopun moottoripyöräilystä,George Clooney on luopunut rakkaasta moottoripyöräharrastuksestaan.,https://img.ilcdn.fi/pj-wuMb46vIJ_TCHeKGnTB3BT4c=/510x318/top/img-s3.ilcdn.fi/7e82328160a7655e731507b5bf489e0a3e7f0502f50b898788280880f7b7f18d.jpg
