paivamaara,otsikko,tiivistelma,kuva,id
2023-10-13T09:08:56.000Z,Niinistö kommentoi kaasuputkiasiaa: ”Nato kykenee antamaan kaiken mahdollisen avun tutkinnassa”,JEF-maiden johtajat kokoontuvat perjantaina Gotlannissa. Kokouksessa keskustellaan muun muassa Suomenlahden kaasuputkitutkinnasta sekä JEFin roolista.,https://img.ilcdn.fi/aznjriYW2J8m5lWxz3g3xfkv8zA=/510x318/top/img-s3.ilcdn.fi/3466fb528a0b945cc5b5ce517d36199c4cf906c944f0116f3c4ccb49251def3c.jpg,69D4CC5C777746C38B187040C3F865D7
2023-10-13T09:10:34.000Z,"Säteilevät Iphonet määrättiin myyntikieltoon – Apple paljasti, mitä myydyille puhelimille tapahtuu","Ranska määräsi Applen keskeyttämään Iphone 12 -puhelinten myynnin liian voimakkaan säteilyn vuoksi. Apple on kertonut ratkaisevansa ongelman ohjelmistopäivityksellä, mutta samalla se kritisoi ranskalaisviranomaisten tapaa mitata säteilyarvoja.",https://img.ilcdn.fi/rPXQ6RXsQbyHWYHEIBrv3G6ver0=/510x318/top/img-s3.ilcdn.fi/604f141e3dce63347c8c8109ff144b05a1992d009db6c389d8fd3651a0e22a4b.jpg,C364C229CDE7438D8E7491F01CCA2341
2023-10-13T09:11:39.000Z,AL: Tamperelaista K-Supermarketia piinaa ikävä ilmiö – Kauppa teki kovan ratkaisun,Tampereen keskustassa sijaitsevan kaupan pikakassoilla voi ostaa tällä hetkellä vain rajallisesti tuotteita.,https://img.ilcdn.fi/bWmD9Q8TJ2lGpoc5LUl6thlCZi0=/510x318/top/img-s3.ilcdn.fi/55118faeb5ab4653054270ca3b8d9d28e7401f1f57f8ef9ab45b6221d80d78cf.jpg,F193756319F643E6A479D2A7A29B9DB8
2023-10-13T09:11:41.000Z,Suora lähetys: Putkirikko puhuttaa – Presidentti Niinistö kertoo keskusteluista JEF-johtajien kanssa,Presidentti Niinistö tapaa suomalaismediaa Gotlannissa.,https://img.ilcdn.fi/bRsbDzTLqnxcF6pIBBWCpFFu-lo=/510x318/top/img-s3.ilcdn.fi/1e4d225e08af8891f326f87318fb93d730b8cb7c2e2942f0b1d5f3124d14990c.jpg,B5B0A1CAD6BA456886D05534B1020EF4
2023-10-13T09:19:50.000Z,Maajussi-Janin suora kysymys saa aikaan pitkän hiljaisuuden: ”Nyt meni se pupu pöksyyn”,Maajussille morsian: Kaikki tarinat -jaksossa lamaannuttava jännitys ottaa vallan useammastakin puolisoehdokkaasta. ,https://img.ilcdn.fi/tr1bz_ishBALVT6pgW3aoCK_OlI=/510x318/top/img-s3.ilcdn.fi/24b441e270645f48d1296cccefe6a14a8804536a133ba9376199d450cc9c70db.jpg,E698C4BCECDF445A891718A641E046AF
2023-10-13T09:21:54.000Z,"Anssi Kukkonen, 89, lataa suorat sanat: Nämä urheilulajit risovat – ”Ei mitään järkeä”",Kukkosen mielestä e-urheilu ja voimanosto eivät ole urheilua.,https://img.ilcdn.fi/6IQzAZYm75HxvD4WargiGP6ACaI=/510x318/top/img-s3.ilcdn.fi/9a760f7676e78263e8c57052b57d3f3f7deb7f9fb6ff43796bc87c9af89a0233.jpg,F838006D808C4C0CB1184244B03DE68A
2023-10-13T09:33:33.000Z,"”Irtokynnet kimaltavat, tekoripset räpsähtelevät” – Teemu Keskisarjan puhe eduskunnassa nostatti kohun, näin hän vastaa",Perussuomalaisten kansanedustajan Teemu Keskisarjan puheet herättivät voimakkaita tunteita eduskunnassa ja somessa.,https://img.ilcdn.fi/FzYJSITUQmqYnGm9k5ZuZ_0Ye1g=/510x318/top/img-s3.ilcdn.fi/c39a5ec268005a49a8bb6f4322a1221f346f5b972e289e784099d9506640bf97.jpg,79B40919308E4B4B9626DCAB8E6E5961
2023-10-13T09:58:52.000Z,KooKoo heräilemässä koomastaan – Uusittu ruotsalaisketju tarkkailuun,KooKoo:n asema Liigan sarjataulukon hännässä ei kerro koko totuutta joukkueen vahvuudesta.,https://img.ilcdn.fi/j170hHJ5ljR01NdBkakSe8Vt26o=/510x318/top/img-s3.ilcdn.fi/00c894dfd8f97722be0f77af0af0be77dca2fbeefffaa2eb6799171776b72e47.jpg,C5FFB7C14A9F4985A950CA0162E99CAC
2023-10-13T10:02:32.000Z,Kaleva: Oululaisseuran valmentaja hyllytettiin – Epäillään epäasiallisesta käytöksestä,"Uintivalmentaja Tomi Pystynen on hyllytetty tehtävistään, uutisoi Kaleva.",https://img.ilcdn.fi/unQROZb5ztwHFDpnhOuB4c7VeUI=/510x318/top/img-s3.ilcdn.fi/d4411eafe4bacff27c4f483778ffa5b77f6f323c25bbb07c471d8864919ac433.jpg,D55714E1244E4BFCACD516A27CB3A7DE
2023-10-13T10:15:01.000Z,Maajussi-Anna-Reetta ja Kalevi: Poika syntyi!,Anna-Reetan ja Kalevin ensimmäinen yhteinen lapsi on syntynyt. ,https://img.ilcdn.fi/_T5cIRkJWJbAj7pJOi1F23xzOL4=/510x318/top/img-s3.ilcdn.fi/6a467fe38a821b84917690a0fc44efa984daa64129da8d282f1193aa6ee08f87.jpg,FF43DF7C5728442EBD5BD0BE6B866F4A
2023-10-13T10:17:08.000Z,"Hakunilan palo: Kiuas oli päällä tunteja, saunassa vaatteita",Hakunilan palon tutkinta on edennyt.,https://img.ilcdn.fi/kT7gRnQgVEz2-S99ZNSF57ZNCyY=/510x318/top/img-s3.ilcdn.fi/7a74973bc9c45ff070ab01017d2f69643ae07dee897419597e9d4a069b7bfc59.png,F82E74E56E9B4AAD8F1F2E8956F3EF8E
2023-10-13T10:23:01.000Z,Yle ja HS: Haavisto ja Stubb ovat presidenttikisan kärkikaksikko – Toisesta kierroksesta on tulossa äärimmäisen tasainen,"Pekka Haavisto ja Alexander Stubb ovat selvästi suosituimmat ehdokkaat uudeksi presidentiksi, Ylen ja Helsingin Sanomien perjantaina julkaistut gallupit kertovat.",https://img.ilcdn.fi/jlYR4MlhIX4U7J0zjherxmLl0QI=/510x318/top/img-s3.ilcdn.fi/6d62cca311850093aa431f86541d0eb7c4a9aadacd7dd32a56f93aa500f26856.jpg,519FFE9611894BCFA75DC5F9BBFC681E
2023-10-13T10:23:47.000Z,Rockstop!-ohjelman juontaja Heli Nevakare on kuollut,"Musiikkitoimittaja Heli Nevakare on kuollut, uutisoi Yle.",https://img.ilcdn.fi/4i8EzBjF97OenBoKn9ppwMVmTtE=/510x318/top/img-s3.ilcdn.fi/ec04cafffcb0570375e69abff9a795e72b945bd517ba9ce4dabfb8f85ff8d838.jpg,9F29236E1234495CB3B33DAC37EB20C8
2023-10-13T10:23:51.000Z,"Veitsimies hyökkäsi kouluun Ranskassa – Yksi kuoli, useita loukkaantui ",Yksi kuoli ja useita loukkaantui veitsihyökkäyksessä kouluun Ranskan Arrasissa.,https://img.ilcdn.fi/cdDq-CUOUc86abZJsipJn2dQ8EU=/510x318/top/img-s3.ilcdn.fi/948fd107a337d38592a0119c6e2cd6112df8d16b984cd0d87c6cee346cb1e8f3.jpg,E286C91F66E045A4A00982FA390BF480
2023-10-13T10:42:19.000Z,Järkyttävä dopingongelma räjähti käsiin Suomessa,Suomalainen fitnessurheilu painii karmean dopingongelman kanssa.,https://img.ilcdn.fi/PhKI3DPvCN2gm0lYiaf1zPOOyws=/510x318/top/img-s3.ilcdn.fi/92cbaf01fe728b54e2e4909a3d655ab72846108f330664a4a2d74d866e61fd88.jpg,329D1F77B9284C6D8E2CBB2C33F4AD7D
2023-10-13T10:47:14.000Z,Sisäministeriö valmistelee liikkumisrajoituksia Inkoon satama-alueelle,Sisäministeriö tiedotti asiasta perjantaina.,https://img.ilcdn.fi/n2nNaHgXLj82QXeFU7vKGQULtzo=/510x318/top/img-s3.ilcdn.fi/947667b6e86ffbe33bcd0a28d460ec29482d8cf96d9dbf546bb67fc26a1c521e.jpg,D101C62266D54CFD88C33399C67109CE
2023-10-13T10:52:45.000Z,"Rahaa huijataan nyt katalalla tyylillä – Ota välittömästi yhteys poliisiin, jos havaitset","Itä-Suomen poliisin tietoon on tullut useita petoksia, joissa on sama tekotapa.",https://img.ilcdn.fi/sBtwfMRkuHzt86cZInUYu8KZv5k=/510x318/top/img-s3.ilcdn.fi/58d2045db93c70c10e377a311e7492172764c9b87c0c7f6b41437fcfb9b67ba7.jpg,2ED16777DF2F47619534BADFF08E9E81
2023-10-13T10:58:56.000Z,Norjan ihmepoika vihaa isäänsä – Yleisurheiluliitolta tyly siirto,"Norjan yleisurheiluliitto ilmoittaa, ettei se myönnä valmentaja Gjert Ingebrigtsenille akkreditointeja kauden 2024 arvokisoihin. Gjertin ja tämän pojan Jakob Ingebrigtsenin välit ovat täysin poikki.",https://img.ilcdn.fi/_YHF3N1VikXQR3go_DwTt577p6k=/510x318/top/img-s3.ilcdn.fi/4f7ea2a5debab90635d9cfa42c585eb08cac90c09b21d1e7104a4357faa0cc29.jpg,D337018AA47A4EDC89909611806EFD82
2023-10-13T11:11:08.000Z,Jättimäinen lista julki: Peräti 13 ihmistä tuomittiin maksimivankeuteen Anom-huumejutussa,Keskusrikospoliisin tutkimasta huumausainerikoskokonaisuudesta on annettu tuomiot.,https://img.ilcdn.fi/WWXJpszNjxVZCbCbvqAYbmsTX7M=/510x318/top/img-s3.ilcdn.fi/8af7a222e1c87aed7df383b158063b182cf79e09198cb8656bd35cba5af6673a.jpg,31D90DB6E9DA421CBC00A5D2EC3563FA
2023-10-13T11:16:12.000Z,Tämän poliisiraportin Madeleine ja Chris halusivat salata ,Madeleine ja Chris O’ Neill halusivat salata heihin liittyvän poliisiraportin.,https://img.ilcdn.fi/K_82l6H5lIUNh8zX82ERGkiIlzE=/510x318/top/img-s3.ilcdn.fi/a0635d7d8b5e061449fdfaa333fbdaa7ab11f579efaf5dfdd4108d9440ab5aaa.jpg,01152CEF8F51470395DE82B68FC4DC9A
2023-10-13T11:16:48.000Z,"Katso koko lista: Nämä tuet nousevat 5,9 prosenttia - Nämä tuet hallitus jäädyttää","Kansaneläkeindeksi tuo 5,9 prosentin korotuksen vain osaan Kelan etuuksista, hallitus esittää muihin jäädytystä.",https://img.ilcdn.fi/llx9viLrVIPZF-NCGklDokkeep0=/510x318/top/img-s3.ilcdn.fi/3075cee9ba69ce8816a26dd1632b2de6527cdd7307686cdd8ba03266f83cd5a1.jpg,BA2D827E05624E50B1985DF7AEFD1295
2023-10-13T11:27:44.000Z,Huuhkajilla kutkuttavat lähtökohdat EM-karsinnoissa – Vakioveikkauksessa Suomi on maistuva merkki,Slovenian ja Suomen kohtaamisessa suurimmat paineet ovat kotijoukkueen harteilla.,https://img.ilcdn.fi/_G-DsBK5hf7LSg2RwCFWqRnZr78=/510x318/top/img-s3.ilcdn.fi/f3f8fffd07257d175e216daed62897ba173de01091c063e57b6415969c33535e.jpg,517A367A227D426EBB1838421BBD11E8
2023-10-13T11:44:26.000Z,Pääministeri Orpo valitsi varakkaiden suosimisen,"Varainsiirtovero on turha ja joutaisi jo historiaan – veronalennusta ei kuitenkaan pidä maksattaa ensimmäistä asuntoaan ostavilla, kirjoittaa vastaava päätoimittaja Perttu Kauppinen.",https://img.ilcdn.fi/sYRietbmoi5EGXZJP5t_UA-GnrQ=/510x318/top/img-s3.ilcdn.fi/c15e8ba515a856f8bc099c6b5bd256e6ffa7db46c4d6b68a54006d2cf49fc3ba.jpg,D47F67B07EA14CF3A01E3FA4B6D2A529
2023-10-13T11:46:35.000Z,Urheilutähti joutui onnettomuuteen ja pelasi maskin kanssa – Paljasti nyt kasvonsa,David Njoku pelasi viikonloppuna naama peitettynä.,https://img.ilcdn.fi/aU7KFG-5uBbupdissfM8eZSGGTU=/510x318/top/img-s3.ilcdn.fi/45ce65c24d66d5abe3d8a05b2500382e3d064489a65c2573e1c1cda2cc98a371.jpg,54E65BC8D2514B85B190C8A3053D5F00
2023-10-13T11:59:26.000Z,"""Ehdottomasti huolestuttavaa"" – Ruotsalaiskomentaja pelkää, ettei epäilty putki-isku jää ainoaksi laatuaan",Havaitut vauriot Suomen ja Viron välisessä kaasuputkessa herättivät huolen myös Ruotsissa.,https://img.ilcdn.fi/Ojn4x3se2JPW2-eQ5CLIUjiZgBM=/510x318/top/img-s3.ilcdn.fi/a69aa7bd08e3e72552a337e3d7e5d39a12abeeaa2a80bea477fc9bcc4fc2e735.jpg,E8C2963F5A6C451A81EA17784FBF93F0
2023-10-13T12:10:18.000Z,Toteutuuko Jari Sillanpään kohukiertue lainkaan? Näin kehnolta näyttää lipunmyynti,Jari Sillanpään joulukonserttikiertueen lipunmyynti on alkanut huonosti. Manageri Ulla Huttunen on silti luottavainen.,https://img.ilcdn.fi/x5s5ApawROEC-_Fc8YpIpl4hH8Q=/510x318/top/img-s3.ilcdn.fi/4e4122a854a8ad18da97dc0e97a6d64d522c285f1f27bc4ee37cefe27b050380.jpg,DB53587C8F2E43288FC96DF5CE98ED6C
2023-10-13T12:17:09.000Z,Esitys ensiasunnon varovapauden poistosta kuohuttaa: ”Hallitus romuttaa nuorten asumishaaveet”,"Opposition kansanedustajat ja Keskustanuoret syyttävät hallitusta siitä, että se pistää nuoret kärsijäksi varainsiirtoveron uudistuksessa.",https://img.ilcdn.fi/2jwNpzGI1TkNBBadT8tVdKcksF4=/510x318/top/img-s3.ilcdn.fi/cf8bffd6f24f7f6cf04a7b3ae7d51627527cb4a425a737e7305f855e40d8029b.jpg,60854F8F899F4D539D30BEF742FD0C52
2023-10-13T12:19:16.000Z,Lehdistötilaisuus muuttui kaaokseksi – Logan Paulin kasvot lyötiin verille ,Logan Paul ja Dillon Danis eivät selvästikään siedä toisiaan. ,https://img.ilcdn.fi/Jnm2HCMHrJO316T4AOwGqwC6qaI=/510x318/top/img-s3.ilcdn.fi/2f7b0ec1cd696de9bd4b0c634ef266780f35920ab2fd6634cf6d139621e7d140.jpg,ED6D20D58F5E4B3EB90CF2F6C119C943
2023-10-13T12:31:05.000Z,Helsinkiläisestä asunnosta tehtiin häkellyttävä löytö –  Valtava rikos paljastui vahingossa,Poliisin tavanomaisella tehtävällä paljastui 37 varastetun polkupyörän kätkö.,https://img.ilcdn.fi/QNnUUaFaCJjHTbRWHDqorTshGF8=/510x318/top/img-s3.ilcdn.fi/3d1ba195d8b06bc87c227f11e2cd464370043a709e9bab02230210e910437ce2.jpg,571ACDD5C677442590A2CFECC3CD39AF
2023-10-13T12:45:17.000Z,Satojen venäjänkielisten pommiuhkausten aalto Liettuassa – Kohteena koulut ja päiväkodit,Liettuassa on raportoitu useista venäjänkielisistä pommiuhkauksista.,https://img.ilcdn.fi/1UglcZTi70qTwGq8Lm-yd7W3rs4=/510x318/top/img-s3.ilcdn.fi/04a47d29a860abebc4ca191ff388d5553a05aa37b27e8917ffd316ce8ef8242a.jpg,2D84FB39799E4D94B5CFE2BECA71C841
2023-10-13T12:48:06.000Z,Euroopan etsityimpiin rikollisiin kuulunut Jan Salminen sai tuomion,Jan Salminen tuomittiin ehdolliseen vankeuteen talousrikoksista.,https://img.ilcdn.fi/5tT-fAT0jiLTucJuCSzg0WuDeIU=/510x318/top/img-s3.ilcdn.fi/779e763761768a17237592f09efedcaaae0e7eb0a534e8698ec57690616b5fc6.jpg,5DEDE9FBBCAE49CB88FC858820113E49
2023-10-13T12:49:55.000Z,Syömishäiriöt yhä yleisempiä – Yksi syy ylitse muiden,Koronaepidemian aikana syömishäiriöt lisääntyivät Husin alueella jopa 70 prosenttia.,https://img.ilcdn.fi/yZ0EBiLeqvjhGFbrOf3ZevGW-BQ=/510x318/top/img-s3.ilcdn.fi/bc0f4e274e566ef5233f4243fb3204028b8dbf115f59c771235984dc4192b0c2.jpg,538B274FC8904EE485CBDC0AC01A85E5
2023-10-13T12:54:07.000Z,Rattijuoppo kaahasi 160 km/h ja törmäsi puuhun Seinäjoella – Kaksi kuoli,"Onnettomuutta on tutkittu törkeänä liikenneturvallisuuden vaarantamisena, törkeänä kuolemantuottamuksena sekä rattijuopumuksena. ",https://img.ilcdn.fi/zgQtbRgeLsZ_DG0nkgS9JxhDfIk=/510x318/top/img-s3.ilcdn.fi/2a71ccf6581153534a61d80318515ed543830c10d67208b6c510e5e7a5652521.jpg,2F2B702E1F58438E87AEC6C07EE5964F
2023-10-13T13:02:03.000Z,Miksi huimassa vireessä oleva pelaaja jäi taas ulos Huuhkajista? Näin Markku Kanerva vastaa,Simon Skrabbin seuran päävalmentaja avautui poikkeuksellisella tavalla.,https://img.ilcdn.fi/X_KmAinAZmL1eh82UcU2V78RvMg=/510x318/top/img-s3.ilcdn.fi/8a63f6a91f12d8cd444d57a65720feb6204a1f474f4b7f4fa6f544004f3c73f7.jpg,C9B221804A1542AF8B04AC0F290EEE96
2023-10-13T13:02:10.000Z,Amazing Race -kilpailijoita odottaa maaliviivalla jymy-yllätys,Amazing Race -kilpailijat seikkailevat Vietnamin Ho Chi Minh Cityssa. VARO JUONIPALJASTUKSIA! ,https://img.ilcdn.fi/HogKfJknMwm-KsH-F9tXNAO4JDw=/510x318/top/img-s3.ilcdn.fi/78b21125bd05eed5705effc1370a5bb5b0eccb4ce5fffcd79f5ea84a1f756e7b.jpg,AA8DDE7B60944274BDA51C2E67C3EA6F
2023-10-13T13:09:47.000Z,Näin hallitus leikkaa yleistä asumistukea,"Omistusasuntoon ei saa enää asumistukea ja asumistuki pienenee, jos ruokakunnan jäsenillä on palkka- tai elinkeinotoiminnan tuloja.",https://img.ilcdn.fi/t0oG2zpQsJCU3smMfOym6BvBqMI=/510x318/top/img-s3.ilcdn.fi/5ff5a9f3eeefa784fda7a6ec8acf5f95bb74753f3c136a1a90e39e4dedc8ce94.jpg,5C0B256C3C99480B835A9B22D739D103
2023-10-13T13:14:47.000Z,Tallinnan suomalaiset ”helmet”,"Viimeisen 30 vuoden aikana suomalaiset ovat perustaneet Tallinnaan ainakin parikymmentä ravintolaa, joista monen tarina on täysin pähkähullu. Vai miltä kuulostaa ravintola, jossa omistaja paukuttelee pistoolia, tai toinen, jossa omistaja — tai sellaiseksi itseään väittävä mies — kähmii naisia vessaan rakentamastaan salaluukusta?",https://img.ilcdn.fi/3R7AFLxQKU-tQhNH15O-_hECyXU=/0x723:2000x1973/510x318/top/img-s3.ilcdn.fi/c6a303f22387baef7b66f5b57f4dad379d58b10bcdb0b93a3ccab7a9e1bb1724.jpg,5687099875254606AB6519A50F6DCA6D
2023-10-13T13:18:46.000Z,Näin hallitus leikkaa työttömyysturvaa,Nykyisin työtön saa ansaita kuukaudessa 300 euroa ilman että se vaikuttaa työttömyysturvaan. Hallitus esittää niin kutsutun suojaosan poistamista.,https://img.ilcdn.fi/lhaCyzx__wvo7x63ql9FHIltrls=/510x318/top/img-s3.ilcdn.fi/6e64a500665ec303cf692ba2f256c7a6f3e162ecb3d3040936ece7b317880165.jpg,A153791762A74D15B6D7A8491FE24038
2023-10-13T13:25:55.000Z,Tällainen on onnettomuuslaiva M/S Eckerö,Autokannen hylly romahti perjantaina M/S Eckeröllä. Tällainen laiva se on.,https://img.ilcdn.fi/m0sjOwa6RE78cM-iGJl_7tBuGUs=/510x318/top/img-s3.ilcdn.fi/028fcca64e57e687de3f6b547d5f425680ed4fc78d8e9caeb851870134474799.jpg,54674CDE24E74FCF8454C179EC506DDF
2023-10-13T13:35:57.000Z,Kuinka hyvä yleissivistys sinulla on Yhdysvalloista? Vain kovin seriffi saa 10/10! ,Kuinka hyvin tunnet Yhdysvaltoja? Se selviää pian!,https://img.ilcdn.fi/J02tiGyoSzWQ31wYTZV75ScMXdw=/510x318/top/img-s3.ilcdn.fi/cc12c762a8a33c7464750729c0d51e0bd4ba89ce66735f41a21f5ca581f06ae6.jpg,7E14A87EF11948A6ABB765891DFF0722
2023-10-13T13:49:34.000Z,"Ranskan rajalla on 4000 asukkaan pikkukaupunki, jossa on upeasti esillä suomalaista rallihistoriaa",Ranskan itäosassa Sochauxissa sijaitseva Peugeotin museo on upea vierailukohde kenelle tahansa autoista innostuneelle.,https://img.ilcdn.fi/SKRrFQkaRo-iPYzUU4N_CLNMGd0=/510x318/top/img-s3.ilcdn.fi/d4090886d97b623f81f082b9cd02dcc50b711416724b4097e38dfeb4660d8805.png,08E51A74F4464D3183A809F743E5A64E
2023-10-13T13:50:29.000Z,Britannia lähettää 20 000 sotilasta Pohjois-Eurooppaan,Britannia aikoo lisätä sotilaallista läsnäoloa Pohjois-Euroopassa.,https://img.ilcdn.fi/QN7GD1nNml-bl0SOCl6jDJLw_DA=/510x318/top/img-s3.ilcdn.fi/5c54111ec025615dff3d9cd0b965fe7724f8380166932c970fc86cb6337beee8.jpg,C657F52E2F7F4C578396B1816C892E42
2023-10-13T14:12:49.000Z,Poliisit menivät lounaalle – Takaisin palatessa odotti ikävä yllätys,Poliisin partioauto oli parkkeerattu pysäköintikieltoalueelle Tampereella. Partio oli A-tehtävävalmiudessa.,https://img.ilcdn.fi/ywYRcnppvgwMuiCO6t0ImkclPm0=/510x318/top/img-s3.ilcdn.fi/48795c2f9d9d23b617f54d285ea30d719edd9794af76799ce0d2038030980631.jpg,6A55EECA3BE542318483C6A3D5564994
2023-10-13T14:16:21.000Z,Poju pyysi anteeksi,Artisti julkaisi anteeksipyynnön.,https://img.ilcdn.fi/CK2SwuO_p4oOprIPLnVwKjpHdqE=/510x318/top/img-s3.ilcdn.fi/71ea1742fe47c64ccb7a1f085b2ef4936bffff2519c9e45678938ec63ced6e15.jpg,AEFF24DDB6704848A9E89B256524897E
2023-10-13T14:30:35.000Z,Bruce Willisin ohjaajaystävältä karu ulostulo tähden tilasta: ”Hänen elämänilonsa on kadonnut”,Näyttelijä Bruce Willisin sairaus on edennyt hurjaa vauhtia.,https://img.ilcdn.fi/-yStrWAk6WrlfUJwLR9D4rbt6IE=/510x318/top/img-s3.ilcdn.fi/bff0ee6663f5ebfd909f5af0a78304c0f172e87dbda6af89b09b2837314465fd.jpg,B297E339EDB742DBB66E06A1E9FF9F1F
2023-10-13T14:34:16.000Z,Putin kommentoi kaasuputkea: ”En ole kuullutkaan koko putkesta”,Vladimir Putinin mukaan Venäjä ei ole Suomenlahden kaasuputkivuodon takana.,https://img.ilcdn.fi/Ot0Xk5SAbr0NIcZx3oDb4pB2UFI=/510x318/top/img-s3.ilcdn.fi/98744e62fa36de53c9600cb6ad2efffed01aeb8b2e13f46de8b95ad7647a3ddb.jpg,48877853F213491582C46034B1D5150E
2023-10-13T14:40:01.000Z,Olympialaisiin useita uusia lajeja – Suomi voittanut mitaleja näissä lajeissa,Olympialaisissa nähdään viisi uutta lajia vuonna 2028. ,https://img.ilcdn.fi/siBc-iaN6QLnI1HYHlqPmMw_9h4=/510x318/top/img-s3.ilcdn.fi/0988289eb1ebc7ed4a179c3a1a6f53804694316bb87b1ca2b09daf623391bf14.jpg,8B4074A88AA9425A9CFB4087187928D7
2023-10-13T14:49:16.000Z,Miksi kauhea pissahätä iskee kotinurkilla?,Koti-ovella iskevä poikkeuksellisen kova pissahätä on usein itseaiheutettua. Näin pääset siitä eroon.,https://img.ilcdn.fi/dmKe5wrk_k4LwboFE6ZYHo6xKQI=/510x318/top/img-s3.ilcdn.fi/343758c3f39ab4b5374d09ff165e0771fb03519063fb29720d280bb30f3ab085.jpg,6C876A43614544F5B9ACDC90F71F051B
2023-10-13T14:51:44.000Z,Severi Lahtisen raiskaustuomiota kritisoitiin – Rikosoikeuden professori jyrähtää,Urheilija sai pitkän vankeusrangaistuksen raiskauksesta. Oikeus piti Severi Lahtisen kertomusta tapahtumienkulusta epäuskottavana.,https://img.ilcdn.fi/TaJxXUX5nwUFao-3jRMjN_JfJ3U=/510x318/top/img-s3.ilcdn.fi/df8196d8c4d7f6adac32082f01abb96b3e213c2db94e769afd008452e39e645a.jpg,3F2D1C47D01940B68F5F223D8BD27A38
2023-10-13T15:00:07.000Z,Poliisi ja Rajavartiolaitos perustivat yhteisen tutkintaryhmän kaasuputkivuotoon liittyen,KRP:n Risto Lohi kertoo ryhmän perustamisen nopeuttavan ja tiivistävän viranomaisten välistä tiedonvaihtoa.,https://img.ilcdn.fi/geU0DEYVWL0vESN4nsFplIVy57w=/510x318/top/img-s3.ilcdn.fi/75a6916beae1012dd2c2994412ff8844d8d8a4ffef1b3fa18faac25488309a9c.jpg,66EA0834EB0A4CB8AD2DF0DEFC7FD7B8
2023-10-13T15:01:33.000Z,Wilma Murto sai hienon tunnustuksen,Wilma Murto palkittiin Vuoden yleisurheilijana. ,https://img.ilcdn.fi/QI9sV2kX89V1KxpW81NBwOcX0b8=/510x318/top/img-s3.ilcdn.fi/71536733ec077950d43305ab2f410672c05c4a4799f179a130f195d512afa972.jpg,637BE919B3DC43D6A95F4F9BCABB42AE
2023-10-13T15:03:56.000Z,"Alkaako kuhina? Näin monta tonnia säästät, jos olet nyt nopea asuntokaupoilla",Ensiasunnon ostajan verovapaus varainsiirtoverossa poistuu vuodenvaihteessa. ,https://img.ilcdn.fi/mh96MkFnFlA8E91VaXsA67I9Vk4=/510x318/top/img-s3.ilcdn.fi/cd729ced600b11460044e25fe12939d622fb737b95fe7ad1d6e331ab7d358a49.jpg,F14A20200DBE45CB8BBA622F011A51F5
2023-10-13T15:11:10.000Z,Itsemurhapommittaja iski moskeijaan Afganistanissa – Ainakin seitsemän kuollut,Ainakin seitsemän ihmisen kerrotaan kuolleen.,https://img.ilcdn.fi/GOCibgArCgpsdte6wTZG4w6sGQ8=/510x318/top/img-s3.ilcdn.fi/65f0c850d2378c2f6012311a32dea24c43eaa26909859db0d38ba2384b81a56e.jpg,64A9B3A944E84D918DDE0D2192A5124C
2023-10-13T15:16:09.000Z,IL seuraa: Jokereita kuritetaan kärkipelissä – Vastustaja hirmuvireessä,SM-liigassa ja Mestiksessä rytisee perjantai-iltana.,https://img.ilcdn.fi/9SgHHwtF_g3u03m9fD3B5luaS9w=/510x318/top/img-s3.ilcdn.fi/91793cb492eb2f02a9e917b540f96c3c3852a78902e289dfd93222a0269cdaa1.jpg,5A17119F45D14C42B6DECAF087FE88AA
2023-10-13T15:27:58.000Z,Räjähdys poliisien koulutuspäivillä: Kaksi loukkaantui – Tapaus etenee syyteharkintaan,Lohtajalla sattui reilut kaksi vuotta sitten vakava räjähdeonnettomuus Pohjanmaan poliisin koulutuspäivän aikana.,https://img.ilcdn.fi/VK92BpBTNQWRkb4vSdO4ygvZ4wc=/510x318/top/img-s3.ilcdn.fi/617a5a3c513b0da7b8bf8185e7fbd05ca44f83bd81a69a7cd6a5ed0df2a0622c.jpg,101F4AD76451450AB639BC2A7851C3AB
2023-10-13T15:30:17.000Z,Anniina Valtoselta avoin ulostulo ruoka-allergioistaan,Anniina Valtonen kertoo olevansa allerginen monille ruoka-aineille.,https://img.ilcdn.fi/LkkYZK9d6YHNCJppLbHmvMGLyQM=/510x318/top/img-s3.ilcdn.fi/cb5c3538d8b27c7b51f083a2db4b354f02ab19d2803d4eb7c8a6bed3b42c22f5.jpg,C8FE90C4D5334B58BA2B8F78574D4BCD
2023-10-13T15:31:02.000Z,Jokerit-buumi herätti koko uinuvan Mestiksen: ”Kymmeniä tuhansia euroja”,Jokerit keräsi seitsemään ensimmäiseen otteluunsa kaikkiaan 30 103 katsojaa. Seurojen kassakoneet kilisevät helsinkiläisten ansiosta myös maakunnissa.,https://img.ilcdn.fi/mGG-bpUC4cvH9n-kbN0kCTVOUZ4=/510x318/top/img-s3.ilcdn.fi/dada7bff1f46f3314182d7ae62885d7d4afa8c8c04aa0e55483b5221361a87e1.jpg,F3AB89EE9F7648F4B32815283F3833B4
2023-10-13T15:32:55.000Z,Bussikuski-Vesa kuunteli sukulaisen Tiktok-neuvoa ja suosio räjähti: ”Otan nyt ihan rauhassa”,Järvenpääläisen Vesa Heimon suosittu Tiktok-tili on kerännyt liki 60 000 seuraajaa.,https://img.ilcdn.fi/C_ROG2y9iRiA9jzPAxayPjaYED0=/510x318/top/img-s3.ilcdn.fi/2f03c235990b5f883a7de8a9f108c2911f71acd7cdbfab6985d9fefbd43c2660.jpg,BB7DA59AD4F74AAB8FCF478CAA6A65C6
2023-10-13T15:43:48.000Z,Mahtuisitko asumaan tänne? 20 neliön kaksio on minimalistinen tilaihme,Voiko 20 neliön kaksio olla toimiva tai edes mahdollinen? Pääsimme tutustumaan tyylikkääseen minimalistin unelma-asuntoon.,https://img.ilcdn.fi/7tM1iAtqp18JemzZUw17peqXuqI=/510x318/top/img-s3.ilcdn.fi/b75761d832b2f0f99020e441c5080830195bad1e9be3d4bfed33af8b71b8ab57.jpg,ABB2FE97D5B74826BD61C6FF2A46B98A
2023-10-13T15:46:33.000Z,Järvestä löytyi kuollut mies,Sivulliset löysivät miehen rantavedestä ja hälyttivät pelastuslaitoksen noin kello neljän aikoihin perjantaina.,https://img.ilcdn.fi/t8XnwnaEb-64peCbDtFkIdLmlU8=/510x318/top/img-s3.ilcdn.fi/f32f243577e66e7b715ce20f1cde82ccd0ea0e8cd3cc37616912dbff9abdb37c.jpg,8AF0F63CA1584FB98A3514A8CA9116A4
2023-10-13T15:58:13.000Z,Seuraako Israelin konfliktista pakolaiskriisi? Asiantuntija: ”Kyseessä olisi etninen puhdistus”,"Israelin ja Hamasin välisen sodan on pelätty johtavan pakolaiskriisiin, mutta suomalaisasiantuntija rauhoittelee huolia.",https://img.ilcdn.fi/34Fr0iYRm5cxzZ6Vhl2lFM99xUs=/510x318/top/img-s3.ilcdn.fi/32783cb8593c4c290252393f7c9b1cffdc490385705d3548f4672994f4f88db0.jpg,2F9EE28CC83B4CF3BD5CC74451BD5BDF
2023-10-13T16:00:38.000Z,Suomella valtava ottelu edessä – Kuvat paljastavat erikoisen virityksen kentässä,"Markku Kanerva ei usko, että Slovenia yllättää tai muuttaa juurikaan mitään.",https://img.ilcdn.fi/uEYoQdOaL74_baTbbdPMF6vUPmA=/510x318/top/img-s3.ilcdn.fi/f07420a4d4064c3896aca831b88af287fc1efd5bf272d55e8cdf071e9a8a7ac9.jpg,9ED6951306BE470A8E496D682499D79C
2023-10-13T16:11:11.000Z,Alastoman 36-vuotiaan naisen jumppahetki pihalla herätti huomiota Espoossa,Espoolaisnainen jumppasi alasti omakotitalonsa terassilla omissa juhlissaan.,https://img.ilcdn.fi/ZUFW8VzqIhdvg2S0GdHTSZBLaF4=/510x318/top/img-s3.ilcdn.fi/85c053e17ee407e04c0b229e7a77f0269c975be9d10678eeee03ad488d98c5e3.jpg,30B549548A13496781FF5F0395AA12B5
2023-10-13T16:21:57.000Z,Upeaa pukuloistoa! Wilma Murto saapui gaalaan muiden tähtien kanssa,Suomen yleisurheilutähdet kokoontuivat juhlagaalaan. ,https://img.ilcdn.fi/bt9ilL1lW39ij38FRkeDvHPgcgE=/510x318/top/img-s3.ilcdn.fi/9dc0ab63ea08e457ef8ae8e4c3bb49d2c6ee9e994778ebede949ac0b5e391996.jpg,D4029848FA094688BC2FCE17263C4A93
2023-10-13T16:27:37.000Z,"Tiesitkö? Nuoren Virve Rostin ura starttasi, kun Danny tarjosi kesätöitä","Tämän viikon Vain elämää -jaksossa Virve Rosti kertoo, kuinka sai kesätöitä Dannylta vuonna 1974.",https://img.ilcdn.fi/z-9hojDc94IvZHnCvYoUf5u80aU=/510x318/top/img-s3.ilcdn.fi/63c9fb052766a40f041da5f00d8e4c03662ec978579d84ecf5980e62910576fc.jpg,6D08544E74B5402B8EA5FAA8D3AC9CAF
2023-10-13T16:41:01.000Z,Puolustusvoimien asiantuntijoilta täystyrmäys venäläisaluksen ankkurointiselitykselle,Asiantuntijoiden mukaan viikonloppuna Suomenlahdella liikkunut venäläistankkeri ankkuroitiin outoon paikkaan.,https://img.ilcdn.fi/8PDs7BflLLRojHJaLQYRF7RXMF8=/510x318/top/img-s3.ilcdn.fi/a353b2d7c793823101be5464997b09ecb0dc3252a8e7d3800100197abaffd5f4.jpg,312CA96D68B04EB98588B72F5B0B0649
2023-10-13T16:42:03.000Z,Mikko Rantasen joukkuekaveri sai jättisopimuksen,Devon Toews jatkaa pitkään Colorado Avalanchessa.,https://img.ilcdn.fi/tgjUS1upwJC3SE74jzTTDTfNVMU=/510x318/top/img-s3.ilcdn.fi/e985e956c37bb4cb37f16a1aba59efc845d52c3f8b188db949946119b698daa7.jpg,45EFC9A6E5064A688892B57C5F029BDC
