paivamaara,otsikko,tiivistelma,kuva,id
2025-07-25T10:18:34.000Z,Seuraako Suomi Ranskan perässä? Nyt lausuu Stubb,"Torstaina Ranska päätti tunnustaa Palestiinan valtion, ja keskustelu Suomen tilanteesta on kiihtynyt sen jälkeen.",https://img.ilcdn.fi/mk8IdvHVcoWSPF3CowDoD9p_Dxk=/510x318/top/img-s3.ilcdn.fi/df81103f1f11b3df019baca6ce1fad4927d96bc6f2bea3e02efa34d29cd0a0a1.jpg,9047E31F8DEB4119B4FDA15E5C789AB7
2025-07-25T10:22:51.000Z,Terrafamen toimitusjohtaja vaihtuu,Yhtiö päivittää strategiaansa ja on osana tätä nimittänyt uuden toimitusjohtajan.,https://img.ilcdn.fi/22Z3b4a936zMApWdHpzV0QKO9BA=/510x318/top/img-s3.ilcdn.fi/9529a39be0d5e0e5164577e2ebe7b3791b7edaea7f1c7520d1836795e1215252.jpg,F161F73ECDB745FAA7682893CA642E3B
2025-07-25T10:37:27.000Z,Uusi kuva julki – Tämä on onnettomuuteen joutuneen Petri Kontiolan tilanne,Kontiola on kotiutunut.,https://img.ilcdn.fi/QPOmznGBFL7-v8iI_-pz2-iuqW8=/510x318/top/img-s3.ilcdn.fi/b03daab360c516154510b0a43b6b19125192607990936cf5d79a414543cba71e.jpg,AE935BC223334BD8BCEF2778742BE9B7
2025-07-25T10:39:02.000Z,”Donald Trumpin” penis nähtiin televisiossa – Valkoiselta talolta raivokas reaktio,Valkoinen talo reagoi voimakkaasti Trumpia pilkanneeseen South Park -jaksoon.,https://img.ilcdn.fi/qOepDq-LdoQw6Kr6pyar3TaWC1w=/510x318/top/img-s3.ilcdn.fi/768a11a3fe7cb2b2d4dfa334a0ee3315c08f28df5599cc88a7b4510c3e39a181.jpg,DFE513D4D7314A388EBC4AE401A66E32
2025-07-25T10:45:32.000Z,Elina Valtoselle kuraa niskaan: ”Totaalinen etninen puhdistus” ,Nasima Razmyar kritisoi ulkoministeri Valtosen lausuntoa ja vaatii toimintaa. ,https://img.ilcdn.fi/69JPvDJaBNZOY8_IgiUpaY3FyS4=/0x0:2000x1249/510x318/top/img-s3.ilcdn.fi/4d92fede8b077e4784c30d9ad62696ffec3226221f53df4dbfe8911b9926fbec.jpg,B6DB1368226044C5A17AC08F3D670A3D
2025-07-25T10:45:58.000Z,”Juomme viinaa tai kaljaa” ,"Suomessa on alue, jossa olutta kiskotaan jo puoliltapäivin. Lähdimme selvittämään, millaista siellä on. Yhdestä paikasta löytyi mies, jonka kasvot näyttivät hämmentävän tutuilta. Syy selvisi nopeasti.",https://img.ilcdn.fi/_jjCiS9CDQwt5Ef4ZDidSFsL2WY=/510x318/top/img-s3.ilcdn.fi/0606ae3d3495b2c23297fc3e63150a1df61e95e88431a2e2de9a76c58130a889.jpg,440C72DD886C4EE4B492B66793906137
2025-07-25T10:49:28.000Z,Teini-ikäinen nostettiin elottomana vedestä Lahdessa,Pelastuslaitos sai tehtävän paikalle hieman ennen kello yhtä perjantai-iltapäivänä.,https://img.ilcdn.fi/e1mBQcVi7JE7oK3eSIPM4wsJNI4=/510x318/top/img-s3.ilcdn.fi/e20bcbe164329cf130e450a9b69b4d628257852182c5b04823d28f06a4f88547.jpg,13EBBCCBDF9441DB940BC94859EDCC1F
2025-07-25T10:50:03.000Z,Kraft ei ole suosikki – OsPa kupongin paras varma,Myös kakkoskohteesta löytyy nurinkurisesti rastittu kohde. AC Oulu on saarilla suosikki.,https://img.ilcdn.fi/ZYWKTVZpHGEYVpXh_wV-oAxHHP0=/510x318/top/img-s3.ilcdn.fi/c56ff174514eb8b0cb8148c23f178892b1709dc46c02a459c8b38f3e94c67b6d.jpg,246244AAE5C04D87B9810437B3FD67B6
2025-07-25T11:00:46.000Z,Hollannin futisjätin päävalmentaja hiilenä Ilves-tappion jälkeen: ”Siitä olen kaikkein vihaisin”,AZ Alkmaarin päävalmentaja Maarten Martens antoi palaa Tammelan stadionilla. ,https://img.ilcdn.fi/QbGa2sFv69DXR-qiLPhCy-Qe14A=/510x318/top/img-s3.ilcdn.fi/8c0383c596680cfe97b8a5db5aed4381b8f132ca9aabed85e803c240af81d5b4.jpg,DC8BCF36E86C4B1789C0BC6531A3AFE0
2025-07-25T11:23:08.000Z,30 asteen helle iskee – Lääkärit: Lenkille kannattaa lähteä ,"Iltalehden haastattelemien asiantuntijoiden mukaan helteellä urheilu ei ole kovin riskialtista, mutta tietyt asiat siinä pitäisi muistaa.",https://img.ilcdn.fi/jHCKMKG90QpKg9sC2jo4zKN1K3o=/510x318/top/img-s3.ilcdn.fi/953a0dda6434fc3f1b4d6a5b627e6e27d3bd36e0c666f6a84f8fe4d5b319523b.jpg,DF35F330DF7447AF9C9348EAFF82B273
2025-07-25T11:25:51.000Z,Miss Suomi osallistuu tänään erikoiseen kilpailuun,"Matilda Wirtavuori on kova nyplääjä. Wirtavuori lähtee hakemaan nopein nyplääjä -kilpailun voittoa tosissaan, mutta pilke silmäkulmassa.",https://img.ilcdn.fi/bwq9Mfl77uSExZog58kT6AOdY98=/510x318/top/img-s3.ilcdn.fi/14f6ae6e30785ab66b6991d96faa5af26683bb733a0b2ba2c5ca5fbe2a0eae4a.jpg,96ACDE42C9934AADAD5602142FC59485
2025-07-25T11:26:32.000Z,Krista Pärmäkoski Kalevan kisoihin – Tämä on laji,Maajoukkuehiihtäjä kisaa yleisurheilun SM-tapahtumassa. ,https://img.ilcdn.fi/ZbF2W2WSHAl6HcvuFg88_5bVqIc=/510x318/top/img-s3.ilcdn.fi/28d37992a14b8e94f58629ad3701e3238b3ef188247b248475a7c8231d893712.jpg,C48C2F13B210439C909879959959DF2E
2025-07-25T11:29:22.000Z,Järkyttävä saunamoka johti vanhempien kuolemaan Imatralla,Kuusikymppisen miehen iäkkäät vanhemmat kuolivat tulipalossa.,https://img.ilcdn.fi/oXEGkSuQ-IcAoA5QYb9eg9s0hT0=/510x318/top/img-s3.ilcdn.fi/b36638e1476ce0b0720495852e7c0c102578440bcad6a99b4a7f59bb30051fa9.jpg,59114BE197604A2FAC2188D0836A40CB
2025-07-25T11:34:22.000Z,Red Bull siirtyi uuteen aikaan – Nyt latu maistuu myös Max Verstappenille,Belgian GP:n ainoa harjoitustunti ajettiin Spa-Francorchampsin radalla. ,https://img.ilcdn.fi/oiDlHkTFrN-jk9ywa0gf7G5Cz54=/510x318/top/img-s3.ilcdn.fi/46d68848ce3fa208af4a511ee90065cfd90f0957fdcd4fc70bfdeca5b4aca6a3.jpg,8CECD8F218ED4005A165567E47C0E8F8
2025-07-25T11:51:07.000Z,Humanitaarinen katastrofi pahenee Gazassa – Asiantuntijalta tyly arvio Suomesta,"Asiantuntija ei usko, että Yhdysvallat tai Eurooppa olisivat valmiita painostamaan Israelia lopettamaan sotatoimiaan. ",https://img.ilcdn.fi/j3q3rhhqXoRGjCCh4aThGe0uZ04=/510x318/top/img-s3.ilcdn.fi/65c9f601ccbd931c2372ac9153920e4f44c781cb628345dad5f07c06733d7dd2.jpg,D53BE4FD04CF4EF6896D5A17F1CF8891
2025-07-25T11:55:14.000Z,Lasten toiminta riistäytyy käsistä Helsingin Oodissa,"Lapset ovat kirjastossakin huoltajien vastuulla, Oodi muistuttaa.",https://img.ilcdn.fi/rMJgKlGzJHk2sV5-uWiUaqDb-zE=/510x318/top/img-s3.ilcdn.fi/5c66b6fa6730da601cbc33b4b792e57c647ba8b8e9143e5531c2b53119556374.jpg,47CD1118557F4F26A6E58298D69C9C1C
2025-07-25T11:59:59.000Z,HS: Jutta Urpilainen muuttaa Qatariin,"Entinen komissaari Jutta Urpilainen muuttaa Qatariin, kertoo Helsingin Sanomat. Hänen puolisonsa sai sieltä töitä.",https://img.ilcdn.fi/LUMblhbPuNxIhG_uyacSxZ9ysFY=/510x318/top/img-s3.ilcdn.fi/e0aa7b79c221e49d23117f92ffc3833e9f51e838a56bc1d9725a7633a5ee5b42.jpg,A3691F8BCAAE4925BD0F78E5C5274107
2025-07-25T12:11:15.000Z,Uutta tietoa Coldplayn keikalla pettäneen naisen parisuhteesta,Astronomerin henkilöstöjohtaja Kristin Cabot jätti tehtävänsä kohun keskellä. Nyt naisen parisuhteesta on saatu tietoa.,https://img.ilcdn.fi/d06D6YerIPY28IuTM9sp9C4J8qE=/510x318/top/img-s3.ilcdn.fi/8ab123e403951349b404f2b11ef8c56367629b5dd170fb16d41d4dd3c9fb08ae.jpg,BA326039E6B2464FBB2096B0C6A9C4F7
2025-07-25T12:18:54.000Z,"Salen myyjä kohtasi epäilyttävän näyn, sitten ryöstäjä lausui kylmäävät sanat",Ryöstäjän saalis jäi vähäiseksi.,https://img.ilcdn.fi/52-phG6qGEF2-V_KtVVC9827z6Q=/510x318/top/img-s3.ilcdn.fi/e8689be6808c2536ed2498a43886d6cafc1fedfe2e867d2908808f5e082a76cd.jpg,2CE49D23ED784DE3BE028433B87B9598
2025-07-25T12:20:32.000Z,Tansanialainen nainen otti vauhtia pituushyppykisassa – Sitten tv-kuva paljasti karun totuuden,"Selostajat havaitsivat, että jotain oli pielessä.",https://img.ilcdn.fi/wGtyDGVhplEVD_5UiAaEyrdNI30=/510x318/top/img-s3.ilcdn.fi/93d0f57e1518cd7119edfcb848fa4a31c63ab61eacc0dadb69637cba61d13894.jpg,72B02CCA5DA54B699208DC771A1B9E47
2025-07-25T12:27:19.000Z,Video paljastaa karmean tilanteen Helsingin rannoilla,Lämpimät kelit ovat tuoneet mukanaan ikävän lieveilmiön Helsinkiin.,https://img.ilcdn.fi/lVCiM4LeuEZRPo7ZsDBPbwGiLg4=/510x318/top/img-s3.ilcdn.fi/b21e59add95880f1dc26f3be8da2b5bc84268dc8c4093b5785f013c21a8b3e77.jpg,A066F9AD2FD9445D9860B176FAF5760C
2025-07-25T12:42:32.000Z,Vieraskynä: Tämä on EU:n valtava rahoitusvaje – Missä ovat Suomen ratkaisut? ,"Lyhytnäköinen oman edun varjelu ei palvele Suomen etua koska se heikentää sisämarkkinoiden toimivuutta, kirjoittaa muun muassa EU:n neuvoston pääjohtajana pitkään toiminut Reijo Kemppinen.",https://img.ilcdn.fi/1ypwzVCK97eZNaeLPtxsM1vKeCc=/510x318/top/img-s3.ilcdn.fi/74fb293079cb747acf576e932202eb05949a02dabad76552722aae2d1f0d4781.jpg,7E6DD7552E4947A0BB0F016C8AADAADA
2025-07-25T12:49:18.000Z,Trumpilla kiusallinen tilanne kameroiden edessä,Kiistaa Trumpin ja Powellin välille tuli Fedin pääkonttorin remonttibudjetista.,https://img.ilcdn.fi/qOepDq-LdoQw6Kr6pyar3TaWC1w=/510x318/top/img-s3.ilcdn.fi/768a11a3fe7cb2b2d4dfa334a0ee3315c08f28df5599cc88a7b4510c3e39a181.jpg,4C9482CD3B6744DFA0636004EB7FDC59
2025-07-25T12:53:02.000Z,IL seuraa: Kurre Westerlund ja Jenna-rakas menevät naimisiin,Iltalehti seuraa tässä jutussa Kurre Westerlundin ja Jenna Välikankaan hääseremoniaa.,https://img.ilcdn.fi/W4k9NjlWU4tBV2UWeM24VonoTMk=/510x318/top/img-s3.ilcdn.fi/c58d5d606fc1664c6670c45ab82bc8f62a4797fd40d2351aaee8be15748f717a.jpg,180896AFAE4D46AF8D612B572BB3DFA4
2025-07-25T13:03:26.000Z,Uutta tietoa Hulk Hoganin kuolemasta,Showpainilegendan viimeisistä hetkistä on paljastunut lisätietoa.,https://img.ilcdn.fi/htzqP6BwwuKkaL6lbtuvzkoVw0M=/510x318/top/img-s3.ilcdn.fi/eaba44de96026e8b28833a4564d33bff5ebcefc4d4fc0ea449b1e4026acaf47d.jpg,92B6670D67474D108B2ADE1C90A92809
2025-07-25T13:07:59.000Z,SVT: Mies löydettiin hukkuneena uponneesta hinaajasta,Hinaaja upposi Perämerellä kesäkuun alussa.,https://img.ilcdn.fi/SUjoJak-cdFUL-3wmZUTJVnc94E=/510x318/top/img-s3.ilcdn.fi/795de4c6f72d743e60f99c2b8ab8198152fb99567bb7265bc0d36bd6361c7b89.png,3F88C143A8864E7084899C7B448C0705
2025-07-25T13:27:05.000Z,Hulk Hoganin uskomattoman kattava autokokoelma: Luksusta ja muskeleita,Showpainilegenda Hulk Hoganilla oli mieltymys autoihin ja erityisesti amerikkalaisiin muskeliautoihin. Tähti menehtyi eilen.,https://img.ilcdn.fi/vrMl2cK9wnj04chKhr4qJuiaAeo=/510x318/top/img-s3.ilcdn.fi/32af045e33c1d3e2f50ddac2e1e922cd5fcfc985e8fc1aba19a8d0dca6a4f2ba.jpg,E326E441897749229FEDC5BF96B16CBB
2025-07-25T13:30:36.000Z,Useat ihmiset todistivat täydellistä tuhoa Toijalan satamassa,Saunalautta syttyi yhtäkkiä tuleen Toijalan satamassa. ,https://img.ilcdn.fi/m05rPrdkXMtaP_rqPZWyQvCFkSU=/510x318/top/img-s3.ilcdn.fi/067ad9e1f53996ce1af3e4994fe0d3a42672c438fcaa3f5df7b9860eeed2fa92.jpg,5C2245466A624959818455D6EF7F8069
2025-07-25T13:49:04.000Z,Tällä ei ole mitään tekemistä lastensuojelun kanssa,"Viranomainen varoittaa lastensuojeluteemaisista huijausviesteistä, joilla rikolliset kalastelevat pankkitunnuksia.",https://img.ilcdn.fi/V0XobBmduFFTp4n-o1ZK4ufdPS0=/510x318/top/img-s3.ilcdn.fi/0bfeb086f657db5cc31c67b44607b1a23a53c16388dbc7d8a2531659e47c1ea9.jpg,7ED099AE343B469AA5648D3BF73E3B6E
2025-07-25T14:02:24.000Z,Leijonien kultasankarin kohtalo selvisi,Harri Säteri pukee ensi kaudella tutun nutun ylleen.,https://img.ilcdn.fi/rY57iYplyIrWiQTmf9H06qfKHO4=/0x0:3000x1876/510x318/top/img-s3.ilcdn.fi/a767c38c4ad8c14e872c8d60985061da7bf9d892d756376d60f036c3f48388cb.jpg,913EAB8EEB6947E38258FDB45EA82E56
2025-07-25T14:08:51.000Z,HIFK vahvistaa rivejään: Kaksi nuorta pelaajaa liittyy joukkueeseen,Helsingin IFK vahvisti rivejään. ,https://img.ilcdn.fi/6FwGTSU8Lde70-OttdtNvhDHkYs=/510x318/top/img-s3.ilcdn.fi/185c4af68499b270e2cebca66fc4622a756cc0bc446904a8b462b1cffce64de4.jpg,BF0B85618DF14DA182552F891686A3E9
2025-07-25T14:08:56.000Z,Video: Äärimmäisen vaarallinen takaa-ajo päättyi näyttävään kiinniottoon – ”Vain hopeaa jaossa” ,Autoa kuljettanutta miestä epäillään viidestä rikoksesta.,https://img.ilcdn.fi/zGsVR8znEIl6I2uln3EaQHqKHPo=/96x0:1824x1080/510x318/top/img-s3.ilcdn.fi/8f6f5d83493cc65e98ec968e0d14085fc417e206c55125adb254e0d4182cb24c.jpg,B487AA2A14174636B1E37F901571EF21
2025-07-25T14:20:07.000Z,Alavireiset vastakkain – Kuka korkkaa voittotilin uudella stadionilla?,Jaro pääsee irti ensimmäistä kertaa uudella kotikentällään. Paikallispelissä molemmilla on haussa uusi suunta kohti syksyä.,https://img.ilcdn.fi/iLQErOWjDQX5xC941PlsPTHtwiw=/510x318/top/img-s3.ilcdn.fi/3269988a596bf2aa8994625ea7c9625a0c769eb414dd4bda0dc05fdb8d516e3b.jpg,7998671C7067484F97771F8F77E5EF73
2025-07-25T14:23:14.000Z,Julia Thurén: Ero,Suosittu somevaikuttaja Julia Thurén kertoo eronneensa puolisostaan.,https://img.ilcdn.fi/xETPoEa1PjUbchIw9sPk5zKqwrs=/510x318/top/img-s3.ilcdn.fi/689be1135026732237e50f4519e1ab4882c2785a1bd403e32fefc31ec9dd22d3.jpg,B89CC457FCD64CC3A7D594F418299C31
2025-07-25T14:41:44.000Z,Toisenlainen kosketus,Aspergerin oireyhtymään kuuluva kokee usein aistit eri tavoin kuin muut. Näin se näkyy parisuhteessa.,https://img.ilcdn.fi/rSaYOwA82NH6bFbaWW3Fp3FU5Yo=/510x318/top/img-s3.ilcdn.fi/5e6681f8f7cd61e589c36a25ef131e24d94427632913146a434c808db9b6d0b9.jpg,26CD900B891C4C23B0164FD43EAAC6E3
2025-07-25T14:43:05.000Z,Asu kuin Michael Jordan – Posketon hinta Airbnb:ssä,Nyt on mahdollista asua kuin legendaarinen Michael Jordan konsanaan.,https://img.ilcdn.fi/Zz9dFO7WcNNDpuvuN86dwMsk6_s=/510x318/top/img-s3.ilcdn.fi/95921469b60ca307e2c635e36fa25b293cfab41f85bbc53281449749a4a8f9cc.jpg,EFB02918F4814DB1A919D92DB1AC2B9E
2025-07-25T14:48:44.000Z,Pelko tulevasta viikonlopusta heräsi – Pelastusylijohtaja: ”Aidosti ja oikeasti huolestuttava”,"Pelastusylijohtaja Kimmo Kohvakka: ”Kehotan, että vanhemmat kantavat vastuuta ja kantavat vastuuta myös omaa perhettä laajemmin.”",https://img.ilcdn.fi/YlErxahqW3fg4CfWpsjGEFBs93Q=/510x318/top/img-s3.ilcdn.fi/0fe552db1b74841ca3f10d075c11a951739ef7921b5accbd753f0f13a25385a2.jpg,8342A5A5C43940F3AB1005EDB7274E40
2025-07-25T14:49:48.000Z,Lewis Hamilton töpeksi – Ulos aika-ajosta ,Belgian F1-sprintin aika-ajo on käynnissä. ,https://img.ilcdn.fi/KVFVWbkGv0VSDNN_0Poa4CsCV7o=/510x318/top/img-s3.ilcdn.fi/d75a59cede2c5093d40b6c1eed2fdf72eade2bcd307acfed16bd56ab28a3631e.jpg,D53E2A225361454E9254171926FB188A
2025-07-25T15:05:55.000Z,"Oivallatko, mitä takavuosien visailuohjelmaa haetaan? Välkyin sohvaperuna ottaa 8/8","Testaa, tunnistatko takavuosien suosikkivisailut kuvauksen perusteella.",https://img.ilcdn.fi/ucOlBgwwfA_Zzl6-mGWhj03n8JQ=/510x318/top/img-s3.ilcdn.fi/c6cc7fd281a8cb54bfa39de824bac9f96285acca29479ac7c7602a66847c3b8d.jpg,FBC8FE8F3E8645EAB665C45AE30365DF
2025-07-25T15:18:33.000Z,Haisteletko omia pierujasi? Tästä se kertoo,Monet ällöttäviksi mielletyt asiat inhottavat ja kiehtovat meitä. Ilmiötä kutsutaan hyvänlaatuiseksi masokismiksi.,https://img.ilcdn.fi/PTMHmEpYBxu71mgp7TdvAh-6XHM=/510x318/top/img-s3.ilcdn.fi/01a58dfd86025661addf87999cf8047ccea3826deac1454ab303a92b95644185.jpg,9A7016C8A70F47C0B29DBF82E063D921
2025-07-25T15:18:53.000Z,Venäjän talous murenee: Autovalmistaja teki kovan ratkaisun,Keskuspankin ylläpitämä korkotaso on saanut kritiikkiä yrityssektorilta.,https://img.ilcdn.fi/HcWTDz0DZDsZ8JkAkJlieTVg7JA=/510x318/top/img-s3.ilcdn.fi/c71943b4f4463ece569eaa3603597cabab091b0f11f5fc08512990af36ed72a0.jpg,267E0E650E1B4E12AD3F2A70772D676D
2025-07-25T15:19:27.000Z,"Maailmalla tunnetun miljonäärin kaapista pilkisti 19,90 euron hintainen suomalaisyllätys",Jakob Ingebrigtsen kuvasi videon keittiöstään.,https://img.ilcdn.fi/KyP82Md4dJ0VdFHxlttDE4-5jVk=/510x318/top/img-s3.ilcdn.fi/955e8a5b0715f3562f21eff823943b0b91a1e1e5e837a0b8e708b27f354365d0.jpg,E87155D0FD6848999BC001E3416E268A
2025-07-25T15:33:17.000Z,Ihminen hukkui Kivenlahdessa,Vedestä nostettiin kuollut uimari Espoossa Kivenlahden uimarannalla. ,https://img.ilcdn.fi/1gcZrP2ARqm95j8mDVX3jEhTxjk=/510x318/top/img-s3.ilcdn.fi/2efce651cb3a1fb705f31bbd191a498fd5486f897ce9c0d3a30214ce12f5f187.jpg,AB83891D06214DC196FDB6169203F4AE
2025-07-25T15:59:45.000Z,Pyöräilijä huijasi Tour de Francella – Jäi nololla tavalla tv:ssä kiinni,Lenny Martinez sai lisävauhtia kesken ajon.,https://img.ilcdn.fi/TcIQjDag5CykHdqXmocReY0I7LU=/510x318/top/img-s3.ilcdn.fi/e635e34d8f160652b5a4cbb913265650726a2d4dffa45d0e1ff4c2089cf27e02.jpg,0F2B8E3B779249B0A3BFDA8DECA23C61
2025-07-25T16:00:05.000Z,Nainen hukkui Pälkäneellä,Uimaan mennyt nainen on hukkunut Pälkäneellä. ,https://img.ilcdn.fi/Jh0MSc5h6Dgg0rfuviYVoXFmhPI=/510x318/top/img-s3.ilcdn.fi/e1fd3eb308fcf371bafa74215d3ce519440f69f6a9014b33a0ddb429150f5693.jpg,F6DA4EF593704E0A8D07537BAC4C24B5
2025-07-25T16:16:26.000Z,Kurre Westerlundin ja Jenna-rakkaan koskettava hetki häissä – ”Tuota en unohda ikinä”,Kurre Westerlund ja Jenna Välikangas astelivat tänään yhdessä alttarille.,https://img.ilcdn.fi/0D6M0nMjZEKISGuxVRUBxJPfiCI=/510x318/top/img-s3.ilcdn.fi/c00e3c49f41a09e3867e421ea98a4524adb9863a7d6002f6f13878b200ad78ef.jpg,8669C0E3224348D89B9C18ADB5275122
2025-07-25T16:33:52.000Z,Trump tapaa Von der Leyenin sunnuntaina – Syntyykö sopu?,Yhdysvaltain presidentti Donald Trump tapaa Euroopan komission puheenjohtajan Skotlannissa.,https://img.ilcdn.fi/VIvfgqsmUbDNCNj6ttuL2T3H4Fg=/510x318/top/img-s3.ilcdn.fi/d75dfc487d59a9b26faac82f3ee107e443c48b6db2f60f86925ae6c21c9b920a.jpg,966A0185596649A0B8D24E651531FC3D
2025-07-25T16:38:52.000Z,Kolmea poikaa etsitään mereltä Kalajoella,Kolmea suppailemaan lähtenyttä poikaa etsitään Kalajoen hiekkasärkillä.,https://img.ilcdn.fi/hLYLTZT53QREckVCOmnWYi14RfQ=/510x318/top/img-s3.ilcdn.fi/0b1c995df41f2c77476784823da192e5591c5c8b141726f032c25e2ff4d6ce95.jpg,2399917DCA9B40DD939E22D4F5662CB2
2025-07-25T16:42:47.000Z,"170 euron tulonmenetys opiskelijalle – Suunta on oikea, mutta hallitus saattaa ottaa liian ison riskin","Muutos opiskelijoiden asumistukeen on tervetullut, mutta uudistus vaatii hiomista, koska monella tulotaso putoaa niin alhaiseksi, että lieveilmiöillä voi olla ikäviä seurauksia, kirjoittaa Elli Harju.",https://img.ilcdn.fi/aJZCCI-KJIvJU8E5sR7W3cOavQo=/510x318/top/img-s3.ilcdn.fi/9bb6cd4bdc17ffe8383197948166b3d217aff4d15b64b653ea4b559b3381e7bf.jpg,1613978A8E3B490CBD8EF6137AB03EDF
2025-07-25T16:49:09.000Z,FC Hakan päävalmentaja sai toimitsijakieltoa – Teemu Selänne tyrmistyi,Teemu Selänne puolusteli FC Hakan päävalmentajaa.,https://img.ilcdn.fi/l-3el4IDAnmApNs7T4S0XrYcKyk=/510x318/top/img-s3.ilcdn.fi/24698322fe176ddbdc24cf40f617232736155722ff62f961b6f0a2665dfc2b01.jpg,776A707530C148B0B4B272D766FA0394
2025-07-25T16:54:00.000Z,Muodikkaat ihastuivat tähän yhteen sandaalimalliin – Katso kuvat,Kesän ajankohtaisimmat trendikorkkarit tulevat tässä. Valmistaudu näkemään niitä kaikkialla.,https://img.ilcdn.fi/fUINYIucAwchX0aV-_UqbbnrvNA=/510x318/top/img-s3.ilcdn.fi/3bc68528ee17dc9a5747823c66184117a28cd00ea226f67c728532b16f73a184.jpg,78F8241DBE5645E9ABF287B42868346E
2025-07-25T17:03:32.000Z,Sanasota repesi: Suosikkijuontaja kuittailee Donald Trumpille,Trump on viime aikoina kommentoinut suosikkijuontajien olevan lahjattomia.,https://img.ilcdn.fi/ik1sElh8CV_aqg4_V0En-Y1nhgo=/510x318/top/img-s3.ilcdn.fi/f1325c27a01982ea204950c4435225eebf391f1f58efa9906ae9114c0f0a53c5.jpg,A3886C53028B4D058898C31AA5B79DED
2025-07-25T17:05:43.000Z,”Viikonloppuna otetaan kovempaa”,Vietimme päivän kännitapahtumaksi leimatuilla Kotkan Meripäivillä. Tällaista siellä oikeasti oli. ,https://img.ilcdn.fi/vyPWosoLzeR24Q-LEqtlOO4F2yk=/510x318/top/img-s3.ilcdn.fi/bb25c6d2d527f9215592a05d82d6194603ecfb491bb1d6115d223ee692718b9f.jpg,E1DD6FEF23944A9BB04366965700909C
2025-07-25T17:16:54.000Z,Suomi yllätti lentopallon jättiläisen – Brasilia sai kyytiä MM-kisoissa,Suomen alle 19-vuotiaiden lentopallojoukkue on aloittanut MM-turnauksen vahvasti.,https://img.ilcdn.fi/-P0Z-ZQENx2BFwVU9IK13dvmxTM=/510x318/top/img-s3.ilcdn.fi/a3d4b86ac376e54dfe3d967586946b157c7d3498c2514ffe0fb8c53375ef4071.jpg,9300FD306E0B4D61BC9ACDE3078AA359
2025-07-25T17:24:54.000Z,Pohjois-Korean Kim: Valmistautukaa sotaan,Pohjois-Korea on asettunut Venäjän tueksi Ukrainan sodassa. ,https://img.ilcdn.fi/Yd1aiDswMQGCPJK6jGbuyn9545U=/510x318/top/img-s3.ilcdn.fi/3931f8e9ee29e3cd42359303a6aeb339ed095807f34a7f9fde4f5544212a513b.jpg,E13AF377E6CF4BDF83A0E2D5A8A8E729
2025-07-25T17:48:35.000Z,Tuukka Taponen: Surkea tulos,Tuukka Taponen jäi toiseksi viimeiseksi Span aika-ajossa. ,https://img.ilcdn.fi/wC96lkLBEjL_vWcgQIEMwCJb9dM=/510x318/top/img-s3.ilcdn.fi/b875f64992f34f6fcbdf4f679f06326756934aa4adcdfed5b9f091164b8259f6.jpg,4DBDD24B02B5488F97B1A7C7F42B480D
2025-07-25T17:49:06.000Z,Myynnissä vuoden näyttävin Porsche – Suunnittelijana poptähti Dua Lipa,Brittiläis-kosovolainen poppari Dua Lipa käyttää vapaa-aikaansa superautojen suunnitteluun. ,https://img.ilcdn.fi/_PS0Avm9DVgX4gShvBJEFfSAnNw=/510x318/top/img-s3.ilcdn.fi/12729f96879f7c301fc53d04a3f03b2a93de3c9babbd010d748887bdde0db539.jpg,9732AF6F12B7473A9D93C4FCDF1A5C45
2025-07-25T18:12:07.000Z,2000-luvun hittibändi tekee paluun – ”Olen treenannut enemmän kuin ikinä”,2000–luvun hittibändi 2. maanantai tekee paluun keikkalavoille.,https://img.ilcdn.fi/IVquQSDsUoXNHU7nQkl7cg8UDw0=/510x318/top/img-s3.ilcdn.fi/11cacf828bfa61215626de5406a221b9cbded45446bcebc68e4d6d9869551785.jpg,6105EA86B64344659D919CABAA67B363
2025-07-25T18:19:10.000Z,Veikkausliigassa nähtiin värikäs tasapeli,FF Jaro ja VPS jakoivat pisteet Veikkausliigassa.,https://img.ilcdn.fi/-Ul8u52-Niqpq_k8ilMF-TixBIQ=/510x318/top/img-s3.ilcdn.fi/4ee5e2b12b5c72f8fbc4acb46c02750e4e39eb5e1c99e93bd1abfc4828b29f0c.jpg,2A1F224A164C4308A49BA0111F14A820
2025-07-25T18:20:29.000Z,Näin iskee akuutti leukemia – Tunnista oireet ajoissa,"Akuutti leukemia todetaan vuosittain noin 300 aikuisella Suomessa. Osa potilaista voidaan parantaa kokonaan, mutta hoitamattomana sairaus johtaa yleensä kuolemaan.",https://img.ilcdn.fi/LpdSwoZJ3LkOSE5rOQoqHvGubsU=/510x318/top/img-s3.ilcdn.fi/a9643aa6ac994268b28790e63531e699582bd2673c2dbc80a9953357ed2b03cc.jpg,7A6BD2EDD2694AF98504EC08749DAD15
2025-07-25T18:27:31.000Z,Suomalaisjudoka avasi Suomen mitalitilin universiadeissa,Emma Krapu avasi Suomen mitalitilin universiadeissa.,https://img.ilcdn.fi/BGsO9eiHkvoF3dg_IF6tr0Qg10s=/510x318/top/img-s3.ilcdn.fi/9eb87977e93e143d6720b4407c84f3869df15c00d9ff917deda511b2d4da073e.jpg,8AEC64CB7C8A4D869B38830F67419A95
2025-07-25T18:40:09.000Z,Jari-Matti Latvalan omaisuus pelastui – Tällaista tiliä hänen firmansa takoo,"Latvala kertoi tuoreessa kirjassa, että työpaikka pelasi hänen taloudellisen tilanteensa.",https://img.ilcdn.fi/HmiSj6SB7PP882N7g9s0Bmaz3Zg=/510x318/top/img-s3.ilcdn.fi/3b2d645ae147ede34d1e1778bb8c0e55cf06d5e0b13d7770c902c39bb140895c.jpg,32A047DB964B49F4B619162A6A0DAF8E
2025-07-25T18:54:08.000Z,1 654 675 725 406 pistettä ei riittänyt voittoon,Open AI:n tekoälytyökalu otteli erikoisnäytösottelussa ihmiskehittäjiä vastaan.,https://img.ilcdn.fi/mpvInym27Mclzg-ETibxiUTCYcQ=/510x318/top/img-s3.ilcdn.fi/36646682f904874b2f52a6b7af5833b32643084c0048185a5353ffec3bf7483f.jpg,1F758AC8DFDA40179930203C7E414CD1
2025-07-25T19:05:25.000Z,Järkyttävä onnettomuus: Italialaisvoimistelija putosi niskoilleen,Lorenzo Bonicelli putosi niskoilleen kesken suorituksen.,https://img.ilcdn.fi/VdOMjRYREAvrNQbRpLTn2GjhbDE=/510x318/top/img-s3.ilcdn.fi/4a98b61daec7543dca5324b051589126c0daf378655d2fbe4f8fc5ca29f2782f.jpg,377F5374F7384A0E8FDC3899349195EB
2025-07-25T19:18:31.000Z,"Erika, 16, yritti pelastaa mereen kadonneet pojat Kalajoella – Näin hän kuvailee järkyttäviä tapahtumia","Erika Pynnönen, 16, kertoo yrittäneensä parhaansa poikien auttamiseksi.",https://img.ilcdn.fi/Z_Ol8IocSjPYVDv9xPCidNH5xso=/510x318/top/img-s3.ilcdn.fi/8c6c118a1c6eaa2e9a77291b6c7ec56749d6ed7f0988139092605cd5cb5b6a7b.jpg,64DE21D9C543425CBBD7EE831ECF141F
2025-07-25T19:20:35.000Z,Antti Reinin suuri suru: ”Lungia matkaa faija”,Näyttelijä Antti Reinin isä on saatettu tänään taivasmatkalle.,https://img.ilcdn.fi/ZXPiyUwddPoGwvmrdiY_mt2PoQw=/510x318/top/img-s3.ilcdn.fi/53e2a4ff37b36cf9776d68d3c1d6d2b73a87f95181f87df7aa3160beadeca54d.jpg,EBE05F8D68D24BDD89CCF4D31C7D6DB5
2025-07-25T19:34:53.000Z,Mies kuvasi seksiä useiden naisystäviensä kanssa – ”Jotta ei syytettäisi raiskauksesta”,Salaa kuvatut naiset tulivat tietoiseksi toisistaan ja viestittivät keskenään seksikumppaninsa tekemisistä.,https://img.ilcdn.fi/_sbsD5FIr_gnhoelV8T_eT-Wk4A=/510x318/top/img-s3.ilcdn.fi/2d6275ffebabb98db052b795b54508d4b7e3204b53811cdaee38564bc6d41913.jpg,BC55B0D087EE4688A21936993DCA8DF3
2025-07-25T19:48:52.000Z,Netflix-sarjasta tutun veljeskaksikon murhatapaukseen uusi käänne – Toinen sai vakavan diagnoosin,Erik Menendez on siirretty sairaalaan.,https://img.ilcdn.fi/ukh8RO61vkYtCQ21PAKk7BjdeWo=/510x318/top/img-s3.ilcdn.fi/a3e2cf7207d7812c8ea315188ccfc710ea9c361aa950fa9f158c401c8550cbcd.jpg,9000C8591EA84579AF3556FE0F0CA3DC
2025-07-25T19:53:15.000Z,Suomen aitajuoksijalle kultaa universiadeissa,Saara Keskitalo voitti kultaa 100 metrin aidoissa Saksassa.,https://img.ilcdn.fi/NIqudjEqMEh3RdxhTUcwsX1lw4k=/510x318/top/img-s3.ilcdn.fi/592a265923d01b66eab2b09f7366e228868e05d0e0d9160b2d7c8169ba3e8396.jpg,E4A0DACD1C5048F9874E1C96B86904EA
2025-07-25T19:57:58.000Z,Hulk Hogan mahtaili 25 sentin peniksellään – Tässä on totuus,"Kuollut legenda muistetaan erikoisesta oikeudenkäynnistä, joka johti mediayhtiön konkurssiin.",https://img.ilcdn.fi/htzqP6BwwuKkaL6lbtuvzkoVw0M=/510x318/top/img-s3.ilcdn.fi/eaba44de96026e8b28833a4564d33bff5ebcefc4d4fc0ea449b1e4026acaf47d.jpg,38CD3F86F8A14303BDB23353670CA1A5
2025-07-25T20:01:17.000Z,Ahvenanmaalainen miljonääri juhlii hulppeita synttäreitään – Tällainen on artistikattaus,Ahvenanmaalaismiljonääri Anders Wiklöf juhlii jälleen syntymäpäiviään hulppean konsertin muodossa.,https://img.ilcdn.fi/IG7i88wgeMSyZUh7JTDpplDJIvk=/510x318/top/img-s3.ilcdn.fi/9c3b281461cfce8a974e65c822b96bc8c188ece20f372499d35440f25e952b61.jpg,1C49B53C61474FCB8D1C87CD6047F8DB
2025-07-25T20:12:09.000Z,Bild julkaisi järkyttävät kuvat: Venäjän joukoilta karmeaa käytöstä,Saksalaislehti Bildin näkemillä videoilla haavoittuneet venäläissotilaat kokevat karmean kohtalon.,https://img.ilcdn.fi/RGwr8Q93V1NBmV7rd3eVjpJLfec=/510x318/top/img-s3.ilcdn.fi/3b092bc5b4b15243311f1cea0f19a49b65e5988a6dffcd694c19e63d79f51d75.jpg,47CA34F2A94048BCBB37C57F31C00CED
