paivamaara,otsikko,tiivistelma,kuva,id
2021-04-06T10:36:38.000Z,Kansanedustaja Kautto päihtyi valtuuston kokouksessa - luopuu nyt puheenjohtajan tehtävästä,"”Ongelmat ovat kasautuneet etätyöaikana, ja olen hoitanut niitä alkoholilla”, kansanedustaja kertoo.",https://img.ilcdn.fi/xmsPvjH66IFWXiCMMB0AIxazxag=/510x318/top/img-s3.ilcdn.fi/981dcb0482d6107f5d98c2f36c4f489e736df5183820310097d11888f86a912d.jpg,83CD316B9D794CE898C3A84F7AE870C5
2021-04-06T10:44:33.000Z,Tylsistyneen brittimiehen kömmähdys tallentui valvontakameraan: naama edellä saveen,"Mies yritti nojata aitaan, mutta kaatuikin sen lävitse.",https://img.ilcdn.fi/9v1qkvcDFQVomsLS9sGnXlxCaV0=/510x318/top/img-s3.ilcdn.fi/6541c53ec06cb2a9c76794bcb2979fc8217e159b061f439eb6319779a0d895ae.jpg,890ADC57492F4CDA8E14968682037DEC
2021-04-06T10:51:57.000Z,Hirvittävä onnettomuus: yksikätinen mies jäi moottoripyörän alle ja kuoli Argentiinassa,"Alberto ‘Wey’ Zapata, 23, kuoli traagisesti sunnuntaina ajetussa motocrosskisassa.",https://img.ilcdn.fi/KbhwOdKtjsA-fOdvJYm0lCiGvAQ=/510x318/top/img-s3.ilcdn.fi/dbde4b9087d60c85debd5257a8aafe34483bdc52f7a8b8b49c750d5f6c6da3f1.jpg,885CFA4A73054005B3E9C921648255A8
2021-04-06T11:18:06.000Z,Ozzy Osbournen koronaharrastus aiheuttaa paheksuntaa: ammuskelee kissoja ja lintuja pihallaan,Ozzy Osbourne on alkanut paukutella kivääriä pihallaan.,https://img.ilcdn.fi/MkXY04Aq2eVor9zRU1dRQCGu7Fk=/510x318/top/img-s3.ilcdn.fi/5833e18bc10e09fa8dd3674ed698e388fde20249ecb0fcf8361f9747e0bed69b.jpg,7655675F48D147A3AC74A9ECE0B2BC42
2021-04-06T11:19:09.000Z,Ville Rannan pilapiirros: Tässä yhteiskunnallisessa debatissa voit vain hävitä!,Ville Rannan pilapiirros 6.4.2021.,https://img.ilcdn.fi/MzvyZPp5oi1xuuuJwkLoBzvs55U=/510x318/top/img-s3.ilcdn.fi/dc3d9f75866a178483dc8814fb098d744f8cd33c3f7228049d7eac77bea813d6.jpg,56EAE567AB9E42289D8EB7706F2C412F
2021-04-06T11:26:49.000Z,Fimean ylilääkäri Astra Zenecasta: ”Myyntilupa tuskin peruuntuu – haitta äärimmäisen harvinainen”,"Fimean ylilääkäri Maija Kaukonen ei usko, että Euroopan lääkevirasto EMA peruisi Astra Zenecan koronarokotteen myyntiluvan. ",https://img.ilcdn.fi/aXLAjDb6rHID8T-Zfbv33HFSsVQ=/510x318/top/img-s3.ilcdn.fi/652a4638c2596a6248a20554ce2f57e9dc5acab0a1f603a60b46d08823347d12.jpg,7071B24604EB4FA3B49228D5CC5364CE
2021-04-06T11:36:45.000Z,Alaikäistä vahingoitettiin teräaseella Vantaalla maanantaina – epäilty myöntänyt teon,Epäilty on myöntänyt teon. Uhrin tila on vakaa.,https://img.ilcdn.fi/M_S9J-L3WZLV3cWWfkaEQi169Hc=/510x318/top/img-s3.ilcdn.fi/62b3d51b8c1653423b384b7b77b5f3920ac636e312d2663392d20c4ac50de852.jpg,311DA5EA67504742BB9314585EB1E34E
2021-04-06T11:47:23.000Z,”Ei pitäisi tehdä kuten täällä Pohjanmaalla aikoinaan”,"""Koskenkorvan sheriffi” Jari Mäki ei enää pidä Donald Trumpia Yhdysvaltain historian parhaana presidenttinä. Tässä jutussa hän kertoo, miksi.",https://img.ilcdn.fi/6tenFcX_Q7T50RVC-Q8hjJ2wQRc=/510x318/top/img-s3.ilcdn.fi/11c72c53f164dc20de6f3f2b268261eb1a033dde957b69adc12f8ac1fa8fb9a3.jpg,EB9A454DD4224D1DBA4E8BE932655FCE
2021-04-06T11:54:41.000Z,Keniassa kuollut suomalainen siviilikriisinhallinnan asiantuntija on tuotu Suomeen,Henkilö menehtyi 21. maaliskuuta. Vainaja tuotiin Suomeen viikonloppuna.,https://img.ilcdn.fi/fZ_QqKkkTsOa04gS8kGv53JGbyA=/510x318/top/img-s3.ilcdn.fi/25f6d404729f3470673a17ceca6491144ad3754446bdd66e802abeef810490b8.jpg,8100A58C05C14A5685CE95226449E738
2021-04-06T11:56:18.000Z,Boris Johnson aikoo maanantaina pubiin oluselle,Isosta-Britanniasta kuuluu nyt varovaisen myönteisiä koronauutisia.,https://img.ilcdn.fi/bVsf77hmDScxx2tjOAZrJanA8_w=/510x318/top/img-s3.ilcdn.fi/cdd4325db38c5494333bb85462622e7b181136c1c5d72a22ad0ac8a31c4e8690.jpg,6F6E41A646F246A7BDB90384463A9EDD
2021-04-06T12:08:49.000Z,Eduskunnan tilintarkastajien puheenjohtaja: VTV:hen ylimääräinen tilintarkastus,Tarkoituksena on vielä syynätä Valtiontalouden tarkastusviraston ylimmän johdon kuluja läpi. Eduskunnan kansliatoimikunta käsittelee torstaina VTV:n pääjohtajan Tytti Yli-Viikarin viralta pidättämistä.,https://img.ilcdn.fi/55_huuffPJMPRxQMuJ3uVPHl2Yw=/510x318/top/img-s3.ilcdn.fi/1527a24a52a395bcbac2b52a8fd394e064de3a29c8b8e6496a319ab5a9e0b3e1.jpg,429B1EA631BB44EBBF04D49280438796
2021-04-06T12:11:04.000Z,Showpainija potkaisi vastustajaa kasvoihin – sai vankeustuomion Englannissa,James Riley sai 21 kuukauden vankeusrangaistuksen tempustaan. ,https://img.ilcdn.fi/QQWZMXJbpX6k-oAb10dINn9IN4E=/510x318/top/img-s3.ilcdn.fi/e5a4886c267061005209ebcc0850f6fc882908de4e97edd9ce773fd9cd2c6998.jpg,5EA3FE95F34C4626B2DA05D64D1B02E4
2021-04-06T12:28:10.000Z,Hallitus on sopeutustoimista hajallaan kuin varpusparvi ,"Hallituksen jatkomahdollisuudet ovat koetuksella huhtikuun puoliväliriihessä, kirjoittaa Juha Keskinen.",https://img.ilcdn.fi/XW-35vjM-LVEBC-Sa-cX2Bpnx8s=/510x318/top/img-s3.ilcdn.fi/d56c55e6bf4f5e44a8b4d8e184cec015c7a67cc708d68c8995e3ae5bc317c70a.jpg,0027C44F1A90426C8CCADE82DACCFC8B
2021-04-06T12:35:12.000Z,Tehot irti! Näin kannattaa syödä ennen treeniä,"Ruokavaliosta kannattaa tarkastaa erityisesti hiilihydraatit, proteiinit ja rasvan laatu.",https://img.ilcdn.fi/FGLkNOQvGSE91nwEQLLJBj9XCSM=/510x318/top/img-s3.ilcdn.fi/d13c07bfa3f97e928e0b04e429ca389cbcd8e6625e97f58c26eb10a092a61d96.jpg,79B0F145B9794D399F7F9DC274EBE068
2021-04-06T12:47:17.000Z,"Jukka Rautakorpi sai sakot – kuinka moni Tapparan pelaaja rikkoi rajoituksia? ”Oliko niitä kuusi vai enemmän, en muista”",Tapparan urheilujohtajalle määrättiin 20 päiväsakkoa.,https://img.ilcdn.fi/8okVH5R8LG9D0N04i7MzaLMCmKw=/510x318/top/img-s3.ilcdn.fi/4ba402e8583935c095aaceab373d0cfcd0e345f74ddf6e4c388a924753b990f0.jpg,22C1E0465C8740778E345E5595E53953
2021-04-06T12:53:52.000Z,Lapsenlapsi vei vaarinsa koripallokentälle - ex-pelaaja ällistytti tallella olevilla taidoillaan,Vuosikymmenien tauko koripallosta ei vienyt isoisän pätevyyttä pallon käsittelyyn,https://img.ilcdn.fi/GjtEJuByXl4C7u5ie-Ddy0oBBJA=/510x318/top/img-s3.ilcdn.fi/2489587e676567ccf2c95004ff400aa40e0e99d4322b72a6c6df2dcd1f680325.jpg,8C19B10209E6405B8E97ECB5F161FAD0
2021-04-06T12:56:07.000Z,"Puhemiesneuvosto käsitteli Ano Turtiaisen väkivallalla uhkailua, ryhmäjohtajat kutsuttu koolle: ”Erittäin vakavaa”",Puhemiesneuvosto: Asian käsittely jatkuu perjantaina.,https://img.ilcdn.fi/OJOSdHM5sGHiJ2UTh3TrZyJ8u1s=/510x318/top/img-s3.ilcdn.fi/d94238965550b5e37cdff9e8a463a211fd3a9e85d574f34ea3288a947d88bce8.jpg,D7A8E9E854204E9C9CED0290C4AB26C3
2021-04-06T12:56:30.000Z,Skandaali Mrs. World -kisoissa – voittajalta revittiin kruunu suorassa lähetyksessä,"Mrs. World Sri Lankan osakilpailussa nähtiin kunnon draamaa, kun vastakruunattua kaunotarta syytettiin sääntörikkomuksesta.",https://img.ilcdn.fi/obpNdYYVdazRmrI31R8u8RUBWcE=/510x318/top/img-s3.ilcdn.fi/162fb4a7fbd74e8338f2e105721399bdb423fbb542b2835a562ff66917d7dbf5.jpg,F40A6644DF004698ABCA2CB617F952AB
2021-04-06T13:21:57.000Z,Rauman Lukko kertoi hienon uutisen: tehohoidossa ollut Pekka Virta palasi pukukoppiin,Pekka Virta on ollut joukkueen toiminnassa mukana jo viikon ajan.,https://img.ilcdn.fi/6-RsPRPsCkRXv9okjqTsszA923k=/510x318/top/img-s3.ilcdn.fi/bb3a6b95eb7fec1b61f6a89e2996df1d2507bb0d505b16f6bf35f5c83a6c0854.jpg,C9E1239F95AE4D5F858967927B1AC412
2021-04-06T13:22:08.000Z,Uusi pieni bensa-Volkkari tulossa – kaupoissa jo vuoden lopulla,"Volkswagen on julkistanut luonnoskuvat uudesta pienestä katumaasturistaan, joka esitellään kesällä.",https://img.ilcdn.fi/B8xEQgyAGds_Jq87UqCAlJdLRf8=/510x318/top/img-s3.ilcdn.fi/8f74a04a2209408c429265c95ffdc1bb2aad4a733529747a0251348008bc6f83.jpg,D52FFA757DAF4F40A70622905E8C388F
2021-04-06T13:27:35.000Z,"Turun kaksoissurma: Epäillyllä moitteeton tausta – yhteys uhriin löytyy ”turri"" -fantasiakulttuurista",Epäilty on historiansa perusteella varsin eri maata kuin tyypillinen henkirikollinen.,https://img.ilcdn.fi/BsTP-eiTcGByQ4qxtlUIHkDGEzw=/510x318/top/img-s3.ilcdn.fi/16cb5721491250da27ac43ffc1a79eb477242b7e0518df8a6aeb51f2455d85ff.jpg,051D866A0DFC4D20BB564362056F92B6
2021-04-06T13:34:11.000Z,"Hunter Biden avautuu uutuuskirjassa, kuinka koukuttui viinaan ja huumeisiin ja rakastui kuolleen veljensä leskeen",Yhdysvaltain presidentin pojan tuore muistelmateos kertoo rehellisesti riippuvuudesta ja vastoinkäymisistä.,https://img.ilcdn.fi/uaan0hMMB0QNC7TAVTxVpME5PCA=/510x318/top/img-s3.ilcdn.fi/136e0ae5b6f19b159ba49da923acbecda7ac10eecd7a753872c8329ee1c59e8a.jpg,E86092582A3C457E9A2DA6D5D0E94D80
2021-04-06T14:05:01.000Z,Tällainen on Niko Ranta-ahon uusi väitetty huumeliiga,Ranta-ahon uusiin huumerikoksiin liittyen epäillään tällä hetkellä noin viittätoista ihmistä.,https://img.ilcdn.fi/cEbpVln2O_YbEdOaIL9mTq-xd50=/510x318/top/img-s3.ilcdn.fi/fe1e026b7215233403da9c9b695941d1483f96aee884b7e475e188df8a543519.jpg,B90A89B3E1A84D26AC3190D760597FC1
2021-04-06T14:06:01.000Z,Korona pisti NHL-seuran sekaisin – jo yli 20 tartuntaa: ”Oksentelua ja kramppeja”,NHL:n mukaan tartunnan saaneita pelaajia on Canucksissa 17.,https://img.ilcdn.fi/5xkVyDDbKJJvP3d6fviJp7_kXFM=/510x318/top/img-s3.ilcdn.fi/3d4f5df2a701ce23fd41e628e00d0ac7bdffb3dd177e2dc7664c91a9b0f73f66.jpg,F3C9070615DD4F8FB4AC3FE0D9EDF35B
2021-04-06T14:07:05.000Z,Linda Lampenius hymyilee kuvassa Hugh Hefnerin kainalossa – ikävöi Playboy-aikojaan,Viulisti Linda Lampenius vietti 1990-luvulla aikaa Playboy-kartanossa.,https://img.ilcdn.fi/yhafDtNoE8gVZXrFb36o1hD2ots=/510x318/top/img-s3.ilcdn.fi/ac45bef9fd10dea89336b11246a785662d5327c9fc5ba52d65ebd8fc770d8b57.jpg,1A2AE7D2B1614102A665294212D3B3FF
2021-04-06T14:28:20.000Z,Maailman vahvin ja ME-mies hyppäävät nyrkkeilykehään vastakkain – muodonmuutos paljastaa hurjan treenin tuloksen ,Eddie Hall sekä Hafþór Björnsson ottelevat viiden kuukauden päästä syyskuussa. ,https://img.ilcdn.fi/S48utERjvmZn5SuX4ingrKRY5kU=/510x318/top/img-s3.ilcdn.fi/b21c8582998af3518af2682f40e01fccb53c61078ab4f04a55657580ae03fcbf.jpg,E8FC6ED92273484DB9FD1CE0C7BC9BEB
2021-04-06T14:38:00.000Z,Amerikkalainen koira sisusti olohuoneen uudelleen popsimalla säkkituolin – Katuva ilme kerää sympatiapisteet,Lily-koira päätti popsia omistajansa tuolin.,https://img.ilcdn.fi/FC2WWufneQ76sDNshFlq-D2Yjjk=/510x318/top/img-s3.ilcdn.fi/c2ff077a7a420e713bb46defbd5e3754e55b70c00a4be3f99c7d2596c1a6dd7c.jpg,7A7524D7FF47401081BDB1EA8A710954
2021-04-06T15:05:27.000Z,Erika Vikmanin rohkea intiimipaljastus podcastissa – porno ja välineet tuttuja,Laulaja Erika Vikman kertoo itsetyydytystottumuksistaan Ina Mikkolan podcastissa.,https://img.ilcdn.fi/KBd8jIvgf5yQvU9Ft7jyzUgZC6w=/510x318/top/img-s3.ilcdn.fi/47271eb0c0b07f50c8beac89de3c222f15c594d233a7831fd90191a94270b9c7.jpg,C43833BE23B2460EA11739242C091E5F
2021-04-06T15:08:18.000Z,Mitä jos on jo saanut ensimmäisen annoksen Astra Zenecaa? 5 polttavaa kysymystä ja vastausta kohutusta rokotteesta,"Suomessa Astra Zenecan koronarokotteen käyttöä jatketaan, mutta päätös voi muuttua.",https://img.ilcdn.fi/v9A6FrnGKznraHyaxW34aRkOu_I=/510x318/top/img-s3.ilcdn.fi/27a5ffab7f227cb72455137fa0b5b0e51a31d0eb1ddeb27bde751f58b8c2c91c.jpg,C2C42D05E1214D8DA019E3ED774844FE
2021-04-06T15:14:39.000Z,Kimi Räikkönen julkaisi mystisen videon – Mintulta napakka vastaus arvailijoille: ”Ei todellakaan”,Kimi Räikkösen nauru pisti seuraajien silmään.,https://img.ilcdn.fi/p2Orox2LDLtxIVqZQBmYLelgQXM=/510x318/top/img-s3.ilcdn.fi/94100456195a1ce81c35ab51b3fdb7a23ad9af6727f00958889168b17a42ca39.jpg,9C650277B782471484BAF0C5A4369D75
2021-04-06T15:21:39.000Z,"Keskustan kapinakenraali Hannu Hoskonen lisää kierroksia EU-tukipaketin vastaisessa taistelussaan – ""Itsenäisyys on uhattuna”",Keskustan ryhmäjohtaja: ”Käsittelemme näitä asioita suljettujen ovien takana.”,https://img.ilcdn.fi/slXmWVhR1vkMxMMUD5D01mb8RL8=/510x318/top/img-s3.ilcdn.fi/b07bcf51e195c770da30c56e218b74166fe375be6b047599670e1cfaf8f478e1.jpg,70D0917575DA4FDEB4640699C295C978
2021-04-06T15:31:52.000Z,Kendall Jenner löysi täydellisen kukkamekon! Kopioi kesän kaunein look,"Huippumallin puhvihihainen kukkamekko on juuri sellainen, joka nyt halutaan.",https://img.ilcdn.fi/wrA0yv8gBY-1ANrgql4XBCGGZUk=/510x318/top/img-s3.ilcdn.fi/21034c1f6a03c050f02417ce1413c461db494f44d86a1c527dba453eef98acf2.jpg,6D0D3932D4A14613B6E1FA224B8EFD7E
2021-04-06T15:42:32.000Z,Kaksikkoa syytetään tuttavansa taposta Pihtiputaalla – vanhempi syytetty mielentilatutkimukseen,Tapauksessa syytetään kahta miestä tuttavansa taposta ja hautarauhan rikkomisesta sekä kolmekymppistä naista useista pahoinpitelyistä sekä hautarauhan rikkomisesta.,https://img.ilcdn.fi/xqlTPgVtasJNx83nO41UnBc3eNk=/510x318/top/img-s3.ilcdn.fi/92b1ec04aa4ea941cda6005e371f4c94b7c4b171e0c046730d0eb0e11d235662.jpg,8E78C510C14643F8A1EE956CDC0CC989
2021-04-06T15:58:56.000Z,Naisemme maailmalla,Kolme naisrauhanturvaajaa kertoo oman kokemuksensa maailman kriisialueilta – siellä heitä todella tarvitaan.,https://img.ilcdn.fi/ux2JczxPDHSC6na_0uAW-ubx838=/510x318/top/img-s3.ilcdn.fi/7e979ddc4db94a28606ff23b290767702296e2185afc4edea1e3be4789c4e484.jpg,169F9F8283B442C1BB91427DC999A89C
2021-04-06T16:02:31.000Z,Kuusi ihmistä löytyi kuolleena asunnosta Texasissa – veljeksiä epäillään perhesurmasta,Asiantuntijan mukaan tapaus on erittäin harvinainen. ,https://img.ilcdn.fi/phj4KI9K6uH-N2Klr-idkOQ_6jM=/0x86:3000x1961/510x318/top/img-s3.ilcdn.fi/c6f9d1fc120acfe37c2a957d22288927efbe6fe3cda5697798c13f8a57a52b74.jpg,C4C79967525A4CEAAFA7305572AD2282
2021-04-06T16:10:59.000Z,Erling Haaland asettuu näyteikkunaan – norjalainen on Manchester Cityn ostoslistan kärjessä,Erling Haalandilla on henkilökohtainen suhde Manchester Cityyn. ,https://img.ilcdn.fi/F-_usc_TTkMWpR_kw7GXoFiz9Ts=/510x318/top/img-s3.ilcdn.fi/2b48b3e345e705a1c630142eb7da68b2250b138c13a66713e469e734d1fa109d.jpg,EC066FDAAC08442697569573EE9ABCB4
2021-04-06T16:16:42.000Z,Lukko jälleen Turussa niskan päällä – Sport ja HPK kisaavat viimeisestä playoff-paikasta,Liigan runkosarjan loppusuora avautuu tiistaina kuuden ottelun kierroksella.,https://img.ilcdn.fi/T887DdfaEIFRDREGOnF15QM7ZL4=/510x318/top/img-s3.ilcdn.fi/f479bee7eb3af8fb03f27be4dcb6b27323354a17a5d7361337745d5b0554b595.jpg,2A5B1B7CC5CD4500A2493EC1E6E62119
2021-04-06T16:31:45.000Z,Kim Kardashian on nyt miljardööri – meikkibrändin arvossa hurja nousu,"Kim Kardashian on nyt virallisesti miljardööri, julistaa Forbes.",https://img.ilcdn.fi/FHZGmL1nn3F7TK6twNbH648U3PQ=/510x318/top/img-s3.ilcdn.fi/bc297a4a3671c0176fe3addbdc9cedd8ffe38318c00c491c6247202ee37558e7.jpeg,BD8C680A9C114E11A236120933F56CE9
2021-04-06T16:33:55.000Z,"Anniina istui metsätilkulla nauttimassa keväästä, kun kauriit saapuivat: ”Olin ihan puulla päähän lyöty”",Kaksi kaurista lähestyi Anniina Keskistä Mynämäellä.,https://img.ilcdn.fi/-hXiC-Sn6WQPxjBpjvfKea0l6wo=/510x318/top/img-s3.ilcdn.fi/a251bbc94662110ea24a742f467eead2a1e1f1d66a06744616034c3920e2ba20.jpg,0EF368BAD4554E8482B185DD963F76E0
2021-04-06T16:34:30.000Z,Ensimmäinen kuva Trumpin toimistosta Floridassa julki – tarkkasilmäiset tekivät huoneesta mielenkiintoisia havaintoja,Pöydällä on myös silmälasit ja Coca-Cola Lightia.,https://img.ilcdn.fi/Zr_71Gm4imQlKRD0B1Sp62-2FhE=/510x318/top/img-s3.ilcdn.fi/587f9ae6aea3ad940475172dac9df98e9f40514727f430e357489ed9ee28ffae.jpg,99E8B9A311F4401BA53A258EDF79B8A7
2021-04-06T16:44:20.000Z,Dramaattinen operaatio Pohjanmerellä: tyhjä rahtialus kelluu kohti Norjan rannikkoa – öljytuhot uhkaavat,Aluksen koko 12-henkinen miehistö on evakuoitu.,https://img.ilcdn.fi/Yws_DOH4TrBhAANILrXCdJB967w=/510x318/top/img-s3.ilcdn.fi/006d29b919d382fcacf1880df9ca67dcc2d8660ac8d677e39e292b782493c3a1.jpg,CC9A2BAB2C4F4FCC9FC6B261D4DBA1D0
2021-04-06T16:49:36.000Z,"Ex-ministeri Kulmunilta tiukkaa hallituskritiikkiä ravintolasulusta: ”Kiusallisinta tästä tekee se, että tämä on jälkitarkastus”",Väittely ravintolasulusta ja sen toteutuksesta paljastaa hallituspuolue keskustan sisäiset jännitteet.,https://img.ilcdn.fi/5jXtSzp2t5jdqC3NlMAwdFIh_Uk=/510x318/top/img-s3.ilcdn.fi/120c56d70509c98b84480847e2f5d3af3f22a95b251fad34d7925edca4b8071a.jpg,67540F3265A142C49456F484C3EEFA81
2021-04-06T16:50:01.000Z,Liverpoolin-tappajan paluu – Karim Benzema päästetään irti Punaisia vastaan,Karim Benzema on eniten Liverpoolia Mestarien liigassa kurittanut pelaaja.,https://img.ilcdn.fi/jSV4m9hxB1v_ptlZ2IKQ6ecTjAw=/510x318/top/img-s3.ilcdn.fi/93ec4c9ee93e3fb4857b07f56db4f118035fb08fd456e1a42e605d21ddd6cc39.jpg,43FAEE6E9BDE4B7C8DFA0CB7063D3D87
2021-04-06T17:06:33.000Z,"Eskareihinkin maskisuositus Husin alueella, vankila säppiin – tämä on Suomen koronatilanne nyt",Lue alta tiistain koronauutiset tiivistetysti.,https://img.ilcdn.fi/4fgRdAMc1UVeE5sHpLO0uh6MqPo=/510x318/top/img-s3.ilcdn.fi/6f0cbbb033215e2c862642716240e904ad98d83c933fdbf3e8c09e4687c9309c.jpg,ED7F0A98F991443A954AE28125F3468A
2021-04-06T17:34:13.000Z,Tiesitkö? Neuvostoliitossa puuhattiin oma Taru sormusten herrasta -elokuva: Tältä koominen tekele näytti,Neuvostoliitossa tehty Taru sormusten herrasta -elokuva ehdittiin näyttää televisiossa. ,https://img.ilcdn.fi/aFx_P8BaERTtQSe5yKaDzZEOnMM=/510x318/top/img-s3.ilcdn.fi/cf16e6faaa32bce086a29cd98f4a7da78e7fa541684036fc8bddaec1daedfa80.jpg,9F7A8AC64E5D42D29AAFF5E2B821B331
2021-04-06T17:56:48.000Z,Anni Vuohijoki nosti SE-raudat EM-kisoissa – tuomarit hylkäsivät molemmat ennätykset: ”Olin varma”,Anni Vuohijoen sijoitus oli toistaiseksi paras suomalaisnoteeraus EM-kisoissa.,https://img.ilcdn.fi/SO7QTAym4_zKl--LOGtgx-cueMw=/510x318/top/img-s3.ilcdn.fi/fc17a2eef26eac657d45a151897f47152e9a535de6d1b23b5d9074462a3d0567.jpg,B2EFD4278CB649969BC086A96D934B26
2021-04-06T18:03:51.000Z,Keskusta antaa koronarokotteita mieluummin Bulgarialle kuin pääkaupunkiseudulle,"Vaikka hallitus päättäisi muuttaa rokotusjärjestystä välittömästi, käytännössä sen toteuttamisessa menisi useita viikkoja, kirjoittaa politiikan toimittaja Tommi Parkkonen.",https://img.ilcdn.fi/liaieurKWHlpgSrg625UtLH3yJI=/0x105:4925x3183/510x318/top/img-s3.ilcdn.fi/335f8d32a54b086a5b06ba51d512591d96bd7d3631e5c44aeffcac3797ce963e.jpg,E30787E4EE4944D09E7CDBCF58CA9798
2021-04-06T18:14:47.000Z,TIS: Varatulta Mikalta yllättävä tunnustus – pohtii yhteistä tulevaisuutta sinkku-Peppiinan kanssa: ”Oot luotu mulle”,Temptation Island Suomessa kuullaan yllättäviä tunnustuksia. SISÄLTÄÄ JUONIPALJASTUKSIA.,https://img.ilcdn.fi/8Mz8IQZuYUn-4TolOo7xcEd2Wss=/510x318/top/img-s3.ilcdn.fi/09de536fb3bd284225330f806e118b11eaed366fd43f9fc06f6eed289ac946d9.jpg,6DB3A37249FB496384224754A1DCFD8D
2021-04-06T18:21:27.000Z,Koiran ja hevosen taistelu kepin herruudesta Venäjällä huvittaa,"Vaikka meno on villiä, eläimet ovat toistensa parhaita kaveruksia.",https://img.ilcdn.fi/Ofhi2QZlZlNamVGt9eg5Db7yawk=/510x318/top/img-s3.ilcdn.fi/94a5d22c1124eedc2da4e8f947a22976d3d3058ae320e4c3d42fc5fe248af1e5.jpg,0F2BAE5D76E24278AB959DFA21013C1B
2021-04-06T18:23:40.000Z,LG jättää puhelinbisneksen – rullautuvanäyttöinen puhelin romukoppaan,Korealainen teknologiajätti on ilmoittanut lopettavansa puhelimien valmistamisen.,https://img.ilcdn.fi/ors6Iu0OehliNrv6N4-CZxgzADM=/510x318/top/img-s3.ilcdn.fi/8b37495b6b8de0d0dde13623d3610337293d5f268bc3d35089f89502231ceced.jpg,EDC166BEA3E54588ACB0F75F5E09813C
2021-04-06T18:26:06.000Z,"”Mahdollisesti solvannut rasistisesti” – Glen Kamaraa herjanneelle pelaajalle rangaistus, myös Huuhkajat-tähteä uhkaa pelikielto",Ondrej Kudela huilaa ainakin yhden ottelun. Tutkinnat jatkuvat.,https://img.ilcdn.fi/yJzzrYWTgjfOsR2updZN-L4M4lo=/510x318/top/img-s3.ilcdn.fi/cf4df8185c92510651abe92672adb826a0bd89e054c3d145eb7aa05bb795d69d.jpg,C7D86FB53CBA49B1A90577671948194C
2021-04-06T18:48:31.000Z,Pori sulkee Yyterin nakurannan – päätöksen taustalla negatiivinen palaute lapsiperheiltä,Myös alueen yrittäjät kertovat saaneensa asiasta paljon ja hyvin kielteistä palautetta.,https://img.ilcdn.fi/trEaEf2STKV77KIImlU9HcYTY8o=/510x318/top/img-s3.ilcdn.fi/2d967169263058c3094c5a1d5dc601881dd20b7f05bbe00af67dffaf70a91594.jpg,5A58D60AB5444D7093CA2D5037C08B22
2021-04-06T18:56:26.000Z,Maasotakoulussa todettu lähes 50 koronatartuntaa,Uusimmat positiiviset testitulokset on saatu sunnuntaina illalla. ,https://img.ilcdn.fi/gxkpgFZXfKplAM9j1Fsybmt4F3o=/510x318/top/img-s3.ilcdn.fi/1549b421c288ab8b4582bab8e5ee066fc8605e1c143326c8a7a7c9de739bec85.jpg,59B78EA932BF44798DEE846C0264C48F
2021-04-06T19:01:56.000Z,Teemu Pukin ilotulitus jatkuu! ,Kauden 23. maali Mestaruussarjassa syntyi tiistaina.,https://img.ilcdn.fi/COSzcDZXFkJZnhG2-eS1Zq_oytc=/510x318/top/img-s3.ilcdn.fi/4f3871930e928ab16f918a327aee6926d09333dd43bb85dfdcfa7a19de33fa04.jpg,EC68E96E9C18424BA746D93744ADFC35
2021-04-06T19:15:28.000Z,VTV:n Katri Lammi: tuhottavaksi määrätyt asiakirjat ovat tallessa – poliittisia päätöksiä ei saanut kritisoida,Tarkastusraportin pehmentelystä kertonutta ylitarkastajaa oli käsketty hävittämään aineistoja ja kiellettiin puhumasta medialle sopimatta vastauksista etukäteen esimiesten kanssa.,https://img.ilcdn.fi/RqcwvAwVK6f_aTLKkPA9CowxICw=/510x318/top/img-s3.ilcdn.fi/225622c4e69cccefb60be9138b8940edbb83ee1215b2e9ac9f737768b58a21b3.jpg,F886C580F14D4EA8BF1A3374DD15C235
2021-04-06T19:21:03.000Z,Khloé Kardashian piileskeli pienenä äitinsä sängyn alla – sitten sängyssä alkoi tapahtua,"Kris Jenner muisteli hetkeä, kun hänen tyttärensä joutui vahingossa todistamaan lemmenleikkejä.",https://img.ilcdn.fi/VH6PB9ITL2DlwE2XM9wxW0gMPls=/510x318/top/img-s3.ilcdn.fi/408c7e6a14119572d6e22cefaad4d2dae0f40daee20a76d6b9ee614bb6eb079b.jpg,C2DD6B4C2B0145ACB04DC583D7544839
2021-04-06T19:33:12.000Z,"Aivokuolleeksi julistettu brittimies Lewis, 18, alkoi hengittää vain tunteja ennen kuin hänen sisäelimensä aiottiin luovuttaa",Hän oli loukkaantunut vakavasti liikenneturmassa.,https://img.ilcdn.fi/5uum-I2zzapKQloNxH_h1uSBhYA=/510x318/top/img-s3.ilcdn.fi/060756cc277cec141a2e6765f7a9d2eb91fe7be85a189fbb7ae504a4773991e7.jpg,54535827AB59437185C089D458A0E6F0
2021-04-06T19:59:48.000Z,Yli 100 000 tartuntaa päivässä: Intian koronatilanne pahenee – ja edessä on jopa 150 miljoonan ihmisen jättijuhla,Mumbaissa ei ole asiaa ulos iltaisin ja viikonloppuna. ,https://img.ilcdn.fi/9m0zWRSJiUWv_hZqAwiRds9uzyg=/510x318/top/img-s3.ilcdn.fi/89bd09f572702b7e7cc32535446ffd66151e28b616969294704ca09d007c434b.jpg,0EFCF9708FE945C9A265BC616E17075D
2021-04-06T20:17:47.000Z,Liverpool-puolustus suli henkilökohtaisiin virheisiin – Real Madrid otti niskalenkin Punaisista,Real Madrid voitti Liverpoolin 3–1 Mestarien liigan puolivälierien avausosassa. ,https://img.ilcdn.fi/3hu5GU2EByZTjawJH2yKcTewWiw=/510x318/top/img-s3.ilcdn.fi/6304297b5a4c75214af60babc815262f28010d29be6fef69e5ac23e16d722d13.jpg,DEBD32E5076D4FF9BFE602BC7CB5C6DA
2021-04-06T20:25:01.000Z,"Teho-osastolta koronan kourista palanneelta Pekka Virralta painava viesti: ""Se on kova tauti""",Teho-osastolla hoidettavana ollut Pekka Virta palasi Lukon johtoon.,https://img.ilcdn.fi/N18yo3u5YE91Gu2tEh4HOWej4Qw=/510x318/top/img-s3.ilcdn.fi/b60302f5d4908b03fa9bb52a12556ea239d950d44026225ab685f6c425d287e2.jpg,058DF62E9E1749A99678A0615BB47EC3
2021-04-06T20:31:08.000Z,Koronakaranteenin rikkoja määrättiin tekemään 300 kyykkyharjoitusta Filippiineillä – sai surmansa ,Mies oli ostamassa vesipulloa väärään aikaan.,https://img.ilcdn.fi/IKz-NkRGSvFCygxbwnyhpTC_SqU=/510x318/top/img-s3.ilcdn.fi/f37dfa684b77075a0d128e3749fa02b2fdc4490edae34c5d33279cee01a2a24c.jpg,53EB9C32436247678446435E6176905B
2021-04-06T22:06:05.000Z,Harryn ja Meghanin ensimmäisestä Netflix-projektista paljastettiin uutta tietoa – sarja käsittelee sotainvalidien elämää ,Herttuaparin ensimmäinen Netflix-projekti julkistettiin.,https://img.ilcdn.fi/Ey8DWItBZ0CtZ_kqM6didUwRS6Q=/510x318/top/img-s3.ilcdn.fi/c9b17399a2d9263c482871e2a10d4c161cbc8353e20dec579e0d3f95d5c296a7.jpg,F061756F54284BD2B6C313F3AA45B599
2021-04-06T23:00:18.000Z,Horoskooppi,NULL,https://img.ilcdn.fi/ZJX2nPQHLedeTO4nOGca4bZ5URo=/510x318/top/img-s3.ilcdn.fi/0e855f41645f17dbb2436f21bf69f40ac48d1971a147578985e2c64c1fb985d3.jpg,DB45E5B6A64C492FB57C588FA204DA71
2021-04-06T23:04:08.000Z,Biden lupaa: Kaikilla yhdysvaltalaisilla aikuisilla mahdollisuus saada koronarokote kahden viikon päästä,Esimerkiksi Kaliforniassa suunnitellaan jo talouden avaamista. ,https://img.ilcdn.fi/ZymAGalhxx_Yh7HI3E8J4Iol4sQ=/510x318/top/img-s3.ilcdn.fi/17684f3e3b2646ae2240894147b80c739375580445cae261a71ae086f0640308.jpg,6B34E5290070408893EB7929ACADA408
2021-04-06T23:58:18.000Z,Brasiliassa jälleen uusi koronakuolemien päiväennätys – yli 4000 kuolemaa vuorokauden sisällä,Maan koronatilanne pahenee entisestään. ,https://img.ilcdn.fi/XSAuVQ7sKv7ckavnd1YvOebWhlg=/510x318/top/img-s3.ilcdn.fi/8bb1da007b9b47e5b1d0239fb203b03927d42e522b74e808bafe72f41128c3c5.jpg,13F82895750C460DBDD330CD65B06636
2021-04-07T02:00:50.000Z,"Perjantaille on kasassa myrskyn ainekset, tuulituhoja luvassa maa-alueille – sitten koittaa lämmin käänne","Perjantaina Suomeen saattaa saapua myrsky, mutta sunnuntaina sää lämpenee.",https://img.ilcdn.fi/YT4bcPPl0rD2AbSx08pqAUvHnFk=/510x318/top/img-s3.ilcdn.fi/b2edeaf89da12838da864e72461c7000072aa018fa3f028850da1289f3fa2c17.jpg,6959777FAB9F4EF8838BD96959BF2FF9
2021-04-07T02:17:33.000Z,Amnesty: Venäjä saattaa yrittää tappaa Navalnyin hitaasti,"Järjestö on huolestunut olosuhteista, joissa oppositiopoliitikkoa parhaillaan pidetään.",https://img.ilcdn.fi/3Mgk_xZgPQ6v524836aOcwkJ-gw=/510x318/top/img-s3.ilcdn.fi/a274e63a5717a9e387fc8fb1ba3edc16e3ae1a2321f7e1067ad7fc80501025f4.jpg,5270107FFB104C6D8C208324C3F19FA9
