paivamaara,otsikko,tiivistelma,kuva
2020-02-26T11:08:14.000Z,Kaupankäynti Tallinkin osakkeilla keskeytettiin pörssissä,Kaupankäynti AS Tallink Grupp:n osakkeilla keskeytettiin Helsingin pörssissä tänään kello 12. ,https://img.ilcdn.fi/tzNTLsaTq4Q0P8uyiYAT68f4mdA=/510x318/top/img-s3.ilcdn.fi/677f5881a8bfda944f421839854def2c388e3dcd5dee8e277a39a31f72a8fd44.jpg
2020-02-26T11:09:31.000Z,Viimeinen yhteinen ristiretki? Pep Guardiola ja Manchester City lyövät Mestarien liigassa kaiken peliin,Päivän pelivalinta on Mestarien liigan Real Madrid-Manchester City-ottelu.,https://img.ilcdn.fi/Cm2H66FJKFkoJk5mcuE0uz-NvQc=/510x318/top/img-s3.ilcdn.fi/3b12f8fb159d1c148d6ac4a099dacc0a3a19ea010dba5886baf8616fa93979d7.jpg
2020-02-26T11:10:37.000Z,"Syyttäjä: Jari Sillanpää harrasti seksiä lapsen nähden – oikeudessa kiistellään, oliko teko tahallinen","Syyttäjä kertoo viimein, mistä on kyse Jari Sillanpään hyväksikäyttösyytteessä.",https://img.ilcdn.fi/cG0JsCVux7Vayara3YXSYX3svFg=/510x318/top/img-s3.ilcdn.fi/cb8e1905713edd9c38212f6c3c852f6a610912fbecbf71edad4139c200b26dc1.jpg
2020-02-26T11:17:47.000Z,Kuinka paljon asuntolainaa voi saada?,Lainanmaksun lisäksi rahan pitää riittää elämiseen ja säästämiseen. Pankkien asiantuntijat kertovat mitkä asiat vaikuttavat lainapäätöksiin.,https://img.ilcdn.fi/ZuuL75rqrME8cu86-sBSu54C5SI=/510x318/top/img-s3.ilcdn.fi/0417b6336517717cadb02287b292a0d296ebddd1aa01424b286c73494a50cbd8.jpg
2020-02-26T11:27:58.000Z,Pakko saada! Kourtney Kardashianin suosikkileggarit silottavat kroppaa ja kohottavat takamusta,"Spanx tunnetaan muotoilevista alusvaatteistaan, mutta merkin leggingsit vasta ovatkin Hollywoodin A-listan suosiossa. ",https://img.ilcdn.fi/acdO2Nl6szK_F1lsLkEau0Tfov4=/510x318/top/img-s3.ilcdn.fi/98a40052a7145d96ab941c24d7a5022d9185b4f14d4016a9dc4ea1efb9059fdc.jpg
2020-02-26T11:34:42.000Z,Onnettomuus Raision Hoplopissa – parikymppinen mies loukkasi jalkansa trampoliinilla: ”Mistään hirveästä verensyöksystä ei ollut kyse”,"Todella harvoin käy tällaista, kerrotaan Raision Hoplopista.",https://img.ilcdn.fi/OUQDFqDp1uTbnU2Rb2Dt6MBYA-8=/510x318/top/img-s3.ilcdn.fi/8ce68bce063678c59f3de75aa1431abc212b33588c5adfa1359642dd30388c6b.jpg
2020-02-26T11:37:25.000Z,Ohi on: Yli 1 000 NHL-ottelun konkari ei löytänyt pelipaikkaa – iski hokkarit naulaan,Itävallan kaikkien aikojen pelaaja ei saanut pelipaikkaa loppukaudeksi.,https://img.ilcdn.fi/GVQvVX7lnYCZIEn6rMZNhoqyREg=/510x318/top/img-s3.ilcdn.fi/50de0b3ee83abcb5ef94f08790d10e7e62ec80b4fd390e8a5ee23c5cf521de26.jpg
2020-02-26T11:49:42.000Z,Lisää tietoa Jari Sillanpään syytteistä: Lapsi kuvasi laulajan ja hierojan välistä seksiä – ”Kiristämisestä ei ole kyse”,"Jari Sillanpään syytteessä on kyse siitä, että Sillanpää harrasti seksiä alle 13-vuotiaan lapsen nähden.",https://img.ilcdn.fi/8opngcqCY9Rmjc8yIBkUmGXuTRU=/510x318/top/img-s3.ilcdn.fi/8c316a679decad33cbb120b9dbaeea48c93a68feffecc6b4bc342766eb625311.jpg
2020-02-26T11:55:10.000Z,Koronavirus ahdistaa ja rajoittaa elämää – professori antaa 4 neuvoa turhan pelon voittamiseksi,Psykiatrian professori Jyrki Korkeilan mukaan uuden uhan edessä on luonnollista tuntea ensin pelkoa.,https://img.ilcdn.fi/YPljdoOdSaGlFYzF7bKNyDCYing=/510x318/top/img-s3.ilcdn.fi/e1383db43e9986273d4728c03e56d3cafb476f9fc991ea81e95314ddf1d2c45a.jpg
2020-02-26T12:08:18.000Z,Paavo Väyrynen arvostelee Marinin hallituksen päätöstä ottaa 175 turvapaikanhakijaa: ”Kärsivällisyyttä koetellaan”,NULL,https://img.ilcdn.fi/uSF39ddC6UxJmweE-_8pGjZTJKk=/510x318/top/img-s3.ilcdn.fi/50e6758c8f864a798efb6f8634c12c78bf03f6d6771ff1390493422aa311330b.jpg
2020-02-26T12:08:47.000Z,Mielenosoittajat pysäyttivät metsähakkuut Oulussa: ”Ei virkistysmetsää pelloksi”,Pitkään jatkunut metsäkiista kärjistyi tänään Oulussa. Hietasaaren hakkuut aloitettiin.,https://img.ilcdn.fi/38cmwkllRDVwrR8sjX0aXgSXFd0=/510x318/top/img-s3.ilcdn.fi/57d85aae2a45d92fce38d67b21c29a7b857d0dbedca4e5d413a4422a8a06445f.jpg
2020-02-26T12:19:38.000Z,Kaksi vuotta Kööpenhaminassa - nyt suomalainen pizzeria äänestettiin kaupungin parhaaksi,Suomalainen Classic Pizza äänestettiin Kööpenhaminan parhaaksi.  ,https://img.ilcdn.fi/XP-gHaZaKCNWEaTAjNAJ5cALV2E=/510x318/top/img-s3.ilcdn.fi/79125ef29d035004020b5189c402b04849a995793812a5c550c7eb0d648bb040.jpg
2020-02-26T12:34:47.000Z,Manchester City ja Real Madrid tarjoavat todellisen herkkupalan – ”Vastassa on Mestarien liigan kuningas”,Manchester Cityn manageri Pep Guardiola on tottunut voittamaan Real Madridin kotikentällä. ,https://img.ilcdn.fi/2Rc4RiufSFINQRkYcdp9bcoZRMs=/510x318/top/img-s3.ilcdn.fi/cbaa4264ef3bb9d5a934331d10ceedba96533a5408eb66e7473b55873247c64d.jpg
2020-02-26T12:39:51.000Z,F1:n Amerikan valloitus ontuu pahasti – palaako legendaarinen kisaisäntä takaisin?,"F1-sarja haluaa laajentua Amerikan suurkaupunkeihin, mutta suunnitelma on vastatuulessa.",https://img.ilcdn.fi/U9_x1B3VGNjLncyKC4TA_5GY-L4=/510x318/top/img-s3.ilcdn.fi/33929c2343248876af95962b0207cfa8aac444d40d4b27036a39cfc27c8a485f.jpg
2020-02-26T12:45:01.000Z,Venytkö sinä näin? Herttuatar Meghanin notkean kropan salaisuus piilee joogassa,"Selvitimme, miten herttuatar Meghan pitää kroppansa kunnossa.",https://img.ilcdn.fi/F6Vp316IFnbESdVkOm-iHL5r3nU=/510x318/top/img-s3.ilcdn.fi/545d9b83fb3fe17750e2854193527783bff9228e0843e3fa7bca162ca13a86b4.jpg
2020-02-26T12:49:37.000Z,Oikeudelta käänteentekevä päätös Saksassa: lääkäri saa avustaa vakavasti sairasta potilasta itsemurhassa,Katolinen kirkko vastusti muutosta. ,https://img.ilcdn.fi/oO75HVQVgLPGYuObxyMqovSscyI=/510x318/top/img-s3.ilcdn.fi/7d60b459f609db73d7d06dce1b24bcc2e28bb5edb62f8e69076ca5cbd7b92ecd.jpg
2020-02-26T12:50:52.000Z,Kuningatar Elisabet ja Philip eivät asu enää yhdessä – prinssin terveys ei kestä yhteiseloa,Kuninkaallisten asumiskuviot puhuttavat.,https://img.ilcdn.fi/pt20gZhepuYFHjMfTZ6hbwJp1Q4=/510x318/top/img-s3.ilcdn.fi/f9e3092361bc7cd8edf758d304aec1556d9c5361cad43e4cdd0f5171ead8ce4a.jpg
2020-02-26T13:12:21.000Z,Koronavirus sai Facebookin liikkeelle – aloitti puhdistuskampanjan,Facebook yrittää estää väärän tiedon leviämistä palvelussaan.,https://img.ilcdn.fi/1dZfSh3o4W_RS7ri8j6o7udPilY=/510x318/top/img-s3.ilcdn.fi/4b2e30adc8d4b4da4433f70e7478d2b5de50fb8912a329687a3ba35e7012f911.jpg
2020-02-26T13:31:36.000Z,Missä Teemu Pukki pelaa ensi kaudella? Edessä on tyhjennysmyynti,Norwich on putoamassa ensi kaudeksi Mestaruussarjaan.,https://img.ilcdn.fi/ixMMj_3twycGWx53uLbg14jZmUM=/510x318/top/img-s3.ilcdn.fi/985996eb4b5bfb4be8ad20b87d753ba3d3d9be5a5250bf990624856d46eb2058.jpg
2020-02-26T13:36:57.000Z,"Emilia, 25, ja Wallu, 24, osallistuvat Temptation Island Suomeen toista kertaa – taustalla pettämistä ja luottamuspulaa","Emilia, 25, ja Wallu, 24, testaavat parisuhteensa kestävyyttä Tempation Island Suomessa.",https://img.ilcdn.fi/cYl2e5yNw8JuvjGSfd3UY2mDYqg=/510x318/top/img-s3.ilcdn.fi/9b70ab1ab6a5dc7ecfa4141f835fd14a522742ea76aeadd7a2c296fb98d9af7b.jpg
2020-02-26T13:37:03.000Z,Maria Sharapova lopettaa uransa – julkaisi tunteikkaan tekstin: ”Kehostani tuli häiriötekijä”,Maria Sharapova kertoi päätöksestä kirjoittamassaan esseessä.,https://img.ilcdn.fi/_F_Ink3mZYu160BN7cq3BAvr11o=/510x318/top/img-s3.ilcdn.fi/42d33db87b2745d24866fa13ec78c2890cb9f49be30e977631000db0a50fad6e.jpg
2020-02-26T13:43:01.000Z,Teuvo Hakkarainen kihloihin!,Euroedustaja Teuvo Hakkarainen (PS) vahvisti Facebookissa liikkuneen tiedon Iltalehdelle.,https://img.ilcdn.fi/05WfslZN0TJ6uej9F1BkCdK0dsI=/510x318/top/img-s3.ilcdn.fi/e595d79dda48c33e1759a349d1832caa7c12836d6afceac9ee251641202f80ab.jpg
2020-02-26T14:04:17.000Z,Alfa Romeo korjasi ykköstilan – Kimi Räikkönen keskittyi kisailemaan Williamsin kanssa,Jälkimmäinen F1-testiviikko sujui Alfa Romeon tahdissa. ,https://img.ilcdn.fi/P-m5OEPvkiULFv0NL7zdaWLp13A=/510x318/top/img-s3.ilcdn.fi/0825226d0947c291731b76c428d1ca18c1fb55a4c14c4c535846f57be6c321b6.jpg
2020-02-26T14:13:23.000Z,"3 asiaa, jotka todella kannattaa tehdä ennen työhaastattelua","Toimitusjohtaja Tessa White listaa kolme asiaa, jotka kannattaa tehdä ennen työhaastattelua.",https://img.ilcdn.fi/AP_czTNeqOE2KE1yhnJ_qCP8ZAY=/510x318/top/img-s3.ilcdn.fi/6cf1e07ca7d3e51b3ed394a24c49bae6565aea694299c4908152677e281fa6ed.png
2020-02-26T14:16:01.000Z,Suomalaismatkaajien reitti Tallinnassa täysin uusiksi – Tallink rakentaa uuden satojen miljoonien terminaalin,Tallink rakentaa satoja miljoonia euroja maksavan uuden terminaalin. Neuvostoaikaiseen Linnahalliin tulee myös kongressikeskus.,https://img.ilcdn.fi/G8gguLnnJU-YGIrkepKOOIg5Nss=/510x318/top/img-s3.ilcdn.fi/7180aa098920ee41c6dd143fb9b96c3b2795f3c72fc2b953095ad9c7658e1cee.jpg
2020-02-26T14:20:08.000Z,"Näinkö Putin säilyttää valtansa? Entinen avustaja vihjaa, että presidenttikausien laskenta on aloitettava alusta perustuslakiuudistuksen takia",Vladislav Surkovin mukaan laskennan nollaaminen on välttämättömyys. ,https://img.ilcdn.fi/POKb0GeT5iAFJBIyJcFiI4GMUmw=/510x318/top/img-s3.ilcdn.fi/67a442f57612961334b26e973d87bf98e28ced053d24d8feb029ba6548e93f14.jpg
2020-02-26T14:25:15.000Z,Potilas testattu koronaviruksen varalta Mikkelissä – tulokset saadaan torstaina,Testien tulokset on tarkoitus saada torstaina.,https://img.ilcdn.fi/dOZ292QHgx4Up9GiTfuabJwXK9o=/510x318/top/img-s3.ilcdn.fi/99c605f2cff03656ca9dcadeee09729d69286e8c83f1e6cdf8f840f6c53f3fd6.jpg
2020-02-26T14:28:29.000Z,Kevään katupölykausi alkaa ajoissa – ilma huononee etelässä jo tällä viikolla ,Katupöly heikentää ulkoilmanlaatua pääkaupunkiseudulla ja Lahden seudulla tällä viikolla. ,https://img.ilcdn.fi/MOH1o3vc-3pgC9SzcERlEnGvNVk=/510x318/top/img-s3.ilcdn.fi/6825ac80f542c0f0d763f2ea2fb21857d4ed1232ec9b490388cb9748dd1fa7f8.jpg
2020-02-26T14:48:28.000Z,Ensimmäinen yhteishaastattelu: Teuvo Hakkarainen viikossa kihloihin - Stephanie-rakas 30 vuoden ikäerosta: ”Ei ole tärkeä asia”,Teuvo Hakkarainen on parhaillaan Hondurasissa Stephanie-rakkaansa luona. Pari päätyi viikossa kihloihin.,https://img.ilcdn.fi/5AaaRrnFpKgvWd4MkK7ueMif12A=/0x168:720x618/510x318/top/img-s3.ilcdn.fi/e595d79dda48c33e1759a349d1832caa7c12836d6afceac9ee251641202f80ab.jpg
2020-02-26T14:50:39.000Z,Ilvesläinen työn sankari – Liigan pistekärki Eemeli Suomi murtaa Tampereen stereotypioita: ”Rinnalle ja ohi”,Ilveksen kapteeni Eemeli Suomi on kehittänyt itseään kärsivällisellä ja pitkäjänteisellä työllä.,https://img.ilcdn.fi/gwyJG3bMqB0H71cbmm-itx6KCTY=/510x318/top/img-s3.ilcdn.fi/e6af97ea187499d767531d5f0ecb3f135c2f3507c8bac05c22d14a48a27c76a3.jpg
2020-02-26T14:57:36.000Z,Jouko Myrrä hehkuttaa Ilves-kapteenin kykyä johtaa esimerkillä: ”Siinä on vaikea vierellä vetää 95 prosentilla”,NULL,https://img.ilcdn.fi/-RW1k6B9TbqZTmGpSzK_VVkunZE=/510x318/top/img-s3.ilcdn.fi/4bc9eaeb7bc06729b5594935da7e71bc33c6d864f093a9c66853f9c05531403f.jpg
2020-02-26T14:59:44.000Z,Poliisi: Liikennevaloissa sattuneen murhan yrityksen taustalla mustasukkaisuutta,Mustasukkaisuudesta alkunsa saanut riita kärjistyi  kun parivaljakko kohtasi toisensa uudelleen liikennevaloissa.,https://img.ilcdn.fi/N-Yr4RjSLwWKcRojTWI5gIc-Z9Y=/510x318/top/img-s3.ilcdn.fi/5e314bc0113f14c15c0da8b7323a1c9feb3acd84947f4a852b4b8f0312b4e0f5.png
2020-02-26T15:05:32.000Z,Pikkuinen Chloe putosi luksusristeilijän 11. kannelta ja kuoli - isoisä tunnusti syyllisyytensä,Lapsi putosi avonaisesta ikkunasta.,https://img.ilcdn.fi/WA5NWk7ZChIkfuLXsGyvOFUxcag=/510x318/top/img-s3.ilcdn.fi/7d85026bc5dbe969a48b4bd05e4fda65af19fe2c7855d7e3cec847db685f7bbc.jpg
2020-02-26T15:07:36.000Z,Aino oppi kävelemään puolivuotiaana ja kiipesi heti perään sohvalle sipsien toivossa - asiantuntija: ”Ei kovin tavallista”,"Se, että vauva oppii kävelemään jo seitsemän kuukauden ikäisenä ei ole täysin tavatonta, mutta harvinaista se on.",https://img.ilcdn.fi/NSp3NmqIKsLn_eeceqYhnxjHJAA=/510x318/top/img-s3.ilcdn.fi/79b679a192998181d8902937f1a3491de0ca779cfd713d0871a1920e1f06b8e1.jpg
2020-02-26T15:16:52.000Z,62-vuotias teräsmies rikkoi maailmanennätyksen poskettomalla suorituksella – lankutti yli työpäivän verran putkeen,George Hood kertoi treenanneensa lankutusta yli 2000 tuntia.,https://img.ilcdn.fi/s170vnHSMhC_f0qeeX1EkzWCYWE=/510x318/top/img-s3.ilcdn.fi/e3b06971bcafaafaae593ac49cc05050cb683866a78362bfb2e4087891cd32a7.jpg
2020-02-26T15:16:56.000Z,Lappeenrantaan lentää tänään koneellinen ihmisiä suoraan Italian koronavirusepidemian ytimestä – matkustajien terveystarkastukset peruttu,Suomeen saapuvat lentomatkustajat saavat koronavirusohjeita sisältävän paperin.,https://img.ilcdn.fi/XPqM0yhy4XyC_zM8XGzPG5Do9N8=/510x318/top/img-s3.ilcdn.fi/f1af8f9d6c7e3c52b4b26b9757da085520739d7ff93302ca87326901fc090a86.jpg
2020-02-26T15:25:16.000Z,"TIS-Jape, 22, kärsii pahasta mustasukkaisuudesta: ”Riidat ovat kyllä olleet aikamoisia”",Henkilökohtaisena avustajana työskentelevä Mattu ja kunnossapitoasentajana työskentelevä Jape testaavat suhdettaan telkkarissa.,https://img.ilcdn.fi/ZowR4YkIyDKtS5EqbAE3HhU_Exo=/510x318/top/img-s3.ilcdn.fi/ab3a6153e5dad47f2e29012580aa33ccf953f5ab3c8c87bd360ab3ce9d496950.jpg
2020-02-26T15:35:39.000Z,Ulosmarssisumaa puretaan edelleen Helsinki-Vantaalla: Finnairin lentoja myöhästyy,Maahuolintayhtiö Swissportin kuormaajien ulosmarssilla on merkittäviä vaikutuksia lentokentän toimintaan.,https://img.ilcdn.fi/-u-4w8Qsf9RMcNvCn27s_WXBvwU=/510x318/top/img-s3.ilcdn.fi/bbf26874d61ce275be6ed48febc311ec50f3e2b45253b0b061dd7470a8533f38.jpg
2020-02-26T15:37:05.000Z,Sebastian Vettel ei panikoi Ferrarin testivauhdista – ”Kausi ei ole vielä edes alkanut”,Sebastian Vettel aikoo jatkaa Ferrarilla tämän kauden jälkeenkin.,https://img.ilcdn.fi/f9nTXVyfc86yP3BV_IiA5CDoP7U=/510x318/top/img-s3.ilcdn.fi/7ac907e4b13c3715702873eb0cb5cec8069668505e5d6c0ed9898212691b9d37.jpg
2020-02-26T15:47:26.000Z,Nyt se paljastui! Tällainen on prinsessa Madeleinen ja Chrisin uusi luksusvilla,Aftonbladet ja Expressen kertovat yksityiskohtia Ruotsin prinsessa Madeleinen ja hänen perheensä uudesta kodista.,https://img.ilcdn.fi/aYxACo8W8LBCPTTXCV9EmfoofSY=/510x318/top/img-s3.ilcdn.fi/2e59bd6213f07f6f2bfe90f5767c648d0e4082c255cb21ff7d516c555f1a4bb5.jpg
2020-02-26T15:51:21.000Z,Therese Johaug järkyttyi somekommenteista – vihaa ja törkyä lähetetään jopa Suomesta asti,Norjan supertähteä muistutetaan tasaisin väliajoin dopingkärystä.,https://img.ilcdn.fi/gYXztwYO_kFGHLXBfTX7IcZJqf0=/510x318/top/img-s3.ilcdn.fi/9cf211278a31ffdb5097e1a5c8db7ae932b4f07951dc8c4a4de780ebd7e0a44c.jpg
2020-02-26T15:56:09.000Z,Helsinki nostaa valmiustilaa – Tartuntoja Suomessa yhteensä 155,Koronavirus leviää myös Suomessa.,https://img.ilcdn.fi/HWD9mqpSoobNOiwLDYU5gwJPt60=/510x318/top/img-s3.ilcdn.fi/80d8af2bd47682955a9c2fc56b6c71e9590c7d11c698aef0d880d8b05916845b.jpg
2020-02-26T16:02:14.000Z,FBI poistui kohuliikemies Peter Nygårdin toimistosta luotiliivien kanssa – video ratsiasta julki ,Yhdysvaltojen liitovaltion poliisi FBI ja New Yorkin poliisi tutkivat tiistaina Peter Nygårdin yrityksen päätoimipisteen New Yorkin Times Squarella. ,https://img.ilcdn.fi/C1xxDbFuTYHpqkBzsxNMhwE2Few=/510x318/top/img-s3.ilcdn.fi/b9a563a5f0b9793cbbf7a9b3a4e93ec8bc1e4910f9ed52b9b6b3fd23905b18d5.jpg
2020-02-26T16:02:49.000Z,"Pikku Kakkosen ""Eila-mummina"" tunnettu Eila Roine, 88, teki ohjelmaa liki 20 vuotta – vielä tänäkin päivänä häntä lähestytään kadulla: ""Se päättyy aina samaan kysymykseen""",Palkittu näyttelijä Eila Roine on tehnyt vuosikymmenien ajan uraa televisiossa ja teatterissa.,https://img.ilcdn.fi/1-WEQvx2AuCaK4lwxApPZ2Bdp3k=/510x318/top/img-s3.ilcdn.fi/36abc982e4f0d9bfe7e8f43703ce4fe86d3a2640a71daad0e8c72f1357c810f4.jpg
2020-02-26T16:35:22.000Z,Kypsyykö Heli Rantasen valmennuksessa Suomen EM-mitalitoivo? ”Tulokset voisivat olla 64 metriä”,"Heli Rantanen odottaa valmennettavaltaan Heidi Nokelaiselta, 29, isoa tasonnostoa ensi kesänä.",https://img.ilcdn.fi/jQaxQEgiblfVNJboLO1H-bOfHsE=/0x60:3000x1937/510x318/top/img-s3.ilcdn.fi/b17cff5b1a2e584af4b837ef27136daff4af8dc37ccf473d840078f188836cc0.jpg
2020-02-26T16:36:14.000Z,Suosittu Lidlin halpisolut laimenee – syy löytyy kuluttajista,"Huolestunut lukija lähestyi Iltalehden toimitusta olutasialla. Hän oli huomannut, että ”halpisoluiden äidin” prosentit olivat pienentyneet. ",https://img.ilcdn.fi/SaF4XaKhP7Q8Ia2ypgjpgNsb6-s=/510x318/top/img-s3.ilcdn.fi/ad6d1b5a5fcbdde722900b295d6188025f6737cda9fceffd3d674ddfb9daedd7.jpg
2020-02-26T17:00:00.000Z,Luottotiedoton Tarja vuokraa 11 asuntoaan vain maksuhäiriöisille: ”Olen itsekin elänyt sen helvetin!”,"Sensuroimaton Päivärinta -ohjelmassa vieraillut Tarja Vesanen omistaa 11 vuokra-asuntoa, mutta vuokraa niitä vain luottotietonsa menettäneille.",https://img.ilcdn.fi/OEZp4MmIDoTMHlJ_JZX8lANYKgw=/510x318/top/img-s3.ilcdn.fi/6cbf7951f80ff2d070960a628134b0eb203c120db58bc8b50915dd93452b4e1f.jpg
2020-02-26T17:07:22.000Z,Ässillä huima päätöserä Jyväskylässä – TPS:n playoff-haave edelleen elossa,SM-liigassa pelattiin viiden ottelun keskiviikko.,https://img.ilcdn.fi/gNMGJAautrwfu-EF59uhzJghWwE=/510x318/top/img-s3.ilcdn.fi/19372724b41132d1249a6ece91bbeacc4b0ec3e34048597ca481f7df8b9383a1.jpg
2020-02-26T17:09:01.000Z,"Voice: Evelina keskeytti keikkansa yleisön käytöksen vuoksi: ”Jos tällaista huudeltaisiin muualla, kyse olisi seksuaalisesta ahdistelusta”","Evelinan sunnuntainen laivakeikka keskeytyi huutelijan vuoksi, Voice uutisoi.",https://img.ilcdn.fi/hWIvD6n8sg6WT3ec-tY9bFu4e_M=/510x318/top/img-s3.ilcdn.fi/c04cf299bc7c0e7bffb19140fcffda039886faa1eafd0a4e366a56c5e2936c37.jpg
2020-02-26T17:18:53.000Z,Hallitus pitää huomenna tiedotustilaisuuden koronavirukseen varautumisesta – toimenpiteitä tehostettu,Hallituksen tiedotustilaisuus koronavirustilanteesta ja varautumisesta Suomessa järjestetään torstaina  klo 13.30,https://img.ilcdn.fi/F4VClWAQY7HjaHvawtTSA4fQA5w=/0x875:2000x2125/510x318/top/img-s3.ilcdn.fi/96b665e0be8a402e88ecf2d6bf23eec392e5d4bca4bc670e898b6e17e149bbca.jpg
2020-02-26T17:24:14.000Z,Iisalmen Sanomat: Iisalmessa koronavirusepäily suomalaisella naisella,Nainen sai oireita Italian-matkan jälkeen.,https://img.ilcdn.fi/yZQs9WMGp04gMWJH4GCnHj5ViLY=/510x318/top/img-s3.ilcdn.fi/2f8f0f2ad7edd27c1a21e2ca5b890b25b6a342ae42c8561c1ccf3ee4d721bfb5.jpg
2020-02-26T17:29:02.000Z,"Hämmennystä Helsinki-Vantaalla, ihmiset odottivat ruumassa olleita matkatavaroitaan – ”Kuulutettiin, että niitä ei tänään enää nosteta hihnalle”",Iltalehteen yhteyttä ottanut mies kertoo tulleensa Thaimaan lämmöstä Helsinki-Vantaalle kesäisessä varustuksessa. Lämpimät vaatteet ovat jumissa olevien matkatavaroiden joukossa.,https://img.ilcdn.fi/uxzxWRqF8YV3bDRcJR1veM-aQz8=/0x1593:2250x3000/510x318/top/img-s3.ilcdn.fi/7ecea5de053789a89ad1ac80cd126e9c8756108211a39be6fa1d49f396069b2a.jpg
2020-02-26T17:32:07.000Z,Katsoja kuvasi sekavan tilanteen: Valmentaja täräytti nyrkillä pelaajan kanveesiin salibandyottelussa – rangaistuksesta tulossa farssi Norjassa,Tunteet kuumenivat Norjan salibandyn ykkösdivisioonassa.,https://img.ilcdn.fi/fWfYTYjPysuhcDqRDAnago5DoUs=/510x318/top/img-s3.ilcdn.fi/cfc93de0d74c57309152aaaea4215ee0c1510959b84580660879908029daf476.jpg
2020-02-26T17:43:48.000Z,Kevään kaunein hiusväri! Ariel Winter vaihtoi tummat kutrit muotisävyyn – upea muutos,Näyttelijä Ariel Winter viihtyy mausteisen punaisessa hiusvärissä. ,https://img.ilcdn.fi/AYKUQfMg-eXGAp72saFGChn8scs=/510x318/top/img-s3.ilcdn.fi/de562aa586c44a28369dcaa009580b425fd5a509afa889e259a85d76247afc4f.jpg
2020-02-26T17:45:28.000Z,USA nimesi päävalmentajan kevään MM-kisoihin,Johtaako Stanley Cup -voittaja USA:n vihdoin pronssia parempaan sijoitukseen?,https://img.ilcdn.fi/DOvTfZypv4SczL4QUsSlmlZHkIQ=/510x318/top/img-s3.ilcdn.fi/c8979777469404fb874957caff84b8b4bb21a88b09b6710e118a0bc8879a2db3.jpg
2020-02-26T17:46:28.000Z,Jyväskylän koronavirusepäily oli turha – tulokset valmistuivat,Keski-Suomen keskussairaalan potilaalla ei ole koronavirusta.,https://img.ilcdn.fi/U7Lj0BPQ-OL2w85EGAFPGU0i_hU=/510x318/top/img-s3.ilcdn.fi/5f341443c9cced4045120358fac02fe36223580bb407bb840835d797e38217ae.jpg
2020-02-26T17:53:13.000Z,TIS-Pinja törmäsi tulevaan kumppaniinsa monta kertaa ennen kuin pari sopi treffeistä – mies luuli törmänneensä joka kerta eri naiseen,Temptation Island Suomen seitsemännellä tuotantokaudella nähdään monta erilaista paria. ,https://img.ilcdn.fi/UBgcJGC3jKQ9PoBryDOY-b38BLs=/510x318/top/img-s3.ilcdn.fi/0ab905d4122d677a0e13d651172348372fe450b4905d4dd76bc0e07e6832eebc.jpg
2020-02-26T18:04:24.000Z,Expressen: Ruotsalaisnainen kuoli Turkissa tehdyn kauneusleikkauksen jälkeen,Kauneusleikkauksesta ei ole annettu tarkempia tietoja.,https://img.ilcdn.fi/LALxRMaJTXeaD-PWI_q1okO7sRc=/510x318/top/img-s3.ilcdn.fi/484a86ed7f1dc05267b72ddf85052c1a94b9400aa915b1d9d2ed6e0537466330.jpg
2020-02-26T18:21:51.000Z,Pörssisijoituksistani on sulanut melkein 40 000 euroa parissa päivässä – miten tästä eteenpäin? 6 vinkkiä pelästyneille,"IL Rahan Merja Mähkä on innokas sijoittaja, jonka sijoitussalkun arvoon on tullut iso lovi koronaviruksen aiheutettua ryminää pörssissä. Mähkä antaa pörssilaskusta pelästyneille kuusi vinkkiä, jotka perustavat häneen omaan kokemukseensa harrastajasijoittajana.",https://img.ilcdn.fi/-hVP9UqeqbfWBVkhFz4LDnwK1K8=/510x318/top/img-s3.ilcdn.fi/284afb6db1a9a6e024ef8432e45718c1a10901d9e5ef1bee68c2ac5552c564ed.jpg
2020-02-26T18:29:27.000Z,"Lappeenrantaan lentää ihmisiä Italian korona-alueelta, testejä ei tehdä – ylilääkäri: Ennen oireita testi voi olla hyödytön","Lappeenrannassa ei testata ihmisiä, vaikka he lentävät suoraan korona-alueelta.",https://img.ilcdn.fi/_UdUEEHgmZWoQ-XUoe7DMXe0wq4=/510x318/top/img-s3.ilcdn.fi/54b41fa1add05e09ba56876bdfd93884d3393d719e3250dc56cc8510d50fb95c.jpg
2020-02-26T18:38:45.000Z,"Superlupaus toteutti unelmansa, kun hänet vaihdettiin Neymarin tilalle Mestarien liigassa – miten entinen Barcelona-hyökkääjä päätyi Veikkausliigaan?","Kun Vesa Vasara kertoi Jean Marie Dongoulle FC Hongasta, hyökkääjä ei edes kuunnellut muita tarjouksia.",https://img.ilcdn.fi/MZC9mpQv_3euqrM4wzNRGK_vEJ8=/510x318/top/img-s3.ilcdn.fi/0d91ce04b16db879f7022f6761cb0f9976b90eae2946523da5e87ae39024a648.jpg
2020-02-26T18:49:12.000Z,Euroviisujen perumista harkitaan koronan takia: ”Mitä järkeä on tuoda kymmeniä tuhansia ihmisiä Rotterdamiin?”,Monien massatapahtumien kohtaloa mietitään koronaviruksen johdosta. ,https://img.ilcdn.fi/O2cbHsHjnjLFgC9inreGLYiIf4g=/510x318/top/img-s3.ilcdn.fi/780e3b0d10dc7a8ddf5373a6bd57f7a4512868b1b3807f31933522622564303a.jpg
2020-02-26T18:59:42.000Z,Vastustajan toisella iskulla tajuttomaksi tyrmännyt kiekkoilija järkyttyi itsekin,AHL-ottelussa nähtiin tiistaina raju mutta lyhyt tappelu.,https://img.ilcdn.fi/YKUGZifQXUwZBYS9aM-4kolaOpY=/510x318/top/img-s3.ilcdn.fi/2055739d2fb766754d1cd05965822dee0f2c58e45b181cb5b1b389a7b70e8c5e.jpg
2020-02-26T19:12:49.000Z,Syntyvyydessä kaivattu käänne parempaan,"Tuore kysely ja taloustilastot kertovat siitä, että taustalla vaikuttaa talouden tilan kohentuminen.",https://img.ilcdn.fi/9YLBGnviiU9CxIIAsiaxHASorxU=/510x318/top/img-s3.ilcdn.fi/edc0613e587a8538a2aba7580cdb92a24f44d607af603026c8e7125c23109283.jpeg
2020-02-26T19:27:05.000Z,"Kohuedustaja Mikko Kärnä puolustautuu: ”Olen pettänyt aiemmissa parisuhteissani,  nykyisessäni en”",Kansanedustaja Mikko Kärnä (kesk) myöntää Facebookissa pettäneensä aiemmissa parisuhteissaan.,https://img.ilcdn.fi/qdcfBg4Vzejje-TAMpExq-X9Qb4=/510x318/top/img-s3.ilcdn.fi/8730cdb377264a1e8d188f1e654a03ac805af8dc0f47891c767b987b847b5c01.jpg
2020-02-26T19:28:58.000Z,Lääkärien erikoinen pelastustehtävä: Pytonkäärme nielaisi kokonaisen rantapyyhkeen Australiassa,Kolme metriä pitkä lemmikkipyton joutui kiipeliin ahneutensa takia.,https://img.ilcdn.fi/GchKacFf-78lRcJu8OktAgMlMv4=/510x318/top/img-s3.ilcdn.fi/042af12300d5161c1d28ef499aa04c9feaafecf8c32278f30cb195b0836e8436.jpg
2020-02-26T19:35:41.000Z,Kuka palkkaisi Joonan kokiksi?,"Kehitysvammainen Joona Korpinen, 20, opiskeli itsensä kokiksi ja toivoo nyt löytävänsä koulutustaan vastaavaa työtä. Helppoa se ei kuitenkaan ole.",https://img.ilcdn.fi/Eo5u9Qsl2vRofDTFR-WHRSeiPqk=/510x318/top/img-s3.ilcdn.fi/c82a8ab594db40b0d1be57a157e8de0149c3af4b266ddc5f0e4a592098930512.jpg
2020-02-26T19:36:04.000Z,Varoitus Android-käyttäjille: Nämä 10 sovellusta tulisi poistaa heti,Google Play -sovelluskaupasta löytyvät VPN-sovellukset voivat olla vaaraksi.,https://img.ilcdn.fi/tC8U-Lj9NQXjht58yF96huS3UTI=/510x318/top/img-s3.ilcdn.fi/a946ac6d0a0499744bd09eeef2c18b2caac5144b92bde55a54b872a19ba62baf.jpg
2020-02-26T19:59:40.000Z,Voiko tämän pahempaa epäonnea olla? Formulalupaus menetti voitot ja mestaruuden viime hetken rengasrikkoon – kahdesti,"Voiton menettäminen rengasrikkoon turhauttaa. Ajatusmaailmaa voi vain kuvitella, kun sama tapahtuu kahdessa kilpailussa perätysten. Siinä sivussa karkasi myös mestaruus.",https://img.ilcdn.fi/O-IT1nFzNPJNBh5hQxqmQj6Qv1U=/510x318/top/img-s3.ilcdn.fi/dd4ae49cda34b4f5d1c809f41295e721556f29ad712fcb779dfbeffa1919b3a1.jpg
2020-02-26T20:04:28.000Z,Prisman hyllyjä tyhjillään Helsingissä – taustalla muukin syy kuin korona,"Itäkeskuksen Prismasta kerrotaan, että tiettyjen tuotteiden kohdalla on ollut toimitusvaikeuksia.",https://img.ilcdn.fi/0ouZVF3UdhENxUtkpVf1L31-k38=/510x318/top/img-s3.ilcdn.fi/ca6ed930dc51bbefbc4fb9df9800083acee17090703031075f30796adf5d0f68.png
