paivamaara,otsikko,tiivistelma,kuva,id
2023-04-25T03:16:13.000Z,Kilpailu kovenee Diilissä: Pudonnut kilpailija aavisti kohtalonsa,Jaajo Linnonmaa antoi jälleen potkut yhdelle kilpailijalle Diilissä.,https://img.ilcdn.fi/GzQmNXdMStgwWU36W8U7zr2DM_k=/510x318/top/img-s3.ilcdn.fi/29e41bd699cb8412a4c6ad1d1833598b28d14313f59ed090808129f847ab82c7.jpg,C76295E1293448269597C0CFEF9414E4
2023-04-25T03:30:20.000Z,Murtovarkaat Tuukka Taposen huolena Maranellossa – Ferrarin tarjoamassa huoneessa luksus kaukana ,"Tuukka Taponen nauttii elämästään Ferrarin junioriohjelman jäsenenä. Kuukaudet Maranellossa ovat olleet kiireisiä, mutta antaneet paljon.",https://img.ilcdn.fi/oc5yPipZpTrsg1Xc1NtW3FUEY-A=/510x318/top/img-s3.ilcdn.fi/fffb4b17af714e5855f103ee29d44a0a7f67163114992302ecddc8511dce14dc.jpg,AFC8D21EE6BD43B29020AF121C41A12A
2023-04-25T04:02:04.000Z,Raportti: Valtion talousmailta löydetty lisää arvokasta luonnonmetsää – ”Ne tulee suojella pysyvästi”,Vapaaehtoisten luontokartoittajien raportti kertoo arvokkaiden luonnonmetsien uusista löydöksistä valtion mailta.,https://img.ilcdn.fi/n4Gnai1agQQ-tovydjzSxgDfFcI=/510x318/top/img-s3.ilcdn.fi/db2834d5841fc1a86eec6f0cc3e2b190f07a06b0437b7bfa0323e28593f1f8f1.jpg,87CDB65592274D5D861A285A5BC4B200
2023-04-25T04:02:44.000Z,Köpi Kallio herätti YleX-juontajien kanssa huomiota kansainvälisessä tv-lähetyksessä – Näin he päätyivät miljoonayleisön eteen,Köpi Kallio paljastaa Iltalehdelle huomiota herättäneen episodin taustat.,https://img.ilcdn.fi/583gOvngz-t5kvvs3J9cci9xabQ=/510x318/top/img-s3.ilcdn.fi/edd9a6589c29ae4ddbfcfff0d604e501d4c1c1a675cd38a3d9ecc3dba54fa242.jpg,03C2969FCC414F0E8E37CD038D4B756D
2023-04-25T04:06:49.000Z,Tampa Bay suli totaalisesti – New Jersey haki ison voiton,Tampa Bay romahti hämmentävällä tavalla kotiluolassaan.,https://img.ilcdn.fi/7Ki2EMpV9Elif62dhaDUOS6LnMM=/0x64:3000x1937/510x318/top/img-s3.ilcdn.fi/54d9db144b6a870c31c13284c5cc294fc8ebee217194fcab0077b5550b933870.jpg,0E38471FA57848F9BEBE329E0321798D
2023-04-25T04:13:34.000Z,"Orpo tapaa keskustan, kristillisdemokraatit ja perussuomalaiset – Katso suorana klo 7.45",Hallitustunnustelija Petteri Orpo (kok) tapaa tiistaina viimeiset eduskuntapuolueet kahdenvälisissä tapaamisissa.,https://img.ilcdn.fi/DeF6u1adhs1jwBogE-TwpWSzGgI=/510x318/top/img-s3.ilcdn.fi/6243086c847ea0be6950a5b814fea626e4ab80b9c0213e1959d20273dbeabeb2.jpg,5FA1E2692D58454387EEAD835D9B5729
2023-04-25T04:15:00.000Z,Oletko löhöilijä vai aktiivilomailija? Testaa ja löydä unelmiesi viikonloppuloma!,"Härmän Kylpylän hauska lomatesti kertoo, millainen viikonlopun miniloma juuri sinulle sopii parhaiten.",https://img.ilcdn.fi/l-LoQPmvTJvtVBTEZ7xgVs5pckI=/510x318/top/img-s3.ilcdn.fi/a3bf10d5a0ff815f6a7bc5f920347e36fe6810ac58cf407d2f63895396326c21.png,AD782405105746C0892A6313BA4C2CFE
2023-04-25T04:28:04.000Z,IL paikalla: Jasper Pääkkönen haastoi alushousuyrityksen oikeuteen – riitaa puidaan käräjillä klo 8.30,Näyttelijä Jasper Pääkkösellä on meneillään oikeuskiista.,https://img.ilcdn.fi/MYFL7C-ugybZYBrepxZ8QoNIlvM=/510x318/top/img-s3.ilcdn.fi/b78779b161b245ffd6868e384fa58cc79a784b0f7fcc6de4b1bf02ca599a6b13.png,928FEB7C771C43FB91B3C908F94E2189
2023-04-25T04:34:52.000Z,Kova kritiikkiä tänään tv:ssä: Vakavaa varoitusta ei huomioitu – 134 kuoli,Ahr-joki tulvi Saksassa heinäkuussa 2021 tuhoisin seurauksin.,https://img.ilcdn.fi/aw1VpDMKNhRa3r-Dd16gRWZaeuE=/510x318/top/img-s3.ilcdn.fi/8f42c94eb400118432d66ac8493033a107da85d93f88e158efec4c40a786c1d3.jpg,537F117C86DA4D1AB786F729CBB9DA3C
2023-04-25T04:47:36.000Z,Tässä ovat veroilmoituksen viimeiset jättöpäivät,Vuoden 2022 kotitalousvähennyksen voi saada korotettuna.,https://img.ilcdn.fi/d-y2_4g0FWU_t2PhlOB96E9c_Mg=/510x318/top/img-s3.ilcdn.fi/55df8812c1f59a4af731c6f177a566fc6ccb5886bf3c58397a6b40b51ca30a12.jpg,FF5D5D37562146AC844D8D4C2F1081BF
2023-04-25T04:49:17.000Z,Johannes Kläbon päätös järisytti – Näin siihen reagoitiin Norjassa,Johannes Kläbon lähtö maajoukkueesta herättää keskustelua Norjassa. ,https://img.ilcdn.fi/cCVDZVG8sWPUibXp8jb5a-VcVpA=/510x318/top/img-s3.ilcdn.fi/57bc24faf249096a19c4d4ed7c270b4f7dbcc61a160a55505dcd2c3c88a6b629.jpg,FDF9E194C9C441BCB2879F2075861F03
2023-04-25T05:00:56.000Z,"Emmerdale-tähti Dale Meeks, 48, on kuollut","Dale Meeks on kuollut, kertoo The Guardian",https://img.ilcdn.fi/Xprkzc6wBuM_HVXH01bN3nM-DkE=/510x318/top/img-s3.ilcdn.fi/de2670da1587cd5a54b4ac8022434b579a865cd646c2b9a9683c576f6f55f387.png,ABE5F2F875AF4616974107CAFD7F8FAD
2023-04-25T05:02:45.000Z,"Opettaja-Iida, 30, joutuu kesäksi kortistoon: ”Ei kerro ammatin arvostuksesta”","Pätkätöitä tekevä opettaja ei lepäile kesällä. Hän ilmoittautuu työttömäksi työnhakijaksi ja laatii työhakemuksia – siinäkin tapauksessa, että tiedossa on jo työpaikka syksyksi.",https://img.ilcdn.fi/4hK6ZcrmhXlnjDavJknV4GwK7cA=/510x318/top/img-s3.ilcdn.fi/13c74e33bef61f0a5b5397f12657cddfded1e041c2d99ebb8658d25cbcac3b92.jpeg,6B518A606E884EAA9E1C8A81A57DE9DB
2023-04-25T05:08:09.000Z,Hirvi asteli elokuvateatteriin Yhdysvalloissa – Popcornit upposivat parempiin suihin,Yhdysvalloissa Kenain kaupungissa hirvi käveli elokuvateatterin ovista sisään. ,https://img.ilcdn.fi/EpZ0T9ab0cbOzikCgRgB5EW2OmU=/510x318/top/img-s3.ilcdn.fi/8e6c7f565f3bd8a44e2db28bbe7a507305f8faf49a98a87bc77bc20322ede468.jpg,90ED3F17E89342D4BB7C8AD957E81C12
2023-04-25T05:29:37.000Z,Kaksi miestä murtautui asuntoon ja seurasi tulitaistelu – IL seuraa Nastolan ampumiskäräjiä,Tulitaistelu omakotitalossa päätyy viimein oikeuden käsiteltäväksi.,https://img.ilcdn.fi/Va76gnjE7U_Vg-jvabn4w2bCMCs=/510x318/top/img-s3.ilcdn.fi/5728ceab675e614394935e8c329ec132ebc57c959f169881f77329406a91d8e4.jpg,3FCCB9C950FB4D858B2FBB38FBECB9AF
2023-04-25T05:32:53.000Z,Mikko Rantanen nousi pörssikärkeen – Colorado taipui silti huiman trillerin päätteeksi,"Runkosarjassa 55 maalia iskeneen Mikko Rantasen lentokeli jatkuu myös pudotuspeleissä, mutta sekään ei tällä kertaa pelastanut Coloradoa.",https://img.ilcdn.fi/g4VgcWFkA4r6PTDeL1itw1qVzdM=/0x64:3000x1939/510x318/top/img-s3.ilcdn.fi/3471780fe1dfd9d2dd01947514354017a677ee182770b675c44b64b166cb818d.jpg,1576FC07E6B1443DB9C71281540AE02D
2023-04-25T05:49:12.000Z,Presidentti Tarja Halonen: Soten johtamista tulisi kehittää nykyistä enemmän,Halonen ottaa kantaa sote-alan johtamiseen ja resursseihin.,https://img.ilcdn.fi/N0q79_vaqasSJK6jrlgmCR5Ciz0=/510x318/top/img-s3.ilcdn.fi/9716edcb6d208c748ee790765ff5fe75f6f5668011cd6cf78b20b80811840898.jpg,3316712A027C499A8D1E29161B47FB2A
2023-04-25T05:51:17.000Z,"Niko Saarinen tienaa yhdellä somepäivityksellä tavallisen ihmisen kuukausipalkan: ”Myönnän, että saan rahaa helpommin kuin moni muu”",Niko Saarinen on rakentanut uraansa tosi-tv-tähdestä radiojuontajaksi vuosien ajan.,https://img.ilcdn.fi/w1ZbNs7Il82jua9XVpEn4O8jrDk=/0x98:3000x1973/510x318/top/img-s3.ilcdn.fi/3b58af41b0ba3fc0a386c32c3907938c287f9e5ffc4c774b63cf10e4be37d675.jpg,B9399894BEB74914A4C09CE5868956D4
2023-04-25T06:00:08.000Z,"Sergei Lavrov johtaa harvinaisen irvokasta näytelmää New Yorkissa – Asiantuntija kommentoi, onko YK:ssa mitään järkeä",Venäjän puheenjohtajuus YK:n turvallisuusneuvostossa on syystäkin nostattanut tunteita.,https://img.ilcdn.fi/hGAno4pRYvoUxCqqVTCTmEDUa2k=/510x318/top/img-s3.ilcdn.fi/522f31c1e0fb33ede92a3bb27304b401d0ebaed8e3154b3cb5ab03c4b3daf363.jpg,05575E7407E6407D90DC89310124A354
2023-04-25T06:18:12.000Z,Video: Lauri Markkanen heräsi kahdelta yöllä ja antoi haastattelun – Nauratti tukkakuitillaan NBA-legendoja,Lauri Markkanen kertoi TNT:lle kuulumisiaan armeijasta.,https://img.ilcdn.fi/nUnj7TR1Ezc2cTUZe-pbw3ehryU=/0x64:3000x1937/510x318/top/img-s3.ilcdn.fi/c3e3c4b912e9522e0e10b84e489955a93d7d1ce0b0d445b407e3082e1c7663cd.jpg,1B3D223624D842D0BA559BEECB1F8A73
2023-04-25T06:24:38.000Z,Uusia hyönteislajeja Suomessa – Tältä ne näyttävät,Yksi yllättävimmistä löydöistä on nuppojen heimoon kuuluva Byrrhus geminatus -kovakuoriainen.,https://img.ilcdn.fi/Mjs8IC4kf7D8rntNUSq4VcTY6Pw=/510x318/top/img-s3.ilcdn.fi/604169a4bc0d4c7e3c30b359d1b2a453829ab315c158768388129d18a2309a7e.jpg,0402C3698D27406FABA5CC1BBEE230B8
2023-04-25T06:48:15.000Z,Lauri Markkanen jakaa kiitosta videolla – Fanit hullaantuivat: ”Rakastan tätä jätkää”,Lauri Markkanen teki Jazz-historiaa.,https://img.ilcdn.fi/a68yCTeLx-bRwfGtJ3F8SG_TfRw=/0x64:3000x1937/510x318/top/img-s3.ilcdn.fi/6a7b8ee71e044c945150f238a1167bdd7dcfd8e9f0cfa370cf07137559482c77.jpg,82433A6BCB1F416F8CA1F73F6D5A4842
2023-04-25T06:57:10.000Z,Tallink irtisanoo 400,"Sota, pandemia ja alusten vuokrasopimukset vaikuttavat työvoiman tarpeeseen virolaisvarustamossa.",https://img.ilcdn.fi/Xb2Gd9SZmqwoiwRyiOYAsJ3wcKs=/510x318/top/img-s3.ilcdn.fi/bd83e171023fffe5871f8925879b418d25d08f3254adf134e257243aa1f40e22.jpg,9FA0FE6A26A748CABA6683F2F1BC2580
2023-04-25T07:06:05.000Z,Uusia virusvariantteja ja lisääntyneitä potilasmääriä – Husin Järvinen kertoo koronatilanteesta,Teho- tai valvontahoidossa on Husin alueella tällä hetkellä viisi potilasta.,https://img.ilcdn.fi/c8I_Zqdrdiw9baRyV98zwTsWPuo=/510x318/top/img-s3.ilcdn.fi/366c06f14a4a0d3b06b38026e6ee72d3506fcf1bf869d24954df49c50ee89346.jpg,251B733607BF4A5FA71EEA6C379AF5EB
2023-04-25T07:07:07.000Z,CNN-kanavan pitkäaikainen juontaja Don Lemon sai potkut,Uutisankkuri Don Lemon on noussut aiemmin tänä vuonna otsikoihin sopimattomalla käytöksellään naiskollegoitansa kohtaan.,https://img.ilcdn.fi/ttdmW2hLp2Z-HXd1CcN07VnuHys=/510x318/top/img-s3.ilcdn.fi/a4fba5d2b22431c9c32ac1a7617bbedf5757415a63266d6548c2febdc0467dab.jpg,C2415DA1B8224328BAD4CCE5752F87F6
2023-04-25T07:08:43.000Z,Saarikko uskoo oikeistohallituksen syntyyn – Keskusta aikoo tehdä omaa oppositiopolitiikkaa,"Keskustan puheenjohtaja Annika Saarikko kertoo, että hallitustunnustelija Petteri Orpon kanssa puhuttiin EU-politiikasta, koulutuksesta ja maataloudesta.",https://img.ilcdn.fi/DdJ31-fGReyZtUp_6F4ULrQ9ezM=/510x318/top/img-s3.ilcdn.fi/3488c4aefff53d7eadca87fed5f5dabfa9951046f4cce042ebc65a9fd97bb379.jpg,43C91A0783864CE88EC5BDB789AE2132
2023-04-25T07:10:43.000Z,Yle: Venäjän rajaviranomaiset seuraavat suomalaisia rajanylittäjiä kännykkäkoodilla,Ylen mukaan Venäjän rajaviranomaiset ovat selvittäneet suomalaisten rajanylittäjien kännyköiden IMEI-koodeja.,https://img.ilcdn.fi/0UWRWxB_lczJ4NbuwV5QAohyRec=/510x318/top/img-s3.ilcdn.fi/d8b4c0d847a6fd24b16674049564bb761c3a512e013ea7b5a4eb4951f642ce2d.jpg,00B485A957A44B64AC6C3B2271FE34CD
2023-04-25T07:12:53.000Z,Moottorikelkkailija kateissa Itä-Lapissa,Moottorikelkkailijaa on etsitty aktiivisesti maanantaista lähtien.,https://img.ilcdn.fi/ZBMjPUqrzfo8tPHPprCcSRqyWhQ=/510x318/top/img-s3.ilcdn.fi/f74608d54f69c8d8cc3c32bc132a8540c77ca3c568367c05cf89af92be8bf2b1.jpg,303A1F2440F748E0A57D09F11F63BCD5
2023-04-25T07:30:44.000Z,Edulliset erikoisoluet testissä,"Iltalehti testasi kauppojen erikoisoluita, jotka saa kolmesta suurimmasta kauppaketjusta alle kolmella eurolla. ",https://img.ilcdn.fi/tSYfrwUTiEE-XYVJlYDCQ8J82Wc=/0x56:3000x1929/510x318/top/img-s3.ilcdn.fi/bc0e7213579dd0378ec0ab6c2f1113f293449087e6e11f95f474b05c58828046.jpg,29649373AC0C476FAB262DDA6A8110F5
2023-04-25T07:31:41.000Z,Floridan tähtipelaaja sai naurettavat sakot sikailustaan,Matthew Tkachuk saa hieman maksaa poikkaristaan.,https://img.ilcdn.fi/pXZ9DhYVU-Tpj67d8VAgnf9NM88=/0x64:3000x1937/510x318/top/img-s3.ilcdn.fi/affd3f3f335a06fb7db975f29e637b9feb2d5c2e2b4e7903b9953891bf29bbf3.jpg,AA6E9A63F92D439CA360DD52F0D65E1B
2023-04-25T07:34:58.000Z,"Pia järkyttyi: Juuri ostettu auto olikin kertaalleen kolaroitu, myyjäliike ei ollut sanonut mitään","Erimielisyyttä syntyi siitä, oliko autoliike varmasti kertonut ostajalle käytettynä myydyn auton kolaroinnista.",https://img.ilcdn.fi/cGrBkM8xiuGG5qmmgjKosL2uUzc=/510x318/top/img-s3.ilcdn.fi/79485e59ad5c68767d6ab5e7be3f5ce135c27709525e3fe69a2d132cbbff2017.jpg,7C48ADB115F94405B3B71D0C2DC5CE27
2023-04-25T07:35:31.000Z,Pamela Anderson sai merkittävän tunnustuksen – Edusti tuoreissa kuvissa gaalassa,Näyttelijä Pamela Anderson palkittiin The Los Angeles LGBT Center -gaalassa.,https://img.ilcdn.fi/fYlSccwivw-m_JdREoaZMfVJJdY=/510x318/top/img-s3.ilcdn.fi/b80bd1005780d728e5af905b13bbe4bcf6244f09235b3be16a34e890863e3d3a.jpg,B83EE36B47074D9881F24E2B4490518B
2023-04-25T07:38:02.000Z,Varo näitä kakkukynttilöitä,Tuotteesta puuttuu suomen- ja ruotsinkieliset varoitukset.,https://img.ilcdn.fi/4KzC3d26JrsvE07lxK_9zqMAY3Y=/510x318/top/img-s3.ilcdn.fi/074503f9fb7e4ca5230f2c25b3e13d9099356333db66728890e0bad2d33eda97.jpg,BAF5082636C64D26A47D9CB88813EF26
2023-04-25T07:42:49.000Z,Reiman ostamat laminaatit lohkeilivat – Tuloksena riita kaupan kanssa,"Lattialaminaatti on tunnetusti kestävää materiaalia. Kenen on vastuu, jos laminaatti lohkeilee kulmistaan? Reiman tapauksessa kuluttajariitalautakunta ei nähnyt tuotteessa tai kaupan toiminnassa moitittavaa.",https://img.ilcdn.fi/p1giIdORrGeBQnLwYZj1a2ZLie8=/510x318/top/img-s3.ilcdn.fi/b65f7164612f3875e2ebc69342b72e8e4c5fe8afc523761b9b23c5245013144a.jpg,108B7C697EA64EAF8D0EDA284B4CF1D9
2023-04-25T07:48:41.000Z,IS: Sometähdet Janne Naakka ja Joni Hesselgren aloittivat epätavalliset käräjät: ”Kaksi somettajaa tappelemassa”,Tubettajat puivat tänään 25. huhtikuuta kiistaa Itä-Uudenmaan käräjäoikeudessa.,https://img.ilcdn.fi/JVFMkOXXFlkb7TsQis5S70qkdAs=/510x318/top/img-s3.ilcdn.fi/0a70d386c3a823f0bbe76ba01f12162e2b18ffbe4339ca5504ba7d299173a8d0.png,BACBB1D4968748D7843C98FAFF90287E
2023-04-25T08:03:24.000Z,Oppilasta kiusattu vuosia – Äiti teki rikosilmoituksen koko luokasta,"Kaakkois-Suomen poliisista vahvistetaan, että sille on tehty tutkintapyyntö imatralaisesta luokasta.",https://img.ilcdn.fi/ocodDSxdyRlGdheMQxMObE5C-3E=/510x318/top/img-s3.ilcdn.fi/6a3c000af99f1c89a0b7a405b8afada796a5ae1748320b0cee993a8b693e2953.jpg,FA919EEB8BE84E028D1989FBCA3E7ED4
2023-04-25T08:08:59.000Z,Talouselämä: Venäjä halusi sulkea Maarianhaminan konsulaatin jo 1998,Asia ilmenee Talouselämän saamista ulkoministeriön asiakirjoista.,https://img.ilcdn.fi/om3wtWj3vlnGzrJ3Do6JyCXcliI=/510x318/top/img-s3.ilcdn.fi/cc39012eb0b0a62449d87f9c8cebfc4f73c47a5813987ae9e8366cc87bf80a6d.jpg,B4E2C79442414DFB9795899EAB8CBA06
2023-04-25T08:20:10.000Z,"Tämä ei riitä, Aleksander Barkov","Aleksander Barkovin suoritustaso ei ole riittävällä tasolla, kirjoittaa Iltalehden urheilutoimittaja Otto Leinonen.",https://img.ilcdn.fi/29vAc6AyL7cSyJlk0pX81rVpa-M=/510x318/top/img-s3.ilcdn.fi/e8f8de92912faf25542ea08ca216ee72f2da531e956cdaeefb7e207500fe09f7.jpg,638DEF821F7C4278BE41A4CC08670AD3
2023-04-25T08:25:30.000Z,Ville Rannan pilapiirros: Wolt-kuski saapuu vaaralliseen osoitteeseen!,Ville Rannan pilapiirros 25.4.2023.,https://img.ilcdn.fi/z8yWiddEPF3RGRJ3AMNVSLWaT78=/510x318/top/img-s3.ilcdn.fi/3bb9eac55cec43b2e3883ea7a5dce198ee68a7a5ac8d0a27cdc35e2c13f62199.jpg,722C21051A1F4BA5917C0AB368106AD2
2023-04-25T08:26:19.000Z,"Etla: Paikallinen sopiminen ei laskenut palkkoja, vaan nosti niitä ","Paikalliseen eli yrityskohtaiseen sopimiseen siirtyminen ei laskenut työntekijöiden palkkoja metsäteollisuudessa ja ohjelmistoalalla, kuten aikanaan pelättiin, toteaa Etlan tuore tutkimus. ",https://img.ilcdn.fi/Zhfw103FPmdQhzsHEWtWXs8Uj88=/510x318/top/img-s3.ilcdn.fi/2ac390c61a2ec632726d166f221acd1d7f64296c3a68955f74b3fd1851478a48.jpg,3F3C74E0C07040A0B1AAC39FCF4F2095
2023-04-25T08:26:32.000Z,Kiusallinen käännösmoka: Koiranlelua kaupattiin ”kyrpänä”,Koiranlelun myynti-ilmoitukseen lipsahti kiusallinen käännösmoka.,https://img.ilcdn.fi/yWE_UZ9h6qsfqVoSnvVorqBhuJc=/510x318/top/img-s3.ilcdn.fi/708bd427ab6db639634f6a2f29beab2e19502f259bc5c6ec444df83909c869ed.png,46EDABAAB4C145FF8FF85D5782114711
2023-04-25T08:30:42.000Z,Essayah: Otamme niin monta ministeripaikkaa kuin on tarjolla – KD avoin erilaisille hallituskokoonpanoille,"Kristillisdemokraattien puheenjohtaja Sari Essayah vahvisti tiistaina, että puolue on halukas hallitukseen ja valmis erilaisiin hallituskokoonpanoihin.",https://img.ilcdn.fi/n24GgOn8POS7HKiaIV95i5yMAw0=/510x318/top/img-s3.ilcdn.fi/e70d976eca2fe966c8826b8c4b7e84e0aee0444db11ad018a25f592d221a0bfe.jpg,9542ADAE7A834ACF803890E4F7A0B468
2023-04-25T08:48:32.000Z,Tällaisia arvioita Alman uutuuslevy saa ulkomailla – Hämmentävä vertaus Abbaan,Almalta ilmestyi perjantaina uran toinen levy Time Machine.,https://img.ilcdn.fi/0VF__N625lAi_xMf5vP4mP6Ti_M=/510x318/top/img-s3.ilcdn.fi/bf99aca2cb0fbe5bc1822ddcb03c6628c8aecadb9457b1daccd603f6ff75dc88.jpg,131762E8A6A74BD9949FDFC58B3D1787
2023-04-25T09:07:31.000Z,Netflix-tilin jakamisen esto tulossa Suomeen – Tätä se tarkoittaa,Tilille on mahdollista ostaa lisäkäyttäjä.,https://img.ilcdn.fi/ojbV7y4E1f91c4uqbCwk1hLuU9c=/510x318/top/img-s3.ilcdn.fi/18a94d5baea11e46817b07dd93ece48e3f95d705a3806065705694fa5bc3a6bb.jpg,4FE162FCAE614A67A30560E68279199A
2023-04-25T09:13:37.000Z,Porsche-kuski kyllästyi ohituskaistalla Vantaalla – Näin lähti kortti hyllylle,Vaarallinen ohitus tallentui poliisin kojelautakameraan.,https://img.ilcdn.fi/t8JY818D3UIB46e8PNpft556oJs=/510x318/top/img-s3.ilcdn.fi/03f70ea6092940cc20d42a16d78d2cae9edf3708019a1c7905c0678ca84c6b25.jpg,4AA0A3FD60CF4F2690572BEE7412BEF0
2023-04-25T09:17:52.000Z,Tiesitkö? Tv-katsojille luvassa täysin uudet kuviot tämän viikonlopun F1-kisassa,Azerbaidzhanin GP hakee vielä lopullista muotoaan. ,https://img.ilcdn.fi/rxcjBqLf2VZmgOeTjC6PNVD6I2Q=/510x318/top/img-s3.ilcdn.fi/3b98e9e1499e1990ebb66276bea2a13f1e2229e8be2979bf78545263445f17df.jpg,20A4CFD9B7DC4AE4806A225AC2750675
2023-04-25T09:21:37.000Z,"Katja Ståhl tilasi sohvanpesijän, joka riisuutui yllättäen – Juontaja ikuisti tilanteen Facebookiin","Juontaja Katja Ståhl halusi puhtaan sohvan, mutta pesuyrityksen työntekijä yllätti käytöksellään. Ståhl kertoo oudosta kohtaamisesta Christoffer Strandberg Show’ssa.",https://img.ilcdn.fi/Us2LGrE1r827l8GwFKjDBtmj7s4=/510x318/top/img-s3.ilcdn.fi/a8e26178f02d671e4b5f9381d31b4fd1a33e35670b4914798be2ab06b78f1d2f.jpg,5E3A60B493A54CEA94F8BE92B82EA8E9
2023-04-25T09:32:04.000Z,Kardio vai painot – Kummalla kannattaa aloittaa salilla?,"Tiedätkö, miten kuntosalilla kannattaa toimia, jos haluat samalla kerralla kasvattaa lihas- ja kestävyyskuntoasi? Huomioi nämä seikat, niin paukkusi riittävät koko salitreenisi ajaksi.",https://img.ilcdn.fi/e5XarFAYs8VeKeQbtTBXavRqwmY=/510x318/top/img-s3.ilcdn.fi/a0ceef3346e4baf5b9dd8af306e71a39bd8ef70391ea7bfe268d6df1a709ca9d.jpg,B93308BBB890468C86DFAD3ACD41DB79
2023-04-25T09:36:08.000Z,Nyt tulee lämmin,Alkuviikolla päästään osassa maata jopa 20 asteen lukemiin.,https://img.ilcdn.fi/L_UkKsCTnYaRo5t7TwCE_LVMlMI=/510x318/top/img-s3.ilcdn.fi/478ee3599a397fd9cfa3a56ad8c0f0ac55a1996459529869be39912517e46ded.jpg,A8FF2B17313B4C9DA9D91C7B678758C4
2023-04-25T09:50:24.000Z,Tunkeutujat veivät naisen väkisin kotoaan – Jättivät parinkymmenen kilometrin päähän tien varteen,"Naiselle tuli vammoja, jotka vaativat sairaalahoitoa.",https://img.ilcdn.fi/iHmqgGPRZHn97Jent9YdgHoD-GU=/0x495:2250x1901/510x318/top/img-s3.ilcdn.fi/5879a8ff0e98073171f87b1743bbfbd57fa90b31c0bc646e0b609852090fc76f.jpg,8B55C32CCA4F4E7C9D37FC3EE389E39D
2023-04-25T09:51:55.000Z,Joel Harkimon Jokerit-yrityksellä miljoonavelat – tässä ovat velkojat,Helsingin Jokerit oy on asetettu konkurssiin.,https://img.ilcdn.fi/4WScOKXiPGOqQuMXTmFTPSQJZb8=/0x0:3000x1875/510x318/top/img-s3.ilcdn.fi/004109661d55b5df045dfad0a13a2e63a0e146c5b2a564656cbfdaa543ae1b17.jpg,4985682A03ED479692CF119C538CEAE0
2023-04-25T10:02:31.000Z,Kuinka Meghanin poissaolo vaikuttaa prinssi Harryn kruunajaisvierailuun? Asiantuntijalta karu arvio,"Asiantuntija Jack Royston uskoo, että herttuatar Meghanin poissaolo kruunajaisista saattaisi vahvistaa prinssi Harryn keskusteluyhteyttä perheeseensä.",https://img.ilcdn.fi/qWdkwUGed52w1yb0XwwUoIvfdzM=/510x318/top/img-s3.ilcdn.fi/4c7a8e1a8964d8bf3228df7dac139d7de0941ce531c1edd28979de998b2d2453.jpg,6DDF7686ACED49D783F2CDD90C0EEE11
2023-04-25T10:08:27.000Z,"Toimitusjohtaja ajoi Mersulla 3-vuotiaan kuoliaaksi – Pyytää, että häntä ei rangaista","Potkupyörällä liikkunut lapsi kuoli Kempeleessä elokuussa, kun auto törmäsi häneen. Syyttäjä vaatii auton kuljettajalle sakkorangaistusta.",https://img.ilcdn.fi/Z5SiQPVuVFtdzL0-v8aobbo4P9s=/510x318/top/img-s3.ilcdn.fi/5b3f1c84114d058507e2f7680caee9e05ecf8a7833b9e178be6fc9932267eedd.jpg,0B28F744B92046338FB75AA742D4C550
2023-04-25T10:09:12.000Z,Joe Biden pyrkii jatkokaudelle,Yhdysvaltain istuva presidentti Joe Biden pyrkii jatkokaudelle.,https://img.ilcdn.fi/G6WmB-5JT-oq9CpQQuOcfMcnT6E=/510x318/top/img-s3.ilcdn.fi/329b2edab5211cdb289e6ae9a71b00bdc3e5eeccddba05e3f0ecc174f01af980.jpg,8BBCC6F6274043229EA15BFAA170C523
2023-04-25T10:10:12.000Z,Halpa lataushybridi koeajossa: Oikea kuljettaja säästää Kia XCeedillä tuhansia euroja vuodessa,Kian sekamuotoinen lataushybridi näyttää piirun entistä paremmalta ja on markkinoiden halvimpia lajissaan. ,https://img.ilcdn.fi/2Ofz5MkTmgeDD3_ufzPW2iuXtPU=/510x318/top/img-s3.ilcdn.fi/0b853a8c5adbdffbcb2508615b894fc4763e4af85141016993ba6cbd4de45fd4.jpg,33C60EA484AF4F4FB3E2670CE5CBCE22
2023-04-25T10:16:05.000Z,Putin sai oman tekoälyn – Kilpailja ChatGPT:lle,Sberbankin mukaan GigaChat osaa kilpailijoitansa paremmin venäjää.,https://img.ilcdn.fi/_tg6h9zV7X0cSjAWemdbMwHzfj4=/510x318/top/img-s3.ilcdn.fi/e151d846889d7b537ad3d2748028e9c64778483ec0e158b64fd66995268f6bea.jpg,56DF5C6DA58A48D39FFFB800CF9BB50E
2023-04-25T10:21:08.000Z,Poliisi tutkii tappoa Imatralla,Epäilty on 1990-luvulla syntynyt imatralainen mies.,https://img.ilcdn.fi/MVCTHeXURubKJFRI4nKchJc2qtI=/510x318/top/img-s3.ilcdn.fi/845e0a0eb27b6c71f68e34d95212f233b388e97552b58fd0f5e3881966f2d226.jpg,BE1252D5FBE5420AB04566F8BEB1399A
2023-04-25T10:27:14.000Z,Liigan finaaleissa nähtiin yllättävä käänne – Onko Tapparan tauti jo ohi?,Tappara on neljännenkin liigafinaalin selkeä suosikki.,https://img.ilcdn.fi/n16w9ilqKuoqDo6YnopyMxP0MKI=/0x64:3000x1937/510x318/top/img-s3.ilcdn.fi/e11bb51cb8561b3f050ee58c43f896585acd1971d6564358ac4ba0829e84499f.jpg,C6663D26CD714A409AE1162C5B6920E5
2023-04-25T10:28:10.000Z,Elixia sai 900 000 euron sakot,Norjan valvontaviranomainen määräsi kuntokeskusketjulle sakot.,https://img.ilcdn.fi/DAJqNkOgHehqDjd34L963SwRUlo=/510x318/top/img-s3.ilcdn.fi/0ac4e1abcf55c17135f315de8981e7faf9388bb7295474938e5667273e3f5348.jpg,D04BB59ADCC24BF38B27715F1072AAF9
2023-04-25T10:28:17.000Z,"Salma Hayek, 56, julkaisi bikinikuvia: Sai aikaan ylistysten vyöryn",Salma Hayekin bikinikuvat ovat saaneet valtavasti huomiota ympäri maailmaa.,https://img.ilcdn.fi/yXgsNW-E-VcMPnPi8n8wws3wj_E=/510x318/top/img-s3.ilcdn.fi/3b5b22ba1866f65b2c9368e2c296caeeb276618e969112ac282364392bd3b9ec.png,8BBE59DA9D5D4F9FA18781118674E440
2023-04-25T10:33:50.000Z,Kissaa kaltoin kohdellut Aarni Mikkola palasi julkisuuteen: ”Haluan vielä kerran pyytää julkisesti anteeksi”,Aarni Mikkola poistui julkisuudesta vuoden 2022 alussa suuren kohun saattelemana.,https://img.ilcdn.fi/u-aW-eTwnU-qCemEsItSmOcJiqA=/510x318/top/img-s3.ilcdn.fi/71bbb9add43cdfd42bbb9a88efbaa4c080862cc63869df43372d8d67e85633c0.jpg,87FF9A7956C3470281F22FB8BFCC4F8B
2023-04-25T10:54:51.000Z,Napoli sekosi! Dramaattinen voitto käynnisti villit juhlat tulevasta mestaruudesta ,Napoli voidaan kruunata Italian mestariksi jo tulevana sunnuntaina.,https://img.ilcdn.fi/3-s3Rk5u1G5EYQT3YbaHEZM9rF0=/510x318/top/img-s3.ilcdn.fi/39c710f1f7411853db9ae2d048612338af55ddf8a0825100e19d3f33a01c020e.jpg,01A60357A7184800839EEB427BEE8E34
2023-04-25T11:03:40.000Z,Riikka Purra: PS:n linja on edelleen poistaa pakkoruotsi,Perussuomalaisten puheenjohtaja Riikka Purra kommentoi tiistaina hallitustunnustelujen tilannetta eduskunnassa.,https://img.ilcdn.fi/DM9P1EJmjX3K41eh6-NuzjNgL_4=/510x318/top/img-s3.ilcdn.fi/15f1b58df4908866cc69156a2a0e314f3330c17e07ed88d47cdf1a9dbc59ec49.jpg,762D1B14F0684260B5274D366F97A992
2023-04-25T11:15:47.000Z,Drag ei tuhoa lapsia tai palvele pedofiileja,"Ala-asteikäisten “bondage-kurssit” eivät liity dragiin mitenkään, ja tämän väittäminen on vaarallista, kirjoittaa Iltalehden toimittaja Eevi Karvinen.",https://img.ilcdn.fi/AeOPSHLJkYDSKwUVQIq93R1pgio=/510x318/top/img-s3.ilcdn.fi/53388968358c0c7a739ef69d429d5a02124c8b42863ffb917d21028fb3d2518b.jpg,D5F521EA08BA472D9A60B738242EA8BF
2023-04-25T11:32:10.000Z,Huumekuriirien älytön takaa-ajo tallentui Espanjan poliisin videolle ,Salakuljettajien pakomatka tallentui poliisin kopterikameraan.,https://img.ilcdn.fi/fCeeX9Sp6BusS6TG5Fw2bvCxM8U=/510x318/top/img-s3.ilcdn.fi/48096354dbea3c89fe15db114104405392924b361c4e975505c05d578bc3e2c6.jpg,A7F8AC3759F64701A3A94F8E8675139D
2023-04-25T11:35:28.000Z,"Jenni Poikeluksen käynti gynekologilla sai omituisen käänteen: ”Olisit odottanut, että mä laitan housut jalkaan”",Juontaja kertoi kummallisesta kokemuksestaan radiossa.,https://img.ilcdn.fi/QDmniWZs5tmmrWvfUBgYGiD0hCY=/510x318/top/img-s3.ilcdn.fi/7e449ee4e391b10c9f8e1f0d61dd20208acec4b126e40c29bca3a01017551879.jpg,75D0D4C69ED143C883CD950B9557484C
2023-04-25T11:43:34.000Z,Niinistö jätti karttakepin kotiin Afrikan-vierailullaan,"Lännen, Venäjän ja Kiinan taistelu Afrikasta kiihtyy. Myös Suomen presidentti panee itsensä likoon lännen puolesta, kirjoittaa Iltalehden toimittaja Kreeta Karvala.",https://img.ilcdn.fi/27Cs2OMEmJzRJgKxe4ftKLBA6N8=/510x318/top/img-s3.ilcdn.fi/69745b4794eb3f73b92fa5b1a346be0ac4404c1cf15812324fd8e74c6883ffb7.jpg,E011EEDB513347119E30066B19B2DD54
