paivamaara,otsikko,tiivistelma,kuva,id
2022-10-10T23:17:52.000Z,Horoskooppi,NULL,https://img.ilcdn.fi/ZJX2nPQHLedeTO4nOGca4bZ5URo=/510x318/top/img-s3.ilcdn.fi/0e855f41645f17dbb2436f21bf69f40ac48d1971a147578985e2c64c1fb985d3.jpg,D5D6DFF0FC884BB79C1EBFADE8C8B352
2022-10-10T23:38:03.000Z,Sadat surivat ”jumalaisen krokotiilin” kuolemaa Intiassa – väitetään eläneen kymmeniä vuosia kasvisruoalla,Paikallisilla oli tapana tuoda lapsensa temppeliä vartioivan krokotiilin siunattavaksi.,https://img.ilcdn.fi/MVkV8zPMqv3qn5tOKBePlKHgWY8=/510x318/top/img-s3.ilcdn.fi/37074320de641d8183c17ec7da1178f864ec3e93d0aacb758cadd22c0fa1ba08.jpg,D421394B0C7C4A5295B082A330B3664A
2022-10-11T01:25:20.000Z,3-vuotias nukkui läpi Thaimaan päiväkotiverilöylyn – ainoa eloonjäänyt,Hyökkäyksestä selviytyneellä lapsella ei vaikuta olevan muistikuvia tilanteesta. Yli 30 ihmistä kuoli verilöylyssä viime torstaina.,https://img.ilcdn.fi/kF3YeNdnd5d0FmsHEcOe5auH3RM=/510x318/top/img-s3.ilcdn.fi/f5d5add015689ca37f5bc403053174428e3c75f5e3d85b62eb3fd0a00697cf91.jpg,0FBBB838C2F647A48140D9ACB313DFC6
2022-10-11T01:43:17.000Z,Syyssade pyyhkäisee Suomen yli – paikoin jopa 20 millimetriä vettä,Lämpötilat viilenevät tiistaina ja sateita tulee suuressa osassa maata.,https://img.ilcdn.fi/dMN99qtKyS6nt7TSaS9pUZ7KZB0=/510x318/top/img-s3.ilcdn.fi/ee5fcdf0bbe7e6ea4526e5ad53a251c488888f0b7902ed983a4e6a90e2cf2529.jpg,62CE08138AF2431A8068D2819956A9EC
2022-10-11T02:00:08.000Z,Tänään tv:ssä: Katja kävi vain puolen tunnin päässä kuolemasta – ”Jalkojeni mustelmat alkoivat kuplia” ,Katja Tamminen kertoo pysäyttävästä kokemuksestaan Akuutissa.,https://img.ilcdn.fi/lTH_MTEz1o6xtJxL-VhFi5rLCBE=/510x318/top/img-s3.ilcdn.fi/1c98ae7ef209ac060b365e5244c656e38fe8bb7840fc22a4c81b0f74b8c76993.jpg,03F1FA42048F4109BE3B6C755D944C7B
2022-10-11T02:34:05.000Z,Haluatko sijoittaa bitcoiniin ja muihin kryptoihin? Tiedosta 13 riskiä,Kryptovaluutoista on tullut yhä suuremmalle osalle suomalaisista houkuttelevampi kohde sijoittamiselle. Niiden kohdalla kannattaa pitää kuitenkin pää kylmänä ja tiedostaa sijoittamiseen liittyvät riskit.,https://img.ilcdn.fi/oDKMYZ5nGaBKodpvvKYAHZEM7G0=/510x318/top/img-s3.ilcdn.fi/96b32b6a3ad0a7549a9a90663a4b8a3c4d4e38c6a4fb3b15987402e126ac930b.jpg,B68C760C2BAF4806AC7CCE5064B5F4EF
2022-10-11T03:00:00.000Z,Montako vuotta Pelé täyttää tässä kuussa? Pelaa 10 kysymystä!,Iltalehden perinteinen urheiluvisa on myös verkossa. Montako tiedät?,https://img.ilcdn.fi/6kXYY4KPwN9xsKz2eZ59MhWNFP8=/510x318/top/img-s3.ilcdn.fi/86fe1d84871d456862f25d2b96d182bb53632b2f8748813e221ce272257c7c61.jpg,4D6A65DC81F9495AB8242CE75787C821
2022-10-11T03:00:48.000Z,Ahti sai tarjouksen sähköyhtiöltä: 700 prosentin korotus – ”Naurattaa”,Ahdin vanha sähkösopimus umpeutuu tammikuun lopussa. Sen jälkeen sopimusta voisi jatkaa Helenillä hurjalla hinnannousulla.,https://img.ilcdn.fi/_yi2h89R7BRtAkfQF4Y0r0RhF2Q=/510x318/top/img-s3.ilcdn.fi/49dbb7a368234c122868eea982eb7c5b57a02fbdf1a239b4e3d7d528fa28a8b9.jpg,CC02EE9059614B8C960580417CE4B538
2022-10-11T03:01:35.000Z,"""Putin voi haluta takaisin myös Suomen""","Viro on varoitellut Venäjästä jo 30 vuoden ajan. Viron ex-pääministeri ja kaksi muuta kärkipoliitikkoa kertovat Iltalehdelle, miltä muu Eurooppa sulki korvansa – ja mitä Putinin Venäjästä pitäisi ymmärtää juuri nyt.",https://img.ilcdn.fi/1j5_2TqbXt9sVlXK3bH8HDRDnYc=/510x318/top/img-s3.ilcdn.fi/9e5241f40970d44068c1b3b9d11c38d72755ce2ff78680cb30137d05ea358fa4.jpg,48310C60C514438DB10B4D6C8B89B912
2022-10-11T03:04:42.000Z,Mika Häkkinen kieltäytyi Keke Rosbergin salajuonesta: ”Miksi olisin kiusannut toisia sillä tavalla?”,Mika Häkkinen kertoo kirjassa kulissien takaisista juonitteluista.,https://img.ilcdn.fi/h8_Rcbh1V-rJVzuNgaE3xxKEJ8E=/510x318/top/img-s3.ilcdn.fi/4bdcf12cc26954afbfececa436e2e654f23f5aad28600b1c320f7a65114dbf5b.jpg,B19916C464624FCE94C810A147C98562
2022-10-11T03:15:14.000Z,Maroon 5 -yhtyeen Adam Levinen pettämiskohulle päätös ,Levinen vaimo Behati Prinsloo aikoo tukea puolisoaan kohusta huolimatta ja he haluavat jättää sen taakseen. ,https://img.ilcdn.fi/dv-H1dbxaeV-1Q1NFMO-1GveZAY=/510x318/top/img-s3.ilcdn.fi/3da7317116344b37642bf512eac58c40f6bc8a9348f22638759da2b89497f8b3.jpg,A7B7D9A7984844ACADE5866D3C1E8A06
2022-10-11T03:29:05.000Z,Tällainen on suosikkiartistia piinannut nainen,Valtion virkamiehenä työskennellyt nainen kaivoi tietoja pariskunnasta jopa väestötietojärjestelmästä.,https://img.ilcdn.fi/gK-DsI_PI7u0HncEYSfuPLf0Kjs=/510x318/top/img-s3.ilcdn.fi/7a65da87c52cc5385dcc70c3011f36fa978773d32a7941994503c133273e1573.jpg,43A2ED9EE19047C4B500FA60FA1F46F9
2022-10-11T03:53:30.000Z,Ruotsalaistähdiltä kova uhkaus – Jelena Välbe näpäytti takaisin: ”Emme menetä mitään”,Hiihdon MM-kisoista puuttuu joko ruotsalaisia tai venäläisiä tähtiä.,https://img.ilcdn.fi/8CdHPHexiJh-OkERy4YF-IsFVQc=/510x318/top/img-s3.ilcdn.fi/f262effbc60ddc1068a89f5700ab296658034765fc8f3d54fef134287e7fea66.jpg,BE956F44421A45F580C8BE604C904F5F
2022-10-11T03:57:05.000Z,"Helsinkiläisessä pihapiirissä kuvattiin tv-sarja, jossa nähdään joukko suomalaisia lapsitähtiä: ”Pelotti etukäteen ihan hirveästi”",Uutuussarjassa Munkkivuori nähdään harvinaislaatuinen näyttelijäkaarti.,https://img.ilcdn.fi/Q6OCfCaklXLnplobrI3Ok4WWmK8=/510x318/top/img-s3.ilcdn.fi/44210e95e3508243024ce50339b4a5c7449da7a7796bf055c01cbf8d3470b4bb.jpg,7C499E36DFD24FF08BB545A559881479
2022-10-11T04:00:43.000Z,Viron “salaisuus” hyvään Pisa-menestykseen: Oppilaat tekevät enemmän töitä kuin Suomessa,Viro saavuttaa hyviä Pisa-tuloksia vaikka Viron peruskouluissa eivät viihdy opettajat eivätkä aina oikein oppilaatkaan.,https://img.ilcdn.fi/2OezbgBLWhTo-lsK0hOW9vVeT0Y=/510x318/top/img-s3.ilcdn.fi/01fcc46e1a6144404909ceebe36587d9f46fd2da8a35c7c3e5eacdf06f03c61f.jpg,D9E90AB5B6E84BE7BA62A4ED107FE93D
2022-10-11T04:12:09.000Z,"Legendaarinen DJ Art Laboe, 97, on kuollut","DJ Art Laboe on kuollut, kertoo New York Post.",https://img.ilcdn.fi/MrOT9BnPnala5rdICaUyUE_AIMM=/510x318/top/img-s3.ilcdn.fi/fae7872b2a022921413199f02d546e21eb2468301b8e78c21f0d10d86ede4398.png,DD6552FB9ECF4675B6C6AAF136A85431
2022-10-11T04:22:56.000Z,Kaikki halusivat kuvaan Hollyn isän kanssa – onko tässä Snoop Doggin kaksoisolento?,Holly oli isänsä kanssa lomamatkalla Kyproksella.,https://img.ilcdn.fi/6QN7s6bppZnJdU4LmVF_x4eBEbY=/510x318/top/img-s3.ilcdn.fi/fe838aaea92a1eda71a74c1cf63470b4c55599db5701fb613c345091fd3927a2.jpg,EAAB23E234A64872A8B5F4055F4F8DD8
2022-10-11T04:32:20.000Z,"Spice Girlsit villiintyivät Mika Häkkisestä, ajohaalarit haluttiin repiä irti: ”Ehdottivat vähän kaikenlaista”",Mika Häkkinen muistelee F1-uransa erikoisinta mediatilaisuutta Heikki Kullan uudessa formulakirjassa.,https://img.ilcdn.fi/lG58w3j5r0qGM34tseU3rcy2wSc=/510x318/top/img-s3.ilcdn.fi/4438ad0303e33a8bbed798ed9b48580added2826bd5a95234465f236f83d7428.jpg,4705E925F9944BF7BB98496A03D3E95A
2022-10-11T04:34:43.000Z,"Dobrila on menestysyrittäjä, joka asuu Helsingin arvoalueella – hän tietää, millaista on pakolaisen valheellinen toivo","Dobrila Tadic tietää, miltä tuntuu paeta sotaa.",https://img.ilcdn.fi/YFqw4OJaqUsbv4fy0x4pLI2hYA0=/510x318/top/img-s3.ilcdn.fi/3a6c8835358e1977828077e6ab60dac570fe9d7c1e8f426f31f16e3482759a9b.jpg,7224D7B3F67A42DBBDBCBB84045916D0
2022-10-11T04:37:57.000Z,"Halle Berry, 56, sai osakseen kritiikkiä Twitterissä: Näyttelijän vastaus leviää netissä kulovalkean lailla",Halle Berry naseva vastaus somekritiikkiin on otettu vastaan huumorilla.,https://img.ilcdn.fi/pJ2fMPzl3jdhXddlvLIJmYyh-uo=/510x318/top/img-s3.ilcdn.fi/301e5a41c9ee267f2d3e6bc48e4e8c4294bad805ee26599f1c97dc944da3bfc3.jpg,20F0F4FBD96F4CCCA324C842A710A0D7
2022-10-11T05:02:26.000Z,Moni masentunut on itselleen poikkeuksellisen ankara – tällaiset ovat tyypillisiä tunnelukkoja,"Pappi ja terapeutti Miia Moisio avaa kirjassaan, miten masentuneen mielenmaisemaa leimaavat lähes poikkeuksetta useat, vahvat tulkintamallit. Niiden lieventäminen on yksi avain toipumiseen.",https://img.ilcdn.fi/LD0FVelNcqlRqr4VfbqzBzGsVUo=/510x318/top/img-s3.ilcdn.fi/5853c4298fb881cf76ebcb5f0c9af2de7f7adca69d97dd37d68417cdc9107d72.jpg,B974C88F807348709F584FFF2DE830B4
2022-10-11T05:05:35.000Z,Paralympiamitalisti kriittisessä tilassa – puolisolta vakavia lisätietoja vammoista,George Peasgood joutui pyöräilyonnettomuuteen.,https://img.ilcdn.fi/UU9zo7QpexBk2E_tEGVCGcRB8FM=/510x318/top/img-s3.ilcdn.fi/f99e2be38e52951a5b3ef63077086e113f842bc473b6c49c516e46978f3aabd2.jpg,67437C48DD7F4D0BAFB9DA4BEA4D7856
2022-10-11T05:19:43.000Z,Naton Euroopan-joukkojen komentaja vierailee Suomessa,Yhdysvaltalainen Christopher G. Cavoli tutustuu Puolustusvoimiin ja Suomen Nato-jäsenyyden sotilaallisiin asioihin.,https://img.ilcdn.fi/hjN53oEWWX9nAnHZk0xfdJCstys=/510x318/top/img-s3.ilcdn.fi/747620613c9e7f31d5fcb5fbbf98036f8d76d9727c8ae40e81c38cedb69c5632.jpg,0EC37631D9214843A32CF43DAD0BA2E0
2022-10-11T05:19:58.000Z,Sofia Belórf kiistää vieneensä huumerahoja Espanjaan – IL seuraa Katiska-oikeudenkäyntiä,Sofia Belórf valitti käräjäoikeuden tuomiosta hovioikeuteen.,https://img.ilcdn.fi/fjP3ZRyM-sI70wmje81li4qp_V8=/510x318/top/img-s3.ilcdn.fi/3ecc24108babbbfc453ee5dd941b9c6aa22a809b7e9120160f8f0060bf111528.jpg,4358847A433C4B48895790FE4D245A15
2022-10-11T05:31:02.000Z,Katso kuvat: Emma-palkittu muusikko kisaa Suomen kauneimmassa kodissa – saa kritiikkiä sisustuksesta,Kilpailuun osallistuu Reginasta muistettava Mikko Pykäri.,https://img.ilcdn.fi/emxLkK5eOfvKU6zvEY3_UkoUfmQ=/510x318/top/img-s3.ilcdn.fi/d6a192a0c8e099ab96390609b1faff870c4d75e10e29512d825f921ae54aeeb1.jpg,04E780A3331F4D308BEC8DE56CF2027C
2022-10-11T05:58:37.000Z,Vuosi sitten Krista kertoi somessa olevansa yksinäinen – viestitulva yllätti täysin,"Krista Peltovirta hankki uusia ystäviä aikuisiällä. Apunaan hän käytti sosiaalista mediaa. Avoimesti yksinäisyydestä kertominen sai aikaan viestitulvan, joka yllätti Kristan.",https://img.ilcdn.fi/7j5PdqhcSMW2mKdkl8IYg-IBlVc=/510x318/top/img-s3.ilcdn.fi/6aa18371972e91df428362cbdd7b414b180f77a6d8d7e627583aeb8a00f8799d.jpg,640C5928AC444609B37BD78663CB625A
2022-10-11T06:07:05.000Z,Seuraava sähkösopimuksesi on huomattavasti kalliimpi kuin entinen – tässä syy,"Kuulutko niihin onnekkaisiin, joilla on edullisin hinnoin tehty parin vuoden sähkösopimus? Toivottavasti luet silti sähkön säästövinkit ja myös toteutat niitä. Seuraavakin sähkösopimus on nimittäin huomattavasti kalliimpi kuin entinen, kirjoittaa Iltalehden kolumnisti Emilia Kullas.",https://img.ilcdn.fi/-ahFEYgS_GrlG9cnjGDD0bEjKVw=/510x318/top/img-s3.ilcdn.fi/ff01c27f1f97f2419f246d7eb4f9725fb8c0b43f94c347ed8997466e59c44d12.jpg,E047801139D04A84A689FFA8AE277BE8
2022-10-11T06:13:42.000Z,Nämä ovat talven halutuimmat talvitakit ,"Lämmin takki on syksyn tärkein hankinta. Haaveiletko pehmeästä teddyturkista vai toppatakista, jonka sisään voi uppoutua? ",https://img.ilcdn.fi/RhOWZZBSMtoIJnaxwOTbihALv4Q=/510x318/top/img-s3.ilcdn.fi/765ee7532b274947f0ce6452b94d49c6d71b7fe82c483ff41d6e32eee1d940c2.jpg,AECA8923ACF642ACA8A851EF2A2C34D5
2022-10-11T06:15:55.000Z,Tässä ovat Ylen Urheilustudion asiantuntijat – kaksi nimekästä vahvistusta,Yleisradio julkisti talven tv-lähetysten kokoonpanonsa.,https://img.ilcdn.fi/bO1jaIKyF3xza1tYJNd4E252EXU=/510x318/top/img-s3.ilcdn.fi/9f9b95c3e1326119485ccaadc64e4962c540cdbf56d519ed590e16fb6b604fe4.jpg,83F4C9DF4D0B479CA2A80A931AC6CAF4
2022-10-11T06:20:42.000Z,Tässä ovat Miss Jyväskylä -finalistit – katso upeat kuvat,Kymmenen upeaa naista kisaa Miss Jyväskylän tittelistä.,https://img.ilcdn.fi/1SL9ocQmHPmZ7yYAgaU1oi4hVEE=/510x318/top/img-s3.ilcdn.fi/6d207744da6de3e4c3fc169ff9a09f3ae02a2788af2a366dd49769475f865ef1.jpg,CA13225F883045F2A3CD8B2CF56BFB39
2022-10-11T06:34:10.000Z,Talvirenkailla edessä hintapiikki – kallein päivä marraskuussa,"Talvirengassesonki lähestyy, mikä tarkoittaa sekä rengasliikkeiden ruuhkautumista että hintapiikkiä.",https://img.ilcdn.fi/keUR_Zxv395w7sMQpVikwKIATCw=/510x318/top/img-s3.ilcdn.fi/ce2f4e3cb8d3e20d98de2a55b37e156e4493bbae77b92de0e6b44df4b1006086.jpg,E724C20B6AD641B28BE6D372FE0665C6
2022-10-11T06:40:11.000Z,"500 valasta huuhtoutui rantaan Uudessa-Seelannissa – kukaan ei tiedä miksi, selviytyneet tapettiin vaaran takia",Pallopäävalaiden joukkokuolemat herättävät hämmennystä Tyynellämerellä.,https://img.ilcdn.fi/7wd_AgXgP-NEpoHEGk1WXYPRAn8=/510x318/top/img-s3.ilcdn.fi/903ca57c1615707b3aba7d57c841fb4453f0aa00065ab2f975ee27e57b30829e.png,A96AB0CE0E6C46B89709AA3945E5BAA2
2022-10-11T06:53:48.000Z,Zelenskyi: Venäjä käytti iskuissaan uusia iranilaisia aseita – tällainen on itsemurhalennokki ”lentävä ruohonleikkuri”,Ukrainan mukaan Venäjä käytti maanantaisissa iskuissaan sekä ohjuksia että iranilaisia itsemurhalennokkeja.,https://img.ilcdn.fi/TiFJ8E3e00xYXwzIdM0Lgsxh_t4=/510x318/top/img-s3.ilcdn.fi/b29dc53e5418ec2aa5a6ad0a14a9242f4949dd35b7f5314e347a4f6d842aace0.jpg,0DC2D4A50E7B434591E1EFE15B3A804D
2022-10-11T07:02:54.000Z,"Päihtynyt mies makasi keskellä tietä, kuorma-auto ajoi yli – kuljettaja ei ilmoittautunut poliisille","Oikeudessa kiistellään, syyllistyikö kuljettaja huolimattomuuteen.",https://img.ilcdn.fi/afpMdfGznyBw_sOgS4bzrnMPQ-Y=/510x318/top/img-s3.ilcdn.fi/201fd47fa66092973a7dd339cc93f08bd3c3e9b136d26cbb0c1f5fab1cfcb94b.jpg,9FD023F77D1B403A9AB99290096CB4C5
2022-10-11T07:18:20.000Z,Salkkareista tuttu Ilona Chevakova odottaa toista lasta,Chevakovan perhe kasvaa.,https://img.ilcdn.fi/pkSfnric0tMPGnBavH1zKQS1QOc=/510x318/top/img-s3.ilcdn.fi/4bacce66aa680369bacb72c23cbe918b37737e794c7ee634976bcf5a49a4b891.jpg,A1EDFFA80C684A57949796F82CE0D68A
2022-10-11T07:26:30.000Z,Käsirysy päättyi puukotukseen – poliisi tutkii epäiltyä tappoa Oulussa,Epäilty henkirikos tapahtui Oulun Tuirassa perjantaina.,https://img.ilcdn.fi/KLTcdw8u2jEA3bnfGYqSCUq70Ko=/510x318/top/img-s3.ilcdn.fi/e28165d3bf6505bca96d032f3788b3ab0ec8ab68a5c48dfb0df05189239b41b3.jpeg,8C46EF9085534F6FB059FAAF6F4FC349
2022-10-11T07:36:41.000Z,STM kehottaa suomalaisia hankkimaan jodia,Sosiaali- ja terveysministeriö on uudistanut ohjeensa lääkejodin käytöstä säteilyvaaratilanteessa.,https://img.ilcdn.fi/VBGXwDESs4DpBQ581EE2hkbET6k=/510x318/top/img-s3.ilcdn.fi/e497a21bcf945ae4bc7265e09c5595e014432f3112f1fc058b90a4dd059a64a0.jpg,A46DD0BACB14432984BBCA09BBA3E9B8
2022-10-11T07:46:52.000Z,Tyrmäys viidessä sekunnissa! Vapaaottelija suojaus petti pahasti ottelun alkuhetkillä,Lukasz Klos sai ikimuistoisen ensimmäisen vapaaotteluvoittonsa.,https://img.ilcdn.fi/K0wXqB2T5dTlAdkVBs37C0bc6_0=/510x318/top/img-s3.ilcdn.fi/670ae0bb395dd46983d7d706deef525a358aa057a5868c166eb8614039ed6a9c.jpg,B53EEC5D8781448E9C6D28C5A3ACC312
2022-10-11T07:55:59.000Z,Mika Aaltolan hurja ennustus: Ukrainan sota voi olla jo keväällä ohi,"Ulkopoliittisen instituutin johtaja Mika Aaltola uskoo, että Venäjä ajautuu sisäiseen kaaokseen Ukrainan sodan jälkeen.",https://img.ilcdn.fi/ehDjeMV04TJwuR__yxGShekEJZA=/510x318/top/img-s3.ilcdn.fi/5b714664817e2cc4f0d9dbbcc64c179f8d18fd22c62f84adac0888c0adec5631.jpg,0CE1E305F2BC412E8CEA28D9C5455AC3
2022-10-11T08:02:06.000Z,Pete Parkkonen kertoo televisiossa pelottavasta tilanteesta: ”Mies kaivoi peräkontista pesäpallomailan...”,Tommi Läntisen Vain elämää -jaksossa artistit kertovat rankoista kiusaamiskokemuksistaan. ,https://img.ilcdn.fi/p_0LisAHPL1ZJ4NZY1PJV9EMHKA=/510x318/top/img-s3.ilcdn.fi/195d30dcd66dcf4414f8af5552ac052e3d48e84f8be065f62c64e4658b3725a9.jpg,1B5D85DAD7A442A39434A8B46FB304F6
2022-10-11T08:08:35.000Z,Elokapinan mielenosoittajat liimasivat itsensä yrityskonttoreiden rakenteisiin – poliisi repi irti ja teki kiinniottoja,Helsingin poliisilaitos kertoo Twitterinsä tutkivansa mielenosoituksiin liittyviä tapahtumia.,https://img.ilcdn.fi/ZeQkeSJrs5A2lO5aJHPvyoBOgFE=/510x318/top/img-s3.ilcdn.fi/6db10f64bf5911616c89b229d8214ddf6048642d636c762c4b34fa9cbc88a0b6.jpg,518C8E1F63D842128F722FA0391B5CBA
2022-10-11T08:14:59.000Z,Tältäkö näyttää rasvaprosentti 19?,"Toimittajamme selvitti kehonkoostumuksensa. Lääkäri kertoo, mitä kehonkoostumusmittaustuloksista voi päätellä, kuinka luotettavia tulokset ovat ja mitä kannattaa huomioida niitä arvioidessa.",https://img.ilcdn.fi/dtTRgnjmA2SSz5pA1kRz5sZX8w4=/510x318/top/img-s3.ilcdn.fi/b3561f0f12a083d7152f76cbeddf473633e10bbb2ab536190c1b68411854646d.jpg,166E353BDE34408B8CAE03EEAF325E1C
2022-10-11T08:18:17.000Z,Remonttifirma teki järkyttävän huonoa jälkeä – 22 000 euroa takaisin asukkaalle,Kylpyhuoneremontin lopputulos oli täysi floppi. Kaikki uusittu on remontoitava toistamiseen.,https://img.ilcdn.fi/KUKFEMuiM89XdfV0QEnu_V49tSs=/510x318/top/img-s3.ilcdn.fi/6ef587607dbe7a557027dc0a5d1ac89d2e040919e139ebb99db3be4f14be273c.png,85B6D042E70147B29C6301847430CA01
2022-10-11T08:25:07.000Z,Ville Rannan pilapiirros: Ex-pääministerit: Kai me saadaan silti pitää nämä rahat?,Ville Rannan pilapiirros 11.10.2022. ,https://img.ilcdn.fi/oWMBlBnmSHKCVgwngZjH3yy27Fk=/510x318/top/img-s3.ilcdn.fi/9a5e91ba5f0d09e159b682f70dc4cb43df9903ded5b0d2fb6ff058ce217e8b2f.jpg,A7014EA301B54661AFF3794209373AA8
2022-10-11T08:30:01.000Z,Näyttelijä Eileen Ryan on kuollut – esiintyi usein poikansa Sean Pennin kanssa,Eileen Ryan näytteli uransa aikana yli kuudessakymmenessä elokuvassa ja televisio-ohjelmassa.,https://img.ilcdn.fi/WhSgPUW0iEUZ_HLNnvUw7jtK2Ss=/510x318/top/img-s3.ilcdn.fi/93a689f5f0f79bb69f298ae9ec2f19dcb9e7e882a03d7592d0fb6a09ab0fb92d.jpg,BC69F691F02641C495E50940E0D76674
2022-10-11T08:44:51.000Z,IL:n tiedot: Toyotalla on Suomessa salainen projekti – ei suostu hiiskumaan sanaakaan,Iltalehden tietojen mukaan japanilaismerkki testasi uutta ralliautoaan Suomessa viime viikolla.,https://img.ilcdn.fi/VU6eExyqQwxu68ogX_XFWc6VtVk=/510x318/top/img-s3.ilcdn.fi/a430e7ef70e324484da9fc1b8d07b09e900ecdbfa8cad7ee4c10bd9c90cdaf9b.jpg,93F1689B92554A188B54E5FC87B2AF0C
2022-10-11T08:59:12.000Z,Tämä jodista on nyt syytä tietää – asiantuntijat kertovat,STM päivitti lääkejodia koskevaa ohjetta ja kehottaa suomalaisia hankkimaan jodia. Joditabletit ovat erityisen tärkeitä lapsille ja raskaana oleville. Yli 40-vuotiaat eivät hyödy niistä.,https://img.ilcdn.fi/mQlEi3gb1XDtXRCXt7FkL0o9210=/510x318/top/img-s3.ilcdn.fi/f1a78b7b2208731bbdcea2b9c7a158769bfaeadfde047158d1aed77f7af47489.jpg,C194CEDD237C46CFA5AFFEBA6B61B9DD
2022-10-11T09:01:27.000Z,Kuvat: Mäntsäläläisen Cittarin seinästä revitty automaatti löytyi hylättynä metsästä ,Itä-Uudenmaan poliisi pyytää yhä silminnäkijöiltä havaintoja ja tietoja rikoksen selvittämiseksi.,https://img.ilcdn.fi/77w3airkNVC-pA3OEI_HH8M9TII=/510x318/top/img-s3.ilcdn.fi/2451922037674c0df159de7a150e2e72d05ae42ca3955ee29a3d7f476715df47.jpg,553898A6F3D04A9A95C7AB0CBA9D18C3
2022-10-11T09:19:52.000Z,Janni Hussi sai mahtiroolin: samassa elokuvassa Julia Robertsin veljen kanssa – traileri julki,Janni Hussi nähdään yhdessä Insite-elokuvan päärooleista.,https://img.ilcdn.fi/HhLTTa9xmYlsHVVU9A1nj2MIvGA=/510x318/top/img-s3.ilcdn.fi/c91853201e37c1a56f97fa33b5f1bf1590c5d56bf6f73e669dd7d373e59d0e05.jpg,99563CB639DC495F9C0EAB09EC071B02
2022-10-11T09:26:38.000Z,SaiPa hävisi oikeustaistelun: Tero Lehterä saa suuret korvaukset,Hovioikeus hylkäsi lappeenrantalaisseuran valituksen.,https://img.ilcdn.fi/XCV8qjuA8c4ZlI2wrBNdPJ1kuq4=/510x318/top/img-s3.ilcdn.fi/4ea69dd8112347dea7efc605c9cee478e0b9931ddd5ee45f79f0c872b106f67d.jpg,DB251FCA6A6B43399F111024EE034E5F
2022-10-11T09:34:33.000Z,"Valtava Volkswagen, joka kulkee kuin juna – koeajossa 22 000 euron käytetty Amarok",Volkswagen Amarok eroaa saman kokoluokan avolava-autoista henkilöautomaisuudellaan. Se on herrasmiehen lupsakka pick-up vielä vanhana ja paljon ajettunakin.,https://img.ilcdn.fi/oNp0-qAQd-DS1qhairjsmGJ_ook=/510x318/top/img-s3.ilcdn.fi/a2fb323a9a5f4dd6e6e59d861738793ac14415a9ace2f2f25f0e5992bc1dae2b.jpg,A4B3D6F3B6454EB0802150D78907E513
2022-10-11T09:40:01.000Z,Vanha Rouva vaarassa lipsahtaa ulos jatkopeleistä – tiukkaa tekee jopa Israelissa,Nimijoukkueista Juventus on tiistaina tukalimmassa tilanteessa Mestarien liigassa.,https://img.ilcdn.fi/ZbuTi-4jmGzQ4gVybP5Cxl8cW3M=/510x318/top/img-s3.ilcdn.fi/56bb8f04ea9756c08b23c4f4b08da7a80bc1e64d008e865e8cdc1e7c39e44f87.jpg,77A47B9ED4C04B09AEA8E24F94A29A61
2022-10-11T09:43:03.000Z,Analyysi: Muovikuula-asevyyhti jatkuu - sama teko on sekä rikos että laillinen,"Suomessa voi saada rikostuomion hankkiessaan ”tehokkaan ilma-aseen”, vaikka toiset voivat tuoda niitä maahan ja myydä, kirjoittaa toimittaja Mikko Niskasaari.",https://img.ilcdn.fi/mU0Qdzr_zHyryUH0U0xdNWH6UQI=/510x318/top/img-s3.ilcdn.fi/1d6f78daf33374ba02025552ff426c97dd15f4265232290810751b33add9c761.jpg,64AB4B4D8F794E0B9028ED217CBD2602
2022-10-11T10:02:07.000Z,Hääpäivä pilalla – olympiamitalistia odotti täydellinen hävitys Monacon-kodissa,Tanskalaisen perhe joutui evakkoon. ,https://img.ilcdn.fi/kfxlpvEN0P-s8LOh03tmW0T2XoQ=/510x318/top/img-s3.ilcdn.fi/bd204f05e0ebeae5b20b705c1c7f0cc66ecb61d0788181dbb2b72766bb04f915.jpg,24007E85334F4CBDA6AFA1F15A826266
2022-10-11T10:07:02.000Z,Ella ja Aleksi -lapsiduon Ella on 23-vuotias ja oikealta nimeltään Siiri – tältä hän näyttää nykyään,Siiri Nuora teki päiväkoti-ikäisenä uraa Ellan ja Aleksin Ellana. Nyt hän kertoo kokemuksesta ensimmäisessä lehtihaastattelussaan.,https://img.ilcdn.fi/B1VxarbYy41HxRUsxHUFCzfqC1E=/510x318/top/img-s3.ilcdn.fi/3da9fae7bd90c6a38a8c3ef0d49bb2421039c2cde749d14635a06138574908a5.jpg,456FE33C65C7407580ACDBD269CC3627
2022-10-11T10:07:07.000Z,Kauneusvaikuttajan contouring-vinkki hämmentää Tiktokissa: lopputulos yllättää,Kauneusvaikuttaja julkaisi Tiktok-tilillään hurjan suosikkivinkkinsä. ,https://img.ilcdn.fi/ZHEcK-tt-eD35BPwiFT9qKML_b0=/510x318/top/img-s3.ilcdn.fi/4fcb5dd4b7670e666aa14998d3d4ae086cc8cf001efb40e919d43df1c14f686c.jpg,8B38AEFC51EB49B58F9EBBEF33478F63
2022-10-11T10:22:14.000Z,Miksi jodiohjeistus päivitettiin nyt? STM vastaa,Ohjeistus lääkejodin käytöstä säteilyvaaratilanteessa oli edellisen kerran päivitetty vuonna 2002. ,https://img.ilcdn.fi/blva1Dp_TjfT95Emg6CE0xxjVf0=/510x318/top/img-s3.ilcdn.fi/1497acad48d498e20c9f2c13e5f7a96b62f190eb6dc55bfa597c19ed39211c69.jpg,1E60D4C2E253439D90037A148DDA4D89
2022-10-11T10:27:12.000Z,"Ruorimies hukkui veneturmassa, päällikölle rikossyytteet",Yksi Rajavartiolaitoksen miehistön jäsen kuoli onnettomuudessa.,https://img.ilcdn.fi/8vb_DJRP7KNhjf8TXlJMTXOzSG0=/510x318/top/img-s3.ilcdn.fi/47e527a95f14b8e6e5aea4f028c9d9d815994b2a3a3b3c00797daa6206a4d8d7.jpg,D89B890BAA654E2181D37063D117FA81
2022-10-11T10:34:47.000Z,”Länsimaat lähettävät roskasakkiaan kuolemaan” – näin Kremlin propagandakoneisto kehottaa uutisoimaan sodasta,"Kreml kehottaa venäläistä mediaa kertomaan, että Kertšinsalmen sillan räjähdykseen liittyvä hysteria on laajasti liioiteltua Ukrainan toimesta.",https://img.ilcdn.fi/b8xkS2Y9U9bAAzy8QdUbVff7RLU=/510x318/top/img-s3.ilcdn.fi/5533fd6efc01ad4d0655d12bb99524b2448d2c6cfc5ed525c0ce3d32a28b6281.jpg,2F758794550746C7991E2FFF9726C75F
2022-10-11T10:39:56.000Z,Niinistö: Putinin ja Erdoganin huomisella tapaamisella on laajaa merkitystä,"Ninistön mukaan Venäjää ymmärtäneissä maissakin on jouduttu nyt pohtimaan, mihin sota on menossa.",https://img.ilcdn.fi/XwGEnYSG98XnxLjhEUP5AQmseSE=/510x318/top/img-s3.ilcdn.fi/92ce381caf08bef487eb3382e923ea7b745d304c273618355c51571e186c5fe4.jpg,D8E3C2E63EFA4E13A4357E96921BF018
2022-10-11T10:41:02.000Z,Suomalainen Herman keksi nerokkaan niksin auton siivoukseen – videosta tuli somehitti,Herman Fleenin Tiktok-videota on katsottu tähän mennessä jo yli 12 miljoonaa kertaa.,https://img.ilcdn.fi/BeJBEg7R-SID9zi06uoR7zU_bJI=/510x318/top/img-s3.ilcdn.fi/974c5c6488d86554326d85eb9a31f7ab116a3d51d2705223ebd888961ebc2038.jpg,4967C9F4395742DBA0E8A14355EA416E
2022-10-11T10:43:29.000Z,"Tähdet, tähdet tekee paluun – tässä ovat kisaajat","Tähdet, tähdet -ohjelma uudistuu.",https://img.ilcdn.fi/tOFojHJd-oCd_lDIJHadO5Q_qzE=/510x318/top/img-s3.ilcdn.fi/53a459f4856ec3c51ecb9957b511acd493316d72381f8ccfe2439c7ed4dc77b3.jpg,4AC983FC464A492F8419C14BF2EF6B58
2022-10-11T10:45:22.000Z,Onko tässä vuoden 2022 hittijoulukalenteri? Täysin uudenlainen kalenteri saapui kauppoihin,Listasimme vuoden 2022 kiinnostavimmat joulukalenterit. ,https://img.ilcdn.fi/SJV5z5QZlPdDHbAjs5MPuKAGur4=/510x318/top/img-s3.ilcdn.fi/3adf805fd6169bf957d71ac920bb9f5292f3678eda7eff150c2c98614e601ce5.jpg,CCBE69D5EDFB409194A4EDCC1D116052
2022-10-11T10:50:54.000Z,Joditabletit loppuivat välittömästi Helsingin keskustasta – ihmiset pettyneitä,Iltalehden apteekkigallupin vastaajat jakoivat huolen ydinaseista.,https://img.ilcdn.fi/5PaoRivFo7KvdI0PMc-o_wF65kM=/510x318/top/img-s3.ilcdn.fi/406f668c24ae36b804673f7b2c91cf6567eb5d2b32ecb90713c9cfc5ba1d7356.jpg,B4D4B4A71C6B48B5808949493EE290DB
2022-10-11T10:57:07.000Z,Nämä rajut onnettomuudet olivat liikaa – hiihdon kauhukurviin muutoksia,Rukan maailmancupin radan Impilinnan lasku ei ole entisellään.,https://img.ilcdn.fi/dy0wluHeLrETw08vk52XjelCp2w=/510x318/top/img-s3.ilcdn.fi/e8484cc7440d7f5639de44d2ae2dc106b917853038a95faf7c5c090f3e799ea1.jpg,EFB28C9AB3D5441C9C5B897E61B83EF2
2022-10-11T11:41:02.000Z,Ilkka Vainio kokee jääneensä velkaa Kikalle: ”Minulla olisi pitänyt olla enemmän aikaa hänelle”,Sanoittajaguru Ilkka Vainio näki läheltä iskelmätähti Kikan nousun ja tuhon.,https://img.ilcdn.fi/nra0Oo_VFdEBghtKOzBIAkubyis=/510x318/top/img-s3.ilcdn.fi/bbd54cf8a04c41e1df43580140254c084e81e0a32b904298f9bd16f007553383.jpg,B75BE9F611CD40D6910EAB2BA11536AC
