paivamaara,otsikko,tiivistelma,kuva
2019-04-04T06:46:17.000Z,SM-liigan pörssikuninkaan Malte Strömwallin uusi seura selvillä - ruotsalaistähden ura jatkuu KHL:ssä,KooKoossa ihastuttanut ruotsalaishyökkääjä Malte Strömwall siirtyy KHL:ään.,https://img.ilcdn.fi/rU0eK_6JCrq241bST-5FBBLe5b8=/0x0:3000x1873/510x318/top/img-s3.ilcdn.fi/2c1920af2b61915f5e00b1903a125742682f0dd48fd8ec7248663bc0c9f6f8a6.jpg
2019-04-04T06:50:02.000Z,Varma kevään merkki: kesänopeudet tulevat!,Tyypillisesti korkeammat nopeusrajoitukset ovat käytössä koko maassa viimeistään ensi viikon sunnuntaina.,https://img.ilcdn.fi/u6bT0H1F9S-stPvCR3EDWCYzI3c=/510x318/top/img-s3.ilcdn.fi/432dd888f9d72880b23b53a24cb9efc418063a7ffc77b2d6eaf2dd8a735d0523.jpg
2019-04-04T07:05:34.000Z,Mikä takaisku! Kovan onnen suomalaishiihtäjä tippui rivistä ennen kauden kliimaksia,Ristomatti Hakola joutuu jäämään sivuun Ylitornion Suomen cupista selkämurheiden takia.,https://img.ilcdn.fi/q3dBcxgZr2j7a_lJSNzhBb5KUpM=/510x318/top/img-s3.ilcdn.fi/9f51eca8919bea99e34ccaceddd4ec23ba191e12765432c3a9e1b35a2852bd81.jpg
2019-04-04T07:07:42.000Z,"Tuure Kilpeläinen näki tulevan vaimonsa Manuela Boscon televisiossa ja teki hänestä kappaleen, jota ei pitänyt koskaan paljastaa – ”Oliko tämä enne?”",Manuela Boscon tapa puhua televisiossa jätti huippumuusikkoon lähtemättömän vaikutuksen.,https://img.ilcdn.fi/m2Uo-bpJf3qvLzr8wqNdN23dwAg=/510x318/top/img-s3.ilcdn.fi/962edfdcd7498430f39ce453bd84206854f6d2239178e0772f7189e85bccd403.jpg
2019-04-04T07:10:25.000Z,Anne Bernerin yhtiö tekee miljoonatulosta: Sen hikipajat Intiassa eivät maksa edes minimipalkkaa,Finnwatchin raportti paljastaa ministerinä toimineen Bernerin yhtiön taustalta alipalkkausta. Yhtiössä yllätyttiin.,https://img.ilcdn.fi/Z5D-nDfHa4gL8s5GPyLqBNMdYTs=/510x318/top/img-s3.ilcdn.fi/14e20fad12f9cff3a7436800c922b65bec30a1042df8437e21fcfba2d77edd73.jpg
2019-04-04T07:11:53.000Z,Suomalaisen luksusbrändi Balmuirin tuotteita tehdään alle kolmen euron päiväpalkalla - kehuu vastuullisuuttaan,"Balmuirin tuotteita tekevät intialaiset eivät tule alle kolmen euron palkalla toimeen, eivätkä saa liiemmin eläkettäkään.",https://img.ilcdn.fi/IntpBjP_joWo94FnlLq3cUCQJ1Q=/510x318/top/img-s3.ilcdn.fi/e9a7a16cd743875bb931313a4d818e8986a5d1ffe4022fe3e4595f8549dd5846.jpg
2019-04-04T07:12:17.000Z,Espanjan äärioikeistolaisen puolueen kannatus hupenee,Sosialistipuolue on johdossa uusimmassa torstaina julkaistussa mielipidemittauksessa.,https://img.ilcdn.fi/x6LrwWnnf9sp0BmbTIdI9TG5i1Q=/510x318/top/img-s3.ilcdn.fi/fc3d819aea518b242739df61eadf584940aab624a0fd1ffe7014be418bf21ba3.jpg
2019-04-04T07:17:29.000Z,"”Suomi on maa, jossa oikeaoppisia muslimeja ei ymmärretä” - Tuore raportti paljastaa, miten suomalaiset jihadistit toimivat verkossa ","Islamistiseen jihadismiin kannustava materiaali on painunut lähes täysin maan alle. Sisäministeriön tilaama raportti paljastaa, miten Suomeen liittyvää jihadistista viestintää harjoitettiin vielä muutama vuosi sitten.",https://img.ilcdn.fi/EHcHwMFjrFvqQGDpgvFmyvlZzcM=/510x318/top/img-s3.ilcdn.fi/1396a7a179f556ef0b7984512557bee5d0a40d3117c19e08e3f0f51bf4dc4418.jpg
2019-04-04T07:27:18.000Z,"Entinen F1-kuljettaja tölväisi Kimi Räikköstä, Sebastian Vettel on saanut entistä kovemman haasteen Ferrarilla: ”Tämä on juuri se syy, miksi Leclerc tuotiin talliin”",Sebastian Vettel on ajautunut tukalaan heti kauden alussa.,https://img.ilcdn.fi/VyHFcpWexiAoV8g6Qfg_MPjpEb0=/510x318/top/img-s3.ilcdn.fi/5d129ee2004fe09c46262b284390a257ec8326314fe680085b293090bfde3337.jpg
2019-04-04T07:31:05.000Z,Kahdeksan vuotta sitten kadonnut teini löytyi USA:ssa - kertoo paenneensa kidnappaajiltaan,”Ette koskaan löydä häntä” luki äidin kirjoittamassa viestissä.,https://img.ilcdn.fi/Fdgen8jMjn0f2XiGyFJ2Q1Xzjeo=/510x318/top/img-s3.ilcdn.fi/068c733889d30dc11d305b4e071d21883553e686d13a65f8018b71efdef0426e.jpg
2019-04-04T07:37:45.000Z,"Vuoden isä Jukka on tehnyt virheitä, joita katuu syvästi: ”Eroissa roolit menevät helposti niin, että lapsi kannattelee vanhempaa”","Ensimmäinen tunne eron jälkeen on riehakas vapaus. Sen jälkeen on aika katsoa peiliin, tietää Jukka, 49. Hän kertoi kokemuksistaan Iltalehden haastattelussa viime keväänä.",https://img.ilcdn.fi/Cv_7OyXS_hKHYV-ckXOp-AQQRoM=/510x318/top/img-s3.ilcdn.fi/4529ebd47cc9520c250c3dcc8df099ac151bc760e2c5c30a3d04a01872769c12.jpg
2019-04-04T07:43:52.000Z,SM-liigan tekemä muutos näkyy - Kärppien maalivahti ottanut jo kaksi erikoista jäähyä: ”Pitää yrittää terästäytyä”,Kärppien Veini Vehviläinen on saanut tämän kevään pudotuspeleissä jo kaksi jäähyä kiekon sulkemisesta.,https://img.ilcdn.fi/8HzetrTe4vOU2Y4pa3LmSJjV_Fg=/510x318/top/img-s3.ilcdn.fi/3dc2122bcf1d566e568872c2debafe2fa7ec4a1e735f765f2102af3f8c3410d6.jpg
2019-04-04T07:50:34.000Z,Katso suorana: valtiovarainministeriö julkistaa arvionsa talouskasvusta - onko meillä miljardeja vai ei?,"Ellei työllisyysaste nouse 75:een prosenttiin, seuraava hallitus joutuu todennäköisesti leikkaamaan rahaa joistakin nykyisistä menoista, jos se haluaa toteuttaa uusia asioita.",https://img.ilcdn.fi/clM7fB_CZlKQ4WpK4IHINgD6nJI=/510x318/top/img-s3.ilcdn.fi/60d1bc94238f80908da0cb0b89a9b08b3cc7053da54b10f23313bcc6b0518fab.jpg
2019-04-04T07:56:44.000Z,Erika Vikman lähti Las Vegasiin - strippiklubi otti heti yhteyttä,Laulaja Erika Vikman on jo pitkään haaveillut Vegasin-reissusta.,https://img.ilcdn.fi/MhDH7RZoxiUHPTn2-zW1HZCSA9Y=/510x318/top/img-s3.ilcdn.fi/65aebdd56f8f561589b86948cd08290895de8c802af09fcb4e9d77dd6b2f09b5.jpg
2019-04-04T08:27:11.000Z,Nousukauden talouskasvu on ohi - valtiovarainministeriön katsaus ennakoi vaikeita hallitusneuvotteluita ikääntyvässä Suomessa,Tällä hetkellä alle 20-vuotiaita suomalaisia on kaksi kertaa enemmän kuin 75 vuotta täyttäneitä. Jo vuonna 2040 näiden ikäryhmien arvioidaan olevan lähes samansuuruiset.,https://img.ilcdn.fi/cFc_JQ68m1zm-90ghvHdtlACV58=/510x318/top/img-s3.ilcdn.fi/fbb538108db70043b56a249ec1f6bc87c62d5379e72066ca14a37a45962196ee.jpg
2019-04-04T08:31:56.000Z,Kolme syytä matkustaa Kroatiaan – lomat alkaen 240 euroa,"Näistä syistä Kroatia on noussut suosikkikohteeksi klassikoiden Kreikan, Espanjan ja Italian rinnalle.",https://img.ilcdn.fi/MP9XPWbkjGcTorThPCZNVHOHb18=/510x318/top/img-s3.ilcdn.fi/bd785fcc4bf25f800f135882af500a965723e62b1dc9400e91b65c316c322a7d.jpg
2019-04-04T08:42:33.000Z,Heath Ledger olisi täyttänyt tänään pyöreät 40 vuotta - lyhyeksi jäänyt elämä päättyi alastomana vuoteeseen,Näyttelijä Heath Ledger olisi tänään torstaina täyttänyt 40 vuotta. ,https://img.ilcdn.fi/q3Lbw1Lt3xevmyFWEJ115COqlCU=/510x318/top/img-s3.ilcdn.fi/9e066bbecd3d9929b91a96222debcbf1f370900bdefc9fb1d2f03df7e8600517.jpg
2019-04-04T08:59:21.000Z,"NHL-tähdet kokivat kauhunhetkiä juhlamatkalla - lentokoneen moottori hajosi: ”he eivät ole varmoja, mikä se oli”",Tämän kauden NHL:ää runkosarjaa dominoinutta Tampa Bay Lighningia kuljettanut lentokone joutui tekemään hätälaskun.,https://img.ilcdn.fi/I3i-AUXOHhMUr5WoYdb5E0yd7ZA=/510x318/top/img-s3.ilcdn.fi/7dda6094fed21fd397b72c35bab8987e6aea119d05ee3b334ee533571646a3fa.jpg
2019-04-04T09:02:49.000Z,"Etiopian lentoturman raportti: Lentäjät toimivat ohjeiden mukaisesti, koneen MCAS-toiminto petti",Lentäjät olivat raportin mukaan harjoitelleet vaaratilanteissa toimimista.,https://img.ilcdn.fi/QePwPcgRyFXXQcLKnBcy35kBpyA=/510x318/top/img-s3.ilcdn.fi/c49992994690e9bade9151e971b408468ca78e0f69cfce0cbcbd806f3a394a10.jpg
2019-04-04T09:05:37.000Z,Game of Thrones -tähdet saapuivat ensi-iltaan aivan erinäköisinä – mitä tukkamuutoksia! ,Hittisarja Game of Thronesin päätöskauden ensi-illassa nähtiin upeita kauneuslookeja - tässä niistä parhaat! ,https://img.ilcdn.fi/oqah_1jMR-B3FLzhpMeyahy3PvA=/510x318/top/img-s3.ilcdn.fi/8eac1ac51ac8a647c7377b0d73295efa7f24276e30c09f374277932b4e02394d.jpg
2019-04-04T09:08:27.000Z,"Nälkäinen herttuatar aloitti perinteen, joka näkyy Suomessakin - afternoon tea on uusi brunssi",Afternoon tea on trendikäs vaihtoehto viikonloppubrunssille. ,https://img.ilcdn.fi/PrIjOnw2irZj9GHpNXDgSNFWrXI=/0x883:2250x2289/510x318/top/img-s3.ilcdn.fi/53e98922689deeab07df5c25414194f9089c694115e148225a8d917225502029.jpg
2019-04-04T09:12:59.000Z,"""Venäläiset liian köyhiä ostaakseen kengät"" - Kreml raivoissaan maan tilastolaitoksen raportista",80 prosentilla kotitalouksia on vaikeuksia pärjätä taloudellisesti.,https://img.ilcdn.fi/nvMRrqaWEa8nw4x6w-yVvJeSjC0=/510x318/top/img-s3.ilcdn.fi/048fbb4f07f7ab05dcb6fa9e592855f0b5108eaf5b83fcbb3467c9b4b49ddb4e.jpg
2019-04-04T09:16:04.000Z,Kruununprinsessa Victoriakin sen osaa – näin onnistuu flossaus prinsessalta,Kruununprinsessa Victoria repäisi työkomennuksellaan tempautuen tanssin vietäväksi.,https://img.ilcdn.fi/QFtoRiHwAAmcdFk9WydzPQTUT34=/510x318/top/img-s3.ilcdn.fi/59f3efd3640a04c062f28e6a86ef90b386c4e9beb72d116998c97468e7c279cc.jpg
2019-04-04T09:23:44.000Z,Muistatko? Puolustajajätin kuittailut Patrik Laineelle päätyivät kiusallisesti - muistelee nyt SM-liigan finaaleita: ”Nuoruuden höntyilyä”,HPK kerää hedelmiä pelaajien pitkästä kehitystyöstä. Välieräsarjassa dynastia-Tapparaa vastaan pelaajat yrittävät saada virheet minimiin.,https://img.ilcdn.fi/5Ud-PJS-HARuFhkqpT_qLaLvyP0=/510x318/top/img-s3.ilcdn.fi/172e0580ccf6af0b15c372dd95b517f1b93e7a543654e2051f590a86d5d29dea.jpg
2019-04-04T09:26:55.000Z,"Me Naiset: Kalastajan vaimo löysi rikkaan lääkärin - jäätävät välit kalastajamieheen, avioliitto vielä voimassa","Tuoreessa Me Naiset -lehdessä paljastuu, että suosikkibloggari Johanna Alvestad on jo löytänyt uuden miehen, vaikka on yhä naimisissa.",https://img.ilcdn.fi/gnQTRVPcGcGnlcxUjyuKYujSzYE=/510x318/top/img-s3.ilcdn.fi/e592182012dd1130eb63847f476cfd73f4238dd92a05e98aaff847351dc94ef4.jpg
2019-04-04T09:43:59.000Z,Paavo Väyrysen tähtiliike ei tarkistanut ehdokkaiden taustoja käytännössä lainkaan: ”Se on mahdoton tehtävä”,"Tähtiliikkeen eduskuntaryhmän pääsihteeri Harri Lindell myöntää, ettei 18 rikoksesta tuomittua ehdokasta näytä puolueen kannalta hyvältä.",https://img.ilcdn.fi/owuvBJpLAhLv5kk01cwdlWt3XmI=/510x318/top/img-s3.ilcdn.fi/60919d4049e37f56443a0108291c86efe0c6410e5ded4f7443233f7c3da7b595.jpg
2019-04-04T09:46:24.000Z,"Mick Schumacher intoili F1-testistään, lipsautti samalla mielenkiintoista tietoa Ferrarin moottorista",Nykyiset F1-moottorit ovat sääntömuutoksista huolimatta taas 1 000 hevosvoiman tuntumassa – mahdollisesti jopa sen paremmalla puolen.,https://img.ilcdn.fi/j87rveim7_fEGU-vVUz6I4w_BZE=/0x105:3000x1981/510x318/top/img-s3.ilcdn.fi/c3a00f60e4887d16cc275b5f0f93323b839711d9d0be0327dbff57687902b58c.jpg
2019-04-04T09:47:48.000Z,Petteri Orpo: Donald Trumpin ja Kiinan kalistelu sekä Italian populistit uhkaavat päättää lujan menon - työperäinen maahanmuutto vastalääkkeeksi,Orpon mielestä seuraavan hallituksen on yritettävä nostaa työllisyysaste 75 prosenttiin. Kokoomuksen puheenjohtaja vaatii paikallisen sopimisen ja työperäisen maahanmuuton merkittävää lisäämistä.,https://img.ilcdn.fi/hWE2iW8h2L570P8O6PudqGqXmV8=/510x318/top/img-s3.ilcdn.fi/14e5760971ee847cd71e2de524a6cd6a2dd24c25cfc3e2a25bc4d188835522d5.jpg
2019-04-04T09:52:10.000Z,"Airbusin toimitusjohtaja jää eläkkeelle vaan ei tyhjin käsin, saa 38 miljoonan euron kultaisen kädenpuristuksen - Ranskan valtiovarainministeri: ”Kohtuutonta” ",Airbusin toimitusjohtaja Tom Enders kuittaa liki 38 miljoonan euron potin jäädessään eläkkeelle.,https://img.ilcdn.fi/5pXRjK1F8Tepaw7-yg-gNKg8i6c=/510x318/top/img-s3.ilcdn.fi/69613e4a45805e350d698c896467a42310ec9f78a8eb5a17e486c0fc5e4960ba.jpg
2019-04-04T10:07:55.000Z,IL-TV: Mistä ehdokkaiden paljastuneet tuomiomäärät kertovat?,Iltalehden jättiselvitys paljasti eduskuntavaaleissa ehdolla olevien tuoreet rikostuomiot.,https://img.ilcdn.fi/FpzHE-Tu1Z3a7AnlVVtzFEgVT9M=/510x318/top/img-s3.ilcdn.fi/adea6be1d3359dd496d73a91bcaa06bd75d522301034c2c008082b8689872901.jpg
2019-04-04T10:15:25.000Z,"Lastenvaatteet, jotka kasvavat pituutta! Nämä viisi keksintöä muuttavat muotia",H&M Foundation on jakanut miljoona euroa apurahaa viidelle erilaiselle muotia muuttavalle ekokeksinnölle.,https://img.ilcdn.fi/I7w8mLKe8Qa2CrXZQV2ApScH2dQ=/510x318/top/img-s3.ilcdn.fi/1b490b202c4aa81cfc42e6dc879b6966afff61af0a9c8ca5012e1716b7f044d5.jpg
2019-04-04T10:28:35.000Z,Piraattipuolueen ehdokas antoi nuoruudessaan itse itsensä ilmi poliisille - tuomittiin törkeästä huumerikoksesta,Piraattipuolueen Lapin ehdokkaan rikoksesta on jo aikaa. Teko oli kuitenkin törkeä ja vankila hyvin lähellä.,https://img.ilcdn.fi/IhAmYnh0Cozn2cQtAYpRBvWGvhQ=/510x318/top/img-s3.ilcdn.fi/9cf329abdb2ff52bdebd1ef40fa77393c6d7b9c801cd6fc9afcb13225db5c792.jpg
2019-04-04T10:31:06.000Z,Jihadismi Suomessa:  Suomesta lähdetty konfliktialueille poikkeuksellisen innokkaasti,"Jihadistinen liikehdintä Suomessa on toistaiseksi vähäistä. Tuoreen tutkimuksen mukaan Suomesta konfliktialueille lähtevien määrä on kuitenkin korkea, kun se suhteutetaan maan väkilukuun.",https://img.ilcdn.fi/uKqgaqisE7kLzJTRNOIkgJNFZ20=/510x318/top/img-s3.ilcdn.fi/4aa959e05ead9974f4a11010746b258b3abaeb42ea6f5321b72427483ca6934a.jpg
2019-04-04T10:32:35.000Z,Vain yhden miehen kompurointi voi kaataa Tapparan - kirvesrinnoilla iso etu Hakametsässä,Liigan toinen välieräsarja Tappara-HPK alkaa tänään. Tasaisessa taistelussa kotietu noussee ratkaisevan rooliin.,https://img.ilcdn.fi/l5-2O95XhGqwimccLNTx232BeAc=/510x318/top/img-s3.ilcdn.fi/35b9445e43d0d8c5523bdab61013c98a326021213a5adc19cf29db0749ccc007.jpg
2019-04-04T10:42:38.000Z,TIS: Iiro selittelee tekemisiään: ”Olen nukkunut ex-vaimon parhaan kaverinkin kanssa lusikassa”,Temptation Island Suomessa jatketaan treffailua.,https://img.ilcdn.fi/D6dM-kKDF98EhbY_rbE8JY_hjiU=/510x318/top/img-s3.ilcdn.fi/52e4cfb4bfe206de1a1d0e7a91b44c8bdedeb896d0786bbb57b5dd2b8afbb16a.jpg
2019-04-04T10:46:50.000Z,Uuden-Seelannin iskuista epäillylle useita syytteitä: 50 murhaa ja 39 murhan yritystä,Uusia syytteitä saatetaan nostaa lähitulevaisuudessa.,https://img.ilcdn.fi/Ir_CTJdrlLR6AK0A0_6wC_cSBDA=/510x318/top/img-s3.ilcdn.fi/327b351a2ec993e85c6a8e86fd89b39c5cc813bc233a03a0b1b1c0bfd864524f.jpg
2019-04-04T10:47:44.000Z,KalPa hankki kaksi uutta veskaria - Eero Kilpeläinen valittu Liigan parhaaksi,KalPa vahvistuu kahdella uudella maalivahdilla.,https://img.ilcdn.fi/QBE0LlzJeQdqmAMWEfzhGh1dnZA=/510x318/top/img-s3.ilcdn.fi/29526a4cd56a3aceef30777a7105f942db68f189c1996b8c34243cc80adf469c.jpg
2019-04-04T11:07:32.000Z,TIS-kohupari Janne ja Jonna seksihuhujen pyörteessä – kertovat nyt totuuden saaren tapahtumista,Janne vaihtoi Tian Temppareissa lennossa Jonnaan.,https://img.ilcdn.fi/reTu5GnM4s7-gMy_PIZtZFWW8gQ=/510x318/top/img-s3.ilcdn.fi/990fe0538ac892d07a64ff332903cb3ad8010121c92ac629fa71a46446c58f05.jpg
2019-04-04T11:09:49.000Z,Conor McGregor kommentoi hääkuvaa törkeällä tavalla - raju vastaus pamahti: ”Oikeus löytää sinut”,Habib Nurmagomedov vastasi Conor McGregorille. Irlantilainen otti jatkoviestissään sovittelevan sävyn. ,https://img.ilcdn.fi/awqp8ynkX2WWYCqr9U6FLmP3YZU=/510x318/top/img-s3.ilcdn.fi/56d6ade51b79610524b85cd79563eee0f6290f6d975bd83ea742ebb8d0c0e2fe.jpg
2019-04-04T11:18:00.000Z,Tutkimus: Muovipussi onkin kauppakasseista ympäristöystävällisin,Tanskan ympäristöviranomaisten tutkimus haastaa käsitystä muovipussista kauppakassien pahiksena.,https://img.ilcdn.fi/pjetfmvBRKtp5GXXLvmnSnoPSgQ=/510x318/top/img-s3.ilcdn.fi/307691c1b7117cc14f439d25a01c6fcb12c711ce1a8e4b9481a9be1b1304ac13.jpg
2019-04-04T11:22:23.000Z,Lihamakaronilaatikon haastaja on tässä - chileläinen hittiruoka sopii suomalaiseen makuun,"Mitä siitä tulee, kun samaan ruokaan yhdistää jauhelihan, kananmunan, rusinat ja maissia? Tietenkin seuraava hittiruoka.",https://img.ilcdn.fi/fxekrhJR3dfhECJ7_KE3wVI7yL0=/510x318/top/img-s3.ilcdn.fi/377256b6500013230ead918605a70c1612d69cf91fb70d115c04f0c4b0941290.jpg
2019-04-04T11:25:11.000Z,Kevään trendikkäin hankinta: Sähköpotkulaudat valtasivat kadut – näin varmistat ettet maksa liikaa,"Haluatko hankkia kevään vauhdikkaimman menopelin? Vertaa ensin hintoja, sillä voit säästää jopa satasia.",https://img.ilcdn.fi/7lxY9HT6-Ul60BUGFZN1LuiJuVw=/510x318/top/img-s3.ilcdn.fi/03e8d4d42e02327fbf9d2ff7d81562da1c0276b27e2e46364a558fb90929147f.jpg
2019-04-04T11:31:53.000Z,Poliisi jatkaa alaikäisiin kohdistuneiden seksuaalirikosten tutkintaa Tampereella - toistaiseksi ketään ei ole otettu kiinni,"Virkavalta ei tämänhetkisten tietojen nojalla epäile, että tapaukset liittyisivät toisiinsa.",NULL
2019-04-04T11:35:06.000Z,Kanariansaarten rannoille huuhtoutunut kuolleita lehmiä ,Ainakin kolme lehmän ruhoa on löytynyt ajautuneena Kanariansaarten rannoille viikon aikana.,https://img.ilcdn.fi/CRFWdVX2p1hTjERJTGflShZTlJ8=/510x318/top/img-s3.ilcdn.fi/10d2c42cf21d477daac584dc6369292b3afa2fc02884008d1b43ae0cacf4ced2.jpg
2019-04-04T11:36:35.000Z,"
Suomalaisten suosimalla lomasaarella valtava vesipatsas - katso turistin kuvaama video","Gran Canarialla kalastusretkellä mukana olleen Richard Sharpin retki sai kiinnostavan lisän, kun  veneen eteen nousi valtava vesipatsas. ",https://img.ilcdn.fi/p9qrEMJfvBv9KWEIKyCiYe6b3ao=/510x318/top/img-s3.ilcdn.fi/70c384527d6250585e104b3954bdc7baa8d2e2ad410e263d94459637a10f0104.jpg
2019-04-04T11:43:40.000Z,Jyrki Järvilehto myy upeaa funkkiskotiaan - hintapyyntö lähes kaksi miljoonaa euroa: Katso kuvat,"Jyrki ja Satu Järvilehto erosivat syksyllä, nyt Westendissä sijaitseva 255 neliön kokoinen paritalo on tullut myyntiin. ",https://img.ilcdn.fi/DrIRsS_kQTBFqi00dAx_32aoGg0=/510x318/top/img-s3.ilcdn.fi/8065a7b2166d1cd05d7a7351f10adb9dee50e27b22b75ad4bf09fcea48e8ad8b.jpg
2019-04-04T11:56:07.000Z,Jääkiekon superkaksoset Jocelyne ja Monique synnyttivät lähes samaan aikaan - Suomi kohtaa repaleisen olympiavoittajan: ”He eivät ole treenanneet niin paljon”,NULL,https://img.ilcdn.fi/lYTUd0BPaWZ2m890yVV0blxiYFg=/510x318/top/img-s3.ilcdn.fi/2c0672791e143a7fb45d867620f72bc9e63e6e0ecad3cb4b54dc7d6a02a5bcc6.jpg
2019-04-04T12:03:36.000Z,Riisuttu puoluetentti: Näin Petteri Orpo kommentoi kokoomuksen rikostaustaisia ehdokkaita,Kokoomuksen puheenjohtaja Petteri Orpo osallistui IL-TV:n Riisuttuun puoluetenttiin torstaina.,https://img.ilcdn.fi/BdBIyQa_7RTrsgQWuu_s-AoTuHk=/510x318/top/img-s3.ilcdn.fi/c68a460df130b2ba7fa0512cbd2fb55acd98f8f31e1bdd5fb8a89302d67b9ed3.jpg
2019-04-04T12:14:30.000Z,Kaksi lasten turvakaukaloa osoittautui testeissä vaarallisiksi – lopeta käyttö heti,"Törmäyksessä kaukalon turvavyön alaosa repesi irti kiinnikkeistään, turvavyön solki osui nukkea päähän ja nukke lensi pois istuimesta.",https://img.ilcdn.fi/tWF54R8IrPOCn_bjseb3XeJ95ZM=/510x318/top/img-s3.ilcdn.fi/09b639c0a40be278fa264a3d55fb0fa0be94b132d367b04893f49d223660068d.jpg
2019-04-04T12:17:44.000Z,"Mailis Penttilä rohkea veto - julkaisi meikittömän kuvan, innostui itsekin: ”Näyttää hyvältä!”",Missikaunotar Mailis Penttilä irrotti silmäripsensä ja päätti julkaista kuvan. ,https://img.ilcdn.fi/TW3B2SXhZIoT_f6Rhqs-sVHW7Iw=/510x318/top/img-s3.ilcdn.fi/801a3c7f67af1f565c15e31488ad9211c24e106e088fd75310a821f9afbded8e.jpg
2019-04-04T12:26:32.000Z,Suomi tipahti yhden sijan Fifa-rankingissa – kärkikolmikko säilyi ennallaan,Suomi on tuoreimmassa Fifa-rankingissa sijalla 60.,https://img.ilcdn.fi/GuHcYxYqz_pnC0v24zS-joVQeFI=/0x19:3000x1895/510x318/top/img-s3.ilcdn.fi/6e0231371fe2c3a9458d13b44110d00912d30a9524d4c3c99a81bdcdd2a160df.jpg
2019-04-04T12:29:09.000Z,Autokauppa hoituu nyt kokonaan kännykällä – kauppakirja tallennetaan samalla automaattisesti,"Suomessa on lanseerattu uusi palvelu, jonka avulla yksityishenkilöillä on mahdollisuus hoitaa ajoneuvokaupat alusta loppuun asti verkossa. ",https://img.ilcdn.fi/lblJKUDWqcX7JpeKTU-YqnpVXT4=/510x318/top/img-s3.ilcdn.fi/747c5865fce787bc9fc59524715ff9b8d8b058d911b45ae5be1584cf38ed02fe.jpg
2019-04-04T12:40:48.000Z,"Varapääministeri jäi nolosti kiinni pettämisestä:  Ex-vaimo ei jäänyt rannalle ruikuttamaan, treenasi itsensä huimaan kuntoon - nimettiin kostokehoksi: ”Minulla oli kaksi vaihtoehtoa”",Natalie Joycen muodonmuutosta ihastellaan Australiassa.,https://img.ilcdn.fi/cF0Wdd7gcMgeAp-9l5ZptHQWC50=/510x318/top/img-s3.ilcdn.fi/daa95426c19d8ee1f134a0be4ec2005298fb74c2a61857b3e9f46bc08464a648.jpg
2019-04-04T12:42:33.000Z,Nopeusvalvontamaratonin karu tulos: yli 5 500 ajoi ylinopeutta - ”Liikaahan se on”,Vuoden takaiseen nopeusvalvontamaratoniin verrattuna kiinni jääneiden määrä kasvoi lähes neljällä sadalla.,https://img.ilcdn.fi/EVTl9ZOPlE61UNakSVlQKPWRlA4=/510x318/top/img-s3.ilcdn.fi/4c2eccfa1019f14c8ff45fd0ce54789fdbe030e62f056734c5d9402cb8ce1645.jpg
2019-04-04T12:43:14.000Z,Video: Mies varasti moottorisahan housuissaan USA:ssa ,"Valvontakameralle tallentui, kuinka mies tunki ison moottorisahan pöksyihinsä. Tämä varkaus on vaatinut hieman viitseliäisyyttä.",https://img.ilcdn.fi/HQa5RUQ7Vl3ahv9w23-UdkneJ1U=/510x318/top/img-s3.ilcdn.fi/a74fc3005e018f7d69b2fa209c31743d489168c47b6a7e4b8149461a9933f56e.jpg
2019-04-04T12:47:20.000Z,Petteri Orpo: ”Ay-liike tulee liian usein eduskunnan tontille”,"Kokoomuksen puheenjohtaja Petteri Orpo osallistui Iltalehden Riisuttuun puoluetenttiin torstaina 4. huhtikuuta. Ay-liikkeen lisäksi puhe oli mm. maahanmuutosta, taloudesta, työllisyydestä ja sotesta.",https://img.ilcdn.fi/DK6VcO7v4FS5Ek4lDNwKRVkY7BY=/510x318/top/img-s3.ilcdn.fi/cb03753d9e790dea7062c1d2984c04bfcddc5ce6b93276b7291070daed71f5ef.png
2019-04-04T13:00:00.000Z,Uusi jättimäinen Facebook-vuoto: vapaa pääsy satoihin miljooniin käyttäjätietoihin,"Facebook painii uuden tietovuotoskandaalin kanssa, mikä ei johdu tällä kertaa suoraan yhtiöstä itsestään.",https://img.ilcdn.fi/NXh3h1z1aXN_YDcCsBGoAi5SZeU=/510x318/top/img-s3.ilcdn.fi/b8747ab50e343ba4433bb78e1055f7e48b599062061fad7146781dddeb15f735.jpg
2019-04-04T13:10:15.000Z,Kuvat: Ferrari-fanin uskomaton F1-kokoelma huutokaupataan Australiassa – ”En ole eläessäni nähnyt vastaavaa”,Australian Hurstvillessä huutokaupataan tässä kuussa valtava F1-kokoelma.,https://img.ilcdn.fi/3EkdGzTfeaTwqNMbl6bUNYtQLyM=/23x0:2982x1849/510x318/top/img-s3.ilcdn.fi/a4584117598488fbb70ccfb1e998038a1bd99826a1b725f8ca407c4415b56669.jpg
2019-04-04T13:17:17.000Z,"Vantaalainen kotiäiti Olivia, 22, etsii miestä Napakympistä – Janne Kataja flirttailee neiti X:n äidille: ”Olisi kiva tutustua”",Vaipanvaihtoa harrastava kotiäiti istahtaa neiti X:n paikalle illan Napakympissä.,https://img.ilcdn.fi/Mya2oFWHRR8latOfbBBooIhX5l0=/510x318/top/img-s3.ilcdn.fi/cb6890dee4f5aa662ecc832a738f48687e67ad249810bc4d0c742227c66d58d8.jpg
2019-04-04T13:21:02.000Z,Venäläinen vakoilukone lensi tarkkailulennon huippusalaisen Alue 51:n yli Nevadassa,Area 51 on Yhdysvaltojen kaikkein salaisin ilmavoimien koealue.,https://img.ilcdn.fi/8GLwu4K3OIHgSQXp3UE7G6WUC7A=/510x318/top/img-s3.ilcdn.fi/4cf517a63da9be846dc9778bdf241c670c269ee06dbc1a1d5f152aa0d8c221d5.jpg
2019-04-04T13:36:10.000Z,"Norjalaispeluri jatkaa KooKoossa – ”Saamme taistelijan, joka antaa kaikkensa”",Norjalaispuolustaja Alexander Bonsaksen jatkaa uraansa KooKoossa.,https://img.ilcdn.fi/qKkETNpBWpanj8miQfMjucI2oRY=/0x0:3000x1876/510x318/top/img-s3.ilcdn.fi/e8336257e4e8155c2ecf137349472c10a3e0803c7cfbeaa9a7a1c699ff00809c.jpg
2019-04-04T13:47:12.000Z,Mies auttoi sairaan vaimonsa eutanasiassa ja videoi teon Espanjassa - poliisi pidätti,Pariskunta kyllästyi Espanjan eutanasiaa koskevaan lainsäädäntöön.,https://img.ilcdn.fi/u6WawFUAwCvECuKR03dJl2pduys=/510x318/top/img-s3.ilcdn.fi/80f376041d690841e3c5ff2627a54b5bdb077907372503356fabea2ac0726d17.jpg
2019-04-04T13:52:10.000Z,"Sinisten ehdokas teetätti virolaisilla työntekijöillään yli 13 tunnin päiviä ilman lomia, pakotti yhden työntekijän yrityksensä hallitukseen",Iltalehti kävi läpi kaikkien eduskuntavaaliehdokkaiden rikostuomiot. Sinisten ehdokas Markku Siitari on tuomittu useista yritystoimintaan liittyvistä rikoksista.,https://img.ilcdn.fi/tvKQtSmqOqTHjVJFVgRkSTzs6GY=/510x318/top/img-s3.ilcdn.fi/0d5c9ed1a389fecf9bcf909d3ee5c0a46900e54e5ee4795d8efad2f94ae5b00b.jpg
2019-04-04T13:54:33.000Z,"Jää petti pilkkijöiden alta Pyhtäällä – makoilivat kylmissään jäälautalla puoli tuntia, sitten helikopteri haki pois","Jää oli niin huteraa, etteivät miehet uskaltaneet yrittää tulla sitä pitkin takaisin rantaa.",https://img.ilcdn.fi/x--5Q-Hk87RQE5vhEp-tye0NwfM=/510x318/top/img-s3.ilcdn.fi/74a1ecc9148315a62a4573f1f4cd2f3e27c292bd2ee80d466d89d0c6d8ceaf6c.jpg
2019-04-04T14:06:53.000Z,"Kaksi päätä, neljä kättä, yhdet jalat – maailmankuulut siamilaiset kaksoset täyttivät 18 vuotta",Mediassa on seurattu kaksosia tasaisen epätasaisin väliajoin vuodesta 2014 lähtien.,https://img.ilcdn.fi/9fGdngBXsxTYi1soa-f6iiExyMQ=/510x318/top/img-s3.ilcdn.fi/148fc4ce093551330616675bbf58f1ea4976da247282aa6540520f95ce78cbcc.png
2019-04-04T14:12:45.000Z,17-vuotias nuorukainen pelasti veikkausliigaseuran kauden avauksen: sai valmentajalta mahtavan yksinkertaisen ohjeen - ”Vähän jännitti”,Rovaniemen Palloseuran liiga-avaus oli hämmästyttävä. ,https://img.ilcdn.fi/meHounazvLN5lIdNh-YEqqN8bIE=/510x318/top/img-s3.ilcdn.fi/7156b2a043933a35a003675ad78afb58e7b7d5f4783d6d28e1c7897cd3f7d9ff.jpg
2019-04-04T14:13:11.000Z,Prinssiveljesten hajurako kasvaa – Meghanin ja Harryn oma Instagram-tili korostaa perheiden erillisyyttä,Williamin ja Harryn perheiden elämät tulevat poikkeamaan toisistaan. Harrylla on mahdollisuus veljeään vapaampaan arkeen ja se tullee näkymään myös Instagramissa. ,https://img.ilcdn.fi/_PZcWLz-IfCmCTy-KWujYvU3CGI=/510x318/top/img-s3.ilcdn.fi/558f88fcc07c04c073b4122b63549393a1a4f1e5b47cdbc5f2b8a0c8c6a467b9.jpg
