paivamaara,otsikko,tiivistelma,kuva,id
2022-09-15T10:00:21.000Z,Eeva Kalli nousee keskustan eduskuntaryhmän puheenjohtajaksi ,Keskustan eduskuntaryhmä valitsee torstaina uudeksi puheenjohtajakseen kansanedustaja Eeva Kallin.,https://img.ilcdn.fi/nDrF_oq0bDMq44gFMSIq7jDveyI=/510x318/top/img-s3.ilcdn.fi/ef7aa6a18f97edd238c7e547d102aef5bff9b70351a4a9f7f592dff12128d409.jpg,DF241B22BF384F90BAE6FEE41A05C5CA
2022-09-15T10:15:41.000Z,Lukko hankki kanadalaishyökkääjän Pohjois-Amerikasta,Gabriel Fontaine ei ole vielä kokeillut siipiään Euroopassa.,https://img.ilcdn.fi/6vT1e2VhZ4ktTkXOBUSycyc7tII=/510x318/top/img-s3.ilcdn.fi/31af68042855042f1b26620c58e60c7b61e9a0b3f050b52a6b443cb35e9b2b3c.jpg,824C5CBD0E4C420CA807CE364E69E220
2022-09-15T10:17:01.000Z,Tyylikäs täyssähköinen farmari tulee Peugeotilta – yli 400 km latauksella,Peugeot e-308 tulee tarjolle sekä farmarina että viistoperänä. Konsernin sähkövoimalinjaa on hiottu energiatehokkuus mielessä.,https://img.ilcdn.fi/CB23tjlG0wrhveMMh0l3KKyfBTE=/278x120:2742x1667/510x318/top/img-s3.ilcdn.fi/1e142b8c30b47a759e6f7cda34d3fdb8c33a9f06dace9b7263c125174eb08b30.jpg,B0370D58111A4BF1BC024F09B26E55D3
2022-09-15T10:17:58.000Z,Nämä valtionjohtajat on kutsuttu Elisabetin hautajaisiin ,Elisabetin hautajaisiin Lontooseen on osallistumassa yli kaksikymmentä valtion johtajaa ympäri maailmaa. ,https://img.ilcdn.fi/tl-PzD51tjGth1NRkmtV6DB3rvU=/510x318/top/img-s3.ilcdn.fi/85cab196ceccff1dac15521c60272ae81a6737748dc4e1bd70fddce67373a3e2.jpg,02303D619F4B45718CA9E3410E802B6F
2022-09-15T10:42:23.000Z,Tämä rakennus on nähtävyys! Kiero pilvenpiirtäjä kummastuttaa Kiinassa,Kiinalaisesta tornitalosta haluttiinkin tehdä maamerkki.,https://img.ilcdn.fi/h-U1VSzrBzcXsbqqJpNs6l1QZ2Y=/510x318/top/img-s3.ilcdn.fi/1db37eb5f064e3fd14ba8f300b8332320b91987e43c57333bcecfd5a4fafb6b5.jpg,E40DA71E15134E9694C86298EC5FB063
2022-09-15T10:43:03.000Z,Eurooppa-liigassa hauska tilanne: AS Roma pakkovoiton edessä HJK:ta vastaan ,HJK pääsee tänään haastamaan huippujoukkue AS Roman psykologisesti edullisista asetelmista.,https://img.ilcdn.fi/T9PNR_GnyLBShGnuDhi2Fy4-H0o=/510x318/top/img-s3.ilcdn.fi/353a7330d3858ab8c2bf7da50925040e416687939e83360bc3b2b0128bb085e7.jpg,3F3E59FE46EA4A5A9076A6C272C3E68F
2022-09-15T10:45:52.000Z,Näin Ruotsi saa uuden oikeistohallituksen – tekeekö ex-pääministeri yllätyspaluun politiikkaan?,Uusi hallitus voi olla kasassa parhaimmillaan jo ennen kuunvaihdetta.,https://img.ilcdn.fi/oxHmiuq-2BxAmhWeXauACfQP7TQ=/510x318/top/img-s3.ilcdn.fi/d9ae987f26b7ebfeca99942345facc3ee3eb7da9f0ff74dba69ad656aabeb8b6.jpg,5C8EC260DEE8483D9A9988D0CE14367B
2022-09-15T10:51:48.000Z,Kuningattaren arkulle yli viiden kilometrin jono ,Sadat tuhannet ihmiset ovat halukkaita jättämään kuningatar Elisabetille viimeiset jäähyväiset. ,https://img.ilcdn.fi/v1W9WMSqFJ1_WzGDjIWTFJHv9kI=/510x318/top/img-s3.ilcdn.fi/b9aa6d7b662bb8747c44243af6476f5031a28902f8fa37db563009211fb9fc38.jpg,16DDFDE0E2804D0A9119DAF1BDB235FA
2022-09-15T11:16:30.000Z,Yle: Venäläisturisteilla väärennettyjä rekisterikilpiä – pelkäävät autoihin kohdistuvaa ilkivaltaa,"Venäläisautoilijat ovat huolissaan siitä, miten heihin suhtaudutaan ulkomailla, kertoo Yle.",https://img.ilcdn.fi/7Fa18N9zm5EClp6hSEVLL19m5UM=/510x318/top/img-s3.ilcdn.fi/30a417342e3eb65a25c10f9438d5ab29b1b49b1f9178e34899f3f5f828a84137.jpg,0ED3B8E514304B32A3E58DE65734C785
2022-09-15T11:27:10.000Z,Ensimmäinen kerta Vain elämää -historiassa: Leri Leskistä ei nähdä televisiossa,Vain elämää -ohjelman uuden kauden ensimmäisessä artistijaksossa kapellimestari Leri Leskinen loistaa poissaolollaan.,https://img.ilcdn.fi/I5ngqFm8z2IU2A_7w0hw3G24bvQ=/510x318/top/img-s3.ilcdn.fi/c2d8e83b0562c3bdc6b641a202f6bb05b6562f4d2d4da6d0e8272c0787cebe60.png,DA9F3A7761674C5EA2FF6B0CA0D303E4
2022-09-15T11:28:14.000Z,Eläkeläismiehen tilit tyhjennettiin yöunien aikana – rikolliset veivät iäkkään äidin arkkurahatkin,"Aiemmin tullut ilmoitus olisi voinut estää tapahtumasarjan, joka johti 37 000 euron huijaukseen.",https://img.ilcdn.fi/Jp17kIHecyV97gztIGth9QHKfAk=/510x318/top/img-s3.ilcdn.fi/ccc6110f5cdbab0767f503be605c09996e517caff3eb8fdf80cfaabddca81a7c.jpg,54309E971CDA440CADD0F0D1AC9C8849
2022-09-15T11:33:27.000Z,Johan Hägerströmin murhamysteeri: tällaista puhelinta poliisi etsii nyt,"KRP kaipaa vihjeitä kadonneesta puhelimesta, joka on päätynyt Mustioon.",https://img.ilcdn.fi/X-2cuJ_pLsm9GjUcbUdzTHB6br8=/510x318/top/img-s3.ilcdn.fi/e2456513c1d1dd01647881bb3d0a73338aaad5e168af123e55febce91d8a0af6.jpg,A29A7CDD23D2425BA4039F6BEA3B5AE1
2022-09-15T11:36:01.000Z,Francesco Totti syyttää ex-vaimoaan härskistä toiminnasta kesken surutyön: ”Meni tyhjentämään tallelokeron”,Francesco Totti avautui eroon päättyneen liittonsa käänteistä. ,https://img.ilcdn.fi/F9IZDJtTja2A9hlyBhZBg78BR4Y=/510x318/top/img-s3.ilcdn.fi/67e9d222121a00d0154dd408002f48dc774bd65252af461676eb839c962681b5.jpg,BF9E9ABC1F6143B5A5F560EF54E7848B
2022-09-15T11:44:37.000Z,Potilasturvallisuuskriisin ydin hämärän peitossa: Mitä muutoksia vasemmistoliitto vaatii?,"Muissa hallituspuolueissa on ollut epäselvyyttä siitä, mitä muutoksia vasemmistoliitto haluaa potilasturvallisuuslakiin.",https://img.ilcdn.fi/UNLDcU3IxcE8DeuZ89CWzju0T9c=/510x318/top/img-s3.ilcdn.fi/de9f741875178bbaa7eab817d6968da4b5fdf1554781cf3f5d4dd7eff694de0d.jpg,FFF65F0600EE4F2C982A6133F7079D26
2022-09-15T11:49:02.000Z,Tilanne on herkkä -valtakunnansovittelijakaan ei kommentoi hoitoalan neuvottelutilannetta,Hoitajajärjestöt ja Kuntatyönantajat jatkavat neuvotteluita taas maanantaiaamuna.,https://img.ilcdn.fi/lbG2XGnVJ7HeAgZkFo7QBTbILVg=/510x318/top/img-s3.ilcdn.fi/fab5fd962b58bd08a5e6abb1bbeae2f52ea51ce5c949fe3a8918a20aa276ff58.jpg,1E0D3996B9F74FAEB24BBB20EE1AEC54
2022-09-15T11:54:13.000Z,Putin kiitteli Kiinaa ”tasapuolisesta suhtautumisesta” Ukrainan sotaan,Venäjän ja Kiinan presidentit kohtasivat ensimmäistä kertaa Ukrainan sodan alkamisen jälkeen.,https://img.ilcdn.fi/30G7l1HcQR6UsENQPsP87TmoUBI=/510x318/top/img-s3.ilcdn.fi/ba88289b6d4e9775e940f697dee96e5916c14b5cc2fa789f2443176b29ed0604.jpg,6BB6E4600ACC49FCB1BE19866F379C9C
2022-09-15T11:54:14.000Z,Vesa-Matti Loirille kunnianosoitus: Saa oman kunniatuolin elokuvateatteriin,Helsinkiläinen Cinema Orion -elokuvateatteri muistaa edesmennyttä Vesa-Matti Loiria omalla kunniatuolilla.,https://img.ilcdn.fi/GQe87ONrJGo8LwH20k_OYwcpdFI=/510x318/top/img-s3.ilcdn.fi/3a876fd4f3e009ba639c10ffcd32219a2f73c1417b4083ec3f5b5a2f1d34765d.jpg,E9E552EA22BE4E9BB00AE9ACF79EC927
2022-09-15T12:07:07.000Z,"Pöytyän kunta kommentoi kuolintapausta: työvoimaa oli tarpeeksi, vaikka asunnolla ei käyty viikkoon","Poliisi tutkii tapausta, jossa iäkäs pariskunta jäi viikoksi kotiin, vaikka kotihoidon piti käydä paikalla. Pariskunnasta toinen osapuoli löytyi kuolleena ja toinen huonossa kunnossa.",https://img.ilcdn.fi/KBA2z-B1descfMpXkKzjEQv7aV8=/510x318/top/img-s3.ilcdn.fi/3b9c59632e5e8a9019b75c1a67dc50a55dbf458d32b94d98302d61a54a07da25.jpg,E701A53991634E04BC3EF549C1335853
2022-09-15T12:07:11.000Z,Kirjaväite: Annika Metsäketo torjui MTV:n ex-ohjelmajohtajan illalliskutsun – menetti mahdollisen työtarjouksen,Annika Metsäketo muistelee uutuuskirjassa uraansa televisiossa.,https://img.ilcdn.fi/oi5CmTfizQRDBh3GznPlL7c0gcY=/510x318/top/img-s3.ilcdn.fi/d9a187b47f5fb1905e3b95673a0e2567a03d00056aa8b65e00be904f6b9e3951.jpg,0F169CCC8A3F4F609D70AAC52F0EA641
2022-09-15T12:09:59.000Z,"Vaarallinen ilmiö Varsinais-Suomessa: Alakoululaisten polkupyöriä sabotoitu, poliisi jyrähtää",Polkupyörän etupyörän kiinnityksen löysääjä syyllistyy mahdollisesti rikokseen.,https://img.ilcdn.fi/O4xvb6YCt9_za9cgI76ZIm27zug=/510x318/top/img-s3.ilcdn.fi/7cdc16c30482f67fe35891dd53b08364d56d23a086d56d2300f28e4178031574.jpg,09B7ED0B0A2A4D5489215FB41A457A39
2022-09-15T12:14:47.000Z,Sähköyhtiö lisäsi määräaikaisiin sopimuksiin uuden maksun – asiasta ryhmävalitus,"KKV:n tiedossa ei ole, että mikään muu sähköyhtiö olisi lisännyt datahub-maksuja määräaikaisiin sähkösopimuksiin.",https://img.ilcdn.fi/RmV-muOM3sGcxvGidepKxa_-QxQ=/510x318/top/img-s3.ilcdn.fi/a7ed1305eb3cec693b964fe23fa3126fb3f5988abc0015324ca8f4273f474480.jpg,11292C4602BE43C1A0FA706DDC0CD4AE
2022-09-15T12:18:14.000Z,"”Pakkolaki” yhä tulossa – Marin: ”Arvio on, että lainsäädäntö on edelleen välttämätön”",Pääministerin mukaan potilasturvallisuuslakia tarvitaan edelleen hoitajien tulevien työtaistelutoimien vuoksi.,https://img.ilcdn.fi/51OxDCTspuhHTbamJwttT3VHEmo=/510x318/top/img-s3.ilcdn.fi/a7eeee83e46b514f695d9b7b1ae19648d420a2b9a7df7efc04c4fc20e457b11f.jpg,F5ED578249F74FF1B07319BA322994BD
2022-09-15T12:34:03.000Z,Ellen kyllästyi naisiin kohdistuvaan häirintään yöelämässä – keksi ratkaisun,"Helsingin Kallioon perustettu Kvääristö haluaa olla kuppila erityisesti heille, joille yöelämä ei ole yhdenvertaista.",https://img.ilcdn.fi/bquGmGzA06SBccbv8R3-PlwK9Ys=/510x318/top/img-s3.ilcdn.fi/816b4cf29d325851bcf7222c9a3d340705ff525bff82ffc454b2aa6d04c831ba.jpg,C01E1D4375634B098F28C2038144E399
2022-09-15T12:34:43.000Z,Seuraa suorana kello 16: Oppositio tenttaa hallitusta venäläisten viisumeista,Todennäköisesti kyselytunnilla puhuttavat ainakin venäläisten viisumit ja kiinteistökaupat Suomessa.,https://img.ilcdn.fi/GorZRYjpyhVHq_Bo-fNshG4AFr4=/510x318/top/img-s3.ilcdn.fi/f724205ea6ef6e8e1430b1bbde205a4c997db6532d9481a18bdbc979923c341b.jpg,3C569DF8571E439095B01DA4F6180E7A
2022-09-15T12:38:19.000Z,Cheyenne Järvinen julkaisi kuvia dramaattisesti muuttuneesta kunnostaan – iso päätös kisaamisesta: ”Painan saman verran kuin 18-vuotiaana”,Cheyenne Järvinen päätti keskeyttää syksyn kisaurakkansa.,https://img.ilcdn.fi/a9Hw6fzPcB5f-DkGdtN_JIofQb4=/510x318/top/img-s3.ilcdn.fi/194fd8d693c6cd203259f969adfa825ff56e7eb1991658655d139646c270abbf.jpg,10A9E738C31E42C1BA8484C472454CAD
2022-09-15T12:48:53.000Z,Vartijan lyyhistyminen kuningattaren arkulla herätti huolen – seisovat paikallaan kuusi tuntia putkeen: ”Aivan liian pitkä aika”,Vartijan lyyhistyminen Elisabetin arkun vierellä on herättänyt huolta vartijoiden työajoista.,https://img.ilcdn.fi/8krxtL0OrpOBdArxgMfR_WDFNlc=/510x318/top/img-s3.ilcdn.fi/90c21333574946ef8200cba9a2ae1b94a3f74b52eb10457b0e9b7f288845dfb8.jpg,72B0F8D5FE554E81B136CCE28D7CFFFA
2022-09-15T12:59:09.000Z,Onko Tesla huijannut kolaritesteissä? Hakkeri syyttää: autot ohjelmoitu tunnistamaan testit,Tunnettu Tesla-hakkeri on löytänyt epäilyttäviä koodinpätkiä Teslojen ohjelmistosta. Törmäystestejä tekevät organisaatiot ottavat väitteen vakavasti.,https://img.ilcdn.fi/iXW50JkXBKzq6fM2puedB8So1HA=/510x318/top/img-s3.ilcdn.fi/a501ae4a392396107d09ef530620bd86e188031ca413ec6399788e932b783402.jpg,1A4BA1B80D2A4F3293BD5C8573DDF828
2022-09-15T13:12:39.000Z,"Tietosuojavaltuutettu selvittää S-Pankin tietoturvaloukkausta – toimi näin, jos jouduit kohteeksi","S-pankki on kertonut olleensa yhteydessä niihin asiakkaisiin, jotka joutuivat tietoturvaloukkauksen kohteeksi.",https://img.ilcdn.fi/Bjbc5-wxm14dYOi6cxPekKzMDBE=/510x318/top/img-s3.ilcdn.fi/132050307f167e18a3bbcf57867400eac79537c07917b5b24cf27196ca35d645.jpg,7D1AF1495EA64A8D8428E1A042C51032
2022-09-15T13:12:44.000Z,Väite: Paseja Ukrainassa,Suosittu Twitter-tili on jakanut kuvamateriaalia suomalaisvalmisteisista panssariajoneuvoista Ukrainassa.,https://img.ilcdn.fi/G8R-fOmDY05-rsk-Ow8rYKw9j3U=/510x318/top/img-s3.ilcdn.fi/14993fde481fd16298095902af3d2cf66ef0a595a23dfe7a777e609a3574d071.jpg,35B0600DBEA64D75B798D41F8B65C6FA
2022-09-15T13:24:56.000Z,Seurapomo paljasti: Metodeillaan kohua herättänyt NHL-mestariluotsi neuvotteli KHL-pestistä,Mike Babcock ja Joel Quenneville olivat kiinnostuneita KHL-pestistä.,https://img.ilcdn.fi/o7O-NIAeFBsMEx2J5_A3_AEvvHQ=/510x318/top/img-s3.ilcdn.fi/6ac25c54b8daa3f561cb434ad8fc94d11851508282d72ac51a9914ecddf09a09.jpg,76178B45F3F94CFCAAF3731DA5D6795A
2022-09-15T13:27:49.000Z,Matthew taiteili teipistä uskomattoman muotokuvan kuningatar Elisabetista – ”paras kunnianosoitus”,"Kanadalaisopiskelija loi hämmästyttävän muotokuvan Elisabetista, jonka hän teki kokonaan teipistä. ",https://img.ilcdn.fi/y1RpoIjkiuG85aYyiGO6Gfw7doo=/510x318/top/img-s3.ilcdn.fi/602e76e6a622cebc0765712bb0e44c7beb65d8c3c124a0dc495789cee8e3c981.jpg,8E2E096DC1B7462FA590AAFE39673CDF
2022-09-15T13:37:10.000Z,Roger Federer päättää uransa,Tennissuuruus Roger Federerin upea ura päättyy ensi viikolla. ,https://img.ilcdn.fi/sBN3sKnpb-MEqOn5j3eM1JaApcw=/510x318/top/img-s3.ilcdn.fi/3cd1fde85fbfa7fcaecbf9ca163b58d72b2d15a218a678d1c54b15dfea641550.jpg,992B67F7CC624F6C94EF507F701C5BCB
2022-09-15T13:55:22.000Z,IL-Arvio: Tuore dokumentti prinsessa Dianasta kolisee tyhjyyttä ,"Dokumenttielokuva prinsessa Dianan poikkeuksellisesta elämästä lupaa paljon, mutta sortuu toistamaan jo moneen kertaan kuullut asiat.",https://img.ilcdn.fi/z8gU9QbvNmSQND39ihDeGjH06dU=/510x318/top/img-s3.ilcdn.fi/4546f61ff75016400e5bddfe67bf73cd8a8012bce48495ad060a34736e64ab29.jpg,BF587937A51241CFA2234A3D0E4920F2
2022-09-15T14:19:22.000Z,Markus Kitusen unelma toteutuu tänään Roomassa: ”Tapahtui sillä hetkellä”,Roomaan matkusti myös tiivis HJK:n faniryhmä. ,https://img.ilcdn.fi/0pL15Ta1EpWlgF30Ar09BBx0pbk=/510x318/top/img-s3.ilcdn.fi/45acb1abe6f7edc33060316d03b80fd716a7832faeddbb22cbab8aa3de6c69f4.jpg,7E435C352CFC4768852D16251776F554
2022-09-15T14:31:44.000Z,Sähkökriisi räjäytti kaasulämmittimien myynnin – varo näitä hengenvaarallisia virheitä!,"Vanhojen huoltamattomien kaasulaitteiden käyttöön liittyy turvallisuusriskejä, kuten palo- ja häkävaara.",https://img.ilcdn.fi/LQ24pDwQc1AzSwfvF1dRy89ZNV4=/510x318/top/img-s3.ilcdn.fi/2daf58cb765167896744b4ed5e564f6ba7e16d276446f78e2458b2b060e2b53c.jpg,EFA5AB7DA80D47778EF2C2425D4E076A
2022-09-15T14:36:41.000Z,Amerikkalaiskenraali ylistää harjoittelua Suomen kanssa,Suomessa vieraillut yhdysvaltalaiskenraali kertoo odottavansa jo Suomen Natoon liittymistä.,https://img.ilcdn.fi/QbiA3wJNaVvmJq7Vby-sGsGfFVE=/510x318/top/img-s3.ilcdn.fi/d7233f071ff75d8ac019a46834a441b0d6fb39ac67d830871318a58ee85f683b.jpg,6F7BB7BE32C44505B72249156B4641C7
2022-09-15T14:39:03.000Z,"Äänestääkö vasemmistoliitto ”pakkolakia” vastaan? – ”Riippuu siitä, mikä on neuvottelujen lopputulos” ",Potilasturvallisuuslain säätäminen kuohuttaa eduskunnassa. Vasemmistoliitto peräänkuuluttaa edelleen muutoksia hallituksen esitykseen.,https://img.ilcdn.fi/H7xQO8iEt-2maqNMTr8Q6GjaKGo=/510x318/top/img-s3.ilcdn.fi/21ca613f9a8bcc60b1d9e4c42eabef559a44f8f7d2e3bf1f6b7d29bf96be7945.jpg,B258A4CFBBC149118C40D0E76F0A6978
2022-09-15T14:54:19.000Z,Vilautusmekko on täällä! Ole valmiina syksyn bileisiin,"Trendimekko paljastaa ihoa decolteelta, vyötäröltä tai lanteilta.",https://img.ilcdn.fi/uz6ZgSR-bqR9sOH9kjnK7HiGy5w=/510x318/top/img-s3.ilcdn.fi/4904f9190588b0702c8bd080b8fe5d685af7b7bd4bf7b5ca10dc28f9c9c94b15.jpg,DD58E82D1A2241B6949F214180BFA0E5
2022-09-15T14:56:48.000Z,Emmy-gaalassa muistettiin edesmenneitä tähtiä: kunnianosoitusten saajina Bob Saget ja traagisesti kuollut Anne Heche,Emmy-gaalassa kunnioitettiin edesmenneitä televisioalan tähtiä.,https://img.ilcdn.fi/Q8u90C8k4-jjAQDPbhmO2vAMf6U=/510x318/top/img-s3.ilcdn.fi/22eddbcdc38bdd39c749589ff0473f1b60eb4696ddef85f22baefa211d5524b1.jpg,2F8A69FA5E484AEFA1D35532A9C0025E
2022-09-15T14:58:38.000Z,Suomeen satoi jo ensimmäiset lumet – ja ensi viikko on vielä hyytävämpi,"Vaikka Saana-tunturiin tuprutti lunta, viikonlopun sadekelit pitävät syyskelit Suomessa. ",https://img.ilcdn.fi/Ac3SE_QEdF8qwKDzMLA1-kqcx4Q=/510x318/top/img-s3.ilcdn.fi/79f63d9324716193bb0cfa1917bd3f8ff4408c63f9f84b8a212e850843d69979.jpg,3880225C4DA74BEDB9387D22551973E4
2022-09-15T15:12:16.000Z,Talletusten korot nousussa,Sijoitusten ja rahastojen heiluessa plussalta miinukselle voi perinteinen säästötili alkaa kiinnostaa. Mutta saako sieltä tuottoa?,https://img.ilcdn.fi/f2ugh-1P5LEHkMxVGnpl254UPVM=/169x0:2832x1665/510x318/top/img-s3.ilcdn.fi/7b9775f615e7349181be59433cf88a122ba73c08aed527530180aafbfca4ccf5.jpg,0AE821FD976B452DB0B142FE45E8CDAB
2022-09-15T15:20:44.000Z,Hoitajaliitot peruvat teho-osastojen lakot ,"Tehyn ja Superin hallitukset päättivät tänään, että järjestöt eivät aloita käräjäoikeuden kieltämiä lakkoja. ",https://img.ilcdn.fi/M7fnJmLEoGDSe4_IXryvuFRNeG4=/510x318/top/img-s3.ilcdn.fi/46bc2676a31c463c927f88a91f72f7284c54b87fb3fe1a76cf976fa97a2197d6.jpg,19D7CE4EE868441B8B97FB88CBFF647F
2022-09-15T15:21:00.000Z,Kirsti Paakkasen miljoonaomaisuudesta riita – sukulainen haluaa osansa rahoista,Kirsti Paakkasen perinnöstä riidellään oikeudessa.,https://img.ilcdn.fi/ycsWPgtvcF255eeqWUKMiMU2DLM=/510x318/top/img-s3.ilcdn.fi/ab40811b2c9a9d7ef93a00d3e8294f1f721c2bd0e5116be839b4d9c8ce67f3b6.jpg,D9EE8D02018549F187D737E46028832E
2022-09-15T15:23:41.000Z,HJK valmistautuu pallopyörremyrskyyn – ”Aika harva seuran ulkopuolelta odottaa”,Jukka Raitala nauttii syntymäpäivälahjastaan.,https://img.ilcdn.fi/CIFhs4IZ-I27jE53E3smmw97aJs=/510x318/top/img-s3.ilcdn.fi/588e3a7f37f6076e02ed6e9030c079cb0381498a10fcf76edce3ed39b09426fb.jpg,3DCAFC51211D4AF487AFB83438314B84
2022-09-15T15:28:21.000Z,Suomi ei nyt tarvitse edellisten vaalikausien loppukohellusta,"Kuinka oletettavaa on, että sosialidemokraattinen ministeri tekisi lakiesityksen, joka olisi työnantajamyönteinen lakonmurtamislaki, kirjoittaa Juha Ristamäki.",https://img.ilcdn.fi/izmGAZUjd8RDGNGQ6VFl5eezrhw=/510x318/top/img-s3.ilcdn.fi/0ff6aa35a7c11757b65cc4ff6bcae6b13f0ad7a9c631ef4c272ac84e7f8bcd0f.jpg,924D4400CF1F472B910A9D328B716221
2022-09-15T15:51:57.000Z,”Perälautaa” ei ole – Fortumia odottavat miljardien alaskirjaukset,"Saksan valtion vakautuspaketti on jo käytetty, nyt koetellaan perälautaa. Sitä vaan ei näytä olevan olemassakaan, kirjoittaa politiikan ja talouden toimittaja Jarno Liski.",https://img.ilcdn.fi/sL-dDSnKX-Xq8DenvElkK7e6MdI=/510x318/top/img-s3.ilcdn.fi/83703e49f0ec17a412f2eb6147c517e643a3d65b68ff062d51b6d8ed030a3284.jpg,9AD4050B8AAE45B7ACAACB0D8A01D23B
2022-09-15T15:52:46.000Z,Tämä kuningatar Elisabetin hautajaisista tiedetään nyt: arkkukulkueessa mukana sairaanhoitajia ja lääkäreitä,Britanniassa on luvassa historiallinen päivä ensi maanantaina. ,https://img.ilcdn.fi/L_gsJoZHWE6ngMNKm7Ws-LZyAnU=/510x318/top/img-s3.ilcdn.fi/dad76362929171fed6e0235f2ddfad03b9abe808a37d625d323667c09263fd46.jpg,2ED3038A045449B5B44163478A4F5DD2
2022-09-15T16:13:43.000Z,Mercedeksen uuden SL:n äänet nostavat ihokarvat pystyyn – kuuntele,Mercedeksen seitsemännen sukupolven SL ponnistaa aivan eri suuntaan kuin aiemmat sukupolvet. Se on yhtä aikaa sekä urheilullisempi että suurempi kuin edeltäjänsä.,https://img.ilcdn.fi/XYgdzRuiBIx7_-jgHqspsDavdX4=/510x318/top/img-s3.ilcdn.fi/3e279f4a37f69e852d01396663ecfb70c3776c8f041af0acc66807fd3b005a9f.jpg,F98CEC8C2A834547ACBB397081F04474
2022-09-15T16:17:27.000Z,"Näin Marin perustelee turistiviisumien myöntämistä – ”Ei ole viranomaisia, jotka sanovat, että jokainen venäläinen on turvallisuusuhka”","Pääministeri Sanna Marin korosti torstaina eduskunnassa, että Suomi ei voi kategorisesti kieltää venäläisten turistiviisumien myöntämistä EU-sääntöjen ja viranomaistulkintojen vuoksi.",https://img.ilcdn.fi/bIe8FbYGMsp3DyREpHAKHNeFsvQ=/510x318/top/img-s3.ilcdn.fi/595978765b3beff3dd8d7606f7beb8c3c079fc8089a9b06bfe71942240c80798.jpg,1982F74C00DD40F6A7E42E6FC2CB191D
2022-09-15T16:17:44.000Z,Kesken kisojen tehty sääntömuutos vei suomalaiselta paikan MM-kisoissa – ”Onhan se jollain asteella villiä”,"Santtu Raitalan raviohjastajien Euroopan mestaruudessa saavuttaman viitossijan piti alun perin riittää paikkaan MM-kisoissa, mutta näin ei ilmeisesti kuitenkaan ole.",https://img.ilcdn.fi/RlpuOTZbhVNBhhTN2bUEloeYx3c=/510x318/top/img-s3.ilcdn.fi/7c8b39089a0215376ce6812105fd4e6b494752a65c4c6f08f21f348d9216fcfa.jpg,D087D0D4EB6E4A709A3FE944E3A7F04C
2022-09-15T16:23:40.000Z,"IL:n tiedot: Viisikko kokoontui –  potilasturvallisuuslaista keskusteltu, mutta neuvottelut ovat kesken",Iltalehden tietojen mukaan hallituksen johtoviisikko on käynyt keskustelua potilasturvallisuuslaista. Sopua ei ole vielä saavutettu.,https://img.ilcdn.fi/lWqx5-k7zT8qiBws88BYZDFNvY8=/510x318/top/img-s3.ilcdn.fi/aa8be4830f863df4cb4dc81854d242236be6bd889ca6a30f599eb75b26de693e.jpg,E2A989A309AF4A88AC981464A0CA3BF0
2022-09-15T16:29:48.000Z,Koronarokotteen haitoista korvaushakemusvyöry – Suomi omassa luokassaan,"Korvausta on maksettu esimerkiksi kuumeesta ja särystä, allergiaoireista, sydänlihastulehduksesta ja vyöruususta. ",https://img.ilcdn.fi/IBxFp54K470qjI1Xw8zRrT7azm4=/510x318/top/img-s3.ilcdn.fi/2bcfa73239ce8311af3484af1e0ffa5e1cd8e4d02190e9ac6c3b984131c1336a.jpg,F68A39B6A837491BBD51176727DCAD86
2022-09-15T16:35:43.000Z,Syntymäpäiväkakku sai kovaa kyytiä – epäonninen moka tallentui videolle,Syntymäpäiväjuhlat Meksikossa eivät menneet aivan putkeen.,https://img.ilcdn.fi/EbhlUYVB_kcRjkxycpgDQOXG5CM=/510x318/top/img-s3.ilcdn.fi/49176eb5ec056efc9f174668db68093c03d587a2559d473ea1d1025502e8c8ac.jpg,E0191494459F44B29E45DD2DB58E6888
2022-09-15T16:45:16.000Z,Sodassa merkittävimmät muutokset kuukausiin: ”Alkanut herättää levottomuutta Venäjällä”,"IL-TV:n 14. tilannestudiossa käydään läpi sitä, miksi Venäjä vetäytyi Harkovasta ja mitä se merkitsee sodan kannalta.",https://img.ilcdn.fi/KQPrJQ7JkKNmj7gCN3eHYZYaBFU=/510x318/top/img-s3.ilcdn.fi/31b6ea6930f2ae12789859e636d042497b5d0f1a4bb4536c46138acd6114109b.jpg,A47F94EE894F40969942135E5D1F42A3
2022-09-15T16:54:12.000Z,Huippumalli haussa -osallistujien joukosta yksi nousi heti ylitse muiden – päätuomari hämillään: ”Minulla on heikkous”,Yksi Huippumalli haussa -ohjelman osallistujista teki jo ensimmäisessä jaksossa vaikutuksen ohjelman päätuomariin.,https://img.ilcdn.fi/_dbMgI0SmBwl2zxp3l_-KHZtxCA=/510x318/top/img-s3.ilcdn.fi/5f5adc9514b0e429ef4fcc742c78345229cb2c819980b05d8439b41c601b0b90.jpg,B34FDD55E9E54B73A7E8FC654BEF2371
2022-09-15T16:58:12.000Z,HIFK:n huippuhankinta palasi ryminällä SM-liigaan – heti kaksi maalia!,Tappara isännöi HIFK:ta.,https://img.ilcdn.fi/7ANPrD7rnqzu1Z2e60cFH3uHL9M=/510x318/top/img-s3.ilcdn.fi/2a8e3a4fdac27e8bd5a03d1d53cd7cf0d73a25ce00acb19848d75aff3c06d678.jpg,64FBB073BF6D4797BBAE828C2FAFCD07
2022-09-15T17:58:23.000Z,Satoja pieniä ”herhiläisiä” Ukrainan avuksi – norjalaiset mikrodronet painavat vain 33 grammaa,Minikokoiset Black Hornet -dronet ovat niittäneet mainetta muun muassa Afganistanissa.,https://img.ilcdn.fi/qqxRUa9tOB39ZOM_BaGk9gccq2w=/510x318/top/img-s3.ilcdn.fi/91809849d545b6e93ad4f8ebfb0053a980d727101831d0ed0b3f22bb8877b3f7.jpg,1C727B7362FC4160B4FD63275F328694
2022-09-15T18:01:54.000Z,Tuomio pitenee entisestään: R. Kelly todettiin syylliseksi lapsipornon tuottamiseen,Kelly tuomittiin kesäkuussa 30 vuodeksi vankeuteen. Uusi tuomio pidentänee vankeusrangaistusta. ,https://img.ilcdn.fi/a4qltEWd_EX7FZXoNIWBlpb8SmM=/510x318/top/img-s3.ilcdn.fi/62083ca1c2735f252b5a035a6ec9eb944d099a1f3fbcc46a13ad783d1ff6b23d.jpg,164CB97FE59F4460B8D8CB76A72737A0
2022-09-15T18:08:15.000Z,Saksalaiskenraali pitää Venäjän hyökkäystä Suomeen mahdollisena – asiantuntijat: ”Häviäisi saman tien”,Pekka Toveri ja Emil Kastehelmi tyrmäävät saksalaiskenraalin näkemykset toisen rintaman avaamisesta ja Venäjän resursseista.,https://img.ilcdn.fi/1zPwpiQY30pCo4wKktVBemGSQec=/510x318/top/img-s3.ilcdn.fi/7ed13e435a3ce48a45072d2ce14ce859a4a09f697655a674da1b1c01b220462f.jpg,2F837BD9960746BFBC7D71118143012F
2022-09-15T18:16:07.000Z,Poliisi etsii kadoksissa olevaa 70-vuotiasta miestä Helsingissä,Havainnoista pyydetään ilmoittamaan hätänumeroon.,https://img.ilcdn.fi/p2KmoFysql7Fl5fZRs7GwhLBFfw=/510x318/top/img-s3.ilcdn.fi/d097e79ab1eb0c57bee2a9fe57b29aedbcd53225bfe08358157d1b6ae170f165.jpg,0D6D42D81E0D4BE0A0F8BE683B8A2FBD
2022-09-15T18:34:02.000Z,"Erikoinen video: Valko-Venäjän Lukašenka ilkkuu Euroopalle ja heiluttaa suomalaisen näköistä kirvettä: ""Hyvää puuta""",Valko-Venäjän johtaja irvailee tuoreella videolla Euroopan energiakriisille.,https://img.ilcdn.fi/RnfmJsBnIsiCCqIJ7S4AJZ2vxuQ=/510x318/top/img-s3.ilcdn.fi/f1ddb115a550337c30c103c86cff0bc8477fefa5f1189c92249f7d5fd597ad19.jpg,E8F44CFF0489410FB49C4A312F641DE2
2022-09-15T18:35:23.000Z,IL seuraa: Valtava koitos alkaa – HJK hakee sensaatiota yli 60 000 katsojan edessä Roomassa,Iltalehti seuraa AS Roman ja HJK:n välistä Eurooppa-liigan ottelua.,https://img.ilcdn.fi/1FErHunTrd8XAStGg6zG3sYPNSE=/510x318/top/img-s3.ilcdn.fi/4a18f3127d3e95bd4d8349075215415786956d4e6964db6045803cafbebd99b9.jpg,3AA87964277C47CC970598394B8C69FE
2022-09-15T18:43:55.000Z,Kuvat: Prinsessa Catherine huomioi 8-vuotiaan Elizabethin erityisellä tavalla – ”Hän itki onnesta”,Prinsessa Catherine ja prinssi William vierailivat Sandringhamissa.,https://img.ilcdn.fi/q1UZYbl0_ktZJGGZTSNcU8cg3vc=/510x318/top/img-s3.ilcdn.fi/ab8ef6204c1521765e12757cafd3f6251594dd3f05c3e51b33e6043602608339.jpg,38D53BA43F3049AE941761F19AE304D3
2022-09-15T19:27:27.000Z,Kahden maalin Melart lähetti viestin joukkuekavereilleen: ”Hyvä ottaa koppi”,"Tappara kaatoi HIFK:n viihdyttävässä ottelussa, jossa Ilari Melart nostatti hetkellisesti helsinkiläisten toiveita.",https://img.ilcdn.fi/gAzr_LPWafB9-6Wh4wnAiNJyR4A=/510x318/top/img-s3.ilcdn.fi/ccf127d199e53504a438aa851c4b7ccb099808983c863a59a6ccee2104780e42.jpg,7EC7855A114B41DAB6D74675F208A165
2022-09-15T19:35:47.000Z,Kolmen miljardin euron firman omistaja luopui yrityksestään – jättirahat ilmastonmuutoksen torjuntaan,Patagonia-ulkoiluvaatemerkin perustaja halusi tuottojen menevän ilmastonmuutoksen torjuntaan.,https://img.ilcdn.fi/wVWMWjXqpAgwGlx7FJfjhis_X8w=/510x318/top/img-s3.ilcdn.fi/2ae895f34e30d92a5fae746bf023b809464f6ab847806bb3f6aee88d5d93f8f2.jpg,44A15E79B938426CB2E3059C2FDA9701
