paivamaara,otsikko,tiivistelma,kuva,id
2024-01-25T13:16:27.000Z,Yhdysvaltalaiset sotilaat tekivät yrittäjän onnelliseksi Sodankylässä,Sodankylän kunta laajentaa lentopaikkaansa. Hanketta perustellaan muun muassa Suomen Nato-jäsenyydellä.,https://img.ilcdn.fi/AtIZaa94oMOMrAfBI7ZTEIVdMg4=/510x318/top/img-s3.ilcdn.fi/d8a8c7636fc3c06931e92a9c41dda81021e64666d199869634e562807b0ebdbf.png,93DFA1C2726A45599E125DDFED6C7844
2024-01-25T13:16:58.000Z,Pelé saatetaan kaivaa ylös haudastaan,Peléstä vaaditaan dna-testiä.,https://img.ilcdn.fi/Nn1SebhVzNNl6DxN_Smjoi0R1y8=/510x318/top/img-s3.ilcdn.fi/b1c760597da6b2b119dbec87da5d6d1972153ce57e05248211226a255cf12295.jpg,8CAA99C6E7F4429EB48281EB52AC2A8D
2024-01-25T13:24:02.000Z,TPS:lla huikea maalivahtisirkus – Nyt penkillä legendan poika,Noa Vali vartioi TPS:n maalia illan ottelussa HIFK:ta vastaan.,https://img.ilcdn.fi/-0RJdnkIFaGF3EKg9xGd_sxMtA8=/510x318/top/img-s3.ilcdn.fi/1c812c6460851a06d27fa84296209e0af2d72f710949c832ce1cfeaf40792d4e.jpg,BBABC9B1123D49FC9296B879BEF8A2C7
2024-01-25T13:26:39.000Z,Syöpää sairastava Sarah Ferguson kertoi voinnistaan neljällä sanalla,Sarah Ferguson vastasi kuninkaallisfanien tervehdyksiin.,https://img.ilcdn.fi/VSPiKWCo3W_aE6gt8CWKcq6G70A=/510x318/top/img-s3.ilcdn.fi/a411bc3efde082372b8d28c2cfc975fcb5952199f5ba3b838aae7f75a1e71ae4.jpg,4B1BF11749EE458BA7CDF8081865F1C3
2024-01-25T13:42:12.000Z,Poliisi tarttui päivittäin eteen tulevaan rikkeeseen – Sakko rapsahti!,"Älä autoile ilman valoja, kun näkyvyys on huono, muistutti poliisi antamalla sakot pimeänä porhaltaneelle kuljettajalle.",https://img.ilcdn.fi/B3SSiApN6nq1QRaV0zoVl8BepBs=/510x318/top/img-s3.ilcdn.fi/784b94a41e7ce2c27a0c54fa42d472908a56c4b3a7c3aea3902a7729c957c027.jpg,850E00B105934F389FDAFEAD26896C1E
2024-01-25T13:45:40.000Z,Liigassa läpimurron tehneelle maalivahdille uusi sopimus,Mikkelin Jukurit pitää lujasti kiinni ykkösmaalivahdistaan.,https://img.ilcdn.fi/nDoqUhAi6GO6oJfB0PygmDjZzF4=/510x318/top/img-s3.ilcdn.fi/31ed9728252fe2ccac0705179af3f6abeea8994139972deb0c3ff37dd6aa04e8.jpg,2DFF10B109C34193A765A4939BC2300F
2024-01-25T13:58:41.000Z,Kommellus Salkkarit-juhlissa: Kakku romahti!,Salatut elämät -näyttelijät juhlistavat sarjan 25-vuotispäivää.,https://img.ilcdn.fi/9D--72bcZiwJ7xMdrocXcTxSLSM=/510x318/top/img-s3.ilcdn.fi/d8ecda58daf5b77a73d18efb1c1b4d90391a70310fa19a01e516ed22af034bbc.jpg,79C09E3CC96B4D24B7B3C175290AF81D
2024-01-25T14:03:12.000Z,Kaikista pahimmat deittimokat ,"Suomalainen deittikuningatar Anna Uusiheimala paljastaa miesten ja naisten tyypillisimmät deittimokat. Entä mistä johtuu, jos et saa koskaan pääse toisille treffeille? Vastaus saattaa hätkähdyttää.",https://img.ilcdn.fi/A9sO6Hb7V8o0T3eFgivauaN7EG0=/510x318/top/img-s3.ilcdn.fi/6bb7a8e1eaf9eb598cb5efcf29564eb11129938dbae6340cab8543c44259b745.jpg,ECA28B8A916E4CF39C238032DE2E4EF0
2024-01-25T14:07:43.000Z,Archie Cruzilta rajuja syytöksiä bändikavereistaan,Archie Cruz syyttää bänditovereitaan epäluotettavuudesta. ,https://img.ilcdn.fi/Mt01oUfWhJs4UlsB7roa8Slba74=/510x318/top/img-s3.ilcdn.fi/b02df53ad84906a1f7d817fb6843b4366b6fbb0002c73e0841c69be082db9376.jpg,3D67C97019E4420A98BD1A310B4F0424
2024-01-25T14:10:02.000Z,Yleinen harhaluulo voi tuottaa turhaa työtä ja aiheuttaa vaaran – Älä pudota lunta katolta,"Lunta on enemmän kuin yleensä tähän aikaan. Asiantuntija kertoo, onko pientalon katolle kertynyt lumi syytä pudottaa.",https://img.ilcdn.fi/CpMRxUJuB4p8oohEsUwaXhGKJLo=/510x318/top/img-s3.ilcdn.fi/ad5ff30d0eb89f5ff91db621dd8d117fc06ce18bd49e47019318b8236b9f7d5c.jpg,28035C21882C4762A668B4FCBFC78C50
2024-01-25T14:18:55.000Z,Entisen Hartwall-areenan tiedoista paljastui jälleen karu yksityiskohta,Intrum oy:n luottotietorekisteri kertoo Helsinki-hallin taustayhtiöllä olevan lähes 40 000 euron lasku pystyssä.,https://img.ilcdn.fi/0x8sA3mbWprxrWWaSwyBQacUr2U=/510x318/top/img-s3.ilcdn.fi/acb86a205461a680587b5754c5040d484ed8d71eb2ce1b2717c4b221100ff200.jpg,8D9A239C268841FBA80F7EF1D551488B
2024-01-25T14:31:59.000Z,Iso muutos paljastui – Presidenttikisa voikin saada dramaattisen lopun,"Vaalien lopullinen tulos riippuu nyt siitä, miten epävarmoissa äänestäjissä muhiva kannatuspotentiaali realisoituu gallupien kärkikolmikolle, kirjoittaa Iltalehden uutispäätoimittaja Valtteri Varpela.",https://img.ilcdn.fi/yZ_X5vHZs4sZb3D-A4Jj5hzuJEU=/510x318/top/img-s3.ilcdn.fi/8aa86c54055cc1279008e7bbdb44f11e2d0ae81d73346eb570c9da91a1de336f.jpg,292E75039F954092A3B07399E6AB3A11
2024-01-25T14:40:52.000Z,Kaarina Kivilahden suku taisteli perheyrityksen rahoituksesta – Miesvainajan tyttäreltä tyly päätös,Yrittäjä ja seurapiirirouva Kaarina Kivilahden perheessä on ollut kiistää yrityksen rahoittamisesta.,https://img.ilcdn.fi/xG5PZVNKk_RxDtPLTMEJGe5Z77A=/510x318/top/img-s3.ilcdn.fi/e9e7008fec052178942dce4d0d39d0bd375aec0f1b304e83842c195cea2f9067.jpg,B5C1BC7532FB4124B18657B89AA03277
2024-01-25T14:57:35.000Z,Ferrari kiinnitti ykköskuskinsa – Charles Leclerc jatkaa unelmiensa tallissa,Charles Leclerc jatkaa Ferrarin ratissa. ,https://img.ilcdn.fi/1wOfu0Gisc7cvlBIehP27rQiHEM=/510x318/top/img-s3.ilcdn.fi/24adb4421f262d3e102dc52db0a201f3a0dbdf3ac4997bcc6f101a904e6d79dc.jpg,EDCE9002F7D54BCF86DC987309DC009F
2024-01-25T14:58:09.000Z,Rajut aallot iskivät Yhdysvaltain armeijan etuvartioon,"Rajut aallot törmäsivät Yhdysvaltain armeijan etuvartioon, joka sijaitsee pienellä saarella Tyynellämerellä Marshallinsaarilla.",https://img.ilcdn.fi/40tKIwh1hP5JFy0bdyG0V2zb1BI=/510x318/top/img-s3.ilcdn.fi/cfd0193d85ece1df3910d95c39fd2d428b4c3d7c5ab885855221b45280b36ac2.jpg,8F744BBF32A841118FCCEFAE2746AE3D
2024-01-25T14:59:01.000Z,Ylen tiedot: Halla-aho on maanviljelijöiden ylivoimainen suosikki,Iltalehti kävi läpi Ylen torstaina julkistaman presidenttikyselyn tausta-aineiston.,https://img.ilcdn.fi/yt2HpztETRCN0BVwZF8ietUTjEo=/510x318/top/img-s3.ilcdn.fi/b8782692a5ab17caec0dec6e47acf9bbd8ad240a34cb5674a4baa872a2966a8d.jpg,8022B1D681454DB3A295B65B4B84CB86
2024-01-25T15:04:19.000Z,"Riikka, 40, on ylpeästi kalju",Riikka Herrasen hiukset alkoivat lähteä jo nuorena tyttönä. Heikosta itsetunnosta hiustenlähdön vuoksi kärsinyt Herranen teki lopulta ison päätöksen ja luopui peruukistaan.,https://img.ilcdn.fi/C13i2k391plfnYhjR8N8p_uavxM=/510x318/top/img-s3.ilcdn.fi/5694f730a9e2ac7161719e93f2c9085e0f4cd9c24506710d4780a52ab1ba166a.jpg,73E7B50A60654957BC130FFF6360F0EB
2024-01-25T15:17:07.000Z,Painosti vuosia Puuiloa ja Motonetiä: IKH:lle jättimaksut,"Korkein hallinto-oikeus katsoi IKH:n rikkomuksen olleen pitkäkestoinen, laadultaan vakava ja moitittava.",https://img.ilcdn.fi/MbarcJ8_T6BdYvbyDLV0gPEERy8=/510x318/top/img-s3.ilcdn.fi/25b723554c84115dc0f078f058779557136c0b03fa995d67707887f46e0ee83b.jpg,D16F4AD2060B489E94EDA2652FABFDF6
2024-01-25T15:19:50.000Z,Olympiaurheilija kuoli – Oli juuri rintaleikkauksessa,Maricet Espinosa menehtyi. ,https://img.ilcdn.fi/BRZyPoIvLz6ePMnOJiMgaUtCWwQ=/510x318/top/img-s3.ilcdn.fi/8e1d4968f3296b42271ff9b15646deccc818047439c89ceea5124694ef0ae556.jpg,3549F796F7E54C78855F12075A814B06
2024-01-25T15:20:37.000Z,Salkkarit-tähdet edustivat upeissa iltapuvuissa: Katso loistokkaat kuvat!,Salatut elämät -sarja täyttää torstaina 25. tammikuuta 25 vuotta.,https://img.ilcdn.fi/kYVcWOSC3XOoTaGN2yIBtTNMMSA=/510x318/top/img-s3.ilcdn.fi/037b59e2663769f6c814064e27e5bb220e64a32391773e86c79b2e963dec33ba.jpg,2988DD5D45C74E5BBCB89BBD2C5B3A75
2024-01-25T15:30:43.000Z,"Kehotus Ruotsissa: Kakkaa näin, jos sota tulee",Ruotsalaisia valmistellaan sodan varalle monin tavoin.,https://img.ilcdn.fi/n8lVkn5DUg63yte_1IDykFMLVF4=/510x318/top/img-s3.ilcdn.fi/c2bbbc5ccbfb4d04b4cfc677516fe7646e686bb56ae94f235a26a28f96b40754.jpg,1F97420E9EEB46C1B30BA0C246A890AA
2024-01-25T15:32:47.000Z,Jennifer Lopez varasti huomion Pariisissa: Takki tehty 7000 ruusunterälehdestä,Amerikkalaistähden asu keräsi huomiota Pariisin Haute Couture -muotiviikolla.,https://img.ilcdn.fi/b3YRgofbI73KSPyEi_wabbovKIA=/510x318/top/img-s3.ilcdn.fi/34ba4b47608ab5c516f79ea5cf77024b2b5a39c6266b5b2649476cfa841eb0b4.jpg,D82D60A4077943C3B19D63ADA0BC008E
2024-01-25T15:34:03.000Z,Sanna Marin Elle-lehden jätti­haastattelussa: ”Biletän yhä”,"Sanna Marin antoi ranskalaiselle Elle-lehdelle suuren haastattelun, jossa hän muistelee bilekohua sekä uraansa Suomen pääministerinä. ",https://img.ilcdn.fi/uPxz0uG2nTcJxofrMImQmQZaUrI=/510x318/top/img-s3.ilcdn.fi/cd7ac1cdaef1b2bb292ec55f67f5984f78a0b371c90d09091bd2871621bf14fa.jpg,CDBB262FAA704EFE9502FA7706BD3482
2024-01-25T15:41:50.000Z,Verottaja varoittaa pian alkavasta piinasta,Verottaja muistuttaa lähestyvän veroilmoituskauden näkyvän todennäköisesti myös huijausviestien määrässä.,https://img.ilcdn.fi/INe1276T8EaEpLQestOFEbYu-4s=/510x318/top/img-s3.ilcdn.fi/ea5f13b9ae63ffbcd96f5751675457768df1a89b06eb6b97b04b6b819cdf6443.jpg,C7AFF9283FEF4101B43D76E880184649
2024-01-25T15:53:38.000Z,Susi vieraili Ninan pihalla: ”Ei tarvitsisi ovikelloja soitella”,Lieksassa on tehty tänä talvena poikkeuksellisen paljon susihavaintoja.,https://img.ilcdn.fi/zCYxWD-N5G1ASkeghWil4YfsHvQ=/510x318/top/img-s3.ilcdn.fi/a539a42cb8afcb1d7bf139fcbfb0c8acf817c7a86df134f2b3d83db231cde883.jpg,C83B53DD5EB24DFB8C9D5918C76BD987
2024-01-25T15:53:58.000Z,Jan Vapaavuorelle uusi pesti – Tällainen on kuukausipalkkio,Helsingin entinen pormestari kannatti Helsinki Garden -hanketta jo vuonna 2020. ,https://img.ilcdn.fi/DhyYnhwUyFj_p3EkZR6-ZN5odVI=/510x318/top/img-s3.ilcdn.fi/0781d15d2973f4d4419d75bb8f24538d8773828eb9fb88c91e91cd61dc772632.jpg,EA09CBA3EA2E4E19993F120FF1CC2523
2024-01-25T16:02:03.000Z,Perheenisä jätti lapset yksin ja lähti ryyppäämään – ”En keksinyt enää muuta ratkaisua”,Parikymppinen perheenisä jätti kaksi pientä lasta heitteille ja lähti yömyöhään juopottelemaan.,https://img.ilcdn.fi/CPcCIiFiBwgkO7Z1BdBsJyDe-14=/510x318/top/img-s3.ilcdn.fi/6188d76aae047e30a941d8bdf7dd9cdb0172404234e60518e204399bec1c53a8.jpg,F38BDDAE002E4707AFF69E24CD838274
2024-01-25T16:16:52.000Z,Esko Eerikäinen joutui keskellä yötä sairaalaan – Diagnoosi ei yllättänyt,"Esko Eerikäinen kertoi Iltalehdelle, että hänelle todettiin silmätulehdus.",https://img.ilcdn.fi/0_1ANOA83EpDhB0Lc5sRHzaeOfI=/510x318/top/img-s3.ilcdn.fi/229de19f1495ca5e88892d1d6de120039adf8b7ac636b775d0e7e23ab832c82e.jpg,C07DE20557B5400592BEAEBB08A9615F
2024-01-25T16:30:34.000Z,Stubb viljelee erikoista Suomi-väitettä,"Asiantuntijan mukaan Yhdysvaltojen näkökulmasta hyvä liittolainen on sellainen, joka tukee USA:n kauppa- ja turvallisuuspoliittisia tavoitteita.",https://img.ilcdn.fi/JFyzdjiksRpyjmzOEWnemgfKkGc=/510x318/top/img-s3.ilcdn.fi/b7db0fe018e0263309d62df1ad727a51c125f557af656d3a25d52b4b7058cb40.jpg,486D095B9151433A92DA7233488482B4
2024-01-25T16:45:26.000Z,"Jos tulostimesi ei yhtäkkiä toimikaan, voi syynä olla valmistajan tympeä temppu","HP on saanut kuraa niskaansa tulostimiensa ominaisuudesta, joka rajoittaa kolmannen osapuolen mustekasettien käyttämistä. Yhtiö perustelee käytäntöä tietoturva-asioilla.",https://img.ilcdn.fi/tWoDFKvMlryD2wpiXiq_srAWimA=/510x318/top/img-s3.ilcdn.fi/79776234d826b8113f703a4ad7b4d4f35861a8c6eace59d896726986b60fc5b2.jpg,F64E3B9525B0491E889ACC16AAF6004F
2024-01-25T16:47:58.000Z,Cora Schumacher sanoi liikaa tv:ssä – Lehti: Totuus F1-legendasta lähellä paljastua,"Saksalainen tv-yhtiö pelkäsi, mitä Cora Schumacher olisi seuraavaksi sanonut.",https://img.ilcdn.fi/xHgVtnUkpIQ8fvPDwhw9kzzWAjY=/510x318/top/img-s3.ilcdn.fi/675ceab1f2b54ed64a77f56efb5216dc0e57ff41ee81cb813650d0f3c34d3e40.jpg,39E62BF4E4074C5381D43109265F2B9E
2024-01-25T17:07:59.000Z,Säässä täyskäännös – Pian lämpötila kohoaa alkukevään lukemiin,"Forecan kuukauden sääennuste povaa pakkasta talvilomaviikoille, mutta sitä ennen on keväisen lämmintä.",https://img.ilcdn.fi/s3-Zuvix6SQ6_c_eNCHwsj6UcNw=/510x318/top/img-s3.ilcdn.fi/0727b6cadecf7a9bc31047e776aabad01e5765879efa8d76fc68f6ef714bf21e.jpg,86EBD92971BF4A559FA2548215FB0679
2024-01-25T17:16:25.000Z,"Pikkukunnassa äänestettiin niin vilkkaasti, että päättäjät ovat poikkeuk­sellisen ratkaisun edessä",Lestijärveläiset ovat innokkaasti lähteneet vaaliuurnille. Nyt vaarana on vaalisalaisuus.,https://img.ilcdn.fi/8PaF0A2zchWLiTKi5xjVD1Ws_9E=/510x318/top/img-s3.ilcdn.fi/004c134b3d6d2894bcd53b1e9e7943cdd09a0acbbe014d6bc815e8e8ed2ac508.jpg,4630C07F08914819AA84C58DDDB4C2B6
2024-01-25T17:21:55.000Z,Mika Aaltolan Kirsi-vaimo huolestui Ylen vaalitentin olosuhteista – Näin Yle perustelee,Presidenttiehdokkaat joutuvat seisomaan kaksi tuntia putkeen Ylen vaalitentissä. ,https://img.ilcdn.fi/UQReF_PeyhJX38Yk1HDGT3B84C8=/510x318/top/img-s3.ilcdn.fi/692fb655daef07721e6955120ed4480bbe1705ec4bf8712d588d75fa1f761fc0.jpg,4AB2BCEFD2A04963948CAF6801FCBEDA
2024-01-25T17:35:18.000Z,Pakkosuutelija voi joutua vankilaan – Härski yritys kohun peittämiseksi paljastui,Espanjan futisliiton entinen puheenjohtaja Luis Rubiales joutuu vastaamaan tekosistaan oikeuden eteen.,https://img.ilcdn.fi/Wqi8bwMmHK6u9KOjgArhDxju4aA=/510x318/top/img-s3.ilcdn.fi/c8afd3a90ee08515e4f016316e39b58b863f4f2613440b11b43415481d63ec83.jpg,C40B38A2A5C04946AC374AFAE69EDBA2
2024-01-25T17:36:11.000Z,Ukrainan eturintamalla hirvittävä kaiku ensimmäisestä maailmansodasta,"Ukrainan eturintaman jo valmiiksi vaikeita olosuhteita piinaavat poteroihin hakeutuvat jyrsijät, jotka levittävät tauteja ja saastuttavat sotilaiden ruokavaroja.",https://img.ilcdn.fi/AGpFo_OSZHUVdoDlLWTac5j3Vs0=/510x318/top/img-s3.ilcdn.fi/4c8bb3721a138f73e3bac8a46d4bb88a2dc8524af49831606a1f97b3b1ef39c2.jpg,1B787CDF93BF4906AD21B975574EE939
2024-01-25T17:44:18.000Z,"Ihminen kuoli Lahdessa – Ohikulkija käyttäytyi julkeasti, nuoret muodostivat joukkosuojan",Nuoret muodostivat näköesteen kuolleen henkilön ympärille ennen poliisin saapumista paikalle. Lisäksi he käskivät tapahtumaa kuvannutta poistumaan.,https://img.ilcdn.fi/Yb_ARdgSJ2BCFHR38IrikHq1nfI=/510x318/top/img-s3.ilcdn.fi/1f556e710ba3af270457dc0bfd2f4b3f42c49d83815aa647f236ab1c76a27ab4.jpg,93A7D2EECD87471B96F373E3FCE00421
2024-01-25T18:07:03.000Z,"Lapset pelkäsivät henkensä edestä, kun humalainen kaahasi heitä päin koulun pihalla",Päihtynyt mies ajoi teinejä takaa koulun pihalla. Mies kertoi halunneensa pitää pojille puhuttelun.,https://img.ilcdn.fi/IYVxIWgNvoQ0KzkkZ3XMRB7W1kk=/510x318/top/img-s3.ilcdn.fi/0da6820906aacbe464221fc5397e28323a5b6622da5e3c432bf5ad8a555903f2.jpg,268A9AC7B13E4937905FB987F9AA99B4
2024-01-25T18:15:45.000Z,MM-rallissa valtava muutos – Jari-Matti Latvala jyrähti: ”Olimme vastaan”,MM-rallipromoottorille saattoi tapahtua karmiva laskuvirhe.,https://img.ilcdn.fi/1U6m_vDoqoH0iVWB74xc1HkMifI=/510x318/top/img-s3.ilcdn.fi/e470805ad4c3b2121ee5c97860275926b513392cb588fa06cab5abecdb605e0f.jpg,0F9862A682DA41D7978F5BC02D47886D
2024-01-25T18:18:49.000Z,IL julkaisee uuden ennusteen: Haaviston ja Halla-ahon kisasta tulee erittäin tiukka,Accuscoren laatiman ennusteen mukaan Alexander Stubb ja Pekka Haavisto ovat etenemässä vaalien toiselle kierrokselle.,https://img.ilcdn.fi/sQXvNftkBsKPZ6rgPRU1J7T88Ho=/510x318/top/img-s3.ilcdn.fi/9f00d50635b4bd7ca639aa0688ce7107ddef8bdfa98b2ca66af58cdbffb4adb4.jpg,CEAF42FC7190460A8D6408D88669029D
2024-01-25T18:27:28.000Z,Maailman viisuhulluin maa saattaa jättää Euroviisut väliin,Islanti ei välttämättä osallistu Euroviisuihin.,https://img.ilcdn.fi/5nZYwBdls4jzr7Xky0xyVK7YNAo=/510x318/top/img-s3.ilcdn.fi/36f5a90aecfdfa045e26f1ec0af87e352ca123a1f543bf5097c4d7d18c1b02a1.jpg,ECEA819A3E0341C9979B31389E0A7DDB
2024-01-25T18:45:47.000Z,"Paljonko Niklas Anttila, 22, tienaa? Nyt puhuu huikean diilin tehnyt pelaaja itse",Suomen frisbeegolftähti kertoo olevansa automies. ,https://img.ilcdn.fi/WyKlvx1XrFLT5oJUO7-hZISaXlM=/510x318/top/img-s3.ilcdn.fi/754e0ac95af46c520927bde0506a16948ffa0af5e8bdfb210be9faabcb05c797.jpg,6FDD6785CB614C928B9D1672F336505A
2024-01-25T18:50:45.000Z,Maalaislääkäri Tapani Kiminkiseltä suorat sanat Ylen vaalitentin olosuhteista,"Maalaislääkäri Tapani Kiminkinen ei olisi huolissaan siitä, että presidenttiehdokkaat joutuvat seisomaan kaksi tuntia putkeen.",https://img.ilcdn.fi/WleOscJbhjyVR5mVGJjjWkAccTQ=/510x318/top/img-s3.ilcdn.fi/1599d163e0431d2f5b6508a9e4ea92a4f5626ecd441457498faadd47961f49be.jpg,818414A860F84C2BBE327A78545519FA
2024-01-25T18:55:21.000Z,Mieletön latolöytö: Arvoautot paksun pölyn peitossa päällekkäin ,Aivan tavallisen näköisen asuinalueen varastoissa ja talleissa saattaa piilotella arvokkaita harvinaisuuksia. Brittiläinen latolöytökanava taltioi usean auton pelastustehtävän.,https://img.ilcdn.fi/h6mngIOsxWwhLghCwsMm3FaA4cQ=/510x318/top/img-s3.ilcdn.fi/47c82331b0f30d0de9a84091007df41421518466caf4a088b29d30b135825301.jpg,B60139F6D9A9477392D7348E29119B24
2024-01-25T18:56:09.000Z,Kapteeni iski ensitahdit – TPS juhli Pride-teemaottelussa,TPS sai kostonsa lokakuun ensimmäisestä kohtaamisesta ja saalisti pisteet sarjaneloselta.,https://img.ilcdn.fi/h_XTfsuG2Hh-BBGPd_G_6JtcwKk=/510x318/top/img-s3.ilcdn.fi/a01df4fedb1e8c0212ef45b8242f4b4722c267a38a18bf63491cba1b9bacfa5b.jpg,7C1C3A2A35294275A425F4D493CB680B
2024-01-25T19:01:17.000Z,Raportti paljastaa: Trumpin Valkoisessa talossa jaettiin pillereitä kuin karkkia,Valkoisen talon pilleripolitiikka joutui syyniin vuonna 2018.,https://img.ilcdn.fi/UaKweNPrQJXwZN89a4RGFtpi84w=/510x318/top/img-s3.ilcdn.fi/d76c4356ab9e1dc1cee778d92e8adf259e37a1f368162dd061a1b81fd3952a93.jpg,8D6B950F58094EFFBC830A1B0E1DC1E2
2024-01-25T19:10:26.000Z,Venäjän ”lihahyökkäykset” Avdijivkassa alkoivat toimia,"Tilannestudion 79. jaksossa pureudutaan sodan etulinjassa olevan Avdijivkan tilanteeseen, jossa Venäjä on onnistunut etenemään. Hinta on kuitenkin ollut kova. ",https://img.ilcdn.fi/jCJyD8nCRDmj2Pn_PRdG5uVNF54=/510x318/top/img-s3.ilcdn.fi/86ba060f81cdea29aac363e5870ecd5cb31cc1659a954ec423f84930a9277e4b.png,97C730ECF6EA46BAA57286FD19C654DF
2024-01-25T19:20:41.000Z,Erdoğan allekirjoitti – Ruotsin Nato-jäsenyydelle sinetti Turkissa,Turkin presidentti allekirjoitti Turkin suostumuksen Ruotsin liittymiselle Natoon.,https://img.ilcdn.fi/tYVP5Nr5BPmBus5bFlv-cSQfzpU=/510x318/top/img-s3.ilcdn.fi/8ede05fbb5d1acbdbc3c8157596988e2ae64ac5f4e762f25c5a4e272bc314f4e.jpg,2B557374096E49958D6D384938894B72
2024-01-25T19:21:28.000Z,Virpi löysi läheltä kotiaan harvinaisuuden – Poliisi ampui sen,Poliisi lopetti Joensuuhun eksyneen lunnin.,https://img.ilcdn.fi/jVTzoch0ZcTp31muyph5lTRfyNI=/510x318/top/img-s3.ilcdn.fi/6943c0eac78fe4dd56ab6de02159daf2aad0743a9f1a701909053dfebf3555b0.jpg,EB5D5263F398475883E4250FE393F3CB
2024-01-25T19:24:58.000Z,"Viljami, 20, oli useita kertoja Patrick Royn puhuttelussa – Tällainen on NHL:ään palannut kohuvalmentaja","Patrick Roy palasi NHL:ään lähes kahdeksan vuoden tauon jälkeen. Ville Nieminen ja Viljami Marjala kertovat nyt, minkälainen hahmo on New York Islandersin uusi päävalmentaja.",https://img.ilcdn.fi/oYJKudoOBZI2Z-ZV-7BfhC7f2Cc=/0x64:3000x1937/510x318/top/img-s3.ilcdn.fi/2723ac3f10a7bfb71b8581d022dc1acf71ed9096a0ad2291f9b8692d58a72fee.jpg,6783C8069C844DB3B542D9267FCE4238
2024-01-25T19:37:39.000Z,EK1: Elfyn Evans löi luun kurkkuun muille,Walesilainen Elfyn Evans tykitti avauspätkän pohja-ajan. ,https://img.ilcdn.fi/v-lwSoFaYj3UWR_b0l-PgVXR7_4=/510x318/top/img-s3.ilcdn.fi/129084a23f1f2360960a835f01927d5950c1fb89ac33bf33c321da9994e62fe9.jpg,195E367A095245BFB0A7C3341FAD21A0
2024-01-25T19:42:24.000Z,Yksin kotona -näyttelijä kiidätettiin kriittisessä tilassa sairaalaan,Devin Ratray on joutunut sairaalahoitoon.,https://img.ilcdn.fi/Q56DqIKilUO6UFt5NfufnD8Ysms=/510x318/top/img-s3.ilcdn.fi/5bceb5d04fe69556ea7bedf48845cbcf930b42fddb63ffb24473aeb0966bdf5a.jpg,2633C2B382AC42FE83E869FF9785FC58
2024-01-25T19:57:46.000Z,Tutkijakin yllättyi ulkomaalaisten työllisyysluvuista Suomessa,"Jos maahanmuutto Suomeen ja ulkomaalaisten työllistyminen Suomessa jatkuu samanlaisena, työeläkemaksuja voidaan jopa alentaa tulevaisuudessa.",https://img.ilcdn.fi/R3LHf_ZtoH6Ue42lBFNCuNcHIVc=/510x318/top/img-s3.ilcdn.fi/a72d0701045cecfd40e941aa14d432f2daef68819a2a6db8e34f93ae825e20ca.jpg,B75F529740374E58A80D42D77DB8E961
2024-01-25T19:59:14.000Z,Ruotsin NHL-tähti katosi lähes kahdeksi vuodeksi – Nyt tuli upea uutinen,Kylington kärsi vakavista mielenterveysongelmista.,https://img.ilcdn.fi/wkL7p67hkWD39mRIYNswiwzJqfQ=/510x318/top/img-s3.ilcdn.fi/47e3df62c74512d18217d2f0e1d95843410681de83f063225993fc23daf55e66.jpg,B4BAB73229C14B9F9200828B87ABC219
2024-01-25T20:03:15.000Z,Ylen vaalitentille sataa murskaavaa kritiikkiä: ”Ensi sunnuntaina pidetään näköjään eduskuntavaalit”,"Moni pohtii sosiaalisessa mediassa, miksi Yle keskittyy presidenttitentissään sisäpoliittisiin asioihin ensimmäisen tunnin ajan.",https://img.ilcdn.fi/f8SxOqMOf0dJZ5WMFW5YeSGMnDo=/510x318/top/img-s3.ilcdn.fi/88a339cf78182f8f204153909a7baf227fa97adc7a93804e79afadd4269b137c.jpg,A4C84FA43CFA4F8AB6A99F3CD4C38637
2024-01-25T20:29:03.000Z,Mustasukkainen mies teki naiselle järkyttävän teon tämän syntymäpäivänä,"Naisen mukaan hän pystyi todella käsittelemään tapahtumia vasta, kun mies oli joutunut vankilaan. ",https://img.ilcdn.fi/94cFAbeN4PCenK0hNxcPocMtetI=/510x318/top/img-s3.ilcdn.fi/4c478dc5dee86434e1f6721e1ed8b84fdfbc4b99d27b335a73951fb286bc38d9.jpg,4F3C5AD69A5C4DE9A3ABA8A6441AE323
2024-01-25T20:31:24.000Z,Jussi Jokinen palaa murheelliselle paikalle – Haaveet romuttuivat hetkessä,Jussi Jokinen palaa MM-pettymyksen tapahtumapaikalle. Yhdeksässä vuodessa NHL-miljonäärin työnkuva on muuttunut merkittävästi.,https://img.ilcdn.fi/xAWLt3U-zeYLpFri0ueQEUukqM4=/510x318/top/img-s3.ilcdn.fi/2e28309d9009630b3ecce3fc0afdb4b3ac6fc73cb71252412a5df999f424fcbb.jpg,C966A10A5E7646A58E3AE0C43923F1BA
2024-01-25T20:41:46.000Z,HIFK syöksyi tappioputkeen – Ville Peltoselta rajua tekstiä,"– Todella iso mahalasku meiltä, HIFK:n päävalmentaja Ville Peltonen sanoi suoraan, kun joukkue oli taipunut Turussa maalein 1–3.",https://img.ilcdn.fi/2xGInmI5XG0jgHmJxZEYQMK0OxQ=/510x318/top/img-s3.ilcdn.fi/e5968d094640b358aefde41a81ad5c168d909462b470c9a21915c093e2194026.png,135C757DA0094F22831E4E4484014846
2024-01-25T20:55:42.000Z,Kolme ystävää makasi kuolleena takapihalla – Amerikkalaismies lekotteli vain sohvalla,"Kuolleiden vanhemmat epäilevät, että Jordan Willis huumasi ystävänsä.",https://img.ilcdn.fi/iOtRHdI5N3W9CaHgwRO1okFzcZ0=/510x318/top/img-s3.ilcdn.fi/771889a4388792c426b5d14fb05e28eadd7e5ebd9b751251b92e9140dce9e48f.jpg,EB11B59F1C754CA7ACAE6FFDE7362CBB
2024-01-25T21:00:02.000Z,Taylor Swift oli kannustamassa rakastaan – Samaan aikaan omassa kodissa tapahtui karmeita,33-vuotias mies on pidätetty.,https://img.ilcdn.fi/E38Wl757_erEMpEpMF8a06FIvM4=/510x318/top/img-s3.ilcdn.fi/5fe3fbabfb7d2981a2df302ca499386456cbb2580dca090cb20e0314c9397a60.jpg,21E8DFFA4104475A96E3CEC77B0B7011
2024-01-25T21:02:50.000Z,"Syntymäpäiväsankari Zelenskyi kielsi juhlat, Ukraina saa oligarkin luksusjahdin",Tähän artikkeliin on koottu Venäjän täysimittaisen hyökkäyssodan 701. päivän keskeisimmät tapahtumat torstailta 25. tammikuuta.,https://img.ilcdn.fi/3W6T4tFKok4Ip2ynLkA63mzHkBc=/510x318/top/img-s3.ilcdn.fi/762f35bde1d326b7454f41a7e3eca08999485e66ce7cf88af5e62fafb5f75dc1.jpg,6D36FFFB61BB417BAC43AA9B100340FB
2024-01-25T21:10:13.000Z,Kymmenkertaisen määrän lääkettä saanut vanhus kuoli – Hoitajat syytteessä,Hoitajat kiistävät syyllistyneensä rikokseen.,https://img.ilcdn.fi/UPOWDk19JT9aI5xgQaM0NYt_BR8=/510x318/top/img-s3.ilcdn.fi/1550fcdcfb3e8dfb18c314fea9757ed49c72e3f482249692ae2f0086aaae4087.jpg,77DE8F0686A1428E9532DAFF884DFC2A
2024-01-25T21:11:03.000Z,Rehn piikitteli Stubbia Ylen tentissä: ”Oliko virhe? Sori siitä”,Ylen vaalitentissä Olli Rehn iski kovaa Alexander Stubbia kohtaan.,https://img.ilcdn.fi/7LewsPWMA1Eht2IDnbkELFNyg-o=/510x318/top/img-s3.ilcdn.fi/00541b2350b8844cdd7d4a4fd6095c6556c349c83e25a91b5a52b3ba43649ee2.jpg,1B679996B8614892B9FE67F3B4C7A803
2024-01-25T21:30:34.000Z,Venäjältä historiallisen pitkä tuomio naiselle,Sotabloggarin tappanut nainen sai 27 vuoden tuomion. Myös Putinia arvostellut ultranationalisti tuomittiin vankeuteen torstaina.,https://img.ilcdn.fi/p_ziPDgGyrxBR14MLwniKjayAU0=/510x318/top/img-s3.ilcdn.fi/03bd942fd2d6691d280d968bb860947474e517b9322c0b0ffb20203c59c62806.jpg,C6144444A7164AE391EF47B1F2042D14
2024-01-25T21:54:20.000Z,"Leijonat ja lampaat Ylen tentistä: Demariehdokas ärhäköitynyt – ""Hyökkäsi Stubbin kimppuun” ",Iltalehti arvioi presidenttiehdokkaiden suoriutumisen Ylen vaalitentissä. Kyseessä oli viimeinen tv-tentti ennen sunnuntain vaalipäivää.,https://img.ilcdn.fi/Qtaf2FgLKwqbjMc1gUNQEl7hYWg=/510x318/top/img-s3.ilcdn.fi/76f1ebc1833aa5f27a35a60f75ed41f1aa095bbd7380f410fd4709487069e2d0.jpg,273461FE698E4F76BB6F7ED85E279771
2024-01-25T22:10:08.000Z,Upea läpimurto! Sukupuuton partaalla oleva sarvikuonolaji mahdollista vielä pelastaa,Äärimmäisen uhanalainen zairenleveähuulisarvikuono odottaa koeputkihedelmöitystä kannan pelastamiseksi.,https://img.ilcdn.fi/B7WKRfiUq0lU1CgqKp47e_ic15o=/510x318/top/img-s3.ilcdn.fi/671df6b23ede52af7be375758ecebf3d1b88f56b88ed6d1a1510b1cac1a9ec28.jpg,D033E6E8E6E9459494DF9F5008723965
2024-01-25T23:50:54.000Z,Hjallis Harkimo suivaantui Mika Aaltolan kommentista: ”Älä nyt puhu höpöjä!”,Keskustelut lähtivät laukalle Ylen presidentinvaalitentissä.,https://img.ilcdn.fi/HckO9ZcInYktiOZSF9abNrb6BMk=/510x318/top/img-s3.ilcdn.fi/fc8f447d79a4e788971d4d4ce72871127b2d97908f3c45805dd2335b426f4b63.jpg,E153907633F540F6AE63552496EB2A17
2024-01-26T00:00:02.000Z,Horoskooppi,NULL,https://img.ilcdn.fi/ZJX2nPQHLedeTO4nOGca4bZ5URo=/510x318/top/img-s3.ilcdn.fi/0e855f41645f17dbb2436f21bf69f40ac48d1971a147578985e2c64c1fb985d3.jpg,536CA9A94A1C429E96957B45A1FC2BD9
