paivamaara,otsikko,tiivistelma,kuva,id
2020-02-08T15:59:05.000Z,Teknologiateollisuuden työriitaan ei saatu ratkaisua – Ammattiliitto Pro hylkäsi esityksen ja  ilmoitti lakkojen laajentamisesta ja jatkamisesta,Ammatiliitto Pro ilmoitti teknologiateollisuuden lakon laajentamisesta ja jatkamisesta.,https://img.ilcdn.fi/FLQmBwk1qjHOEexLW7lpdnUmmTw=/510x318/top/img-s3.ilcdn.fi/c8dc9d36a7e182a3bc2fac805557f18aceb0e6abc917eb6c60afce251e2e8511.jpeg,8709C880BBCF408594F265F7310A7677
2020-02-08T16:00:00.000Z,EU:lta tiukka linjaus: kansalaisia seuraavaa kasvojentunnistusta ei lisätä,"EU:n parlamentti vakuuttaa, että se ei aio ottaa käyttöön kasvojentunnistusteknologiaa.",https://img.ilcdn.fi/0BD9rtfQARGi0TEBvADoc1kmFe4=/510x318/top/img-s3.ilcdn.fi/07c095cbe5e27c0ea1acc83e0317e2eb6e270cc10f1365afb7c9e636ed14fe0c.jpg,B727AD49C0364C6D99960FDBAA1EA0E5
2020-02-08T16:00:00.000Z,Hollywoodin paras pukeutuja! Margot Robbien asut pistävät muut häpeään,Näyttelijä Margot Robbien viimeaikaiset asuvalinnat ovat osuneet aina nappiin. ,https://img.ilcdn.fi/oaLbDE0pQ7nl7utUEVe7mYU9R-o=/0x156:1738x1242/510x318/top/img-s3.ilcdn.fi/cde4e9733043b4bd97e55a797a0166c5aa3a63d7ef8ff8e69969a8da40c730ab.jpg,78238B764F924902A6BA2B7E126D8D68
2020-02-08T16:00:29.000Z,Armeijan keskeyttäminen harmittaa Kalle Rovanperää – ”Se meni vähän vaikeaksi”,Kalle Rovanperä joutui keskeyttämään varusmiespalveluksensa vain vajaan kahden kuukauden jälkeen. ,https://img.ilcdn.fi/4aOynMzXfPy-2MEfJXSQXTEhxXQ=/510x318/top/img-s3.ilcdn.fi/9453a4e6c90cb85b40b051c8dbda6debe7b129967df7f22ddaa8855eb73e3a3e.jpg,0080ED8C1C0C455FB41E5841D99BE509
2020-02-08T16:06:49.000Z,Gettomasa yllätti Emma-gaalan punaisella matolla – tyrmäsi Pyhimyksen periaatekysymyksen jättää gaala välistä: ”Kyseenalaista”,Viiden Emma-palkinnon saajaksi ehdolla oleva Gettomasa ihmettelee Pyhimyksen päätöstä jättää gaala välistä.,https://img.ilcdn.fi/JDXB0f-JaU0tXUimjdt6UWc0f38=/510x318/top/img-s3.ilcdn.fi/d699e83098797602b422b26e1309e8e1799040e172f30f0e76ce0cdac505b9f7.jpg,C4611010D1EE413F923011F6984E41ED
2020-02-08T16:18:49.000Z,Jenni Vartiainen hämmästytti saapumalla Emma-gaalaan – nauttii arjesta lapsen kanssa: ”Se on maailman parasta”,Jenni Vartiainen kertoi äitiyden tuntuvan luontevalta.,https://img.ilcdn.fi/IZjYZU-XotpKLzFcmQBQokpohs4=/510x318/top/img-s3.ilcdn.fi/1f4bfee9a79bbaefcc073c912a346e77e00eef4fea93c6cbd41cea213bceac6b.jpeg,20C2720AE5C64D66B8B868BDE8428930
2020-02-08T16:42:26.000Z,Jari-Matti Latvala kertasi rankkaa viime vuottaan – odottaa verottajan lopullista ratkaisua,"Jari-Matti Latvala myöntää, että viime vuosi meni piloille siviilipuolen haasteiden takia.",https://img.ilcdn.fi/0yK_yAtRU9WOaKT0pTXcIdU_WYE=/510x318/top/img-s3.ilcdn.fi/e582188e507f14f19381775f31b05523e3c783e8118d44bcce40c85ed576bd63.jpeg,59533F9225254B02B9CE056192E756B4
2020-02-08T16:45:59.000Z,"Erika Vikman kommentoi asumiskuvioitaan Dannyn kanssa – koti kahdessa kaupungissa: ""Siitä on kyselty paljon""",Erika Vikman kertoi kuulumisiaan Emma-gaalan punaisella matolla. ,https://img.ilcdn.fi/nQQkgLu8TPZSQ02VHCYmPhzOCpg=/0x170:2000x1420/510x318/top/img-s3.ilcdn.fi/8d3a983e594016b52755d17bdfa3afe6965dc1fa30dec7e93a97165cd489cdde.jpg,FCB62509C39B42AE83BECDFE065BAF55
2020-02-08T17:01:20.000Z,Saksalaisyleisö villiintyi – yllättäjä leiskautti uransa ensimmäiseen maailmancupin voittoon,Antti Aalto pääsi ainoana suomalaisena toiselle kierrokselle.,https://img.ilcdn.fi/Ly8zkQRKujYMR3BjD0j9WlqhDTw=/510x318/top/img-s3.ilcdn.fi/0c1accbdd7075d73cb451e6d8558f95e2b2b3b746d122a04a87f1a2b67038fc0.jpg,0767D1EDE485489FBEE4167B4580C606
2020-02-08T17:03:16.000Z,Martina Aitolehti juhlii Emma-gaalassa ex-miehensä Esko Eerikäisen kanssa – Stefan-rakas jäi kotiin,Martina Aitolehti saapui Emma-gaalaan ilman Stefan-kihlattuaan.,https://img.ilcdn.fi/hLQUHV3xxaWF_OkrqhknRuLqORE=/293x83:1678x941/510x318/top/img-s3.ilcdn.fi/9a4b2f4f6a92b12065a5f35befcc30f8b630e1e5097f4f864aba86f8c3275596.jpg,3BC503832A394C20B4994AAD0D741588
2020-02-08T17:18:51.000Z,"Tiesitkö? Jos Pohjois-Korea tekee ydinkokeen, tämä sysmäläismökki havaitsee sen 10 minuutissa",Piskuisessa Sysmässä valvotaan suurvaltojen ydinkokeita ja maanjäristyksiä.,https://img.ilcdn.fi/T5Zko2X-mn4hNBuDUJztIAULBIQ=/510x318/top/img-s3.ilcdn.fi/4be7b4af4a73eb813e8d18c8292c19785bf84ac9abaa0794d29b73f58c0853f4.jpg,E25C970BB6EB4B32A63ECF2FA904D047
2020-02-08T17:30:20.000Z,Conor McGregorin pieksemältä UFC-ottelijalta hurja paljastus: ei saanut penniäkään massiivisista tv-tuloista,Donald ”Cowboy” Cerronen pyristely päättyi 40 sekunnissa.,https://img.ilcdn.fi/WsWl9QAKrb5A58S9074f433pQXE=/510x318/top/img-s3.ilcdn.fi/d9d9ee9249d92776e67ed4738e24770ebf8af3c5c16fdebc167620861e5a47a8.jpeg,084C36CCCE8C4D588BB3AA2AF295B0E4
2020-02-08T17:40:57.000Z,Samu Haber kirjoittaa elämäkertaa: ”Samun seikkailut – K-80”,Vienti-Emman voittanut Sunrise Avenuen keulakuva Samu Haber on nauttinut täysin siemauksin ajastaan Suomessa.,https://img.ilcdn.fi/grKqac6Wf2Y4SlDQ2zTSwvAFkkQ=/510x318/top/img-s3.ilcdn.fi/547825a5fe5974efb38cd35d9269c80b51b424fb49fca83def642db50b6636d4.jpg,9B4DC1E4F9054BE29348006CD1D7C81D
2020-02-08T17:45:30.000Z,Live-Emma tuli! Paula Vesala paljasti pysäyttävimmän keikkahetken: ”Aloinkin vaan itkeä”,Paula Vesala kertoo selättäneensä esiintymisjännityksen viimeisimmällä keikkarundillaan.,https://img.ilcdn.fi/feVAyxjsrZA4LYpDOT1VVPUIdUI=/510x318/top/img-s3.ilcdn.fi/531cb94f3ac5db616283871a85d0a5f1dd00118b0743a854b3f61aeca029f505.jpg,0123882D4D114698A064FEC8BB90867D
2020-02-08T17:49:17.000Z,Täysin tuntematon artisti varasti show’n Emma-gaalan punaisella matolla – tämä asu käänsi kaikkien katseet,"Laulaja ja tubettaja Pinsku ei ole vielä suurelle yleisölle tuttu, mutta hän varasti huomion Emma-gaalan punaisella matolla. ",https://img.ilcdn.fi/umTUi9YDat3jrn9b2RT3GWdvNsk=/510x318/top/img-s3.ilcdn.fi/e94429ad68aff56a5eade4b138bfe1a9f28a1213f0174002215738e8f54d74fb.png,36345F3285594D95ACE6FBCA1E6640B5
2020-02-08T18:00:00.000Z,"Hedelmien, vihannesten ja teen nauttiminen vähentää riskiä sairastua Alzheimeriin – tuore tutkimus pureutui flavonoidien merkitykseen","Ihmiset, jotka saivat ravinnosta eniten flavonoideja olivat muutoinkin aktiivisimpia.",NULL,2C385C7B08BF4030B991EEB71FF96EC1
2020-02-08T18:05:25.000Z,"Heikki, 31, hävisi pörssiin puolet säästöistään – sitten hän luki 70 sijoituskirjaa ja kaikki muuttui",Tuore sijoituskirjailija aloitti sijoittamisen tekemällä mojovat tappiot. ,https://img.ilcdn.fi/YYWXv8OQseon2pykGahImqGsCPI=/510x318/top/img-s3.ilcdn.fi/b6bbbf3c71b425d5e28bb27b98e9446a8713f40cc367f9470c2022a4362487d1.jpg,DB20021199EE417BBD40DB85BA96A1DF
2020-02-08T18:14:35.000Z,Jari-Matti Latvala laittoi yli 100 000 euroa omaa rahaa näyttöpaikkaansa – tonneja maksanut kypärä herättää huomiota,Jari-Matti Latvala sijoitti pienen omaisuuden päästäkseen ajamaan rallia.,https://img.ilcdn.fi/WZwm4m8M2UHPi4DJGojGnzMmB8E=/510x318/top/img-s3.ilcdn.fi/ff684edaf8e81ce77e9e998deeee4af9561726a8c28b22c3e2ccd3014a981125.jpg,CCF81AC8DFFE4800A4FB1A2651F17E58
2020-02-08T18:19:09.000Z,Antti Tuisku teki paluun Emma-gaalassa – show sai yleisön suut loksahtamaan auki ,Antti Tuisku teki paluun keikkatauolta Emma-gaalassa.,https://img.ilcdn.fi/4fObhwdLryxOXCDOkBBpn3F6rg8=/510x318/top/img-s3.ilcdn.fi/53c8299a10561a4de06122002aafdaa0d9ed28e686a878a381368a35532a52ad.jpg,58BE8AD9702E40678BE454A251C82943
2020-02-08T18:24:19.000Z,Jare Henrik Tiihonen palasi julkisuuteen – Emma-gaalan yleisö villiintyi ,Jare Tiihonen on pysytellyt pitkään poissa julkisuudesta.,https://img.ilcdn.fi/jmfaAsvE70Oc3sJO1voJ89Hjk0A=/510x318/top/img-s3.ilcdn.fi/f093046dbe154beaf79b65805ad30f3806c109f5ebfec506300d706cecf05775.jpg,31D3C2704F9546F8BF91F18F009CD077
2020-02-08T18:43:52.000Z,Rohkeita halkioita ja kirkkaita värejä – tässä ovat Emma-gaalan upeimmat asut,Emma-gaalan punaisella matolla nähtiin säihkettä ja rohkeita valintoja.,https://img.ilcdn.fi/OMmtfLir896r3XuDbLgg7WfcEF8=/510x318/top/img-s3.ilcdn.fi/be236449bc3f8d9fb87885547a4210f1db8afc31d9e47b8980c610d5e2adb0c2.jpg,47E2E383F4304E77BDDDEB6502773AA6
2020-02-08T18:55:05.000Z,"Xavier tekee taikatemppuja, jotka ajavat kulmat kurttuun – miten tämä on mahdollista?",Xavier näyttelee taitojaan muun muassa Las Vegasissa.,https://img.ilcdn.fi/8Cbra828uapQ7CMRAX-0HqZPD2o=/510x318/top/img-s3.ilcdn.fi/bc5de56bdac0a2d68e39c9359d4fff9cec531265e11e41388f8b88d388e3b24c.png,A5BE6D1674A6442FB855D06B31103C08
2020-02-08T19:03:02.000Z,103-vuotiaana menehtynyt Kirk Douglas haudattiin Los Angelesissa,103-vuotiaana menehtynyt Kirk Douglas laskettiin haudan lepoon perjantaina.,https://img.ilcdn.fi/J5dWz00xol6mcKB2upq4Ev4LjvE=/0x203:2323x1655/510x318/top/img-s3.ilcdn.fi/e096938a65d11aad321ea4f19d3ed7135f0eba00288a0a3820577293000f2b79.jpg,0D1932FFE0904B7282400C9F071B05F5
2020-02-08T19:08:27.000Z,Vakava onnettomuus Loimaalla: henkilöauto törmäsi betoniautoon – yksi kuollut,Liikenne valtatie 9:llä on poikki.,https://img.ilcdn.fi/TthvHuT1zMQr7vSw8lRtmsQ1eA0=/510x318/top/img-s3.ilcdn.fi/740f45acf8cc529849f52fafabe520e8c53bfc1ef5acdea514f7c18633c310e4.jpg,B62194BF9DF144C7B9CA675FCB49A568
2020-02-08T19:37:27.000Z,Lukas Hradecky nollasi Norjan ihmepojan komeasti – Leverkusen kampesi sensaatiomaisesti voittoon,Leon Bailey osui vajaassa kahdessa minuutissa kahdesti.,https://img.ilcdn.fi/iPFDN2Z6nrGoQwxY-CdKAijY7R0=/510x318/top/img-s3.ilcdn.fi/135f901453c30e060711b3aa0e6191e3aabcfb7c91c0fdbb2de97baa0f50e76b.jpg,F8D389A8FB904EEFB166E65C2D360DAA
2020-02-08T19:46:43.000Z,Maailmanennätys Ruotsiin! Hyppääjäihme Armand Duplantis teki sensaatiomaisen tempun,Armand Duplantis vei Renaud Lavillenieltä ME-tuloksen.,https://img.ilcdn.fi/Ajcbn7Nj8-NJy-JMkJOs9LFN4kM=/0x874:2878x2673/510x318/top/img-s3.ilcdn.fi/44adf61acdd28d24515936efcca6340bb9af97a5fb39c653cdacace5b6be693d.jpg,F51C168752D5475D8ECFA0F2D282A9B8
2020-02-08T19:48:41.000Z,Putouksen sketsihahmokilpailussa toinen pudotus – hän joutui kotimatkalle ,Toinen sketsihahmo joutui jättämään Putouksen.,https://img.ilcdn.fi/017RjcqxTtO5BG1AxeJZhryi4f4=/510x318/top/img-s3.ilcdn.fi/07041be1263b013e575ebfcbafccbfa05fc1e0288a42e88495fa68921a0923c1.jpeg,E25BBE346C9646FBA54E4CC57679BEFD
2020-02-08T19:56:07.000Z,”Ollut aika kiusallista...” – näin keskustalaiset kommentoivat hallitusyhteistyötä ja surkeaa kannatusta ,"Keskustan kuntapäättäjissä on tyytymättömyyttä hallituskumppaneiden toimintaan, vaikka hallituksessa halutaankin pysytellä.",https://img.ilcdn.fi/6kdNfM5fEbRu5QvYmroAVKMkEJw=/510x318/top/img-s3.ilcdn.fi/a24f48f702b6796b79a9fc9d2a76e5f7100c10137bb2a182b472c276d967cc70.jpg,671EFC706E9D4117A6E6D90C820F1BED
2020-02-08T20:10:21.000Z,Loch Nessin hirviöstä tehtiin tämän vuoden ensimmäinen ”havainto” – katso kuva,Jokin useita metrejä pitkä ”ui ja läiski” kuuluisalla Skotlannin järvellä. ,https://img.ilcdn.fi/bBmzY8qA8dj8SzHqbmqzDd7Hv78=/510x318/top/img-s3.ilcdn.fi/ae0787200da57ead0a926bf4bb026d63d5f33fafa430aa6042453cfdc123287f.jpg,7A753A52FC1947118925E3344C51BD8B
2020-02-08T20:11:07.000Z,Superyllättäjä Jesse Markin kahmi kaksi Emmaa – oletko kuullut hänestä?,Emma-gaalan yllättäjäksi nousi tulokas Jesse Markin.,https://img.ilcdn.fi/tCKaGgEOWduEjDOWevCnOhmtUuo=/510x318/top/img-s3.ilcdn.fi/3b889ba36e6a5b68eea391162605699c504a4fc3ccfe9a3e06dfc6e2e115b249.jpg,DBFCD51F77B24885A2F64712479F0EBB
2020-02-08T20:20:05.000Z,Lotossa ei yhtään täysosumaa – katso oikeat numerot,"Ensi viikolla potti on 2,4 miljoonaa euroa.",https://img.ilcdn.fi/kF-9ZaAMnFw6siKT7UY-NIdfOe8=/510x318/top/img-s3.ilcdn.fi/b49b9e8c96aed1e6ee646e91f2ed5a355be5202e38babff64df55c9c306f8c27.jpeg,768DCD5CF4EE4D0F8DD41D265BD6CE72
2020-02-08T20:21:22.000Z,Naisleijonat EHT:n voittoon! Ruotsi kaatui finaalissa tyylipuhtaasti,Suomi voitti Ruotsin finaalissa maalein 4–0.,https://img.ilcdn.fi/_wJGeN-qLkXz2EYwJoHRmekgd-I=/510x318/top/img-s3.ilcdn.fi/1137e30b1127dc07d9c2e18642de7fb2401192e4696fcc3de3ecf79f124eefcc.jpg,84ED358156E9453789D141BE0EE6A719
2020-02-08T20:21:58.000Z,Tässä ovat kaikki Emma-voittajat – JVG ja Lauri Tähkä kahmivat pystejä!,Emma-gaalassa palkittiin jälleen Suomen menestyneimmät artistit ja yhtyeet. ,https://img.ilcdn.fi/TUGnOQ7P3Grj96EBiy-yn_oEfno=/510x318/top/img-s3.ilcdn.fi/638ecee0968efb46b1dba763b01d9c69690732697d9a4a766d0a55ba87499e40.png,6C28B4AD39874282897483E2F28F0F28
2020-02-08T20:27:12.000Z,Valas ui Emman vierelle ja alkoi synnyttää – katso video,Emman turistimatka koki eksoottista eksoottisemman käänteen.,https://img.ilcdn.fi/GCl2aLZ1CMMYx-n3lOGSJOsBzgU=/510x318/top/img-s3.ilcdn.fi/f8d51d747a3e383a1cc4231ce1f6a916bb9af8106d2888f413025245cb6fa154.png,C139C1FF5E7E4650A9088A171C2B2827
2020-02-08T20:37:22.000Z,Eva Wahlström hävisi maailmanmestaruutensa nuorelle tähdelle – päättyykö suomalaisen upea ura?,Terri Harper kukisti suomalaisen yksimielisesti.,https://img.ilcdn.fi/RqB4hEBozeCVhwjgzT6sM0XzJmM=/510x318/top/img-s3.ilcdn.fi/eb8153d3c098c157e88c81f127fde87ad3056302459b4250785ed6080d221c59.jpg,5D1EF345FD964E17948BC4B7725FCC55
2020-02-08T20:37:24.000Z,Lauri Tähkälle uransa ensimmäiset Emmat - jättää juhlat väliin: ”Villasukat jalkaan ja nukkumaan”,"Lauri Tähkä sai kolme Emmaa, joista yksi oli illan kovin, nimittäin Yleisö-Emma.",https://img.ilcdn.fi/E1meAgH8XtfYf8dmhN1NUYz41Ns=/0x225:2000x1475/510x318/top/img-s3.ilcdn.fi/8bbc143ea9e3226728399964229b620d4530d8ac468ab44abbfd264f3cf52fe6.jpg,EF4EE5121983432B8445648D1D7A93DD
2020-02-08T20:53:00.000Z,Jarmo halusi haloilmiöstä ottamaansa kuvaan vielä jotain lisää – lopputulos on upea,"Jarmo Kuittinen kertoo, että paras kuva syntyy spontaanisti.",https://img.ilcdn.fi/a6m9pfu1rycVJBUi8OoXFkuhdmw=/510x318/top/img-s3.ilcdn.fi/022eb9c2e608ebbdd6becbaa838d02ecd44f6a47dd38521335a889da517500a5.jpg,44FD1711B55C4F80927CF468F7594ACC
2020-02-08T21:15:53.000Z,JVG kahmi eniten Emmoja – yllättävä tunnustus jaksamisesta: ”Rehellisesti sanoen...”,"JVG kahmi peräti neljä Emmaa, nyt duolla on yhteensä 13 Emmaa.",https://img.ilcdn.fi/fWdOClNNxAlivV9czLcXwVydlkM=/510x318/top/img-s3.ilcdn.fi/d8e3a7206b54bd6edb51bd6a9ce3eeae2d16e8453367e0cc8f87229f8b4e21cd.jpg,B3EE12A54FC34F4F8676C26236ADFAF5
2020-02-08T21:23:02.000Z,"Naispuolinen vanginvartija leikkasi Britanniassa reiän housuihinsa, jotta pystyi harrastamaan seksiä virkapuku päällä pahamaineisen gangsterin kanssa",Vartija sai kahden vuoden tuomion.,https://img.ilcdn.fi/mmtU-wYJPNVr296an1AVXFI9QUY=/510x318/top/img-s3.ilcdn.fi/55a52b1a6a0e5439bb5410835d59a01a0262c056ec631d8753cd80a01f0b8cad.jpg,F96D874BB80346AEAADC5B3472407EB5
2020-02-08T21:43:47.000Z,Patrik Laine paukutti ensimmäisen hattutemppunsa yli vuoteen – Katso tästä kaikki maalit,Tamperelaisen edellisestä hattutempusta ehti kulua pitkälti toista vuotta.,https://img.ilcdn.fi/0IIFGKN2-H5kBHPXRJ7moJZvfyU=/510x318/top/img-s3.ilcdn.fi/d1fa2ff4238e0f379181decd95f577272275f1cff505c0bb8caa4b088c50b49f.jpg,647FECE69DC543678D92410D4DEBC69E
2020-02-08T21:48:51.000Z,Maailman tunnetuin plusmalli Ashley Graham julkaisi suloisen imetyskuvan – paljasti poikansa nimen,Ashley Grahamin esikoispoika sai nimekseen Isaac.,https://img.ilcdn.fi/MP1F4fmQlfW-OAu9p3uRH-1sKf8=/0x0:2000x1250/510x318/top/img-s3.ilcdn.fi/b691a011d45830a4e5aa8886bce4a8e60b06213054dbe34be3cc55ab8a627f00.jpg,B0333DD3216F472FA0E4C7D74ACDE267
2020-02-08T22:34:23.000Z,Valtteri Bottas toi Tiffany Cromwellin Lapin hangille,Tiffany Cromwell on tutustumassa Valtterin Bottaksen kanssa pohjoisen maisemiin. ,https://img.ilcdn.fi/6DDPATAIgZthMFg0eFikhIyw3do=/510x318/top/img-s3.ilcdn.fi/45c64662e79084d89bcee9e6a190c5188e7b0b2c220c2e8a704ab6e9b88b54cb.jpg,E5BEA15CC8DE492E8B6C169BCE062238
2020-02-08T23:16:12.000Z,"Täydelliset naiset -sarjan näyttelijä Orson Bean, 91, on kuollut ",Näyttelijä ja koomikko Orson Bean on kuollut.,https://img.ilcdn.fi/1Ja3A0ZMpsafeAd_06usENsy13I=/510x318/top/img-s3.ilcdn.fi/27e7b020fa899031c71a60cf6834dc07edf42c351fbb0558d46773931883268c.jpg,FCC0E798FF354931ABB1078866FB346B
2020-02-09T04:02:26.000Z,Superharvinainen 1-luokan Mannerheim-risti myyntiin ensi kerran: ”Tämähän on ihan ainutlaatuinen”,Ristit on myönnetty Mannerheimille ja jalkaväenkenraali Erik Heinrichille. Moista ei ole myyty koskaan.,https://img.ilcdn.fi/ncjg76RWLbiabov9KATD_z_liDU=/510x318/top/img-s3.ilcdn.fi/6b9f1b6f2a70c065188fc125accde0e95714be7e5d0852938cba735a287a57f2.jpg,F0C538B4BD184D9C8FA5D77203D90EDE
2020-02-09T04:18:22.000Z,Sunnuntaina vielä poutaa kunnes maanantaina tapahtuu käänne: sateita tiedossa koko maahan,Sää on lauhaa monin paikoin. ,https://img.ilcdn.fi/8-tjJ-36GYLuByhzfCPNSIz1qsY=/510x318/top/img-s3.ilcdn.fi/872df2a935d5942c6cd5a42f82e4e5b92bcd9be82d4a074104050a588d77df25.jpg,51E5146210F34E53AD82989EC794CFDC
2020-02-09T04:36:07.000Z,"Nisa Soraya, 62, vahvistaa vuosikymmenten takaisen kohusuhteen – rakkaus syttyi Markku Aron kanssa keikkaillessa",Nisa Soraya on viihdyttänyt suomalaisia jo 40 vuotta. Esiintyjän yksityiselämä on ollut vähintäänkin yhtä värikästä kuin show-kokonaisuudet.,https://img.ilcdn.fi/V0RBckIiTGDJ60sr-0HXukfZtnQ=/536x203:2400x1370/510x318/top/img-s3.ilcdn.fi/60e23a74295683e1b48d06087b256c5d7faca697ca19ac752aeb4f865e1ec8e7.jpg,FA271718C5104AEEA146654B7B217E67
2020-02-09T04:40:50.000Z,"Saunassa voi piillä ikävä yllätys: tunnistatko, milloin kiuaskivet pitää vaihtaa?","Saunan sydämestä, kiukaasta pitäisi muistaa huolehtia.",https://img.ilcdn.fi/C5er2B0s4Fzgxubq1ewppSxjXHc=/510x318/top/img-s3.ilcdn.fi/6f23172fbe05b228a3211345b295721bfa61f8d933df57702bd128ab1a8b3785.jpg,AE643D0E04724DC2A87E56405FA11F18
2020-02-09T05:02:20.000Z,"Vankiloiden toimintamalli myllätään uusiksi – vartijoista tulee valmentajia, vangeille digipäätteet: ”Monilla arjen taidot aivan hukassa”",Noin puolet vangeista palaa vapautumisen jälkeen pian vankilaan. Monilla paluuta vauhdittaa arjen taitojen puuttuminen.,https://img.ilcdn.fi/ybyzTWYaGmUD9a-wRv6ZnO-1Ve0=/510x318/top/img-s3.ilcdn.fi/159850f0ed3fb3cc627788bf0d557ba940d5f5c7b05bbe72df7cdd54913f742b.jpg,E32C8D9A68AC45829992C8D6CAD6F549
2020-02-09T05:10:21.000Z,"Kalle Rovanperä on kasvanut tv-kameroiden edessä – kertoo nyt toisesta puolestaan: ""En ole erityisen ulospäin suuntautunut""",19-vuotias Kalle Rovanperä on jo kokenut rallikuski.,https://img.ilcdn.fi/YDIlnAy8f9Tn_xMa487upDdNPJQ=/510x318/top/img-s3.ilcdn.fi/dfef68e20da609bb542bb72b1691dfc823bb40604ce36b56f90d9edccc8a1c9c.jpg,F440321CCE4446AABADE3921CED07040
2020-02-09T05:27:44.000Z,"Katin, 28, huulet ennen ja jälkeen täyteaineiden: ”Itseluottamus on paljon parempi”","Kati Sironen, 28, otti huulitäytteet ensimmäisen kerran kaksi vuotta sitten. Enää hän ei aio luopua niistä.",https://img.ilcdn.fi/z6h6XrCSYOvOFxKa0YWhJj1sD-M=/510x318/top/img-s3.ilcdn.fi/8c6c17f241d8f9ea9aa01fb67e50f6380921219135128bfba1efaead7295d220.jpg,BDEC84B4A0104E299BBD9BD547FE9F9E
2020-02-09T05:28:48.000Z,"Tuure Boelius kertoo, millainen on hänen unelmiensa kumppani: ”Haluaisin löytää yhtä hyvän miehen kuin iskä on äidille”","Tubettaja ja laulaja Tuure Boelius kertoi Iltalehdelle, millaisen kumppanin hän toivoisi löytävänsä rinnalleen.",https://img.ilcdn.fi/VWrz8_46bOsHOKD0QRGgoOzuJZA=/510x318/top/img-s3.ilcdn.fi/b42fecc23baeeb11197bb1dcf11b3dbab1cab2a9603cd374a1b1791a80685233.jpg,3178048CD467462B8E212408AF9BE035
2020-02-09T05:31:45.000Z,Tällainen oli Emma-gaala – katso kooste illan tähdistä,Emma-gaala järjestettiin 34. kerran.,https://img.ilcdn.fi/Dlj7OFSCxVyQ62q_qT7QaqPKBUk=/510x318/top/img-s3.ilcdn.fi/e3a1df9814348c9c6202c21b46e9bacf00098d397714934c44447f5d1591df9d.jpg,40C11F8BD5B84E1C9B26A3D775BB19B4
2020-02-09T05:48:59.000Z,Eva Wahlström menetti MM-vyön – britit haltioissaan historiallisesta tapahtumasta: ”Wahlström on kotimaassaan suuri tähti”,Terri Harper aiheutti Eva Wahlströmille tämän uran toisen tappion.,https://img.ilcdn.fi/1XI76O30zGiFv7UxFxr-gRcttG0=/510x318/top/img-s3.ilcdn.fi/2453915de4b54a853fd70460231259eef857ef29f92e5c3dc2b66bca4c8f8c90.jpg,BBDE275930D9412588C48338864AF915
2020-02-09T06:00:11.000Z,Ilman yhtään ystävää ,"Lukiolainen Eetu kirjoittaa avoimesti itse, miltä tuntuu olla yksinäinen. ",https://img.ilcdn.fi/IjcD62m4phBgmKmKihrf3wtlcxY=/510x318/top/img-s3.ilcdn.fi/4043619ee937b1cc333f1b45cf6efdfd4e9cb936bf6564f64763bac2c7cbbc6d.jpg,E2D9145A50034E6AB3B38357D483CC98
2020-02-09T06:02:00.000Z,Himotuin reppu juuri nyt - näin löydät sen halvemmalla kuin muut,"Oli haussa sitten tämän hetken halutuin reppu tai uusi matkalaukku lomareissulle, hintojen vertailulla voi säästää kymmeniä, jopa satoja euroja.",https://img.ilcdn.fi/zsQJ0Dzc2BdcevPFYHpqkDn0x0Y=/510x318/top/img-s3.ilcdn.fi/6407ee61fe886dafa7affaf3ff5112e214189a3725d8244b468772e8350e112b.jpg,3F375361DB8D4AA0B88B197618D3024D
2020-02-09T06:23:56.000Z,Vuosi Olli Lindholmin kuolemasta - ystävä muistelee viimeisiä aikoja yhdessä: ”Oli rakastunut ja onnellinen”,"Olli Lindholmin kuolemasta tulee 12. helmikuuta kuluneeksi vuosi. Musiikkituottaja Jimmy Westerlundin on yhä ajoittain vaikea uskoa, että työtoveri ja ystävä on poissa. Monta kertaa on tullut mieleen, että lähtö oli liian aikainen.",https://img.ilcdn.fi/4xImaaYwNuuFJ-TPLb1wcWxJPaI=/510x318/top/img-s3.ilcdn.fi/fb3c237342d3bb2dc2754c76c9d00bbfa9656d8cf75063bdb3a2bd6eb5a86397.jpg,609515984C2E45E1BE7169C6D9CE7A04
2020-02-09T06:32:34.000Z,Sebastian Aholle 30 maalia täyteen! Suomalaiset rohmusivat tehopisteitä NHL:ssä,"Sebastian Aho sivusi NHL:n yhden kauden maaliennätystään, ja aikaa ennätystehtailuun on vielä runsaasti.",https://img.ilcdn.fi/lG9Bd965gIb0aLBemGPKC5s2Hgg=/510x318/top/img-s3.ilcdn.fi/5ad22a7b8d70a5efab5ff1e7891edc82c3c56f258f28bf6c3e187f7911f9d4f3.jpg,BA135EFC7C8548A299EFF9BB9E3A368E
2020-02-09T06:58:30.000Z,Saksalaistaitelija aiheuttaa liikenneruuhkia älypuhelimilla: Googlen karttapalvelu sekoaa,Googlen karttapalvelua voi johtaa harhaan vetämällä perässään 99 älypuhelinta.,https://img.ilcdn.fi/oTxAwNZlcGk8ZhXhCdwOyD9Lvl8=/510x318/top/img-s3.ilcdn.fi/614d59bb6d4fbc213792b708e0d51ac427e214b49f2b7629f3b16173cfe76606.jpg,FCF0D64A54B84C7B811ABBEC71C6B166
2020-02-09T06:59:57.000Z,Barcelonalla hyökkäyspäässä vajausta – 17-vuotiaalla superlupauksella tilaisuus loistaa,Sunnuntain kovin koitos on La Ligan myöhäisillan ottelu Betis–Barcelona.,https://img.ilcdn.fi/ZFosPkwBusXybA_cDUUQs3SnVpI=/510x318/top/img-s3.ilcdn.fi/52c53f9719dec725c895d2b2c5e4cee529f4727eeccef3a0dbcdb69981cc5d3d.jpg,CAFE6D526FAD4EC58176AEBF5E0E977E
2020-02-09T07:01:26.000Z,Tämä saattoi jäädä televisionkatsojalta näkemättä! Ellinoora häkeltyi Vuoden naissolisti -Emmasta – työnsi kätensä kakkuun,Ellinoora voitti himoitun Vuoden naissolistin Emman.,https://img.ilcdn.fi/0bTm_30puZkKTVfLY6yR5aBl3vY=/510x318/top/img-s3.ilcdn.fi/5388ba9aea6013fccedbbc599efc5370576dcb021c1b21858ea98eee45e73f7c.jpg,7E7B39C883E543838284DCD5D3AD2598
2020-02-09T07:02:10.000Z,"Päivän ravivihje: Toto4, Forssa 9.2.","Toto4, Forssa 9.2. klo 13.",NULL,F7FD0018321D41949D5D746F547CCEEB
2020-02-09T07:15:25.000Z,Valtiovarainministeriö ja keskusta hyysäävät rikkaita veronkiertäjiä,"Valtion verotulojen vähäisyyttä voivotteleva valtiovarainministeri Katri Kulmuni (kesk) ei halua tukkia porsaanreikää, joka mahdollistaa rikkaille miljoonien eurojen siirtämisen ulkomaille verottajan ulottumattomiin, kirjoittaa politiikan toimittaja Tommi Parkkonen.",https://img.ilcdn.fi/UC0Oer31PhK0oVpe9WQEIt1XghQ=/0x188:5792x3811/510x318/top/img-s3.ilcdn.fi/4fe978c0fdfc9c5bbf665536e5a93008e8b05594c2778ba26a55ab87d78fed2f.jpeg,A455050EFFCC4873991EE25241C60AAE
2020-02-09T07:30:40.000Z,"Mauno-koira vaistoaa, koska jäätävä kohtaus iskee - Päivi kärsii lamauttavasta kivusta joka päivä ","Päivi Vaarakallio, 51, saa joka päivä vähintään yhden lamauttavan kipukohtauksen.",https://img.ilcdn.fi/hKlJOL98rQ4inzNGT7ShSvASs-o=/510x318/top/img-s3.ilcdn.fi/43b745597ec5fb38ebc684923a62315037c7b7062538ff6ae18b203269a91333.jpg,A207D9AA53024DAA92487FDF0DB80FA8
2020-02-09T07:31:05.000Z,"Silmät muuttuvat videolla karmealla tavalla – voimamiesjätti kertoo, kuinka hirvittävä runttaus valutti verilammikon: ”Täällä Eddie Hall kuolee” ","Eddie Hall pitää hallussaan maastavedon maailmanennätystä. Brittiurheilija kuvailee, kuinka koville 500 kilon runttaus laittoi kropan.",https://img.ilcdn.fi/8TuavrNK_SduhkaWvR1jzRA7qTA=/510x318/top/img-s3.ilcdn.fi/e36337fa8c7cbaa0ad8e9951366f8f018538e0db9b4e3ba32b6760cb97780f6f.jpg,528641D3A67948BAA23C3FD4EFC6FB84
2020-02-09T07:31:36.000Z,Chisun Emma-palkintopuhe poikkesi muista – kiitti itseään ja lausui miehelleen yleisöön yllättävät sanat: ”Rakastan sinua”,Chisu riehaantui voitostaan Emma-gaalassa.,https://img.ilcdn.fi/TbOWvXEywfr9PQpDf5BhC-rxXhQ=/510x318/top/img-s3.ilcdn.fi/5a3a25f84f2d3526b0da35c3ee5d4d193c7d8476e5e6d805f00d8735f2d15255.jpg,3CDB1C551FC34E64B659494CDF22FFC2
2020-02-09T08:05:57.000Z,"Natsikenraalit uhmasivat Hitleriä kehittääkseen kiväärin, joka muuttaisi sodankäynnin pysyvästi – jäljet näkyvät vieläkin kaikkialla",Saksalaiset kenraalit uhmasivat Adolf Hitlerin suoraa kieltoa kehittäessään uutta kivääriä. Työn lopputulos näkyy kaikkien maiden armeijoissa vielä tänäkin päivänä.,https://img.ilcdn.fi/gD8yWk37tVzE5nOdO34IPSjQB5s=/510x318/top/img-s3.ilcdn.fi/a35c9e27665188a1b8ccef6eb62f03c72b9f505dd00fed60c543ae391ef1273f.jpg,34330A541A474F01957370D8B32FF0FA
2020-02-09T08:32:38.000Z,Vahva suositus: Paratiisi-sarja on loistava ja niin on Riitta Havukainenkin,"Riitta Havukainen on uudessa poliisisarjassa Hilkka, joka on Fakta homman Hansun vastakohta.",https://img.ilcdn.fi/eGMNU8ICWC2oc-a-nWinRNqig9Y=/510x318/top/img-s3.ilcdn.fi/77908eb1c1293b39fa6ecf08931676e20017398c10f58d013279df62b63fd399.jpg,3C15D221F4874BD9A686A0597DCD3F0C
