paivamaara,otsikko,tiivistelma,kuva,id
2024-01-23T12:42:12.000Z,IL-tentin ryhmäkuva huvittaa somessa – Mika Aaltola vastaa ihmettelyyn,Presidenttiehdokkaiden ryhmäkuvasta pomppaa silmille Mika Aaltola.,https://img.ilcdn.fi/b3PBVr4vt7oh-WzO0j3O5ArT0XM=/510x318/top/img-s3.ilcdn.fi/21d985a571d7ea08364d20a31879766c0b93d69c427a18846dab8c38daa5c72c.jpg,687D672836764208B4533B8BCF49EFE8
2024-01-23T12:44:26.000Z,Olli Halonen rehellisenä parisuhteestaan: ”Minulla on käynyt älytön tuuri”,Laulaja Olli Halosen täytyi löytää onni jostain muualta kuin menestyksestä. Asioiden käsitteleminen kesti yli vuoden.,https://img.ilcdn.fi/bNRjb3EIvODvJQu1jFKYMqGVRCU=/510x318/top/img-s3.ilcdn.fi/2e83d7cd1b34a7637a5f69ba751917437937e18936d4a5ab6959cf2b06bc13ba.jpg,7F306B7220504609816530AB5CE61D8A
2024-01-23T12:59:11.000Z,Suomen Yrittäjiltä viesti työläisille: ”Ei ole lakkovelvollisuutta”,"Yrittäjien Petri Salminen: ”Muualla on tehty – myös ay-väen tuella – merkittävästi rohkeampia uudistuksia, mikä on nostanut työllisyysastetta ja vahvistanut kilpailukykyä.”",https://img.ilcdn.fi/8SIideAxW6r235cIcN5aTPNg9Bs=/510x318/top/img-s3.ilcdn.fi/a49e27699723d1a7a2a30f5a77124d63fb5ff564a422cb082b4e1a965597bc82.jpg,EA6382F19C7D425C9B4B898DADD573A1
2024-01-23T13:01:38.000Z,Saako Aki Kaurismäen Kuolleet lehdet Oscar-ehdokkuuden? IL seuraa julkistusta,Oscar-ehdokkaat julkaistaan tänään iltapäivällä. ,https://img.ilcdn.fi/EaycgY8C6GspCICJb87ZlG3alkc=/510x318/top/img-s3.ilcdn.fi/6313fdd52faa31d9ef1d597dd4dd271e35b390221d5da8352ae956502fb35a04.png,A74E27B289A14734B25899B99AFA52D5
2024-01-23T13:11:38.000Z,Viikko kuukaudessa vuoden ajan – Uusi tapa vähentää juomista,"Uudenlainen vaihtoehto tipattomalle tammikuulle auttaa pohtimaan suhdetta alkoholiin, mutta toisella tavalla. Juomatta ollaan viikko kuukaudessa vuoden ajan. Tällaisia etuja ja haittoja menetelmällä on.",https://img.ilcdn.fi/Mg2Drw43FHR5k88SSP_fd8Sd960=/510x318/top/img-s3.ilcdn.fi/31d924a6e3a046ed2e717a338afabc26a6f0ca7800290f53f830afffbc99d2e8.jpg,9855E9D888CC4D89ACB2FDA021BEE861
2024-01-23T13:18:48.000Z,Lukašenkan 19-vuotiaalle pojalle röyhkeä nimitys,Nikolai Lukašenkalle pedattiin jääkiekkopelissä kaksi maalia.,https://img.ilcdn.fi/A1nEqDQPfIvjwUOxy49Px3hZCMY=/510x318/top/img-s3.ilcdn.fi/7a4f4beced8856be04083afd7c6f0191c87b5f532500d52208cefb9f217dc609.jpg,8F2F920B2C46413FB7F82F186759FD9B
2024-01-23T13:31:15.000Z,Tässäkö seuraava halpa kiinalaisauto Eurooppaa valloittamaan?,Uusi MG 3 tullaan paljastamaan kokonaisuudessaan Geneven autonäyttelyssä.,https://img.ilcdn.fi/n96nIDCbIxSiGMKbuZstGhWp7Go=/510x318/top/img-s3.ilcdn.fi/c7fe5b73b9b33ae4eef385314c1f6965330fe790cb12ba8a350fa34207c4af4d.jpg,FDD890F7B19941408E892E1C524B6AFD
2024-01-23T13:35:26.000Z,Näin Suomi erottuu koko Euroopan sähköalueella,"Sähkön hinta laski viime vuonna. Vaikka hinta yhä heiluu, Energiavirasto ei hillitsisi sitä hintakatolla.",https://img.ilcdn.fi/k5GXtalp-O25Ow0ljXE16fkqxYM=/510x318/top/img-s3.ilcdn.fi/6a4f4239552acf484b8366d0a9f8eabe022325672093f5485d39c221ecdc0186.jpg,A04F2A35A78D4AC89935428563024C47
2024-01-23T13:41:25.000Z,"Suomalaisen Tomin, 18, murhaaja vapautetaan vankilasta New Yorkissa",Vankilasta vapautuva Vincent DeRosa tuomittiin suomalaisen Tomi Uutun murhasta vuonna 1988.,https://img.ilcdn.fi/pTRwPQ6YfxX1ktYxUd4Bdmz53F8=/510x318/top/img-s3.ilcdn.fi/83f078ddb91ffb00a85e4716e130162574f8a34152ec7edc19f779fddd4e017c.jpg,36C9A75ED96F480BAACA5EB5D5DFD98C
2024-01-23T13:47:53.000Z,Tapparalle merkittävä vahvistus,Veli-Matti Savinainen on toipunut pelikuntoon.,https://img.ilcdn.fi/Fxwrj-kKlOe1P8_EbUAX6SEr07g=/510x318/top/img-s3.ilcdn.fi/e2b4b52a51207d53012faade3d5b8cad12c02cdb71812867954451428a5ee34e.jpg,0EE47EDF91324489B996D0D79DB2067D
2024-01-23T13:59:40.000Z,"Yango suistui tieltä joulupäivänä karuin seurauksin – Nyt selvisi, miksi",Poliisi epäilee nyt kahta kuljettajaa liikenneturvallisuuden vaarantamisesta ja kahdesta vammantuottamuksesta.,https://img.ilcdn.fi/XnZb2MzLzqCn7T22B7EaSw1BZsA=/510x318/top/img-s3.ilcdn.fi/fbda312caf8131f054531ac7eb1fef594acfc8090a84b7a5771fda9069df337d.jpg,96BE3E611A784CDAA2235C40382E5246
2024-01-23T14:01:17.000Z,Näin karmeita ovat presidenttiehdokkaiden arviot Venäjästä,"Presidenttiehdokkaat arvioivat Iltalehden suuressa vaalitentissä, millainen Venäjä on 5–10 vuoden päästä ja mihin Venäjä pyrkii.",https://img.ilcdn.fi/Jv3yP1zOT8dWoX3YFqn8ZcSBcTo=/510x318/top/img-s3.ilcdn.fi/da0f5d030a9bea7da4021771896afbaa9c464ea1fc1b8c2567a8bad7f3da3a08.jpg,02DDED2D30BA46B39C524D8B45879733
2024-01-23T14:05:25.000Z,Näin saat parhaat bonukset,"Iltalehti laski, minkä kauppaketjun bonusohjelma on paras juuri sinun ostokäyttäytymiselläsi.",https://img.ilcdn.fi/DEcme1Jf8nwI6DDHxt5Yg7h9QmM=/510x318/top/img-s3.ilcdn.fi/c39c2e05990d9a1e9c1b524762c33a37eeb93e9355ad97d7cc6797b091476d3e.jpg,ABCD8DF61DE64BEAB37DBC617418CF85
2024-01-23T14:11:17.000Z,106-vuotias Ilmari Koppinen on rautaisessa kunnossa – Kahden sodan veteraani kertoo salaisuutensa,"Veteraaniyleisurheilija Ilmari Koppinen, 106, astui jälleen kuularinkiin ja työnsi pitkälle.",https://img.ilcdn.fi/MpcejLPJDcAqetqzPDZgOM8Df7w=/510x318/top/img-s3.ilcdn.fi/9f0912f3e663e327a31756e8714f4d80df1df2847a78df3ef748c845fa51ce02.jpg,019C00EDACD64C1B9A04747F954B2C22
2024-01-23T14:14:07.000Z,"HS: Venäjän tv:ssä parjattiin Stubbia ja Halla-ahoa: ""Nato-uhoaja ja Venäjä-vihaaja""",Venäjän valtiontelevision lippulaivaohjelma maalasi Suomesta kuvan ”ryssävihaisena” Nato-maana.,https://img.ilcdn.fi/gMKcTKIiW4Il3I8z3SrrcYONlmk=/510x318/top/img-s3.ilcdn.fi/c417f4c6a4540c8fddb440d03ff656a0416d2801925e67d610ae9ff48fee1529.jpg,A180C4FE70B54E39AB6F38B0551B4630
2024-01-23T14:15:18.000Z,Marraskuussa kuoli poikkeuksellisen moni,Eurostatin tilastojen mukaan Suomessa menehtyi marraskuussa poikkeuksellisen paljon ihmisiä.,https://img.ilcdn.fi/gCb0DrtK0sU1XcWxoW15qGz0yIk=/510x318/top/img-s3.ilcdn.fi/e65fc4bc47d35ab660fbb9cc67a7bc7136b986f018cd022a6ca4cadc0c4a4d0d.jpg,59D6B27A5CF54DDC8C968497CF4A8A78
2024-01-23T14:23:05.000Z,Armeija naisistuu,Naisia hakeutui asepalvelukseen noin 300 enemmän kuin viime vuonna.,https://img.ilcdn.fi/bfT4zdZrulrL-sbENBJTIg7lr0o=/510x318/top/img-s3.ilcdn.fi/262582fc0ddcbb2f6152047e44bf2c8ff61811691c121abd9b09be31bf9e521f.jpg,332899B4B3D7438B9C05EBDF1F6A8876
2024-01-23T14:26:40.000Z,Jorma Sairanen arvosteli Suomen tv-ohjelmia – Marja Kihlströmiltä napakka vastalause,Marja Kihlström vastaa napakasti Jorma Sairasen esittämään kritiikkiin.,https://img.ilcdn.fi/tb7SPpR0IupCud3Z3l5DNCeM0mA=/510x318/top/img-s3.ilcdn.fi/621546c1535bf8b709b28f32ddc2f03feb64586e0749ce6375cd9fdb99acf687.jpg,C3DF9B088985458D8660DF4A273E9B16
2024-01-23T14:32:26.000Z,Niklas Laurila kuoli 25-vuotiaana – Liigaseuroilta kaunis ele,Salibandyperhe suree kuollutta Niklas Laurilaa.,https://img.ilcdn.fi/op_OMsK7B3wO1W5xofCSeXUKDhM=/510x318/top/img-s3.ilcdn.fi/d171c4f2bd8fa2962117523e6d8b5c31614ca500c00ad20ef2a979b2570563a4.jpg,74A7EB6E76CB421BA52411235EFBC76E
2024-01-23T14:41:58.000Z,Työntekijä kuoli tapaturmaisesti Vuosaaren satamassa,Työntekijä kuoli onnettomuudessa saamiinsa vakaviin vammoihin.,https://img.ilcdn.fi/jji7scR0nhX1LkXwiqF3SwC8_kM=/510x318/top/img-s3.ilcdn.fi/630470e8b54f62935bc3a21dfec27efe5ecf05c086a1dacdb1bf9218062404e8.jpg,55DF526CBDB84BC1AC0D435192F25D6C
2024-01-23T14:54:10.000Z,"Norjan kuningas Harald, 86, ei aio luopua kruunusta","Kuningas Harald totesi puheessaan tiistaina, ettei suunnittele vallasta luopumista.",https://img.ilcdn.fi/B7knlGfATp4LVSNrMTbq4l45D9E=/510x318/top/img-s3.ilcdn.fi/7af9698b7aecb6a53c1b31ccc3a981f3b17858676ed1fea69813314487a6487a.jpg,EB12D9C5A8384AE59E6992C4B01C5B8F
2024-01-23T14:57:43.000Z,Muistatko hänet? Jenkkikonkari palaa nyt SM-liigaan,Terry Broadhurst pelasi SM-liigassa viimeksi kaudella 2016–17.,https://img.ilcdn.fi/vFiFawcXpF6W8pM9rtCZJ_dxyWs=/510x318/top/img-s3.ilcdn.fi/ca2c82bd26585ec1e29be316e122d62994841e244b9926e2bb7c534f3c2bb16f.jpg,79D805BBED644B03BF6C33FCF847B10B
2024-01-23T14:58:36.000Z,Putinille viime hetken haastaja: Boris Nadeždin vastustaa sotaa ja sai nimekkäitä tukijoita,Venäjän hallinto voi vielä estää oppositiopoliitikon presidenttiehdokkuuden.,https://img.ilcdn.fi/jWCDFs9OYXWhQBxI7Uox2ZNvar0=/510x318/top/img-s3.ilcdn.fi/196e644a8a34aba87e5f5307589a883da08c2bb1e99b2a1c7d5a78262e3caac2.jpg,499457FCB0EA48BC8AF1FEFB170750A5
2024-01-23T15:09:48.000Z,"Asiantuntija: Kotihoidon työntekijä teki oikein, kun asensi Tinderin vanhukselle",Ihminen ilmaisee seksuaalisuuttaan syntymästä kuolemaan. Lapsen ei kuulu puuttua vanhemman seksuaalisiin tekoihin. ,https://img.ilcdn.fi/RETx69z7PYkHvgZXUlUUmJ7qWoY=/510x318/top/img-s3.ilcdn.fi/9ece9eab701d73ad84cf663c0f757b40da2b2711012b3c1b4da2bc3c1b86fa73.png,22E5B5BF091B4272836875FE9E56A22A
2024-01-23T15:10:03.000Z,Lapsuudenystävän kauna päättyi hirvittävään tekoon,"Kuusikymppisten miesten välit alkoivat rakoilla muutama vuosi sitten, kun toisen heistä parisuhde päättyi.",https://img.ilcdn.fi/8ecYbA14a-yFgH_zeeW9i44UkY4=/510x318/top/img-s3.ilcdn.fi/8a4b545db42d9c5d5dc3fb98aa21f224e34b9a2607db7815cf79622118e7fd37.jpg,3545816CDA634507A5FC2EA70ABDDBE6
2024-01-23T15:10:11.000Z,Poliisi varoittaa: Älä klikkaa tällaista linkkiä,"Poliisi muistuttaa, ettei se pyydä maksamaan sakkoja tekstiviestitse.",https://img.ilcdn.fi/Z056pHY6iFPdg2RM288i_XdtkpI=/510x318/top/img-s3.ilcdn.fi/9bf1c0a31cbcaeee3a57885712b5218d16d6e077332a435400190883a6985300.jpg,6CF132D004F740B5B6F192B95B140142
2024-01-23T15:31:41.000Z,"Mobilepayn iso pomo kertoo, mikä meni pieleen",Maksusovellus Mobilepayn uuden version lanseerauspäivä ei mennyt kaikilta osin putkeen. Yhtiön Suomen-maajohtaja kommentoi tapausta maanantai-iltapäivällä lähetetyssä mediatiedotteessa.,https://img.ilcdn.fi/nxNd0KJsekoPWaRVS4x_-zNz_wo=/510x318/top/img-s3.ilcdn.fi/e5c1c42ea3bf7bf4edde85399711413545909b1878f9725b9ad0829aad8c0e1b.jpg,F29F8134946048AA93737855D73F7CCB
2024-01-23T15:41:27.000Z,Camilla kommentoi Charlesin vointia,Brittihovissa on kaksi toipilasta.,https://img.ilcdn.fi/HEt8-AHTn7_wOKtv9ebSqsksONw=/510x318/top/img-s3.ilcdn.fi/a755dcd50bb71dffeb959ade344dbbf9aad89f1704b5512ae4dd40ddf46a00fd.jpg,A6B6AE2589754ED3BF69A0EC85E18F93
2024-01-23T15:42:28.000Z,Tuomiopäivän kello: Maailmanloppu on edelleen ennätyksellisen lähellä,Tuomiopäivän kello pysyy historiallisen lähellä kohtalokasta keskiyötä.,https://img.ilcdn.fi/B7uxTgokYNFdOOuKbI9jfoi-ZvU=/510x318/top/img-s3.ilcdn.fi/cb1febb9f5e2c85a346970f87839c2596b6f5a3998584b7366f45bae6990fcd8.jpg,814E0E626F7144939F44F73CC445C804
2024-01-23T15:56:20.000Z,Syyttäjä: Sanna Kiiski huijasi valtavia summia isänsä nimissä,Syyttäjän mukaan Sanna Kiiski keplotteli isänsä nimissä kymmenien tuhansien eurojen edestä kulutusluottoa ja käyttötavaraa.,https://img.ilcdn.fi/SbunX2fkBuYtyZjb-BQZhH10_0A=/510x318/top/img-s3.ilcdn.fi/9a13e86126774491411dc570b1e0881bb3002b1996d6e495d32458b3c94966d0.png,5C0D65B172434973B50446DC397CC35E
2024-01-23T15:56:37.000Z,Tässä ovat Liigan talvisensaatiot – Pekka Virralta iso huomio kevääseen: ”Vaikka päätyyn asti”,Jukurit ja Pelicans ovat säväyttäneet keskitalven huikeilla voittoputkillaan SM-liigassa.,https://img.ilcdn.fi/cORpGMlZ6eMdH0gDH_tvBOMj08k=/510x318/top/img-s3.ilcdn.fi/e59fba4866a2d80182f83850e8b7284245b164f55f8bb6aee1dd7cf657337d75.png,2EAE38332D0A44C1A67A228DDC41AC87
2024-01-23T16:10:08.000Z,Yksi kommentti sai Aaltolan nieleskelemään – Tämän yksityiskohtaiset eleet paljastavat presidenttiehdokkaista,Kehonkielen asiantuntija Sami Sallinen arvioi presidenttiehdokkaiden viestintää maanantaina pidetyssä Iltalehden vaalitentissä.,https://img.ilcdn.fi/fHkcdRwBGFS8VPSkhzsSHZfb62U=/510x318/top/img-s3.ilcdn.fi/df7caa01b9debd5604ec8f53f082a08587f0bee7525b59e426a6c78df6fa9d2e.jpg,8E81F812723541F7AD757DF930D8FB43
2024-01-23T16:25:33.000Z,Lehti: MTV:tä kaupataan pilkkahintaan,Kauppaan kuuluisi myös suomalainen MTV.,https://img.ilcdn.fi/rL3UDhYBXTFMUCL5eWyO6uAyqiM=/510x318/top/img-s3.ilcdn.fi/11d2745e29c5e29dcdd4de8c5456b079b50560155827dab9d42a7c7d5b10adec.jpg,D93CA802EE48456D811A627786924D2D
2024-01-23T16:37:50.000Z,Aleksanteri Kivimäen tilille satoi rahaa – Tästä on kyse,"Iltalehden toimittajat käyvät läpi kuusi asiaa, mitkä Vastaamo-syytetyn kuulemisesta nousivat esiin.",https://img.ilcdn.fi/R54ilbMgX3DDdXJFIsvX-5buj7M=/510x318/top/img-s3.ilcdn.fi/03289e46c8f6a24473f7769c1a3da7286a54d1caf637d4ab1c1e833d9c1bd226.jpg,A02EEBBC50E84C209D642E6E3E7AA416
2024-01-23T16:40:06.000Z,Ilves veti vesiperän,Arttu Ruotsalainen jatkaa Sveitsissä.,https://img.ilcdn.fi/QcePglLxsSY7q2sAAgcJAJjF4kk=/510x318/top/img-s3.ilcdn.fi/487e720618d1fd02511d79914d950ecfaa5568a66ca956170286a073c38a9c54.jpg,BCC8F60E70F04A0BBEF7B358F10D8F5F
2024-01-23T16:40:58.000Z,Marja Hintikalta jämäkkä viesti tietylle ihmistyypille: ”Todella armoton ajatus”,"Marja Hintikka on kyllästynyt ihmisiin, joilla on sama sanoma jokaiseen vastoinkäymiseen.",https://img.ilcdn.fi/7fRgkkIYWpk0ze3XoMOzc44UnoI=/510x318/top/img-s3.ilcdn.fi/a6e536529b64c3011ae9ac369178303e5d24543f4217b19116aa507fe8611f97.jpg,75A0619825634DA29831CA135A7A973F
2024-01-23T16:58:54.000Z,Tässä ovat presidenttiehdokkaiden kootut Venäjä- ja Nato-selitykset,Iltalehden tentissä kysyttiin presidenttiehdokkailta perusteluja heidän aikaisemmille Venäjä- ja Nato-kannoilleen.,https://img.ilcdn.fi/GUhFm4lx8OUhCjpFfZyy2moZVfc=/510x318/top/img-s3.ilcdn.fi/6351cfb2d7d27ba1be9fbe943f212ee7f181117dbdccf75abff684c74d09157d.jpg,C4743DACD661420DA0344D1388FF5C9A
2024-01-23T17:16:40.000Z,Dikmen Himet huomasi rakennuspalon ja teki jotain harvinaista: ”Olemme aina valmiita auttamaan”,"Viime perjantaina Helsingin Vuosaaressa riehunut tulipalo sai paikallisen yrittäjän auttamaan heitä, jotka tavallisesti auttavat muita. Pelastuslaitos palkitsi huomionosoituksella yrittäjän.",https://img.ilcdn.fi/SVCJnCES3T4zu6nRMOPtTUE3sd0=/510x318/top/img-s3.ilcdn.fi/f601f5692df7d03a97ac436eb960f2f9aeaadc9f782031ae4116def44124743a.png,85694B8EE81E4155AE01556148FBFD83
2024-01-23T17:16:51.000Z,Yhdysvaltalaisnainen poisti jäätä tuulilasista – Salaa kuvatusta videosta miljoonahitti ,"Yhdysvaltalainen Ben Wolverton kuvasi salaa työkaveriaan Marisaa, joka tuskaili auton skrapaamisen kanssa.",https://img.ilcdn.fi/_LZTJWxISlDt13T1vT-HBqcEexM=/510x318/top/img-s3.ilcdn.fi/3c42826e4e4ca70a5ef7bd1c37641b36462825455976096e494c7cba03d7334f.jpg,0E92300393A542C7BB03BE237C93BF58
2024-01-23T17:17:01.000Z,Asiantuntijalta viiltävä analyysi: Näiden syiden vuoksi Kaurismäki jäi ilman Oscar-ehdokkuutta,"Elokuva-asiatuntija Anna Möttölä yllättyi, ettei Kuolleet lehdet saanut Oscar-ehdokkuutta. ",https://img.ilcdn.fi/DXk5Wc3IvJ7cnkfm2wbsjyhSv8w=/510x318/top/img-s3.ilcdn.fi/1eb69cfa726dd10620876696d3a971b606ac0448b50d5c1cd7b6fa1af35e85c2.jpg,0252C47E24A34462B5E27DD0804A9765
2024-01-23T17:32:24.000Z,Pääkallopakkanen paukkuu,"Jalkakäytävät ovat olleet liukkaita Suomessa tiistaina, eikä helpotusta ole tulossa ainakaan heti.",https://img.ilcdn.fi/Q2Cu4UqN4V8-7BqHhsY121Etkw8=/510x318/top/img-s3.ilcdn.fi/f636e2e993a338ea7738cfc26db69e4418241c5f20debcfc4de7069a6a695ee1.jpg,EA938A890BDE49C98732C85E08E15850
2024-01-23T17:36:08.000Z,Nooralotta Neziri tykitti kauden kärkiajan,Neziri ei vielä rikkonut MM-hallirajaa.,https://img.ilcdn.fi/9kZTWfHUSJmv03k_bcwibRGx9ms=/510x318/top/img-s3.ilcdn.fi/8d2b859c109dd17f2104dd79882b19dbcb3f7a4c4c4752a481344be8ee204f44.jpg,A5B42509CC394C9CB14A03315CE7FE3D
2024-01-23T17:52:34.000Z,Ozzy Osbourne esiintyy sittenkin ,Black Sabbath -legenda Ozzy Osbourne suunnittelee jäähyväiskonsertteja.,https://img.ilcdn.fi/cX9hpwUBcS1jLO3NrRpyH5j33iM=/510x318/top/img-s3.ilcdn.fi/04cd529c9bb12d61e886ebbad3058a3751f92d985a484948aa9eac17abf914a9.jpg,4207A896B49D40F595E0EAD3E4BE54D1
2024-01-23T18:06:01.000Z,Googlen työntekijä murhasi vaimonsa Yhdysvalloissa,Sekä uhri että syytetty työskentelivät Googlella insinööreinä.,https://img.ilcdn.fi/zF3Bdzf4S5UrHdZR36wznKD0nEQ=/510x318/top/img-s3.ilcdn.fi/a40986a930302ebdfb84165185b900dc191a68490f10a6f5d6eebea435e1ca84.jpg,0959A8DFFCC444619DCE93EF03FFB9C4
2024-01-23T18:06:29.000Z,Yllättävä käänne Nokia-areenalla – Timo Jutilaa pännii: ”Miksei hepat hypi täällä?”,Tampereen monitoimiareenan kalenteri näyttää kiekkopelien ulkopuolella melko tyhjältä. Mitä on tapahtunut?,https://img.ilcdn.fi/ampT_yZvsk6z8tpfNC2WhijqJJo=/510x318/top/img-s3.ilcdn.fi/53b9d9dbaf67c8d6ffefe7164b567df6d67a3c96afbd34258493c8345741d28d.jpg,DDF18E2CDC5F4206A48B6C2F143F8B1B
2024-01-23T18:16:16.000Z,Nooralotta Neziriltä kova siirto – Puoliso otti ohjat,Aituri pyrkii palaamaan vanhalle tasolleen vaikeiden vuosien jälkeen uudessa valmennuksessa.,https://img.ilcdn.fi/r7bpkGDs_vwzU_3nW9Rpe8qpNKk=/510x318/top/img-s3.ilcdn.fi/06f138764dcf75f907a377b7009e51576a6a5f9074dd5e72296c573273574c69.jpg,02298CBD7F7540C5A6D6AD4418A4AD3E
2024-01-23T18:25:43.000Z,Kela löi luvut pöytään: Näihin nuoriin sosiaaliturvan leikkaukset iskevät isoimmin,"Kela laski, miten pienituloisuus lisääntyy nuorten keskuudessa sosiaaliturvaleikkausten myötä.",https://img.ilcdn.fi/C7k2-5Q4zUZzwR1XWVGCCET9JZ4=/510x318/top/img-s3.ilcdn.fi/de53231043529030ff5940686852519d50d1f9208cfa975fa2b55d29ef9950fc.jpg,91F552C77E17406588ADE65B673EF857
2024-01-23T18:26:31.000Z,Kärpät haluaa eroon Nick Ritchiestä,NHL-vahvistus ei onnistunut Oulussa.,https://img.ilcdn.fi/Q9ukZf_21DWxo3kAVFlq7Rh_z5A=/510x318/top/img-s3.ilcdn.fi/e8cfea08954d1b04a7097110ecb5080472ba126c242ebfb8fa35c6c0c44dab16.jpg,CCEE3930117A4DB49D68795ECB15A619
2024-01-23T18:31:33.000Z,Kuva: Hurja jono Triplassa – Kansa ryntäsi ennakkoäänestämään viime hetkillä ,Presidentinvaalien ennakkoäänestys sulkeutuu tiistaina kello 20.,https://img.ilcdn.fi/gKGgzfE82CeL68obRf1UKZDW_nw=/510x318/top/img-s3.ilcdn.fi/3705c456efb8f6d165c00757f7597a10d52c1679891a3cf8c309a147a8e01b47.jpg,928D6F43141B4CAC97FC5359831E4BBD
2024-01-23T18:35:44.000Z,Charlesin eturauhasen liikakasvulla yllättävä vaikutus,Yli 26 000 brittiä haki netistä tietoa eturauhasen liikakasvusta. ,https://img.ilcdn.fi/xe3KNZxNAJLRVEgs0rbOnnaCVg8=/510x318/top/img-s3.ilcdn.fi/9f5312b1580dc2ed95ddb6ebf3b577b8d9bb00f8e1cc7d1a23b8075a5a68b446.jpg,BC8FE872AC34403F97FC36B15FBFD50A
2024-01-23T18:39:59.000Z,”Iskä ei” – Pienten tyttöjen piiloleikki päättyi järkyttävällä tavalla,Viisikymppinen perheenisä raiskasi kuudesluokkalaisen kesken piiloleikin.,https://img.ilcdn.fi/-5NfgPI7ejof75_CndLGuxNy2_4=/510x318/top/img-s3.ilcdn.fi/98171343672b266b2bdf04e1462c76d51bbaf88c0e1494bad93e71a031865b99.jpg,9ECDBE486A34477AADE781A91D57CAEB
2024-01-23T18:40:42.000Z,Kaikkien aikojen kakkostulos Suomessa!,Urho Kujanpää hyppäsi seivästä 570.,https://img.ilcdn.fi/DHlAG_jBe-ClXyN8KC4-NR6cp7c=/510x318/top/img-s3.ilcdn.fi/c9fedb47ed2e4783ee27fe34af6316eabac6c62398fb4f04687f8e233f0ea11e.jpg,83BA04BAECC64ADC9CDB78D254C9F903
2024-01-23T18:59:57.000Z,Vain yhden pisteen ero! Suomalaisen menestysreseptin voittaja selvisi,Suomalaisessa menestysreseptissä nähtiin tänään tiukkaakin tiukempi finaali.,https://img.ilcdn.fi/V9tPlXLGoj1DHfjw4EmfnK2rVgM=/510x318/top/img-s3.ilcdn.fi/a517735487e18e5d2fb2cc6037e100d7776c25ca4fdb213e066f654518ade640.jpg,6C81602FC9AA4AD187ED697F5A979A58
2024-01-23T19:05:06.000Z,Tappara-tähden upeat luistimet varastivat huomion – Silti tuli takkiin,Veli-Matti Savinainen palasi kaukaloon erikoisluistimissa.,https://img.ilcdn.fi/oKYFrWZkOXy0-vQwg5VEWwfx_iE=/510x318/top/img-s3.ilcdn.fi/6a5d1f80fdaccfbeb6afcba021f889be69ef609ed707623b409948e1d6885a8e.jpg,3E9A84A4BA464240A803A5ACDFB51AF8
2024-01-23T19:06:48.000Z,"HS-tentti: Vain yhden presidenttiehdokkaan mielestä Suomen pitäisi boikotoida Euroviisuja, jos Israel osallistuu ","Vasemmistoliiton presidenttiehdokkaan Li Anderssonin mukaan asiasta olisi pitänyt muodostaa yhteinen kanta kaikkien maiden kanssa, hän sanoi HS-tentissä.",https://img.ilcdn.fi/-cITLRvmMDnXR1OeuE7gmNkq2xs=/510x318/top/img-s3.ilcdn.fi/289c54ca41ec4224df4eac3e8e31280c144ca0985f0cfe4ab3cda74fe8942d32.jpg,03931A093D494236B03E4E094D1F0C87
2024-01-23T19:07:05.000Z,Aivosyöpään sairastunut Olga Temonen viettää syntymäpäiväänsä – Julkaisi rehellisen kirjoituksen ,Olga Temonen täyttää tänään 46 vuotta. ,https://img.ilcdn.fi/6EU-hwqBxALrQYQKKjxpuLkkXUg=/510x318/top/img-s3.ilcdn.fi/4504ee9883995a6c5a35633994535f0408237af5a711b85dc2e1f81469b31fc6.jpg,F85C7AF42E354BAEB6AE5E10935D0667
2024-01-23T19:09:54.000Z,Suomalaisjuoksijalta ennätysmurskajaiset – Ikivanha SE mielessä,"Joonas Rinne kellotti 800 metrillä ylipitkällä radalla 1.48,40. Hän hakee tavallisen sisäradan SE:tä.",https://img.ilcdn.fi/1UWOJe51RJFpHhpZUvqvB8oIrXw=/510x318/top/img-s3.ilcdn.fi/026ec097c03132c6f95b08728f450e759edaf198dce4f2580ff628219a43c0d9.jpg,F4B898C710B546D98F58C79231165ED7
2024-01-23T19:10:59.000Z,"Finnairin lento kääntyi takaisin Helsinkiin, vaikka oli lähes määränpäässä – Tässä syy",Finnairin mukaan koneeseen iski tekninen vika.,https://img.ilcdn.fi/54TmmHvJm0VN7y0nkC93wzVtCKM=/510x318/top/img-s3.ilcdn.fi/cf5a6fa4549c8859fe00d7f00a91ad39c225fe74f07242ce3cea83bbafc0762d.jpg,6438E947E888410985503214E0451F16
2024-01-23T19:16:43.000Z,Tässä on maailman paras keksitaikina,Erika Poussa kehitti Suomalainen menestysresepti -kilpailun voittoreseptin jo vuosia sitten. ,https://img.ilcdn.fi/1torcePlu4oYkKgc3w5P35WUDPk=/510x318/top/img-s3.ilcdn.fi/11b82c4e9f60a8508ef258fa0c15cb33efdf599d80f5401884b905276677b0a7.jpg,9686B2E4016943F2972D47C057C386F1
2024-01-23T19:28:10.000Z,Kuihtuva pikkukunta houkuttelee asukasta ilmaisella asunnolla,Vastineeksi ilmaisesta asunnosta Rääkkylä toivoo somenäkyvyyttä tai taidetta.,https://img.ilcdn.fi/lk6eBoaQoga709rONy6FVw9CreI=/510x318/top/img-s3.ilcdn.fi/dc3da3b978ca215ea6ca758ec25463f936b106e0aa8d5e1439d91c1fb3a49fb7.jpg,8D9387BFA8484A73ADEF484401038058
2024-01-23T19:29:47.000Z,Fordin sähköauto ilmestyy vihdoin – Lähes vuoden myöhässä,"Ford on ilmoittanut, että sen myöhässä olevaksi ilmoitettu Explorer saapuu asiakkaille tämän vuoden elokuussa.",https://img.ilcdn.fi/sjAihMYRENoBH32aRaMuvxwPSB0=/510x318/top/img-s3.ilcdn.fi/bbfebdcd310ff5cc2534f8b343d470d51565de92f2d25cab01f262909ed8d913.jpg,1175C617E085456E8119FEEDE1E92178
2024-01-23T19:34:36.000Z,Suomen lupaavimman pikajuoksijan selkä murtui – Raju paluu kohti huippua,Riku Illukka on vihdoin terve.,https://img.ilcdn.fi/B1OctA2Tynl-QhIKDgia3yint-s=/510x318/top/img-s3.ilcdn.fi/0285749cb211a26fd53ebfe8b906abc6d926e6392e957adc62f9d9848bfd8793.jpg,799BC10F43EE415FB1C5310F5D42293C
2024-01-23T19:42:48.000Z,Neljä ihmistä kuoli perhesurmassa Norjassa,Nelihenkinen perhe on löydetty kuolleena Norjasta.,https://img.ilcdn.fi/e_ovrMBiZrcEa11YK7o9dPxvogc=/510x318/top/img-s3.ilcdn.fi/5bbd13577bb79a0a9d5d87d4f183445fc88d4c77568cea177480bc5b20c8f990.jpg,A2C1E753C69C4A3187B051546EA37D5F
2024-01-23T19:44:20.000Z,Daddy Cool -hitin kirjoittaja on kuollut,Frank Farian oli kuollessaan 82-vuotias. ,https://img.ilcdn.fi/qLO-8FBURSLFusqbrknkPC2YOQg=/510x318/top/img-s3.ilcdn.fi/ea644a5f228a7d342cefe989f879a8b2e674450091bdc940bdce41b3bdfb3514.jpg,03C5F86C4FAF46F2A64C1EAAFBD780B4
2024-01-23T20:03:53.000Z,Suomalaisten rakastamassa lomakohteessa kiellettiin viina – ”Katastrofi!”,Kitzbühelin kännikaaokseen haluttiin puuttua.,https://img.ilcdn.fi/vBO049CjDUc4K7AEx90eQc9ggxI=/510x318/top/img-s3.ilcdn.fi/0e7763e52a27ca89444d974abf12cf83bf2590a689b198fb49a6b09324af5b0d.jpg,367F30DF8BF9432184E9F4887B72E86A
2024-01-23T20:07:43.000Z,Ukrainan uusi taktiikka: 40 prosenttia Venäjän öljynviennistä vaarassa,Ukrainan viimeaikaiset hyökkäykset Venäjän satamiin huolestuttavat öljymarkkinoiden asiantuntijoita.,https://img.ilcdn.fi/TvrAemBE1_CG9Kpop9hwKknJ2bk=/510x318/top/img-s3.ilcdn.fi/e517ca6611884818630ee0e2d4155c08c04e15d439bdc3e036ef581163a29888.jpg,85BAA04C79E04A91950C57C59D2827C7
2024-01-23T20:17:11.000Z,HS-tentti: Tätä mieltä presidenttiehdokkaat ovat USA:n vaalitilanteesta,"Helsingin Sanomien presidenttivaalitentissä kysyttiin ehdokkailta, kenet he haluaisivat nähdä Yhdysvaltojen presidenttinä. ",https://img.ilcdn.fi/LUzA-jd44-y_gb4pMXgyF7WcsxE=/510x318/top/img-s3.ilcdn.fi/50b9d1cca2034abab404e112fc2df1616d3221fd468136ffc441660deda9a5ef.jpg,E55D5CC0B8954996A663F9BC673E8144
2024-01-23T20:24:41.000Z,Rosanna Kulju saa sairauksistaan halveksuvia viestejä – Näpäyttää nyt takaisin,"Rosanna Kulju on kertonut muun muassa Mitä mielessä? -podcastissaan, että hänellä on todettu masennus ja sydämen synnynnäinen rytmihäiriö.",https://img.ilcdn.fi/3nXXEOIPPgwZqF5Sv8GRtaxj3ew=/510x318/top/img-s3.ilcdn.fi/8186bf5d91d709ccb21ba8140f444f722e57bfc5607e312d1cafe09bddbf492d.jpg,965602C27F8D44C490772154DA3C0036
2024-01-23T20:39:25.000Z,HS-tentti: Li Andersson hyväksyisi ruoan varastamisen lapselle,Li Andersson oli ainoana ehdokkaana tätä mieltä HS:n tentissä.,https://img.ilcdn.fi/HORgdoC-FqJXE_pVig5wx1e1UYs=/510x318/top/img-s3.ilcdn.fi/aabf368f171a5720322d68faab5e6bc8e146b612a73348850114f8c4bc0e088a.jpg,1426F7D93EB4443FBE0353D8C722E812
2024-01-23T20:41:33.000Z,Ensisilmäyksellä-tähti Josh Radnor meni naimisiin – Fanit haltioissaan,Ensisilmäyksellä-sarjasta tuttu näyttelijä Josh Radnor on mennyt naimisiin kumppaninsa Jordana Jacobsin kanssa.,https://img.ilcdn.fi/CSensu3d59sRkO_SSRSxB-02qPA=/510x318/top/img-s3.ilcdn.fi/4a91dabaf2e865a86945f115dc7bf1b1dbfb584a92dc5c669ebbb72d6f1a3928.jpg,ED740034F94A49069F89A2D7ABB17908
2024-01-23T20:44:21.000Z,Niinistö kommentoi Turkin parlamentin päätöstä Ruotsin Nato-jäsenyydestä,Presidentti Niinistö hehkuttaa Turkin äänestystulosta tuoreeltaan X:ssä.,https://img.ilcdn.fi/VF0a079fSXop0PfZncn37ccXQyU=/510x318/top/img-s3.ilcdn.fi/c1e51066f7a5f66a834f506fb2b412c932e4067c2515b492b88a7cc85f10be1c.jpg,1EBD8A07F53F41D886022CB6E8613378
