paivamaara,otsikko,tiivistelma,kuva,id
2025-03-26T18:54:36.000Z,Kari Savolainen tyrmistyi Ylen päätöksestä – ”Sapettaa”,"Entinen valmentaja pohtii, että joillekin kuluttajille kuunteleminen on ollut paras keino seurata jääkiekon pääsarjaa.",https://img.ilcdn.fi/mv_sbLnYmJILXB9eWvjI9RRSeUg=/510x318/top/img-s3.ilcdn.fi/f01ebb73d767d4556f590a300c75a59eb042758a139f42b64f4664224dbc95a3.jpg,35D88F894060434BA911A01C3AB2D837
2025-03-26T19:01:37.000Z,Tietoturva-asiantuntija vain nauroi: Trumpin hallinnon moka ”ylittää kaikki asteikot”,"USA:n johdon ”legendaarinen moka” osoittaa, että pikaviestisovelluksia ei pitäisi käyttää valtionsalaisuuksista keskustelemiseen.",https://img.ilcdn.fi/u7E5c5iVwgdjKaI3QvqMGVZDeD4=/510x318/top/img-s3.ilcdn.fi/e4c8d8690567c5f75a76ba4d48d173c07a9bfb7fa62749de2aed884c00ee48c6.jpg,57367D2C5EA74593923A539DA15779A5
2025-03-26T19:03:31.000Z,Kohulaki on täällä – Hallitus nojaa taas demareihin,"Perusteet rajalain jatkamiselle eivät ole muuttuneet, kirjoittaa Juha Ristamäki.",https://img.ilcdn.fi/4BRQZyPzFO75Xceq2aA4Bry7CDk=/510x318/top/img-s3.ilcdn.fi/b10770a46212bf517bf82177828eec1dc9ec25a30459dc740599c180a1736b01.jpg,16965AE844E7497EBEA5E2E5AF729F44
2025-03-26T19:07:34.000Z,Salkkarit-tähdeltä kaksi uutta aluevaltausta,Salatut elämät -sarjassa lopettanut Ronja Alatalo kertoo Iltalehdelle uusista aluevaltauksistaan.,https://img.ilcdn.fi/j5ngfrB_G8L5SvlFoynUBLbW49U=/510x318/top/img-s3.ilcdn.fi/91bc3e1a7de787a7f859b503dff7182a9408a7ae3c365af493c5f4e1aa561fd6.png,5B450EFDC19E4361B0C1C93F5B75A4F4
2025-03-26T19:08:55.000Z,Kultaleijonan hölmöily kertoo Tapparasta kaiken,"Tapparan romahdus Ilvestä vastaan kulminoitui Veli-Matti Savinaisen hölmöilyyn, kirjoittaa Tampereelta Riku Isokoski.",https://img.ilcdn.fi/gTNAzW7qMByAqpY4kaKrYgMULrs=/0x64:3000x1939/510x318/top/img-s3.ilcdn.fi/6e12c6b498276b6a4a1d59fbd9840b75018d1adf42cd1c311bafd6309cc51d8a.jpg,A96FF7C886DB4D8980BD01C751056398
2025-03-26T19:18:27.000Z,Elon Muskilta avuntarjous,Elon Musk on tarjonnut asiantuntija-apua viestisotkun selvittämiseen.,https://img.ilcdn.fi/PgHj28oQjvCfE04VW2DfY6MD3DE=/510x318/top/img-s3.ilcdn.fi/c831d7f38f02ac757d873644cb97559467ec317459f81926e8594e9417c6c99d.jpg,FE097EBD0BDE49A9ACA473F3DC37BC5F
2025-03-26T19:46:48.000Z,Lapsi raahautui auton perässä noin 200 metriä – Silminnäkijöille kriisiapua,Poliisi tutkii tapausta vammantuottamuksena ja liikenneturvallisuuden vaarantamisena.,https://img.ilcdn.fi/VmP718hYLeMD6e2crrvpzrjQ-Fo=/510x318/top/img-s3.ilcdn.fi/14341abe7f382e99ae62a3224042bb4a74f611500db622ea2ef1716e82d742ee.jpg,497C325A33C64B7EB9A7BC1AC464E35F
2025-03-26T19:55:20.000Z,SM-liigassa jysähti pelikielto,Pelicansin kanadalaispelaaja on pelikiellossa seuraavat kolme ottelua.,https://img.ilcdn.fi/ibwSA-Uw-GRqmI_Hc954dRFZ_Co=/510x318/top/img-s3.ilcdn.fi/1de3ffdfb79f1bbc56a02aad0cb7032b93326cd603696bf8eebb3fa407050739.jpg,E95A903C46CA46398E369047DFF803F7
2025-03-26T20:01:48.000Z,Tiesitkö? Näin lapset piilottavat asioita vanhemmiltaan Whatsappissa,"Erityisesti lapset hyödyntävät tätä kikkaa Whatsappissa, jos he haluavat piilottaa keskusteluja vanhemmiltaan.",https://img.ilcdn.fi/6GNILVf8gQyRExBDQWSxDrwf7Ec=/510x318/top/img-s3.ilcdn.fi/f50b14dea2f15f64d82cc09db28e5c128678ed2052276b4dc506ec4a53c4e248.jpg,C0E3FA4CA7E241079ACE0228ECE34A0C
2025-03-26T20:02:13.000Z,Stubbilla valtava mediamylläkkä – Tämä on viesti Trumpista,Tasavallan presidentin näkemykset maailmanpolitiikasta ovat haluttuja tällä hetkellä.,https://img.ilcdn.fi/ijs0nyNT_XyQoXxngs9REyD_kPw=/510x318/top/img-s3.ilcdn.fi/c0f9ded289e8358696f0e86796526c9c035251a68c5d36bb22d9e8f1e5789a21.jpg,A8F80BE082B84E619618A6ED62EAC649
2025-03-26T20:05:10.000Z,Dome Karukoskelta kova suoritus,"Dome Karukosken uutuuselokuva keräsi avausviikonlopun aikana 2,7 miljoonaa Netflix-katselijaa.",https://img.ilcdn.fi/Q_Bh9N52XC4kJs6iPKDP3i-5d9c=/510x318/top/img-s3.ilcdn.fi/188e8fbece6bbab002dc233d78c5b91b7bd75e51b2c0b051d8b6205a0f30fedf.jpg,EA9B65C8466B4DABA6645A80EA4FE5DE
2025-03-26T20:18:11.000Z,Rikard Grönborg latoi tiukkaa tekstiä – Tommi Niemelä äimän käkenä,Ilveksen ja Tapparan välinen puolivälieräsarja alkoi kiihkeissä tunnelmissa.,https://img.ilcdn.fi/qslliDihN3tNu0e4VPmcGpugywo=/0x64:3000x1940/510x318/top/img-s3.ilcdn.fi/a68fdb017f6718a69f5aa743a1c08858bdd705c1604d853e79368ee76de631e0.jpg,1A8F82FF1B1D4ABEBCA26193F34E3717
2025-03-26T20:20:18.000Z,Luke: Kymmeneen vuoteen tukalin kevät tulossa,"Koivun kukinnan odotetaan olevan runsainta vuosiin, kertoo Luonnonvarakeskus.",https://img.ilcdn.fi/2K00rL3jKk1EjOCgjLX86sHeHoc=/510x318/top/img-s3.ilcdn.fi/fba98582b1b2fe6980c7fdefeecc4458c372cdf2bfe0133d5fe97f8d6d76ee8b.jpg,1C2F2AED4A784D608E81BC5C63CCDE31
2025-03-26T20:39:48.000Z,Maajussi-Kallen ja Niinan vauva syntyi,Kalle Linkki ja Niina Wunsch Linkki ovat saaneet esikoisensa.,https://img.ilcdn.fi/_6d0GHatgHd6OrmB4yze8hBQo2M=/510x318/top/img-s3.ilcdn.fi/03abea549a6cf5e8354abbaf70a1e995ed59bb0b991edf534c17aa5e36b022d2.jpg,7528D10A946F4C7A80CDC4B384EE978F
2025-03-26T20:54:55.000Z,Ilveksessä tapahtui silmiinpistävä muutos – ”Ei se missään nimessä mörkö ole”,Ilveksen ainoa ”oma poika” Ville Meskanen elää tamperelaiskiekkoilijan suurta unelmaa.,https://img.ilcdn.fi/74Ch3gIRhKouLdI7yvDH0yfgR_0=/510x318/top/img-s3.ilcdn.fi/307782ec1b118dc32cba353bf8eda070098e54e84d4cc68c48b79da3837b68c8.jpg,6BCED6E24A964C1187E2B54BD30793F5
2025-03-26T21:01:41.000Z,Teinitytön pää iskeytyi tuulilasiin suojatiellä – 81-vuotias ei havainnut ja ajoi korttelin ympäri,Vanha mies ajoi henkilöautolla teini-ikäisen tytön päälle suojatiellä Joensuun keskustassa viime lokakuun lopussa.,https://img.ilcdn.fi/iJkoSWN0-u_y2sQYXh8qdhD5j9A=/510x318/top/img-s3.ilcdn.fi/be42401c5be7f89503f6140a28f486adb38a25592fecce3d172f3699d6eedff3.png,865F1BE048D24AEB841A7331540B9F4E
2025-03-26T21:30:19.000Z,Macronilta kova vaatimus Venäjälle,Tähän artikkeliin on koottu Ukrainan sodan keskeisimmät tapahtumat keskiviikolta 26. maaliskuuta 2025. Kyseessä on sodan 1127. päivä.,https://img.ilcdn.fi/PcFJYHFQpe4eSIJ1QZmgNuy4x8I=/510x318/top/img-s3.ilcdn.fi/1dc951e08e5740f28e2ac9230cd23fcef0e3b5a350bec8d82b4932fd289813a3.jpg,3BB54A22740B4B4BB09D61B92A79ABD8
2025-03-26T22:01:00.000Z,44-vuotiaana menehtynyt Pasi Ikonen sai lääkärissä musertavan tiedon: ”Muita vaihtoehtoja ei enää ole”,Pasi Ikosen elämästä ja kuolemasta kertova kirja ilmestyi tällä viikolla.,https://img.ilcdn.fi/IDnBpHY5mEvmRw9j-wjA4ZPx3tc=/510x318/top/img-s3.ilcdn.fi/5acb0ef0698a23a1abb47a85b52e2d6bcc262717af3bfe19994a687588c45c0d.jpg,792A28845A204E539D0F49AF53F60548
2025-03-26T23:03:13.000Z,USA:n puolustusministerin salasana löytyi netistä,Der Spiegel kertoo tehneensä uuden huolestuttavan paljastuksen.,https://img.ilcdn.fi/5rTjZ7w80yyNcZogfLuwIAs9_H8=/510x318/top/img-s3.ilcdn.fi/4c881545d1fb404fece8d01f02fad6c27ac1f529b9d7969362c23354225fe6c1.jpg,8C380C066FDB4735982163479AFA41E7
2025-03-27T00:03:30.000Z,Horoskooppi,NULL,https://img.ilcdn.fi/jm9wPlnoWFx5jhlXkB6i6JzE1x4=/510x318/top/img-s3.ilcdn.fi/8d5c61e8c61ff106bc8907444720fdd5e3bdfa0bdec71d9ddc943f19d86978bd.jpg,5582B82DA86A450B9930A0BD69E72A75
2025-03-27T00:43:34.000Z,Poliitikko ehdottaa: Melania Trump voitaisiin karkottaa,Demokraattipoliitikko paukautti tylyt terveiset presidentti Donald Trumpille.,https://img.ilcdn.fi/kKWdsaxtrqODPuWOwEFsnhYzlec=/510x318/top/img-s3.ilcdn.fi/b4cfeae87aadb3116bf178857f605fe885e0226d83101ab9131e09934e26b2d0.jpg,6FF4786812AB4E0E8877392B717C6344
2025-03-27T02:21:14.000Z,Pamela Andersonilta koskettava avautuminen: ”Jos sitä ei ole kokenut...”,Entinen Baywatch-tähti avautui palkintopuheessaan.,https://img.ilcdn.fi/-lwRT34R5vaY2S6QJ8FMsLycuNg=/510x318/top/img-s3.ilcdn.fi/e85b87fb957f3897671c07f571d7909021cf8643e758ae597d5ce238007db6ae.jpg,D498EF0930A14D6EA26741D334A4BE7D
2025-03-27T03:00:18.000Z,Näissä käytettynä myytävissä autoissa on eniten epäselvyyksiä – Listan huonoimmasta puhtaat paperit saa vain joka kolmas,"Käytettyjen autojen historiatietoja haaliva CarVertical on listannut ne automerkit, joiden käytetyistä autoista löytyy vähiten ja eniten epäselvyyksiä.",https://img.ilcdn.fi/_KDrPLaiBO6dsExofi2r8A-ZMnc=/510x318/top/img-s3.ilcdn.fi/2e94c63b5e86f79c429967aa0b3daa64d7a830953235946295c101b058e92bdc.png,0E2827FC28114DA79113DC2B88CF9939
2025-03-27T03:34:37.000Z,Tapani Kansa antoi viimeisen haastattelunsa IL:lle reilu viikko ennen kuolemaansa – Tällainen oli pysäyttävä viesti suomalaisille,"Iskelmälegenda Tapani Kansa antoi Iltalehdelle viimeiseksi jääneen haastattelunsa, joka tehtiin puolitoista viikkoa ennen hänen kuolemaansa. Iltalehti julkaisee haastattelun Kansan puolison Nina af Enehjelmin pyynnöstä. ",https://img.ilcdn.fi/watTQhvGZ4QcaRh9oUmdPZwvSd8=/510x318/top/img-s3.ilcdn.fi/712baefa167cfd4004dfc63442d71134f97cc8578696ab5e944d3228c00aefdf.jpg,3384361CBF00436BA2FAAB3000FD6BFE
2025-03-27T04:00:03.000Z,Masentuneen hipiällä,"Kaikki on kuin mudassa rämpimistä. Siltä masentuneesta helposti tuntuu. Silloin yksi tärkeä asia saattaa pudota arjesta pois. Sen huomaavat nopeasti muutkin, mikä pahentaa tilannetta.",https://img.ilcdn.fi/tACfcDTYfFKIVU5a_vxwP_xLfds=/510x318/top/img-s3.ilcdn.fi/bdfe63c656072254f12480b585ac2c67071cecb9fccd559b42896cce1d127770.jpg,628CC2F2052342DA8BFD02D259A16674
2025-03-27T04:00:42.000Z,Danny on miettinyt Helmin tulevaisuutta – Koskettavat sanat podcastissa,Danny ja Helmi Loukasmäki vierailevat Iltanuotiolla-podcastissa.,https://img.ilcdn.fi/57hjd0bjRvB_d6mQJ4jvB0OTl8o=/510x318/top/img-s3.ilcdn.fi/47c035fb33ab9480dd7e6085c933c674dbcf3b4f0aa7665c30ebc31bd48a6603.jpg,280900F4172F4C5684419D9D7ACFED86
2025-03-27T04:05:25.000Z,Kirja: Näin päättyi Pasi Ikosen ja Minna Kaupin suhde – ”Sun on aika lähteä”,Pasi Ikosen elämästä ja kuolemasta kertova kirja Myrskyn suunnistaja ilmestyi tällä viikolla.,https://img.ilcdn.fi/M9BD29lOVBnbGuLMfZjbw-hBLnY=/510x318/top/img-s3.ilcdn.fi/34cada908d2e6e1b18a5ff7410fa8d3d44dedc640a6b01ab97f2db8adae74826.jpg,02AC9F3E420647D2A9B9E712553A08E6
2025-03-27T04:36:55.000Z,Norjassa historiallinen jääkiekon sääntömuutos,Norjassa naiset saavat jatkossa taklata.,https://img.ilcdn.fi/MrnchkHAE5CBBe13Y4VOldgL2Ls=/510x318/top/img-s3.ilcdn.fi/6c0bec508c8273c36d5d8fdec9d54891b5e21abeb7e72f4884b257c1786656d5.jpg,9048F6DD45EB45F4AF19015387EAD4A1
2025-03-27T04:39:56.000Z,Tänne Venäjä hyökkää Ukrainan jälkeen – Asiantuntija antaa hälyttävän analyysin Euroopan tilanteesta,"Tutkija maalaa hälyttävän kuvan Euroopan puolustuksen tilasta, vaikka Suomi on toiminut esimerkillisesti. Mahdollista ”halukkaiden liittoumaa” saattaa hänen mukaansa odottaa yhteenotto Venäjän kanssa. ",https://img.ilcdn.fi/4SYkMa8DUVmv2P2eK71E3ccnoUM=/510x318/top/img-s3.ilcdn.fi/487c1295f7a90200c703ea8f3136ccbdc68d197211527793b97a601452831345.jpg,BF2435D2322A4BAF8721A7B835AE6729
2025-03-27T04:43:35.000Z,Trumpilta uusi tullimälli – Musk: Osuu myös Teslaan,Yhdysvaltain presidentti Donald Trumpin ilmoitus näkyi jo osakemarkkinoilla.,https://img.ilcdn.fi/MeEMg2zcDHZ3ZA3poLuNJLrIkek=/510x318/top/img-s3.ilcdn.fi/e37b166e5d9016dbf50267a2e50e8bc3fa644a1a2037a10269566c85606abc0f.jpg,1613D6882FFF49A486E51A80BFABBCFF
2025-03-27T04:50:35.000Z,Ylen muutokset suututtavat: ”Kyykytetään kunnolla”,"Yle on tiedottanut viime päivinä useista mittavista ohjelmamuutoksista, joiden syynä on säästöohjelma. ",https://img.ilcdn.fi/xyOcCtARmn_eKhDFbcLl-NN7NZs=/510x318/top/img-s3.ilcdn.fi/8687bd6980395db0ef63cf7f0e86148068b5c9a74c6e47d231087f7bdb0aea1c.jpg,E06CA09401DD4A1CAC6559A5499A02C2
2025-03-27T05:01:17.000Z,Pysyvästi edullinen -kyltti eksyi yli 9 euron kahvipaketin alle – Tästä on kyse,"Kahvipaketit ovat harvoin mukana Keskon Pysyvästi edullinen -kampanjassa, sillä kahvin hinta vaihtelee niin voimakkaasti. ",https://img.ilcdn.fi/7evBmywtLwty6H_r6hmcOo49DFE=/510x318/top/img-s3.ilcdn.fi/0f1f6081558450e74d222cc44b866c1fd60177f0162ac20275636800ad3f7aa8.png,9778CD7D4DA64C0F99F1BA618E68AB47
2025-03-27T05:06:52.000Z,Hattutemppu 10 minuutissa – Roope Hintzin johtama ketju hirmuliekissä,Dallas kävi ryöstöretkellä Edmontonissa.,https://img.ilcdn.fi/RHQktkPvUxPZy0u5SI5SWSFBLPo=/0x0:3000x1876/510x318/top/img-s3.ilcdn.fi/cf1b0754c3cfbcf4e9b6f843d4ac531d9868bd7c8bf2852cf0c3d390699ff8da.jpg,56CE6195AC7648F1BBB628C6292B6B92
2025-03-27T05:33:54.000Z,"7 merkkiä, ettei maksasi toimi","Maksasairaudet ovat alkuvaiheessa usein oireettomia,  mutta edetessään ne voivat ilmetä keltaisuutena ja mustelmataipumuksena.",https://img.ilcdn.fi/GE0xMLgaAmpBwAJgUj_qOO3-1GM=/510x318/top/img-s3.ilcdn.fi/85f8c2848f8d48ec2cbd13ed181938f669757a4fb6c07b477f72b702d56259b3.jpg,F3D81CBEBD6B4856B622BD343A8B3C2F
2025-03-27T05:35:19.000Z,Pelicansin kotikaukalo tutkitaan: ”Tämä on nyt syytä selvittää”,Pelicansin kotikaukalon luukut eivät pysyneet kiinni tiistai-iltana.,https://img.ilcdn.fi/yOJtk_FcWgxZl8Rx05rs3KPLY-c=/0x64:3000x1940/510x318/top/img-s3.ilcdn.fi/90dea7e20ddd2ef2fbf71ed81960061ba4dfb5cc8954b48e59f05e0e908cce0d.jpg,446D9B18B17E43819A28B017B76F6891
2025-03-27T05:37:42.000Z,"Verottaja älähti ihmisten erikoisesta käytöksestä veroilmoitusten kanssa: ""Ovat selvästi digitaitoisia""",Verohallinto antoi neljä määräpäivää veroilmoitusten tarkistamiseen.,https://img.ilcdn.fi/eaZUZtU5xkWQF3pHqDT-faOwwnM=/510x318/top/img-s3.ilcdn.fi/3057301c62f08374417766719211755bd48dbb10f70c13fe2082b10896045351.jpg,B25C77A47C094F1BA8DEE9C7A5D942A3
2025-03-27T05:45:42.000Z,Todella huolestunut Pia Penttala varoittaa äitiä tänään tv:ssä: ”Se ei ole leikin asia”,Pia Penttala joutuu puuttumaan tv-sarjassaan itse akuutteihin tilanteisiin.,https://img.ilcdn.fi/rYr2_xTZIsrrM4X3J1lEXMTwil0=/510x318/top/img-s3.ilcdn.fi/ef8ba9035822902fd453d3780b0e836415868fc7cba6029d633fe18409ca9086.jpg,C059FC4FEB434C1C8DCEC0B52E110B65
2025-03-27T05:51:30.000Z,Kerrostalon asukas havahtui kummalliseen näkyyn asunnossaan – Syyllinen jäi kiinni läheisessä ravintolassa,Poliisi otti miehen myöhemmin kiinni huumausainerikoksesta ja lievästä petoksesta epäiltynä.,https://img.ilcdn.fi/4W7hiY-o_5s04xh40B8Ehp8vLkg=/510x318/top/img-s3.ilcdn.fi/751819ee3a78dda95b647ada36dd6668db0b0636c3655a75e751987b055b55db.jpg,24336119C0DC42D287535435DBCD1E3B
2025-03-27T06:01:18.000Z,"Politiikan toimittajat antoivat arvosanat puheenjohtajille –  Yhdelle murska-arviot: “Epäonnistunut, epäselvä, sekava, kadoksissa, käpertyy nurkkaan”",Vihreiden puheenjohtaja Sofia Virta sai selvästi heikoimman tuloksen politiikan toimittajien arvioinnissa puolueiden puheenjohtajista.,https://img.ilcdn.fi/45XOyEphEf9bth6Q9SGKemaXXhE=/510x318/top/img-s3.ilcdn.fi/183bc7b79db04572365e0a5f3917a4ce35434b4c8402324336937c8e57baaacf.jpg,4FBDCE9ED5394F1BA3F4C58A6A34D2C2
2025-03-27T06:03:36.000Z,Raju ryöpytys! Mestis-valmentaja haukkui seuran omistajat lyttyyn Kainuun Sanomissa,Mestis-seura Hokki meni konkurssiin. Nyt joukkueen päävalmentaja Antti Halonen haukkuu seuran johtoportaan toimintaa Kainuun Sanomissa.,https://img.ilcdn.fi/0-jJzvRkvVYmYCV2Xnwbf-H0n9M=/510x318/top/img-s3.ilcdn.fi/a72f7027523b7a1fc7f7abc597aefdfe7b6ad0413e5da236bc3cfbc5ab372d55.jpg,D9692BF091D5489BB72F2200833FA43E
2025-03-27T06:16:43.000Z,"Venäläisten naamat valahtivat valkoisiksi, kun suomalaisfirmalta tuli postia: ”Kaikkein pahin isku”",Venäjällä närkästyttiin suomalaisen Supercellin ilmoituksesta Ukrainan sodan alkamisen jälkeen.,https://img.ilcdn.fi/FHtlGMRXQFwzyWDYb0QudmZBNk0=/510x318/top/img-s3.ilcdn.fi/e10206e3e58cacdbc4269289f27394f666be88ca9cf06eb8eb8be9e98c5ba4a0.jpg,3F5BDE375E1D407FB4962F606A846FEC
2025-03-27T06:22:17.000Z,Oulaskankaan sairaalan psykiatrinen osasto suljetaan,"Pohteen yt-neuvottelut päättyivät viime viikolla, ja Oulaskankaan psykiatrinen osasto aiotaan sulkea.",https://img.ilcdn.fi/7VJdUhPpxDYfhy9sx8DtMu-rNxo=/510x318/top/img-s3.ilcdn.fi/663145fc6aabaa877af0c996d17f311a5a0e0405aeb335b121c1902660ce16d8.jpg,79260E69355849B29D75269E8AC1DF9E
2025-03-27T06:28:28.000Z,Hintojen lasku jatkunut asuntomarkkinoilla,Tilastokeskus: Vanhojen osakeasuntojen hinnat laskivat helmikuussa sekä vuodentakaiseen että tammikuuhun verrattuna.,https://img.ilcdn.fi/Ro-vZE1gYIbwT7PcJDvsLoYPn8A=/510x318/top/img-s3.ilcdn.fi/342f1405c134476b2bc07ec59d5733d3f7e529d4256da54769b9a67287e5005e.jpg,7116CC9131C34BDA8C2E9B78278730AA
2025-03-27T06:31:29.000Z,"Juan Aguilera, 63, on kuollut",Tennistähti menehtyi tiistaina kotikulmillaan.,https://img.ilcdn.fi/OiJerJdXqvJKg8XLfFvelXp4ZB4=/0x260:2059x1546/510x318/top/img-s3.ilcdn.fi/ad080eaff62f44b409277bd4f995ad7b7f2d6c6d2ab87ef56d34b47ce2c6f897.jpg,389BD9F68DE6445E8EB4CD5C17BA502F
2025-03-27T06:41:25.000Z,"Purra väläyttää: Maahanmuuttajien lapset päiväkotiin, tai tuet pois",Perussuomalaisten puheenjohtaja Riikka Purra väläytti maahanmuuttajille velvoitetta laittaa lapsensa varhaiskasvatukseen sosiaalitukien menettämisen uhalla.,https://img.ilcdn.fi/j_0sKqAnZaN7QYrg6q0eMmAm51k=/510x318/top/img-s3.ilcdn.fi/54c5bdb7c449872a11bc3f3bbd5f16bdf26d453e1a08d2172a311fa91384a56c.jpg,74920C6858C7479FB442D0A3E8F12F99
2025-03-27T06:51:39.000Z,Älä ohita näitä trendikkäitä kaihtimia – 5 syytä valita osaksi sisustusta,Käytännölliset ja tyylikkäät Visor kaihtimet sopivat niin mökin kuin asunnon sisustukseen. Nyt Classic-kaihdinmallisto on valmistettu kierrätysmateriaaleista ja kaihtimien sävypalettia ollaan uudistamassa. ,https://img.ilcdn.fi/wPB0VUT7CK55-8Tisa43ZZbyzPM=/510x318/top/img-s3.ilcdn.fi/63029f48ce6783ba67a256d2ac40c05306684a4e79d01162122ddd3b27337d5b.jpg,E821D561FFB14CFDA38257A9C2574E9E
2025-03-27T06:52:17.000Z,Näe Real Madridin ja Barcelonan tähdet tositoimissa! Iltalehti Plus näyttää Copa del Reyn huipennuksen,Iltalehti Plus -tilaajille on tarjolla todellista jalkapalloherkkua.,https://img.ilcdn.fi/J4JBQ-pYbLno8WngZv7zLuNZcrY=/510x318/top/img-s3.ilcdn.fi/3092c8d5c2e91ac70e6d9c631a0403223a733ec1576d625b234e939698d90455.jpg,F503DA9E08544F58B4AD39C5D90EBE2D
2025-03-27T06:52:35.000Z,Skandaali jatkuu: Mariusta epäillään jälleen uudesta rikoksesta,Marius Borg Höibyä epäillään jälleen seksuaalirikoksesta. ,https://img.ilcdn.fi/cnaLNXNoML-EXGUIf4sPwOghm2k=/510x318/top/img-s3.ilcdn.fi/b78e3e9e6c44d2c49bea4049cf76e47b17e0c5e1b9c0c0d73525f07cac0b7eee.jpg,C6EFF358F3054C1397297632EAF50B1A
2025-03-27T06:53:27.000Z,Helsingin horisontti muuttuu,Korkein tornitalo ulottuu 120 metriin Pasilan Veturitien tasolta.,https://img.ilcdn.fi/rzKKcdt583olc1ykbVyBXG754gk=/510x318/top/img-s3.ilcdn.fi/96e1af36773031d7e8b6e8fb408005a492980323801348c47a7bfcb5a836d876.jpg,1B4AB0184571438580D34E1623610D0E
2025-03-27T06:56:04.000Z,Puuilon toimitusjohtaja: ”Ennätystulosta pöytään”,"Puuilo maksaa omistajilleen ylimääräistä osinkoa niin, että koko osinkopotti lähes kaksinkertaistuu.",https://img.ilcdn.fi/A_POodEN5bLyMgYaAoq2X26lZFA=/510x318/top/img-s3.ilcdn.fi/487709fe97f60c8796061f0ddf0f0e9333214d19c60504a9319e7b4c0dd485af.jpg,41EDCD21258B4AD89F62F6F48DEC6390
2025-03-27T07:03:40.000Z,"Kolme stailausvinkkiä, jotka kannattaa kopioida parikymppisiltä – ”Anna mennä vain”","Muotitoimittaja kertoo kolme kikkaa, joilla oman tyylin saa näyttämään nuoremmalta, etkä tarvitse yhtään uutta ostosta.",https://img.ilcdn.fi/skECin16OCTAWxzaa8TTM7yylgc=/510x318/top/img-s3.ilcdn.fi/23dc88b80386ce8ebd02fb1259b6c15f03541805257af3a347543de2378e3683.jpg,53F71F45E7B34028AB0F322340DF9259
2025-03-27T07:09:14.000Z,Uusi robotti-imuri Saros 10 mahtuu sohvan alle ja ylittää kynnykset – Tervetuloa uuden aikakauden imuri!,"Siivoaminen ei ole koskaan ollut näin helppoa ja vaivatonta. Samalla kun teet töitä tai harrastat, voit laittaa Roborockin Saros 10 -imurin töihin – saat omaa aikaa ja siistin kodin. Uuden aikakauden robotti-imurille kynnykset ja muhkeatkaan matot eivät ole esteenä.",https://img.ilcdn.fi/BS5p-5BbAbjuSG6ZH8JQTTZ3WSI=/510x318/top/img-s3.ilcdn.fi/a888a2a07b27e9dc76da498a7b3795016e537493c025ac739c52dc4070a50318.jpg,66ED2A7AADCE4325A38A68042B1C3181
2025-03-27T07:13:28.000Z,Kurvinen tylyttää Orpoa: Missä johtajuus?,Keskustan Kurvisen mukaan Orpon ja kokoomuksen johtajuus on ollut hukassa leikkauspäätöksissä ja monessa muussa asiassa.,https://img.ilcdn.fi/j_wzy70vazvs122Oj6ljrBU8JHw=/510x318/top/img-s3.ilcdn.fi/7058bbc609c81dc12598eae31447748ae7dad81b5cea34573b757064bfa67d9a.jpg,5E1E9B97F81E475AA16F1BE6AEADC7D8
2025-03-27T07:19:59.000Z,Suomen huippuottelija tekee paluun: ”Euroopan vaarallisimpia”,Jesse Urholin nähdään Cage66-tapahtumassa.,https://img.ilcdn.fi/oWAhEC3Qr-5QkwWDKDlmcFtY95g=/878x263:2543x1291/510x318/top/img-s3.ilcdn.fi/b681b0558695cd57d61b7af73ee38d29b46bf0c5bc9b86f3978c02c3b6957964.jpg,E55CD35F1F0F4222BBB158C4BCAFE896
2025-03-27T07:22:44.000Z,USA:n nöyrälle pyynnölle nolo loppu Grönlannissa,Nuukissa ei oltu innostuneita USA:n varapresidentin vaimo Usha Vancen vierailusta. ,https://img.ilcdn.fi/X_II-mlLyQjHti2ouur0lvQfZe0=/510x318/top/img-s3.ilcdn.fi/316a497decdbf0a5ddfabd91de6701b5bfca77a10b1519b226ca600b5a50ed34.jpg,4986A121C8944523B46CC012C5124476
2025-03-27T07:31:33.000Z,LK: Sekavia puhunut professori sai pysäyttävän diagnoosin potkujensa jälkeen,"Lapin yliopiston entinen rehtori Mauri Ylä-Kotola hakeutui lääkäriin ja sai kaksi pysäyttävää diagnoosia, uutisoi Lapin Kansa.",https://img.ilcdn.fi/eb1fAvMIJXuwxmZjxVx-_qk26ts=/510x318/top/img-s3.ilcdn.fi/d4f5c7bb6dec6735d7aa0ffda131cf2f02b932ba97b70832c26b6a26a23b08c3.jpg,3AA5E138DD164E9DA2BA78821C83AACA
2025-03-27T07:31:56.000Z,Suora lähetys: Poliisi kertoo suuresta tutkinnasta – Maastosta tehtiin pelottava löytö,"Poliisi kertoo tutkinnasta, jonka kohteena oli laaja huume- ja väkivaltarikoskokonaisuus.",https://img.ilcdn.fi/omERV9RWsi9vwqlVZNDd3y4yDtk=/510x318/top/img-s3.ilcdn.fi/b4597adb76f2780f91452b8fbb969c31b6aa103013749c187d77d2c84b2b1d60.jpg,EB8A771B20D44F48A7FCD95220ABD9AF
2025-03-27T07:43:39.000Z,Kotoisan suunnittelija jättää taas asukkaan toiveen toteuttamatta: ”Ei tule”,Kotoisassa nähdään tuttu asukas: stand up -koomikko Ali Jahangiri.,https://img.ilcdn.fi/AvGiwRqKhv0TMGPFZed61yfNAAc=/510x318/top/img-s3.ilcdn.fi/184617833166fd0e49026bb9cc46d870732568ae2daecb4ed3627ad8fe2a20d1.jpg,5620C65DF85D42BC83BC386BD0D51A99
2025-03-27T07:45:31.000Z,Ruumis löytyi vedestä Espoossa,Poliisi ei epäile asiassa rikosta.,https://img.ilcdn.fi/9jDFsKJ2mHmet36OMjqS13ihX18=/510x318/top/img-s3.ilcdn.fi/bad3b9ac80da6dbc0c5dbb2aa33d9b059bb00151a5aa49f94d17c6296495b1d4.jpg,04A8B0E9E25C4477803F422EB5332ECC
2025-03-27T07:49:07.000Z,24/7 bileet ,"Aino, 24, oppi jo lukioikäisenä pitämään kulissia yllä. Sitten hän liittyi petolliseen ryhmään.",https://img.ilcdn.fi/FigOWzDVylhD7_W19sZdYPQmLTE=/510x318/top/img-s3.ilcdn.fi/b2cd06aad0abb759d9c9afce52db5e0f6722bad968c605f1def46c21fba42a51.png,23BC42DBAF89497487BF59BE76A24423
2025-03-27T07:59:22.000Z,Viestikohu-Waltzin viikko vain pahenee – Uusi moka paljastui,Venmo-profiilin unohtaminen julkiseksi on voinut tarjota arvokasta tietoa ulkomaisille tiedustelupalveluille. Yksityisasetuksia muutettiin Wiredin yhteydenoton jälkeen.,https://img.ilcdn.fi/okbEcwcKqAinMLx_peC_QU9b-Dw=/510x318/top/img-s3.ilcdn.fi/126c4ef7c5a36e1664d966c73b7409516a110788e474155bf49833b82e7f8b77.jpg,66CBFE7DFF734A4E90B05F4BC12ED345
2025-03-27T08:03:10.000Z,Harva noudattaa tätä kananmunaan liittyvää erikoista ohjetta,"Kananmunan käsittelyyn liittyy ohje, jota harva noudattaa.",https://img.ilcdn.fi/KDMemTObd_C8JsgQd3A6jYR3pQs=/510x318/top/img-s3.ilcdn.fi/7aa605cba6ae715a97df0acbc6a59fc5c5376a1eef0dd90615667cea3bf56052.jpg,0A4CC571C2084C3E835A411FAAC0BFF2
2025-03-27T08:05:51.000Z,SaiPalle avautui käsittämätön mahdollisuus,SaiPa hyötyy poikkeuksellisesta otteluohjelmasta.,https://img.ilcdn.fi/x4BMUx9mZRtNfRKwGb2l8dwXVeM=/0x64:3000x1940/510x318/top/img-s3.ilcdn.fi/af1a4025bd3cc4c11cb834ceae8fe089ccb2dab811b8a211f6d79cb41f3bbd3b.jpg,57C7287CAA5F4D5ABCB134A3C3EBFF32
2025-03-27T08:31:08.000Z,Suomalaisten yleisin eläke nousi reilusti – Kuva paljastaa kokonaisuuden,Mediaanieläke eli yleisin eläke oli viime vuonna 1 848 euroa kuukaudessa.,https://img.ilcdn.fi/Y-gs0QlYdqMNopkxfF0QlG4aasA=/510x318/top/img-s3.ilcdn.fi/0361f9cb493157386374937d663c8e220bc16a831ac55f27a9d303a08fdc9ab9.jpg,6A224FACC55F4ECAA375F50A72217A54
2025-03-27T08:31:42.000Z,"Jotain vakavaa on tapahtunut Pirkanmaalla – Poliisilla konepistoolit, helikopteri ilmassa",Paikalla on nähty myös lääkärihelikopteri ja useita ensihoidon yksiköitä.,https://img.ilcdn.fi/rE5mDmMt4zrNT-1Wk_dtbsMXhhw=/510x318/top/img-s3.ilcdn.fi/0ff3e5c412933534321cddd61c4fbebf78332613f66e0561ac293280a9ea2098.jpg,0319BB688537410892895D7472A83AA1
2025-03-27T08:31:59.000Z,Sähköiset säiliörekat tulivat Suomeen – ”Dieselrekat häviävät meiltä kokonaan”,Ensimmäinen sähköllä toimiva säiliörekka otetaan käyttöön Kaakkois-Suomessa,https://img.ilcdn.fi/D7Wd9ZvbQmCMyG--qVd4dti4TM0=/510x318/top/img-s3.ilcdn.fi/72ab806347cdee13c1c29541f30fc5fa7a4e40440aee15b01cba043f3b46fd69.jpg,2D6D07A0DC42476ABD1C89C1261EEAD4
2025-03-27T08:35:22.000Z,Marko istui Pasi Ikosen kuolinvuoteen vieressä ja luki ääneen – Seuraavana päivänä tuli viesti: ”Pasi 30.06.80–03.08.24.”,"Kuolemansairas Pasi Ikonen tilasi itsestään hyvän mielen kirjan. Elämäkerturi Marko Kantomaa jättää lukijan arvioitavaksi, onnistuiko hän toimittamaan tilauksen.",https://img.ilcdn.fi/6PGSn4_EXjnFp4hUA4_XDoPkBho=/510x318/top/img-s3.ilcdn.fi/0d9d7afaaebc630c0315edad0e71d22da74a58359ba1e742c860ada9e9d3f5a2.jpg,A1EAA71EC620493A85E699950A3E4418
