paivamaara,otsikko,tiivistelma,kuva
2019-08-09T14:27:40.000Z,Isopanda synnytti kaksi poikasta eläintarhassa Belgiassa – poikaset ovat kuin kaksi pinkkiä rääkyvää katkarapua,"Belgialainen eläintarha ilmoitti, että tarhan isopanda oli synnyttänyt terveet kaksoset ja on jo osoittanut hämmästyttävää äidinrakkautta poikasiaan kohtaan.",https://img.ilcdn.fi/7uqlS1XxPuAXBOMCngni4wf8kDA=/510x318/top/img-s3.ilcdn.fi/65b035ce79f0ed698afbbdd61062de4e173eaa6e7f658ce561ac2583bb5b4cec.jpg
2019-08-09T14:38:53.000Z,Kaikkien aikojen olympiasauma tuli ja meni – Kiina romutti Suomen haaveet: ”Joukkue ei osaa voittaa”,"Suomen lentopallomaajoukkueelle avautui kaikkien aikojen paras sauma olympiakisoihin, mutta se romuttui käytännössä heti Ningbon turnauksen avauskamppailussa.",https://img.ilcdn.fi/5AdF4sS1QfymMr6B9AcJJAEfDIw=/510x318/top/img-s3.ilcdn.fi/33e8dbb2595801765216f0545570e6efb08325db232d7c39ae8f20b9db56eec2.jpg
2019-08-09T14:40:17.000Z,Kolumni: Tuhotaan Suomen viina- ja peliriippuvuus! Veikkaus voi auttaa!,"Suomalaisten kesä rakennettiin taas addiktioiden ympärille, kirjoittaa Tuomas Enbuske.",https://img.ilcdn.fi/1PRQecqSID8Qcfc20rB_-RHM5uM=/510x318/top/img-s3.ilcdn.fi/343e13ac4b1da57738056686bca0bca7870bb43565dbd6006a42db23db89542f.jpg
2019-08-09T14:49:07.000Z,Kaikkien aikojen photobombaus - Abbey Roadin kannessa näkyvä mysteerimies ei koskaan pitänyt  Beatlesin musiikista,Amerikkalaisturisti päätyi vahingossa ikoniseen valokuvaan.,https://img.ilcdn.fi/vFXBxG5334veVgR232LXkmTb5XA=/510x318/top/img-s3.ilcdn.fi/74f748a1e09693af10795b5351600b099f19d26666459deea12e2cc014c87bf3.jpg
2019-08-09T15:05:43.000Z,Maanviljelijä-Aarno haluaisi välttää ruokahävikin ja ostaa lastenannoksia – ravintolat tyrmäävät pyynnöt,Suomessa noin viidennes kaikesta ravintolaruuasta päätyy roskiin.,https://img.ilcdn.fi/Jf8d3GPHuLYfSutYIcOUQHWizD0=/510x318/top/img-s3.ilcdn.fi/2aa6731df5f9861e9c05b57d4de1cdf7ce3908a97f034edef755577d585e8fa0.jpg
2019-08-09T15:08:44.000Z,Kolme maistuvaa valkkaria elokuun iloksi - loistohinnalla ranskalaisviini,"Perjantaipullo: Château de la Jaubertie 2018, Ranska, 11,83 €",https://img.ilcdn.fi/z3MfDjdM4yKqoJ2YwDSyrKLfe1Y=/510x318/top/img-s3.ilcdn.fi/7ca2f2279cc15dc6928764f07f9db56c2517fef3c9b85c4d1adf785e388f2e20.jpg
2019-08-09T15:16:29.000Z,Mihin vatsa hävisi? Kehonrakentaja esitteli häkellyttävää taitoaan – jättireisistään tunnetun ennätysmiehen kuva mykistää ,John Jewett on myös voimanoston moninkertainen maailmanmestari.,https://img.ilcdn.fi/vtRYPwHQ_gK-eNOgM05_3KXqjtE=/510x318/top/img-s3.ilcdn.fi/d39f1775ac59ef2af997513114861c9a65cfc6557d8d8ac40f8a5843db9b80de.jpg
2019-08-09T15:22:34.000Z,"Julkkiskaunottaret Flow-tunnelmissa – Tiesitkö, mitkä asiat yhdistävät Sara Sieppiä, Sabina Särkkää, Diandraa ja Tiktakin Petraa?",Nelikko vietti tyttöjen iltaa ennen Flow-festareille suuntaamista.,https://img.ilcdn.fi/q7yCUM9wpksub_N2if5fjK84FKM=/510x318/top/img-s3.ilcdn.fi/1d400f5e82f1c752966c7363ad83044cb53919b14768caa835b7f86e1c622c46.jpg
2019-08-09T15:24:10.000Z,Hipstertaivas Flow-festivaali käynnistyi: tältä aitojen sisällä näyttää nyt,Valtavirtaan lipuva hipstereiden kestosuosikki Flow-festivaaliviikonloppu käynnistyi tänään. Kurkista miltä festivaalialueella näyttää tänä vuonna.,https://img.ilcdn.fi/LysaunLYYoA57Ek2VB7brGsCeZ4=/510x318/top/img-s3.ilcdn.fi/b47e821a243c53d2ced200f7047a922fceca9b8ee8a610a657ba766641b21f22.jpg
2019-08-09T15:29:23.000Z,Kihelmöikö päänahkaa? Taustalla voi olla alkava sairaus tai inhottava tartunta - 10 syytä kutinaan,Päänahan kihelmöinti voi johtua esimerkiksi hermoston toiminnasta tai vain kuivasta ja kutisevasta ihosta.,https://img.ilcdn.fi/4bha0-WOYkHCTIvWW3deiSVtc_A=/510x318/top/img-s3.ilcdn.fi/46e1eebc2fce1808fa172545ee84040a203779667733b066460196686ff44088.jpg
2019-08-09T15:58:59.000Z,"Alppihiihdon olympiavoittaja Julia Mancuso, 36, julkaisi erittäin intiimin kuvan - hymyilee kameralle heti synnytyksen jälkeen: ”Sai minut tuntemaan itseni epäonnistuneeksi”","Entinen suurpujottelun olympiavoittaja Julia Mancuso avautui esikoislapsensa synnytyksestä, joka ei sujunut aivan suunnitelmien mukaan.",https://img.ilcdn.fi/uQJnKqemJ8ZWzbam7xVVjjTVw_E=/0x64:3000x1939/510x318/top/img-s3.ilcdn.fi/59f2480bea3e649047cfc9a553871fa472355a3987257be3fe0d29db7452daa2.jpg
2019-08-09T16:10:16.000Z,"Kadoksissa ollut Willi Wonka -kenguru on heräämässä nukutuksesta - omistaja kertoo IL:lle, miten erikoinen eläin päätyi hänelle",Iltalehti kertoi aikaisemmin poliisin tiedottaneen eläintehtävästä Ahvenanmaalla. Maatilalta karannut kenguru saatiin kiinni puoli kahden aikoihin iltapäivällä. Se jouduttiin tainnuttamaan nukutusnuolella. ,https://img.ilcdn.fi/PIqNYoaiDU-TtqVzEAe0foUNtZU=/510x318/top/img-s3.ilcdn.fi/95095145dace0dce6997121afb433ba22cb48eabea5d7a765152e7a7751f876a.jpg
2019-08-09T16:32:54.000Z,Hallitsevan Valioliiga-mestarin tähtilaituri jopa puoleksi vuodeksi sivuun – Pep Guardiola kiisti jyrkästi aiemmat Bayern München -siirtohuhut,Manchester Cityn manageri Pep Guardiola kertoi Leroy Sanen eturistisidevamman vievän saksalaispelurin kuukausiksi sivuun.,https://img.ilcdn.fi/TZcyMIwLt6bellH47EBKkp47GUw=/14x790:1701x1851/510x318/top/img-s3.ilcdn.fi/96624a43bbdd021d84681b49cf78a5435fbb3f672020057a91b45c137883ea08.jpg
2019-08-09T16:35:17.000Z,"Salkkarit-kaunotar Sofia Arasolan karu menneisyys: kasvoi lastenkodissa – ""Keksin itselleni aina päämäärän, joka vei eteenpäin”",Näyttelijä Sofia Arasola on keskittynyt täysillä työntekoon. Menneisyys on vaikuttanut naisen päämäärätietoiseen asenteeseen.,https://img.ilcdn.fi/ltaIGTzRRYYNKpBZahZ_FSwlpKw=/0x83:3000x1959/510x318/top/img-s3.ilcdn.fi/a72c8635c66cefdf75400720ce85272369fd4fe4546721b2bc96526345cd351f.jpg
2019-08-09T16:44:21.000Z,Tässä on Flow-festivaalin megatrendi - nämä kengät ovat joka toisella,Ugly sneakers -lenkkareiden sijaan hipstereillä on uudet hittijalkineet: Flow-vieraiden ehdottomat ykköskengät ovat nimittäin perinteiset Dr. Martens-maiharit.,https://img.ilcdn.fi/_R5pxMznbfrswSXDMeFAm9I780A=/0x740:2000x1990/510x318/top/img-s3.ilcdn.fi/54ccc5058507528bf1e85eaded9fbba290efe0d16ab442b7d0e8d3a03d699fa2.jpg
2019-08-09T16:57:18.000Z,"Mystinen lukitusongelma piinasi Porvoon torin lähettyville parkkeeranneita, autoon ryömittiin jopa takaluukun kautta - häiriön syy löytyi kaupungintalolta",Ongelmia oli torin ympärille parkkeeratuissa autoissa jo kesäkuussa.,https://img.ilcdn.fi/F2NHu8zzyUnflEsPY5chlZIOVc0=/510x318/top/img-s3.ilcdn.fi/26e1e8c2e515992d9aabf4179af67e0cfc8cda21eae3983bb3a16249c82780f3.jpg
2019-08-09T17:04:57.000Z,"Bernie Sanders: Jos minut valitaan presidentiksi, paljastan Yhdysvaltojen hallituksen salaiset tiedot ufoista ja muukalaisista",Sandersin vaimokin on jo kysellyt salaisuuksista.,https://img.ilcdn.fi/vuQtrZKfjc-cobuv1-R2tfVEDqs=/510x318/top/img-s3.ilcdn.fi/f520efafc59c2e641ae2d068e4baca313af79e436c163b66fefbb0ad0bfd06e8.jpg
2019-08-09T17:16:13.000Z,"Selviytyjissä kisannut Veronica Verho sai keväällä yllättävän yhteydenoton: ”Jos olisi tilanne, että olisi menossa Selviytyjiin, niin...”",Yksi tulevan Selviytyjät Suomi -kauden taviskisaajista kysyi Veronica Verholta vinkkejä.,https://img.ilcdn.fi/eg6GomaaHutzJQKfA0wlO4g2Y-I=/510x318/top/img-s3.ilcdn.fi/7721c9c8cf62ed7604f0ea6613146a3505038c1ed1d83f53d797323ba2a259ab.jpg
2019-08-09T17:28:46.000Z,"Yhdeksän ruumista roikkui sillalta, seitsemän lojui maantiellä Meksikossa ",Nouseva huumekartelli pyrkii osoittamaan vaikutusvaltansa raaoilla tavoilla.,https://img.ilcdn.fi/4DymVoljevRd5MHgqO6a3nbe1ZA=/510x318/top/img-s3.ilcdn.fi/ef93c5a0d6553443c11a471a02a3b35674410e7aac94b31d107a48f46f79a6da.jpg
2019-08-09T17:38:53.000Z,Verohallinnon kirjesotkusta ilmoitus tietoturvaloukkauksesta - asiantuntija: ”riski tietojen väärinkäyttöön on olemassa” ,Tietosuojavaltuutetun toimistosta ei toistaiseksi kommentoida kansalaisille aiheutuvaa tietoturvariskin tasoa. ,https://img.ilcdn.fi/vJrIEPwuls2T4EiGUqbqzjtL4WE=/510x318/top/img-s3.ilcdn.fi/2d6dc38533edc124bb2268d4ccd7ae2ea8bd43e711a7fece7b58e03ec3ab9234.jpg
2019-08-09T17:38:54.000Z,"IL arvioi: Näin käy Valioliiga-kaudella - Manchester City on ylivoimainen suosikki, Norwichin peleissä nähdään maaleja","Iltalehden vedonlyöntiasiantuntija Pete Käenmäki rankkasi kauden 2019–20 valioliigajoukkueet. Vaihtuuko mestari, säilyykö Teemu Pukin Norwich?",https://img.ilcdn.fi/6eWo7yG5sH3pVdVNaSOjtspxxH4=/510x318/top/img-s3.ilcdn.fi/876a026409aff9f82da584a75b8d93b5ef2cbfbb416fde89663b0a1e67d9ada9.jpg
2019-08-09T17:49:58.000Z,Hurja ryöstöyritys vaikuttaa yhä Valioliiga-tähtiin – Arsenal jätti pelaajakaksikkonsa pois liiga-avauksesta ”turvallisuustilanteeseen” vedoten,Mesut Özil ja Sead Kolasinac eivät pelaa Newcastlea vastaan seuransa kauden avausottelussa.,https://img.ilcdn.fi/hEIcBIN42K0AMFpLDzGblOfINLQ=/0x62:2258x1473/510x318/top/img-s3.ilcdn.fi/bcdbd9d8f4edfb726e2221b320e1779f6b1bccf8dfddb56974ec709b295e5618.jpg
2019-08-09T17:56:41.000Z,Eevi Teittisen vapaaottelijarakas on tarkka kodinhengetär: ”Hinkkaan tasoja jatkuvasti”,Eevi Teittinen ja Teemu Packalén viettivät harvinaista vapaailtaa Flow-festivaalien etkojen merkeissä.,https://img.ilcdn.fi/naIc65c7uTfWryFz2TBvagNXm8Q=/510x318/top/img-s3.ilcdn.fi/4fd02f46487366b91d3e3eb33a8f6dc71accdc57ab0a59788e5f25a7b6b56e0e.jpg
2019-08-09T18:16:42.000Z,Historiallinen lumisade sai australialaiset epäuskoisiksi - ”Sulaa osuessaan maahan”,Canberrassa satoi lunta.,https://img.ilcdn.fi/gxEpPZglbM-j7LUhY7G2x4DmVGY=/510x318/top/img-s3.ilcdn.fi/53a4980a6b16d2c8a969a91a659423770c66d6733512f4c3b2f4c263af1ac25d.jpg
2019-08-09T18:18:03.000Z,Kaarinalainen baari perui Läskit Lokit -bändin keikan ja uhkasi kipakan some-keskustelun jälkeen sakolla - yhtye: Emme maksa ,Bar Nuotti halusi yhtyeen ja sen fanien pyytävän anteeksi kommenttejaan.,https://img.ilcdn.fi/AZ-CLPFh_Xl7fzGYB2JgO-hC8Fs=/510x318/top/img-s3.ilcdn.fi/ef9f1a402c4b3185bf2ccbc63b8ac0cfa83862c5e0551b65b7d67f6fd761cb46.jpg
2019-08-09T18:28:42.000Z,Joonas-poikansa keväällä menettänyt Vesa-Matti Loiri rikkoi somehiljaisuuden: ”Kesä on ollut pitkä”,Vesa-Matti Loiri on viettänyt hiljaiseloa. Syksyllä hänet saadaan valkokankaalle.,https://img.ilcdn.fi/R-ePVr_vA8jfGVl85S4CBRewzY0=/510x318/top/img-s3.ilcdn.fi/a48d6cf92937f18f873849c145d6038f2ccf5785ad4fffbbb872ec01da8db8ef.jpg
2019-08-09T18:29:57.000Z,Näin hyvältä pyöräilysortsit näyttävät nyt - katso kuvat Flow-festarilta!,"Mukavat ja muodikkaat! Pyöräilytrikoista on tullut tämän hetken halutuimmat sortsit, ja trendi näkyy myös Flow-juhlijoiden päällä. ",https://img.ilcdn.fi/jCQ46-GX3HTJFOvb1yjmlbeQMXU=/258x310:1756x1235/510x318/top/img-s3.ilcdn.fi/eaeb59b7d618ca585303d97e084572bcc8e5d96562fc2737cb3772f234841e41.jpg
2019-08-09T18:30:31.000Z,Voiko pieniruokainen aikuinen tilata ravintolassa lastenannoksen? – ”Moni ravintola myy niitä ilman katetta”,"Kysyimme ravintola-alan edunvalvonta- ja työmarkkinajärjestön varatoimitusjohtajalta, saako aikuinen ostaa ravintolasta lastenannoksen.",https://img.ilcdn.fi/scu9yzHEnrvgqVz9EjVzz5IkBqk=/510x318/top/img-s3.ilcdn.fi/c1284bb8300d8abedb85b811e7a24ffc52b7d4de3da6c2622905b8f820766b51.jpg
2019-08-09T18:50:54.000Z,Käsittämätöntä epäonnea: nyrkkeilyn maailmanmestarin käsi jäi sattumalta kaatuneen betonipylvään alle – esitteli irvokkaasti turvonneen nyrkkinsä videolla,Aiemmin urallaan kahden eri nyrkkeilyliiton MM-vyötä hallinneen Carl Framptonin paluu kehään kariutui täysin odottamattoman onnettomuuden vuoksi.,https://img.ilcdn.fi/1p7iGLKqeBJb-LVl2EGTul1EVks=/0x0:2378x1487/510x318/top/img-s3.ilcdn.fi/22d50f30eee48f806cecc0406abc6b42dfdefbcff439f332b15b99938f5e3644.jpg
2019-08-09T19:01:00.000Z,"”Kuulosti, että eläin narskutti luitani” – kanadalaismies pelastautui karhun hampaista taskuveitsellä ",Mies selvisi välikohtauksesta ilman vakavampia vammoja. ,https://img.ilcdn.fi/3fbCZ-30nRi2yTMyTl_1_yiZAlA=/510x318/top/img-s3.ilcdn.fi/20dfffe567dd0310c16f70a501fbc867d22f4df3c12c4205a35b4f0be57f99b2.jpg
2019-08-09T19:08:13.000Z,Kimi ja Minttu Räikkönen lähekkäin – ”Auringon suutelemat”,Räikkösten hääpäiväloma Italiassa jatkuu.,https://img.ilcdn.fi/uJkqGFu7VIcThsBbUx5C39DPbzk=/510x318/top/img-s3.ilcdn.fi/ff3997173d8ef5bb071c5300cd18e5a11fd969dd9ca11ee7eb36de99af7b452e.jpg
2019-08-09T19:12:03.000Z,Kännykän näprääminen oppitunnilla ei ole ihmisoikeus,"Kännykkäparkkien rakentamisen ei pitäisi olla kouluille ylivoimainen tehtävä, kirjoittaa uutispäätoimittaja Perttu Kauppinen.",https://img.ilcdn.fi/Hd5BhRO6Mtvt4bjpGICG1mzx0n0=/510x318/top/img-s3.ilcdn.fi/91acde202a7b99ac98b5fc582623b9bb0e6af4c8e59e66745469c72d58dea09d.jpg
2019-08-09T19:12:08.000Z,Edis Tatlin lauantain paluuottelun painoraja muuttui – nicaragualaisvastustajalla vaikeuksia kilojen kanssa,Berman Sanchezin ylimääräiset kilot johtivat Olavinlinnan pääottelun painorajan nostamiseen 66 kiloon.,https://img.ilcdn.fi/ycvp5u17ovIJoTaIFDfpMIEIp0g=/840x90:3000x1430/510x318/top/img-s3.ilcdn.fi/fcf5bd0ab5f718e24444cd057b739615237a6d44da85007de244440ea0396386.jpg
2019-08-09T19:53:49.000Z,Hyväntuuliset ihmiset ovat helpoiten huijattavissa – näin hakkerit käyttävät mielialaa hyväkseen,Tutkimuksen mukaan hyväntuuliset ihmiset avaavat helpommin huijausviestejä.,https://img.ilcdn.fi/wZkAEaRX1jS5QHUf6sjG0jPjGAA=/510x318/top/img-s3.ilcdn.fi/6bfa6e01163eee61592809a0b025a7b189f5b78c0ae97756a3477946ca14842f.jpg
2019-08-09T20:02:40.000Z,Teemu Pukilla ikimuistoinen ensi-ilta – Liverpool repii Norwichia kappaleiksi,Liverpool teki hetkessä selvää surkeasti puolustaneesta Norwichista. Teemu Pukki pääsi ajoittain palloon ja loi tilanteita.,https://img.ilcdn.fi/Eph0WCFAT6gc0LThZnY6P1N7eeQ=/510x318/top/img-s3.ilcdn.fi/d8d51c77f108cfe7f6fdaad410cdfa16eb692855acb8d98d6d8840caa9e3653b.jpg
2019-08-09T20:34:00.000Z,Se on siellä! Pukki avasi maalitilinsä Valioliigassa – katso upea maali videolta,Teemu Pukki kavensi tilanteeksi 4–1.,https://img.ilcdn.fi/q0df9o8kA0gM1Ax1mTCWO_zaEQw=/510x318/top/img-s3.ilcdn.fi/7b15bf0c010f282a492133e1b340a78a251c9d2875b2bd0bbd86b070308b588d.jpg
2019-08-09T21:19:20.000Z,Lehtitieto: El Pason joukkomurhan epäilty tunnusti – ”Ampuja olen minä”,NULL,https://img.ilcdn.fi/xNYGfGFwYca3Mrf3pOVIgq9dIfk=/510x318/top/img-s3.ilcdn.fi/77b841770bad903b2c0f6f766ad46d6a8f02ecf53b8606eb5f417a2929a6c74a.jpg
2019-08-09T21:54:30.000Z,Ydinvoimayhtiöllä onnettomuus Venäjällä: viisi kuollutta,"Venäjän valtiollinen ydinvoimayhtiö Rosatom kertoo, että viisi yhtiön työntekijää on kuollut onnettomuudessa.",https://img.ilcdn.fi/m1YbOuhK9bWPLxKzdD4HFb88d2I=/510x318/top/img-s3.ilcdn.fi/c569449a83b48f3b9d6f2e71fe7098ba7d249c480abfea8bf45719e1d256b313.jpg
2019-08-09T22:55:45.000Z,Brittien X-Factor tähti pidätetty – pyysi lasta lähettämään säädyttömiä somessa: ”Joku koettaa saada minut ansaan”,NULL,https://img.ilcdn.fi/SchEoPLoLYO4tDX2jC7YPaAOQeA=/0x211:2761x1936/510x318/top/img-s3.ilcdn.fi/31f063aac9a9b36ea83ef3488ec5096739c50026b4316b1f1da4b84b7314e48f.jpg
2019-08-09T23:03:47.000Z,Horoskooppi,NULL,NULL
2019-08-09T23:55:31.000Z,Pohjois-Korea laukaisi taas – Trump väläytti uutta tapaamista Kim Jong-unin kanssa,Pohjois-Korea on tehnyt jälleen asekokeita.,https://img.ilcdn.fi/wcR9dUxeECyc2FnX7y_H5ykT-PI=/0x64:3000x1940/510x318/top/img-s3.ilcdn.fi/a108b6ed6c959e195449fa2a49ec27db4b2f689d9a349fc81dfea74143b9c128.jpg
2019-08-10T00:29:52.000Z,Anne Hathaway esitteli raskausvatsaansa punaisella matolla – näyttelijäkaunottarelle suunniteltiin uniikki mekko: ” Anne + 1”,Näyttelijä Anna Hathaway odottaa toista lastaan.,https://img.ilcdn.fi/Rcz-HcZt7TUx1zwsPbUNoXx0-fo=/173x62:3099x1890/510x318/top/img-s3.ilcdn.fi/c0967fdead1a8ef6a7fd66403654f5981f609848e964c6a6ce5146bad1280779.jpg
2019-08-10T00:30:00.000Z,"Tiedätkö, kuka on ainoa F1:n maailmanmestari, jonka etu- ja sukunimi alkavat samalla kirjaimella? Pelaa viikonlopun 10 kysymystä!",Iltalehden perinteinen urheiluvisa. Montako tiedät?,https://img.ilcdn.fi/Z5LkzZJ-DZRW_m8zVKmU0HOyxo8=/510x318/top/img-s3.ilcdn.fi/906f6ba6c09b4de832f4df86323409d0d60f1b9522481c82cdf97f2b1ef577b5.jpg
2019-08-10T01:09:23.000Z,"Walmartissa syntyi paniikki – videolta näkyy, miten poliisi pidätti asemiehen",Yhdysvaltain Missourissa pelättiin ammuskelua.,https://img.ilcdn.fi/bL-2SEVg33d7uvgvyteY2ryp80c=/510x318/top/img-s3.ilcdn.fi/90e9e078f760b9282e6b7901b959e3185be30b44b5ab3d4a3b3bb21b6a88e71b.jpg
2019-08-10T01:35:59.000Z,Näin Englannissa reagoitiin Teemu Pukin debyyttiin ja maaliin Valioliigassa,Jalkapalloilija Teemu Pukki saa ansaitut kehut - jopa kriittisyydestään tunnetulta brittilehdistöltä.,https://img.ilcdn.fi/X_gkLh9eoMxpjQ0jVCTVBEtcO7c=/0x59:2753x1780/510x318/top/img-s3.ilcdn.fi/5a39f9133ea39f82c4e995bfafaa269b02ce51cee3761f0635e38d0eb5b7560c.jpg
2019-08-10T02:00:54.000Z,Villa Mehu,"Kirkkonummen metsissä on 15 vuotta sitten autioitunut maailma, joka on ajankohtaisempi kuin uskoisi.",https://img.ilcdn.fi/mbJLKRFtwLP9tHmrm_rduiCIEoo=/510x318/top/img-s3.ilcdn.fi/3ef65bc4808a13b0ecc1aaf78bee7aa9fccd2ac2444599c801bad016d6acb4e7.jpg
2019-08-10T02:20:06.000Z,Hetkeksi kuivaa ja lämmintä – rajuja matalapaineita tulossa,"Lauantaiksi Suomeen saadaan hieman mukavampaa säätä, mutta ei ole syksykään enää kaukana.",https://img.ilcdn.fi/Yweo51ZdFF-1LgnaBtlgWw7dl7Q=/510x318/top/img-s3.ilcdn.fi/cd5b6febdd0fd93b49331f9be4bd785f982d03e05b9cf50e73d0f78e2e74b1e9.jpg
2019-08-10T03:06:38.000Z,"Avioliitossaan onnellinen Nanna Karalahti avoimena rakkaudesta Jereen: ""On hetkiä, jolloin ollaan eron partaalla""","Nanna Karalahti, 31, oppi jo kotona reippaaksi pärjääjäksi. Vaikeuksien kautta hän on oppinut tuntemaan paremmin itseään. Samalla on vahvistunut myös avioliitto Jere-puolisoon.",https://img.ilcdn.fi/y9MHa_yMYHU-2JCHUB2gzUcqiyM=/510x318/top/img-s3.ilcdn.fi/698aec9eaa66f9716fa74df79f659ab66427f10ee544dcc59350b8932ea770d9.jpg
2019-08-10T03:36:08.000Z,"Minkä ikäisillä on parasta seksiä? Tuhat suomalaista kertoi, kuinka tyytyväisiä he ovat seksielämäänsä","Erilaiset elämänvaiheet voivat muuttaa seksihaluja radikaalistikin. 40-vuotiaana parisuhteessa koittaa puolimatkan krouvi, joka ajaa osan eroon ja pitää osan yhdessä.",https://img.ilcdn.fi/daMr1CfRLsfWAfcZMZoXcldq7J8=/510x318/top/img-s3.ilcdn.fi/1444b31aab3d540fbb25e2e6a06528ce8a5748004400af51a0f123e5e1bf94c0.jpg
2019-08-10T03:38:06.000Z,Charlie Sheenin eksä joutui rankoille teille – hakeutui hoitoon pahan huumeaddiktion takia,Julki tullut video oli liikaa Brooke Muellerille.,https://img.ilcdn.fi/oQMWuoJuXcsKLT7QFTMF_5w7Bhs=/0x49:2045x1327/510x318/top/img-s3.ilcdn.fi/e37cd9ccdc2d6a6206356e195093d6e29e53bc379a1de9fa8c8a3a7469dbb307.jpg
2019-08-10T04:15:06.000Z,"Selänteen ja Räikkösen luksusjahdit karille, känniveneilystä käräjille, rytinällä pusikkoon... nämä kuvat vesipeleistä muistetaan vuosien varrelta",Viimeisen kymmenen vuoden aikana mediassa on käsitelty lukuisia kohukipparointeja ja vesillä sattuneita epäonnen hetkiä.,https://img.ilcdn.fi/lqaYwQ2p_g7j_qRzxaOtw1P2xZk=/510x318/top/img-s3.ilcdn.fi/984357787f7b0d4b7c9460b06696438a54b1f43a345ca9ca85b9fb19dab37056.jpg
2019-08-10T04:17:52.000Z,Mikko Rantasta odottaa NHL:ssä megasopimus: Jopa kymmenen miljoonaa kaudessa - turkulaiselta viileitä kommentteja tulevasta tilipäivästä: ”Työn alla”,"Hyökkääjä Mikko Rantanen on yksi niistä NHL:n nuorista tähtipelaajista, jonka sopimusneuvottelut etenevät kulisseissa. Valmista ei vielä ole.",https://img.ilcdn.fi/-q5XFv65Nm7TdS1FT0t-hFWcJ-E=/510x318/top/img-s3.ilcdn.fi/ffa56562f897332b152c051e8775d4177c1e184b7d705d178ad998c14af7b884.jpg
2019-08-10T04:29:38.000Z,Turun satamaan saapui huomiota herättävä vieras – tältä valkea luksuspursi näyttää,Helsingissä on menneellä viikolla kohistu Yas-nimeä kantavasta maailman kahdeksanneksi pisimmästä superpurresta. Myös Turkuun on nyt ankkuroitu aikamoinen luksusjahti.,https://img.ilcdn.fi/ZbRX7KZPwzYdH-wf9JL4u1V2Yo0=/510x318/top/img-s3.ilcdn.fi/1e687a1eb2bf192784116d0845144f15e7b5226b122d3c07b97fbc2d68f06479.jpg
2019-08-10T05:03:00.000Z,Uskomatonta! Valioliigadebyytissään onnistunut Teemu Pukki on jo kahdeksan vuoden maaliputkessa – ensimmäinen suomalainen maalintekijä yli 10 vuoteen,Teemu Pukki teki maalin ensimmäisessä Valioliiga-ottelussaan perjantaina.,https://img.ilcdn.fi/9v5keA2fW9bOx2mGQYgi1C1V96Q=/510x318/top/img-s3.ilcdn.fi/ecd4d6b331bbe9eb8939bedee5313a8f2921af0ba2ac45a836569f0c308245f1.jpg
2019-08-10T05:05:13.000Z,Brittisarjan päätähti vaihtuu kesken kaiken: Näyttelijä toivoi tv-pastorille karmeaa kuolemaa,Grantchesterin pastorin Sidney Chambersin loppu on onnellisempi kuin mitä näyttelijä James Norton olisi toivonut.,https://img.ilcdn.fi/Y2V-VyJZBvz9mXQtYtz1IGHtbkA=/510x318/top/img-s3.ilcdn.fi/ef74bc327dac4024ef62d063d9f38c12689187b5accd952251c48bacc7c9f0e6.jpg
2019-08-10T05:50:36.000Z,Lady Gagan Oscar-palkittu kappale plagiointikohun keskellä – huomaatko sinä yhtäläisyydet?,Lady Gagan Shallowia väitetään samanlaiseksi kuin Steve Ronsenin Almostia.,https://img.ilcdn.fi/_5pdLsWGzkGe_jf0YKQ9-vqARDE=/510x318/top/img-s3.ilcdn.fi/432308c6ceb9a2f27f2e594ac203aee3f4ba1f5f5c4941d1cbb4cf8a37417435.jpg
2019-08-10T05:54:04.000Z,Kenellä on varaa näihin? Nämä ovat suomalaisten halutuimmat asunnot nyt,"Etuovi.com selvitti, millaiset asunnot ovat parhaillaan haluttuja suomalaisten keskuudessa. Osa on melkoisia luksuskoteja.",https://img.ilcdn.fi/iK-g0zQRmVXo21YH_yrt8FBK2FY=/510x318/top/img-s3.ilcdn.fi/78ef53f9d65757cfbe53bc0ad25799d57dbf5d7c4639964281560f1c888fa700.jpg
2019-08-10T06:02:01.000Z,Ensitreffit alttarilla -ohjelman Tiinalla ja Samuelilla erikoinen yhteinen harrastus: ”Käymme parisuhdeterapiassa”,Ensitreffit alttarilla -ohjelmassa avioituneet ja rakastuneet Samuel ja Tiina tekevät paljon asioita yhdessä.,https://img.ilcdn.fi/4spv_lDhG2CGtcYDIQsONh6049w=/510x318/top/img-s3.ilcdn.fi/7aaa863d597040bed76a840e52ed15dd9d1648590af128d860f72fcb5ce4c185.jpg
2019-08-10T06:17:34.000Z,"50 vuotta sitten vietettiin legendaariset festarit, joilla ruoka loppui, vettä satoi, aidat kaadettiin ja ruuhkajumi iski – Silti kaikkialla vallitsi rauha ja rakkaus","Kukaan ei osannut ennakolta varautua siihen valtavaan ihmismassaan, joka vyöryi Bethelissä asuvan isännän maatilalle nauttimaan rock-musiikista vuonna 1969 – tällainen oli Woodstock.",https://img.ilcdn.fi/keXIs7s-V-2lcNKnZiSWxlDFGME=/510x318/top/img-s3.ilcdn.fi/74a9a75438f10cb0764a50f9a3ca05796e6aad208e69b4bcf3ba0c37020560b3.jpg
2019-08-10T06:18:52.000Z,65-vuotias mies kuoli äkillisesti pyöräilykilpailussa Ruotsissa – muut kilpailijat elvyttivät reitin varrella: ”Ei minkäänlaisia varoitusmerkkejä”,Mitään ei ollut tehtävissä.,https://img.ilcdn.fi/RJB_eAi72RtiW7kEIAolqwlb8gA=/510x318/top/img-s3.ilcdn.fi/8fdca09f0585dbb34608ec69cf3f260c36b2d598dbf134ba6b7af50392c1e478.jpg
2019-08-10T06:31:41.000Z,Satumainen näky! Kuuden hehtaarin kukkapelto puhkesi täyteen loistoonsa Sastamalassa,"Kukkapelto istutettiin Sastamalan juhlavuoden kunniaksi, eikä se ole ainut.",https://img.ilcdn.fi/xqdj5pl2SAWzDL3U8mk92pSgFR4=/510x318/top/img-s3.ilcdn.fi/d72da359776e43a5a4677f303ebe8e1582a2a87dc9209dbfcf8613c8b3ea9f67.jpg
2019-08-10T06:42:29.000Z,Auto suistui päin puuta – 17-vuotias poika kuoli ulosajossa Konnevedellä,Onnettomuutta tutkitaan törkeänä liikenneturvallisuuden vaarantamisena sekä kuolemantuottamuksena.,https://img.ilcdn.fi/STXg_0hJPMFMivGEok8TVbv7EsA=/510x318/top/img-s3.ilcdn.fi/dcf84dbc3c4553fadec62e7d0743fc032e68c8759b7825163d66c3a7f6454c62.jpg
2019-08-10T06:46:51.000Z,Karmivan hajuinen pieru pakotti keskeyttämään Kenian alueparlamentin istunnon,Puhemies joutui tyhjentämään salin ja tilaamaan ilmanraikasteita.,https://img.ilcdn.fi/cEXpx1UQWDtN_o73hQpwRhhyclc=/510x318/top/img-s3.ilcdn.fi/b28863e655e1264a52f1bef3da3ea8c916440726000c9fe9fdf6704c710bc007.png
2019-08-10T07:07:13.000Z,Tšernobylin kuolettava salaisuus tänään tv:ssä: Sabotaasi vai virhe?,Amerikkalaisessa dokumentissa selvitetään KGB:n ja CIA:n osallisuutta vuoden 1986 tragediaan.,https://img.ilcdn.fi/jDpZO7dz0UtHJQ82D0biPs_0Gb8=/510x318/top/img-s3.ilcdn.fi/18ddc49d72ef06fcafe00aea4e25d81fe2833dbc4fdf322ea026fd1d562d616a.jpg
2019-08-10T07:21:18.000Z,Yli miljoona ihmistä evakuoitu – Supertaifuuni Lekima myrskyää Kiinan itärannikolla,Tuuli on puhaltanut pahimmillaan 187 kilometriä tunnissa ja miljoona ihmistä on jouduttu evakuoimaan myrskyn tieltä. ,https://img.ilcdn.fi/v2B5kgdSaYqVlFuGgmAA75FVN6A=/510x318/top/img-s3.ilcdn.fi/5d59605c17999bb01f0823944f930afee23308d31a11f3c913546928e58e1ff1.jpg
2019-08-10T07:35:12.000Z,"Mikä näytös! 18-vuotias NHL-lupaus latoi neljä maalia SM-liigan harjoitusottelussa – ""Semmoinen peli, että huh-huh""",Ilveksen päävalmentaja Karri Kivi oli haltioissaan joukkueen tulokkaan mykistävästä näytöksestä.,https://img.ilcdn.fi/QWC6hgQ8668o1GFDpHQWdOZLayY=/510x318/top/img-s3.ilcdn.fi/e653f05c3e1b2653845c7309141acce786f1e30e51f39882542b8826335d9a3c.jpg
2019-08-10T07:40:33.000Z,"Kesä houkuttelee nuoria aikuisia huumekokeiluihin – päihdelääkäri: Helle, humala ja tekemisen puute altistavat kokeiluille","Yhä useampi kokeilee huumeita ensimmäistä kertaa kesällä, kertoo yhdysvaltalaistutkimus. Suomalaisen päihdelääkärin mukaan kesässä on monia ensimmäiselle käytölle altistavia asioita.",https://img.ilcdn.fi/gFALeJB8CD4VrdUtqQESh6q1Kzc=/510x318/top/img-s3.ilcdn.fi/4aa2b24fe534dd9b7972d484885d28ee243d9c91395b2b8abf4ac90f052fa65f.jpg
