paivamaara,otsikko,tiivistelma,kuva,id
2019-10-30T04:39:33.000Z,Kaapo Kakon sinnikäs yritys palkittiin - kauden toinen maali syntyi onnekkaasti,New York Rangers otti kauden neljännen voittonsa. ,https://img.ilcdn.fi/bXC0-wHkCLd2ZS-1sRqGKkvxPa8=/510x318/top/img-s3.ilcdn.fi/cc5af7caadfdd7dc935c3eaec7bb553c82379febe676ce7f27dd64f7214eff4c.jpg,798E3A7487C74214AE11FD45F2B3DD9C
2019-10-30T05:00:00.000Z,"5 syytä, miksi nykytelevision kuva on omaa luokkaansa","Uusimmissa huipputelkkareissa kuva on kuin elokuvateatterissa: terävä, värikylläinen ja kirkas. Elämys ei synny sattumalta, vaan siihen on viisi selkeää selitystä. ",https://img.ilcdn.fi/XlLjsGSc-WwnBKSZWiIrpPyYKzQ=/510x318/top/img-s3.ilcdn.fi/14fc909f55fbc36845c7c1af5361c7bb0f0f09e7785a40e316e12be67cfa8e7b.jpg,5233A9F95CF9448E80E78B4F13260748
2019-10-30T05:00:28.000Z,Antti Hanhivaara katosi 13 vuotta sitten: erämaasta löytyneet tavarat viety nyt dna-tutkimuksiin,"Poliisi selvittää nyt, kuuluvatko erämaasta löytyneet tavarat kadonneelle Antti Hanhivaaralle.",https://img.ilcdn.fi/TozgfJOSB-nNFJg3DA2XWdU6czY=/510x318/top/img-s3.ilcdn.fi/b2b29e247a071e1d2b2fa3bb4b2f19aca1e830caa3853f9938e750b2e5908d50.jpg,986BBD430C1E4231A445BE21FBF26E9B
2019-10-30T05:03:00.000Z,Samia hoidettiin aivan väärin - Erikoislääkärikin kauhistui,"Muusikko Sami Nieminen ei ollut masentunut eikä hän kärsinyt työuupumuksesta, toisin kuin lääkärin vastaanotolla pitkään väitettiin.",https://img.ilcdn.fi/RZncmWUA41FRuMwQ8RyDEd27T54=/510x318/top/img-s3.ilcdn.fi/69d5235ff19537dcebf51e4046061b066f77f3534b47af47e714fd65690e8a52.jpg,DBF0822B314A4077BFE549D0BE20201E
2019-10-30T05:12:57.000Z,"Uusi tutkimus: narsistit voivat olla paitsi kamalia, myös keskimääräistä onnellisempia ihmisiä",Narsistien epätavalliset ominaisuudet tekevät heistä esimerkiksi vähemmän stressaavia ja masentuneita.,https://img.ilcdn.fi/4KEw77I6L_hEYiJf2ei587VENv8=/510x318/top/img-s3.ilcdn.fi/1b6cafd0d895e6a8081ed7c8538ac0d96a5de9baeb6edb2ce3db6b518dfd0c89.jpg,B92C8CEED3E7408A9092BBDCFA9ADA15
2019-10-30T05:16:47.000Z,"HS: Suomessa on ainakin viisi vankia, joita ei pitäisi koskaan vapauttaa","Psykiatrisen vankisairaalan vastaavan ylilääkärin Hannu Lauerma arvioi Helsingin Sanomille, että Suomessa on noin viiden vangin joukko, joita ei pitäisi koskaan vapauttaa.",https://img.ilcdn.fi/2y1RiszMO4tj4ijplxrMV17S7WQ=/510x318/top/img-s3.ilcdn.fi/5948d96e7f5248f79e7f5ae7b42d0c0a8093c7d2936ab3078c52c372ada4f840.jpg,728D41CD23214FB1807910313EF76347
2019-10-30T05:20:31.000Z,Ahon ja Teräväisen joukkuekaverilta historiallinen temppu: Näin syntyi NHL:n ensimmäinen ilmaveivimaali,Carolina Hurricanesin Andrei Svetshnikov teki NHL-historian ensimmäisen ilmaveivimaalin. ,https://img.ilcdn.fi/QQKwpQL3hla4wEbia-PaJraYFU4=/510x318/top/img-s3.ilcdn.fi/718f748826c0a0225b19d68d76f4b8c2bd66f223e82afbaf9c9b4ec6d6859a6a.jpg,104939DCF3D9471385D7F5871B3D11D7
2019-10-30T05:20:51.000Z,Australialaisnainen keksi nerokkaan kastelujärjestelmän: kaksi kärpästä yhdellä iskulla,Tee-se-itse kastelelujärjestelmä sai keksijänsä kiljahtelemaan innosta.,https://img.ilcdn.fi/phKjUL05JT7R08zkW252cXyk8k4=/510x318/top/img-s3.ilcdn.fi/8838f8c5eeeb66011fb8bdc6178652025d29b8d2792a5e1cd2f43042c7418206.jpg,F0A4B718FC0841AD82812046BBAB5E2A
2019-10-30T05:30:09.000Z,"6 superlukua ennustaa jo nuorena, millainen sinusta tulee vanhana - toimi välittömästi ",Tulevan vanhuutesi elämänlaatu ja toimintakyky paljastuvat jo keski-iässä sydän- ja verisuonitautien riskitekijöissä.,https://img.ilcdn.fi/HdXevkzR3OKHOJN0KHNFCBkRp5E=/510x318/top/img-s3.ilcdn.fi/201631750057684a4fe56932f05cf0a8c1d165ba00668c802d5af6ccacb610b7.png,74A05ACF03C5464884EF04F1B92BB474
2019-10-30T05:42:55.000Z,"Pippa Laukka hätkähti Wallu Valpion viikon ruokailuja: ”Pelkästään alkoholia, ei ruuan murustakaan”",Kymmenen julkkista pistävät elämäntapansa uusiksi Olet mitä syöt -ohjelman tulevalla kaudella. Wallu Valpion ruokapöytä hätkähdytti Pippa Laukkaa.,https://img.ilcdn.fi/EuI6TiXEgI7akMfx4qj3xFNPl5k=/510x318/top/img-s3.ilcdn.fi/a1abed67c62fad867cddd6bdf30dff6f1971e09e7f196ca142cfab46adca4270.jpg,B8604692C1924C9A92D4F1B793F3617E
2019-10-30T05:57:14.000Z,Vihdoinkin vahvistus! Game of Thronesin tarina jatkuu,Suositusta Game of Thrones -fantasiasarjasta tehdään esiosasarja.,https://img.ilcdn.fi/oJagb3isU5h89xhKjca4shxxEaU=/510x318/top/img-s3.ilcdn.fi/7581f3f33b3804a268e3945503002b10e532206d3b8786374ee2e36145103c22.jpg,080A4F4B945444BD9A8C09F70DF42046
2019-10-30T06:02:33.000Z,"Tuntuuko lokakuu poikkeuksellisen synkältä? Ei ihme, Kuopiossa aurinko paistanut yhteensä vain 26 tuntia","Erityisesti Rautavaaralla lokakuun sää oli keskimääräistä synkempi, mutta muuallakaan Suomessa ei paistateltu kuulaassa syyssäässä.",https://img.ilcdn.fi/eQeQVeug2um3vHHsXHZeX9OX5fI=/510x318/top/img-s3.ilcdn.fi/f8638ddfb023ceb1889ecddc59a6eb308e37245159b5196ac0fcd68e60609359.jpg,69098CDF479D4C6D83E67AEBEE4815B7
2019-10-30T06:15:17.000Z,Lapset kohtasivat kauhun: peura paiskautui sisään koulubussiin USA:ssa,Kukaan ei onneksi loukkaantunut vakavasti.,https://img.ilcdn.fi/2WtwaDtsnNiihQxyoinKdKobInw=/510x318/top/img-s3.ilcdn.fi/bc6b00ad85505d060deafa93e6337672b338588fee89ac1e76830072c97c4c88.jpg,58A32912A3814510AB1B55DAAA916947
2019-10-30T06:23:24.000Z,Suomalainen olympiavoittaja kertoo uransa karmeista kuormista – yksi harjoitus kesti viisi tuntia: ”Tehot tulevat alas”,"– Soutu on kivaa, mutta helppoa se ei ole koskaan, kiteyttää Pertti Karppinen, kolminkertainen olympiavoittaja.",https://img.ilcdn.fi/tg6gvsWuY45w4Oew_tP9N8rq8MQ=/510x318/top/img-s3.ilcdn.fi/16a0ea85f2c4b22ef1a301f6626c5523c52592e719202ba8fdd23476d5622f8c.jpg,69565F3EE72E4CCBB09FF77E972C5BB4
2019-10-30T06:27:47.000Z,"Vanha sähkölaitteesi voi olla vaarallinen -  liesi syypää lukuisiin tulipaloihin: 6 mokaa, jotka kostautuvat",Vuosittain pari tuhatta tulipaloa johtuu sähkölaitteesta tai -asennuksesta. Syynä voi olla esimerkiksi laitteen ikä tai huollon laiminlyönti.,https://img.ilcdn.fi/uy6XUxgqECDtWADFssKhONzBabU=/510x318/top/img-s3.ilcdn.fi/62e4df68461d2ae8e0060354b1b1fb918984523f8378485a128fd949f2d3b2a9.jpg,3EED4CEBA82749E8A5547ED59FB9822D
2019-10-30T06:44:34.000Z,SKA: Poliisi epäilee aikuista puukottaneen verisen 16-vuotiaan tytön suunnitelleen myös toista henkirikosta,Harjavallan veitsihyökkäyksen tutkittava rikosnimike koveni murhan yritykseksi. Satakunnan Kansan tietojen mukaan epäiltyä 16-vuotiasta teinityttöä epäillään myös toisen henkirikoksen suunnittelusta.,https://img.ilcdn.fi/Fz7RQ6jQVBO3T2ETNRvceLumlwY=/510x318/top/img-s3.ilcdn.fi/bc2fedd684d0f4646a542099cdf00bcf018b937085899c273bc0bfadf255a04a.jpg,0CF0A20D2267484AA8A614163032B4D8
2019-10-30T06:51:07.000Z,Helsingin väestönkasvu mullistaa suomalaisen politiikan - vihreät saattaa ohittaa keskustan pysyvästi,"Vaikuttaa epätodennäköiseltä, että keskustapuolueella on enää 2020-luvusta alkaen edellytyksiä nousta eduskuntavaaleissa Suomen suurimmaksi puolueeksi.",https://img.ilcdn.fi/r5IzX3Xh4_UVAb69ifSkkfDh-X0=/510x318/top/img-s3.ilcdn.fi/a069f867d624fe2fa83a4bc8b80fd126a5b5e437b77541f7e5cab661ef1c7e24.jpg,BD77A906576246D4B3ED85A3FD1DE620
2019-10-30T07:07:30.000Z,Korkolaki muuttui ja nyt on oikea aika yhdistää vanhat lainat – 3 vinkkiä kilpailutukseen,"Lakimuutos tuo lainanhakijalle uusia mahdollisuuksia, mutta muutama asia on hyvä ottaa huomioon.",https://img.ilcdn.fi/fBp676pkTV5IztmSeFDpJJZPyiQ=/510x318/top/img-s3.ilcdn.fi/db910b5520a3d96e144317862bea25448ee1bda7a5b680eb66baee21950af6c8.jpg,99814563575C448FACA43C3A22E96F0C
2019-10-30T07:08:08.000Z,"Therese Johaug kaameassa vireessä alppileirillä, norjalaiset haltioissaan: ”Hänestä on tullut vielä parempi”","Therese Johaug täytti kesällä 31 vuotta, mutta kehitys ei iän myötä ole päättynyt. ",https://img.ilcdn.fi/7G-Z4H3ShuSxL_0N38GBmIfVDfo=/510x318/top/img-s3.ilcdn.fi/d1275d28622e7a33398cc233913c10a749cde9adfc1dd9143f0d19247cbacc3b.jpg,E7A7E38C197146BB92AE36032BA61DAD
2019-10-30T07:10:00.000Z,Mikä neuvoksi ennenaikaiseen hiustenlähtöön?,"Monella meistä hiukset harvenevat iän myötä, ja useimmat miehet kaljuuntuvat ennemmin tai myöhemmin. Toisilla hiustenlähtö alkaa jo teini-iässä. Onneksi apua ongelmaan on saatavilla.",https://img.ilcdn.fi/Tj7dPAyndum4TGgHZIZdC04LQos=/510x318/top/img-s3.ilcdn.fi/00d69fd39f9bbde8e764199f7a5ceb1b70aaf235ae2d3589da48b6ffaeb4679e.jpg,2016070121827239
2019-10-30T07:10:14.000Z,Ensitreffit alttarilla -Heidin käytös puhuttaa somessa: ”Nelikymppinen bilehile vetää sangriaa ämpäristä” – Perhehaaveista puhunut Oskari saa sympatiaa,"Katsojat pöyristyivät siitä, miten kylmästi Heidi kohteli sydämensä avannutta Oskaria. Nelikymppisen naisen teinimäistä biletystä ei myöskään ihan ymmärretty.",https://img.ilcdn.fi/RSW89nQpz-gTBuH7AKXLcUiiw5Q=/510x318/top/img-s3.ilcdn.fi/9b0ace21c05ee117fea1ee2edf21e6c9c57faf047f12f0a638222929c48e5248.jpg,A25F9075C5ED4CE4849FDF83F3608A55
2019-10-30T07:45:32.000Z,Yksinkertainen opas Britannian vaaleihin - työväenpuolueen voitto johtaisi uuteen kansanäänestykseen,Ennenaikaiset parlamenttivaalit järjestetään 12. joulukuuta.,https://img.ilcdn.fi/YdsSCNME0AXhIt97Z0K_puYyDrA=/510x318/top/img-s3.ilcdn.fi/4152b4abaef5ccb0b237604e508694efe783d01696b098ceee88df5bcc5e540a.jpg,280725E6D6D24ACAA0314B5E37FE34A5
2019-10-30T08:17:50.000Z,9 käytännön vinkkiä: Näin vaihdat talvirenkaat autoosi itse,"Auton renkaiden vaihdon voi tehdä itsekin, jos ei pelkää käsien likaantumista ja osaa tehdä vaihdon oikein. Tässä tärkeimmät ohjeet omatoimiseen renkaiden vaihtoon.",https://img.ilcdn.fi/WhavD6fmIXcNFcxkW_02l53JlF0=/510x318/top/img-s3.ilcdn.fi/e87091917b49c66790dd96bd5e2b71235e8fca083238f7ec768a8cb8f5a19249.jpg,4F65DA65AE18471CACDD3DEDDB2E71AE
2019-10-30T08:27:56.000Z,”En ole mikään kikkailija”,Viron verojärjestelmän väitetään vetävän suomalaisia maahan. Tallinnassa asuva iTapsa-ketjun isän Tapio Marjasen mukaan totuus maiden eroista ole niin yksioikoinen.,https://img.ilcdn.fi/VTRJF0dHZjIw6rrVWvkqYrSk-YI=/510x318/top/img-s3.ilcdn.fi/a2d51b3973c35c4f457e351f83f2fb6dcf5f60fdd01221c7d3ff45f1fb82b445.jpg,B7A84CEA1B334C63B5225916364FB362
2019-10-30T08:36:24.000Z,"Tanssileski Toni Wirtanen jännittää joka viikko vaimonsa suoritusta: ”Luotan rouvan taitoon, mutta sitten on ihan kamalaa kun h-hetki lähestyy”",Muusikot Toni Wirtanen hämmästelee viikosta toiseen vaimonsa Jannika B:n antautumista tanssin pauloihin Tanssii tähtien kanssa -ohjelmassa.,https://img.ilcdn.fi/LwBNlih8bkdPQlnA4n2R_VzRkOw=/510x318/top/img-s3.ilcdn.fi/873388b3fb53b3133df66a6dd965bd968533145878b9900cf1593664c07223f8.jpg,85D00D56557549C083D977C4D3249736
2019-10-30T08:39:08.000Z,Conor McGregor käytti tapaamisen Vladimir Putinin kanssa häpeilemättä hyväkseen - turvamiehet suhtautuivat vakavasti viinalahjaan,Conor McGregor on keskittynyt vapaaottelu-uransa sijasta viskimerkkinsä mainostamiseen. ,https://img.ilcdn.fi/n1T2tnrwtt4DFpBz8XEKWhGmxAQ=/510x318/top/img-s3.ilcdn.fi/8ed173bc54352ade52e0a357fb2c08bb2baedd105871e9eda70d31dd02e5cb1c.jpg,E3A799769B26470F9FB0D2FFFB7EE0AE
2019-10-30T08:46:03.000Z,"Thaimaan kuningas jakoi taas potkuja - neljä kuninkaallista vartijaa sai lähteä, osa ”haureuden” takia","Thaimaan hovissa käy ovi nyt yhtenään - neljä kuninkaallista vartijaa sai potkut tiistaina, joista kaksi haureuden ja sopimattoman toiminnan takia.",https://img.ilcdn.fi/9bb08LWpHhXNpIU82_6WvsBGH5A=/510x318/top/img-s3.ilcdn.fi/2606a2871317ff35f95e26a50f180197093dabb54df03cbf0d06ee11bbb2ebb1.jpg,C8547E1EBF1B4B459919F9AFA97C123C
2019-10-30T08:46:23.000Z,22-vuotias vangittu Oulussa – mikä saa nuoren miehen raiskaamaan vanhuksen? Psykiatri: ”Ihminen on eläimistä julmin”,"Vankilapsykiatri kertoo, että seksuaalirikollisia on vaikea niputtaa yhteen muottiin tai profiiliin.",https://img.ilcdn.fi/hHFN0BUyAf_rsyrwUZ7rdFG4Pwg=/510x318/top/img-s3.ilcdn.fi/e45de8d55f097fc117e7148e6a15ff1dd55cfd17dd1520ce956be3cf8d956ab1.jpg,8714FBB4C0814627A9DB005912A29D05
2019-10-30T08:52:05.000Z,Juhana Vartiainen ja Päivi Nerg haluavat rahaministeriön uudeksi Martti Hetemäeksi,Haku valtiovarainministeriön kansliapäällikön tehtävään päättyy tänään. Martti Hetemäen seuraajaksi on useita tunnettuja halukkaita. ,https://img.ilcdn.fi/hKTa13KRfKJUSGtEtCBH54uc1wk=/510x318/top/img-s3.ilcdn.fi/77fcf46f903afc7cffbfa148f3e263d326d2370043a61d86216c22f31481abdb.jpg,09616B752F064A8FA1EEDE15E577FD2F
2019-10-30T08:56:30.000Z,Ricky Martin sai neljännen lapsen sijaissynnyttäjän avulla - tässä on Renn-vauva,Latinotähti Ricky Martinin perhe on kasvanut poikavauvalla.,https://img.ilcdn.fi/rVY6BK6BtLV9A4JtnQZF5d_ol3Q=/217x140:1725x1080/510x318/top/img-s3.ilcdn.fi/a1ba9df1d4040d9c6d7fa294aa6a2d561caa2c5866a6eb4bdd3f32695275f28a.jpg,C26A6C005CD446AF9CD3840BD344200F
2019-10-30T09:00:17.000Z,"Kahden lapsen äiti Katri, 36, ei ehtinyt treenata – sitten hän keksi itselleen naurettavan helpon tavoitteen","Näkökulman muutos auttoi Katri Gruneria, 36, lisäämään liikunnan määrää ruuhkavuosiarjesta huolimatta.",https://img.ilcdn.fi/MlxrfrZ1-NPlp3nqDjvgm7UqN3A=/510x318/top/img-s3.ilcdn.fi/5a0212365f9b6215e9ff8141c86b24c6b0798cb10cf3f3ba66821ff53365d5a1.jpg,3B8F4A79FBE842D4A4E779B462780EE8
2019-10-30T09:05:42.000Z,Tokmannilla meni lujaa kesällä - pörssikurssi kovassa nousussa,Tokmannin toimitusjohtajan Mika Rautiaisen mukaan myyntiä paransi myös veronpalautusten ajoittuminen aikaisemmista vuosista poiketen elo- ja syyskuulle.,https://img.ilcdn.fi/3p1iFrBzYAP4L7FqzQBrbrgGUFk=/510x318/top/img-s3.ilcdn.fi/225ef4cf968063906baa1a26f3f7339c721b131a1c5662dd20791339f72fa402.jpg,4849BF6BB46E48239137EBC5E85F63B1
2019-10-30T09:08:25.000Z,THL:n tutkimus: Sisäilma ei ole niin vaarallista terveydelle kuin ihmiset kuvittelevat ,"Suomalaiset pelkäävät sisäilmaan liittyvien terveysriskien olevan suurempia kuin ne todellisuudessa ovat, selviää THL:n tutkimuksesta.",https://img.ilcdn.fi/r1nIpIJ9e_Se6ClJwpEtzNPWYMQ=/510x318/top/img-s3.ilcdn.fi/c638f8dfd03153c79c9c1db7d8553b4f21c7dcc60173c5ca4f49428fa6acd0a5.jpg,7E4679CAC5FB42558D6C27E9B3F9C19B
2019-10-30T09:21:00.000Z,"Petra Ollilla takana raskas syksy: ""Yksi urani kovimmista päätöksistä""",Painin MM-kisoista sivuun jäänyt Petra Olli kertoo nyt kovan päätöksensä taustoista.,https://img.ilcdn.fi/orWQMwtQo6sf0tHn-SBJafcdOZY=/510x318/top/img-s3.ilcdn.fi/e14607c2193ed5cd63a8df4517286e9db705af3d881cad402b2f8a3812f59f9a.jpg,3C44207783534FA29E20444161778101
2019-10-30T09:31:53.000Z,Tältä näyttää täysin uusi Skoda Octavia - naamioituna vielä: Valtava 640 litran tavaratila!,Škoda on julkistanut uuden neljännen sukupolven Octavia-mallinsa huippumodernia tekniikkaa ja naamioväreillä vielä peiteltyjä muotojaan. ,https://img.ilcdn.fi/5kFmHJT8blBbaXSxwpChmP3NXeI=/510x318/top/img-s3.ilcdn.fi/3b35fab46b77b2f31c8ec2cab0c23b388c69cdecf1e12d5d54b30bb134412236.jpg,6E387A2CA69A4711B6742023F209C7AA
2019-10-30T09:34:47.000Z,"Trump keksi päästään, että al-Baghdadi ruikutti ja itki - tilannehuoneessa nähdyssä videossa ei ollut ääntä  ",Valkoisen talon virkailijat ovat ihmeissään Trumpin ilakoinnista.,https://img.ilcdn.fi/gAtCQ_r13rxwsK6FDOJ-ap1fKsw=/510x318/top/img-s3.ilcdn.fi/61506329d05a5f52d802bae35be03bbd4e31aae93001d3689ab71f3593213f27.jpg,F6F1141F1E6E4F6EADD4048D30ADF6EB
2019-10-30T09:38:08.000Z,Irtisanoutunut uutisankkuri Aino Huilaja kertoo elämästään pakettiautossa – avautuu myös lopareiden syistä: ”Olemme hyviä pilaamaan elämämme”,Maikkarin ex-uutisankkuri Aino Huilaja otti loparit ja lähti puolisonsa ja koiransa kanssa pakettiautolla maailmalle. Nyt hän kertoo päätöksestään uudessa podcastissa.,https://img.ilcdn.fi/vHn_81NFX8jBFiS6qCTx_UL2hfg=/510x318/top/img-s3.ilcdn.fi/c93d3e41cee579a94666a599c2cac507219b8cf3b66e6974f2ddb0624276f0cb.jpg,6077ED3C260342D0A2108991CD84649C
2019-10-30T09:58:26.000Z,Sensuroimaton Päivärinta tänään: Entisestä silikonblondista tuli suntio - Katri Haapanen kertoo nyt miksi,Erikoistoimittaja Susanne Päivärinnan vetämässä Sensuroimaton Päivärinta -ohjelmassa vierailevat tänään entinen kohublondi Katri Haapanen (ent. Sorsa) ja muusikko Sipe Santapukki.,https://img.ilcdn.fi/GmK9JUyepESBFEtrSnu-bjuvXAE=/510x318/top/img-s3.ilcdn.fi/224e76034e2f403162a23926f0935bd85662b0269705147ad3a293fe7cb437bb.jpg,92E89767D8234856BCDA90F95D47096E
2019-10-30T10:09:02.000Z,Tjäreborg jatkaa toimintaansa – hotellimoguli osti suomalaisten suosiman matkatoimiston,Norjalainen hotellimoguli Petter Stordalen on ostanut Tjäreborgin.,https://img.ilcdn.fi/ZcosIx1L1Eqly-6tDKRZrLXOLe8=/510x318/top/img-s3.ilcdn.fi/f1d5fdee8a91c95b9d19e08ba1bcacb06db1a343af9af6ac4b4e8aeebcf57750.jpg,3FC6A98163CF4F06B3A57999C3D238FB
2019-10-30T10:12:20.000Z,Farkut uudella tavalla – kopioi julkkisnaisten 7 tyyliä,"Jos rakastat farkkujasi, tästä jutusta löydät asuinspiraatiota jokaiselle päivälle.",https://img.ilcdn.fi/fJPUDcDSzN4YerMqiCyI7LYayy8=/510x318/top/img-s3.ilcdn.fi/569416dcb3b81bfb779a0ed800a95b2ae175302f0b30c5b92ee2712503a87400.jpg,45C89959A81B4B19A6EAF6F1FD9D5693
2019-10-30T10:17:14.000Z,Kännykkävideo paljastaa: Tältä näyttää paluu maastopalojen keskelle jääneeseen kotiin,Kaliforniassa riehuvat maastopalot ovat jyränneet alleen useita koteja jättäen useita kodittomaksi.,https://img.ilcdn.fi/Re-1fS39bmgl33AJ2EgtwiMmxes=/510x318/top/img-s3.ilcdn.fi/d83ded9c4db4b2343d80afb9639e8bea360ffedefe58a925581eb801778a41c3.jpg,FC71F15F372A43B19C1958FE1E66EE8C
2019-10-30T10:20:06.000Z,Blogi: Salkkarit-tähti Johanna Puhakka erosi avopuolisostaan: ”Silmäkulmat ovat olleet kaikkea muuta kuin kuivat”,Näyttelijä Johanna Puhakka kertoo tuoreessa blogikirjoituksessaan eronneensa avopuolisostaan.,https://img.ilcdn.fi/j3wbEZG6DBQaEF9UOS8_QVV844U=/510x318/top/img-s3.ilcdn.fi/46545ae71f982a6cd72e5eaff34a31db27cb5baa724b4ab4d03a66ce794a6d5f.jpg,EF3F1408D4F24C19BC2006819DEFBF84
2019-10-30T10:30:06.000Z,Nyrkkeilyn raskaansarjan maailmanmestari pelkää tappavansa vastustajan – vertaa voimiaan Hulkiin: ”En voi kontrolloida itseäni”,Nyrkkeilykuolemat ovat koskettaneet myös Deontay Wilderia.,https://img.ilcdn.fi/VH1vGwXn7vG2pYQ5pENibkm7nZo=/510x318/top/img-s3.ilcdn.fi/0e6ee1b7757cdedebac996a14aea5436d5293b50511cb475ee58b7ede6cb30ae.jpg,D072BF741440463EADC0D059043F007A
2019-10-30T10:44:00.000Z,"Suomalainen Jan, 34, nousi Euroopan etsityimpien rikollisten listalle",Keskusrikospoliisi on kierrättänyt Suomen maapaikkoja Europolin ”most wanted” -listalla.,https://img.ilcdn.fi/RGC6P7aJqd7dQe6D6HNLB886rbM=/510x318/top/img-s3.ilcdn.fi/16e88fdbd0f95d75f35736bf0adb349021fe7e0dd386507ff231c7e41c592f9d.jpg,AD5EB007D4F745829F345B95E7A2E9B9
2019-10-30T10:49:35.000Z,Ex-missi Niina Lavonen toista kertaa raskaana: ”Miten ihana vihdoin jakaa tää teidän kanssa”,Nykyään pankkialalla työskentelevä Niina Lavonen odottaa toista lastaan. ,https://img.ilcdn.fi/DKOg6Pr1PLhGwbrGatxvd9Dka7E=/458x257:2202x1348/510x318/top/img-s3.ilcdn.fi/57fc21f46c4cd4cad65cd2d5289e3fb28e33c5fb8f6afed49851d4a220366b1f.jpg,1831615E96B446608E4C658DFF34AF92
2019-10-30T11:10:09.000Z,Yksi tilasto avaa maagisen maalivireen taustaa - Lukko joutuu tänään koville Jesse Puljujärven kanssa ,Päivän pelivalinta on Liigan kärkikamppailu Kärpät-Lukko. Kärpillä on voitolla mahdollisuus nousta sarjataulukossa jo tasapisteisiin Tapparan kanssa.,https://img.ilcdn.fi/kuta4NSIqWkJ6oIAC3DxK5mbf8M=/510x318/top/img-s3.ilcdn.fi/32f7aba6434a3a808e0caeb07c32f2c980c28dcfb6e9ea6df03476284297f03a.jpg,27E34FDA00094A2F9F75A40B01FB34E3
2019-10-30T11:10:54.000Z,"Isabel, 79, kuoli kylpyammeeseensa Madridissa, mutta jatkoi laskujen maksamista - 15 vuoden jälkeen käly soitti poliisille",Naapurien huoli johti lopulta toimenpiteisiin.,https://img.ilcdn.fi/gSOaEWYpAPZZ3KsVx02U7YPOEek=/510x318/top/img-s3.ilcdn.fi/17e3b64aff908ee1d2ee28faa3189607420a46947dd5284d9b4c5ee89a37eff5.jpg,A20DAE063A3743DCAEE691D3C0D3C1AC
2019-10-30T11:28:47.000Z,Al-Baghdadin sisäpiirissä hääri Isis-loikkari - nyt terroristijohtajan kavaltaja voi saada jopa 25 miljoonan dollarin palkkion,Yhdysvallat lupasi Isis-johtajan päästä 25 miljoonan dollarin palkkion. Se saattaa nyt mennä terroristijohtajan kavaltajalle. ,https://img.ilcdn.fi/e0ABV5pR1Plle4J8UWn3JPzcNLY=/510x318/top/img-s3.ilcdn.fi/3a9ef33258d9951ec966e0c82d3d223d46131784eb55b96dd0938139369242d9.jpg,6C71A7BD5A9E41DBBA6099A37453AE2D
2019-10-30T11:30:06.000Z,Potilas sidottiin sänkyyn ja sairaanhoitaja painoi tyynyä naamalle – tuomittiin pahoinpitelystä,Huutavan potilaan naamalla tyynyä pidellyt sairaanhoitaja tuomittiin sakkoihin. Hän myös menetti työnsä Auroran sairaalassa Helsingissä.,https://img.ilcdn.fi/QRcyP_3B_cCa-7Lh0kqh-TtpIII=/510x318/top/img-s3.ilcdn.fi/b84fd2c839eb391b6ab8fe6b440cbea5969d77a80a7996010e5fad20b44efdb8.jpg,F3535CBCD9FA44A69DAD02C1A861FFD9
2019-10-30T11:42:10.000Z,"Päivän ravivihje: Toto64, Teivo 30.10. ",Kahdella varmalla Vermon iltaan.,NULL,1B5EFEFD0A144F3B8FCB60EFC7DE647E
2019-10-30T11:43:52.000Z,Itsenäisyyspäivän juhlavastaanoton kutsujen postitus on käynnissä - juhlien teema julki,Tasavallan presidentin kanslia kertoo tiedotteessaan tämän vuoden teeman olevan tieto ja yhteiskunnallinen keskustelu.,https://img.ilcdn.fi/q6cs-NXteluo3JIgojV2918Ux9M=/510x318/top/img-s3.ilcdn.fi/8af778dc49b7a073946866869e1ecda3b8e4f939fcf8be5012d483d6af15a9a5.jpeg,0A2186E8A4E044C1B30C9CD32C7923AC
2019-10-30T11:53:02.000Z,Pikkujoulukauden kuumin mekko ja 5 muuta asua juhlien kuningattarille,Nyt on taas aika vetää bilemekko ylle. Oletko valmis näihin juhla-asuihin?,https://img.ilcdn.fi/LJVUoAza6D713iWmC88WL8MvwNc=/510x318/top/img-s3.ilcdn.fi/b037d17d15e16b214f1c922ad0038cb03a27611e31b97686d7558a7326dd2d4b.jpg,56B1A04FE64F4C63A05657C39E7F602A
2019-10-30T11:59:48.000Z,Mopoauton alle jäänyt 14-vuotias tyttö kiidätettiin helikopterilla sairaalaan - sai vakavia vammoja,Mopoauton alle Parkanon keskustassa jäänyt tyttö loukkaantui onnettomuudessa vakavasti. Poliisi kaipaa turmalle nyt silminnäkijöitä.,https://img.ilcdn.fi/DcnxjgJueceaN_RQo3_YBHHp-z0=/510x318/top/img-s3.ilcdn.fi/6f67b9b9df732bd4092cc6850b06cf85c8169b9847157d6ed17ecdc6f585b578.jpg,4433794648AA4AEC85053F1F234B5D7A
2019-10-30T12:32:08.000Z,"Sami Yaffa tuohtui vaimonsa Meeri Koutaniemen saamasta tuomaripalautteesta: ”Kuohahti niin, että meinasin lähteä nostelemaan parketin kautta”","Sami Yaffa ei osannut etukäteen arvata, kuinka hermoja raastavaa vaimon osallistumisen Tanssii tähtien kanssa -ohjelmaan olisi.",https://img.ilcdn.fi/E3P8OrX-njLO8uztgLh1JWfenFQ=/510x318/top/img-s3.ilcdn.fi/661ebfea6a634c218802d7c4193336056674efa60975e68f3bbc48ce0c7409e7.jpg,869E59E1724C449EA2C38564F75AE46B
2019-10-30T12:37:10.000Z,Jääkiekon olympiavoittaja pahoinpiteli naapurinsa metallitangolla – tuomari määräsi miehen sivuun oikeudenkäynnistä,Mark Pavelich hakkasi naapurinsa metallitangolla kalastusreissunsa päätteeksi. Tuomarin mukaan entinen kiekkoilija ei ole kykenevä osallistumaan oikeusprosessiin. ,https://img.ilcdn.fi/e4YE30htG9uq3vHQsAqhOCr4rFw=/510x318/top/img-s3.ilcdn.fi/ae410b1c7d1f400eecbe7816892c5746057a261ffa29dd8458669da7644d01df.jpg,68E15B82CD984F93A40FD6B599870681
2019-10-30T13:01:05.000Z,Rita Niemi-Manninen antoi vauvalleen korviketta – äidit raivostuivat,Rita Niemi-Mannisen tie Imetyksen tuki ry:n imetysvaikuttajana päättyi väsymiseen rajuun kritiikkiin.,https://img.ilcdn.fi/808frbGQq-OQsoZrhr-Buxmpttg=/510x318/top/img-s3.ilcdn.fi/baef909c74e36530d959ac7917d316ede9dd70f7b516ca74dcf35b04e5880b84.jpg,F4402404ED654144A8E0FAB29C238899
2019-10-30T13:11:52.000Z,"EK:n johtavalta ekonomistilta pysäyttävä arvio: ”Yritysten odotukset synkentyneet - kysyntä hiipuu, tilauskirjat ohenevat”","EK:n johtava ekonomisti Sami Pakarinen pelkää, että ”kasvuennusteita tullaan päivittämään vielä alaspäin”.",https://img.ilcdn.fi/sVTc8uwAsCRgbbVzzq5kr4PvHxc=/510x318/top/img-s3.ilcdn.fi/6dbf8adfc4d890e90381388b6509ea79b61a8ff3894c513df7c2d1811f799277.jpeg,AAA3113B40E447C791B692AF8BB18537
2019-10-30T13:28:29.000Z,"Nylon Beatin Jonna julkaisi harvinaisen kuvan lapsistaan: ""Tyttäreni, rakkaimpani”",Jonna Geagea on jakanut suloisen kuvan lapsistaan.,https://img.ilcdn.fi/rS41L_Iv4lN78RQHDBe_lR5suDU=/93x543:4066x3033/510x318/top/img-s3.ilcdn.fi/1da1cc4b4f31e32ff93372c2ef0fe0baf0d6e310ca73ee3f491191b6376a4de4.jpg,A9C06102570D434AB8D18559E29E0EB0
2019-10-30T13:28:53.000Z,Nyrkkeilyn uskomattomassa suurottelussa pää värähteli kuin äänirauta: ”Teloitukseeni suunniteltu erä on ohi” ,"Trash talkin mestari Muhammad Ali haastoi maailmanmestari George Foremanin 45 vuotta sitten Zairessa. Rumble in the Jungle on yksi kaikkien aikojen kovimmista, puhutuimmista ja seuratuimmista urheilutapahtumista.",https://img.ilcdn.fi/Yn-dGxAvrxP_mXRD2iXBRGOZaoI=/510x318/top/img-s3.ilcdn.fi/7abcb75cd363ed47456471b68f7e4f4c62718326978642642b6837038c6acd15.jpg,91F254CF227E4D71A175F6CC2D98EE4B
2019-10-30T13:36:31.000Z,"Aurinkoloma muuttui taisteluksi elämästä ja kuolemasta - hai vei jalan,  ruotsalaispari pelasti brittimiehen hengen Australiassa","Emma Andersson ja Billy Ludvigsson pelastivat brittimiehen, joka menetti toisen jalkansa  haihyökkäyksessä suositulla turistirannalla Australian Queenslandissa.",https://img.ilcdn.fi/Ry3dwqbrDAFCScAlCHR6SlPjEF0=/510x318/top/img-s3.ilcdn.fi/58eb9628f4bef74a3439a3ac0449914e481ad24c1fedb97ffbf6fc0fbfb49724.jpg,759C788C20734F318DF1424CCB28E104
