paivamaara,otsikko,tiivistelma,kuva,id
2019-10-29T04:35:49.000Z,Ensitreffit alttarilla: Heidin käytös hämmentää Oskaria – ”Miten joku voi vihata noin paljon?”,"Oskari toivoisi, ettei Heidi kokisi tarpeelliseksi lähteä hyökkäämään häntä kohtaan kovasti.",https://img.ilcdn.fi/2iE-F2O45dOuAo9c00jGcVmmsi4=/510x318/top/img-s3.ilcdn.fi/02749d5c9e69dde874c3bfc0de454ef44eb7bbc1fb3815cd7f75fd05839b17c8.png,98576BCE799D494A84E36B9CA34E9F60
2019-10-29T04:36:42.000Z,"Lauri Markkanen rohmusi pisteitä, mutta Chicago Bulls hävisi taas",Chicago Bulls on hävinnyt kauden neljästä ottelusta kolme.,https://img.ilcdn.fi/82csyOq-yy2bAZm5Effsd3C02LM=/510x318/top/img-s3.ilcdn.fi/f9924cd5e4fbaa33e65bdc7588ae57e1e5fa0278b4d13a3471e3d67a551ad19d.jpg,5F18D5E51A7F4392AB09B663C2166C0C
2019-10-29T05:00:39.000Z,"""Otin opikseni”",Huumeet veivät Riinan elämästä kymmenen vuotta. Vasta vankilaan joutuminen auttoi hänet irti menneestä.,https://img.ilcdn.fi/XxBeS_y8Bc41iA53YZr9MMJ4P-c=/510x318/top/img-s3.ilcdn.fi/b6624069da86d57c087015635e8b10d79d2c06675ac6a5c429df125d7ef37c75.jpg,DCDF5648210C4C708ED027FE72B88AD9
2019-10-29T05:01:46.000Z,"Hyytävän sininen karttakuva kertoo, mikä on Suomen vanhustenhoidon suuri ongelma","Hoitajamitoituksen nosto ei yksin auta tilanteessa, jossa hoitajista on jo nykyisellään huutava pula.",https://img.ilcdn.fi/cvhvdC_bSX2Znu-OPFxMHSESiKg=/510x318/top/img-s3.ilcdn.fi/5030a9189a907f33b37d6c3b70acc55e2d5363ae1a226744b4349daacb997a23.jpg,67D2557D7DD5478D99A0F92CA9723492
2019-10-29T05:16:19.000Z,Aleksander Barkovilla sysimusta ottelu NHL:ssä – teki murheellisen oman ennätyksensä,Vancouver Canucks rökitti Florida Panthersin.,https://img.ilcdn.fi/8xjKJszNTv2cBru-ssMd079OoMo=/510x318/top/img-s3.ilcdn.fi/822804fc992c7c2678ce08516b8de06deeece76c2c3cac2db859f0b5f538d607.jpg,9B341508B5A242708FBB2442D5449D2D
2019-10-29T05:19:58.000Z,Lauri Ylönen suunnitteli hulppean kakkoskodin Mikko Kuustoselle ja Hanna Brotherukselle – tältä siellä näyttää,"Lauri Ylönen rakastui järvimaisemaan, joka Kuustosen ja Brotheruksen mäntyharjulaisen kakkoskodin ikkunasta avautuu.",https://img.ilcdn.fi/Qi7UzhuCh5t8fsCh7_-Jjc8B3Ug=/510x318/top/img-s3.ilcdn.fi/9bb2cf9f5acb2359d41ea3ded3eb218cd811a3ac82711537d7989691ed610e36.jpg,A9D3E9B918AA41178FE4C6F49A73DF4E
2019-10-29T05:31:15.000Z,Porakaivoon pudonnut kaksivuotias intialaispoika löytyi kuolleena,Poika putosi kaivoon perjantaina.,https://img.ilcdn.fi/YN5RMis5JZiJ6kEk9pBzSQawXYE=/510x318/top/img-s3.ilcdn.fi/3e56ec061ba1a1c37e683dc1b985be14e12402ccc9604c96b9796f276bcee514.jpg,F2CDBBF8D77243898FAC6228331F0716
2019-10-29T05:31:42.000Z,"Muut eivät tajua – Iivari, 27, löytää kirpputoreilta jatkuvasti aarteita: 50-luvun lasia, arvohuonekaluja ja lamppuja: ""Tuhansia euroja olen käyttänyt""","Iivari Viilomaa, 27, metsästää kirpputoreilta upeita lasiesineitä ja trendikkäitä vintagekalusteita, joita monet himoitsevat. Kokoelmaan kuuluu satoja esineitä.",https://img.ilcdn.fi/EW59VJCmZXNSmVdkmGae-7JXWOI=/510x318/top/img-s3.ilcdn.fi/7b75ed7900bd08c478415d3c14c66b58efa5cbc90cf14c554cb26080281c3319.jpg,741926415EFD4385869DC6EB9252D1F1
2019-10-29T05:44:38.000Z,Halloween-pirskeet Valkoisessa talossa: tällaisissa asuissa lapset juhlivat,Presidentti Donald Trump ja hänen puolisonsa Melanie Trump järjestivät juhlat Valkoisessa talossa.,https://img.ilcdn.fi/82S0h5uujuBzIP-FnDU3JZkxRkU=/510x318/top/img-s3.ilcdn.fi/6290d08bb8026cc20c08c9f7a298f52bdf0eb366c1a04c11ee960fe8d02812ff.jpg,8E9176F75911486E89ACF08301420F8A
2019-10-29T06:01:08.000Z,Palo roihusi rajuna – Perheen haukullaan pelastanut Pörrö-koira teki jo toisen sankarillisen tekonsa,Suomen Kennelliitto myönsi Pörrölle kunniamaininnan sankarillisen toiminnan johdosta.,https://img.ilcdn.fi/lirw6mq52ckGZQPax8jO9dpt70E=/510x318/top/img-s3.ilcdn.fi/5e4a771fe5eb315772feaeb88ee73491f3090fc82e24f32c0e2e467bde867132.jpg,80DE116889B142E09B92A53F4C476FEE
2019-10-29T06:02:13.000Z,"Heti häätöiltana Eeviksen kanssa samaan sänkyyn: ""Vietimme yön yhdessä""",BB-talosta häädetty Jukka vieraili Iltalehden studiossa ja kertoi tuoreimmat kuulumisensa.,https://img.ilcdn.fi/wroU-Y0wk577XMgWIOnFzGteX5Y=/510x318/top/img-s3.ilcdn.fi/77196e3e94fd74b5f6deaf034bc57786378ffa1baf185e3df7d0d6abd6028b26.jpg,2369A008CAF54D25AC3D463C9A8365E8
2019-10-29T06:04:50.000Z,Jukka Hildén paljasti pian syntyvän lapsensa lasketun ajan – ”Batman-prinsessa” on tulossa hetkenä minä hyvänsä ,Jukka Hildén julkaisi Instagramissaan tuoreen ultrakuvan tulokkaasta.,https://img.ilcdn.fi/XCHTERrXulPR6nKFstwCuAidt74=/510x318/top/img-s3.ilcdn.fi/06846cd3cf39ba43732f1bf227136aaadd9bce721dd5847bd735258c82880b00.jpg,3CC11F7B424D458C936ECDA8581BEE69
2019-10-29T06:12:42.000Z,"Presidentti Trump julkaisi kuvan sankarikoirasta, joka loukkaantui terroristijohtajan jahdissa ",Koiran nimi pidettiin edelleen salassa.,https://img.ilcdn.fi/HwMKA8ZCUVOkMBHX8-aDBHniOFY=/510x318/top/img-s3.ilcdn.fi/57b11aec8bdb5a21579d9990646dd610d9894c8173773915b16537c610c55df1.jpg,28195F353CE949EDAB33932C00D045CD
2019-10-29T06:29:55.000Z,Aino kehuu teinejään pienistäkin jutuista ja katkaisee netin yöksi – Sijaisperheen rutiineista muutkin voivat ottaa oppia,"Murrosikä on tärkeä vaihe elämässä, ja siinä sivussa aikuinenkin kasvaa ja oppii, sanoo nokialainen sijaisperheen äiti.",https://img.ilcdn.fi/_fiMIKrWiMwkdygef9wWI8eVFuw=/510x318/top/img-s3.ilcdn.fi/1ec271f882c16a734f0e52dc57ffde2f3e6673b518ed6d61e61354e6652c4a49.jpg,A76D009726834BB8A6886DFF1FEB907E
2019-10-29T06:32:00.000Z,"Laskujen eräpäivien missaaminen kävi Atelle, 43, kalliiksi – ratkaisu löytyi kännykästä","Laskupinot kasaantuivat turkulaisen Aten eteisen pöydälle, ja laskujen eräpäiviä oli hankala muistaa. Lopulta hän pääsi eroon kalliista maksumuistutuksista ja paperilaskuista Clark-sovelluksen avulla.",https://img.ilcdn.fi/FSiNk8Xq0z2US3zzr8rJxGrrYY8=/510x318/top/img-s3.ilcdn.fi/c41ad7509ed6d99b2f86b848ff1a6b1dad81c2a4c906f1bb654dde1917e869f9.jpg,F56127591C3C4014824E9224C3D1C6B2
2019-10-29T06:36:47.000Z,"Painin olympiakulta yritettiin viedä törkeällä tavalla – Pertti Ukkola kertoo, kuinka tuomarien puhelimeen soitettiin monta kertaa",Pertti Ukkola valittiin historian toisena suomalaispanijana kansainvälisen liiton Hall of Fameen.,https://img.ilcdn.fi/aEzo-ocgbL0crcgvXrCJgyHVyz4=/510x318/top/img-s3.ilcdn.fi/4713427c79c3032e8cc07c64606f4937357204be414c698f35c99be642259078.jpg,4451E8E6B9FE4A13B0DF4286AC15B426
2019-10-29T06:38:53.000Z,Mehiläisen lääkäri vakoili ex-miehensä puolison potilastietoja,Naislääkäri kalasteli entisen miehensä uuden puolison tietoja työantajansa lääkäriasema Mehiläisen tietojärjestelmästä.,https://img.ilcdn.fi/KMRsm_baBQl1qWoUK-za7VinaOQ=/510x318/top/img-s3.ilcdn.fi/32c9440bc50b5fcbc4f992bf9c4605b94754e20027ff55c41f79ce0ccb176216.jpg,E060D12BCC3B45DF81DD1B12608471B7
2019-10-29T06:45:34.000Z,Minna hämmästyi – näin hän sai 12 lainatarjousta parissa minuutissa,"Minna etsi lainaa remonttia varten ja yllättyi, kuinka nopeasti hän sai lukuisia lainatarjouksia pienellä vaivalla. Lue Minnan onnistumistarina täältä!",https://img.ilcdn.fi/bElzKhD5WXEV_YzFSrgUSdNxtyk=/510x318/top/img-s3.ilcdn.fi/19ec00ff84686f04768dae5ff548ee849a19282fc960c34b8f733a2eb3966790.jpg,F7DD5914F55145139379C5E8051D8C8B
2019-10-29T06:47:50.000Z,Muistatko vielä nämä kutsumokat? Kutsut Linnan juhliin lähtevät tällä viikolla – näin kierretään mahdollinen postilakko,Mahdollinen postilakko ei sekoita valtakunnan odotetuimpien kutsujen aikataulua.,https://img.ilcdn.fi/H-eqPJheo3-fyAWsUCLsi7ClJps=/510x318/top/img-s3.ilcdn.fi/c48e544abcd3f298913cfefb124e45204e5a89978b9d8f2e27976e6618ab6134.jpg,9051CCAD0F2C42B4880F49A3A12BE8BC
2019-10-29T07:02:42.000Z,Max Verstappen tötöili taas – Jos-isän kanssa samassa tiimissä ajanut JJ Lehto tiivistää toiminnan yhteen sanaan: ”Typeryyttä”,Max Verstappen puolusti Meksikossa kahden edellisen vuoden voittoaan.,https://img.ilcdn.fi/oq4ljk5EgGG4Kv20ZtdwzEPLcUU=/510x318/top/img-s3.ilcdn.fi/802db4e4812ae30426fd739074a576441d506f62bc3336e1dad7e077281227ef.jpg,1B6F1C3AE28448F7862C7775F081C099
2019-10-29T07:10:51.000Z,Helppo ja nopea lisälaite talikkoon – Matti suunnitteli lisälaitteen pihatalkoiden avuksi,Matin talikkoon asennetulla lisälaitteella roskien siirtely helpottuu.,https://img.ilcdn.fi/9d4N-kMgwV2uRFiaB_wLvwhwubE=/510x318/top/img-s3.ilcdn.fi/28a30111f282b849e31099f15ec58df841f671207dde15ec367e45fb373e96a2.jpg,27A1EE81774F4623A99FFFB92DCC209C
2019-10-29T07:13:25.000Z,Työntekijöiden palkanalennusta ajanut Posti kasvatti liikevoittoaan 134 %,Postin mukaan osa kesän ja alkusyksyn jakeluhäiriöistä menee PAUn laittomien lakkojen piikkiin.,https://img.ilcdn.fi/LIJ11CXYLGwOjnLLYc-pEYEcbXI=/510x318/top/img-s3.ilcdn.fi/2c2a34deef7647bc482fba9817b9c642054153d5bd91472a33173a03fdb37db2.jpg,9EEDC6FDF30E4212BA5F5EA1DCAF5DD5
2019-10-29T07:33:48.000Z,"Raisa, 21, on mielestään ihan hyvä kuski - Ajanut kolmea ihmistä päin ja melkein sillalta alas",Suomen surkein kuski -ohjelmassa mukana oleva Raisa on ollut ajaa autolla myös jokeen. ,https://img.ilcdn.fi/IKUBaZmlpbXpkcUs0_WdtE21TxQ=/510x318/top/img-s3.ilcdn.fi/5250cd08f07ecabc96afaf65128488ee4432fd9e011336f958c8e743de87bffa.jpg,7FA0987B95BE4D5BB91702340EFA7C19
2019-10-29T07:49:41.000Z,Luksusristeilijän ikkunasta pudonneen taaperon isoisä sai syytteen taposta,"Chloe Wiegand kuoli heinäkuussa San Juanin satamassa, Puerto Ricossa.",https://img.ilcdn.fi/agxmQwydv99pJ58GiS0KyROkJC4=/510x318/top/img-s3.ilcdn.fi/219f1ec2b201717c73e61f47c926530ba835bbd122ce9be0e6e50740617bbd09.jpeg,33FAF413698846F39A46DB8F0A4D72B4
2019-10-29T07:55:24.000Z,"Näissä maissa käy kaikkein vähiten turisteja - mene, jos haluat välttää ruuhkat","Haluaisitko lomailla paikassa, jossa vältyt suurilta turistimassoilta? Näissä maissa sellaisia ei löydy.",https://img.ilcdn.fi/lhUEH_MKd4okC8EAFiTrl2nsqIY=/510x318/top/img-s3.ilcdn.fi/2f6d725772169c307cb2b80505575a69df70f3afaa9af2e28d3d6a70b262cd99.jpg,7893B52CE47C4CB9B266B558900540F0
2019-10-29T07:58:47.000Z,Olet mitä syöt -ohjelma palaa: mukana 10 julkkista - seuraa osallistujien julkistusta IL-TV:n suorassa lähetyksessä,Olet mitä syöt -ohjelman uusi julkkiskausi alkaa joulukuussa MTV3-kanavalla.,https://img.ilcdn.fi/nxFkJcijyhsAPLIzhJC--995pR4=/510x318/top/img-s3.ilcdn.fi/ac1697ca4958aae4b832d931c663aefb0dac4d20717ba8843d195fa943a68b28.jpeg,114481B74D45425DA91688474CABAF83
2019-10-29T08:07:22.000Z,Tuskissaan kierivä Rangers-luotsi otti kantaa Kaapo Kakon alakuloon – huomautti isosta muutoksesta: ”Hänellä olisi jo 18 pistettä”,New York Rangers luisui tappiokierteeseen.,https://img.ilcdn.fi/9PfMEP7xN7puCpNM597wQmkuTp4=/510x318/top/img-s3.ilcdn.fi/86f2ae177c9bf9babc5767c5425cbbdb9c0babba6a914f7da8d02ddc3a17912d.jpg,48986A7C1700498980F3C3D50EDACB8C
2019-10-29T08:09:34.000Z,Apple pisti Airpodsit uusiksi – Pro-ominaisuuksilla varustettujen kuulokkeiden hinta 279 euroa,"Apple on esitellyt uudet Airpods-kuulokkeet, jotka poistavat taustamelun.",https://img.ilcdn.fi/r2pXGNFVRCvtsqKWIJCzKp4n6oY=/510x318/top/img-s3.ilcdn.fi/07e77b23290407a27a6a2fca64fafd1ada9ff979e079fbe6671cf8d9f88886a2.jpg,04DA35BA6F594F7194AAD8029A818CAB
2019-10-29T08:20:34.000Z,Poliisi epäilee: Pyöräilijä joutui karun katuryöstön kohteeksi Turussa – sai pitää vain alushousut,"Lounais-Suomen poliisi tutkii tapahtumaa, jossa parikymppiseltä mieheltä vietiin vaatteetkin päältä Turussa.",https://img.ilcdn.fi/eF46VFJZfxn6MI0uTU0FoKqcLk4=/510x318/top/img-s3.ilcdn.fi/bcdd2f1b703da5f5b5e5a662c30c898099900025ad387b5bb5202b3d2ca49747.jpg,27FFD9664D724B379A1E6A6C20FE6800
2019-10-29T08:27:14.000Z,"17-vuotiaiden turma herätti huolen – Jo yli 10 000 alaikäistä saanut ajokortin, tuhansia hakemuksia jonossa",Suomalaisnuoret ovat hakeneet poikkeuslupia sankoin joukoin. Onnettomuustilastoissa tämä ei näy.,https://img.ilcdn.fi/bTEQqX4P783CGctqbPoFc0y0Nwk=/510x318/top/img-s3.ilcdn.fi/94dd639f7d01f03bf05a93c4708e71dd4513f21da1f1bccf0d19b4e121cd6945.jpg,653613BD570F4305878D6A2E3E81B519
2019-10-29T08:46:50.000Z,Suomalaisvalmentaja sai potkut KHL:ssä,Sotshi antoi kenkää yhteensä neljälle valmentajalle.,https://img.ilcdn.fi/O4g62tO6KLBqQj9cW1TZQCKHkM4=/510x318/top/img-s3.ilcdn.fi/5a4fcf12dfa1535cf1641c30e44b8371b6e27ab6ec1d6d5b3ebd6a293e50002b.jpg,2C996A9495294351A6214ABF214D16A5
2019-10-29T08:49:17.000Z,"Tässä ovat Olet mitä syöt -ohjelman 10 julkkista: Kaisa Liski, Meiju Suvas, Wallu Valpio...","MTV3 julkisti tänään tiistaina julkisuudesta tutut henkilöt, jotka parantavat elämäntapojaan Olet mitä syöt -ohjelmassa.",https://img.ilcdn.fi/KE8A-a_7iGcqx2FdYT8_ML19y4A=/510x318/top/img-s3.ilcdn.fi/4eb2ce24425e3dffc660a5f353f232ada08f0a5c35aaa548df49929f1a0a2a33.jpg,D6B1F8DF17E043AABA67CEF3EE53F839
2019-10-29T09:11:27.000Z,Messi kuntoutunut – latautunut Barcelona lopettaa Valladolidin leijumisen,Päivän pelipoiminta tulee La Ligasta. Odotan Barcelonan lyövän tänään luun kurkkuun ylisuorittaneelle Valladolidille.,https://img.ilcdn.fi/msYLWSj8T_ydYCCtzeAbGxqz_Pg=/510x318/top/img-s3.ilcdn.fi/6e95e27f4dd7eb17e5fbb4109851dc3f6bdd35795e9abf240691e61142b8e61f.jpg,7567FE729FCC49CA99C6718481D9F63F
2019-10-29T09:20:49.000Z,"Espoon Erotuomarikerhossa kuohuu – ex-avainhenkilölle tuomio petoksesta, todistaja sai kenkää seurasta: ”Rettelöitsijä”",Riitaisella yhdistyksellä oli kaksi samanaikaista asiaa hovioikeudessa.,https://img.ilcdn.fi/qMS3-rhe5FCsAbdbw_uqpRU3v-c=/510x318/top/img-s3.ilcdn.fi/67ee4a5e7f2efc2d6e07d1cfd33b98a77b69a1e428fc2b63ad94de3ca9a05331.jpg,57CCF98B18364EF0A7B4C06616C70C3E
2019-10-29T09:30:22.000Z,USA:n mystinen vakoilusukkula laskeutui 780 päivän jälkeen - testasiko avaruusaseita?,Miehittämättömän lennon tehtävät ovat huippusalaisia.,https://img.ilcdn.fi/18VMeoxlPHZuTUrZS4c7vF8AE2Q=/510x318/top/img-s3.ilcdn.fi/ec001e20bcd77912c4746b26acc3485e6f42fa5665ca066408db5da5d5fa645f.jpg,8FAD4669ABCE481DA4EB1E06DB009A83
2019-10-29T09:34:19.000Z,Suurin fani löytyy rinnalta - kuningatar Silvian rintakoru varasti huomion romanttisuudellaan,Ruotsin kuningas Kaarle Kustaa ja kuningatar Silvia sekä prinssi Daniel edustivat perjantaina Kuninkaallisen insinööritieteiden akatemian satavuotisjuhlassa.,https://img.ilcdn.fi/d6NkWsguXEsv1otrGqUyGtteSwo=/510x318/top/img-s3.ilcdn.fi/f30d34237dfb16d8c6a8a9fabc6e132ca9b1e1feb068ea208ef5a7fa34632ced.jpg,1B414F2CB8F24370B1328E5D90783E3F
2019-10-29T09:51:29.000Z,Uutta tietoa terroristijahdista:  Alusvaatteet koituivat Isis-johtajan tuhoksi,Isis-johtajan sisäpiiriin kuulunut tiedonantaja salakuljetti Abu Bakr al-Baghdadin käytetyt alusvaatteet ja verinäytteen Yhdysvaltain tiedustelulle.,https://img.ilcdn.fi/e0ABV5pR1Plle4J8UWn3JPzcNLY=/510x318/top/img-s3.ilcdn.fi/3a9ef33258d9951ec966e0c82d3d223d46131784eb55b96dd0938139369242d9.jpg,4E11281DA8114EA1BC53138E49CD8600
2019-10-29T09:53:50.000Z,Lohduttomat kuvat Salosta: Humalaiselta vaikuttanut kuski kaahasi yli 30 metriä metsään – sinkoutunut ruumis löytyi puun alta,Poliisi sai Muurlassa liikkuneesta henkilöautosta ilmoituksen maanantai-iltana vähän ennen kello kahdeksaa.,https://img.ilcdn.fi/iz2vbxs13j-csMxji3y81W6oiRY=/510x318/top/img-s3.ilcdn.fi/42a74d1d6258f3cfb7bcda2b2c9c8c08271f20bca722ebdc5f1ec2d1132a5973.jpg,EF6968ADCEE9459C8F6B0B7D549A47E5
2019-10-29T10:00:12.000Z,Huvittava koulukuva 30 vuoden takaa – urheilijajättiläinen pesi muut koollaan jo teininä,Shaquille O’Neal dominoi korin alla lukiopeleissä.,https://img.ilcdn.fi/M7olXtu9P21qidnkyX3boW-2U0o=/510x318/top/img-s3.ilcdn.fi/0759785711f52c55463d5af76e6f300156fe8f5abd8ab0ebb78eab346e770093.jpg,BCBDD0AADA4E4455B8ABADDC938736B7
2019-10-29T10:22:06.000Z,Suomen ennätysnainen vakavassa onnettomuudessa: auto törmäsi suojatiellä keskellä päivää,Tiia Kuikka joutui auto-onnettomuuteen keskellä päivää Savonlinnassa.,https://img.ilcdn.fi/RxTiY0kffuwXWV1fnHxoDu9IpTM=/510x318/top/img-s3.ilcdn.fi/2e2711024cd7b404a50d214968a87c07caa2dd305b0a12115be237e824e38102.jpg,11E7CE4BB3374418B305E25551C7BA43
2019-10-29T10:23:58.000Z,Vessakäynniltä kuulostava lorina yllätti katsojat kesken Ylen aamu-tv:n – päällikkö: ”normaalin elämän ääntä”,"Ylen aamu-tv:n ulkomaanuutisten osiossa ääni ei tullutkaan Hongkongista, vaan vessasta.",https://img.ilcdn.fi/Sea1m_uqNl9YW8oetlM8HCE1POw=/510x318/top/img-s3.ilcdn.fi/cecc562f3bc50e3846439a668f40ee41bd9af1815c0ff2342ea7797dfb421da9.jpg,86C859D1C4EE4D02A5107AB105839ED0
2019-10-29T10:25:07.000Z,"Läheisen liikenneonnettomuus pysäytti Heidi Pakarisen: ”Kun tällainen tulee lähelle, ajattelee kiitollisuuden aiheita aivan eri tavoin” ","Laulaja Heidi Pakarinen on elänyt ristiriitaista syksyä. Koti- ja työrintamalla asiat ovat hyvin, mutta surua on tuonut perhepiiriin vahvasti heijastunut onnettomuus.",https://img.ilcdn.fi/9LKCKiOolp7ww7cNDhbTTKq1niE=/510x318/top/img-s3.ilcdn.fi/2d929d20c051ade492daa4e4a2d3c70caa67d2500e7a8cb98edbcd40b5feae2f.jpeg,3CF9BEC7A73C4EE2A22923419127B642
2019-10-29T10:47:57.000Z,"Hollannin lahkoperheen mysteeri syvenee: Maatilan lukitut lapset dna-testeihin, isä epäselvä",Lapset elivät lukitussa tilassa 9 vuotta.,https://img.ilcdn.fi/pmFluTXLuEWXEhjaY5HZG-8QtJg=/510x318/top/img-s3.ilcdn.fi/569ec4ae21df456afa72fee65c05159c42a582ffce7db3eb71e721abc26437b4.jpg,82F802E2125C42D680A22990A8978EED
2019-10-29T10:55:56.000Z,Myyjän ammattitaito voi ratkaista autokaupan – ”Ajatteli muutakin kuin pelkkää myyntitilannetta”,Pirjo ja Markku arvostavat luotettavuutta ja varmuutta niin autossa kuin autokauppiaassakin.,https://img.ilcdn.fi/hvRWXgRua4xOiT6mRaLpi3bhej4=/510x318/top/img-s3.ilcdn.fi/13be31263f6a5b9e0cfa41c15385e02e86583aad98162ab922b4bed0c9795f5f.jpg,A07A85BD964B4A0AB273A021DA6A17D9
2019-10-29T10:58:00.000Z,"Nanna Karalahti lopetti rankan fitness-elämän: ”En halua enää miettiä, ovatko pakarani tarpeeksi pyöreät”",Hyvinvointivalmentaja ja some-vaikuttaja Nanna Karalahti ei halua enää treenata ulkonäkö edellä. Tiukan treeniohjelman ja kisadieetin jälkeen hän voi paremmin kuin koskaan.,https://img.ilcdn.fi/N2zpBTs1IThzSkfkCh7u3TPl4Ww=/510x318/top/img-s3.ilcdn.fi/c408c3ee7277a3d80c77a475d3156d2215841cc8b6cee5d386960aead95e1e5e.jpg,365C8C9BE5D24ABEBC269734930FEA60
2019-10-29T11:04:03.000Z,Yksi video näyttää karun totuuden Triplan ja Redin asiakasmääristä ruuhka-aikaan,Iltalehti vieraili Triplassa ja Redissä ruuhka-aikaan. Tuloksen näet videolla.,https://img.ilcdn.fi/vEmz7vxUnghjJVhpuPiMrIt6etA=/510x318/top/img-s3.ilcdn.fi/951b7c836a5121af37e0f9f175bb18f615d729ca6ab4f5c0b41ac8b9be312370.jpg,897AF5711B0B4990BCD380A77AAAC946
2019-10-29T11:07:18.000Z,"Mikael Granlund pukeutui Kris Jenneriksi peruukin ja minihameen avulla - vaimo mukana leikissä, katso kuva",Halloween-naamiaisissa Emmi ja Mikael Granlund muuntautuivat televisiosta tutuiksi miljonääreiksi.,https://img.ilcdn.fi/HU2Y_3zdqWOvosyWyBwWMkekrG0=/510x318/top/img-s3.ilcdn.fi/c913ead6a7571b7e80da965867e6acc3914fd195d5b76c5e75590b8eaea08caf.jpeg,84575DAAAF11453D98521C45A16AB729
2019-10-29T11:10:34.000Z,Uudet vaalit varmistuivat Britanniassa - työväenpuoluekin tukee vaaleja,Vielä kiistellään vaalien päivämäärästä.,https://img.ilcdn.fi/MQi98V3xDMf1tLcxJIxOjp6rld0=/510x318/top/img-s3.ilcdn.fi/1a2871b11f53a7f3f2a6308e558932d9e68063825ff8c3bad87484b761ea30ee.jpg,BB6DF2147F5B4533B6AD0B486D3BFB1F
2019-10-29T11:11:24.000Z,"Kärkiteemana yhä makoisa muoto: Et arvaakaan, mitä yllätyksiä löysin Renaultin uudesta suosikkimallista!",Täysin uudistuneen ranskalaissuosikki Renault Capturin ohjaamosta löytyi koeajossa kaksi yllätystä: piirongin laatikko ja leijuva konsoli. Kuin bonuksena autossa on vielä tuulitunneli keulassa.,https://img.ilcdn.fi/NToVL3oIcpAGvzcwDjdub9xyApk=/510x318/top/img-s3.ilcdn.fi/0b264944287bb6a2171e81cb072b3b6aeaad2c10c4b3e31ae95f0a10ff92ae49.jpg,D9EE008150284E13A0C83825DF390783
2019-10-29T11:33:37.000Z,Zlatan Ibrahimovicilta salaperäinen ilmoitus tulevaisuudestaan – rahakas höynäytys vai tieto urasta?,Zlatan Ibrahimovic julkaisi salaperäisen videon.,https://img.ilcdn.fi/mtU9wG7lkLl15TakD944tnMqFGs=/510x318/top/img-s3.ilcdn.fi/0f2f0376df43f211840a7db73c171b6e8d6635d0b55f6daa99bf06cafcb63f70.jpg,D916CE5BE2BE4331B6888A68DD9CF057
2019-10-29T11:46:19.000Z,Miss Helsinki äimistelee blogissaan hamstraushulluutta: ”Ihmiset jyräävät toisensa kirjaimellisesti kuoliaaksi”,"Nina Kallio kirjoittaa blogitekstissään siitä, miten esimerkiksi ilmaisia virvoitusjuomatölkkejä ahdetaan reput täyteen.",https://img.ilcdn.fi/Ybg3cTfH-wYhSkjjvsRl4EvvDgg=/510x318/top/img-s3.ilcdn.fi/60eeb479584119a2f1689f6f55bba8ee56b45d99c4fd189a68dc41d1247712c5.jpg,0C140EDA5737446C914A11BEB796BBB5
2019-10-29T11:51:54.000Z,"Tyttöystävä yllytti itsemurhaan satoja kertoja - toukokuussa Alexander, 22, hyppäsi katolta USA:ssa",Tyttöystävää syytetään Alexander Urtulan kuolemantuottamuksesta.,https://img.ilcdn.fi/jIu05u7iomhGCV-tmDtgiN0Vdt0=/510x318/top/img-s3.ilcdn.fi/d1b1d8935a9e578eeb7c785fc22a3401e86953c604a56ca6500f4cc98fbb649d.jpg,B72BBD991E684E1FA4F07BC04F1C1665
2019-10-29T11:54:48.000Z,Gimbaali auttaa kuvaamaan parempia kännykkävideoita – testasimme edullisen mallin: ”Todella positiivinen yllätys”,Omia kännykkävideoita voi parantaa heittämällä kuvauskahvan avulla.,https://img.ilcdn.fi/-oBS0lKHgI4-yWOUQLJOBz9Yowc=/510x318/top/img-s3.ilcdn.fi/87dfc45da9ae456f95a460f2f066443c5754070185daefc590f1ee5148f2d7fb.jpg,5B0BC6D95F194B3FBE78F55D56E85A44
2019-10-29T11:57:02.000Z,Oletko nähnyt heitä? Poliisi etsii törkeästä katuryöstöstä epäiltyjä miehiä Tampereella,"Sisä-Suomen poliisi etsii kolmea miestä, joiden epäillään hyökänneen kadulla uhrin kimppuun.",https://img.ilcdn.fi/oBETIKQVAQEbHpTxVGrTvprRJj8=/510x318/top/img-s3.ilcdn.fi/f0460056e588068703ad254af829e9b961c2bf62c7e06bbb67dcdbd2236d7abd.jpg,F6080D9591414AE5B155ED7E4951C192
2019-10-29T12:00:50.000Z,Tivi: Näin puhelinvalmistajien markkinaosuudet jakautuvat Suomessa – ”suomalaisten suosikki” luultua pienempi,Tivi on selvittänyt puhelinvalmistajien markkinaosuuksia Suomessa.,https://img.ilcdn.fi/Rz1PfhvBrkTVa_uTkNKiWYIKHyc=/510x318/top/img-s3.ilcdn.fi/c6311b361e5e9b9b6993199e83c3ec0f6507fb05486e94004155cec550e0cf08.jpg,640567C1C71549D6B52E2FF2FE0B5883
2019-10-29T12:06:30.000Z,SaiPan maalitykki sai ilkeästä tempustaan pelikiellon,John Persson huilaa seuraavat kaksi ottelua.,https://img.ilcdn.fi/-jlQ7AnXxFONRNTAM0PxXgbOays=/510x318/top/img-s3.ilcdn.fi/ec7ddcbf234f8f1a2e6c4250e1f3474e1b17af2eb4dcc865c978b63e94227dcb.jpg,E66CE7151E9040CA9925DF1BF7757D04
2019-10-29T12:07:20.000Z,Teemu Selänne olisi halunnut kuitata jättisakkonsa istumalla vankilassa: ”Se on kuin päiväkoti”,Teemu Selänne kertoi TSN:n studiossa sakkoennätyksestään.,https://img.ilcdn.fi/eCCB5vyISdiDjuu7xqUR0b_dzIo=/510x318/top/img-s3.ilcdn.fi/746e9d123a5d8433d0928dd92665794d6d039248980d5f5234113d25442bc389.jpg,02968BB2A2B147B094AB4DF857E0070D
2019-10-29T12:12:45.000Z,Lapset kertoivat nöyryytyksestä sijaiskodissa – kunta joutuu maksamaan tuhansien korvaukset,Lapset saavat kunnalta 4 000 euron korvaukset.,https://img.ilcdn.fi/ax02zHCAhkr7P5mzcH4nnuaQE1M=/510x318/top/img-s3.ilcdn.fi/ac4be6d2f151e9604d9ed2af2f38c166d42df737f36198307a30e81cb5fce752.jpg,5DB6E14B7E7B466891CAEF54520EE17A
2019-10-29T12:39:53.000Z,Prinssi Harry ja herttuatar Meghan etsivät kakkoskotia Yhdysvalloista – asuntonäytöille ensi kuussa,Herttuapari suuntaa kiitospäiväksi Kaliforniaan. Kalkkunan syönnin ohessa katsastetaan paikallista asuntotarjontaa.,https://img.ilcdn.fi/592Wo-Nl9YJ4Mmf0jpML-46KzgE=/510x318/top/img-s3.ilcdn.fi/eedfe746c6ff2c84a48582b27101041df078a637fdb36c60998e2919dc24b081.jpg,6C1BA0C3AE5B41E89781E92361A3B751
2019-10-29T12:56:39.000Z,Ville Rannan pilapiirros: Lentovero: Missä kaikki allekirjoittajat?,Ville Rannan pilapiirros 29.10.2019. ,https://img.ilcdn.fi/32JWiNYx9XhWpVmI9Pn9JlSZiWs=/510x318/top/img-s3.ilcdn.fi/a0380cae258516bf7bc6f52a425f051674413cd209c110f6aee7829953ebf2d2.jpg,DC3F4FC950AC41D5B0A4284C72396F44
2019-10-29T13:01:09.000Z,"Mikä kissanainen! Mona, 27, on Suomen halloween-kuningatar – katso huikeat asukuvat",Mona Kuoppamaa on tehnyt halloween-bileidensä asuista suoranaista taidetta. Näillä vinkeillä myös sinusta tulee naamiaisjuhlien näyttävin ilmestys! ,https://img.ilcdn.fi/q01OlJsrxr0SROwdF8-SXISh3Q0=/0x158:1080x833/510x318/top/img-s3.ilcdn.fi/1206d2d5e6318b55f657bc5f3c18f2859afef1cdd9a1b790deea6d8320039015.jpg,3BEE8405755342999C0C1E81A9541937
2019-10-29T13:17:13.000Z,Kiekkolegenda Raimo Helminen tietää uransa varrelta homoseksuaaleja pelaajia: ”Eihän siitä ole ennen vanhaan puhuttu”,Kiekkolegenda Raimo Helmisen mukaan kaikki ovat tervetulleita jääkiekkoilun pariin.,https://img.ilcdn.fi/T1SBCAJZC27CeYwjqeZ-OwLJoV8=/510x318/top/img-s3.ilcdn.fi/db8abaabf91c0d6a88bef5a02bcb29cb2bb5cb66625157c660a30c33290729e1.jpg,59792B455EC24F4DA7173167C1E2BBFE
2019-10-29T13:20:15.000Z,Saksa syyttää kahta syyrialaista rikoksista ihmisyyttä vastaan - ensimmäinen Syyrian  hallinnon tukemaa kidutusta selvittävä oikeudenkäynti alkamassa,Saksa on nostanut syytteet kahta Syyrian salaisen palvelun entistä työntekijää vastaan.,https://img.ilcdn.fi/1LE9zKtpH5NcCmNO2KyLVGkUMGo=/510x318/top/img-s3.ilcdn.fi/ae771dba2731d00ea8388f02d85e3314075013e0bc288e197b9ad668b6c16ed5.jpg,BC670E5B4C7A4908B8D6E3D7D6DDC383
2019-10-29T13:54:56.000Z,Trump: Isis-johtaja Baghdadin seuraaja on myös tapettu,Trump kertoi asiasta Twitterissä. ,https://img.ilcdn.fi/_I87d59AwOaYhxgK5OtuCrd-YJ0=/510x318/top/img-s3.ilcdn.fi/d85c8bf9aa65280e4904f431f0b373cb8dd01103c4a4b67abb3e10f70b9957ef.jpg,01843BA9C1E9492E9F28FA55AFA04EB7
