paivamaara,otsikko,tiivistelma,kuva,id
2021-04-03T12:22:53.000Z,Tehohoidossa oli viime kuussa enemmän koronapotilaita kuin koskaan aiemmin,Karkeasti arvioiden joka kuudes tehohoitopotilas kuolee koronaviruksen aiheuttamaan tautiin. Yli 70-vuotiaista tehohoitopotilaista siihen kuolee joka kolmas.,https://img.ilcdn.fi/sPExjln8RXAzurTVU3dS-1HLQx4=/510x318/top/img-s3.ilcdn.fi/9da54857f67d2c925a1ec98096419b9ff3e47b1a0cbba5b85e9cc750ce97b877.jpg,A761C718A31848F79D5F251A12EED916
2021-04-03T12:29:26.000Z,Tiian suloinen pupukakku onnistuu aloittelijaltakin – katso yksityiskohtaiset ohjeet,Pupukakku on täydellinen esimerkiksi lasten syntymäpäiväjuhlille.,https://img.ilcdn.fi/RHy1_HU4Ef-lugOaPOsoOeN34eM=/510x318/top/img-s3.ilcdn.fi/5b739846a272d0966dbd7e5e75441a8a676d0bd633cda547d3050134afd5520b.jpg,A23027EEF3E14285915B7E1DF35DF933
2021-04-03T12:50:40.000Z,"Karmeasti pudonnut mäkihyppääjä siirrettiin Norjaan – ""Tämä on sensaatiomaista""",Daniel-Andre Tande siirrettiin kotimaahansa ambulanssilennolla.,https://img.ilcdn.fi/kBHRgks4yUFmWa9k1C5qie5aaCE=/510x318/top/img-s3.ilcdn.fi/2ea5d0978aa0350d476e22fca1fcafdc59a634bf9530430e1801897544537ba5.jpg,6FB7650B350E4EEA86734017E5A7E9AF
2021-04-03T12:55:48.000Z,Aki ja Rita Mannisen suuri helpotus: pitkään myynnissä ollut Porin talo myyty – ”Sattuma johti toiseen”,Manniset iloitsevat talokaupoista.,https://img.ilcdn.fi/fBxnhODlrd9JKXVvIjjnvcdA_Zw=/510x318/top/img-s3.ilcdn.fi/3366d0a91bf07898eee96d2c87967d739ee9649474cd32b680d2205d8a643653.jpg,80EE54E14002407C8EA213D221A68BF0
2021-04-03T13:01:25.000Z,422 laivan jono: Suezin ruuhkasuma saadaan purettua tänään,Viimeisetkin jonossa olevat alukset pääsevät tänään Suezin kanavaan.,https://img.ilcdn.fi/YGLJ_FsuvKbGv52ukkoxq8oNJso=/510x318/top/img-s3.ilcdn.fi/e4b8747fc5d041fc38de2b7ac29c5ea63cdac866f69974f8991c6314089b822a.jpg,F51AA269D40942939661F6A0E5CB7897
2021-04-03T13:07:17.000Z,IL Ylläksellä: Limusiinilla Leviltä 30 kilometriä kaljalle naapurikylään – ”Pitää elää jonkin verran”,"Kun Levin baarit ovat kiinni, monet suuntaavat Ylläksen juottoloihin taksilla. Tai limusiinilla.",https://img.ilcdn.fi/jJELV63IemM5G_1yI_X-MphTIFM=/510x318/top/img-s3.ilcdn.fi/9cd4bea8916c7808695af1fdac5b79dd9528daf262078a549df38f4251b5070e.jpg,817C4C56EAA64A8FA59D2CDAB2B6A814
2021-04-03T13:43:18.000Z,"MTV: Leijonien kaksinkertainen MM-mitalisti lopettaa uransa – ”Kymmenen leikkausta""",Ville Koistinen laittaa luistimet naulaan.,https://img.ilcdn.fi/6Oj_pgGVmFjuW5-RHadnH5r6wC0=/510x318/top/img-s3.ilcdn.fi/0ceec705476720eb35a2b7667fec3a34e36baa5eff04eccaa2fb59b4316606dc.jpg,F03BA0BAF2A345DBBF28BCB1D489B593
2021-04-03T13:49:56.000Z,Onko tässä maailman laiskin hevonen? Irkkuhevon mielestä pepullaan istuminen voittaa työnteon,Työnteko ei kuulu Monty-hevosen mielestä päivän ohjelmaan.,https://img.ilcdn.fi/EUJFlusZxL3IWEAtlgYlcd_QkUM=/510x318/top/img-s3.ilcdn.fi/ecef3565d379c7a4eac3704c42ae2cd81a142c024eb01b29fdfe846ab7de7056.jpg,AB751C5C71C54C3D8A807236A61D44ED
2021-04-03T13:58:10.000Z,Madeira päästää myös rokottamattomat turistit maahan,Maahanpääsyn ehtona on hiljattain sairastettu koronavirus.,https://img.ilcdn.fi/zw9yq2FovNsJIW74FgMBNKFQxQI=/510x318/top/img-s3.ilcdn.fi/ef3e85d08368cb41cfee2e4dfade2d5a0e74241e9e66cad25bbe9448a81b65a1.jpg,50360393342148CDA1B1836823051166
2021-04-03T13:59:27.000Z,Kuka on syyllinen Ever Givenin tapaukseen? Alus voi jäädä uudelleen jumiin monimutkaisen lakisopan vuoksi,Ever Givenin tapauksen osallisilla voi olla edessään pitkä oikeusprosessi.,https://img.ilcdn.fi/Obj9ssYgKS1pYpnplD64FMSpdqk=/510x318/top/img-s3.ilcdn.fi/ee764c34019eac2fc62fef0d0772963631f3714eba0b108493e637f493c6cfeb.jpg,761CE0184C1647E6AD96318F340DA598
2021-04-03T14:06:54.000Z,Huutokauppa Erling Haalandista käynnistyi – isä ja kohuagentti kiertävät jo seurapomojen puheilla: ”Koko maailma oli väärässä”,Isä Alf-Inge Håland ja agentti Mino Raiola käynnistivät tarjouskilpailun Erling Haalandista.,https://img.ilcdn.fi/E1oka-1bon_t7QiN_Pm7roW3HrA=/510x318/top/img-s3.ilcdn.fi/179eb2bd534a215a7248814e6cafbfbd5026fcd4223e0b11e1d23361ad71a94b.jpg,A72710D20E364437BEA3F4E1E7248564
2021-04-03T14:19:18.000Z,Love Island -tähti ja somevaikuttaja Meri Turunen sai musertavia uutisia: Sairastui parantumattomaan MS-tautiin,Love Island -ohjelmasta tuttu Meri Turunen kertoo sairastuneensa MS-tautiin.,https://img.ilcdn.fi/1KrbM6a0U9NcTg2y1AakEII8wFk=/510x318/top/img-s3.ilcdn.fi/808b90bbb89331de81baded31d9d6dea1dae78355a347f8582db8d75e141762d.jpg,ADE5965536A84742AF21BB8049F8CEAD
2021-04-03T14:36:05.000Z,Mestarisuosikkien pääsiäiskamppailu: TPS johtaa sarjakärki Lukkoa vastaan Turussa,Illan kärkikamppailussa sarjajohtaja Lukko yrittää hakea tärkeitä pisteitä Turusta.,https://img.ilcdn.fi/vt8lFFbZSePKueYWkJTtRCgOUqE=/510x318/top/img-s3.ilcdn.fi/101f8c6e6d1f18986b5e4ee8012ac258006e928664074c60e0192036692c0d63.jpg,9367E481F9CA4601A32B9EEDA37F7DC5
2021-04-03T15:02:22.000Z,Johannes Kläbo ei muistanut avautumistaan – videon julkaiseminen otti koville: ”Rumaa”,Johannes Kläbo vaatii FIS:ltä muutosta ja nykyistä selvempiä sääntöjä.,https://img.ilcdn.fi/7q4ckGvK_7LySVTlldHloqamAWk=/510x318/top/img-s3.ilcdn.fi/71860803dd7d007af497dff1f6a1fdb2155289da7b7b2b526c6cdb97c641069e.jpg,FE11F47772AA4E9F812F6D77722C3E2A
2021-04-03T15:15:06.000Z,IL Turun surmapaikalla: Naapuri ei kiinnittänyt huomiota meteliin – vasta ystävän puhelu paljasti yön kammottavat tapahtumat,Poliisi tutkii kahta epäiltyä murhaa ja kolmea epäiltyä murhan yritystä.,https://img.ilcdn.fi/F40viMxRkgaTYElXUrjlNGO6h54=/510x318/top/img-s3.ilcdn.fi/02ffe30ce56e48b3f62d94643543151609f2b66777963c6e4ad9b5d49503786b.jpg,FC1B7FAAED7A40F7BC412BA84DD95136
2021-04-03T15:18:40.000Z,Aleksander Barkovista hyviä uutisia,Aleksander Barkov hyppää jälleen kaukaloon.,https://img.ilcdn.fi/P-4RJHimScJ40_XIBTomOyp9BTs=/510x318/top/img-s3.ilcdn.fi/f61a62557c1b373b24f8b7e3a43918701be25118ed80d360e8630de09d183dcb.jpg,9373594AFEF946528816CB8BC0547335
2021-04-03T15:30:51.000Z,Ruotsin Masked Singerissä nähtiin koominen paljastus – tytär ei tunnistanut kansan rakastamaa äitiään,"SISÄLTÄÄ JUONIPALJASTUKSIA Ruotsin Masked Singerissä nähtiin lauantaina hämmentävä hetki, kun panelisti Pernilla Wahlgren ei arvannut, kuka on maskin takana. ",https://img.ilcdn.fi/O6f4RrfrxUGpEhssKPNKezWYhgQ=/510x318/top/img-s3.ilcdn.fi/a8d8c0ef3c3cbd9499c3d8b72172074e293373cb0fd5c7eafb8afefdd4c7e8e4.jpg,1B1BAFBE17DD48EE924BA78CB33A4BE4
2021-04-03T15:33:10.000Z,Mikkeliin rakennettiin moderni jätevedenpuhdistamo – hintalappu paisui 30 miljoonaa euroa,Kaupunki odottaa puhdistamon ympärille syntyvän kansainvälistä tutkimusta ja yritystoimintaa.,https://img.ilcdn.fi/jBa2oM6FGdwPxEZf9h2s2lqe1Jw=/510x318/top/img-s3.ilcdn.fi/1636ae2fd063173ca524b59d15b97d0e1be7c4ad378c0b9642d9d1181d3a1fbd.jpg,172233929F5E415B8C53B4E0B1AB69F2
2021-04-03T15:39:38.000Z,Päätähuimaavaa menoa! Ranskalainen pariskunta kiipeili kuumailmapalloa pitkin 300 metrin korkeudessa,Eeppinen kiipeilytemppu saa jalat tutisemaan,https://img.ilcdn.fi/JUPhs18ERb9KUk6vMQeVaO0fOT8=/510x318/top/img-s3.ilcdn.fi/af28353fdb6ea90408123021937b4e72c270c9da73ba4b5d1bec53f924c69382.jpg,749C4BAF8C6D40389F00D8310C6EF95B
2021-04-03T16:00:00.000Z,Iltalehden villapaita sopii jokaiselle – nappaa tämä ohje talteen ,"Novita suunnitteli Iltalehden lukijoille ajattoman villapaidan, joka on helppo ja joutuisa neuloa. ",https://img.ilcdn.fi/o4nqfjdGwGelb6XOOKbn0AjNrjA=/510x318/top/img-s3.ilcdn.fi/421d6e154665004b8277a4e1df1ced2a4fe372d417cd39dd5ab6b76fbc226b91.jpg,8FDEA276927A4D6586866C42A308E180
2021-04-03T16:03:26.000Z,Moottorikelkkailija kuoli törmättyään puuhun Kolarissa ,Poliisi tutkii lauantai-iltapäivällä tapahtunutta onnettomuutta.,https://img.ilcdn.fi/DZRLT9nIH0rNYMQs7r75TM61evE=/510x318/top/img-s3.ilcdn.fi/fab9ecf47b3b8cab6859a09b96a5e75e0f6febcfd110c81259f95aa291d724c4.jpeg,9F2DF78CF5C64AD4BBD1FF984543875A
2021-04-03T16:05:23.000Z,Tuomari loukkaantui SM-liigassa – kiekko suoraan suuhun,Ottelu jatkuu Hämeenlinnassa yhden päätuomarin johdolla.,https://img.ilcdn.fi/xiIvKNNhsWJO1DTBA3GJCm4p23M=/510x318/top/img-s3.ilcdn.fi/6a97086e381498e72b4d077f84e5cbc94f292fdedd172caabfa168c0bc6ac5d6.jpg,4BBC77A9C5AD42BB9366BDF93A7895FD
2021-04-03T16:23:45.000Z,Voiko lapsi olla psykopaatti? ,"Vaikka epäsosiaalisen persoonallisuushäiriön diagnoosia ei voida antaa alaikäiselle, piirteet ovat nähtävissä jo pienillä lapsilla.",https://img.ilcdn.fi/YaU0kz8RmbKovIY1kytpwbBJMuA=/510x318/top/img-s3.ilcdn.fi/d3e388c18a1884afdf8dd3d1fafe9a91c788334973d7ce2c51d85e7e3b6e9ab7.png,61C9C0BADDC94151ADB36C5B625744D5
2021-04-03T16:28:53.000Z,Lukas Hradecky palasi tolppien väliin – Leverkusen nappasi tärkeän voiton,Bayer Leverkusen syvensi Schalken putoamiskurimusta 2–1-kotivoitolla. ,https://img.ilcdn.fi/2HDeY0EZxc0_Y1P0MvnDaxx21PI=/510x318/top/img-s3.ilcdn.fi/f4f053624f37868c3c0b58a747ac7e557a6ab121410c694f9ac0c0e4a997fe7c.jpg,0DE671FC718A46E2A514EFFA7D8EE6EE
2021-04-03T16:49:42.000Z,Räppäri DMX otti yliannostuksen ja sai sydänkohtauksen – tila on erittäin vakava ,DMX on sairaalahoidossa.,https://img.ilcdn.fi/_IgxVEzCp6fYat_SUbj_A9zYa7c=/510x318/top/img-s3.ilcdn.fi/8330b60f7fb3321d6ab8fac1486f489fc05045c6a579972faba36038af3ee7f7.jpg,BEA211216748459CA6F4BCA0EEB00675
2021-04-03T17:00:00.000Z,Valehteletko ostoksistasi kumppanillesi? Et ole ainoa – niin tekee joka toinen suomalainen,"Suomalaiset eivät ole rahankäytöstään yhtä avoimia kuin ruotsalaiset ja norjalaiset, tutkimus kertoo.",https://img.ilcdn.fi/b96rYa1fHVSWLKaCu7Q5B0c8-eY=/510x318/top/img-s3.ilcdn.fi/12c3c92121cba8987daad73402b5e14b2ec37a2f5c0d4426ce7a96f86822dd24.jpg,6B57D25028004235A22CE67D2F059E58
2021-04-03T17:04:25.000Z,HJK tylytti HIFK:ta paikallisväännössä – konkari sai punaisen kortin ,Miesten jalkapallon Suomen cupin välieräparit ovat nyt selvillä.,https://img.ilcdn.fi/RibvrDNSlfdfAdk1zlTuYvS4XwE=/510x318/top/img-s3.ilcdn.fi/202dd35bfe1e0f68258a97b2377088a5c0e660e65317ed8bdb4e663a59f14f17.jpg,82D873CC53BB437C8C76DE01196E88C1
2021-04-03T17:05:52.000Z,"Uusia tartuntoja runsaat 400, ravintoloiden ovia säpissä myös harvojen tartuntojen kunnissa – tämä on Suomen koronatilanne nyt",Lue alta lauantain koronauutiset tiivistetysti.,https://img.ilcdn.fi/axUjjVgLIfSrbjguAXKfRCrjPq0=/510x318/top/img-s3.ilcdn.fi/3ede45af73e97e21e3fc45b0751381afa2373306c2a21c050ca65b2d2fc5bd43.jpg,C0A9332FD4564C59B90CB2D58BD8DFC9
2021-04-03T17:27:26.000Z,Selviytyjät Suomi: Kisa luisuu nimittelyn puolelle – Kristian Heiskari ja Archie Cruz ottavat yhteen,Vaanit ja Aasat yhdistyvät pian. Juttu sisältää juonipaljastuksia. ,https://img.ilcdn.fi/ihfASOZsoTCZ7Ie_iGdPePEN8sY=/510x318/top/img-s3.ilcdn.fi/3ca1e810d9b30cd73799ac3503640f8232e1134b6b8308a92ca344b364f090da.jpg,46D9921BB4CF4BA0BF99085237965964
2021-04-03T17:39:54.000Z,Turun surmissa käytetty ampuma- ja teräasetta – tämä kaikki tapauksesta tiedetään,"Poliisi tutkii tapausta kahtena epäiltynä murhana ja kolmena epäiltynä murhan yrityksenä. Lisäksi esille on noussut myös muita nimikkeitä, joita poliisin mukaan on syytä epäillä.",https://img.ilcdn.fi/7Rzcj4M85zu-xQRTJx1HrEGZRzE=/510x318/top/img-s3.ilcdn.fi/fd054a186d81dff44ec67990404ec1d1225fba0df6564a2fe8ccc55b533dd545.jpg,EFF9BFCBBBA344CE8345B272DF368EA0
2021-04-03T17:51:44.000Z,Therese Johaugilta tyrmäys ruotsalaistähtien idealle: ”Entistäkin tylsempää”,"Therese Johaug ei halua uudistuksia, vaikka hyötyisi niistä itse.",https://img.ilcdn.fi/59H4A6T49dLA-OQeUr4dEkloPNQ=/510x318/top/img-s3.ilcdn.fi/146d28d9a9cd0e23e86f9b03f2f3a44ee986f42c3457fada24f5d154ccf317b9.jpg,81668C82AAD64B81AFAA267433E3D669
2021-04-03T18:04:02.000Z,Selviytyjät Suomessa sekoitetaan jälleen pakkaa - yhteiset iltapäiväkahvit päättyvät hurjaan juonitteluun,Selviytyjät Suomi -ohjelmassa nähdään jälleen kerran juonittelua ja ennennäkemättömiä tilanteita.,https://img.ilcdn.fi/zrrl8P-CYFHaxVUtKlQ5BAj_Eh4=/510x318/top/img-s3.ilcdn.fi/a180de576dcba306991fa655a8f8aed05b0e2316e7e8029ddb2886176a25f6a0.jpg,DF19B0A40F6349D9AC6570727DAFC084
2021-04-03T18:04:29.000Z,Maan etsityimpiin rikollisiin kuulunut Toni Tuunainen istui 20 eri vankilassa Ruotsissa – tällainen maine suomalaisilla on telkien takana,Entinen arvokuljetusryöstäjä Toni Tuunainen on ollut yksi Ruotsin etsityimpiä rikollisia. Nykyisin hän auttaa muita pois rikollisesta elämästä.,https://img.ilcdn.fi/a40PKqgOrybFq5kPqQaKrSM1iFU=/510x318/top/img-s3.ilcdn.fi/c7336f9c0f37646934cca45c71b36d7f6408c1ec2df652d1aac6a0950222dd7d.jpg,7870D06C15BF4F1591F085EFD4052481
2021-04-03T18:11:22.000Z,Taaperon ensimmäinen sitruunan maistelu - Hapokas reaktio naurattaa!,Lapsosen elämän kirpeiden hedelmien oppitunti alkoi sitruunalla.,https://img.ilcdn.fi/mF5_6YNaWlx9V_ylCYjzBJz12rs=/510x318/top/img-s3.ilcdn.fi/8802c727a2e825839581ce19131e87c1497356df9cd9c7ada717ba66d39c5c58.jpg,1A2C58C5AE064AFAB44DFF702674CAFD
2021-04-03T18:24:35.000Z,Kuvat: Upea pääsiäisperinne toi loistoa Etelä-Pohjanmaalle – Petri muistelee takavuosien hurjaa naapurinokittelua,Pääsiäiskokot rätisivät ja räiskyivät tunnelmaa pääsiäislauantai-iltaan. Kokon polttaminen on monille tärkeä perinne.,https://img.ilcdn.fi/OEK4NsdNXt-Oy35ROCgU2FTB_ow=/510x318/top/img-s3.ilcdn.fi/072c7274a96cb58f88bc9971fbb7104b1a7b8dd6b1052a5924af73d78f236c4f.jpg,79D3F09820D340EBB7A3A104E001EC13
2021-04-03T18:35:45.000Z,Manchester City ei anna armoa – liigakolmonen jäi jyrän alle,Leicester City ei pystynyt toistamaan syyskierroksen ihmettään.,https://img.ilcdn.fi/KBnPY_UJZPP2Kb39DSdiNZszahM=/510x318/top/img-s3.ilcdn.fi/0c24a8b291c9360ad396554df0fec8cb580250851369c2ea0928255f923d9ceb.jpg,CA422BDB473D4624B086427BBF771F0E
2021-04-03T19:00:38.000Z,Kalastajaveli tuijotteli soutuveneestä siskonsa mökkielämää vuosien ajan – tuomittiin vainoamisesta,Pariskunnan vainoaminen järveltä käsin jatkui usean vuoden ajan.,https://img.ilcdn.fi/OSVEt6fY78eERdHzLJjsqdHvV5M=/510x318/top/img-s3.ilcdn.fi/eddba60937757bf52a906a4dd690ae65c52b68cc878ef140aa9c200a1da9ac19.jpg,9A1502B7B3204147B9404ECCFCA521B8
2021-04-03T19:01:24.000Z,Selviytyjät Suomi -jaksossa täysin odottamaton pudotus amulettipelin takia: ”Kokemus jäi nyt ihan täysin kesken”,Selviytyjät Suomi -ohjelmassa on riittänyt käänteitä. Niin tälläkin kerralla.,https://img.ilcdn.fi/5KRgoOkRDAhTeZK2qlyd_xahwU4=/510x318/top/img-s3.ilcdn.fi/8512b07648217504aacdd54cc3fd942a7c0c19ae91fcc4999ee584955132efc3.jpg,C34FAE48517A420FABBB0282C5A91152
2021-04-03T19:10:16.000Z,Tässä ovat Liigan suursuosikit – länsirannikolta purjehditaan finaaleihin,"Vahvan viime kauden pelannut Lukko oli jo kesällä monien veikkaus sarjan kärkisijoille. Yllättäjä-TPS haastaa, kirjoittaa Timo Kunnari.",https://img.ilcdn.fi/y-UTg4ioQ9dQ6buM8EZgaJn57zg=/510x318/top/img-s3.ilcdn.fi/50d8d3572ba52f927a6ad5973c4e1e7e39afea3922582ce6b5a2013b4123e6ba.jpg,4B68C20745CB41209AF8556D80085115
2021-04-03T19:23:03.000Z,"Lotossa ei taaskaan täysosumaa – pääpotti kasvaa 15,7 miljoonaan euroon",Pääsiäisviikolla potissa oli 14 miljoonaa euroa. ,https://img.ilcdn.fi/AiQdWHoqqyG8KL0OstUl8e47Pbk=/510x318/top/img-s3.ilcdn.fi/c07db259e18bd2252a7bbba54533eb515242cabb34b05fa7fb423f179300dffd.jpeg,8767140E1E314B14A4DD7879AC94D351
2021-04-03T19:28:29.000Z,CSI palaa – mukana sarjan alkuperäisiä näyttelijöitä,Rikospaikkatutkijoista kertova televisiosarja CSI palaa ruutuihin.,https://img.ilcdn.fi/nbyQIEk9e7Uv1twH5pODNA7e6mc=/510x318/top/img-s3.ilcdn.fi/321795d2bd16cdea315d6611f1abab95a494f1d01f95febd0ec4e031205318a5.jpg,A41298F6F5FA4734932B7398A7E08001
2021-04-03T19:40:52.000Z,Eeli Tolvaselta upea maali – Kevin Lankinen ei pystynyt pysäyttämään hirmuvetoa,Eeli Tolvanen on ollut viime aikoina kovassa iskussa.,https://img.ilcdn.fi/AMRt9CrjrYc-MUr-yrfmxPONCG8=/510x318/top/img-s3.ilcdn.fi/40aebd1ea6b6014ca4cfc93134f41b379c33e2d7c3090c297364bc29bfd49936.jpg,D6967920AFE044DEA052D2CAD3744B53
2021-04-03T19:58:17.000Z,Youtube-kaksoset tekivät feikkipankkiryöstön – tapahtumat riistäytyivät käsistä ,Uber-kuski joutui pahaan välikäteen. ,https://img.ilcdn.fi/6arK24Bi-X-y8RBz8v4edU0uqQ8=/510x318/top/img-s3.ilcdn.fi/718757b3bad15553f520eb299fceefe4003046317892cff0b249254094691dbc.jpg,CA912C157EF942F79AD779BB94EDD5B3
2021-04-03T20:02:25.000Z,Tortorella jälleen penkityspuuhissa! Laineen kanssa siirtynyt hyökkääjä koki tylyn kohtalon – kommentti kertoo kaiken,John Tortorella ei kommenteissaan peitellyt suhtautumistaan hyökkääjään.,https://img.ilcdn.fi/JeBX9xMj9I8Ov68zsfBLPMX3oSw=/510x318/top/img-s3.ilcdn.fi/b0788a708d07a93e475c3770d007076cf1f4dcebce35949116729550797acc2c.jpg,55AC858476DD48D7A4011587E104A95F
2021-04-03T20:59:04.000Z,Liverpool väänsi tärkeän vierasvoiton – nouseeko Punaiset vielä neljän sakkiin?,NULL,https://img.ilcdn.fi/JGkZ3kVQewdm4o6TgFslgRYrkgo=/510x318/top/img-s3.ilcdn.fi/f4649db8a11b8178e091c0e53f6ba3f7eb74c39a4682dfea88217208c4f79268.jpg,EA3BD6824DA84EB89CF51AA7F59603D0
2021-04-03T21:41:26.000Z,Cupin finaali sai Baskimaan sekaisin – ”Häpeällistä käytöstä”,Real Sociedad voitti vuoden myöhässä pelatun Espanjan cupin finaalissa paikallisvastustaja Athleticin 1–0.,https://img.ilcdn.fi/A1Fda790mIhwWJGB8xqY51daaRA=/510x318/top/img-s3.ilcdn.fi/c8ecf1ea3e331247843447e1778c9088611112a5714f66ec9663e48b700e5010.jpg,9AC24AE6C7E8450C82F8A3703F166593
2021-04-04T00:07:03.000Z,Jordanian entinen kruununprinssi määrätty kotiarestiin – kritisoi aiemmin velipuolensa hallintoa korruptiosta,Kuningasperheen lähipiiriin kuuluvia henkilöitä on pidätetty epäiltyinä salaliitosta hallintoa vastaan.,https://img.ilcdn.fi/fSvJM4JX8YiWBFkGILHqoEc7FbA=/510x318/top/img-s3.ilcdn.fi/433d60147bc155c80420cff4a52c97ac7572f66a8c9566d57e292d23d88d8da5.jpg,23E65F3F78CC4107BEEAF02BF8722EAD
2021-04-04T00:59:28.000Z,"Pääsiäissäässä tapahtuu täyskäännös: sunnuntaina aurinkoista ja lämmintä, maanantaina sateista ja koleaa","Sunnuntai on pääsiäisen lämpimin päivä, mutta maanantaina sää muuttuu täysin.",https://img.ilcdn.fi/EJQeuwnTkBEwFl1b4Ryjlbu4KzM=/510x318/top/img-s3.ilcdn.fi/f6a771c99245b56e7c47a9b01d7139a863ed323f70bdcd7b4511c7377de3adb6.jpg,BCE9D7542F4C4D449AA7E80BEE0C1495
2021-04-04T01:59:00.000Z,Olga Temosen pitkäaikainen haave: Perustaa pizzerian keskelle maalaisidylliä,Näyttelijä aikoo muuttaa koulurakennuksen ravintolaksi.,https://img.ilcdn.fi/wHS43wfw4-ZT0jH21TVWynbW8Do=/0x1753:4016x4264/510x318/top/img-s3.ilcdn.fi/524eff8c76b5309baaa939f39436b4f59b9a1ee164a59f7b78cbd929958935eb.jpg,C3E83EF79A4A44E7A8166C400EEA6318
2021-04-04T02:26:51.000Z,"Raumalla terveydelle vaarallista savua ilmassa, asukkaita kehotetaan pysymään sisällä",Savu on peräisin omakotitalon tulipalosta.,https://img.ilcdn.fi/-Be4LIldKRuJJeQIndabo3vv1-k=/510x318/top/img-s3.ilcdn.fi/19f79b6442ccce55211017c88eb51c439550bab86e76586127b86558286244bf.jpeg,BC51B07C49274C4F82C84338B41E987B
2021-04-04T03:16:46.000Z,Omien vaatimustensa ristitulessa,"Piritta Hagman kertoo olevansa obsessiivinen fanaatikko – henkilö, jonka kohtuuttomat tavoitteet voivat pahimmallaan johtaa loppuunpalamiseen.",https://img.ilcdn.fi/Mrw4nPR5xMW6BuvlbHvTZyua0uM=/0x124:2828x1892/510x318/top/img-s3.ilcdn.fi/804f99e24228af08ea4885a0a66b770721867c63185f0574204e4790e8a4fe63.jpg,8077BCB46F3045A397776A8E63610AE0
2021-04-04T03:39:54.000Z,Oletko huomannut lasitetun parvekkeesi mahdollisuudet? ”Kasvihuoneita kerroksittain”,"Oletko koskaan ajatellut, että lasitettu parvekkeesi on kuin kasvihuone? Siellä voi kasvattaa niin perunat kuin tomaatitkin.",https://img.ilcdn.fi/KZ4-BZfamo4p0eZdTiEo5M9Kh_I=/510x318/top/img-s3.ilcdn.fi/4ba4508b058d20a109ea52ce2606245b4a5a8ca84bfccaa2f5b604c210e8184f.jpg,5429349207094AD88F00D8FE915B1765
2021-04-04T03:56:58.000Z,"Helsinkiläisessä taloyhtiössä yhtäkkiä paljon koronatapauksia – Isännöintiliitto kertoo, miten minimoida koronan tarttuminen taloyhtiössä ","Taloyhtiön hallitus voi tarvittaessa sulkea yhteisiä tiloja, kuten saunan tai pesutuvan. Kotibileitä Isännöintiliitto pyytää välttämään.",https://img.ilcdn.fi/rpoXGrj71qKhNZUGSeXRLTYPuwM=/0x64:3000x1940/510x318/top/img-s3.ilcdn.fi/b294716d41d9ce1bb487021f065e8d19c6f1f453b1cdb38a3ba832532bb0cd83.jpg,7A160FB4567C436CA6BA11DF52169CEC
2021-04-04T04:00:00.000Z,Mitä maksaa omakotitalo? Katso kalleimmat ja halvimmat keskihinnat!,"Haaveiletko sinäkin omakotitalosta? Etuovi.comin tilastot kertovat, että omakotitalot ovat nyt todella haluttuja. Mutta mitä oma talo maksaa?",https://img.ilcdn.fi/Q06gc8SWxcRoibehyqVUUkOY9yk=/510x318/top/img-s3.ilcdn.fi/cb31e1c96340b28c3e13a7fd47a9bdda0e8a51823a99ccf0565bd6e694bf6f1b.jpg,0F66E140874D4057B0E766ACD167D286
2021-04-04T04:00:00.000Z,Yhä useampi ostaa kesärenkaat verkosta – näin onnistut ja säästät!,Nyt on aika tarkistaa kesärenkaiden kunto ja hankkia uudet. Yhä useampi ostaa renkaat verkosta. Näin vertailet hintoja ja säästät. ,https://img.ilcdn.fi/0D3LU_2wA_jZPCNB_5AAhMKXV_Y=/510x318/top/img-s3.ilcdn.fi/ecaa938b18f3e9a119e2a5ee98f1594bc68ca9c18ad354c3595713dd0f138764.jpg,18DC9CA5FE5A4857B227B54C481208A2
2021-04-04T04:10:28.000Z,F1-legenda heitti villin teorian Sebastian Vettelistä – entinen kuski tyrmää: ”Se on hölynpölyä”,Marc Surer ei usko David Coulthardin esittämään väitteeseen.,https://img.ilcdn.fi/gzpUDflypj851kQcCtxzIXc3XYI=/510x318/top/img-s3.ilcdn.fi/78e93fb45c992675442a1749720031996b4e33e7f43a47867f36356bcf3a6b5a.jpg,72C69AFEC42B4DCABF6A25D878819C2B
2021-04-04T04:23:41.000Z,Jalan menettäneen amerikkalaispojan ystävyys avustajakoiraan saa sydämet sulamaan,Avustajakoira-Dexter opettaa poikaa kävelemään uudelleen.,https://img.ilcdn.fi/BfbV7iwYvQegU_6J9ON40xi2hu4=/510x318/top/img-s3.ilcdn.fi/8d46a34f5ad2a018c52cdbb018b9434ef871af428e535cde0723ddad37f08855.jpg,E27965332E77444D820EDB94A85BD6BD
2021-04-04T04:39:04.000Z,Nämä maailmantähdet ovat kuolleet koronavirustaudin seurauksena,Maailmantähtien joukossa on useita koronavirukseen liittyviä kuolemia.,https://img.ilcdn.fi/VTdMZ8yW9kHSaKB3Fq8-Yeorvc8=/510x318/top/img-s3.ilcdn.fi/ebfabbe298bc24016adfc031c299c81e51a076c8267f5c32a29244200961aff0.jpg,22813C347AD44EAF9F931C9DFCE78F77
2021-04-04T04:48:51.000Z,Ruotsalaishyökkääjä näpäytti Jarmo Kekäläistä – Patrik Laineen piina jatkuu,Aleksander Barkov palasi Columbusta vastaan tehokkaana.,https://img.ilcdn.fi/QEMLt5XwxXXHczGfGUiibzuGwAY=/0x64:3000x1940/510x318/top/img-s3.ilcdn.fi/3eeedd249b9cb55273a11c867f122b293b0357de701c310728c622d3747f524b.jpg,302FD5D010ED432DA13C0A6F623FFFB9
2021-04-04T05:05:17.000Z,Farmi Suomi alkaa tänään – Sanna Ukkola juonii Mikael Jungnerille: ”Sun pitää löytää heikko nainen”,Ellen Jokikunnaksen juontamassa kisassa Pieksämäen seudulla sijaitsevalle maatilalle saapuu joukko julkkiksia.,https://img.ilcdn.fi/CzcI43_0uCLaOMkZTlAgJzpmKd4=/510x318/top/img-s3.ilcdn.fi/bb4dcab696a5a2fe4c5ff5c78c157c51dc575f02a6a75484eccbf9790099ded5.jpg,53FB4A51FC34401485DF9774D3562F0B
2021-04-04T05:18:51.000Z,"Iltalehti Ylläksellä: Nyt puhuvat Lapin matkailusta elävät Anne, Joona ja Marikki","Lapin Ylläksen yrittäjät iloitsevat ravintolapalvelujen avautumisesta, ",https://img.ilcdn.fi/cr-ZNGpDADYeaXsEWzQVYUVtvlo=/510x318/top/img-s3.ilcdn.fi/0761295cd2b20c81c9752139a105cce0643c43c3c6fb79fce547a465b174556b.png,70C7F5F3F70E457CA7313BAC1A23D1DC
2021-04-04T05:27:02.000Z,Bikini fitness -tähti kuoli traagisessa onnettomuudessa – ”Hän eli viimeiset hetkensä täysillä”,Karen Pang on poissa.,https://img.ilcdn.fi/uQZrcbKsynlEl9CvZaYN0lBx3t4=/510x318/top/img-s3.ilcdn.fi/3576640fdf169aaa67a030364bb80817863407e5a54d44179de236132da71fd9.jpg,9EE905624962426D87E8957C1A89E487
2021-04-04T05:42:21.000Z,Kaikkien tuntemasta Oravan pesä -kappaleesta poistettiin aikoinaan kokonainen säkeistö – syynä lapsille liian rajut sanat?,Oravanpesästä kertova kappale on monelle tuttu koulusta.,https://img.ilcdn.fi/e7gINCsEHt1fFuFwLtU2lOoUznY=/510x318/top/img-s3.ilcdn.fi/0e85c66b4fa8c8ccced7e30db0d21366650142e22109fa6f65949f18eeffce4e.jpg,27A338E7346B4F5DA8AFC0805132CA6D
2021-04-04T06:00:28.000Z,"Antaa kaikkien kukkien kukkia – kannabiksen laillistus etenee maailmalla pienin askelin, mutta vauhti kiihtyy","Pohjois-Amerikasta on nopeasti tullut kannabiksen laillisen viihdekäytön kehto. Kannabisteollisuus odottaa kieli pitkänä, mitä Yhdysvaltain lainsäätäjät tekevät. ",https://img.ilcdn.fi/7yuDbSHDo_oEHaw6h2KyR3Re99M=/510x318/top/img-s3.ilcdn.fi/bf47d1d583268dde4502d201c7ac19d59e486b2f361ae9b8912d4a3b7728b6af.jpg,C934EE02CA8A470E89BC76389CF6563D
2021-04-04T06:05:26.000Z,Tappaja meni Tinderiin,"10 vuotta sitten hän surmasi ex-tyttöystävänsä. Vapauduttuaan hän on vainonnut, pahoinpidellyt ja raiskannut naisia. Miten se on mahdollista?",https://img.ilcdn.fi/df8ALh47oII8ZfvfeU3GwEX-nIs=/510x318/top/img-s3.ilcdn.fi/a674cb288f45f9b4da83103765fcadafb6d11f13fd3cfbff0b310a782c7b7418.jpg,68BE5DA59EF04BC88517530F2F6FCD84
2021-04-04T06:20:43.000Z,"Yli 500 miljoonan Facebook-käyttäjän tiedot vuotivat nettiin – mukana 1,4 miljoonaa suomalaista",Tiedot varastettiin vuonna 2019 ja ne on julkaistu netin hakkerifoorumeilla.,https://img.ilcdn.fi/Gtni_ND_KCoh6pXI3tB172wuAn0=/510x318/top/img-s3.ilcdn.fi/523a13eeaf671c229edbf2b013d776033d94254788a5d5576bc8ad42836f5671.jpeg,9833F04272E74E24B47C3E8B67A4AA33
2021-04-04T06:30:15.000Z,Sydän toi takaisin Suomeen,"Kaiken formulavarikoilla nähnyt Erkki Mustakari, 75, ei koronavirusta pelkää.",https://img.ilcdn.fi/0IROPneHAyCslDG941YQTJ7ldfg=/510x318/top/img-s3.ilcdn.fi/77771953cacd073eca819414ddbe8de2d92a397a7a8d2c860e2995955daa204b.jpg,C0A0F9EAA5964A8EA10FDC8B7785D3F6
