paivamaara,otsikko,tiivistelma,kuva,id
2022-07-11T10:39:13.000Z,Merivartiosto julkaisi hurjan kuvan ”pärskyttävistä” trombeista,Merivartioston mukaan trombeja oli parhaimmillaan seitsemän kappaletta. ,https://img.ilcdn.fi/OGdZK0mAqe7g5ecGVsJYeFsY99E=/510x318/top/img-s3.ilcdn.fi/028bd49640a59116b759d1873bf3485a16a3227ea8e85983f152c68f5ebc9694.jpg,7CE30947DE4D49A29648A139B4FA2390
2022-07-11T10:54:27.000Z,Valmentajaksi vaihtaneen Wayne Rooneyn uusi seura on selvillä,Wayne Rooney on valmis aloittamaan valmennustehtävät Washingtonissa.,https://img.ilcdn.fi/3mmsWdBIeJMMIVPk45RiMVKn5ms=/315x56:2891x1652/510x318/top/img-s3.ilcdn.fi/aca0b6b42b360db298f4c2c616f419726adfd6f375bc0f6c3ddbc69a2e47ec54.jpg,9FB2C846C80841D6980BC40F9408B30D
2022-07-11T11:18:21.000Z,"Britakakku ja juustopiiras, jotka onnistuvat varmasti – kokeile poliisi-Mikan ohjeita!","Jos haluat säväyttää, tarjoa kesävieraille poliisin ohjeella leivottua juustopiirasta ja britakakkua!",https://img.ilcdn.fi/iUnoRyutTcIznWceTmfAV9LL1Fw=/510x318/top/img-s3.ilcdn.fi/d939e8bff51d2b809110e982890873dd5da28ea2fd0fa3413d5e5f33a00ec515.jpg,40A1EA4E8ABC43FD84170DEC657B0DF1
2022-07-11T11:20:53.000Z,Jennifer Lopez avautuu uupumuksestaan – kärsi uransa alussa rajuista paniikkikohtauksista,Jennifer Lopez kertoo avoimesti uransa vaikeista hetkistä uupumuksen ja paniikkikohtausten kanssa.,https://img.ilcdn.fi/Ex1LS3Y8y03y0uIaF--lo6I-oiU=/510x318/top/img-s3.ilcdn.fi/697e0547678376102c989799752393f88adff074c963fb1e77aaab8c9a1d9b95.jpg,5C81E8FCB2904902A137B175EE693CB7
2022-07-11T11:32:33.000Z,Nuori henkilö uhkaili Lapuan Pridea verilöylyllä – poliisi otti kiinni,Epäilty nuori on alle 18-vuotias ja kotoisin Etelä-Pohjanmaalta.,https://img.ilcdn.fi/9jInFiz_OxOab489dHSYUKv9JXw=/510x318/top/img-s3.ilcdn.fi/60cab55c801fdd65e5d9b8702a701c2e7d0544b453a6d4d3d6eb4855d98c0261.jpg,AD786D4C8D05498F9894B3955BC8CD98
2022-07-11T11:46:34.000Z,Hailuodossa ammuskeltiin sunnuntaina – poliisi otti kiinni kolme epäiltyä,Poliisi otti kolme henkilöä kiinni epäiltynä ammuskelusta Hailuodossa. ,https://img.ilcdn.fi/zjtB0XdpdLbZK3MoTt4FXLJNIbE=/510x318/top/img-s3.ilcdn.fi/268ddbf9b79b7ce1d8a7e263d0954c3a7bbef31aa9abf59bd74789a901e97920.jpg,DA5E82AB8A3442FB8741E9B2CC1B64EF
2022-07-11T11:55:12.000Z,Ramses II vuodatti kyyneleitä keskeytyneen Ruisrock-keikkansa vuoksi: ”Olin ladannut niin paljon tähän” ,Ramses II eli Rami Shikebenin kaikkien aikojen ensimmäinen festariesiintyminen päättyi keskeytykseen. Se veti artistin mielen matalaksi. ,https://img.ilcdn.fi/o_Nrku3nYwkX_lA7lUUf9d-Gbzk=/510x318/top/img-s3.ilcdn.fi/714334a769a39f8e20ee607bea9dc71918126e0a7b3f8dc27cabba66aaf543cf.jpg,A8557F1417DA47E0B25CE109B451C6B9
2022-07-11T12:05:40.000Z,Helmareiden avainpelaajalla koronatartunta – sivuun elintärkeästä ottelusta?,Tuija Hyyrynen antoi positiivisen testituloksen maanantaina.,https://img.ilcdn.fi/mCs4H95uZKpCeljS7auNINiQPcc=/510x318/top/img-s3.ilcdn.fi/c84a1cc8a7c913bd63e9745f5bce79fd795c782b35837c25a3dc8058e9a0e6e4.jpg,C9069B7FD3C147758B488A05E919FEB4
2022-07-11T12:13:27.000Z,"”Osa unohtaa käyttää kondomia” – someterkkari Jenna huomaa, mitä festareilla tapahtuu ","Seksitautitesteihin kannattaa hakeutua, jos on harrastanut suojaamatonta seksiä tai epäilee muuten tartuntaa.",https://img.ilcdn.fi/o7gLCt6pGOYC2mjAsQrtpZub9_8=/510x318/top/img-s3.ilcdn.fi/543dbdc8704c862a1d9515acab860b0153b96f07f950ee69af36d3afe66b2be0.jpg,4E9B26AA4DC345D3AC774280C399C44D
2022-07-11T12:37:14.000Z,Antti Tuisku juhli Ruisrockissa valeasuun pukeutuneena – ”En olisi tunnistanut”,Antti Tuisku oli ottanut festariasuunsa inspiraatiota Top Gun -elokuvasta.,https://img.ilcdn.fi/zuspD53k0UA7ioA9Rr_PSyDoLK8=/510x318/top/img-s3.ilcdn.fi/02ead1da329d5eed9541a8ef12c844e1b8299e2aaf2e289b8a182ba47416bd81.jpg,663D9EC9B04F4DF2A240502E2FD3DDC5
2022-07-11T13:09:44.000Z,Perussuomalaisten Packalén: kannabis Alkoihin,"Suomi-areenan väittely huumeista jäi samanmieliseksi, mutta ”hyysäyksen” vastustajaksi nimetty Packalén yllätti kannabiskannallaan.",https://img.ilcdn.fi/NNiKTA5VaB5wUm9TCK3fLl7qxQk=/510x318/top/img-s3.ilcdn.fi/c62d99ef020f6aaa6d50682bb9319bc47621182d59c767674d3a9b0bf96bc457.jpg,C1B9D75F3EB742CCB19889350CA6A37E
2022-07-11T13:24:00.000Z,Narsistinen persoonallisuushäiriö on yksi miesten yleisimmistä persoonallisuushäiriöistä – tällainen ydinkokemus siihen liittyy,"Miehen persoonallisuushäiriö käy yleensä ilmi kautta rantain, kun se alkaa aiheuttamaan ongelmia esimerkiksi ihmissuhteissa. Miehillä yleisimpiä persoonallisuushäiriöitä on kolme. Tunnistatko niiden merkit? Apu voi helpottaa oireilua huomattavasti.",https://img.ilcdn.fi/wfXEgsceYsEEd79cATAhMGlRWJE=/0x127:3000x2001/510x318/top/img-s3.ilcdn.fi/c255040b4da654148a209a739a223ee4bc1abda3cdcc9a0f4baa2fb8bbd24738.jpg,A4BF552866A24A06B6DF7BF82B168569
2022-07-11T13:30:24.000Z,"Bernie Ecclestonelle, 91, syyte petoksesta – piilotti verottajalta lähes puoli miljardia euroa",Bernie Ecclestone on ajautunut ongelmiin tällä kertaa verottajan kanssa.,https://img.ilcdn.fi/0UBK48SQNMP7wSQZKArFK_9mEtI=/510x318/top/img-s3.ilcdn.fi/a68d42445f9b6f71ea4964bcbadf4e1c3496e699e6744cae099781786859080d.jpg,45373014BBC4403BACAFAC3603C4154A
2022-07-11T13:38:22.000Z,"Cameron Diaz uskoo toimineensa huumeiden salakuljettajana – ”Olin blondi, sinisilmäinen tyttö”",Cameron Diaz joutui erikoiseen tilanteeseen uransa alussa.,https://img.ilcdn.fi/9jEqF6efpy1fldnB3iTmjmAKJWs=/510x318/top/img-s3.ilcdn.fi/3baef1a973742eb03db77db91dbf3188a1bb43723bf45454afd54d73b9d8ec9a.jpg,D55B077A34EA4066A879751F64BB32A6
2022-07-11T13:39:30.000Z,"Herttuatar Camilla avoimena väleistään prinssi Philipiin – paljastaa, mikä kuninkaallisessa elämässä yhä kauhistuttaa",Herttuatar Camilla on antanut merkkipäivänsä kunniaksi avoimen haastattelun.,https://img.ilcdn.fi/1H9ItVbZt4EM1DkQt03PfPz6mSc=/510x318/top/img-s3.ilcdn.fi/39d38b13e1a1f32aa0f91fa7806c03b8a1b64cf71f3675bc83de2839e6708fd5.jpg,A1CF3448C9D04721B6B81363A9F2634D
2022-07-11T13:51:03.000Z,Pienlentokone laskeutui keskelle vilkasta moottoritietä USA:ssa ,Moottoritie osoittautui ainoaksi laskeutumisalustaksi.,https://img.ilcdn.fi/k5kseuTMu8-xxx2DVG4sdOPQzJw=/510x318/top/img-s3.ilcdn.fi/03a7b66638a123203a85ed0903c8f26a0d7cb3213e85a6b89eadd8e146a86a57.jpg,80A03508BE72447BBEF1B8388C74A013
2022-07-11T14:12:26.000Z,Mikä kömmähdys! Urheilulegendaa luultiin pikkulapseksi lentokoneessa,Lennon henkilökunta erehtyi pahemman kerran voimistelun supertähden Simone Bilesin iästä.,https://img.ilcdn.fi/4TbQhAP14wo3y2GykmC-fFFlMMQ=/0x56:3000x1929/510x318/top/img-s3.ilcdn.fi/6a5da35af25ce35819e338335e5913d97f05485f7e9cc8d75ececd1bb957127e.jpg,37A4B8CE4E87452DBAE2C2B6D4716201
2022-07-11T14:17:25.000Z,Guardianille vuodetut asiakirjat paljastavat: Uber uhrasi kuljettajat kasvattaakseen voittoja,"Brittilehti Guardianille vuodetuista yli 124 000 asiakirjasta selviää, kuinka Uberin johto jätti kuljettajansa pulaan ja hyödynsi heidän kohtaamaansa väkivaltaa lakimuutoskampanjassaan.",https://img.ilcdn.fi/IRK3wt65fLJoK0PGi1LVxn39QgU=/510x318/top/img-s3.ilcdn.fi/2b7b76365fec66fbd0cfa3b490fad06a400a98e20489c64c003aa9aeac58f4be.jpg,36B2921ED4CC41A0B8337A3EC676B5D1
2022-07-11T14:27:14.000Z,"Ukrainalla on työn alla miljoonan hengen armeija, jonka voimin se aikoo vallata maan eteläosat takaisin","Neuvostoaikaisten aseiden vaihtaminen nykyaikaisempaan kalustoon on kestänyt kuukausia, mutta työ on tuottanut tulosta, puolustusministeri kertoo.",https://img.ilcdn.fi/WSf5OxjoH9700xW7S1xagSQ5kZE=/0x64:3000x1938/510x318/top/img-s3.ilcdn.fi/46b56000a77d9771d5d5774e8a20df1a5b31bc8f85f2c2fc31ccb5a7f6f310eb.jpg,09C9418F1B7A458C97EAB6563C41C46C
2022-07-11T14:27:24.000Z,Nämä vintagemerkkilaukut kiinnostavat nyt suomalaisia eniten,"Suomalaisia kiinnostaa erityisesti eurooppalaisten, perinteisten luksusmuotitalojen vintagemerkkilaukut.",https://img.ilcdn.fi/ZTQJ_y6kj8TaqlB0K-EbCweitIQ=/510x318/top/img-s3.ilcdn.fi/ff92256a18c3efabc865849540f1ae66ed78ad767f888df2833a7f20ce39ad89.jpg,A1F1CCFB186F4385B550794F9414143A
2022-07-11T14:56:26.000Z,Suomelle valtava takaisku – Pippa Laukka: ”Pysytään ihan rauhallisina”,"Helmarien lääkärin Pippa Laukan mukaan syytä paniikkiin ei ole, vaikka joukkueessa on todettu koronatartunta.",https://img.ilcdn.fi/AiTZSgt2Zcfw3csxPm4g-e3VTHY=/510x318/top/img-s3.ilcdn.fi/6d9e133eb0a1b460a3d6592ea6a36586ff62298a94e0dadb0b9e5bf4afeb4068.jpg,BF966109355E481DB7905C0E5C260001
2022-07-11T15:01:02.000Z,Marilyn Monroen asu oli Kim Kardashianille lopulta kivulias kokemus – dieetti kärjisti terveysongelmat,"Kim Kardashian noudatti ennen Met-gaalaa tiukkaa ruokavaliota, joka ei lopulta sopinut hänelle lainkaan.",https://img.ilcdn.fi/-Ruxyp2DP1F5gmfcbRShK5Z4zrs=/510x318/top/img-s3.ilcdn.fi/c5f5c21304a3c6d20c85a1415caeaca3e54c1900f4cae238be5bee6b82465536.jpg,EAF24711028146E18981E0A532433FEE
2022-07-11T15:31:17.000Z,Henkilökunnan alekoodi levisi nettiin – ihmiset tilasivat Hobby Hallista tavaraa puoleen hintaan,Henkilökunnalle tarkoitettua alennuskoodia jaettiin sosiaalisessa mediassa.,https://img.ilcdn.fi/j0-sXYBb5H4fuJSUCiaUUwuDhFU=/510x318/top/img-s3.ilcdn.fi/f716e91d5a3a3751be96dbd52b43e8c8ec361c94ce3e1e62160a1e00721fda7e.jpg,E293AC2FD03D45B5A128C6839ECF601F
2022-07-11T15:51:12.000Z,”Sopimatonta!” Italialainen suosikkikohde kielsi bikineissä kulkemisen kaupungilla,Sorrenton kauppoihin tai ravintoloihin ei enää ole asiaa pelkässä uima-asussa.,https://img.ilcdn.fi/5hNwWzpHzOzMfAuoujE-qdKUOHw=/510x318/top/img-s3.ilcdn.fi/7ea467d71a56efcb39ff0dfb728b2ccfc6779f9b24a2280e21e4035e2ba48604.jpg,9DB2C2EF40DE4A95982BF0095851FA52
2022-07-11T16:00:35.000Z,Fortumin tytäryhtiö tekee miljoonatappioita päivittäin – ”Periaatteessa jokainen suomalainen omistaa”,"Fortum on tukenut tytäryhtiötään Uniperia jo kahdeksalla miljardilla eurolla. Uniper on hakenut nyt Saksan valtiolta tukea, joka voi muuttaa omistusosuuksia yhtiössä merkittävästi.",https://img.ilcdn.fi/6WDrDesok3EuqjU3bw3RXbusHcA=/510x318/top/img-s3.ilcdn.fi/bfbad72a3882e3a0fb6c3915de3203589dc0c54583eda3925112b6a53c3c0e50.jpg,2188848B64B747E2ADF7680236C80729
2022-07-11T16:05:06.000Z,Palkittu GM jättää tehtävänsä: Stanley Cup -voittajan toimistolla jaettiin ylennyksiä,Chris MacFarland ottaa ohjat Colorado Avalanchen GM:nä.,https://img.ilcdn.fi/p0Y23tYpDLJNftM1I3GwLvR1SIM=/510x318/top/img-s3.ilcdn.fi/48c860c84a953e78c2316bd31727d961d12dc041a01b906c4f0334033ea14995.jpg,4B6DC85B613640ABA8694F8C01773F34
2022-07-11T16:09:02.000Z,Kulmien värjäämisellä oli hirvittävät seuraukset:  englantilaisnaisen kulmakarvat tippuivat pois – ”näytin hirviöltä”,Allerginen reaktio sai Michellen kulmakarvat tippumaan.,https://img.ilcdn.fi/IIxUuIX501GtDKSx9cJI0MxzJ_A=/510x318/top/img-s3.ilcdn.fi/fbf19b3fbaf4a106fe908f4277a8cc1721551d4b62ce4c276df69af7ad283678.jpg,9659F4E447C74DC6A6405314683E0417
2022-07-11T16:28:00.000Z,Jussi 69 täyttää 50 vuotta – katso kuvat vuosien varrelta,Suomalaisrumpali siirtyi seuraavalle vuosikymmenykselle.,https://img.ilcdn.fi/aogon3hJE2wz33xEbjVZ4ABPLxc=/510x318/top/img-s3.ilcdn.fi/a1687ceb8b1243b5cd300c5d567632311d1f6375e5aa0b5527bae68ade4729d4.jpg,A2D805B8687041CAA3DF89B1ED4D48CD
2022-07-11T16:31:19.000Z,Joukkueen pomo täräytti nyrkin otsaan – pesäpallotähti Henri Puputti koki ikimuistoisen juhannuksen Vimpelissä,Tampereen Manse PP:n Henri Puputti jahtaa lisämenestystä komealle uralleen. Värikkään kopparin taipaleelle on mahtunut monenlaisia tapahtumia.,https://img.ilcdn.fi/Wbf_50CIwdYnFCozDT7kSJ1rd_c=/510x318/top/img-s3.ilcdn.fi/619c92d6acba4d56248ffdb3882111f29fc4ee30b1ae3e59206aac75a32df888.jpg,253C3ACB5CAF49EB985134E931AE921C
2022-07-11T16:36:09.000Z,Luonnon tila heikkenee – suomalaisprofessori haluaa maa- ja metsätalouden maksajiksi,"Ekologian professorin toivoo lakia, joka velvoittaisi luontohaittoja aiheuttavia tahoja kompensoimaan haitat.",https://img.ilcdn.fi/KmHFTl5FecIqS2-hElAryLPV4EA=/510x318/top/img-s3.ilcdn.fi/9d2b0a6e0d7ba5b351d96e30271f12498785aef683503901d234ffd715f56202.jpg,3C42AE5E8185472B9608DF2DE5ED3583
2022-07-11T17:00:12.000Z,"Ensin rajuja ukkosia, sitten 10 astetta kylmempää: ""Vähän jopa alkusyksyn tunnelmaa""",Sadealueet yltävät lähes koko Suomen alueelle tiistaina ja keskiviikkona. ,https://img.ilcdn.fi/z96c2G6w1pB0TPYwVQNO2nuTsiI=/510x318/top/img-s3.ilcdn.fi/cfb722a82fa4737ebe3dd813bdc3e255e094aaa3911acf002bd59522f89084c9.jpg,C62F915F555C4F4EBDD9AB3116755037
2022-07-11T17:24:11.000Z,Kim Kardashianin lapsen pyyntö nostatti huolta somessa: ”Tämä ei ole ollenkaan hauskaa”,Kim Kardashianin North-tytär ei halua joutua kuviin. ,https://img.ilcdn.fi/lcEl0ldQS2ZmCULnAQmVLXWqlXQ=/510x318/top/img-s3.ilcdn.fi/2ee80e25a8c4c722f2c59c82a5317b7fecccd170253066f16024d23542b0473e.jpg,3583AAC2F92448ADB24FD63E89102448
2022-07-11T17:28:20.000Z,Le Mans Classic on huumaava hyppy toiseen todellisuuteen,"Maailman suurimpiin kuuluva klassikkoautotapahtuma Le Mans Classic on ensikertalaiselle pökerryttävä kokemus. Vuorokauden aikana ehtii näkemään niin paljon, että asian sulattelu kestää helposti viikon.",https://img.ilcdn.fi/fNSv9VfnFxeU0EZkow9CeR6Dr0w=/375x629:2580x1981/510x318/top/img-s3.ilcdn.fi/a1f933ca44ee46cf28d5e8d047110915cc47ea84aa3e4c26798c0c915a0e65a9.jpg,EF655466824F4216B7A77B6DF14CCEC5
2022-07-11T17:47:03.000Z,Aivan kuin isänsä: Romeo Beckham teki loistokkaan maalin vapaapotkusta – ”Tunnen itseni niin vanhaksi”,Romeo Beckham omisti maalinsa isälleen.,https://img.ilcdn.fi/jpeD0tMtw5eZSYCyMvVWFRbb0uM=/510x318/top/img-s3.ilcdn.fi/0a577d38fa79ed39ac043714b326a9549a2e13386dcf4d5a5df7b0fe1fb46438.jpg,709CA24D5D8E417FBF00F1FC5CB19F6E
2022-07-11T17:59:56.000Z,Raaka murha Tallinnan turistialueen ytimessä Raatihuoneentorilla – uhri 37-vuotias ulkomaalainen mies,Murha tapahtui asunnossa aivan suomalaisten suosimien ravintoloiden vieressä.,https://img.ilcdn.fi/lIY29FnYqphhzUPRxcd9lP-aAlg=/510x318/top/img-s3.ilcdn.fi/93a33013c35ed7808ad04ce8ab7f70596f7f3407a32ef79a665b7fa655f6f519.jpg,37C58B0C3014451B9149F56D2FE7A4ED
2022-07-11T18:04:19.000Z,Aamulypsyn juontaja Tuukka Ritokoski sai opiskelupaikan uudelta alalta,Tuukka Ritokoski sai opiskelupaikan Helsingin yliopistosta.,https://img.ilcdn.fi/fCafonIdmGQjGGJ1CnRzSsPqJcg=/510x318/top/img-s3.ilcdn.fi/94877d78a5accefb6dff5283dfcc8efa8f677d74053cdef2120dcbcbae7bf9ea.jpg,B171D43431AA4A9CA40AFA86DED39FF3
2022-07-11T18:30:22.000Z,Lähes sadan tonnin painoinen tuulivoimalan osa putosi kyydistä kesken kuljetuksen Vaasassa,Tuulivoimalan runkoputki oli matkalla Vaasasta etelän suuntaan.,https://img.ilcdn.fi/lhew28S87huSdgffXHRFhptxuw8=/510x318/top/img-s3.ilcdn.fi/64127da69c469db54713360bb4a88daa7e3e080188d9c81f1a31c8820a269417.jpg,BDF76C0807F848E490BA44F9978F0086
2022-07-11T18:39:06.000Z,Edmonton Oilers teki jatkosopimuksen kohuhyökkääjän kanssa,Tehokas hyökkääjä ei ole onnistunut kaukalon ulkopuolella.,https://img.ilcdn.fi/X6-rZu2TpovBHQxaV1YYtsfGiHk=/510x318/top/img-s3.ilcdn.fi/f04d30fbe56a04e4d4e540bc857f8e00d50dab3d6d72f18d616fdde620110f6a.jpg,19A7765748604F1B93243DBA42D65D26
2022-07-11T18:52:04.000Z,Suomen Lontoon-suurlähetystöön tuli epäilyttävä paketti – poliisi tutkii,Paketista tai sen sisällöstä ei aiheutunut vaaraa.,https://img.ilcdn.fi/_Q2QXFuZVkviTU_Jp64LA-Bi8XM=/510x318/top/img-s3.ilcdn.fi/52edfec49fce17a5b1f9ba72cdcb491dfdb1cefd35e4e914fd4807f1c6f4c283.jpg,F370FD8052DE4DA0BE97BD06F93AD976
2022-07-11T19:06:53.000Z,Hurja tilanne superpesisottelussa – pelaaja lennähti pää edellä jokeen!,Elmeri Anttilan lyönti painui vastustamattomasti jokeen asti.,https://img.ilcdn.fi/OZCXqsjsbKKkRiQnhBNQtFaCq0U=/510x318/top/img-s3.ilcdn.fi/25ad4415d82c92fb848c3f6541c6fd76c7fef635964afb689be78bda17a060db.jpg,A1775D8EE0054EF5B5A01080A300F316
2022-07-11T19:12:41.000Z,Lapsi lähti etsimään äitiään: roikkui päästään 5. kerroksen  ikkunasta – sankarimiehen toiminta pelasti,Ohikulkija pelasti ikkunasta roikkuneen lapsen Kiinassa.,https://img.ilcdn.fi/s4j-RRmg9mXWELs7XI6BCoskwqs=/510x318/top/img-s3.ilcdn.fi/1cb3204d11f9f8f604dba6071d437a930ee6a1f596d097f02de0136a35cc1ea3.jpg,43CDD76BA77947DBB50EEC0FC6B014CE
2022-07-11T19:13:41.000Z,Kymiringille lisää lunta tupaan: jälleen yksi suurkilpailu peruttu,Nitro Rallycross liittyy peruutettujen tapahtumien pitkään listaan.,https://img.ilcdn.fi/rqGltmk52QUNdi7Au5Wv1Ujt1GE=/510x318/top/img-s3.ilcdn.fi/19ac596ae98d85c53555c0795eea348a018018a8d41e85f7b46915ebb731547d.jpg,342BD7869A544424801A0D653B211605
2022-07-11T19:25:51.000Z,Pitkä avioliitto ajautui katkeraan eroriitaan – 16 rotukoiran arvoa puitiin oikeudessa asti,Eroon päätyneen pariskunnan omaisuuden arvosta käytiin katkera riita.,https://img.ilcdn.fi/I5j3sZ66Aylz7HbateMuGT8q_vo=/510x318/top/img-s3.ilcdn.fi/f29071114dd00b52e37f2384651499509ba4f0705a58d1c14060eb60f701b582.jpg,657D01918A94432688CC36E2ED4B963E
2022-07-11T19:30:30.000Z,Britney Spears: ”Koko Amerikka on nöyryyttänyt minua parhaansa mukaan”,Poptähti Britney Spears pitää hänestä tehtyjä dokumentteja nöyryyttävinä. ,https://img.ilcdn.fi/WNF-TueG4xKcz6Ecy4u6mankVSg=/510x318/top/img-s3.ilcdn.fi/0778d47a5b9ea83875aba20d3f7ff37619137c75531d39e016c4dac3e3e53a0a.jpg,F68A6DC47CAF41F8BC067A60EA242151
2022-07-11T19:51:36.000Z,Äiti yllytti perhekotiin sijoitettua tytärtään puukottamaan työntekijää,Äidin mukaan kadun lait oli otettava käyttöön.,https://img.ilcdn.fi/60fzc7JY6-RKX1OTdsgVh1vElM8=/510x318/top/img-s3.ilcdn.fi/00259c41ec17010302e0c33768663e2064a38cef464339fc909f939b28e653b0.jpg,41CB1033D7004DC5B81C2AD02ED4EBDE
2022-07-11T19:58:11.000Z,TPS:n tehohyökkääjä Lukkoon – Liigaan kaksi kovaa paluumuuttajaa,Liigan ex-pörssikärki ja KHL-kierturi palaavat Suomeen,https://img.ilcdn.fi/XD3f1ANnxk9UJv4wJdlGwtnnIoQ=/510x318/top/img-s3.ilcdn.fi/140f4e76d8271473c19f8edea54fac4cdbcc93adbfc722d98ca9b44ec9cb7827.jpg,21D28EF09B774DCF840C1C581657D106
2022-07-11T20:30:48.000Z,Heinolalaismies ehdotteli torilla sukupuoliyhteyttä koulutytöille ja masturboi tultuaan torjutuksi ,Päijät-Hämeen käräjäoikeus on tuominnut 61-vuotiaan miehen kolmesta lapsen seksuaalisesta hyväksikäytöstä ja sukupuolisiveellisyyden julkisesta loukkaamisesta.,https://img.ilcdn.fi/hSRHUCrmTRV2814hdvKbBpjxhWg=/510x318/top/img-s3.ilcdn.fi/acfd4340e2f1f29b9ce26e4e343ddb58183e366c3c17ab1aaea7e276411395da.jpg,05EC3B082F894672966193E51CE0E01C
2022-07-11T20:44:36.000Z,"Jari-Matti Latvala hyppää erikoisen menopelin puikkoihin: ""Tulee hauskaa""",Viron ralliviikonloppu käynnistyy kuormurinäytöksellä.,https://img.ilcdn.fi/Gz7OZSSAnGd0iYuKof92H_OHS3c=/510x318/top/img-s3.ilcdn.fi/6614b2de73ca1e8a89354912a13fd940f75dac99c4caa4d64da975908f1c4bbb.jpg,3F3C0EC2ECB546C98227BD864419563D
2022-07-11T20:51:56.000Z,Kahdeksan maalin Englanti historialliseen murskavoittoon – päävalmentajalla käsittämätön tilasto,Englanti voitti Norjan A-lohkon kärkikamppailussa peräti 8–0. ,https://img.ilcdn.fi/3b6ca350bak_zY-EH25SWEJrSA8=/510x318/top/img-s3.ilcdn.fi/e2928cffb7a8d4a48c9e5c4f849803ec23d9fa6f89b2d6a2eb9b2b5b2100f19d.jpg,879EDDFBC6804B638B44419418BF4D6E
2022-07-11T21:13:40.000Z,Rovaniemellä suuri poliisioperaatio – poliisi kehottaa asukkaita välttämään ulkona liikkumista,Rovaniemellä Pöykkölässä on käynnissä suuri poliisioperaatio. Asukkaita kehotetaan pysymään sisätiloissa.,https://img.ilcdn.fi/IVZgUfUQxAILHDYufKiuWCBUyt0=/510x318/top/img-s3.ilcdn.fi/20ea50a61a6bd01f41f6dc91689e41cf455e83ffe1d7fcc3559452b25a506935.jpg,8BF8E1DB15F04C038BD64C1E237C9C9B
2022-07-11T23:00:25.000Z,Horoskooppi,NULL,https://img.ilcdn.fi/ZJX2nPQHLedeTO4nOGca4bZ5URo=/510x318/top/img-s3.ilcdn.fi/0e855f41645f17dbb2436f21bf69f40ac48d1971a147578985e2c64c1fb985d3.jpg,F0A377486DA6441793FC1DE753ADD516
2022-07-11T23:36:13.000Z,”Ruotsin Suomi-areenan” murhaa tutkitaan nyt terrorismina ,Epäiltyä psykologin puukottajaa tutkitaan murhasta ja terrorismista.,https://img.ilcdn.fi/ybONV4cdWrZW9qZdlfUKoUQQLtY=/510x318/top/img-s3.ilcdn.fi/e0fdc8867e113b42c6ec5ded6a8a2e7b86a043574471f5ebf656fb7568c4abab.jpg,FCA70E4A69F64316BF2BFF0BA422EFA8
2022-07-12T00:46:03.000Z,Ensimmäinen James Webb -teleskoopin ottama kuva galakseista on julkaistu ,Uusi teleskooppi mahdollistaa kuvien ottamisen aiempaa syvemmältä avaruudesta.,https://img.ilcdn.fi/ZGpPDLEWDt5UReJYC88OC5qsA3I=/510x318/top/img-s3.ilcdn.fi/9cff97d2c4ff286baa7378736ab17cee91e6500d4257d7ee6093bbda3d6f0704.jpg,83875266FB0643DC95F3FB266EE32CE2
2022-07-12T01:54:16.000Z,Boris Johnsonin seuraajavalinnan aikataulu selvillä – he pyrkivät Britannian pääministeriksi,Britannian uusi pääministeri on määrä julkistaa 5. syyskuuta mennessä.,https://img.ilcdn.fi/VsXrLftWhhjj4yjfQu6zrVZweVo=/510x318/top/img-s3.ilcdn.fi/440f54feb6d3868d984beee19a99d2f555ab866e6cbd0ebca1a6859bfad58990.jpg,C266C07E3289476CA4351B3D6FEACA58
2022-07-12T02:45:00.000Z,Mikä seura isännöi alkavalla valioliigakaudella City Groundia?,Iltalehden perinteinen urheiluvisa on myös verkossa. Montako tiedät?,https://img.ilcdn.fi/c-4gD7K2HVTvnpCmnb6B2aGx-b8=/510x318/top/img-s3.ilcdn.fi/7a046ae5fdfc391b06d6877a32fcff4043bbb4559d2581bcf74ba92db1cba295.jpg,83B4536160244148B1C195B3AF295AE6
2022-07-12T03:01:09.000Z,Näitä asioita suomalaiset häpeävät – yksi asia nousi yli muiden,Tutkimuksen mukaan naiset häpeävät useammin kuin miehet.,https://img.ilcdn.fi/zX-g2PdhS7k3uShaORUCVpvtAgM=/510x318/top/img-s3.ilcdn.fi/747f1c8b8ae92943fd584429e0f3c874e13cc543913d30128b36b64b108daea2.jpg,0AD6AA7EB26D4591B6D636E09C0392B5
2022-07-12T03:02:53.000Z,Menolippu Suomeen,"Saimme selville, että venäläiset ovat keksineet syvästä epätoivosta kertovan oljenkorren päästä itärajan yli Suomeen. 21-vuotias Andrei on yksi heistä. Hän kertoo uskomattoman tarinansa.",https://img.ilcdn.fi/JO8opcM7lhLgByHAEPgZHfh-iKU=/510x318/top/img-s3.ilcdn.fi/4ca400560dc12dd0f423f96147ef9b7d2c4d364b1adaa91640272620470a4b54.jpg,D6469B744F7340A8B81BC6F2A5EA2667
2022-07-12T03:15:23.000Z,Arto Bryggare suitsuttaa tuoretta SE-miestä: ”Teknisesti valtavan kaunis juoksija”,"Samuli Samuelssonilla on rahkeita parantaa satasen ennätystään 10,16.",https://img.ilcdn.fi/pmPoErI16T6hiVCZJ0tLEXRnNMc=/510x318/top/img-s3.ilcdn.fi/2d07490f1bcabf6c55e9dbe0d6cdeeb3ef8bb49f40513dcd4675d691ca653954.jpg,D41F6978EE924042B5DAFEE99BEC3F6D
2022-07-12T03:21:57.000Z,"Lenita Airisto ei säästele sanojaan Kesäterassi-ohjelmassa: ”Naisen mainehan on se, joka ensimmäisenä tuhritaan”","Airistolta kysytään, miten hän suhtautuu puolustautumiseen ja luovuttamiseen.",https://img.ilcdn.fi/Vfxrau8F21v2FINnhFVdLzYUtlg=/510x318/top/img-s3.ilcdn.fi/ae7ed20a48f7e94d45bfa81092238d24c188eb6987191ab4816afbaee5e07193.jpg,A07DB43D6224452D90DA61FB9EDC0298
2022-07-12T03:34:06.000Z,Kari Väänänen kärsii terveysongelmista: Toinen jalka halvaantui,Kari Väänäsen toinen jalka halvaantui.,https://img.ilcdn.fi/_kFW-oG-7tD8Goj-r4a3X-5NR9o=/510x318/top/img-s3.ilcdn.fi/01d3498b24a8f1af685aea6e80c8161727b7aee66545a54c4d01ac6d46acbf84.jpg,E5A4C224159B41CE85F9CE429B99B2C1
2022-07-12T03:42:21.000Z,Puukotus Turun jokirannassa – poliisi vaitonainen,Turun jokirannassa on puukotettu ihmistä yöllä.,https://img.ilcdn.fi/lqwFS8OphiOXMR4inqX7-ZKK0KM=/510x318/top/img-s3.ilcdn.fi/c632166d8b033baf325498854864359c567a2ffc018d28948179aa45557c8950.jpeg,273D052FB2824DB5A4A484B7BCA950E0
2022-07-12T03:57:16.000Z,Pojan ensimmäinen kalareissu päättyi epäonnisesti – varas väijyi pusikossa ja virveli sai kyytiä,Pesukarhu murskasi pienen pojan unelman. ,https://img.ilcdn.fi/ilCMY9xS9PzrrsjKiWSrlrSElXs=/510x318/top/img-s3.ilcdn.fi/ecb54043e695937fc799496006296f937095f54d57f51be385a767fe5912c636.jpg,07C87C6C156C450E92A3EF6764848CEC
2022-07-12T04:00:14.000Z,"Näin ""Putinin hinnat"" muuttivat suomalaisten ostotottumuksia",Suuri osa ihmisistä on lisännyt reilusti suunnitelmallisuuttaan ostosten suhteen.,https://img.ilcdn.fi/gkAdjIDtEe1WlTG5D-jcDwknxyg=/510x318/top/img-s3.ilcdn.fi/ef48fdd5381584696f4ec9fa3d20c97d54edc71286c8ad972891524622b492c6.jpg,A547B169158747D5AEF8B9C5D799F185
2022-07-12T04:03:14.000Z,"Ukkospuuskia, hellettä ja sadetta – sää heittelee tänään laidasta toiseen",Sää on tänään vaihteleva.,https://img.ilcdn.fi/d7ou_7gRZrDlCHH15CIQFLKcypM=/510x318/top/img-s3.ilcdn.fi/9a26768eefe5e28589d691dc86e63f6d520bb6a70e43e7cdcf905a32587714d3.jpg,0789694E876F4BFD97745B250D62AEED
2022-07-12T04:09:21.000Z,Japanin entinen pääministeri Shinzo Abe haudataan Tokiossa – seuraa suoraa lähetystä ,Japanin entisen pääministerin hautajaisia vietetään tänään maan pääkaupungissa Tokiossa. ,https://img.ilcdn.fi/P-JE4mUtmc4gf4Ns-eqTOr2vIVI=/510x318/top/img-s3.ilcdn.fi/ea3a34f6495226692e9ed6b9e100d1a933dbc0486c9004bf36de7e1ef7947efa.jpg,F21A039D977346DCA7722D3176A755F6
2022-07-12T04:10:39.000Z,Suomea johtaa modernin ajan Tihonov – Anna Signeul saa mennä,"Anna Signeulin ura Helmarien peräsimessä loppuu nykyisen sopimuskauden umpeutuessa, kirjoittaa Janne Palomäki Milton Keynesistä. ",https://img.ilcdn.fi/GpbgEio2r_6wS7i11ZnWRXN6eh0=/510x318/top/img-s3.ilcdn.fi/254a8108b7094b225dc6e7fd7e3d6e40e8377cce94f0380f62820ed51e21aff5.jpg,F0B02B959E414B3FAA5ACCB50078BA9F
2022-07-12T04:21:17.000Z,Ukrainan vastaisku alkanut: iski Venäjän ammusvarastoon Hersonissa – tämä sodasta tiedetään yön jälkeen,Ukraina on aloittanut vastaiskun Venäjän valloittamille alueille. Iran aikoo lähettää lennokkeja Venäjälle.,https://img.ilcdn.fi/CNU4mWp8jWJ6SsYX6uv5BiMXn_8=/510x318/top/img-s3.ilcdn.fi/030febe6154eae89a3339871e66d122f5706115a6830b6d7388e4ecfe9188195.jpg,C54D5617AAF0407D9735038F7ECE7F6F
