paivamaara,otsikko,tiivistelma,kuva,id
2022-07-16T07:23:54.000Z,Aki ja Rita Manninen ostivat oman saaren: tältä näyttää perheen hulppea kesäparatiisi Porin saaristossa,"Aki ja Rita Manninen omistavat tätä nykyä saaren Porin saaristossa, vanhoilla kotikulmillaan.",https://img.ilcdn.fi/L0kuCPQ3hglQF0fQP4VJb5vo8sQ=/510x318/top/img-s3.ilcdn.fi/2b20cef71420619e375dec7fa9de93240da76c338035cbd3c85dd9da966e7976.png,7BB0CF31B1594C2097EF55B7F35454EB
2022-07-16T07:34:14.000Z,Barcelonan kultapoikaa savustetaan ulos – onko kyse pelkästään rahasta?,"Syyt Frenkie de Jongin myymishaluihin eivät ole pelkästään taloudellisia, kirjoittaa Sami Pilvinen. ",https://img.ilcdn.fi/aSpaB7zGPJeRhsZvUD4v-SyL0cs=/510x318/top/img-s3.ilcdn.fi/725fa270997778f9905c41e35a383ff41e8da91f67014f470f322b75eb3b71dd.jpg,8DB013515E45401A9825262F888DA981
2022-07-16T07:36:37.000Z,Jyväskylän rannalla havaittu nyt myrkkykeisoa – kahdella rannalla edelleen kakkabakteereja,Lisäksi Köhniön uimarannan vedestä on edelleen löydetty pieni määrä vatsatautia aiheuttavaa norovirusta.,https://img.ilcdn.fi/D3pRpRwIYY0eIUbALvDdxfu9aAc=/510x318/top/img-s3.ilcdn.fi/f23433048a4d89759198c56882b8d26f991782195b351260ea3cc3c460742d87.jpeg,E073BB05B8AC4338A189E7F1C5773661
2022-07-16T08:17:40.000Z,Topi Raitanen meni retkuun: ”Ei ollut tietenkään fiksua” – jenkkien sähläys hämmentää,Asiantuntija Arto Bryggare paketoi lauantain vastaisen yön MM-kisatapahtumat.,https://img.ilcdn.fi/hO-oHdVizMj-I5493nfRVLIjlgc=/510x318/top/img-s3.ilcdn.fi/47dd671b4aa6ad63c974674f6f0569f3552492fe6409dca41440ef18bda1a3cf.jpg,B70FC7A90C4342698642A50F909BC55F
2022-07-16T08:22:26.000Z,Nämä kolme vinkkiä antavat pihallesi uuden ilmeen – eikä maksa juuri mitään,"Kysyimme puutarha-alan ammattilaiselta vinkkejä siihen, miten tylsän puutarhan saa uuteen kukoistukseen ilman mittavaa remonttia.",https://img.ilcdn.fi/bkLCABjcWVYVM_GYDz1mon5L3i8=/510x318/top/img-s3.ilcdn.fi/953f7652f27351f32e33f30cda25a0b7187f7e0e4683392c4ce44e71b4b87bdb.jpg,149BA2E9A0D74A74BD3A68B3D49CA279
2022-07-16T08:35:49.000Z,"Bentley esitteli ylellisen varusteluversion heille, joille ylellinen ei yleensä riitä","Brittiläinen loistoautovalmistaja muistuttaa, että sen mallistossa on sijaa muullekin kuin perinteistä ammentavalle urheilullisuudelle.",https://img.ilcdn.fi/k8eN7zNu1wjae-Gxy4rPXm8DU2Q=/510x318/top/img-s3.ilcdn.fi/fe1da8e5927151ab51e0ea36295be1011cc74579221f6dd3ec4592d85d669b1f.jpg,40A97C01E2D946DC9056CBBDF95A56A9
2022-07-16T08:36:55.000Z,Martina Aitolehti täyttää 40 vuotta julkkisystävien ympäröimänä: ”Juhlan arvoinen asia”,Martina Aitolehti viettää nelikymppisiään Ibizalla ystäviensä kanssa.,https://img.ilcdn.fi/Tn0cQXQto2zaxtIHjIViKZVyCSU=/510x318/top/img-s3.ilcdn.fi/2bba4c47a94dd358b0dd0aec9a27c972009aa15d18d784975dac1586b71bb8c1.jpg,241FCEA3D9384B53B1DBE01C2D413D53
2022-07-16T08:38:24.000Z,Rajakoira Rolle pääsi eläkkeelle,Rajakoira Rolle pääsi eläkkeelle hienon yli 10 vuoden työuran jälkeen.,https://img.ilcdn.fi/bQgXg029Pqw7bCL3y-JRz3S-Gtg=/510x318/top/img-s3.ilcdn.fi/b01edb37db3f69fdfde550e1c3638bd987c78649a8c6d4e85eb950d66175d786.jpg,6597C72FCCB245D988DCF605B5F4A694
2022-07-16T08:58:23.000Z,Tuulet lähes myrskylukemissa viikonloppuna – hurja video näyttää kuinka rajuilma piiskaa omakotitalon pihaa ,Viime päivien kovat sateet ja tuulet saavat jatkoa viikonloppuna.,https://img.ilcdn.fi/vDh9vlMGE_IWMKuqeV0VerWnHMs=/510x318/top/img-s3.ilcdn.fi/0ef5ff3216c46c28ea417aaafb82fee7705e513deba9ea4edae39d25381a7e39.jpg,D05DC12D4C0048038CCB84DA4DCE8DB6
2022-07-16T09:16:28.000Z,"Unohda Kanaria ja Kreikka! Tunisia on loistava kohde, jossa aurinko paistaa läpi vuoden","Niille, jotka ovat jo käyneet kaikkialla muualla, Tunisia tarjoaa rennon ja helpon matkakohteen, jossa yhdistyvät niin Välimeren alueen rikas historia, läpi vuoden tasainen auringonpaiste ja muun muassa loistavat mahdollisuudet golfin pelaamiseen. ",https://img.ilcdn.fi/RcLnqTY1HiH5XNdd27pSosQVaqo=/510x318/top/img-s3.ilcdn.fi/2a8b888f608fc5001032db05b0a69b1b71da9fae29118e5165ed63e40dd7318b.jpg,B362ACC8CF4A4475AD45505783602380
2022-07-16T09:18:50.000Z,Venäläinen urheilupomo puolustaa pidätettyä amerikkalaistähteä,Britnney Griner joutui torstaina uudelleen oikeuden eteen. ,https://img.ilcdn.fi/Oz7G4OSlLBfub_itB8fs91q2cE8=/510x318/top/img-s3.ilcdn.fi/7eeccc7ed9594a56d65604ce2b57860dc544576806d89610fa0608ac39c3d16a.jpg,92A037FA5E06413EA1FD2D8223DB665C
2022-07-16T09:27:08.000Z,The Rasmuksen Emppu Suhonen harvinaisessa yhteiskuvassa miehensä kanssa: ”Viisi vuotta rakkautta”,Emppu Suhonen viettää kumppaninsa kanssa vuosipäivää.,https://img.ilcdn.fi/N4qJuQ9ODieX53Ay2-ZjbZ9WT8k=/510x318/top/img-s3.ilcdn.fi/7af943df654d463f2b7fac7808757879841d3ebb21cb73dcc79f51b07e701daa.jpg,4BA7808947EE4AE4819CB286D96D4C70
2022-07-16T09:59:46.000Z,Vammaisen avustaja maksaa Zoolandiassa täyden hinnan – kävijä yllättyi poikkeavasta käytännöstä,Zoolandia vaatii vammaisten avustajilta täyden pääsymaksun vedoten tasa-arvoiseen hinnoitteluun.,https://img.ilcdn.fi/gpGcavMirpkVjNw3olOF1fsqqw0=/510x318/top/img-s3.ilcdn.fi/222f93465aea67302f124e1887c5784a3c340265280da01e865481849cd347e5.jpg,D07135C48E7440BE9E5AF8607664DE67
2022-07-16T10:04:22.000Z,"Kampaaja vinkkaa, kuinka saat kiharat oikeasti kestämään – katso video","Monen ongelma on, että kiharat eivät kestä kampauksessa pitkään.",https://img.ilcdn.fi/laHlfrXKqODGh1E2TBrYPn1wxgc=/510x318/top/img-s3.ilcdn.fi/ece3d6ad0459096dbbcb7dd7ec22328939f8df865fb460def5fd977286609802.jpg,DDCC3494ABA94828A1AD25DEACB7B87F
2022-07-16T10:11:48.000Z,Dopingtestin jälkeinen puhelu sokeerasi norjalaisurheilijaa – joutui pian leikkauspöydälle,Dopingtesti paljasti sairauden.,https://img.ilcdn.fi/vgrwsykIDsurc5Z4hfyxGM3vObM=/510x318/top/img-s3.ilcdn.fi/823cf12edd3a4228213ee2c4cbeab402497be84659f4fc7d3fc7b0c1fa74c152.jpg,D496EB18EF4547788BBC58C2CF7C07F9
2022-07-16T10:15:28.000Z,"Essillä, 24, on kamat pakattuna äkkilähtöjä varten – tältä näyttää rekkakuskin laukun sisältö",Laukusta löytyy tavarat vähintään yhden yön reissuja varten.,https://img.ilcdn.fi/9pSdI_aEpLuH2Hr5toMhBjzzCm0=/510x318/top/img-s3.ilcdn.fi/a5b94d00f78ee1ab4dc75d3ea36faa6863d88eb7390dca31ba70da3f6767285d.jpg,342569B4DC3C4B4A9648F0F06D9631EF
2022-07-16T10:17:57.000Z,Ympäristöministeri Ohisalo: hallitus haluaa maataloustuottajat maksajiksi pellonraivauksesta,"Ympäristö- ja ilmastoministeri Maria Ohisalo (vihr) kertoo, että valmistelussa on laki, jonka mukaan metsien raivauksesta esimerkiksi pelloiksi tulisi maksaa. Tarkoitus on ehkäistä metsäkatoa.",https://img.ilcdn.fi/hihahECDtb6rFCu_SHUxbvAitiY=/510x318/top/img-s3.ilcdn.fi/ff877128b4c04709e490f2d414f0bdcc40134409fc861a69ed08c55cd163e028.jpg,C9557293C8E946B5AB1C55DFEFB42C7A
2022-07-16T10:31:28.000Z,Ricky Martinia syytetään insestistä – uhkana 50 vuoden vankilatuomio,Ricky Martinin väitetään olleen suhteessa 21-vuotiaan siskonpoikansa kanssa.,https://img.ilcdn.fi/aD9sWtoY05VaTVR20rmh_efMAu4=/510x318/top/img-s3.ilcdn.fi/06e018ca483f1a55fce9a36ce4a14316eb2c31b8bdd677094068fa792178beda.jpg,BEE8C53C172E48BCA1D08B0EFD2FC951
2022-07-16T10:38:39.000Z,Liikuntarajoitteinen Sanni ei mahtunut Ruisrockin invataksiin – järjestyksenvalvoja kehotti kävelemään kolme kilometriä taksille,"Ruisrockin kävijä, liikuntarajoitteinen Sanni Karhu joutui jäämään sairauslomalle viikonlopun kävelyurakan jälkeen.",https://img.ilcdn.fi/yL_MM8ENO6kDf__XPQfKllEXJlI=/510x318/top/img-s3.ilcdn.fi/9573ba2a7f241bc3bf88a75a6770df62227776a514b6abf39a707ec65bfa7efb.jpg,79D57A55667A4122835ACD493CAB294F
2022-07-16T10:40:39.000Z,Suomen MM-urheilija paljasti Ylen tv-lähetyksessä reppuun keräämänsä luonnonkappaleet: ”Kaikki naureskeli minulle”,Silja Kosonen löysi pitoapua Creswellin harjoituskeskuksen luonnosta. ,https://img.ilcdn.fi/i5co_WEka6dmm3NmgVohE0NLy5s=/510x318/top/img-s3.ilcdn.fi/0de76dbad927cee76a5507ea5a958b4de8bf3ad1d9bd59c1f4006ae0a725ebef.jpg,F01F2D93C3204E3782FBC4ABFB214D73
2022-07-16T11:01:53.000Z,Öinen hätä ,"Jos vessassa pitää juosta öisin, on syytä hakeutua ammattiavun pariin. Kerromme tässä jutussa, mistä nämä yöjuoksut johtuvat.",https://img.ilcdn.fi/--cEHmR-oz82HotFiux4kT2M_uI=/0x64:3000x1937/510x318/top/img-s3.ilcdn.fi/5d0ac3750c2474996ba0e9bd46c0b8b3733b9f35c2ae73f3d653603042a5965c.jpg,78A1964C09F34219A3272175A806D6A6
2022-07-16T11:11:45.000Z,Vladimir Putin myönsi Tuomas Sammelvuolle kunniamerkin,Tuomas Sammelvuo sai merkin toimistaan Venäjän lentopallomaajoukkueen päävalmentajana. ,https://img.ilcdn.fi/rr0_Dsca5qoUP4uwoKJGGuu5dgc=/510x318/top/img-s3.ilcdn.fi/6628d6731da054016335cd50fe35b516644f9995934b0b5b88406588f7fc10cb.jpg,7C9F6D7EB2DC4AB4957241D6CC0213EB
2022-07-16T11:24:12.000Z,IL Haminassa: Eksynyt mursu on saanut jo nimen – näin legendaarinen kippari kommentoi,Iltalehti vieraili mursun villitsemässä Haminassa. Yllättävä vieras on kiinnostanut sekä paikallisia että muualta tulleita.,https://img.ilcdn.fi/hsveb7BIg79txBK1v-MvKO_rgmg=/510x318/top/img-s3.ilcdn.fi/4d43a19b06a8b4b82dcfa750a39559a5330adff76fc124f539725465342d78bd.jpg,578BC72B290E4D0A8C01896CB630CCAC
2022-07-16T11:28:52.000Z,"Laulaja Ilta kohtasi kyseenalaistusta nopeasta avioitumisestaan – kertoo nyt, mitä ajattelee kommenteista","Ilta ei lapsena osannut haaveilla laulajan urasta, sillä pelkäsi epäonnistumista.",https://img.ilcdn.fi/khg9XvBNvPHDkelHMlO7a3d7Aj4=/510x318/top/img-s3.ilcdn.fi/b5617397d5390e2f9e87de714e196c367f4483e51ee0b30c3e5329b7c94c82c4.jpg,F1BFB72A856D47DEB279CC56BAFFA6DB
2022-07-16T11:30:46.000Z,Poliisi: Haminan mursu on jatkanut matkaansa,Koko Suomea ihastuttanut Haminan mursu on jatkanut matkaansa.,https://img.ilcdn.fi/LcgwtIRVctwc-5q_ctGLADIk7mk=/510x318/top/img-s3.ilcdn.fi/7f3c116a89d456c0584aef562d44b03a5c086bce9933ca000e33ee685d49ce0a.jpg,F3165BEDAEF7460EAE8D40D1B9F8B5A1
2022-07-16T11:46:04.000Z,"Helppo taikina, jota ei tarvitse vatkata – ja toimii kaikissa marjapiirakoissa! ",Helppo marjapiirakka maistuu kesän kahvipöydässä. ,https://img.ilcdn.fi/oQFtYdcXB9Roqjdn71sxyz_wrL4=/510x318/top/img-s3.ilcdn.fi/3ebbe49d5ae88408980e5ad21ef839d323e453ba6b92c4db3a5af65ff44d1637.jpg,E12E5021BB4141E8AD74D510EB0DC398
2022-07-16T12:00:06.000Z,Tällainen eläin on mursu – elää jopa 40-vuotiaaksi,"Mursut saattavat mylviä ja kuorsata kovaäänisesti, aivan kuten Haminassa tavattu yksilö.",https://img.ilcdn.fi/FXqDmZtfRXHxlXnnpUNT15YpFgg=/510x318/top/img-s3.ilcdn.fi/237507e7a85aaf3dea4aad4c8669f22c0c2f490d3af4c8f052a6320f376861d3.jpg,98E956E7107246DEA2A1E07E744084ED
2022-07-16T12:13:02.000Z,Fortum tulee kohta kukkarollesi,"Yhtiöllä on edessään massiiviset alaskirjaukset, kirjoittaa Iltalehden Mika Koskinen.",https://img.ilcdn.fi/zbbn7xbCufanOlKLdCiqrEAAjak=/510x318/top/img-s3.ilcdn.fi/67d81dd797a58c4059ce0f983bce1fd96910950ea618b627104065d34fd68f0d.jpg,101F25FD71D14B9EA8ABB2B96A15ABBC
2022-07-16T12:23:43.000Z,Esko Eerikäinen onnittelee Martina Aitolehteä somessa: ex-puolison ylistävä kirjoitus koskettaa,Esko Eerikäinen ylistää ex-vaimoaan Martina Aitolehteä Instagramissa.,https://img.ilcdn.fi/a33Z1nigCaTZqpE1up04QaLTJ-k=/510x318/top/img-s3.ilcdn.fi/a511ec9d0672f9aea01a3d95f2e773e7396dfe3f219fa0c213c01851c9908b54.jpg,217AA1FC955F40F1BEB04C7EAEA42566
2022-07-16T12:28:33.000Z,Yli sadan vuoden takainen vääryys korjattiin vihdoin – ruotsalais- ja norjalaisottelija pudotettiin olympiahopealle,Jim Thorpe voitti kaksi olympiakultaa Tukholmassa kesällä 1912.,https://img.ilcdn.fi/yA9tieUsyqQHlX1KUSfykJoeHCQ=/510x318/top/img-s3.ilcdn.fi/e107d515c034f58a2454fd9f34510dbd91c737214d1b57bed45d732abbd1dffb.jpg,81853327D547492C9690B92C9EE01F0A
2022-07-16T12:42:46.000Z,Ihomelanoomien määrä räjähti – tunnista varhaiset oireet,Melanoomatapaukset kääntyivät Suomessa selvään kasvuun 2000-luvun taitteen jälkeen. Taustalla ovat etenkin vääränlaiset auringonottotavat. ,https://img.ilcdn.fi/2GuL_vd9ZStlCPEztNjvosjdG9s=/510x318/top/img-s3.ilcdn.fi/97531e03fd04f803392350ea10c14db35cdd0a63a5e550b6b9f6c934e0e3ae84.jpg,EF27B5EEFF0B40FAA75191EBF7CEDB79
2022-07-16T12:53:08.000Z,Hirmuhelteet runnovat Eurooppaa – ”Tunnelma on kuin maailmanlopun jäljiltä”,Liekkien odotetaan nuolevan asuintaloja Portugalista Kroatiaan vielä useita päiviä. Lämpötilat nousevat vaarallisimmillaan 45 asteen paikkeille. ,https://img.ilcdn.fi/9ZmDVjtXztltjKjmwKMzP7Mp4_c=/510x318/top/img-s3.ilcdn.fi/770db20c706f0c9eee0f94344d40509d8e5d6a28f9568a8e7a8a40cf3af79804.jpg,6B244E2AE0094B4F94E1CB364E14118F
2022-07-16T13:08:56.000Z,Pahamaineinen huumelordi pidätettiin jälleen Meksikossa – ”Rafa” Quintero vietti viimeiset vapauden hetkensä pusikossa piileskellen,Kiitos pidätyksestä kuuluu Max-koiralle.,https://img.ilcdn.fi/b6QAWAawJLwh3y74Ce0dejqahsA=/510x318/top/img-s3.ilcdn.fi/542ffd75bea0aa6731e93553b271eb5989b1c6704a8c178ddbff43e05f709beb.jpg,03461F6D7D5D47EEA9789F64E1EEDF61
2022-07-16T13:11:55.000Z,Poliisi pysäytti vaarallisen kuorman: 23 000 kiloa kiviä matkasi vaarallisesti rekan kyydissä ,Itä-Uudenmaan poliisi pysäytti perjantaina varsin riskaabelin kivikuorman.,https://img.ilcdn.fi/HZ4CuvykrbNR_X4VYZuJ3niPubQ=/510x318/top/img-s3.ilcdn.fi/f3136303908e08cc15efcf6c1a42eebb1d55d8f8f7d60ce48359c16077d1940e.png,8C70BECF66FC47ABA454598EB903EEB7
2022-07-16T13:16:15.000Z,Oululainen Oskar bongasi trombin merellä – katso video,Oskar Saarinen katseli trombia kotinsa ikkunasta Oulussa.,https://img.ilcdn.fi/ibSxfaWIOjU371H13bJZqHXNkKo=/510x318/top/img-s3.ilcdn.fi/2e4f17650bdc5e0d12c189c8b7465ff3481eefc6da50bd1aabb50819ba462254.jpg,5320ACA7A88A479187688DD4B500F252
2022-07-16T13:18:17.000Z,Suomen koronapommi paheni – taas kaksi pelaajaa pihalla: kenet saadaan kentälle?,Suomi kohtaa Saksan EM-kisojen päätösmatsissaan. ,https://img.ilcdn.fi/xS3WZvPJ35VreCRPic5mVJj4N_M=/510x318/top/img-s3.ilcdn.fi/dbc7ad7c4b42c1e8f7f514b12bd44133d820c3cda5629d856b008f402aab7201.jpg,06E643B012E74D0E9AFD57A4FC88D349
2022-07-16T13:26:03.000Z,Tältä Britney Spears kuulostaa nykyään: jakoi uuden version jättihitistään,Britney Spears laulaa tuoreella videollaan ...Baby One More Time -hittikappalettaan.,https://img.ilcdn.fi/-C6XqNXbY5o2rKj_Rp6m2hdfaBA=/510x318/top/img-s3.ilcdn.fi/d43487ba4305381918414980206c7994a7d8906d91501b3846c79a813db5006f.jpg,BCA19C7536444CEE8C3EE55B8430C4BA
2022-07-16T13:29:13.000Z,Poliisi selvittää: Nuorten väkivaltaiset tappeluvideot leviävät sosiaalisessa mediassa,Nuoret ovat järjestäneet tappeluita ja käyneet porukalla yksittäisten henkilöiden kimppuun aiheuttaen vaarallisia kohtauksia.,https://img.ilcdn.fi/cfQKkx7IUKFClvZJmubpkX2w58g=/510x318/top/img-s3.ilcdn.fi/4b02d3b834a8ea380d73eb94f65464754bdd391dd1ea93fbef8a419c3a298a1a.jpeg,BCD032444E044164BC438591F2039111
2022-07-16T13:50:17.000Z,Kesän käytännöllisin vaate villitsee – tähän trendiin sinäkin haluat ottaa osaa,"Mikä sen ihanampaa kuin viettää pitkää kesäpäivää rennossa, mutta silti äärimmäisen trendikkäässä lookissa. ",https://img.ilcdn.fi/CfjxGMXX_YKmDUA3W7b9Olp7th8=/510x318/top/img-s3.ilcdn.fi/538f135b6c10628582ba8578189458603aac3c222aad2a6e87b4da115da89b92.jpg,73DFD47D9E0A4A30AE7D3CD2EB616768
2022-07-16T13:50:48.000Z,Ukrainalla on valtavia vaikeuksia vastahyökkäyksissä – 5 syytä miksi Venäjää ei saada työnnettyä rajojensa taakse ,"Ukraina ei pysty nykyisillä voimillaan vapauttamaan kaikkia miehitettyjä alueita, mutta toisaalta Venäjä ei kykene valtaamaan koko Ukrainaa.",https://img.ilcdn.fi/Ha8S-pPcGMVqNNYpEnExFf-9Ckc=/510x318/top/img-s3.ilcdn.fi/7c88aa80fe6bc05c738a5f32c663a37dd5948ab1e1344ae5f4c30be0908a1542.jpg,2B61938C7D1D46369A20682AE95E10DD
2022-07-16T14:20:19.000Z,Kammottava lemu pakotti tamperelaisnaisen muuttamaan pois omakotitalostaan – rakenteista löytyi haisevia yllätyksiä,Omakotitalon ostanut nainen joutui muuttamaan pois kodissa velloneen viemärinhajun vuoksi.,https://img.ilcdn.fi/E-CrAa07ZGQweUvdO0NOToiznzw=/510x318/top/img-s3.ilcdn.fi/b8d63928d2b4a0a5bd14e425f30ef49374829766d6bf7e0d529b88094e3939f0.jpg,908E3BE74CC64409822964EF643056F1
2022-07-16T14:47:37.000Z,Instagram julkaisi tilauspalvelun – julkaisut näkee vain maksamalla,Tilausten myyminen on mahdollista tällä hetkellä vain yhdysvaltalaisille sisällöntuottajille.,https://img.ilcdn.fi/LQQjMWm-o44HK6fKci-ATZyiDIk=/510x318/top/img-s3.ilcdn.fi/1fed90bbcce7102d4daf61274404119c75e22b35248bbc0eaa652d2fb7ccf554.jpg,F427BFB7DD5447CFBF4AF184159C1F0D
2022-07-16T14:53:44.000Z,Muistatko kesähittien lyriikat? Tee testi!,Selvitä kesähittitietämyksesi hauskalla testillä. Varoitus: saatat saada testistä korvamadon.,https://img.ilcdn.fi/H7OCd1PcFq3ICWSz-hbM1v4AO3k=/510x318/top/img-s3.ilcdn.fi/b04717d464c1fb6411bc92987c5420e3ff53cc7924685e93e89bf403555389f5.jpg,D8CF1221862B4A63AA8456FECD488D8B
2022-07-16T15:01:01.000Z,Ugandalaislehti: Ugandalainen nainen on tuomittu 30 vuodeksi vankeuteen suomalaisen liikemiehen murhasta,Naisen vankeustuomiosta kertoo ugandalainen New Vision -sanomalehti.,https://img.ilcdn.fi/9WeRNGhFrqMtvYZmq6SoSojPpiM=/510x318/top/img-s3.ilcdn.fi/2c5223bb3c1c0cc0ae5eb26285dac9b97f75722614d39610844e2db3cae340f9.jpg,D6CC0FB1A53E4D118ABA2F377715E39E
2022-07-16T15:12:58.000Z,"Senni Salmisen ja Kristiina Mäkelän välit puhuttavat: ”Senni, vihaatko sä mua?”",Loikkaajat kuittaavat väitteet viileistä väleistä puppuna.,https://img.ilcdn.fi/B0SSV7HETxMlQMQwzqCbp4CrDW0=/510x318/top/img-s3.ilcdn.fi/7609ba657d23f53a93fd447b34a2d27b946a17a1c2b9d672e50d86469dbcdb14.jpg,AA00492AB9194E7889E14AF4416085F5
2022-07-16T15:53:16.000Z,Susi vei koiran kotipihalta Sastamalassa – löytyi raadeltuna pellolta,"Riistanhoitoyhdistys muistuttaa, että koiria tulisi aina valvoa, mikäli alueella on tehty susihavaintoja.",https://img.ilcdn.fi/3PHtJ6gUrIwARq58EPn3UzLUdIc=/510x318/top/img-s3.ilcdn.fi/32b50c1cb57fde2bca62fc78f417c6f5c5c392e3aa566ad47efb20839dae4914.jpg,7A53920E18F14783830EE9D1DFBAF00A
2022-07-16T16:13:48.000Z,Ylen juontaja Janne Grönroos sai lapsen: suloinen kuva julki,Janne Grönroos on nyt isä.,https://img.ilcdn.fi/OE_gJOAZpjqPMSHsqRL_Wm8prmY=/510x318/top/img-s3.ilcdn.fi/419ae4a1d78cd02d22658503231fa43721bdf97690f992bb0ed2076a3cf36b00.png,5F6DAD0E702E434C977B65BF2E7866F7
2022-07-16T16:38:42.000Z,Alligaattori ilmestyi puistoon - amerikkalaismieheltä jäätävä reaktio ,"Puistoon ilmestyi alligaattori Georgiassa, Yhdysvalloissa.",https://img.ilcdn.fi/i8AUA0-5S8ec1yXGg9Ztv4sWXQ0=/510x318/top/img-s3.ilcdn.fi/1b693415431d4491a8686141acaf49efa53db5a747e44e2fa3d150588e70f574.jpg,F62DBD90597E448194B3B2B1DE7E98D3
2022-07-16T16:54:19.000Z,Ukraina teki oman versionsa suomalaisesta tunnetusta sotalaulusta – kertosäkeessä tylyt terveiset Putinille,Suomalaisen talvisodan aikaisen musiikkikappaleen Molotoff on vaihtunut Ukrainan versiossa Vladimiriksi.,https://img.ilcdn.fi/_J39Ou7zfW0HKYH2SdwOAmrFh4o=/510x318/top/img-s3.ilcdn.fi/a972d6851f678aaa54e9f14122b1d2233d318cb7d3c1b5429a7613b820ab70c7.jpg,D1D16AEC7C424F1686CE6554F362E6C9
2022-07-16T17:09:54.000Z,IL seuraa: Kristiina Mäkelä loikki ennätyksensä! Suomalainen upeasti MM-finaaliin,Iltalehti seuraa yleisurheilun MM-kisoja läpi yön.,https://img.ilcdn.fi/LImm0afF3KNDpWaZZGwCMYYsZdw=/510x318/top/img-s3.ilcdn.fi/1d72732e1dcda2b49579fa9fb20862ee6229f41dc617e8e33f5748ac0a0d2410.jpg,FF3C0F2A9B6042A3A4168DE247B83CBB
2022-07-16T17:13:05.000Z,Esapekka Lapin ulkonäkö villitsi selostajat – suomalaista verrattiin Boris Johnsoniin,Esapekka Lapilla on ollut hikinen urakka Viron MM-rallissa.,https://img.ilcdn.fi/IAtziVeN_1EfLe1dVGuWMMKIQj8=/510x318/top/img-s3.ilcdn.fi/80738e354fdcfbaf045e82921a709d1eb76d20867e546d703e4f1781c13a8a6d.jpg,ED782E6EA0C843A1A1730B7732B5E400
2022-07-16T17:18:24.000Z,Autofanien unelma: Hyundai N-vetyhybridikonsepti lyö yli 500 kW takapyörille,Seksikäs 70-luvun coupé-konsepti kaivettiin naftaliinista tulevaisuutta edustavalle sähkön ja vedyn yhdistävälle hybridivoimalinjalle. Tässä on Hyundai N Vision 74.,https://img.ilcdn.fi/ugIglxH8FDFd7GA_wS7vCifaWFU=/0x0:2663x1663/510x318/top/img-s3.ilcdn.fi/a6338795ea88a741cc05d51a4185a72ff1bf5cad92dcd8218a76091d5f629d0f.jpg,156B6F270C2B4749BA6A12ACA5350ACC
2022-07-16T17:33:42.000Z,Pulitzer-palkittuun sotakuvaan ikuistettu ”napalmtyttö” sai arpiinsa viimeisen kerran laserhoitoa – tältä hän näyttää nyt,Vietnamilaissyntyinen Phan Thi Kim Phuc loukkaantui pahoin napalmiskussa 50 vuotta sitten.,https://img.ilcdn.fi/78pJ3K8CfrRoZs219yTMm-yODFQ=/510x318/top/img-s3.ilcdn.fi/6907b8d39e51b2fe4a64e1cb4cb32546f89a0b993890aa834630bd74cce05d9b.jpg,74B7C68A375443B09697E364435CCADF
2022-07-16T17:57:05.000Z,Olympiavoittajaa epäillään dopingrikkomuksesta – lensi pihalle MM-kotikisoista,Randolph Ross ei pääse juoksemaan kotikisoissaan. ,https://img.ilcdn.fi/AJxIhUCFUGWE6axNrT7vrLGrMvQ=/510x318/top/img-s3.ilcdn.fi/085816ba61348234678c5eb329fc84bf3c0ac735cfde3a1c43e2f0036e1e0c11.jpg,B7614743E9B64621A048924CE4E05538
2022-07-16T18:01:38.000Z,"Urakoitsija ryssi kattoremontin, asiakkaalle jättilasku – asiantuntija: ”Kohtuutonta”","Imatralainen Ilkka Heikkinen tilasi kattoremontin ja kaikki meni pieleen.  Kilpailu- ja kuluttajaviraston johtava asiantuntija Raija Marttala sanoo, että aukottomasti kuluttaja ei voi riskejä välttää, mutta niitä voi pienentää.",https://img.ilcdn.fi/gHD7qleOTmtGmZrh-Um0md__X5g=/510x318/top/img-s3.ilcdn.fi/c6916c6fc34dc65069a7ba1db4f913d218d4c49bdbb070f8c6f38490f1e2000b.jpg,ED7319149F1649ECA104E70CEB2B2D42
2022-07-16T18:05:26.000Z,"Kirjaväite: kuningatar Elisabet helpottui, kun Meghan ei saapunut prinssi Philipin hautajaisiin",Uusi paljastuskirja käsittelee Harryn ja Meghanin välejä brittihoviin.,https://img.ilcdn.fi/gjFWr5M2NPhFUMcxFUosCkf9g5U=/510x318/top/img-s3.ilcdn.fi/90abd56f8fecaa8d3c9d52f30b1ac7ad88ed67e0fe09c7829ec8176e12761251.png,A39C764A3A6043B7AEF0F14B047E9E5E
2022-07-16T18:09:32.000Z,Jari-Matti Latvalalta tiukka analyysi Kalle Rovanperän hirmuvauhdista,Kalle Rovanperä oli täysin omaa luokkaansa Viron MM-rallin lauantain erikoiskokeilla.,https://img.ilcdn.fi/N4lfoDB1WGR1f7K5evLUwZ2v85I=/510x318/top/img-s3.ilcdn.fi/3bff7a425ae98a5f93c3e320d8f15192307b37166092c0759ab5439ec2856fcd.jpg,554FAE1C493C466EB49D5EBE4C3C8230
2022-07-16T18:20:41.000Z,IL seuraa: Tuleeko kylmää kyytiä? Koronan runtelema Suomi päättää EM-urakkansa Saksaa vastaan,Helmarit lähtevät Saksa-otteluun vahvana altavastaajana. Peli alkaa kello 22.,https://img.ilcdn.fi/mPyN8gd3ldmr8-JginU-PRkiCzg=/510x318/top/img-s3.ilcdn.fi/1cfaa17dd1021418560db1f8c7727c12ccdfd2381e370f3f194319abba286229.jpg,242A81DB0F694F2DB76F5C30309A3040
2022-07-16T18:22:17.000Z,Naisten futiksessa järkyttävät tasoerot – ratkaisu löytyy Pepsi-pullosta,"Englannissa rikottiin jo EM-futiksen yleisöennätys, kirjoittaa Janne Palomäki Milton Keynesistä.",https://img.ilcdn.fi/fG9qxCsHFQVz63vj1wpthHltl6s=/510x318/top/img-s3.ilcdn.fi/5aad83850b72bfcf3be0bb199be59925f107979ef6c37be2cbbc67977004bc42.jpg,FE30E3DE980D4F7BA74F5E0D853C953E
2022-07-16T18:59:17.000Z,Potilas jäi ilman asianmukaista hoitoa ja halvaantui – ylilääkäri perusteli kiireellä,PVK:n mukaan aivojen laskimotukoksen toteamisen viivästyminen vaikutti todennäköisesti hoitoon sekä sairaudesta paranemisen ennusteeseen.,https://img.ilcdn.fi/tSrpJeO26rFIhwDIbQmCzzqI5P4=/510x318/top/img-s3.ilcdn.fi/91da64ef7f8898e9fb07023665466bf57336e9eeb4da4bb2ad0f3e9908d84e1b.jpg,63D973A3B7054E6C8FAAB19F42380024
2022-07-16T19:23:44.000Z,Kristiina Mäkelän upea ennätystulos muutettiin: ”Oli paha olo”,"Ennen loikkakarsintaa huonosta olosta kärsineen suomalaisen ennätyksestä lähti sentti pois. Karsintatulos on 14,48.",https://img.ilcdn.fi/w9-lFGX9Bnmj3NGfDtZFJ6a6Ugg=/510x318/top/img-s3.ilcdn.fi/1415a2e87faf37df9f83e0855bd3ccc35eb45d14a0b6177c424053e08523936f.jpg,3215DC0ED493480EB89FCF939D005E19
2022-07-16T19:56:15.000Z,"Murtunut Ella Junnila itki: ”Mitä se höpöttää, kun se ei hyppää paremmin”",Korkeushyppääjä ei päässyt MM-finaaliin.,https://img.ilcdn.fi/LiN7TPIDYCkoXsE4TrPduKrq8B0=/510x318/top/img-s3.ilcdn.fi/5c5a4370b3c0d87808b72fe20a720b5b2289e09e5a13eb5bb9d4b7bf04309639.jpg,CF084F073472443592702957FC65E588
2022-07-16T20:02:09.000Z,"Video: Yksikätinen venäläistaistelija räimii singolla pitkin taivaita – ”toivon, että tämä on vitsi” ",Video on sota-asiantuntija Emil Kastehelmen mukaan erikoisin pitkään aikaan.,https://img.ilcdn.fi/p-HSDc_du1YMzvHs4rbWV8GCuvw=/510x318/top/img-s3.ilcdn.fi/678bfb3346e1d310f549529c632bb0733c9d462e9f6975e79b4541d0869a718a.jpg,819C496A60DE4351BBC1616DEFC4C172
2022-07-16T20:20:21.000Z,"Mitalia hakeneelle Senni Salmiselle takaisku: ”Eniten olen iloinen, etten ole kuolemaisillani”",Loikkaaja otti karsiutumisen MM-finaalista rauhallisesti ainakin median edessä.,https://img.ilcdn.fi/cx0sG_rvgzjDRpzwcOaCFg96LPE=/510x318/top/img-s3.ilcdn.fi/4d4ada01271a59eb7fb01ee097c2eba8a5be142ebf0ed7cb02a3171c54fbfad5.jpg,C1A69D4AAC6D441DB139A904A55DB859
2022-07-16T20:46:42.000Z,Juoksija sukelsi pää edellä vesiesteeseen – Ylen lähetyksessä säikähdettiin: ”Oho!”,Lea Meyer kaatui pahasti yleisurheilun MM-kisoissa.,https://img.ilcdn.fi/7LizXc_LTFFLd33o5mLSvFiDi1c=/510x318/top/img-s3.ilcdn.fi/8b7d8212e95a3e503eae925dc3f869e98fe927415a97f459eca8c62e847bf2ff.jpg,5531D100040F49AA8AB7FAE4C59C4950
2022-07-16T20:58:34.000Z,Suomi–Saksa-ottelun Leijonat & lampaat: ”Juoksi kahteen suuntaan keuhkonsa pihalle”,Suomi–Saksa 0–3.,https://img.ilcdn.fi/wUqgDOOpfINNnvRutkL2FiUuwCQ=/510x318/top/img-s3.ilcdn.fi/fa97625b92a0f8814ed7bd0de71a1f8490da166965634f84fab4d77f4d9f0931.jpg,67038B056D7A4AFF9F552B233F5CA59F
