paivamaara,otsikko,tiivistelma,kuva
2019-04-02T11:01:56.000Z,Lehtiväite: Prinssi Andrew ja Sarah Ferguson palasivat yhteen - yksityiskohta lomalta herätti huhut romanssista,Vuonna 1996 eronnut herttuapari lomaili Bahrainissa F1-kisoissa Beatrice-tyttärensä kanssa. Hovi on kiistänyt suhdehuhut.,https://img.ilcdn.fi/IEvjqKk5XkE7xX2B7oSHppFYP9o=/510x318/top/img-s3.ilcdn.fi/9c600b9a9ba8cbab130d51c152c8cab866a928472f15e1dd475c57114eb12f9a.jpg
2019-04-02T11:02:19.000Z,KSML: Matti Nykäsen omaisille toimitettiin olympiarenkaat hautakiveä varten,"Matti Nykäsen läheisille on toimitettu olympiarenkaat hautakiveä varten, Keskisuomalainen kertoo.",https://img.ilcdn.fi/tknnAEYEot7BPs7VYBWPHlJRURI=/510x318/top/img-s3.ilcdn.fi/1c6091e0fdae8405108355a5cf4f4916dd6af72a0150c99c57b5bef4c58fc604.jpg
2019-04-02T11:10:50.000Z,Michael Jacksonin Suomessa asuva veljentytär tyrmistyi kauhudokumentista - puolustaa setäänsä IL:lle: ”Perhe kärsii nyt raskaasti”,"Michael Jacksonin Suomessa asuva veljentytär Autumn Jackson sanoo, ettei tänään Ylellä nähtävä Leaving Neverland -kohudokumentti todista mitään.",https://img.ilcdn.fi/_l1HrNB8lkGrOSJdPAvrp_YIBv0=/510x318/top/img-s3.ilcdn.fi/8a5c0b0f37ce896b27f3ba72fdd43a06c88a0bae1dcf12195ec1ad2933f54702.jpg
2019-04-02T11:20:17.000Z,"Maailman matalin naisääni ei suostu lähtemään seksipuhelinuralle – katso, miten ennätyksiä rikkonut ääninäyte tallennettiin",Walesilainen laulaja rikkoi matalimman naisen laulaman nuotin maailman ennätyksen.,https://img.ilcdn.fi/FEJujQq3NX_yFlgox2gOWpYzstA=/510x318/top/img-s3.ilcdn.fi/ca082b989afbcacc7516e211e01d3c8d715915cb7ebb41ebf95f3bee39c0af17.jpg
2019-04-02T11:23:19.000Z,Tampere laittoi historiallisen arvorakennuksen Tammerkosken rannalla myyntiin lehti-ilmoituksella: ”Hintaa en edes lähde arvioimaan”,"Tampereella Tammerkosken putouksen vierestä kaupataan kulttuurihistoriallisesti arvokasta, tiilistä Frenckellin tehdasrakennusta.",https://img.ilcdn.fi/tr9JUL9_H35lOlauax5pOTfQCQk=/510x318/top/img-s3.ilcdn.fi/50992d2895538e3f8392b05d41e49ba7ccb3dece1f2a5155d859af3f39631bfb.jpg
2019-04-02T11:54:10.000Z,"Näyttelijä Johannes Holopaisen raju muodonmuutos: hiustyyli uusiksi, kova punttikuuri - vertaa kuvia!",Palkittua Kaikki synnit -tv-sarjaa tähdittävä näyttelijä Johannes Holopaiselle uravalinta kirkastui jo 9-vuotiaana.,https://img.ilcdn.fi/nkfRjqNTVXlCHpV3W7CB204R4-E=/914x195:1973x864/510x318/top/img-s3.ilcdn.fi/6247988088f771baad2c8c5fe789057312c27763326fe6edd1f288c98a58229c.jpg
2019-04-02T11:59:56.000Z,Aivovamman saaneita huippukiekkoilijoita valokuvattiin - suomalaistaiteilijalla iso huoli nuorista: ”Jätetään oman onnensa varaan”,"Helsingin Musiikkitalolla avautuu huhtikuussa valokuvanäyttely, jossa tunnetut suomalaiset ja kansainväliset kiekkoilijat kertovat, kuinka elämä muuttui taklauksesta syntyneen aivovamman seurauksensa.",https://img.ilcdn.fi/-1DKYPb9QEAl-CokL8hu4OyhZxA=/510x318/top/img-s3.ilcdn.fi/0d9d231107dc21e182586a25f7f3fde887f09495aed0460c2d0094bded916567.jpg
2019-04-02T12:12:57.000Z,Sipilän ex-avustaja Riikka Pakarisella “ei mitään tekemistä” bioyhtiön kanssa – paitsi lapsi ja äiti olleet osakkaina,Panimoliiton toimitusjohtaja Riikka Pakarinen ei suostu kertomaan perheenjäsentensä omistuksia valtion tukemassa bioyhtiössä. Yhtiö ei anna ajantasaista osakasluetteloaan.,https://img.ilcdn.fi/1JcFMtmd28xSjsQE4INoMwW3G_M=/510x318/top/img-s3.ilcdn.fi/65c7bd6b8a142705d30409a4e690e8da7b6694e57302320d202f7299b8760d48.jpg
2019-04-02T12:24:05.000Z,Voiko vanhoilla talvirenkailla ajaa kesällä jos nyppii nastat irti  - entä kitkarenkailla?,"Jopa kolmannes autoilijoista kelpuuttaisi kesärenkaiksi vanhat nastarenkaat, joista nastat on nypitty irti. Asiantuntijat varoittavat: talvirengas voi muuttua vaaralliseksi ajettavaksi kesällä.",https://img.ilcdn.fi/bt-sSxnUwc4651y1V3-rVQPkO2Y=/510x318/top/img-s3.ilcdn.fi/ef3766e1f323cbcc9a267a4f4d8e7bc374400979d6fef920e7ad30e3165d0943.jpg
2019-04-02T12:33:20.000Z,Riisuttu puoluetentti: KD:n Sari Essayahin mukaan Israel saa rakentaa siirtokuntia miehittämälleen Länsirannalle - Hyväksyy myös Trumpin Golan-linjauksen,Kristillisdemokraattien (kd) puheenjohtaja Sari Essayah osallistui IL-TV Riisuttuun puoluetenttiin tiistaina 2.4.2019.,https://img.ilcdn.fi/EBnpbnc30eoATW1Hb1Ed9Qieu8Y=/510x318/top/img-s3.ilcdn.fi/2f1922a5615f714468f38d3bacbd2c21b60d79dcc8095577d35f6ed6a19ef382.jpg
2019-04-02T12:36:54.000Z,"Kuva: Corinna Schumacher tarkkaili poikansa menoa Ferrarilla, ex-mestari ylistää pikku-Schumin vauhtia – ”Hyvin tunteikasta”","Mick Schumacher aloitti kaksipäiväiset testinsä Bahrainissa. Tiistaina hän ajaa Ferrarilla, keskiviikkona Alfa Romeolla.",https://img.ilcdn.fi/DPIQd1T_bMPi30DY563W_Dz0WI4=/510x318/top/img-s3.ilcdn.fi/371a15573ef0fc09dbd8c4aebcf1adffe12fad284c6918d3203cec59a96d06cd.jpg
2019-04-02T12:37:12.000Z,"Brittiläinen Isis-morsian Shamima Begum katuvana: ”Minut aivopestiin, haluan toisen mahdollisuuden”",Shamima Begum on nyt syyrialaisella Hawlin pakolaisleirillä.,https://img.ilcdn.fi/C1w6W-d5WqQaQlrgT42sxK9OcDA=/510x318/top/img-s3.ilcdn.fi/e49ecf1fb2703484ad8a5e9725df59fda380ace350bdeafe61fa9675a09e1b86.jpg
2019-04-02T12:42:15.000Z,Israel rakentaa siirtokuntia miehittämällään Länsirannalla - KD:n Sari Essayah puolustaa Israelin toimia ja Donald Trumpin Golan-linjausta,"Kristillisdemokraattien puheenjohtaja Sari Essayah kertoo Iltalehden Riisutussa puoluetentissä muun muassa sen, miksi KD nosti Israel-politiikan osaksi vaaliohjelmaansa ja miten Viro maksaa suurempaa lapsilisää kuin Suomi.",https://img.ilcdn.fi/S5XXwrP6PpBtB8q3HciFbYrYqLw=/510x318/top/img-s3.ilcdn.fi/554e4fec8730b2f39b0abf24a6b29febf980a5f81638b1e050b2b92149ceee78.jpg
2019-04-02T12:43:28.000Z,Game of Thrones -meemejä ja vauvan kakkaa - huippumallin perhe-elämään on helppo samaistua,Huippumalli Suvi Riggs jakaa somessa palasia perheensä arjesta ja siihen ei voi olla ihastumatta.,https://img.ilcdn.fi/_eD4GMJD8xxb0TohIGof0yh6Yd0=/510x318/top/img-s3.ilcdn.fi/624f87484a2c5176988e5b449439904aec3484609d3daae5012c37c56217b9fe.jpg
2019-04-02T12:46:58.000Z,Viimeksi kiinni jäi yli 5 000 kaahailijaa – huomenna on taas vuoden varmin päivä saada ylinopeussakko,Poliisin nopeusvalvontamaraton alkaa tiistain ja keskiviikon välisenä yönä kello 00.00 ja kestää 24 tunnin ajan.,https://img.ilcdn.fi/EVTl9ZOPlE61UNakSVlQKPWRlA4=/510x318/top/img-s3.ilcdn.fi/4c2eccfa1019f14c8ff45fd0ce54789fdbe030e62f056734c5d9402cb8ce1645.jpg
2019-04-02T13:02:04.000Z,Konkurssi uhkaa suosittua lasten liikuntakerhoa   – tuhannet tuen ansiosta harrastamaan päässeet lapset jäämässä nyt ilman harrastusta,Hyvinvointijärjestö Wau ry jätti konkurssihakemuksen eilen maanantaina. Noin puolet kerhoista on jo lopetettu.,https://img.ilcdn.fi/_qU0wFO8qN4DgJ1DqPKjrHZjU20=/510x318/top/img-s3.ilcdn.fi/6e8eb4d8d5141919f45b826dc60dedff895235e945d532daca7609491e2a9c19.jpg
2019-04-02T13:09:21.000Z,"KalPa vahvisti: Sami Kapanen jättää seuran, Sveitsissä odottaa kahden vuoden pesti - Tommi Miettinen uusi päävalmentaja",Sami Kapasen valmennusura jatkuu HC Luganossa.,https://img.ilcdn.fi/_VhsxylpD8v-mXbE4O1OGu7mWkQ=/0x49:3000x1922/510x318/top/img-s3.ilcdn.fi/82a9627ab36a6db44d58b07fda22764c8655bf598f84f4ea8d8155591215e6a8.jpg
2019-04-02T13:25:48.000Z,"Rikollinen tonki yli 20 kilon huumemottia terassin alla, poliisi varjosti ja otti kiinni: Mutta kuka on ”liettualaisen ylämies”?","Hämeen poliisi on selvittänyt Sysmässä takavarikoidun, yli 20-kiloisen amfetamiinilastin alkuperää.",https://img.ilcdn.fi/KGtIDlizPmrfNJcQQiP9us4V0_M=/510x318/top/img-s3.ilcdn.fi/0b0a42caf491c53e510d40cd3c7dc54c2c815bbfc201888c76f47632fa9d19ca.jpg
2019-04-02T13:32:29.000Z,Sebastian Vetteliä ollaan jo heittämässä ulos Mick Schumacherin tieltä - nelinkertaiselle mestarille hurjaa ryöpytystä Italiassa,"Sebastian Vettelin on saavutettava hyviä tuloksia mieluummin ennemmin kuin myöhemmin, mikäli hän haluaa palauttaa asemansa italialaisten silmissä.",https://img.ilcdn.fi/eP56PMC3X9TJqWHSzPNRUfk9r4E=/0x60:3000x1936/510x318/top/img-s3.ilcdn.fi/561c31c733efc0877bd516c2c1cc462c4fc0531c74a89f0720867e087f05ced5.jpg
2019-04-02T13:34:14.000Z,Aivan uudenlainen lääkärin määräämä resepti toisi parempaa terveyttä lähes jokaiselle meistä - haittavaikutuksia ei lainkaan!,"Yhdysvaltalaistutkijat ovat laskeneet, miten huikeasti lääkärin määräämä ruokavalioresepti vaikuttaisi terveyteen ja kansantalouteen. ",https://img.ilcdn.fi/gUZsOHZqwT_taN1Hq4FEh45ROkQ=/510x318/top/img-s3.ilcdn.fi/a921d1da5d1ffdbd5fb6cffb9e3260f007ebc41dd676a12f8460425a759d37dd.jpg
2019-04-02T13:42:27.000Z,Jääkiekon superuutinen oli aprillipila,"Kerroimme 1.4 TPS:n siirtyvän pelaamaan NHL:ään pääsponsori Tempurin ostettua sen. Uutinen oli TPS:n, Tempurin ja Iltalehden yhteinen aprillipila. TPS pysyy, pelaa ja vaikuttaa edelleen Turussa.",https://img.ilcdn.fi/nmgYKdCBNm3tRCNfqE_xFEUJNy0=/510x318/top/img-s3.ilcdn.fi/0766d176f1b48b6187c5b597e3d5b86d085ba02bb36cef8874523fa04d3d18d2.jpg
2019-04-02T13:56:40.000Z,"Mies tuomittiin raiskauksesta ja karkotettiin Tanskasta, haki Suomesta turvapaikkaa ja on taas epäiltynä raiskauksista – Migri kertoo, miten tämä on mahdollista",Suomesta turvapaikkaa hakenutta miestä epäillään Suomessa kahdesta raiskauksesta. ,https://img.ilcdn.fi/jSw2TpZO_NicMkqAKPmiU9ZLq4c=/510x318/top/img-s3.ilcdn.fi/20f0e86aefc96c6a651cdb657c75557f47c816ce935f93025cc355d263475d79.jpg
2019-04-02T14:07:59.000Z,Hyvästi avokadot ja Toyotat - näin Trumpin uhkaus sulkea Meksikon-raja näkyisi amerikkalaisten elämässä,Sulku aiheuttaisi ison iskun Yhdysvaltojen teollisuudelle.,https://img.ilcdn.fi/iyxVSdwkeF5vmGsLxKafbIKfdSI=/510x318/top/img-s3.ilcdn.fi/f6a82e5b225eddcea69736b8dde38e7d05f1d5dd123cd3861f9bc39085237391.jpg
2019-04-02T14:12:03.000Z,Povipommi Marianne Kallio: Yllätyskihlat - salihirmu kosi aprillipäivänä,Tosi-tv-ohjelmista tuttu Marianne Kallio on mennyt kihloihin.,https://img.ilcdn.fi/Wh-R8pp69rdtH0qUn_4VI2y3WvI=/510x318/top/img-s3.ilcdn.fi/9f0d910f07997a0f0c38ae3a12cdda1db0d02a529fae92fa663ed594b07b249e.jpg
2019-04-02T14:20:04.000Z,Kouvolassa meininki kuin Kummisedässä – perheen pihalta löytyi verinen hevosenpää,Kaakkois-Suomen poliisi vahvistaa Iltalehdelle saaneensa ilmoituksen verisen hevosenpään noutamisesta.,https://img.ilcdn.fi/VLupH2z2tXXGAAWZoB-bLVsvEDk=/510x318/top/img-s3.ilcdn.fi/625674eda91615c790efacb0515d6386bcdda89bc626483d1e42d0c9541f8088.jpg
2019-04-02T14:33:06.000Z,"Tämä sitruunapiirakka on syy siihen, että Teemu Aura jätti menestyvän huippuravintolan ja perusti leipomon","Ihan kokonaan ei leipomon perustamisesta voi kiittää sitruunapiirakka, vaikka se onkin Teemu Auran mukaan tajunnanräjäyttävä.",https://img.ilcdn.fi/WdE1jvM7RXUYcppEzzMGMTnuScU=/0x898:2000x2148/510x318/top/img-s3.ilcdn.fi/a46fe25d52aeced59e9d90969a445d4c95f0327d94ff399fd33781bae0ddd361.jpg
2019-04-02T14:37:50.000Z,"Naisleijonien luotsi Pasi Mustonen lataa kovaa tekstiä - ehdottaa miehille uusia sääntöjä Pitsiturnaukseen: ”Sitten huomattaisiin, että jukolauta!”","Pasi Mustonen ei epäröi sanoa ääneen, mitä hän ajattelee.",https://img.ilcdn.fi/fNpPIavO2cXK16wL_RzRhjCovqc=/510x318/top/img-s3.ilcdn.fi/30335cfd440a65336bb40b2e63ddcb5bc57bb0a389c4b31f479a842a57be509c.jpg
2019-04-02T14:48:44.000Z,Tiina petti miestään ja tuli raskaaksi: Pekka kasvatti poikaa 12 vuotta omanaan – nyt Tiina kertoo miten kaikki tapahtui ja paljastui,"Tiina eli 12 vuotta karmeaa kaksoiselämää. Hän tiesi koko ajan, että poika ei ole hänen miehensä, vaan nuoruuden yhden illan hairahduksen.",https://img.ilcdn.fi/RaUqW79HrjhkA3D7emN-waqIwdo=/510x318/top/img-s3.ilcdn.fi/047250a16e36dd2ddc120e843a711d7db63fcd2b79a5c4a777812a2d97548eb1.jpg
2019-04-02T15:00:00.000Z,Illinoisin osavaltio kielsi Sonyn Aibo-robottikoiran myynnin – haluaa estää kansalaisten vakoilun,Osavaltion biometristen tietojen tietosuojalaki estää robottikoiran myymisen.,https://img.ilcdn.fi/BmgmreiTeifOCOOPdzV3f1Uxt5I=/510x318/top/img-s3.ilcdn.fi/dba75bc8f353ef6b14a32de4f702fe3d230c7f59726e48e0573076e1c0ebd711.jpg
2019-04-02T15:00:01.000Z,"Euroviisujen esiintymisjärjestys paljastettiin - Darude vältti kaikista pahimman, Ruotsi laitettiin mainiolle paikalle",Darude esiintyy Tel Avivin Euroviisujen ensimmäisessä semifinaalissa kolmantena.,https://img.ilcdn.fi/em9afuKTxBY-MybbLQvxPfzugj4=/510x318/top/img-s3.ilcdn.fi/4743c679e31be1a7c7b436dcd0aff3c74fad46b7510186a758b85661f78c491e.jpg
2019-04-02T15:07:13.000Z,"”Meidät on lähes pakotettu sairastumaan astmaan” - Norjalaishiihtäjä lataa kovaa tekstiä FIS-pomoille, vähättelee keskustelua herättänyttä lääkeasiaa","Norjalaiset hiihtäjät ovat huolissaan siitä, miten maastohiihdon maailmancup-kalenteri paisuu.",https://img.ilcdn.fi/wXtZK5kLlC0EEnZLEWEBv5CZ6y4=/0x0:3000x1876/510x318/top/img-s3.ilcdn.fi/12192954e2bf94c66d1eb34151760d1e7a3045db839891e8174563a92a2eb40c.jpg
2019-04-02T15:07:20.000Z,"Kuin Linkedin, mutta ilman miehiä – ruotsalaiset Aleksandra ja Sofia loivat vain naisille suunnatun urasovelluksen, koska meidän pitäisi tukea toisiamme",Lukuisissa kaupungeissa ympäri maailman toimiva Her Global Network -verkosto haluaa auttaa naisia verkostoitumaan.,https://img.ilcdn.fi/d6WpPzi-d2S2I79_oSXSSWnGO7M=/510x318/top/img-s3.ilcdn.fi/0ac32eadc3d9aefaacda050ecc83a93ce0d68518ff86ea9515d45e0e57ffddf6.jpg
2019-04-02T15:11:35.000Z,Kalifornialaismiehen uhkarohkea teko: nappasi tiukasti ryöstäjän haulikosta kiinni kesken aseellisen ryöstön,Vaarallinen tilanne tallentui valvontakameran kuviin.,https://img.ilcdn.fi/GDGg8u6p-8T7BLykBTXqKEvBhSM=/510x318/top/img-s3.ilcdn.fi/672a43aa04aa106d09ae37ce25bfc1d5eb87a845231ec769b92c66b00a09de97.png
2019-04-02T15:34:16.000Z,Bachelor-Christoffer antaa tänään ensimmäisen suudelman: ”Ylitti kaikki odotukset”,"Bachelor Suomi -ohjelmassa tunnelma tihenee, kun Christoffer ryhtyy suutelemaan. Mutta kuka on ensimmäinen suudeltava? ",https://img.ilcdn.fi/mM9HpKlVvtSSFN6jwmkl4nM7wh4=/510x318/top/img-s3.ilcdn.fi/52c459d043380d255dda3d74bf729494a1a7f61911fc45b94e618ac4093e284e.jpg
2019-04-02T15:36:20.000Z,"Kysy itseltäsi 4 kysymystä, niin onnistut paremmin työnhaussa","Uravalmentaja Pilvi Nybom muistuttaa, että omaa työnhakuaan voi parantaa koko ajan.",https://img.ilcdn.fi/ZJe6q3y1ql23QNflPteoGlDBo5M=/510x318/top/img-s3.ilcdn.fi/2d4091606c9475c9317459d7a471eda2dbd22e6214c16126d7d1bbae9b9a4213.jpg
2019-04-02T15:47:19.000Z,Iltalehti Amsterdamissa: Ford paljasti -  isoa Explorer SUVia aletaan tuodaan Eurooppaan,Ford aloittaa isoimpiin ja järeimpiin SUV-malleihin kuuluvan Explorerin tuonnin Eurooppaan ja  sen nähtäneen myös Suomessa. Ford julkisti tiedon Go&Future -tapahtumassaan Amsterdamissa.,https://img.ilcdn.fi/2qFeEYP_1NoIvUkOMBBdrvVpmZE=/510x318/top/img-s3.ilcdn.fi/8e2266e3c62690e7aa72f7ca1861701e5178de82d50520a80aa9a9e2538f7665.jpg
2019-04-02T15:49:51.000Z,Britannian poliisi tutkii kahta löytämäänsä ”laitetta” – epäilee brexitin innoittaneen raideliikenteen sabotointiin,"Britannian liikennepoliisi korostaa, ettei tarkoituksena ilmeisesti ole ollut infrastruktuurin tuhoaminen vaan liikenteen häiriköinti.",https://img.ilcdn.fi/ZdhcneLb7mK0ROHeEm6PR4g0yNI=/0x64:3000x1940/510x318/top/img-s3.ilcdn.fi/98e7756094e8e247b79299ca1f7808a00036e87a20b372fc8ae84104978e2a96.jpg
2019-04-02T15:53:36.000Z,"Max Verstappen pilasi F1-romantikkojen päivän viime hetkellä, Mick Schumacher testien toiseksi nopein - tuloslista huvitti: ”Vuosi 1994, oletko se sinä?!”",Sade sotki tiistaina Bahrainissa ajettuja F1-testejä.,https://img.ilcdn.fi/mtRTSch9Aa-A1NfFHu-KiEd190I=/0x8:3000x1884/510x318/top/img-s3.ilcdn.fi/632073a23793ddef626b5da3a3ad946659e4518810b80d36d71af7165c9118cf.jpg
2019-04-02T16:00:00.000Z,"Niina ajaa autolla, jossa on ""milffirekkari"" - tällainen on ronski, korkokenkiä rakastava savolaisnainen",IL-TV:n Elinvoimaiset -realitysarjan ensimmäinen jakso on nyt julki. Jaksossa seurataan kenkäkauppiatar Niina Styrmanin elämää.,https://img.ilcdn.fi/1Ws4-EPy_G3nZq_84EOvaqTi7qo=/510x318/top/img-s3.ilcdn.fi/5ffdee26aaf8542973c5e246930039ad318cc0bd5fa575d9a465c784c56afe52.jpg
2019-04-02T16:08:00.000Z,Pullo viiniä viikossa vastaa puolikasta tupakka-askia - etenkin naisille vaikutus voi olla kohtalokas,"Viinipullo viikossa on verrattavissa puolikkaan tupakka-askin polttamiseen, ja lisää syöpäriskiä yhtä paljon, ilmenee tuoreesta brittitutkimuksesta.",https://img.ilcdn.fi/XVR-kSMgfx6CEoY-49ZoApY3xzw=/510x318/top/img-s3.ilcdn.fi/1722247e827312b92c62aae7bd87b52863b502696005bd3d0acf21aeb68af919.jpg
2019-04-02T16:20:40.000Z,Helsingin Hämeentiellä ryöppyää vesi valtoimenaan - koko Kauppahallin kellari veden vallassa: ”Iso runkovesiputki poikki”,Iltalehden lukija kuvasi veden vyöryä tapahtumapaikalla.,https://img.ilcdn.fi/CMcJLZH66V5eAyRBu6C8MSzFT0c=/510x318/top/img-s3.ilcdn.fi/fab6cd48f1c5e436067f9103ccd9e8192afef781a842b441c3953d121d1e9a99.jpg
2019-04-02T16:35:27.000Z,Eripuraa lietsonut tähtihyökkääjä vapautui koirankopista - tylyä tekstiä laukoneen valmentajan puheet muuttuivat kahdessa päivässä täysin: ”Arvokkaampi kuin Ronaldo ja Messi yhteensä”,"Mauro Icardin ja Interin erimielisyydet tuntuvat olevan ohi, sillä argentiinalainen on nimetty joukkueensa kokoonpanoon keskiviikon Genoa-otteluun.",https://img.ilcdn.fi/8il6TmrifiQftLjiVvccqHdVp5Y=/0x8:3000x1888/510x318/top/img-s3.ilcdn.fi/104e26bac2cadbc6397d752350caf97e005b142497e593ce77e6d6e029c6effe.jpg
2019-04-02T16:43:11.000Z,Teemu Hartikainen uskomattomassa vireessä: teki kahdella tavalla historiaa ja nousi pudotuspelien pistepörssin ykköseksi!,Suomalaishyökkääjä tekee kovaa jälkeä KHL:n pudotuspeleissä.,https://img.ilcdn.fi/_bIjq7TBUbx9wigJK9ItFzLR6Ok=/510x318/top/img-s3.ilcdn.fi/8403a1cef620a8f7639aa101ef49cac7770358e0ea7ed59a4a9d9150311657bb.jpg
2019-04-02T16:55:03.000Z,TIS-kohupari Janne ja Jonna eivät joulukuussa tienneet edes toistensa sukunimiä – asuvat nyt yhdessä ja lähtevät rakkauslomalle Espanjaan,Janne vaihtoi Tian Temppareissa lennossa Jonnaan. Tässä suhteessa mies aikoo oppia pitämään puolensa.,https://img.ilcdn.fi/TKw6Rp9SrGpFZwzRpvg6LKxTxU8=/510x318/top/img-s3.ilcdn.fi/03d919711792bb439aebe88028a0e26ed9c0b2dd04a49e47dcc171c80e38d148.jpg
2019-04-02T16:59:56.000Z,Nyt on ysäriä! Takavuosien pissishuulet ovat täällä taas - nämä meikkikuvat tuovat muistoja mieleen,Tyttömäisen suloinen huulikiilto tekee paluun meikkipussiisi. ,https://img.ilcdn.fi/1b3WSY3m_MZQG_rhb7TrLAPwx1M=/510x318/top/img-s3.ilcdn.fi/c22318f1cd109e8cd2d513b5c828811f876c4ebb39e92264af40ca04a1aa1fc0.jpg
2019-04-02T17:00:00.000Z,Lähtikö keräily käsistä? 20 000 konsolipeliä keränneen teksasilaismiehen kotona ei seiniä näe – katso video,Teksasissa asuvan miehen kokoelma sisältää yhteensä 20 139 peliä.,https://img.ilcdn.fi/HVroy_VwE5EA2AhuAOPtm7vQ70E=/510x318/top/img-s3.ilcdn.fi/53f870ddb319c0cf0e8cc1b107b33cc9cb58dadb537c67f6d0fe5cded6bf4b21.jpg
2019-04-02T17:00:31.000Z,Lindsey Vonnin julkaisema video kerää katseluja hurjaa tahtia - höpisee lääketokkurassa: ”Äitini syöttää minulle kultakaloja”,"Tähän kauteen uransa päättänyt alppitähti Lindsey Vonn, 34, kärsi huippuvuosinaan lukuisista vammoista.",https://img.ilcdn.fi/021fuZib5XVob17UCKvG3G1XM2k=/510x318/top/img-s3.ilcdn.fi/25966a2809039521f840754665e2bb7adad24954c0939fd0c943226b9b8e6b79.jpg
2019-04-02T17:21:18.000Z,"Amerikkalainen Katelyn, 26, laihdutti noin vuodessa yli 100 kiloa – kerää nyt joukkorahoitusta ihon poistoleikkaukseen",Katelyn Broughton onnistui pudottamaan lähes puolet painostaan 15 kuukauden aikana.,https://img.ilcdn.fi/xUbXCpFq5p-DSFyvnctfuQO_n4Q=/510x318/top/img-s3.ilcdn.fi/b25470ded105dbd32d4b444b811c7dd7e2dd0e9b28c63e90b711469d849c1ab9.png
2019-04-02T17:26:05.000Z,"Syy Sebastian Vettelin etusiiven irtoamiseen varmistui, kipinät sinkoilivat erikoisessa tilanteessa",Bahrainin GP meni Sebastian Vettelin osalta pilalle 38. kierroksella.,https://img.ilcdn.fi/5glLcnZz0pSi2corbVB7XOAvDtw=/0x104:2677x1778/510x318/top/img-s3.ilcdn.fi/c3dfccfd54a48c27cbb2839a9f71612968a5c5039520521e8f3837536996fe6f.jpg
2019-04-02T17:27:12.000Z,"Mainiota kevättä, suomalaiset! Koko huhtikuu on tavanomaista lämpimämpi ja vähäsateisempi",Kymmenen plusasteen lämpötilat paukkuvat tällä viikolla Etelä- ja Kaakkois-Suomessa.,https://img.ilcdn.fi/vEMRMGf9a8mjAWjI_l1U5UYn_V4=/510x318/top/img-s3.ilcdn.fi/dd8ea890e263e3d8040f9e52940d758c8d6f23ccda2cc4ebaa51660abcbceb85.jpg
2019-04-02T17:30:09.000Z,Theresa May: Britannian haettava EU:lta jälleen lisäaikaa brexit-neuvotteluille,"Britannian pääministeri Theresa May tarjoutui istumaan neuvottelupöytään opposition kanssa, jotta maa pääsisi eroamaan EU:sta sopimuksen kera.",https://img.ilcdn.fi/4TtmWMSumaqmHEBvsr-tmtVMa-M=/0x33:1560x1009/510x318/top/img-s3.ilcdn.fi/52c0052e724744975b513bea36f9caf9af8fc2d75bf423de52be76d75aae92aa.jpg
2019-04-02T17:33:44.000Z,"Ahdistavaa hiippailua, erikoisia selityksiä: Selkäpiitä karmiva huijari piinaa turkulaisia - ”Hän vaikutti jopa liian kiltiltä”",Useat turkulaiset vuokra-asunnon etsijät ovat joutuneet saman omituisen huijarinaisen armoille.,https://img.ilcdn.fi/uBjKbYwhLP34haVF0Foxk9rvb7Y=/510x318/top/img-s3.ilcdn.fi/c632166d8b033baf325498854864359c567a2ffc018d28948179aa45557c8950.jpg
2019-04-02T17:41:40.000Z,Pääkirjoitus: Suorempaa puhetta hallitusvaihtoehdoista,"Äänestäjä ansaitsee avoimempaa keskustelua siitä, millaista hallituspohjaa kukin puolue ensisijaisesti havittelee, kirjoittaa vastaava päätoimittaja Erja Yläjärvi.",https://img.ilcdn.fi/CkO7EwXmDJexfGHJ_00h841IF74=/510x318/top/img-s3.ilcdn.fi/f3b09815b26e7f07cb41f938a8f1c5aafbdd468cb0b3679a6e9f37b81ce8fe3c.jpg
2019-04-02T17:41:55.000Z,6 helppoa huonekasvia - Näitä ei tapa tumpelokaan,"Listasimme helppoja huonekasveja, jotka sopivat aloittelijallekin.",https://img.ilcdn.fi/i2cZobQjTaaQkNxxKHpi7lYGkbk=/510x318/top/img-s3.ilcdn.fi/35c7b586b1cf947a130ec6d1feba44d55bdbc9e0c14a8c88714ef89b2a07e8d2.jpg
2019-04-02T17:44:10.000Z,"Matti Nykänen saa upean kunnianosoituksen - Pia-vaimo: ”Nyt kun hän on kuollut, hän saa enemmän kuin mitä olisi tarvinnut eläessään”","Pia Nykäsen mukaan läheiset eivät järjestä seremoniaa, kun Matti Nykäsen hautakiveen lisätään olympiarenkaat.",https://img.ilcdn.fi/7E8K2faMWLGpzNtK_EXGwXkXwZ0=/510x318/top/img-s3.ilcdn.fi/9cb31cc912904947582f365628b0d04bd673dc46803e728479eb0403f1ae4325.jpg
2019-04-02T17:53:41.000Z,Vaarallinen tarratemppu paljastui - voi ohjata auton vastaantulevien kaistalle,"Tutkijat ovat onnistuneet kehittelemään yksinkertaisen tempun, joka saa Teslan autopilotin kaartamaan omalta ajolinjaltaan vastaantulevien kaistalle.",https://img.ilcdn.fi/qJqR-XliqKWEv3Uo22FlDrhXeCk=/510x318/top/img-s3.ilcdn.fi/7f473a863d2e4444c29edd4f5a967d3f57e92c65fc971eedb87212b262c783dc.jpg
2019-04-02T17:55:53.000Z,Huhumylly velloo TIS-Meijun ympärillä - kommentoi nyt törkeimpiä väitteitä Iltalehdelle,Temptation Island Suomen ympärillä riittää puhuttavaa. Pariskunnista varsinkin Meiju ja Iiro ovat aiheuttaneet somessa säpinää.,https://img.ilcdn.fi/LYTg2gEicEMgA0lMU5_BGwEn9WE=/510x318/top/img-s3.ilcdn.fi/5a56d5228cf2f972b0fc40b5aee9e9ff65966fed7d89fb366eadcdcb8fdcdbc9.jpg
2019-04-02T18:00:00.000Z,Samsungin 5G-puhelimen julkaisu lähestyy – myynti alkaa Koreassa jo tällä viikolla,Samsung aloittaa 5G-puhelimensa myynnin Etelä-Koreassa perjantaina.,https://img.ilcdn.fi/WrMSLOYo6lYcWlHwSVNY-iIdEuU=/510x318/top/img-s3.ilcdn.fi/03ef7b5d6e3029b2cd0ce94963dd09847a43ea153bdfa611f96ff8cafc4aa142.jpg
2019-04-02T18:03:16.000Z,Haluaisitko asua Lego-linnassa? Uutuushotellissa unelmasi toteutuu ,"Tanskan Billundiin on noussut hotelli, joka hurmaa jokaisen Lego-palikoita rakastavan.",https://img.ilcdn.fi/kfWmerG-twXkpXfc_Neb5NEiQ0M=/510x318/top/img-s3.ilcdn.fi/9e1f77004ba1f0d28ab6e41faa5d0cd577ce3cb42e21e5e28f56243d6a6d542e.jpg
2019-04-02T18:19:33.000Z,"Alepa hamstrattiin vedestä tyhjäksi, kansanedustaja lirissä Helsingin Hämeentien tulvan keskellä: ”Uimalla pääsisi”",Hämeentien putkirikko vaikeuttaa ihmisten elämää Helsingissä.,https://img.ilcdn.fi/UoFcxY2HSy_sjMW3LqFYCCtQ14Y=/510x318/top/img-s3.ilcdn.fi/33330824c4ac65aab09a6b3606474477b4c6868660f30e212c8c5962a874deac.jpg
2019-04-02T18:39:40.000Z,NHL:n ruotsalaistähti rikkoi sääntöjä ja heitti yli 11 miljoonaa taivaan tuuliin – liittyi harrastejoukkueen harjoituksiin,NHL:ssä 717 ottelua pelannut hyökkääjä menetti peli-ilon ja halusi vain pois oravanpyörästä.,https://img.ilcdn.fi/1HCIujuELE6y4d1THejspu4y52w=/510x318/top/img-s3.ilcdn.fi/378a43654ff37b27ae862d7cf2680f33b7f1560b76bb15fb9b741d17e8156fda.jpg
2019-04-02T18:46:30.000Z,Justin Bieberin aprillipila arasta aiheesta raivostuttaa – ”Niin ajattelematonta”,Laulaja intoutui vitsailemaan vaimonsa olevan raskaana.,https://img.ilcdn.fi/-UBGSk6NSo66-xh7H_24prgXXhg=/510x318/top/img-s3.ilcdn.fi/9e81a193967a3cb6240fea1479abb405752ff0c71585e25444f5594b57485f29.jpg
2019-04-02T18:46:51.000Z,Europol: Suomen järkyttävän lapsiseksiringin tutkinta voi johtaa uusiin kiinniottoihin ympäri maailmaa: ”Annamme kaiken tukemme”,Euroopan poliisiviraston kyberrikoskeskuksen tiimin vetäjä Cathal Delaney kiittelee Suomen poliisin toimintaa lapsiseksiringin epäiltyjen rikosten paljastamisessa.,https://img.ilcdn.fi/2C30zN5HOTq7h6Ac2ZsKGTwuBU0=/510x318/top/img-s3.ilcdn.fi/aac51b60bf23374c7f11f8a31a92b9498629de8dbf1c7b336da789434ebbca39.jpg
2019-04-02T18:53:30.000Z,Näissä töissä on pulaa tekijöistä Seinäjoella,"Uusin ammattibarometri kertoo, että Seinäjoella on pulaa tekijöistä monenlaisissa ammateissa.",https://img.ilcdn.fi/IrUUAAOkNedr2_mMeTLiKYsLX3U=/510x318/top/img-s3.ilcdn.fi/302a0ab1b5bb876e2867d537900303d122dfeeb1d3b09706b5fa054d3c13d4ef.jpg
