paivamaara,otsikko,tiivistelma,kuva
2019-08-12T04:43:59.000Z,"Päivän ravivihje: Toto4, Turku 12.8.",Lindalike vakuutti Jokimaalla.,NULL
2019-08-12T04:52:48.000Z,Sami Kuronen vahvistaa vihdoin suhdehuhut: seurustelee vuoden 2017 Miss Suomen kanssa - ikäeroa 18 vuotta,Radiojuontaja Sami Kuronen vahvistaa myös uudessa ruokakirjassaan Elämäni reseptit (Otava) seurustelun vuoden 2017 Miss Suomen Michaela Söderholmin kanssa.,https://img.ilcdn.fi/P6kcl6cMe6hBBzBgmmCOzXsq49k=/510x318/top/img-s3.ilcdn.fi/8f5b912b502f7c251dbd98e6a74b4868672c64dabf5143161511dd4b60ef8c5f.jpg
2019-08-12T05:00:00.000Z,Syksyn sisustustrendit - poimi kuumat uutuudet,Syksy tekee tuloaan! Mikä on sisustuksessa kuuminta juuri nyt? Bongaa tuotetärpit ja ole trendien aallonharjalla.,https://img.ilcdn.fi/PwAimLsHstKqweBb52VSFHByuFI=/510x318/top/img-s3.ilcdn.fi/73d68071eaf54e0170ecabcdf3fd8450796980edb0b15ea016eac1a88f85715f.jpg
2019-08-12T05:02:26.000Z,"Havainnekuvat paljastavat: Hämeenlinnaan nousee varsinainen naisten luksusvankila – Digisellit, kampaaja, luontopolkuja ja kaupunkiviljelyalue",Hankkeen tavoitteena on rakentaa maailman edistyksellisin vankila. Myös vangit ovat osallistuneet suunnitteluun.,https://img.ilcdn.fi/b58uJkzW2yQT__K6rFmkolxyteQ=/510x318/top/img-s3.ilcdn.fi/f0c61a7af80ca2061ec46bdeeda319fb7b453e01003a10b65fdce8dafeb9c0dc.png
2019-08-12T05:24:14.000Z,Puheet Patrik Laineesta ihmetyttävät - entinen NHL-pelaaja muistuttaa tosiasioista: ”Moni ei pysty koko uransa aikana”,Entinen NHL-pelaaja ja maajoukkuehyökkääjä Mika Alatalo on seurannut läheltä Patrik Laineen kehittymistä pikkujunnusta NHL-tähdeksi.,https://img.ilcdn.fi/3p3t1sZOtghzDtZ8GJPgQTZldkE=/510x318/top/img-s3.ilcdn.fi/ca588c08896c01f5279bbf4bd6eabbcfb9b341d6ae22166b9c20cbae1b66e473.jpg
2019-08-12T05:29:05.000Z,Nopeampi netti kotiin – testissä olohuoneeseen ja matkalle sopivat 4G-reitittimet,Mikrobitti testasi työpöydälle ja mobiilikäyttöön sopivat 4G-reitittimet.,https://img.ilcdn.fi/0d9xXhWBf2aFhmYofZvT3X1I268=/240x356:2663x1868/510x318/top/img-s3.ilcdn.fi/4511335ebae91f25481e3ffedd734c06102ca168637a22ec258d64fa6529f599.jpg
2019-08-12T05:37:44.000Z,"Keinut, kokemuspolku, hotelli… Tampere-talo yllättää paatuneenkin bisnesmatkaajan",Bisnesmatkakohteena Tampere tarjoaa paljon – etenkin kulttuuri- ja kongressikeskus Tampere-talo on nostanut suosiotaan monipuolisena tapahtumatalona.,https://img.ilcdn.fi/CEaMBJ6cmkLnw-2Idib5vYyc7eU=/510x318/top/img-s3.ilcdn.fi/b6d4b07072b81db7e275f076f2de8122250459f830367d4530ca34e528744b15.jpg
2019-08-12T05:58:04.000Z,Karu arvio palkkaverotuksen kiristyksistä: Keskituloisen lompakkoon lohkeamassa jopa 250 euron lovi,Kilpailukykysopimukseen liittyvät palkansaajamaksujen muutokset uhkaavat kiristää palkkaverotusta ensi vuonna. Veronmaksajien keskusliiton laskelmien mukaan seuraukset olisivat keskituloisen kukkarossa tuntuvat.,https://img.ilcdn.fi/b8PumHmznsxmdsVl2P_qlYWKZRs=/510x318/top/img-s3.ilcdn.fi/0ba71e1d85de5742ff46d0331b1f149aae7640e384ad3e8b291f3e1edcba564d.jpg
2019-08-12T06:00:48.000Z,Katja Ståhlia alettiin kiusata kuudennella luokalla – kiusaamiseen suhtauduttiin vähättelevästi: ”Eihän ’älä välitä’ ole edes mikään neuvo”,Katja Ståhl joutui vuosia vaimentamaan itseään. Kiusaaminen päättyi yläasteen lopussa.,https://img.ilcdn.fi/Q7CutW7IoxvfK5e5LqFlHY2Zp6w=/510x318/top/img-s3.ilcdn.fi/79810c91ed91b7d58b4696d59e14f480a36df82e05946b91c9d5c6e11c41a6a3.jpg
2019-08-12T06:10:49.000Z,Pesukarhut pelastuivat palavan varaston katolta – kiipesivät tikkaita pitkin turvaan,Palomiehet pelastivat kaksi pesukarhua palavan varaston katolta. ,https://img.ilcdn.fi/8iCZkMBQuJQL4y7Si7QU7djF78Q=/510x318/top/img-s3.ilcdn.fi/473d26d2b0365381cd4d09fb1fcc0ea7ea5c103c98e50cbaacacb7f85ca724ed.jpg
2019-08-12T06:30:29.000Z,Kuvat ei herkille: Vapaaottelijan nenä meni tuusan nuuskaksi - joutui välittömästi leikkaukseen,UFC:n välisarjan ottelussa Vicente Luque mursi Mike Perryn nenän karmeannäköiseksi.,https://img.ilcdn.fi/XzW_zXrysyMPK4fLHeJThixo2E0=/0x64:3000x1939/510x318/top/img-s3.ilcdn.fi/2353899ee078cc7301001aedfb173237ae9e10db9c3f3f142c50c3df64de7545.jpg
2019-08-12T06:32:04.000Z,Olivatko Jeffrey Epsteiniä valvoneet vanginvartijat ylityöllistettyjä? – ”Ei edes työskentele vartijana vaan opetustehtävissä”,"Vielä ei ole kyetty vahvistamaan, tekikö seksirinkiä pyörittänyt Jeffrey Epstein vankilassa itsemurhan.",https://img.ilcdn.fi/-Z0f_GGUoNXN_mdu-1kiGwnL5Wo=/510x318/top/img-s3.ilcdn.fi/3a0ce3b621b3283647bba4f56a6cdd26e1f72c27c5ff154758e4ae483bf90d99.jpg
2019-08-12T06:36:45.000Z,Hovioikeus linjaa: Syyllistyiskö marjayrittäjä ihmiskauppaan? Tältä näyttivät thaipoimijoiden ”ihmisarvoa loukkaavat” majoitustilat,Käräjäoikeus tuomitsi keskisuomalaisen marjayrittäjän muun muassa ihmiskaupasta vuoden ja kahdeksan kuukauden ehdolliseen vankeuteen tammikuussa 2018. Nyt asia käsitellään Vaasan hovioikeudessa.,https://img.ilcdn.fi/N1v9z7iVtlOCo7E4nQNwHobJ6f4=/510x318/top/img-s3.ilcdn.fi/4a42eb448f8da63ce0bf0dd36197b76ff2406242fdcb408881531dd558c5be80.jpg
2019-08-12T06:40:14.000Z,Poliisi epäilee: 19-vuotias mies suivaantui risteyksessä ja löi autoa vasaralla – kaahasi poliisia karkuun kaupunkialueella 114 km/h,Poliisi otti miehen kiinni sunnuntaina Joensuun Rantakylässä takaa-ajon jälkeen. ,https://img.ilcdn.fi/wdYEZi9y4G2F1aJiFuzjtdKCD5Y=/510x318/top/img-s3.ilcdn.fi/324edebe512a4e4a1442fe132cfb893dd841832aea368d82969b66c40c722cc5.jpg
2019-08-12T06:47:25.000Z,"Miss EW -kisan toinen perintöprinsessa Essi Tähkä, 23, oli rajusti koulukiusattu – poliisi joutui puuttumaan tappouhkauksiin: ”Se pysäytti”",Luomumissikilpailussa toiseksi perintöprinsessaksi sijoittunut Essi Tähkä avautuu rankasta taustastaan. ,https://img.ilcdn.fi/Qpo6k62w8LkCAPOoLlrPAAYuGH4=/236x90:2752x1655/510x318/top/img-s3.ilcdn.fi/3bd8ad2cc41cc8670a77821a809c0a8386d5988aff2ebe231e0285e549421d5b.jpg
2019-08-12T06:55:06.000Z,"Antti Rinne Ylelle: Aktiivimallin leikkurit puretaan, mutta työttömyysturvan parannus jää voimaan",Lakiluonnos aktiivimallin purkamiseksi lähtee lausuntokierrokselle tällä viikolla.,https://img.ilcdn.fi/hViUg3w9tbmDZXLZjxFdSXXpiJM=/510x318/top/img-s3.ilcdn.fi/50696971e493ad1dfb09acb78be11b083b9303e6ed0d0933b836a5625c5cd13d.jpg
2019-08-12T06:58:09.000Z,Nimimoka johti diskaukseen Superliigassa - ”Urheilijat suhtautuivat asiaan uskomattomalla tavalla” ,Britannian 4x400 metrin viestijoukkue hylättiin Superliigassa.,https://img.ilcdn.fi/DcsQGwhnVq7HtUT2YLSsrvshghA=/510x318/top/img-s3.ilcdn.fi/3a69e52a72eaa095e31941c2622073ade89b3f33ad57eff8d8968469637338be.jpg
2019-08-12T07:20:01.000Z,Etla: Kiky-sopimus paransi työllisyyttä – työajan pidennys 24 tunnilla olennaisin syy: Nyt ”tarve samansuuruisille toimenpiteille”,Etlan mukaan pelkän työajan pidennyksen voidaan odottaa lisäävän työllisyyttä 8 000‒16 000 henkilöllä vuoteen 2022 mennessä.,https://img.ilcdn.fi/syR1Pkz5fAAbqyuOcuASsV-epzc=/510x318/top/img-s3.ilcdn.fi/1afd5327370040dc9c2ecbb5835adb0c5296ffe2c790d1e99f1cee68c4eb5ded.jpg
2019-08-12T07:34:36.000Z,"Taksikuski hakattiin Helsingissä, ohikulkija löysi aamulla autosta – ”Maksusta oli tullut riitaa”","Epäiltyä pahoinpitelijää on kuulusteltu. Rikosnimike selviää, kunhan taksinkuljettajan vammojen vakavuus on selvillä.",https://img.ilcdn.fi/Ky0_1zDyAFbvfT9LTicCrFYCpVo=/510x318/top/img-s3.ilcdn.fi/db076afce5fe491f22776c6f7fd8712a6b826df0c72ebd3e4a9e175ae61828f0.jpg
2019-08-12T07:35:42.000Z,Näin voit syödä pikaruokaa ilman morkkista – 4 terveellisempää vaihtoehtoa,"Esimerkiksi lisukkeiden valinta vaikuttaa siihen, kuinka terveellinen pikaruoka-annos lopulta on.",https://img.ilcdn.fi/jdQ--W185yvPytNXJgslGjNbQgQ=/510x318/top/img-s3.ilcdn.fi/a60d394dac510520e8da8893e1313dcb216edfbcae59aa26e66582f015e1b76c.jpg
2019-08-12T07:37:44.000Z,Eva Longoria teki yllättävän paljastuksen häistään: Ricky Martin ja Victoria Beckham aikamoisessa maistissa! ,Eva Longoria joutui tentattavaksi Andy Cohenin tv-ohjelmassa.,https://img.ilcdn.fi/G2T7qH5O8BQK6W_K2FyOMlgMd4Y=/510x318/top/img-s3.ilcdn.fi/09cba7ce3df580b50493ade97d9a7e25e9a658d1da236271268d0e9f24d562b2.jpg
2019-08-12T08:00:33.000Z,Richard Gere närkästyi Italian tylystä turvapaikkapolitiikasta - sisäministeri Salvini vastasi: ”Elätä heitä huvilassasi”,Näyttelijä Richard Gere vaati Italian hallitusta olemaan demonisoimatta turvaa hakevia pakolaisia.,https://img.ilcdn.fi/G8GFjHU7C0XgEw02a5XPKZU7waA=/510x318/top/img-s3.ilcdn.fi/ea569fb2e3eb36743a2784204dfeba82227a1bde742c7b623942b57b058d15d5.jpg
2019-08-12T08:04:02.000Z,"”Kiitos, että huolehditte minusta elämäni hirveimpänä aikana” – Putkavanki lähetti yllättävän kirjeen vartijoille",Itä-Uudenmaan poliisi on jakanut Vantaan poliisivankilan henkilökunnalle suunnatun kirjeen kiitoskirjeen Twitterissä. ,https://img.ilcdn.fi/EfNb6OK1Cd3RfPwB_AnWqhiD2-I=/510x318/top/img-s3.ilcdn.fi/59381daabe915b51f87244c66ec1aedfbbe4bec79543d70d1580f0c77d4b2754.jpg
2019-08-12T08:13:57.000Z,Jo pienetkin muutokset elintavoissa auttavat nopeasti – Laita rasvamaksa kuntoon kotikonstein ,"Alkoholin käyttö voi vahingoittaa maksaa hyvinkin nopeasti. Myös ylipaino tekee maksalle tuhoa. Munuais- ja maksaliitto kuitenkin muistuttaa, että maksa toipuu, jos vahingot eivät ole vielä liian vakavia.",https://img.ilcdn.fi/56yuyrUYz6S6DP_W6pCNwVIdAyI=/510x318/top/img-s3.ilcdn.fi/0c156c2112b11df29e855b71b414e7ac587454bc8c7093a7a41804280f06808d.jpg
2019-08-12T08:15:41.000Z,Työmaalla porattiin dynamiittiin Helsingissä – räjähdyksestä singonnut kivi osui lapseen,"Dynamiittiin poraaminen aiheutti räjähdyksen, jonka seurauksena kiviä oli singonnut päin kahta ohikulkijaa. Toinen ohikulkijoista oli ilmeisesti alakouluikäinen lapsi.",https://img.ilcdn.fi/44sZ7FRGaLjPGZpkD6hbFe23q7A=/510x318/top/img-s3.ilcdn.fi/1628f9e847375711d8edf2c2ff7e3291f0a98dfa09c4f8369acd06f86a73f588.jpg
2019-08-12T08:17:39.000Z,"Mikko Leppilampi lapioi hiekat sotaveteraanivaarinsa haudalle: ”Hyvää matkaa, rakas Veska-Pappa!”",Mikko Leppilampi esitti pappansa hautajaisissa koskettavan laulun.,https://img.ilcdn.fi/YW7T36JCoN4gT-99lriSITdCgiM=/510x318/top/img-s3.ilcdn.fi/7fb9bc3befa97c6fcdbe01daed7b27119b19826005694e896f0f572ba14c0dd2.jpg
2019-08-12T08:26:59.000Z,Kimi Räikkönen repäisi FIA:n gaalassa - paljastaa nyt Minttu-vaimon reaktion juhlakuntoonsa: ”Hänellä on kokemusta” ,Kimi Räikkönen pureutui pilke silmäkulmassa viimevuotisen FIA:n palkintogaalan tapahtumiin.,https://img.ilcdn.fi/xS3_M9E4-PwtygBDfli6cxOVF_E=/510x318/top/img-s3.ilcdn.fi/cafec3013e72d8ceea8ed004c38ae9b72ffe7f0ec66b875d66bf204e21cf882a.jpg
2019-08-12T08:31:04.000Z,Dagbladet: Norjan moskeijaiskun epäilty on varakas kiinteistösijoittaja ,Epäilty kiistää iskun sekä siskopuolensa murhan.,https://img.ilcdn.fi/Y8WojfAXrJluednVjlTXzI6XSCI=/510x318/top/img-s3.ilcdn.fi/dd1dbd9cecae390c758e30cff4bbb210727caaf4d2a2a4e9e43dc2e0fd243263.jpg
2019-08-12T08:58:13.000Z,Ykkösen kaikkien aikojen maalipyssy vaihtaa Suomen Italiaan - heiluuko verkko vielä jäähyväispelissä? ,"Päivän pelipoiminta tulee kotimaisesta Ykkösestä, missä sarjan kaikkien aikojen paras maalintekijä Kalle Multanen pelaa jäähyväisottelunsa KTP:n paidassa TPV:tä vastaan.",https://img.ilcdn.fi/ss1fWn1xapj4aGWZOiOUROrde4o=/510x318/top/img-s3.ilcdn.fi/1e3d192e23dbc9eb190f82da958b413206692fd55b218ed032ea7ebb7c91be21.jpg
2019-08-12T08:58:24.000Z,Vastaeronnut Miley Cyrus julkaisi joukon kuvia mystisillä saateteksteillä: ”Muutos on väistämätöntä”,"Laulaja, näyttelijä Miley Cyrus on kommentoinut eroaan Liam Hemsworthista ensimmäisen kerran.",https://img.ilcdn.fi/ngK7T8GuWrXtVmaL4C-v7U_gHhk=/510x318/top/img-s3.ilcdn.fi/b411ff8d272fb1d0261c42b59b486739d2087934fb597a3a72d00d85522b660b.jpg
2019-08-12T09:01:37.000Z,Ikkunasta pudonnut 1-vuotias lapsi menehtyi vammoihinsa Göteborgissa,Yksivuotias lapsi putosi ikkunasta viikonloppuna Etelä-Ruotsissa Göteborgissa.,NULL
2019-08-12T09:14:48.000Z,Kaipaatko kouluruokaa? Nurmijärvellä kuka tahansa voi nyt syödä sitä,Suomessa syntyy ruokahävikkiä noin 450 miljoonaa kiloa vuodessa. Nurmijärven kunnan Aleksia-ruokapalvelut haluaa olla vähentämässä sitä omalla toiminnallaan.,https://img.ilcdn.fi/DB6VTsnGr7Cq-DoPtclK_rcQpp8=/510x318/top/img-s3.ilcdn.fi/0e564582b22a946e5d1e295b54be591fd555a254f1704de2dd8d0ef841180c35.jpg
2019-08-12T09:24:44.000Z,Olen suomalainen -elokuvan musiikkivideo julki – mukana paloja Kari Tapion aidoista kotivideoista,Olen suomalainen -elokuva saa ensi-iltansa 13. syyskuuta.,https://img.ilcdn.fi/p0hGII-qPEDB_sOX5GIzbfQ1IQs=/510x318/top/img-s3.ilcdn.fi/d9ac6261b8a0601693ecc2f178d72987e0a11ba884f5d471e201a1dc627082e1.jpg
2019-08-12T09:32:18.000Z,”Ei kuulemma voi käyttää kaupungilla” – Näitä naisten suosikkivaatteita poikaystävät eivät voi sietää,"Väljät mekot, culottes-housut ja leopardikuosi – siinä muutamia muotivaatteita, joita kyselymme perusteella miehet eivät ymmärrä. ",https://img.ilcdn.fi/7OEB1prwTWZXkkMJ95OG7kfdx9M=/510x318/top/img-s3.ilcdn.fi/ec19f9ea1da71915e9cd009732e65bcf840325657b2f9037c43bb82777369707.jpg
2019-08-12T09:42:25.000Z,Kaikki Hongkongin lentokentän maanantain lennot peruttu - lentokentällä yli 5000 mielenosoittajaa,Mielenosoittajat ovat tunkeutuneet lentokentän sisätiloihin.,https://img.ilcdn.fi/ls56sIUcVUXB_4vLwuc71olqCq4=/510x318/top/img-s3.ilcdn.fi/819f0008470f14e6358e4cb139cfd76968a7dd2bb1ec37c9e1cce377c8c9b5eb.jpg
2019-08-12T09:46:19.000Z,Lentoemäntä sai potkut Yhdysvalloissa – epäillään työskennelleen humalassa,Lentoemäntä pidätettiin työskenneltyään päihtyneen oloisena lennolla.,https://img.ilcdn.fi/jqxc1qAzuRdiHnKxmlWQv3h14JI=/510x318/top/img-s3.ilcdn.fi/955633dae4a4a206e3274bf5ae2dd6537ce895d790f5290c6ff2f1bd8f71c80c.jpg
2019-08-12T09:47:31.000Z,"Ronaldoa lentokentällä odottaneet fanit joutuivat pettymään – supertähti livisti pois paikalta yksityiskoneella, muut pelaajat lensivät yhdessä ",Cristiano Ronaldo teki katoamistempun Ruotsissa.,https://img.ilcdn.fi/Z27Kw2bc_NuobzZEGOYibvdGnCQ=/510x318/top/img-s3.ilcdn.fi/29a455c1217f641923cabc2d62e358b067d91a441ea4966ad2e4a1fde098c2f6.jpg
2019-08-12T09:51:21.000Z,"Ex-huippumalli Niina Kurkinen-Nyholm julkaisi harvinaisen yhteiskuvan tanskalaismiehensä kanssa: ”Jos tämä on kesän viimeinen päivä, se on hyvä sellainen”",Niina Kurkinen-Nyholm hempeili Nikolaj-rakkaansa kanssa Flow-festivaaleilla.,https://img.ilcdn.fi/xm3CGXvCqhgQfLmt6UD470voQ3Q=/328x252:1992x1289/510x318/top/img-s3.ilcdn.fi/96d13ca6e0a02b1759e5ed16c0da435743fc4950f828628027215c3ed70e06ed.jpg
2019-08-12T10:21:43.000Z,"Ihanaa nostalgiaa! Katso, kuinka Finnairia on ennen mainostettu",Vanhat mainoselokuvat herättävät niin ihastusta kuin hilpeyttäkin.,https://img.ilcdn.fi/BQdsmlpxdcK1UFkrzSNeupKqUuQ=/510x318/top/img-s3.ilcdn.fi/8021fa635e6f1ea36b788b221bb5321b3d0c3fe79d8ea06738260ac78ff8c94b.jpg
2019-08-12T10:27:41.000Z,"Sarjavaras vaani rollaattorimummoja, 14 puolustuskyvytöntä uhria – syyttäjä: tuli Suomeen vain tehdäkseen rikoksia",Itä-Uudenmaan käräjäoikeus tuomitsi sarjavarkaan kahden vuoden ja 10 päivän ehdottomaan vankeuteen.,https://img.ilcdn.fi/2cZU-ISXUGXHeUqPfGL0_XZbdfs=/510x318/top/img-s3.ilcdn.fi/9a3aa45e77e4cb46425d5c1b613f39f2314f6e71979ae42549bfe2ed84588eb0.jpg
2019-08-12T10:29:01.000Z,Maailmankuulu pakolainen väitti olevansa 18-vuotias – uusi tieto paljastaa valheen upeassa tuhkimotarinassa,Bakery Jatta saa toistaiseksi jatkaa pelaamista HSV:n paidassa.,https://img.ilcdn.fi/HhzFaEPJ-UeEmwkY07r2aCMT5UQ=/510x318/top/img-s3.ilcdn.fi/fd18d9a03b377b1c9a3db43a176c61434c1d5e538f73dc6fce7b9e61b20407ed.jpg
2019-08-12T10:35:11.000Z,"F1:ssä jysähti siirtopommi – kauden floppi sai lähteä Red Bullilta, uusi kuski tilalle",Alex Albon ajaa Red Bullilla jo Belgian GP:ssä.,https://img.ilcdn.fi/r26_NaE1y7XIpo9fkH7QMukciPQ=/510x318/top/img-s3.ilcdn.fi/58ccd80d6f57f3d5e81142c8bc77da91da7003eb33b857cffd122a3b0537d6ce.jpg
2019-08-12T10:35:14.000Z,"”Vaitelias painija” iski ruokakauppaan: Yritti viedä 400 euron arvosta juustoa, lihaa ja voita – ei vastannut yhteenkään kysymykseen",Itä-Uudenmaan poliisilaitos tiedottaa sunnuntaina sattuneesta erikoisesta myymälävarkaudesta.,https://img.ilcdn.fi/DBIZXk21t8N0x2DkCpzQKA1lUOA=/510x318/top/img-s3.ilcdn.fi/4fae24fd7cd5fb1dd607bdfca1accced4027fe2e44fd5a18fe85c3801269f3f0.jpg
2019-08-12T10:40:08.000Z,"Rammsteinin jäsenet jakoivat kuvia Suomen vierailustaan - saapuivat yksityiskoneella, tapasivat suomalaisfaneja ja nauttivat lämpimistä illoista",Saksalaisyhtye Rammstein esiintyi perjantaina ja lauantaina Tampereella.,https://img.ilcdn.fi/QifnGLoaJXRMoaSebIyZIdikpQ8=/510x318/top/img-s3.ilcdn.fi/973bd5e23794cf183255d530f386865ebe9c6f73ac18a9fb86b68f2cbc44440e.jpg
2019-08-12T11:03:21.000Z,"Tunnistatko, mikä on väkivaltaa ja mikä ei? Testaa!","Parisuhdeväkivalta alkaa usein pikkuhiljaa, eikä sitä ole helppo tunnistaa. Tunnistatko sinä väkivallan? Testaa!",https://img.ilcdn.fi/ktTuypYpI4pFjP1qAf5gk7AW2Ok=/510x318/top/img-s3.ilcdn.fi/814ac8fc0de8c31123ff2761b0023162a236cbc720bd87a692428054a097dc86.jpg
2019-08-12T11:24:37.000Z,Liki koko kehonsa leikkauttanut kohukaunotar Katie Price kotiutui sairaalasta – kuvattiin kasvot runneltuina ja pää siteissä,Katie Price saa tällä hetkellä silmänsä juuri ja juuri auki. ,https://img.ilcdn.fi/VKmKMtYgDi2djppva_kmg-rL06A=/510x318/top/img-s3.ilcdn.fi/439f6bda6b7569c6e1c95f5929b43c8e56cfb2e80a9d5b888e358f0efb4e914d.jpg
2019-08-12T11:41:06.000Z,"Hohdokkaat havainnekuvat hämmentävät – Vankilanjohtaja kiistää, että naisvangeille rakennettaisiin luksuslaitosta: ”Ei tämä mikään satumaa ole”","Hämeenlinnan vankilan johtaja naurahtaa sille, että uutta naisvankilaa kuvaillaan luksusvankilaksi.",https://img.ilcdn.fi/b58uJkzW2yQT__K6rFmkolxyteQ=/510x318/top/img-s3.ilcdn.fi/f0c61a7af80ca2061ec46bdeeda319fb7b453e01003a10b65fdce8dafeb9c0dc.png
2019-08-12T11:42:34.000Z,Puolialaston ruotsalaisnainen löytyi kuolleena tieltä Barcelonassa ,Naisen kuolinsyy ei ole tiedossa.,https://img.ilcdn.fi/1yNwUe7nXnflU-eudiY-_w7zQYI=/510x318/top/img-s3.ilcdn.fi/9a5ab03b3c90098af79555e40cc9d4e90af76c32fea1648d46a17664cd86707e.jpg
2019-08-12T11:51:23.000Z,Uuden Citroënin ajomukavuus yllätti kokeneen koeajajan - ”Miksi kaikki autot eivät ole tällaisia?”,KOEAJO C5 Aircrossin olennaisin piirre on mukavuus jopa vaihtelevantasoisilla suomalaisilla maanteillä.,https://img.ilcdn.fi/EI7zfRsNSu2poa-Om_aoRdivrcA=/510x318/top/img-s3.ilcdn.fi/4eed7972c1b9cccf09a13ae1c6a56a4a21e2481f7663ac956c838b379ab033dc.jpg
2019-08-12T12:05:40.000Z,"Ensitreffit alttarilla -Pia juhli häitään iltapäiväteellä Kämpissä – samppanjaa, skonsseja ja kurkkuvoileipiä: ”Vihdoinkin kahden!”",Pia Alapeteriä kosittiin juhannuksena.,https://img.ilcdn.fi/T1ydwnApqH8kub_IoIGTeuLSMig=/510x318/top/img-s3.ilcdn.fi/73df55b8eda224a8ff8fb6375ce2f36cf6a4aa8e69361057dd238618754018af.jpg
2019-08-12T12:07:13.000Z,Rakastunut Sami Kuronen tunnustaa ihastuvansa helposti - hemmottelee naista ruoalla: ”Tällä annoksella hurmaat deittisi satavarmasti! Testattu on” ,Juontaja Sami Kuronen on koonnut elämänsä reseptit saman nimiseen juuri ilmestyneeseen keittokirjaan. Mukana on myös muutama hurmausresepti. ,https://img.ilcdn.fi/glMvbdbZE9OrBl_PwNAsQ9dxdho=/0x498:2000x1748/510x318/top/img-s3.ilcdn.fi/06702ecd5b291e90cc4ac8a7dc61bbb8eea0095974651705e4d6f83ca8158b4a.jpg
2019-08-12T12:12:05.000Z,"Mestarijuoksijaperhe tukkanuottasilla – Jakob Ingebrigtsenin tuuletukset saivat valmentaja-isän tylyttämään poikaansa: ”Jos siinä käy pieni vahinko, näytät ainoastaan typerältä”",Jakob Ingebrigtsenin jo loppusuoran alussa aloittama tuulettelu tulistutti valmentaja-isä Gjert Ingebrigtseniä.,https://img.ilcdn.fi/HczI-rjqdxrEAqjhs8h4o2snclA=/510x318/top/img-s3.ilcdn.fi/0f14a0fa7431b6c589778d1610f7af8089f8134e36246d0c9a2828717fdd35d5.jpg
2019-08-12T12:15:05.000Z,Jeffrey Epsteinin itsemurhan jälkeen syyttäjien huomio kohdistuu Ghislaine Maxwelliin - johtiko miljonäärin rakastajatar  hyväksikäyttörinkiä? ,"Hulppeissa oloissa kasvanut Ghislaine Maxwell oli Jeffrey Epsteinin tyttöystävä, mutta ehkä myös parittaja. ",https://img.ilcdn.fi/UyzyR2Eh-1Wh2U2qNnu0tEz92t8=/510x318/top/img-s3.ilcdn.fi/36d8a3d8aa2b5194f6c8389137cc3802a3a42c7d08667fbb6d209db3abd92316.jpg
2019-08-12T12:47:36.000Z,"Samae Koskinen vaihtoi koulua kiusaamisen takia: ”Tuntui, että maailmassa ei ole ketään minua varten”",Muusikko on antanut kiusaajilleen anteeksi. Kokemukset ovat opettaneet myös empatiaa.,https://img.ilcdn.fi/pO-Ur49MuK9r0umXUoXZieUZjGU=/510x318/top/img-s3.ilcdn.fi/d237563029f3199a470dd12025cc5e2ca703defeae80b3580f3c8c150c106caa.jpg
2019-08-12T12:55:58.000Z,"15-vuotiaan pojan kuolema pysäytti Kontiolahden koulun: oppilaille tarjottu kriisiapua, aamulla vietettiin hiljainen hetki",15-vuotias poika ilmoitettiin kadonneeksi perjantai-iltapäivällä. Poika löytyi kuolleena lauantaina. ,https://img.ilcdn.fi/rHEtcuPVGzLG-ZORO7sXSMCWmdo=/510x318/top/img-s3.ilcdn.fi/e4087881d1956a7e7e2bcede6183d7b2fe57d32637651fa3044d667fd854ee99.jpg
2019-08-12T13:22:08.000Z,Kimi Räikköseltä suoraa puhetta haastattelussa – tyhjensi 16 päivän ryyppyputkeaan: ”Se oli täysin normaalia”,Kimi Räikkönen kertoi viime vuonna julkaistussa ”Tuntematon Kimi Räikkönen” -kirjassaan 16 päivän juopotteluputkestaan ja kommentoi sitä nyt saksalaiselle Motorsport-Totalille.,https://img.ilcdn.fi/gixAmZSHFetXCr4UG-RgDJtfrSc=/0x64:3000x1940/510x318/top/img-s3.ilcdn.fi/89834d0655aa5aea1015de6462e0fda0460a593c5ce387c7aa4336a530a38f2c.jpg
2019-08-12T13:33:28.000Z,Ilmakiväärin luodista silmäänsä osuman saanut menehtyi sairaalassa – ampujalle syyte taposta,Kylävierastaan ilmakiväärillä silmään ampunut lappeenrantalainen mies on saanut Etelä-Karjalan käräjäoikeudessa syytteen taposta. ,https://img.ilcdn.fi/jmWavaX8zkCqFUbAKW9Mqi_T_i0=/101x503:1324x1261/510x318/top/img-s3.ilcdn.fi/5382407226c90fc1a8adc6aa626849ab9aa0e5cc0874846dddb272fafccff7ec.jpg
2019-08-12T13:40:25.000Z,ASAP Rocky nousi ensimmäistä kertaa esiintymislavalle vapautumisensa jälkeen – kertoi ajastaan vankilassa yleisölle: ”Se oli pelottava kokemus”,Räppäri esiintyi sunnuntai-iltana Real Street -festivaaleilla.,https://img.ilcdn.fi/9xeNB6i3OGiS1l2hFiR8DqXv090=/224x253:1806x1227/510x318/top/img-s3.ilcdn.fi/92fabf76b8c9d62bc97f069c7f49df22e19a53d095caab022f7fd34dbbb9a87e.jpg
2019-08-12T14:00:11.000Z,Viestisovellus Telegram esitteli uuden esto-ominaisuuden – kopioiko Whatsapp sen seuraavaksi?,"Telegram-käyttäjät voivat nyt määrittää, kuinka usein ryhmäkeskusteluissa voi laittaa viestejä.",https://img.ilcdn.fi/cnTjOhE3KGT-jkJ2yrQtm8EOf6k=/510x318/top/img-s3.ilcdn.fi/551cf927f83f8a1cbf73e328ae1693c8ae22d06f7cca2467e9e7248627c0aed3.jpg
2019-08-12T14:06:30.000Z,Oho! Suomalainen NHL-maalivahti valitsi poikkeuksellisen kesätreenijoukkueen – ei aiempia sidoksia ruotsalaisseuraan,Juuse Saros harjoittelee SHL:n HV71:n kanssa tämän viikon.,https://img.ilcdn.fi/ETn8c2IkmZ32ejEUkxf-T1lD3Rc=/0x0:2875x1797/510x318/top/img-s3.ilcdn.fi/ba3465856391cf6b7c38fddc41492cd0495a6d0fd97f2a89b67a92b3532ef0de.jpg
2019-08-12T14:08:51.000Z,IS: Sampo Terho eroaa vaimostaan ,Terhon mukaan avioerohakemus on jätetty käräjäoikeuteen kesäkuussa. ,https://img.ilcdn.fi/BU5KNkpHN6OZCUuT2wX0QRTHcnQ=/510x318/top/img-s3.ilcdn.fi/9259d1b760b34715ad058ee28ee47c0868d5e05910c4e93c8413c4ea4224b746.jpg
2019-08-12T14:20:28.000Z,Raju sadekuuro muutti kadun joeksi Jyväskylässä – ”kymmenen minuuttia tuli rajummin vettä”,Poikkeuksellisen kova sadekuuro sai useita katuja tulvimaan Jyväskylässä maanantaina.,https://img.ilcdn.fi/MH-2FACgq8VnkQIWV3sQZ-2CTUI=/510x318/top/img-s3.ilcdn.fi/d58b83e6d5ef85958ebe36e029847194f053dc175fca5067a9f91eb3720e5819.jpg
2019-08-12T14:29:34.000Z,"Kipinät sinkoilivat ja sirkkelit vinkuivat, kun taistelurobotit ottivat yhteen Helsingin Messukeskuksessa",Radio-ohjattavat robotit iskivät yhteen kuun alussa järjestetyssä Assembly Summer 2019 tapahtumassa.,https://img.ilcdn.fi/FGx6QeL8weHyytdCupWTAGS0svo=/510x318/top/img-s3.ilcdn.fi/384440886bb6c71c94c03999f89f82ccd5f647367c7726e9d7c14988504172a7.jpg
2019-08-12T14:34:14.000Z,Bryan Adams konsertoi keväällä Suomessa – jokaista myytyä lippua kohden istutetaan puu,Bryan Adams pyrkii parantamaan ihmisen elinolosuhteita säätiönsä kautta.,https://img.ilcdn.fi/bKcC_eRlGV1S-h6vN5r8XxB546s=/510x318/top/img-s3.ilcdn.fi/e25f1360d69cfdc7b2292f680e11cc9306f61415e5cfcd1ea814d823c5f335d7.jpg
2019-08-12T14:43:52.000Z,7 parasta hajuvettä juuri nyt - näihin jokainen ihastuu,"Poimimme syksyn tuoksujen parhaat – löytyisikö näistä uusi suosikkituoksusi, josta sinut jatkossa tunnistetaan? ",https://img.ilcdn.fi/aDo1R_Qinc_6dYwyGDcqsKr7N70=/510x318/top/img-s3.ilcdn.fi/398c245e3a93984330326a85befcd5dee6b03fd9b78925af1ab8d1b70985ed3f.jpg
2019-08-12T14:54:19.000Z,Huijarit veivät ikäihmiseltä Hyvinkäällä 34 000 euroa  – Itä-Uudenmaan poliisille jälleen useita ilmoituksia valepoliiseista,Oikea poliisi ei koskaan kysy verkkopankkitunnuksia. ,https://img.ilcdn.fi/eIKen-7tLEoESm66IUjyfXKIZAE=/510x318/top/img-s3.ilcdn.fi/22e8cb1d5a12c8bddd95221511a5b52dea6c19929de7a1a8c618acb5f21fce1b.jpg
