paivamaara,otsikko,tiivistelma,kuva
2019-08-10T18:46:58.000Z,"Video: purjevene joutui hätäväistön tehneen M/S Galaxyn kanssa törmäyskurssille – kuljettaja: ”Tuli olo, että ollaan kusessa” ","Silja Linen M/S Galaxylla ollut matkustaja kertoo, että tapahtuneesta ei saatu tuoreeltaan tietoa myös suomeksi. ",https://img.ilcdn.fi/pjJS2j2Of_eb5mtwiDzFScAg1B0=/510x318/top/img-s3.ilcdn.fi/34879b0885b0c17be3c62eb1137742421a7788c7fe064d303b238dbd509fc911.jpg
2019-08-10T18:51:40.000Z,Edis Tatli iski voittajaksi Olavinlinnassa! Vastustaja kiemurteli ja toimi nyrkkeilysäkkinä,Edis Tatli palasi takaisin nyrkkeilykehään lauantai-iltana Olavinlinnassa.,https://img.ilcdn.fi/Gfk5q9jl_TWb1M_Ytp__TjTXyBw=/1088x0:2963x1170/510x318/top/img-s3.ilcdn.fi/f266d17e76a064c527650994d77ddb116dd7412bd2f6cc45cd1ada9931b2602b.jpg
2019-08-10T18:59:38.000Z,Me Naiset: Heidi Sohlberg avautuu ensimmäisestä eron jälkeisestä vuodesta – alkoi saada paniikkikohtauksia,"Heidi Sohlberg kertoo Me Naisten Uusi alku eron jälkeen -erikoislehdessä, miltä tuntuu olla ensimmäistä kertaa aikuisiällä sinkku.",https://img.ilcdn.fi/qVInjp7KyxAdYGvmndclo-jvHwg=/510x318/top/img-s3.ilcdn.fi/4083ec1e12d03d1b1b933d5ab914b6931809a9935e89fdbdb9f45b74a032062a.jpg
2019-08-10T19:03:14.000Z,"Vanhasta Nintendo-pelistä maksettiin 13 000 euroa – tarkista, löytyykö omasta pelikaapistasi aarre",Retropelien arvo voi olla tuhansia euroja.,https://img.ilcdn.fi/B1NhY_BzOnb51wxijVMzWXcOeZg=/510x318/top/img-s3.ilcdn.fi/a71383cb79c5a5e872c2a1ab46886eb1d32e94b25dd5098673d22bbe0bff3cf9.jpg
2019-08-10T19:24:52.000Z,Merkittävä osa Suomen kuoveista joutuu hengenvaaraan – ranskalaiset herkkusuut saavat ampua tuhansia kuoveja,"Kuovin kanta taantuu, mutta ranskalaiset herkkusuut aikovat silti ampua pitkänokkia.",https://img.ilcdn.fi/rQKHlt6erz9wAAemEDKqUi1wC_g=/510x318/top/img-s3.ilcdn.fi/edce97ead48ebd1708c28597fa49bad0eaf6550a577e5d34cb5ba2da757b3a38.jpg
2019-08-10T19:29:06.000Z,Saksalaislehti Till Lindemannin nakupyllystä: ”Rammsteinin laulaja jättää nyt Suomessa arjen taakseen – ja vaatteet myös”,Bild-lehti on tehnyt videon Rammsteinin nakuvirvelöinnistä.,https://img.ilcdn.fi/USSwEMaNae-4P9F0I3fv_6yzVdI=/510x318/top/img-s3.ilcdn.fi/e52cc08a3d5c9e4cbdde5befa0145701665c2870a42490af8c68430be0cc5b57.jpg
2019-08-10T21:18:48.000Z,"Lehtitieto: Norwegianin lentokone sylki pirstaleita moottoristaan, palasi lähtökentälle",Kukaan ei tiettävästi loukkaantunut norjalaisyhtiön koneen moottorivian takia.,https://img.ilcdn.fi/yBeh48QJNlOi752pWsfGH-tTZpM=/510x318/top/img-s3.ilcdn.fi/9479b09593b2d0a34b58e7d3d4969365631241ec67f7cdecd28c5b852fd2b69b.jpg
2019-08-10T22:01:37.000Z,Ällistyttävä virhe Selänteen ja Koivunkin voittamassa NHL-palkinnossa,New York Islanders vaihtui vihollisjoukkue Rangersiksi.,https://img.ilcdn.fi/qj0eC8I8RPxmPnrsGhCOCQuK9Jg=/0x469:2500x2032/510x318/top/img-s3.ilcdn.fi/996af9feb39a1e26ece7e45f28c1ae8d8913b1ad3fe9bc622fb8ed186e1e627e.jpg
2019-08-10T22:08:21.000Z,Edis Tatli ei lähtenyt tyrmäämään: ”Chillasin ja nautin kehässä”,Ammattinyrkkeilijä Edis Tatli voitti Nicaraguan Berman Sanchezin Savonlinnassa kaikin tuomariäänin.,https://img.ilcdn.fi/ix7kmY4szgywH5YevJkahqshIbs=/510x318/top/img-s3.ilcdn.fi/8a9525c133fe76bb5a0303767339c2ecfc99e8da65addfa959e06e1b8141d096.jpg
2019-08-10T22:54:33.000Z,Huippumalli Gigi Hadid ryöstettiin lomalla: kehottaa ihmisiä välttämään Kreikan saarta – seuraajat raivostuivat,Malli oli seurueineen Mýkonos-saarella juhlimassa siskonsa syntymäpäivää.,https://img.ilcdn.fi/U-V7WB_LZuMlPfGNL1PTLGlCnxE=/510x318/top/img-s3.ilcdn.fi/6fef47698678d18cd4534440469e7298b2c4843a4ca377866ecdb47abb50d70a.jpg
2019-08-10T23:15:29.000Z,"Viisi kuollutta, lapsia haavoittui: pommi-isku Libyassa",Yhdistyneet kansakunnat tuomitsee Benghazissa tehdyn iskun.,https://img.ilcdn.fi/dnESjtDZ2_KHZwID3MR1Ar46NSU=/510x318/top/img-s3.ilcdn.fi/174d7700e2ec10df4780f30fac0b6f7769715b3ffb3d1f4e4fdc6f261e3d51c4.jpg
2019-08-10T23:58:23.000Z,Pieni Merenneito -elokuvaan valittu Halle Bailey sai osakseen rasistisia kommentteja – vastaa nyt saamaansa huomioon,R&B-laulaja ei välitä saamistaan negatiivisista kommenteista.,https://img.ilcdn.fi/0fdNrcoMClADGBFundwG9uEmy60=/510x318/top/img-s3.ilcdn.fi/a617429b720753dd9b01077c25baf8ad40ba1e4771bf508e6d6e6e39f2373493.jpg
2019-08-11T00:47:36.000Z,"Ukkosvaroitus annettu! Katso, missä tänään rytisee","Suomessa on sää suhteellisen lämmin sunnuntainakin, mutta vesisateita on luvassa.",https://img.ilcdn.fi/RXnQsG-eOx18kGZxfaJpnayfXrI=/0x203:2852x1984/510x318/top/img-s3.ilcdn.fi/b0aaae1607ca5c09e0484a035832e408d181ea972a46ac392326e8e410cdb07d.jpg
2019-08-11T01:29:45.000Z,"Boris Johnson käy taistoon rikollisuutta vastaan, lähes kolme miljardia vankiloiden laajentamiseen – ”On tullut aika toimia”",Brittikabinetti on saanut tarpeekseen rehottavasta rikollisuudesta.,https://img.ilcdn.fi/Qj4SUPbQVpFXJoB6EUq0QA5ABJw=/510x318/top/img-s3.ilcdn.fi/59b74cf0c798fc4b813115af6d317031bf642127e83da43a4cf0622d7943ed7c.jpg
2019-08-11T02:09:34.000Z,Mikä idea! Maarit julkaisi kuvan mökkituliaisestaan – ja some meni sekaisin: ”Tervetuloa tännekin”,"Kuopiolainen Maarit Tuovinen, 49, kokosi miehensä kanssa veikeän lahjan polttopuista. Sosiaalisessa mediassa mökkikansa inspiroitui täysin.",https://img.ilcdn.fi/uNsToKbL2zNr8bd53QAAW4TPjQ4=/510x318/top/img-s3.ilcdn.fi/3f1abad2a209bc6b335b6656e8ab0d2cc0b649f72c53b3c262b484c166937ba7.png
2019-08-11T03:00:57.000Z,Sofia Belórfin ja Niko Ranta-ahon Espanjan-huvilaan tehtiin kotietsintä – autoa tai moottoripyörää ei löytynyt,Poliisi teki heinäkuussa kotietsinnän Sofia Belórfin ja Niko Ranta-ahon Espanjassa sijaitsevalle huvilalle. Iltalehden tietojen mukaan etsintä ei kuitenkaan tuottanut toivottua tulosta.,https://img.ilcdn.fi/qTV8gTRREYSag_GmArjEgsTzXag=/510x318/top/img-s3.ilcdn.fi/dbe5cbecd8adb82d4a5ac95d34568d8fd8df39828cb4f7c9219fa5deea88567b.jpg
2019-08-11T03:11:32.000Z,Erkki Tuomioja sanoo Lännen Medialle kannattavansa Sdp:n ja vasemmistoliiton yhdistymistä: pesäero on kestänyt 101 vuotta,Yhdistynyt vasemmisto saisi Tuomiojan mielestä paremmin viestinsä läpi.,https://img.ilcdn.fi/ID4jWmInaMPDhbiB5wGNTg0ruvc=/510x318/top/img-s3.ilcdn.fi/ec0252bfe94649072ed226859956bd62590eead01074800556950fa67751d2cc.jpg
2019-08-11T03:39:12.000Z,"Tornadot tekivät tuhojaan, Hollannissa romahti osa tunnetun jalkapalloseuran kotistadionista",Myrskytuulet riepottelevat Benelux-maita. Lauantaina kärsi tunnetun jalkapalloseuran kotikenttäkin.,https://img.ilcdn.fi/ySwGF1Jbfo42hIh8ch42mYHSAhk=/510x318/top/img-s3.ilcdn.fi/2b47d7fab3e76f24ddd5df25170932547d79273860fc66ed176f25c9ce88df63.jpg
2019-08-11T04:19:44.000Z,Muistin arvoitus,Muistisairaudet ovat kansantauti siinä missä sydän- ja verisuonitauditkin. Joka kolmas yli 65-vuotias ilmoittaa kärsivänsä muistioireista.,https://img.ilcdn.fi/Dscc9loOfVKqiWrq0Fhs4u2Oy4k=/510x318/top/img-s3.ilcdn.fi/47fe055a09dbb4edfdb387ab5a44f65d27adf8842c035bf1cf30ea07559e63e1.jpg
2019-08-11T04:34:29.000Z,"Muistatko Mika Alatalon? Entinen NHL-pelaaja kertoo nyt, miten ura Pohjois-Amerikassa päättyi – kieltäytyi sopimuksesta: ”Ajattelin, että ei helkutti”",Mika Alatalon hieno jääkiekkoura ei koskaan saanut kruunukseen arvokisakultaa.,https://img.ilcdn.fi/zrx363RAVAG7_8lWcH7dMxFiOvA=/510x318/top/img-s3.ilcdn.fi/5390052e57c40692dfb8609b645f4ea570fd99ccebfa7d72dc1389d6bfd8841e.jpg
2019-08-11T04:35:20.000Z,Maailman suomalaisin lintu on hätää kärsimässä – täystuho tuttu näky selkälokkiluodoilla: ”On kuin hautuumaalle tulisi”,Mustaselkäinen selkälokki oli aiemmin sisävesillä runsaimpia lokkeja. Nyt maailman suomalaisimmaksi kutsutun linnun tutkija kohtaa monella pesäluodolla masentavan täystuhon.,https://img.ilcdn.fi/rUlUnGdvZnVLJ-YlHt-vFyAiCuM=/0x302:815x812/510x318/top/img-s3.ilcdn.fi/35c38306b0532f18e14cc4c704a4051ed6870f145e3c75713635ee4befedd531.jpg
2019-08-11T04:47:54.000Z,Ahvenanmaan valkoisen kengurun mysteeri – Willy Wonkan seikkailut saivat onnellisen päätöksen,Aiemmin tällä viikolla Ahvenanmaalla tavattiin valkoinen kenguru.,https://img.ilcdn.fi/z7YiMvAkAdkSYvZ7E8sDqhO7avw=/510x318/top/img-s3.ilcdn.fi/8b8a9acbfbd09990c469dbcea268492e15ecd305c14de0cf3e7519343cb02b7f.jpg
2019-08-11T05:09:05.000Z,Tänään tv:ssä: 27 000 eurolla valmentaja ohjailee salaa treffien kulkua – ”Ole naisellisempi!” ,Stephanie haluaa sijoittaa hänen ja hänen aviomiehensä tulevaisuuteen. Aviomiehen henkilöllisyys ei ole kuitenkaan selvillä. ,https://img.ilcdn.fi/kZm-XhoM_vjHIbIJedLHFk8Mkjo=/510x318/top/img-s3.ilcdn.fi/ea0d04719ffe0507884dec46ae5b21edbd6b103c83b9650f6606e3a49e467cd9.jpg
2019-08-11T05:09:47.000Z,"Kuka sanoo, ettei mummo voi värjätä päätä pinkiksi? Ennen ja jälkeen: katso ihastuttavat kuvat kampaaja-Leenan unelmaprojektista!","- Kehuja on sadellut, etenkin nuorison edustajilta, muuttumisleikkiin horoskoopin kehotuksen ansiosta lähtenyt Hilkka Vakkilainen kertoo.",https://img.ilcdn.fi/1C2-v6BF6mBGepTmIvTNTfdT1kM=/510x318/top/img-s3.ilcdn.fi/0165382d2e7685a54dc2b7cc18e9769a9a58a4f74f0f3643b4d26f51cf97ddd7.jpg
2019-08-11T05:29:05.000Z,"Keskustan puheenjohtajapeli alkoi Rovaniemellä - Sipilä sai pyyhkeitä: ”Keskusta ei voi olla vaaleanvihreä, pikkukokoomus tai light-versio persuista”",Keskustan puheenjohtajaehdokkaat Antti Kaikkonen ja Katri Kulmuni aloittivat neljä viikkoa kestävän kiertueen sopuisissa merkeissä.,https://img.ilcdn.fi/gxYBROdkEKqka2JNB0nFK5ofFFE=/510x318/top/img-s3.ilcdn.fi/a81196a2ba0dce1cdc966235c8427fb5b00d4787c672b57d11cdf7808f1fb7fe.jpg
2019-08-11T05:34:06.000Z,"Tunnistatko rakkaudenosoituksen sellaisen saadessasi? Tee testi ja selvitä, mitä rakkauskieltä ymmärrät parhaiten!","Tiedätkö, mitä rakkauskieltä puhut?",https://img.ilcdn.fi/NWoIBTCJjIW5BdSV7_hODgvGhIY=/510x318/top/img-s3.ilcdn.fi/c21980ffe48e69cad62170b719f2de5bd8c0ea098a5beb6a213b305ab9d8fd2a.jpg
2019-08-11T05:50:10.000Z,Annimari Korte julkaisi lohduttoman kuvan tyhjästä lautasestaan – joutui hakemaan Puolan Superliigassa eväät itse kaupasta,Korte juoksee sunnuntaina Superliigan aitafinaalissa.,https://img.ilcdn.fi/WUajdX4wbWqZ5QJXbhSPXTLAMzg=/510x318/top/img-s3.ilcdn.fi/c4041581fe3e88d7b7649b4c90bd0c91c933e926fb17c89be0cf66ded4f2d6c2.jpg
2019-08-11T05:52:03.000Z,"Miley Cyrus ja Liam Hemsworth: Avioero! Laulaja puhuu tuoreessa haastattelussa liitostaan: ”Olen heterosuhteessa, mutta tunnen silti seksuaalista vetoa naisia kohtaan”",Laulaja ja Hollywood-näyttelijä ehtivät olla naimisissa vain reilut seitsemän kuukautta.,https://img.ilcdn.fi/DlVQBl-SCQunqpOBnIJj9BnbSg0=/238x143:1704x1036/510x318/top/img-s3.ilcdn.fi/9d03467179e9daa418dcad27ada8adea2ef35b013e3b9ad8a2ca0bbdeba0de2b.jpg
2019-08-11T06:03:32.000Z,Suomenruotsalaisten muutto Ruotsiin kiihtyy – osa muuttajista kuvaa Suomen ilmapiiriä ”ahtaaksi”,Ajatuspaja Magma selvitti Ruotsiin muuttaneiden suomenruotsalaisten syitä muutolleen. ,https://img.ilcdn.fi/tnQnH0ABuN5LG99jaAgtrLi-r-w=/510x318/top/img-s3.ilcdn.fi/f401bf49cfd25b9ec8d9f7d7929c160eddaf80e478e683ea14a837722a28fe33.jpg
2019-08-11T06:24:39.000Z,Pohjois-Korean aavepyramidi on maailman korkein tyhjänä seisova rakennus – Aukeaako ”tuomion hotelli” koskaan?,Hotelli Ryugyŏngista piti tulla Pohjois-Korean ylpeys.,https://img.ilcdn.fi/RLDtwCeLc5aPE4AfYOySv7TiWmw=/510x318/top/img-s3.ilcdn.fi/ae7cc1775489de740394e249b03051f2160c0858ffe8645595a71c11598b8439.jpg
2019-08-11T06:40:26.000Z,Ensitreffit alttarilla -ohjelmaan palaava pastori Kari Kanala paljastaa sarjasta poistumisen taustoja: Kaksi suurta elämänmuutosta vaativat aikaa,"Ensitreffit alttarilla -ohjelman kuudes tuotantokausi alkaa AVAlla 3. syyskuuta. Uudella tuotantokaudella asiantuntijoina nähdään Kari Kanala, Marianna Stolbow ja Elina Tanskanen.",https://img.ilcdn.fi/vtYK8Fw8zHiypTmgLPZRRGCE7j4=/510x318/top/img-s3.ilcdn.fi/ec1ad45b69702a06a818b48faeff3ee4b05a1d4ba45ea78004b19b2b5eb062ae.jpg
2019-08-11T06:49:30.000Z,Miksi krapula vie keskittymiskyvyn? Tutkijat löysivät syyn,Krapulassa tarkkuutta ja keskittymistä vaativat asiat eivät onnistu. ,https://img.ilcdn.fi/uWtTzU-9S3Yal9BF2ZyMeXfEDqA=/510x318/top/img-s3.ilcdn.fi/e2734d700c45f56f4b3191c6d5f56f15164df7d5e0c6f65df179077b5658c781.jpg
2019-08-11T06:56:19.000Z,"Tässä ovat Suomen luonnollisesti kauneimmat missit: Tiia Aalto, 19, on uusi Miss EW ",Miss Eloweena -kisan on voittanut 19-vuotias espoolainen Tiia Aalto.,https://img.ilcdn.fi/SXBGMVWr8FoHiwraowT3LAYUGbA=/510x318/top/img-s3.ilcdn.fi/0380c0749ee97617571e125205091ffa9205908cce3944a187f59b829dec359c.jpg
2019-08-11T06:57:16.000Z,Kanki vai Katri? Siinäpä on keskustalla pulma,"Antti Kaikkoselta ja Katri Kulmunilta ei puutu poliittista rohkeutta, kirjoittaa Iltalehden politiikan ja talouden toimittaja Marko-Oskari Lehtonen.",https://img.ilcdn.fi/pF3FoNTuTBkzhF1GtyruHq9BNzI=/510x318/top/img-s3.ilcdn.fi/fe386927d615bec7d4d7a80dbcc759619b3840785133b0aefc16615bc75f2b25.jpg
2019-08-11T07:05:20.000Z,Ryöstöyrityksen kohteeksi joutuneiden Arsenal-pelaajien piina ei ole ohi: poliisi pidätti kaksi miestä tähden asunnolta – pelaajat sijoittivat satojatuhansia turvatoimiin,Mesut Özil ei ole saanut olla edes kotonaan rauhassa.,https://img.ilcdn.fi/QxgAUjvLB38EUNk-wrM8a-x8PDE=/510x318/top/img-s3.ilcdn.fi/bcdbd9d8f4edfb726e2221b320e1779f6b1bccf8dfddb56974ec709b295e5618.jpg
2019-08-11T07:23:03.000Z,Miley Cyrus ei jäänyt murehtimaan eroa: kiihkeää suutelua tosi-tv-kaunottaren kanssa uima-altaalla,Laulajan avioliitto Liam Hemsworthin kanssa päättyi. Cyrus on parhaillaan lomalla pitkäaikaisen ystävänsä Kaitlynn Carterin kanssa.,https://img.ilcdn.fi/W6v2Yqid-muboIfeKnCRNtKjUmM=/510x318/top/img-s3.ilcdn.fi/c7df14101e93d27ca4ad9220f727b6ec76bfe3866279056f3957a9a48f580a09.jpg
2019-08-11T07:27:21.000Z,"Lapsijoukko ”leikki” linnunpoikasen kuoliaaksi, siileillä pelataan jalkapalloa... Eläinsuojeluyhdistys vaatii kovempia rangaistuksia rääkkääjille",Tiiranpoikanen ei selviytynyt lapsiporukan riepottelusta Hämeenlinnassa. Nuorin tekijöistä oli vain 5-vuotias. Eläinsuojeluyhdistyksen puheenjohtajan mukaan julmuus eläimiä kohtaan on yleistyvä ilmiö.,https://img.ilcdn.fi/nswuC1GDfStfnf9CAK_NfQ7jWKY=/510x318/top/img-s3.ilcdn.fi/a2193ca9a94166857e55000dfaa9096d09ba00b28c524a3e5802819ac99fab85.jpg
2019-08-11T08:06:07.000Z,Historia: Viipurinlahden laineet sekoittuivat vereen – vihollinen ei koskaan päässyt pohjoisrannalle elävänä,Heinäkuussa 1944 vereen käytiin kiivaita taisteluja Viipurinlahden rannoilla.,https://img.ilcdn.fi/vdaZg-FCdy6tpCDAmu-wv9OnLp4=/510x318/top/img-s3.ilcdn.fi/f1daf36ece42d5c56ce45c2e4f0bd92131f87b8bbbc695dee72522b0066c935a.jpg
2019-08-11T08:24:57.000Z,Uskomaton ujutus! 17-vuotiaan suomalaislupauksen rangaistuslaukaus on kuin Peter Forsbergin kikkapankista – suoritusta kehuttiin jopa Pohjois-Amerikassa,Vasta 17-vuotias Juuso Aaltonen näytti taitojaan.,https://img.ilcdn.fi/msmb1Ufamz-y_gKkyYdZjYSiedM=/510x318/top/img-s3.ilcdn.fi/e1e73b57aa63ea8e3ff675b27eea1349e1a7c07388ed2ef288781188fee497a0.jpg
2019-08-11T08:27:11.000Z,Lontoolaistubettaja löydettiin kymmenen päivän katoamisen jälkeen: ”Hän on turvassa ja voi hyvin”,"Tubettaja Marina Joyce on löydetty, ja hän voi hyvin.",https://img.ilcdn.fi/x1HrcKzI7QCwBujyNI9DxNQeQus=/94x0:1581x929/510x318/top/img-s3.ilcdn.fi/9c27239ffccb8ad38bfd8f2f82c1764f4e7d3224fb2bad84da61a1356b29a69c.jpg
2019-08-11T08:42:46.000Z,Frank Lampardilla tulikoe Old Traffordilla – Chelsean puolustus vuotanut harjoituspeleissä kuin seula,"Herkullisin ottelu on tarjolla Old Traffordilla, missä seuralegenda Frank Lampard debytoi Chelsean managerina Manchester Unitedin vieraana.",https://img.ilcdn.fi/UqMUZw4m_u2rZ8wku5oDy64evPs=/510x318/top/img-s3.ilcdn.fi/a672dfba2d6a22ba8f417daa3d81b49c121d69b1a4bdda48592cc300e893b210.jpg
2019-08-11T08:56:59.000Z,Suomen lentopallomiehet hävisivät myös päätösottelunsa – järkyttävässä tappioputkessa oleva joukkue jäi lohkon jumboksi,Suomi hävisi sunnuntaina Kanadalle.,https://img.ilcdn.fi/S0_7ZQB25E0Y0c9rNWTkfaYjoqw=/510x318/top/img-s3.ilcdn.fi/ebf44e2b9f02012c48d7f0e318ab0f4528b078b4ae297cfe4261b872f17b704b.jpg
2019-08-11T08:58:31.000Z,"Susanna Törrönen, 21, teki maailmanennätyksen ja voitti klassisen penkkipunnerruksen EM-kultaa – lähetti Suomeen piikin: ""Onhan tuo apurahajuttu kummallinen""",Suomalainen palkittiin EM-kisojen parhaana juniorinostajana.,https://img.ilcdn.fi/bBUc_FkbijapeufGaJz-MtpeGJs=/510x318/top/img-s3.ilcdn.fi/a3cdb6bc32494d81890e8e19a07055153e32439f3df38e635d8ef37c87030ba9.jpg
2019-08-11T09:02:42.000Z,Paikallinen asukas kuvasi lähietäisyydeltä tuhoisan tornadon – romut lentelevät auton tuulilasiin Luxemburgissa,Tornado runteli Luxemburgia perjantai-iltana.,https://img.ilcdn.fi/0HheGajh41DLHEReJwBz3ygwMvw=/510x318/top/img-s3.ilcdn.fi/c1a89a24170af3583736e4c78be68a1ae0a91dc74ecb6bad3c4dee033cc5c630.jpg
2019-08-11T09:18:01.000Z,18-vuotias painin Suomen mestari on kuollut auto-onnettomuudessa – ”Ei löydy sanoja kuvaamaan surua”,Painija Said Tasukhanov tähtäsi olympialaisiin.,https://img.ilcdn.fi/vrv_Xie85aOq6VFMZqgN8LhCMGg=/510x318/top/img-s3.ilcdn.fi/9cec229060e98490c934bc90650f70bfc027ccab1a196c1971ba8b5d380dd8d6.png
2019-08-11T09:18:41.000Z,"Muistatko vielä BB:stä tutun Iida Ketolan? Julkaisi kuvan 10 vuoden takaa: ""Näytin aina kuin olisin kännissä""",Iida Ketola-Korppila työskentelee nykyisin kampaamoyrittäjänä.,https://img.ilcdn.fi/s7awzx409EZo2hW8mmET_jZjo84=/0x508:2001x1759/510x318/top/img-s3.ilcdn.fi/3b90112ea51ac1b4cc494d2fda31d3f89c95827890de839e4b0129a2c21a6c6c.jpg
2019-08-11T09:27:54.000Z,Kesämökki paloi maan tasalle Varkaudessa – omistajan epäillään menehtyneen liekkeihin,Syttymissyytä ei toistaiseksi tiedetä.,https://img.ilcdn.fi/65mWcI0vTg_vFjJVBwZJTKTW9Gg=/510x318/top/img-s3.ilcdn.fi/06e699283da0bb730ccbf07137a76e9cb3fe6fea1ab85af8a834c174eb577848.jpg
2019-08-11T10:06:31.000Z,Hovi julkaisi suloisia kesäkuvia Estellestä ja Oscarista – Victoria-äiti heilui kameran takana,Kruununprinsessa Victorian perhe lomaili heinäkuussa Ruotsin länsirannikolla.,https://img.ilcdn.fi/j_A4B3QMLlnIG7AlUHtbue2Y0yU=/0x114:1904x1304/510x318/top/img-s3.ilcdn.fi/6ac3ff96ef5b9a0a4d4f17c57c563dc3359574f26e7d5ac6e7d70106cae6cb90.jpg
2019-08-11T10:15:10.000Z,"Sukeltajat Jani ja Ina menivät naimisiin samassa luolassa, jossa heidän ystävänsä kuolivat viisi vuotta sitten – ”Halusimme häillä pyyhkiä pois murheellisia muistoja”","Seremonia järjestettiin Pohjois-Norjassa Pluran luolan ilmataskussa, ja paikalle sukelsi hääparin lisäksi 68 vierasta.",https://img.ilcdn.fi/ZyOFve-bZ47-9cNvOHXZOP2UVd8=/510x318/top/img-s3.ilcdn.fi/041cac0d3706112fbc5655d759a3a23b85b216c48948290a18ca7a85e724d59e.jpg
2019-08-11T10:18:32.000Z,Huawein villit ennustukset viidelle vuodelle: supernäkö ja elämää robottien kanssa,"Huawei on julkaissut raportin, jossa kiinalaisyhtiö ennustaa teknologian ja teollisuuden alojen kehitystä vuoteen 2025 saakka.",https://img.ilcdn.fi/Y86c9E6NITUdtsm9itcNgamX-A0=/510x318/top/img-s3.ilcdn.fi/006f459417bca04c7091b9bdffd235f99da0db7add2bc3dd3e6b2d77b9fc84bc.jpg
2019-08-11T10:36:30.000Z,Trump levittää salaliittoteoriaa Jeffrey Epsteinin kuolemasta - vihjaa Bill Clintonilla olleen osuutta asiaan,"Seksirikoksista syytetty miljonääri Jeffrey Esptein löydettiin lauantaina kuolleena vankisellistään. Yhdysvaltain presidentti Donald Trump vihjaa, että presidentti Bill Clintonilla olisi jotain osallisuutta Espteinin kuolemaan.",https://img.ilcdn.fi/Eei4Ye2wO-hvbVyZ_BSIi-FMOe8=/510x318/top/img-s3.ilcdn.fi/fdca61318fc61406240387e36186e1591320b5cdd51ba0d62dde5c0886e16cf7.png
2019-08-11T10:39:14.000Z,Valmentaja järkyttyi olympialaisiin tähdänneen suomalaislupauksen kuolemasta – kertoi painijan poikkeuksellisen upeasta käytöksestä: ”Hän tuli tunnin ennen omia harjoituksiaan”,Valmentaja kuvailee Tasukhanovia erittäin lahjakkaaksi urheilijaksi.,https://img.ilcdn.fi/vrv_Xie85aOq6VFMZqgN8LhCMGg=/510x318/top/img-s3.ilcdn.fi/9cec229060e98490c934bc90650f70bfc027ccab1a196c1971ba8b5d380dd8d6.png
2019-08-11T10:51:56.000Z,Brittiseurapiireissä kauhistellaan Meghanin käytöstä: herttuatar vähät välittää tiukoista illallissäännöistä – osa jättää jo kutsumatta,Daily Mailin mukaan Sussexin herttuatar ei noudata brittiylhäisön illallisetikettejä.,https://img.ilcdn.fi/1_xY3QlPrrVJlfxZn8XK-LS77vE=/0x64:1394x935/510x318/top/img-s3.ilcdn.fi/6a89aed609862f9341dca39a2eade6941448f024b96daae48eadd4b0da46143e.jpg
2019-08-11T10:52:56.000Z,Suomalainen Mauno-siili on vasta puolen vuoden iässä mainoskasvo ja musiikkivideotähti – katso söpö video!,"Afrikkalainen nelivarvassiili on suloinen, mutta helposti vilustuva ja piikikäs lemmikki.",https://img.ilcdn.fi/RmbhWGaU05L-w-Ta53WFhCZJ1jA=/510x318/top/img-s3.ilcdn.fi/f66eb993283d8b15bdea4363387cff780dfc6f008c728b6a2100972f1218623f.jpg
2019-08-11T10:57:45.000Z,Auton pesu omalla pihalla: tiesitkö nämä 5 ehtoa,"Auton pesu omalla pihalla on monen mielestä itsestään selvä perusoikeus, mutta ympäristösäännökset rajoittavat pesuoikeuksia.",https://img.ilcdn.fi/oanVrovGw2T_a9mFe0Q7inlwKcA=/510x318/top/img-s3.ilcdn.fi/67501d314a794b7b24923c61f94a4438dbc7aa15ff74480139f54a713a03d092.jpg
2019-08-11T11:12:46.000Z,"Pride tuli ja meni, mutta Lääkäriliitossa kiistellään siitä edelleen – ”Emme saa antaa minkään painostuksen vaikuttaa hoitokäytäntöihimme”",Liiton jäsenjulkaisu on julkaissut hiljattain kaksi eriävää näkökulmaa aiheesta. ,https://img.ilcdn.fi/cICBWz1qXPnDaW2tCE7BtKFrbS4=/510x318/top/img-s3.ilcdn.fi/b9308454ed500e8486965fc84145d1235d8917eb0f3cbcee389ac9f6b699cfb0.jpg
2019-08-11T11:15:04.000Z,"Norjan moskeijaiskua tutkitaan terroritekona - epäilty ei tunnusta tekoa tai siskopuolensa murhaa, kieltäytyy kuulusteluista",Epäillyn kotoa löytyi hänen siskopuolensa ruumis.,https://img.ilcdn.fi/ior8AvHZn87APEuccGRDnwKDedU=/510x318/top/img-s3.ilcdn.fi/0913193e20b0c1b5e9f168242a33783f463af66e2fb7ea9da63e9dcf0ef893bb.jpg
2019-08-11T11:39:38.000Z,Rottaongelma ruokakaupassa: rottia vilisevä video tokiolaisesta liikkeestä leviää sosiaalisessa mediassa,Kaupan tuotteet kiinnostivat myös rottia.,https://img.ilcdn.fi/BTS8OdWxOeZwMGOjxdibCGDPGFk=/510x318/top/img-s3.ilcdn.fi/8dd6e0fb7b96a30a64b69343845d177931e5e5f99bfea3a4a4252f5b4af4fbb2.png
2019-08-11T11:49:36.000Z,"Ensitreffit alttarilla -ohjelman Sarin ja Antin rakkaus kukoistaa yhä, vaikka kotia on remontoitu ja mökkiä rakennettu: ”Aika kiireistä elämää”",Ensitreffit alttarilla -ohjelman toisella tuotantokaudella avioituneet Sari ja Antti ovat viimeistelleet kotinsa remonttia ja rakentaneet mökkiä.,https://img.ilcdn.fi/_73pWtnLjBsCIXexTn37h1pKaRg=/510x318/top/img-s3.ilcdn.fi/76c8eda05e44ad7f7c66704bf0dd3c507c2bfcc0c0f9d1210ea274e671a326f6.jpg
2019-08-11T11:55:11.000Z,"Suomi on yleisurheilun Superliigassa putoamisvaarassa – Annimari Korte, Ella Junnila ja lukuisat kärkinimet puolustavat jatkopaikkaa sunnuntaina",Suomi on putoamassa Superliigaa alemmalle tasolle Ykkösliigaan.,https://img.ilcdn.fi/fBr8Nw52xz3IcCWcJSAZzzZgyE0=/510x318/top/img-s3.ilcdn.fi/1ac29856830b55a470425ab9f189ada0240579c142b53c93c085ff62a5b193e3.jpg
2019-08-11T12:17:00.000Z,"Miksi koulun alku itkettää lasta? Psykologi neuvoo, miten lapsen jännitystä voi helpottaa","Mitä tehdä, jos koulun alku jännittää lasta niin paljon, että itkettää? Psykologin mukaan aikuisen tehtävä on hyväksyä ja opettaa lapselle selviytymiskeinoja. Vähätellä ei saa.",https://img.ilcdn.fi/m_4wUVSkUtqIJWj8bhZM9erDVJQ=/510x318/top/img-s3.ilcdn.fi/9acb6fdb43303a6a369d4a3819ec67414197249a49cf3083759aeb95d7ec034e.jpg
2019-08-11T12:48:17.000Z,Idoliaan jahdannut 11-vuotias juoksi vahingossa täyttä vauhtia päin tolppaa - tuloksena ikimuistoinen yhteiskuva,Liverpoolin Mohamed Salah pysäytti autonsa ja riensi häntä seuranneen 11-vuotiaan faninsa Louis Fowlerin avuksi.,https://img.ilcdn.fi/j6C84P_nd5X2L0Vao2uBao0dJ7Q=/510x318/top/img-s3.ilcdn.fi/07ab505f7000bf08961c367d75d70426c85fd4f23ed1584356a6784eff3c18d6.jpg
2019-08-11T12:49:35.000Z,"Vikojen suma iski VR:n junaan, sitten katkesivat sähkötkin - Mari juuttui tuntien odotuspiinaan kuumaan junaan pienen vauvan kanssa",Joensuusta Helsinkiin sunnuntaiaamuna kello 9.06 lähtenyt InterCity 6 juna on pahasti myöhässä aikataulustaan. Aikataulun mukaan junan olisi pitänyt saapua Helsinkiin kello 13.40. ,https://img.ilcdn.fi/KpEPMAwxWZPKNqZ7Kwkywrm_XI8=/510x318/top/img-s3.ilcdn.fi/66b4d0e15077307b83e16b8a29bfa9fddf263b2e8b6398b081c0cd733dee8308.jpg
2019-08-11T13:02:15.000Z,Tältä näyttävät tulevan Kaunotar ja Kulkuri -elokuvan suloiset päätähdet – äänirooleissa Marvel-tähti sekä konkarinäyttelijä,Elokuva saa ensi-iltansa vuoden lopulla.,https://img.ilcdn.fi/duGpdPJxzzsmxySMfI28nS7xWIw=/510x318/top/img-s3.ilcdn.fi/079d8b98b62b0ac0a40df0608eac37b4b2d7dec9dc020e0dd92858ba5ad22a7d.jpg
2019-08-11T13:14:44.000Z,Tässäkö uusi trendi? Englantilaisvaatturi luo unelmien häntiä asiakkailleen,"Miltä tuntuisi omistaa pörröinen häntä, jota voisi heiluttaa miten tahtoo?",https://img.ilcdn.fi/YRuBFNV8TnMz71GBYlSSZuXCFfk=/510x318/top/img-s3.ilcdn.fi/9b999aec477b6fbfe26822875465cee61c404ce95f76b544cc242729a0c71603.jpg
2019-08-11T13:15:53.000Z,Kuvat turmapaikalta näyttävät tuhon - 18-vuotiaan Suomen mestarin elämä päättyi kolariin linja-auton kanssa,18-vuotias painijalupaus Said-Magomed Tasukhanov kuoli Virossa tapahtuneessa auto-onnettomuudessa.,https://img.ilcdn.fi/fqphahnhS32WqGhBM6bxmoj2SdY=/510x318/top/img-s3.ilcdn.fi/42e0b8926679f9f8dc44ff980b48e53dbcfa65bccd6f4f9e8046d9232292cb21.jpg
