paivamaara,otsikko,tiivistelma,kuva,id
2020-02-11T14:45:18.000Z,Laskettelija kuoli Pyhätunturilla,Lapin poliisin mukaan lasketteluonnettomuus tapahtui tiistaina alkuiltapäivästä. ,https://img.ilcdn.fi/-Xh9NQxmL5mBZmUtRssynjVDnkk=/510x318/top/img-s3.ilcdn.fi/2caff972dad889834f8da67a26f1824bb7f24a2de9b303c001894fd1f1a754b2.jpg,C0A94C5B1DD847269EB596D8CB6FD4EC
2020-02-11T14:50:38.000Z,Presidentti ja puhemieskin ihmettelevät jo hallituksen avustajien määrää,Huoli poliittisten avustajien ja virkamiesten roolien sekaantumisesta on otettava vakavasti.,https://img.ilcdn.fi/xF4BPa-x8DXWtIz5gmh0s3dZVs8=/510x318/top/img-s3.ilcdn.fi/a309762b4f6658d1eb0ccf3be5a9ec0521d2a1374dee3deae7e4b81361e1e64f.jpg,45A4376D51A6434A9A9217A21399643A
2020-02-11T15:01:03.000Z,Edis Tatlin vastustaja vaihtuu – arkkivihollinen kieltäytyy ottelemasta,Edis Tatlin vastustaja päätti luopua mestaruusvyöstään.,https://img.ilcdn.fi/RVQKuEA3ofncOfaA3tVBsbK5e2I=/510x318/top/img-s3.ilcdn.fi/bc700b4298953d3624ac0a885ea7f76e359448e1ca8fc43a6602a021d3c38b6a.jpg,98B9919135CA4A26A9DAA72EF942DA07
2020-02-11T15:07:29.000Z,Moottorisahan pyörivä terä osui nuoren kesätyöntekijän polveen - kolmelle sakkoja,"Kesätyöntekijältä puuttui osa suojuksista, eikä vakituinen työntekijä ollut valvomassa häntä.",https://img.ilcdn.fi/yaCmxFKGGZFCvyUSrhRbGBHuYQE=/510x318/top/img-s3.ilcdn.fi/10f1a912a15200684015aeeab0f2e163f7d4dd52a76e492f98577cb89998b2bc.jpg,EF2890CA036C412A9ADDE6044B731985
2020-02-11T15:29:06.000Z,Joaquin Phoenix sai maidontuottajat raivon valtaan Oscar-puheellaan,"Näyttelijä Joaquin Phoenixin puhe Oscar-gaalassa on suututtanut maidontuottajat Yhdysvalloissa, kertoo USA Today -lehti.",https://img.ilcdn.fi/IvG9TrdwAdqa5dZShEeZQezKFQs=/510x318/top/img-s3.ilcdn.fi/55ed59579516785adf97aca5070eb4a14d883a7bec6276e35dd46dc149912006.jpg,A943B9C08FCF4E969605166A2843A285
2020-02-11T15:39:12.000Z,"Näin oppositio rökitti pääministeri Marinin hallitusta: ”Räyhä-Mykkänen”, susia ja ahdasmielinen vihervasemmisto ",SDP toivoi oppositiolta yhteistyöhalukkuutta.,https://img.ilcdn.fi/zLpLxGTcGcp-5tcneuL7ok72wI4=/0x128:6000x3880/510x318/top/img-s3.ilcdn.fi/b7ad98d01a082cd7a69046b51fd8d197e1d87478a85f8ec0c63e8dba4bee5fce.jpg,91A6E087F12748CEAE897A8F078E0C5E
2020-02-11T15:54:09.000Z,Erikoinen tilanne: Rikkoiko NHL-joukkue sääntöä peräti 20 kertaa? Viiden miljoonan sakot uhkana,"Arizona Coyotes saattaa joutua maksamaan jopa viiden miljoonan dollarin sakot, jos seuran katsotaan rikkoneen NHL:n sääntöjä.",https://img.ilcdn.fi/oYPJTXf8ru_2Rfp18opG0-7VWGI=/510x318/top/img-s3.ilcdn.fi/96acc8b759e8a5e272286c825c143376e72fde2e186dd761eca54a3d65c13948.jpg,92EBAE2C89BB45A6BA627819739EBE23
2020-02-11T16:03:11.000Z,Hallituksen selvitys: Dieselin verotuesta luovuttava – samalla loppuisi dieselveron perintä,Tuore tutkimus näkee dieselin verotuen poiston konstina vähentää päästöjä. Tuen poisto lakkauttaisi tutkimuksen mukaan myös nyt perittävän dieselveron.,https://img.ilcdn.fi/TLrKfuwqzxG0Bu2r8DzcnTgr_co=/510x318/top/img-s3.ilcdn.fi/7d3a3b4554611597d57fc5fa3a1c53214214b2bfab8911ee370c63e1a366073b.jpeg,8682A6E7BE764013BEDEDF0A234798AD
2020-02-11T16:18:57.000Z,Tutut ketjuliikkeet yllättävät nyt trendihuonekaluilla: eivät vaadi jättimäistä lompakkoa,Ketjuliikkeet ovat vastanneet ajankohtaisiin trendeihin.,https://img.ilcdn.fi/-t9cM4TBRmywtIWOIci4VQGf5n0=/510x318/top/img-s3.ilcdn.fi/53fd322addc5f7acaae155518d87680e1bd115c7eec6cddae3a97c6cd3a8134b.jpg,0F68EFEE3CD1498091F4D386E31430BE
2020-02-11T16:19:39.000Z,Kovista kivuista kärsinyt Madonna puhalteli keikan jälkeen – kasvot kielivät tuskasta,"Madonna on kertonut kärsivänsä kovista kivuista, jonka johdosta osa keikoistakin peruttiin.",https://img.ilcdn.fi/Gosq8zTEFEWcJFuXE6BJ4v3nQS4=/510x318/top/img-s3.ilcdn.fi/20e30b2a01c341b2b8431ae9ed98abdaa05beac3d9dd1a665a657a7db87d5139.jpg,0766BBF2B7BD402DA38667FB6A971238
2020-02-11T16:20:56.000Z,Video: Pysäköidyt autot jäivät tulvivan veden varaan Skotlannissa,Kymmenkunta auto jäi tulvaveden saartamaksi Dundeessa.,https://img.ilcdn.fi/YUVFoY8cBEcKfswP1W_-yCki46U=/510x318/top/img-s3.ilcdn.fi/77ab66be95beb02e5c4019ea643e456174fcb095ba979c0768067e2ca820c479.jpg,CC5FADC1E0CB419BAADFF58AFA79AD82
2020-02-11T16:30:37.000Z,Yllättäen ovensa sulkenut huippusuosittu Farang avautuu jälleen - mikä ravintolassa on muuttunut?,"Kohta Tomi Björckille ja Matti Wikbergille selviää, miten ravintolan sulkeminen ja sen uudelleen avaaminen onnistuu. Uusi Farang avaa ovensa tämän viikon perjantaina. ",https://img.ilcdn.fi/0RnVlrjLPp5Q4B0ekeokmMbGKck=/510x318/top/img-s3.ilcdn.fi/304f23be5d8e771b608948ee695bfaa2450ba97196c0fc2149f318b36759e9de.jpg,C0AAB2C58FC747D69DC58CED6DEBE24C
2020-02-11T16:48:58.000Z,Elias Kuosmanen sai isän kädestä EM-välierässä – keskiviikkona painitaan pronssimitalista,Elias Kuosmanen taipui selvästi armenialaisvastustajalleen.,https://img.ilcdn.fi/OLx9AI6HPDrDErZgH-tvArc0hpE=/510x318/top/img-s3.ilcdn.fi/75fb08f9e1cb80e2f4e002de1dec632448fb04ebd2db88b01eb7de0cdb67c533.jpg,808D0C6561704BE59CCBC3BAC97B2119
2020-02-11T16:49:03.000Z,Voita yhteinen elämys sydänystäväsi kanssa – arvo 200 euroa,Iltalehdessä vietetään Ystävänviikkoa. Osallistumalla Instagram-kilpailuun voit voittaa 200 euron elämyslahjakortin.,https://img.ilcdn.fi/hvArYCYoumyiRn-fBLF_Oi3vJG8=/510x318/top/img-s3.ilcdn.fi/7b06ee6064ef9d6de8f3ba3dbf1325c04bf3d3a9a26b1f1e38b271baf0dcd2ac.jpg,1E9F6E9F5216424BBBA0AD4986935667
2020-02-11T16:49:38.000Z,Masentavalle märkäyttäjälle ei näy loppua – hiihtolomalaiset saavat etelässä unohtaa hiihtämisen,Tämä ja ensi viikko ovat vuodenaikaan nähden tavallista sateisempia.,https://img.ilcdn.fi/VDZxRnoJmmPkFc9j1vkEQCsyPtA=/510x318/top/img-s3.ilcdn.fi/e796ca430f83885008860862ede12b6d7f90f222b8e025ee93b20287e13a56f1.jpeg,E1FD63EE31F64FBBB97BE0BC71B44288
2020-02-11T16:52:26.000Z,STT: Mirjami Penttisen seuran kokoukseen kutsuttiin järjestyksenvalvojat – paikalle jonotti yli sata ihmistä,Mirjami Penttisen toiminta ja sitä seurannut keskustelu on jakanut HSK:n. ,https://img.ilcdn.fi/4sdEq0tmNNVFH_AieabqUuVNUXo=/510x318/top/img-s3.ilcdn.fi/fde02d1223513678372986e113649b359a15b5147730764f20f04361775ecc64.jpeg,12A66B0AADC34C7DA6B4FFB31E2F1696
2020-02-11T16:55:05.000Z,Pilvi Hämäläinen julkaisi rujon kuvan – keho pahoilla mustelmilla Putouksen jäljiltä: ”Kamppailin nuken kanssa”,"Pilvi Hämäläinen julkaisi Instagramissa kuvan, joka paljastaa, että näyttelijän työ voi olla välillä hyvinkin fyysistä.",https://img.ilcdn.fi/lx42ztOEf4VML4_kVi5xOmQLbEs=/510x318/top/img-s3.ilcdn.fi/bb1c891e39249d4c4707c9f38aae5511d248dab9a902c1a4a56ccaac51f7e586.jpg,6ED58B0873E341ADAAF0B69D011B836A
2020-02-11T17:04:16.000Z,Alma-kysely: Perussuomalaiset jatkaa suosituimpana puolueena - PS:llä on myös uskollisimmat äänestäjät,"Antti Rinteen joulukuinen ero pääministerin tehtävästä ei ole murentanut hallituspohjan kannatusta: äänestäjistä 53,2 prosenttia luottaa Sdp:n, keskustan, vihreiden, vasemmistoliiton ja Rkp:n viisikkoon.",https://img.ilcdn.fi/DkZ0gf78mYMs9P-0y48dEVM1iJo=/510x318/top/img-s3.ilcdn.fi/6de6fcc5f93cd721c5f048c950b408df480cc0b1159bcb72e76395e5417aa87a.jpeg,2DDEB1CC2DA443A6A3BB8D9018D6821E
2020-02-11T17:19:02.000Z,"Syö, juo ja elä näin, jos haluat madaltaa korkeaa verenpainetta - Tieteen uusimmat löydökset",Miten korkeaa verenpainetta voi ehkäistä ja hoitaa? Viime vuonna tiede selvitti muun muassa verenpaineen ja muistisairauksien yhteyttä.,https://img.ilcdn.fi/VYywQRVjmeF6I0ULHAd29XhgidA=/510x318/top/img-s3.ilcdn.fi/49f000f2ab06933ef6aad3d5fdb9c35a3c2d107f58e9557796cd82d1a549ff87.jpeg,BB30A6DF036C4C47A1603703CADF13DD
2020-02-11T17:32:59.000Z,"Kaikki haluavat oluelle Li Anderssonin kanssa, mutta vasemmistoliitolle Sanna Marin tuottaa päänvaivaa, Halla-ahosta puhumattakaan","EVA paljasti perussuomalaisten ja punavihreiden väliset voimasuhteet jo vuonna 2017. Li Andersson on suosittua seuraa, mutta se ei yksin riitä, kirjoittaa Iltalehden Lauri Nurmi.",https://img.ilcdn.fi/EeaIWDe7-nHLEVcpAu11azsZLZ8=/510x318/top/img-s3.ilcdn.fi/f38bfdd04c5ea366dc313917b83dfb3e48d38a67cfcb28ce1e5d9315ce7f1e93.jpg,52A47E651D254B72897F9309E99DFB01
2020-02-11T17:46:50.000Z,Anna: Iiro Seppänen Kaapo-veljensä kuolemasta: ”Oli outo kokemus seurata elämänliekin hidasta hiipumista”,Iiro Seppänen muistelee Anna-lehden haastattelussa edesmennyttä Kaapo-veljeään.,https://img.ilcdn.fi/OiNW6XSRSh15amCdNx7AlZkBVDE=/510x318/top/img-s3.ilcdn.fi/7e3bf89c121a6a4bb8f1f1bdc46278acdb5612a425e3493008b9422cb738674f.jpg,C194A238F7654460925201C23F100DB7
2020-02-11T17:49:04.000Z,"Karu tarina leviää somessa: Lompakko katosi, mutta lähimaksut vain jatkuivat suljetulla kortilla – Näin Nordea kommentoi",Nordean mukaan lähimaksua ei voi kytkeä korteista pois.,https://img.ilcdn.fi/CVIoz9nBMib__J0tKBGVoIoGDSw=/510x318/top/img-s3.ilcdn.fi/e5b52ead677a8896ac6b8e76ebead3169d7ec4b048130f76921e7e7bbd175b02.jpg,8231A709AB7945B09426D456BB6590EC
2020-02-11T17:49:06.000Z,Finlandia-hiihdon pääsihteeri kuvaa lohdutonta tilannetta: ”Ne pohjat olivat suurimmaksi osaksi hävinneet”,"Finlandia-hiihdon pääsihteeri Tiina Hernesniemi sanoo, että kilpailun järjestäminen tänä vuonna oli täysin tekemätön paikka. ",https://img.ilcdn.fi/iEOmtYE_22CNUXs7zDXdTJxmnbA=/510x318/top/img-s3.ilcdn.fi/da1f55dd3d9426698a355a983af35c03bb18aa005ae9ae947e4be558715b2167.jpg,3F18388FEB1C4F30A70494E5E42870DB
2020-02-11T18:08:24.000Z,Tässä on Ferrarin uusi F1-auto! Sebastian Vettel löysi heti eron viime kauteen – katso kuvat,Tulevan kauden Ferrarissa on enemmän mustaa väriä kuin viime kaudella.,https://img.ilcdn.fi/2lfmg0siid1OSDmYZ6X0OHKjTgs=/510x318/top/img-s3.ilcdn.fi/799820c989bbe24bf7e403430e4c0a32641132006142b0bc6cf32b1c702794ec.jpg,A63321BD35A34F63865DA01C77F4BC47
2020-02-11T18:14:23.000Z,"Tiktokissa ihmetellään käsitemppua - huomaatko, mitä kädelle tapahtuu?",TikTok-sovelluksen hämmentävä käsitemppu leviää somessa. ,https://img.ilcdn.fi/7mkZSbGXNedrRXbbLpSPqObeDfE=/510x318/top/img-s3.ilcdn.fi/0824dc2e3ea8b2c2d34d12fbc0ca0fcb721386ba39e4ccf87edf2dfc1430bd35.jpg,EB1642637A8944E1BCF3A09F6E67300F
2020-02-11T18:15:21.000Z,Presidentti Halonen valitsi anteeksiantoemojin – voidaan nähdä puhelimissa ensi vuonna,Emojin tarkoituksena on sanoa helposti ”Annan sinulle anteeksi”.,https://img.ilcdn.fi/kphyAVsgMoFZYZ9lEKCDLEqF5vI=/510x318/top/img-s3.ilcdn.fi/9229da6d283bc2f1f6ecc25e4c7f232a4897bfc30f89e559adcf7ca4e4f83dc2.jpg,A91E1F6721CE4C32A0C25D43D60C7FB4
2020-02-11T18:21:58.000Z,Jere Karalahti hehkuttaa hahmoaan Aku Ankassa – ”Jörö Kurulahti” laukoo maaleja: ”Yksi suurimmista kunnianosoituksista”,"Ex-jääkiekkoilija Jere Karalahti kertoo olevansa otettu siitä, että hänen hahmonsa seikkailee Aku Ankassa.",https://img.ilcdn.fi/AScQPAaQmKevUzhboaaGCS8NH9w=/510x318/top/img-s3.ilcdn.fi/ef69693f7787129bc84ce5ff1ff3f6f823bd359790e2933434ca3581edd7a611.jpg,A1C0F83C04084033B1FBF8A8D02C32FB
2020-02-11T18:26:56.000Z,Tältä näytti Kaj Kunnas hiukset päässä – vanhan valokuvan näkeminen nosti muistot esiin,"Suosikkiselostaja Kaj Kunnakselle näytettiin yli 30 vuotta vanha valokuva, joka on otettu ennen hänen kaljuuntumistaan. ",https://img.ilcdn.fi/4FqG-g-Dfy71ZE0UfCjadcF4k6Y=/510x318/top/img-s3.ilcdn.fi/f6a9533762ea7bc8c740c9e29d14021c5b96136db682405b5c008f39fd04a131.jpg,CCD28885975F4194A11EB9944EF0F7AE
2020-02-11T18:41:05.000Z,"Suomalaismalli maailman huipulla – kuvankaunis Paula, 26, teki historiaa ennätyksen rikkoneessa tempauksessa","Hapenpuutteen, paukkupakkasen sekä muut ääriolosuhteet selättänyt suomalaismalli käveli maailmanennätyksen rikkoneella catwalkilla Nepalissa.",https://img.ilcdn.fi/l7uIfGcjA717unMMCEMqTcJs1kk=/510x318/top/img-s3.ilcdn.fi/91d0ce19eb34ad01c103cf2aa0c1af761bafb421d4c9c290cc1768a05da87050.jpg,F00F4B46A54E4E27BEFAC55167ECCDC1
2020-02-11T18:46:01.000Z,Ferrari kiusoitteli F1-autonsa uudella ulkoasulla – Mercedekseltä heti kylmä kuitti,Ferrarin ensi kauden F1-auto ei ollut monien mielestä yhtä mullistava kuin olettaa saattoi.,https://img.ilcdn.fi/D2nUBCcqC4ku6I4T8kJmC_5PpA0=/510x318/top/img-s3.ilcdn.fi/ef012708c557598ae8c102bfdbb86f27a56a7eb9d97ef7612e4f1f58653b3f78.jpg,4408836FDD154095892AEE5B16CD708E
2020-02-11T18:47:57.000Z,Kaj Kunnas sai karmean törkypalautteen 2014 – osaa sen yhä sanasta sanaan ulkoa,"Urheiluselostaja Kaj Kunnas osaa yhä ulkoa haukkupalautteen, jonka sai tv-katsojalta kesken Sochin olympialaisten 2014.",https://img.ilcdn.fi/PF4XxX0dR1ebwBqYLPbcedNYG1c=/510x318/top/img-s3.ilcdn.fi/a4aa4cced822cd83bf50e92c24923b4d19d6af16eb29332e6151a621b736ecf9.jpg,51A6560BE01A496E93AE84FC04FEE452
2020-02-11T18:53:17.000Z,"Historiallinen tappio oli jo tulossa, ”Mörkö” Anttila ja Savinainen pelastivat Jokerit",Jokerit joutui tiukille Traktorin kanssa ja oli ensimmäistä kertaa hävitä kotonaan Tsheljabinskin miehistölle.,https://img.ilcdn.fi/gRTPG7D2-p3jQugfTKy9hmdd6pM=/510x318/top/img-s3.ilcdn.fi/9b3631c8c53dd8de4c162da0503b320f12fac7fd586d0ff89807e14e50e9d90c.jpg,6648B252EAD94B9B8162626754B20371
2020-02-11T19:02:48.000Z,Suomessa kuvattiin 12 julkkiksesta täysin uudenlainen tv-ohjelma – taustalla tiukkoja salassapitosopimuksia ja piilottelua ,"Helsingissä kuvattiin viime syksynä kaikessa hiljaisuudessa ohjelmaa, jonka vuoksi moni ohjelman tekijä on joutunut allekirjoittamaan tiukan salassapitosopimuksen.",https://img.ilcdn.fi/NNKsqMGSdNPvRs9nXcHoBFm08mA=/510x318/top/img-s3.ilcdn.fi/81d9802b858b943e46e5d4bd1dec9951cf46161b88768f102f0b3f3f6d62859c.png,7F6307785434437691FE817CBD4C240D
2020-02-11T19:33:51.000Z,Yksinäiset vanhukset juttelevat viherkasveille – haluaisitko sinäkin auttaa heitä? Näin se onnistuu,"Markku Remes on luottoystävä seitsenkymppiselle leskimiehelle, josta hän ei puolentoista vuoden tuttavuuden jälkeenkään tiedä edes koko nimeä.",https://img.ilcdn.fi/L7pep_aJIRbA2EP9l_oJgwGvN7A=/510x318/top/img-s3.ilcdn.fi/53779ecccbf75c6cfcfad66231c18d30662d29bc113e250f46bdbd9fa60ac5be.jpg,7E9BD0477CAF4673A5B0C9E8F13EDE73
2020-02-11T19:34:40.000Z,Koronapelko varjostaa maailman suurimpia mobiilimessuja – nämä yhtiöt jättävät tapahtuman väliin,Suuret teknologiayhtiöt ovat ilmoittaneet jättävänsä MWC-messut koronaviruksen vuoksi väliin.,https://img.ilcdn.fi/wd2PiWtRQKObkyYkcQ1Vb1GkD3w=/510x318/top/img-s3.ilcdn.fi/f41771bb60f0c8a0d82a89245588e44a76c556435debaafab6f94b5f8d632eca.jpg,29C7DA79CBEF4E8696A7AC05C4ED7BBC
2020-02-11T19:46:59.000Z,Arvi Savolainen hävisi EM-pronssiottelun niukasti – yli 20 kiloa painavampi saksalainen vei mitalin tasapistein,Arvi Savolainen hävisi EM-pronssiottelun.,https://img.ilcdn.fi/nI0hFZjYNLAoWxQ4NXZg4Mo2iIw=/510x318/top/img-s3.ilcdn.fi/89014a0007c19d19baadf11fc95cbfe4f57d3deb31dc5a50718ac1ce99546aa3.jpeg,8A4B0ADA02D540C7997637D192D31987
2020-02-11T19:56:00.000Z,Yle: Ministeri Ohisalo haluaa Suomeen perheettömiä lapsia Kreikan pahamaineisilta leireiltä,"Sisäministeri Ohisalo ei maininnut, kuinka monta alaikäistä Suomeen mahdollisesti tulisi Kreikan leireiltä.",https://img.ilcdn.fi/iWaB9flUHYe3KoiVyZsTcLfK_Jk=/510x318/top/img-s3.ilcdn.fi/17d964e7925e739beabbb9393946e1c942c8e8df249750043fbac4714f76aa5b.jpeg,8AD37D5A95A64355872157854E85515B
2020-02-11T19:59:51.000Z,Varo ”ilmaisia” elokuvia – haittaohjelmia levitetään aidolta vaikuttavien sivujen kautta,"Ihmisiä yritetään huijata sivustoilla, jotka lupaavat elokuvia ilmaiseksi.",https://img.ilcdn.fi/Xs80ZVWJjxpPjmiycwj1NXDht-Y=/510x318/top/img-s3.ilcdn.fi/9a0fb6e39dac26d8ae17bfa79d0f95e70210002148cfc7ac609b81dc52eff16e.jpg,916F3D2937974323A5530CAF1C13794B
2020-02-11T20:14:57.000Z,Surullinen paljastus: jalkapallolegenda Pelé on ”vankina” omassa kodissaan – ”Hän ei halua mennä ulos” ,"Jalkapallolegenda Pelé, 79, on huonossa kunnossa.",https://img.ilcdn.fi/0TJUhsOM36hWzMZv17JxykTzYhM=/0x64:3000x1940/510x318/top/img-s3.ilcdn.fi/8f89b2a20c225e0257c8eb9458416685b5ee90eaf70d98185d642cc301599f5f.jpg,2963F5AD3E5C4001B67A023FCD31833D
2020-02-11T20:26:53.000Z,Jamie Oliverin avioliitto kukoistaa: Haluaa naida vaimonsa uudelleen 20 vuoden jälkeen – katso kuvat vuosien varrelta,Julkkiskokkina tunnettu Jamie Oliver suunnittelee vaimonsa kanssa häiden uusimista. ,https://img.ilcdn.fi/0LrUAafDg8sqSKdhMfUKgTI29wQ=/0x283:1650x1314/510x318/top/img-s3.ilcdn.fi/c165e37a783a337761a89d003e0f680edc4f1f258132405f78ea7b8f6edba12c.jpg,FDA7D839FE8045B189BD5F2597FD125B
2020-02-11T20:48:01.000Z,"""Seinillä oli oksennusta"" – ampumahiihtäjä sai kovan rangaistuksen sekoilustaan",Anton Pantov oli toista kertaa juopuneena maajoukkueen tapahtumassa.,https://img.ilcdn.fi/dE80Jlu7-4xx6sGGqFS38b87rcY=/510x318/top/img-s3.ilcdn.fi/d8b1f3918a914c87f4e82a856ac1f4af6a05aba058a8c8bd0816e341c847be52.jpg,27218102EA72469E8A9A81D0AC37C555
2020-02-11T20:49:44.000Z,Syyte: Ryöstön uhria pidettiin vankina ja kidutettiin julmasti Kouvolassa peräti kuukauden ajan,Syytteen mukaan mies ja nainen pahoinpitelivät uhriaan piinan aikana julmasti.,https://img.ilcdn.fi/Es50aA35l_hiuudAaAwmY3fa3gg=/510x318/top/img-s3.ilcdn.fi/03e9b96e8f57d7d5860d75869c1d02390aa2196287613ec1660069c5ec71745e.jpg,AB2F57D7E8A6489CA65BB04FBEAC4C01
2020-02-11T22:19:53.000Z,Bernie Sanders niukkaan voittoon New Hampshiren esivaaleissa – Biden floppasi,Ero toiseksi tulleeseen Pete Buttigiegiin jäi hyvin pieneksi.,https://img.ilcdn.fi/BDwbzpn7kGQSfWwdDNVjCjjw4ac=/510x318/top/img-s3.ilcdn.fi/7a5269b997104a0b731127dee0408d9310027be6d322f3d83be256b90e5a31fa.jpg,A340C2528DE64025BAAEDA73C8B8F8CE
2020-02-11T22:45:18.000Z,Jennifer Aniston ja Brad Pitt kohtasivat Oscar-gaalan jälkeen – ex-vaimolta onnittelut palkinnon johdosta,Viime aikoina huhut Jennifer Anistonin ja Brad Pittin lämmenneistä väleistä ovat velloneet villeinä.,https://img.ilcdn.fi/eq28RVCoiWH58n-wmEnRgM3bmLs=/510x318/top/img-s3.ilcdn.fi/ad51077b6bc493da07f63b246fc1891cd7c40fa035ea1ed041668ad921d9dafa.jpg,AE2EAA46788945E1906C9245AF8DC642
2020-02-11T23:22:25.000Z,Donald Trump ottaisi vastustajakseen mieluummin Bloombergin kuin Sandersin – ”Hän ostaa tiensä sisään”,Trump ei usko Mike Bloombergin mahdollisuuksiin presidenttikilvassa.,https://img.ilcdn.fi/HSeEoj0c0-wgOBbUCuXxNsYhsQM=/510x318/top/img-s3.ilcdn.fi/d161e02f588da07bdb74ea0f95c73d4a8bf205cdc24920fe1f266ba99937e8a4.jpg,78F01E7FA5AA466CB27B6003808AAC11
2020-02-12T00:00:13.000Z,Horoskooppi,NULL,NULL,E8CF579213DA49128570AF486EAA410A
2020-02-12T00:57:30.000Z,Oscar-gaalan katsojaluvut putosivat Yhdysvalloissa – kaikkien aikojen surkein tulos,Oscar-gaalan televisiokatsojaluvut laskivat kaikkien aikojen huonoimmiksi Yhdysvalloissa.,https://img.ilcdn.fi/xDBRBHRVPJv-4Y51S3iuMRqBBsY=/510x318/top/img-s3.ilcdn.fi/b58f694f015a80a264254bae2e6cf3a0fab074fce6e168716b7b47d374a70640.jpg,0BF4E90ACB7B45DF97F3606C9133CF15
2020-02-12T01:31:52.000Z,Eric Trump lyttäsi Brad Pittin Oscar-puheen – ”Omahyväinen elitisti”,Pittin kannanotto ei miellyttänyt presidentti Trumpin poikaa.,https://img.ilcdn.fi/nVdXbHYsU6ShEV55RAy_Ed54CB0=/510x318/top/img-s3.ilcdn.fi/c43c69abd1484ead5e78877d2e68f6180805ff5252956a1e74647331ffffdd81.jpg,9F04087A3F724898B72A89C1322EFD47
2020-02-12T03:01:08.000Z,Britannia rakentaa 125 miljardin euron luotijunaradan – tällainen siitä tulee,Britannian hallitus hyväksyi maan historian kalleimman rautatiehankkeen.,https://img.ilcdn.fi/07-OzEAhxPKdgNd6kBVwtEqItQc=/510x318/top/img-s3.ilcdn.fi/0b1798f6cde0d9c853d578ba45c244828d9f2f7069c87909cbf7908e05aa6bdf.jpg,6A7D8B19E5854C7BA60328650BA74899
2020-02-12T03:12:57.000Z,"Keskiviikon sää on etelässä epävakainen, pohjoisessa on pikkupakkasta",Epävakainen talvisää jatkuu keskiviikkona.,https://img.ilcdn.fi/cSslBsttiwwOMAvHhHe5uuJxnPw=/510x318/top/img-s3.ilcdn.fi/2f3d446c790d1a2b06070615f1be3fb66b405e75cd58198862d38bb87ffb4750.jpeg,28338C6C8E6E44368FB2B800D817539F
2020-02-12T03:30:44.000Z,Yksinäisyyden kierre ,"Miksi joillekin ystävien saaminen tuntuu olevan helppoa, ja sitten on niitä, jotka jäävät aina yksin ja tuntevat olonsa ulkopuoliseksi?",https://img.ilcdn.fi/V_VM13wgOuPum0cK--aA2s-583E=/510x318/top/img-s3.ilcdn.fi/0cec7b48ab3c4800f05acc69a2e49b1bd591f905583262f41aca502f64091449.jpg,2BFC25D94AA1431FB17F584D7588F2D9
2020-02-12T03:43:31.000Z,Patrik Laineen ja Kaapo Kakon kohtaaminen päättyi yllättävällä tavalla – ”väärä” mies iski kaksi maalia,Winnipeg Jets ja New York Rangers iskivät yhteen Winnipegissä.,https://img.ilcdn.fi/5DdxGi4MnuGbxxnZf64VX1l-KXc=/510x318/top/img-s3.ilcdn.fi/16e5ab7a3bab77e07f99e25d9bbe6ffb2fba1e6e04cfb03bb1182b21ca760302.jpg,0E5C7A1859FD4E429018428647329D51
2020-02-12T03:55:00.000Z,"Kun Barbara Petzold juhli kympin olympiakultaa Lake Placidissa, ketkä suomalaiset sivakoivat hopealle ja pronssille?",Iltalehden perinteinen urheiluvisa on myös verkossa. Montako tiedät?,https://img.ilcdn.fi/5ure0E_tCp4wlGeoX0HffhcrBMM=/1061x45:3000x1178/510x318/top/img-s3.ilcdn.fi/a1bae864043e960de7769e0f0af2d5c4dd4cc06331968885d10e8bb63ccb8030.jpg,A1CCA3C55B4A4F11824D59405411741F
2020-02-12T04:05:51.000Z,Musta alkutalvi vei kävijät etelän hiihtokeskuksista – yrittäjä-Tapani tuskaisena: ”6–0 turpaan”,"Soittokierros hiihtokeskuksiin kertoo, että kävijämäärä mustana alkutalvena etelän keskuksissa on ollut jopa puolta normaalia alhaisempi.",https://img.ilcdn.fi/uGfEp2A-yDBEzeBelKm7VsW--M8=/510x318/top/img-s3.ilcdn.fi/d2e741b6ccfd6caed0424a26968e403c85baa6c4bab1d5e9bedfcd45f1e2c349.jpg,2EA843BDB29C491888096EAD522E0D9F
2020-02-12T04:12:16.000Z,La república - tasavalta -sarjan ystävät huomio! Tänään alkaa uusi espanjalainen draamasarja,"Yle Teema&Femillä alkaa tänään uusi espanjalainen historiallinen draamasarja, jota seurataan aina keskiviikosta perjantaihin kello 20.",https://img.ilcdn.fi/Hg4VoiLpdfMZisVDucS0QJE6mCU=/510x318/top/img-s3.ilcdn.fi/51acb82cdb43de40eb8bdcbc6ecf907cfa86ced918a90b54fd1c51c29b40870a.jpg,AF7F6074EEED4DFAB4FEC7D6F31F1E48
2020-02-12T04:23:45.000Z,"NHL-pelaaja sai sydänongelmia ja lyyhistyi vaihtopenkille – kuljetettiin tajuissaan sairaalaan, ottelu keskeytettiin",St. Louis Bluesin puolustaja Jay Bouwmeester kärsi sydänvaivoista ja lyyhistyi vaihtopenkille.,https://img.ilcdn.fi/rqHzvQN8on5DAt_MG_c3JGsC6_s=/510x318/top/img-s3.ilcdn.fi/de5213a77a200aba948ce8ea28c02a5f24a161dabda1fe3e95fcf7b4a509e081.jpg,3CC765E97427408A88BA5448D145E018
2020-02-12T04:34:38.000Z,Olet mitä syöt: Pippa Laukka kauhistuu Kaisa Liskin herkkukaapin sisällöstä – jääkaappi kertoo toista tarinaa: ”Tämä on aika harvinaista”,Keskiviikon jaksossa hyvinvointilääkäri Pippa Laukka laittaa uusiksi kiinteistökuningatar Kaisa Liskin ruokavalion.,https://img.ilcdn.fi/_T4Sm5vutedcQf4Fds2jqvFNWQM=/510x318/top/img-s3.ilcdn.fi/9096533c892f2f9aa86e8c8e798e9bd84908722ac4dc21092beb7569631a63c7.jpg,E3FE23060EFD4B89BFEB22885FDCA0A7
2020-02-12T04:41:01.000Z,Ryhävalaat näyttivät hyppytaitojaan – luontokuvaaja ikuisti ne videolle,Kahden ryhävalaan liikkeet tallentuivat ilmakuvaan Havajilla.,https://img.ilcdn.fi/YxOO_zupON1AI01UAhEmxP6iiJc=/510x318/top/img-s3.ilcdn.fi/6fd0ad7ae4d30dea6545a16ec65e15a461d5b382ff5a7910424b4149630c9852.png,7BDCFC1266C04777B493C0E57BF747A9
2020-02-12T05:00:00.000Z,"Mercedes-mekaanikko Tuomas ja Mobilo-liikkuvuusturva varmistavat, että matka jatkuu",Autojen huolloissa on eroja. Vehon merkkihuollossa asiakas saa paitsi maan parasta Mercedes-asiantuntemusta myös maksuttoman Mobilo-liikkuvuusturvan autolleen.,https://img.ilcdn.fi/f4NSkidgTzt_WD5OI1Y3lSar_hE=/510x318/top/img-s3.ilcdn.fi/80ab7ae0eb3852ad03b4aa1025e71bf04aa4c385dd45f57e359657c4d5f18b02.jpg,F20E330ABE83476B8E49C2A69E5104E3
2020-02-12T05:02:00.000Z,"Hoitovapaa, päiväkoti vai hoitaja kotiin? Täältä löydät kaiken tiedon lapsen hoidosta ja etuuksista",Raskaaksi tullessaan vanhempien on oltava yhteydessä jopa seitsemään eri tahoon. Byrokratiaa helpottamaan on luotu Suomi.fi.,https://img.ilcdn.fi/4qP55U9MC8QfV_mIoiYRbnJykDk=/510x318/top/img-s3.ilcdn.fi/3c7316bb0b8ae4b1740f8a3cc3a681c056743843b896bfb4459d1931b613ecba.jpg,CC8BA4B9BDA047A989582B8D03B40CB1
2020-02-12T05:02:38.000Z,Tänään tv:ssä: Espoolainen nainen surmattiin raa’asti - henkirikosta tutkittiin 20 vuotta,Arman ja Suomen rikosmysteerit -ohjelmassa perehdytään rikostapaukseen vuodelta 1987.,https://img.ilcdn.fi/6OVPf5Bnecmlb5SY9MGhuhHTF_g=/510x318/top/img-s3.ilcdn.fi/77f467b9e20eb99589577fde7781806c979abf3a22f8b8a71d0db1487c753838.jpg,3CE792079DE94702B5093CC431712CFA
2020-02-12T05:02:42.000Z,Juha Sipilän hallituksen aikana tehdyistä Neste-kaupoista on koitunut lähes miljardin euron laskennallinen tappio veronmaksajille,Onko valtio-omistajan menettely ollut viisasta ja oikein ajoitettua? kysyy Iltalehden Mika Koskinen.,https://img.ilcdn.fi/FlTeKvqQwB1s1QFOWA5fMUlot3s=/510x318/top/img-s3.ilcdn.fi/634585f123ef799b73859516a9817a0960e6c501395b2751629e2f4f4728ccf0.jpg,76971E6F64CF4D7C975C4EF4A42A2B74
2020-02-12T05:06:46.000Z,Sebastian Aho on upeassa maaliputkessa – Kasperi Kapanen räjäytti 19 000 katsojaa täyteen riemuun,"Sebastian Aho teki maalin jo kuudennessa ottelussa putkeen, mutta Carolina hävisi Dallasille.",https://img.ilcdn.fi/IRFBQVPlZ0cg3EZOZ7UM0j3kyaM=/510x318/top/img-s3.ilcdn.fi/f343b50ca7d90b7c889a25902d6c6ba2346d3437d7b806014e306b9b283c697c.jpg,B4D2126293414FDA97904B0F3A24D8FE
2020-02-12T05:32:02.000Z,"Ex-luotsi avautuu Dorothea Wiererin pöyhkeästä käytöksestä – ei tervehdi, lyö puukkoa selkään: ”Jotkut urheilijat ovat hyvin itsekeskeisiä”",Italialainen huippuluotsi Patrick Oberegger kertoo IL:lle vaikeasta tilanteesta entisen suojattinsa kanssa.,https://img.ilcdn.fi/LFI8orBjRiKY3BqbBXKlTM1MbK8=/510x318/top/img-s3.ilcdn.fi/0954abdafb92d19c373346b9d8bf319c0679ee9f6be9731a74117e68ba258d5b.jpg,8F7D9209C6444C078E94A46213D649D2
