paivamaara,otsikko,tiivistelma,kuva,id
2023-10-10T04:00:30.000Z,"Tällaisia ovat salaisimmat asiat, joita Sanna Marin tietää Suomesta","Kaikki informaatio on pääministerin saavutettavissa, mutta joskus sitä pitää osata pyytää, sanoo yksi Iltalehden lähteistä.",https://img.ilcdn.fi/3C7harpyPiZtvWR5V8I1DOd2mR8=/510x318/top/img-s3.ilcdn.fi/45afbaf975d74719f6f3f5e59ea91bcd8eba55d6fab69423238de47f364e4da7.jpg,F189FA18C0A744F2857DC6430E67C61C
2023-10-10T04:04:43.000Z,"Vain harva autoilija tietää, miten tämä risteys toimii – Eikä ihme",Autoilijoiden ja kevyen liikenteen risteys aiheuttaa vaaratilanteita Helsingissä.,https://img.ilcdn.fi/i_Vgik1zSSldLL7pA0rfTebDMWg=/510x318/top/img-s3.ilcdn.fi/45f3a58a6eb7954531b11db3ce5679c6b1f2b2e9e1dcd871f0d46d1c49a89cb5.jpg,F4B14453B2124F119DC051429DF54253
2023-10-10T04:08:31.000Z,"Tällaista on julkisuutta kartelleen Frederikin, 78, elämä nyt – Yksi addiktio vaivaa: ”Jengi kattoo huuli pyöreänä”","Julkisuutta kartellut junttidiskon kuningas kertoo Iltalehdelle, millaista arkea hän elää nykyään.",https://img.ilcdn.fi/CIPf9nRbuXVzYIKOlKoeMlMlyD0=/510x318/top/img-s3.ilcdn.fi/dcd5be1de3789d26c063ff8bda5427da8566f48dd7f1742f89db9a108e16e0ff.jpg,8620B7BE40FD444E82A9AC5CEA07CEE7
2023-10-10T04:12:04.000Z,Ruotsin maajoukkuetta uhkaa pannukakku – Nyt tuli karmea uutinen,Valioliigatähden loukkaantuminen estää pelaamisen. ,https://img.ilcdn.fi/H_n_tFPcDbLDtdYHiGJTmXr-huo=/510x318/top/img-s3.ilcdn.fi/3919f71c05c73a98ceec0eb8c01cab5f7e89afa8c81e9aae71d41de3005f435e.jpg,1F0FCF95920A4648ACA6719BCEA2DDF3
2023-10-10T04:30:00.000Z,Räntä - ihana syy juhlia esittävää taidetta Kajaanissa,"Uusi festivaali kokoaa yhteen esittävän taiteen herkkuja, ja tarjoilee ne  ympäri Suomea saapuvalle festarikansalle. Räntä-festivaali on oiva syy vierailla esittävän taiteen pohjoisessa ihmekaupungissa Kajaanissa.",https://img.ilcdn.fi/-7uD6gIF4phX_-rvcuj7tu0SEP4=/510x318/top/img-s3.ilcdn.fi/f99afa25eef139bc6c86ff9569a44d0e32c84cc2f6e66a5e246ad986f8de4c38.jpg,5AB0BA13E38A4D489B5F27ADDE9418B0
2023-10-10T04:31:47.000Z,Patrik Laine pesi lajin supertähden,Patrik Laineen harjoituskausi oli tehokas.,https://img.ilcdn.fi/IgwBW9VGMR9clIntU6HL7BwKVBc=/510x318/top/img-s3.ilcdn.fi/2a8ebd101f83ae94821c86c07a8447128db909b5723a3b1f426745ad1446af81.jpg,77EEB96E74A646C3BBAB2E536590B273
2023-10-10T04:34:51.000Z,Äidin murskaava suru: Huolehti poikansa sähkölaskusta – Poika löytyi surmattuna kadulta sama lasku takataskussaan,Neljää miestä syytetään vuonna 1996 syntyneen miehen murhasta.,https://img.ilcdn.fi/QfPCFSi3totgXm6f4dvax6XwDo8=/510x318/top/img-s3.ilcdn.fi/9559883836aa69f57ec3b1b6e39229171d0113cfc8c054c9ce4a75ea969fc86e.jpg,FA090BD778684206B465FB5360D6A740
2023-10-10T04:45:00.000Z,Laadukas vastamelutoiminto ja kristallinkirkas äänimaailma – Sonyn huippukuulokkeet ällistyttävät,"Sonyn langattomat WF-1000XM5-kuulokkeet edustavat huipputeknologiaa, joka tarjoilee markkinoiden parhaan vastamelutoiminnon ja ensiluokkaisen äänenlaadun – niin musiikin kuunteluun kuin puheluihinkin. ",https://img.ilcdn.fi/dTwwENPmn798kuxH2mHTnu8GLTk=/510x318/top/img-s3.ilcdn.fi/d3979c8d1aeaaf458dcd44e8782da7d083fe604c65fce04695916a2329dbc145.jpg,AB28088DE4BC42D9ABED9B08FE5B238E
2023-10-10T05:01:35.000Z,EU:ssa halutaan lentoyhtiöt kuriin käsimatkatavaralla rahastamisesta,"EU-parlamentti katsoo, että lisämaksut käsimatkatavaroista ovat EU:ssa säädettyjen matkustajien oikeuksien vastaisia.",https://img.ilcdn.fi/LBHBqLYvEbJTzYewVmqpm-_0MkI=/510x318/top/img-s3.ilcdn.fi/8e3afbf0dff28051ea72d712c6856a3d3b1b0cc3933750995540f9a549e9e03b.jpg,8A3FF38A0E3E415A84D23D01645F8620
2023-10-10T05:02:18.000Z,Vapaaottelutähti sai järkyttävän diagnoosin Whatsapp-viestillä ,Michael Smolik halusi jatkaa ottelemista. ,https://img.ilcdn.fi/SCWIOjSXlPuLIt0cToofZ7YhrbA=/510x318/top/img-s3.ilcdn.fi/5581167672423eedf8cbab2cfae127617040e16ed18ad1fcdf03bfee3716c737.jpg,15C87ABC90B14BADACF3068EA890E8AA
2023-10-10T05:05:33.000Z,"Väsyttääkö heti aamusta? Nämä merkit paljastavat, että olet uupunut vanhempi",Suomalaisvanhemmat ovat maailman uupuneimpien joukossa. Vanhemmuuden uupumus on korkealla tasolla myös Yhdysvalloissa ja joissakin muissa länsimaissa.,https://img.ilcdn.fi/CrM8DgGymdcqKKqeY5klbWfwduQ=/510x318/top/img-s3.ilcdn.fi/a65d6fa9098e2c1ff77bbd79a0959481924c18f66b5e5d9bbc9d2b3dd260c4dd.jpg,16F554B49C274FED9C68F6C628F9FCB4
2023-10-10T05:17:56.000Z,Aki töpeksii Suomen huutokauppakeisarissa: ”Eihän tällaista voi laittaa televisioon”,Akin Palsanmäen mielestä huutokauppa on aloitettava alusta.,https://img.ilcdn.fi/USIKHiCE6t5pRxdoIl9dBHbDj8Q=/510x318/top/img-s3.ilcdn.fi/463bb5f3698b0d9ba8bc3eb4588324fe05f5129579417c30df6b44b69321bf22.jpg,A2078D0C98D94E978222CFE7D206C7AF
2023-10-10T05:31:40.000Z,Tänään tv:ssä: Johannan pikkuveli tappoi itsensä – ”Sinulle on tapahtunut jotain tosi pahaa”,Johanna Kososen ja Joonas-veljen tarina kuullaan Trauma-sarjassa.,https://img.ilcdn.fi/8_ah4ujAQx1fqLFJdLIsT-GiwDs=/510x318/top/img-s3.ilcdn.fi/865395c56c3265e21578dbc82f43bd270ef4f233b755b93f221ffc99cc83d363.jpg,CCDD067F510F409D8C2C3A6FAB1D7C5C
2023-10-10T05:50:53.000Z,Köyhän paimenpojan sensaatio – Maratonin ME-hirmulla ei ollut rahaa matkustaa yleisurheilukentälle,Kelvin Kiptum juoksee yli 300 kilometriä per viikko Kenian ylängöillä.,https://img.ilcdn.fi/Dy9D9BdnjFShIiNCVWT_015TfV0=/510x318/top/img-s3.ilcdn.fi/8cc0cbd14cf10f144f10b4d1b4da97faed926732af4c6f4d560438a9242ae27c.jpg,D6493B72AB534C23A16AD7DF2111046C
2023-10-10T05:51:58.000Z,Petteri Orposta leviää erikoinen video,Viime viikolla Espanjan Granadassa vierailleen pääministeri Petteri Orpon käytös puhutti espanjalaismediaa.,https://img.ilcdn.fi/mOmYDNHk5ju_gd5B5qxM-ntlUyY=/510x318/top/img-s3.ilcdn.fi/c1de5731248e5115f71b80eab969b3ed79f57867f44cc48d3c4ecca4429f85e8.jpg,A08BB6B2F6E2438A9E64997F36532678
2023-10-10T05:59:44.000Z,"Ruotsalainen supertähti vertasi Ukrainaa Palestiinaan, some raivostui",Zara Larsson osoitti tukensa Palestiinalle sittemmin poistetussa Instagram-julkaisussaan.,https://img.ilcdn.fi/Qv0kLbVanFgxE90uMnS4w3CDOOM=/510x318/top/img-s3.ilcdn.fi/6f0721d9e2e46e4736a6b3383304dcf8732fad5bb036964233ce3814ace1a718.jpg,57B66289612C49C7B2C4C8AB770B9EF6
2023-10-10T06:00:32.000Z,"Suomi sai niin erikoisen laitteen, että Sauli Niinistö pitää siitä puheen – Tästä on kyse",Uusi 20 kubitin kvanttitietokone ratkaisee valmistajien mukaan ”monimutkaisia ongelmia”.,https://img.ilcdn.fi/1O0ocO90cZC8xL72BhRqUo9qhZo=/510x318/top/img-s3.ilcdn.fi/be1903f48599cbf8aadf675c5d10715bade144cf17e34838233266c1b19ad3a1.jpg,D3A86468147549EA94C6BD434C8C73E3
2023-10-10T06:14:24.000Z,Suomalaisyllättäjä nappasi paikan NHL:n huippujoukkueesta,Entinen Tappara-tähti vakuutti harjoituskaudella. ,https://img.ilcdn.fi/FVujPzTJWmfIQ7sv897Fz-g-B5g=/510x318/top/img-s3.ilcdn.fi/0cba9171380ec8fb15a4394282b1e697d8c95d065a86da02f55726236f2c571c.jpg,AB9F38CAB68D4085924C485B3A9E3447
2023-10-10T06:16:58.000Z,STTK:n kysely: Suomalaiset tyrmäävät ansiosidonnaisen turvan ehtojen kiristämisen,STTK:n kyselyn mukaan koulutus ja osaamisen kehittäminen on tärkein työllisyystoimi.,https://img.ilcdn.fi/1Xe19vrhMWFjXjztWSIukiWivK0=/510x318/top/img-s3.ilcdn.fi/4e21412ad87223bd2d15fb4ebe3ba7e81e90272056851c84ef7d11d1a1752c7e.jpg,20A40EE8B46745EF9A5EACF3665224FB
2023-10-10T06:31:06.000Z,Ryhtiliike,Ryhdin pitäminen hyvänä on entistä vaikeampaa älylaitteiden valtakaudella. Siihen panostaminen kuitenkin kannattaa.,https://img.ilcdn.fi/IFH9ChPsUYGnWCft8NxIJzJgeSg=/510x318/top/img-s3.ilcdn.fi/fb709a882d92e7df5ba4d0c3d80b798062b13a717d18462429e1987dda3c249d.jpg,0C274067AEE544FCA918AE9D890E1800
2023-10-10T06:35:37.000Z,Levoton yö Tukholmassa: Seitsemän epäiltyä tuhopolttoa,Tukholman alueella peräti seitsemän asuinrakennusta joutui epäiltyjen tuhopolttojen kohteeksi tiistain vastaisena yönä.,https://img.ilcdn.fi/6ioYXc41qmT3GoBGdFg6d48CSXc=/510x318/top/img-s3.ilcdn.fi/b119822215ac4d71b7265657d907e49f0d52a25eaa8817e32633149e141f2108.jpg,8833DCAB19B248DDB49F11DFDF963219
2023-10-10T06:39:44.000Z,"Tuukka Ritokoski paljasti salaisuuden Amazing Race -ohjelman kulisseista: Tuotanto mokasi, peitteli jälkensä ja vaikeni","Tuukka Ritokoski kertoi suorassa radiolähetyksessä, mitä tapahtui Amazing Race -maaliviivalla. ",https://img.ilcdn.fi/UO5uCxTiNz-pLToosg2DY0WpDp4=/510x318/top/img-s3.ilcdn.fi/3ec091e424d46a8dccf8d97a9ed4844f4ab95850b9dc66da851b8b74f35bce47.jpg,DD9905ECB6174FD691FAE990D7AD97AE
2023-10-10T06:50:03.000Z,”Hän ei ole koskaan syönyt pikaruokaa” – Tällainen ihmelapsi on NHL:n uusi mainoskasvo,Connor Bedardista odotetaan NHL:n seuraavaa supertähteä. 18-vuotias sentteri onkin poikkeusyksilö sekä jäällä että jään ulkopuolella.,https://img.ilcdn.fi/rRpGakWiug_DotDaEYGu0QGG4yE=/0x26:3000x1901/510x318/top/img-s3.ilcdn.fi/cec92c12fe116825cb55066204c015c797a6d839f69025345c4557aca26ef0de.jpg,647BD36A7AED4E49946E87540A1E5888
2023-10-10T06:54:10.000Z,Tästä Israelin konfliktissa on kyse – Asiantuntija selittää alle kahdessa minuutissa,"Israelin ja palestiinalaisten välinen konflikti syttyi viime lauantaina, kun äärijärjestö Hamas teki yllätyshyökkäyksen. Tilanteeseen vieneet syyt ulottuvat kuitenkin vuosikymmenien taakse.",https://img.ilcdn.fi/RxFnJpMUdL5gd4lQ9CisZLtLUJA=/510x318/top/img-s3.ilcdn.fi/4c8f63ad295f9409c5ed0a2f47e6a3c7b5e6a501106bd738a214faafd4a9ebd6.jpg,9E40FBE5F1FF40DD8ED97D0D2AD3EEC2
2023-10-10T07:02:05.000Z,Mika Aaltola pilkkaa Pekka Haavistoa kirjassaan: ”Taustalla häärivä vaikuttaja”,Uudessa kirjassaan Mika Aaltola valottaa ajatuksiaan presidenttikisaan lähtemisestä.,https://img.ilcdn.fi/BQELwqv2LENT34apf2vvop1OuwI=/510x318/top/img-s3.ilcdn.fi/084587c0c5c5dd202739443b777cbb2eb1077dda3ad709105ee67da3c5ec24db.jpg,2569DD6080A24A0BBE5E82981C7717EA
2023-10-10T07:07:26.000Z,Mika Aaltolan hälyttävä arvio: Maailmanjärjestys on mullistuksessa,Mika Aaltola nostaa uutuuskirjassaan esille Venäjän hyökkäyssodan käänteentekevään roolin maailmanjärjestyksen mullistuksessa. ,https://img.ilcdn.fi/k3EhkFdC5HoOnJQYuallHCYE-_Y=/510x318/top/img-s3.ilcdn.fi/e8ff8c93615f60e76148b32ac068999a1167b7b24eead20d8f250e8d54896c67.jpg,19E9183FC12940D8814E05E4395D3060
2023-10-10T07:13:24.000Z,Dirtfish: Rallin MM-sarjaan uusi osakilpailu,WRC-tykit palaavat Puolaan. ,https://img.ilcdn.fi/tv0-xbTa0gnlv756ZTQikkuUNWg=/510x318/top/img-s3.ilcdn.fi/79c5ab2a5f80c35ce9c7dfd81f41f31ac6b3d44c9306152dfca9323a557b52eb.jpg,4AA23A58EE5A44338E6C668FFFA28DAA
2023-10-10T07:15:15.000Z,Aaltolalla kasassa 25 000 kannattajakorttia,"UPI:n johtajan Mika Aaltolan tukiyhdistys kertoi tiistaina, että Aaltolan presidenttiehdokkuuden taakse on saatu kerättyä 25 000 kannattajakorttia.",https://img.ilcdn.fi/0uP0ql_Em-wAeWndYb_PbIZrJ6Q=/510x318/top/img-s3.ilcdn.fi/b5376d74a6e0ee95c2552f591288f3d53cb6fdab03c2a61c7acbc003c32af1a2.jpg,66DA1155CC27409DA569894D2572E85F
2023-10-10T07:19:26.000Z,Haistelisitko vieraan ihmisen paitaa vapaaehtoisesti? Ensitreffit alttarilla -ohjelmassa nähdään hämmästyttävä uudistus ,Ensitreffit alttarilla -hakijat haistelevat toistensa ominaistuoksuja ennen pariutumista. ,https://img.ilcdn.fi/VAmiUwsJB9VL0cmrQvjcIWeG1Zk=/510x318/top/img-s3.ilcdn.fi/854731829b7ee3c67f3ba5113fe80c4d91bcf9c21c49b21073a3d87a0837e6ad.jpg,60156B2F27984D6FA7EDEC4511BAA69B
2023-10-10T07:21:39.000Z,Moni on vaikean valinnan edessä: Ruokaa vai lääkkeitä – ”Rahat ei vaan riitä”,"Iltalehden kyselyyn vastanneista moni kertoo joutuvansa miettimään, riittävätkö rahat lääkkeisiin, vuokraan ja ruokaan.",https://img.ilcdn.fi/T-EueKZKAWlxdB92nYTayhCeCag=/510x318/top/img-s3.ilcdn.fi/dc8bfd0d43bc81be521bca18ec018a67331841927222597001d9623ab839c6ae.jpg,4F3C416AAA9D4650A4BC2E17D57C27EF
2023-10-10T07:25:41.000Z,Älä syö näitä Muumi-patukoita,Ruokavirasto kehottaa palauttamaan tuotteen takaisin ostopaikkaan hyvityksen saamiseksi.,https://img.ilcdn.fi/p50m6D9F0zrvrDgzRIhBVlpSd9I=/510x318/top/img-s3.ilcdn.fi/68feeba80b9148f351f348a4682948b6a8e6d93816a95286e861c4d29cc01a5b.jpg,4A633D9ED82C4352B4A21B2C05605D68
2023-10-10T07:32:21.000Z,300 000 miestä aseissa ja valtava viha – Näin rajuun hyökkäykseen Israel pian pystyy,"Gazan asutuskeskuksen valtaaminen kestää viikkoja tai kuukausia, arvioi Pekka Toveri.",https://img.ilcdn.fi/CQ6jKeVHflfom8I9DRnctVmXzwU=/510x318/top/img-s3.ilcdn.fi/a86aadff0d07dfa9907eb48fa36925e8c9beaa9931906bbfb49ffd68b878596c.png,20D425D6D44A4EC29EAED2E2136B5448
2023-10-10T07:46:00.000Z,"Kate ei ole vieläkään antanut Harrylle anteeksi – Nyt kukaan ei voi yhdistää riitaveljeksiä, sanoo hovilähde","Paul Burrell uskoo, että Catherine olisi ainoa henkilö, joka voisi saattaa Williamin ja Harryn jälleen yhteen.",https://img.ilcdn.fi/wL2-mb9X22r2myi7T_at2g8RwDM=/510x318/top/img-s3.ilcdn.fi/fc15571f869d4585e3db3cbeaf35385891dedf066695095987f807ecde3fee8c.jpg,729FECBFA2FB42459D0D5C72CC6F6345
2023-10-10T08:01:45.000Z,Seuraa suorana kello 12: Budjettimaraton alkaa – Hallitus saa kuulla kunniansa,Eduskunta aloittaa valtion vuoden 2024 budjettiesityksen käsittelyn tiistaina. ,https://img.ilcdn.fi/SsaMb46ba6Dxrq4PN7zgPeg4t4Q=/510x318/top/img-s3.ilcdn.fi/38fd06dc4f2ea76db2cbbbc40b59e7ec9590b5813802196ea495f4da6b82e6fa.jpg,7D57FB12E1A747EBB828FDBA62F4A331
2023-10-10T08:05:18.000Z,"Jos autosi kahvassa on kolikko, kannattaa ehkä soittaa poliisille – Asiantuntija yllättyi tilanteesta","Iltalehti kertoi aikaisemmin maailmalla havaitusta tavasta, jolla pitkäkyntiset pääsevät autoihin ilman voimakeinoja.",https://img.ilcdn.fi/5HrfzZw4Cmh9dWy4eISgIY95TuU=/510x318/top/img-s3.ilcdn.fi/bb05f3ebdf36eb69fe2150bc8dbc69ad3e7cd212641eb611a59567d7f2426008.png,B179C4BFA4214EFB87FA7DA33AB86FFB
2023-10-10T08:15:59.000Z,Poliisi kaipaa havaintoja Espoossa kadonneesta 73-vuotiaasta naisesta,Poliisi kaipaa havaintoja Espoossa kadonneesta 73-vuotiaasta naisesta.,https://img.ilcdn.fi/wDEKQdG_wJN-6Up_niMXbvC_J4s=/510x318/top/img-s3.ilcdn.fi/35d5a6377ff634ba970c34e343d3f720509822109f138553555b24cec2d980a9.jpg,DC1BEC1F50294805BFBDC84446CB0663
2023-10-10T08:20:37.000Z,Alisha Lehmann paljastaa ihailijalta yökerhossa saamansa tarjouksen  – ”Ei voi olla totta”,Suurta suosiota Instagramissa nauttiva Alisha Lehmann kertoi podcastissa Miamin-lomansa tapahtumista. ,https://img.ilcdn.fi/u2nI7OAOQB0FwcpFdPQumHAO1dg=/510x318/top/img-s3.ilcdn.fi/7e716a0b1f9882eca6cab54ddd1ca4dd2d1b3b205b777c6d023334c0302e4927.jpg,A4AFD316D5D145ACB6A0F23A1E94834C
2023-10-10T08:34:12.000Z,Bruce Willis kuvattiin pitkästä aikaa – Vaimo kommentoi vointia päiviä aiemmin,Bruce Willis kuvattiin pitkästä aikaa Los Angelesissa.,https://img.ilcdn.fi/8hG1JGH2hevyiJLCyO0uPnnZqIs=/510x318/top/img-s3.ilcdn.fi/c9daf0b9cdf7da0537a2fa17b7f774f253f331802f8789097bf703fdd55b1c74.jpg,6489AC2DCD484AA5983263C0645CBF96
2023-10-10T08:34:37.000Z,Poliisi: Törkeä ryöstön yritys Myllypurossa – Tilanteen keskeyttänyt pariskunta haussa,Helsingin poliisi tutkii Myllypurossa elokuussa tapahtunutta törkeän ryöstön yritystä.,https://img.ilcdn.fi/f-DHyf2rJGj3tnUigZz9d7GEl_8=/510x318/top/img-s3.ilcdn.fi/7b08f42834bd19f76d84aa572d7acc9cb4c706fb5b3a11ec20316144aee6be1b.jpg,2D82044C08CC4245938460913BB7232B
2023-10-10T08:38:02.000Z,Tämä kenkä on edelleen ykkönen: Muodin kerman suosikkipari,Muodikkaat cowboy-buutsit taikovat koko olemukseen ryhtiä ja leikkisyyttä.,https://img.ilcdn.fi/1SZdcf4N-M2nFE54kn7D-vHlYdc=/510x318/top/img-s3.ilcdn.fi/66ab591e13d73522cabc8d4f949cb9b9f2dc99faca7b9848bea518b88fb98317.jpg,D646F7498F7E4E24815DAD8B405321DA
2023-10-10T08:51:28.000Z,Näin Venäjällä on reagoitu Hamasin hyökkäykseen: Putin vaikenee täysin,Venäjällä rajuimmat kommentit Israelin konfliktista on suunnattu Yhdysvaltojen niskaan.,https://img.ilcdn.fi/v7oCRNB9oHUUhojpeBRxOt5YPzI=/510x318/top/img-s3.ilcdn.fi/e0336e059f2c909aa4a1d89dd7ccd8457cfbffaea450111fae7b49a3be09ac01.jpg,813773C2F6FA4B0A8137975D9B66F3EE
2023-10-10T09:01:35.000Z,"Ministereiden, erityisavustajien ja poliittisten valtiosihteereiden palkkaukseen ei myönnetty lisää rahaa – Näin ministeriö selittää","Valtioneuvoston kanslian (VNK) mukaan ministerit, valtiosihteerit, erityisavustajat ja sihteerit ovat nyt ensimmäistä kertaa valtion budjetissa samassa momentissa.",https://img.ilcdn.fi/11GqXuUlF-HdCB_sKEs6wuBu1TU=/510x318/top/img-s3.ilcdn.fi/d4a24e293ae81deca2c3a132542f87ecb32f078ec7645c2151cc67e031bb4e19.jpg,4E6493A491B44FE88C177F0438AA81B5
2023-10-10T09:11:21.000Z,Uutuuskirja: ”Silmittömän raivon” vallassa ollut ex-pääministeri Mari Kiviniemi haukkui Anna-Maja Henrikssonin pataluhaksi eduskunnan hississä,"RKP:n puheenjohtaja Anna-Maja Henriksson kertoo elämäkerrassaan, miten on saanut ruotsinkielisten palveluiden puolustamisesta lokaa niskaan.",https://img.ilcdn.fi/WGoPgwS1DbscscXIgPTc6gr4TSI=/510x318/top/img-s3.ilcdn.fi/01c24260370fdeaea9a4c555866a5117904cdc25fa45b5aa591e0132139395b0.jpg,34054D9B4C85440DA4CD0A33CC1245AE
2023-10-10T09:28:29.000Z,Prinsessa Catherine suosii nykyään housupukuja – Tyyliasiantuntija kertoo miksi,Prinsessa Catherinen tyyli on kokenut hiljattain muutoksen. Asiantuntija Miranda Holder arvioi tämän kuvastavan Catherinen uutta asemaa.,https://img.ilcdn.fi/jpZt--BVDcqd_V08MZKm2eL2xEE=/510x318/top/img-s3.ilcdn.fi/ee37cbe9747618ce525850661821bd958d1bbc21ccc87f3caa7d010b90b144ff.jpg,714CD27E26FA4E839F1C76A909419B7F
2023-10-10T09:32:07.000Z,"Eden Hazard, 32, lopettaa uransa",Belgialaistähti loisti Chelseassa ja maajoukkuepaidassa. ,https://img.ilcdn.fi/JZdJrm_wYam-Y2XdoluTFN-iNrM=/510x318/top/img-s3.ilcdn.fi/121fd836718089295b0bc358386838cbf8ed08e2759f3388d9b397a93038cde0.jpg,95BDA8F7033B4BB7890DC316068C3CEA
2023-10-10T09:32:35.000Z,Uusi muumimuki sai ostajat hiiltymään: Tiina harkitsee jopa keräilyn lopettamista,Uuden muumimukin myynti aiheutti pettymyksen joillekin keräilijöille eilen maanantaina. Arabian mukaan virhe johtui teknisestä viasta.,https://img.ilcdn.fi/cuCGxzac6xFmuLKqSz5GU-_xl0o=/510x318/top/img-s3.ilcdn.fi/addedc3b88dca68ac7ac035d1ba87d6c00e9b1e8a244d191e8215cfb956e711b.jpg,4B313B25EB0E499FA589F90F773FBAB7
2023-10-10T09:40:38.000Z,Finnairilta raju ratkaisu: Kaikki Tel Avivin -lennot peruttu,Finnair peruu kaikki Tel Avivin -lentonsa talvikaudeksi.,https://img.ilcdn.fi/I8HZGNT1R0bIbpMruz7zVQb8EKY=/510x318/top/img-s3.ilcdn.fi/3ecbf79d998e3606f0d9bc2b9386fe0df8fb4abe3b1b7a809a2d0e49c0b34ec1.jpg,833AA8E155EA4389992DDDF2EBA38CC4
2023-10-10T09:41:23.000Z,Ville Rannan pilapiirros: Palestiinan kansan pelastajat,Ville Rannan pilapiirros 10.10.2023.,https://img.ilcdn.fi/RDUiaqsB0ejvNJk9wzrA7mmg_2U=/510x318/top/img-s3.ilcdn.fi/08e59694bd5b240cab9ad09c3ce1aeea17461572116e9ec661aa013faf807a7b.jpg,5F22978DBD7646C48B484F03364B2BD5
2023-10-10T09:53:47.000Z,Kokeile ainakin näitä! Scandicin henkilökunta antaa parhaat vinkit hotelliaamiaiselle,Scandicin aamiainen syntyy yhteisellä ponnistuksella. Scandic Hotelsin henkilökunta kertoo omat suosikkinsa herkullisesta aamiaistarjonnasta.,https://img.ilcdn.fi/GOJe-jZRm1m9TivIfQcqIEG5B30=/510x318/top/img-s3.ilcdn.fi/80c5d934bcd030a256a74a54230509b7d1de815fb2b0a3245f000ff69add6122.jpg,D352DA502FCC4188B08D6E54D8DBB9F9
2023-10-10T10:03:23.000Z,Pakkasta pukkaa,Tiistaiyö oli syksyn toistaiseksi kylmin. Samalla tiistaiaamuna meni rikki kuluneen syksyn pakkasennätys.,https://img.ilcdn.fi/fhJqqiW_LQnH-q_NHcPShJ6aRbg=/510x318/top/img-s3.ilcdn.fi/dd43501f978d5f91d444fc7bb0799a2fb36e9d72eb2d07b405d5b384bb50dec2.jpg,1F98FFD4C02C4920BE838EC45DC2D828
2023-10-10T10:03:41.000Z,IL:n tiedot: Hallitus järjestää turvallisuustilanteesta tiedotustilaisuuden kello 14,Tarkka aihe on ollut ennalta vain valtionjohdon tiedossa.,null,07FA366628044D9A98C191A3056E2995
2023-10-10T10:07:05.000Z,"Yhtä valmisruokaa Vappu Pimiä rakastaa yli kaiken: ”Lapsuudesta asti ollut luottoruokani, järkyttävän hyvää”",Tänään 10.10. vietetään seitsemännen kerran Maksalaatikkopäivää. ,https://img.ilcdn.fi/ZBJj1DQyPQK99XO581TZLyEWVVw=/510x318/top/img-s3.ilcdn.fi/10603687eec801ec81812fd8459129dc647bebbd7d4ef9bf1b5c869f04ca50e7.jpg,06E5BC98731143958DF6990D8EA4429B
2023-10-10T10:10:04.000Z,Naisurheilija väitti maannaistaan transsukupuoliseksi – ”Tämä ei jää tähän”,Swapna Barman pyysi myöhemmin viestiään anteeksi. ,https://img.ilcdn.fi/OT31MWngZy_a6FplaTXeOMVsQnQ=/510x318/top/img-s3.ilcdn.fi/0b00d79f78dc08985d3dc3edc7e028ab8be00a7c37170291ae6bdc77e2347812.jpg,4B33A29D3E8E4DA5AACFE6F556289833
2023-10-10T10:10:33.000Z,Huippumallin gaala-asu herätti kysymystulvan – ”Miten voit istua?”,Huippumalli Coco Rocha saapui muotigaalaan diskopallona.,https://img.ilcdn.fi/zidY5ei1wbB6gMOxNE-M44DiFDM=/510x318/top/img-s3.ilcdn.fi/5e9e9f371593fab9925d497c29420d8bc4c6b54c388652402c72fdee1f0a0657.jpg,5CA1E40F91FF4F6EADDF66547DB73A5F
2023-10-10T10:15:37.000Z,Poliisi: Törkeä pikaravintolaryöstö Salossa – Mies tunkeutui sisään autokaistan luukusta,Poliisin mukaan epäilty mies asioi luukulla jalkaisin ja poistui sinisellä polkupyörällä.,https://img.ilcdn.fi/5UAK5E8sUswaKTmWlwVbOdB9Src=/510x318/top/img-s3.ilcdn.fi/e2f0f6fb316480c13f7bcbbedf5ddd7cc3583e3bf529d05237903b97716af4f5.jpg,0B84821916354D75993C152C56B0C274
2023-10-10T10:38:37.000Z,Venäjä aikeissa vahvistaa tärkeää sotilaspiiriä Suomen rajalla,"Venäjän puolustusministeri Sergei Šoigu on aiemmin ehdottanut laajaa sotilaspiirien uudelleenorganisointia vastauksena ”Naton haluun lisätä sotilaallista potentiaaliaan lähellä Venäjän rajoja"".",https://img.ilcdn.fi/qSJ_vGH4S8Qvk-g0tCxDIYeNjW8=/510x318/top/img-s3.ilcdn.fi/3145a69cd2e8c7d846416b54d3b9b8cafc2cbe28c41c49e449c3b8789ae64282.jpg,FBA8C3625A0D4B4C9B005AD600BF6601
2023-10-10T10:41:08.000Z,Uusia tietoja julki Hakunilan tuhoisasta palosta – Tällaista tavaraa saunassa oli,Tutkijat ovat löytäneet kerrostaloasunnon saunasta tekstiilejä. Seuraavaksi tutkitaan kiuas.,https://img.ilcdn.fi/hzF9_9z37r8zFzsksSjLZ6qCkGY=/510x318/top/img-s3.ilcdn.fi/8923e8d928f5dc3abbb02240dc90f4b9959acf600f896bdcbe0f934e4c6b6b7f.png,D2E7535C1CE44701B27B006E3285A2EA
2023-10-10T10:43:29.000Z,"Porschen luksusmaasturi sai lisää toimintamatkaa, eikä menettänyt V6-moottorin jylinää ",Porsche teki Cayenne-luksusmaasturille reippaan kasvojenkohotuksen. Suomessa hittituotteen statuksella kulkeva lataushybridiversio sai reilusti lisää sähköistä toimintamatkaa.,https://img.ilcdn.fi/zcFjh45PWowH2jBgV73EJgz8Xn8=/510x318/top/img-s3.ilcdn.fi/68894913e5ea75c9341fa72d29ada05a3e7bed99c5acbd62b319c14dfa56112d.jpg,DC29C81A1F6D4CCF92DB8C08378F3879
2023-10-10T10:45:50.000Z,"Amazing Race -tuotanto paljastaa, miksi Tuukka Ritokosken lipsauttamaa isoa mokaa ei nähty televisiossa ","Tuotantotiimin mukaan Jukka Rasilan ja Mirvan taksikuski ei ollut löytänyt oikeaan osoitteeseen, minkä vuoksi kilpailijoiden kolikkotehtävä jäi suorittamatta. ",https://img.ilcdn.fi/iA2MMD16mYkVe3sm3eaHXbvS1lw=/510x318/top/img-s3.ilcdn.fi/b0ef9a3339480ad10d8d07f272ec537ea177ac41d824650501ac94cab3924575.jpg,06F376CE6FF74E3BAE10CC6174F22FC4
2023-10-10T10:49:46.000Z,Näin presidentti Niinistö ylisti Suomen huippukeksintöä Espoossa – Katso video puheesta,Presidentti Sauli Niinistö kunnioitti suomalaisten kehittämää laitetta läsnäolollaan Espoon Otaniemessä.,https://img.ilcdn.fi/-yDx9exaFHaane03bGxR_m16tBo=/510x318/top/img-s3.ilcdn.fi/487204a8c648ec48aad3e8af28f85f84fecd11447e1944b758117fd78d20611e.jpg,BB5DE02BC6A14EBCB633FA80CD8552A8
2023-10-10T11:00:19.000Z,SM-liigakiekkoilija tuomittiin raiskauksesta kahdeksi vuodeksi vankeuteen,JYPin hyökkääjä Severi Lahtinen tuomittiin raiskauksesta vankeustuomioon.,https://img.ilcdn.fi/XiBjv6Qm6LH3PM7GWk5haS48kzk=/510x318/top/img-s3.ilcdn.fi/b7a629c553f9571b0a8998eedd3734400581f08a03828c26f2bb2fcbb822e85f.jpg,B47E8A5AB4854B30B0B6D851CD7B9918
2023-10-10T11:06:38.000Z,Nyt puhuu raiskauksesta tuomittu Severi Lahtinen – ”Omatunto on puhdas”,Severi Lahtinen sai kahden vuoden tuomion raiskauksesta.,https://img.ilcdn.fi/TDGQbhchHxvgbTMFI1cy2VpWxug=/510x318/top/img-s3.ilcdn.fi/fc272d4db76676dd69d244bb96935bc5d825c2613d2aceb785175aedfd1e0957.jpg,5FBB974235C9462E9E10EE65508591E1
2023-10-10T11:28:01.000Z,Leinelän taposta epäilty vangittiin – Ei peitellyt kasvojaan,Poliisi epäilee 36-vuotiasta miestä taposta.,https://img.ilcdn.fi/veFjtudcvXrardX_zFch_Hxvqug=/510x318/top/img-s3.ilcdn.fi/c1a2ca8598d41782d2e036dd7effa633ae0b1bc0d4311fbd921858ea8d4feb63.png,B7D68887875A47A2910915EB212EE7C8
2023-10-10T11:47:17.000Z,Tiesitkö? Ensitreffit alttarilla -osallistujilta vaaditaan useita juridisia toimenpiteitä ,Ensitreffit alttarilla -parit laativat muun muassa avioehdon. ,https://img.ilcdn.fi/VAmiUwsJB9VL0cmrQvjcIWeG1Zk=/510x318/top/img-s3.ilcdn.fi/854731829b7ee3c67f3ba5113fe80c4d91bcf9c21c49b21073a3d87a0837e6ad.jpg,C6DFF4F0A8E641A999B441FED1AAB455
2023-10-10T11:55:57.000Z,"”Työ saa minusta parhaan version, kotiväki sen, mitä on jäljellä” – uraäidit kertovat karusta todellisuudesta","Suomalaisvanhemmat ovat maailman uupuneimpien joukossa. Mothers in Business -järjestön ja työnhakupalvelu Joblyn seminaarissa keskusteltiin ja etsittiin ratkaisuja, mitä työnantajat voivat tehdä tukeakseen vanhempia työn ja perhearjen yhteensovittamisessa.",https://img.ilcdn.fi/x1g0xIOiSAfJMc_xYL0EOkLpGtg=/510x318/top/img-s3.ilcdn.fi/a6e55c143754d71c0488ec733026b6bce0281fe31472d394c5a73ad9a3a9cec8.jpg,AC462EB1899A4804B5CE833E0C5E145F
