paivamaara,otsikko,tiivistelma,kuva,id
2020-02-11T04:58:53.000Z,"”Omituinen signaali veronmaksajille, jos hallitus ei puutu verovälttelyyn” – Näin asiantuntijat kommentoivat Katri Kulmunin tyrmäämää maastapoistumisveroa","EK muistuttaa, että verrokkimaa Ruotsissa ei ole vastaavaa veroa.",https://img.ilcdn.fi/qE5OpBD1JL61B9mZQieoVFUB_Wo=/0x69:3450x2227/510x318/top/img-s3.ilcdn.fi/3a21e48b34e51aac5b3ffe70cf0d00ced2439be9afcc483025b4207ae9ddae7e.jpg,472D1A98DB894B77A4DBCC53F2BA4D11
2020-02-11T05:01:30.000Z,"Nämä ovat kaikkein pahimmat CV-mokat - katso, miten vältät ne","Monster.co.uk listaa pahimmat virheet, joihin CV:tä tehdessä sorrutaan.",https://img.ilcdn.fi/2-7L9TGpbkgfTfA_XyMmwsZmUPw=/510x318/top/img-s3.ilcdn.fi/0e25fe602a1592df64ec815a90863018d612c9a2466ba2728e417e78d280301f.jpg,254FA4FE6AEC43FA80EE47C85BFA15C0
2020-02-11T05:03:33.000Z,Entinen lapsitähti Raphaël Coleman on kuollut 25-vuotiaana - sairaskohtaus juoksulenkillä,Raphaël Coleman tähditti lapsena muun muassa Nanny McPhee - satumainen lastenvahti -elokuvaa.,https://img.ilcdn.fi/rgSY9nYYvC7elNgEmklNZaRLaQA=/510x318/top/img-s3.ilcdn.fi/00b9e6baa8760e838390e6fd91666b3a0153bc9b017b2ac2e0da6b0e82182c6c.jpg,2BE4A9098B6048B6B0C87172EE441AC4
2020-02-11T05:04:23.000Z,Surun murtama Vanessa Bryant avasi tunteitaan koskettavassa tekstissä: ”Olen niin vihainen”,Aviomiehensä ja tyttärensä kaksi viikkoa sitten lentokopteriturmassa menettänyt Vanessa Bryant avautui tunteistaan.,https://img.ilcdn.fi/OU1J0I4bGT1eiZNbHkQHLd0kDPQ=/0x26:3000x1902/510x318/top/img-s3.ilcdn.fi/e5591ac8d0cc936afdde78b01339f5edca64bb0773962ae226630a034a45faed.jpg,59E888A1EABB4AB18ECF99E0AB6E0184
2020-02-11T05:29:54.000Z,Supernanny Pia Penttala järkyttyy kaksivuotiaan nukkumaanmenorutiinista: ”En ole vielä koskaan nähnyt näin hätkähdyttävää hetkeä”,Illan jaksossa Supernannyn apua tarvitsee Kiukaisissa asuva kahdeksanhenkinen Mattilan perhe. ,https://img.ilcdn.fi/ZAol5sq_a60Tm8JT_c8-Pht4YAo=/510x318/top/img-s3.ilcdn.fi/2e6901dddee38a65c13b09f317632c7065134a1a495766fc94239faef1c806f8.jpg,4B49DD3A5B3143069D1A29D9B17F777A
2020-02-11T05:41:28.000Z,HS: Autoa töhrittiin ulosteella – kohuvalmentaja Mirjami Penttisen vastustajia syrjitään ,Helsingin Sanomien mukaan peli on muuttunut kovaksi kohuvalmentaja Mirjami Penttisen tukijoiden ja häntä vastaan olevien luistelijoiden välillä.,https://img.ilcdn.fi/OwiTIhGQ1cArt2LHKLbOrZiY5EE=/510x318/top/img-s3.ilcdn.fi/b658bbcd2a5110708372d68aaf3e654d8d74bfaff7db01a01bb66d3255a41b96.jpg,4A5E229BA96A4A748E880737F9DB81B9
2020-02-11T06:00:58.000Z,Tällainen on Suomen trendikkäin talo: ”Ihmiset karttavat ruskeaa turhaan”,"Ruskea ja puu valtaavat kodit! Lähde kierrokselle Turun Rakenna & Sisusta -messuilla olleeseen taloon, jossa näkyvät tämän hetken kovimmat trendit.",https://img.ilcdn.fi/Bn-LD7mGMCGBWpN7uxqp1YI_Y9Y=/510x318/top/img-s3.ilcdn.fi/68fa8758e297e2ac6f0a58fd7caa51def1d94698414749df8c2ca2cfd520497c.jpg,0EC35D47B5EA48E4A9B206A21E9BB3C1
2020-02-11T06:01:50.000Z,Alma Media myy maakunta- ja paikallislehtensä Sanomalle,Aamulehti ja Satakunnan Kansa siirtyvät Helsingin Sanomien julkaisijalle.,https://img.ilcdn.fi/UM8154snA3oOXvBPIBaFAN_wdww=/510x318/top/img-s3.ilcdn.fi/1c931032223e2aea1d4056a3cbde161de20a1f60fdb42d17d0cf10fb08fa592d.jpg,4C7255156FAA41C5A77CA7ED40D743D9
2020-02-11T06:12:09.000Z,"Saako myrkkyä niellyt ihminen oksentaa? Mitä tajuttomalle tehdään? Testaa, osaatko auttaa hätätilanteissa!","Testaa 112-päivän kunniaksi, osaatko toimia yleisimmissä ensiaputilanteissa.",https://img.ilcdn.fi/JKd99pOfsdT43WjZZKmCXrCWsI4=/510x318/top/img-s3.ilcdn.fi/7df4aadb08a242cb93c005400462dbd15c4472812c2f160e8e4a7eef60100693.jpg,D2B1547177A346028629DADCF75B1354
2020-02-11T06:24:33.000Z,"Seiväsihme Armand Duplantis saa jatkossa huimia kisapalkkioita – kokenut urheilumanageri: ”Väitän, että ME-tuloksen arvo on aika kova”",Seiväshypyn ME-mies Armand Duplantis tekee jatkossa kovaa tiliä yleisurheilukisoista. ,https://img.ilcdn.fi/cxA7qimTBkp0Rm6ZDljOvhMHsN4=/510x318/top/img-s3.ilcdn.fi/3bd9063381aeca13ef0100fbc7c089afb86e297e67e667d3e0a8f2816851b6ba.jpg,7122F141C8374425B4866524E6638B42
2020-02-11T06:36:51.000Z,Pekka kuvasi kärpän ja rotan rajun painiottelun: ”Kunnon niskalenkki pohjalaiseen tapaan”,Kesämökin pihamaalla käyty taistelu päättyi kärpän selkeään voittoon.,https://img.ilcdn.fi/k1rgq_DA6vmtA3AMqUYf7EM9IJI=/510x318/top/img-s3.ilcdn.fi/47865787c0cceea063572595468bae14fd9addac447ae2d76e3e40dfffae2783.jpg,1652E63953B044CA9FC2C58FB0475F5F
2020-02-11T06:53:10.000Z,Tuhannet suomalaiset saaneet outoja puheluita +882-alkuisesta numerosta,Moni kertoo Iltalehdelle saaneensa outoja puheluita. Ei kannata vastata.,https://img.ilcdn.fi/Spzbc0U2T5NF-DRnSoyTfJiHv4k=/510x318/top/img-s3.ilcdn.fi/92e3d3e4cced6a8ab882800333c0153179ed978339330f8031b2eae2a8e2869d.jpg,6C5C314AB3A14E428FF4D101BB91C72A
2020-02-11T06:56:20.000Z,"Aloitko laihduttaa vuoden alussa? Nyt on kriittisin hetki – asiantuntija kertoo, miksi dieetit usein epäonnistuvat","Laihduttaminen itsessään ei ole vaikeaa, mutta painonhallinta on. Näin vältät yleisimmät virheet.",https://img.ilcdn.fi/YDDskY4PxJOHT2MAYbCpmvxN5W8=/510x318/top/img-s3.ilcdn.fi/a34c42390420d580e203a65ecc1700face7ee36b8c148e83f074054cbac9a712.jpg,D0974BCA9630464AAA50FB211DD4D57A
2020-02-11T07:00:30.000Z,Nimekäs kaappaus! Barcelonassa Mestarien liigaakin pelannut hyökkääjä siirtyy FC Honkaan,Kamerunilainen Jean Marie Dongou allekirjoitti sopimuksen espoolaisseuran kanssa.,https://img.ilcdn.fi/8UbqxkQjQqSJiQZmLDt8zbYHjXA=/510x318/top/img-s3.ilcdn.fi/e3a26c9adcf64dc5c4cbce03f06b37f9421bde7f291768dfb29f5cf11f6b3aa4.jpg,B62A13A0CE764B4B91DCA7C4BFBC424E
2020-02-11T07:19:22.000Z,Saab-miehen auto kulki yli kahta sataa – poliisi ei pysynyt perässä,"Poliisi ajoi nuorta, kännistä ja kortitonta saabistia vauhdikkaasti takaa.",https://img.ilcdn.fi/Nf4gfh3DznIS9YNKwCFddX3XfjE=/510x318/top/img-s3.ilcdn.fi/2297bbf0e58836171904184712181f66101ffff4462580e2ff83195809ea95b1.jpg,8FF20723347747E78053D1704A657026
2020-02-11T07:31:44.000Z,Huomasitko? Valtteri Bottaksen uudessa F1-autossa on hieno yksityiskohta kuolleen mestarin muistolle,Valtteri Bottaksen ja Lewis Hamiltonin autoissa on hieno muistomerkki Niki Laudan kunniaksi.,https://img.ilcdn.fi/x27QW2uMPvNnr-GkwpIzJAHwss8=/0x0:3000x1876/510x318/top/img-s3.ilcdn.fi/7ffd3e5d9d25f3971c19fa085294747216d84cc31c8a3480a24ab4f0f7dc89ac.jpg,9734FEC688C04E3BA4A6BD198655C02B
2020-02-11T07:32:04.000Z,Tiesitkö? Näin toimit oikein tulipalotilanteessa,"Oletko tietoinen, kuinka tulipalotilanteessa kuuluu toimia?",https://img.ilcdn.fi/6VSMVfaxwNfW8C70WKy6fj446mg=/510x318/top/img-s3.ilcdn.fi/4dd540b648a6b010078eb401fef01a4867778b5bf3c1bac661f01593b5366c38.jpg,931BAF1D91FF4DBD9A8DEAF94E8EBC09
2020-02-11T07:47:01.000Z,Kirkas vai kermainen kalakeitto? Tänään kattiloissa porisee kalasoppaa,Kansallisena kalakeittopäivänä soppakattilat kiehuvat niin kotikeittiöissä kuin ammattilaistenkin valmistamana.,https://img.ilcdn.fi/m2VV8UQKdwZDRc4xo-xxhVEMQl8=/510x318/top/img-s3.ilcdn.fi/71cd4e77b263bee6054b9212a5f59edca2819d03512dc0ef159d08e80882b923.jpg,1368F5E0EC224B6A833411DDA9906368
2020-02-11T07:55:51.000Z,"Jälleen hoviskandaali: Kuningatar Elisabetin vanhin lapsenlapsi eroaa – vaimo muuttaa Kanadaan, kuningatar järkyttyi","Herttuatar Meghanin ja prinssi Harryn muutto Kanadaan on ilmeisesti saanut aikaan sen, että myös maitomainosskandaalissa ryvettyneen Peter Phillipsin Autumn-vaimo uskalsi tehdä saman liikkeen.",https://img.ilcdn.fi/44W4ZVsERlU1fwV93a4I5OKf8lQ=/510x318/top/img-s3.ilcdn.fi/64b28ca0de4414e9ba257eb551e4f2b23a1417783801a2e26b3f8f207a57a06e.jpg,4AA24E14DCBA4139AE3AF03985327728
2020-02-11T08:07:40.000Z,Vaihtokauppa NHL:ssä! Minnesota kauppasi Jason Zuckerin – paluupostissa saapuu floppihyökkääjä,"Jason Zucker, 28, jatkaa uraansa Pittsburghista.",https://img.ilcdn.fi/bp5GI26WH-SIw3iuOuMTHHv-l5w=/0x113:3000x1989/510x318/top/img-s3.ilcdn.fi/c917a2b6c781f0bab80b0da3bb99dceb1190954282600fa3d393ac722064cfcb.jpg,37E9D5A8ECBB4A79B7D2F7F6E65A4DBD
2020-02-11T08:08:04.000Z,Häxa-koira auttaa lapsia lukemisessa – tällainen on karvaturrin työpäivä Töölön kirjastossa,"Lukukoira on kärsivällinen ja rauhallinen kuuntelija, jonka kanssa ei tarvitse jännittää.",https://img.ilcdn.fi/kvuXMXdO1EIvAy3z7a8GaDdRuow=/510x318/top/img-s3.ilcdn.fi/907d0bef4880ba7801c785e95dab46700480302901f129175c3762d44496c204.jpg,C5438CEF10B34B7D983B9EC243F58116
2020-02-11T08:10:38.000Z,Kehno tulos ja surkea talvi ajavat XXL:n poikkeuksellisiin toimiin: aloittaa varaston pakkotyhjennyksen,Urheiluketju XXL karsii neljänneksen tuotevalikoimastaan myymällä ne tappiolla.,https://img.ilcdn.fi/WpFXcLNn5DJFHMbjDQsxZgKujPA=/510x318/top/img-s3.ilcdn.fi/47c1048d74434077b8b96cd24ac1b451c73725d1d42684f7c280fa2e6e611d9f.jpg,6C8F2A7A1DBC4AA4809F18B861B550B8
2020-02-11T08:19:29.000Z,19-vuotias mies ajoi iäkkään rollaattorilla liikkuneen naisen päälle Porissa,Jalankulkija oli törmäyksessä kaatunut auton konepellille ja siitä edelleen maahan.,https://img.ilcdn.fi/NhqCcnUer-GBgYDJqHOMT7M7etk=/510x318/top/img-s3.ilcdn.fi/8230bd30548e445aa0ca3c22e05cb7241531980e942fdb8e3b89715d216ab60d.jpeg,B0910729EF594BFF8B40B7ED0E6A3313
2020-02-11T08:32:42.000Z,"Missä on kadonnut kolmekymppinen Teemu? Tapasi tuttavansa marraskuussa, pian sen jälkeen puhelin vaikeni",Viimeinen havainto Teemu Koskisesta on tehty Järvenpäässä viime marraskuussa.,https://img.ilcdn.fi/N25JR56YoHFfU1Xsg4aXLSYuKWI=/510x318/top/img-s3.ilcdn.fi/43bd7cdd4bc6d5dfba2630f615626fd125ad4d777695d3e38344fa95e073f78e.jpg,9A8A411AF1AA494E9A139DE191346381
2020-02-11T08:43:44.000Z,Alma Median pörssikurssi lähti nousukiitoon,Myös Sanoman osake on kallistunut selvästi aamupäivän kaupankäynnissä.,https://img.ilcdn.fi/qGYEY0edvOHDE_5chlWKNL2_lAw=/510x318/top/img-s3.ilcdn.fi/2c8fc7de491280f69bad6ee1a113b371001ad4abfd8741c33e64759948da6bcf.jpeg,9037F732AF9B414C99D4C75B953C374F
2020-02-11T08:46:34.000Z,Valtteri Bottas ja Tiffany-rakas hempeilevät Lapissa – ”Taianomaisia muistoja”: Katso suloiset yhteiskuvat,Valtteri Bottas ja Tiffany Cromwell nauttivat täysillä niin Lapin lumosta kuin toistensa seurasta.,https://img.ilcdn.fi/0B2uTQ4TVWuwigu-ZkCQUXUxYfc=/510x318/top/img-s3.ilcdn.fi/56b42b712ded3c822ba23ddba6c09555ddd56629061fdce1b5167a7e62fa15d7.jpg,A073CB41E6B8414AB48BCF37B3F9B6BF
2020-02-11T08:48:58.000Z,Nainen järkyttyi pyydettyään lokitiedot Omakanta-palvelusta – naapuri oli käynyt urkkimassa intiimejä terveystietoja 7 kertaa päivässä ,Savolainen sairaanhoitaja tuomittiin sakkoihin tietosuojarikoksesta.,https://img.ilcdn.fi/KDY3xRQ_NpCdL4bvhBdabXJZCKg=/510x318/top/img-s3.ilcdn.fi/f826c0c8f58e57f6458481e6fa2d4abdcf6771b27ea9be071f6a691710e4cffb.jpg,804811533FB44388BE5B2E5528472AD9
2020-02-11T08:51:54.000Z,Kehonrakentaja ei kuunnellut ohjeita ja jatkoi treenaamista – kuoli koronavirukseen Kiinassa,"Kiinalainen kehonrakentaja Qiu Jun, 72, on kuollut.",https://img.ilcdn.fi/6hujrgh2Geqnkv-MAbd7NHDwAH8=/510x318/top/img-s3.ilcdn.fi/95b9c75bdfd16f1c4e89720080a1e5c117bdc5f04afd355078a9b468ce2f3c98.jpg,6016965169F84AB686CEC07026169434
2020-02-11T08:56:20.000Z,Kadonnut jalkapalloilija oli ollut juhlissa teekkarikylässä – saattoi lähteä ulos vieraan ihmisen farkkutakissa,"Poliisin etsinnät keskittyvät Helsingin Töölöön, jossa Miikka Leinosesta on viimeinen varma havainto.",https://img.ilcdn.fi/JTxytVTtBgPn-6dl8TmVPBKhgvg=/510x318/top/img-s3.ilcdn.fi/2bd30185a334ff9e920ee26aeedd17c69b010dbd532dcbc3d6ef3cfd2da2e787.jpg,7FC357AC4DAA404BAF13F7688CFCB8DA
2020-02-11T09:23:29.000Z,Näin asennat LED-valopaneelin autoosi itse: Jo 150 eurolla saat huimasti lisävalaisua pimeille mökkiteille!,Suomen talvessa pimeitä taipaleita kurvaillessa ei auton keulalla voi olla liikaa valovoimaa.,https://img.ilcdn.fi/-FRRMwcjzC0Gginfw6o-Q9PRM0s=/510x318/top/img-s3.ilcdn.fi/48e3ce1673e5c3558dfdeed047eb02280ae71ca7357be94a81ade8177bdb6f02.jpg,2F4AA9E44F884E62BCF83EDD35C141F7
2020-02-11T09:25:43.000Z,Trumpin rusketusraja herätti hilpeyttä Twitterissä - presidentti sivalsi: ”Valokuva on käsitelty”,Yhdysvaltain presidentin ihonväri on herättänyt keskustelua jo vuosikymmenien ajan.,https://img.ilcdn.fi/GMKSlaoU5308y4kPcWAgD3FvQLY=/510x318/top/img-s3.ilcdn.fi/943e8bb241875c5d56c48201383a982efa53c9d55c9e44a36a335f03c617506e.jpg,228C2EB7F931489E8B24392CDA218626
2020-02-11T09:31:51.000Z,"Päivän ravivihje: Toto5, Teivo 11.2.",Kahdella varmalla Teivoon.,NULL,0F864B71EB0C4B28AF196A47F2420FA4
2020-02-11T09:42:52.000Z,Ex-vuorikiipeilijä Veikka Gustafssonilta karu arvio Lotta Hintsan talvikiipeilystä: Sormien ja varpaiden amputointi yleistä,"Maailman kaikilla korkeimmilla huipuilla käynyt Veikka Gustafsson kertoo, että talvella vuorilla saattaa helposti menettää sormia ja varpaita.",https://img.ilcdn.fi/PCn7eGn_LjaPMKuunMhl4OhZj2E=/510x318/top/img-s3.ilcdn.fi/8ad9298196ef41f2f0dce78d65802f3a0d73c7fd5e11e37677880f5a74288a66.jpg,DB04493D999E48A4B5929450E8F5AC74
2020-02-11T09:57:26.000Z,Islannin kauneimmat paikat - 7 silmiä hivelevää luonnon ihmettä,Islannin erikoiset maisemat ovat maan suurimpia matkailuvaltteja.,https://img.ilcdn.fi/8Gs_za0yU38CdYsZEBdo7QfWiMc=/510x318/top/img-s3.ilcdn.fi/34a0412d8e31d2b08bcd6337f988f698f664134f32912bb643932bb295bc1e09.jpg,4CE68EA8A20E4B2688ADFBC14273559F
2020-02-11T10:08:45.000Z,Koronavirus voi tartuttaa jopa 60 prosenttia maailman väestöstä ,Koronavirusepidemia saattaa levitä jopa kahteen kolmasosaan maailman väestöstä.,https://img.ilcdn.fi/ps9GikFvzAc18LHNBBi4jeBM9ts=/510x318/top/img-s3.ilcdn.fi/32ff4d66a3166796177d7ebbda2aef86ff8f0f1d31d0a3cf04a565c0a9cd2d30.jpg,D3843B22D15E4AE39B299473C0550F82
2020-02-11T10:24:22.000Z,Posketon palkka! Lewis Hamiltonille huhuillaan todella tuhtia palkankorotusta: ”Me haluamme nopeimman miehen”,Mercedes on tarjoamassa Lewis Hamiltonille todella tuhtia palkankorotusta Independent-lehden mukaan.,https://img.ilcdn.fi/StWKm6cjGsaq-45Ar01mNfuiKY4=/0x55:2563x1658/510x318/top/img-s3.ilcdn.fi/16e93410478f93613132f44b01b1593be62526363186face129ff5336c49f8c1.jpg,15AD9D7B4D3E4B06A3BFC76FF5BEAEA4
2020-02-11T10:40:53.000Z,Traktori hyytynyt pahasti – Jokereilla edelleen kiikarissa divisioonansa ykköstila,Päivän pelinvalinta on KHL:n Jokerit–Traktor.,https://img.ilcdn.fi/G3-BaJqFHNmMMrlmZ95ZsfsrGcc=/0x19:3000x1895/510x318/top/img-s3.ilcdn.fi/a6c4515a766cf44dacd11cabbef89c756ebbce044877846b2ad890dd69b8a1ed.jpg,D0B1FD0062774AF7B3DEB4F541EF97E3
2020-02-11T10:49:22.000Z,Näyttikö Pamela Anderson todelliset kasvonsa? 74-vuotias Jon Peters ”jekutettiin” naimisiin: ”Maksoin hänen velkansa ja tässä on kiitos”,"Pamela Andersonin, 52, ja Jon Petersin, 74, pika-avioliiton taustoista on tihkunut uutta tietoa.",https://img.ilcdn.fi/wM6FT4jR6i1mMoc28qiFwEqmLsQ=/510x318/top/img-s3.ilcdn.fi/da5a0dfd866e993fd65344fec7232816d28c89743fa9805e9ba5825e1ef6192d.jpg,6DA88E5268854FDF9A1C1EC5A850297D
2020-02-11T11:03:46.000Z,"Pornosivusto tarjoaa vapaan pääsyn Diamond Princess-risteilijälle karanteeniin määrätyille ihmisille - ""he kärsivät ikävystymisestä""",Pelko virustartunnasta ei ole ainoa harmi eristetyille ihmisille.,https://img.ilcdn.fi/ENrhhGuk3Mge6u5uA6B44PWC6fk=/510x318/top/img-s3.ilcdn.fi/082468fcd4d2fd275ddea2bc404be46ee750a3abad1021d0d4bbddb7bbb47f67.jpg,746F49E888F646E3AA6E21B284E26149
2020-02-11T11:06:55.000Z,Missä Isisin vangit ovat nyt? 8000 kadonneen joukossa kuuluisa toimittaja ja pappi,Yli 8000 terroristijärjestö Isisin vangikseen ottamaa ihmistä on yhä kateissa.,https://img.ilcdn.fi/sAJmlof-aQ-29ar4RBUt1KDXaks=/510x318/top/img-s3.ilcdn.fi/dc1f2e1a53e575bc2d17e9182f11e4b05de753fa8e1867387bf580ce12955615.jpg,F16C3312D10D44368A1F0D37FA49ABC9
2020-02-11T11:12:17.000Z,Konkaripakit Topi Jaakola ja Markus Kankaanperä jättävät SM-liigan,Topi Jaakolaa ja Markus Kankaanperää ei nähdä enää tällä kaudella SM-liigassa.,https://img.ilcdn.fi/LvJA5l1XragfUhhMHNKV-vPnsis=/0x0:3000x1876/510x318/top/img-s3.ilcdn.fi/0feba50c30072a933993c664f468aac5b632aa070c76dc220c26085088bac2a4.jpg,27E93770065B483B90374411566344B9
2020-02-11T11:30:43.000Z,1200 km/h New Yorkista Lontooseen – matka taittui ennätysvauhtia,British Airways lensi ennätysajassa New Yorkista Lontooseen.,https://img.ilcdn.fi/PY5EWgH5dYotoFcq258f5euRFko=/510x318/top/img-s3.ilcdn.fi/7d258969f545a5b18387b63abe176fcef7e502c1c51620d65e64d33abab53a4f.jpg,E3C5E046A2114676A103D5CA7DE8D91C
2020-02-11T11:37:43.000Z,Pohjoismaiden paras pukeutuja? Jankan tyyli on kaikkea muuta kuin minimalistinen – katso kuvat!,Norjalaisen juontaja ja muotivaikuttaja Janka Pollianin tyyliin on helppo ihastua.,https://img.ilcdn.fi/_DoDAN8iFsW630P3IEB_TMaseH4=/510x318/top/img-s3.ilcdn.fi/d9b6382ced547f39b303d6f5d3aee120dcaba71b7ce32e3759521f69da1b93f3.jpg,7EBBD0FDF2694E7186C2758A99261CA8
2020-02-11T11:49:26.000Z,Viisi myyttiä vedonlyönnistä: ”Ammattimaisesti vedonlyöntiin suhtautuvalla ei saa olla peliongelmaa”,IL:n vedonlyöntiekspertti Pete Käenmäki käsittelee ja oikoo viisi harhaluuloa ammattimaisesta vedonlyönnistä.,https://img.ilcdn.fi/qZYmsgrt2rEI1u3vsfAIFl58G7A=/510x318/top/img-s3.ilcdn.fi/b5e68ae85c5214ded1cd02e2d14d4d4c8488cf152368b5c2bb5a4258bbe3aa11.jpg,E21C0298DF2C4A43B8B6562CE51AAF65
2020-02-11T11:54:20.000Z,Käänne Pirkanmaan joukkokiinniotossa: vapaaksi päässyt naiskolmikko edelleen epäillyn asemassa ,Noin 35-vuotias mies löytyi kuolleena yksityisasunnosta Mänttä-Vilppulasta lauantaina.,https://img.ilcdn.fi/XSUpeKOS1qblzxsIs2NK_503msI=/510x318/top/img-s3.ilcdn.fi/ffb1329d84de2d74238729e30240c66dd1f185611d3ca092fce35c175dcaa134.jpg,6A86CCDA067543D483978ADEC806505C
2020-02-11T12:04:39.000Z,Hurjasti painoa pudottanut Adele on lähes tunnistamaton - juhli leopardikuosissa Oscar-jatkoilla,Adele juhli Beyoncen järjestämillä Oscar-gaalan jatkoilla.,https://img.ilcdn.fi/3htPBjuQGoMnZRhX0Ue7AXYerhk=/510x318/top/img-s3.ilcdn.fi/9aefd81503743bd781c9116d75cf36e485f383c4b03643a7c2796136e26c0ba9.jpg,3CED029BFD9C4097B9518077FF813E21
2020-02-11T12:07:05.000Z,Kaisa Mäkäräisen tilanne täysin poikkeuksellinen ennen MM-kisoja – Toni Roponen lyö tiskiin kovia yksityiskohtia,Suomalaistähti lähtee MM-kisoihin vailla mammuttimaisia menestyspaineita.,https://img.ilcdn.fi/QPgm8fhpK_3GU9_AdPWdwPGA6i4=/510x318/top/img-s3.ilcdn.fi/c25b07b9ef2ce22ce3778e173def08d2f54fe589de7112d42ee9df7214ce45fe.jpg,466C9B6847944C179741612616F6C12B
2020-02-11T12:09:19.000Z,Ikean uusi toimitusjohtaja on Jon Abrahamsson Ring,Abrahamsson Ring aloitti Ikea-uransa harjoittelijana 1990-luvun lopussa.,https://img.ilcdn.fi/J__492vFj-MT84GLa2PvmFGrpfc=/510x318/top/img-s3.ilcdn.fi/525ac27d5860d425d1c67bb29db4b514bb318110873dfdef330f4adc09c49db9.jpg,1D10AC1F02404C98842A2CDF35FEBB5F
2020-02-11T12:27:47.000Z,Pääministeri Marin työllisyyskeinoista: ”Olemme myös valmiita tekemään vaikeita päätöksiä”,"Pääministeri Sanna Marin (sd) avasi eduskunnalle antamassaan ilmoituksessa hallituksen politiikasta keinoja, joilla hallitus aikoo nostaa työllisyysasteen 75 prosenttiin.",https://img.ilcdn.fi/LazPMwwpHwyIVe-bfEGqETilWK4=/510x318/top/img-s3.ilcdn.fi/59632b2da06c629bae8106d0a8b588057e206d4c0698e3dd89618162d49894d2.jpg,6C0DFBD53CF2466FB32196C87F721B60
2020-02-11T12:33:42.000Z,Kuva ei herkille: Tamperelaismiehen kananmunista putosi ällöttävä yllätys pannulle,Tamperelaismies osti joulun alla kananmunia. Sen jälkeen niitä ei hetkeen tehnyt mieli.,https://img.ilcdn.fi/1gGcrOQ4--SkXlloalMdwFgE9CA=/510x318/top/img-s3.ilcdn.fi/81f72fd7809f3d3a693b100bfefe063e35de3f814b6622aaed4339d681cacea5.jpg,EB6B26F1B4A047188EEF2DD41E7CBA29
2020-02-11T12:52:32.000Z,Poliisilla operaatio vantaalaisella pientaloalueella: ”Suojasimme sivullisten turvallisuutta” ,Henkilö oli uhkaillut sivullisia.,https://img.ilcdn.fi/-w1gL2Wi8S2mJ78ibOooTC0lz0E=/510x318/top/img-s3.ilcdn.fi/868baaa56ff6d4b5775bbac1c41027cf9f9beffd46ce38fb169533bd8966ccd9.jpeg,5014332EB81F46528C7BC05A305BF3A2
2020-02-11T12:57:38.000Z,Lentokaaos Saksassa – Suomen nuori ampumahiihtolupaus jäi aseineen jumiin: ”Huoltomies on hoitamassa asiaa”,Myrskytyyli perui maanantaina lentoja Keski-Euroopassa. Suomen Venla Lehtosen matka tyssäsi Frankfurtiin.,https://img.ilcdn.fi/a8JPcycOYIT3Vr_Rie3-WctoN54=/510x318/top/img-s3.ilcdn.fi/b3b0638bae195746c5e838c9e7f639a406058c4cb48c62ce0528f72a788aa99d.jpg,B19F8515ED594ABF8E4363C1514654DE
2020-02-11T13:03:05.000Z,"Ruotsin prinssi Oscar, 3, varastaa huomion uudessa perhepotretissa - miten leveä hymy",Ruotsin kruununprinsessa Victorian perheestä on julkaistu uusi yhteiskuva.,https://img.ilcdn.fi/1b_XhGKI7iOtJUBdAeuAH33H96M=/510x318/top/img-s3.ilcdn.fi/0f6449b994a58f7d7e02ed46198e6fd91369b38c4620e7874b4a1e7fcebbb7e9.jpg,F9335F8614B646A69C6DFE7CBF174C30
2020-02-11T13:11:15.000Z,"Suomalaiset avautuvat pettämiskokemuksistaan: ""Hävettää, että petin ystäväni huijarimiehen tähden”","Pitkään kestänyt salasuhde, suhde parhaan ystävän puolisoon ja viesteistä paljastunut vieraan naisen raskausepäily. Suomalaiset kertovat, miten heitä on petetty suhteissaan – ja miten he ovat itse ajautuneet pettäjiksi.",https://img.ilcdn.fi/QMl94MndKi82FvhD60GF4vwxoJI=/510x318/top/img-s3.ilcdn.fi/f4121813ccab4964e8c5e3695d490e6274fc7f4dd4769258866ac2687f51dd21.jpg,26A54D6EC6894DC2A6DD91EAF8B2E56D
2020-02-11T13:13:44.000Z,Volvon uusi sähköauto puhuttaa: 400 km toimintamatka ja urheiluauton kiihtyvyys!,Volvon urheiluautomaisesti kiihtyvä XC40 -sähköauto on esitelty viikonloppunäyttelyissä Suomessa ja tilauskirjat ovat alkaneet täyttyä. ,https://img.ilcdn.fi/IXy82cPKdNAYdt2fkkajfsH8-Ws=/510x318/top/img-s3.ilcdn.fi/57d9048af062810755ac7cb090c602bf68d8625e5e14224111fd4c57bf15d93f.jpg,F30C3BFD3CD24AA98BC4638A3FD6D45B
2020-02-11T13:20:40.000Z,Suomen parhaimmiksi arvioidut ravintolat on listattu – löydätkö joukosta oman suosikkisi?,Pöytävarausjärjestelmä jakoi tunnustusta ravintoloille asiakkaiden arvioiden perusteella.,https://img.ilcdn.fi/m_lnqLYWCr2mVKnvAnV-IMdA6M4=/510x318/top/img-s3.ilcdn.fi/024cc79774ca55e794bc4bf4b674f302a749ea708ccc964209a05d29b98ba59b.jpg,9F8F95C38F7B4D9798317A68E8315AF6
2020-02-11T13:29:17.000Z,Lehti: Tässä on Petteri Forsellin uusi seura!,Petteri Forsell on siirtymässä Puolan pääsarjan Korona Kielceen.,https://img.ilcdn.fi/XvySI5G5gAEOdMsRJIHzxU78gJY=/510x318/top/img-s3.ilcdn.fi/11b0da6afd0f9a39b4ad7741db46fc8aab3c7f99ddd8b0035d361789c8caf1da.jpg,3B55324F8F984620A9682B753F64A9B1
2020-02-11T13:30:19.000Z,Ville Rannan pilapiirros: Angela päättää pelastaa demokratian saksalaisilta,Ville Rannan pilapiirros 11.2.2020.,https://img.ilcdn.fi/65COVdT4f2ACL4eUYsVWL-cjJFQ=/510x318/top/img-s3.ilcdn.fi/05be66c0cb2962d557f30e06013b47c77adec9132d479fb4384fb6688a3db6c6.jpg,E561613F8F13474FBD7931A195E4B345
2020-02-11T13:39:24.000Z,Aku Hirviniemi iloitsi somessa vapauttavasta tuomiosta liian aikaisin: Ahdistelusyytteet hoviin keväällä,"Aku Hirviniemi ehti Facebookissaan iloita vapauttavasta käräjäoikeuden tuomiosta, mutta liian aikaisin. Toukokuussa syytteiden käsittely jatkuu Turun hovioikeudessa. ",https://img.ilcdn.fi/w2FgnH1DNV61dbdWDVPAapXaYqs=/510x318/top/img-s3.ilcdn.fi/7e42e42f0a3b2b09f632b195a2fb9dbca4a2e5e0dffa28f485c93d29d6c64d1b.jpg,D9802DCE2FE84705BE6176CD8F4B8234
2020-02-11T13:55:40.000Z,Tasa-arvo eduskunnassa on parantunut – nuori naiskansanedustaja moittii seksistisiä vitsejä ja nettipalautetta,Tiistaina julkistetun Terveyden ja hyvinvoinnin laitoksen (THL) selvityksen mukaan tasa-arvo on viime vuosina eduskunnassa parantunut.,https://img.ilcdn.fi/k5po7zl_zWrn8J2d744KDu17kBQ=/510x318/top/img-s3.ilcdn.fi/659ed1c02aa73f3d5f894b3b2b6e808a8e014fb88d05674306eeafb4cf429e84.jpg,ED67F2E1F6EA4A1BA91D97C696040597
2020-02-11T14:01:51.000Z,Syyte: Vastamielenosoittajat heittelivät Soldiers of Odinin kulkuetta kivillä ja kananmunilla,Syytteen mukaan kaksi miestä yllytti vastamielenosoittajia kohdistamaan väkivaltaa Soldiers of Odinien joukkoa kohtaan.,https://img.ilcdn.fi/48kHZHfxBpqCiIrHBgIKmK8ZYdo=/510x318/top/img-s3.ilcdn.fi/4422f103cc4acbacf3f8701d7dce2567693e74928810ef46854eba5b2af13632.jpg,9580C8217C6546E88F7C89A5749411EB
2020-02-11T14:02:10.000Z,Mike Tyson valmistautui matsiin seksileirillä: ”Päivää ennen ottelua otin kaksi siivoojaa” – sitten tuntematon Buster jysäytti kaikkien aikojen pommin,"Välipalaksi kaavailtu Buster Douglas tyrmäsi tasan 30 vuotta sitten Mike Tysonin, voittamattoman maailmanmestarin.",https://img.ilcdn.fi/YY4D46SRNzcb5NnlYH__muUCvAc=/510x318/top/img-s3.ilcdn.fi/8120ed1e8ac38b3d5055f4e78c986056405318f1e2dd83e090813e9929a1a7d7.jpg,DB0FB71C7D61484199E6F28DE726D9B4
2020-02-11T14:18:05.000Z,11 ihmistä sai koronaviruksen Steve Walshilta - supertartuttaja on yhä eristettynä sairaalassa Lontoossa,Brittiläinen liikemies ja koronaviruksen supertartuttaja Steve Walsh on eristyksessä lontoolaisessa sairaalassa.,https://img.ilcdn.fi/bWI1lCJyS1jBo3r7YkT1Kf2Ljbw=/510x318/top/img-s3.ilcdn.fi/d0e20db8e2a4837cab855d42bdc447d425ddbe21bd6af91b99ded84efe569092.jpg,2A6C9BCB4C7D4FF4990CFB0D26272F7C
2020-02-11T14:34:43.000Z,Jenni Alexandrova julkaisi kuvan pojastaan – poseeraavat yhdessä selfiessä,Radiojuontaja Jenni Alexandrova poseeraa vastikään julkaisemassaan kuvassa poikansa kanssa. ,https://img.ilcdn.fi/JNpRYYLaIGHoYXa05xjd2A8nl0s=/510x318/top/img-s3.ilcdn.fi/d08fc8f2ae34c46cbc6f39674f1f06ee79f3b9fc8b2046feb5017af44abddaaa.jpg,FE4BC9C03EA346D39ADD34768424BEA5
2020-02-11T14:35:46.000Z,Seiväshypyn ruotsalainen EM-mitalisti on nyt nainen – tukahdutti identiteettinsä machoilulla: ”En kestä enää”,48-vuotias seiväshypyn EM-mitalisti korjasi sukupuolensa.,https://img.ilcdn.fi/08og3wqGYofYs0OQvcfNEFeGa8I=/0x130:2000x1380/510x318/top/img-s3.ilcdn.fi/fe0d82d737b1cdc9f7e612cc6eabcaf3a0caf9012299cfb0f8739264d6aba764.jpg,5C87DFBA5CE04D02A582BBB9EF0BC167
