paivamaara,otsikko,tiivistelma,kuva
2019-09-25T10:01:02.000Z,"Pekingin keskiviikkona avattu lentokenttä on 98 jalkapallokentän kokoinen, Finnair lentää jatkossa uudelle Daxingin kentälle ",”Meritähti” on maailman suurin yksittäinen lentokenttäterminaali.,https://img.ilcdn.fi/70Db5cNT_qwq4PWNqFvfuxhxAiU=/510x318/top/img-s3.ilcdn.fi/94aca079632acf27c2bc6cd9d4543d99ab01aee7b5e31cc22130ba532c6dd036.jpg
2019-09-25T10:04:41.000Z,"Suora lähetys klo 13.30: Britannian parlamentti palaa tauolta, eroaako Boris Johnson?","Korkein oikeus totesi eilen, että Johnson toimi laittomasti passittaessaan parlamentin istuntotauolle. ",https://img.ilcdn.fi/8U-QZ79ZlqxigxOj1n825h8CNMY=/510x318/top/img-s3.ilcdn.fi/59f8f9aadc6da50039f59adf704f8f8892087b31167ff12a0098a91a89915b04.jpg
2019-09-25T10:40:34.000Z,"Eduskunta pui kansalaisaloitetta seksuaalirikollisten karkotuksesta - Hassi näpäytti PS:n kansanedustajaa: ""Kankaanniemi voi tarkistaa pöytäkirjasta, mitä minä sanoin""","Kansanedustajat saivat tänään puitavakseen kuuman aiheen, kun käsittelyssä oli kansalaisaloite seksuaalirikoksista Suomessa tuomittujen ulkomaalaisten oleskeluluvan peruuttamisesta ja karkoituksesta.",https://img.ilcdn.fi/Ujs83_VNCju6rPO8iJffKIfWECA=/510x318/top/img-s3.ilcdn.fi/f4a4c2d3e9a60bb8a8cbaa8769969bec4a44ef9277468e1cbeb23e23990b0d2c.jpg
2019-09-25T10:42:42.000Z,Nämä sijoittajan perusasiat opetettiin Miss Suomi -ehdokkaille: Raha jauhaa rahaa ja paperit kuntoon ennen avioliittoa,"Miss Suomi -kiertue vieraili tiistaina naisten pörssiklubilla. Sen vetäjä Marja-Leena Haapanen piti misseille sijoituskoulutuksen, jonka opit hän jakaa myös IL Rahan lukijoille.",https://img.ilcdn.fi/J6IsRVIxGhkZIihAyc9tMYni83c=/0x176:3000x2050/510x318/top/img-s3.ilcdn.fi/f4bc9d0a272bc116c36910d3b8d04a00b3c746a413ac908ac7160560436896e6.jpg
2019-09-25T10:48:14.000Z,"Ässien kultakypärä kärysi nuorena dopingtestistä -  erikoinen yhtälö herätti kysymyksiä: ""En vieläkään tiedä mitä tapahtui""","Säkenöivästi Ässiin saapuneen Edwin Hedbergin uralle tuli äkkipysähdys 20-vuotiaana, kun hän kärysi dopingtestissä. Puolen vuoden pelikielto toi mukanaan myös jotain hyvää. ",https://img.ilcdn.fi/uf9c6C4lt3yo7tlfnel_K__sEdg=/510x318/top/img-s3.ilcdn.fi/3ede90d0b010213261e28d3133da5205af74130d674b2f4c9466dc0f84d64c2c.jpg
2019-09-25T10:55:39.000Z,Mari petti Eeroa jo ennen Temptation Island Suomea - edelleen lämpimissä väleissä kaikkien osapuolten kanssa,"Mari, 21, ja Eero eli Väpä, 21, viettivät kesälomansa Temptation Island Suomen kuvauksissa. ",https://img.ilcdn.fi/Dci68LN5dNnw1IUOZV-W2kHQKvc=/510x318/top/img-s3.ilcdn.fi/3016266018f282f2211cc67f1d78f4e6e18cd765f9d23bc4cca33c9d46a50bc7.jpg
2019-09-25T11:06:27.000Z,Bayern Münchenin seurapomo uhkailee maajoukkuetta täysin poikkeuksellisella boikotilla - syynä Saksaa puhuttava tähtipelaajien taisto,Bayern München -pomo Uli Hoeness puolustaa harvinaisen kiivaasti Manuel Neueria. ,https://img.ilcdn.fi/p_co8OUtUfpnRVL8lnjG17aATik=/510x318/top/img-s3.ilcdn.fi/beda66b8d1246fb9ad9c9816af37e84702058502bd3ad6138463981f20711618.jpg
2019-09-25T11:20:53.000Z,"Uutuuskirja: Tapio Suomisen ura Ylellä päättyi dramaattisesti, kertoo hautoneensa itsemurhaa – ”Kantti ei kestänyt”",Tapio Suomisen elämäkerta Urheiluhullu ilmestyy tällä viikolla.,https://img.ilcdn.fi/SnXOEQ3HBI6kXYWwjJNKcPXnyb4=/0x98:3000x1973/510x318/top/img-s3.ilcdn.fi/47f941ffaee1bb6db05c53244d93b04d1c655638b374aefe2b27460734778789.jpg
2019-09-25T11:33:24.000Z,Karmea temppu Nokialla: Joku oli tökännyt neulan Sirpan tarjolle laittamiin omenoihin,"Nokialla sattui viime perjantaina ikävä tapaus, kun ohikulkija löysi Sirpa Mäkelän tarjolle laittamista omenoista neulan. Poliisin tiedossa ei tällä hetkellä ole epäiltyä tai motiivia.",https://img.ilcdn.fi/4yJQv8e7HZ_FAElir4nFTMRtYlY=/0x311:542x650/510x318/top/img-s3.ilcdn.fi/30f604c8e112ff52c31623954a491b2f039fd8cc07639c99d278322728576304.jpg
2019-09-25T11:40:42.000Z,Liikenneministeri  Marin: Liikenteen päästöjä pitää vähentää ennakkoluulottomasti,"Liikenneministeri Sanna Marin vaatii liikenteen päästöjen vähentämistä, jotta Suomi pääsisi tavoittelemaansa hiilineutraaliin aikakauteen vuoteen 2035 mennessä.",https://img.ilcdn.fi/P7N74oVlz3NUeziuP43CQiYtNj8=/510x318/top/img-s3.ilcdn.fi/f9ae8774aa53bed56dabb43785db63415a89f1bad109c228e7b29e8cc00f82a0.jpg
2019-09-25T11:44:50.000Z,"Uutuuskirja paljastaa: Kun aika on -hitistä tunnetun iskelmälaulaja Seija Simolan traaginen elämä: Menetti äitinsä, pikaero, euroviisufiasko...",Edesmenneen iskelmälaulaja Seija Simolan ääni on jäänyt elämään.,https://img.ilcdn.fi/utqchqlu8abIBxE6hbjMcxLAe9I=/510x318/top/img-s3.ilcdn.fi/069f01b76432455f924ebce0fe297ed6737e7443ed02db223bb5318f84917903.jpg
2019-09-25T11:55:12.000Z,Ministeriö vaatii korkeakouluilta lähes 8000 uutta tutkintoa – ei lupausta erillisestä lisärahasta,Hallitus lisää korkeakoulujen perusrahoitusta 60 miljoonalla eurolla. Sillä pitäisi rahoittaa myös merkittäviä tutkintomäärien lisäyksiä.,https://img.ilcdn.fi/Ubwx52n_qjeOxq-4oybViQRCGgY=/510x318/top/img-s3.ilcdn.fi/897fa4964b1a70dbd5fef958cc5c83dcd621c8c19579666ddf3641847e7b2696.jpg
2019-09-25T11:57:04.000Z,Syksyn suosituin kuosi on nyt kaikkialla – näin hyvältä ruutu näyttää,Näin kuosien klassikko taipuu maailman parhaiden pukeutujien päällä.,https://img.ilcdn.fi/qCkq112tdlBJsyedBwuA4nTxy-M=/510x318/top/img-s3.ilcdn.fi/c184848e638728f9a20aab46f8cebd1969b556f6822726a1e77fdfb6b7b2b2e5.jpg
2019-09-25T12:27:34.000Z,KRP tutkii Estonian hautarauhan rikkomista – Epäily: saksalaislaivalta laskettiin sukellusrobotti hylylle,"Keskusrikospoliisi selvittää yhdessä Rajavartiolaitoksen kanssa, onko vuonna 1994 uponneen matkustaja-alus Estonian hylyn hautarauhaa rikottu.",https://img.ilcdn.fi/3EibntWHrvBoPkvK5v3ARxrSOZg=/510x318/top/img-s3.ilcdn.fi/baced8258c8d3afe6444010b83f376e93884a62a1c43b9813a35b724d6b1da88.jpg
2019-09-25T12:36:59.000Z,Channing Tatumista eronnut Jenna Dewan löysi nopeasti uuden onnen – odottaa lasta näyttelijärakkaalleen,"Jenna Dewan odottaa toista lastaan, uutisoi People.",https://img.ilcdn.fi/G7zrpOgPKvd-FqMznfAwgPYOo4A=/510x318/top/img-s3.ilcdn.fi/b3dee5258ffb6a3c820de1f10840d64af31d91b9953ab325647fe2b3a72e1efa.jpg
2019-09-25T12:39:33.000Z,Microsoft varoittaa vakavasta selainuhasta – hyökkääjät voivat ottaa koko tietokoneen haltuunsa: Lataa välittömästi päivitys tai vaihda selainta!,Microsoft ohjeistaa Windows-käyttäjiä asentamaan uuden hätäpäivityksen tietoturvan parantamiseksi.,https://img.ilcdn.fi/1iZOUmM1jfjCh17SdX_nRiVvn30=/510x318/top/img-s3.ilcdn.fi/6427904599027e72443af0dec44e50769448ea118e439bcd83bd367abbbbcde0.jpg
2019-09-25T12:42:49.000Z,Jokereille huippuvahvistus NHL-jäiltä! Saku Mäenalanen siirtyy Helsinkiin,Saku Mäenalanen oli viime kauden jälkeen vapaa agentti.,https://img.ilcdn.fi/7-O8aOdofSeyCxLIV7QfqXB3iQg=/510x318/top/img-s3.ilcdn.fi/fdecb905d9bb53971a31198e96ece6ed0103771f425ce292c9afc18773a3d93a.jpg
2019-09-25T12:52:30.000Z,Osa Mont Blancin jäätiköstä romahtamassa - ihmisiä evakuoidaan lähellä hiihtokeskuksia ,Myös teitä on suljettu Länsi-Euroopan korkeimman vuoren lähellä.,https://img.ilcdn.fi/XsmkHw29LVr9MugM9DCvtTkKaqE=/510x318/top/img-s3.ilcdn.fi/a576316682afa8c057ae13d6263f4aed588466cfdb97bb669dda0d51f0bd73f1.jpg
2019-09-25T12:55:21.000Z,Morsiamet varokaa! Minna ei ole ainoa huijattu: pitääkö näille puvuille itkeä vai nauraa?,Älä tilaa hääpukua halvalla netistä! Brittisaitti julkaisee kuvia epäonnistuneista hääpukutilauksista varoittaakseen morsiamia feikkikauppojen vaaroista. ,https://img.ilcdn.fi/dK1anbTIpAkU98FaFVIvlKEesMU=/510x318/top/img-s3.ilcdn.fi/a6a2309cc676b01a11a3a5b0c6229287a281bf3ba51e8e7c3796d3e9d4b54283.jpg
2019-09-25T12:56:15.000Z,Lyhyen matematiikan yo-kokeessa oli kunnon källi: oikeaan vastaukseen ei tarvitse laskutoimitusta – osaisitko?,"Tehtävä osoittaa sen, että matematiikka ei ole pelkkää laskemista. Se on myös logiikkaa ja päättelyä.",https://img.ilcdn.fi/-BZB8Rlx4KNtOcA3yn6ZByhQBnY=/510x318/top/img-s3.ilcdn.fi/f67138a40d51211cc0e53e11164462d7d4fc4677da2035494c77016516595872.jpg
2019-09-25T13:03:30.000Z,Journalisti: Kielitoimisto esti Neekerisaaren nimenmuutoksen Liperissä,Loukkaavaksi koettu paikannimi on löytynyt kartasta 45 vuoden ajan.,https://img.ilcdn.fi/eH9loxVvjmjY7rFd5ZkCZl5bIJg=/510x318/top/img-s3.ilcdn.fi/e70b216d47f521debdb68e357256713a25c229c76febb4c94502490d73023bc6.jpg
2019-09-25T13:22:05.000Z,"Teemu Pukilta harvinainen jyrähdys elämäkerrastaan! Oikaisi heti virheellisen väittämän: ”En tiedä, keneltä on peräisin”",Urheilutoimittaja Juha Kanerva kirjoitti Teemu Pukista elämäkerran.,https://img.ilcdn.fi/ADJjX7pNSv7qZ1xvNcgh_S60bXA=/510x318/top/img-s3.ilcdn.fi/ce55d51772c71c2365c4ab513cc834dc21104b6f1b0ef1eb940a03d2ef71cbf9.jpg
2019-09-25T13:30:37.000Z,Lomaile Lapissa kuin Kardashian - näillä Kourtneyn keinoilla se käy,Haluatko viettää Rovaniemen-lomaa Kourtney Kardashianin tapaan? ,https://img.ilcdn.fi/zAQ9lGAchmppHmVxGSTDzg5l6ro=/510x318/top/img-s3.ilcdn.fi/6bd0ad17b7242483ac4dbeacad4ffe349041d2be4b127be51c68529cd2c89438.jpg
2019-09-25T13:45:18.000Z,"Aktivistit yrittivät estää luksusristeilijän lähdön Helsingin Hernesaaressa, asettuivat kajakeilla aivan laivan kylkeen","Queen Elizabeth -aluksen piti aikataulun mukaan lähteä Hernesaaren satamasta kello 17., mutta lähtö viivästyi.",https://img.ilcdn.fi/sLs-MHsqdw5Z9i5Ae9d-rAD-r0Y=/510x318/top/img-s3.ilcdn.fi/1539f6a97000f0aa5e005dc1dd8d781e8a3a0f053c1a644bf5b04eafe815eb75.jpg
2019-09-25T13:47:02.000Z,Kaksikko yritti poistaa hometta kellarista polttamalla rikkiä: Tuloksena myrkytys ja sairaalareissu,Pelastuslaitos tiedotti myrkyllisestä toiminnasta.,https://img.ilcdn.fi/5k_sRUv1beR51_H7_sC1vqT_Nr8=/510x318/top/img-s3.ilcdn.fi/c46fde9c80c81fb2209da074acb98aa8385df6b67983fa3e9714270cbe6b8c09.jpg
2019-09-25T13:50:20.000Z,Uber lupaa: Tämä keksintö vähentää pyöräonnettomuuksia - ”opetamme myös hollantilaisen otteen”,"Uber lanseeraa Helsinkiin kännykkäsovelluksen, jonka tarkoituksena on vähentää pyöräilyonnettomuuksia. Keksintö ehkäisee pyöräilijää törmäämästä juuri avattuun auton oveen.",https://img.ilcdn.fi/RXVTpQ_9--ikuIUVtUoLivwHwNE=/510x318/top/img-s3.ilcdn.fi/c505fb2a2d77980dea3aaa94a7b32d2c6f70cb2df3e56dd6ff335b0a29c8c611.jpg
2019-09-25T13:51:01.000Z,"Terveystarkastajan mies ampui 200 kania - Joukkolahtausvyyhdissä 15 rikosnimikettä, useita epäiltyjä ","Hallinto-oikeus on jo aiemmin käsitellyt juttua, mutta valituksia on vetämässä korkeimmassa hallinto-oikeudessa.",https://img.ilcdn.fi/I_mhINxZ1W82pAAFUn5I7_25OCU=/510x318/top/img-s3.ilcdn.fi/279acccb8e1a007704d47b00828b6d14c007d9c8ab9f10851c807bf8a2e8387e.jpg
2019-09-25T13:57:22.000Z,Ratkaisuhetket lähestyvät: NHL:n huippuluokan ärsyttäjä teki rahakkaan sopimuksen – nyt odotellaan Patrik Lainetta ja Mikko Rantasta,Matthew Tkachukin sopimuksen myötä rajoitettujen vapaiden agenttien lista kutistui muutamaan nimeen.,https://img.ilcdn.fi/wSt_pTvwkMqki4MgogJpM69GcH8=/510x318/top/img-s3.ilcdn.fi/1d77a6b1e1ca90d67dd2366db105066c537ecc04e739737aceb77b9985ef1819.jpg
2019-09-25T14:00:53.000Z,Ilmastonmuutos on verrattavissa Thaimaan tsunamiin – tutkimusprofessori varoittaa jo nyt ennusmerkeistä: ”Aikaahan ei ole yhtään”,"Suomen ympäristökeskuksen tutkimusprofessori Markku Viitasalo sanoo, että tsunamin lailla ilmastonmuutoksen merkit ovat jo nähtävissä.",https://img.ilcdn.fi/d6AEhw6J21VdubJnRmnJrSg8N_g=/510x318/top/img-s3.ilcdn.fi/46a5774e37109d780a6aa139a38c8230ec6a2fee8612d240e9d5db7e2fad75db.jpg
2019-09-25T14:17:05.000Z,Kelan pääjohtajaksi kuusi ehdokasta – suosikki koki kolme vuotta sitten tylyn kohtalon ja hävisi arvalla,Kelan pääjohtajakisan loppusuoralle selvisi kuusi ehdokasta. Outi Antila hävisi pestin viimeksi tylysti arvalla.,https://img.ilcdn.fi/N1r0FKvX7KubaqHAKfnJZk7SEww=/510x318/top/img-s3.ilcdn.fi/ed4b5871c3783fa6b48fb366e3be52e6fc018b07b25befa25180724581ab1f06.jpg
2019-09-25T14:24:37.000Z,"Naiset vihaavat, kampaajat rakastavat – näitä tukkatrendejä sinun pitäisi silti kokeilla","Kaipaatko uutta ideaa hiuksiisi? Tässä kolme trendiä, joita ammattilainen haluaa sinun kokeilevan - ja joita muuten tuskin uskaltaisit testata. ",https://img.ilcdn.fi/WVa_ZL5yE2repCIC2gk5t_mtiXI=/0x188:2000x1438/510x318/top/img-s3.ilcdn.fi/de6fc4ae982e0cc4c6e4228d59c0e3f2a89fef84f8b9b33452fe963c277d8f5e.jpg
2019-09-25T14:25:21.000Z,Ryhmäliikunnalla huippukuntoon – tähtiohjaaja vinkkaa parhaat lajit,Ryhmäliikuntakonkari Kira Tiivola saa parhaat ideat omille tunneille toisten vetämistä treeneistä.,https://img.ilcdn.fi/eHy2Bh9NIWRftV2ND5nlF6QUfu0=/510x318/top/img-s3.ilcdn.fi/bce3e290a1d8e38e528795fa7c87aa81fbbbc738c53f9a0ea241da8c18a7fff6.jpg
2019-09-25T14:30:34.000Z,Lauri Markkaselle huikeaa kunniaa: arvostettiin NBA:ssa todella kovalle listalle – jo nyt oman joukkueensa ykköstähti,Suomen NBA-tähti niittää mainetta ja valmistautuu kolmanteen kauteensa.,https://img.ilcdn.fi/8fEmmKs3jOXlp2XsSK6nB6VNsjc=/510x318/top/img-s3.ilcdn.fi/b3177aca6ac78d5537a86d9679ba15325a126246dc1bfec9b5a8e9dd07dcd9b3.jpg
2019-09-25T14:34:41.000Z,Ruotsalaisnainen ammuttiin ensi kertaa avaruuteen,Kansainväliselle avaruusasemalle on matkalla kaksi ensikertalaista. ,https://img.ilcdn.fi/9Iav5FLq3w4DuRL7D1vCp4ZQvdM=/259x731:2690x2243/510x318/top/img-s3.ilcdn.fi/3d737181a37e43c5e4568d65b65b412e57e1e3aaeaf90ecda6c43363d75a5337.jpg
2019-09-25T14:36:54.000Z,Tapio Suominen paljastaa elämäkerrassaan: Petteri Ahomaan imitaatio hienolla illallisella USA:ssa meni liian pitkälle – ”Täydellinen hiljaisuus laskeutui saliin”,Tapio Suominen muistelee elämäkerrassaan Petteri Ahomaan edesottamuksia Atlantan olympialaisissa.,https://img.ilcdn.fi/Hix3FGWQ1Pwk1me7W2D_Qgoo86o=/510x318/top/img-s3.ilcdn.fi/e06f7739e79d2acb9e0fc0ddcb330112bcc2de2df5e1722c0ac4a6fe9db50fe9.jpg
2019-09-25T14:43:07.000Z,Drone tiputti vankilaan marihuanaa ja puhelimen – katso turvakameran tallenne Amerikasta,Vangin tempusta ei ole vielä tullut seuraamuksia.,https://img.ilcdn.fi/MTDCiDqGNzhpzCWqH_ocDg5lGC8=/510x318/top/img-s3.ilcdn.fi/da6e58524f829d3ac089f8207c709c20c904eb82713354e636227a3be07c1e2e.png
2019-09-25T14:44:32.000Z,Apple varoittaa bugista: Voi antaa näppäimistösovelluksille Iphonen täydet oikeudet – vaarana salasanojen urkkiminen,Apple varoittaa IOS 13 -käyttöjärjestelmään päivittäneitä käyttäjiä.,https://img.ilcdn.fi/oPEQeeSip7jI2-Tb-3jFTENtTao=/510x318/top/img-s3.ilcdn.fi/73afc5237ee3011ab931ab7e2bbf5401365ccbff2b47ea641ff6b272e8abfbe1.jpg
2019-09-25T14:53:44.000Z,Holtiton ruoppaus vapautti syöpäsaasteita Kymijoen pohjasta – kolmelle miehelle syytteet,Joenpohjasta otettiin ylös 50 kuutiota teollisuusmyrkkyjen tärvelemää maa-ainesta. Syyttäjän mukaan miesten toiminta oli törkeän huolimatonta.,https://img.ilcdn.fi/0PTKqF18o4Trijj7-ZcMyg4MSuE=/510x318/top/img-s3.ilcdn.fi/ffdb7260156a8fe6dd7cf93276c465c4714865ca02265af73326861571ce1f28.jpg
2019-09-25T14:58:03.000Z,"Lehtiväite: Britney Spears, 37, voi jälleen huonosti, isä jatkaa holhoajana – muuttui lähes tunnistamattomaksi","Jamie Spears huolehtii jälleen Britneyn talousasioista. Hommaa hankaloittaa se, ettei Britney suostu puhumaan isälleen.",https://img.ilcdn.fi/6zTSPFWfWPX8xuR1xMf09YazHPs=/510x318/top/img-s3.ilcdn.fi/18709a1360c94b0461800b3d0935c24571ec0e37b4974ea430e37b53d178222e.jpg
2019-09-25T15:00:42.000Z,Työllisyys polkee paikallaan – nyt tarvittaisiin tehotoimia,"Hallituksen täytyy aktivoitua ja jämäköityä työlinjallaan, kirjoittaa politiikan toimittaja Juha Keskinen.",https://img.ilcdn.fi/Pfz4NgX1KypbCgvyGECrQMipgVc=/510x318/top/img-s3.ilcdn.fi/fa057684b97c419f113c8c4ffe3869be9166443eaf21a0fcd087463ede4bfb1b.jpg
2019-09-25T15:00:45.000Z,Puhelu todistaa: Trump pyysi Ukrainan presidenttiä tutkimaan Bidenin toimia,Valkoinen talo on uutistoimistojen mukaan julkaissut tiivistelmän kohupuhelusta USA:n ja Ukrainan presidenttien välillä. ,https://img.ilcdn.fi/_Q7x9SC2w2fXAyubioeH32PEOaI=/510x318/top/img-s3.ilcdn.fi/304b9e1a7bc639cd0da0b49a25b2730657198507b4c2d27b9cf5abaf93505cc7.jpg
2019-09-25T15:04:59.000Z,Täyteläinen sipulikeitto koleisiin syyspäiviin - juustoinen kuorrute kruunaa herkun,"Ranskalaisen sipulikeiton maku rakentuu hitaasti poreillen, mutta on odottamisen arvoinen arjen herkku.",https://img.ilcdn.fi/1d_8HyhAhSj3H3_MS3IXEMCqqn4=/510x318/top/img-s3.ilcdn.fi/1cebad2fa5ba8d2d3258cacecb5df524a18329a724eed841d1064fd56f1f0d14.jpg
2019-09-25T15:22:37.000Z,"Suomalainen valmentaja kertoo Dohan täysin poikkeuksellisista oloista – 60 metrin keihäsmies ajelee Maseratilla, lapsilisillä voi tienata melkein miljoonan","Yleisurheilu ei ole paikallisen väestön suosikkilajeja, vaan kärjessä ovat haukkakilpailut, kameliratsastus ja moottoriurheilu.",https://img.ilcdn.fi/a3Ksbfb3VJ-XwO74LobYavdLcck=/510x318/top/img-s3.ilcdn.fi/4545f71534bb8590be3e9f3041cc36f97162e97bf6ca217bea066ccd4b35ddb8.jpg
2019-09-25T15:38:03.000Z,Video: Taksikuski tallensi järjettömän tempun - salamatkustaja hyppäsi bussin takapuskurille roikkumaan Helsingissä,Taksinkuljettaja ei ollut uskoa silmiään joutuessaan aitiopaikalta todistamaan nuoren miehen bussin perässä roikkumista.,https://img.ilcdn.fi/k1AMDChja519js9iwYG-tcsyh3s=/510x318/top/img-s3.ilcdn.fi/7993f6dafdeef92cf45f93d8b9fbfe2add79028ad7a7b31a3d2c44c09554b686.jpg
2019-09-25T15:44:34.000Z,Nina Mikkonen purkaa Suurimmassa pudottajassa laihtumisturhautumistaan Janni Hussille: ”Mikä tässä mättää?,Suurin pudottaja -ohjelman kilpailija Nina Mikkonen ei ole tyytyväinen painonpudotukseensa.,https://img.ilcdn.fi/yHC_1w_HXqQk-9_EWHC3R0PILAo=/510x318/top/img-s3.ilcdn.fi/3217d1a2f47cd984bd470e820a680386d3d078b303596787a2814af4223e696a.jpg
2019-09-25T15:45:01.000Z,Jokerien vuoden odotus palkittiin – nyt maailmanmestari Mäenalanen ei karkaa NHL:ään,Jokerien NHL-vahvistus hakee nostetta uralleen KHL:stä.,https://img.ilcdn.fi/mw3KDVNJIVyhB-s1sOpnFqPhUAQ=/510x318/top/img-s3.ilcdn.fi/734338ae3e29c017ef003b2acd50eae812d1c70bbd07a630563f25685e254459.jpg
2019-09-25T15:45:18.000Z,Joel Pohjanpalon painajainen päättyi – ”sulanut nilkka” kestää jälleen: ”Kaikki on lopultakin kohdallaan”,Bayer Leverkusenin hyökkääjä Joel Pohjanpalo sai hyviä uutisia.,https://img.ilcdn.fi/jdU5WjaJtPfYUJtPmGmQKov5n8U=/510x318/top/img-s3.ilcdn.fi/1aae76a2ae00a4758c8dfca1f31b7b4e5ceadba96d852ff0afa2e6262124efd0.jpg
2019-09-25T15:47:31.000Z,"Tupakankin vaaroja vähäteltiin, kuten ilmastonmuutosta nyt – suomalaisasiantuntijoilta tyly viesti Trumpille ja muille ilmastoskeptikoille ","Iltalehti kysyi tutkimuksen ja hallinnon edustajilta, minkälaisen viestin he haluaisivat lähettää ilmastoskeptikoille. Vastaus oli hyvin yksimielinen.",https://img.ilcdn.fi/wSdGT7g-U9GP8WN4ICjfx10d7oA=/510x318/top/img-s3.ilcdn.fi/a745f41a24c587d3ca88043574437fc9b983116df94b90ca6a74fc3781b7bf38.jpg
2019-09-25T15:50:51.000Z,Lääkäri teki abortin väärälle naiselle Etelä-Koreassa - potilas oli sairaalassa saamassa vitamiinia,Naisen henkilöllisyys tarkistettiin huolimattomasti.,https://img.ilcdn.fi/xbq-dusB4GIjoto4T_9sJ-b0evE=/510x318/top/img-s3.ilcdn.fi/27f51f442df4c89c0bffedb4906431c32a49e9f69b7f875e6a40f6240df7845f.jpg
2019-09-25T15:53:45.000Z,"Onko sinulla tällainen maatiaiskissa? Se on suomalainen harvinaisuus, jonka geenitutkija etsintäkuulutti",Kissojen geenitutkija etsii kuvan mukaisia kissoja ja niiden vanhempia tutkimukseen.,https://img.ilcdn.fi/xP34xM_LspGJyHB5wFKGlJt4vDs=/510x318/top/img-s3.ilcdn.fi/7a7bcdcf2dee2d75f4333b973465892f389a57cd5367a175713a4ded00b649fe.jpg
2019-09-25T15:57:46.000Z,Boeing maksaa vähintään miljoonan ensimmäisessä MAX 8 -turmassa kuolleiden perheille,"Lentokonevalmistaja on sopinut ensimmäiset omaisten kanteet koskien kahta lentoturmaa, jotka vievät puolen vuoden sisään 346 ihmisen hengen. ",https://img.ilcdn.fi/tUWEGTJvuOepBEPkyaakuKymZYs=/510x318/top/img-s3.ilcdn.fi/4d3b4980776705354567e1148d388112b1b2c2bfa89778e013adde43722c9ea5.jpg
2019-09-25T16:00:00.000Z,"Sensuroimaton Päivärinta: Potkut saaneen Jonne Virtasen rajut paljastukset kiekkomaailmasta: ”Sain pokaalin siitä hyvästä, että olin sammunut”",IL-TV:n Sensuroimaton Päivärinta -keskusteluohjelman jaksossa numero 73 nähdään kohujääkiekkoilija Jonne Virtanen ja vasta 16-vuotias ilmastoaktiivi Atte Ahokas.,https://img.ilcdn.fi/AK8B4cUc4t6EJZHBJdS-kF_d8UQ=/510x318/top/img-s3.ilcdn.fi/f061d739e3c6e8e487ed280a75fe69022766bf996d17f5507a34b1cf205d9dfd.jpg
2019-09-25T16:14:22.000Z,Tiinan pysäyttävä video: miesten deodorantin hajuste vie välittömästi äänen täysin,Kemikaaliyliherkän Tiinan kunto romahti kolmisen vuotta sitten. Hän oli tietämättään herkistynyt pidemmän aikaa vakavasti kosteusvauriomikrobeille.,https://img.ilcdn.fi/Z1YEfMjTJcrzKwNXrAOzRtyu4YM=/510x318/top/img-s3.ilcdn.fi/3ffc55280b3502b8b263698e06130f4f48bc26dd55d34d3e227970295d9ac7ea.png
2019-09-25T16:15:36.000Z,"SM-liigassa mitattiin hämmentävän kova rannari, Telian asiantuntija tyrmäsi suorilta – SaiPan tuore vahvistus oli heti iskussa",Entinen huippukiekkoilija Tomi Kallio piti tilastoja liioiteltuina.,https://img.ilcdn.fi/B82WtgbNswZki6T-9ijY_lNuy-c=/510x318/top/img-s3.ilcdn.fi/bb4df89a97690a896920ca2f90d37a97f687ef3789c184e56c3bc34681cc3e88.jpg
2019-09-25T16:22:49.000Z,"Katala ”haamunälkä” viekoittelee ahmimaan - lääkärin mukaan pelkän itsekurin avulla ei voi laihtua, tässä paremmat konstit","Pelkkä itsekuri tai tahdonvoima ei riitä painonhallinnassa, koska teemme ruokaa koskevat valinnat etupäässä tiedostamattomalla tasolla.",https://img.ilcdn.fi/L42vh82uosLavSonh2oaUuwokYE=/510x318/top/img-s3.ilcdn.fi/fb1735fcccba9e748b03f5fef515a219afe3884f8c8bf44bd4e356879a0e83d6.jpg
2019-09-25T16:24:04.000Z,Seksuaalirikollisten karkottaminen keskustelussa: Halla-aho vetosi tapaus ”Husseiniin” - ministeriaitio ammotti tyhjyyttään,"Jussi Halla-aho: ”Nyt kun meillä on entistä paremmin palkattuja ministereitä ja heillä aiempaa enemmän erityisavustajia, tämäkin lakihanke on varmasti mahdollinen toteuttaa.”",https://img.ilcdn.fi/C6z-2to9u2CJPqjpCkt8Zby2gb0=/510x318/top/img-s3.ilcdn.fi/82362ca81d4395f7f2494b1c04ad6a689fdfddeccb0c5be28ab25df85edc5a70.jpg
2019-09-25T16:51:54.000Z,Jonna Järnefelt menetti äitinsä muistisairaudelle - avautuu kipeästä kokemuksesta: ”Kommunikoimme loppuun asti laulamalla”,Jonna Järnefelt purkaa omiin teksteihinsä pohjaavassa musiikkiesityksessä muun muassa menettämistä ja pelkojen kohtaamista.,https://img.ilcdn.fi/_rgxNUQuixbAgkMkuK6RK6M3ofc=/510x318/top/img-s3.ilcdn.fi/5140401c186769461ea50fdb85294fd2ccd1c5f4465a2f6c95e6890f3764dc73.jpg
2019-09-25T17:05:03.000Z,Tjäreborgin piti jatkaa normaalisti - Lapsiperheet jumissa kellon ympäri Mallorcan kentällä: ”Tämä on ollut ihan hirveää”,Suomalaisia on jumissa ainakin Mallorcalla. Tämänhetkisen tiedon mukaan kaksi konetta vie suomalaisia pois vielä tänään.,https://img.ilcdn.fi/XG18JxX4RRvOQSg1FzZ_UqnsF1M=/510x318/top/img-s3.ilcdn.fi/24d7c4d74e585968f9d2fadfcda192550173222994b7c80e4e0dd4ac52692e49.jpg
2019-09-25T17:18:08.000Z,Mikä sattuma! Saman palolaitoksen 9 palomiestä tuli isäksi lähes samaan aikaan – katso hellyttävät kuvat Kaliforniasta,Kaikki lapset ovat syntyneet maaliskuun ja heinäkuun välillä.,https://img.ilcdn.fi/eL3L4iH81hnS0VZtaBEW6JAoWBk=/510x318/top/img-s3.ilcdn.fi/eb2047b2b775da3375a21a2a1048126ca78ba7ab1430549d9ce7bd08ee5f2d19.png
2019-09-25T17:21:32.000Z,Greta Thunberg teilattiin ”hyväksikäytetyksi PR-tuotteeksi” - Tällaiset joukot 16-vuotiaan taustalla vaikuttavat,"Aluksi Greta Thunberg käännytti äitinsä ja isänsä vegaaneiksi. Nyt hän johtaa maailmanlaajuista muutosliikettä, jota kohtaan vanhemmatkin olivat aluksi kriittisiä.",https://img.ilcdn.fi/vpsjN41OkFF8f0cyoPos5LToWpg=/510x318/top/img-s3.ilcdn.fi/5f4e9825e22dbebf24aa7fd1e10f7614341dd7b32e6d83fe4138f8e41451851d.jpg
2019-09-25T17:21:37.000Z,MM-urheilijoita odotti Dohassa kuvottava ilmestys – tältä kohuttu hotelli näyttää,"Ruotsin joukkue joutui jäämään hotelliin, mutta norjalaiset vaihtoivat majapaikkaa.",https://img.ilcdn.fi/ZPvpiQ4-U1cJOZvAzAaEWxlzxXg=/510x318/top/img-s3.ilcdn.fi/26e965bb932437f75ba0f28c9dc5b838a651738ec922da7ab307328a9e76c103.jpg
2019-09-25T17:41:26.000Z,"Helsinkiläinen Maria kohtasi sienimetsällä hurjan näyn - yli kahden kilon jättiläinen täytti korin kokonaan: ”Tytär totesi, että se on kauhea”",Maria Arruda tunnustautuu laiskaksi luontoihmiseksi. Nyt löytyi kerralla iso saalis.,https://img.ilcdn.fi/cphhYVgeEvmYckrh_feNCMye1As=/0x1282:2250x2688/510x318/top/img-s3.ilcdn.fi/ee7cf712877964c5edcc3a5b962d43d42d6730de47eabbd4007dbf2e83cec00f.jpg
2019-09-25T17:43:27.000Z,"Jukka Poika vieraili Temptation Island Suomen kuvauksissa vain 20 tuntia, syy nopeaan paluuseen löytyi kotoa: ”Ei siinä ollut tavallaan mitään järkeä”",Laulaja Jukka Poika on tehnyt Temptation Island Suomeen uuden tunnarikappaleen. Uutuuskappale kantaa nimeä Papaija.,https://img.ilcdn.fi/QuiyHGuIIm3fJqE5pASOq89BugQ=/510x318/top/img-s3.ilcdn.fi/75164ef9691e123ccf91415f9a2e4e34c7767690a5875f5a67a74ca258312b10.jpg
2019-09-25T17:44:38.000Z,"Jokerit rimpuili minkä pystyi, mahtiseura vain meni hymyillen menojaan",Jokerit pysyi numerollisesti puolitoista erää hallitsevan mestarin kyydissä.,https://img.ilcdn.fi/-o6OHGkchKPsn9lm-D1tKeBp_Y0=/510x318/top/img-s3.ilcdn.fi/da9f9df5f961acd863740c9d25aafd8219a3a40e13a622ca2172a60790bc5410.jpg
