paivamaara,otsikko,tiivistelma,kuva
2019-09-26T16:31:51.000Z,Kansanedustaja teki harvinaisen ratkaisun – palkkasi avustajakseen kollegansa vaimon: ”En palkkaisi omaa vaimoani”,Kansanedustaja Ano Turtiainen (ps) palkkasi eduskunta-avustajakseen edustajakollegansa Olli Immosen vaimon – Immosen suosituksesta.,https://img.ilcdn.fi/UjH9Z3_PzCLhzaZ4nhbyAGVosUQ=/510x318/top/img-s3.ilcdn.fi/c4eeb300392922eb2b44c97af3405f1c979a762ebef4bf20135f651caa694f5a.jpg
2019-09-26T16:32:40.000Z,Alisa Vainio teki ison päätöksen – näytönpaikka MM-kisojen avausyönä: ”Nyt on hyvä fiilis”,Kestävyysjuoksulahjakkuus valitsi maratonin päälajikseen. Lauantain vastaisena yönä on edessä uran ensimmäinen aikuisten arvokisastartti.,https://img.ilcdn.fi/mmqP_UrEmu_OFVG3X5uBsFAx37I=/510x318/top/img-s3.ilcdn.fi/6be359574ff51b8f82308ccfc3f2d8ea2a3a00b9a80ab871394b29276342f82b.jpg
2019-09-26T16:43:24.000Z,Teslan kojelautakamera tallensi tunarivarkaiden keikan Espoossa – autolla päin seinää ,Keskellä kirkasta päivää tapahtunut varkaus tallentui videolle.,https://img.ilcdn.fi/5rx0zlBOUkWW3PH9TnGmLwXE4n8=/510x318/top/img-s3.ilcdn.fi/3df2d716fa75e21dcbc8658db950879c2fc26d66a1a6f949945bed43b68a7f38.jpg
2019-09-26T16:56:19.000Z,Kuukautiset ja seksi: ”Tuntuu kuin orgasmi tulisi helpommin”,Seksiä kuukautisten aikana vai ei? Neljä naista kertoo kantansa.,https://img.ilcdn.fi/8Dl0vhewqcnhGONVaOnpuaREBVU=/510x318/top/img-s3.ilcdn.fi/d02d8c6331e18e8bbc16b7c230f0659353039bfc9f150cb884da16a5770ce06b.jpg
2019-09-26T17:08:05.000Z,Carolina Hurricanes pudotti suomalaisia leiriltä – kultaleijona sai farmikomennuksen,Eetu Luostarinen ja Janne Kuokkanen pelaavat alkavalla kaudella Charlottessa.,https://img.ilcdn.fi/X3mGbV_iFMh0DQmWZ9c70SerI9Q=/510x318/top/img-s3.ilcdn.fi/c1c5b39c894eba3c095921e0203259a4c4cedf0d2f5644d4f1ae467208958cac.jpg
2019-09-26T17:16:07.000Z,"Ilmastolakkoilija Atte Ahokas, 16, järkyttyi suomalaispoliitikkojen Greta Thunberg -kommenteista: ”Vaikea löytää sanoja, aikuiset ihmiset!”","Ilmaston puolesta kampanjoiva 16-vuotias Atte Ahokas ihmettelee sitä, miten julmasti aikuiset kirjoittavat ja puhuvat hänen ikätoveristaan Greta Thunbergista. ",https://img.ilcdn.fi/XX8VFc69u0q2HlZBu0eUeFCg4ZY=/510x318/top/img-s3.ilcdn.fi/ae177750bcab14bf3b20ae025ea46d4f6f2a7deef0096d3b946e7fe084896335.jpg
2019-09-26T17:16:11.000Z,"Yo-kokeen arvosteluasteikko on epäreilu, tylyttää tuore tutkimus – paremmat arvosanat tietävät isompaa palkkapussia","Nykyistä hienojakoisempi arvosteluasteikko vähentäisi arvosanarajoihin liittyvää epätasa-arvoa, sanovat tutkijat. Ylioppilastutkintolautakunta ei täysin niele näkemystä.",https://img.ilcdn.fi/Ffg5Mm4HiKXk0gwrylvMIVpGQVY=/510x318/top/img-s3.ilcdn.fi/ebc8ee15ef16ccb5cae44020f972acb72286d2eeebd0d86c298249b84fde07a2.jpg
2019-09-26T17:34:46.000Z,Jonne Virtanen tuomittiin sakkoihin nuuskakohussa – esittää nyt rajun syytöksen TPS:n suuntaan,Jonne Virtanen ei säästellyt sanojaan vieraillessaan Sensuroimaton Päivärinta -ohjelmassa.,https://img.ilcdn.fi/7kl-QK4ktz3LK0XyAlZpQovl3to=/510x318/top/img-s3.ilcdn.fi/6d734dabb1ab25c50fe3673a2ee3ee62d8285bd1c0d2bb0ce4215bc28108fe6d.jpg
2019-09-26T17:35:02.000Z,Joel Pohjanpalo voitti vaikean vamman – valmentaja antoi yllättävän varoituksen: ”Se on positiivinen merkki”,Palaako Joel Pohjanpalo heti Leverkusenin kokoonpanoon?,https://img.ilcdn.fi/NrqZ6AnXDsty7HtvvNsOFJh5buI=/510x318/top/img-s3.ilcdn.fi/c841b1d59004b329f8d492f0d5963cf2c43136d112913df126c4717c3ce00804.jpg
2019-09-26T17:52:55.000Z,Patrik Laine sai sisäpiirin mukaan uuden sopimustarjouksen – agentti haluaa suomalaiselle ennätyspalkan,Winniepg Jetsin ja suomalaishyökkääjän sopimusneuvotteluissa on otettu uusi askel.,https://img.ilcdn.fi/PfCbZKH08ACMH14TfyP1rfwXxF0=/510x318/top/img-s3.ilcdn.fi/15ded52b8d69714a3aeab93795808d14ea305efd0c1df6126a9601402211b95a.jpg
2019-09-26T17:56:27.000Z,Turun epäilty murhajoukkio: Miksi 21-vuotias nainen on yhä vangittuna? Vanhemmat miesepäillyt paatuneita laitapuolenkulkijoita,Toinen nuorista naisista on päässyt tutkintavankeudesta. Poliisi ei edelleenkään kerro tapauksesta.,https://img.ilcdn.fi/SM8n7N3B2o7570s8l88v1wNfVhw=/510x318/top/img-s3.ilcdn.fi/fa9e1bdda7e9458eaa242c7164bf541ec225386670d644a1dae035b911b4ab94.jpg
2019-09-26T18:03:49.000Z,2000-luvun kauhu! Tähän laukkuun ei voi olla rakastumatta,Paris Hiltonin suosikkiveska teki paluun ja nyt kaikki haluavat sen.,https://img.ilcdn.fi/ikKKvrfJfPRJ28dqixPVkGHVwoM=/510x318/top/img-s3.ilcdn.fi/41d1c8925096ce44747545878e54a050ff6cc6b9383b0c55b78bd962c610be5b.jpg
2019-09-26T18:21:13.000Z,"Deittisivusto jäi kiinni nolosta huijauksesta, houkutteli uusia käyttäjiä valeprofiilien avulla –Tinder-yhtiö haastettiin oikeuteen",Yhdysvaltain kauppakomissio on haastanut Tinderin omistavan Match Groupin oikeuteen.,https://img.ilcdn.fi/loNTcO7wx58prrKTwyETwWLC9iQ=/510x318/top/img-s3.ilcdn.fi/50eac92fbcb5b8772d45cbc3a910c71bc2c556c59dddfaa657b0f0b5b31c781c.jpg
2019-09-26T18:35:28.000Z,Hyytävästä ilmastoinnista suomalaistähdelle tuntuva terveysmurhe – rajua kritiikkiä kohuhotellille: ”Meinasin jäätyä pystyyn”,Estejuoksija Camilla Richardsson sai nuhan. Myös Sara Kuivisto ja Krista Tervo kritisoivat ilmastointilaitteistoa.,https://img.ilcdn.fi/LfrURzaonwD08L3ZZW_pq0N6ELM=/510x318/top/img-s3.ilcdn.fi/af72b5e5c701373f08c79a7965ff18d46c5e4445dc52ac82a171886f98230273.jpg
2019-09-26T18:38:22.000Z,NYT: Trumpin ilmiantanut henkilö on CIA:n työntekijä,"Kohutun Ukraina-ilmiannon tehnyt henkilö on mies, joka oli hetkellisesti töissä Valkoisessa talossa. ",NULL
2019-09-26T18:48:50.000Z,Tällaisissa kuvissa et ole aiemmin nähnyt Miss Suomi -finalisteja: Paljasta pintaa ja silkkiunelmia,Miss Suomi -finalistit valitsivat itselleen uudet tyylit.,https://img.ilcdn.fi/fVWTzNEM8Hih5UH32aFrHamCvig=/510x318/top/img-s3.ilcdn.fi/d4be74378432f2910ff5f2a637c099cc54bffb276c09ab7c04713e74aee1aa11.jpg
2019-09-26T19:05:56.000Z,Temppeli romahti ja putosi vesialtaaseen Thaimaassa – syynä viikkoja kestäneet rankkasateet,Buddhalainen temppeli romahti useita viikkoja kestäneiden rankkasateiden seurauksena.,https://img.ilcdn.fi/R6kWG9LUB-wd9co7pMqGMEWXTYY=/510x318/top/img-s3.ilcdn.fi/f3310ac6740e7792d3c6b8925687ebcf70020bb81fa672a692744b14f1e4f674.jpg
2019-09-26T19:09:05.000Z,Pelottava törmäys Ruotsin kiekkoliigassa – pelaaja makasi jään pinnassa useita minuutteja: ”Tuota katsoessa koko kroppa kylmettyy”,Liigapelaajan osuma laitaan pelästytti kaikki ottelua seuranneet.,https://img.ilcdn.fi/ZYo6umNiSShVMubYU1ifx2LAhGI=/510x318/top/img-s3.ilcdn.fi/440669a4cacc9754fd7adb3b4e3bd042129f9c77f556fbde4f5f78e964da67c4.jpg
2019-09-26T19:10:41.000Z,"Tjäreborgin matkafarssi huipentui tekstariin: ”Sinut on valittu jäämään pois lennolta” – Ville matkustaa Kreikasta Suomeen bussilla, lautalla ja kahdella eri lennolla",Suomalaisten matkustajien paluu Tjäreborgin lomamatkoilta ei ole kaikilla sujunut aivan niin helposti kuin yhtiö on tiedotteissaan antanut ymmärtää.,https://img.ilcdn.fi/6_sJt13aZavBOadXdp3rBBbVYR8=/510x318/top/img-s3.ilcdn.fi/78e8b22ea87011bcb4bdb2a3638709c0aba921d537b8eab13413adcea9ee8414.jpg
2019-09-26T19:21:43.000Z,Känninen supertähti Auston Matthews riisui housunsa nilkkoihin – nyt puhuu ahterin nähnyt naisvartija: ”Isä pitää poikaansa Jeesuksena”,Kiekkohullun kaupungin ykköspuheenaihe on ollut oikukas supertähti Auston Matthews.,https://img.ilcdn.fi/mK7IAvxw0hopX9NCr-5t4x7rbI0=/510x318/top/img-s3.ilcdn.fi/9799c9f7e170bdfb4331df0fcdabf7fa1c3ffac8bc328493f87e6930be82d319.jpg
2019-09-26T19:29:26.000Z,”Netflix-tilauksesi on peruttu” – Älä lankea tähän sähköpostihuijaukseen! Aidolta vaikuttava viesti ohjaa rahasi rikollisille,"Netflixin nimissä liikkuu sähköpostiviestejä, joissa väitetään tilauksen keskeytyneen.",https://img.ilcdn.fi/_XlI2_OBHlraYjCf7tIy6ZwiDPA=/510x318/top/img-s3.ilcdn.fi/2009cf9a738badb653e6287dc3caf6261b6d13073efb092b2f53ef6590fa2460.jpg
2019-09-26T19:30:38.000Z,"Markus Selin oli mukana pelifirmassa, joka myytiin 59 miljoonalla eurolla -  pitää salassa oman osuutensa jättikaupasta","Markku Selinin Perustuu tositapahtumiin -elämäkerta paljastaa monta herkullista yksityiskohtaa pitkän uran varrelta, mutta 59 miljoonan pelifirman kaupoista Markus Selin ei halua puhua mitään. ",https://img.ilcdn.fi/8_OeaNiPoUvW7kI5wpTl0klHdrk=/510x318/top/img-s3.ilcdn.fi/09d8c9ee917fbb27b84eb18443cbf978859d701b2cf9a8e7680c1964184a3bf7.jpg
2019-09-26T19:38:01.000Z,Mitä ihmettä? MM-kultaleijonalle tyly kohtalo – Jani Hakanpää passitettiin NHL:n siirtolistalle,"Jos yksikään seura ei poimi puolustajaa, aloittaa hän kauden AHL:ssä.",https://img.ilcdn.fi/l3QZkbgDhpoXNzog3-8u2F943qU=/510x318/top/img-s3.ilcdn.fi/47f84afbea17839e6bdd053c80ed633c4801ffeef3dfe74dbd0b3989bbce26dd.jpg
2019-09-26T19:56:01.000Z,Kaksi köyhää lasta hakattiin kepeillä hengiltä Intiassa - syynä tien varteen ulostaminen,"Kaksi kastitonta lasta tapettiin Intiassa julmasti. Syyksi epäillään sitä, että nämä ulostivat julkisesti.",https://img.ilcdn.fi/cPl1nsQ-EpftG6quciUN0VRkJo4=/510x318/top/img-s3.ilcdn.fi/205f4bc8d115f7d6d5a30d84df58217417284b3c30f02cf45136722d1a29f7d5.jpg
2019-09-26T19:57:19.000Z,"Uutuuskirja: Pöytäliinan alta paljastui Ylen tv-kasvo alastomana ja omena suussaan – ""Aiheutti jonkin verran hämmennystä ravintolan asiakkaissa” ","Marko Terva-aholla oli ajoittain vauhtia kisareissuilla, paljastaa Tapio Suominen tuoreessa elämäkerrassaan.",https://img.ilcdn.fi/a6Qj1hGqlV3yvtda753xj7Fy3VI=/510x318/top/img-s3.ilcdn.fi/5c54992927c2b984ec1022470ad878b908c39151934137490852f1885c9eb966.jpg
2019-09-26T20:07:27.000Z,Trump vaatii päitä vadille: ”Kuka antoi ilmiantajalle tiedot” - haluaisi myös keinon lopettaa itseensä kohdistuvan virkasyytetutkinnan,"Trumpin mielestä häneen kohdistuu jälleen noitavaino, jonka laukaisijana on silkkojen toisen käden tietojen varassa toiminut ilmiantaja. ",https://img.ilcdn.fi/WUB57w_kQqTFVbIm9RoIBrG4C1s=/510x318/top/img-s3.ilcdn.fi/ab3741b9f0f478cfaf69253da006cc9c21abd6fd927dee5679e6ed2e2644c36a.jpg
2019-09-26T20:15:01.000Z,Mistä on kyse Trumpin Ukraina-tutkinnassa? Lue tämä kooste sotkun etenemisestä ja pääset kärryille,"Torstai oli vilkas päivä Yhdysvaltojen poliittisessa pyörremyrskyssä, jonka silmässä seisoo presidentti Donald Trump. Tämä skandaalin käänteistä tiedetään. ",https://img.ilcdn.fi/rvxzh-VH3GOcetBqhyklq3s6YU8=/510x318/top/img-s3.ilcdn.fi/5290f52c419bccb9ba5b58217d6587465507fd1880d592aaed55918e57813707.jpg
2019-09-26T20:49:00.000Z,Valtteri Bottaksen vanhaa Mersua myydään netissä - hintaa lähes 70 000 euroa,Valtteri Bottaksen vanhaa Mercedes-Benz C 63 AMG Coupéta myydään netissä.,https://img.ilcdn.fi/irmsdkRdsSX8M4VWFH3-24feCXY=/510x318/top/img-s3.ilcdn.fi/e09e81a1ca9c46b0c48413e54cb5d8da8c0161a3b85647249e32d99d3ac32de0.jpg
2019-09-26T21:30:17.000Z,Ainakin 30 kuollut Tšadissa laittoman kultakaivoksen romahduksessa,Lisäuhreja voi löytyä vielä kaivoksen raunioista.,https://img.ilcdn.fi/fRj_MD8ZbDf2-rLXmp-9wx6gfw4=/510x318/top/img-s3.ilcdn.fi/9589c00362bc3e4f4043f887c621616d7fac3c34dbee94f1633f7b30692f7597.jpg
2019-09-26T21:36:48.000Z,Kuningatar Elisabet muistaa tapaamansa ihmiset erikoisella kikalla – kaksi sanaa auttavat,"Kuningatar Elisabet, 93, haluaa muistaa tapaamansa ihmiset. Muistia helpottaa hyväksi havaittu muistikikka.",https://img.ilcdn.fi/Rdfh3tvnNahtDX_oGJ9TxpGKWhc=/116x945:2412x2390/510x318/top/img-s3.ilcdn.fi/c91f4fadf10ede019490438d7e1b7150f7515f400215cf8b6a7f39659336a00e.jpg
2019-09-26T23:02:46.000Z,Horoskooppi,NULL,NULL
2019-09-26T23:28:38.000Z,Three Mile Islandin ydinvoimala suljettiin lopullisesti – voimalasta tuli ydinvoiman vaarallisuuden symboli,Kuuluisalla ydinvoimalaonnettomuudella 40 vuotta sitten oli suuri vaikutus ydinvoima-ajattelulle koko maailmassa.,https://img.ilcdn.fi/IIg59Q7gOR2AXCcwx-Sag2Oq-B4=/510x318/top/img-s3.ilcdn.fi/cd27b91964cf4b4d0156a88ed7a80f48b982928b8a1994af4a4792ba37d24f8b.jpg
2019-09-27T00:48:57.000Z,Viisivuotias tyttö selviää videolla täpärästi kojootin hyökkäykseltä – ”Se melkein puraisi minua kyljestä”,"Yhdysvalloissa herättää kohua video, jossa asuntoalueelle eksynyt kojootti hyökkää 5-vuotiasta tyttöä kohti.",https://img.ilcdn.fi/wqMUAG0NwiKwJ92yf4_lJIlxXB0=/510x318/top/img-s3.ilcdn.fi/25a9e4f77ca9fd80feaebdc441c161160f9d59526112a8952b6dc303ac8605c7.jpg
2019-09-27T02:01:03.000Z,Facebookilta erikoinen hankinta: kehittää nyt ajatuksen voimalla ohjattavia tietokoneita,"Facebook on julkistanut uusimman yrityskauppansa. Yhtiö osti yhdysvaltalaisen CTRL-labsin, startupin joka kehittää teknologiaa, jonka avulla ihminen voi ohjata tietokoneita pelkästään mielensä voimalla.",https://img.ilcdn.fi/yXDMH1mOmx4jvqoomhW1s5cBZng=/510x318/top/img-s3.ilcdn.fi/d753aa44b3e2d477f298f326f98cdd16eb7f650ed6dde6c545d156966d50cbc5.jpg
2019-09-27T02:07:46.000Z,Räppäri Cardi B kertoo joutuneensa seksuaalisen ahdistelun kohteeksi kuvaussessiossa – ”Sitten hän veti peniksensä esiin”,Rap-artistin mukaan varsinkin köyhistä oloista tulevia nuoria naisia kohdellaan usein alentavasti.,https://img.ilcdn.fi/jhoYtQKpHoHRrVvNU7z0sEzGejU=/510x318/top/img-s3.ilcdn.fi/26e5f5549f04d160b0ebcd70249029835522eaffc82b024b1ea6191c55c530ac.jpg
2019-09-27T02:43:03.000Z,25 vuotta sitten alkoi painajainen merellä – Näin Estonian tragedia eteni: kuuntele hyytävä mayday-kutsu,Estonia lähti viimeiselle matkalleen Tallinnasta 27. syyskuuta 1994. Laivan lipuessa illalla pois satama-alueelta mikään ei poikennut tavanomaisesta.,https://img.ilcdn.fi/y4WTINUi0KoWyXMXiZUAgZt2unQ=/510x318/top/img-s3.ilcdn.fi/8c72fa341b31aad7816bd4adee8e1dcc986a59bb16dcd1b44ada496356abbc32.jpg
2019-09-27T02:55:00.000Z,Minkä vuoden kotikisoissa Juha Väätäinen voitti kaksi Euroopan mestaruutta?,Iltalehden perinteinen urheiluvisa on myös verkossa. Montako tiedät?,https://img.ilcdn.fi/n4FVM_ludYYK81daJJbKrn7-B6o=/510x318/top/img-s3.ilcdn.fi/ef37e410413c22c2d07e373253b3a445a49b1d2523958ed07eba417cf758383e.jpg
2019-09-27T03:07:06.000Z,"Alma Hätönen jätti vakityön radiossa – ensin epävarmuus itketti, sitten soi puhelin ja nyt BB-juontaja on unelmapestissään: ”On älytön etuoikeus olla osana tätä”","Big Brother -juontaja Alma Hätönen teki rohkean tempun, kun hän hyppäsi YleX:n huippusuositusta iltapäiväohjelmasta pois – ja jäi tyhjän päälle. Tänä syksynä uskallus on palkittu huippupestillä Big Brother Suomi -ohjelman juontajana. ",https://img.ilcdn.fi/o895s8XX6SZvVvyWKe1ZM8kbo58=/510x318/top/img-s3.ilcdn.fi/c5deac9e187730128f6b21d91be1a038497fd412acbc3ec6cf2a56e8dfe54c25.jpg
2019-09-27T03:07:59.000Z,Säilytätkö polttopuita sisällä? Älä kopioi sisustuslehtien tapaa: ”Voi aiheuttaa hengitystieoireita”,"Polttopuiden sisäsäilytyksessä tehdään virheitä, jotka voivat altistaa sisäilman sieni-itiöille.",https://img.ilcdn.fi/m74mxT39Jr8f0L7O4jVvSbZqzdg=/510x318/top/img-s3.ilcdn.fi/d7559426b4c4a2a24c0fb1d089b23f3b7bb2cb3e4ae5e3e2c8aec8d730eeaa74.jpg
2019-09-27T03:10:15.000Z,Tuhannet mehiläiset valtasivat parkkeerattuna olleen auton Australiassa – ohikulkijat hämmentyivät,Mehiläiset päättivät tehdä pesän auton takaosaan.,https://img.ilcdn.fi/LhEmVVPSzk2aWYchqN8D4pW68j8=/510x318/top/img-s3.ilcdn.fi/82fa9ee8c44f338a82cffa8435487f84f4667b2725563dbcf0f894cdadab006f.jpg
2019-09-27T03:15:31.000Z,Iltalehti analysoi Suomen MM-joukkueen urheilija urheilijalta – yksikin yleisurheilumitali olisi lottovoitto: ”Voi tulla kulta tai täydellinen romahdus”,"Suomen joukkueessa Dohassa on turhan paljon turisteja, eikä yhtään mitalisuosikkia. Mitalitoivoja on kolme.",https://img.ilcdn.fi/C0dqfwI0AeABSQxOBkcR9s7J3Ww=/510x318/top/img-s3.ilcdn.fi/9c31bf2bbe0303f13e05b5f70de9ab5acd357d13d4c0f83402318fac00df65fc.jpg
2019-09-27T03:37:20.000Z,Aleksander Barkovin tilanne aiheutti pelkoa – Floridan supertähti sai iskun päähänsä ja jätti ottelun kesken,Florida Panthersin tähtisentteri ja kapteeni Aleksander Barkov keskeytti harjoitusottelun Tampa Bay Lightiningia vastaan.,https://img.ilcdn.fi/5-MDbVpHGcH81LxvlbI_7K-Bnas=/510x318/top/img-s3.ilcdn.fi/a32caa71de4fc88baedc15cd2a1e89902c5cf9f34062eef99095df50e51d4d3a.jpg
2019-09-27T03:40:45.000Z,Talvi on nyt tulossa: Ensilumet alkanevat vihmoa Suomea sunnuntaista alkaen,"Illat pimenevät, ja sää alkaa kääntyä hiljalleen kohti talvea.",https://img.ilcdn.fi/SJ0-iYqEHZcsTSMuvCQr2ElTVys=/510x318/top/img-s3.ilcdn.fi/74c2f741658aed4662236a362061f1c42bf87e49feb11bf7c0aa1bfc4ed0af4f.jpg
2019-09-27T03:45:15.000Z,"Mika Siirilä, 47, ei osaa lukea eikä kirjoittaa - Käynyt silti koulut ja ryhtynyt poliitikoksi","Lukutaidottoman Mika Siirilän peruskoulun päättötodistuksen keskiarvo oli 6,7.",https://img.ilcdn.fi/fZ4R_F1FbSASIEcPiR25yPg--DI=/510x318/top/img-s3.ilcdn.fi/0a17a54a044ea87fcdda6cb2948dcaac4a29dc78ebbb6122998b8bdba4ba3929.jpg
2019-09-27T03:47:40.000Z,Sää on pilvipoutainen ja ajoittain sateinen,"Viikonlopuksi hieman lämpenee, mutta sunnuntaiksi on luvassa Lappiin jopa 20 senttiä lunta.",https://img.ilcdn.fi/t-Z6CIoL_taDjaH_QGSwSlvOqCo=/510x318/top/img-s3.ilcdn.fi/3169af693fa03c55fae74ff8fedce6271620c7498afe663edf4a14ec822f07a7.jpg
2019-09-27T03:55:02.000Z,"Päivän ravivihje: Toto4, Pori 27.9.",NULL,NULL
2019-09-27T04:01:12.000Z,Qatarilaismiehet kohtelevat Suomen naisurheilijoita kuin halpaa makkaraa: ”Ei missään määrin tasa-arvoista”,"Sara Kuivisto, Wilma Murto, Krista Tervo ja Camilla Richardsson kertovat tylyistä kokemuksistaan Dohassa.",https://img.ilcdn.fi/paPuS68JiUAx4vo2N3BZT-JPR2c=/510x318/top/img-s3.ilcdn.fi/93ec0462ac1fac00042337cef1c2a22d6cb05bda8045e433d02de33a383a1515.jpg
2019-09-27T04:26:15.000Z,Tanssii tähtien kanssa: Jo toinen sairastuminen ensimmäisen suoran lähetyksen alla – Timo Lavikaisella miesflunssa,"Timo Lavikaisen ja Kia Lehmuskosken tanssitreenit ovat tauolla, sillä tauti kaatoi miehen.",https://img.ilcdn.fi/oaZDLlGC3CaU8lSL_LGuaEtKeSg=/510x318/top/img-s3.ilcdn.fi/b805d408c243b07a6d03240740a825aa5cc5d08de07b83a6b7145578507895cf.jpg
2019-09-27T04:39:53.000Z,"Anne, 35, on tavallinen perheenäiti, joka halusi huulitäytteet – nyt hän kertoo, miksi",35-vuotias Anne on ottanut kaksi kertaa hyaluronihappoa huuliinsa. ,https://img.ilcdn.fi/EKllYm8z7EBxBFf5-8Zm_qsabVA=/510x318/top/img-s3.ilcdn.fi/2c09a7e8fea4bfa32fb17394857f003969b218136fb1d7568012bd0e6f89a8f8.jpg
2019-09-27T04:41:44.000Z,Yli 300 työntekijälle potkut antanut Posti hankki 30 000 euron golfosakkeen Suomen kalleimmalta kentältä golfia harrastavan toimitusjohtajan aloitteesta – ministeri pyysi selvityksen ja sai sellaisen,Valtion omistajaohjauksesta vastaava ministeri Sirpa Paatero (sd) on saanut selvityksen Postin tappiollisista golfosakekaupoista.,https://img.ilcdn.fi/I297u25PSAQi8j8O7HTI3thUMr8=/510x318/top/img-s3.ilcdn.fi/3516d22a1688674179f1db6b3a81b6f3481834787fc0c38c5dc076211f9a8e7e.png
2019-09-27T04:53:21.000Z,"Huippu-dj Tiesto, 50, meni naimisiin 23-vuotiaan kanssa keskellä aavikkoa - seurustelun alkaessa DJ:n rakas oli vain 18-vuotias",Tiësto eli Tijs Michiel Verwest on nyt naimisissa.,https://img.ilcdn.fi/3dBtYUyYsMDIvJWD6MNLIJTmILY=/440x370:1743x1193/510x318/top/img-s3.ilcdn.fi/6370c3a01e4213f69cf8fedb4f18a9d8f26001f8427508d5903d43ae402390d2.jpg
2019-09-27T05:05:56.000Z,250 vuotta vanha kivitalo seilasi proomun kyydissä uuteen paikkaan – Katso video muuttomatkasta,Historiallinen kartano siirrettiin jokea pitkin uuteen paikkaan. Katso videolta hienoa ilmakuvaa muuttomatkasta.,https://img.ilcdn.fi/4ET8Y_ynLMsAHki-ol1U18qY4qI=/510x318/top/img-s3.ilcdn.fi/14d32d992972cf4b6b5b33932139ec9dfe536ab2b5827fd45f19e765c486fa08.jpg
2019-09-27T05:06:28.000Z,"Suomalainen Estonia-selviytyjä Petter järsi pelastuslautan tarvikepussin auki niin, että hampaat katkesivat – kauhujen yö oli viedä hengen: ""Tajusin, että seuraava aalto veisi minut""",Petter Ehrnstenin Estonia-matkan varaus oli peruttu virheen vuoksi. Mies päätyi kuitenkin alukselle peruutuspaikan kautta.,https://img.ilcdn.fi/stGKLqdp4u7CzC1Prx_MfvnBrPA=/510x318/top/img-s3.ilcdn.fi/2f22a6d5f56ef26a647b4c62b5c82d5d9f1e41561725fa4aa7df853d49fe86d1.jpg
2019-09-27T05:14:32.000Z,Talliradioon kiroillut ja kiukutellut Ferrari-kuski Charles Leclerc ruoskii nyt itseään: ”Pidän turpani kiinni”,"Singaporen osakilpailussa viime viikonloppuna talliradioon ärähdellyt Charles Leclerc lupaa, että on parantanut tapansa.",https://img.ilcdn.fi/EtNzg-BITwna63J7jzlVJGHWNEQ=/510x318/top/img-s3.ilcdn.fi/69c8f876797c936e43765e0b076d59a86260f06696620d01fa4c156200a165ed.jpg
2019-09-27T05:15:25.000Z,"Ei riskitekijöitä eikä yhtään oireita – rintasyöpä yllätti Sari Essayahin täysin: ”En ollut ajatellut, että se tulee omalle kohdalle”",Kansanedustaja Sari Essayah on ollut rintasyövän hoitojen vuoksi pois töistä vain kaksi viikkoa.,https://img.ilcdn.fi/AqlYYztXE55gx3NMl_m-l8Rnpco=/510x318/top/img-s3.ilcdn.fi/323f23415c0c4bc33c8c05f5a6747af0bb189187f3e2f1a95a072c83bec1467d.jpg
2019-09-27T05:17:49.000Z,Suomalaistutkijat: Kauppojen lihatarjoukset pitää lopettaa ,Tutkijoiden mukaan suomalaisten ruokavaliota pitää kasviperäistää.,https://img.ilcdn.fi/P6CuZUz2OTdiUasZCAMDD8R7ou0=/510x318/top/img-s3.ilcdn.fi/cac7997e3185ad9528f0f5354d93eb033a585af153824f11bde7a4d7ea78a444.jpg
2019-09-27T05:19:35.000Z,Estonian uppoaminen oli surullisten virheiden summa: nämä 12 asiaa menivät pieleen,"Estonian tragedian syyksi paljastui huonosti kiinnitetty keulavisiiri, mutta myös onnettomuustilanteen tiedonkulussa ja pelastusvälineissä oli ongelmia.",https://img.ilcdn.fi/SJ0W8azMRhlYq1-Y1NTf5CTzn8s=/510x318/top/img-s3.ilcdn.fi/e0d96de11cabe8b90be9a14027062ad829db280a72a90179d62999496b0ca024.jpg
2019-09-27T05:36:16.000Z,"Alina Tomnikov: ""En halua jännittää nukahdanko tänään vai en""",Selkäkivut ajoivat näyttelijä Alina Tomnikovin uusimaan sängyn. Nyt yöt ovat rauhoittuneet eikä unen tuloa tarvitse enää jännittää.,https://img.ilcdn.fi/sbuDgp4rhS7TWdBOias4KqJySio=/510x318/top/img-s3.ilcdn.fi/a373f4bf28ec78c5d28baf782a2e7206e1107b241bfec4fd071e8fc579e4b8a6.jpg
2019-09-27T05:37:50.000Z,"Satumainen video! Joka syksy Sarin riistakameran edessä kylpevä pöllö ihastuttaa netissä – ”Siinä käy kaikenlaisia eläimiä, mutta tämä on se sankari”",Keskisuomalainen Sari Viren on hämmästynyt jo kahtena syksynä pöllön palattua samalle kylpypaikalle.,https://img.ilcdn.fi/Kd43hR9MQiKTVw5PbQD0RkHgrfY=/510x318/top/img-s3.ilcdn.fi/22f98d83b64c9d2cf4b08912a87abe416463ca6fe09fa272f31b007999d554c1.jpg
2019-09-27T05:39:04.000Z,Koira raateli BB-juontaja Alma Hätöstä 1998 – hurja tapaus päätyi Iltalehden lööppiin: ”Puri suun ja silmän ympäriltä”,"Koiria jo pienenä rakastaneen Hätösen mukaan tuttavaperheen koiralla oli kasvain, jonka vuoksi raatelu tapahtui. – Muistaakseni koiraa ei jouduttu onneksi lopettamaan, Hätönen pohtii. ",https://img.ilcdn.fi/vcZZ1ZpQQ2lPtw83TO6GwF2tBgY=/510x318/top/img-s3.ilcdn.fi/154df2bcb874c7b78cd71d984d8d5dc2c27196adf4ab106ad26985ec2e3a79d6.jpg
2019-09-27T05:45:49.000Z,"Naisleijonien luotsin kommenteista nousi kohu Ruotsissa – ”Kaikki eivät pidä siitä, mitä sanon”",Pasi Mustosta harmittaa marraskuun huipputurnauksen peruuntuminen.,https://img.ilcdn.fi/yOPlEN7Rl2m65dBGagKhJF_HvJc=/510x318/top/img-s3.ilcdn.fi/d6480050e2e315d1fe67103f5746ef5ccbae96884d6652505d663e58f9fbc22c.jpg
2019-09-27T05:50:49.000Z,Maailman pienin auto,Paavo Kestin menopeli on Guinnessin ennätystenkirjan mukaan maailmanhistorian pienin sarjavalmisteinen auto.,https://img.ilcdn.fi/m9HlfKTan2HUw4yclv1lvBGNwbY=/510x318/top/img-s3.ilcdn.fi/485ad37fffe3e9d9fdc895fdd7f711b51553bbbe9b08f6c55de6c0adf6af486d.jpg
2019-09-27T06:04:19.000Z,Kuin Sinkkuelämän Carrie! – Sarah Jessica Parker poseerasi kotiportaillaan näyttävässä tafti-iltapuvussa,Tyylitaituri lähti New York City Baletin vuotuiseen muotitapahtumaan romanttisessa Zac Posenin suunnittelemassa puvussa. ,https://img.ilcdn.fi/qu2ojXznTRjsBf7B-2g2rkrkZyM=/510x318/top/img-s3.ilcdn.fi/ee5468077dcf3abe66c325a6a75c5d02b81b94c9f6a51a9a5bc2ba2c86642fd8.jpg
2019-09-27T06:04:40.000Z,Ministerit järjestävät pyöreän pöydän keskustelun ilmastoahdistuksesta: ”kaikki mahdollisuudet vaihtaa ilmastoahdistus ilmastoinnostukseen”,"Ministerien mukaan ilmastoahdistuksesta on tullut ilmiö, joka koskettaa tuntuvaa osaa koululaisista ja opiskelijoista. ",https://img.ilcdn.fi/e4X_Gdk10ZouIYerumgof7mQo48=/510x318/top/img-s3.ilcdn.fi/97762fcde51ab6e3665c3cc793dfaf6e065c3307d0cac37709f4162e880f0e59.jpg
2019-09-27T06:17:36.000Z,Tällainen on prinsessa Beatricen kihlasormus – kalliimpi kuin Meghanilla,Prinsessa Beatricen platinainen timanttisormus on sulhasen suunnittelema.,https://img.ilcdn.fi/FD2uBTnlDo9WTQEFsotZiUiOpuU=/510x318/top/img-s3.ilcdn.fi/5ad48da75234082d8af047ead4500401a61123bbe6e179053d6a3a0d1f7e1c64.jpg
2019-09-27T06:18:25.000Z,"Helsinkiin avautui ravintola, jossa asiat tehdään päinvastoin: ""Tiedän, että moni erittäin taitava kokki ei halua tulla tekemään tätä ruokaa”","Helsingin Esplanadin kulmalla avautui keskiviikkona ravintola, jollainen on Helsingistä puuttunut. ",https://img.ilcdn.fi/YM2q5qLrp_9kz1_76Sddk7ByBts=/510x318/top/img-s3.ilcdn.fi/99bc7370b986c7349ed00e9d2c341253d043c73cf233e108be9a81e4216618c9.jpg
2019-09-27T06:19:33.000Z,Kannattaako raha laittaa kiinni seiniin?,Omaa varallisuuttaan ei kannata laskea yhden kortin varaan.,https://img.ilcdn.fi/L1nIwOAHlA8iQcFbvVDC8HY7s6U=/510x318/top/img-s3.ilcdn.fi/eaae7b47db775421945fb24d246aea02961efd3260d0aff969b11535a756e28c.jpg
