paivamaara,otsikko,tiivistelma,kuva,id
2021-04-05T04:00:00.000Z,"Penishieronta villitsee nyt miehet, mutta myös naiset","Joko olet kokeillut penishierontaa? Se luonnollisesti villitsee miehet, mutta sen potentiaalin ovat vihdoin löytäneet myös naiset. Läheisyys lisääntyy ja yhteys toiseen syvenee.",https://img.ilcdn.fi/bKFgfbVFLSE8hm8OHaMDw524clc=/510x318/top/img-s3.ilcdn.fi/19a06ddf2225ba9c81916f93f98206a95a9b09afe3c8bafc25889bdf3700508a.jpg,9D74A23397644A23BB32BA5301E09611
2021-04-05T04:00:00.000Z,"Sähköpyörä on kevään 2021 suurin kuntoiluhitti – Jättisuosio yllätti kauppiaat: ""Parhaat mallit myydään huhtikuussa”",Sähköpyörien myynti on räjähdysmäisessä kasvussa ja kysytyimmät pyörämallit loppuvat varastoista tänä keväänä ennätysaikaisin.,https://img.ilcdn.fi/bxBVt9ACCX8wCxaWj_QpfLQKUew=/510x318/top/img-s3.ilcdn.fi/73a1a9883fa3450ac8a6770cf97432f0a258be895beee6502590cd2e01562852.jpg,AF8D1EE27E4941ABA49D71D021AE28B4
2021-04-05T04:01:05.000Z,"Teräsvaari Martti, 91, on tuore maailmanmestari – näin hän treenaa ","Martti Mäkelä on elävä esimerkki siitä, että ikä on vain numero. Aktiivisesti päivittäin liikkuva teräsvaari on hakenut liikunnasta voimaa myös elämän kivisiin hetkiin.",https://img.ilcdn.fi/qSa9vWLqHd09hkkCAwHJRtZCARw=/510x318/top/img-s3.ilcdn.fi/41aec514861c39c3484352ad9c639e5210f3049557fa535d652ec1437f262305.jpg,52F1D6A7611B4C38A2821E752DD20FB1
2021-04-05T04:11:36.000Z,Juha Mieto on omistanut karvapohjasukset jo 45 vuotta – pito hylkeennahasta: ”Ne pelaa kuin häkä”,"Juha Mieto muistaa, että luisteluhiihdon pioneeri käytti karvapohjasuksia jo vuoden 1976 olympialaisissa.",https://img.ilcdn.fi/Gslu1P8tewZZRvxLCXyodGMsx9k=/510x318/top/img-s3.ilcdn.fi/0e7bff16a9d5f513f2605307a58512680eb04cfd495643e41a4c5721bfff25d7.jpg,3A25442B888A47B18158CF54AD991917
2021-04-05T04:17:24.000Z,"Huh, mikä terästyttö: kuusivuotias jenkkineito vetää hurjan määrän leukoja",Leuanvetoa rakastava tyttö hämmästyttää voimillaan.,https://img.ilcdn.fi/44DNuXcdCqBW_D1j-UXA3g_cksc=/510x318/top/img-s3.ilcdn.fi/853376b7b9d96134ff38c5b9d0e5222a87dd073964c8c74eb933a1062aff49d4.jpg,9165A742ED3548D882FC7E063655BF85
2021-04-05T04:32:01.000Z,Sähköautojen latauspaikkoja ja kaasuautojen tankkausasemia tulossa uusille paikkakunnille,"Uusia sähköautojen suuritehoisia latauspaikkoja ja kaasuautojen tankkausasemia on tulossa erityisesti paikkakunnille, joilla ei sellaisia vielä ole.",https://img.ilcdn.fi/rH0ASheMhm0q00uRfPSYaP4Yl94=/510x318/top/img-s3.ilcdn.fi/a49aaa3368db435341d814c648a2ced90554c23391932ed993672c139ca931e3.jpg,8B16D0F1DD424E92924FC2B9F7CC8A60
2021-04-05T04:53:48.000Z,Positiivinen koronatesti rokotteesta huolimatta – NHL-valmentaja vedettiin sivuun kesken pelin: ”Emme tiedä mitä tapahtuu”,Dallas Stars pelasi erän verran ilman päävalmentajaansa.,https://img.ilcdn.fi/QnrSo2ppPsvPSYZ8U9wTdDL9GsQ=/510x318/top/img-s3.ilcdn.fi/2008e4f5ce11c2f9f8bee51735d241b35c017d6dac38453176f2683b36fc8d15.jpg,B61FF3D89BDA45B488649F660C2EE30D
2021-04-05T04:57:05.000Z,IL:n selvitys paljastaa: Korona on lisännyt ambulanssien kiirettä – katso oman alueesi tilanne,"Iltalehden selvitys osoittaa, että vasteajat paukkuvat ensihoidossa. Silti kiirettä kuormittavampi tekijä on usein se, että ambulanssi on monessa sairaanhoitopiirissä sosiaalipalveluiden korvike.",https://img.ilcdn.fi/8CjcT3ASM7SA9ZOzV5U3ELiXmbM=/510x318/top/img-s3.ilcdn.fi/0797d682b3d9c573384e04543d0c5dca7f6f9d9033556c1752e872d3663c9d78.jpg,9DE5A6BC0D154912A3377838F0F2161C
2021-04-05T05:16:17.000Z,Ennätystehtaan uudet jaksot alkavat tänään – Janni Hussi: ”Suomi on täynnä huikeeta talenttia!”,Ennätystehdas-sarjassa suomalaiset koittavat rikkoa ennätyksiä mitä mielikuvituksellisimmissa lajeissa.,https://img.ilcdn.fi/qKSrrQPV5eI6ryr-138PG1mA6YY=/510x318/top/img-s3.ilcdn.fi/2809446f4c4d634b4698018af50decd5d8689b48898bc0635219f7b20078566b.jpg,9C719E3053A84C38A07C9D20C03AAF45
2021-04-05T05:31:11.000Z,Turhat ylikansalliset byrokratiat kahlitsevat meitä – mutta missä ne ovat onnistuneet?,"YK:ta ja EU:ta voidaan moittia, mutta ne ovat myös onnistuneet monin tavoin, kirjoittaa Petteri Taalas.",https://img.ilcdn.fi/Ejf_suCLIAsjaHC7hZH2WhBvfFQ=/510x318/top/img-s3.ilcdn.fi/03d37e2b8c182017b55689f05feb000380587d6367048d3757517fbb895f4b9c.jpg,395AA1B8EC184315942B1F5AA48DE463
2021-04-05T05:48:16.000Z,Maria Veitola järkyttyy esiäitinsä kohtalosta: 8-vuotiaana piikomaan ja esikoinen kuolee lipeään,Sukuni salat -ohjelmassa tutustutaan Maria Veitolan isoäidin äitiin.,https://img.ilcdn.fi/JzJENj-efGmYcndItWek2QQLd80=/510x318/top/img-s3.ilcdn.fi/60170c830ef62626ac8ba33a6316fbf89d7666f70e3b611588d911effc647bbf.jpg,0AED3F96772445C1A6D491165AD5AE17
2021-04-05T05:53:10.000Z,"Ruotsalaishyökkääjä kuittasi lähes kaksi miljoonaa, tilille ei pisteen pistettä",Ruotsalaishyökkääjän panos ei ihan vastaa palkan suuruutta.,https://img.ilcdn.fi/iLVcgbHrY-ThcmihO4qNd2Cisjo=/510x318/top/img-s3.ilcdn.fi/fac7c95ab188e0c3f85a884224f84b68c83af5cd7fbcdac8f41be393a6f25eae.jpg,88198D3F838342BDB89A870F4E0F707C
2021-04-05T06:31:11.000Z,Katri Helenan tyrmäävä tyyli täysin nykypäivää – katso julkkisten huikeat tyylinäytteet ysäriltä,Tähtien 1990-luvun tyylissä näkyy paljon tuttua.,https://img.ilcdn.fi/B_Vs31w1l4qZLNYzJMZCE6JHTPY=/510x318/top/img-s3.ilcdn.fi/dd34aeb0b58c615d085423cfe62f14b3907fa4cbd9cf755bd73d32ac58bd1d7e.jpg,B6285923641C4CD49072DB39210BA4E5
2021-04-05T06:32:00.000Z,Espanjalaisjoukkue jätti kentän rasistisen solvauksen takia – raportti paljastaa törkeät sanat: ”Laji on menetetty”,"Valencian mukaan joukkuetta uhattiin pistemenetyksellä, jos peliä ei jatkettaisi.",https://img.ilcdn.fi/DC1Cvg4KnUiBsDSbA7g3fgbP2Ho=/510x318/top/img-s3.ilcdn.fi/99b6fe94e50554b4a5fe7bb1f8866f46ed5c58bb8dd322b06590ca5532fe9eac.jpg,CF98C6159E374E5CAA6EF6DFACE874F1
2021-04-05T06:45:41.000Z,Palashampoo on nyt in! Testasimme neljä erilaista – pärjääkö pala perinteiselle shampoolle?,"Palashampoo on muoviton ja ekologisempi valinta, ja niitä ilmestyy nyt markkinoille yhdeltä jos toiseltakin merkiltä. Saako palalla tukan puhtaaksi, pärjääkö lopputulos tavalliselle shampoolle?",https://img.ilcdn.fi/2g7_bKtfzioWsifuZX7ExAA21kk=/510x318/top/img-s3.ilcdn.fi/d344d75b89d7d5b9d0b312b5c76ef98b067308220ba0c2aabe50a0ee7a70ff53.jpg,C5082F4D44E4478EB4E67C233CD4F84F
2021-04-05T07:00:23.000Z,Liian kaunis alkoholistiksi ,"Päällisin puolin Nadja Mäkinen, 39, oli elämäniloinen viiden lapsen äiti, mutta kulissien takana hän joi pakonomaisesti ja kärsi masennuksesta. ",https://img.ilcdn.fi/LQ4QEFTHwvP-RKJUKUC_5wpZWnE=/0x1128:3540x3341/510x318/top/img-s3.ilcdn.fi/4aad5ab110e3577322ad568eb34004fdd6d7bcffe77f5675b97c9874301878a9.jpg,B9433AD7266446EE8C8002EE668D0CE3
2021-04-05T07:25:34.000Z,Iltalehden suuri luontovisa – testaa luontotietämyksesi 15 kysymyksellä,Mikä on Suomen suurin lintu ja mikä lintu kärkkyy ruokaa nuotiopaikoilla? Testaa tietosi Suomen luonnosta Iltalehden luontovisassa.,https://img.ilcdn.fi/WIBmTAdrnbHhE6vgNqmKcLDElGQ=/510x318/top/img-s3.ilcdn.fi/119a390bb964ac9ff3aa19bdb7d428f5e6bc144980538ac26c11b39e253f5a4d.jpg,2573C454377B4CA59492E2E9AB4261A3
2021-04-05T07:34:00.000Z,"Suomalaisten edustama seura kaaoksessa – valmentajat lukivat potkuistaan lehdestä: ”Luoja, minä häpeän”",Kahden suomalaispelaajan edustama Brynäs hoiti potkut tökerösti. ,https://img.ilcdn.fi/Gux3q08pndREO2KYgpwif5ymL_Y=/510x318/top/img-s3.ilcdn.fi/695e7dc434c43da281dd607c7559bddd6640e7e8d3213155715e7f7d4bed6c76.jpg,A14CEE243D754388B74CF081C7D525AD
2021-04-05T07:55:59.000Z,Pitkä takaa-ajo Lahdessa: huumekuski jatkoi pakoa jopa tyhjentynein renkain,Poliisia karkuun ajaneen miehen huumepikatesti antoi positiivisen tuloksen.,https://img.ilcdn.fi/SkdJwZguHSCK2uHOTsIx-e_LT_0=/510x318/top/img-s3.ilcdn.fi/8648e6fab8c8298e3776d502c99ab73a3b554a55e828383ffe7aebf81cdc011a.jpg,CB3799FB97D04AE5BC4AC4A46DC0EE94
2021-04-05T08:01:58.000Z,Tältä näyttää Madonnan omakuva – munassa,Laulaja on ryhtynyt pääsiäisen kunniaksi taiteilemaan.,https://img.ilcdn.fi/sC9hwJ74I3LLE6VwNBUSEfi31ek=/510x318/top/img-s3.ilcdn.fi/f24ba6c0ff9ca14c9541f7514fd36324b4b1803c0a7b96cf4a61e65f3d88dc57.jpg,F5EEB3B8AF8845F1B7ED1C64D650E04A
2021-04-05T08:05:14.000Z,Tiedätkö millä korvaat kananmunan tai liivatteen leivonnassa? Tiina jakaa vinkit vegaaniseen leivontaan ,Näin pääset alkuun vegaanisessa leivonnassa.,https://img.ilcdn.fi/E87tDK3owBGUdUfTu0D6fS9hF_0=/510x318/top/img-s3.ilcdn.fi/44c413b2dd5cc619f4c96a8a959412886927bae0e81121b8175f9ec7d047023b.jpg,8671CB705771452292E8B3928DDD29B2
2021-04-05T08:06:16.000Z,Pikkupoika juoksi vilkkaalle tielle Thaimaassa – kuskin nopea reagointi pelasti hengen,Tilanne tallentui kuljettajan kameraan.,https://img.ilcdn.fi/5uj5S8zKTIxyiR4wOHkYBMlrrpE=/510x318/top/img-s3.ilcdn.fi/3eba6e3aa901aea3060e3c96dfa9b084f9b101ebea3b6fb8a43d1e55b891673c.jpg,CFF266F9F2FD48F08CB120B47BA2CF8B
2021-04-05T08:41:48.000Z,Jari-Matti Latvala tyrmää sähköautot – tarjoaa oman ehdotuksensa ralliin,Moottoriurheilu ja samalla myös ralliautoilu ovat ottaneet askeleita kohti sähköisempää tulevaisuutta.,https://img.ilcdn.fi/hAIM6-5SRhCHM_UeAGv0nRNL_ys=/510x318/top/img-s3.ilcdn.fi/acfeecbc625b363a68a3dd42b7a9aca3185ec588cee2d4ebef9f548486a7230c.png,4189E3BF852E421D8B8993604C8AFEBA
2021-04-05T08:53:52.000Z,Useita loukkaantunut nokkakolarissa Suomussalmella – Viitostie poikki,Loukkaantuneiden tarkkaa määrää selvitellään yhä.,https://img.ilcdn.fi/h-0f6fynQCU9O1Dd5TYNthnNfOc=/510x318/top/img-s3.ilcdn.fi/dcf84dbc3c4553fadec62e7d0743fc032e68c8759b7825163d66c3a7f6454c62.jpeg,B8C2D4B13AED414D8832B8D3A46CE254
2021-04-05T09:15:53.000Z,Prinssi Williamin lapset etsivät suklaamunansa nopeasti – makealle perso isä saattaa nimittäin ryövätä ne,"Kensingtonin palatsissa, kuten missä tahansa kodissa, on oltu munajahdissa.",https://img.ilcdn.fi/WqjG1PWUKcLlk0ex01MO4v-VR_I=/510x318/top/img-s3.ilcdn.fi/279e5ac3fbe8752b5d08c41b917baccaf75b8b082e20b6538bf98078c87488ea.jpg,B2CF42C98B2647659B026EA24A0CF0B8
2021-04-05T09:43:44.000Z,UFC-tähdelle sataa somessa törkeää palautetta – pyytää ihmisiä jo lopettamaan: ”Kukaan ei ansaitse tällaista”,Australialaisottelija on aiemmin kärsinyt mielenterveysongelmista.,https://img.ilcdn.fi/gV2GNf1JjYXtyETnbKlsQ4Wk_Mw=/510x318/top/img-s3.ilcdn.fi/f01a5aa295e2e5d42345a20435fd2e3d77f0a7f9f0d4ea4ff80efc9798a5a1fc.jpg,322F17C545464AA89B3006D681AB9FC9
2021-04-05T09:58:05.000Z,West Ham otti syksyllä murskavoiton – maanantaina pelissä paikka Mestarien liigassa,West Ham jatkaa maanantaina Valioliigassa ensi kauden Mestarien liigan paikan jahtaamista Wolvesin kustannuksella.,https://img.ilcdn.fi/xFQzyPwRZw2Wdv1np3TlY0WeSTo=/510x318/top/img-s3.ilcdn.fi/0bbf5a2d8dbe1bdf4f7b217a205ee35a283047e3e576d97fa231d5d189844c9a.jpg,5DAE00134A5942B59DC747B059076D45
2021-04-05T10:02:39.000Z,"Egyptin ensimmäistä naiskapteenia syytettiin Suezin kanavan tukkimisesta: ”Olen kohde siksi, että olen menestynyt”",Vuosia alalla työskennellyt nainen kertoo BBC:llä kohtaamastaan seksismistä.,https://img.ilcdn.fi/IL9dyFQkn0K6e53k4yeHDi5obrE=/510x318/top/img-s3.ilcdn.fi/959ebaa8ffe2d5d1cca482d3c08380aede355ffa04290ce2edacb6b30f08dc07.jpg,46A5BEABF13C49AEB4AC6B98B3BEE2A2
2021-04-05T10:17:59.000Z,Metsäkauris ui Johannan mökkirantaan – taltioi ylvään eläimen ulapalla: ”Uskon sen uineen ainakin kilometrin”,Metsäkauris selvisi tilanteesta loukkaantumatta.,https://img.ilcdn.fi/pMmznvLJMbLt24iNdBIiP8WT3gk=/510x318/top/img-s3.ilcdn.fi/0ca4c05374706ac016d8c015119b30c79582eee73eec68a16ebbdddd58752677.jpg,93D84654DFD048438F2C550BEA2DC480
2021-04-05T10:20:04.000Z,"Koronapääsiäinen Länsi-Uudellamaalla: maskitonta asiakasta huidottiin veitsellä marketissa, juhlijat rikkoivat rajoituksia",Pääsiäisviikonloppuna Länsi-Uudenmaan poliisia työllisti välikohtaus Espoon kauppakeskus Sellossa sekä yksityiset tilaisuudet.,https://img.ilcdn.fi/7klTI-uJI_aQH-GcgGPh__uNt7c=/510x318/top/img-s3.ilcdn.fi/5b06452ebd09818ba72399006c1e3c15beefd17340e9e81e0671f2958213b44c.jpg,F773AC32BF7A468BB2D9472E3A6E711A
2021-04-05T10:32:24.000Z,Katsojien toiveet kuultiin: Huvila & huussin muutoskohteena tänään tavallisten ihmisten tavallinen mökki,"Remonttikohteena on ränsistynyt mökki, jonne ei tule juoksevaa vettä.",https://img.ilcdn.fi/qPRXWYseD51oNweRRKOh22hZ86o=/0x665:2000x1915/510x318/top/img-s3.ilcdn.fi/10e297e0bde2bf9f21fa698d8a3074f411613b4f956eae79a2ed69ffac4e8fbf.jpg,B34F13AE47904A1E88A7FEF26F24AE9A
2021-04-05T11:12:35.000Z,Ilmoitus tuli perjantai-iltana kymmeneltä – sitten Laura Liukkosella oli kiire: ”Tein viimeisen painonvedon yöllä”,"Ennätyksensä murskannut Laura Liukkonen kertoo, minkälaista meno oli painonnoston EM-kisoissa Moskovassa. Määrätietoisen naisen päätähtäin osoittaa Pariisin olympialaisiin.",https://img.ilcdn.fi/lvf6lLDPCGHL-yceQ5lkk_MS3H4=/0x64:3000x1940/510x318/top/img-s3.ilcdn.fi/8fce9cb07d9db3b3b79c63c667157c10ee3f457a2cc90bfef6aa38ae3544585c.jpg,AE34DE71797F4870A288614F25B797C9
2021-04-05T11:44:14.000Z,"Janni Hussi palaa Ennätystehdas-ohjelmaan: Paljastaa, mitä temppua kokeilisi itse",Ennätystehdas-ohjelman kilpailijat inspiroivat juontajaa.,https://img.ilcdn.fi/X-211q8JwVpCLZfwUHYOTqE1DzE=/510x318/top/img-s3.ilcdn.fi/831a67281e11e3fac5096ab284830f6bb0fe5b873150f6f5390c24c295714021.jpg,1725F0FF3FAC4856A71055DB27069929
2021-04-05T12:27:05.000Z,"Norsu, joka osasi itkeä","Vannin olisi pitänyt saada vaeltaa vapaana savannilla, mutta ihminen jossain päätti toisin. Vannista tehtiin sirkusnorsu.",https://img.ilcdn.fi/OXfGaE2n_r3kjPF0rXH7IosLrLU=/510x318/top/img-s3.ilcdn.fi/eb451007dbbc6c6ea2e6b19fd93288d03442ccfd9c3604b59f5d5f124af58769.jpg,F4C52ABC017F4376B0084903AF8BC70B
2021-04-05T12:43:11.000Z,Typerä temppu! Video: kuski tönäisi kilpailijaa liki 200 kilometrin tuntivauhdissa,"Tönäisty kuski ihmettelee, miksi rangaistuksia ei jaettu.",https://img.ilcdn.fi/BzWzYOeSgISLqZpmHtIJ_3dVw-U=/510x318/top/img-s3.ilcdn.fi/09037929d8f1a5b49526416b41349330a0f36dccad16476b6b1be2049fb63299.jpg,55D00DA563324904AF9385319C304A16
2021-04-05T12:52:43.000Z,James Middleton tekee paljastuksen perheestään: Tässä on Pretzel,Herttuattaren veljellä on ihan oikea pääsiäispupu.,https://img.ilcdn.fi/Jyz4zJ0Wkh0q8nrSs5_OQdmAwTc=/510x318/top/img-s3.ilcdn.fi/377ae8cdee232ad7af439ba52b6a5e6c56bb6e39b91c61ed5d3b80ecd6fd5d5e.jpg,553A183ED8B94397BE39BA5ECAD8992B
2021-04-05T13:00:27.000Z,Suomi antaa koronarokotteitaan muille EU-maille – vaikutus kotimaan rokotustahtiin ”marginaalinen”,EU-maat sopivat kiirastorstaina auttavansa viittä jäsenmaata saamaan lisää rokotteita.,https://img.ilcdn.fi/yZx0tlRD6sk3AltTUaz7ltnMJ40=/83x0:5934x3655/510x318/top/img-s3.ilcdn.fi/185a0c91dda84a54420d25372c7d939ba0e4349e2f6f8f3556200b57a73811d1.jpg,8E8ACAEE90044864825C08804EBE3EEB
2021-04-05T13:23:36.000Z,Hurja tilanne hevosen ja auton yhteentörmäyksestä tallentui kojelautakameraan,Hevonen selvisi törmäyksestä onneksi säikähdyksellä ja jatkoi laukkaamistaan.,https://img.ilcdn.fi/RlxDpOcMQKmVlzGybE4scqX_xVE=/510x318/top/img-s3.ilcdn.fi/28fd33ed904f064f6df0463bef08542f63b037451335dcb5f2be22a7cce9ac98.jpg,447F5F0949DD4FE8A843516E2F65297A
2021-04-05T13:26:50.000Z,Hallituksen ennätyssuuri avustajakaarti ei ole lisännyt lainvalmistelun laatua ,"Hallituksen koronatorjuntaa varten tehdyt epäonnistuneet lakiesitykset herättävät huolta lainvalmistelun tasosta ja sen valvonnasta, kirjoittaa Kreeta Karvala.",https://img.ilcdn.fi/tJcTu7R_Y5w21g8FEGFqgS-_LYc=/510x318/top/img-s3.ilcdn.fi/4b0eef7c936d297c1cacc85889f7d75154ef15a91a31d2e5d91ce57d26c759cb.jpg,6B2D62164DCF4C7FAA6B0A33EF08408C
2021-04-05T13:37:15.000Z,Mitä Marsista löytyy? Nasan minihelikopteri valmistautuu historialliseen lentoon ,Nasan drone-kopterin on määrä tehdä neitsytlentonsa huhtikuun 11. päivä.,https://img.ilcdn.fi/wMFeoOY0tONTdhh28ZhV-Nd1WnU=/510x318/top/img-s3.ilcdn.fi/d0ec4b243e20b0c778271dd90d0fe5eebf060587a8a1d56f6bb7a9d41cfbf7db.jpg,1D0FBE1233CB44F9802BA03DDBA4A2B0
2021-04-05T13:46:36.000Z,Miten tämä on mahdollista? 10-vuotiaan tennislupauksen suoritus sai ihmiset mykistymään ,Vasta 10-vuotiaan juniorilupauksen pelisuoritukset ihastuttavat somessa.,https://img.ilcdn.fi/hoe5ljVgehjucv-4bNftEee_hdI=/510x318/top/img-s3.ilcdn.fi/b4ba91d11d4b8a5491e57fd5d063e54761fa9f24e271a82307898f4b8f93e88d.jpg,3212B7079B5C44FFAA068F821A668259
2021-04-05T13:56:06.000Z,Nuorta vahingoitettu teräaseella Tikkurilassa – myös epäilty on alaikäinen,Poliisi sai tapauksesta ilmoituksen noin yhden aikaan iltapäivällä.,https://img.ilcdn.fi/aR0QuuGzOU-C4V94gL0FDA6R3GU=/510x318/top/img-s3.ilcdn.fi/9e0768c8e71012e58746045d26687f3af26106d48733c4570bc0e20870bb5e3e.jpeg,CD1F54AB650F494888FE2CA03C0F3C06
2021-04-05T14:15:59.000Z,Mies kaasutti varastetulla autolla piikkimattoon Leppävirralla – jatkoi pakoaan puhjennein renkain,"Itä-Suomen poliisilaitos tiedottaa takaa-ajosta, johon poliisipartio joutui maanantaina aamupäivällä Pieksämäellä.",https://img.ilcdn.fi/rrh8wGqZt0HsZMDpKKENTUPrOjo=/510x318/top/img-s3.ilcdn.fi/556bc3667f46bbc3e68dee4632044e1ca715a9dcd95a8269b8529c8f4f9666fe.jpg,AB315BCD1B354C7F9C8BEB488AAA54C8
2021-04-05T14:25:02.000Z,Kirsikkapuut kukkivat Japanissa ennätysvarhain – asiantuntijoilta vakava varoitus,Hanamia juhlittiin Japanissa aiemmin kuin 1 200 vuoteen.,https://img.ilcdn.fi/AvqGwgc38oRbn7fRQm0vJcr1ZwM=/510x318/top/img-s3.ilcdn.fi/b974f844aea7811235b16f1bb9828642bea119345242cee8c6e452875d5bbe8c.jpg,9DC5AE97C62E426682A8E8C723202F12
2021-04-05T14:51:03.000Z,"Kimi Räikkösen ikonisen jäätelöhetken taustalta pelottava paljastus – vesilammikossa lillunut Ferrari herätti kauhua: ""Kukaan ei uskaltanut mennä lähellekään sitä""",Sähkö ja vesi ovat tunnetusti erittäin vaarallinen yhdistelmä.,https://img.ilcdn.fi/7d8mcoRzKhUjMl57Z2L-dc4n1zQ=/510x318/top/img-s3.ilcdn.fi/0e45a872d664d9647f1291625493afb07abe12f9d0481c11d822b9ca48e79022.png,E4C2DDB8F2DF4F4A8A12AC842346FC2D
2021-04-05T14:53:14.000Z,IL-reportaasi: Ylläksen baarit avattiin pääsiäiseksi – näin ihmiset oikeasti käyttäytyivät,Iltalehti seurasi Ylläsjärven ja Äkäslompolon yöelämää pitkäperjantaina ja lankalauantaina.,https://img.ilcdn.fi/CE4K-0tGjOXUmgWmNkf5p4bYUo4=/510x318/top/img-s3.ilcdn.fi/9b2dfe4fd9cae7931383404e22dd38b4c09414203409d8547bbd52dd0799bcac.jpg,EB10E32208D843838F1643AC65809F51
2021-04-05T15:00:00.000Z,Moni pilaa oman elämänsä kolmella erityisellä tekniikalla,"Self help -kirjailija Gary John Bishop neuvoo meitä kohtaamaan sisäinen saastamme, jolla sabotoimme omaa elämäämme.",https://img.ilcdn.fi/yLKfLuourjoANg6BaFKpxtwYl3A=/0x263:3000x2139/510x318/top/img-s3.ilcdn.fi/992c142070f23d3db5171b7cd8f60db78c747c7dc28e71beaa1b6a70c8ad494f.jpg,BF26245347E14235BB19B61AE935E771
2021-04-05T15:00:01.000Z,Näin Suomelle uhkaa käydä Euroviisuissa,"Euroviisuista näyttää tulevan kahden kauppa, kirjoittaa toimittaja Mari Pudas.",https://img.ilcdn.fi/SPRTjK5cphraTXvLgYD6qTS8T9c=/510x318/top/img-s3.ilcdn.fi/d9de4a1ff516628341a72f4ee32ccfe89b494630ebf43ef4b82d11483ccf0cf4.jpg,24BB49390FEF4DE3BE0D4A9FE8495FEF
2021-04-05T15:01:37.000Z,"Putin allekirjoitti lain, joka mahdollistaa hänen presidenttiytensä vuoteen 2036 saakka",Lakimuutos mahdollistaa Vladimir Putinille vielä kaksi presidenttikautta lisää.,https://img.ilcdn.fi/gEB0mZbZ6-SR04QEaBhf3jKoXuk=/510x318/top/img-s3.ilcdn.fi/d23cf5e3a59820187e97d775a70754d8e0bde6425c92146d26634383ceec8b03.jpg,AE3986EED3BE4DB28E9E9A4B16D10CEF
2021-04-05T15:23:56.000Z,Jääröykkiöt valtasivat Säkylän Pyhäjärven rannan: ”Ehdimme juuri avata terassin lasit ettei jäämassa riko niitä”,Valtavat jäämassat kasaantuivat rantamökkeihin asti.,https://img.ilcdn.fi/e5L1T-5qbdC-zfBMSj4VB0CJfHw=/510x318/top/img-s3.ilcdn.fi/b4022e4f594cbc0884e42e782b4275996268ad564b665bc7181faed48ae09aae.jpg,7BFC1F12177E47F8A09A6412EF81920F
2021-04-05T15:24:14.000Z,Miksi jää on niin liukasta? Fyysikot selvittivät viimein 150 vuoden jälkeen – Ohuella vesikalvolla ei ole mitään tekemistä asian kanssa,Alankomaiset tutkijat päättelivät uuvuttavan huolellisten mittausten jälkeen syyksi molekyylien ympäri pyörähtelyn päällimmäisessä kerroksessa.,https://img.ilcdn.fi/mQEpFqF7Dx9zfrblLXgHQ1jh2s0=/510x318/top/img-s3.ilcdn.fi/1137de555eeeef68b8df1040fac4ff95dd7a30c368d85cb1ad24b3c1cb7f4dcc.jpg,A009E9EAFD0F428EAC1FBFB8D54E5688
2021-04-05T16:03:35.000Z,Tässäkin puhuttiin palturia: Kuningatar ei kieltänyt Meghanilta omaa uraa,"Meghan olisi voinut jatkaa näyttelemistä, vaikka menikin prinssin kanssa naimisiin.",https://img.ilcdn.fi/0KPZhOCAjCXdD4dnDcU4arane1Q=/510x318/top/img-s3.ilcdn.fi/36204c739132322a1e8ff006b0d21a1e9653f67138352cdf3917995e75e0440e.jpg,831748AB73724EC89B14BB48EC63BB2A
2021-04-05T16:06:27.000Z,Jelena Välbe tuohtui venäläishiihtäjälle – syytti tätä Norjan hiihtoasun käyttämisestä,Jelena Välbe myönsi olleensa lopulta ehkä väärässä. ,https://img.ilcdn.fi/XXXSUmFZLXu-5oJaWvkGrwuyP7k=/510x318/top/img-s3.ilcdn.fi/cc13a476b161bc888517db941f0005e7686e627f85add0bdaf78578141392f24.jpg,D28B464A2453487B9BE94692DC0B8E3B
2021-04-05T16:07:19.000Z,Kultalusikan kääntöpuoli,Jo vauvoille perustetaan sijoitussäästötilejä. Asiantuntijoiden mukaan ”kultalusikan” ojentava vanhempi saattaa tehdä lapselleen karhunpalveluksen.,https://img.ilcdn.fi/AKKFCM9CuHqyb8zj0ZGPwFRVppQ=/510x318/top/img-s3.ilcdn.fi/23a71c8881a9dc6814f510668f7f13ad527886a5c646e2faaa184eace5c4626a.jpg,5C915E48923A402492A4D98754B2932A
2021-04-05T16:24:48.000Z,Hyvä Lappi ja muu Suomi! Baarikäytös tuntureilla sen osoitti: yli vuoden koronaharjoitukset ovat tuottaneet tulostakin,"Pääsiäisen vaikutus koronavirustilastoihin näkyy myöhemmin, mutta ihmisten käytös Ylläksen baareissa antaa aihetta varovaiseen optimismiin, kirjoittaa Iltalehden toimittaja Antti Halonen.",https://img.ilcdn.fi/2gLvdTMTeIl4wZUxre34qAxXkAA=/510x318/top/img-s3.ilcdn.fi/f2749c0d06882114e66a6ef7b13799483bcfa09c7c93d2d5c2d99e2ac1130b18.jpg,75A70E46A6F24D5890168F7ED9776985
2021-04-05T16:39:05.000Z,Rovaniemeltä löytyi kuollut mies,Asiassa ei ole tässä vaiheessa syytä epäillä rikosta.,https://img.ilcdn.fi/h-0f6fynQCU9O1Dd5TYNthnNfOc=/510x318/top/img-s3.ilcdn.fi/dcf84dbc3c4553fadec62e7d0743fc032e68c8759b7825163d66c3a7f6454c62.jpeg,F6F18A62E2384BEA8F42BFA68CCBF7B0
2021-04-05T16:57:20.000Z,Urheilulegenda tunaroi somessa – pelaa pokeria humalassa strippareiden ympäröimänä,Paul Pierce mokasi pahasti. ,https://img.ilcdn.fi/W4tsVDr7VSDEn2Y5LB8f4IkctZo=/510x318/top/img-s3.ilcdn.fi/981d83153d223b2882dfa7f8867cff398a5dc9e2f727884ab0c73a887c3ca6f2.jpg,791D0D34C4C24AF0BDA284957DDCE3F4
2021-04-05T17:01:29.000Z,Freddie Mercuryn ensimmäinen tyttöystävä paljastaa: Tajusi museossa Freddien olevan homoseksuaali,Rose Pearson oli Freddie Mercuryn ensimmäinen tyttöystävä. ,https://img.ilcdn.fi/dWo6Gu2YHBpa72BKjpnslRXIoao=/510x318/top/img-s3.ilcdn.fi/bbad74d297520b01355ae3ea67f0607a005b120ac6a912515f65e480f71f5345.jpg,D5A9648EC85143E285C1189A268B0B5B
2021-04-05T17:04:48.000Z,Yksityisjuhlat työllistivät poliisia – tämä on Suomen koronatilanne nyt,Suomessa on todettu koronavirusepidemian alusta lähtien yhteensä 79 737 tartuntaa.,https://img.ilcdn.fi/2EdcaNIk4S_f37RmCRXdLiMO_G4=/510x318/top/img-s3.ilcdn.fi/3b00666363c1d207797778f4261b0bce29979317673244268086d3747bbbb8ba.jpg,65BA958C998443268AC0A0396AA96AD0
2021-04-05T17:31:43.000Z,"Sairaalapotilaiden määrä väheni, koronatartunnat laskussa – Husin Lehtonen väläyttelee paluuta epidemian perustasolle: ”On mahdollista, että toukokuussa siihen päästäisiin”","Husin diagnostiikkajohtaja kertoo, että tällä hetkellä näyttäisi siltä, että koronaviruksen niin kutsuttu kolmas aalto näyttäisi heikkenemisen merkkejä.",https://img.ilcdn.fi/3GyHECx7ec26nc8h_vdJ15RUdTQ=/510x318/top/img-s3.ilcdn.fi/7dc58c8811fc583ebf241a5fe4d9ef62246499403e2f667984156495f4706282.jpg,45E86282B42B42158D7CC419FCC9C915
2021-04-05T17:54:45.000Z,Ei herkille – Myrkyllinen hyönteinen majaili syvällä vietnamilaisen naisen korvassa,Nainen kertoi tuntevansa liikettä ja kipua korvassaan.,https://img.ilcdn.fi/N1nZnU6xWm7rdT7MQEOd7lShrXQ=/510x318/top/img-s3.ilcdn.fi/057fdb5dda17d73a94f6a2faad7682ecfb3e007b6f4453cd30b615ce862c69cd.jpg,2739E2B0CD624CF0A8F53BD772E17CA4
2021-04-05T17:58:07.000Z,Paraisille poikkeuslupa satojen rauhoitettujen merimetsojen ampumiseen,Perusteena on metsille aiheutuvan vakavan vahingon estäminen.,https://img.ilcdn.fi/2Vr9L3o7sIwoXDZ5ktKEXWqvdhQ=/510x318/top/img-s3.ilcdn.fi/31dd50162f907e23c65478939e43fd17f044e685bfebb33edc7d9f733300aa8f.jpg,06A9C51A49974BA8A7F9D7D257751D39
2021-04-05T17:59:16.000Z,Posketon hinta keräilykortista – supertähden lappu huutokaupattiin hurjaan ME-hintaan,Kortin arvoa nosti Tom Bradyn nimikirjoitus.,https://img.ilcdn.fi/y_8xReLWAbyQRchnXSp19I5-cmY=/510x318/top/img-s3.ilcdn.fi/b37203772de73485e6de261b5e064897ff7ab3c3da275e1361cfdb3145c5d449.jpg,916111DC8CA34CD9A56007B05A470B0C
2021-04-05T18:41:06.000Z,Vakoojien pyörittämä lomakeskus,Arousin lomakylä Punaisella merellä lukeutui aikansa hulppeimpiin. Kaikki oli kuitenkin suurta huijausta.,https://img.ilcdn.fi/nRgmvaJ2Omk-0pgrsre0gflHsWs=/510x318/top/img-s3.ilcdn.fi/b47fc54adc53a8efaefa48f68b90f5bfd51df1b3930081150326530a3c8f9328.jpg,7115AE524A65428A8D934E3AD663A1CA
2021-04-05T18:43:24.000Z,Suomalaishyökkääjä saamassa vihdoin NHL-debyyttinsä – kauden pistetahti on häikäisevä,Arttu Ruotsalainen on jatkanut tehoilua AHL:ssä.,https://img.ilcdn.fi/dCXdJ6tf0i0Mxf0il1pLjJxik3k=/510x318/top/img-s3.ilcdn.fi/e9c2cc6669d2cb256c14e923d9d4107402615bf59f01dc14a0fb2f79ad8328a0.jpg,7FFB140F05944DE9BCE92484FA67C2FB
