paivamaara,otsikko,tiivistelma,kuva,id
2023-04-27T18:59:28.000Z,Tältä näyttää Angelina Jolien 21-vuotias Maddox-poika – Edusti äitinsä kanssa Valkoisessa talossa,Harvoin julkisuudessa nähty Maddox Jolie-Pitt vieraili äitinsä kanssa Joe Bidenin isännöimillä illallisilla.,https://img.ilcdn.fi/FkkgZBN_bLR3QQdcOwfW1WOg8Io=/510x318/top/img-s3.ilcdn.fi/2252c2c3c8af6cec75be783a2f6ce6412f2a525005ffbd0a628c1c8562d54b38.jpg,4C08F7CACBA04604B2BEB18069D9B895
2023-04-27T19:09:25.000Z,Tässä on Iltalehden Kultaleijona 2023,Iltalehti on valinnut Kultaleijonaksi pudotuspelien avainhahmon vuodesta 1983 lähtien.,https://img.ilcdn.fi/W-cbSVVto7S1Gibs20l_85innlc=/510x318/top/img-s3.ilcdn.fi/97ab7b014e8bef272758719ec38f48ecd8c38f246fc6b49de5b43ff8b73309af.png,134D5913146C42B895772F85B554BDCA
2023-04-27T19:19:49.000Z,"Huoltamaton ilmalämpöpumppu voi aiheuttaa kalliin vaurion – ""Tuppaa monelta unohtumaan""","Ilmalämpöpumppu tulee huoltaa oikein, jotta ongelmilta voi välttyä.",https://img.ilcdn.fi/bvv3tHxpkfHUhhblEIRbnnBRf2U=/510x318/top/img-s3.ilcdn.fi/9ee727dc7ba445da04e82dfed049a715e1fd3795e7cbfeccd0bf9a5b82cb6c5f.jpg,4638560BE509488197D8E462DE13CF9A
2023-04-27T19:23:07.000Z,Tapparan legenda lopettaa uransa,Kristian Kuuselan ura päättyi Tapparan mestaruusjuhliin.,https://img.ilcdn.fi/zxaOqDepNqGvjNXhc7zbcr-U3B4=/510x318/top/img-s3.ilcdn.fi/a2d12f4bc0f77c6dfe42d635b09e02f989fa591d8779be1597dcc5ea63168fb2.jpg,7354360F77034AEBAB8E0B0B49A083B5
2023-04-27T19:27:52.000Z,Muistatko nämä autot? Katso videolta ikonisen mallin kaikki sukupolvet,"Renault Espace muuttui tänä vuonna katumaasturiksi, mutta tila-auton perintö on arvokas.",https://img.ilcdn.fi/nv1esK3FmhUWGd64cPLgK7sRplQ=/510x318/top/img-s3.ilcdn.fi/44bed38ffcdf24e492768d7d7ddc380a6440a25c484b8df71dc20c657f5e9faa.jpg,17923EFB7AC94A9B8676BC477AE4CC1F
2023-04-27T19:47:00.000Z,Vaihtoehtoisia hoitomuotoja edustavat järjestöt kantelivat uskomushoito-termistä,Tukes valvoo vaihtoehtohoitojen turvallisuutta. Lääkäreiden enemmistö kieltäisi osan vaihtoehtohoidoista.,https://img.ilcdn.fi/_84AKJ8a6k4ZcMSKislmCS-QkAQ=/510x318/top/img-s3.ilcdn.fi/49a937cb9919c8598e86a2f4bb7d8f63ae93a95d537ef91b80cccfec4ceacd7d.jpg,1602E50D2DF84099AE82977A8DABE57F
2023-04-27T19:55:55.000Z,Tapparan kultavalmentaja joutui tekemään kipeän päätöksen: ”Pirun vaikeaa se oli”,Jussi Tapola jätti Tapparan nelinkertaisena mestarivalmentajana.,https://img.ilcdn.fi/Ve8vbDEG-DtIXnaDAB-EnSwsk8c=/510x318/top/img-s3.ilcdn.fi/f1db8ee5dfa73ff99055c30443eabed3a6f4c3e7267c5ae192f05553e8c384b3.jpg,1A87493A07EA402A9E59F802B1E80E70
2023-04-27T20:04:30.000Z,Tapparan valmentajalta huima bilelupaus pelaajille,Jussi Tapola lupaili pitkiä juhlia.,https://img.ilcdn.fi/DRHfo0aA3CWagrbD0Wsn9DMBX_E=/510x318/top/img-s3.ilcdn.fi/dec5513b19068a0c81ee5c1745723bf6dc745437837ab02abf45f4c5a58c7760.jpg,599F760335B342BF8B6B8912F60EA5C2
2023-04-27T20:27:22.000Z,Jori Lehterä vakavoitui ja lausui tunteikkaat sanat mestaruuden jälkeen – Paljastus katsomoon heitetyn Kristian Kuuselan viikoista,Jori Lehterä arvostaa Kristian Kuuselaa hurjasti.,https://img.ilcdn.fi/mQmtUpcqfuUqRPX4nmkxm_A2mJ4=/510x318/top/img-s3.ilcdn.fi/02b79b29f7ad9a07994fb529aeee3a47ecd62a229e3b9e9b9aa96a45a8231d1e.jpg,1B2F8C8AACFA4701BF260ED467E672D2
2023-04-27T20:35:22.000Z,Ylen toimittajalla kuumeni – Töni katsojaa suorassa lähetyksessä,Jussi Saarinen kävi käsiksi Tappara-faniin.,https://img.ilcdn.fi/78VmtzTgvoEwP-cUO8Mk0PatOjA=/510x318/top/img-s3.ilcdn.fi/70c015d682913ba01f0d9f956a9c9f98f4e9065b0dbe822ee163d0556b59211b.jpg,8D2D40FD64C6428BBF813E240CFA25DE
2023-04-27T20:51:23.000Z,"Ukrainan sota, päivä 428: Venäjällä ja Yhdysvalloilla kiistaa toimittajista, Mykolajviin osui tuhoisa ohjusisku",Tähän juttuun on koottu Ukrainan sodan tärkeimmät tapahtumat torstailta.,https://img.ilcdn.fi/Q2w08p1akmvHhUctpKVej5FuugU=/510x318/top/img-s3.ilcdn.fi/d0eed9f0c1bdaa575d61b46629fe5aaa6787c690904b2ccd5461c51f0dadcca1.jpg,089515A4FA344A21BD295DFDD44B61D2
2023-04-27T20:52:08.000Z,Näin etenivät Tampereen torijuhlat: ”Poliisia ei kaivata” – Taivaalla huima valoilmiö,Mestaruusjuhlat Tampereella sujuivat perinteisin menoin.,https://img.ilcdn.fi/W48OGZRYNrwVgMyNx4blN9LmaEE=/510x318/top/img-s3.ilcdn.fi/e0aaf121249a6696394563c47b69f3854e918273cde6d5a72a572b28ad786514.jpg,238A368B3B2745999923DC1AB3F9B4AB
2023-04-27T21:04:04.000Z,Suomalaispurjehtijan pelastaja voitti koko purjehduskilpailun,"Tapio Lehtisen merihädästä pelastanut Kirsten Neuschäfer on ensimmäinen naispurjehtija, joka on voittanut maailmanympäripurjehduskisan.",https://img.ilcdn.fi/Kn6SGJLOzpaBtlrjI7xdc7sjOic=/510x318/top/img-s3.ilcdn.fi/7ef3bda925f48954944ece6a5a178210ee8a86bc14896c1eb423aadf6d7d2b4a.jpg,379C99316FE64A8B887E2FAD68899253
2023-04-27T21:10:20.000Z,Tottenham pelasti pisteen: Tasoitus hiljensi fanien vihellyskonsertin,Tottenham nousi kahden maalin takamatkalta pistejakoon Manchester Unitedin kanssa.,https://img.ilcdn.fi/AYo4W9R_B4OCnA9nRnYC0mxBO6c=/510x318/top/img-s3.ilcdn.fi/7d84b744f5a0cde46f8a8c164809771535c992e2366481a4b96b43aa38c38b9b.jpg,6A082CD648DB4524B28AA327E9D81324
2023-04-27T21:38:09.000Z,Läpimurto toi 255 miljoonaa dollaria – Sadat elämät mullistuvat viikonloppuna USA:ssa,Läpimurto toi pelaajalle ällistyttävät 255 miljoonaa dollaria – satojen jenkkiurheilijoiden unelmat käyvät toteen viikonloppuna,https://img.ilcdn.fi/Gtk63RnD6zZe7elroYxw_WRdH6k=/510x318/top/img-s3.ilcdn.fi/4f2d5abe3d5b907c489878fa7caf52fd0204e21069fe44b6b07a08013649cc1c.jpg,C740BBE6399243F19C679E240EDFA39D
2023-04-27T22:38:37.000Z,"Joe Biden, 80, kommentoi ikäänsä: ”Mietin sitä tarkkaan”","Yhdysvaltain istuva presidentti Joe Biden kertoo, mitä mieltä on ikänsä arvioinnista.",https://img.ilcdn.fi/MgazB0zm2DL8UG9rNuD-3btC1G0=/510x318/top/img-s3.ilcdn.fi/bf4935931a0e9fe38b60bf47d2077e75c93943a5e40356b7e4ac361b937ce234.jpg,608CF9810D35452D998C247B2B59DE42
2023-04-27T23:00:03.000Z,Horoskooppi,NULL,https://img.ilcdn.fi/ZJX2nPQHLedeTO4nOGca4bZ5URo=/510x318/top/img-s3.ilcdn.fi/0e855f41645f17dbb2436f21bf69f40ac48d1971a147578985e2c64c1fb985d3.jpg,F0A14803B99B4E48A32CF4ECB62531E2
2023-04-28T00:39:58.000Z,Näännyttävä kuumuus käristää Euroopassa – Tätä se tarkoittaisi Suomessa,Espanjan Córdobassa rikottiin lämpöennätys torstaina.,https://img.ilcdn.fi/9UBm05PcMRUoxrRhaCmBKE-5q_w=/510x318/top/img-s3.ilcdn.fi/757ea6ae858dcbe7a31544bd31ecf849f1c81d952d58c6206a82ccdcb7bb5ed7.jpg,F866E22522694DA9AF43B3A0AD93CAD4
2023-04-28T02:00:01.000Z,Tänään tv:ssä: Nikon mielestä hänen harrastuksessaan ei ole mitään hävettävää – ”Se lukee Tinder-profiilissakin”,Helsinkiläinen Niko Ikonen on lentopistekeräilijä.,https://img.ilcdn.fi/acapWRt39xeKhwscHEys-AfUoJI=/510x318/top/img-s3.ilcdn.fi/4722db7847f4c466e82d2fba86a712caca6b934003dfa1245102b306b87ac128.jpg,ACB39BD9B2904065AFACD166B053FE5B
2023-04-28T02:01:07.000Z,MT:n gallup: Suomalaiset valikoivat leikkaukset ennen veronkorotuksia ,"Enemmistö uskoo leikkuriin, selviää Maaseudun Tulevaisuuden kyselystä.",https://img.ilcdn.fi/NRaE108_6MXb41RT0yRUcK0ENkA=/510x318/top/img-s3.ilcdn.fi/0ee308f9efd90d99ed58009ddd70984ab6b66cb7a91fa1b1678b436a83dc48d0.jpg,E42D88E186494C86B7E7E9712F714152
2023-04-28T02:30:02.000Z,"Näin Venäjällä: Nokian renkaiden fontti ja värit kopioitiin härskisti – väittävät valmistavansa Nokia Tyres -renkaita, vaikka lupaa nimen käyttöön ei ole ",Ikon Tyres jatkaa Nokian Tyres -renkaiden valmistusta Venäjällä.,https://img.ilcdn.fi/TXvVuE0GE5urJ7joe14Jpyxjpt4=/510x318/top/img-s3.ilcdn.fi/8dd4ad80aa029b358a37364dbf5e04179c75443851940ed05e777f776527efc8.jpg,202CB7242205401B95923E562D6BF36D
2023-04-28T03:00:02.000Z,"Nyt minä tunnen sinut, pikkusisko","Kun Anne Rossi-Horton pikkusisko riisti oman henkensä, ilmaan jäi loputon määrä kysymyksiä. Miksi ihmeessä rakas ja lahjakas pikkusisko ei halunnut elää? Sitten Anne löysi siskonsa päiväkirjat. Niiden takaa paljastui jotain niin järkyttävää, ettei Anne ole vieläkään täysin selvinnyt siitä.",https://img.ilcdn.fi/FXHvzwvG_g9wDNbPB7_Osbb29xo=/510x318/top/img-s3.ilcdn.fi/ee1d4a17293be259871b69fe9090763853abb072d3ba1e9f09d4aac8836e0df5.jpg,229B6AFD53A643D3919206EEE9CA2D5D
2023-04-28T03:00:08.000Z,Venäjä jätti verot maksamatta – Verohallinto karhuaa Venäjältä viisinumeroista summaa voudin välityksellä,Verohallinto karhuaa Venäjän valtiolta maksamattomia veroja ulosottoteitse.,https://img.ilcdn.fi/84O2YP6IPn4jUUmfX49_hN5F6FM=/510x318/top/img-s3.ilcdn.fi/0ecda8c119eeecebc8247c9e8c031793ec02afa3a9e7f5c452e04f299b1acb56.jpg,A406E18B3F5F4C3D931A407203111404
2023-04-28T03:01:09.000Z,Railakas karnevaali alkoi – Tapparan tähtipakin kultamitali jo lainassa: ”Kyllä viikon verran vedetään”,Mestaruusjuhlat ja pitkä vappuviikonloppu. Siinä on Tapparan mestarijoukkueelle pureskeltavaa seuraaviksi päiviksi.,https://img.ilcdn.fi/PiN5_mMJlFQYHlGLwpdJxUWd-Zg=/510x318/top/img-s3.ilcdn.fi/1cbc4b75234072f0ed5fa37d5133cda6469be0acd40c74b4158f04ebaf05d3cf.jpg,4E03F01A2C2843B4BFAF08830AE0CA86
2023-04-28T03:20:28.000Z,Pelicans ei luovuttanut missään vaiheessa: ”Mahtava ylisuorittaminen”,"Tommi Niemelän Pelicans teki urotekoja pitkin ikimuistoista kautta, mutta lopussa se ei mahtanut paremmalleen mitään.",https://img.ilcdn.fi/x_kc33B3L-d7_L6ETNZRtq1-b8s=/510x318/top/img-s3.ilcdn.fi/1af91b4dbcb67edee1655c45efd1947da4106f9867f52d57e56de09c31d48973.png,77BCB592540F485CAB5DE40AD4F2CEEF
2023-04-28T03:30:56.000Z,Michelin-ravintola sulkee ovensa – Pöydät varattiin täyteen 2 tunnissa,Sasu Laukkosen ravintola Oran tarina tulee päätökseensä vappuna. ,https://img.ilcdn.fi/DeN7KO2UgNFYwAXYE72LC_UONoU=/510x318/top/img-s3.ilcdn.fi/9f03125e229792c5dcfdfe143cc88840671f6e1a4e69cdd1733395004bed833e.jpg,069CE897ED2E4AA1873AD7A199C1FD50
2023-04-28T03:40:40.000Z,Tappara-tähti paljasti: NHL-sopimus pöydällä,Tapparan suureksi ratkaisijaksi nousseen Waltteri Merelän seuraava suuri askel on NHL-sopimus.,https://img.ilcdn.fi/EKkNoCcGQDcH5ZI2uyKRqXx5CdQ=/510x318/top/img-s3.ilcdn.fi/47eca62f7c1597d8cd55f1ab0621d275abe7c291f17aa6cd74e0ec4b661d41af.jpg,5D812A9517D24718A77D320E6353A3E1
2023-04-28T03:49:50.000Z,Mitä tapahtui Johnny Deppille? Näyttelijä astui paparazzien eteen lähes tunnistamattomana,Johnny Depp ikuistettiin pitkästä aikaa paparazzikuviin.,https://img.ilcdn.fi/zuLvpJJYQlnkdov2MLytf5fcQr0=/510x318/top/img-s3.ilcdn.fi/8c6ad9fd0a2d94e992c58938d720fc86def399a859ec01fe1514cab129a5571d.jpg,7D54933C53084020BC5C2EA69F749040
2023-04-28T04:00:00.000Z,Erik Haula Devilsin tehopelaajana – Kevään yllätyssankari jälleen Rangersin riesa,Devils kaatoi Rangersin osumin 4–0.,https://img.ilcdn.fi/nCnVjY0G_dhvZd1le-pJZgOYnHE=/0x55:2575x1663/510x318/top/img-s3.ilcdn.fi/9a2f36c3184e9854fdb1c9c876bec7303f7c282182c21ad1ba327aed4bb0452d.jpg,1E5D2E0E38A94E6CB7EE75861BDB9A07
2023-04-28T04:01:40.000Z,Yllättäen sulkeutuneen queer-kahvila Kvääristön konkurssissa outo käänne ,"Helmikuussa sulkeutuneen baari-kahvila Kvääristön taustayhtiö yritti hakeutua konkurssiin, mutta se ei onnistunut. Sen sijaan yhtiö saattaa ajautua selvitystilaan, koska sillä ei ole hallitusta.",https://img.ilcdn.fi/kt7dtalpAPQGncsG9Ey7tF_sC1E=/510x318/top/img-s3.ilcdn.fi/47a404754d7dfc8c3fa921ae502588d745437cca1791e5dee5f9ac6b3671289a.jpg,81E6E7B847124C688F190C1923FF5878
2023-04-28T04:15:31.000Z,Tähtihyökkääjä ylisti organisaatiota – Tappara on dynastia: ”Me ollaan jääkiekon Real Madrid”,Anton Levtchin kausi alkoi Floridan auringossa ja päättyi Tampereen keväässä.,https://img.ilcdn.fi/0oIBVUF9kWhMwbMDmHfJL_NvPsQ=/510x318/top/img-s3.ilcdn.fi/a143ec5c13a1b3422d49630abd1185d30efc518fd72699bfc1cb31cfcd448ca1.jpg,BB1FE09DCF4448E491E3A489A549DBE8
2023-04-28T04:21:52.000Z,Tältä näyttää supersuositun Nälkäpeli-saagan uusin elokuva: Katso hyytävä traileri,Näet Iltalehden ensinäytöstä esimakua tulevasta Nälkäpeli-elokuvasta.,https://img.ilcdn.fi/MfiOGUOvqsEWH0O9xAWh_w7kwME=/510x318/top/img-s3.ilcdn.fi/c52b0d22b34633cf556c3b48cc927355a27f92d9f48d55fa7fd246998291ee5d.png,29528F5C1A7F497DA937FD5832E93F79
2023-04-28T04:29:37.000Z,Asiantuntija: Rauha Ukrainassa ei kiinnosta Kiinan Xitä – Tavoitteena heikentää Venäjää,"Asiantuntija arvioi, että Kiinaa kiinnostaa rauhan sijaan lähinnä oma geopoliittinen agenda. ",https://img.ilcdn.fi/4dtBWv8tYelRr3WaYJykrK-Qw7I=/510x318/top/img-s3.ilcdn.fi/491d370df90ef57fc02fc2f6146847689d599fd1d3b235cf435e3a7cda7d46c1.jpg,E8C0F2DAA2144C1DA848FAC3131C7067
2023-04-28T04:35:50.000Z,Venäläisen NHL-tähden katoamisesta ilmeni lisätietoja – Sekavassa tilassa ollut nainen vietiin hotellihuoneesta sairaalaan,Valeri Nitšuškin on yhä sivussa NHL:n pudotuspeleistä.,https://img.ilcdn.fi/swYqKKFAme5crJhvq-ERcIPuajM=/510x318/top/img-s3.ilcdn.fi/4dcafdbe137ed4071835db7a092a86bf20ca4444bb84f8e5ca4cd01c07d64fa2.jpg,BD026E544E7B42E9B9E475891EF83F94
2023-04-28T04:46:07.000Z,Asunnonostokyky historian huonoin – OP:n ekonomisti: ”Jos on nyt lähdössä asuntomarkkinoille...”,OP:n ennusteen mukaan asuntojen hintojen odotetaan laskevan vielä tänä vuonna.,https://img.ilcdn.fi/3BnZDRjEiuN3JNDhVCVGTkmnvgg=/510x318/top/img-s3.ilcdn.fi/6f391bb36b7ad6f9f8d1a7b40499e87561b7c4cc8bed6e834e720d5ec18ad41b.jpg,CCF31D205D9C4710926F4D8823463E30
2023-04-28T05:01:56.000Z,"Vauva jäi autoon, kun äiti hyppäsi pois kuskin paikalta – Mies pakotti tekemällä hirveitä tekoja",Liki tunnistamattomaksi hakattu pienen vauvan äiti selvisi turvaan hypättyään liikennevaloissa ulos autosta. ,https://img.ilcdn.fi/VPuKv_or1B9XPWLNoo7SDgwQWe4=/510x318/top/img-s3.ilcdn.fi/1a5b408707a7da4a7119c62b1e7c6d073c729b7f7f6adc6f4d22e7c721bec425.jpg,7EEBAE7B95424B9CB0BB0E61113A3668
2023-04-28T05:09:58.000Z,Sulaako Toronto Maple Leafs jälleen? ”Älkää lyökö vetoa näitä jätkiä vastaan”,Tampa Bay Lightning haki Torontosta 4–2-voiton.,https://img.ilcdn.fi/Mo_GjaQpTjpM4Vzw7uEwJnVgzFo=/0x34:3000x1909/510x318/top/img-s3.ilcdn.fi/6d3cf470f78f48fefd61fa1e98fdc80d3fce6b55bda15d574a98cdf0a72982dd.jpg,C526807EFF0E4F22BAB47A250DEA6519
2023-04-28T05:13:31.000Z,Kammottava näky – Hamstraajan koti hautautui tölkkeihin Floridassa,Koti oli hautautunut oluttölkkeihin.,https://img.ilcdn.fi/R-BirlXCFxGA10T1cEJgdcM19yI=/510x318/top/img-s3.ilcdn.fi/6cc49baf675baa8c5572d482c281e8281ba26977207cdb7fb7199683f9fecb45.jpg,CE10D4C03E85419494162C8FE611D3FE
2023-04-28T05:14:44.000Z,Mitä ihmettä? Brittien aamu tv:ssä vieraili Camilla-nukke ,Pian kruunattavan kuningatar Camillan näköinen vahanukke vieraili televisiolähetyksessä. ,https://img.ilcdn.fi/u5ErYuzYMNwWkDNVT9FncNWqphU=/510x318/top/img-s3.ilcdn.fi/f8c552af5e87f7023dce2a6a84d90924c1d685e331f5f6b69f807cc05ddbdc1e.jpg,5EAEA0FA953142FF9927B912C360971D
2023-04-28T05:33:50.000Z,Hurjat euromäärät julki – Esko Seppänen paljastaa podcastinsa salaisuuden,Esko Seppänen on luonut Urheilucastistaan toimivan tuotteen.,https://img.ilcdn.fi/LgkNuDPgCD1bHwrRdr2sUr2TZ4U=/0x64:3000x1937/510x318/top/img-s3.ilcdn.fi/22d02e8eae379cffe0d47b68a09f313a0bfe1bb0882b1674aede7c3a3dabe05f.jpg,0429B831BBE44FE9B5B4A7CDF461C14A
2023-04-28T06:00:03.000Z,Pizza ananaksella vai ilman? Suomalaisten ikuisuuskysymykseen saadaan tänään tv:ssä vastaus,Vastauksen suomalaiskatsojille toimittaa Italiassa reissaava Köpi Kallio.,https://img.ilcdn.fi/6OMyp00VSFMZiHOb_Za3gubWplQ=/510x318/top/img-s3.ilcdn.fi/6c5b46960bc81e04d7150c5530faf39078ea6cd11ccd0ac3e5009e3bbdf4548c.jpg,367ED2ABFF0E40D98AD7AB1F16CB45DF
2023-04-28T06:08:43.000Z,Ensimmäinen playoff-sarja katkesi – Saako Leijonat tutun vahvistuksen?,Golden Knights kaatoi Jetsin osumin 4–1.,https://img.ilcdn.fi/yczDoWWeTKtyxVOszO3ArEI-IgY=/0x64:3000x1937/510x318/top/img-s3.ilcdn.fi/e029b6de98feb449499d43800e4054ad0cce2670a2d9dbfb2b7841b18628aa31.jpg,FC6869FDC9C34E20821D8CCA22BC5EE4
2023-04-28T06:22:12.000Z,Suomen hallituspohja nousi otsikoihin maailmalla – ”Laitaoikeisto neuvottelee liittymisestä”,Maailmalla kiinnostuttiin Suomen mahdollisesta uudesta hallituskokoonpanosta.,https://img.ilcdn.fi/9JgfPA2oIX0HIJVcnfG6zAJNGsk=/510x318/top/img-s3.ilcdn.fi/71a70afd6df0479a325c9fa1bcd41e821d05371d32ab5d86a9aa186f384ca868.jpg,50CC9484A88544F0988FD7EB4684661E
2023-04-28T06:24:49.000Z,Samat ruuat jääkaapissa paljastivat tilanteen – Näin muistisairauden merkit paljastuivat,"Äiti ei enää osannut käyttää kahvinkeitintä, isän työkaverit paikkailivat työn jälkeä, mummolta katosi empatiakyky. Muistisairaus ei välttämättä alussa oireile varsinaisina muistivaikeuksina. ",https://img.ilcdn.fi/fZ-T2ypUeBX85tOsRAPzvUR84n0=/510x318/top/img-s3.ilcdn.fi/a4927ab687dd44afaa647857bc94c55f6190a7520aede68b1c9933221a9f4b35.jpg,02A16C093E6F42989CCE47EF9B201F2E
2023-04-28T06:26:32.000Z,Oikealla vastauksella olisi voittanut 5000 euroa Haluatko miljonääriksi? -sarjassa: Osaisitko vastata tähän kysymykseen?,Haluatko miljonääriksi? -ohjelmassa arvuuteltiin torstaina muun muassa Top Gun -aiheisella kysymyksellä.,https://img.ilcdn.fi/S8ANSKg7XW7b8siOvHt742SpaVk=/510x318/top/img-s3.ilcdn.fi/ccdce33e59209e249dbea527c73e5d42ce53683971b447a2e80f114e5a84abd6.jpg,8E381120BF3C4A01ADC4C776E77BAA7E
2023-04-28T06:46:13.000Z,Kauniaisten epäilty jatkaa pakoaan – Tämä tapauksesta tiedetään nyt,Tekijä on ollut nyt viikon kadoksissa.,https://img.ilcdn.fi/BrVIeZI-MBk3xpWrD1UhsN3lVvg=/510x318/top/img-s3.ilcdn.fi/58acba73e46217713a7d8afeee373137f1dea906eb45f92b288413bd35abcf50.jpg,9218A52048AF4916966708D869AA88AD
2023-04-28T06:51:05.000Z,Antti Törmänen lähti syöpähoitoihin Sveitsin finaalin jälkeen ,Geneve-Servette voitti Sveitsin mestaruuden. Hopeajoukkueen päävalmentaja Antti Törmänen lähti kemoterapiaan.,https://img.ilcdn.fi/Kuw13TvgTzlDg6CTvfKivdv0s5c=/510x318/top/img-s3.ilcdn.fi/ab355bb67134aaf03e2d22f4e9f43b84c30565f9ff89b3601a2b58d8f30dcecc.jpg,238D04D0F7804A7CB5097E2F32C4D919
2023-04-28T07:04:43.000Z,USA:n asevoimien helikopterit törmäsivät ilmassa – Kolme kuoli,Tapaus on jo neljäs laatuaan lyhyen ajan sisällä.,https://img.ilcdn.fi/d_rBcVooNh7W8_A1xR59c2f66Xo=/510x318/top/img-s3.ilcdn.fi/15c880cb03136c0a83be6267ef58c0d87da0c76b3f0726cab8d175992894a8f5.jpg,9B6AB170664C4D2F96B337EE784F952D
2023-04-28T07:14:03.000Z,Janni Hussi paljastaa: ”Häät kesällä”,Janni Hussi menee naimisiin kumppaninsa Joel Harkimon kanssa.,https://img.ilcdn.fi/3nbftHV5CRgXJ1pwU2AsGwlCMx4=/510x318/top/img-s3.ilcdn.fi/1451030caab932710cb9ea01aa2238a7c8265448dc6cc3140f19ca71fe625010.jpg,49305CBA27A44024B34FE71AE0FCEA62
2023-04-28T07:21:46.000Z,Veitsimies hyökkäsi Haartmanin sairaalassa Helsingissä – Hus ei hälyttänyt poliisia,Sekava potilas sai leipäveitsen haltuunsa henkilökunnan taukotiloista.,https://img.ilcdn.fi/4d87nGLaj399zEXeid53Y3e5p18=/510x318/top/img-s3.ilcdn.fi/74355c2bcd1a15d30d393deec25c64f55f8816834feca498e77d54daa549f29b.jpg,899B6F00B6624EA284F7199864A3590F
2023-04-28T07:27:03.000Z,Ääri-islamfani tuomittiin terrorismirikoksesta,Tuomittu myönsi kiinnostuneensa ääri-islamismista.,https://img.ilcdn.fi/gpJQWpsPcCKrkXfT2UotxQNzlEI=/510x318/top/img-s3.ilcdn.fi/5e870634904a22d4b1a1c292524922159d5f8d4d54e0ff4608796b20555d1b7f.jpg,CE9FDF5C5DBD4F8CAB192D240A6C09B3
2023-04-28T07:29:57.000Z,Toimittaja töni katsojaa suorassa lähetyksessä – Näin Yle vastaa,Jussi Saarinen tuuppasi lähelleen tulleen katsojan sivuun kesken tv-lähetyksen.,https://img.ilcdn.fi/j1dVftYST4kGgUA7yngF7fwJ-fk=/510x318/top/img-s3.ilcdn.fi/9de3377f6e15fe0b77f62bd674178c10a7f9087598e6736e444b4bd260438cac.jpg,15C6D7A01B3944D2A5825D18F3933408
2023-04-28T07:46:00.000Z,Nuorena kuollut muusikko Teemu Ruokoski esitti yhden toiveen juuri ennen tragediaa – Nyt toive toteutui,Remix-yhtye julkaisi perjantaina Teemu Ruokosken viimeiseksi sävellykseksi ja sanoitukseksi jääneen kappaleen.,https://img.ilcdn.fi/rzZBB0tlV2M2wyyrzvZBWX900Bk=/510x318/top/img-s3.ilcdn.fi/b4dd9789e6f7183c130a0526e7b289a164b47dec7e3cc4b8a772db07ffe3cb27.jpg,123E2309D9F147899D44769524E23A85
2023-04-28T07:47:16.000Z,Tältä näyttää Hakaniemen uudistetussa kauppahallissa,Hakaniemen halli avasi ovensa viiden vuoden remontin jälkeen.,https://img.ilcdn.fi/TFHfLMyG2JvSCti6b4ZFsPF-fzU=/510x318/top/img-s3.ilcdn.fi/efb817e4f4435d3627db1a81f863d60ad46074199233eb7e8485eb839bf3da3a.jpg,59ADBD5CEC6C46D69EC06730B3EF26A9
2023-04-28T07:55:03.000Z,Ilves kaappasi olympiavoittajan,Jääkiekkoilija Niklas Friman pelaa Iltalehden tietojen mukaan ensi kaudella Tampereen Ilveksessä.,https://img.ilcdn.fi/n8nMCBITCgd3ujUg3obqNJfpfs4=/510x318/top/img-s3.ilcdn.fi/d5e2a0763318d87149c979fa23b7e1feec18d80fc4a66e2e1daf51847108f926.jpg,D0F690F6B32C4C578496FE02C7B42E8A
2023-04-28T08:12:44.000Z,"Autoala: Polttoaineita ei saa yliverottaa, Suomen mentävä kilometripohjaiseen verotukseen","Autotuojien toimitusjohtaja Tero Kallio sanoo, että Suomen on siirryttävä polttoainepohjaisesta verotuksesta kilometriverotukseen. Uhkana on liikenteen verotulojen romahdus ja se, että kovin isku kohdistuu pienituloisille ja ammattiliikenteelle.",https://img.ilcdn.fi/3ATo9ys8ESf6vpIvd8hSqu1cg9o=/0x64:3000x1937/510x318/top/img-s3.ilcdn.fi/ae8c75df759fcbf02aeb15cc6bb263dac627bfb74c69ddf76759de0adbde7d69.jpg,5657AF37DF9047C1842B5823307514CA
2023-04-28T08:15:20.000Z,Venäjän panssarijoukkojen eversti vangittiin,"Venäläiseverstin epäillään kuuluneen ryhmään, joka varasti kuukausien ajan panssarivaunujen moottoreita suoraan tehtaalta.",https://img.ilcdn.fi/4eU_cWJYONoPjUy0agH1Yf2m4zQ=/510x318/top/img-s3.ilcdn.fi/3f8fe7872ee33dc724d2d33f2392c9115c44bd556d84d98d1d7b788613ebb424.jpg,08101877ED834FA8A4C4AD6B2BE554E0
2023-04-28T08:37:31.000Z,Tappara-tähti siirtyy Sveitsiin,Torstaina uransa ensimmäisen Suomen mestaruuden voittanut Niko Ojamäki on siirtymässä Sveitsin liigaan.,https://img.ilcdn.fi/7u4Gc-uQoBeB-uGdpZrGk0bI91U=/510x318/top/img-s3.ilcdn.fi/2bc033dd7116e0d68001be31f9660204a79ebce891ac7cb44dd2dea14cbe5d89.jpg,A5CBEA1DEF204D588EA7E105CDC980CC
2023-04-28T08:44:14.000Z,Perunasalaatti vaatii juuri oikeanlaiset perunat – Vapun paras ohje,"Jos perunasalaatin valmistaa itse ja kruunaa salaatin äyriäisillä, on tarjolla mahtava vappuherkku.",https://img.ilcdn.fi/qpbBwX1yKLmQS98qgHbMYQEImRs=/510x318/top/img-s3.ilcdn.fi/6e99d1e952fdc130fc9a2632784470765bf42e8520ce75787801bb9eb9587fcb.jpg,483BC0BD4C564C8E82B16DB775591760
2023-04-28T08:47:23.000Z,Akseli Herlevistä eronnut Emmi Suuronen kertoo: Tällaista elämää hän elää sinkkuna,Emmi Suuronen on ollut muutaman kuukauden ajan sinkku.,https://img.ilcdn.fi/ZpVppvOLkivOa-hamiLmfvBanIw=/510x318/top/img-s3.ilcdn.fi/71cdc3f3960e705788770df95b0f678e71893c1f9934f379bf2dda2f3e9dbbef.jpg,686EEF4D3C4246168EA0AAC0EB196822
2023-04-28T08:53:24.000Z,Näin mies pääsee karvoistaan ,"Miesten sokeroinnin suosio kasvaa. ”Kalustailisti” Eveliina Rosenström kertoo ja kuvat näyttävät, millaista miesten brasilialainen sokerointi on. Se voi parhaimmillaan auttaa oman kehon hyväksymisessä ja kohentaa itsetuntoa. Ari, 40, on käynyt sokeroinnissa kolmisen vuotta. ”Seksikin tuntuu paremmalta”, on yksi perustelu. ",https://img.ilcdn.fi/PlCH2fewaW-VrsytQZ2JkiKPGHM=/510x318/top/img-s3.ilcdn.fi/0ad120f4ddb9d65ed8a3e08977fd8edb413cc6c384d2da52396a36444c7dc68e.jpg,2FC31E5E9182474D8C60950393E5E8DE
2023-04-28T08:55:14.000Z,Artisti Stigin yllätyspäätös: Jää julkaisutauolle – Avautui ratkaisustaan Suomipopilla,Julkaisutauon lisäksi luvassa on pari tuumailutaukoa.,https://img.ilcdn.fi/Bu-ZQsoHC5l_tZVKLBUOdGjYukw=/510x318/top/img-s3.ilcdn.fi/6839416b0f2ee8024d82f09d84c26220d70f326a8100d8312c03d5361e2d79a5.jpg,50A4D0B29F87482FB10DBC1A204659BB
2023-04-28T09:08:11.000Z,Mellunmäen kauhukortteli aidattiin,Mellunmäen purkutalot ovat rauhoittuneet aitauksen ja vartioinnin myötä.,https://img.ilcdn.fi/Qlf7tpW4OSPDKjfoitpncoRDSeU=/510x318/top/img-s3.ilcdn.fi/a7d5bc7c1a18265cdb80523fed429c295104a1762fd0f954b17d8287e636b2f4.jpg,4CAE11F5E0444EA1B80566FD063C7F7D
2023-04-28T09:16:54.000Z,Qatar sai jälleen yhdet jättikisat – Suomalaislegenda tyrmistyi: ”En pysty käsittämään”,Shawn Huff järkyttyi Qatarin kisaisännyydestä. ,https://img.ilcdn.fi/yRRb1QxF4hGC3rjrOWXQdVYTB84=/510x318/top/img-s3.ilcdn.fi/6bcc2b6677cc17cd7c95d455f3a5d36e2c4af078c59e83b71e4c209e148f40a4.jpg,6D0154AA4FB040C39CCC0B652B197259
2023-04-28T09:21:03.000Z,Mies esitteli valtavaa pytoniaan ravintolan asiakkaille Romaniassa,Mies herätti valtaisasti huomiota käärmeensä kanssa ravintolassa.,https://img.ilcdn.fi/DoMwtL3Vw0k1VF9HBIpJMGHmFDM=/510x318/top/img-s3.ilcdn.fi/74123e0a17ab903cbd5f7cd4077f3088d7c578fba6750231f8d0a393a94e28b4.jpg,2E884A9D853D49ED934B95FA0D721F54
2023-04-28T09:25:03.000Z,Ville Rannan pilapiirros: Vasemmiston vappurieha 2023,Ville Rannan pilapiirros 28.4.2023.,https://img.ilcdn.fi/19BRarKA0DLmOFtOIJebf2JYevg=/510x318/top/img-s3.ilcdn.fi/4d64325db2efbded9282373ac2440295b9654c3eb5ae42ab51a889138960cf85.jpg,1468A687A62848F2B519CB5EB0BEC797
2023-04-28T09:30:45.000Z,Charles saa kruunajaisiinsa yllätyspaketin Suomesta!,Fazer muistaa kuningas Charlesia perinteisillä kruunajaismarmeladeilla.,https://img.ilcdn.fi/bgiTIJR0a4n5c92BziLUv-adjAU=/510x318/top/img-s3.ilcdn.fi/fe16c10da17ddb910003f92b4ae825572e55a640c90e5967d100baacccbbd5e6.jpg,212406D1000942F1B38AA7261E2735E5
2023-04-28T09:40:16.000Z,Varo tällaista puhelua! Inhottava huijaustapa on palannut,Vuosia liikkeellä ollut huijauspuhelu yleistyy taas Suomessa. Usein huijari väittää soittavansa Microsoftilta tai Amazonilta. ,https://img.ilcdn.fi/JThyD0_tCEOh-aq-QQ6UcECikU8=/510x318/top/img-s3.ilcdn.fi/2973f4fb2f754b8eeb8302759200e7f07ee071a9f4b08a6034df7955716e2048.jpg,2E4A9ADAA76849788C94A45B3A3ED225
