paivamaara,otsikko,tiivistelma,kuva,id
2020-03-04T18:29:01.000Z,Hallitusviisikon Anderssonilta mullistavat esitykset: syrjäseuduille matalampi tuloverotus hyvityksenä bensaveron nostosta - työsuhdeautoiksi vain täyssähkö- ja kaasuautoja,"Li Anderssonin mukaan hallitus voisi kompensoida haja-asutusalueiden pienten kuntien asukkaille taloudelliset menetykset, jotka seuraisivat mahdollisista liikennepolttoaineiden ja lämmitysöljyn veronkorotuksista.",https://img.ilcdn.fi/ikKg4XNjnmCsrx5hMhuaQdGWfXo=/510x318/top/img-s3.ilcdn.fi/a239fcf0efcba1166ee40feafb63d6deb20abc9ee3c02d54a69d5172cea75b58.jpg,8EEE96A0905B4858ABE10D4F478E2FBB
2020-03-04T18:31:00.000Z,Myrsky jatkaa riehumista huomenna erityisesti Itä- ja Pohjois-Suomessa – lunta jopa 20 senttiä,"Tuulet ovat tyyntyneet keskiviikkoillaksi kurjan myräkän jäljiltä, mutta tilanne ei ole vielä täysin ohi.",https://img.ilcdn.fi/RoBaeL-JwNHQAhdfgayiXW9Stn8=/339x46:2464x1384/510x318/top/img-s3.ilcdn.fi/45fc4fbd128fc8acc296e87a86ad91495f7903f272ea3a778164794b56825d15.jpeg,295E4ACE9F474CE59245D96AD343ECE9
2020-03-04T18:40:29.000Z,"MM-kisojen peruuntuminen olisi paha takaisku Suomelle – Jukka Jalonen vakuuttunut iskukyvystä: ""Mulla on sellainen kutina""",Sveitsissä 8.–24. toukokuuta pelattavien jääkiekon MM-kisojen kohtalo on koronaviruksen takia vaakalaudalla.,https://img.ilcdn.fi/WZtiB8UIg8EIXOLs4Oy0_ZpM7Uc=/510x318/top/img-s3.ilcdn.fi/039d62b48d85a4c3c518e631f5a8061fdd9f0db3996196849d58dec412849a0d.jpg,14C59B5C6B56453A8ACE1472F43C2593
2020-03-04T18:42:17.000Z,Perheen lomareissu päättyi naisen hakkaamiseen  – taksikuski pelasti tilanteen,Pahoinpitelystä epäilty mies pakeni lopulta paikalta ja jätti muun seurueen taksiin.,https://img.ilcdn.fi/oJNLyqOd5CAe-B0WtdVNPmxsmT4=/510x318/top/img-s3.ilcdn.fi/d60c80c3d32ecc33fd47b41c97c1dee7d99077f3c6e699277ec9e20a54134647.jpg,89B7ADFC0D1245FCBC531B6F233ACB19
2020-03-04T18:48:10.000Z,Kourtney ja Kim Kardashian pukeutuivat lateksiasuihin – tältä samat lookit näyttävät catwalkilla,Huippumuotitalo Balmainin ensi syksyn mallisto on täynnä hittiluomuksia. ,https://img.ilcdn.fi/h2ENaue4nd4vvwiwSIxTdjmJuuk=/510x318/top/img-s3.ilcdn.fi/2f4476a70f3b727bae8e8e2f405146d2f93d4ec07b4566c80511326b21c42e5f.jpg,9F8807956F0A4712989CDF956079720D
2020-03-04T18:59:01.000Z,Näin siivoat uuden koronaviruksen huomioon ottaen – vinkit myös ammattisiivoojille,"Ohjeet kertovat myös, mitä on otettava siivouksessa huomioon niissä tiloissa, jossa tartunnan saanut henkilö on oleskellut.",https://img.ilcdn.fi/1n6iyZQ4Au505ykHGr0X3dqPQ4o=/33x293:3838x2647/510x318/top/img-s3.ilcdn.fi/44beb127d8b1ffad1fb540b65a352e14225c31fe618645f9c95b047e7e58c35b.jpg,8E1209BDC3574353A9D05FC680F989EA
2020-03-04T19:05:44.000Z,Marita Taavitsainen paljastaa erikoisen asumisjärjestelyn 15 vuotta nuoremman Pasi-rakkaansa kanssa,Tangokuningatar Marita Taavitsainen aloittaa pian hius- ja kauneusalan yrittäjänä Hyvinkäällä.,https://img.ilcdn.fi/jbRdlMTHGUYL2QWBDoLQscIifis=/510x318/top/img-s3.ilcdn.fi/e43cdaeaf1ea98b0dbd3adcad84bf4655c2c140ba916f8b0c059f517ff96eabc.jpg,625913BD8966482A892E5BD2391E700F
2020-03-04T19:11:24.000Z,Jääkiekon MM-kisat saatetaan siirtää koronaviruksen takia Venäjälle tai Valko-Venäjälle – ”Emme tietenkään pelaa tyhjille katsomoille”,Päätös kisojen järjestämisestä Sveitsissä tehdään ensi viikolla.,https://img.ilcdn.fi/qXE7QlqB7O5BB_2ncJK3wTiqgxk=/510x318/top/img-s3.ilcdn.fi/f448a3aaabb9e4ac309d33afb5f2a462b0a9a0630ca022eedbb4367706908d05.jpg,4C5397A8193B4209BA1E28930430BCC4
2020-03-04T19:29:06.000Z,"Kansanedustaja poisti pakolaisiin liittyvän Twitter-kyselyn, koska joutui mielestään ”masinoinnin uhriksi”","Kansanedustaja Veikko Vallin (ps) kertoo joutuneensa somekonflikteihin aiemminkin, silloin vastassa olivat harrastusmetsästäjät ja etnonationalistit.",https://img.ilcdn.fi/2NsJi710ujWMURPPT0QyK3wahB4=/510x318/top/img-s3.ilcdn.fi/06b579489b553edb297620fe18e398e123bc7b495c324a2893c828f30ed95c5e.jpg,15E3BC26F7B14643895C8061A12010AB
2020-03-04T19:30:19.000Z,Hyviä uutisia: Lauri Markkanen toipui pelikuntoon – palaa kentälle ensi yönä,Chicago Bulls ajautui synkkään tappioputkeen Lauri Markkasen poissaolon aikana.,https://img.ilcdn.fi/mRpvYpp8xI4x-VJJnIrZ0UvcYf4=/510x318/top/img-s3.ilcdn.fi/41e7aead80194180764f881d4f55006bf552d3ee00661910cb87282fced779c7.jpg,DE752FE495724EFEBF300D1C845A3E25
2020-03-04T19:31:23.000Z,Kohuvalmentajan joukkueella tyly kohtalo: 2–1-johto vaihtui ottelun lopussa 2–4-tappioasemaksi alle kolmessa minuutissa,Dynamo nousi viime hetkien maaleilla voittoon Spartakista.,https://img.ilcdn.fi/pCVX7tJBecHmg9_Fgj6e-LKC04s=/510x318/top/img-s3.ilcdn.fi/1041eabf33d8b80ce46772bec3cb7e4e6d36f1c2f0ae616777a7de8fbf31e844.jpg,51DE6F9B9CD94C80B7ADE1A823143FAB
2020-03-04T19:48:48.000Z,"Koronavirus iski Iphone-tehtaisiin – työntekijöille luvataan bonuksia, jos he tulevat paikalle",Koronavirustapaukset ovat vaikuttaneet Iphone-puhelimien tuotantoon Kiinassa.,https://img.ilcdn.fi/bdShLEekc5pNnxcRTqFnwzmcACQ=/510x318/top/img-s3.ilcdn.fi/2df2bbf5df0fbc22abce1a0dff770f8cebb1dae68d33f09b19d0f4f278f37ea7.jpg,FF6EF3165DFA4A5D9D4A8CD0EFA8B70C
2020-03-04T19:56:01.000Z,Kennelliiton koiratuomarin synkkä salaisuus: kymmeniä kaltoin kohdeltuja koiria – 12 jouduttiin lopettamaan,"Koiratuomarina ja koirien kasvattajana toiminut nainen jätti hoidossaan olleet kymmenet koirat ilman riittävää huolenpitoa, ravintoa ja juotavaa.",https://img.ilcdn.fi/WcwKELWmEOoQ0dbJtEFeJ3VIBD8=/510x318/top/img-s3.ilcdn.fi/e439081c92a71edb348bddb5f66bdf7c6f9b6770bc1d87396e8d90d9cfc4f854.jpg,6F84959CE1E24DE0919DC799E965F9C3
2020-03-04T20:01:16.000Z,Suomalainen rallitoivo saa loistavan näyttöpaikan – ”Joko siitä oli tieto mennyt julki?”,Rallin SM-sarjan kärkikuljettaja Emil Lindholm pääsee ajamaan tällä kaudella neljä EM-osakilpailua rengasvalmistaja MRF:n testikuljettajana.,https://img.ilcdn.fi/B5nVkX6eozKGgVdYXTxPeervWOU=/0x0:3000x1876/510x318/top/img-s3.ilcdn.fi/3806ce5664237c9184d7668a0e01adb2dc054047a7f1afbd2e0724553cdf491f.jpg,64DCE53A7E63490E992CF563A289EACD
2020-03-04T20:04:22.000Z,Suomalaispelaajan luistimen terä naamaan: 90 tikkiä silmäluomeen!,New York Islandersin puolustaja ei menetä näköään.,https://img.ilcdn.fi/CLYT284teAXy5B8nm714lvzTyd8=/510x318/top/img-s3.ilcdn.fi/7358a221ba2ab7976d94f58306ff9c401393f1a59dac97b487281832b55c2d02.jpg,00BB14350FAC4F50A949BB685D738D0E
2020-03-04T20:08:25.000Z,Seksinukkebordelli sai tylyn lopun - näin Antti Kurhisen elämä jatkuu: ”Palasin ajamaan taksia”,"Kannelmäen seksinukkebordelli nostatti ison kohun, mutta paikka suljettiin vajaan vuoden jälkeen. Toiminnalle kasvot antanut Antti Kurhinen ei kadu pestiä paikan isäntänä.",https://img.ilcdn.fi/TzcR0i0GA1DiHgrhg6iMhEiw_NQ=/510x318/top/img-s3.ilcdn.fi/93946ea383a25f6b8b7b4ad80d4adfacb2d7a5510177a7712d9743e3587a1ca4.jpg,BB5C6D335FE84BEEBF5CCB4AAE336603
2020-03-04T20:08:39.000Z,Eläinrakas pariskunta perusti poikkeuksellisen grilliauton Virginiaan – paikka tarjoaa pikaruokaa koirille ,Grilliauto haluaa tarjota terveellistä pikaruokaa koirille. ,https://img.ilcdn.fi/s_FHhR0WC_VdPwcAi_sgbcjr0WI=/510x318/top/img-s3.ilcdn.fi/e28509547efec049ffd43913b24061131832f7bcd447451ce9fe88183399d935.jpg,17CD083CC3FF4DA9A294BC8AE089991D
2020-03-04T20:41:01.000Z,Puheluote paljastaa: myös 112:n väki kyllästyi Noljakan epäillyn ryöstömurhaajan häiriköintiin ,20-vuotias mies oli alueellaan tunnettu häirikkö.,https://img.ilcdn.fi/9Xl54qD6vAT60tMGRkB6h03cKGE=/510x318/top/img-s3.ilcdn.fi/f64c27d9ac1ddfb17073efbdd103be2c5edbb43276e223056b6bba91b9f6ac74.jpg,F0A6D1C7C6F944E5A51F7700832B9527
2020-03-04T20:41:22.000Z,Räikkönen statistina Netflixin F1-sarjassa: Kimi yllättää vasta loppusekunneilla kuolemattomalla sitaatilla – herkku nousi mainoksiin asti,Netflixin uusi kausi F1-sarjasta voi olla pettymys suomalaisfaneille.,https://img.ilcdn.fi/Q54NVmOVJb2ekk2gYpQbiExN_1s=/510x318/top/img-s3.ilcdn.fi/7985356c6f3363a6bf20c19d43ceb2ed928da6aec1b32097d07679cc03a7f2f5.jpg,E7655A3F931048E9917B2A78ACCA4564
2020-03-04T20:50:54.000Z,Helsinki aikoo myydä Sähkötalon – ei julkista hinta-arviota,Helsingin strategia luopua keskustassa sijaitsevista kiinteistöistään etenee.  ,https://img.ilcdn.fi/D9qrFLvMWvWV2fmE_cZ6aGLD7rM=/510x318/top/img-s3.ilcdn.fi/95550db14dcdf2e0b358fa279aa97f964e6ee316f8c7bc54036bdf28877279e5.jpg,8050B5D76C6C4C42A8B62F98E6E6B0CF
2020-03-04T20:53:30.000Z,Entinen NHL-tähti hakkaa karmeita tehoja kaljaliigassa – video kertoo mykistävästä ylivoimasta: ”Yhtäkkiä kiekko oli verkossa”,Jason Pominville on jatkanut kiekkouraansa tällä kaudella buffalolaisessa kaljaliigajoukkueessa.,https://img.ilcdn.fi/Bx9GAc8RkwKChSGOGTBMZRsSMxI=/0x64:3000x1940/510x318/top/img-s3.ilcdn.fi/07d287b49894f581542f8e2f11c8caf0f7b3c8012ab47eb01ed6010278303da5.jpg,552DB68D61884B87B02B33FEC5BFDCEC
2020-03-04T21:32:13.000Z,Genesis tekee paluun!,Brtittiläinen progeyhtye Genesis tekee paluukiertueen.,https://img.ilcdn.fi/6SpN0IhwWsZgDmy1p36qLpbfCBw=/510x318/top/img-s3.ilcdn.fi/9305f4d78cff043eb5ab11719aaa82d8619336cd88c41c445d67a23f8e01b43a.jpg,ACA67E86B61240DD9C7DCD7657CB299F
2020-03-04T21:34:17.000Z,Puutavarayhdistelmä täydessä 76 tonnin lastissa – ratsia paljasti perävaunun jarrujen uskomattoman kunnon,Poliisin tavoittaman tukkirekan perävaunu oli lähes kokonaan vailla jarruja ja valoja.,https://img.ilcdn.fi/wUEUAkDAduxfJkIc_vE_k7zyFHA=/510x318/top/img-s3.ilcdn.fi/52ebd4953aa239bdda5074def4fc9b23f4d3a7a40ef48354ebc628a2e4822ae2.jpg,7420238BAEFB4A4294F7AE6159457D72
2020-03-04T22:25:59.000Z,"Victoria ja David Bechamin esikoinen täytti 21 vuotta - äidiltä vauvakuva, tyttöystävältä pusukuva",Läheiset onnittelevat Brooklyn Beckhamia 21-vuotissyntymäpäivänä.,https://img.ilcdn.fi/Oc27ePEoctc8THnSnMF7RzbbQlE=/0x200:2358x1673/510x318/top/img-s3.ilcdn.fi/7bde1c0423ba2f1962d582248fc4d530c7fc64c9ccbbaed5ae45cecb2cc1c70a.jpg,745F9EA94CC749728B9F105E88B363BE
2020-03-04T22:38:04.000Z,Teemu Pukin Norwich sensaatiomaisesti jatkoon Englannin cupissa – Tottenham kaatui vasta rankkarikisassa,Norwich voitti Tottenhamin Englannin cupin viidennellä kierroksella rankkarikisan jälkeen. ,https://img.ilcdn.fi/KFr8poaluLGPs0lGM76_lHycKhw=/510x318/top/img-s3.ilcdn.fi/ffc88ba856cbe53f82ed542b436ef36ae5487959ccf992f1c4facc28c508556d.jpg,7FCC63557CBE42729DEFA9FD685BE7B4
2020-03-05T00:16:46.000Z,Maajoukkuepelaaja kiipesi katsomoon tappelemaan fanin kanssa – tappio Teemu Pukin Norwichille otti koville,Tottenham–Norwich-ottelun jälkipyykki käydään yksinomaan Eric Dierin tempauksesta. ,https://img.ilcdn.fi/Qk13KSf6UKIxSFXXpm-loGdy8MM=/510x318/top/img-s3.ilcdn.fi/4e16aefcb3f65c432cb098dab2038047fef1299577f0d509c1a57092f2c49ce8.jpg,6B9532767BA34E87A8FB29B3FE506103
2020-03-05T00:53:45.000Z,Kim Kardashian vieraili Valkoisessa talossa – julkaisi kuvan auttamistaan naisvangeista,Kardashian on aiemmin puhunut julkisuudessa muutamien naisvankien vapauttamisen puolesta. ,https://img.ilcdn.fi/BZ82oiKcQh27eR1mL-ldhX7hV54=/510x318/top/img-s3.ilcdn.fi/ca4f729259533b95e742445f8d9d19efcc401dd15203b475c752a0784568abe8.jpg,3FEBABDF8FC34BF4ABCF5B9157179045
2020-03-05T01:41:57.000Z,Koronaviruksen uhreja Kiinassa jo yli 3 000,Kiina ilmoitti torstaina 31 uudesta kuolintapauksesta. ,https://img.ilcdn.fi/okhA9AMXqDAeH1qF3G73h0HPJCE=/510x318/top/img-s3.ilcdn.fi/9dfa62d8dc64a643e54fbc1ed57aef0ff11c47b755f20aab51e08b185e9b67b8.jpg,12D8812562234C86A74BA06F1C2C4E3C
2020-03-05T03:00:18.000Z,Ikuinen marraskuu on kohta ohi: etelän lämpöaalto vyöryy  Suomeen!,Kuun lopussa mitataan jopa yli kymmenen asteen lukemia.,https://img.ilcdn.fi/dOPxDeUjrTkNaTD2BWMYJ4QXsNQ=/510x318/top/img-s3.ilcdn.fi/74834fff4aecf9bd1271b85bc73501794c810a07d7f79fcd3a405f371b2e5cbf.jpg,734EF5057C8840AAA584D1AB8AC003E1
2020-03-05T03:01:30.000Z,Säästä silmiäsi Whatsappin uudella teemalla – näin otat tumman tilan käyttöön,Whatsapp on tuonut vihdoin sovellukseensa tumman tilan.,https://img.ilcdn.fi/pTBVvCyTNvuvPUdAzxvwTreDEm8=/510x318/top/img-s3.ilcdn.fi/3347c61e7e4de8edd83774e37498673075a8ee9162715d3eb6ef69c62e2d996d.jpg,1ED28B9EA924454DAF1FFD11D98D3084
2020-03-05T03:30:39.000Z,Oletko koko ajan stressaantunut? Syy voi olla sympaattisessa hermostossa – näin rauhoitat sen,"Sympaattinen vaihde voi jäädä päälle, vaikka et tarvitse sitä.",https://img.ilcdn.fi/YBb6vnVAZp48oJhrelwnL5L-diU=/510x318/top/img-s3.ilcdn.fi/e2f197d0329abf3e8c23a81de61d6d9f1e6c3d6c0932db40bc388c5bb66a4727.jpg,31DCE09478CE4550B34BD19086BFB5A8
2020-03-05T03:31:27.000Z,"Tarja Smura muistelee, kuinka torppasi seksuaalirikoksista syytetyn Peter Nygårdin kutsut: ”Olin villikko, mutta järki oli päässä!”","Ex-missi, sosionomi Tarja Smura sanoo, että ei toimisi nykyisin sosiaalialalla, jos olisi aikoinaan suostunut Peter Nygårdin kaltaisten rahamiesten houkutuksiin.",https://img.ilcdn.fi/TihtnEkOde2grKose1rZ-94ZV9w=/510x318/top/img-s3.ilcdn.fi/db752b70aae10b71b5b17c5e4c3db3879e8359dab27fb5706d645102056b480e.jpg,B7E6CFD44F7D4907A59860CAF05BE684
2020-03-05T03:55:00.000Z,Missä New Yorkin kaupunginosassa sijaitsee Yankee Stadium?,Iltalehden perinteinen urheiluvisa on myös verkossa. Montako tiedät?,https://img.ilcdn.fi/apvgJYlIcr6LAcT3aqu4K15WI64=/510x318/top/img-s3.ilcdn.fi/aeb23e8226c1df22b8f86e29fdcb14d10675f75e4e2b222443136455fce29b17.jpg,9DEB1334B48349E689F854E04BB7E968
2020-03-05T04:01:51.000Z,"Jättikavallus legendaarisessa munkkikahvilassa paljastui poliisin virittämällä ansalla – omistajalle rikos oli järkytys: ”Tuntuu pahalta, että luotti” ",Legendaarisen Pyynikin näkötornin kahvilan entinen työntekijä varasti ohi kassan yli 300 000 euroa viiden vuoden aikana. ,https://img.ilcdn.fi/dFZ987oYmUOY8SHPlXyIX4S4E8I=/510x318/top/img-s3.ilcdn.fi/fe06a78c1d5d7c2e85cc2db7e394125aeb9e5193afbe41c13ae83b42615c67dd.jpg,9322487F1F4C461EA24C2739BB6F4FBD
2020-03-05T04:15:16.000Z,Karu näky: Legendaarinen kehonrakentaja esitteli surkastuneita lihaksiaan – keho on kokenut todella kovia,Flex Wheeler ei pystynyt käyttämään oikeaa kättään pitkään aikaan.,https://img.ilcdn.fi/ozpk7rIY5hZu5jJyAE6LWXq45RE=/510x318/top/img-s3.ilcdn.fi/64d2753dddc7f8ec21ec92e1401792ea56b7b41efdcbdb641c9d7af70ad9a9f4.jpg,72C813D480694BBC8866260E60E1A684
2020-03-05T04:30:58.000Z,30-vuotias Joel Harkimo on nähnyt elämän karun puolen: ”Läheiseni jäi pahaan huumekoukkuun”,"Torstaina 30 vuotta täyttävä Joel Harkimo on viettänyt turvallisen lapsuuden, mutta nähnyt myöhemmin rankkojakin ihmiskohtaloita.",https://img.ilcdn.fi/w27sIeqv7YZAdbkqPCYkv15WEhQ=/510x318/top/img-s3.ilcdn.fi/9481004748905dcb33ff1213eb4d9d4d94c184d24f6c1bcf1e97a75296d6f698.jpg,BFD4A0186EAB4664BC228E731A53B011
2020-03-05T04:31:20.000Z,Lauri Markkanen palasi pitkältä tauolta tehokkaasti NBA-parketille – Bulls hävisi ,Lauri Markkaselle annettiin 21 minuuttia peliaikaa paluuottelussaan.,https://img.ilcdn.fi/oBF6N8HJqCFQJcjOtqKyIGJFJ70=/0x458:2600x2083/510x318/top/img-s3.ilcdn.fi/b8a227276f9f53a36fcd9e459d71ef2a9ab6815aae0678da3d7ae8920dd66a2d.jpg,38662F5FCA844B37888BA9C2040485BF
2020-03-05T04:43:25.000Z,Amerikkalainen autonomistaja keksi luovan ratkaisun autovarkaiden varalle – ottaisitko itse käyttöön?,Nainen käyttää sprinkleriä suojaamaan autoaan varkailta.,https://img.ilcdn.fi/PZx8Bt0DE5EWChY-BDZ1-ebyH60=/510x318/top/img-s3.ilcdn.fi/c10cdfa6ed2820bbfa0ee3c387f83a415732a4618f7847e71939dc2e568d27ca.jpg,A7393C1EC0AE477EBFA2C306B0EF534A
2020-03-05T04:58:36.000Z,Putin ja Erdogan istuvat neuvottelupöytään – IL esittelee vuosia jatkuneen Syyrian sodan pelurit Assadista Trumpiin,Turkki ja Venäjä ovat luisuneet vaarallisen lähelle aseellista yhteenottoa Idlibin maakunnassa.,https://img.ilcdn.fi/Llnec2s6-QAsO0LrpBK7FkYRan8=/510x318/top/img-s3.ilcdn.fi/47a13cde1a868e58d3651ba675d3942fe877fc66a8d0a27a311459c5d357fc3b.jpg,14E8F35F2D714ACBB335D8B7BB0CE438
2020-03-05T05:01:40.000Z,Maailman paras naisen ohjaama elokuva tänään tv:ssä,Jane Campionin Piano kuuluu naisille omistetun teemakuukauden ohjelmistoon Ylellä. ,https://img.ilcdn.fi/gBFx-PvREO8_MySd5CfYRdmAH7g=/510x318/top/img-s3.ilcdn.fi/306ba452755fee414c87f8eb4c74d7ac4853933b6e4bb4959ed174d60c44375d.png,E52643F8B58945DD88C3D882118DDC88
2020-03-05T05:04:00.000Z,Vanhat silmälasisi voivat muuttaa tansanialaisen elämän – ”Perheenäiti näki lapsensa kasvot ensimmäistä kertaa”,Specsavers vie suomalaisten vanhoja silmälaseja Tansaniaan. Seuraava vapaaehtoismatka sijoittuu syksyyn.,https://img.ilcdn.fi/DB2FIYK73PjCcKgvmO-j2SQl_NU=/510x318/top/img-s3.ilcdn.fi/7662e48a06a8dac436fd0494e7584fe9e1876209d6cd4a8b4a9a28fc57953fca.jpg,3E08568C88354B2699C541FBE088178C
2020-03-05T05:17:00.000Z,"Nainen! Hiiva voikin olla vakavampi sairaus, joka johtaa ärhäkkään syöpään","Moni nainen kuvittelee alapään kutinan olevan sitkeä hiivatulehdus. Kyseessä voi kuitenkin olla krooninen valkojäkäläihottuma, joka voi hoitamattomana aiheuttaa ulkosynnytinten arpeutumista, kuroutumista ja altistaa syövälle.",https://img.ilcdn.fi/rT6Djzvw7-aI_IqBuCLJAPxHJcI=/510x318/top/img-s3.ilcdn.fi/3891d603e74262f100b8c9cb4f4843aa9fa69532fc73ac42d4d16eb8b9d65ec8.jpg,0C8A2BF820BA4953B50DC10262F3A049
2020-03-05T05:22:52.000Z,"Ylen mittaus: Keskusta kovin nousija – PS:n, vihreiden ja vasemmistoliiton kannatus suli","Keskustan kannatus nousi 1,6 %-yksikköä 12,4 prosenttiin.",https://img.ilcdn.fi/Kj_6mjg95Y_8fh2pWBhg_Gt72Qw=/510x318/top/img-s3.ilcdn.fi/9fb6fd8f792d8246a4371087c5151fa2e0f7cf5c1f7369729d17c5d9c58cc268.jpeg,07F39FCF43654B48992D5A0559C1BEA1
2020-03-05T05:32:09.000Z,Prinssi Harry ja herttuatar Meghan lähtevät hovista näyttävästi – BBC näyttää viimeisen työtehtävän suorana,Prinssi Harrylla ja herttuatar Meghanilla koittaa pian uusi elämänvaihe.,https://img.ilcdn.fi/GBvvC5N5QtVAoKDCU21IqlbJZ6Q=/0x268:2161x1619/510x318/top/img-s3.ilcdn.fi/015c61534e965b9fdf0191abfa2c026378cd92218f9c5b446c9cc2e8cffd6497.jpg,FD6B737164FB48C383A2173B33512D92
2020-03-05T05:35:08.000Z,"Tällaisen nelivedon saa 10 000 eurolla – valitsimme 7 mielenkiintoisinta yksilöä, joissa hinta ja laatu kohtaavat",Kymppitonni pätäkkää lompakossa ja neliveto pitäisi saada. Iltalehti katsasti markkinat ja poimi sieltä seitsemän mielenkiintoisinta mallia.,https://img.ilcdn.fi/Yh29C6UBSKsZOSNC9x69EGtabhk=/510x318/top/img-s3.ilcdn.fi/175de775bf205f8917a50680373c47d8568d2dec7e60527ea79712f4d9a9d92e.jpg,F8194615CD1544619744A66B10162D26
2020-03-05T05:35:36.000Z,Tuoreet kuvat paljastavat: Robert Helenius saapui huippukunnossa median eteen New Yorkissa – vedonlyöntifirmoilla karu arvio,Robert Helenius ja Adam Kownacki kohtaavat sunnuntain vastaisena yönä.,https://img.ilcdn.fi/GHMNbJ9BTdbRf7ubjHBrXGM4C7k=/510x318/top/img-s3.ilcdn.fi/879748976e45eaec167e82f5f5d2051f83f93d4f1e2e5128f73518ace5d760e3.jpg,0DC324CEC9C140C1AFB92843683F3967
2020-03-05T05:55:13.000Z,Kultaleijonan 10 vuoden odotus päättyi – Jani Hakanpää debytoi viimein NHL:ssä,Jani Hakanpää pääsi juhlimaan voittoa ensimmäisessä NHL-pelissään.,https://img.ilcdn.fi/itgEkdShIJN6HL8coJpDYTnFzmM=/910x91:2321x975/510x318/top/img-s3.ilcdn.fi/7fe3abb0f320e22fe2407df030db4e0a25d9e4aad871bcbb8723f0e8263a679e.jpg,6EE4634360194388A56DDC8D83AC9B5D
2020-03-05T05:59:54.000Z,"Näin Niko Ranta-aho ja Sofia Belórf pitivät silmäpeliä oikeudessa - IL-TV:n studio kertoo, mitä salissa on koettu","Torstaina käsiteltiin edelleen syytekohtia, jotka liittyvät törkeisiin dopingrikoksiin.",https://img.ilcdn.fi/pOsoVfvwJ3Uh_fXNZQYpDzYoIKQ=/510x318/top/img-s3.ilcdn.fi/8e6dd22df121f71d0ed9718ac48d56737cc1593456314bca2cd72f0216386329.jpg,69FFD01356E74B0FBF111C83913866EF
2020-03-05T06:00:00.000Z,"Päivi Räsänen tyrmistyi, kun kirkon johto arvosteli häntä: ""Se on kyllä aika rajusti sanottu”",Päivi Räsäsen homovastaiset kirjoitukset saivat piispa Teemu Laajasalonkin ärähtämään.,https://img.ilcdn.fi/xZdoZ7fu2o411f_z35l0Vo1OiWw=/510x318/top/img-s3.ilcdn.fi/883ca2e7aecad129103226b624d730d184f5332f5e8698184ddd0075bd131522.jpg,F54333BDAD2745668870EE9FBE779BFB
2020-03-05T06:02:08.000Z,"Jenni Banerjee julkaisi kuvan vastasyntyneestä lapsestaan – fanit hehkuttavat: ”Apua, miten suloinen”",Jenni Banerjee julkaisi suloisen kuvan tammikuussa syntyneestä tyttärestään.,https://img.ilcdn.fi/Ku_vh62zTp8aLaInsTlvowzSJyE=/510x318/top/img-s3.ilcdn.fi/757c7c96279c261ef0edfc6e34682434a0095e202ef7a4884d7c86d5e56ac37a.jpg,F561909F0F71443FA089817FAEEB7AF3
2020-03-05T06:26:29.000Z,Tälläkö pitäisi kerrostalo purkaa? Koomisen pieni purkupallo kolautteli kerrostaloa – video naurattaa somessa,"Purkuyritys oli jo toinen, mutta purkupallo ei vieläkään ollut tarpeeksi voimakas.",https://img.ilcdn.fi/m7IFZ2ezIwwrRxor4JWc1sHXPC8=/510x318/top/img-s3.ilcdn.fi/5f01d574e602d8d13558bbee7a72dd8dcb0965beefbd1974ff1402efb0bfa695.png,390932A0D6F44C30890B17DE7158B1A0
2020-03-05T06:31:40.000Z,Ei näin! Vanhempi voi pahentaa lapsen nirsoilua - 6 vinkkiä toimia toisin,"Lasten ravitsemuskasvattajana työskennellyt ravitsemusasiantuntija kertoo, miten vanhemmat voivat helpottaa lapsen nirsoilua.",https://img.ilcdn.fi/PcBIC_x7qsrthr3ZaFma-j8we2o=/510x318/top/img-s3.ilcdn.fi/e2ee492eafd321b290449de34a72ceb16dd791ab57691515a48bb7984a2aa549.jpg,D5828707EB9E4A1CA3ABB0174A117223
2020-03-05T06:38:19.000Z,36 vuotta nuorempi rakas jätti Al Pacinon – ex-naisystävä puhuu nyt avoimesti eron syistä: ”Yritin kieltää sen”,"Näyttelijä Al Pacinon entinen naisystävä, häntä 36 vuotta nuorempi Meital Dohan on avannut sanaisen arkkunsa pariskunnan eron syistä, kertoo israelilainen LaIsha-lehti.",https://img.ilcdn.fi/-FoJEV6VCWT6W1V_VSdwXbPTxQs=/510x318/top/img-s3.ilcdn.fi/d965758b0b6d89bb4ca015948e153a122896abef8096cd01998b0a49093ff25f.jpg,0ED09843D3CE45D1A04C7D1A588A58E5
2020-03-05T06:49:36.000Z,Janita Lukkarinen tekee kuolemaa instassa ja saa törkyä saattohoitoon – mitä selfie-kulttuuri tekee meille?,"Netissä yhdestä väärästä kommentista tai huonosti asetellusta sanasta voi nykyään mennä maine, työpaikka ja tulevaisuus, kirjoittaa Sanna Ukkola",https://img.ilcdn.fi/yJocjZs3b7lMxjJoT5tzTVhEJrc=/510x318/top/img-s3.ilcdn.fi/95eda75f47c5f2ecf4299866fe8f4d663656c4a4222f0400d10bed07aeec7c5a.jpeg,8B346C0DAFDA482B9040E37F7DC2D67C
2020-03-05T07:13:08.000Z,Tunnistaisitko tätä heppatyttöä? Martina Aitolehti julkaisi nostalgisia nuoruuskuvia,Martina Aitolehti on viihtynyt hevostallilla nuoresta asti.,https://img.ilcdn.fi/mMr89XAHROm5ha56PUTMqiORgRI=/285x15:2061x1128/510x318/top/img-s3.ilcdn.fi/11052d430de945accf14bf23a5ca5a5a3305ae79ecfb3342b05f6e669b810d1b.jpg,50B14B4797094359AB0F8BB9B0AC9BF6
2020-03-05T07:28:47.000Z,Presidentti Niinistön ja sisäministeri Ohisalon Kreikka-lausunnoissa ristiriitaa?,Presidentti Niinistö: Suomi tukee Kreikan linjaa. Ohisalo korostaa ihmisoikeuksia ja muistuttaa kansainvälisistä sopimuksista.,https://img.ilcdn.fi/BN7ez5A5jxB54dOejGE6Zv4UT-8=/510x318/top/img-s3.ilcdn.fi/51bfedc796a293fd377558eea9c19b1b8ffc7a096e6dd24bf69612b6920158ba.jpeg,0B9A3558B78A49D7B342B392D4E5DCF5
2020-03-05T07:30:40.000Z,"Katy Perry, 35, on raskaana - paljasti täysin yllättäen raskausvatsansa musiikkivideolla: ”Enää ei tarvitse kantaa isoa laukkua”","Katy Perry iloitsee somessa siitä, että hänen ei enää tarvitse piilotella raskausvatsaansa.",https://img.ilcdn.fi/HvEFYRT_Z4do7jOo249TDKkzH38=/0x100:1401x976/510x318/top/img-s3.ilcdn.fi/519493174e49aa5b1d59aab7c7bd04a416b50b9644ba8ff13a0fe128f8f7e3ef.jpg,D90E82574CBE4953B4765FB3C68AFD07
2020-03-05T07:31:26.000Z,"Turussa hankittiin saattohoito halvalla, tuli karmea rikosvyyhti – professori: ”Tämä on oire”",Itä-Suomen yliopiston professorin mukaan hankintojen kilpailutuksissa on Suomessa laajoja ongelmia. Esimerkkejä ovat hoivakohu ja nyt paljastunut Turun rikosvyyhti.,https://img.ilcdn.fi/X4oaLoZezRqd09EcfaZqzXrszIQ=/510x318/top/img-s3.ilcdn.fi/dfbaf861dfc941b6b9900b32fa51827701c21dfbe42f307fb15942f2225cce0c.jpg,4F7DA3BD487C47D6801171E70D2A72C0
2020-03-05T07:37:24.000Z,Prinsessa Estellen koulu on suljettu koronatartunnan vuoksi,Prinsessa Estellen koulu on asetettu karanteeniin.,https://img.ilcdn.fi/inyVBcdThIPAsCTqwqXXztQQ0D0=/510x318/top/img-s3.ilcdn.fi/23a8c9b6563ff2b354bc2f213e405e193c4ef472299e2a22c74a242451d5ef8a.jpg,FFE601FDB84F429899413A49D684853B
2020-03-05T07:56:09.000Z,Kuva: Futislegenda Ronaldinholla väärennetty passi – jäi kiinni ja joutui poliisivalvontaan hotelliin,Ronaldinho ja hänen veljensä ovat poliisien valvonnassa paraguaylaisessa hotellissa.,https://img.ilcdn.fi/ACwkMuKjTGS-7zk3dcnnGJELiAI=/510x318/top/img-s3.ilcdn.fi/2ed220b2a6dc0bfe2082eb08f219ab92acc051d9c0d6f0553c708cb179687043.jpg,B1D38DDD6ADA4281BDF548B30D53D150
2020-03-05T08:05:11.000Z,Laura Närhen tähdittämä Kemopetrol-yhtye tekee paluun - ensialbumista 20 vuotta,Kemopetrol esiintyy ensi kesänä kaksilla festareilla.,https://img.ilcdn.fi/HjQcQSasP7v2zgE5-obBTK-SXLM=/510x318/top/img-s3.ilcdn.fi/6da2560d5ac592ce86503e11537c37cb2bd704cc4235fa15fb5bf3ff2162cf01.jpg,2F7EB4EE5CEC4B1B845B2B351C05C347
2020-03-05T08:09:28.000Z,Paula Vesala rakastaa raskaita silmäluomiaan: En koe paineita ulkonäöstäni,"Paula Vesala häikäisee esiintymislavalla näyttävässä meikissä, mutta vapaalla hän luottaa luonnolliseen kauneuteen.",https://img.ilcdn.fi/Gr9PcCe4KaF7e_rxuWi_DVXyYQ4=/510x318/top/img-s3.ilcdn.fi/6ae3753866b850d28ee64f2c8a77446bbda38f16bf1799c70f4c02ae53d0fc40.jpg,1174885DFE1D433688826A19DC89603F
2020-03-05T08:10:07.000Z,Finnair lopettaa lentojen aikaisen tuotemyynnin – taustalla pyrkimys hiilineutraaliuteen,Suunnitelmiin kuuluu esimerkiksi ruokajätteen puolittaminen ja lennonaikaisen tuotemyynnin lopettaminen.,https://img.ilcdn.fi/a9XcDT5f7vQ61Mwzps31d-ogv1w=/510x318/top/img-s3.ilcdn.fi/8ac41a7c3fc4e589a22ae296b4ab1c343ad574d869f799ea7f52459f2cbb848e.jpeg,25334E54F5FC4640B888CB40E1D0C26A
