paivamaara,otsikko,tiivistelma,kuva,id
2022-10-14T09:32:14.000Z,"Ville Rannan pilapiirros: Nyt vedetään jodia! Tervetuloa, ydinsota!",Ville Rannan pilapiirros 14.10.2022.,https://img.ilcdn.fi/TnbIsDdiMgtOD9XU0pbMAfHRcJA=/510x318/top/img-s3.ilcdn.fi/61f774e54ebe78c376c41f98c1bb3617f6e4cfd827d09e0d83f57a28353a6eb0.jpg,9034E46B0E9349708E35203970C8AF2A
2022-10-14T09:40:46.000Z,Yrittäjä Lauri Salovaara joutuu tyytymään 1 500 euron viikkobudjetin sijaan 80 euroon Rikkaat ja rahattomat -sarjassa: ”Tämä vetää hiljaiseksi”,Lauri Salovaaran huikea viikkobudjetti hämmentää Rikkaat ja rahattomat -sarjassa.,https://img.ilcdn.fi/HRngGSOe_foCAuJgOxwUYqkO61s=/510x318/top/img-s3.ilcdn.fi/b829e156bb25552f0e4023e144d1924e149cc0089a1bdebbcbfd16b28e07cc7b.jpg,3AF53D2516704685B5E57B7F52AFC8AB
2022-10-14T09:53:32.000Z,"Kirja: Saksan liittokansleri sai Suomen vierailullaan samppanjat syliin, liian pienet talvihaalarit ja rakovalkean savut silmille","Esko Aho: ”Näky oli huvittava, mutta kasvot oli paras pitää peruslukemilla”.",https://img.ilcdn.fi/J29jR6vbeZ8zLNlXCQG9S2E8En0=/510x318/top/img-s3.ilcdn.fi/667a95d60ddf2fa9c63a3ae8887fc366725d30de87296e0e45fa9d6830e6d705.jpg,B262D822435949E585414FD85DAAA1C3
2022-10-14T10:13:21.000Z,"Pirkka-Pekka Petelius osallistui rahapelaamista säätelevän lain uudistamiseen, ei kertonut Paf-sopimuksestaan valiokunnalle","Vihreiden kansanedustaja Pirkka-Pekka Petelius osallistui eduskunnan sivistysvaliokunnassa rahapelaamista säätelevän arpajaislain uudistamiseen kertomatta, että hänellä on rahakas lisenssisopimus rahapeliyhtiö Pafin kanssa.",https://img.ilcdn.fi/HTf6LV2RIy9hv9BjzFtrAmmbCJ4=/510x318/top/img-s3.ilcdn.fi/78e5c5dc2293cade06fe8b6dd31bfa62696ea64aef7d1e3807553cac65c544cc.jpg,703A9456080240B39034070A79594E12
2022-10-14T10:15:20.000Z,Robert Heleniuksen huippumatsilla suolainen hinta Yhdysvalloissa – näin näet ottelun Suomessa,Robert Helenius ja Deontay Wilder kohtaavat New Yorkissa 16. lokakuuta.,https://img.ilcdn.fi/f3_gYtthcy28gRKZg04-5NVClFU=/510x318/top/img-s3.ilcdn.fi/bbe46130a463d7a46b1c2eb25b38517ba2d1276e8e54b0997dfebf578261836d.jpg,1E6EA6ADFCF346D6A1DA993B4A5119B4
2022-10-14T10:35:54.000Z,"Poliisi: Varo huijausviestejä, joita lähetetään poliisipäällikön nimissä","Poliisi varoittaa huijaussähköposteista, joita lähetetään poliisipäällikön nimissä. ",https://img.ilcdn.fi/TeBnSSY7gEZnODKCSXwEh9bBlGs=/510x318/top/img-s3.ilcdn.fi/14bfecf5cdecd9f70ec0c059a08ccf3bb9029d3ade0afca263ccd66ea7887bb8.jpg,A3CF26AED5D4469C9F23DF4B4459CE19
2022-10-14T10:40:43.000Z,Salkkarit-tähti Johanna Anttila jakoi hellyttävän lapsuuskuvan: ”Tyttöys voi olla poikamaista”,Salkkarit-tähden lapsuuskuva ihastuttaa sosiaalisessa mediassa.,https://img.ilcdn.fi/bAwoUNh4t9JYlTv1aL-MUvssrlE=/510x318/top/img-s3.ilcdn.fi/7bdfb536257f8a6d6eb96be62777fc875df4b4a77d37ca3b4713c4addf35d2c1.jpg,667679D6BD864AC2BD5E29F9B3D9D429
2022-10-14T10:41:11.000Z,Joko tänään onnistuisi? Tapparan vierassaldo on karmivaa luettavaa,Kuka tekee kirvesrintojen kauden ensimmäisen vierasmaalin?,https://img.ilcdn.fi/_swfGcNkuGjdRV_q_lPHDb9ZtCc=/510x318/top/img-s3.ilcdn.fi/3b3fd508332c27836cff35b9ac06d40cabd9c1de5e44062f66803daf0c715f67.jpg,E176F9B66C3A4D129A19928DABF107A3
2022-10-14T10:53:05.000Z,Lähteet: Kulisseissa suunnitellaan Liz Trussin syrjäyttämistä – ollut pääministerinä vasta viisi viikkoa,Brittilehden mukaan konservatiivipuolue kaavailee Trussin korvaamista joko Rishi Sunakilla tai Penny Mordauntilla.,https://img.ilcdn.fi/lrLk2p1wUggX4kJOX4Vl5Jm_vd0=/510x318/top/img-s3.ilcdn.fi/4a0e797d4473f8e7b94924b8929be7e7f771e7202a6db52471c8dfc783cde224.jpg,AC9E29DB2C214D27AB40E6AD13418B70
2022-10-14T11:02:12.000Z,Serkut sekaisin vankilassa – vaimot odottivat autossa,Serkukset olivat tutkintavankeina samassa sellissä.,https://img.ilcdn.fi/-ibxYus6Dh3tDESarkjcX73BXyw=/510x318/top/img-s3.ilcdn.fi/8f6d8e819098a8482af35f2c82aaec617f870f4dd093b50fa14a6840faded2ae.jpg,08B22FB4D498490681FFDCDCEC422730
2022-10-14T11:13:27.000Z,Miksi venäläisten pommikoneiden määrä on lisääntynyt Suomen lähellä? Näin asiantuntija vastaa,"Satelliittikuvat paljastivat hiljattain, että Venäjä on siirtänyt suuria pommikoneita Olenjan lentotukikohtaan lähelle Suomen rajaa.",https://img.ilcdn.fi/nJZN1CuvmEEESBPn8bZPdw_DoqQ=/510x318/top/img-s3.ilcdn.fi/b3283447c74f60bb6258e794cab649db9a598848055fab97f017b9d5f392fcd8.jpg,F98977FEF9EC48C5A038536980DCAB24
2022-10-14T11:20:06.000Z,"Uudenlainen seksilelu sai Tiktokin sekaisin – ”En vitsaile, 4 kertaa 15 minuutissa”",Ruusun muotoinen klitoriskiihotin on noussut ilmiöksi somessa. Tämä siitä kannattaa tietää.,https://img.ilcdn.fi/5-VT_tqgSFMneJEVD175m_qc_MA=/510x318/top/img-s3.ilcdn.fi/f47edb3694f1c09fe64e125a9d6243bbc6f8ef06cab8294f158249b3ca2d1905.jpg,2AE1B4EEB9AB4F2D8747B56614FE5914
2022-10-14T11:23:41.000Z,Teollisuusliitto irtisanoi teknologiateollisuuden työehtosopimukset ,Neuvottelut palkankorotuksista Teknologiateollisuuden työnantajat Ry:n ja Teollisuusliiton välillä ovat päättyneet tuloksettomina.,https://img.ilcdn.fi/Huijzeuqjuou5GmIT6OsKqQXihY=/510x318/top/img-s3.ilcdn.fi/f38d705ab226d42cdb1f35d5793ccbf607afedc60a5dd9220c625784748b0dc2.jpg,D36B802C8C6746FCB590E24C26A40E23
2022-10-14T11:24:43.000Z,Nyt puhuu Pekka Virta: ”Haluan säilyttää jonkun näköisen ylpeyden ja ihmisarvon”,"Pekka Virta kertoo Iltalehdelle avoimesti näkemyksensä siitä, miksi hänen pestinsä SaiPassa katkesi kesken.",https://img.ilcdn.fi/hR56y0hHo7o2c2hopSSg_y849rg=/510x318/top/img-s3.ilcdn.fi/b935af218d035e222def6bdd39da304c29655cff262ca63d313e3c5679c01c79.jpg,DC8E9A99DE7B4FB1AAF582E59762A2FC
2022-10-14T11:26:47.000Z,Politiikan puskaradio: Suomi meni sekaisin joditableteista – STM teki ”harkitun rikoksen”,"Politiikan puskaradiossa puhutaan tällä viikolla Paf-Pirkka-Pekka Peteliuksesta, joditableteista, kiljuvista ministereistä sekä Mikko Kärnän Helsinki-haasteesta.",https://img.ilcdn.fi/mUxu6Xp1PAXKh9NrRA4Tyq2rsGM=/510x318/top/img-s3.ilcdn.fi/35ffc71a79abaf5535194211321d8660af5051bde1a61b6ed6c5a9bea865ce9d.jpg,530E361120754913A5F137BC51C9022E
2022-10-14T11:35:05.000Z,Brittisarja rikkoo ennätyksiä – kuvauksista ennätysmäärä kilpailijoita sairaalaan,Dokumentaarisen brittisarjan uuden julkkisversion kuvaukset ajautuivat kriisin kilpailijoiden jouduttua keskeyttämään tapaturmien vuoksi. ,https://img.ilcdn.fi/VN6qWhNerDMy8ZYgahaEL5m3UEM=/510x318/top/img-s3.ilcdn.fi/8c30b386806fba94a752d7b4e52d9103cc14186abcb48ecec1bdc8423ff78a34.jpg,BDAC7AAC2ED64608BBF0EF0CB9A960D7
2022-10-14T12:20:20.000Z,Pöystiltä Marinille lakoninen muistutus: ”Oikeuskansleri ei arvioi etiikkaa”,"Oikeuskansleri Tuomas Pöysti antoi pääministerille Slush-esiintymisestä kirjallisen kannanoton, jonka ydinsisällön voi tiivistää: ”aattelepa ite”, kirjoittaa politiikan toimittaja Jarno Liski.",https://img.ilcdn.fi/K4zbAYUWxv_GlEGrOy2auw8QfAY=/510x318/top/img-s3.ilcdn.fi/1a6bec508e91bd02b21ac97108a4b9736c60e85fd59b6d9afb39fef627731c02.jpg,4450F26849B64A52A13DB9B237179C51
2022-10-14T12:20:38.000Z,"Tähdet hurahtivat luomiväriin, joka saa silmät säihkymään – katso kuvat","Imarteleva metallinsävyinen meikki, johon valonsäteet osuvat, korostaa silmiä kauniisti.",https://img.ilcdn.fi/tlmKXUiXu96v4ljT95pxbnruccs=/510x318/top/img-s3.ilcdn.fi/a319f093d6f522af22227078220eef8de55492519e6b7e559a4ebda12dcb3f5c.jpg,C91DC8F6E39241BA90C1E40948251843
2022-10-14T12:22:58.000Z,Epäily: Taksissa ammuskeltiin Pirkkalassa,Poliisi epäilee jonkun ampuneen useita laukauksia sisällä taksissa Pirkkalassa eilen illalla. ,https://img.ilcdn.fi/H3ZzdFCHhCvbHhM1yu2UBCr7Mqw=/510x318/top/img-s3.ilcdn.fi/dada06174d767c47bdbb5ad7a0b624a3d5b9a57cdd07815eb3825808bfd028bf.jpg,23C7A603A74F4242BA07A2E6CB546F9C
2022-10-14T12:23:30.000Z,Macron möläytti: Ranska ei vastaisi ydinaseella Venäjän ydinaseiskuun Ukrainassa,"On ääneen lausumaton sopimus, etteivät ydinasevaltiot kerro, missä tilanteessa ydinaseita ollaan valmiita käyttämään.",https://img.ilcdn.fi/j0T2zL2803ZTU6nu_gnTzelBDj0=/510x318/top/img-s3.ilcdn.fi/43833a0a36bf478c04e096ae011ff9a29953cc0017dc5147d457a81217ef7e75.jpeg,2015670442DF400AA88D9236E1F641C9
2022-10-14T12:28:08.000Z,Lahdessa liigaillan kärkimatsi – Pelicans ei ujostele: ”Kyllähän tavoite on voittaa se kilpasarja”,Lahden Pelicans on saanut lentävän lähdön liigakauteen.,https://img.ilcdn.fi/0a4AdoxUxwEg03ndwmNjcL_NNSc=/510x318/top/img-s3.ilcdn.fi/7cdd74253a045053a9cb1273adaad8eb43fdf58d201b5ad32ada97ce5e65bf5f.jpg,D1015DCB44F048ABBF32EB86E4F28F6F
2022-10-14T12:37:23.000Z,Lauri Tähkän kotiparturointi meni pahasti pieleen – katso kuva koomisesta lopputuloksesta,Laulajatähden uusi kampaus huvittaa faneja.,https://img.ilcdn.fi/79sXzK_4SZvyDn6wlPWJAtHXTrs=/510x318/top/img-s3.ilcdn.fi/d04ec1a6f1943bfc87528b976d8cc5299c13b258be801c0b56dd13468462446f.jpg,BCE1E2284C3E43538589C1B3783B3B23
2022-10-14T12:54:56.000Z,THL:n uudet ohjeet – seuraavan koronarokotteesi aika voi olla jo nyt: tarkista heti! ,Seuraavaan koronarokotusannoksen voi saada jo kolmen kuukauden kuluttua edellisestä.,https://img.ilcdn.fi/8wx2Bx6VF-dvmdTX5v2pD61R6nM=/0x38:2776x1773/510x318/top/img-s3.ilcdn.fi/8361afa211c3dfc71aa73360766fd39197040043de92b9ec0b0cf8adb4a59b9f.jpg,9501023DBD7B437BBEE2AF5FFD33BF66
2022-10-14T13:14:45.000Z,Asiantuntijalta tärkeä muistutus Robert Heleniuksen äärimmäisestä lihansyönnistä – numerot vetävät hiljaiseksi ,"Jaakko Dahlbacka uskoo, että kaksikko Helenius–Lindström on kokeillut kaikenlaisia jippoja, joilla nyrkkeilijän kropasta saadaan tehot irti.",https://img.ilcdn.fi/f3_gYtthcy28gRKZg04-5NVClFU=/510x318/top/img-s3.ilcdn.fi/bbe46130a463d7a46b1c2eb25b38517ba2d1276e8e54b0997dfebf578261836d.jpg,81FF252A5D944F96861CADC813F96FC2
2022-10-14T13:16:38.000Z,Sami Hedbergiltä jättiyllätys: perusti poikabändin,Sami Hedberg ja neljä muuta suomalaista viihdetaiteilijaa alkavat esiintyä El Quattro -kokoonpanolla.,https://img.ilcdn.fi/MsP6LqLdW1YtRlHK6PAwWAILNe0=/510x318/top/img-s3.ilcdn.fi/85c9fa2b4e833afe3eec4d8f67ecd45ad3b1df52b47d42303f0e4eeff9d8dcb4.jpg,E3A30989370949E0BA931BAEA32C6C19
2022-10-14T13:26:38.000Z,Oikeusoppinut Peteliuksen Paf-kytkystä: rima kansanedustajan jääviydelle ”erittäin korkea”,"Eduskunnan puhemies Matti Vanhanen (kesk) ja valtiosääntöoikeuden asiantuntija Pauli Rautiainen arvioivat, että kansanedustaja Pirkka-Pekka Petelius (vihr) ei ole ollut jäävi käsittelemään rahapelilakia. Petelius sai samaan aikaan rahapeliyhtiö Pafilta noin 60 000 euroa vuodesssa.",https://img.ilcdn.fi/MfglJxEDLINNrPpO1Mj-ytjPBCo=/510x318/top/img-s3.ilcdn.fi/6637a6e0d7287a2ba762e3e1e7760cecf1e60b688131539eff36902024795892.jpg,7C894B8A34C6464B91BF1D3BC05420E3
2022-10-14T13:46:39.000Z,”Hartwall-areenan” kauppa on lähellä – ”Tallentanut rahasumman”,Kauppaan pitää tulla siunaus muun muassa Suomen ulkoministeriöltä sekä Yhdysvalloilta.,https://img.ilcdn.fi/HJArisaPRuhYYl9wyJbI7S_qYZU=/510x318/top/img-s3.ilcdn.fi/c9eef009b69b9913df1db338b723d1a5b8ece63f8e434bf27388494c137b5500.jpg,D72417130FE44E4ABEE8A4A974B634D6
2022-10-14T13:53:58.000Z,Elokapina aikoo taas Mannerhemintielle – ”Merkittävää ja pitkäaikaista liikennehaittaa”,Elokapina osoittaa mieltään syyskampanjansa viimeisenä päivänä Helsingin keskustassa.,https://img.ilcdn.fi/OfHY9xSPq5cmFZZ7TJFdQCGpTAE=/510x318/top/img-s3.ilcdn.fi/5cc697de20258f3ab34780d4c5e852d3c899abec49d113adfb19ebc3c5bcc4fc.jpg,0AD8B15319EE40F78D086C985F751E53
2022-10-14T13:59:34.000Z,"15-vuotias iski toista oppilasta saksilla neljästi – myös kouluavustajalle vakavat vammat, ei rangaistusta",Länsi-Uusimaan käräjäoikeus on tuominnut nykyään 16-vuotiaan espoolaispojan kahdesta törkeästä pahoinpitelystä.,https://img.ilcdn.fi/qigz0Z5YSHRpyHyN9lkjQVUHirQ=/510x318/top/img-s3.ilcdn.fi/baa2a5aede1792b68ca407e52167339330922b95934416fb277957ed13ccbf07.jpg,6199A6A8F98A4A658B7C51E8CB07FA11
2022-10-14T14:01:12.000Z,Aktivistit sotkivat keitolla van Goghin arvotaulun – arvo yli 84 miljoonaa dollaria,Ympäristöaktivistit heittivät maalauksen päälle kaksi tölkkiä Heinzin tomaattikeittoa.,https://img.ilcdn.fi/xDrTppMb5_CsECKr7GnSK0uJOQw=/510x318/top/img-s3.ilcdn.fi/97dc278bc7604da07f3f50a908a64064cd8eeaac0b253bf87cedffc5463ca725.jpg,2408CABABE6849D69AB84391107977B7
2022-10-14T14:07:13.000Z,HS: Slush vaihtaa Sanna Marinin haastattelijan,"Uutta haastattelijaa etsitään, kertoo Helsingin Sanomat.",https://img.ilcdn.fi/uDXvfb7SGPc9uirRMd2qjHEKCUU=/510x318/top/img-s3.ilcdn.fi/59516ebe8217d870bace56cfae55ab6f618c4a37ca6a4616ba153985db8c7976.jpg,EA876504E17D4C718EA601E1F7C9BB6F
2022-10-14T14:17:09.000Z,Mikko Töyssy on ammatiltaan myös liikunnanohjaaja – ja Punttikomediassa kovakalloinen bodari ,Näyttelijä Mikko Töyssy tähdittää uutta Punttikomedia-elokuvaa yhdessä Iina Kuustosen kanssa. ,https://img.ilcdn.fi/sAwJje3XEbzoManYHsZ08-1O6gA=/510x318/top/img-s3.ilcdn.fi/1837181ef6eecd5407c4f1a8150109b4013030c155d1417fc2c2d9b4c89716ee.jpg,B9D6FBE51CB2434DAAD9DD577756C761
2022-10-14T14:29:03.000Z,"Brittilehden suora lähetys: kumpi kestää pidempään, salaatti vai Liz Truss?",Britannian tuoreen pääministerin päivien toimistossa uskotaan olevan luetut ennätysajassa ja jopa jäävuorisalaatin uskotaan kestävän Liz Trussia pidempään. ,https://img.ilcdn.fi/U_Go8q3Bx3EVlpRM5qzo9d8f8Xo=/510x318/top/img-s3.ilcdn.fi/aadb7f9a78dae4cae68805d7d274b70a6ae08a524c2c1ed226096d6fce89f83b.jpg,B1EBB8FF6C8C41FFAB058D4FE0806DC2
2022-10-14T14:41:04.000Z,Härskejä suomalaisia paikannimiä – oletko jo bongannut nämä kohteet?,Lähtisitkö kierrokselle kummallisten paikannimien perään?,https://img.ilcdn.fi/cXBGivctk0XWk5iBtIy_hM-YwaY=/510x318/top/img-s3.ilcdn.fi/ae1e9fb6c5e6a2a02591fa0d3b1972030e95ed2b08490f20fa0804de87c9dcf2.jpg,EEB75F2DCF5C4EE4AA561CF872FBA888
2022-10-14T15:05:45.000Z,Kiihottavat kuvitelmat,"Seksuaaliterapeutti kehottaa ihan jokaista tutustumaan seksifantasioihin. Se vaatii uskallusta, mutta kannattaa, sillä  luvassa on todennäköisesti parempaa seksiä.",https://img.ilcdn.fi/YSegH1rkJtXzOob4NSEmeFq3ZKc=/510x318/top/img-s3.ilcdn.fi/b591a7f351be9c709bbbc21641c1a4ad6c5e81b983a5d72ebbbcdcabfb9acc9f.png,FFBF89EFE97E42F39A5096B69EA8853A
2022-10-14T15:06:21.000Z,IS: Noora Räty Kiinan maalivahtivalmentajaksi,"Noora Räty otti vastaan yllätyspestin Kiinan maajoukkueesta, uutisoi Ilta-Sanomat.",https://img.ilcdn.fi/PLLKTZK33guO0DF61mqoS7Bat5I=/510x318/top/img-s3.ilcdn.fi/f805a95da9e3516742c5b5aafc0ca855d9e9fd0a92003392c7514fb1d0d60cdc.jpg,4E2FAD1FBD1B4149B0A5698606908340
2022-10-14T15:11:05.000Z,Tesla-pomon Ukraina-sekoilu antaa kasvot hyödylliselle idiootille,"Miljardööri Elon Muskin ”rauhansuunnitelma” on kuin Kremlissä kirjoitettu. Jos se toteutuisi, maailmassa hyväksyttäisiin kaksi vaarallista periaatetta, Iltalehden Lauri Nurmi kirjoittaa.",https://img.ilcdn.fi/ctvK3iDmeLvxaaq1lCxz2s6ndYs=/510x318/top/img-s3.ilcdn.fi/eb99f21ddbfeb752b215a63917a5138f429cfde7585bfc6b374a1f745e9fc0b6.jpg,F5D51EBFAA96401F8F14FACBF2E83B22
2022-10-14T15:11:34.000Z,BB-talossa puhutaan tisseistä – näille asukkaille isot rinnat ovat haaste,Big Brother -talon asukkaat keskustelevat rinnoista. Toiset haaveilevat isommasta ja toiset taas pienemmästä povesta. ,https://img.ilcdn.fi/rvZ4jvpHvS3isWf_3dtXDlXHj-U=/510x318/top/img-s3.ilcdn.fi/18465175679eef9b4f46e2f6be898e6ef41b87339107f2c620db86d97bc7bdf8.jpg,C7757869C92B4D39805AD42B3F4CC79C
2022-10-14T15:16:14.000Z,Kartta kertoo Putinin mahdottomasta tavoitteesta – Emil Kastehelmi: ”Venäjältä loppuu miehet ja kalusto ennen kuin ne pääsevät sinne”,Venäjä haluaa vallata koko Donetskin hallintoalueen. Tilannestudion asiantuntijan Emil Kastehelmen mukaan se ei siihen nykyisillä voimillaan pysty.,https://img.ilcdn.fi/qO3Oh34yi59y7CBBIIvIw5jATsY=/510x318/top/img-s3.ilcdn.fi/b7119e35518bada96ad9b8a294e355da82ed2b858e0863b3b62f4e80f5645129.jpg,4B1A87D97741425187D2A45270635F80
2022-10-14T15:31:57.000Z,Amnesty: Iranin turvallisuusjoukot tappaneet ainakin 23 lasta protestien tukahduttamisessa,"Ihmisoikeusjärjestö Amnesty kertoo, että Iranin turvallisuusjoukot ovat tappaneet ainakin 23 lasta nuorten mielenosoitusten julmissa tukahduttamistoimissa.",https://img.ilcdn.fi/HOX8YPlso1NY34pszSnHMLQouPE=/510x318/top/img-s3.ilcdn.fi/972ec5ff3d4a997c848bb35b9bf92ad9929e2f95cdbdce886ac6a9129ff5fa8a.jpg,993854C9CB3E4A17B12BED075E4420D3
2022-10-14T15:58:28.000Z,Valtava painoero! Robert Helenius yllättyi Deontay Wilderin kovasta kilokuurista: ”Hyvältä näyttää”,Supertähdet punnittiin perjantaina Brooklynissa.,https://img.ilcdn.fi/mQODayKEuq0QBNBHPZi6-AjGNX4=/510x318/top/img-s3.ilcdn.fi/8b1f8cfee7d54c20df9a26431ba7d78d2ae6566b294a6260e64a2f180e9370d1.jpg,2B89DEFF70AD436DAF0AFD062C15993D
2022-10-14T16:01:00.000Z,"Sokea nainen lamaantui paniikista, kun henkilökohtainen avustaja raiskasi",Avustaja oli yllättäen suudellut naista ja pyytänyt tätä riisuuntumaan.,https://img.ilcdn.fi/ajRL86WpMaFioerqM4sf2DheUH8=/510x318/top/img-s3.ilcdn.fi/10228b52d0befbab2d4aa546f8991772b1feff39033619edc07dd3993d95372f.jpg,06D9FEF32DF943C7AD214113F11C3D06
2022-10-14T16:01:23.000Z,Kuningataräidin kruunusta kiistellään nyt maailmalla – nähdäänkö kruunu myös Camillan yllä?,"Kuningatarpuoliso Camillan uskotaan pitävän kruunajaisissa yllään kuningataräidin kruunua, joka on tällä hetkellä kansainvälisen kiistan keskiössä.",https://img.ilcdn.fi/5RU9mh4V4iAmiJwH_RG4A-b_XmA=/510x318/top/img-s3.ilcdn.fi/8fc4c9d479859eada87009fdcddf91b36c0e8bbb1b8c6c10a4e6e7099c4ceb2a.jpg,08785FA96DC94F748337D10C2E02BA98
2022-10-14T16:04:34.000Z,Venäjällä sotaa protestoidaan vihreillä nauhoilla – tästä on kyse,Venäjällä protestit ovat hienovaraisia. Vihreä nauha on ollut sodanvastaisten mielenilmausten symboli jo hyökkäyksen alusta.,https://img.ilcdn.fi/MvrrMEXCc9mCd0nnkxWAQLgUfB8=/510x318/top/img-s3.ilcdn.fi/fa5fe8a8ad48348659251ea7049679743cfcaf831ef8aa9024335e08d367f252.jpg,B0EC473D2D0B48538DDA9B2167234205
2022-10-14T16:06:47.000Z,Koeajossa työmiehen unelma: nelivetoinen maastoonkin menevä pakettiauto,"Peugeot Expert 4x4 on auto, jollaisen moni työmies haluaisi, mutta vain harva tarvitsee.",https://img.ilcdn.fi/zC1rBLXjOtBum6KARJ80d8JARcU=/0x84:2048x1363/510x318/top/img-s3.ilcdn.fi/4fde84a1aab4b9ca3cbcb665878d855b2a18070e750b4c0ff32d13e55308ecef.jpg,88BC7B1A1254483581DC3E05D53C2C93
2022-10-14T16:25:12.000Z,Kärpät siirtyi heti johtoon – Lahdessa käynnissä tulikuumien maalivahtien kaksintaistelu,Maalit ovat SM-liigassa jälleen kortilla.,https://img.ilcdn.fi/lDPDjvBjdWHWW1HZOnL6u5h0of4=/510x318/top/img-s3.ilcdn.fi/f4e3faa031ba6541059f2a809e55de41a61aa8166bba5c8f304d116c13132c82.jpg,78012398858049E0B75CCD865252C7A7
2022-10-14T16:40:17.000Z,”Ilmakuplia alkoi nousta” – näin suomalaiset upottivat talvisodan menestyneimmän venäläisen sukellusveneen,Porkkalan edustalle 80 vuotta sitten uponnut sukellusvene löydettiin vasta vuonna 2013.,https://img.ilcdn.fi/hz_6n-mNo1Z98W0QwN_8rVUlFfM=/510x318/top/img-s3.ilcdn.fi/f881ed8a03d3fd9601bc987acd76b9c1c1c0dc8fcd01c60c6bcaee4bbe689339.jpg,DE7B2428B92E45869C481FDBBCA9D3C1
2022-10-14T16:46:45.000Z,"Elävää sotahistoriaa: Ukrainassa tallentui videolle taistelu, jollaista ei ole koskaan aiemmin nähty",Tiettävästi ensimmäinen sodassa käyty miehittämättömien ilma-alusten välinen taistelu käytiin Ukrainan ja Venäjän droonien välillä.,https://img.ilcdn.fi/pV-aA0HFN65B_SV7YQwbsUGZQwk=/510x318/top/img-s3.ilcdn.fi/c5c57f3dd8b4e623198386a4b077e07aa622a6f5dbc4cf54be5420120eafc59b.jpg,ABF7689A89D1439E947B6D97B0F38E29
2022-10-14T16:51:29.000Z,Harry Potter -tähti Robbie Coltrane on kuollut,Harry Potter -elokuvien rakastettua Hagridia näytellyt Coltrane on kuollut.,https://img.ilcdn.fi/KjbqWil8x-tM4DQ1nEl-LSlbX7A=/510x318/top/img-s3.ilcdn.fi/55aecf2c72c73b373d2e51bfd0dde3e0e379f692676181600ada92ea75652576.jpg,6E0504877A3041F581F58095945A3C18
2022-10-14T17:04:33.000Z,"Teboil menettänyt jo viidesosan yrittäjistä Suomessa – näin ketjun käy, arvioi professori","”Jos autonomistajat eivät tankkaa lainkaan Teboililla, niin sitten yhtiön toimintaedellytykset loppuvat jossain vaiheessa”, sanoo Peter Lund.",https://img.ilcdn.fi/n45DY4rnbyznALAbJfumhmFR0Og=/510x318/top/img-s3.ilcdn.fi/aa786edde530e8c0b89232cf49db3b283cba9de60c05dfd1aa73771340974e48.jpg,92F1125C50524817B75E7CFBD1E07740
2022-10-14T17:25:26.000Z,Mies suorittaa uskomatonta juoksu-urakkaa: ”Mutta samalla huudan tuskasta”,Tämä hyväntekeväisyystempaus vaatii jo hyvää verryttelyä. ,https://img.ilcdn.fi/IXOsuv_z2-gWVTXoAIUckEBq6sI=/510x318/top/img-s3.ilcdn.fi/a51ea805158663591f8bf564408897d774c1a75515d2ac7111cd853da107254d.jpg,30CE6C11A2A846C2A97D91D6C4205AF7
2022-10-14T17:34:33.000Z,Isä tuli Oodi-kirjastoon sovittamaan lapsensa unohdusta – ”Palautusautomaatti ei taida nyt onnistua”,Alkuperäisen lainaajan isä palautti kirjan kirjastoon.,https://img.ilcdn.fi/NsKNbABCqqU6myfWUwMBvrGXvsU=/510x318/top/img-s3.ilcdn.fi/86cc82c721ad73cb7fba84fc16103050faa04efe467d1fba4450662129510e5f.jpg,66A9999C102A4187AD9333D3BA317FB0
2022-10-14T18:05:51.000Z,Atte Harjanne kritisoi Peteliusta – vihreät ottaa Paf-suhteen käsittelyyn,"Asia käsitellään sen jälkeen, kun Petelius on tullut sairauslomalta.",https://img.ilcdn.fi/TgzxcwG4gkSFgJazfckc9RpcoBY=/510x318/top/img-s3.ilcdn.fi/d0db66f7a29e07b55da1e273296fd577c90ba4178a3f419354f15560e0f52c96.jpg,DC2F187FFEBB4530B67BFC78C2AB062E
2022-10-14T18:23:42.000Z,The Crownin kohutusta viidennestä tuotantokaudesta uusia kuvia julki – paljastuuko hovin synkkä puoli?,Netflix julkisti uusia kuvia The Crownin viidennestä tuotantokaudesta.,https://img.ilcdn.fi/pJth0D5PaLCOoA9xCFq0QBZEQNQ=/510x318/top/img-s3.ilcdn.fi/55d87869287923be7e79c621e708998293fec98458c015fdfd5c84cfe46b5cba.jpg,E7591ED86C9A419E964CD31BAEC42FC1
2022-10-14T18:28:14.000Z,Näitä autoja Suomessa hankitaan eniten omalla rahalla,Iltalehti listaa tämän vuoden ensimmäisen yhdeksän kuukauden aikana yksityisten haltijoiden käyttöön eniten ensirekisteröidyt automerkit ja -mallit.,https://img.ilcdn.fi/JUnbPl8g6WzfK1C5FsWReqBPoXs=/0x0:3000x1873/510x318/top/img-s3.ilcdn.fi/a7f17397bdb4798dfe1a567cb3977e1a7337949a7a6697a6997c85ed9286467e.jpg,BDD064C09E59444ABE350A1B293042DC
2022-10-14T18:35:02.000Z,Kalle Rovanperä sai upean lahjan McRae-perheeltä – ”Nuorimmalta mestarilta toiselle”,McRaen perheessä ei muistella pahalla Kalle Rovanperän viemää ennätystä.,https://img.ilcdn.fi/Qwj1wYgbbL6n5zBREFOuzIfQklQ=/510x318/top/img-s3.ilcdn.fi/5616676f139458c5e88e3c3dbf49dface801171480729bc06b09f027414a2aca.jpg,856283BF7C5145718119D48843DB56CC
2022-10-14T18:49:50.000Z,"Naiset kertovat, millaista on liikkua yksin ulkona – nämä videot nähtyäsi ymmärrät",Iso osa naisista on kokenut turvattomuuden tunnetta yksin ulkona liikkuessaan. Moni on todistanut vierestä ahdistelu- tai häirintätilanteita uskaltamatta puuttua niihin.,https://img.ilcdn.fi/4tnYEPCHCsVFik5eY8aJZ8hYpA4=/510x318/top/img-s3.ilcdn.fi/c658cef9281157e596bde19d599b97ff3d290d79977f107ba5eb0ba575bf0c55.jpg,25357F40940F4EFD90F02B1503FC8B2B
2022-10-14T18:51:09.000Z,Robert Heleniuksen brutaalia ruokavaliota ihmeteltiin maailmalla – nyt dieettiin tuli täyskäännös,Helenius vaihtoi hiilaritankkaukseen perjantai-iltapäivänä. ,https://img.ilcdn.fi/Wt3a4MMk1lG6_0tfeFJB1Xi8244=/510x318/top/img-s3.ilcdn.fi/266ad30d1e9901d7a09dab4799efae847e1aa4c96af9f235f6dc230edb716756.jpg,A0E1777CA4034584A40CFFCC3396395F
2022-10-14T18:53:50.000Z,"Oikeus: artistille sai lähettää pornoa ja seksivälineitä, oli ”tavallista” fanitusta – naiselle silti tuomio puolison vainoamisesta",Oikeuden mukaan tekokokonaisuus osoittaa häikäilemättömyyttä.,https://img.ilcdn.fi/gK-DsI_PI7u0HncEYSfuPLf0Kjs=/510x318/top/img-s3.ilcdn.fi/7a65da87c52cc5385dcc70c3011f36fa978773d32a7941994503c133273e1573.jpg,5EA28F44DCF44E86A50A140FB31B3E51
2022-10-14T19:10:31.000Z,Jyrki69 hätkähdytti Vain elämää -jaksossa: The 69 Eyes -yhtye laittoi Tommi Läntisen hittikappaleen kokonaan uusiksi ,The 69 Eyes -yhtye esiintyi illan Vain elämää -jaksossa.,https://img.ilcdn.fi/6-fvkRg1G37xsB5kquyRg3xvB8o=/510x318/top/img-s3.ilcdn.fi/9d3579232894ec16b5ca156e9e87be5af48dd517d020e72bb7faaed18b3b2626.jpg,F45307B7E1124618914EF88B7E1CC749
2022-10-14T19:18:08.000Z,Viisinkertainen NBA-mestari hehkuttaa – ”Rakastan Suomea”,Michael Cooper nousi vakavasta loukkaantumisesta huolimatta NBA-tähdeksi.,https://img.ilcdn.fi/7SC-QE9BXKoFWPPblCpjQ-bMleU=/510x318/top/img-s3.ilcdn.fi/80ca76af2f7301994886eef938db293ffad4114c9dd4a8c61348a627bbca77f5.jpg,0933860BEB994DB5BB27639F7C34F048
2022-10-14T19:56:12.000Z,Harry Potter -tähdet muistelevat koskettavasti Robbie Coltranea: ”Teit meistä perheen”,Harry Potter -näyttelijät muistelevat Robbie Coltranea.,https://img.ilcdn.fi/KjbqWil8x-tM4DQ1nEl-LSlbX7A=/510x318/top/img-s3.ilcdn.fi/55aecf2c72c73b373d2e51bfd0dde3e0e379f692676181600ada92ea75652576.jpg,043D2177FDE5422BA5DD032EE94C2B87
2022-10-14T19:58:49.000Z,Nyt on lyöty hintaa: Maradonan ”Jumalan käsi” -pallo huutokaupataan,Pala jalkapallon historiaa on myynnissä.,https://img.ilcdn.fi/_u3vimx0XO-3ScCw9JEJI1dn5hI=/510x318/top/img-s3.ilcdn.fi/612b50a316c52b4da3828f278c64ba06b02e5bbc98d76b1bd2842c37a35d8946.jpg,DDE63EA1525649B397DC677F26AB236D
2022-10-14T20:03:37.000Z,"Nainen potkaisi autokorjaamon omistajaa, omistaja vastasi nyrkillä",Auton korjaaminen johti väkivaltaisuuksiin Malmilla.,https://img.ilcdn.fi/RpUHtBEB3o-An4eSlVQu-HECwhU=/510x318/top/img-s3.ilcdn.fi/5a0192ae6ab97b7106a4c8988e124f971aa3d406c0e40f38c8499496111c7f63.jpg,653B06D5FFF44D8CA183536641FC20CD
