paivamaara,otsikko,tiivistelma,kuva,id
2025-03-28T09:42:28.000Z,Trumpin ministeri vieraili vankilassa – Ökykello nostatti raivon,Yhdysvaltain kotimaan turvallisuuden ministeri vieraili El Salvadorin pahamaineisessa vankilassa. Huomio kiinnittyi erääseen yksityiskohtaan. ,https://img.ilcdn.fi/0qFO_bULYhXOeKOiL4GKSYaGROM=/510x318/top/img-s3.ilcdn.fi/88ca8d30a2c989be5b23346bcd85756309bd77f818846e1dfedfff5cdc5cca91.jpg,D028191CB30B4AB89A7B21B42AE15018
2025-03-28T09:48:50.000Z,Baltic Princess remontoitiin 8 miljoonalla eurolla – Tältä suosikkilaiva näyttää nyt ,"Kun risteilylaivoja uudistetaan, ruokalistalla on annoksia, joita ei saa poistaa.",https://img.ilcdn.fi/X7uxCUbYR2jxFHxtJQ0hWH40_qI=/510x318/top/img-s3.ilcdn.fi/acf11dfa182039ea0874b89c16aeb05d04cdea93e8a70ee1788d542e80488a28.jpg,6DFD6A3CB3094D26999D288ADC1BEB7F
2025-03-28T09:55:11.000Z,"Putinin liittolaisen vaimo murtui kyyneliin käräjillä: ""Olen tolaltani""",Putinin liittolaista syytetään pakotteiden kiertämisestä.,https://img.ilcdn.fi/jFYBxEoEZKPzJV1OAC0z03_cbD0=/510x318/top/img-s3.ilcdn.fi/e7dbc6ae93dc89e46500514b34b0d7b3aed2365e440879643feea0c9d2ace1d7.jpg,4935FB7438C64706BD0C910727B5FA5B
2025-03-28T10:09:40.000Z,Erikoinen yksityiskohta – Tältä näyttää Sanna Marinin piinaajan hylätty valitus,36-vuotias mies toimitti itse kirjoittamansa valituksen hovioikeudelle helmikuun alussa.,https://img.ilcdn.fi/1LaG5_uJMZnIOOZ9AqwWWZGY1pM=/510x318/top/img-s3.ilcdn.fi/d76cc319a57bbc2b97954ad7e1830d76807195526dff270c6ca07e34f88b127d.jpg,706E71B2FAC04112BCFCC2C597B5E34B
2025-03-28T10:13:32.000Z,Suomalaisseura piti suuren tiedotustilaisuuden – Nyt paljastui karu tieto ”omistajista”,"Liettualainen yhtiö ei ole hankkinut omistusta koripallojoukkue Seagullsista, vaikka seura elokuussa näin tiedotti. Asiakokonaisuudesta on haastavaa saada tolkullisia vastauksia.",https://img.ilcdn.fi/7FhNvTSR6lvIMHmf54D2CWZDz6E=/510x318/top/img-s3.ilcdn.fi/3930d7a36ac64d03f76cfb1e68849a47c47d6f5adca1fcce996511770b7e4499.jpg,9B127BAEFED542E58150A9460039EBB3
2025-03-28T10:15:29.000Z,Karla Karmala nöyryytti alokkaita – Näin oikeus tuomitsi,Länsi-Uudenmaan käräjäoikeus antoi ratkaisunsa asiassa 28. maaliskuuta.,https://img.ilcdn.fi/HbnhF_i0x2zLNCjngW04kRtpA2Y=/510x318/top/img-s3.ilcdn.fi/635aef3ff0d5bb935efcb2f59351ff478b806d74514e605525d41ecdb11978be.jpg,BF3E214BD76D42DDA119E41D4E6DF5DC
2025-03-28T10:32:34.000Z,Jokerit ei pelaa tänä keväänä ”Hartwall-areenassa”,Hallia ei saada teknisesti käyttökuntoon jääkiekko-otteluihin.,https://img.ilcdn.fi/MIMumXjs44W1_ZHpw3bIxqA9C4A=/510x318/top/img-s3.ilcdn.fi/aab0cb967f09390f7f2e0f3d5adbf84ea7677a1356d9a6b16648a56aaee20192.jpg,66C35339599A444DBFE21637B090B437
2025-03-28T10:49:14.000Z,Susanna Penttilä esittelee Top Gearissa seksikkään autonsa – ”Katsooko viereen tuleva mies minua vai autoa?”,"Top Gear -ohjelmassa vieraileva Susanna Penttilä esittelee ohjelmassa kulkupelinsä. Ohjelman juontaja Teemu Selänne tiedustelee Penttilältä, millä autolla hän saapui kuvauksiin. ",https://img.ilcdn.fi/Z1gzve8G7QFzN8SE-fi6f7NlkkE=/510x318/top/img-s3.ilcdn.fi/4af29f5b990183a0316f82422da6a11edefdd1e421316339b07ae9aa081b8464.jpg,C0C5737B6277411A9BF68F4646A17244
2025-03-28T10:49:53.000Z,Yle: Varoitus,"Yle kertoo, että sen nimeä hyödynnetään tekijänoikeusteemaisessa huijauksessa.",https://img.ilcdn.fi/4pgzeP2-KuNWNUSASns1A6LEGtE=/510x318/top/img-s3.ilcdn.fi/53c7f8355e239654651a8c0c1f2b16bb2856e54809970ec1d8e3d9f9c4ba6a01.jpg,B6A2381DAEF243B1A53C8BA8BA84E1BE
2025-03-28T10:55:59.000Z,Tapparalta iso liike,Tampereen seurojen playoffsarjan toinen näytös pelataan tänä iltana. ,https://img.ilcdn.fi/vUQwmVVosVOvvu7JjWCH-11dj8Y=/510x318/top/img-s3.ilcdn.fi/867e493d64ee737bc4cbbcdf3e1014db1a969db30cdf169ca241c98d4492b499.jpg,0CADD91BE46C4A8D91256F796737589A
2025-03-28T11:07:33.000Z,Analyysi: Putin huijaa amerikkalaisia,"Tällainen on totuus tulitaukoneuvotteluista. Amerikkalaiset kävelivät suoraan Putinin ansaan. Tilanne on absurdi Euroopalle ja Ukrainalle, Iltalehden politiikan toimittaja Lauri Nurmi kirjoittaa.",https://img.ilcdn.fi/gKckv59OY_xoS-Ix977-tDe9kDk=/510x318/top/img-s3.ilcdn.fi/60162c1d3fa63e3008756c6b63d6a5ca45888a5d4cd08404b3192a3d4fb2f269.jpg,A22CBCCE382C4C26BBA3569A91004B7D
2025-03-28T11:18:07.000Z,Kuva paljastaa: SM-liigan mestarilla karu lipputilanne,Tänä iltana pelattavaan Tampereen derbyyn on rutkasti lippuja myymättä. ,https://img.ilcdn.fi/eaqm64zydfeO_Vchf-QNQ6mw_f8=/510x318/top/img-s3.ilcdn.fi/199ae7c0dbdc104b501b554ccd12a436f85b8cf2fc9480fd06cadc8a3022cfff.jpg,FFD7E00DD45E4A0794402C22E3883439
2025-03-28T11:26:08.000Z,Juha Mäenpään epäilty syrjintä etenee oikeuteen,Järjestäjien mukaan Mäenpään lehdessä julkaisemat mielipiteet olivat ristiriidassa tapahtuman arvojen kanssa.,https://img.ilcdn.fi/-AOGOYvLRZJ_PCx8cLrdupGwTpk=/510x318/top/img-s3.ilcdn.fi/b47bcbccb1df000867bbe90e0a6d4faec1509beddb299751d406caa47fb8b162.jpg,83EA4475180B49EBB7357652B8C26836
2025-03-28T11:26:49.000Z,Waldo ja Jussi Rainio paljastavat: Kuvauksissa elämää mullistava hetki,Waldo ja Jussi Rainio ystävystyivät Vain elämää -kuvauksissa.,https://img.ilcdn.fi/4-4J85yMTS8rkTDbVJYDK8MB0MQ=/510x318/top/img-s3.ilcdn.fi/07afd8098e856c45d0872294afdb7a30029c90a233745307e33185d3711cbf8a.jpg,73F7AB0CBB9C43BD8A39455F88B346B1
2025-03-28T11:29:18.000Z,Kansalaisaloite hyväksytty: Eduskunta haluaa kieltää eheytyshoidot,Eduskunta hyväksyi kansalaisaloitteen ”Rikkomaton – kielletään eheytyshoidot” selkeällä enemmistöllä.,https://img.ilcdn.fi/biZucs90uRv1AuskLP08XY2rZ-c=/510x318/top/img-s3.ilcdn.fi/2e7baf967563bd88b08f09da1f28719292891f6ed00ebbccf0c3ef0ca20341fe.jpg,F2C6AC6254A244B78170A4DE77383982
2025-03-28T11:34:21.000Z,Ehdottomasti paras juustoleipä – Tätä raaka-ainetta et olisi älynnyt laittaa täytteeseen,"Sisältä sulaa juustoa, päältä sopivan rapea. Sellainen on hyvä juustoleipä.",https://img.ilcdn.fi/891GtqHrPbk2vqnT22bIln8Z_2E=/510x318/top/img-s3.ilcdn.fi/78b9024d911cc63d5fd22acbcf1a4a20c4ccb0c26e8125848d3f33f388d38927.jpg,03654A42AB7F499BA4207302CD6E93A0
2025-03-28T11:48:41.000Z,"Suomalainen tutkija antaa sysimustan arvion siitä, mitä Kaakkois-Aasiassa alkaa pian löytyä","Kaakkois-Aasian maanjäristys oli epätavallisen voimakas, Seismologian instituutin johtaja sanoo.",https://img.ilcdn.fi/YjrpmqM9D4NbJNyYs88BGN1M_-w=/510x318/top/img-s3.ilcdn.fi/0a52ca438f684c0565aa232246b6b7ab5a4e9f540ff4c719bb16053fb54ec39f.jpg,FBD07F614EB14F438CB7F146809557FD
2025-03-28T11:52:09.000Z,Supervahti loistaa – Pysähtyykö mestarisuosikin matka?,Ässien maalivahti Niklas Rubin on hurjassa pudotuspelivireessä.,https://img.ilcdn.fi/RiAdpQV9IYsD2yIJEVXHYZXS3Jg=/510x318/top/img-s3.ilcdn.fi/d858148b55e85ab77547b54cdbc879d836cacefb8d15f7d9931ff7f7bc9ae046.jpg,171A3400E800412DA1FD51B181036707
2025-03-28T11:56:52.000Z,Hoitajaliitto jyrähtää vanhustenhoidon säästöistä: ”Pahentavat tilannetta entisestään”,"Hoitajaliitto Super huomauttaa, ettei kotihoitoa voi korvata teknisillä ratkaisuilla, vaan hoitotyö vaatii läsnäoloa.",https://img.ilcdn.fi/BH5i2qQ_SvZrsiWf1r3ZoSqdKhA=/510x318/top/img-s3.ilcdn.fi/2234bb565cb24386bc9f7b60bfd19ea8eb908379d45129b3fb8e2f8532181249.jpg,A4E0BB17E10B43A59DF2456049F38419
2025-03-28T12:02:42.000Z,Kuorma-auto ja henkilöauto törmäsivät Valkealassa – Yksi kuoli,Onnettomuus aiheutti liikennehaittaa perjantaiaamuna.,https://img.ilcdn.fi/-yzrzOV_1akA3ZHN7xUt1UQjXR8=/510x318/top/img-s3.ilcdn.fi/2d6c494e2ede101e5f52697870b1915f355d2da73f5574c8955f29689429acc9.jpg,2491CD8C17A2476492145C56B208223F
2025-03-28T12:12:34.000Z,Ruotsalaiset pakenivat henkensä edestä Bangkokissa,Myanmarin maanjäristyksen vaikutukset tuntuvat myös naapurimaa Thaimaassa.,https://img.ilcdn.fi/X_QM0XzmbIcTheFqOfjppzd9NxQ=/0x79:3000x1954/510x318/top/img-s3.ilcdn.fi/0112899b5c6650f94b1f731d2a8582aef320c5aaa21a7216259cf2f8ab1c006d.jpg,48E0002CB2A748558A1A54A69C3BF2C9
2025-03-28T12:19:50.000Z,Ristomatti Hakola kertoi harmittavan uutisen,Ristomatti Hakolaa ei nähdä Iisalmen Suomen cupissa viikonloppuna.,https://img.ilcdn.fi/6cP0WvolVefuCTa79X7I4U6XU18=/0x0:3000x1876/510x318/top/img-s3.ilcdn.fi/cbfa2cdb638a7f5c9a711b34b72a054ac6ee64078d263a946c797abe38d3971a.jpg,51BB21AE33B14A45816930DD0FCF31AA
2025-03-28T12:26:57.000Z,Veriteosta epäilty nainen soitti itse hätäkeskukseen,Uhri on päässyt pois sairaalasta.,https://img.ilcdn.fi/JR2kyAHpqa4aO48IE-os1q_wUcM=/510x318/top/img-s3.ilcdn.fi/c347a307f7e2b2c3f9346865d1a46625c122d75d9ab8ee8d2eca1eea221b92d6.jpg,4BC546BEC8D5476E9B41E4F8DB01F7CB
2025-03-28T12:28:28.000Z,Kersantti tappoi taksikuskin Tampereella – Tällaisen tuomion hän sai,Hovioikeuden mukaan teko täytti tahallisen henkirikoksen tunnusmerkit.,https://img.ilcdn.fi/18WZsaZmSBrxzREl-zFSOpLy3mU=/510x318/top/img-s3.ilcdn.fi/42c8e26020c3be3daf29bc97f1ebacd35c1879a56f154ce304f8d517e56f0af0.jpg,521026B6BCD342179BC6178E48086296
2025-03-28T12:36:34.000Z,"Yli 5000 suomalaista Volvoa asetettiin välittömään latauskieltoon - Näin tarkistat, koskeeko omaa autoasi","Yli 73 000 vuosien Volvoa voi ylikuumentua niin pahasti, että siitä aiheutuu tulipaloriski. ",https://img.ilcdn.fi/vLH8j5NL_Zwy7Ic8zSFmHj9o_lc=/510x318/top/img-s3.ilcdn.fi/6b8f37742c5a3e1850687dee35f48dec54b17bc7c1ae942c05ea6e8956d8485e.jpg,3867814B309C45B5B0D89391E9D17113
2025-03-28T12:49:41.000Z,Aki ja Rita Manninen lomailevat Thaimaassa – Paikallisilta tsunamivaroitus,"Aki Mannisen mukaan tunnelma Khao Lakissa on rauhallinen, vaikka paikalliset asukkaat ovat huolissaan.",https://img.ilcdn.fi/ZuQFPnliTAI_Y3t-syKjsXvUxfo=/510x318/top/img-s3.ilcdn.fi/21346f5d4aaeb3062324db2f7a4f9a1b1a52f2f287497ec206c24e2c3e0fc225.jpg,F1A08E84C36140BDA258D1031B434476
2025-03-28T12:53:08.000Z,Suomelle hiihdon MM-kultaa!,Suomen joukkue juhli Sveitsissä.,https://img.ilcdn.fi/C7titBnBFccN6FSJAns8oE5O4YQ=/0x64:3000x1940/510x318/top/img-s3.ilcdn.fi/4e39b7dd87f398464a526285ff9e834f9c5c20da633a6adbc14f9f572e915e4e.jpg,6EB54E050559404BA1E31181AA866C9B
2025-03-28T12:58:25.000Z,Usko pois: Tämä takki on kevään hitti,"Mikäli tämä takki löytyy vielä omista varastoista, kannattaa se kaivaa nyt esille.",https://img.ilcdn.fi/OX34I9agTwSXHvf03ibRywhaNTE=/510x318/top/img-s3.ilcdn.fi/f6a87a5e1ad1d552e5d561bf806e53bfaaeefc50f20270adee2ba9d5f1943303.jpg,2DC2300622F04493AC0427194285E807
2025-03-28T13:11:53.000Z,STT: Ulkoministeriöön hyökättiin – KRP tutkii törkeää rikosta,"Keskusrikospoliisi on aloittanut tutkinnan epäillystä törkeästä tietomurrosta ulkoministeriöön, STT kertoo.",https://img.ilcdn.fi/KQ99p423XnIgGs8VR9jVcLvM8HI=/510x318/top/img-s3.ilcdn.fi/b1dc3177a056738ada7ed58014ba74fd38892955f618b2376c00f23af9609b88.jpg,52727D419023489E8E897E501BA14BC8
2025-03-28T13:23:57.000Z,Kampaaja pilasi huippumallin hiukset – Otsatukka huvittaa somessa,Huippumalli Emily Ratajkowskin uusi tukka ei näytä ihan siltä miltä pitäisi.,https://img.ilcdn.fi/Bo0aaNqA5ucXMo0DGPdlHnhBJm0=/510x318/top/img-s3.ilcdn.fi/c7f98f2c1eea42e1fd39a124f8629ffd56ff743046abfd67384160159eb1868c.jpg,3510C5364A0D4180BCFDD9C5F1985C66
2025-03-28T13:27:59.000Z,Konkurssihakemus – Jere Karalahden yritys ongelmissa,Iltalehti kertoi yrityksen vaikeuksista jo syyskuussa.,https://img.ilcdn.fi/heiLV-D-zIJmBhu8vqJh5QGRmNo=/510x318/top/img-s3.ilcdn.fi/e629344e69244ae91e2f64bee740d244a6dae4c2b1c05977e606a8669222797e.jpg,F5202BD3F7D54E8F95BDCCF8E6682DF4
2025-03-28T13:38:17.000Z,Kostaako Brighton hurjan nöyryytyksen Nottinghamille?,Vakiokierroksella on kohteita useasta eri kilpailusta.,https://img.ilcdn.fi/DTcBjXpvwtiK8TSf7_uhcB1p2Jg=/510x318/top/img-s3.ilcdn.fi/47c8a28f6c007681565354a4e53fb60e0c8f12a411d55a3ffa45a8d83c6ff5e4.jpg,297EEBF7A9B94C69A8FEA383EDBAD313
2025-03-28T13:41:45.000Z,Onlyfans-opettaja: Potkut,Ammattiopisto Keudassa aikuisviihdekuvauksia järjestänyt miesopettaja on irtisanottu.,https://img.ilcdn.fi/Ty0JwYHvnnB-1C-xbArWGWGdKqs=/510x318/top/img-s3.ilcdn.fi/a794ec6e9e626d9a3c74091966a82a0c97e8b320f5db1233ef841fa90fdf0fd6.jpg,F592C7ADF2304C098B9D6E68D350A3DA
2025-03-28T13:46:17.000Z,Liisa Lääveri on kuollut,Yleisradion entinen työntekijä Liisa Lääveri on kuollut 76-vuotiaana.,https://img.ilcdn.fi/JqtrLBkKSPVtCLozcLDIQQUEZFU=/510x318/top/img-s3.ilcdn.fi/8259e97611f94cbe59a478a492082257a5f825dc5a53f253e60f331f7186504d.jpg,E75A9D89DCB449CEA645CCC573311DC9
2025-03-28T13:53:30.000Z,David Coulthard moottoripyöräonnettomuudessa,Takavuosien F1-tähden onnettomuudesta kertoi perheystävä omassa radio-ohjelmassaan. ,https://img.ilcdn.fi/cd95-cIpnuksta0Iiy-dECjhdp4=/510x318/top/img-s3.ilcdn.fi/e5b7b8081ee7a7bd0eb8f7f2dd8dbd9e19b716e9fd8d7f282c9b1d986ff9ff42.jpg,B0C4FF74362F47779ABAC845B5082BAB
2025-03-28T13:57:49.000Z,"Vantaalaisen kuntavaaliehdokkaan piti olla lääkäri – ""En pidä tätä harhaanjohtavana""","Vantaalainen kunta- ja aluevaaliehdokas kertoo, miksi esittäytyy lääkärinä, vaikka Iltalehden tutustuttua julkitietoihin näin ei vielä ollut.",https://img.ilcdn.fi/tLBdUhysPZLUWe9ceSANjpHHyqM=/510x318/top/img-s3.ilcdn.fi/d54026f2e239ab0da714142fdeee14c89fac25c79237e996b130b8d0d6a547c2.jpg,0FBF4D1E3AFD4E95850A16638B6134DA
2025-03-28T14:00:16.000Z,Trumpilta varoitus EU:lle ja Kanadalle,Trump kutsuu ensi viikon keskiviikkoa ”Yhdysvaltojen vapautuspäiväksi”.,https://img.ilcdn.fi/MeEMg2zcDHZ3ZA3poLuNJLrIkek=/510x318/top/img-s3.ilcdn.fi/e37b166e5d9016dbf50267a2e50e8bc3fa644a1a2037a10269566c85606abc0f.jpg,FDCB912462ED4770AB73D443DD2BED8F
2025-03-28T14:12:41.000Z,Lindtman huusi Orpon päälle – Orpo suuttui,"Suoraan asiaan -ohjelmassa puheenjohtajat Petteri Orpo (kok) ja Antti Lindtman (sd) kiihtyivät sote-säästöistä. Lindtman vaatii Orpoa kertomaan keskiviikkon mennessä, miten sosiaalihuollon säästöt kohdistetaan.",https://img.ilcdn.fi/6PqB5RXpQtJy-pGD-s4dVcHkn-M=/510x318/top/img-s3.ilcdn.fi/90b10ae8f0573d9a97f17f712c5a25dcac4114bcafb8f6cdd2c22f85593acaf8.jpg,6B2C56EDBFAB4DF09ECFF897CFBE10D3
2025-03-28T14:17:14.000Z,Parikymppisen miehen ruumis löytyi Helsingistä – Poliisi pyytää apua tunnistamisessa,Poliisi pyytää apua nuoren miehen tunnistamisessa.,https://img.ilcdn.fi/iqRDwxvTu_SGXMjzdxz-M2yGqaA=/510x318/top/img-s3.ilcdn.fi/d1c49bacfe4d58cd5a1b086bd517371a265436cc6c7d6db1dad07986df980f86.jpg,347196B220AA45C99DE1A05D88303236
2025-03-28T14:18:11.000Z,Erika Vikman vastaa Jussi Rainion rajuihin kommentteihin,Jussi Rainio otti rajusti kantaa Erika Vikmaniin liittyviin somekommentteihin. Nyt Erika Vikman vastaa Rainiolle.,https://img.ilcdn.fi/LL952DyU_1dUoDttzusfmp2807U=/510x318/top/img-s3.ilcdn.fi/473412aaa00ce91a607f37e104025d416594f98f81d6dcf5a058d3da9f2bd68b.png,68544C14DC484983B906DCA58D2B0870
2025-03-28T14:28:17.000Z,Tekikö Barcelona nolon virheen? Kotivoitto saattaa muuttua tappioksi,Osasuna on tehnyt protestin kärsimästään 0–3-tappiosta.,https://img.ilcdn.fi/o_FhzpU-_Xy5ijG4HjaVA-5cSf0=/510x318/top/img-s3.ilcdn.fi/f988c62993b5fe0a26cf3299d892f2ce43ea32b6d9d53ca69f857221490de436.jpg,628EAB75B707430B820322871DDA6C43
2025-03-28T14:37:02.000Z,”Maailman rikkain ylioppilaskunta” joutuu myymään arvokiinteistönsä Helsingissä,Myynnin taustalla ovat Helsingin yliopiston ylioppilaskunnan talousvaikeudet.,https://img.ilcdn.fi/rWlhgCFVtXt2g8tPjTdKMHgCXzs=/510x318/top/img-s3.ilcdn.fi/91a18786d872fe0973758e5083d033116eac7453689d4d7dc30ad3672eddcd0f.jpg,FBC18D3912854F0DBB49BBFAE18EF4D6
2025-03-28T14:46:49.000Z,"Nainen piti jaloista kiinni, kun mies kuristi ihmisen hengiltä – Kumpaakaan ei tuomittu",Käräjäoikeus piti uhrin hengissä selviämistä hyvin epätodennäköisenä.,https://img.ilcdn.fi/BmDoYlSm1VvIoIHIwDW5YLjmzYw=/510x318/top/img-s3.ilcdn.fi/8d9d35568f3717c9e09941edefad8c5020fd47cf2d68e1800398908dea25efe2.jpg,A7FF7C46621F443CB5AB6BDF6B2892F7
2025-03-28T14:53:48.000Z,Dani Alvesin raiskaustuomio kumottiin,Dani Alvesin raiskaustuomio kumottiin.,https://img.ilcdn.fi/oHU5lIo6ZjMxngqzPPzImTdUSdA=/0x56:3000x1932/510x318/top/img-s3.ilcdn.fi/b96ab1cd1559c7ae55185b0e05598fedbb41ed1ccf77cafeb8cb289b7294fceb.jpg,39BEE14CA9604AA0A972829F1D485D22
2025-03-28T15:03:58.000Z,Suomalaisbändin comeback oli tyssätä alkuunsa – Yli 20 vuotta vanhat taustanauhat käyttökelvottomia,2000-luvun alussa tunnettu @Junkmail-yhtye esiintyi ensimmäistä kertaa 20 vuoteen.,https://img.ilcdn.fi/8Y9HCnt3OnsaFqS1cXCZllDSvF8=/510x318/top/img-s3.ilcdn.fi/31484dfbf83e54fdf924f82e43d00b78e9cedeb0534e3757ec2a376bf4342f39.jpg,061981248D034A5FA347A077C337697D
2025-03-28T15:04:12.000Z,Näitkö tämän tytön? Soita 112,Poliisi pyytää havaintoja hätänumeroon 112.,https://img.ilcdn.fi/GvIPeTWKWzcs_C7Rrzig51-GsDs=/510x318/top/img-s3.ilcdn.fi/a0fb3b171c45a8bd3fa10978c12f079507c02fbe254946a293ce787c28482d5f.jpg,DF54AF5761004B16860FA6A473975C8E
2025-03-28T15:13:12.000Z,"”Hanaa, hanaa”, käskee vieruskaveri – Sähköautokin taipuu ratahauskanpitoon myös sivuluisussa","Sähköauto taipuu myös vauhdikkaaseen jäärata-ajoon. Ohjaus on auton tärkein viestikanava kuljettajalle, opastaa Polestarin alustakehityksestä vastaava insinööri Joakim Rydholm.",https://img.ilcdn.fi/w5h4zwySvALgTrsEuME0haYqpUc=/510x318/top/img-s3.ilcdn.fi/2827364dbc7cb0753bda6751aeba494c04088c876ebcaa8a01a6d2ceb4193b0f.jpg,19E5AC4593CA46CD862DF3E774CD83A1
2025-03-28T15:15:15.000Z,Epäily: Nelikko tunkeutui omakotitaloon synkin suunnitelmin – Poliisi sai kiinni verekseltään,Pirkanmaan käräjäoikeus vangitsi epäillyt tänään perjantaina.,https://img.ilcdn.fi/UdsHAnNCcp3Ih4QlK_H4fE0tSmw=/510x318/top/img-s3.ilcdn.fi/ee57904c0336402798b262e4be532bc1821e36c24810fdbaf56522bcee917aa3.jpg,35C8408708454D0F8155344E1FA84DF0
2025-03-28T15:24:46.000Z,Suomalainen jättiyhtiö: Iso sopimus Naton kanssa,Suomalainen avaruusosaaminen laajenee Naton päämajan käyttöön.,https://img.ilcdn.fi/_bS7lRCYdPjUcbA12r0Kdn5h-VY=/510x318/top/img-s3.ilcdn.fi/b9e6bb2eda24162a7cbb7ce0464e7f05a2f4f76c12dd5c9528e136ad471e9184.jpg,4750D1698F2E41FAB764C2D46B0C4C6D
2025-03-28T15:33:52.000Z,Kaisa Mäkäräinen: Suomen mestaruus!,Aktiiviuransa jo vuosia sitten lopettanut ampumahiihdon supertähti on edelleen iskussa.,https://img.ilcdn.fi/73QGwF-ZpZUrAK-PG31kis5JFRA=/510x318/top/img-s3.ilcdn.fi/c4adb20309738dac1ac67efbfa87039936e34f1b005a0e5ebe35a97fe8fe0f31.jpg,92FC35EB350A4E799B423B9E13E0827A
2025-03-28T15:43:24.000Z,Kun tunnelma vie mukanaan,"Maarit osaa tunnistaa miehen, jolta todennäköisesti saa hyvää seksiä. Naiset kertovat, millainen tilanne ja mies saavat heidät haluamaan seksiä ensimmäisellä tapaamisella.",https://img.ilcdn.fi/E4fQ9kDXTAa8qjUiY8F5DvCvBXw=/510x318/top/img-s3.ilcdn.fi/7984fd276bd3d5de9565b8abeb99a0c3c61d1eea9be48ee5da87ebd796b6ebd9.jpg,6C3B67654F1C40E499505D812010231B
2025-03-28T15:45:13.000Z,Laura Arffman: Avioero – Puoliso keräsi tavaransa ja lähti,Ylen suosittu ruutukasvo kommentoi eroaan. Anssi Pentsinen muutti pois perheen Helsingin-kodista.,https://img.ilcdn.fi/d2lEdOSnZ2B4T8YZGqdGAFqMPTI=/510x318/top/img-s3.ilcdn.fi/2682d79c4422842e370099ba4a4a52efd73409b0bb5467c3ed3f04aa2f1cadea.jpg,A79487C3BCB74A0996AF9B461F64E40F
2025-03-28T15:45:28.000Z,Miksi helsinkiläiskoulun pihalla pultattiin kaivonkansia kiinni? Rehtori: Tästä on kyse,Salaojakaivon kannet sinetöitiin metallivahvisteilla kiinni lasten takia.,https://img.ilcdn.fi/5GwKZCjBNWfu_ng7E10hI6Damjg=/510x318/top/img-s3.ilcdn.fi/9423bf126c42e308ac47b5c113b88d6722b7e64e8775686ab049585717c4a04f.jpg,05C9A942D2044EC49D8F92323AED4959
2025-03-28T15:55:15.000Z,Karla Karmala komensi ja muut tanssivat – Tästä syystä kaikki meni järkyttävällä tavalla pieleen,"Karla Karmalan oikeuskäsittely särki sydämen. Miksei koko tapahtumasarjaa voinut välttää, kysyy Iltalehden uutispäällikkö Emmi Oksanen.",https://img.ilcdn.fi/VDYAj2b7wNf8OxMljWej2PnvHCM=/510x318/top/img-s3.ilcdn.fi/e0b4a579809363f30bbc803b49826d18dd31d0b737085d5b3df77d93663fac64.png,C7892B3A9F9C4E11BCE91BDC5541EACB
2025-03-28T16:07:44.000Z,Tältä näyttää Alexander Stubbin kotona,Iltalehti pääsi sisään Alexander Stubbin virka-asuntoon.,https://img.ilcdn.fi/FPx3PsJU0EXavVchjuMfdjw3jkI=/510x318/top/img-s3.ilcdn.fi/871298b1c64fca9daeb5b4129ed8756bf8d86becb11174a33297e2dc638d8edb.jpg,7067E15ECAF2411E87566AC9D76B4A70
2025-03-28T16:12:32.000Z,Politiikan puskaradio: Orpo viritti vaalipommin – ”Ei hyviä vaihtoehtoja ollenkaan”,Politiikan puskaradiossa pureudutaan pikku hiljaa kiihtyvään vaalikamppailuun.,https://img.ilcdn.fi/D-zl4N7SuEG8L9HkUNahiHFJyHE=/510x318/top/img-s3.ilcdn.fi/ebb03981e42e3f2f51f7cf8d2076e7397e39d2592c65d708cbb53fbef638d604.jpg,3F44716C8C5542378F71A1933B72E3C2
2025-03-28T16:18:51.000Z,IL seuraa: Tapparan fanit kiehuvat – Nokia-areenassa kaikui kova kuulutus,IL seuraa SM-liigan kuumia pudotuspelikamppailuja tässä artikkelissa.,https://img.ilcdn.fi/8q3Jw9zVFaoY5MpRHCEjnW3GZEI=/510x318/top/img-s3.ilcdn.fi/c8279da565394e1e375ff71116df7497916801aa24296f803f0f14bdf42bf812.jpg,FFE5D9691C1744EDB8D1A6905856ECAF
2025-03-28T16:25:07.000Z,Pilvenpiirtäjä romahti Bangkokissa – Myanmarin tilanne vielä paljon huolestuttavampi,Kaakkois-Aasiaan iskeneen maanjäristyksen pahimmat tuhot näkyvät Myanmarissa. ,https://img.ilcdn.fi/iXoiGRddr2E4iT__zRh8gWgXaBY=/510x318/top/img-s3.ilcdn.fi/22b6e33577982fdfb7b2fb7b7c0b82c6ccec6e88b9e8608353deb64b3a075e57.jpg,CA9CF6C0A6D449348D42571D3955F9EE
2025-03-28T16:32:34.000Z,Näin Laura Arffmanin ja Anssi Pentsisen rakkaustarina eteni,Laura Arffman kertoo eroavansa aviomiehensä Anssi Pentsisen kanssa. Suhde sai alkunsa kymmenen vuotta sitten.,https://img.ilcdn.fi/8657g7fDBQZwGkN4u0iJS4clfHs=/510x318/top/img-s3.ilcdn.fi/e640e9f9be2b956f0768a19f4eb55b35ff715ca8f196cb3069615e743f356f48.jpg,AF9853E372FB4E53B31050FA8FE5B977
2025-03-28T16:34:19.000Z,Tyly näky Nokia-areenassa,Tampereen paikallissarjan avausottelut eivät ole vetäneet Nokia-areenaa täyteen.,https://img.ilcdn.fi/R-nrkn1XQ6g_K8ECvKUhIROHPxE=/0x128:2048x1408/510x318/top/img-s3.ilcdn.fi/a6a4bc2382e9dbb97b1acb82910a21243d63ff4ac833efcdf4e88b796fd4d461.jpg,4AA09DC863C040C69A2E282906F29AE6
2025-03-28T16:37:25.000Z,"Toimittaja sai valtavan törkytulvan, poliisi pitää itse aiheutettuna","”Jos joku pyrkii lainvastaisilla ilmaisuilla vaientamaan tutkijan, toimittajan tai minkä tahansa ammatin edustajan, on sillä yleistä ja yhteiskunnallista merkitystä”, sanoo professori.",https://img.ilcdn.fi/D9KMDseAsMPGHhxqjMybLTEw4hg=/510x318/top/img-s3.ilcdn.fi/5e02729d27c186c11f6064ff310e563b77e6f36e426ef7eff952400248be6d92.jpg,C09CFB0B60324B9ABBA480F4C1DE0EA9
2025-03-28T16:48:52.000Z,Prinsessa Madeleine vastaa kritiikkiin: ”En näe mitään ongelmaa”,Madeleine ilmoitti uudesta aluevaltauksestaan tällä viikolla. Lanseeraus sai myös kritiikkiä. ,https://img.ilcdn.fi/ssr7fvwCtCX-22B2nAA49dEUccY=/510x318/top/img-s3.ilcdn.fi/ab685bfff95ef1bdd398a9136e400bba341e0319c62194b72aa2a08003877a0d.jpg,669E79DA40C54B1FA4238DDF0B2A87AC
2025-03-28T16:51:10.000Z,Mies kuoli rutiinitoimenpiteessä – Yle: Uusi käänne,"Valvira tutkii tapahtunutta hoidon näkökulmasta, Yle kertoo.",https://img.ilcdn.fi/tRq4GvKtAVMMo5zaFl7Y1p6SRuE=/510x318/top/img-s3.ilcdn.fi/8c44156764883b1845e462f071d5c84c2d3501e75bf5b53c748f06c73a4116cf.jpg,C54B9F8C12FF4ED0B552FDBCF3B5376E
2025-03-28T16:56:09.000Z,Mäkihypyssä orastava suomalaisonnistuminen – Syntymäpäiväsankari varmisti voittonsa,Antti Aalto otti mukiinmenevän sijoituksen Planican lentomäessä.,https://img.ilcdn.fi/1Qy3oRO7lEpfG4p9nLs4qywFtRM=/510x318/top/img-s3.ilcdn.fi/56e241e9bba02607ec217e6a4c4192a6fe5bab10e2a2f2828051eb7e8b13d0c5.jpg,3F6ACBDE05224C49BA7A689323B6AD09
2025-03-28T17:04:49.000Z,"Jussi Rainio: ”Pyydän anteeksi, Erika”","”Artistit saavat esiintyä ja ilmentää itseään juuri niin kuin itse haluavat”, Rainio kommentoi puheitaan Erika Vikmanista.",https://img.ilcdn.fi/Mcq4LzCyQAtfLDWWZI-OhvchoRA=/510x318/top/img-s3.ilcdn.fi/92484a661d9c8834a2d6aac636e8835a7f066be7b7f57882e5209192f8d5d38d.jpg,93D9CA69AA6C4CCDB7FF9B2FC70EF113
2025-03-28T17:16:27.000Z,Paatunut veronkiertäjä ja talousrikollinen on ehdokkaana vaaleissa – ”Oikeusmurha”,Perussuomalaisten vaaliehdokas Riku Kastinen pyöritti liiketoimintakieltonsa aikana yritystä.,https://img.ilcdn.fi/lEwRy64yPe1p_DLzKwIpPHBC21w=/510x318/top/img-s3.ilcdn.fi/2af342a6835aba42d3881b4200f30dbf75eec8d06df15e1c038956fa8ded9fd1.jpg,11F2F989726E43638EBD8CC2B89D117C
2025-03-28T17:23:13.000Z,J. D. Vance vierailulla Trumpin havittelemassa Grönlannissa – ”Tärkeä maailmanrauhan kannalta”,Grönlantilaiset ovat vastustaneet Yhdysvaltain varapresidentin vierailua provokaationa.,https://img.ilcdn.fi/kXnzCRzxCyR_V_CfdYEFErcbwNM=/510x318/top/img-s3.ilcdn.fi/c1acb2d1708e2ba341991085af09a5f3c468a2fcde21228239603c231f1053fb.jpg,D3F2A02309AF4E4985B378AD85AEB9F4
2025-03-28T17:29:29.000Z,Nämä karkit ovat vaarallisia,"Tiesitkö, että tutut karkit voivat aiheuttaa yllättäviä epämiellyttäviä oireita. Listasimme karkit, joiden tiedetään vaikuttavan elimistön toimintaan. Osa makeisista on kielletty Suomessa. ",https://img.ilcdn.fi/7qxbNm5GfkGt2qONof7K17t3NME=/510x318/top/img-s3.ilcdn.fi/32975c1fda8f7be1330ee5cea4e572eadd643e182da9efe0705ee074df95594d.jpg,04FFA407F8B94221BEBD59CD3B06F277
2025-03-28T17:33:14.000Z,SDP:stä kovaa kritiikkiä hallitukselle: ”Oikeusministeri ei voi toimia itsevaltiaan tavoin”,"SDP:n kansanedustaja vaatii, että pääministeri Petteri Orpon on puututtava oikeusministeri Leena Meren toimintaan.",https://img.ilcdn.fi/-K1n95wormXvZvER_xi7dFPwMMM=/510x318/top/img-s3.ilcdn.fi/075263a50037be1162cf700ca2f07070c181c29ba7f3d27122e2ec46b4e508e3.jpg,58C3B90993B646EEACEA4C177CFA61A1
