paivamaara,otsikko,tiivistelma,kuva,id
2022-10-08T11:27:00.000Z,Tuulia teki uskomattoman tempun bikini fitnessissä – tulokkaalle jättipotti! ,Tuulia Aula teki uskomattoman parannuksen muutamassa viikossa ja nousi Pohjoismaiden mestariksi.,https://img.ilcdn.fi/frZ4EkqjX0VBE4BWRqSoFxvpiyM=/510x318/top/img-s3.ilcdn.fi/8bf92cd202d54f3b7bb90d9febdfc27f0d98ac437cc440d58a87e68afda860cd.jpg,521854DDEA91462FB03C0B481C4D8D57
2022-10-08T11:28:03.000Z,Kristen Stewart leikkautti Prinsessa Diana -tukan – grunge-versio!,Näyttelijä Kristen Stewart säväyttää uudessa hiustyylissään.,https://img.ilcdn.fi/O3Qj4wG5YOOuXE9nhbeXZQor9jI=/510x318/top/img-s3.ilcdn.fi/a6457ac412058e8b317fe0e0191e0f877b104dd1dc3ef5220f0ce1e726a51945.jpg,2C5293AD0A604E1C8AD953FA44D24915
2022-10-08T11:34:06.000Z,Erling Haaland on dominoinut Valioliigaa mielin määrin – tänään City ei vietä murskajaisia ,Manchester Cityn Erling Haaland on paukuttanut Valioliigassa 14 maalia kahdeksaan otteluun.,https://img.ilcdn.fi/ButuHXuqkdFEtrXtxGZYO4coTAQ=/510x318/top/img-s3.ilcdn.fi/72ff001a2f64e163b6008d2502eba63338ef8649ee1bc4d01ef4386f7f598a1f.jpg,CCA96503E3AD4F62AA834E2E008BC15E
2022-10-08T11:46:08.000Z,Vakiossa huippuvaikea kierros - vain kaksi kotivarmaa tarjolla,Viikon vakiokierros on erittäin haastava muutamista jättisuosikeiksi pelatuista kotijoukkueista huolimatta. ,https://img.ilcdn.fi/5m1LgOhe64OEoeBkjgT8RYsvf-U=/510x318/top/img-s3.ilcdn.fi/3d8ea7c4a9ddd6af84bf15643d719a978dafc058732cf52a3da1f19510857ad1.jpg,8CCBF324FAAB4BF3A4E7DFF6AAB46C61
2022-10-08T12:40:04.000Z,Eemeli-kukko pääsi hengestään minkin hyökättyä kanalaan –kanalauma pelastui,Sieviläistalon kanalaumaa kaitsenut Eemeli-kukko pääsi hengestään minkin hyökättyä kanalaan. Kanat pääsivät pakenemaan pihakoivuun.,https://img.ilcdn.fi/HEdcQZAc-t0RP94wqTL1v3p0bbk=/510x318/top/img-s3.ilcdn.fi/c0bddccf6e1361a48f33825c13ccee55ee85ba14fb1cd3d0e766e37e7ff8632c.jpg,D1D2B92863564263B9D2D14AF0B875B8
2022-10-08T12:40:49.000Z,Laulaja Leo Stillman kertoo romahtaneensa täysin: ”Olin masentunut ja maaninen”,Leo Stillman kävi läpi raskaita ja synkkiä aikoja. ,https://img.ilcdn.fi/T6nQVLAFFtrxMtmJ7a-WMBz1dO4=/510x318/top/img-s3.ilcdn.fi/0ae1586aba4da3b3f16ecab7562a2326a59b81f57c80d23b9ecfff1222d9b96d.jpg,119518E168FF4557AB130EF10815D014
2022-10-08T13:00:57.000Z,Putinin yksityisarmeijalla valtavia ongelmia – julkaisi paljonpuhuvan rekrytointi-ilmoituksen,Palkkasotilasryhmä Wagnerin on kerrottu kärsineen suuria tappioita Ukrainassa.,https://img.ilcdn.fi/ywz8xaePRZeKozByaQZlKxC1RJY=/510x318/top/img-s3.ilcdn.fi/5494ddc31a0f629ab7765af33f40b7e02c3756de0a26127c0eff54d4653ef74e.jpg,9C915B53B07845018695557BE679AB20
2022-10-08T13:04:29.000Z,Joonas Mäkipelto täräytti leuanvedossa mykistävän maailmanennätyksen! Vertailussa omaa luokkaansa,Joonas Mäkipelto teki leuanvedossa uuden maailmanennätyksen Lahdessa lauantaina. Tulos on poikkeuksellisen kova myös ME-vertailussa.,https://img.ilcdn.fi/CqcA3i0x0hIJpJ-EVXnW4DlbvWA=/510x318/top/img-s3.ilcdn.fi/358a598a4e767003fb4ec63a3599c7f5f423ade8125563b209008cce61871e66.jpg,91F7BE214091447A90455991BF21E55F
2022-10-08T13:09:22.000Z,Pääsevätkö junat kulkemaan Krimin sillalla? Tuore video paljastaa mittavat vauriot,Tuore video kyseenalaistaa Venäjän väitteen junien nopeasta paluusta sillalle.,https://img.ilcdn.fi/jfjc-6fU8LRoLp409JkiwYoeB7c=/510x318/top/img-s3.ilcdn.fi/111d79a646174cb4bf666e7694667aa70acba60c4513f75d7ba6f015456cbff1.jpg,C04F1D3215484F5D8EA8DAE7EA83D146
2022-10-08T13:23:29.000Z,Karlie Kloss ja täydellinen it-tytön look – Tässä asussa on kaikki kohdallaan,Tämä asukokonaisuus on täydellisen hurmaava.,https://img.ilcdn.fi/BeHuoVZweNgWsTJawl_-fBBqF3U=/510x318/top/img-s3.ilcdn.fi/3dbad1409faf5881a8e168b7fe222a0e7acf24e8b4ba1feebc8759e5f869f936.jpg,66911307E43647FBB84FB01CCA17CD8C
2022-10-08T13:46:18.000Z,Kaapeleihin kohdistunut sabotaasi pysäytti junaliikenteen Saksassa,Nord Stream -putkiin tapahtuneiden vaurioiden jälkeen Euroopassa on korostettu kriittisen infrastruktuurin suojaamista. ,https://img.ilcdn.fi/HrjqI9J0oi68AObqjUOp378-Fn0=/510x318/top/img-s3.ilcdn.fi/3ed179e75ed3f331aa423893f454b4495d8bba11305a65c73ea4c7d3111db0be.jpg,17CC02524B33424BA00AF1485CAF3D03
2022-10-08T13:51:57.000Z,Kari Väänänen avautuu kirjassaan kokemastaan työpaikkakiusaamisesta – lähti ovet paukkuen teatterinjohtajan pestistä,Kari Väänänen kokee tulleensa alaistensa kiusaamaksi Rovaniemen teatterissa.,https://img.ilcdn.fi/Rj209U3ACRydCXnTDyU5ViDrmQ8=/510x318/top/img-s3.ilcdn.fi/53c717ad6671a340b8c65d93cfa8399eceea246f86ea15b35535a1772dba9967.jpg,93BFCD60DBA04728A860B0C06122424B
2022-10-08T13:57:46.000Z,”Isällä on karvavaippa” – pikkupojan paljastus hämmensi päiväkodissa,Onko sinulla jokin hulvaton muisto lasten sutkautuksista?,https://img.ilcdn.fi/GKymu581B6G-VIVuwVsm8B3AWrI=/510x318/top/img-s3.ilcdn.fi/a1d7abfef90d080a3d1d70cde73df244335a66c525ec01b95f9afb4f009c9b68.jpg,BA7FA32AB04A4F949ADB64FEC1BB23FF
2022-10-08T14:05:08.000Z,Palokunta pelasti kauriin likakaivosta Vantaalla,Metsäkauris tipahti likakaivoon vantaalaisen omakotitalon pihalla lauantaina.,https://img.ilcdn.fi/CctZIPGJmXZ3SXD50pfpWmrdLuE=/510x318/top/img-s3.ilcdn.fi/712ca4bc59930ad7b9986d7352a94a06e2af2c8f8f55cc3a13f9aa4798eca7aa.jpg,2D06021861FB4C45998F0AD2F1499E4D
2022-10-08T14:06:57.000Z,"Putin sai osakseen ankaraa vinoilua siltaräjähdyksen takia – ”Hyvää syntymäpäivää, herra presidentti” ",Perjantaina oli Venäjän presidentti Vladimir Putinin 70-vuotissyntymäpäivä. Krimin silta räjähti lauantaina aamulla. ,https://img.ilcdn.fi/OLHPnDWB5Y_fUG5zqOMy_JqWCAc=/510x318/top/img-s3.ilcdn.fi/e09cc84c05fcdf7d66d44c2848c0ab0f77fc3273bdfcec494055884af6453d23.jpg,8033D0AC4B3042FB8012435C15C86D17
2022-10-08T14:09:12.000Z,Skandaali murskaamassa Kanadan jääkiekkoliiton – pääministeri latoi suorat sanat: ”Käsittämätöntä”,"Monet suuret yritykset ovat jäädyttäneet välit Kanadan jääkiekkoliittoon, osa jopa pysyvästi.",https://img.ilcdn.fi/NIs5VN-qcpkVNg_8jzOINyoTzls=/510x318/top/img-s3.ilcdn.fi/fbb509c154d4dcc06238c3d6e1539636243635f0719045a3de2c83017bb0d86e.jpg,968A101C1C55492689400879C3F60DA2
2022-10-08T14:29:40.000Z,Lasse Kukkosen paita nousi Raksilan kattoon – Jukka Jalonen veisteli luottopuolustajastaan: ”Luistelu ei aina silmiä hivellyt”,Juhlapuhetta olivat pitämässä muun muassa Jukka Jalonen ja Niklas Bäckström,https://img.ilcdn.fi/tnqlRbzNbvaJpFQWJg9D_tsT9M8=/510x318/top/img-s3.ilcdn.fi/8eb14cc82931d2fd911d68a408b5b6f8891f050132641f627f758667e2f5d29e.jpg,2087A05B1B5D446B83F699B9B4C37E0E
2022-10-08T14:34:59.000Z,Ammattijärjestäjäkin yllättyi tv-sarjan kuvauksissa: ”Se näky oli minulle uutta”,"MTV:n uutuusohjelmassa autetaan ihmisiä, joilla on liikaa tavaraa.",https://img.ilcdn.fi/kmMYw6Qu5eZxlj3oOa3pmWlpvFw=/510x318/top/img-s3.ilcdn.fi/a39e5fa8bb42377a5fa71764d57657ea9136ccd956710a85775b61a74bc078de.jpg,5DB24F475412493B8C8C6B29D0FBB573
2022-10-08T14:44:56.000Z,"Priscilla Presley paljastaa, miksi liitto Elviksen kanssa päättyi ",Priscilla Presley kertoo eläneensä ”kuplassa” Elvis Presleyn kanssa.,https://img.ilcdn.fi/V6jODWtQrJhaH5Vn9trer71Q_2g=/510x318/top/img-s3.ilcdn.fi/5b7ba99397f0242f53f7b978ac6fe72203bd9d2366eb1b47414500a0d8b8cca4.jpg,C71E7575E1A741AC9DEB8717CC381544
2022-10-08T14:46:13.000Z,Yhdeksän kuollut huoltoasemalla tapahtuneessa räjähdyksessä Irlannissa ,Onnettomuudessa on kuollut ainakin yhdeksän ihmistä ja kahdeksan ihmistä on sairaalahoidossa. ,https://img.ilcdn.fi/79ocAAP8HvE05I3vHBYNO2tfeH0=/510x318/top/img-s3.ilcdn.fi/4f00d929e6268541bc84709830e01887db44ea7ce78fc34f3900df9fb0513823.jpg,4D45CEEF3E834745BC500ECCA0C14048
2022-10-08T14:54:04.000Z,Vilkas liigakierros alkoi – Tappara lisäsi SaiPan tuskaa Nokia-areenan kiireisessä jääkiekkoillassa,Kärpät sai lentävän lähdön Lasse Kukkosen juhlailtaan.,https://img.ilcdn.fi/Vgc9eOGELT4rKzekGrLtVpUhrqg=/510x318/top/img-s3.ilcdn.fi/e90366a96c6771c6a1282c5bd8b401c16973ac3e1b4c06bc3e8ae10ea9334675.jpg,B339C973A8F043DA96EE4C3C1B8D2A93
2022-10-08T15:02:54.000Z,Kuningattaren painajainen,"Netflixin sarjassa The Crown esitettiin kolmoskaudella niin hirvittävä kohtaus, että monet katsojat järkyttyivät. Kaikki tapahtui myös tosielämässä. Tällä tragedialla oli valtavia vaikutuksia kuningatar Elisabetiin, joka teki pahan virheen.",https://img.ilcdn.fi/-751ke4HW2nBkIGxlNKDjezXvnw=/510x318/top/img-s3.ilcdn.fi/9d9a8d3fdafc50886293cf3060cfce8491b2b5b018b6e758e93f4cad277f9263.jpg,4D77A60FC9484477BF9159A482D4B401
2022-10-08T15:04:08.000Z,EU-asetuksesta 930 miljoonan vuosikustannukset Suomelle – hallituksella edessä ”metsäsota”,"Oppositiopuolueet moittivat rankasti hallituksen myönteistä kantaa EU-asetukselle, ja tälle syksylle ennustetaan jo ”metsäsotaa”, kirjoittaa Iltalehden Elli Harju.",https://img.ilcdn.fi/09az1rNGDIVkQLkQFrsmY7ScztI=/510x318/top/img-s3.ilcdn.fi/ae266f4ba9b00cf8ad490fa702ff05900c4813fe629e0f4182c044e0ab155e00.jpg,B997A6AF48764A9381F721B26EC3A718
2022-10-08T15:08:47.000Z,Sähköpyöräbuumi levisi Eurooppaan – autoilua verrataan lihan syömiseen,"Pyöräily, ja sen sisällä sähköpyöräily, on Euroopassa laaja trendi, jonka odotetaan jatkavan kasvuaan.",https://img.ilcdn.fi/x5h_WQ5QvvlQGUHxI2rYFkQ0OrQ=/0x0:3000x1873/510x318/top/img-s3.ilcdn.fi/e9ad92928833899214c0b10115ff9ec9877cc7ae01903fba786ad3a8175ae21b.jpg,8FD37D68D44E4E79966CE8FFCA4DC6ED
2022-10-08T15:20:37.000Z,Videot kertovat venäläisten härskistä ryöstelystä Ukrainassa – ”Kyllä tämä käytös on paikoin kuin rosvojoukolla”,Venäläisten ryöstelystä on raportoitu käytännössä kaikilta rintamalinjoilta koko Ukrainan sodan ajan.,https://img.ilcdn.fi/4VmirhG-eHOfaC26OWdcA4e4J8s=/510x318/top/img-s3.ilcdn.fi/770a26ff1e374b607ba618ecd3338d820b6fc8096dd79bb997decdfc8bf06efe.jpg,9E66637F97264272BE17D1A4C7A1133E
2022-10-08T15:27:03.000Z,Maikku Hiljanen palasi uskomattomalla tavalla – kuvataan fitnessurheilun lahjakkaimmaksi: ”Kiitokset vaan sirkukselle”,Maikku Hiljanen jatkoi voittoputkeaan Lahden SM-kisoissa.,https://img.ilcdn.fi/HsxRiSaz85lCXlBV3WhtDfvDRSk=/510x318/top/img-s3.ilcdn.fi/bef9e2d8e74599249724fc9a29ea0bac3235424510232e0135381b15fb5a8795.jpg,9FB40A3916F5459B8BCF785E9ADEE0FD
2022-10-08T15:47:42.000Z,BB-Sofia avautuu transtaustaisena saamistaan tökeröistä kommenteista: ”Ihmiset ruokkivat omaa uteliaisuuttaan” ,BB-Sofia on joutunut kestämään ihmisten epäasiallista käytöstä väärinsukupuolittaessaan häntä. ,https://img.ilcdn.fi/MSwfXxEYyaVJebqIIuwSE9vMQTc=/510x318/top/img-s3.ilcdn.fi/b70322195c91edd5ecac94178a89bf9912dda0f0029642b8bd275750a949af55.jpg,461E3A22A2FE4FE39941FEB8500BBDFA
2022-10-08T15:56:00.000Z,"Maailmankuulu sottapytty laittoi kotinsa myyntiin – juhlat tulossa, jos häipyy","Naapuri lupaa järjestää juhlat, jos talo vaihtaa omistajaa.",https://img.ilcdn.fi/kqaS0liGlUmnWXt2UPI6Hw0r1J0=/510x318/top/img-s3.ilcdn.fi/7f8be6e28dc065edeab4438cf0df8d130c15b1d94e1cfe63a125af30c6851110.jpg,DF4C16D3A81749BBA97385993635CC16
2022-10-08T16:12:12.000Z,Venäjälle tärkeä Krimin silta kärsi kovia tuhoja – tämä räjähdyksestä tiedetään,Tähän juttuun on koottu Ukrainan sodan tärkeimmät tapahtumat lauantailta.,https://img.ilcdn.fi/KjFaH4BIz_iGDTQODUw826cEoac=/510x318/top/img-s3.ilcdn.fi/302db955540072f52b346d128387f71c14f0c2df0d775cc2d08058b49cb2960b.jpg,3382D81DF64B4A269877254B5147F19F
2022-10-08T16:16:37.000Z,"Venäjän supertähti saa rapaa – ”Kaikki tietävät, millainen ego hänellä on”",Venäläiskolossi on jäänyt uudessa seurassaan statistin rooliin.,https://img.ilcdn.fi/F-K66ZOPtF2RWmoiLssSh1eJSXQ=/510x318/top/img-s3.ilcdn.fi/c07f4aaa273e0cfe7dd388e363151b3e485b6e5543aa18994baff1c89fa3c24b.jpg,0FF7B80E5ACF46BE8B266F4F84446A0C
2022-10-08T16:18:52.000Z,Outo rahasotku Ylen kansainvälisen draamasarjan kulisseissa: tuotantoyhtiö jättänyt palkkoja maksamatta,"Jarno Saarisen elämästä kertovan Ride Out -sarjan työntekijät kertovat, ettei tuotantoyhtiö Fanfar ole maksanut palkkoja sovitusti. ",https://img.ilcdn.fi/sawgxi7OuprTV_GcPEiG75w4kOQ=/510x318/top/img-s3.ilcdn.fi/0eaa1c62a210b04616ac4bb22b3ce02789d22c5f8eed7ea7b1489b0f0b6dc8d9.jpg,498B202DB9064B4284A939F54160832F
2022-10-08T16:45:27.000Z,Talousahdinko johtanut kaaokseen Libanonissa: ihmiset yrittävät jopa ryöstää pankkeja päästäkseen kiinni omiin säästöihinsä ,Libanonin pankit ovat kiinni talouskriisin takia.,https://img.ilcdn.fi/rmVc0VNrT4EYJMym4rcoVpui2Yw=/510x318/top/img-s3.ilcdn.fi/b78d1ee87502ec427ed37db338d2422f1ba1da9fd8845eaabf421c7d329ae5e5.jpg,15C1DAC6D39A4448AE6DC9E48E42BC7A
2022-10-08T16:56:57.000Z,Yli tuhat autoa jonottaa pois Krimiltä: ”Ei paniikkia”,Räjähdys sai monen ihmisen pakkaamaan laukkunsa Krimillä.,https://img.ilcdn.fi/LBR9hdVkWmYlBnX25S0hZrkq4r8=/510x318/top/img-s3.ilcdn.fi/3331b6ee0fadb9af35f028979d0b349b13f8a431546a352dfa645eba87d0953f.jpg,571D747E058143978DC7C2ADEAC95C8A
2022-10-08T17:20:21.000Z,IL-Arvio: Metsurin tarinan katsominen on kuin kivirekeä vetäisi,Cannesissa palkittu kotimainen uutuuselokuva on hidas ja kankea.,https://img.ilcdn.fi/iMj1H5yz21ZrBt9QBFNq58b7YHo=/510x318/top/img-s3.ilcdn.fi/115a54896921b880d80e2efae2df0a84fffde7524e94e4886b632fc457e531dd.jpg,B7DD6AFFA5BD4598A30920F5BD9B5CDE
2022-10-08T17:25:41.000Z,Tässä ovat Suomen NHL-suosikit – valokeilassa kuusi joukkuetta,Sinivalkoisten lasien läpi kuusi NHL-joukkuetta näyttää muita mielenkiintoisemmilta.,https://img.ilcdn.fi/lCW6a8aQwiTIvngT_AwV9OegsOE=/510x318/top/img-s3.ilcdn.fi/eab37b72fba4c2abd90f88b12189946c0147bae58a3dd0fdb0b31f591873e0f8.jpg,169461F36F754D7B96891724ED1D1565
2022-10-08T17:31:44.000Z,Puliukkoja mytologisoidaan Facebookissa,Puliukkojen historiaa tutkinut Ilkka Jokelainen katsoo puliukkotarinoiden seuraavan kylähulluista kertomisen perinnettä.,https://img.ilcdn.fi/bwOrBorsEOEsUggXn8MQx5F7GUs=/510x318/top/img-s3.ilcdn.fi/67d86261e5d82ac35b36a9bb62da788ab0c7c8bc66726092a694a3a7f2caea95.jpg,6FC238B5AC054D48A046CC69AB85140F
2022-10-08T17:44:58.000Z,Barents Obsever: Venäjällä juhlittiin Alakurtin ”vapauttamista”,Venäjällä on juhlittu Suomelle kuuluneen Alakurtin ”vapauttamista”.,https://img.ilcdn.fi/EyTTmULzXtdfJHCgrFYEydxxCjw=/510x318/top/img-s3.ilcdn.fi/e023341a85856059876a795c6ffad9e4646f9bc3f0be6067b8ca62743394a63b.jpg,B69CA886C9D54D0C96EEF0E969200920
2022-10-08T17:53:43.000Z,Pohjois-Korea ampui jälleen ohjuksen mereen ,Pohjois-Korea on ampunut ohjuksen mereen. ,https://img.ilcdn.fi/EUye8Z8vS2hDTgXYdpo6uhViI5A=/510x318/top/img-s3.ilcdn.fi/c8149c30f6a301f7ec3f8c60115368ad99859ac5810fa9e3f44ee0b3586c5eaf.jpg,E1F8B41EC6874C3C8D48E5219D517657
2022-10-08T18:01:01.000Z,IL selvitti: Näillä autoilla ajetaan eniten ylinopeutta,"Iltalehti pyysi Poliishallitukselta tilastoja siitä, millä automerkeillä ajetaan eniten ylinopeussakkoja.",https://img.ilcdn.fi/9iuLl-aTnJHxi8n2XZlkioDkaVw=/510x318/top/img-s3.ilcdn.fi/5eaa1125aea64388bd862e33f54b50c4a1c0c3a65baf54eb1603208a5e440bac.jpg,0858535B06664D9987103490D3A0EFA7
2022-10-08T18:23:54.000Z,Lukas Hradeckyn Leverkusen aloitti lupaavasti uuden päävalmentajan alla,Schalke kaatui murskaavasti 4–0 Lukas Hradeckyn vartioidessa maalia.,https://img.ilcdn.fi/vB7eZVOBw793OGB8bYIYGQ03z10=/510x318/top/img-s3.ilcdn.fi/e514612d545254884eddaba16f6a17f178da5a0746184f2e1887327e2d34ec9e.jpg,D4453949DBB54345BCB39333A23F967E
2022-10-08T18:26:08.000Z,"Karoliina kiipeili korkeuksissa, kun hän kuuli metallisen kilahduksen: ”Hengenlähtö oli pienestä kiinni”",Karoliina Halme putosi viidentoista metrin korkeudelta köysirataturmassa. Vakavat vammat saanut Halme selviytyi kuin ihmeen kaupalla elossa. Nyt hän työskentelee röntgenhoitajana ja edustaa Suomea istumalentopallossa.,https://img.ilcdn.fi/SI1_zOBWkWkHk6KNRkNQjnpCyJY=/510x318/top/img-s3.ilcdn.fi/08a92788ea3ee6a0f6ad881c49ecd5e1f9bfd8858bce060bc196b893591ecc80.jpg,1BF2B60AC5E94E0FBDA7396972DC56AF
2022-10-08T18:26:46.000Z,Rakastettu Tipparellu tekee täyssähköisen paluun,"Renault 4 esitellään kokonaisuudessaan Pariisin autonäyttelyssä 17. lokakuuta, mutta saimme jo ensimmäiset kuvat tulevasta uutuudesta.",https://img.ilcdn.fi/5DydaS25ZFdmRPDceoNA3fgMP7g=/510x318/top/img-s3.ilcdn.fi/4006939288548fa31b2a240e09abb05283fe246d4a062a24ae0177f124c58049.jpg,264596EFC2024CC4A1FFD2BB73EF8040
2022-10-08T18:39:23.000Z,Masked Singer Suomen kuudes hahmo paljastettiin: oli toivonut pääsevänsä mukaan ohjelmaan,Masked Singer Suomen kuudes paljastettava hahmo on Ukkonen. ,https://img.ilcdn.fi/9RU9E4eZkerNLQrB-tkDjxUu564=/510x318/top/img-s3.ilcdn.fi/eb27ea4d7dd413833238421127ffed7bd0b43bd7b255aa6da2383a2bf924169f.jpg,FD9D000F7BCD40D5BD021EE39B90267A
2022-10-08T18:49:26.000Z,Teemu Pukki teki komean esityön – Norwich hukkasi pisteet Prestonille,Norwichilla oli mahdollisuus mennä sarjakärkeen.,https://img.ilcdn.fi/1WgemFnW07j1C4MpsbJmtDTPs2M=/510x318/top/img-s3.ilcdn.fi/21f184c14d1ecc3f3c4e3ce106a2146e9ddf860206d8f5f7c4b2f3deb504bc83.jpg,FCCEFD827B2240CA8388BA88EA66719A
2022-10-08T19:03:59.000Z,Kuva: Teboil lähetti asiakkailleen pitkän selityksen venäläisomistuksesta – asiantuntija ei vakuutu,"Asiantuntijan mukaan kansainvälinen yritysrakenne ei muuta sitä, että lopulta omistajuus on venäläisellä Lukoililla, minkä vuoksi rahaa virtaa Venäjälle.",https://img.ilcdn.fi/cm5BdHKwbfIkv3mzRfq8PnNHEZM=/510x318/top/img-s3.ilcdn.fi/24a50e1fc8c68cfea6738f8b64a1f9bf52c43653754ddebe228cfdf0077a5b81.jpg,DCF5E82665124240A32A8648107FF710
2022-10-08T19:05:16.000Z,Pete Davidsonilla salaperäinen laastari – poistattaako mies Kim Kardashianille omistamiaan tatuointeja?,Pete Davidsonin laastarin alla on aikaisemmin lukenut My girl is a lawyer.,https://img.ilcdn.fi/OeZwi9shj37Cuid0iWAGJcjB9bo=/510x318/top/img-s3.ilcdn.fi/bd390e4b742e2125b47d9545d6a4a93e4a50a0493069efbe223f5eaae4349c89.jpg,984676ACEF134669B4607D821C773C96
2022-10-08T19:39:51.000Z,Bikini fitnessin huippukisan voittanut Kimberly teki yllättävän havainnon Suomen säästä: ”Kaikki kyllä sanovat”,Kimberly Percival nappasi voiton bikini fitnessin ammattilaiskisassa Lahdessa.,https://img.ilcdn.fi/BPRjQuixrICPFBSzvArhspxD1ck=/510x318/top/img-s3.ilcdn.fi/15eae4c733d59de1f2b3df61ef1be47df1bbf0378af1c6605be1064abccf0445.jpg,1889268ACE7F4B43BC51A6FA2D2D25A7
2022-10-08T20:03:18.000Z,Viljelypalstaa pitänyt mies ruhjoi lapiolla kuoliaaksi kääpiöpinserin – pikkukoira menehtyi omistajansa syliin,Vain muutaman kilon painoinen pinseri menehtyi raskaan lapion lavan osuttua siihen. Asiaa käsiteltiin oikeudessa Kuopiossa.,https://img.ilcdn.fi/I-7zXwoo2ZNuMtEwYvuRrlBpzw8=/510x318/top/img-s3.ilcdn.fi/984a781f513269073a51c4620f485e2ef0d96601ce2a51b9549aa4fdc7806d5d.jpg,9181B966F72E453BA8C88BCE6791A8E0
2022-10-08T20:04:42.000Z,Whoopi Goldberg tyrmistyi elokuvakritiikistä: ”En käyttänyt läskipukua”,Näyttelijä Whoopi Goldberg kiistää käyttäneensä läskipukua.,https://img.ilcdn.fi/vSVNQ9EYMVP-vFr6DtI5dseGlSg=/510x318/top/img-s3.ilcdn.fi/ccd8a076e6e928f53e957c8fa7f22fb73cceddfe87bcc3e56019a73eed38c79c.jpg,34A8F09FC5A74177B5B22D58CA941AAD
2022-10-08T23:10:22.000Z,Yksi Skotlannin kuuluisimmista sarjamurhaajista kuoli vankilassa,Ainakin kolme naista murhannut Peter Tobin kuoli 76 vuoden iässä lauantaina.,https://img.ilcdn.fi/qWzV_Izw-je8zS-FCZXKZoP63z4=/510x318/top/img-s3.ilcdn.fi/147eef7faaa10e4faab7106a8c1d67a01d2f531aa4514c5dfd3e77ad6501aafd.jpg,B9CE12EC4D034E2D847BCEB4CC1CA5BB
2022-10-09T01:58:31.000Z,Eddie Murphy joutuu maksamaan elatusmaksuja Mel B:lle 35 000 dollaria kuussa,Elatusmaksua nostetaan Mel B:n laskeneiden tulojen perusteella.,https://img.ilcdn.fi/dz7qELhBz0G6aZD4h6IjIFJdJdk=/510x318/top/img-s3.ilcdn.fi/56747a70025dbd1a2c93190f55106da9c4737c5d841b287f7c3d38453bf0a89f.jpg,46D08EF293A648B6871321B3F04F86D2
2022-10-09T03:16:39.000Z,Kultakuumeen legenda,Metallurgian ylioppilas Frans Björklund löysi Ivalojoelta kultaa enemmän kuin kukaan muu oli löytänyt. Hänestä tuli kultakuumeen legenda. Rikastumisen sijaan myyttistä miestä odotti karu kohtalo jo verrattain nuorena.,https://img.ilcdn.fi/MYJ49BuEcIjgt4jeOkKNKyWS9Rw=/510x318/top/img-s3.ilcdn.fi/84d9e0f510e2f44d158e99aedc6bead35d5dc113de66460f403796eac8f64ea2.jpg,8C54BBDDA8D049AA9B1600B34540CC17
2022-10-09T03:18:46.000Z,40-vuotias suomalaismies löydettiin kuolleena Virosta,Miehen läheiset olivat tästä huolissaan ja olivat pyytäneet poliisia aloittamaan etsinnät Virosta.,https://img.ilcdn.fi/vGotyNrspb5BUvGxXfrcsk05YWQ=/510x318/top/img-s3.ilcdn.fi/e6f8a6d41a6132c57f0bdc5fe919138227be9b757769cae166b94155f40f8b28.jpg,5E4A96ED0FDE4200A0146B4D965A685B
2022-10-09T03:41:03.000Z,"Ensitreffit alttarilla -Otto vetäytyy: ”Koen, että jotain meidän väliltä puuttuu”",Ensitreffit alttarilla -Assin ja Oton tunteet eivät ole kehittyneet samaa tahtia.,https://img.ilcdn.fi/zO9ZLd6H4GhfT8tyPZuvj-_Nslg=/510x318/top/img-s3.ilcdn.fi/1aab8c0a0b0d6053a5c466517dde5b34faefb319177773f5862fc19f15228e5a.jpg,DFB0454B8B8647069D1D7E1D6F4084C8
2022-10-09T03:42:43.000Z,Pääosin aurinkoinen päivä tulossa – varaudu kuitenkin tuuleen,Sunnuntaipäivästä näyttää tulevan aurinkoinen. Idässä ja pohjoisessa saatat tarvita sateenvarjoa.,https://img.ilcdn.fi/MwO1huTMeYFuv4imrTNNWrAaxTA=/510x318/top/img-s3.ilcdn.fi/432f3c598b1fccd5f3cfbaef197b9340091d6b752ef31bb6351229e05e13f00b.jpg,2AE5C5924BBF4FD2BEF153A3629A236B
2022-10-09T04:00:00.000Z,Suuntaa talvirengaskaupoille ennen kuin on liian myöhäistä – hinnat korkeimmillaan marraskuussa,"Jos talvirenkaat kaipaavat päivitystä, ei uusien hankinnassa kannata viivytellä. Hintaopas-hintavertailupalvelun avulla voit säästää renkaissa ja varmistaa saatavuuden.",https://img.ilcdn.fi/NpDSAtkj9Eb13YGuxbbF3UUDsW4=/510x318/top/img-s3.ilcdn.fi/f341abb47dbc7f7230214ff5069a551bc39b50f7996d165f1b7a4f6d56de46d6.jpg,42F6593E3E1C40388D636B4A7C38454E
2022-10-09T04:05:29.000Z,Leijonat-legenda järkyttyi näistä kuvista: ”Ihan hirveitä” – yrittää nyt pelastaa maailman,Jukka Tammi kipparoi vesistöjen puhdistamiseen erikoistuneella aluksella.,https://img.ilcdn.fi/Gb44j9WJMrRScM56z3iI7Ge63lU=/510x318/top/img-s3.ilcdn.fi/be40472aa53d2d93c539f2ca8b39e4a0770b714548fa3e007c8acd1b67751b30.jpg,1291C382EBF8419DAFCC524BC56552C6
2022-10-09T04:11:39.000Z,Videot sotasaaliista juhlivista ukrainalaisista kertovat roimaa kieltä Venäjän massiivisista tappioista: ”Huhut pitävät paikkansa”,Ukraina on viime viikkojen aikana ottanut Venäjän hylkäämää sotakalustoa hyötykäyttöön etenkin Harkovan suunnalla.,https://img.ilcdn.fi/iLi79JMRI14UPMySkNqtlPGqJrQ=/510x318/top/img-s3.ilcdn.fi/d8fdf2fdc894b8e57fdda9ab0e5f48be2be4d3c7a4c6c3e67d55950c6562dffe.jpg,AD48F4387C6340E9B864BC9B540E9444
2022-10-09T04:30:52.000Z,IL seuraa: Suzukassa kaatosade – avauskierroksella joukkokato,Suzukassa ajetaan hyvin märissä olosuhteissa.,https://img.ilcdn.fi/cjZxoqwFjhphW698jyNq5jHE1Z4=/510x318/top/img-s3.ilcdn.fi/936f488e9cd9923947d626aa654a2ff4adc09019aa8121b3a31a4bd4e8791526.jpg,75AADB99A50546699B35DF68ADFA26A4
2022-10-09T04:31:12.000Z,"Krimin sillan räjähdyksestä oli kulunut vain tunteja, kun Kiovaan kohosi uusi taideteos",Ihmiset poseerasivat innoissaan taideteoksen edessä lauantaina.,https://img.ilcdn.fi/nrmYkjyV4tMzQEcp6-h-ZynGvoQ=/510x318/top/img-s3.ilcdn.fi/83779f96c7eb6052205a1f121c1b55e3b6adf14934d391db59875a4b1a89c4bf.jpg,67505AB3405C401BBA1B6612C7A188CE
2022-10-09T04:33:37.000Z,Tiedätkö miten tässä kuuluu ajaa – ajoratamaalaukset antavat väärää tietoa,"Iltalehden lukija lähestyi toimitusta erikoisen liikennejärjestelyn tiimoilta. Pirkanmaalta, Lempäälästä löytyy nimittäin linja-auton kääntöpaikka, jossa ajaminen ei ole aivan niin yksiselitteistä kuin kuvittelisi.",https://img.ilcdn.fi/SLsPob-DA5pfE59vc5ffEKeDiN0=/510x318/top/img-s3.ilcdn.fi/fbbcaca2fc20b3dd8a136bb78bad05db60591c03549c2c1b58855a88b2a6e7e1.jpg,7CA0607EC0814FBD9D695FBBD5880D91
2022-10-09T05:01:44.000Z,"Tänään tv:ssä: Renny Harlin ei halua, että hänet unohdetaan –   ""Olen ollut vähän pois Hollywoodin valokeilasta”",Ohjaaja aikoo tehdä paluun Hollywoodiin The Bricklayer -elokuvallaan.,https://img.ilcdn.fi/fZnBNzCXA9o5Ovov6AlCuUmMTyY=/510x318/top/img-s3.ilcdn.fi/a12f827937ca47e13a63368fb02ecb15f284e9d835214ba3caf11e4ce6d4e18d.jpg,A894EE588070472E90F6B93DBFF45357
2022-10-09T05:32:41.000Z,Vantaalaisperheen käsittämätön temppu: sähkölasku -480 euroa – ”Kyllä hymyilytti”,Kallis pörssisähkö onkin onnenpotku vantaalaisperheelle.,https://img.ilcdn.fi/p2Lko_cYQqBPaHBF2YEXrJJjhVY=/510x318/top/img-s3.ilcdn.fi/ce2d9172399ad6a4a8c14f0f96e650926bd9b43f30187ed834f67330cad5db56.jpg,51E7A67013AD42FDAF5F5F14FE91EF10
2022-10-09T05:38:29.000Z,Hengenvaarallista sekoilua F1-kisassa – traktori keskellä rataa ,Jules Bianchi menetti vastaavassa tilanteessa henkensä vuoden 2014 kisassa.,https://img.ilcdn.fi/h8Ga06f2IRdnY9dOmeAy0ommDfU=/510x318/top/img-s3.ilcdn.fi/67e4feed6f8b5cafb64bc09f1a2508f26de2a09cd97393b9e28be2c3e287ca69.jpg,80324882C8104CB2A37D4A976C47771D
2022-10-09T06:02:08.000Z,Prinsessa Madeleine adoptoi koiran: Tässä on Oreo,Prinsessa Madeleinen perheen Teddy-labradoodle sai kaverin havannankoirasta.,https://img.ilcdn.fi/-tnVM4oVLlKY-d-B3GUT4lxJC9k=/510x318/top/img-s3.ilcdn.fi/dceb05ce9c9578c7d7f148722afdacf971d02ecb257da8e26569e0d7053fd26a.jpg,985C05A0D1EA4965A4E802C868801BD3
2022-10-09T06:02:40.000Z,Elisan kovien kipujen syy oli tulehdus aivoissa:”Jokainen päänsärkyyn viittaava oire tuntui pelottavalta”,Filosofi Elisa Aaltolan erittäin vakava sairaus muutti hänen elämänsä prioriteetit.,https://img.ilcdn.fi/8C7iA5FqR8LB9L81uRV08sJfLfM=/510x318/top/img-s3.ilcdn.fi/9ef26acc40a892a759b6c955439c3d2b2ffa24219376f79297c664aec5e05125.jpg,992132842CEF42458E7AE8C4BCA4FCFB
