paivamaara,otsikko,tiivistelma,kuva,id
2023-04-26T10:29:20.000Z,Otkesin tutkinta kariutuneesta miinalautasta valmistui,Merivoimien miinalautta ajoi karille viime kesänä. Otkesin tekemä tutkinta on nyt valmistunut.,https://img.ilcdn.fi/DQ4ucMLWU4MQVwvMjbKPYX7zRLw=/510x318/top/img-s3.ilcdn.fi/56ec6712e9892a63eef1e79d2f87477e0abbdbdd1e5e65555671663344efe694.jpg,A2D174FA66094E078B08937DFD007A2D
2023-04-26T10:29:44.000Z,Erdoğan poistui dramaattisesti suorasta tv-lähetyksestä – Määrättiin lepoon sairastumisen vuoksi,Turkin presidentti on peruuttanut kampanjatilaisuuksiaan huonovointisuuden takia.,https://img.ilcdn.fi/ZRQK8bzTnFfYym2HMbZbjeHmnqg=/510x318/top/img-s3.ilcdn.fi/2b487d8b65f5e2165121dd4d5c237dc55a68e694411fe982c2e7cd0b0530bec9.jpg,B8D7ABE1215C4925868322B7A84F8625
2023-04-26T10:37:00.000Z,Susijengin päävalmentajalla salainen toive MM-lohkoarvonnassa: ”Se on kiehtovaa”,Koriksen MM-kisojen alkulohkot arvotaan tulevana lauantaina.,https://img.ilcdn.fi/kOF3oJv2MmEQjZYqV9uxBz83hng=/510x318/top/img-s3.ilcdn.fi/e1d852b2a6f49ec2dd2b3b8ed83c8c1d11d63328ba730d4c595a3d109e428d09.jpg,B161E00C38394517906E67E1753C763C
2023-04-26T10:37:56.000Z,Pelastetaanko Suomi kokoomuksen johdolla? Mai Kivelä ja Tere Sammallahti ottavat yhteen suorassa lähetyksessä,Iltalehden Suoraan asiaan -ohjelmassa kohtaavat tänään kansanedustajat Mai Kivelä (vas) ja Tere Sammallahti (kok).,https://img.ilcdn.fi/HFC-PsKtNq0mx9tqFllzaXfgWso=/510x318/top/img-s3.ilcdn.fi/011cf7478d2cfa0145b03661a238da5fc1bb725035d084be0d5eb5e56a3553dc.jpg,88D91F0004104C50931B90F4354B00DA
2023-04-26T10:49:36.000Z,Käärijän esiintymisasu nostettiin Helsingin jäähallin kattoon,"Käärijän tavaramerkki, vihreä bolero, nostettiin tänään juhlaseremonian myötä jäähallin kattoon.",https://img.ilcdn.fi/XytMugdQ6eEvwUwHlfjuWhHMmMg=/510x318/top/img-s3.ilcdn.fi/fa16fe671f6e4a3874693e44cc46a7e7c378f4f0392d0c373af8702a57703151.jpg,074E772A8DE8498DA0E3FB4C57D64CCE
2023-04-26T10:53:19.000Z,Näitkö Harry Potterin Balenciagan muotinäytöksessä? Video on tekoälyn luoma,Tekoälyn mahdollisuudet ovat myös herättäneet meeminikkarien kiinnostuksen.,https://img.ilcdn.fi/XBMpyejlKKBh84AUz9CpaaXTZOw=/510x318/top/img-s3.ilcdn.fi/ed63b0ea74950a4dd291018cfcd7994ec055d7527204cd3247b2968bc325d4da.jpg,F132617E26F14A0BBFD72A2DCE07FCEE
2023-04-26T11:12:40.000Z,Tällaista minihametta et ole vielä nähnytkään,Tämä hametrendi villitsee nyt muotikansaa. Muodikkaista reisitaskuhousuista tutut taskut hiipivät nyt myös koristamaan hameita.,https://img.ilcdn.fi/P4w1yd7b2lcDKwslPL-6RqiJ620=/510x318/top/img-s3.ilcdn.fi/7a7997e86315fa3cabe39409a8145c3ab87342c574de54f26bef8ba7b2ab1096.jpg,4E17BC383799462EA16FCBE289625B28
2023-04-26T11:13:27.000Z,"Mika Aaltola Fortumista: ""Karmiva tarina, jossa riskit unohtuivat”","2000-luvun alun harhat heijastuivat Fortumiin, Ulkopoliittisen instituutin johtaja Mika Aaltola arvioi.",https://img.ilcdn.fi/BXjs4YgiORkpD9iYbc3sPpGHrGM=/510x318/top/img-s3.ilcdn.fi/82a0ce775ab7431902f7409caf4045469ae513098a998c3cc889788e798638f4.jpg,3F96C9881EFF4CE18AF4B59533E929A4
2023-04-26T11:14:40.000Z,Oletko nähnyt tätä miestä? Epäillään julmasta teosta Kauniaisissa,Poliisi etsii murhan yrityksestä epäiltyä miestä.,https://img.ilcdn.fi/BrVIeZI-MBk3xpWrD1UhsN3lVvg=/510x318/top/img-s3.ilcdn.fi/58acba73e46217713a7d8afeee373137f1dea906eb45f92b288413bd35abcf50.jpg,175BF9C9423F4B53AC919A07609B230E
2023-04-26T11:27:25.000Z,Poptähti Taylor Swift romanssihuhuissa F1-tähden kanssa – Tämä somepostaus lisäsi kierroksia,Fernando Alonso ei ainakaan ole yrittänyt hiljentää huhuja. ,https://img.ilcdn.fi/ioNfCiZ9iT-rxEmhWsgDyZly_f8=/510x318/top/img-s3.ilcdn.fi/83b17894bbfea634f78ce59dd4169e75f0619e84420b87afb759903de45a251b.jpg,D3F1EFD563D14F5C8DDEB4F3D50AC3C5
2023-04-26T12:01:31.000Z,Kreml kommentoi Fortumin haltuunottoa: Muutkin yritykset uhan alla,"Kreml vihjaa, että Fortumin kohtaloa voi odottaa myös muita yrityksiä.",https://img.ilcdn.fi/1AaE4MjjNu89ftWwwKRxXRQ9RDA=/510x318/top/img-s3.ilcdn.fi/012e367d0208921a99992f9e3cb858c9389048039b165ba288ac1184e1e29a38.jpg,4AD8384A69604ED7A23953D62C347A28
2023-04-26T12:09:27.000Z,"Karjalainen lopetti sunnuntain printtilehden, toimittaja sai nyrkistä",Tapauksesta on tehty rikosilmoitus. Päätoimittajan mukaan printtilehdestä luopuminen on herättänyt tunteikasta palautetta.,https://img.ilcdn.fi/F0jh2hfBLfkYxA-zo26regRI3UQ=/510x318/top/img-s3.ilcdn.fi/adfe0d2d40278db58a1600cf92d5f2224bb1dec27965c3cd35bd9390c0589967.jpg,0147DE1F1BBF49409C3904B36A86E0C3
2023-04-26T12:14:26.000Z,"Vanhemmat huolestuivat, kun vauvan selkään kasvoi ”kilpikonnan kuori” – Kyseessä harvinainen sairaus","James McCallumilla diagnosoitiin harvinainen synnynnäinen jättiluomi, joka vaati leikkauksen korkean melanoomariskin vuoksi.",https://img.ilcdn.fi/SlRVNwHZNMUjEf4t7jcfUVt34P4=/510x318/top/img-s3.ilcdn.fi/a2a179d32b5a365d696eaec86658eae4931d32a89ef2bc11de0aca8c17a9b028.jpg,722B3F02C32A4C31860145124F45C6A0
2023-04-26T12:17:08.000Z,"Yksi kastike löytyy Hans Välimäen pöydästä olipa uusivuosi, vappu tai juhannus – Aina toimii",Ruotsalainen sillitahna kuuluu Hans Välimäen vappuun.,https://img.ilcdn.fi/A7ZaOBnGuAjke3a1WYltbD09ZuI=/510x318/top/img-s3.ilcdn.fi/a763f878c0a9982904756ebedf1aba2ba6c692164a7780218cd209587f400520.jpg,9CB6F27791744560AA6B32FEE1016117
2023-04-26T12:28:50.000Z,"Kippis vaan, liigakiekkoilijat – Onko kännissä kiva olla kesken pudotuspelien?","Muun muassa muutamalla Ilves-pelaajalla tuli kova jano playoffien aikana, kirjoittaa Santtu Silvennoinen.",https://img.ilcdn.fi/Y7p-axlaZTSOHhIOr_ByCH5JXsY=/510x318/top/img-s3.ilcdn.fi/6dfeb3c06d647e37843fd3382830811058f521c329c7f0b66c1297b3fba1fbcf.jpg,C13D1DAD029847B9AD2FF6AEF5880A0F
2023-04-26T12:44:22.000Z,"Maryam Razavilta paljastus podcastissa: ”Soitettiin ja sanottiin, että George Clooney on valinnut sinut tähän”","Maryam Razavi kertoo Perunateatteri-podcastissa työprojektista, jonka hän teki George Clooneyn kanssa.",https://img.ilcdn.fi/lWWRkr08Wz4kq5zeIezp7tfyUbw=/510x318/top/img-s3.ilcdn.fi/85b27410a8a1ea49bbc9b799c76d8f877068ffe4fe2e028eea64e47cb2a10cf1.jpeg,6B9F40AB31BE46E198F8D3AB65772C3E
2023-04-26T12:45:44.000Z,Uusi kevään lämpöennätys! 21 astetta rikki Lappeenrannassa,Lappeenrannassa mitattiin keskiviikkona jälleen vuoden toistaiseksi korkein lämpötila.,https://img.ilcdn.fi/Zr1GOXd80F_nnbcN5_O6_ZlsWPI=/510x318/top/img-s3.ilcdn.fi/8f7e014950cecc23ed4b5f99a09dcb8d106b603b59f3df86510749be86c99d08.jpg,F83D8120D55E4B6393EF93782E46E113
2023-04-26T12:53:30.000Z,Poliisi epäilee: Kasvihuoneyrittäjä yritti hankkia seksiorjan Vietnamista,Tunnettua kasvihuoneyrittäjää epäillään ihmiskaupasta.,https://img.ilcdn.fi/aKVxzZvOdjxdaBQqTFw8vnOFljo=/510x318/top/img-s3.ilcdn.fi/f1d643da7e79beec2978fd0d2d69f2e6b52281779e544475f99e16b0e3cba4c3.jpg,B6CBB2B531FE4B708086967488F7FA01
2023-04-26T13:02:46.000Z,Venäläinen NHL-tähti katosi joukkueesta mystisesti,Valeri Nitšuškinia ei ole näkynyt Coloradon kokoonpanossa kahdessa edellisessä ottelussa.,https://img.ilcdn.fi/WylqZCPdoHJewTpdb46tlMy3AzM=/0x64:3000x1939/510x318/top/img-s3.ilcdn.fi/4dcafdbe137ed4071835db7a092a86bf20ca4444bb84f8e5ca4cd01c07d64fa2.jpg,5DDED087616E4966A3BAD4B8FA609190
2023-04-26T13:18:27.000Z,Lehtisaaren taposta epäilty nainen vapaaksi,Mies pysyy edelleen vangittuna.,https://img.ilcdn.fi/SyxpGM3SGwCf1Uo3LPp6n1tjUmY=/510x318/top/img-s3.ilcdn.fi/171a9b65e57dd88f93b6986a8bc302f02e7398b81de14d570218b92330b02f1e.jpg,7BADC8A6B9C443BF8CFB000A301FADBC
2023-04-26T13:34:54.000Z,KSML: Lasten käytös junaraiteilla huolestuttaa Jyväskylässä,Moni paikallinen on huolissaan junaraiteilla kulkevista lapsista.,https://img.ilcdn.fi/y9uWAMSgpQ3mr3F0NGbF0JC-9DE=/510x318/top/img-s3.ilcdn.fi/a5d9a43d3ec194981ed37b362fc07e6b0be873de237fc14c57cadaed36db4e95.jpg,B5790A1B321D40C5B0B81616E4700B04
2023-04-26T13:40:27.000Z,Podcast: Nelosella tiedettiin Sonja Aiellon rikosepäilystä ennen Selviytyjien kuvauksia,Seiskan mukaan Sonja Aielloa epäillään pahoinpitelystä.,https://img.ilcdn.fi/D_2rf53gXVqaLp1MXhxpxTXJhtw=/510x318/top/img-s3.ilcdn.fi/cfb3784d238f6bb60dea71e1d01e9230a565596dbd40dee06364ad98c8435f53.jpg,B47C9F833EEF4BB28B44231D4512B11A
2023-04-26T13:41:59.000Z,Yli 100 pisteen NHL-tähti oli jo tulossa MM-kisoihin – Ruotsin suunnitelma meni pahasti mönkään ,Ruotsin jääkiekkoliiton kipuraja tuli vastaan. ,https://img.ilcdn.fi/5nRdTeT62J1P3zq72VDjQpKJVHM=/510x318/top/img-s3.ilcdn.fi/731b43650a5a3da5e5f8d860340906f17d117bd25fe657bf51987c33752aacac.jpg,01C614C842A64E638E6F3147BCA95679
2023-04-26T13:45:50.000Z,Totuuspuolue merkittiin puoluerekisteriin,Puolue sai tarvittavat 5 000 kannattajailmoitusta kerättyä puoluerekisteriin liittymistä varten.,https://img.ilcdn.fi/1jmyQXyqn_ZSe-9PH1xxTJaE414=/510x318/top/img-s3.ilcdn.fi/453fca99d6cf77fdf2dfba18728889aa555e3f2b1b3f768685ae4cb46108bc3b.jpg,E82D8922130A4792A998316F2294CE1D
2023-04-26T14:02:47.000Z,"Työvoimapulasta kärsivällä alalla tamperelainen ravintola sai 300 työhakemusta – Kysyimme yrittäjältä, miten se on mahdollista",Yrittäjä Mika Roito ei voi kuin iloita lukuisista työhakemuksista.,https://img.ilcdn.fi/bsBTJo_jxxQBjmL4ZdMkrz2VAH4=/510x318/top/img-s3.ilcdn.fi/0ab238997a1242eb4329cf8573ef5268a300e8451bc937ad6144f7d650cb9988.jpg,A4FDDAB4DEC64FD0BC043F8D41EDE035
2023-04-26T14:03:06.000Z,Äärimmäiset keinot käytössä tänään tv:ssä: Vatsa kasaan ilmastointiteipillä ja tuorekelmulla,"Teipin ja kelmun lisäksi Sandra, 50, litistää vatsansa muotoilevilla alushousuilla.",https://img.ilcdn.fi/UbahUXmbLvvXHoCq3m7zGDS46WA=/510x318/top/img-s3.ilcdn.fi/0847fe325b913719284bdba25c0284cfe6467879d806ac797d1b3f6c7f5b85e4.jpg,D09B0DA6775E463F85C73D01D7FCEF49
2023-04-26T14:10:05.000Z,Zelenskyi keskusteli Kiinan Xin kanssa – Niinistöltä ilahtunut reaktio: ”Hyviä uutisia”,Ukrainan ja Kiinan presidentit keskustelivat puhelimessa ensi kertaa Venäjän hyökkäyssodan alun jälkeen.,https://img.ilcdn.fi/s_Z7LDkVI30GqYc6jb-4cRn-JEc=/510x318/top/img-s3.ilcdn.fi/8c71ebe44b091ed5c8c2db5ff05b45d34b9e1d7b1511466d7ce09459db6d783a.jpg,5B89F09403DD42088961CFAF2DCC3A3F
2023-04-26T14:24:32.000Z,Suomalaisase virolaisten pelotteeksi Venäjän-uhkaa vastaan – Sakea lumisade ratkaisi kilvan,Pohjoisten Nato-liittolaisten tarkka-ampujat käyttävät suomalaista kivääriä.,https://img.ilcdn.fi/di_HJC1vNwVwDq4hW6rBDnNh5Uk=/510x318/top/img-s3.ilcdn.fi/8780ba3e56a9579b6cce1330908e2424ea7012aefc553c143fc516104f25382f.jpg,0FFC0830D77F4AF5A5C6CFE0CFABFF8D
2023-04-26T14:26:15.000Z,TPS menettää hyökkääjänsä – Maailmanmestari vaihtaa osoitetta SM-liigassa,Arttu Ilomäki pelaa ensi kaudella KooKoossa.,https://img.ilcdn.fi/ydJGNs0XgYw6ujUWiYgf97qAhIU=/510x318/top/img-s3.ilcdn.fi/d090e3ee2f2c10e9a26518e96de387c16695c3f602f50674a2a3108b4c10709f.jpg,02E01C9CF672414F9ADD097764A9C537
2023-04-26T14:47:10.000Z,Suru-uutisia vapun juhlijoille: Jopa räntä- ja lumisadetta,Vappuaaton- ja päivän sää näyttää viileältä ja sateiselta.,https://img.ilcdn.fi/MFmmVJNYhH83g2sRSyYNd2jqEVM=/510x318/top/img-s3.ilcdn.fi/5c30bb68bdfa16cfa9150853af260addcd271353b76bd559f6e6fa37b14af033.jpg,32A6A6907A2F420EA9D92064B4718148
2023-04-26T15:03:48.000Z,Karmea lasku kuolemaan,"Jokainen Särkänniemen Tukkijoessa ollut muistaa, miten hurjalta loppulasku tuntui pienenä lapsena. Sitten USA:ssa rakennettiin laite, jota kuvailtiin jo ennen avaamista ”täysin järjettömäksi”. Pieni lapsi kuoli siinä hirveällä tavalla. Kun pojan hysteerinen äiti juoksi turmapaikalle, häntä estettiin menemästä sinne. ”Usko minua, et halua nähdä häntä.”",https://img.ilcdn.fi/B2M--to-cT2YbwqadbCrk-BoWi8=/510x318/top/img-s3.ilcdn.fi/1b294e43cdc1b08a6f330e372462b61a730d1c02790e14ed876f6b830d68060f.jpg,46F8E74E42DF4F2F9BF020585C4A7ABB
2023-04-26T15:04:52.000Z,Sampo Loiri harvinaisissa kuvissa – Koskettava kunnianosoitus Vesku-isän muistolle,Sampo Loiri soittaa isänsä huilua Ilkka Vainion tulevalla Taivaanhuilu-kappaleella.,https://img.ilcdn.fi/7P_VWd3hv_kr9QUVe6jw8FwKO0w=/510x318/top/img-s3.ilcdn.fi/bac4193bec27ec4378f677f7bf47cf8348d27435078ab7656bff1ddbe0227af7.jpg,2437B11B755543A0B10F7C5BE496AB64
2023-04-26T15:06:37.000Z,Media: Venäläinen sotilaskone syöksyi maahan Murmanskissa,Alustavien tietojen mukaan sotilaskone putosi järveen. ,https://img.ilcdn.fi/Zz0M0Fa_WetauoAwGBQHGyXlGUs=/510x318/top/img-s3.ilcdn.fi/b3daf633921ff5ffa5e73faf88fb6bcf48b8087324422d174b96a26698372e1f.jpg,C9E84D35481942B49429CCA783B64087
2023-04-26T15:13:35.000Z,Miehen jalka herätti huomion intialaisella lentokentällä – Kipsin alta paljastui yllättävä löytö,"Mies oli väittänyt, että hänen jalka on murtunut.",https://img.ilcdn.fi/KkOiRUyu5q4kHZd1yE_7BXTf8tw=/510x318/top/img-s3.ilcdn.fi/bf5659b85b0abc3186e06582aaf6cef295fb18c3107a67e8adefee94a7836ba2.jpg,6ED7149E204940ADA4E597F29CF17B0B
2023-04-26T15:18:56.000Z,Valtteri Bottas juoksi hurjan tuloksen armeijan Cooperin testissä – Tämä on viesti varusmiespalveluksesta,Armeija oli F1-tähdelle positiivinen kokemus.,https://img.ilcdn.fi/5lG1cmEN96Ia3pb-g0YHYBBR-KQ=/510x318/top/img-s3.ilcdn.fi/90904b5d3910e45318741c0d8da54f24c382f08ed2f9918c46f0524df8c42da8.jpg,74E5FF66FC1E47938F384B3645B55697
2023-04-26T15:22:55.000Z,Susi hyökkäsi koiran kimppuun – Koira kuoli,Tapaus sattui varhain keskiviikkoaamuna Nurmeksessa.,https://img.ilcdn.fi/XlPUc3vJ_lX9JiaqYYtW4MT9hfo=/510x318/top/img-s3.ilcdn.fi/ad632fdedb3cb2310a68ea6670d2cce88cd62c6bd20ae7e7ea7bc7234b7c4baa.jpg,89ABE0DDBB88436CB235897D183DBE45
2023-04-26T15:47:01.000Z,Lähteet IL:lle: Maahanmuutosta neuvotellaan Säätytalolla viimeiseen asti: ”Ei tule olemaan helppoa”,Kovinta vääntöä Säätytalon tulevissa hallitusneuvotteluissa ennakoidaan maahanmuutosta. Iltalehti selvitti keskeiset kiistakysymykset. ,https://img.ilcdn.fi/CnTuZ5-KmHJYZ1f1MJNoKrArYiw=/510x318/top/img-s3.ilcdn.fi/4294a341705588686f92445fd01cd3e8ad106b862aff83aa3ab0a03d6415debe.jpg,F823CB0F5C77481DB0E4B70B60A541FE
2023-04-26T15:48:54.000Z,Mitä tapahtui Ronnie O’Sullivanille? Sokeeraava käänne snookerin MM-kisoissa,Ronnie O’Sullivanin ennätysjahti päättyi tylysti.,https://img.ilcdn.fi/Ijq5Cj0XqOOiITxfBlqERft4_XA=/510x318/top/img-s3.ilcdn.fi/91112c80ac328e902f8b9621c3a14dee8cf1871102992f4959cdd0a6db0e3eff.jpg,0408F231271A4225BF99EB4BFC0CA1BA
2023-04-26T15:56:29.000Z,”Ostin kevättakkia” – Ikuisten myöhästelijöiden kootut selitykset ,"Krooniset myöhästelijät kertovat, miksi ovat aina myöhässä.",https://img.ilcdn.fi/ZFkiHsBuJD2YOd_GLNuegVqRdok=/510x318/top/img-s3.ilcdn.fi/f5cabee99e206cab993887248b5eb21b414977ac6027cf9cfa9c9ae9812f8938.jpg,33FCAE86143646B3AC2534DC5175A938
2023-04-26T15:59:27.000Z,Petteri Orpo kertoo huomenna hallitusneuvotteluihin osallistuvat puolueet,Eduskuntaryhmät on kutsuttu koolle torstaina 27. huhtikuuta.,https://img.ilcdn.fi/Sdf6TmDh2xs1XJUFStmMpN0ywU8=/510x318/top/img-s3.ilcdn.fi/52636487fec4aa98ce07c032538fddffa056e3bf64157217c5002cf2c65270f4.jpg,E14DE684F4274F1583C6C1A95FE08877
2023-04-26T16:00:19.000Z,"MTV: Susanna Penttilä, 50, on tienannut Onlyfans-tilillään 90 000 euroa",Susanna Penttilä kertoo MTV:llä tehneensä kahdessa kuukaudessa jättitienestit eroottisesta sisällöstään tunnetussa Onlyfans-palvelussa.,https://img.ilcdn.fi/kCT8Q_Xonw1Wg0shELw9DPYc0wo=/510x318/top/img-s3.ilcdn.fi/77b8cdcb2f6a953ca1d5db742baaab425275b9dadfb8da0003f97363c150f737.jpg,85FFE10A6E854F4B9678CD01011263BE
2023-04-26T16:26:22.000Z,USU: Vihreiden piiripomot haluavat lisää puheenjohtajaehdokkaita,"Vihreiden piiripuheenjohtajista vain harva osaa nimetä suosikkinsa puheenjohtajakisaan, kertoo Uutissuomalainen.",https://img.ilcdn.fi/up8ZfhcZl5U4frwj6q4Bnb2cSn4=/510x318/top/img-s3.ilcdn.fi/dcc08879402568dc6310d12da4185ab3782601ed72f5105c442d2628d408a6ad.jpg,F978971B1DEF460F9D4EE60B075ACA10
2023-04-26T16:33:17.000Z,Loreenin kohuttu viisuesitys muuttuu,Euroviisujen ennakkosuosikin Loreenin Tattoo-esitys muuttuu.,https://img.ilcdn.fi/o5X4jTPNYDT-cYvz5uczUNQ003w=/510x318/top/img-s3.ilcdn.fi/773cf1c042432c9c656b465c1ebc17989bd2c15653b2ca1be9bf7d4da6b4c860.jpg,2DE101EC8808461E9868FA7B91C00A0D
2023-04-26T16:39:41.000Z,Kreml vuotaa kuin seula – Kuka Putinin salaisuuksia levittelee?,Kremlistä on jälleen vuotanut tietoja Venäjän suunnitelmista.,https://img.ilcdn.fi/TMJkBKPXaV0_uNiQzbk_fQwj51Q=/510x318/top/img-s3.ilcdn.fi/d0ec8ab73128eed5def8c151855bfd3485915e014e734bc34040f922c08e6db7.jpg,04144D32A34242029B44789A0212CCF9
2023-04-26T16:41:43.000Z,Iida Vainio ilmestyi videotaululle – Näin Liiga tutkii Pelicansin kohutemppua: ”Olemme pyytäneet selvitystä”,"Liigan viestintäjohtaja Tuomas Nyholm kertoi, miten selvitysprosessi etenee.",https://img.ilcdn.fi/nxvE7yvTb0jYiX1haxR-PeGD7E0=/0x64:3000x1937/510x318/top/img-s3.ilcdn.fi/13b554b35a4e2eadee13a82e3bb0672b8962e8b9ce7163959f99ed02c837de36.jpg,162DFEB923514C9982BBE1C6AA5FA414
2023-04-26T16:58:50.000Z,Ulkoministeriö: Suomen evakuointioperaatio Sudanista päättyy,Ministeriö jatkaa tilanteen seuraamista.,https://img.ilcdn.fi/BUJtIgCn_SGJu-Ky_D4nu3J0_cw=/510x318/top/img-s3.ilcdn.fi/52b1c2a74836d3aa8b2fb71e3c6719109dacd30009dbd61172041e3ad67e5479.jpg,D8C63AFEB45146E7BD7AD5CF84113C9F
2023-04-26T17:04:20.000Z,Verkkouutiset: Työssäkäyville kehitysvammaisille maksetaan noin viisi euroa päivässä: ”Ihmis- ja työoikeusloukkaus”,Kehitysvammaliiton työllisyysasiantuntija pitää tämänhetkistä työtoimintaa ihmis- ja työoikeuksia loukkaavana.,https://img.ilcdn.fi/oraloT-sGmAbqj-50XepomF7go0=/510x318/top/img-s3.ilcdn.fi/8a93d91c2db04d6fa3328397653fab36e7419c5080d5c62e39789dcbc5d00bc4.jpg,87CD41D381CA44F3B36071ABEE1FDE60
2023-04-26T17:10:33.000Z,"""Anarkistinen kaaos” – Italialaiskaupunki laittaa turistiryysistä sakoilla kuriin ",Portofinon kauneimmilla paikoilla on liikaa valokuvaavia turisteja.,https://img.ilcdn.fi/2QxS4aR7E1MzyMOrs3MnhQIpgCo=/510x318/top/img-s3.ilcdn.fi/b4e215728f17e729c3ff60dd95700bd3a770a2d13e6ef2a00642039a91a14dfc.jpg,6B0D5C51A3F54AF8BB0335580EAF3A48
2023-04-26T17:11:16.000Z,Näyttävä auto halvalla? Vuoden 2016 BMW 20 000 eurolla,"Kuusi vuotta vanha ja takavetoinen BMW 518d -dieselfarmari riittää sellaiselle, joka haluaa näyttävän ja mukavan auton, mutta ei tarvitse tehoja ja nelivetoa.",https://img.ilcdn.fi/gb9nwNEcvGsaXktLulas8Ifxuk0=/510x318/top/img-s3.ilcdn.fi/9b34e52f59fb67d366b7cef91d7ff2a985a5ecac856862bf416851f8e27db7ee.jpg,2352662D554446C881407376E4F8D9D3
2023-04-26T17:16:02.000Z,Suomalaisnainen sai Sudanissa luodista – Toinen kotimaa hylkäsi,Ulkomaalaisten evakuoinnit Sudanista etenevät vaihtelevasti.,https://img.ilcdn.fi/NKGDcur5FJ7hesx_m7XB00qkYBs=/510x318/top/img-s3.ilcdn.fi/57bf13dfec308269a7f35fc034b09c12b01db0ab46c38be6e4f9fc0dfe01f299.jpg,FD33616826814759A6048CCF15EB103B
2023-04-26T17:27:16.000Z,Yllätyspolttarit: Suomen naishiihtäjät poseerasivat helteisissä maisemissa – ”Lähti käsistä”,Polttariseurue julkaisi kuvia Espanjan lämmöstä.,https://img.ilcdn.fi/qHqpEzZHKv6au7dKE4N4VrxetY0=/510x318/top/img-s3.ilcdn.fi/1b4aab382c4a8dff59441e3d4437a908235a68dfbb352cdf3888dc5836c58777.jpg,9229C1B47E88480090DDFA9F800E90B7
2023-04-26T17:28:07.000Z,Charles ja Camilla vierailivat euroviisulavalla – Kuninkaan kiusalliselle mokalle naljaillaan,"Kuningas Charles saapui avaamaan euroviisulavan käyttöön, muttei onnistunut painamaan nappia.",https://img.ilcdn.fi/p5Egtd_ddYurAweQasW20RWeuxU=/510x318/top/img-s3.ilcdn.fi/0334c4b75aab7bca76a1f7a69a3e6e2f91e27207a4eb1f1b897e231ababa7726.jpg,125A8F8B3FEC4F228BC4DE032EDAAE3F
2023-04-26T17:44:13.000Z,Orpon oikeistohallitus lähtee Säätytalolle – Luvassa on kovaa vääntöä etenkin maahanmuutosta ,"Kokoomuksen hallitustunnustelija Petteri Orpo (kok) ilmoittaa torstaina aloittavansa hallitusneuvottelut perussuomalaisten, RKP:n ja kristillisdemokraattien kanssa, kirjoittaa Iltalehden Kreeta Karvala.",https://img.ilcdn.fi/pXOSx8sc6vfDyi1SnGgIZNKl0GQ=/510x318/top/img-s3.ilcdn.fi/a953812cded6df5c1bf09ee525992aac72177c4ccfa7d8304114a2de57c78c24.jpg,73769A18910F464C8EE69EC1834237B0
2023-04-26T17:52:36.000Z,Suomen mestaruus ratkaistaan Hakametsän jäähallissa – F-liigan finaaleissa huima draamankaari,Salibandyn miesten Suomen mestaruus ratkeaa perjantaina.,https://img.ilcdn.fi/yD1VQR4z_G9CwN2xZXNZI9jvfIU=/510x318/top/img-s3.ilcdn.fi/9288eadae39a1f32881ac807789611b762d7ef8f58e9cc9cf26f12631159716d.jpg,B3B403D16B4C4205A5E98532EBD3D0DC
2023-04-26T17:58:27.000Z,Lidl myi olutta väärään hintaan kaikissa myymälöissään – Lupaa hyvittää asiakkaille,Lidl myi maaliskuussa olutta väärään hintaan kaikissa myymälöissään ja lupaa asiakkaille hyvityksiä.,https://img.ilcdn.fi/bxql0CFwlbijocFIx1-UIMl49qo=/510x318/top/img-s3.ilcdn.fi/3cf9f0fbe14eef54752d982c96a021d185c611244759e6d5391ed2b8be698c66.jpg,196AFD5483804924B5AFDDA5BEEA9639
2023-04-26T18:06:16.000Z,Mikä finaali! Kiekko-Espoo nousi 0–3:sta – Karun oman maalin tehnyt pelaaja järjesteli voittomaalin 3 sekuntia ennen loppua,Kiekko-Espoo on voiton päässä Mestiksen mestaruudesta.,https://img.ilcdn.fi/CYhRx0gNPYxlK-Ru4p9not1qB60=/510x318/top/img-s3.ilcdn.fi/8cbd3939df4c89146cd5733d4e9f6d6968c5c072f34588b31d4f4646da6ed027.jpg,97242A0C0BE3465EBEFCC264FF5A4FFB
2023-04-26T18:21:38.000Z,Sinkkuelämää-faneille ilouutinen: Suosikkihahmo tekee paluun uudella And Just Like That -kaudella,And Just Like That -sarjan toinen tuotantokausi ilmestyy kesäkuussa. VARO JUONIPALJASTUKSIA.,https://img.ilcdn.fi/0RxXFg63P5JLFF8KWDhbcpnwQR4=/510x318/top/img-s3.ilcdn.fi/692c8fed9a8b749fe63183a6860442db2259d22134973c9cf03261c863e82605.jpg,2F2291795F944DC190E08AEBE486911A
2023-04-26T18:25:02.000Z,Koskettava jälleennäkeminen – Ukrainalaislapset eivät osanneet odottaa isän kotiinpaluuta,Lasten isä palasi rintamalta kotiin 13 kuukauden jälkeen.,https://img.ilcdn.fi/VCMiaME_8TQWuelgsslLiWWajg4=/510x318/top/img-s3.ilcdn.fi/697491f1c7ab402837fdb5c9a1817e89623c72e9add250715bda175b4be398a4.jpg,3B06F5CA6A504714A137780E08706F0F
2023-04-26T18:28:03.000Z,"Kokoomuksen Tere Sammallahti lataa suorat sanat työmarkkinamallista: ""Tämä ei toimi""","Tuore kansanedustaja Tere Sammallahti (kok) haluaisi tuulettaa nykyisen työmarkkinamallin, esimerkiksi keventää työehtosopimusten velvoittavuutta.",https://img.ilcdn.fi/mzxxl4-G-_Ets1zyDsMfpwvEJis=/510x318/top/img-s3.ilcdn.fi/5260e963d003d783139529e9057d36e2ada94d9ca530970bed21739dec8d317c.jpg,E78679FA2D6142F28CD53CC82267B955
2023-04-26T18:41:56.000Z,Iso jymypaukku on NHL:ssä lähellä,"Hallitseva Stanley Cup -mestari on ollut vaikeuksissa, kirjoittaa Iltalehden urheilutoimittaja Otto Leinonen. ",https://img.ilcdn.fi/SBGC6g7oJ1U_wgYMmee_P5QcNas=/510x318/top/img-s3.ilcdn.fi/3da82e8474c7717ba83c09aa8112ccabfab2415c60e302ed2ea60eb55faa7df2.jpg,9D8B661C6FB248A0A6A6CD808D1C20DF
2023-04-26T18:58:04.000Z,Syöpään sairastunut SDP:n varapuheenjohtaja Niina Malm julkaisi päivityksen voinnistaan – ”Hymyilin kuin kojootti”,Vakavasti sairastunut Niina Malm suhtautuu toiveikkaasti tulevaisuuteen. ,https://img.ilcdn.fi/PIQgMZ1tmnSXAua_uIVPDbzJbUE=/510x318/top/img-s3.ilcdn.fi/98afc620bc23bf96bb0ce05d2669eb4f3b1373613c7f7d1dbfef0b67615ce4c9.jpg,AD8CD2ADA92A44EBA9EB8FE0A93BA46E
2023-04-26T19:02:21.000Z,"Naapuri näki, kun poika terrorisoi äitiään – Pahin pelko toteutui Imatralla","Henkirikoksen uhria kuvaillaan kaikin puolin kiltiksi ihmiseksi, joka huolehti ongelmaisesta pojastaan.",https://img.ilcdn.fi/Lvu_ZOX-rHt5Q9gbqdhoOOI_7Ik=/510x318/top/img-s3.ilcdn.fi/7ec2670c2902f55104c63e569ee6ef64fa4f4809735be10d45c7cf60997670fb.jpg,E3AAD34B7D0342ACA0EECA8CF12008E7
2023-04-26T19:05:42.000Z,"”Meinaatko syödä itse tuon kaiken”, tökerö kysymys kuului – Lukijat kertovat ruokahäpeästä","Suomalaisia hävettää muun muassa epäterveelliset ruokaostokset ja ruoan määrä. Kysyimme lukijoiltamme, millaista ruokahäpeää he kokevat.",https://img.ilcdn.fi/2hzJXD1FSPsCPnTmaLOZtHZI2Jg=/510x318/top/img-s3.ilcdn.fi/6fccf0fb0746351a89c18d5b3bce559fda90ec209b95388331ac9ea0ca87c136.jpg,88BD87C6C993468289E8F12C84FA85D1
2023-04-26T19:06:19.000Z,Onko tämä todella Peugeot? IL bongasi Euroopassa todellisen erikoisuuden,"Monilla autonvalmistajilla on malleja, joita ei myydä lainkaan Euroopassa vaikka merkki oli täältä kotoisin. Yksi tällainen tuli vastaan kaukaisimmassa Euroopan kolkassa.",https://img.ilcdn.fi/vd2xnPr4i55JpknVybH2z_J8YEg=/510x318/top/img-s3.ilcdn.fi/c639b78924ef83abd4a5f166d29b68cbf93ebeb6ba0111622e11f65f4627f777.jpg,D23146D6869143799C4CED9D8BAFD57E
2023-04-26T19:15:00.000Z,"""Merkittävä halkeama lasikatossa"" – Paavi teki historiallisen päätöksen ",Vatikaani ilmoitti keskiviikkona symbolisesta muutoksesta katolisen kirkon piirissä. Jatkossa naiset ja maallikot pääsevät äänestämään piispakokouksessa. ,https://img.ilcdn.fi/A-9udd_jttF5svRWsLJeK_y7mzA=/510x318/top/img-s3.ilcdn.fi/964a90a9dddb0200b5c6ac19f31afa2e229ed438d54149235721bbb94d5c42d4.jpg,A14624F4C2F14E64BC0ACE4A4F72E395
2023-04-26T19:23:15.000Z,"Honey Boo Boo, 17, osallistui koulun tanssiaisiin – Katso kuvat säteilevästä kaunottaresta!",Honey Boo Boo eli Alana Thompson osallistui koulun tanssiaisiin.,https://img.ilcdn.fi/eJBvxudE245iIMZ8iKSpZhDCrVw=/510x318/top/img-s3.ilcdn.fi/ae33eb04d3d9b60cbc0ae1d8302207284cc3b48df96ace8fbc88526a4d0bbd27.png,EEA7DB17810644429FF7AE68D8599DE2
2023-04-26T19:23:18.000Z,Thaimaassa haluja sallia seksilelut,Thaimaassa on tällä hetkellä laitonta myydä seksileluja.,https://img.ilcdn.fi/fWAOQYmr_ans_h9qyKIQjvbBpxE=/510x318/top/img-s3.ilcdn.fi/2571b342ddb52f07e50cd1c592c72a9af40f149b581106aa587b0d43bd5c5718.jpg,AB8F0CE189BE4CE2954BEBC0747C1BD3
