paivamaara,otsikko,tiivistelma,kuva,id
2022-07-13T19:41:24.000Z,Röyhkeä lokki tepasteli kauppaan – pakeni paikalta sipsipussin kanssa,Lokki jäi kiinni itseteossa.,https://img.ilcdn.fi/heNpZzgjLii_mMKGsSRUS9hgD_g=/510x318/top/img-s3.ilcdn.fi/8974ef34fb98c5a4d947c332b0b71e6feb41be883491295ed96cbd389d9f4c18.jpg,7EF20D4036954B82B1D180E5E90806B1
2022-07-13T19:43:23.000Z,Video paljastaa: Texasin poliisi hengaili käytävällä kouluampujan teloittaessa lapsia,Kouluampujan tappaessa lapsia poliisi odotti rauhassa käytävällä luokan ulkopuolella. Video voi järkyttää herkimpiä. ,https://img.ilcdn.fi/060F98-87isML0c91ReIFali52I=/510x318/top/img-s3.ilcdn.fi/8881ee6200c99c66dac8d89e19ff46393b47dbfaa2ecbed57ecf1bd957337f2e.jpg,8EF381A2F9DB423595B8D04FFA23B221
2022-07-13T19:51:06.000Z,Nyt jysähti kova huhu: Robert Helenius kohtaa supertähti Deontay Wilderin,Robert Helenius kohtaisi Deontay Wilderin. ,https://img.ilcdn.fi/PrFj-svy3f1rUwHw2Wrjeh6H66c=/510x318/top/img-s3.ilcdn.fi/98daaaec5b69215e17c56ec966db344dc422f417503eff4136d34a978c5f8990.jpg,DC4BD6CE56EB4AE593F03FB5DED6F222
2022-07-13T21:09:56.000Z,Amber Heardin vaatimus uudesta oikeudenkäynnistä Johnny Deppiä vastaan hylättiin,"Tuomarin mukaan ei ole näyttöä väärinkäytöksestä, jonka vuoksi uusi oikeudenkäynti olisi tarpeen.",https://img.ilcdn.fi/QGdMLwnYDrfY0YlFDWugq0Nmw3s=/510x318/top/img-s3.ilcdn.fi/52ef899b313e0e704202d06ff6871b1ff184b43c186622d07f29782c332e8272.jpg,7962D0C06FA54AE3B3DC86392A5F5BF1
2022-07-13T22:13:50.000Z,Todellinen yllätysnimi vahvoilla Britannian pääministeriksi – ennakkosuosikki Rishi Sunak piti vielä pintansa,Ensimmäinen karsintakierros järjestettiin keskiviikkona.,https://img.ilcdn.fi/HYh-MKOCwHljFqK1-QImPaASyBo=/0x0:3000x1874/510x318/top/img-s3.ilcdn.fi/a3bd8c94cdfb9b3231b5df1dea8019453db943eed9e8021777414703be2deb60.jpg,91CE9330BF774A688D36C9FA3CFEB3F7
2022-07-13T23:00:02.000Z,Horoskooppi,NULL,https://img.ilcdn.fi/ZJX2nPQHLedeTO4nOGca4bZ5URo=/510x318/top/img-s3.ilcdn.fi/0e855f41645f17dbb2436f21bf69f40ac48d1971a147578985e2c64c1fb985d3.jpg,4F1BAB17D81C4C34AB9A5C4F9DB6AE70
2022-07-14T00:06:25.000Z,Vaaralliset hirmuhelteet piinaavat Eurooppaa – maastopalot roihuavat jo kolmessa maassa,"Hirmuhelteiden seurauksena Ranskassa, Espanjassa ja Portugalissa on syttynyt maastopaloja.",https://img.ilcdn.fi/MUGCuP8b2EgupynEPdn7VoqM27w=/510x318/top/img-s3.ilcdn.fi/b6fb0ceb0445b674bdeb4cbbc24c362c4998c1f70d1070261f805e6fc278a124.jpg,F3169DD76F854DCF984A341F6930D0D3
2022-07-14T01:27:27.000Z,Sateet ja ukkoset sävyttävät säätä – iskeekö viikonloppuna kunnon myräkkä?,Sateet sävyttävät Suomen säätä loppuviikolla.,https://img.ilcdn.fi/3ABmoebdV1q5gJMNmxEvah3gRTk=/0x34:3000x1909/510x318/top/img-s3.ilcdn.fi/6d7bb9ee5a616d38f5cd6ca00c514d65ff7c653f01e3698f6cae33abe105f7d2.jpg,A41602477FCC4DEBBD1AEABD1A65D66D
2022-07-14T02:34:42.000Z,Ukraina kertoo useista iskuista Hersonissa: Venäjän ammusvarasto tuhoutui – tämä sodasta tiedetään yön jälkeen,Tähän artikkeliin kootaan torstain tärkeimmät tapahtumat Ukrainan sotaan liittyen.,https://img.ilcdn.fi/1dcLpQ8clHpN53XvAQdBW_G7IRU=/510x318/top/img-s3.ilcdn.fi/1901e4aceae7237018159f76519d193402df9b46a0cc620456da09e8d60bb7d6.jpg,53F55B29F57F417B9174B0D0FD8C6482
2022-07-14T02:45:00.000Z,Missä seurassa Joe Thornton aloitti NHL-taipaleensa kaudella 1997–98?,Iltalehden perinteinen urheiluvisa on myös verkossa. Montako tiedät?,https://img.ilcdn.fi/gvIqmkHlMgD73WjKTT8QRb7m8xk=/510x318/top/img-s3.ilcdn.fi/cba78162dfb17aae5cc1831d452c137e616928bd3453b2b148780c71799d3ae5.jpg,DF17D860CAB144F58DDC21A3C7108A4D
2022-07-14T03:00:01.000Z,"Tänään tv:ssä: Opus Dei -pappi kertoo, miten välttelee liian mukavaa elämää: Lattialla nukkumista ja kylmiä suihkuja",Kirjailija Miki Liukkonen jututtaa nunnaa ja Opus Dei -pappia.,https://img.ilcdn.fi/2DspfS4fvv0TbD4KTwhLNUgmeMM=/510x318/top/img-s3.ilcdn.fi/9c1aa6d0514a8b5957349ca8ba5d6f7d172d14402880326b7f7812521543f95f.jpg,E019326246B241B685401CD5AB2BF2FD
2022-07-14T03:00:27.000Z,Niki Tuulelta amputoitiin kolme varvasta – suomalaiskuski kertoo toipumisestaan,"Niki Tuuli aikoo tehdä paluun kilparadoille heinäkuun lopussa, vain kaksi kuukautta karmean onnettomuuden jälkeen.",https://img.ilcdn.fi/EbJggf3wmi3I1-di7DMEXGXvhXc=/510x318/top/img-s3.ilcdn.fi/2bef95e722cda307767282e311bc2334125a7c3fa522e7b3301e2206aefa2950.png,23AC29D2E1BA4BC78D865A60ACD1D7D4
2022-07-14T03:02:39.000Z,Uhrin pitkä tuomio,"Se oli tavallinen, hauska ilta baarissa. Laura tutustui mukavaan mieheen ja kutsui tämän kotiinsa. Yöstä tuli Lauran pahin painajainen.",https://img.ilcdn.fi/HzYEuMznDFZwUGCJA8Y0IAg_96o=/510x318/top/img-s3.ilcdn.fi/3f0502e50f174dea4d52db73afed008d7eb99469d81597ab4bea38c53b780b9f.jpg,64C065C330E54D0784BCB36D3BDCD025
2022-07-14T03:21:14.000Z,Ihminen putosi raiteille Helsingissä – junaliikenne Helsingistä Pasilaan keskeytyi keskiviikkona,Viranomaistehtävä vaikutti junaliikenteeseen.,https://img.ilcdn.fi/OO3_oGy93BfCp0ZmhoPSuGgjFDM=/510x318/top/img-s3.ilcdn.fi/4ad240daa57c14e624b973b760f0f4e0c8bfa3569238d8b7d0df922d4882d736.jpg,D281405C5E4A45CDBE54C980426EB715
2022-07-14T03:31:09.000Z,IL-erikoishaastattelu: Matti Vanhanen paljastaa valtiollisen huolen sodan alkuhetkillä: Suomen nopea Nato-ilmoitus olisi voinut syöstä Ukrainan täystuhoon,"Iltalehden erikoishaastattelussa eduskunnan puhemies Matti Vanhanen (kesk) kertoo toimineensa Suomen Nato-jäsenyysprosessin kätilönä. Hän paljastaa myös päiväkirjamerkinnän, jolloin Nato-kanta ratkesi.",https://img.ilcdn.fi/3YKCqmHPmyOG2ax_8EMr5pMOPIg=/510x318/top/img-s3.ilcdn.fi/9694368e399b2f1aa81f2a5a9f9aa17ca4f2dbd44b8278340ba9beed5ce25e90.jpg,AEC1A0F84462455C859C7B1FB47A6B02
2022-07-14T03:44:14.000Z,Khloé Kardashian odottaa toista lastaan ex-kumppani Tristan Thompsonin kanssa ,Khloé Kardashian odottaa toista lastaan sijaissynnyttäjän avulla.,https://img.ilcdn.fi/T2VrMxU78A_ymX5gzoE6hfH0pQs=/510x318/top/img-s3.ilcdn.fi/d881ebc2e9d0b32ce930ef72a3e011cc76df013d0e974e5a49cc20aafde971ec.jpg,1BA94A26C86E47578C3E96335D1FFC5E
2022-07-14T03:48:59.000Z,Innokas synttärisankari ei jaksanut odottaa – koira hotkaisi palavan kynttilän suuhunsa,Nälkäinen koira luuli syövänsä kakkua.,https://img.ilcdn.fi/QTgk9_mGQIYQj0jdJiSbkveSH8o=/510x318/top/img-s3.ilcdn.fi/e1e0c13f65f33f302cbb8bc735416a53778bfbc764cc3f24c82a861bf065478e.jpg,62DCF22148EB41E19C1EE16553DFC901
2022-07-14T04:00:00.000Z,"Luuletko, ettet tarvitse henkivakuutusta? Mieti uudestaan! Nämä arkiset kulut jäävät usein tajuamatta","Luulitko, että nuoret tai vuokralla asujat eivät tarvitse henkivakuutusta? Ifin asiakkuuspäällikkö Ilkka Manninen tyrmää väärät käsitykset henkivakuutuksista.",https://img.ilcdn.fi/jBiwg1m4xilruffCMBhXc2W-WFw=/510x318/top/img-s3.ilcdn.fi/281b0ed03ede62bfb337c088d543c4a6729094ce6f114b9950da60d4d18e2eb9.jpg,F641B0F5AC144A1DB0111C59BCB673A5
2022-07-14T04:07:54.000Z,"Putinille raju näpäytys: ”Pitää viestiä, että johtaja on täysin sekopää”","Yleisurheilun MM-mittelö Eugenessa on ensimmäinen suuren kansainvälisen lajin tapahtuma, jossa venäläiset ja valkovenäläiset on heitetty jäähylle.",https://img.ilcdn.fi/rPjk14Pw_ZbcIpxWF4k02UzxoVA=/510x318/top/img-s3.ilcdn.fi/ff4c914134ba07be6c355cd36897de8aa5b6e065aff90039468fa68a5fd6d3a8.jpg,B858F072ACC3412BAD225A68D2191AA5
2022-07-14T04:26:01.000Z,Barcelona vahvistuu Valioliigan brassitähdellä,Raphinha kohtaa kovaa kilpailua pelipaikasta. ,https://img.ilcdn.fi/HivWFB1CLUWRzOSCN-GgKCiDnvU=/510x318/top/img-s3.ilcdn.fi/a81ca60a5195f342c9117fd4a9e2445793bb1d92526b5de724f598b09eb5bbb7.jpg,28EB145AF7C3457A9166F534A7753704
2022-07-14T04:26:47.000Z,"Suosittu ravintolisä käy kaupaksi, vaikka hyödystä ei ole tietoa: ”Tulee kallista pissaa”","MSM on ravintolisä, josta mainostekstien mukaan voi saada apua moneen vaivaan ja ongelmaan, mutta tutkimustieto hyödyistä on hyvin vähäistä.",https://img.ilcdn.fi/FVDHbBiCsa1a4kzRKELH4DBmPdc=/510x318/top/img-s3.ilcdn.fi/36bc10724d6e578fd23c58184dbf46c942457bdeb3797fb133b25e2dd44216d4.jpg,CFAB879A460646758E4350BE4DE6CB46
2022-07-14T04:34:57.000Z,MTV: Ihmisbarbina tunnettu Amanda Ahola on tuore äiti – synnytys oli riski hengenvaarallisen kauneusleikkauksen takia,Amanda Ahola kertoo MTV:n haastattelussa olevansa tuore äiti.,https://img.ilcdn.fi/tt1pG4AEMlr_4cguFpaiAO7qQho=/510x318/top/img-s3.ilcdn.fi/3b54869c8f03165fc2759e3ebc334fafeefa85b78b1bff857e25dcc451d84b71.jpeg,D9839C42CEBC42CAB62CB1CD15369459
2022-07-14T05:00:02.000Z,Poliisi: Vuoden vaarallisin aika liikenteessä on nyt – ”Syy löytyy ratin ja penkin välistä”,Törkeiden rattijuopumusten määrät ovat korkeimmillaan alkukesästä. Niitä on vuosittain noin 7 000. ,https://img.ilcdn.fi/tK2-FoiVKek9SNAnf3VLcTGOKd8=/510x318/top/img-s3.ilcdn.fi/41954211c7d4296d1c68dae0c86cb95120572c934d24f81be0f0f2aae83fcd81.jpg,4C7DED9887194A588B44C55CCFA707B0
2022-07-14T05:07:56.000Z,Lähde: Suomalaishyökkääjä on jättämässä NHL-seuran – tehnyt sopimuksen Sveitsiin,Arttu Ruotsalaista viedään Sveitsiin. ,https://img.ilcdn.fi/pC7y73A1bzjosMNIYPEHY5ZII-k=/510x318/top/img-s3.ilcdn.fi/85ebe4e29a9c82a80bbcb3fbce4415d35926cdbc18cee849bfe69f78a6c285a5.jpg,BB6B4094CA7640579CAD58C6575ABBAD
2022-07-14T05:11:27.000Z,Kruununprinsessa Victoria täyttää 45 vuotta: tulevalle hallitsijalle yksi tehtävä ylitse muiden,Ruotsin kruununprinsessa Victoria juhlistaa torstaina 45-vuotissyntymäpäiväänsä.,https://img.ilcdn.fi/aXa6HBwNp2WIgMTazDTRUG0cguE=/510x318/top/img-s3.ilcdn.fi/faa396a46208c166eae09041ed58cec15fe375fa90c67d447027b1323d9b4b97.png,75B813DE7EE34A3B9BBA8C8CBC756C64
2022-07-14T05:15:41.000Z,Tulevaisuus on virtaviivainen – tässä on Hyundai Ioniq 6  -sähköauto yli 600 kilometrin toimintamatkalla,Streamliner on huomisen sana. Uuden sähköauton myynti alkaa vielä tämän vuoden puolella.,https://img.ilcdn.fi/XqjJytTTwD8nTZ3jVmhtX6fQPKg=/26x0:2025x1248/510x318/top/img-s3.ilcdn.fi/0bc84373bbf1e0d41d5e4917224b842063a6ce6526b295469c27ebf4093b6c83.jpg,A2D51C9EC03841E49B497A49DFAC554E
2022-07-14T05:16:00.000Z,Polttoaineiden hinta muutti asetelmaa - käytetyn keskivertoauton kuluilla melkein jo hankkii uuden sähköauton,"Polttoaineiden hinnan noustua ajaminen kallistui, ehkä pysyvästi. Laajoilla tosielämän hintatiedoilla tehty vertailu auttaa arvioimaan uusien ja käytettyjen autojen todellisia kustannuksia. Uudet sähköllä kulkevat autot eivät välttämättä olekaan paljoa kalliimpia kuin nykyinen autosi.",https://img.ilcdn.fi/A0MmZeMN8wqRBaPt5l4RbRQNw6k=/510x318/top/img-s3.ilcdn.fi/a477b6a449ef710fb9a740f257b438da6c3ff96698338c3f5c5c5f70c0989389.jpg,2DFA7D4D146A4FD5844A51CC5BCFD929
2022-07-14T05:37:17.000Z,Tänään tv:ssä: Ensivaikutelma tulevasta sulhasesta ei ollut mairitteleva: ”Sillä oli rööki suussa ja se oli todella humalassa”,Unelmahäät-sarjassa vietetään jyväskyläläisten Veeran ja Miron häitä.,https://img.ilcdn.fi/107vxetcjnfUT7VdGrZzTJssJOY=/510x318/top/img-s3.ilcdn.fi/67baf90d150308c3ddcc538615f44682fa865ef36a0d4a829aebff3a7c5cd1f7.jpg,650F310410514F9092AC58B90D7281DF
2022-07-14T05:56:05.000Z,Yksi lyönti päätti perheenisän elämän,"Lyönti päähän ja asfalttiin iskeytyminen aiheuttivat vakavia vammoja, joiden takia uhri menehtyi noin tunnin kuluttua.",https://img.ilcdn.fi/kzUOcbd2V7DDKn1n28uxv7oPUcM=/510x318/top/img-s3.ilcdn.fi/4512015e10a4a989d485c085d7d713125d0cfd30471c991a4c9df03ec64a8305.jpg,8A6C4D1B5D944961A745EC9C4799EE1A
2022-07-14T06:14:07.000Z,"Oskari Katajisto pyrkii nyt selättämään terveysongelmansa: ""Painoa pitäisi saada pois ainakin 20 kiloa""",Oskari Katajisto nauttii kesätyöstään teatterissa.,https://img.ilcdn.fi/pjfYLCucYXqXg8tpM2p3SsUzn9o=/510x318/top/img-s3.ilcdn.fi/66090ec9b420c9a5fa89a7f222ce6bd402cdf3037dfe91dc93b59809e721758a.jpg,FE83DF56995C43578245A8D953B4C291
2022-07-14T06:18:38.000Z,Kekäläisen mahtikaappaus ällistyttää – lähde: supertähti hylkäsi poskettoman summan rahaa ,Johnny Gaudreau yllätti kaikki. ,https://img.ilcdn.fi/OzBomJG6-zvQwLDnqsnHrutaB8A=/510x318/top/img-s3.ilcdn.fi/82868229aa40abddd6b492246634610d44790dff449263da2a24f094c6ecce16.jpg,79F4B4CFFF1A424F8FCB3F27DE46BBE1
2022-07-14T06:28:46.000Z,Venäjä vedättää YK:ta 6-0 – Turkin Erdoğan pelaa omaa peliään taustalla,"YK:n arvovalta on koetuksella, kun turvallisuusneuvoston pysyvät jäsenet voivat veto-oikeudellaan pelata valtapeliä, kirjoittaa toimittaja Nina Järvenkylä.",https://img.ilcdn.fi/8Tf9jLZf2wH6_Stj9zZsajhGf28=/510x318/top/img-s3.ilcdn.fi/84d80d5778b4e99132e698a86db9a1712ea75095333c2993b8046a854c1bca08.jpg,D7AE49FC20934A128ACE8BC6D3C17B33
2022-07-14T06:58:10.000Z,Dome Karukoski muistelee ensikohtaamistaan Antti Litjan kanssa: ”Hän luuli minua ensin sen elokuvan puvustajaksi”,Antti Litjan viimeiseksi esiintymiseksi valkokankaalla jäi Dome Karukosken ohjaama Mielensäpahoittaja.,https://img.ilcdn.fi/hyvqDcWfFexAkTu-Dg3u_cbTXdk=/510x318/top/img-s3.ilcdn.fi/6adf53b3f9063eb05f80d900ad05053e34c7ae0098a17477567845800380152b.jpg,4DDA87F3EC7F4CA199F1507D557535B8
2022-07-14T07:00:09.000Z,Läpimurto tutkimuksessa: näin punkkien levittämät taudit livahtavat ihmiseen,Löydöksestä voi olla hyötyä rokotteiden kehittämisessä borreliabakteerien levittämiä tauteja vastaan.,https://img.ilcdn.fi/vpXSQMRQUypnL3MbMMP06mvrjv0=/510x318/top/img-s3.ilcdn.fi/adde3623d14f7323723000430e09e5d2c1f67b04de0feb26586734c9181ec194.jpg,D3779F351B4A4A05AEB7B4CF90B44190
2022-07-14T07:00:18.000Z,Inflaatio kiihtyy Suomessa: ”Eikä loppua nousuille näy”,"Toukokuussa inflaatioluku eli kuluttajahintojen nousu oli 7 prosenttia. Kesäkuun inflaatioluku oli 7,8 prosenttia.",https://img.ilcdn.fi/-eNWdAgokBqTviVnYpaBG3GjwtI=/510x318/top/img-s3.ilcdn.fi/65f70f14ef337f50d5d6c77bf9c36fc1bcd829e59d359787b951b57cc4e8a1b8.jpg,F9CBE9D041EB44DD833415D730840AA4
2022-07-14T07:03:34.000Z,Raju korona vei viisi kiloa – moukarin hallitseva maailmanmestari ei lähde MM-kisoihin,DeAnna Price joutui tekemään kovan päätöksen.,https://img.ilcdn.fi/wB2jqcp6G3WAgP6A09ySw7b5gyg=/510x318/top/img-s3.ilcdn.fi/1cf81cc2ce8d4bfd220d611f758d6ca9c4812ab6ff866c583aa7f19e9c5d969d.jpg,1711F9F676E5401F955A977B1BD09DA5
2022-07-14T07:24:48.000Z,Tällä vinkillä saat leivinpaperin alistumaan tahtoosi,"Leivinpaperi voi olla hankala käsiteltävä, jos se pitää saada asettumaan vuokaan.",https://img.ilcdn.fi/hvXVaEB9qmoivc_9Cz9lYn8wViI=/510x318/top/img-s3.ilcdn.fi/6f3759b6336412af565321f0a5b15c81beace4b58febeca81e133cf2e7379d0b.jpg,8E284A51F2D04B5E87DE84C1364BD5B0
2022-07-14T07:35:03.000Z,Kuvat: Brutaali mielenilmaus Helsingissä – herkkiä ihmisiä ohjattiin kiertämään kaukaa,"Aktivistien yksi kysymys ohikulkijoille oli: ""Onko lautasellasi sittenkin joku, eikä jokin?""",https://img.ilcdn.fi/DPGiV4SRi93YiwufkAWtfMluQ2s=/510x318/top/img-s3.ilcdn.fi/db57b80778417e4bd2f9b4c54151cb818ffd39112cb21ee3026384ca444c0b60.jpg,65D69C85109A47679E92E53C613E3D11
2022-07-14T07:35:53.000Z,Shirly Karvinen ottaa kantaa hetero-oletuksiin – ”Me eletään niin heteronormatiivisessa yhteiskunnassa”,Shirly Karvinen ottaa kantaa heteronormatiivisen yhteiskunnan oletuksiin.,https://img.ilcdn.fi/am5B4Iuq3hK3IYdPnPpPxlapOkc=/510x318/top/img-s3.ilcdn.fi/4470544317c16f6378aaef75f28664cc9c0d020f01b1eacbc6c78b2b89273f6c.jpg,AF46E6EF24C14B56A445988F678292C6
2022-07-14T07:45:44.000Z,Huuhkajissakin pelannut Boris Rotenberg päättää uransa – taustalla erikoinen diili ,"Boris Rotenberg edusti pitkään Moskovan suurseuraa, mutta ei pelannut viimeisen 3,5 vuoden aikana peliäkään.",https://img.ilcdn.fi/7ggMQ0rSNHUMY0FgOTzOMJRKKIA=/510x318/top/img-s3.ilcdn.fi/8b7960d29345d8ffcde4ed6f99d824d09ceaa39e940195ef1bd1d3255934480d.jpg,4E57EBDCA40B4A10AA2E3456F7542D66
2022-07-14T08:00:18.000Z,Georgia mielessä – KuPS kiinni jatkopaikassa,FC Dilan isännöimään toiseen osaotteluun lähdetään käytännössä tasapääasetelmista.,https://img.ilcdn.fi/QK20Pb9sEZ7rf2IMIkTfb4IC7f4=/510x318/top/img-s3.ilcdn.fi/d02faf033c97ed80d6427b5f0360286cd6947b9199c3b8c60775034ea82a1528.jpg,1FAE49E281084085B6CBD226751CB71B
2022-07-14T08:03:19.000Z,Kulosaaren epäillylle lapsikaappaajalle syytteet panttivangin ottamisesta ja törkeästä ryöstöstä,Poikkeuksellisen kidnappausrikoksen oikeuskäsittely alkaa lähiaikoina Helsingin käräjäoikeudessa.,https://img.ilcdn.fi/K35DdJt4Sey9wv5dm87M9hQfw3M=/510x318/top/img-s3.ilcdn.fi/1d4febb9215554cea1abea3814a741f1b5253c843645b5be725010d7fbd5f104.jpg,7007FAC0CF88457E9BAAD04C33839E3D
2022-07-14T08:06:26.000Z,4 parasta kaupan valmiskastiketta ja majoneesia grilliherkkujen rinnalle – näitä kannattaa kokeilla!,Ruokakauppojen kesän majoneesi- ja grillauskastiketarjonnasta löytyy kokeilemisen arvoisia helmiä. Listasimme parhaat. ,https://img.ilcdn.fi/-jJTxlONg6nGK1FVe81UJjHuggk=/510x318/top/img-s3.ilcdn.fi/bcb617fddd3fe0ee693e890f34a7277915d568c68a1f9807c4a8bd0bdef9f602.jpg,380F19D7C9F04B2C8F3CDA38F839F851
2022-07-14T08:21:48.000Z,Viimeinen BMW V12-moottorilla on valmistunut,Yksi aikakausi autoilun historiassa on peruuttamattomasti ohitse. BMW on kertonut valmistaneensa viimeisen V12-moottorisen autonsa.,https://img.ilcdn.fi/Ffs-c0g2xW1sSgT17v_jAxp_VoE=/510x318/top/img-s3.ilcdn.fi/010eaa329152eb7b210fe71c749262021359c52079c4087490038402f9b350c2.jpg,6D8AB66B146B4EDB8BAFA60FF9E5EFF4
2022-07-14T08:31:38.000Z,Kesän jättihitti Villieläin nauhoitettiin sohvatyynyjen keskellä kimppakämpän olohuoneessa: ”Ehkä se rosoisuus on osa pointtia”,Rami Shikeben tunnetaan artistinimellä Ramses II. Jääkiekkoa rakastavalle miehelle esiintyminen kultajuhlissa oli monella tapaa merkityksellinen kokemus. ,https://img.ilcdn.fi/kWFbS1YYUfkLE5VbKHtp1kco5nA=/510x318/top/img-s3.ilcdn.fi/ed6003c71bfef7a4038482f501eae3c31d5fedec8ba8325095f888033d909dc0.jpg,2E324C1CFDB24F21839485FB2953B41A
2022-07-14T08:36:41.000Z,Mies ampui poliiseja kohti tehokkaalla jousella Liperissä,Tapausta tutkitaan kahtena murhan yrityksenä ja virkamiehen väkivaltaisena vastustamisena.,https://img.ilcdn.fi/iNMSycIIhFQWJj3Nw4AHNFJJuNI=/510x318/top/img-s3.ilcdn.fi/62a243ced8c1f82f16d0d6d5a3403d1aa5fa2412a20fe1500880cf83b6b3a465.jpg,B5A615E5C5DF49A7AF6D91C048F91DBA
2022-07-14T08:48:45.000Z,Jelena Välbeltä saatu viesti herkisti maajoukkueluotsin: ”Istuin kotona ja itkin”,Markus Cramerilla on pitkä historia Jelena Välben kanssa. ,https://img.ilcdn.fi/xzl64RNnzprH3Blz8UQo5h0x-bA=/510x318/top/img-s3.ilcdn.fi/c4687086ddb81cfc3c22ca4f1839ad9a3e472700a22b90d18ad8d7d5a7efcfb6.jpg,9B82F94360E848D6B47E1EDBA5728D78
2022-07-14T09:00:41.000Z,Remonttia pakoon,"Esimerkiksi putkiremontin tai pitkän työkomennuksen ajaksi moni kaipaa lyhytaikaista, 1–6 kuukauden majoitusta ilman sitoumuksia. Esittelemme eri vaihtoehdot.",https://img.ilcdn.fi/qCgEU2n6tt72Xbfzi_jQ13m8TUU=/510x318/top/img-s3.ilcdn.fi/384d3e52aa785f72409d42fc8638b9b9cd2c6bfdbf7eef642af9dec831f4afc8.jpg,271B6750C718482ABEF6815FE38AB2FD
2022-07-14T09:13:27.000Z,Kuvat: Suomalaisilla poikkeuksellinen vastaanotto Yhdysvalloissa: ”Tuli kuninkaallinen olo”,Team Finlandia varten rakennettiin Creswellin harjoituskeskukseen jopa oma moukarihäkki.,https://img.ilcdn.fi/Bk7mPKUstDj9lpT-T_xqSrYzYgM=/510x318/top/img-s3.ilcdn.fi/4216dc6127692542615be3947de60cec57ea26d9ca6e7a5fc488ab0ee7fc3a79.jpg,4E56C849420A4D7884D3DD2F47AF771D
2022-07-14T09:21:45.000Z,Abba-tähti Björn Ulvaeus esitteli uuden rakkaansa – ex-vaimo Lenalle suhteen julkistus ei tullut yllätyksenä,Björn Ulvaeus ja Christina Sas saapuivat Peppi Pitkätossu sirkuksessa -musikaalin ensi-iltaan yhdessä.,https://img.ilcdn.fi/H7rBsINsT7MziR2UqLLGse56CHI=/510x318/top/img-s3.ilcdn.fi/064588a6c8090a325c301a75c35d670dc259fcc2272345eedd72a2953df8ea43.jpg,F3B47CFDCC9C42DD9D4DF450BC923A7A
2022-07-14T09:24:37.000Z,Edulliset tilaukset tulossa Netflixiin – aloitti yhteistyön Microsoftin kanssa,"Tuleva kuukausitilaus on edullisempi, mutta sisältää mainoksia.",https://img.ilcdn.fi/m5Vd4Bb60wrGQozQLPVynBe9viE=/510x318/top/img-s3.ilcdn.fi/a889bc838d209b21b7eabac93dd7d41324e18ad5846d198520355a7bf79bb1a3.jpg,0DA6FABC38CD44BDBCE8D532CFD35E83
2022-07-14T09:41:00.000Z,Podcast: Helsinkiläiset prostituoidut kirjoittivat oppaan uusille seksityöläisille,"Tiina on myynyt seksipalveluita Helsingissä kymmenen vuotta. Hän kertoo Ammattina rikos -podcastissa, miten alalle tullaan.",https://img.ilcdn.fi/6bGHsxcp1futZPaZ2ffZRbegGtg=/510x318/top/img-s3.ilcdn.fi/02d910e8e4403a19154b37e5e7c97c3d391f8b7eb6bd3157474598d9789a78ab.jpg,3D17A92201EC44D49462BE3347E1307F
2022-07-14T10:01:58.000Z,Uusi ennätys: Hittisarjan kaikki keskeiset näyttelijät saivat Emmy-ehdokkuuden,HBO:n suosikkisarja Succession sai tänä vuonna yhteensä 25 Emmy-ehdokkuutta. Näyttelijäkohtaisia ehdokkuuksia näistä on huimat 14.,https://img.ilcdn.fi/yNrtaHgOSyUaL5OxgaBDEvpXPyU=/510x318/top/img-s3.ilcdn.fi/df5b3008d5b170488d6f8f4ce9b3ca9df809866f26cd0b65e03f89157f87afdb.jpg,99D6FA6C28DA4D7F95363AB3C7103366
2022-07-14T10:17:44.000Z,Suomi kätki Nato-jäsenyyden prosessin sisään – Presidentti kävi henkistä ”Nato-painia”,"Eduskunnan puhemies Matti Vanhasen (kesk) mukaan valtiojohto päätti kätkeä Suomen Nato-jäsenyyden prosessiin, ja presidentti edusti ”varovaista” linjaa. ",https://img.ilcdn.fi/MsT4JU8IeVLZrntjEsvjtZrvxiA=/510x318/top/img-s3.ilcdn.fi/f02d14bad1b720c7875081bcae417d580bbdafb089aa8c8b9f6516deb02fbf49.jpg,DFE1AE89A97243FFAD85843607970BD5
2022-07-14T10:31:54.000Z,Kuinka Ramses II tunnistaa villieläimiä? Hupaisa video paljastaa tietämyksen,"Ramses II joutui tiukan paikan eteen, kun Iltalehden toimitus pyysi häntä tunnistamaan villieläimiä. ",https://img.ilcdn.fi/hF8Nkkt0JD3-gi9Fa8HKu0B8n2s=/510x318/top/img-s3.ilcdn.fi/a7af0440b8558efb32726ecea2f00278cb238331cc6c84f0579d16987c5108b4.jpg,8B26C410B7C54981ADEC373DAB906B08
2022-07-14T10:36:01.000Z,Taapero tyrmistyi ystävänsä saamasta huomiosta – hupaisa reaktio tallentui videolle,Taapero tyrmistyi ystävänsä saamasta huomiosta.,https://img.ilcdn.fi/psy4kXwTiSuNWFbnzp6ffWl5-TA=/510x318/top/img-s3.ilcdn.fi/a9129717dba4ae59c870919af520f625aa553126832df43a7b69dd12b1ecb29a.jpg,94A0CC5CA2094848964A0BBED88DC6FD
2022-07-14T10:38:00.000Z,"Katriina Wright ei ole Paavo Nurmi tai Lasse Virén, mutta omalla tavallaan tärkeämpi suomalaiselle urheilulle","Suomen edustajaksi yllättäen tullut juoksija Katriina Wright heijastelee suomalaisen yleisurheilun tulevaisuutta ja tarvetta muuttaa konservatiivisia ajatuksia, kirjoittaa Riku Isokoski.",https://img.ilcdn.fi/d0OEKz8HgZdybA-Hdx89iFrGG5U=/510x318/top/img-s3.ilcdn.fi/e768f4e2b8563a695dcb28d37af1350119ff72c8e6bb00e9dea67dccd2dca7ea.png,BA25E212001F4EB2AF0FA29260F66D26
2022-07-14T10:44:43.000Z,Helmareille taas jättimäinen takaisku – ”Tinjalle tuli oireita Tanska-ottelun jälkeen”,Helmarien maalivahti Tinja-Riikka Korpela on saanut positiivisen koronatestituloksen. ,https://img.ilcdn.fi/zwBDuVzAM6BKfKyUmxQTwCuZhFg=/510x318/top/img-s3.ilcdn.fi/0532aabd117733e03191e60a357192f6ce695ef87f90a89ade2b69bbf18d300f.jpg,3DB1AF85E724475482F7EAFE1B446525
2022-07-14T10:49:09.000Z,Kevin Spacey kiisti kaikki syytteet oikeudessa – syytetään useista seksuaalirikoksista,Kevin Spacey kiisti syytteet.,https://img.ilcdn.fi/st8SRT7FtBe_ArUZKFAWMUhs2yY=/510x318/top/img-s3.ilcdn.fi/338008aaddfc369d042088c6e2ae7461fa6e58e3434c62eaaefc4d20f351fcbc.jpg,27C0BA67A95945D49378C7BE79190EC1
2022-07-14T10:52:35.000Z,Mitä tapahtui Ed Sheeranin toiselle Suomen-keikalle?,Ed Sheeranin sunnuntain 21.8. konsertti Helsingin Olympiastadionilla on peruttu.,https://img.ilcdn.fi/bpNGrkLMBTXIP5KrVdyikfnHAi8=/510x318/top/img-s3.ilcdn.fi/78d6b3a0903f5006d5c0d06cfe7ed679057c10b9e3ff8c467087bb73598b24bb.jpg,56BC1E90D3C04BF98F9E7FFE501FF1A9
2022-07-14T11:04:37.000Z,Räjähdevarkauksia työmailla Itä-Uudellamaalla – poliisi tutkii,Poliisi kehottaa yrityksiä huolehtimaan lainmukaisesta räjähteiden säilyttämisestä.,https://img.ilcdn.fi/Db3N6AZoMapLpnus8_C3Z-2FjsQ=/510x318/top/img-s3.ilcdn.fi/6b18e4973f79ef76dc245a41b035b61190358406d294e4f5dfab5b83589350e2.jpg,A8F20BE145624566AE8EB0D345AF4CDF
2022-07-14T11:14:48.000Z,Suomi ja EU sopuun maatalouspolitiikasta,"Suomalaisviljelijöille maksetaan uuden suunnitelman mukaan tukia vuosittain vajaat 1,7 miljardia euroa, josta EU maksaa noin 875 miljoonaa.",https://img.ilcdn.fi/Wkzbr9l-sYFQiGJwW4nFEiD0gPo=/510x318/top/img-s3.ilcdn.fi/e5c2b11024923d52f7117b483c8f48b239a627e2876c1d93b24803c4a33b87b7.jpg,D30FA657E98D47A5AF705CA125459F2A
2022-07-14T11:22:58.000Z,Ääniviestit herättävät suuria tunteita TikTokissa – samaistutko sinä näihin videoihin?,"Ääniviestien lähettäminen tulee aina vain yleisemmäksi. TikTokissa näytetään hauskalla tavalla se, miltä ääniviestien kuuntelu saattaa joskus tuntua.",https://img.ilcdn.fi/-3-P2OD5qTykGc0qFEA3L8JvPa0=/510x318/top/img-s3.ilcdn.fi/ed1e21088372e4e5d730754623b792049b4ea62f5e40e9582b8b445a9159995d.jpg,D6FFA23ACD7549CFB2E939743B5D31BC
2022-07-14T11:28:56.000Z,Sopupeliepäily Suomen turnauksessa – huippupelaajista skandaalipaljastus: ”Kuulen sinulta ensimmäistä kertaa”,ZDF-kanava sai käsiinsä salaisia tutkimustietoja. ,https://img.ilcdn.fi/t8Ycx95l4gR_3ekpTCTWciDAjf8=/510x318/top/img-s3.ilcdn.fi/037d38ad205d9fbe45421fab89ce67aa11461adb90562c1d5735bfd0b278239b.jpg,2863A499DF114C3E8855099B19DC3A0C
2022-07-14T11:46:09.000Z,Epäily: Kaksi miestä tuli luvatta Venäjältä Suomeen,Rajavartiosto tutkii epäiltyä rajanylitystä. ,https://img.ilcdn.fi/GeW2rrlTyeeXS5ZJ2OCcyKbG7aI=/510x318/top/img-s3.ilcdn.fi/ff84017e5bd2dedd8db0813e2d01617df3a950f1da1b232fc0aa661bb99eb8b0.jpg,3E3C7B04A5A24918937B71D75F36CF23
