paivamaara,otsikko,tiivistelma,kuva,id
2021-04-07T02:31:36.000Z,Niina Kuhta: ”Säästöt menivät firman hengissä pitämiseen” – koronakurimuksen keskellä löytyi uusi työ,"Korona on ollut hääpukuyrittäjälle kurimus. Niina Kuhta on elvyttänyt liikkeensä kehnoa taloustilannetta omista säästöistään. Nyt helpotusta tulee uudesta työpestistä, josta saa samalla uutta virtaa.",https://img.ilcdn.fi/_FTlQW_U1gFIsda7Sx4uDA44P2M=/0x150:1997x1398/510x318/top/img-s3.ilcdn.fi/c70a56e4b4941299995b618a2eb07160e09f3445d6d4ca1fbc55add2368b0f22.jpg,F6EE6D158AD340BABA16546A7F2D98E7
2021-04-07T03:00:00.000Z,Minkä F1-tallin kuljettaja Mick Schumacher on? Pelaa keskiviikon 10 kysymystä!,Iltalehden perinteinen urheiluvisa on myös verkossa. Montako tiedät?,https://img.ilcdn.fi/a7iMiNW0sirUv4GH1We9OQi3RFQ=/510x318/top/img-s3.ilcdn.fi/49933976e5cacbbd7c72d3fc498bfbbe633293ee6efd1295b0ac3b8727f57037.jpg,5ED4C43AFD894D39BF61B3F052828FDE
2021-04-07T03:00:34.000Z,Näin kansan kunto romahti,"Liikkumattomuuden hintalappu paisuu Suomessa jo miljardeihin euroihin. Asiantuntijat neuvovat, miten omaa ja lapsen liikkumista voi lisätä pienillä arkisilla nikseillä.",https://img.ilcdn.fi/wNIEM1U-NW4jsWdX8qe_RG5Y5wk=/510x318/top/img-s3.ilcdn.fi/ebb532c5502daf27df432b4fe662edd8c52cba22d7737b658f31a8cda203716d.jpg,09E218AE047142A4A5A8F34A2F95102C
2021-04-07T03:00:53.000Z,Kemijärven virusmuunnos vielä mysteeri – tuloksia odotetaan tällä viikolla,Lapin sairaanhoitopiirissä koronatilanne on rauhoittunut.,https://img.ilcdn.fi/oSAQ69M3-PfgzxV06F29T8CdC2U=/510x318/top/img-s3.ilcdn.fi/bcff44d22d86c433360cee739302ed32d66e5e4646671e0a47f7046f53e96b65.jpg,E315BD63C5654A6FBD0D4C8E816F4FE8
2021-04-07T03:06:50.000Z,Vapaaottelija paini 200-kiloista voimamiestä vastaan: hyppäsi selkään – leikki loppui lyhyeen,Dustin Poirier otti sai otteen maailman vahvimmasta miehestä. ,https://img.ilcdn.fi/xVombuUH2FZXyXl5R_1iMA3AM0Q=/510x318/top/img-s3.ilcdn.fi/72ff0af5c7b2e4a7a5a1e6c029d95577be145084e135c9fbcfc58d514bcbe45a.jpg,4F2C6897172A4633BAAB97D3507DDF8F
2021-04-07T03:08:08.000Z,"Harry Potterista tuttu näyttelijä Paul Ritter, 55, kuoli aivokasvaimeen",Näyttelijä Paul Ritter kuoli pääsiäismaanantaina kotonaan.,https://img.ilcdn.fi/YZ-7GIKdPCqcsbbjsg1U6R6x1Jg=/510x318/top/img-s3.ilcdn.fi/480cbb1a3c59d787e3d2dc7d3189a5616c6fc00c7ad45cc213be4e72ca33fa19.jpg,1EFED0777DA14AA9B70D0C232B3953D5
2021-04-07T03:30:12.000Z,Jääkiekon MM-kisoihin tulossa erikoinen pelaajamäärä – NHL-miehiä saattaa odottaa liian kova kynnys,Leijonat joutuvat Latviassa viiden päivän mittaiseen hotellikaranteeniin ja kuplaolosuhteisiin.,https://img.ilcdn.fi/WOs3qMVCrndaR36VwkAgn_NmK2E=/510x318/top/img-s3.ilcdn.fi/90fa90a5dff0a2c7ee27a10e2dfb2984815cbc48c809a5e3b9c7b6ce985c7c35.jpg,9EC60255D8CD4A77BEC631791E1B537D
2021-04-07T03:31:55.000Z,Catherine Zeta-Jones paljastaa pitkän parisuhteensa salaisuuden – liitto Michael Douglasin kanssa kestänyt jo 20 vuotta,Näyttelijä Catherine Zeta Jones paljastaa pitkän liittonsa salaisuuden.,https://img.ilcdn.fi/urAbaQPXZGeZbKSAQ4XqIrqVGeY=/510x318/top/img-s3.ilcdn.fi/539436e064348fc3ee0df83e88e693dd0878ed4db00e2488ed6fec97800120e5.jpg,2C161C0BC4E949F7BE99B3842071062B
2021-04-07T03:31:59.000Z,Ratkaisevat ajat käsillä Saksan kanslerikisassa – IL esittelee kärkiehdokkaat: onko Merkelin seuraaja vihreä nainen?,"Saksan vihreät ovat nousemassa kuninkaantekijän asemaan, kun maa valitsee seuraajan Angela Merkelille.",https://img.ilcdn.fi/kyIpXiapMn5V5OPkGCFHhKJAVsc=/510x318/top/img-s3.ilcdn.fi/a563e70f17f181904f80ed9cfd8b77bfdf8fb535354a966a25583b02bc794302.jpg,73B5FD8520A0453889E8BC6DC48F2608
2021-04-07T03:35:28.000Z,Amazonin Jeff Bezos tukee Bidenin esitystä yrityksiin kohdistuvista veronkorotuksista,Bezos kommentoi asiaa tiedotteessa.,https://img.ilcdn.fi/1bYyzzeT6Bz-NxWZgM9NHhnUVes=/510x318/top/img-s3.ilcdn.fi/b1535fb8fa4ef9305ebf3d9b0b03a49ad897f69492248efd3297cb61d503d078.jpg,B32A4823868A43649B2FEB1B2CCCFB76
2021-04-07T03:40:27.000Z,Mykistävä putkimainen pilvi muodostui Suomenlahden ylle,Dronekuvaaja taltioi auringonlaskun maiseman erikoisella pilvellä varustettuna.,https://img.ilcdn.fi/MpzDaL6mUFW9JQpZcsTs8pnotYY=/510x318/top/img-s3.ilcdn.fi/84ebcb57af39a5063e06fc52f94fa07b5b91991bba011df1e246b0069acebbfc.jpg,2C5E54F39EA64E359BBC7D8DFD3A3517
2021-04-07T03:43:19.000Z,Mestareiden mestari: uusi urheilija tulee loukkaantuneen tilalle – jalkojaan teloo jopa kolme kisaajaa,"Yleisurheilujoukkue saa lisävahvistusta, kun ohjelmassa takareitensä ja olkapäänsä loukannut Taina Ojaniemi lähtee kotiin.",https://img.ilcdn.fi/60Y72Vo09GiNLapio8p2PCy1ZY4=/510x318/top/img-s3.ilcdn.fi/52b8421b67aa2c57e37502a710c1044ea39cb13705c08dc43cc6c5a7e8c61811.jpg,C34BB6D7164F4DC8ABFA066D932C4F39
2021-04-07T04:00:05.000Z,VTV:n päällikkö: virastolle on valittava uusi pääjohtaja pian,"VTV:n tuloksellisuustarkastuspäällikkö Lassi Perkinen sanoo, että virasto ei pärjää pitkään pääjohtajan viransijaisella, jos Tytti Yli-Viikari pidätetään virasta.",https://img.ilcdn.fi/2BEim9rHjSu1hk4PFoxBLfecNV0=/510x318/top/img-s3.ilcdn.fi/83e6357f5a020e78964cab6793f67a01b516df44442391a9083ff7fc52c110a7.jpg,9E8E5C99021B4A81B82C62CF4798BD6D
2021-04-07T04:01:44.000Z,Nyt sattui! Patrik Laineen kuti napsahti joukkuekaveria käteen – suomalaiset rohmusivat tehopisteitä,"Keskisen divisioonan kärkiottelu Carolina–Florida oli suomalaisten näytös. Patrik Laine ei onnistunut vieläkään maalinteossa, mutta tamperelaisen laukaus teki silti tuhoa.",https://img.ilcdn.fi/0aXkQZTBqY9gP2u3tO4DgCn-6m0=/0x113:3000x1988/510x318/top/img-s3.ilcdn.fi/934ffd517621d56812d6b3fcfc6f0da666bd7c03598f2afbf269f8c7170edd9f.jpg,DEC504D1B69848E6A1CE9F8C449EBE8C
2021-04-07T04:20:00.000Z,"Tiedätkö, saatko tarpeeksi B12-vitamiinia? Mittaa vitamiinitaso helposti ilman lähetettä ",Riittävä B12-vitamiinin saanti tukee muistia ja hermostoa. Kuinka puutostilaa voi ehkäistä ja miten omaa vitamiinin tarvetta voi arvioida? ,https://img.ilcdn.fi/0lAFf1nEETHizvWDr17MjC-DERs=/510x318/top/img-s3.ilcdn.fi/699b11c3f7c426fab4ae977a24e32a24a39226f2e3d71a7faa182ec0d133ed43.jpg,7245969174B24215A3E01CD0B54A906A
2021-04-07T04:30:00.000Z,Autojen keräily on monelle pitkäaikainen harrastus – Marko Nikkasen viimeisin helmi löytyi Rinta-Joupin Autoliikkeestä,Joutsalainen Marko Nikkanen on innostunut keräilemään vanhoja Saabeja. Niissä kiehtovat automuistot lapsuudesta ja keräilyautojen hyvä hinta-laatusuhde.,https://img.ilcdn.fi/UTfZbpT2asERCQ0kC4HVVw3-puI=/510x318/top/img-s3.ilcdn.fi/3b569449238bb0d2cc27ee19eee82377745abc17641384b41b93384f11c7e6ab.jpg,F06E9B2292804DBC95D77B153F242DCF
2021-04-07T04:30:02.000Z,Noora Karma jättää Suomen ainakin toistaiseksi – muutto Aurinkorannikolle: ”Olen onnellisempi siellä”,Mentalisti Noora Karma jatkaa elämäänsä Aurinkorannikolla.,https://img.ilcdn.fi/MFCJKzNUeJBC8tK2UC9pnPOu4zg=/0x64:3000x1939/510x318/top/img-s3.ilcdn.fi/e6eba2a7f3b2baa953a05f689ff9a6945026760b0c2f8876f31a9207883abf0a.jpg,A957CDE944E64447B64D61AC7F78FF71
2021-04-07T04:45:00.000Z,Kärsitkö katkonaisesta yöunesta? Näin heräät virkeänä,Aamuyö kuluu vähän väliä heräillen ja sängyssä pyöriessä. Yöuni on katkonaista ja tästä syystä olo on aamulla nuutunut. Tuttu tunne? Vaivaan on saatavissa tehokas apu.,https://img.ilcdn.fi/HhjOIBxj7fdOLTnNly_QFjR3PDQ=/510x318/top/img-s3.ilcdn.fi/7dc2c590084a9e6f086ee460fd9600649a5aa2d1507177acc032586c8a682c34.jpg,249B9F8C0C844D74A8DAE2038E8FD58F
2021-04-07T04:45:59.000Z,Maailmanmestari Jani Hakanpää kulki pitkän tien miljoonaliigaan – Selänne naureskeli treeneissä,Puolustaja Jani Hakanpää pelaa uransa ensimmäistä täyttä kautta NHL-tasolla – 29-vuotiaana.,https://img.ilcdn.fi/zNd6haw3nt2Bh8MQw8XiULxXKOY=/510x318/top/img-s3.ilcdn.fi/7e6fc730ab6b2f15f8a7ebbb0dee215f108eb786f81b7ec15974269461da939b.jpg,E20A45DE091543FE89986AA98C91753E
2021-04-07T05:01:07.000Z,Tautipunkit leviävät nyt ennätysvauhtia – Helsingissä eniten vaarallista virustautia,"Ulkoilusta ja retkeilystä innostuneet suomalaiset eivät ole aina muistaneet varoa pusikoissa väijyvää, tauteja levittävää punkkia.",https://img.ilcdn.fi/lXqmUVRQX-74Y0g_CDdCf99KPsM=/510x318/top/img-s3.ilcdn.fi/fce25328d41f678617b52d2b7e09fcfc90ce1b305f880251bf007ef49f1b2589.jpg,2C1F9D90BDA94781AD8805393E49DFC4
2021-04-07T05:12:31.000Z,Kuljettaja ohitteli Länsiväylällä autoja kuin pujottelukeppejä - Lukija tallensi vaarallisen sarjaohituksen: ”Olihan tämä nyt käsittämätön”,Lukijan autokameroihin tallentui hurja ohitus. ,https://img.ilcdn.fi/sI8UXJca6beqbaLGyBx0hwjPhDg=/510x318/top/img-s3.ilcdn.fi/09e000e6d24175c78261883eea3917eece33f9ce295ff675efba0ca8caa46efb.jpg,5B1B81608C194643803F19935CC7FC41
2021-04-07T05:25:59.000Z,"Me Naiset: Anne Kukkohovi oli lapsi, kun veli teki itsemurhan ja perhe vaikeni – avautuminen piti opetella aikuisena","Anne Kukkohovi kertoo Me Naisissa, miten kovien paikkojen läpikäyminen on auttanut korona-arjessa.",https://img.ilcdn.fi/msYqlWZ5KVDYKjAgMit7Lgpt-Fs=/510x318/top/img-s3.ilcdn.fi/860b797019dca8bc327b9a02471e8021af5a3dd3046a4dcb96117e5075635509.jpg,4EABD396A60D4B728A737641656FC203
2021-04-07T05:26:30.000Z,”Ei noin voi tehdä!” – tuomarin temppu kulisseissa aiheutti ison kohun Mestarien liigassa,City-Dortmund-matsin jälkeen nähtiin outo tilanne pelaajatunnelissa.,https://img.ilcdn.fi/v1unu8OXwcB_RXpiiv_IABcCmoo=/510x318/top/img-s3.ilcdn.fi/0b4c627f61d56d7045588e697fe213745ebc87c64de27e3b6c9b97c2e2970ed5.jpg,4CBEA8B11FB84AF9866B487661AC5D3D
2021-04-07T05:30:23.000Z,Pankkitunnuksesi yritetään kaapata – varo yhteydenottoa: mieheltä katosi 300 000 euroa,"Pankkien nimissä liikkuu huijausviestejä, jossa yritetään saada siirtymään kalastelusivustolle.",https://img.ilcdn.fi/vpULZOQ05nJCCZe4h0PCia4zLCg=/510x318/top/img-s3.ilcdn.fi/2a5c662a0be88b9142dd456b8befb7dfa0cc721a231bdf008176f26fa98ed247.jpg,7FD7BAC6FEED49DC8BFA8EA50657E801
2021-04-07T06:00:12.000Z,Suomalaistutkimus: parisuhde tekee hyvää etenkin miesten mielenterveydelle,Sinkut ja eronneet kokevat mielenterveytensä heikommaksi kuin avioliitossa elävät.,https://img.ilcdn.fi/6Jh2RQx33xZ_hM5Mv9wQtU8fA7Y=/510x318/top/img-s3.ilcdn.fi/2b00de9134820b10426625a0beba212a6d58abd122c67301306ca11cd177d42d.jpg,51FD10C8E13E44E89232528CD436C846
2021-04-07T06:08:24.000Z,TIS: Varattujen naisten pila menee Nicolla tunteisiin – ”En halua enää kaksnelosille sun kanssa”,Temptation Island Suomen viimeiset bileet saavat ikävän lopun. SISÄLTÄÄ JUONIPALJASTUKSIA!,https://img.ilcdn.fi/1LPYsdj4NF_-J9vdEpz7Nh_NTNM=/510x318/top/img-s3.ilcdn.fi/15ff7566fe7b1d4edd1a95626d66b318e858859e1a42a270faa2355c723a85e5.jpg,315A917C253E4A1D9C339F30AED4B349
2021-04-07T06:10:14.000Z,Kumpi maistuu paremmin mökkimaisemissa – kompostijumppa vai grilliherkut?,"Korona-aikana on saatu maistaa myös mökkeilyn arkisempaa puolta, kun harmaavesipömpelit, kompostorit ja ulkohuussit ovat vaatineet entistä tiheämpää huoltoa- ja tyhjennystä. Mökilleen FANN-järjestelmän hankkineet ovat voineet sen sijaan keskittyä etätöihin sekä chillailuun ja grillailuun.",https://img.ilcdn.fi/g4JhT4JAuZEqAjZ_6An3e0Y5twc=/510x318/top/img-s3.ilcdn.fi/816ae7d51212fa32c2997daf74b3bfe1099eeaf7fa911a9fc6fe1f21ca4945e8.jpg,28750B6C214442659DE6710197E405A6
2021-04-07T06:16:34.000Z,Suomen ensimmäinen NBA-nainen,"Awak Kuierista, 19, on tulossa ensimmäinen suomalainen, joka pelaa maailman kovatasoisimmassa naisten koripalloliigassa NBA:ssa.",https://img.ilcdn.fi/rVreCSQT9ncysBfuCZ-4wZ17BZc=/510x318/top/img-s3.ilcdn.fi/17dce3954a06ae4a1cb18b01f29ae2356355166d7fe8db326bf2c5a52ff2c1bf.jpg,B375BAC3C96541F9877FCF272A6F7894
2021-04-07T06:17:30.000Z,Laittomia lottoarvontoja kaupiteltu ahkerasti puhelimitse – ”Viranomaiset eivät voi auttaa”,Poliisihallitus ja kuluttaja-asiamies varoittavat osallistumasta puhelimitse markkinoituihin lottoarvontoihin.,https://img.ilcdn.fi/Zj46QJSTcIyjnin1Wu8FvGYmasQ=/510x318/top/img-s3.ilcdn.fi/3f84e3b073d49969e9e0eb5ab877181190e79044ce9da549499075c2bdd9777d.jpg,A317EF0D51E34E549931E637DDBD5A34
2021-04-07T06:58:12.000Z,Johanna Vehkoolle valituslupa korkeimpaan oikeuteen Junes Lokan tapauksessa,Korkein oikeus (KKO) myönsi valitusluvan toimittaja Johanna Vehkoolle kunnianloukkausjutussa.,https://img.ilcdn.fi/VPtLyJCP7Q8pwotXDY7R17hSiHw=/510x318/top/img-s3.ilcdn.fi/d80f4d6c549e6f84c81a3c0885aac6bdecfff683c5b3f06264e67af9ce31c441.jpg,54A3E9EEEC38448F887E86A9C6269A83
2021-04-07T07:00:18.000Z,Kiekkolegendan kuolinsyy selvisi – sisko kertoi surullisesta muutoksesta: ”Tämä on aivan joku toinen tyyppi”,Kiekkolegenda Mark Pavelichin kuolinsyy on selvinnyt.,https://img.ilcdn.fi/AKqafFaUtS9UnP88muat8mu9faY=/510x318/top/img-s3.ilcdn.fi/ef4496a4d890f02806fd1043bf56abc15a35f993dcf53be7498be7339d623222.jpg,D9985A94137849D7A80893B873CF022B
2021-04-07T07:06:21.000Z,Näihin töihin tarvitaan nyt eniten tekijöitä Suomessa,"Uusi ammattibarometri kertoo, missä ammateissa on pulaa tekijöistä.",https://img.ilcdn.fi/8sw7oAsBzjJfcWO2jufnpGBIWlo=/510x318/top/img-s3.ilcdn.fi/e517da1ff99dc4cc42bd19ccfdde21166bdfc0efbba1430c2a878ae2bf24bf0b.jpg,AC210C99C3A840E78905E9AD8F71A9ED
2021-04-07T07:06:24.000Z,Kiti Kokkonen liikuttui koronarokotteestaan: ”Itketti moni asia”,Kiti Kokkonen kiittelee paitsi rokotteiden kehittäjiä myös hoitohenkilökuntaa.,https://img.ilcdn.fi/A745JmMKNIxS5nlsFMZgzc3zwDs=/510x318/top/img-s3.ilcdn.fi/1e9da699efe93a3c8d213e9cf2f5a70eecfe368e06dbf6f7993871fd4afac075.jpg,21891A769E65412799BAD02BFAC28CE4
2021-04-07T07:09:46.000Z,THL: Korona vähensi alkoholinkulutusta – katso oman alueesi tilanne,"Alkoholinkäyttö väheni viime vuonna 5,2 prosenttia koronaepidemian vuoksi. Näet oman alueesi tilanteen jutun lopusta löytyvästä taulukosta. ",https://img.ilcdn.fi/fehaZWjWsApesnS89TSmKEjT0JQ=/510x318/top/img-s3.ilcdn.fi/6a09658bd05e01452ffa2cc0ac57538e9fc02917b765051b0a62bb7ef1662419.jpg,9502035DFF83436B86E8A16F0840DE33
2021-04-07T07:11:01.000Z,"Megan Fox näyttää, miten neuletakki kannattaa pukea – kopioi seksikäs asuidea",Näyttelijä Megan Fox yhdistää pitkän villatakin minimekkoon.,https://img.ilcdn.fi/8ebsWWCDnBfM9eIkc_MGh5AYhUA=/510x318/top/img-s3.ilcdn.fi/6eca216632a2072da8ad9dfdda90005cc5ed3ead568d221f5a1c8ea25220990c.jpg,59C1707B83C9402DB47609FD6CC2A8F0
2021-04-07T07:31:30.000Z,"Hyviä uutisia Turusta: Lähes 40 000 saanut ensimmäisen rokoteannoksen, vaihto-opiskelijoiden tartuntarypäs rauhoittunut",Ylilääkärin mukaan Turkuun odotetaan keskiviikkona erittäin suurta määrää koronarokotteita.,https://img.ilcdn.fi/wpiam7CNssA6tdOTjSPfFt0QOm0=/510x318/top/img-s3.ilcdn.fi/77c59755f8b6725a38c67805ca978a4fe476ab97b887e8e4b0d07d8897576fa4.jpg,50AC3E38D2444F9FAC73D40EB96825F4
2021-04-07T07:34:41.000Z,"Tuore listaus: Pandemia on kohdellut hyvin maailman miljardöörejä – mukana uusi suomalaistulokas, Trump tippui 300 sijaa",Talouslehti Forbesin miljardöörilistalla on nyt kaikkiaan seitsemän suomalaista.,https://img.ilcdn.fi/X5lZOlht33UVcpsKEHhCh4JSYfQ=/510x318/top/img-s3.ilcdn.fi/1fe46815ac8ca221bbfc1174aa5cb33d2f56c883dfd7179d8d7d95244194b3f1.jpg,F6E76D579E864895B40FF3C71A7C7B23
2021-04-07T07:39:51.000Z,"Helppo tonnikalapasta maustetaan valmiskastikkeella – ""tästä tuli meidän perheen lemppari""",Bearnaisekastikkeella voi maustaa myös helposti uunissa valmistuvan tonnikalapastavuoan.,https://img.ilcdn.fi/w4mVyPg_go58nTeg3tUfgSyl0vg=/510x318/top/img-s3.ilcdn.fi/e05e7807aceea7dfb92d61d6996461058922630e50554850a3cd185734baec41.jpg,AE42A6D9FFD54507BAD9936FAFA443CB
2021-04-07T07:50:12.000Z,"Teemu Suniselle mahtava bonus: suomalainen nähdään Kroatian MM-rallissa! ""Pojat ovat saaneet myytyä pari ralliautoa""","M-Sport Fordin suomalaiskuljettaja Teemu Suninen vahvisti keskiviikkona, että mies on mukana myös parin viikon päästä ajettavassa upouudessa Kroatian MM-rallissa.",https://img.ilcdn.fi/NL-wJ11q-bVe8UL3BJQ-2cOyLJI=/0x23:3000x1898/510x318/top/img-s3.ilcdn.fi/5c53757a0f4000f03b486b40ffc877b0c196df6de6b5e04cc08a40c17e03d369.jpg,FDE1C8522E5F4F2589B64FF9CE04374C
2021-04-07T07:56:24.000Z,Nämä ovat suosituimmat lasten nimet – vuoden 2020 suosikkinimet julki,Tässä ovat vuoden 2020 suosituimmat etunimet. Onko lapsesi nimi listalla?,https://img.ilcdn.fi/aJbpFPI_QBRTTNEzxjuJexsWrpo=/510x318/top/img-s3.ilcdn.fi/0552fc0c09c4ce293d934a0aefb58a9bf8da62d186a6751e93a72cca7d2bcd69.jpg,F3C7FCBD6F7648C7B869816948F41FAC
2021-04-07T08:05:22.000Z,Jill Bidenin verkkosukat puhuttavat somessa: ”Joe on onnenpekka”,Yhdysvaltain ensimmäisen nainen puki vähän rätväkämpää päälle.,https://img.ilcdn.fi/EjIQJ7wTctBh9vq5NIpHxAbuKvs=/510x318/top/img-s3.ilcdn.fi/a57ace9e10e3d34e8a90415a21826c907429360f25afdda6d999829370421043.jpg,9D1348F328FD4FF5A9661A99D459E710
2021-04-07T08:15:05.000Z,Hallituksen suunnitelma: Suomi ulos koronakriisistä kesä-heinäkuussa,"Hallitus kokoontuu keskiviikkona Säätytalolle pohtimaan exit-suunnitelmaa, jonka pitäisi viitoittaa Suomen tietä ulos koronakriisistä. ",https://img.ilcdn.fi/YMLiKbIpz-Cb1Afd6RokT6xDIWY=/510x318/top/img-s3.ilcdn.fi/50a4b6a4b1f3d77c5af696980091397385956a21ac126900e34c7615b35f8a43.jpg,D6224D4CB6F74279BD665E26E320761A
2021-04-07T08:19:11.000Z,Tässä on Naisleijonien MM-joukkue – mukana 15-vuotias teinilupaus!,Pasi Mustonen on valintansa tehnyt.,https://img.ilcdn.fi/j0wptSO7Vs0QVVaLuF4sQwW4VhM=/510x318/top/img-s3.ilcdn.fi/ad02833242c6acfcb3e456cb2a49db836a1b7fd275da4e13fc501ade89c14837.jpg,541A0BBBE782446D87CC26191CECBA4C
2021-04-07T08:34:34.000Z,Salitreeni ulkona – seitsemän liikettä riittää koko kropalle,"Ulkokuntosalilla voi tehdä yhtä tehokkaan treenin kuin tavallisella sisäkuntosalillakin, vakuuttaa personal trainer ja hyvinvointivalmentaja Heidi Tainio.",https://img.ilcdn.fi/5kqeAS0PETNlQjY0j-s8RjauFUQ=/510x318/top/img-s3.ilcdn.fi/941baa37a9ce44d636eb10c283c5646604951c546cded905ed2f1ae91d840e21.jpg,58708EBACBBB431385137406B5B68694
2021-04-07T08:38:49.000Z,Kotkassa löytyi kuollut mies – poliisi epäilee henkirikosta,Henkirikoksesta epäilty on poliisin hallussa.,https://img.ilcdn.fi/aR0QuuGzOU-C4V94gL0FDA6R3GU=/510x318/top/img-s3.ilcdn.fi/9e0768c8e71012e58746045d26687f3af26106d48733c4570bc0e20870bb5e3e.jpeg,A788500B7D8E4CCD8387759FB4F5CC51
2021-04-07T09:00:11.000Z,Maailmanennätysmies Pekka Koskelasta julkaistaan kirja – treeniohjelmat paljastetaan: ”Aivan päätyyn asti ja vielä pari kertaa”,Pikaluistelun maailmanennätyksen luistelleesta Pekka Koskelasta julkaistaan kirja elokuussa.,https://img.ilcdn.fi/9n3oo5XOt9fDZ38_VN0euLnYMdI=/510x318/top/img-s3.ilcdn.fi/cec6160342813ef6f0f1a2750a81641587380f0cee38553e0b42cb47dbc5ce2d.jpg,918C0638E2F947B3B952F92FF327EA51
2021-04-07T09:09:11.000Z,"”Ne luulivat, että olen vakooja”",Korona aiheutti monelle ulkomailla asuvalle suomalaiselle erikoisia tilanteita. Mallintöitä tekevän Jenna Mäki-Patolan seikkailutarina hakee kuitenkin vertaistaan.,https://img.ilcdn.fi/W-HDxDMapwcu2LwRpRpLI0F2vCQ=/510x318/top/img-s3.ilcdn.fi/c2d09b026d23e0b48de47f4888c6d8c74d6af97f48907d9c8ac2829e28875338.jpg,E7ED82AFE9CB4B8C80BFB8B5CC0650DA
2021-04-07T09:18:26.000Z,TIS-Mitte tunnustaa kateutensa: ”Nico on astetta parempi kuin minä”,Temptation Island Suomessa Mitte odottaa jo viimeistä iltanuotiota Sonyan kanssa. SISÄLTÄÄ JUONIPALJASTUKSIA!,https://img.ilcdn.fi/4iyen39hcBGmoDz0KWalX-h-cKc=/510x318/top/img-s3.ilcdn.fi/1e612ff6eeda8b8feeed6f39431d4fb895fcfa521175fcbe17cc7b24263555ae.jpg,B3DBAD2C671F4974AE60528A8BFEE3A5
2021-04-07T09:21:19.000Z,Konstaapeli vaati 1000 euroa teinipojalta ja vanhemmilta – korkein oikeus ei antanut valituslupaa tuomiosta,Virkavelvollisuuden rikkomisesta tuomitun poliisin valituslupahakemus hylättiin.,https://img.ilcdn.fi/qj6yjwa4iJwbtQCgMfslmVxkkDE=/510x318/top/img-s3.ilcdn.fi/2815aa479dacedf87634d8f6dd25eefceeca1d7d696c362d41ec8b67de8beb54.jpg,46E47365B9E84196A04EA064DAE91653
2021-04-07T09:22:25.000Z,Suomen nuori yleisurheilutähti kertoo podcastissa yllättävästä intohimostaan: ”Valtteri Bottas on hieno ihminen”,Moukarinheiton SE-nainen Silja Kosonen on innokas F1-autoilusarjan seuraaja.,https://img.ilcdn.fi/-rWs2Zh3X59Vy5c0YnmvUAPdMas=/510x318/top/img-s3.ilcdn.fi/9966b270de546f2fc1583ac6807506dac87aca2b6bd78110c6a28f0cff192261.jpg,A08625A265AA413FBB6EBA912A6B8AD2
2021-04-07T09:30:42.000Z,Mikä aiheutti Facebookin jättivuodon? Yhtiö ”päätti olla ilmoittamatta” asiasta,Facebook on kertonut tarkemmin massiivisesta tietovuodosta.,https://img.ilcdn.fi/c5M28cByAqbuhlCjWHxDU50zTF8=/510x318/top/img-s3.ilcdn.fi/e61fa6772aa614adc3fd7486f2c3faa8106eb18c44d4e1aff32ca7e92d2dcc1c.jpg,8C83F7588A6649CCBF94B8D99BD990E5
2021-04-07T09:32:23.000Z,Silvio Berlusconi joutui taas sairaalaan – ehti olla kotona vain viikon,Italian entinen pääministeri on ollut sairaalahoidossa tiistaista lähtien.,https://img.ilcdn.fi/mTexAcsf02Ab8DiaCZ1ve98CqvE=/510x318/top/img-s3.ilcdn.fi/e8e0de856bd43db097a6d71e05db23392a1ce8e11a99d5dcde84b2c1d5369a37.jpg,5449E8FE2CC241C9A584FA8D5BAF261F
2021-04-07T09:34:21.000Z,Isä ravisteli pikku vauvalleen vakavat aivovammat: ”Jostain syystä vain napsahti”,Hovioikeus piti isän toimintaa törkeänä ja kovensi sakkotuomion ehdolliseksi vankeudeksi.,https://img.ilcdn.fi/P-AZkuE6y76_7v32i31A2TdfTlo=/510x318/top/img-s3.ilcdn.fi/664b93a7bda9cea71df14f964e3d14dfcbbbba96320096b6769739374b69c7a2.jpg,BDEAAE5543AE4ADE955D392589059CAC
2021-04-07T09:39:45.000Z,Serbialla on koronarokotteita vaikka muille jakaa – tuhannet rokoteturistit hakeneet jo omansa,"Serbia on neuvotellut itselleen koronarokotteita niin idästä kuin lännestä, ja maa on lahjoittanut jopa kymmeniä tuhansia rokotteita naapurimaille.",https://img.ilcdn.fi/RT2Z8MOqxKrl18NySx8hPd8m5Nw=/510x318/top/img-s3.ilcdn.fi/bb4e47a3fc7ffdceeb2ee1d5445ad4377d9abfc9317f62e92a88f9ac30374718.jpg,1C6CBA0B99234A9B990A6C8FA5C9C146
2021-04-07T09:59:01.000Z,Indonesialaispelaaja edusti naisten maajoukkuetta ja kasvoi tyttönä – onkin biologisesti mies: ”Hän oli hyvin innostunut”,Indonesian maajoukkuepelaaja oli jo pitkään kokenut sukupuoliristiriitaa. ,https://img.ilcdn.fi/_7JEpnYHnMbf0AvzbYRyDfSrGro=/510x318/top/img-s3.ilcdn.fi/7532ee69faaee0742243945386a6ac8a04060ebb80283e162bc5593b4f359c69.jpg,E21EE7C7CEAE42CA8E255C9BABD57489
2021-04-07T10:04:48.000Z,Kekkosen luuranko sai Annika Saarikolta passituksen multiin - Venäjä-mielistely väistyy kepun johdosta ,"Keskustan puheenjohtaja Annika Saarikko sivuuttaa Paasikiven-Kekkosen-linjan, mikä nostaa länsimyönteisen Rehnin kurssia keskustan presidenttipelissä, kirjoittaa Lauri Nurmi.",https://img.ilcdn.fi/le6_toaiakLgHzUZyJ1E5J9CadE=/510x318/top/img-s3.ilcdn.fi/5aa1bdbc3e68b801570c4d659e5f859836d9b1ed0d8643341ca9cbd66c445be6.jpg,A3D6F72700C54A49833923730BD5033E
2021-04-07T10:09:29.000Z,Pakistanilaisparturilla omaperäinen leikkaustekniikka - uskaltaisitko istua hänen tuoliin?,Uskaltaisitko sinä pääsi tämän parturin käsittelyyn?,https://img.ilcdn.fi/valmsQRJBl5dXvq8N5V-ex_mqeQ=/510x318/top/img-s3.ilcdn.fi/fbf2fcd000b8759690c99bed9fb9181fd092e6c2ef567a8880f91c035562e9dd.jpg,77683CD641D34094821A678EBB8145A0
2021-04-07T10:23:18.000Z,Hallituksen salainen muistio: Paluu normaaliin lykkääntyy heinäkuun loppuun – syynä rokotusten viivästyminen ,"Hallituksen salainen korona-exit-muistio paljastaa, että rokotusten viivästyminen johtaa siihen, että Suomi saadaan todennäköisesti ”auki” vasta heinäkuun loppupuolella.",https://img.ilcdn.fi/ufc98JDQmw2fy4c1J35nb2S2pu8=/510x318/top/img-s3.ilcdn.fi/6c0f092916fd0f2d6d0d5ea06af8afa7e364da4974aac67aa699851f8172de16.jpg,CE988C849B0C4E6D86CC40BD35D51BB5
2021-04-07T10:29:27.000Z,Bayern Münchenin talismaani lasaretissa – pöytä katettu Neymarille ja Mbappelle?,Keskiviikkona on ohjelmassa kaksi äärimielenkiintoista Mestarien liigan ottelua.,https://img.ilcdn.fi/e98mki-SDbdx4eajhkvtpq_qoeI=/0x64:3000x1940/510x318/top/img-s3.ilcdn.fi/de7041abf00d2a73d0bace7283efa28896615496a3d8705dcb2cdbf52ef48bf0.jpg,F8AA5DB01E0D4977BEF4498CC969716C
2021-04-07T10:47:28.000Z,Radiopersoona Ville Kinaret muisteli ällöttävää The Rasmukselle tehtyä kakkakepposta: ”Meistä se oli nautinnollista”,Musiikkipäällikkö ja radiojuontaja Ville Kinaretin yhtye oli The Rasmuksen lämppäribändinä.,https://img.ilcdn.fi/VzaLfwjkf4Mr2HuqwUJX2d0iZoA=/510x318/top/img-s3.ilcdn.fi/f44ce58604c02fe6b60397508fcc4b9e85f627bf81f2ee0b9154fb945da51f69.jpg,50BACE6CDE2745BF825F55A2BA89083F
2021-04-07T10:52:57.000Z,Poliisi pyytää havaintoja Keuruulla hoivakodista kadonneesta Pekasta,Kadonneesta Pekka Puttosesta on viimeisin havainto tiistaiaamulta.,https://img.ilcdn.fi/trYAau03eibEZlhQ6oq4d9QQJmY=/510x318/top/img-s3.ilcdn.fi/85975083049a5e706c69aa54e026af869ec015bde52948e820904ba09a29c3e1.png,63A30B3B744D40119C00962124441918
2021-04-07T10:53:05.000Z,Posketon palkka! Jättitappiot tehnyt Manchester City teki uuden diilin Kevin De Bruynen kanssa,Kevin De Bruyne allekirjoitti Manchester Cityn kanssa uuden sopimuksen.,https://img.ilcdn.fi/yKE8xgyYWdbCBXumdgPbRKNSCL0=/0x64:3000x1940/510x318/top/img-s3.ilcdn.fi/fc20db8751f3bdac0f223ee0678baa1a9b9e0116db504052d298eecf5abe207f.jpg,9E9DBBD602D44F7396060498C9492612
2021-04-07T11:07:43.000Z,Oulussa joulukuussa kadonnut mies on löydetty kuolleena,Poliisi ei epäile kuolemaan liittyvän rikosta.,https://img.ilcdn.fi/aR0QuuGzOU-C4V94gL0FDA6R3GU=/510x318/top/img-s3.ilcdn.fi/9e0768c8e71012e58746045d26687f3af26106d48733c4570bc0e20870bb5e3e.jpeg,3E421D78EF16488C9029E6423B5EE910
2021-04-07T11:33:18.000Z,Ilmavoimien harjoituksessa pudonnut painava ilmatankkausletku löytyi läheltä asutusta Kihniössä,Yhdysvaltain ilmavoimien kesken harjoituksen pudonnut ilmatankkausletku on löytynyt.,https://img.ilcdn.fi/8ihowMosNiMOJA_FMhHjFgMm3UY=/510x318/top/img-s3.ilcdn.fi/4d52cbffb2c9d44d7ea5e8425b5c1b43fc04de295873821c47053f9db296c708.jpg,E2278A1B869A4C6CA022FC6DC60F5C42
