paivamaara,otsikko,tiivistelma,kuva,id
2023-10-11T18:47:16.000Z,Ketut alkaneet syödä pysäköityjä autoja – Lontoon asukkaat ihmeissään,"Lontoossa kääritään autoja verkkoihin, jotta niitä ei syötäisi. ",https://img.ilcdn.fi/KJAD_5GWYW-EnquVDJy2XG-vIp0=/510x318/top/img-s3.ilcdn.fi/fa8981c9afad8d3f5283f632da5c4e0845e1d89d73cd8fa448f04e7a970358d1.png,F422161165AD481D8F581690E24997C3
2023-10-11T18:49:31.000Z,Tekikö vanha liittolainen oharit Putinille?,Armenian pääministeri jättää IVY-maiden kokouksen väliin.,https://img.ilcdn.fi/BwRfRKbDxYJpWSqYv4K5C1Fjpik=/510x318/top/img-s3.ilcdn.fi/bf39e39cd4d066a9dd2a120e55207f94ff5da826d6800225481c5283bee685bf.jpg,C5767B3521B3493D83507CB7E1404C70
2023-10-11T18:52:15.000Z,Patrik Laineelta kysyttiin isosta muutoksesta – Täräytti alatyylisen vastauksen,Patrik Laine uskoo itseensä.,https://img.ilcdn.fi/TlY_8MyTzv0sAJgnHHIBfOHiIdU=/510x318/top/img-s3.ilcdn.fi/9d3782ebac40c4fa850bf97907fecad87f3332052dbe16851741404921e3c2ef.jpg,12127B5040AC4FB6ABFFB36ED0135904
2023-10-11T18:55:02.000Z,Yllätyspaljastus: Prinsessa Diana nähdään haamuna Netflixin hittisarjassa,The Crown -sarja huipentuu kuudenteen tuotantokauteen.,https://img.ilcdn.fi/GmmaSspFLk8HF6zjh4T5KA9Vlyw=/510x318/top/img-s3.ilcdn.fi/92e86441c4e12b12a89fb53086342c5542a9e19c559be3236db7f87266eceab9.jpg,C5B8F185457242239AA8F21B1546130E
2023-10-11T19:20:17.000Z,"”Kyseessä hybridi-isku” – Näin Haavisto, Stubb ja Aaltola kommentoivat MTV:llä kaasuputkivauriota",Presidenttiehdokkaat keskustelivat muun muassa Suomen turvallisuudesta ja Israelin tilanteesta.,https://img.ilcdn.fi/yWgonksF8JAvTJG8egG2_OHp2cw=/510x318/top/img-s3.ilcdn.fi/4821b104dd54e5f6cd5f5693e41885372b941473532658793ae1de499e81cc7f.jpg,7CF48775803546FF9F695A6348993A55
2023-10-11T19:25:49.000Z,Iida Vainio lähettää tatuointinsa myötä viestin hänen ja Archien suhteen epäilijöille: ”Hyvä keskisormen näyttö”,"Iida Vainio kertoo samalla, miten heidän hääsuunnittelunsa ovat edenneet.",https://img.ilcdn.fi/qAZFy4IcYlu4R-Q5tYtKCL5Kj2U=/510x318/top/img-s3.ilcdn.fi/49c73b0629565658e63b5bc4215921e2d0139a4d93d94e253defa3d6afe20cad.jpg,D58B482B78DD4F01BBBF4DC59A7AA36D
2023-10-11T19:29:41.000Z,Tämä tunarointi maksoi paljon – SM-liigavalmentaja puhisi: ”Käsittämätön maali”,Sarjan peräpäässä majaileva KooKoo haki kaksi pistettä Porista.,https://img.ilcdn.fi/OYDXwG8LswYIYbE2RUELqU9T2Qs=/510x318/top/img-s3.ilcdn.fi/67c18039ce9cbdad8db55ec3ec7bd907a29eb711fc01038085d7585a7f82d0a4.jpg,BBF1166910B54C378532E3262766A884
2023-10-11T19:30:57.000Z,Suomi lähettää lisää sotatarvikkeita Ukrainaan,Tähän juttuun on koottu Ukrainan sodan tärkeimmät tapahtumat keskiviikolta. Kyseessä on sodan 594. päivä.,https://img.ilcdn.fi/OHeU_vZVfXZ3C1PC9qD6pjc0VZY=/510x318/top/img-s3.ilcdn.fi/2e5a82d1464c95b564e8ce54a9a3bb0aecd7e804a10137770d5df3ff49e44810.jpg,FEB095444A4E487A8DE6A911114BD688
2023-10-11T19:35:15.000Z,Nyt mitattiin lähes hirmumyrskyn lukemat – Yli 30 000 kotia on ilman sähköä,Myrskyisä sää jatkuu keskiviikon läpi torstaille. Useilla merialueilla on voimassa aallokko- ja tuulivaroitus.,https://img.ilcdn.fi/F8AQI90JttVXsLOk3tZZECu2l3M=/510x318/top/img-s3.ilcdn.fi/1072284e08616e66b4d2086b22727c6fcccffb26198e4ebdd3fb61d35124924a.jpg,43077D19BC3947DD9BB59CED8AB30C66
2023-10-11T19:50:22.000Z,Epäilty tuhotyöläinen iski Malmin kauppakeskukseen – Koko rakennus tyhjennettiin,Poliisi on pidättänyt yhden henkilön kauppakeskuksessa syttyneen tulipalon seurauksena.,https://img.ilcdn.fi/vJUtiKgQuzWk-CDfejo6HxEZNRo=/510x318/top/img-s3.ilcdn.fi/bc0122f1187a9b31a65adefc89a3ffa09637e0304b8531d73f41a7d348a41aef.jpg,39FF377AD01D4252B30B4008F2F3D002
2023-10-11T19:57:25.000Z,Valmentajaa epäillään epäasiallisesta käytöksestä – Oululaisseura otti yhteyttä poliisiin,Seura käynnisti toimenpiteet epäilyn jälkeen.,https://img.ilcdn.fi/RK_pNBOtt43GfLY46EBluD4naUE=/510x318/top/img-s3.ilcdn.fi/8caf4f15b34a975ad0b073beceec9b97c744c7e6b48514a3de640b60bc2b0e1e.jpg,466F9CA1E2DA46B885D81EEA20ECEA42
2023-10-11T20:05:05.000Z,Helsinkiläishotellissa tulvii,Ruoholahdessa sijaitsevassa Unity-hotellissa rikkoutui putki myöhään keskiviikkoiltana.,https://img.ilcdn.fi/PppaMTRs-DAqCjPQ2EFzoeIWiRY=/510x318/top/img-s3.ilcdn.fi/9c556130554c3d8859886a7a86ae6668801b3f98215c5086edc9d821398e5e9d.jpg,81B3B0C32C314CEBA12893721140F9B4
2023-10-11T20:32:13.000Z,Vitostiellä vakava liikenneonnettomuus – Tie pysyy kiinni vielä tunteja,Runsaan lumisateen vuoksi paikalla on erittäin huono ajokeli.,https://img.ilcdn.fi/fqOIO-M16s0PjI9j2ASsrTgPmBQ=/510x318/top/img-s3.ilcdn.fi/1f8ecba87f3df5b2360c7f1187d9b320f530f92a3c2a9178b33db785b778dfc2.jpg,DBCA0DFC7B244ACFB5A93BC138E1BE1B
2023-10-11T21:13:01.000Z,Hattutemppusankari solmi AHL-sopimuksen,Joel Kiviranta pukee ylleen kotkapaidan.,https://img.ilcdn.fi/WRuds7_BETz77iEMZ76Iq2W7aFU=/101x158:2869x1868/510x318/top/img-s3.ilcdn.fi/9a9eb7c58b5333d4ad202b70c3636265a2526a6b0323d1b4f680037932acb260.jpg,AECE3F8D497648F592689F047C87B28A
2023-10-11T21:24:14.000Z,Musertava suru-uutinen yllätti Jari Saarion – Some puhkesi myötäeloon,Soutajakonkari sai kuulla suru-uutisen perheen lemmikistä.,https://img.ilcdn.fi/4kh5EX29PdYC1w38f33sJyxT5aQ=/510x318/top/img-s3.ilcdn.fi/8bb5d3f61148f354b0d643bbb3f06639076a25e3076aaa2345053927e4132a91.jpg,4A5C93C630DA42998A4E9C8C17B063C0
2023-10-11T23:00:00.000Z,Horoskooppi,NULL,https://img.ilcdn.fi/ZJX2nPQHLedeTO4nOGca4bZ5URo=/510x318/top/img-s3.ilcdn.fi/0e855f41645f17dbb2436f21bf69f40ac48d1971a147578985e2c64c1fb985d3.jpg,DC4A33B28DCD4E228156DFECB61DCA52
2023-10-11T23:51:44.000Z,Dolly Partonin isoisä rankaisi Dollya fyysisesti liian paljastavista vaatteista,Kantrilegenda kertoo kokemuksistaan brittilehdelle.,https://img.ilcdn.fi/uSR73vec1KnjTn74MuIAAEDlIik=/510x318/top/img-s3.ilcdn.fi/d1eae945e8c9897fd30351a6522ce3cc252d4838b0d450325acee24a020c85ee.jpg,EF6270752D7D4A0E8CB2102D0F0D63EF
2023-10-12T00:44:44.000Z,Silmänsä menettänyt Salman Rushdie vastaa väkivaltaan taiteella,Salman Rushdie yritettiin murhata viime vuonna. Kirjailija kertoo kokemuksistaan tulevassa teoksessaan.,https://img.ilcdn.fi/5lSb6e7uIkoogwhaMKZq7o-33Hk=/510x318/top/img-s3.ilcdn.fi/168cf925ccff6d04a2d57a1d04ec4e42a9606aa5a5647e32390a692ab9a035a0.jpg,B3EDC261126847E1B9512FA21999B265
2023-10-12T01:21:51.000Z,Myrskyisä sää jatkuu torstaina – Varoituksia koko maahan,Kovasta tuulesta varoitetaan koko maassa.,https://img.ilcdn.fi/EpYFgp6kCdv1kzfpaaxlupwbIIs=/510x318/top/img-s3.ilcdn.fi/b44773ffe2daa2eaaf0dd2a3baa5fc9b73f2934ffc2af127e65dfdbcfec1fdb7.jpg,151B5E6A1CDF49BF9100C9FBFFC315BC
2023-10-12T02:00:22.000Z,"Autovarkaiden kolikkokikkaa testattiin – Katso videolta, miten kävi",Autovarkauden kerrotaan onnistuvan tavallista kolikkoa apuna käyttämällä. IL-TV testasi kolikkokikan toimivuutta nykyaikaisissa autoissa.,https://img.ilcdn.fi/EpsKGDJZ4GNBwEZOR6dVaEzNQQE=/510x318/top/img-s3.ilcdn.fi/b175f349d7d8e5f67d4364dcb1421b14d7924bb19ee5323ec2ba11b959858814.jpg,F22A9C436EAE4C578F2BB7FBCC516562
2023-10-12T02:14:41.000Z,Näin naapuruston maat kiristävät omien kriittisten kohteidensa turvatoimia,Norjan öljykohteita valvotaan tiukemmin.,https://img.ilcdn.fi/6jL6m7h46OBh1zKDSrPhd5A20uA=/510x318/top/img-s3.ilcdn.fi/6f6e4c84602a8aaec373f71f41ab69cad049a50b9204fee45127bbb96f65b3fb.jpg,B1A83B8D1DC045CF887A6771A9FC4881
2023-10-12T02:30:00.000Z,Näitä autoja suomalaiset etsivät nyt – sähköautot nousevat vauhdilla,Autotalli.com -palvelussa tehdyt vaihtoautohaut kertovat mitkä autot suomalaisia juuri nyt kiinnostavat. Top 10 listalla juhlivat eritoten saksalaiset merkit. ,https://img.ilcdn.fi/MKt_XOQYJwdmQM3-jdBVcg3aks8=/510x318/top/img-s3.ilcdn.fi/2c96d065b6ddaf2d3538a0eafde3bd30b4e95d96b5c6fa4318c603887dafe80c.jpg,8833DD7FA6B24195A5D2A2684FFACE0C
2023-10-12T02:30:02.000Z,Linda Lampenius poseerasi alasti Playboyssa – Paljastaa nyt dokumentissa yksityiskohtia kuvauksista,Linda-dokumenttisarjassa käydään läpi viulistin nousu kuuluisuuteen.,https://img.ilcdn.fi/T_MppT12y6u64reGnyG0LASwbpw=/510x318/top/img-s3.ilcdn.fi/9a0b8b38df5e64aa413f497e1287ba457fb2ec6a177ba4da53db2e03b315c984.jpg,4372D4DE6C62497D807EC67760822340
2023-10-12T03:00:05.000Z,Kalle Palanderilta tiukka viesti varakkaille suomalaisille: ”Koettakaa nyt ymmärtää”,Syöksylaskija Elian Lehto lähestyy maailman kärkeä. Menestyksen uhkakuvana voi Kalle Palanderin mukaan olla talouspuoli.,https://img.ilcdn.fi/SvtxYIIbGg9rsJBLlg3tksTtU50=/510x318/top/img-s3.ilcdn.fi/6f70282b06c5c913d4684ed102762f7bf454a475bcf4695f8132987d153b7ab0.jpg,CB3FEF757B49492CB0C77C7E5C772690
2023-10-12T03:00:09.000Z,Sattumaa vai ei? Nämä asiat yhdistävät Nord Streamin ja Balticconnectorin vuotoja,Balticconnectorin ja Nord Streamin tapaukset muistuttavat myös aiemmin Norjan havaitsemista ongelmista.,https://img.ilcdn.fi/1MBqRPFHq7QzjviqL5vSP3o4ZYI=/510x318/top/img-s3.ilcdn.fi/5421a5f97cfbd0faa91a9463d3306cfc3043386c423f7c9cbef512932a7795a4.jpg,65B3A6105DCB4DAFB816719114CE0C34
2023-10-12T03:00:13.000Z,Oman käden oikeudella,"Suomen rikoslaissa on pykälä, joka panee nopeasti rikossyytteeseen sellaisen, joka ajattelee vain tekevänsä omalla omaisuudellaan mitä lystää.",https://img.ilcdn.fi/8xw6y8gv4hS5e9oyHTsikKMLTXE=/510x318/top/img-s3.ilcdn.fi/f1da7a9594c78436cc3d33a90b0dd8d5fd9bffae6ccdb3474824516295178c6b.jpg,52DBDC5FB92D415E8FAF22F1F90649D1
2023-10-12T03:09:55.000Z,Madonnan tytär kopioi tarkoituksella äitinsä ikonista kappaletta tuoreella musiikkivideollaan,Musiikkivideolla nähdään muun muassa Madonnan tyttären Lourdes Leonin alaston keho.,https://img.ilcdn.fi/1qkWFI-DoNOLpe1rXpf7du1rcbs=/510x318/top/img-s3.ilcdn.fi/7f1888373b094fdb2bb26dc17941eb3821ff6c4aacf8d221afec1fc9dcd4c823.jpg,24818E985C48431A93BEEE4766AE8EF7
2023-10-12T03:30:48.000Z,HS-gallup: Kokoomus kiilasi kärkeen – Perussuomalaisten alamäki jatkuu,"Kokoomus ohitti kannatuskyselyssä SDP:n suosituimpana puolueena, perussuomalaisten kannatus puolestaan on laskussa.",https://img.ilcdn.fi/U5WlKAuckGM2gDiebIihD15YuuA=/510x318/top/img-s3.ilcdn.fi/8834137123f5f55c18e34d96db1777cbafa8956e21b16976eac1903ced4bd8ca.jpg,85C008B8024A4A3598C6F1715244EC72
2023-10-12T03:34:24.000Z,Ainutlaatuinen iskun paikka asunnonostajalle Helsingissä ,"Sp-Koti kertoo tiedotteessa, että 400 000–500 000 eurolla voi nyt poikkeuksellisesti päästä kiinni perheasuntoon jopa Helsingin kalleimmilla asuinalueilla.",https://img.ilcdn.fi/IFZwV9kzoAMptMmBiAEfzbdcLm0=/510x318/top/img-s3.ilcdn.fi/70d597464d82b5454789deaef2fc53f078e183e85b684457096656f97f7d2ec2.jpg,E2C0F29556664D93916DE43CBDC731A4
2023-10-12T03:35:01.000Z,Superlupaus sai maalitilinsä auki! Vanhanaikainen yllätti ruotsalaisvahdin,Connor Bedardin Blackhawks hävisi Bruinsin vieraana.,https://img.ilcdn.fi/DPVBxy-bIoNNLVXTRVQKd8Ny29A=/0x64:3000x1937/510x318/top/img-s3.ilcdn.fi/4db0cdd7b91d7ee11280ba0faa1af65ee563dcf6ff29bdbe6962cf70e7536391.jpg,93DDE87C27F5431EAE1C7F3800E88709
2023-10-12T03:45:37.000Z,Carolinan suomalaiset heti pisteille – Joonas Korpisalolle sähäkkä alku uudessa seurassa,NHL-mestarisuosikki avasi kautensa voitokkaasti.,https://img.ilcdn.fi/tyEY3LEPiV-ywK6qhWEQ5vXcbMk=/510x318/top/img-s3.ilcdn.fi/ce8d9a848c1eabafa10ecb8b5f24376f9f255da924581e6944dc1dedc458f058.jpg,1731F25D22C14F6D94CBBDF391301339
2023-10-12T03:58:29.000Z,Muistatko Anniina Valtosen tekemän mokan suorassa tv-lähetyksessä? Teki sen taas,Anniina Valtonen sai haasteen uusia muutaman vuoden takaisen mokansa keskiviikkoillan tv-lähetyksessä. ,https://img.ilcdn.fi/e2KogWtFYLHHdY9R_QovJxAzlbo=/510x318/top/img-s3.ilcdn.fi/0624cba247e180aa48f94fe3fd26b5f2c455e20cb3fd86fff18961bdb153b05f.jpg,61FB22937ECE43729612C0E6B36AA186
2023-10-12T04:00:00.000Z,"Silmien kuivumista, näön hämärtymistä ja päänsärkyä – näin vähennät digitaalista näkörasitusta, josta lähes jokainen päätetyötä tekevä kärsii","Digitaalinen näkörasitus aiheuttaa muun muassa tarkentamisen vaikeutta, silmien väsymistä sekä päänsärkyä. Maailman näköpäivänä halutaan nostaa esiin silmäterveyden tärkeyttä työpaikoilla.",https://img.ilcdn.fi/GEL6HAU2xySCeQfdUPxIlx2fbbU=/510x318/top/img-s3.ilcdn.fi/3e77da4789f04c25416af2913a34354f01114e1be18fbafabdac9ac7aea0ffea.jpg,43E2F14EB12242B99755A8C23A340988
2023-10-12T04:00:56.000Z,"Hamasin hyökkäyksellä oli sokkivaikutus, mutta sotaa sillä ei voiteta","Ensi-iskun voima ei riitä pitkälle, jos terroristijärjestö Hamas ei saa sotilaallista tukea muualta, kirjoittaa Iltalehden erikoistoimittaja Emil Kastehelmi.",https://img.ilcdn.fi/isFSB8jNscYPPFXKmtWaharq3C8=/510x318/top/img-s3.ilcdn.fi/e9e3de264ae1af10dc568c1bf73a6cfe981b2612fbe596516f2ec341f10074bc.png,7CC4913BE97548B2A26D6ADAC43B5755
2023-10-12T04:04:17.000Z,Mikko Rantanen hurjana kauden avausottelussa – Reiluun erään kolme tehopistettä,Avalanche avasi kautensa LA Kingsin vieraana.,https://img.ilcdn.fi/tuiGDlrReH8UOZd383T73FmzLcQ=/0x64:3000x1937/510x318/top/img-s3.ilcdn.fi/2082c461c07cbc0e4f934d778e0b4b27e5e5a6120752b568b3ec2cb63610b0cd.jpg,882872BEFE7E4691828785D7695404DF
2023-10-12T05:01:05.000Z,”Sanna Marin on kuin nuori Lenita Airisto” – Tämä ex-pääministerissä kiehtoo hänen ihailijoitaan,Iltalehden lukijat kertovat Sanna Marinin määrätietoisuuden olevan ihailtavaa.,https://img.ilcdn.fi/QfuKU5YBUasD748f1ACcCKYk7e4=/510x318/top/img-s3.ilcdn.fi/3d396aa95e5b55d2295b568139200d4765a32469b7f7a582e82c892b5f1e772c.jpg,C524F905BED94C0C86266F3B96810153
2023-10-12T05:08:12.000Z,Meikkivallankumous on alkanut – Tältä näyttävät viisikymppiset naiset ilman meikkiä,Yhä useampi Hollywood-tähti edustaa ylpeästi meikittä tai äärimmäisen luonnollisen näköisenä. ,https://img.ilcdn.fi/oOOA2y3Z5tzYRruFFS8URRciBRY=/510x318/top/img-s3.ilcdn.fi/c05ae792e306b1b4d91dde54021ed1728679470dfbc4cacea120e9fd6991db26.jpg,B2E93044BE2C43D1B9C132E537391A47
2023-10-12T05:13:15.000Z,Tiesitkö? Yllättävästä ravintoaineesta apu kohonneeseen kolesteroliin ja verenpaineeseen,"Monen suomalaisen kolesteroli ja verenpaine ovat kohonneet, ja nämä ovat tunnettuja riskitekijöitä sydän- ja verisuonitaudeissa. Niin kolesterolia kuin verenpainettakin voi kuitenkin tutkitusti tasapainottaa aidosta luonnonraaka-aineesta saatavalla ainesosalla.",https://img.ilcdn.fi/1Ll3O5RE1yq8D5CC7Xthc8S4UXA=/510x318/top/img-s3.ilcdn.fi/1b96786bc9d02058b416044cc73d7c063a2b695182651afd10971963ae4f32ca.jpg,1D1CBE41C02745B7895F785892958CAD
2023-10-12T05:15:56.000Z,Tällainen oli Miki Liukkosen kirjan koskettava julkistamistilaisuus – Kasvot piirrettynä suureen kanvaasiin,Kesällä kuolleen Miki Liukkosen postuumisti julkaistun Vierastila-kirjan julkaisua juhlittiin Helsingissä. ,https://img.ilcdn.fi/fdxNQbcDWgRFobo-VMnI0hkW6yw=/510x318/top/img-s3.ilcdn.fi/660dc74c60ae45b9cfcef18a787945bd3600a8a0ca9286fd28a20d5eae831187.jpg,32AC387725BF4D2DABE7F28CE5B28CE2
2023-10-12T05:20:20.000Z,SM-liigan ex-tähti palkattiin Columbuksen valmentajaksi,Columbus Blue Jackets sai valmennukseen ruotsalais-suomalaista osaamista.,https://img.ilcdn.fi/e2bXaLLCwwBMIl_Fsb649drmjpY=/510x318/top/img-s3.ilcdn.fi/1236eb99c0ec00107292c24ae2d344f0efdfc22b19be917783fa4afbd998be39.jpg,8E968514C527492CB13F9955E9A7639A
2023-10-12T05:27:56.000Z,Tyrmäys! Connor McDavidin kausi sai surkean startin,Canucks rallatteli kotijäällään 8–1-voiton Oilersista.,https://img.ilcdn.fi/zBtX6axzUqSWuxjIcePyFTtnJx8=/0x86:3000x1961/510x318/top/img-s3.ilcdn.fi/fa9b557420221cd08c6fc49791fb8f4bf907b43055d8ca34ab58522c6b9189eb.jpg,2A1B9EE421F04684957EF14C8466CD18
2023-10-12T05:31:55.000Z,"Itkuinen Elina Gustafsson tunnustaa tv:ssä, mitä hän katuu: ""Häpeän silmät päästäni"" ",Elina Gustafsson on yksi Petolliset-sarjan tähdistä.,https://img.ilcdn.fi/d8muB_cXWGNskrOocGYBk9HaFUM=/510x318/top/img-s3.ilcdn.fi/58e5014c07cc41806fbb33f0a19a29a1eeaa1581e18ff436be436563c53711d3.jpg,F5A8626C574B487BA571077CDF3770FB
2023-10-12T06:00:33.000Z,Suora lähetys kello 10: Näin Venäjä vaikuttaa Suomeen juuri nyt – Supo kertoo Suomen turvallisuustilanteesta,Suojelupoliisi julkaisee torstaina kansallisen turvallisuuden katsauksen.,https://img.ilcdn.fi/nX1dCwvsikwHjTPP7a7aEmGiB-M=/510x318/top/img-s3.ilcdn.fi/4e06435841aff29a60cb12ceab4c3e68b6409cdd01123791602a14f00eed028d.jpg,3EF9FAE44A3246F99AB81B0664A4A13D
2023-10-12T06:02:46.000Z,Lukijan video: Rekkakuski teki rohkean ratkaisun pikkutiellä ,"Eurajokelainen Veli-Matti oli tiistaiaamulla 3.10 matkalla kohti Euraa, kun rekka teki rohkean päätöksen liikenteessä. Veli-Matin mukaan liikenteenvaarantamiset ovat lisääntyneet järjettömästi ja hänen mielestään valvontaa tarvittaisiin lisää.",https://img.ilcdn.fi/Og964MBWOrivWOxatD5eJ6FN7Yk=/510x318/top/img-s3.ilcdn.fi/6fc2f4daa36e5f70fe32fbe83a275b88bd6ba54df7c55ea82a582fbb32fbb02d.jpg,0422D35CC4BE4FE6953B40E68AA8A25E
2023-10-12T06:08:05.000Z,Conor McGregorista iso paljastus – UFC teki tähden takia rajun liikkeen,Irlantilaisen paluu UFC-kehään saattoi lopettaa anti-dopinginjärjestön sopimusneuvottelut.,https://img.ilcdn.fi/INURcfsZgLQIUg5DGDIG-DT8J4U=/510x318/top/img-s3.ilcdn.fi/3c223d8fd7317c2059914254f267d3c06cfa3adba7f2e329132d4b8a867ad5d8.jpg,07D2B5581307463AA1DAC130B0658A41
2023-10-12T06:13:40.000Z,Lapsenlapsi kaapattiin ulkomaille – Pääepäilty on nyt Suomessa,Satakunnan käräjäoikeudessa käsitellään tänään pääepäillyn vangitsemista.,https://img.ilcdn.fi/oLPSKb9pOsQLqxqkNPJ9yY9PfXg=/510x318/top/img-s3.ilcdn.fi/7d901578a91e39234cd6e479b55062acb9d86facd876fa5c3aa0a0f6549be0ae.jpg,3039E1C4B93F4351938C39E9604D619E
2023-10-12T06:26:10.000Z,Yllätysnimi näyttelee Pave Maijasta Dingo-elokuvassa,Reino Nordin nähdään jälleen valkokankailla. ,https://img.ilcdn.fi/N4JXKnmx8Ojh1tzP02KeP8QcgpQ=/510x318/top/img-s3.ilcdn.fi/4cd7c224af0a0879b22989a042d4d934fe45236fd597c37d017fa3dc716f3c37.jpg,51F7204CB5824ECF9E03EE847EEFB3BD
2023-10-12T06:27:16.000Z,Nainen surmattiin kotiinsa Kittilässä – Motiivi täysi mysteeri,Järkyttävän teon motiivi ei selvinnyt tutkinnassa.,https://img.ilcdn.fi/rxIEqpGl44mOfzTYbUgl9s8lMqE=/510x318/top/img-s3.ilcdn.fi/438442cc20f3f63deb5c353e7bca0aaa587c6f8f98e19f7c45122a9f0537d6fc.jpg,1AAF490F41E045CE867FC2FAF52A8FAB
2023-10-12T06:31:20.000Z,"Ruumiintarkastuksia kaduille, massakameravalvontaa – Kuulostaa jo sortovaltio Kiinalta","Olisiko sinulle ok, että komisario-Kalle tulee olohuoneeseesi, poimii perheesi kännykät ja lukee viestejänne työkavereidensa kanssa, kysyy Iltalehden kolumnisti Sanna Ukkola.",https://img.ilcdn.fi/OQNpfndYlF6qO4FmIhIGhqf0Cxs=/510x318/top/img-s3.ilcdn.fi/902fe04f2f002acf1efb838b54a3ca06df99c7f623cd9651b1e46d93ef9a992e.jpg,25A8DB919EF841EFB1BEFFC132B854EF
2023-10-12T06:36:54.000Z,Putinia pyydettiin rauhanvälittäjäksi Israeliin,Irakin pääministeri esitti ehdotuksen Venäjän energiaviikko -foorumissa.,https://img.ilcdn.fi/Zo4EXiaQJh19ROTNRFRDOGikf8g=/510x318/top/img-s3.ilcdn.fi/e76b435e46a2e44167d9d9c8ae87fcf09436b23b3d15d056815e0afc8adcf999.jpg,D40078563D4443088493C5002CA4D83A
2023-10-12T06:41:31.000Z,"Vallen ostos käänsi päitä Ykköstiellä – ”Katsoivat varmaan, oliko Kimi Räikkönen ratissa”",Entinen autourheilija hankki työpaikalleen muistoja herättävän koristeen.,https://img.ilcdn.fi/lPJbC2E1PquMTQeQOi1M4jm6VKA=/510x318/top/img-s3.ilcdn.fi/7102c13b44548acc46832ee4da8c122c17d3f5461a0c60b5d55f190acd50b2b7.jpg,2B66BDCC03194521A6D728366616E27A
2023-10-12T06:44:47.000Z,Tiesitkö? Näitä lääkkeitä ei saa milloinkaan puolittaa tai murskata,Lääkkeiden ottaminen väärällä tavalla voi viedä lääkeaineen tehon tai aiheuttaa jopa myrkytyksen. ,https://img.ilcdn.fi/Le4zitxEEFlW7X-p7EJQ2GUQcdg=/510x318/top/img-s3.ilcdn.fi/e7e6dc58156fe4119a79c064b30d449a8fdf9b99d391bf32f9ca047fca034708.jpg,F483427D26DF4019950E5468698B61FB
2023-10-12T06:58:36.000Z,Marita Taavitsainen raivostui silmittömästi Petollisten kuvauksissa: Tätä mieltä kilpakumppanit ovat,Marita Taavitsaisen käytöstä ei tuomita enää Petollisten aamupalapöydässä.,https://img.ilcdn.fi/pA8N63faSUIzA_QgVuvsX7WS4Cs=/510x318/top/img-s3.ilcdn.fi/6d72f1dcf79393901a55c924412567e819ed862bb6cea65a45cebb91dcf4443d.jpg,F4A9DFF6CB0544679D96210B835679D4
2023-10-12T07:14:33.000Z,J-pussin pelastama ,Miia Tilli sairastui haavaiseen paksusuolentulehdukseen vähän ennen 30-vuotissyntymäpäiväänsä. ,https://img.ilcdn.fi/VtbZg77I58g05a8067NG7_qDL2c=/510x318/top/img-s3.ilcdn.fi/c0c16dd485c9b7945480ced7ef6076153339b634342f1842de5e7a9db93d3bea.jpg,82BC511AC53A4FE6871E7DEB2F6F9669
2023-10-12T07:14:40.000Z,Suomalaisten evakuointilento Israelista peruttu,Norwegianin oli määrä lennättää pohjoismaalaisia kotiin Tel Avivista jo keskiviikkona.,https://img.ilcdn.fi/as3wB_AwDLeF5RVaAJF5wGUXU-g=/510x318/top/img-s3.ilcdn.fi/491c5213eba5390d96db0aaf8c6f2ebdf32c2129ba01fd624609741a86500267.jpg,DBF1E9DAEA4D47E5839344E01865765E
2023-10-12T07:15:18.000Z,Sanni ja Arttu Wiskari The Voice of Finlandin uusiksi tähtivalmentajiksi!,Sanni ja Arttu Wiskari ovat The Voice of Finlandin uudet tähtivalmentajat. ,https://img.ilcdn.fi/qkRi7YsfxvLuEDjBZAz3jheeNfY=/510x318/top/img-s3.ilcdn.fi/9dae10d972e01697223d8498b73dc791fc95a822108d36dc6b8093217b2cbaa6.jpg,7033408DAA9B432C8C207A40939E430B
2023-10-12T07:22:07.000Z,Poliisi julkaisi kuvan: Tätä mysteerihenkilöä epäillään törkeistä rikoksista,Poliisi pyytää apua törkeistä rikoksista epäillyn tavoittamiseen.,https://img.ilcdn.fi/hToMB1OVVcdUZlNFSmD7oWGIdLI=/510x318/top/img-s3.ilcdn.fi/6d06809c57acaeafb306224c7a71940aa718c89313230dda82e0ab63ecfd4690.png,C79446BBEA95426C848AE07850B9DA25
2023-10-12T07:23:35.000Z,Entinen NFL-pelaaja pidätettiin: Epäillään äitinsä murhasta,San Diegon poliisi on pidättänyt Sergio Brownin epäiltynä henkirikoksesta. ,https://img.ilcdn.fi/QHT1GGxxZZ2YN8u-JcFRq0POcH4=/510x318/top/img-s3.ilcdn.fi/86e9f28149a45550d1a9c7da0f10c25ccee8de8571cc2715af019f44a90f8be7.jpg,1F8DB877D2494D85BE36F520855370F7
2023-10-12T07:44:58.000Z,Poliisi: Leppävirralla lopetettu kissa oli Ragamuffin-rotukissa – Tapaus syyteharkintaan,Poliisi on tutkinut lisäksi tapauksen Facebook-kirjoittelua kahtena kunnianloukkauksena.,https://img.ilcdn.fi/LbmnaFanmKbTRLN29vgQYIsnWIo=/510x318/top/img-s3.ilcdn.fi/91029cda30b6a20f13f5a7941a5fdee3868564f7cd6b0067d36ab2b38c821d86.jpg,3984FAA50E3B4F9CA874DDCD1FC5A507
2023-10-12T07:47:05.000Z,Majakkarannan puukottaja oli mukana Vallilan puukotuksessa – Nyt hovioikeus otti kantaa pojan ikään,Vallilan puukotuksen kolmannen osallisen ikää on puitu eri oikeusasteissa.,https://img.ilcdn.fi/RNh6UDrYo7CfDHfEvj-P7lDwTHs=/510x318/top/img-s3.ilcdn.fi/a19feccc81ba170c3fa430b00c1d0915453d18ff9c76474ba62540ea12eed669.jpg,F7847C5A9B2141928CB4CC2A6F380EA4
2023-10-12T07:59:36.000Z,”Ei millään muotoa tyylikäs lausunto” – Näin JYP reagoi Pojun törkykommenttiin,"Poju on pyytänyt JYPiltä anteeksi sanomisiaan. Seura ei ole vielä tehnyt päätöstä siitä, soitetaanko miehen musiikkia kotipeleissä.",https://img.ilcdn.fi/TWZQIQhGvR1Xs0q6dUJnq_9iHxs=/510x318/top/img-s3.ilcdn.fi/624fe8079c40e3550c0138f3700fa80b46c15ba047cf66da5b5e4b2541987de6.jpg,ED83E3CB5D344028AF0049BDDC89D552
2023-10-12T08:00:49.000Z,Uudet Frasier-jaksot tuottivat pettymyksen jo ennen julkaisuaan: ”Kaikki vaiva tämän takia?”,Frasierin uudet jaksot eivät vastanneet kriitikoiden odotuksia.,https://img.ilcdn.fi/ZR3XP2a6skvlLWe-AKH0JDv-JaA=/510x318/top/img-s3.ilcdn.fi/212e40ebabdee88324dd55ce03ac116aee70b9336c554f3559b64baa9cb53e6a.jpg,C062A26ACD9B43A19F47D1628B6825E7
2023-10-12T08:36:31.000Z,Suomi–Venäjä-seuran avustus lakkautetaan – Julma hyökkäyssota perusteena,Ystävyysseura on jo aiemmin joutunut irtisanomaan työntekijöitään.,https://img.ilcdn.fi/KSLec8ey5kOc15MBgv0ZNtzkgVw=/510x318/top/img-s3.ilcdn.fi/ebde4041afb83300f4e365a4c4c2bc8f8570ad9a2b9d66f10bb52045a4dd63d1.jpg,3B3DB6BDB3404D5797C1403B2B3ED747
2023-10-12T08:40:14.000Z,Tv-persoona Jimmy Savile raiskasi ja hyväksikäytti satoja lapsia – Nyt hänestä tehtiin draamasarja ,"Brittiläinen Jimmy Savile käytti hyväkseen satoja lapsia uransa aikana, käyttäen hyväkseen asemaansa erityisesti lasten- ja nuorten suosimien tv-ohjelmien kasvona. ",https://img.ilcdn.fi/Vf5OTDhVhGky2E5Zn96DiqIg8eY=/510x318/top/img-s3.ilcdn.fi/204133abfcf227892a0666fbb49474a35987e3cf79fc11766f4660249cfce633.jpg,55CE03780BF04D5D96F433EBFCBCD25A
2023-10-12T08:47:18.000Z,Juuso Pärssisellä mahtava kyykkytulos! ”Varsin riittävä”,Juuso Pärssinen paineli viime kaudella isoista ovista sisään NHL-piireihin.,https://img.ilcdn.fi/ymbH29p6lIwqBt-Tna5hokVsO-U=/510x318/top/img-s3.ilcdn.fi/b3212f764862b5a4d6762590c0d5555bacbf20372364e318fb833684c66acc05.jpg,12D43BA2C0F34120A7F93BF73BA48DA2
2023-10-12T08:47:51.000Z,1980-luvun hitti on taas täällä: ”On loistava ruoka”,Tämä pannulla kypsyvä broileri on todella mehevä. ,https://img.ilcdn.fi/k5pruuWfphdftWXHI7CYDk42pUw=/510x318/top/img-s3.ilcdn.fi/888c829a693c36f02c7b91451e6ae73a2d950e8540aa2ef2414ab99286403a88.jpg,07EFAABDC3C34198A85751E48A2F098E
2023-10-12T09:00:52.000Z,"Joku voitti 1,6 miljardia euroa lotossa USA:ssa",Voitokas kuponki ostettiin 2 500 asukkaan pikkukylässä.,https://img.ilcdn.fi/hcOvy_G6z9aqFLQEnhwnqpdwAz0=/510x318/top/img-s3.ilcdn.fi/b2860d7c77ae020d79b565f8d2fa10e44dbdba1d99040dced67fe567a9448187.jpg,ACD5096DAE434BD6BB67F85BB3CFF024
2023-10-12T09:06:20.000Z,Kaasuputken vaurioitumiseen kytketyn tankkerin omistajalla yhteyksiä Putinin lähipiiriin,Balticconnector-kaasuputken lähelle ankkuroituneen tankkerin omistavan yhtiön on väitetty olleen Putinin lähipiirin määräysvallassa. Venäjän vakoilualus kartoitti putken ympäristöä useaan otteeseen tänä vuonna.,https://img.ilcdn.fi/TTcCUB0-C2kWt4BaWJFQU57cehk=/510x318/top/img-s3.ilcdn.fi/400d519b6eaf5f44a0e48efc0bd155aaae698a296de89caa0e1839c33cbb130c.jpg,5752CF2F10D64728A437B7A817159278
