paivamaara,otsikko,tiivistelma,kuva
2020-02-26T20:14:59.000Z,"Kiekkojuniori Mattias, 18, näännytti itsensä melkein hengiltä – jakoi pysäyttävät kuvat 38-kiloisesta vartalostaan",Mattias Höglundin syömishäiriö alkoi valmentajan kommentista.,https://img.ilcdn.fi/38PujHoMGejf4MJIJTrTO4kfG4Q=/510x318/top/img-s3.ilcdn.fi/f1cf2dd8bd78de772a8cd99061d6c56adc9881e095917d5a17aa0f646c038e57.jpg
2020-02-26T20:24:15.000Z,Tässä on Pierce Brosnanin hylkäämä ja harvoin julkisuudessa nähty poika,Pierce Brosnanin 47-vuotiasta Christopher-poikaa ei ole juuri julkisuudessa nähty.,https://img.ilcdn.fi/DT2N7DiLSIsQpTvXWM3uWDnryps=/510x318/top/img-s3.ilcdn.fi/9ed17ec4ae69539b689d755acc80245f4cfbc614bf150d2be4ba05bc4558975d.jpg
2020-02-26T20:35:45.000Z,Italian-lento laskeutui Lappeenrannan kentälle: ”Matkustaja desinfioi aika huolella istuinta”,Bergamon lento laskeutui Lappeenrantaan keskiviikkoiltana.,https://img.ilcdn.fi/GGvgDn0f508i3dT8Uv83lOITgX8=/510x318/top/img-s3.ilcdn.fi/3ab362a93cc80abe89c7cf2d6ff70c1eeedace8788826c2098f0281225db7093.png
2020-02-26T20:36:06.000Z,Poliisi harjoittelee yöllä kauppakeskuksessa Espoossa,Harjoitus tapahtuu kauppakeskus Isossa Omenassa.,https://img.ilcdn.fi/aR0QuuGzOU-C4V94gL0FDA6R3GU=/510x318/top/img-s3.ilcdn.fi/9e0768c8e71012e58746045d26687f3af26106d48733c4570bc0e20870bb5e3e.jpeg
2020-02-26T20:42:06.000Z,Rangers jatkaa pystijahtia Euroopassa – huuhkajatähti Glen Kamara seurasi penkiltä voittoa,Glasgow Rangers eteni Eurooppa-liigan neljännesvälieriin.,https://img.ilcdn.fi/AB_q2Hda732p51McXzTQ6dz3Eiw=/510x318/top/img-s3.ilcdn.fi/2e80d171c50b5dc241aa43b206d12fd9c1844b5a3857ed35a037775d938bd026.jpg
2020-02-26T20:47:50.000Z,Lukko jyrää Liigan kuntopuntarin kärjessä: ”Raumalla on hieno olla”,Ilkka Heikkinen on tuonut Lukon peliin rauhallisuutta ja esimerkkiä.,https://img.ilcdn.fi/w4vRRGOchWkOMbVBGc5zlrEIWk0=/510x318/top/img-s3.ilcdn.fi/5aece0a2cb0e43a3f27f403a967c4b45c21cb47fac91753acbaaa31fcdb831ee.jpg
2020-02-26T20:49:59.000Z,"Syntyvyyden lasku on tasaantunut, kertoo tuore tilasto ","Syntyneiden määrä on ollut viime kuukausina pienessä nousussa, kertoo Tilastokeskuksen uusi tilasto. ",https://img.ilcdn.fi/IZFmmbg08OBU0oV3XTjeIsH9Kv0=/0x135:5412x3519/510x318/top/img-s3.ilcdn.fi/f838263deb722861899bf6efa7cb3918fcb25536d2affa0b13cf745db4e6cfeb.jpeg
2020-02-26T20:50:18.000Z,Peiteoperaatio teki suomalaisnuorista SS-miehiä itärintamalle,"Suomalaisvapaaehtoiset olivat osa Saksan suurhyökkäystä, Operaatio Barbarossaa. ",https://img.ilcdn.fi/dJQlXcjUEZBsqzaltLtAbuBNlRM=/0x188:3000x2063/510x318/top/img-s3.ilcdn.fi/6635c003d61d6eb3ab04e15e69b709c37bb91faf7530a44f72f7f2ed35387d3a.jpg
2020-02-26T20:50:39.000Z,Omakotitaloihin pääkaupunkiseudulla murtoja tehtailleet napattiin Puolassa – ”arvo-Porsche” saadaan palautettua pienelle omistajalleen,Suomessa tehdyistä omakotitalomurroista epäillyt miehet saatiin kiinni Puolan ja Ukrainan rajalta.,https://img.ilcdn.fi/mUx04tcXNC1nysVAaVFJSUDVI0s=/510x318/top/img-s3.ilcdn.fi/155ca82e1410c21b990cf11c1a757b186c878a7746bd9d049cfb8918cfe9ca84.jpg
2020-02-26T20:51:18.000Z,Eduskunnassa kiisteltiin oliko Suomen EU-puheenjohtajuuskausi eleetön vai elegantti: ”Yksikään ihminen ei ole saari”,Pääministeri Sanna Marin (sd) kehui Suomen EU-puheenjohtajakautta: ”Rahaa säästyi ja hiilijalanjälki pieneni”.,https://img.ilcdn.fi/qYurB6_Q3dXLwU2pWS3kSywaYPM=/0x128:6000x3880/510x318/top/img-s3.ilcdn.fi/e967739dfbeb4ada58e3d85d6377cf0e54e7178d3c377c1420ed62b9a0aaee34.jpeg
2020-02-26T21:00:44.000Z,Kahden miehen väitettiin kannustaneen väkivaltaan Soldiers of Odinia kohtaan – lähes kaikki syytteet kaatuivat oikeudessa,Oikeus hylkäsi syytteet väkivaltaisen mellakan johtamisesta.,https://img.ilcdn.fi/48kHZHfxBpqCiIrHBgIKmK8ZYdo=/510x318/top/img-s3.ilcdn.fi/4422f103cc4acbacf3f8701d7dce2567693e74928810ef46854eba5b2af13632.jpg
2020-02-26T21:01:02.000Z,Espoossa sähköt poikki sadoilta Carunan asiakkailta,Vian selvitys ja korjaus on käynnissä.,https://img.ilcdn.fi/-k6VXSZ4u5Tpe_Uzs5nVPbE6fN0=/510x318/top/img-s3.ilcdn.fi/7b360f58544156911f4979f1f48ac2be776d1bf3dd268e9c5e285d6c2055886f.jpg
2020-02-26T21:10:44.000Z,Formulakuski Hubertin kuolonkolarin siemenet kylvettiin minuutteja aiemmin – hiilikuituromun vaarallisuudesta jälleen karmea osoitus,Valitettavien tapahtumien sarja johti formulalupaus Anthoine Hubertin menehtymiseen viime syksynä Belgian Spassa.,https://img.ilcdn.fi/krM2gaMOxTAZvLb4rJA9vnM-T30=/510x318/top/img-s3.ilcdn.fi/baab4ca64110ffe139896c5756ed9b34ce53bcc3e834adc534ade4c53c7e86a6.jpg
2020-02-26T21:16:22.000Z,Sukulaistyttöään hyväksikäyttänyt kolmekymppinen mies sai viisi vuotta vankeutta  ,Pohjanmaan käräjäoikeus on tänään keskiviikkona tuominnut Keski-Pohjanmaalla asuvan 34-vuotiaan miehen viiden vuoden vankeusrangaistukseen.,https://img.ilcdn.fi/TgAbzxWBjID_wIfo6u4_7T6xZ2A=/510x318/top/img-s3.ilcdn.fi/51569d63ddc497a96f9cf5f11883075603f8e6c451f89e784784468a4738e204.jpg
2020-02-26T21:33:15.000Z,Manchester City nousi sillasta voittoon – Pep Guardiolan uhkapeli toi täydellisen tuloksen,Manchester City voitti Real Madridin 2–1 Mestarien liigan neljännesvälierän avausosassa. ,https://img.ilcdn.fi/cMkzSyLARjfinioyxKu84r-K3_Q=/510x318/top/img-s3.ilcdn.fi/4129b811c641e4bd8e2e983875eb9fb56664a3b66d6ce5fe8ad47f006baf9a9f.jpg
2020-02-26T21:35:06.000Z,Rajut kuvat: Juventuksen nuori tähti poistui kentältä pää veressä,Matthijs de Ligt poistui kentältä muutamaksi minuutiksi ja pääsi todistamaan samalla Lyonin 1–0-maalia.,https://img.ilcdn.fi/ExxAcmQDEL7sAJeLY-uUZWSf7Ps=/510x318/top/img-s3.ilcdn.fi/f6d5da1fba9a18dace27cbd287bedd97a555c4705a753d27ac774066171b3c6d.jpg
2020-02-26T21:38:57.000Z,Norjassa todettiin ensimmäinen koronavirustapaus – henkilöllä ei ollut viruksen oireita,Norjan kansanterveysinstituutin mukaan tartunnan saaneella henkilöllä ei ollut ulkoisia oireita.,https://img.ilcdn.fi/JPW_EGzRXNSFoFw92FM10IEAjJs=/510x318/top/img-s3.ilcdn.fi/cccec2c299b559d03be67d2a39b04b20b509968ab7e5058e785e39ff7793ae25.jpg
2020-02-26T21:51:49.000Z,John Lennonin lapsuuden maisema on nykyään avoinna yleisölle – punainen portti vetänyt turisteja puoleensa jo monta vuosikymmentä,Kulttuurikohde avautui yleisölle.,https://img.ilcdn.fi/fw4CDtydayQ8hOD8SkOP4N_3VOA=/510x318/top/img-s3.ilcdn.fi/4672299aa1ae29d78922686ef194c80c13f2af89cdf61129415781b4bd2b34ce.jpg
2020-02-26T22:34:04.000Z,Brasiliassa Latinalaisen Amerikan ensimmäinen koronavirustapaus – henkilö oli palannut Pohjois-Italiasta,Tartunnan saanut henkilö oli ollut Italian Lombardiassa. ,https://img.ilcdn.fi/2SY_0efCKSWXFqBT-M9h-nqcSU0=/510x318/top/img-s3.ilcdn.fi/d3d7e52d89fe69903a929bf7ddfde33004e9d4305eb304b9d1b0dd5c9399d3c6.jpg
2020-02-26T22:37:26.000Z,Leonardo DiCaprio auttoi eksynyttä turistia New Yorkissa - apua tarvitseva ei tunnistanut supertähdeksi,Leonardo DiCaprio auttoi hukassa ollutta miestä New Yorkissa.,https://img.ilcdn.fi/JUX3HslRIioIWWEe2XeTGRBwYCc=/510x318/top/img-s3.ilcdn.fi/126af7c94077e9ba865a2aebd9d2ed397bb7f22acb6d66a14e09fca99a960a4c.jpg
2020-02-26T23:29:53.000Z,Vakava kolaritilanne Posiolla – useita loukkaantuneita,Risteyskolarissa oli osallisena kolme henkilöautoa. ,https://img.ilcdn.fi/PgkyLdyT3z11_Ts6-J2aCax3X7c=/510x318/top/img-s3.ilcdn.fi/d40ba8c9fea465b638a28ab0c2412945ff5af5d9a3e2bd42b5aa2561d194686e.jpeg
2020-02-26T23:44:36.000Z,Horoskooppi 27.2.2020,NULL,NULL
2020-02-27T00:05:15.000Z,Trump maailmalla leviävästä koronaviruksesta: amerikkalaisten sairastumisriski on pieni,Trumpin mukaan amerikkalaisten massasairastuminen koronavirukseen on epätodennäköistä. ,https://img.ilcdn.fi/dUlakMTUw1fk_vY1Kddud-dNUA0=/510x318/top/img-s3.ilcdn.fi/893d7e00bc6813a4b10162e3a099c6ae966e51561ba58d57b17ff1eb51ff041a.jpg
2020-02-27T00:36:07.000Z,Jälleen uusi joukkoampuminen Yhdysvalloissa: ainakin 7 ihmistä kuollut,Ampumavälikohtaus tapahtui panimolla Wisconsinissa. ,https://img.ilcdn.fi/renSo79c_sEKzziMSDtRy5MIEqY=/510x318/top/img-s3.ilcdn.fi/c780ef0a297283108579db3c3986ef6efd4cc362b10a0c06b58e479b86fbe948.jpg
2020-02-27T02:57:42.000Z,Stripparin ahdistava esitys järkytti tamperelaisissa opiskelijabileissä,Tapahtumajärjestäjä on pahoitellut torstai-illan tapahtumia.,https://img.ilcdn.fi/fQkjFjGIa-yPbLUnwKdD0E47U-E=/510x318/top/img-s3.ilcdn.fi/84cec155498b31543ec336532877e117cb0c25c9436482c77feda671d8d7a673.jpg
2020-02-27T02:59:58.000Z,EK:n asiantuntijalääkärin koronaviesti työnantajille: Anna flunssaisen työntekijän olla omalla ilmoituksella 5 päivää kotona ,Suosituksen mukaan työpaikoilla pitäisi ottaa käyttöön tai pidentää sairauspoissaoloa omalla ilmoituksella.,https://img.ilcdn.fi/mDNUpFJqCEWiKVTFFGefoDqCu88=/510x318/top/img-s3.ilcdn.fi/14012cf469da86079ef44e37243de84f81f8677adb3080e61c8b7fbeaf831c28.jpg
2020-02-27T03:28:07.000Z,Tuukka Temonen hehkutti menestystään filmifestivaaleilla – asiantuntijoiden ihmetys heräsi: ”En ole koskaan tästä festivaalista kuullut”,"Tuukka Temonen palkittiin Monacossa Angel Film Awards – Monaco International Film Festival -nimisessä tapahtumassa, joka herättää paljon kysymyksiä.",https://img.ilcdn.fi/1X5BwzsQVAN8MS_GFoqCrEp9qCs=/510x318/top/img-s3.ilcdn.fi/50bb9712e9f451bbf38c928582a2bef9713d4d0045a96e0b8b0cc4d2de9678b5.png
2020-02-27T03:28:45.000Z,Kissoille kehitettiin oma musiikki – kuuntele erikoinen kappale,"Tutkijat ovat löytäneet musiikin, joka voi rauhoittaa kissaa esimerkiksi eläinlääkärikäynnin aikana.",https://img.ilcdn.fi/-36qcgX7sdLrtaE7X3qFs-ci5AM=/510x318/top/img-s3.ilcdn.fi/763cc7919242008e14669da015e0a17ffa852e82e8f9f1c06a85ceb6f8e24fa4.jpg
2020-02-27T03:55:00.000Z,Kuinka monesta sulasta sulkapallo yleensä aina valmistetaan?,Iltalehden perinteinen urheiluvisa on myös verkossa. Montako tiedät?,https://img.ilcdn.fi/FWt4-78Huj1SvHVOotOd_L5EGPg=/510x318/top/img-s3.ilcdn.fi/13215472a60f25c719e147e62ae2da584897165bce56290a90d7baa6e29d9c07.jpg
2020-02-27T04:02:54.000Z,"3 tapaa, joilla ikäihmisiä huijataan asuntokaupoissa - saatetaan uhata jopa hoidotta jättämisellä",Ikäihmisiä yritetään ajoittain huijata asuntokaupoissa. Kiinteistövälittäjät eivät näe ilmiötä kuitenkaan laajamittaisena.,https://img.ilcdn.fi/OQxvfNMyQOHtfy_zLbA0sQM6xxQ=/510x318/top/img-s3.ilcdn.fi/07c1448b5f74a343e7df6027b44816c64bdbd40c1438958de9818a6c410d426f.jpg
2020-02-27T04:13:05.000Z,Tänään on ideaali keli hiihtolomalaisille – aurinkoinen talvipäivä koko maahan,Lämpömittari on pakkasella monin paikoin. ,https://img.ilcdn.fi/fsb8XKKY_HbKqo_039OM0HuEJTs=/510x318/top/img-s3.ilcdn.fi/7add6179e990fda3cc6c7cc81262ef369d42179e55d5155dc620f1ef72fbd5d4.jpg
2020-02-27T04:22:19.000Z,Elina Gustafssonilla on uusioperhe: Emmi-rakkaalla kaksi lasta,Nyrkkeilijä Elina Gustafssonin ja Emmi Asikaisen perheeseen kuuluu kaksi poikaa.,https://img.ilcdn.fi/7enx2LHlRrCwb_UWHgGUx3nv9rU=/510x318/top/img-s3.ilcdn.fi/a175ace2c11afbb16c1ccb75b45459b317e94256743e67a9dfb133601aac1d60.jpg
2020-02-27T04:24:14.000Z,"Turhautunut Mika Häkkinen unohti kiinnittää ratin paikoilleen – hetken päästä valokuvaaja räpsi elämänsä skuupin, joka paljasti McLarenin nerokkaan keksinnön",F1-sarjan hovivalokuvaaja joutui mukautumaan paparazziksi tuhannen taalan paikan avautuessa. McLarenia se saattoi harmittaa.,https://img.ilcdn.fi/u6Ctoh4I9xC9ZreB1Q8fbffMto4=/510x318/top/img-s3.ilcdn.fi/18212d3f06a33980694995056d8639654b76cb78e4c1e0866f75bdc522255799.jpg
2020-02-27T04:27:38.000Z,Video voi järkyttää: Mies sytytti itsensä palamaan Ukrainan presidentin kanslian edessä – väkijoukko pelasti sankarillisesti,Mies yritti saada teollaan huomiota maankäyttöön liittyvään ongelmaansa.,https://img.ilcdn.fi/St1oEhJxM1kAj-Yz7a2IyucWa28=/510x318/top/img-s3.ilcdn.fi/2faca970ce6d89dd81944a3d48b60cfe6fc4f7ce145e935f1585218d0b420f8f.jpg
2020-02-27T04:34:59.000Z,"”Ennen hävettiin paljon enemmän” – lääkäri kertoo, miksi mielenterveyssaikku on yleistynyt",Mielenterveyssyistä johtuvat sairauslomat ovat lisääntyneet huimasti 20–49-vuotiailla viime vuosina. Mutta voivatko suomalaiset oikeasti psyykkisesti huonommin kuin ennen?,https://img.ilcdn.fi/5WYYwrzqXHOBNpynL6_wo1NtZkc=/510x318/top/img-s3.ilcdn.fi/818cb72c81a7cb4c5df92345731d92a58d4dfed8eb07f5dbe5738baa7f20ac16.jpg
2020-02-27T04:45:13.000Z,Naisten liigan nimi muuttuu Kansalliseksi Liigaksi – Palloliitto haluaa edistää tasa-arvoa: ”kyseessä on vahva kannanotto”,Naisten liigan uusi nimi on Kansallinen Liiga.,https://img.ilcdn.fi/_67mNPyQZpJjB3K-PnwshYulXN8=/510x318/top/img-s3.ilcdn.fi/9cd07fee1dfb54e55735cc9f064beed5525dc79e72f706cae6a7338cca4dbae2.jpg
2020-02-27T04:54:16.000Z,Kuuluisa tv-persoona kiistää yhä raiskauksen: Japanilaiselle naistoimittajalle korvauksia ,Shiori Itō tapasi synnyinmaassaan tunnetun Noriyuki Yamaguchin ravintolassa vuonna 2015. ,https://img.ilcdn.fi/Iq9tAULhZBfA34KFCyXMFgAnqe8=/510x318/top/img-s3.ilcdn.fi/34e35fb1633b88832857e5bb021377d384c3d01c966af995cd0e9611c806d616.jpg
2020-02-27T04:59:25.000Z,"Koronavirustapaus varmistui, Helsingillä pandemiasuunnitelma viruksen varalle:  ”Tiedot lähtökohtaisesti salaisia”","Apulaispormestari Sanna Vesikansa toteaa, että on tärkeää olla lietsomatta turhia pelkoja.",https://img.ilcdn.fi/4IWNIrHiNAiQH6oRJWaaXUnMOEE=/510x318/top/img-s3.ilcdn.fi/4495228ebba2a6d1d09150310d2252a19eaa5644cd35bd1fc812f44342c95285.jpg
2020-02-27T05:00:00.000Z,”Opel tarjonnut vuodesta toiseen parhaan hinta-laatusuhteen” – hinnat jopa laskeneet,Rakennusten automatisoituja sisäänkäyntiratkaisuja tarjoava Assa Abloy Entrance Systems Finland on luottanut Opelin pakettiautoihin jo kahdeksan vuoden ajan.,https://img.ilcdn.fi/h0PTeDVjEV8GVZ6iQ6lATiwcVHU=/510x318/top/img-s3.ilcdn.fi/1c957ab6e393de6a9cdd3b44efc6c9306f11332c75a7e9300cf021bf6dcc2f6e.jpeg
2020-02-27T05:15:26.000Z,Aiheuttaako koronavirus varotoimia? Kestävätkö ladut? Näin vastaa Salpausselän kisojen järjestäjä,Salpausselän kisat järjestetään Lahdessa perjantaista sunnuntaihin.,https://img.ilcdn.fi/aMxufBVC2W_aFJEHwp1OzE2GlHo=/510x318/top/img-s3.ilcdn.fi/6a1e2029e2b097533711d8e790e7677e96000e187934f7b1421c866f33483143.jpg
2020-02-27T05:36:30.000Z,Mihin katosi tangokuningas Amadeus Lundberg? Sairausloma jatkuu – myös maaliskuun konserteissa tuuraaja,Tangokuningas Amadeus Lundbergin sairausloma jatkuu helmikuulta maaliskuulle. ,https://img.ilcdn.fi/DyobfYF1EvytJ14acOISskZyy1c=/510x318/top/img-s3.ilcdn.fi/21ea88f82269d56b7a3b11882c7693b525623fec3b1039852f510f0d68447c51.jpg
2020-02-27T05:47:44.000Z,Uusi maailmanennätys! Jättiläismäinen voimamies meni crossfit-kisoihin ja piti ennätystä pilkkanaan – uskomaton parannus,Eddie Hall teki jälleen uuden maailmanennätyksen.,https://img.ilcdn.fi/PNN4zYLLxfTxbaHg2ODaubvwxwo=/510x318/top/img-s3.ilcdn.fi/26fe46792d733e8eb340a13433ce04d4aeffb96198ec6989bb7cba28d1bc7ee4.jpg
2020-02-27T05:51:17.000Z,Tallinnan rantaan nousee jättimäinen konferenssi- ja konserttikeskus – hintalappu 300 miljoonaa euroa,Yli 5 000 henkeä vetävän keskuksen kustannusarvio on 300 miljoonaa euroa.,https://img.ilcdn.fi/0-6miiVeXgmWzFQQKAguSl7qXHs=/510x318/top/img-s3.ilcdn.fi/ee31fa84da9dcfdf27709715748fbdddfedffe95d262d2aaa019b4d4422d588d.jpeg
2020-02-27T06:01:47.000Z,Ensimmäisellä suomalaisella koronavirus – Näin sairaaloita on käsketty varautumaan koronaviruspotilaisiin ,Euroopan tautiehkäisykeskuksen ohjeet ovat erittäin yksityiskohtaiset.,https://img.ilcdn.fi/ug6Rin4YIVqVfDGjCenpW9QzDAM=/510x318/top/img-s3.ilcdn.fi/1918d657f7758c1c77f0687bc6b5ad12e2af289d903815d92e6bc965144fda40.jpg
2020-02-27T06:05:53.000Z,Matkailijat vierailivat hylätyssä huvilassa Italiassa – kuvasivat paikalta mystistä materiaalia,Ryhmä kaupunkimatkailijoita matkusti Italiaan ja vieraili kaupungin hylätyssä huvilassa.,https://img.ilcdn.fi/vZx4cB9l13eTVzqezZ3CxacLYVc=/510x318/top/img-s3.ilcdn.fi/a933482843b4730da10511dbd89eb3ca75f82a100ecc2df82ec90dba33139fec.jpg
2020-02-27T06:21:52.000Z,Prinssi Harry ei halua enää olla prinssi Harry: Ihan Harry vaan,Prinssi Harry kertoi toiveensa Skotlannissa.,https://img.ilcdn.fi/0edI_Bj_Xhq1r8RGyt21QjKfhfg=/510x318/top/img-s3.ilcdn.fi/1632b1089f7a107361862df9ee74ad3a0931b224033f1c4b617149a73732a969.jpg
2020-02-27T06:22:11.000Z,"Italiasta tullut koronaviruspesäke, josta turistit levittävät tautia ympäri maailmaa, Tanskassa vahvistettiin ensimmäinen tapaus",Italiassa on jo ainakin 400 tartuntatapausta.,https://img.ilcdn.fi/hUKAMGl0lIznZ4r5UgxSZgE7m8I=/510x318/top/img-s3.ilcdn.fi/0217a136e1633c89d07390e490e6a297e1df006f644cc5193dc341fcad5be9ee.jpg
2020-02-27T06:27:41.000Z,Kuvat: Hölskyvistä irtosilmistä ”hillitsemättömiä naurunpurskahduksia” Järvenpään kirjastossa,Järvenpään kaupunginkirjasto julkaisi asiasta humoristisen mutta opettavaisen Facebook-päivityksen. ,https://img.ilcdn.fi/rPdu33_uA7TtNeegn0chPfTchMI=/510x318/top/img-s3.ilcdn.fi/0652b291bbb913fbe7d77ea8ca9a92f79d1e617006aa93522b2a6c7d1aecea4e.png
2020-02-27T06:33:53.000Z,Asiantuntijalta kova arvio – Therese Johaug hyötyy yhä dopingista,"– Hyödyt, jota kielletystä aineesta on saanut, jäävät urheilijan elimistöön ainakin osittain, sanoo Toni Roponen.",https://img.ilcdn.fi/BfKwaNmjJufPXKfR9EUJz0BzWng=/510x318/top/img-s3.ilcdn.fi/846a3c8fbe76bc1bf7932e6e2ed92c89cb94b0c0ab700a082c9eb2b3abd244b4.jpeg
2020-02-27T06:45:55.000Z,Nämä ovat arimmat ja rohkeimmat koirarodut - suomenlapinkoira loistaa listalla,Tuoreen suomalaistutkimuksen mukaan espanjanvesikoira on pelokkain koirarotu. Ihmisystävällisimpien listalla loistaa kotimainen rotu.,https://img.ilcdn.fi/EMYCYTYJoITXG6N3WGZ_CCv5XC4=/510x318/top/img-s3.ilcdn.fi/9c542c3ca227a6ae2770bb0a4140c93f7ae47f7096ba55db3c551d08c0957f6b.jpg
2020-02-27T06:53:01.000Z,"”On syljetty päin, lyöty, potkittu...” – Poliisit: Työturvallisuutemme on heikentynyt",Lähes 70 prosenttia poliiseista on kokenut väkivaltaa kenttätyössä.,https://img.ilcdn.fi/lkisbTa1cNjJTcBCCoSY4Frtl3A=/510x318/top/img-s3.ilcdn.fi/b49225550ea6e754ee52d357ffd0d2abfbd4b03112039ac21a8a9f85a66ac100.jpg
2020-02-27T07:05:32.000Z,Seksi ei maistu ja paino nousee - testosteronitason lasku aiheuttaa keski-ikäiselle miehelle monenlaisia vaivoja,"Kaikki eivät ole tietoisia siitä, että testosteronitaso laskee luonnostaan ikääntymisen myötä kaikilla miehillä.",https://img.ilcdn.fi/3y6uYHjZChQnc4QTEXjC4xoWo68=/510x318/top/img-s3.ilcdn.fi/7acbeb02e96484125ffbee1cab4981a80fb3148ac5fcc5edfac868b72e5200f4.jpg
2020-02-27T07:06:10.000Z,Sampo Kaulanen julkaisi hätkähdyttävän kuvaparin itsestään – viidessä vuodessa valtava muutos: ”Onpa eri mies”,Kyläkauppias Sampo Kaulanen julkaisi Instagramissa hätkähdyttävän kuvaparin.,https://img.ilcdn.fi/AatYUWj5u1ueEAZpKWzL_M1LjSQ=/510x318/top/img-s3.ilcdn.fi/425ef61708df88d842e9154522f8c807b586d3d7b1fe6915e561d739678b9798.jpg
2020-02-27T07:31:53.000Z,"Koronavirus jyllää – Heikki Kovalainen epätietoinen kaudestaan: ”Voi olla, että tämä vaikuttaa meidän kalenteriin”",Heikki Kovalaisen pitäisi aloittaa kuudes kausi Japanin Super GT -sarjassa muutaman viikon päästä. Koronavirus saattaa kuitenkin sekoittaa asioita.,https://img.ilcdn.fi/64eecQByAXhmh-BoNuRqgx2iPH0=/510x318/top/img-s3.ilcdn.fi/4300413ec043523f45349550b96ef5ea3a9c2d27f23c415315129168ab59c755.jpg
2020-02-27T07:45:26.000Z,Nikke Ankara saapui käräjille lähes tunnistamattomana – artistia syytetään seksuaalirikoksesta: ”Hämmentynyt fiilis”,Rap-artisti Nikke Ankaran seksuaalirikossyytettä käsiteltiin torstaina 27. helmikuuta Helsingin käräjäoikeudessa.,https://img.ilcdn.fi/06dEufMMJ0siFq9H0Dkz7sv8s_g=/510x318/top/img-s3.ilcdn.fi/92f781b21356f9029a2c68ceaf7b710ef7966f1d044700ac9fe49dd972963d73.jpg
2020-02-27T07:52:01.000Z,"Natsi! Suvakkihuora! Rasisti! Laura ja Li, mitä sitten kun kaikki kortit on käytetty?","Kun Laura Huhtasaari tai ministerin erityisavustaja leimaavat kaikki eri mieltä olevat kommunisteiksi tai fasisteiksi, he rakentavat viholliskuvia, Iltalehden kolumnisti Sanna Ukkola kirjoittaa.",https://img.ilcdn.fi/dAk7CpgbXmstGC19T8Vbb6bQZeQ=/510x318/top/img-s3.ilcdn.fi/b4a2fc193adb3ab9acd349555bb6e5918f2dfe5026cb27e803b00ff4a0ab62dd.jpg
2020-02-27T08:05:39.000Z,Töissä vain päivän - sai lopulta 17 000 euroa,Työntekijän ja työnantajan riitaa puitiin oikeudessa.,https://img.ilcdn.fi/E7oiiTtuXOoVdwB1SiERbsCuCwE=/510x318/top/img-s3.ilcdn.fi/c401d2bd4d8a602b9d8a6b2e339f079f816f0e46650d217ebc87f1e88d6083b3.png
2020-02-27T08:05:49.000Z,Poliisi epäilee: kaksi alaikäistä poikaa yritti tappaa kolmannen Helsingissä,Uhri sai vakavat vammat.,https://img.ilcdn.fi/7ui7Ve0zZxoXls-tpWBqCg1mRds=/510x318/top/img-s3.ilcdn.fi/3059af10340fb4a06672b61353879a7e525a610da353830108afe9ed2339dd5f.jpg
2020-02-27T08:07:06.000Z,Jo kertaalleen parantunut nainen sairastui uudelleen koronavirukseen Japanissa - tauti voi olla kaksivaiheinen,Nainen sai taudin kiinalaisilta turisteilta.,https://img.ilcdn.fi/4tjjdHvAVmwlvC3VTuG9uHYTc4g=/510x318/top/img-s3.ilcdn.fi/1d4d52ec836105eda36ce3f6b6a582d5565e722c5f20b4c4c66d1fd4034fd7a5.jpg
2020-02-27T08:22:57.000Z,Verkkokauppa.comin nimissä leviää huijauspäivitys – jopa tuhannet suomalaiset menneet halpaan,Facebookissa leviää Verkkokauppa.comiksi tekeytyneen sivun huijauspäivitys.,https://img.ilcdn.fi/j43o_iYa8Co-LkEAtdcEIuAIiK4=/510x318/top/img-s3.ilcdn.fi/a8f8cd3eee62ff3aa9f21c0238ea593e3ff311d58b06324abaab34072cb115e5.jpg
2020-02-27T08:23:00.000Z,”Hullu” suomalaismies Juha hurmaa Italiassa – jalkapallon suurseura teki komean esittelyvideon,Suomalainen Juha on harvinaisen innokas AS Roman kannattaja.,https://img.ilcdn.fi/QfZudht4PEr66PXiXJuCJ07jw-A=/510x318/top/img-s3.ilcdn.fi/6c0c4b1dce910c7a7f0be216e35f6386bb84b3d4a00d2d33dc89699d9713d33c.jpg
2020-02-27T08:36:01.000Z,Täydellinen farkkuasu ja muut ideat muodin eturivistä – näitä on kokeiltava!,"Zoe Kravitz näyttäytyi Pariisin muotiviikolla farkkuasussa, joka kiteyttää rennon biletyylin olemuksen. ",https://img.ilcdn.fi/5jbayVXDWmeAW7dXOqPXDNmmAcU=/510x318/top/img-s3.ilcdn.fi/13afdfa865074b8c202c4fc6b0a7ab16b6ad2934a124315bd03d88217f1b0301.jpg
2020-02-27T08:38:08.000Z,Koomikko teki 10 videota Tempurista – hävisi vedon ja joutui tiskaamaan,Unet Tempur-vuoteessa ovat saaneet stand up -koomikko Matti Patrosen luovuuden kukkimaan.,https://img.ilcdn.fi/KPBv1E-oWGcOFjzCgo48UkdMhEM=/510x318/top/img-s3.ilcdn.fi/9dfc3651f1f7264514dca67222a3eb953974bf3db7cd7d5085982991224fff5b.jpg
2020-02-27T08:43:41.000Z,Suomalaisnuorten trendinuuska ”denssi” ei kelpaa ruotsalaisille – päihdejärjestö syyttää petollisesta markkinoinnista,Päihdetyöntekijän mielestä denssipurkki on petollisen nerokas: Nuoret mainostavat tarroilla tuotetta toinen toiselleen.,https://img.ilcdn.fi/T91IE3rj4RbFDigykqio-dZm1uo=/510x318/top/img-s3.ilcdn.fi/6339794fdaecd058109a9f5cacc7f30c8c3fb713ba580c00a7a9698002c9b800.jpeg
2020-02-27T08:44:58.000Z,Onnistuuko sinulta? Somen munahaaste loksauttaa suut auki,Vaikka kuinka puristaa on kananmunaa vaikea saada käsivoimilla rikki. ,https://img.ilcdn.fi/oOekKdHPzFAQ40-AwAn87q_jOuA=/510x318/top/img-s3.ilcdn.fi/9625e8328cdacc4fd2717a31425d9bcfcf53b1a0e67819bbbee4c25cd4d51a8d.jpg
2020-02-27T08:51:00.000Z,Mikko Leppilampi ja Jaana Pelkonen nostalgisessa Euroviisu-kuvassa: ”Olimme niin nuoria ja ruskettuneita” ,Juontaja Mikko Leppilampi ja hänen kollegansa Jaana Pelkonen juonsivat Euroviisut vuonna 2007. ,https://img.ilcdn.fi/_-DyAdWj7zGtyONpCI80k2DRUdU=/510x318/top/img-s3.ilcdn.fi/261a860c63156e52244e56104159d74e9ad64f64c817921754e1a8e8a9ea201b.jpg
2020-02-27T08:51:35.000Z,"Heli Rantanen on huolissaan yleisurheilun tilasta Suomessa – ”Tuntuu, ettei tulla yhtään vastaan”",Heli Rantanen arvioi suomalaisen yleisurheilun ongelmia.,https://img.ilcdn.fi/n5Wx-dBIq2qdPFVYMFiUwhpFFEA=/0x64:3000x1940/510x318/top/img-s3.ilcdn.fi/8623091c151315cca396ceefc332da8e841de787bbacad5668921b493978abbb.jpg
2020-02-27T09:05:16.000Z,Herkät kuvat kertovat urheilijaparin onnesta – Tiffany-rakas saapui varikolle kannustamaan Valtteri Bottasta,Torstai on F1-talvitestikauden toiseksi viimeinen ajopäivä.,https://img.ilcdn.fi/m5zwdS_Kpe2UeHlK3TQQF-iWEkk=/510x318/top/img-s3.ilcdn.fi/931e201e6fbbc547c75ef9f988ff8041f800a646063e14091a8734ea0bf31716.jpg
2020-02-27T09:17:22.000Z,Tytär ei päässyt lennolle passin voimassaoloajan takia - isä jätti kentälle ja lähti itse lomalle,Kuinka sinä olisi toiminut tässä ongelmallisessa tilanteessa? ,https://img.ilcdn.fi/m3l3wShgeeOIZPXUNotSrfWjn7U=/510x318/top/img-s3.ilcdn.fi/a021968966de54b93819cbb51e377739d8c6ae105138eb6fb17c01c550fb14c9.jpg
2020-02-27T09:31:44.000Z,Antti Tuisku täyttää 36 vuotta – julkaisi syntymäpäivänsä kunniaksi suloisen lapsuuskuvan,Laulaja Antti Tuisku julkaisi syntymäpäivänsä kunniaksi lapsuudenkuvansa Instagramissa.,https://img.ilcdn.fi/k-ldxrqZ662C4SU37uJsCZC92ek=/510x318/top/img-s3.ilcdn.fi/31ef0b2c86c27e320aeefadcb0c76dee85c7282173e74ec703cdfc950327ccc0.jpg
2020-02-27T09:40:44.000Z,"Supertärkeä E-vitamiini suojaa kehoa – tiedätkö, mistä sitä saa? Testi paljastaa, mitä tiedät vitamiineista",Testaa tietosi vitamiineista!,https://img.ilcdn.fi/ArJ0PKAS4_30_t8kWsdXzN3G2uM=/510x318/top/img-s3.ilcdn.fi/789f5cce086950ca2ff034816d589a514d468a06787b8d077450c40bb43b43e3.jpg
2020-02-27T09:44:08.000Z,Kotietu ja -yleisö vaikuttavat myös tuomareihin – SM-liigassa vierasjoukkueet ovat istuneet jäähyllä satoja minuutteja enemmän,Kotiyleisöllä on luultua suurempi vaikutus kotiedun syntymiseen. Näin ainakin antavat tilastot ymmärtää.,https://img.ilcdn.fi/1LkbfYTRI64TfUXea9j0DtCYJ_I=/510x318/top/img-s3.ilcdn.fi/ef87ac3186875954721863086d99244d0c57c67d970aaa1b1d2fc768ba4bed1c.jpg
