paivamaara,otsikko,tiivistelma,kuva,id
2025-07-27T06:15:44.000Z,Aki Manninen tiukkana saarellaan: ”En aio tehdä asian eteen mitään”,Aki Mannisen mukaan kotisaaren kasvillisuus on luonnonvaraisessa tilassa ja tulee olemaan jatkossakin. Puoliso Rita Niemi-Manninen paljastaa parin suunnitelmat kotipihan suhteen.,https://img.ilcdn.fi/kcW4RUHUpxVJlFLbi5CXFBX--Jg=/510x318/top/img-s3.ilcdn.fi/db412d6ca91ec68dec0b010839899361deb831e6208667c889cce3ab6f578888.jpg,089E6573049F4388BF1BCCB89649A53C
2025-07-27T06:21:17.000Z,Senegalilaishyökkääjä meni Suomessa saunaan ja ryntäsi heti ulos – ”Mitä ihmettä te teette?”,Maissa Fall on pelannut Suomessa aiemmin Hakassa ja nyt VPS:ssä. Iltalehti esitti senegalilaiselle 10 kysymystä Suomesta,https://img.ilcdn.fi/fUTK8peSDH4BefosoaPsP0b4vOU=/510x318/top/img-s3.ilcdn.fi/743b4a7daca4a7cdd25f33f67bb5d7f8bc13806da0c770b8ae4fecfd882ec000.jpg,F9BA94686423463D980506B897293E78
2025-07-27T06:31:36.000Z,"Moni tekee näin, vaikka ei pitäisi – Puhelin voi mennä rikki","Puhelimen kastuminen yritetään usein korjata jopa haitallisilla kotikonsteilla. Lähitapiola kertoo, miten veteen pudonneen puhelimen voi pelastaa.",https://img.ilcdn.fi/wj5ADmfMDIymR-bMtLpHwIREAPI=/510x318/top/img-s3.ilcdn.fi/6c9c8ef4942f8b3bea56ae405118cc8bec7de84eb3be0108baf54122b5dedf06.jpg,5CD12A02D568470A96B7613090DA9939
2025-07-27T06:57:35.000Z,"Jukka näki, kun etsijät löysivät kolmannen hukkuneen pojan Kalajoella: ”Kyllä siinä vähän tippaa ilmestyi silmäkulmaan”",Kolmas Kalajoella kadonnut poika löytyi hukkuneena myöhään lauantai-iltana. Tilannetta sivusta todistanut Jukka kertoo löytöhetkestä Iltalehdelle.,https://img.ilcdn.fi/xEBsexkhE3BxAj3p_gJ4xvjDyYg=/510x318/top/img-s3.ilcdn.fi/92efb63b4acfc124392db8941a30aca4588faceb938f95ccbccb90e11cccb4d9.png,DA545C87C90147E890FC887559B7214E
2025-07-27T07:00:58.000Z,”Viinalla saapi päänsä sekaisin”,"Ilosaarirockissa tapahtuu asioita, jotka päätyvät vain harvojen silmille. Kävimme paikassa, jossa nukkumapaikat on jouduttu suojaamaan eritteiltä.",https://img.ilcdn.fi/R9gh7OPmrJ-A8pm3SwXtHAFZLZo=/510x318/top/img-s3.ilcdn.fi/ac068117f26c5f15ddae4c76666313da3ead5b7f422cd321e56ee8f28290dc2f.png,6577C72095BE4D9AACA25329B546974B
2025-07-27T07:02:02.000Z,12-vuotias ihmelapsi meni MM-kisoissa jatkoon,Kiinalainen ihmelapsi Yu Zidi debytoi aikuisten MM-tasolla ja eteni jatkoon. 12-vuotiaan tulokset ovat huimia.,https://img.ilcdn.fi/usZGVcQMXJw50nd6WiMVh4W9JHM=/510x318/top/img-s3.ilcdn.fi/4e0907f9bdc0e963ef8390e8931fd47bee1f4bd0609edd3ce5597fecf69fb802.jpg,3202D08656DE4377A020CBD24981F10A
2025-07-27T07:02:39.000Z,Essi Unkuri ja Viljami Harjuniemi suuntasivat häämatkalle – Tämä on kohde,Unkuri ja Harjuniemi juhlivat kolmepäiväisiä häitään viime viikolla.,https://img.ilcdn.fi/cMAwiL4_JXcvn54CIKQvzOwCdXo=/510x318/top/img-s3.ilcdn.fi/a9bf9d68a29cc8cec77a578d2465be4a630c54d25587babfc301e126dfa9c431.jpg,0ED96F6993954A66BF34FCE5F16471CE
2025-07-27T07:16:57.000Z,Kammokisa Spassa – Ei yhtään kisakierrosta,F3-sarjan Belgian pääkisa yritettiin vetää läpi kaatosateessa. ,https://img.ilcdn.fi/YEywRj0lRvXrJxqHKeOrnizEc6Y=/510x318/top/img-s3.ilcdn.fi/86b4b7fa9b18a6ddc34552ae49af17a7dfbd6aa1f98a10f3309c83cfdb5cf5d7.jpg,9C274B572083492BAD8FEB7EDD5901D6
2025-07-27T07:40:30.000Z,”Nauramme Suomen helteistä valittaville” – Tältä tuntuu asua oikeasti tukalassa paikassa,"Viisi Kreikan hirmuhelteissä asuvaa suomalaista kertoo, mitä he ikävöivät Suomesta.",https://img.ilcdn.fi/l0mAJCKVxa2peH8fm4j5Nxp5KVQ=/510x318/top/img-s3.ilcdn.fi/6e57d176cb3fd50a8a25e670e78ac2a511e7a95e0338b150efb10966ef7da9fc.jpg,4B87AD46FC9A4B868184FD28199B745A
2025-07-27T07:49:38.000Z,Mies heräsi Kotkan Meripäivien jäljiltä – Sai tietää olevansa 58 miljoonaa rikkaampi,Lähes 60 miljoonaa euroa voittanut kotkalaismies kertoo Veikkauksen haastattelussa kuulumisiaan.,https://img.ilcdn.fi/u3qeKXZnqcTn3xLaPHjhfqwpZ4w=/510x318/top/img-s3.ilcdn.fi/d835dce08bf0b0000973484b3f0bea0254a31c82d204ea0569721084672a116e.jpg,9297418507DC4578BFD07EC822C5003D
2025-07-27T07:58:19.000Z,TIS-pari Joanna ja Nero: Häät,Joanna ja Nero tapasivat toisensa Temptation Island -ohjelman 11. kaudella.,https://img.ilcdn.fi/sveQDrQ8oAJOQvXAykvDtsBv-FY=/510x318/top/img-s3.ilcdn.fi/e2d352024cf942ee22c11d77a66a6d30ffe483b553538119d4076db74faa1a7c.jpg,E6483FD5795B49E1BFAC2B8934A0FAED
2025-07-27T08:02:03.000Z,Koululaisten päähuivit kuumentavat tunteita,"Sivistysvaliokunnan varapuheenjohtaja Ari Koponen (ps) vaatii puuttumaan koululaisten huivien käyttöön ennen kuin siitä tulee laajempi ongelma, mutta opetusministeri Anders Adlercreutz (r) pitää asiaa marginaalisena. ",https://img.ilcdn.fi/1k1CdL7Ix2JpJkYmF3_xGhXCG6g=/510x318/top/img-s3.ilcdn.fi/a7f5914c7dbeaa83b8209810b090dd4f5ead05577ba13f3a1351753bfd49e4f2.jpg,523859982B174EAD92C0F7254C140211
2025-07-27T08:04:04.000Z,Marjastaja kuoli Karstulassa,Iäkäs mies oli lähtenyt lauantaiaamuna marjastamaan Karstulassa.,https://img.ilcdn.fi/t513M2tLX9oRotF7ATs6InOKZ54=/510x318/top/img-s3.ilcdn.fi/13d8eb9958acb765ed9caea64670c6169fc4f8f1cae2d955e2775edc321087a2.jpg,517EBEEFE5C04158ADDFEB012A24CD8D
2025-07-27T08:07:11.000Z,Supertähti sai vakavan diagnoosin ennen h-hetkeä – Julkaisi kuvan sairaalasta,Supertähti Aitana Bonmatí nousi kuin ihmeen kaupalla sairaalavuoteesta Espanjan sankariksi.,https://img.ilcdn.fi/XYCxsQHmrP8bRmX8tO7CuOe6kJY=/510x318/top/img-s3.ilcdn.fi/3b7ad40060b533fbae7e7dac3f5b57115dfc9ddcc8ffdcab356ba9e3d4bc1b23.jpg,94CC6F97D9FD4BCA9C83EFA9C900CAB0
2025-07-27T08:09:55.000Z,"Trumpille tyly vastaanotto Skotlannissa – ""Tuomittu rikollinen saapuu""",Vierailusta koituu skotlantilaisille veronmaksajille miljoonien eurojen lasku.,https://img.ilcdn.fi/prA0TYAJqPWhjdIv03lZhjd9siY=/510x318/top/img-s3.ilcdn.fi/b4caf7940cc90f49a8962b25c1c09854f15a81e2e9a88eb8d4eb8501164f1d2b.jpg,B47797B7573F42D0A77B84E7FECBDA61
2025-07-27T08:20:28.000Z,"Mersukuski avasi ikkunan ja teki jotain, mikä hakee typeryydessään vertaistaan – Poliisikin kiinnostui",Ohikulkijan mukaan henkilö heitti palavaa paperia puun juurelle ja poistui paikalta kaahaten. Alueella on metsäpalovaroitus.,https://img.ilcdn.fi/yF2CD4WkejBot9fFemUfC42xC-4=/510x318/top/img-s3.ilcdn.fi/2b59d39e2e2fa2c8700aebc5c851a511a64b5e55a8ae13c7b26928451de8f6f7.jpg,86C8D090BA50492F9D13D39598582AAA
2025-07-27T08:27:24.000Z,Mersun ensimmäinen sähköfarmari latoo pöytään hurjia lukuja – Ja ne ovat niitä tärkeitä ,Kulutuslukemat ovat pieniä ja lataaminen nopeaa. ,https://img.ilcdn.fi/9t9nixWGUvxuUBFx7OC_jRFuu_Y=/510x318/top/img-s3.ilcdn.fi/a5c03e6715de849ac41ac60e27dbd6ab6ceac60055cc339db54c0453d9db2c44.jpg,02A1E1DDBFA14C048D8DB7C1F3AD15F9
2025-07-27T08:28:11.000Z,"Testaa, tunnetko merkkihenkilöiden kuolemattomat sitaatit – Vain sivistynein nappaa 12/12 ","Vastaa 12 kysymykseen ja selvitä, tunnistatko kuuluisat sitaatit.",https://img.ilcdn.fi/awcA7KR13yoNNS83EBcoZIM6-vk=/510x318/top/img-s3.ilcdn.fi/fbddb884c14b7957f404727aabd70170ec03b3a327fcc347320631bfa894ef8c.jpg,DF6418684BE8482FB4A4182DFA7AA406
2025-07-27T08:33:55.000Z,Kirkkoherra lausui vaimolleen pahaenteiset sanat – Pari tuntia myöhemmin kolme poikaa kuoli Kalajoella,"Kalajoen kirkkoherra Kari Lauri oli itse uimassa meressä vain muutama tunti ennen järkyttävää tapausta, jossa kolme poikaa hukkui. ",https://img.ilcdn.fi/Kjz7-K_Gvw5oAXDivxOw4-B4vfE=/510x318/top/img-s3.ilcdn.fi/69cfe1be30876db7965b073658e5af31a3e57fef7f82e869eab706a69606f3fb.jpg,CB824D2E3A234057A75D5FD9D0742E69
2025-07-27T08:44:15.000Z,Venäjä avasi uusvanhan lentoreitin – Kohdemaa ei totisesti yllätä,Maiden pääkaupunkien välillä on ollut suora lentoyhteys viimeksi 90-luvun puolivälissä. ,https://img.ilcdn.fi/-LHef9vnAumfsl5c_TJggAXmXoE=/510x318/top/img-s3.ilcdn.fi/850786eb59aeed1543ab1f41919ba41662a1e29ba113fa7e1f118a7077584d9e.jpg,56130517BC2A4CEDA80F14220F2BB7AE
2025-07-27T08:54:57.000Z,"Sohvaperunat-Katjan elämä romahti vuosi sitten: ""Olin vain ratas oravanpyörässä""","Tv:stä tuttu Katja Rämö uupui, sai ADHD-diagnoosin ja kuntoutui yhdeksän kuukauden sairausloman jälkeen.",https://img.ilcdn.fi/TXMWhuUDcRFf3xJugxMTKeRR7X0=/510x318/top/img-s3.ilcdn.fi/4cc769fd6875de82e3ab4567f8b013e7792636f0e03e8fe7434cde0dc5e81934.jpg,102D74838A4D488C97F5F46625247F16
2025-07-27T08:58:53.000Z,Selvä suosikki EM-kultaan – Helmarien päävalmentajalta tyly arvio,Englanti ja Espanja ratkaisevat naisten jalkapallon Euroopan mestaruuden. Ottelu alkaa kello 19.00.,https://img.ilcdn.fi/KWJ63MnHoMWVIZ8utyGLLxoX4FM=/510x318/top/img-s3.ilcdn.fi/63681c92ff452c67661a22a689dfdcc23d595890cdaf50ff633ec2bc9e7f5c15.jpg,D47629A3ECC7421AAAB326F2793D6F97
2025-07-27T09:02:56.000Z,Fazerin uusi suklaatehdas saa terveysvalistajalta täystyrmäyksen: ”Ihmisten terveys pitäisi panna rahan edelle”,Pitkän linjan terveysvalistajan Pekka Puskan mukaan lihavuus on noussut ylivoimaisesti suurimmaksi ongelmaksi Suomen kansanterveydelle ja on suuri rasite myös kansantaloudelle. ,https://img.ilcdn.fi/eCDSDoE86mrTlKuWnZ0UEMHcGJ8=/0x0:3000x1874/510x318/top/img-s3.ilcdn.fi/26f3fff8a43e48140e88405be603ba7a3d385cb918aa8fd021d3cf69957daebc.jpg,EDA2686DE0554CCCB2A954F397F107D4
2025-07-27T09:14:36.000Z,Ilona Monoselle kultaa!,Ilona Mononen voitti sunnuntaina Saksassa universiadikultaa.,https://img.ilcdn.fi/VAZsX6bTsmbdEBDtc8DgubVoXGU=/510x318/top/img-s3.ilcdn.fi/aa1f5a9c1d4968c223699c4d6009ce870fcbde4f5912b781ca7497ade4dd4fc9.jpg,7889CEE88E63487CBBBD4156FB3DF852
2025-07-27T09:23:25.000Z,Karu totuus paljastui ravintolasta Lapin syrjäseuduilla – Pahempaa oli luvassa,Iäkkäästä ravintolarakennuksesta paljastui uusille omistajille ikäviä yllätyksiä.,https://img.ilcdn.fi/tAh-YKBujyWUnfVRxPaunh368Lc=/510x318/top/img-s3.ilcdn.fi/cbae65de3b745a74d654fbcb5ebe08c9b0142a6d47eac4f03c1432a2ee782fc4.jpg,4BEDA56482CE4AA4BE396357E2E69D3E
2025-07-27T09:30:42.000Z,Luvaton hautausmaa paljastui Humppilasta,"Hautausmaan perusti uskonnollinen yhteisö, joka lakkasi toimimasta jo 1930-luvulla. Aluehallintovirastolla ei ole tietoa hautausmaan nykyisestä ylläpitäjästä.",https://img.ilcdn.fi/Vv6QZuCaKaLjffVMsyCy3zzvalg=/0x637:1536x1597/510x318/top/img-s3.ilcdn.fi/7278b8067fb6c2dba7fb91d62473d0b9b50bc11d87ed43ac0dfba771b7fb9716.jpg,5891AA5B0BB74A60971E025295312110
2025-07-27T09:36:00.000Z,"Kun Ilona-possu murjotti pieleen mennyttä kylpyä, hyvä ystävä Severi-hevonen tuli lohduttamaan – Syntyi somehitti",Ilmeisesti kylpy oli mennyt pieleen tai sitten pitkäksi.,https://img.ilcdn.fi/dH-aN541pfvrQw7Y_Peegj-LmkI=/510x318/top/img-s3.ilcdn.fi/f3301a648e1c72d67f01ef547ceb44a1f81437c80dffb444335b71c38b95a5f7.jpg,CDA3DEF3AE9D4E55B9D7B6DEA962A2EB
2025-07-27T09:45:30.000Z,Tämän kesän ruokahitti on tässä – Testaa,Tänä kesänä pakastimeen päätyy muutakin kuin jäätelöä. ,https://img.ilcdn.fi/fgGaS485DVjSIACCsQUwlp9Ypvs=/510x318/top/img-s3.ilcdn.fi/cbc014806600bc84ee69a66979c06089dd9cca8913bb2fe3193f975c62622bc1.jpg,1741FFCEAFF7457093C2520FA1A8E245
2025-07-27T10:02:17.000Z,ES: Kannattajat hyökkäsivät katsomoon Lappeenrannassa – Rikosilmoitus kirjattu,"Kakkosen ottelu päättyi kahakkaan, uutisoi Etelä-Saimaa.",https://img.ilcdn.fi/ipFKHnr7RcDB-aKkjN59LgiEcAg=/510x318/top/img-s3.ilcdn.fi/6402cf59d195f9acca12d3151be06059faf85557408d8336c20e9dbee14b087b.jpg,277E5E3958EA40289C3D86F0963BC572
2025-07-27T10:04:32.000Z,Ensi viikko käynnistyy rytinällä,Helteet tuovat mukanaan ukkosia. Huomenna salamoi etenkin Pohjois-Suomessa.,https://img.ilcdn.fi/1oTvB1RAw10lvudqb6XEDsU-URI=/510x318/top/img-s3.ilcdn.fi/ebcf48380ce4ee7971e282d9a82e2377887a285535d4fddb62cb601b7ea99824.jpg,93CB5238A1B34BAEBE05D4DDD01673EF
2025-07-27T10:15:19.000Z,HS: Jouko oli aloittamassa seksiaktia livelähetyksessä – Poliisi antoi varoituksen,Jouko Kärkkäinen on tunnettu ”rappiostriimaaja”. ,https://img.ilcdn.fi/1HHxNll_z-ls6CJR7Q_PNrXXeXE=/510x318/top/img-s3.ilcdn.fi/886f088ae70dc1935afcd6ce0c7ad3f9656dd632beb3cb75fe5afc0a5b98c3cc.jpg,F86C7DB24A0741DB9FD67E77947E8916
2025-07-27T10:17:48.000Z,Miten tämä hinta voi olla mahdollinen?,Tavaran tilaaminen Temusta on herättänyt runsaasti keskustelua julkisuudessa. Bitin toimitus tilasi läjän käsittämättömän halpaa pienelektroniikkaa ja yllättyi jo shoppailukokemuksen aikana. ,https://img.ilcdn.fi/zlg4Yt04l-bgYoUlEPiHAUUWrM8=/510x318/top/img-s3.ilcdn.fi/0e4c942d1a5dd3f529c6b4d2b92382e36306f311ea73aedfc50bf5281c43cb1d.jpg,D19049461E554A6781FA945536208F98
2025-07-27T10:20:05.000Z,Suomen ennätys rikki Ruotsissa,Mico Lampinen heitti Ruotsissa uuden Suomen ennätyksen.,https://img.ilcdn.fi/esC7Xqpqh4XB9kiE8NcPpOxT1Is=/510x318/top/img-s3.ilcdn.fi/57779bdb6a0e2e241f29eb7e9532cc80c0d5f9ba98e186f0fee18fe78cb3253a.jpg,1A83CD201FE34F41B5D235A44866BEA2
2025-07-27T10:25:19.000Z,Aalto-Setälä ehdottaa: Pelastusliivipakko,Kokoomuksen kansanedustaja Pauli Aalto-Setälä ehdottaa pelastusliivien käyttöpakon laajentamista ja painottaa peruskoulun uimaopetuksen tärkeyttä.,https://img.ilcdn.fi/aJ_hJhQ7wdjQvAYjls7LkRWdjfU=/510x318/top/img-s3.ilcdn.fi/8b0cacbde9d69a858de56773e1efdd53a031f4a46b6f78e1b32db1916d5de979.jpg,02E8A88C0D7B41E596796082ADD18F0E
2025-07-27T10:48:21.000Z,"Autopajoilla näkyy vakava muutos – ""Esimerkiksi monilla pienituloisilla eläkeläisillä""","Ihmiset tuovat korjattavaksi yhä vanhempia autoja, joiden vikalistan pituus yllättää – eikä lompakossa ole aina tarpeeksi pelivaraa.",https://img.ilcdn.fi/f50GQSLHZm5L6jxDxDgNsBq7C-8=/510x318/top/img-s3.ilcdn.fi/787a9022ac97832fd4f953c327a35a82a31ddcf38e5a44ad937ae92704f15ad9.jpg,742D31CEB9D442A6938139C6B2188A2A
2025-07-27T10:52:04.000Z,Poliisi: Kalajoella hukkuneet pojat olivat ulkomaalaistaustaisia,"Poikien kanssa jutelleet ihmiset kertovat Iltalehdelle, että nuorten suomen kielen taito oli vajavaista.",https://img.ilcdn.fi/VaCJ5NQB_WpOJTMhKWXq7mI-T5k=/510x318/top/img-s3.ilcdn.fi/2343eb5024ae4e1100b8a289a47156f6266810c8ccbf9574fe6426668a6339bf.jpg,2B29762FBC9442FDA0C30C24068ADD4D
2025-07-27T10:54:32.000Z,KSML: Juha Mieto on lyöty,"”Mietaa” osallistui polttopuukisaan Koskenpään markkinoilla, kertoo Keskisuomalainen. Legenda joutui toteamaan kilpakumppanin paremmakseen.",https://img.ilcdn.fi/YtUaBnJY4v77ex8RgRv2dAVXEQA=/510x318/top/img-s3.ilcdn.fi/167a12e19238dfde4310567f9d7a29a60ff3014118e6095b12cbbb205a80cbad.jpg,5830BDFB7202492B961D3EE1BDFFF9B9
2025-07-27T11:02:00.000Z,Suomeen tuli jälleen mitali,Sara Killinen voitti universiadipronssia.,https://img.ilcdn.fi/C1a5HNKCgGVcJdAdKu28efs_-fA=/510x318/top/img-s3.ilcdn.fi/9048c50d75bc4ce3b616b992fbcaf95467dd78b604c3316dd0cef3629f6b6ad4.jpg,49158EB6AA9F49A6A24ACFD68A95D3F3
2025-07-27T11:02:48.000Z,Kaaos luvassa? F1-kisaan useita rangaistuksia,Belgian osakilpailusta odotetaan yllätyksellistä. Kolme kuskia lähtee varikolta.,https://img.ilcdn.fi/4mBfqczvP2eQnCdTyeHz1eqBQlM=/510x318/top/img-s3.ilcdn.fi/de25b2e3f78a3517138d87ba740f4425ba933bc960786a29ab63edee66fafdb9.jpg,BCA77164CB004DDAACFA767280B598A7
2025-07-27T11:08:37.000Z,Sharon Osbournella on yksi toive Ozzy Osbournen hautajaisiin liittyen,Lähteen mukaan Sharon Osbourne ei välttämättä järjestä isoa muistotilaisuutta rock-legendalle.,https://img.ilcdn.fi/YkjGCEac0nBeKq-w9oKPbkmhB5E=/510x318/top/img-s3.ilcdn.fi/2e70b447f411a015aa3a2d2ca24ae883c49bfedfd2ed1666c1c9258fb6d2d063.jpg,AEED24925E40494A8F40EF25225683B3
2025-07-27T11:18:08.000Z,Iso mutta – Mitaleita kahmivalta Ilona Monoselta suorat sanat voitoistaan,Estejuoksija Ilona Mononen saavutti jo kesän kolmannen arvokisavoittonsa.,https://img.ilcdn.fi/PDCXULvlF0w-FTU4WNmA_6C8vtc=/510x318/top/img-s3.ilcdn.fi/3d99440aacde8c9a00427a76f4d64c2d6fc9da30b7ec320921c45620b8fec7fb.jpg,3C7A462F96AE4302A257A0F06FF98545
2025-07-27T11:34:06.000Z,Hyvät neuvot kalliit,"Eläkeikä lähestyy, ja velkaa on vielä jäljellä. Asiantuntija neuvoo, miten kannattaisi toimia.",https://img.ilcdn.fi/eF17veI_OV5pClaLq-b5bcYPIoo=/510x318/top/img-s3.ilcdn.fi/a9b554188961a0aeb1c0b6be16dfb2546ba5f63f178ac46d338ad4f7fc541e4a.jpg,81B98822A97348E6B70DDD948FBE3D0F
2025-07-27T11:46:58.000Z,"Yhden työntekijän huono salasana riitti – 158 vuotta toiminut yritys nurin, 700 työttömäksi",Perinteikkään brittifirman tarina päättyi kiristyshaittaohjelmahyökkäykseen.,https://img.ilcdn.fi/tkxlybtMm5vAGrZ_g3AycdNmuwc=/510x318/top/img-s3.ilcdn.fi/d8e290a8ac8dcd4e83d9a0c0f616c6a3c3aaf83abf892fec663138b458a29b6e.jpg,153660F607CE41E68314D33BC4825D87
2025-07-27T11:54:03.000Z,Pippa Laukalta vahva viesti suomalaisille ruokakaupoille,"Pippa Laukka on huomannut, ettei prosenttien puute vaikuta juomiskokemukseen.",https://img.ilcdn.fi/6yyVf7Q_oPnUswmno_5uCFKieBY=/510x318/top/img-s3.ilcdn.fi/156401bf550aedb1b3b2b3624c38ed40b2072fd22b8abfdc2501d501fb476fc1.jpg,BCD3FA0468D747D499336A3FD62BFC22
2025-07-27T12:02:29.000Z,Toimittaja Jorma J. Mattila on kuollut,Iltalehden pitkäaikainen uutistoimittaja Jorma J. Mattila on kuollut.,https://img.ilcdn.fi/582wevP_fcDwDKZxf_J2CCMeo6Q=/510x318/top/img-s3.ilcdn.fi/080d3161e0b00a0cbeca6e1c39df04b696f8f8ee09d7dedb24177681cef63ede.png,D872A841E00346B5B19723ABA511B42B
2025-07-27T12:16:54.000Z,Yli 300-kiloinen autonrengas irtosi ja lähti pyörimään kovalla vauhdilla – Hirmuista jälkeä,Monsteriauton rengas aiheutti vaaratilanteen Yhdysvalloissa.,https://img.ilcdn.fi/4_wDhwjs_WPx7KUuxSU2I78HJIA=/510x318/top/img-s3.ilcdn.fi/cc4435c5676b6a9bb28c892a9c51fd8b2b00d94d48f7e732e076088a916ca810.jpg,734D8ADD13874BCA9BF005954B5EFFA0
2025-07-27T12:21:15.000Z,IL seuraa: Valtteri Bottas vastasi huhupuheisiin Sky Sportsilla,Kauden 13. F1-osakilpailu ajetaan Spa-Francorchampsin klassikkoradalla. ,https://img.ilcdn.fi/PpUPZKTFyh1SrsGk1aFacwcCvs0=/510x318/top/img-s3.ilcdn.fi/a286ad39091eb87a9b25d0ae0df0b3f8e3ee001808f23d4f6f9a08769d7b49e2.jpg,BF7FAD8632424D8F912A347DBC66F962
2025-07-27T12:37:20.000Z,Mikä on maauimalan pukeutumiskoodi? Saavatko musliminaiset olla altaassa vaatteet päällä? Liikuntajohtaja vastaa,"Sosiaalisessa mediassa on ihmetelty kuvaa, jonka kerrotaan olevan peräisin Espoon Leppävaaran maauimalasta. Kuvassa musliminaisia on huivi ja mekko päällä altaassa. Espoon liikuntajohtajan Martti Merran mukaan se ei ole sallittua. Hän huomauttaa, että muslimitaustaisille on omat hupulliset uima-asut, jotka ovat sallittuja uima-asuja. Jos ei mene uima-altaaseen, maauimalaan voi tulla viettämään aikaa kuten uimarannalle tavallisissa vaatteissa.",https://img.ilcdn.fi/C3STtxWg9qFPhw5fofM6N1l_kpw=/0x0:720x450/510x318/top/img-s3.ilcdn.fi/ef7eaca7cd25bd9f0b8b3ec63fccd118e80b5d2bb5174ad4ec37af6da76fb405.jpg,F112B15AA718441FA50A45F959154045
2025-07-27T12:48:00.000Z,Donald Trumpilta ”pelastus” – Loppu törsäämiselle,Yhdysvaltain presidentti puuttui yliopistourheilun kasvaneisiin pelaajapalkkioihin.,https://img.ilcdn.fi/I_MCsqjCLNCJkqrWa1uv048Wty8=/510x318/top/img-s3.ilcdn.fi/71a568a53c5722a8e87ddf08217009ab2fc4db1293a0e3eacd5d1b0ce6037b43.jpg,E5F70D20F494491C82DEC5BDCC4F3AC1
2025-07-27T13:04:19.000Z,Tätä on todella vaikea selittää  – Toisella joukkueella merkittävä etu EM-loppuottelussa,Tilastojen mukaan Englanti voittaa Espanjan naisten EM-finaalissa. ,https://img.ilcdn.fi/e8DLFS7u_gJzuin45y-In5DDNaY=/510x318/top/img-s3.ilcdn.fi/b4d8381e714796f0ab3c61db6276d69dbaee33ee3c3dec3bc916d59654f326c4.jpg,410637BAC5044CAB93246FD531DEE314
2025-07-27T13:05:15.000Z,Orpo kommentoi synkkiä lukuja: ”Sydäntä särkeviä uutisia”,"Pääministeri toivoo, että lapsia valvottaisiin uintireissuilla tarkoin.",https://img.ilcdn.fi/OdlRPjglf9Pb60QklBpGWFh2auk=/510x318/top/img-s3.ilcdn.fi/9f9a1044adef3b5968a49bc96e19ce3ebb173e902300f17c1f15d4b5ac328f34.jpg,103CC8B0886D422387FA28951B4666EE
2025-07-27T13:10:40.000Z,Supernanny avautuu hengenvaarallisesta diagnoosistaan,Jo Frost kertoo hengenvaarallisesta diagnoosistaan.,https://img.ilcdn.fi/88lLK7SRbMt-1iCI7Buf5HLZXxE=/510x318/top/img-s3.ilcdn.fi/a5ddd603fd06aa62f93da58fff5a7f30ffd2783ee06d6e1fe08e9164de21cb91.jpg,CB52AC5BD87E41C7A30A1014BB5BF0F1
2025-07-27T13:12:37.000Z,Järkyttävä välikohtaus Icon of the Seas -aluksella,Tekijä pakeni paikalta ja hyppäsi mereen. Hänet todettiin myöhemmin kuolleeksi. ,https://img.ilcdn.fi/RxfrAjsq6AAyjbXLQ-5q7Cjhn6I=/510x318/top/img-s3.ilcdn.fi/2060cda057abd87da094d9e0f16bf43b7f2036b76ef06f414d27166d276e05c0.jpg,078786747A43433B9F402FFF51924106
2025-07-27T13:31:12.000Z,Veneilijät ajoivat kylmästi apua tarvitsevan ohi – Merivartiosto tyrmistyi,Merivartiosto hinasi moottorivikaista venettä.,https://img.ilcdn.fi/vkmIMThsMNtiTnGYDX7O1VyWmIc=/510x318/top/img-s3.ilcdn.fi/0b75837ee301e967fe22c403b96c4aab1893b0ab82acf96ab87c9ad157abcb73.jpg,D86CD7437D5D4D3480A98070B3E01BCF
2025-07-27T13:47:52.000Z,Heikki Kovalainen latasi kovan näkemyksen Viaplaylla,Belgian gp-kisa jumittaa heikon sään takia.,https://img.ilcdn.fi/y_6WmM8rplwD367fCmzUYOvhHXk=/0x0:3000x1876/510x318/top/img-s3.ilcdn.fi/561d0f4423471a665758cf622d229dfc92db9739492b38d9e2afada82194a415.jpg,2754F1D9044D47E48BC37B5E4A9B3A0A
2025-07-27T13:50:17.000Z,Trump Skotlannissa – Näin järeät ovat turvatoimet ,Skotlanti on järjestänyt mittavia turvatoimia Yhdysvaltain presidentti Donald Trumpin vierailun takia. ,https://img.ilcdn.fi/-MixgEO3SmLymNm13n_4OGZU5fc=/510x318/top/img-s3.ilcdn.fi/b5083cc4f20328ab5b5944068dac0065faeea172a88758801068781a3fc30dca.jpg,44EA1FF958F54E81BBF379897608A8C9
2025-07-27T14:09:19.000Z,Me Naiset: Robin Packalen tekee paljastuksen parisuhteestaan,Robin Packalen kertoo Me Naisille kiireisestä elämästään. ,https://img.ilcdn.fi/irGt31s9q71rMsBGfxcv_TH0QvU=/510x318/top/img-s3.ilcdn.fi/7e304065eb41c9116ccb3c15dc79764557af7cf01f6f82daaf19713ff00a5ebf.jpg,5E876C78D2204DF3858405C338E5BFCA
2025-07-27T14:12:55.000Z,Söpöt eläimet keskeyttävät koeajon keskellä kylää – Katso video!,Mazda 6e -sähköauton ensikoeajolla tapahtui jotain odottamatonta.,https://img.ilcdn.fi/YOO-32vWXssyhKtVf8m3eu3ZxRY=/510x318/top/img-s3.ilcdn.fi/388331e46398c9adac6c87415f1e5a86a38a4cca1965e2efa8af752181c7c3aa.jpg,959EB8837C1749FB99263C52F5AF168C
2025-07-27T14:16:45.000Z,Kolme valkoista keppiä muistuttavat tragediasta – Tältä Kalajoen turmapaikalla näyttää nyt,"Meressä on kolme valkoista keppiä, joilla sukeltajat merkkasivat mereen hukkuneiden poikien löytöpaikan. ",https://img.ilcdn.fi/AciD5u3LO5W7NnqfyDLLbg1GTok=/510x318/top/img-s3.ilcdn.fi/e9729f23f7828288a1dc9611a9c7df34662cef60f4cb495672c90a69b37f86c3.jpg,1D3DEFC6F17D4A77A2866C0D66786688
2025-07-27T14:22:12.000Z,Näin naisten futis on muuttunut: ”On pidettävä piposta kiinni”,"EM-turnaus osoitti, että naisten huippufutis tulee koko ajan fyysisemmäksi. ",https://img.ilcdn.fi/gGe8afJ1LAYwtkLuwOKlPO8XT1w=/510x318/top/img-s3.ilcdn.fi/3f3cf36dd655ff44a4f297eebcfe2786d7fcd47f247b48eaa9f785af09eb25f6.jpg,1A4520AA6B984D78BE7701407BD689E9
2025-07-27T14:25:33.000Z,Brittihovin uhka,"Brittihovin avainhenkilö on Walesin prinssi William, jonka odotetaan seuraavan isäänsä valtaistuimelle. Mutta mitä jos hänelle tapahtuu jotain traagista? Iltalehti kysyi kuninkaallisasiantuntijalta, millainen uhka brittihovin yllä leijuu. Rakennelma huojuu monesta suunnasta. ",https://img.ilcdn.fi/I9U6m1eE9JGLJg89Y33l6-F9kfY=/510x318/top/img-s3.ilcdn.fi/b1d15106eace7c4e8ba1d73a90890344bf4ce88bc5ca5b9a324b33bba1e70bc7.jpg,529DE2503E7E40E999EF7C0F2D4A0B2A
2025-07-27T14:30:26.000Z,Järkyttävä näky häkissä: ”Haluaa nähdä ruumiin lähietäisyydeltä”,"Abu Dhabin UFC-ilta sisälsi brutaalin ottelun, jossa hävinneen kamppailijan kunto herätti huolta.",https://img.ilcdn.fi/LAuNVM2PNA5cwryx75lmHjY7k3M=/510x318/top/img-s3.ilcdn.fi/99f8f2332f812d346d945188bd3e4c5d597e134b59ec0b1eeabb51519691be0c.jpg,7AC95CC16C0F45BFBC50805AB9740F2E
2025-07-27T14:36:19.000Z,Skuuttionnettomuus Helsingissä,Yksi henkilö vietiin sairaalaan.,https://img.ilcdn.fi/p5moqqEkEXF9WgiAWqxI3kg2Dwc=/510x318/top/img-s3.ilcdn.fi/7ff6ea37cd539dd5a178e0d49ce851681b4b16dd990a1c270e6d1788f85ebfa1.jpg,C231DEB9AED5488F9DDD614115031684
2025-07-27T14:48:25.000Z,Ideaparkissa lainehti,Pirkanmaalla on sunnuntaina voimassa ukkosvaroitus.,https://img.ilcdn.fi/L-bWleEZmlYu_2ShEFwqFGFVvBg=/510x318/top/img-s3.ilcdn.fi/9728a36f87998a036577d2d1da24603d91f202e465a31085437b4470771b2627.png,A99D724E0E9B41F490552BEE92198BD5
2025-07-27T14:48:27.000Z,Näin suomalaiset ostavat lenkkareita – Yksi malli ylivoimaisesti suosituin,Suomalaiset ostavat marketeista mukavia unisex-mallisia lenkkareita. Tennarit pitävät pintansa erityisesti miesten ja nuorten naisten keskuudessa.,https://img.ilcdn.fi/m55bbtSn4yS_laMFiX7qDCIpq-0=/510x318/top/img-s3.ilcdn.fi/9eff20e3b1e079326428aa19dd897b74c7685a5caaf7cb5dbef969a2c469a6db.jpg,B7536CACE4BA4638A5C6344242F06BB1
2025-07-27T15:03:41.000Z,Tiedätkö nämä 10 faktaa seksistä? Tässä testissä pärjää vain aito sekspertti,"Selvitä Iltalehden testin avulla, kuinka hyvin seksitietous on hallussasi.",https://img.ilcdn.fi/gJ4g04TyFu9tSsOQ0UEOnUJJ2cE=/510x318/top/img-s3.ilcdn.fi/45ac146d6a26e45fd623a684819dbfbdf5711f9a13f865407884f06f0f853688.jpg,F766590CE75C4F85B149B565F25F16EE
2025-07-27T15:09:51.000Z,Perheen Karibian-risteily sai karmean käänteen – Mitä tapahtui 23-vuotiaalle Amylle?,Unelmaristeilylle lähtenyt nainen meni tupakalle hytin parvekkeelle. Mitä ihmettä sitten tapahtui?,https://img.ilcdn.fi/nI8bkzleJFHTvoPLfseXjGwtUvY=/510x318/top/img-s3.ilcdn.fi/7a5c4f91ab9349da9c464704791ddce1b49821d1d921012ba295396812bce233.png,DF8D859EDE4545A2A5CBC88A614F594A
2025-07-27T15:21:56.000Z,Mies riisui kaiken keskellä peltoa Vantaalla,"Mies pysähtyi vasta, kun poliisi uhkasi häntä etälamauttimella.",https://img.ilcdn.fi/Way4aCChdSRyRACmSdUuGkBBnwE=/510x318/top/img-s3.ilcdn.fi/ecfc22e004164d4a3793f2fbd8bd00c46c13809b4982db1b602501d59514e07b.jpg,8999C90B15DF42D3811FF7DD762EA689
