paivamaara,otsikko,tiivistelma,kuva,id
2019-10-28T04:55:37.000Z,Tiesitkö tämän kikan? Näin viikkaat paidan salamannopeasti,Tässä erittäin kätevä tapa viikata t-paidat.,https://img.ilcdn.fi/ljczR9hVK24YoazguClVDyxmPJM=/510x318/top/img-s3.ilcdn.fi/1e761ce44e9bd87824e1aba6f41357295a3897177ddb45e67396492701ff932e.jpg,7BB939FC03CF43D5AE212FFCE29BA267
2019-10-28T04:56:25.000Z,NHL-puolustaja Esa Lindell poistui verta vuotaen kaukalosta: laukaus läsähti suoraan naamaan – katso kova tälli videolta,Esa Lindell palasi kentälle maskin kanssa.,https://img.ilcdn.fi/ehsjnZDpRlf4Vfgw1we-t95VaDo=/510x318/top/img-s3.ilcdn.fi/08ed375c0263dfbdde17e148d45ecb10612f920f672164aa371be1ad41396ea1.jpg,B426E652D65447A0B22BD9268C21D13F
2019-10-28T04:59:27.000Z,Ex-nyrkkeilijä Amin Asikainen ja Nadia juhlistivat merkkipäiväänsä – voittivat vaikeudet: ”Rakkaus on vain kasvanut ja vahvistunut”,Ex-nyrkkeilijä ja valmentaja Amin Asikainen sekä Nadia Ammouri ovat olleet yhdessä jo neljä vuotta. ,https://img.ilcdn.fi/lin55e_YrTXJnxTttKRurHBU4eE=/510x318/top/img-s3.ilcdn.fi/103e73bf255a38676a210e7294503812159e5e03ff184ad411d6e55f1c1d9524.jpg,3754DF45975247ECABB1BA70A59FB60D
2019-10-28T05:00:00.000Z,Asuntovaunulla lomafiilis löytyy aina - Surffaajaperheessä seikkailumieli on vakiovaruste,Ville ja Jenna ryhtyivät karavaanareiksi vierailtuaan karavaanarimessuilla. Viimeisen vuoden ajan he ovat opetelleet asuntovaunuilun saloja yhdessä pienten lastensa kanssa.,https://img.ilcdn.fi/1AXUipA__21GtZl6KpTdql1D7MA=/510x318/top/img-s3.ilcdn.fi/5993c844b7aa58ea50c2dad57679c38c4c4145de09cfe3cb555f5baf15dc605f.jpg,B112B77832114768BBAA4AE6E93097D7
2019-10-28T05:00:44.000Z,"Muistisairas vanhus ei saanut hoivapaikkaa, vaan turvarannekkeen, jota ei osannut käyttää – paleltui kuoliaaksi",Valviran tuoreet ratkaisut kertovat kahdeksan surullista tarinaa vanhustenhoidon todellisuudesta.,https://img.ilcdn.fi/MwBj4VO55OrV1f8JvWQTiaPq23c=/510x318/top/img-s3.ilcdn.fi/8a774e0b07237fd1381f554585a3ea86c92733fe28446d4b01b79cfcb551bdf8.jpg,CEC005CB50C74F7287608412B6BADCE9
2019-10-28T05:31:05.000Z,"Jonna, 36, lopetti ketodieetin, kun se alkoi häiritä unta: tunnemyrsky tuli yllätyksenä","Helsinkiläisen Jonna Musakan, 36, oli vaikea lopettaa ketoilua. ",https://img.ilcdn.fi/q6MB0ZfUK-dn6YVrRAqsBBT97yE=/510x318/top/img-s3.ilcdn.fi/4170d749ca32cc498cf414cef8241c0223f01b85c2a4dd3868bbc818f328e5ab.jpg,6D15965A8F524042958E4AA4738EF2FF
2019-10-28T05:53:27.000Z,Jennifer Anistonin kauneuden salaisuus – Asiantuntija arvioi: nämä kosmeettiset operaatiot hänelle on tehty,Ikinuoren näyttelijän ulkonäkö ei ole vain hyvien geenien ja elämäntapojen tulosta.,https://img.ilcdn.fi/1-0b-5aTuUmM1M3DF-P8SpSubKs=/510x318/top/img-s3.ilcdn.fi/e81cd1692c7a936f624ab29025c58958e19831d6b2884d98b6ba18fb0a54b865.jpg,1619560974E94339892A92295446DA5A
2019-10-28T06:00:00.000Z,Sisustussuunnittelija visioi - ensi vuoden kovimmat sisustustrendit,Sisustussuunnittelija Linda Baki visioi ensi vuoden kovimpia sisustustrendejä. Jatkaako samat trendit voitonkulkuaan vai onko kenties luvassa jotakin uutta?,https://img.ilcdn.fi/RnuWPZjUCV8BmNvbZ64uwn0lB_o=/510x318/top/img-s3.ilcdn.fi/96628661fa5fe402f8b70c2006b2d332b891683980514ec686619c2a04664eae.jpg,BDB5C891C7024BE49EAF268D11D8B770
2019-10-28T06:00:21.000Z,Säästöä hävikkiruoalla? Täällä se onnistuu,Hävikkiruokaa myyviä ravintoloita on jo ympäri Suomea. Ylijäämälounaan voi ottaa mukaansa muutamalla eurolla.,https://img.ilcdn.fi/DKvAgfEZEbHsbOWJSe73Ph0aOHI=/0x188:3000x2063/510x318/top/img-s3.ilcdn.fi/15153fecea959f20b0946eab4846cb7d231629d08dbf782438bc553bafe61cda.jpg,D2C1E620251C4C1889F16F274D70A555
2019-10-28T06:06:13.000Z,Tiger Woods teki huimaa golfhistoriaa – ”Tämä on ihan hullua”,Tiger Woods nousi Sam Sneadin rinnalle.,https://img.ilcdn.fi/9YiX3LSG7lgLHJVuTaKlKF75dXI=/510x318/top/img-s3.ilcdn.fi/8816389e718faaa95b45d01d4318f139dc0cad840d669b1c8aa2fa538a096f1a.jpg,F619413FC67046D6AE73E52488BE8FCB
2019-10-28T06:07:08.000Z,Marika luuli valtavaa möykkyä kannon nokassa ampiaispesäksi - kyseessä olikin sieni,Eteläisestä Suomesta löytyi jälleen suuri kurttusieni.,https://img.ilcdn.fi/u82Qe5t8FXYvhQxcyuoLGtDzQuQ=/0x425:1200x1175/510x318/top/img-s3.ilcdn.fi/a1d01b11c0fe44f712d995dc94ba6a9290b2cd9d33a016f060cc3137b32ed9c8.jpg,76420FA235084CF5A5CD78A89DF044EC
2019-10-28T06:30:58.000Z,"Aurinkoa ottava alpakkaa näyttää aivan kuolleelta: ”Kyllä siihen saa viereen kävellä tarkistamaan, hengittääkö”","Alpakkalaumasta löytyy jos jonkinmoista luonnetta, mutta rakkaus aurinkoon yhdistää lauman yli kahtakymmentä yksilöä.",https://img.ilcdn.fi/kX6DK-0-DklwKVJbma0R_SYz_TI=/510x318/top/img-s3.ilcdn.fi/a2671ac8ca2d1ce2022869bfc0397cb0f610bda7554d85a1021c1739a4f4ec72.jpg,7B411FACF01047D89312CF9CDCA3455E
2019-10-28T06:32:24.000Z,Näin prinssi Williamin lapset viettivät syyslomaa – herttuatar Catherine on ottanut kakkoskotiin kanoja,Prinssi George ja prinsessa Charlotte vetivät hetken henkeä kouluvelvoitteista.,https://img.ilcdn.fi/cZ0wqlgpC_WwoVLzV7H-DTtt8Q0=/510x318/top/img-s3.ilcdn.fi/77ef42915b3b42541d7037aa6435c7cf22fc8cc5a23ebc4bae340bdf30c030ad.jpg,6DAA58FD89DC4D08B755C0B59E8C946B
2019-10-28T06:37:32.000Z,Viimeinen drinkki jäi puolitiehen – näin legendaarinen kiekkotähti lopetti ryyppäämisen kertalaakista,Alkoholiongelmasta kärsinyt Veli-Pekka ”Vellu” Ketola pani korkin kerralla kiinni vuodenvaihteessa 1992–1993.,https://img.ilcdn.fi/kMutCq-7ourekpduRptaG12eFnw=/510x318/top/img-s3.ilcdn.fi/1fb4a41b558f0874d808e553a52e25f05865550b9b4df55c501cfe1c36fa7bba.jpg,72743590F0E847B7A22773F8262F9231
2019-10-28T06:45:18.000Z,Koulu joutui silmittömän ilkivallan kohteeksi Harjavallassa – virkavaltaa odotti paikalla tolkuton siivo,Poliisi pyytää yleisöltä havaintoja tapahtuneeseen liittyen.,https://img.ilcdn.fi/DZRLT9nIH0rNYMQs7r75TM61evE=/510x318/top/img-s3.ilcdn.fi/fab9ecf47b3b8cab6859a09b96a5e75e0f6febcfd110c81259f95aa291d724c4.jpeg,F95D837899AB43A8B151826CFE177EDC
2019-10-28T06:48:30.000Z,"MOT: Suomea uhkaa miljardilasku EU:lta, jos metsähakkuiden kasvattamista jatketaan","Uusien sellutehtaiden vaatimista hakkuumääristä voi seurata miljardilasku, paljastaa Ylen MOT.",https://img.ilcdn.fi/jCdpY6_F4_cTASQjjzDmejY8qbQ=/510x318/top/img-s3.ilcdn.fi/9140dabd33e8a79bc65f8409e181d5cc12446faae34ecba0dd4aa2dd861d1bfe.jpg,B9E96A1FD74F41228DD83267D59B06EE
2019-10-28T07:25:13.000Z,Sarah Jessica Parkerin villi teoria Sinkkuelämää-sarjasta – tätä tuskin kukaan on tullut aikaisemmin edes ajatelleeksi,Sarah Jessica Parker analysoi sarjaystäviään varsin tuoreella tavalla.,https://img.ilcdn.fi/P7-7b4CD9volDqRFscmFkKKVlqs=/510x318/top/img-s3.ilcdn.fi/f75636cd827a68a2e44ae5b51c2c8be7655770df0aff0409b3d09e74da20f7f0.jpg,B279EC1599D2417492430150D989EAA7
2019-10-28T07:26:10.000Z,Britannian ruumisrekan kuljettajaa kuullaan oikeudessa - seuraa suoraa lähetystä kello 9.50,Kuljettajaa syytetään muun muassa taposta ja ihmiskaupasta.,https://img.ilcdn.fi/jrGUSdCwsM7NBcNPfXMOWi89H-M=/510x318/top/img-s3.ilcdn.fi/1cae9f219843a5df7eb2f872759f91dc31ae1322882ad5926050c6b9fe851992.jpg,BB43C47210E14AD4B6FB15F6DAED814F
2019-10-28T07:37:45.000Z,Tämä juhlapuku on syötävän hyvännäköinen – asutaiteilija loihti mekon lakritsista,Lakumekko oli esillä Helsingin Lakritsifestivaaleilla.,https://img.ilcdn.fi/FB4Umn9SsEP31k7BFYzOVWKipjU=/510x318/top/img-s3.ilcdn.fi/a9824e3b1de197b9edc53518f2b6079b6e4c77dd3fe71ee87bb7a41552a53466.jpg,CEAFE19D7FF84B659D3864AE3FF31680
2019-10-28T07:40:09.000Z,Amerikkalainen matkailusivusto ei vakuuttunut suomalaisesta ruokakulttuurista: ”ruoka on kallista ja tylsää”,"Suomalainen ruokakulttuuri ansaitsee aika ajoin myös kansainvälisiä kehuja, mutta amerikkalaissivustoa emme onnistuneet vakuuttamaan.",https://img.ilcdn.fi/JQFVTFSQLE8bGOQLM-VPed8Hi-4=/510x318/top/img-s3.ilcdn.fi/760de71a5322ff03848ac972942e722f2c2dacc1f751e2264fbcdb1ada414d45.jpg,DF0039B4B73F4078815073102973B6E1
2019-10-28T07:40:48.000Z,KRP epäilee: Kuopion miekkasurmaaja suunnitteli vieläkin suuremman väkijoukon tappamista ,"Tutkinnanjohtaja kertoo, että epäilty yritti polttaa saman luokan, johon hyökkäsi.",https://img.ilcdn.fi/dkGSjJP6-1PRq3dnXmUpRKH0-hM=/510x318/top/img-s3.ilcdn.fi/0acd99657455d2c35b76045d5e1f723131d8c200e326e9b1ef30a90aa240ae76.jpg,CD7B5C82998449009373324629C3DB6D
2019-10-28T07:43:45.000Z,Peronisti Alberto Fernandez voitti Argentiinan presidentinvaalit,Voitto ratkesi jo ensimmäisellä kierroksella.,https://img.ilcdn.fi/Q7dNFDUfi8A0vEUgzKDAXUS5TQ8=/0x0:3000x1876/510x318/top/img-s3.ilcdn.fi/0fb8b525b2e100effa31fd1eeeecff34ab14aba8f350a270bde9a7c8f745f06f.jpg,2DF94D8515C44536BA592C81F6B8E388
2019-10-28T07:44:55.000Z,Milloin on oikea aika ostaa iPhone 11? Katso miten uutuusmallien hinnat laskevat,"Uusien matkapuhelinmallien julkaisut ovat odotettuja päiviä elektroniikkahifistelijöiden keskuudessa, mutta kiinnostuksesta huolimatta uutuudet eivät aina nouse välittömään suosioon. Hintaopas vertaili iPhone-mallien suosiota ja aikaisempien mallien hintakehitystä.",https://img.ilcdn.fi/qqd_pC7io5rOsL0iEZZ7uMUANNM=/510x318/top/img-s3.ilcdn.fi/37eb92c18e45bc247f47fbc493d7b221f191697d4d2006fe13da0374a0f0027c.jpg,98AAAEED51F6401BB96CB0192C8A0194
2019-10-28T07:47:22.000Z,Joko Lewis Hamilton on F1-historian paras? – ”Hän on hyvin lähellä Michael Schumacheria”,"Lewis Hamilton voittaa, vaikkei hänellä ole nopeinta autoa. ",https://img.ilcdn.fi/HSry1TIrO45H_Ej2H3Qd8fs8wSE=/510x318/top/img-s3.ilcdn.fi/4660cf98c1b45fed8608056d4866ad3377a6c4575e5323074228c4b43024931c.jpg,F2F924D4DA094819A9F160792878D615
2019-10-28T08:02:45.000Z,Erikoinen tilanne valkokankailla: Ensi kesänä kuvataan kaksi Kiljusen herrasväki -elokuvaa,Janne Katajan tuotantoyhtiön lisäksi myös toinen tuotantoyhtiö kuvaa Kiljusen herrasväen elämästä elokuvan ensi kesänä.,https://img.ilcdn.fi/KHsHkThx4AF2HaoypZc6wEpmeoI=/510x318/top/img-s3.ilcdn.fi/fd747444bff97c35d74d5c0f8db3b0e8a2f97a17876957910d86fe2acad700e2.jpeg,79221D8F9A864D7BBCA3A9EDB269DB38
2019-10-28T08:11:43.000Z,"Jo toinen koulu tulessa Nurmijärvellä, lauantaina paloi edellinen: ”Ei siitä enää kouluksi ole”",Nurmijärvellä yöllä palamaan syttyneen kyläkoulun arvioidaan tuhoutuvan palossa.,https://img.ilcdn.fi/TtjynCIt_54I1qY6NU-SbGGbwgc=/510x318/top/img-s3.ilcdn.fi/d534849a0c3f646fde8e92c09468906ccd217fa0001ceb30787865f516bf1dd5.jpg,4AB43E8B0C794951BAF22E03761AE8EC
2019-10-28T08:13:47.000Z,Poliisi epäilee Nurmijärven koulupaloja tuhopoltoiksi - kunta aloitti tehovartioinnin kaikilla kouluilla,Poliisi epäilee Nurmijärvellä maanantaina aamuyöstä syttynyttä Valkjärven koulun tulipaloa tahallaan sytytetyksi.,https://img.ilcdn.fi/mHSHhxIWxf0n18H_QtqXoVScq2I=/510x318/top/img-s3.ilcdn.fi/50c2fa685f1c7e05f3916a0c0d26817bffdc0a40d1d202e16bf5102bf5f54c62.jpg,B822FE95EB714F5E831835E996C9A437
2019-10-28T08:26:18.000Z,Neljä kalvoa ja yksi Cheekin biisi – näin Jukka Jalonen valmisti Leijonat MM-finaaliin: ”Aivan maksimaaliset kylmät väreet”,Suomen päävalmentaja Jukka Jalonen veti oikeasta narusta viime kevään MM-finaalin ottelupalaverissa.,https://img.ilcdn.fi/9BjO3RT1vF_61sjXwA2kLLQ6Xcw=/510x318/top/img-s3.ilcdn.fi/5f3ddd94ad973cfc2bd938aeb630f4869dd96ffeaaf747a41686a4d6923c8791.jpg,4BD6C0425E9F49B48077231EB312D635
2019-10-28T08:30:13.000Z,Kiinalaisnainen synnytti tyttövauvan 67-vuotiaana - ”Tuskallista”,Naisella on entuudestaan kaksi lasta.,https://img.ilcdn.fi/KtDAKJgIYs19rJSZJzQYWVjYxDQ=/510x318/top/img-s3.ilcdn.fi/3ea79806e079f7f6a93e6e0de1b099af3c15d7058086187762b1da5833cd95c3.jpg,9A4B52A962694255881AC8ED2A631092
2019-10-28T08:44:51.000Z,"Vetinen ja mauton kasvisruoka maksoi 20 euroa - Ravitsemusterapeutti: ""Pää räjähtää""","Ravitsemusterapeutti Leena Putkonen moittii ravintoloiden kasvisruokaa mielikuvituksettomaksi ja ala-arvoiseksi, mutta poikkeuksiakin löytyy.",https://img.ilcdn.fi/8MkuCfjp60KMB0kRNlXGYfJsIXA=/510x318/top/img-s3.ilcdn.fi/121754d974fd356df7d98a1a90be63fe7add88907a382aee70560f884f798809.jpg,6A5EB883A20641EEAF02DF0A672DC2D8
2019-10-28T08:48:19.000Z,"Urpo Taskinen viilettää erikoisella velomobiililla jopa 5000 kilometriä ja kehottaa kuuntelemaan, mitä hänen ystävänsä Greta Thunberg sanoo","Velomobilisti Urpo Taskisen ilmastoahdistus muuttui käytännön työksi. Hänen mukaansa Ruotsissa ilmastokeskustelussa on ihan eri sävy kuin Suomessa, jossa luontoaktivistit herkästi leimataan.",https://img.ilcdn.fi/gX3UDYlIkCc-8GD5o0e62NGv5dI=/510x318/top/img-s3.ilcdn.fi/ee22115538d29c6ea900b5d8724d8fb3d1d01e69331028e1a476da3de4dfeb63.jpg,B47FC26EAA37483C969C6279DB3FDF5D
2019-10-28T08:58:28.000Z,Poliisi etsii omakotitaloihin murtautujia Oulussa: ”Voivat olla myös ulkomaalaisia”,Poliisin mukaan omakotitaloihin murtautuneet ovat saattaneet liikkua rikospaikoilla jo ennakkoon.,https://img.ilcdn.fi/yF931vgqGw2FpvUxhXXM53NWiSk=/510x318/top/img-s3.ilcdn.fi/4bac4c9784905193580d4e6e183b31b75599467e50be490a3856e06819c4ac87.jpg,E48B6AB54ADA499C8483EAD4B6365FEA
2019-10-28T08:59:23.000Z,"Homoudestaan puhunut ex-huippukiekkoilija Janne Puhakka kertoi Ylelle yllättyneensä keskustelun mittakaavasta: ”Toivon, että nuoret, teini-ikäiset saavat tästä jotain”",Janne Puhakka teki arvokkaan ulostulon Helsingin Sanomien haastattelussa.,https://img.ilcdn.fi/NVx7kFsUb4JFz57ZchtN8_gN2vg=/510x318/top/img-s3.ilcdn.fi/965ac47141d38eb88b15db92a0439114ff8fb326c0f40c2b759ceef7894fa0a7.jpg,AE0440918CA14534BB0606586D434F42
2019-10-28T09:03:35.000Z,Minttu Kaulanen joutuu jättämään Suurin pudottaja -kisan kesken intiimin vaivan vuoksi,"Minttu kärsii jäätävistä ja vihlaisevista kivuista, jotka vain voimistuvat tehtävän jatkuessa.",https://img.ilcdn.fi/VfpbYbb61FSIhnIYtYFoKYW-2Ig=/510x318/top/img-s3.ilcdn.fi/7ffae5437801e5549b9c49216c00b8e217069623fd89035085e0676b51174365.jpg,756168355E55434193BE53807DF99373
2019-10-28T09:06:54.000Z,Eläkevakuutusyhtiö irtisanoi kerrostaloasukkaiden vuokrasopimukset - Perusteena piha- ja kylpyhuoneremontit: ”Se on ulos ja tulos” ,Eläkevakuutusyhtiö Keva sanoi irti Helsingin Sörnäisessä sijaitsevan kerrostalonsa 56 huoneiston vuokrasopimukset. ,https://img.ilcdn.fi/_xLPFhd8VSxr6D02TkfjlycUilY=/510x318/top/img-s3.ilcdn.fi/f1de5b24199d8cf1c987f2733f1e234cfb89e23a035f6ae9b1302a5d2909cb61.jpg,B22EF46D62E5484BB487482E36BCA6B5
2019-10-28T09:21:50.000Z,"Kasvonaamio, jota ei pestä pois – uskallatko kokeilla?",Testasimme seitsemän kasvonaamiota erilaisiin iho-ongelmiin. Löysimme tehotuotteet niin näppylöiden kuin viileiden säidenkin kurittamille kasvoille.,https://img.ilcdn.fi/gyV-_-Cf84xacPgmONntl-6VxF0=/510x318/top/img-s3.ilcdn.fi/71cf67cd1d9506e86045a31b79760a4be1649575342e282f6e3b29e593aa59d6.jpg,F4AF615DF52A4025B1E45106FCFB4B47
2019-10-28T09:23:12.000Z,Paluu 50 kilometrin helvettiin,"Pikakävelijä Jarkko Kinnunen kertoo uransa rankimmasta kokemuksesta – 4,5 tunnin piinasta paahtavassa kuumuudessa ja tukahduttavassa kosteudessa.",https://img.ilcdn.fi/-ctD2UNPDVOTb7xoygitHKLu_4E=/510x318/top/img-s3.ilcdn.fi/aac23968b96e27c49f9c4cd2ad06101d709a30b32303f87c86bbeee94e0900b7.jpg,6206D23273F44F6892A319410B7BBCBA
2019-10-28T09:33:53.000Z,EU-mailta siunaus: Brexit lykkääntyy ainakin vuoden 2020 tammikuuhun,Alkuperäisen suunnitelman mukaan Britannian oli määrä erota EU:sta tämän kuun 31 päivä.,https://img.ilcdn.fi/cQj56rH_UcheXCGPF7VWkP9GQ34=/510x318/top/img-s3.ilcdn.fi/1cbe460aaf1db80a85113607f22c98ca80c099ad713e0d2f8593e7bcd3823662.jpg,665C206DEBF943D380644ECF153B9D94
2019-10-28T09:49:31.000Z,Pyhimys julkaisi uuden musiikkivideon – mukana useita julkkiksia: myös BB-Tarina vilahtaa ruudulla,"Räppäri julkaisi syntymäpäivänään kappaleen, joka käsittelee kyllästymistä omaan artistiprofiiliin. Musiikkivideolla mukana ovat muun muassa Arttu Lindeman, Jaakko Parkkali ja Ernest Lawson.",https://img.ilcdn.fi/qmKYaaUm5Pd0HIMxML6Oe0Sh5M8=/510x318/top/img-s3.ilcdn.fi/451d5a73f25f1b9d11ce9a898a962858af922527a01b7f35d44bab0755b8c573.jpg,24BD04CED2C6489CBACF0F5F136C6BF9
2019-10-28T09:51:34.000Z,Nyt paukahti kunnon pakkanen: Uskoisitko lokakuusta -24 asteen lukemia,"Suomenennätyslukemiin on vielä matkaa, mutta Lapissa mitattiin jo kovia pakkasia.",https://img.ilcdn.fi/oS-Pwj6KVCjq3ef_nD5FlfxrBNQ=/510x318/top/img-s3.ilcdn.fi/9caee96dd317c0f1fe0e9a3994b01e132dbabd007f189431911aed6ac9c4c36f.jpg,4ADA48B12AC84A16BAE3B64BD22A395A
2019-10-28T10:07:56.000Z,Valkeakosken kauppatappaja vankilaan – yksi laukaus maksoi hengen,Pirkanmaan käräjäoikeus antoi henkirikosjutun tuomion vielä pääkäsittelypäivänä.,https://img.ilcdn.fi/LCDt16rVgwjH-Y4APBoU979B1q8=/510x318/top/img-s3.ilcdn.fi/c87dee30d19ae97bd6d18a8428d3892967315ab1bebf22787220f0465f17c5fe.jpeg,6EF0D368CEDF4DC2A8C4C6E190F36B70
2019-10-28T10:25:42.000Z,Tampere sai seuraa – Helsinki jääkiekon MM-kisojen 2022 kakkosisännäksi,Jääkiekon miesten MM-kisat 2022 pelataan Tampereella ja Helsingissä.,https://img.ilcdn.fi/2yZimnKtVsDNXSQrH_YzslaF-q4=/510x318/top/img-s3.ilcdn.fi/6400833747fd64bcb94f54cd045773a531e43e6558aec8b81e31b6a23662e8f4.jpeg,E30688D987EB47328FCC4990DA312E67
2019-10-28T10:41:04.000Z,"KHL:n jättiläinen on täydessä kriisissä – tappio tänään, ja valmentajan potkut ovat lähellä",Päivän kiinnostavin peli on KHL:n Severstal-SKA Pietari. Tappiolla Aleksei Kudashovin lähtö SKA:n penkin takaa on varmuudella lähellä.,https://img.ilcdn.fi/OPs3DTN39VEEDjfpPtGODtMKNCE=/510x318/top/img-s3.ilcdn.fi/17e26ed69542a64ac376ef4d602332b50c60592f7a8d1b7599972ba42ce29a75.jpg,4EE862C07C8A4DAFB6887FECE00050DB
2019-10-28T10:42:35.000Z,Vanhuksen auto juuttui keskelle raiteita - taksikuski Tom nosti omin voimin pois,"Vanhuksen pelastanut ja uhkaavan junaturman estänyt Tom Seppelin ihmettelee, miten vilkkaan junaradan yli voi mennä kävelytie ilman puomeja.",https://img.ilcdn.fi/hRXNED9mt5VRxGJ14b2_SMDEuf0=/510x318/top/img-s3.ilcdn.fi/76feda055c433af42d17e601501ce70611ee4971c647d0c06e0de267eeda6bb4.jpg,11F1BD674F68410B9897305164AFD6C3
2019-10-28T10:43:05.000Z,Jukka Jalonen nimesi Leijonat Karjala-turnaukseen – mukana 14 kultaleijonaa ja kaksi ensikertalaista,Leijonat lähtee nimekkäällä joukkueella marraskuun Karjala-turnaukseen.,https://img.ilcdn.fi/mAq2Zy3TKDSdrV4gBeo-qS9Eonk=/510x318/top/img-s3.ilcdn.fi/d650f95b6724cfeb78ff49b6347ee3ec46d40a2a26321e167cc1eb85ada1ef33.jpg,B05504518E734120B9E54D624FF3DA62
2019-10-28T10:46:24.000Z,Prinssi Charles huolestui The Crown -sarjasta – nouseeko legendaarinen tamponipuhelu taas esiin?,"Prinssi Charles pelkää, että historiallinen draamasarja tuhoaa hänen maineensa.",https://img.ilcdn.fi/kQ45HOfqKx4EcHdQu7eu_Q4aB-I=/510x318/top/img-s3.ilcdn.fi/6b8780abbe13d73f63e0c203e03e90c3bafb51d754beb061237a76fac33f1d0d.jpg,D8A98420C0294F3C998EC05A2BE54830
2019-10-28T11:06:22.000Z,Päivi Räsänen poliisikuulusteluihin – ei kadu kirjoituksiaan: ”Enemmän tulee totella Jumalaa kuin ihmistä”,"Kansanedustaja Päivi Räsänen ihmettelee, että häntä koskevaa rikostutkintaa jatketaan. ",https://img.ilcdn.fi/ie1aS2ic2_R1lwQxqbllgFLjnHM=/510x318/top/img-s3.ilcdn.fi/efa49ddb54f1fb8803ff491c83e245665864a8109388b4f2164a64b4a845dbb1.jpg,57998F84528242EAAC0BB87847D0BCCB
2019-10-28T11:12:28.000Z,Nurmijärven koulupalossa tuhoutuivat lasten lelut - iltapäiväkerho pyytää nyt lahjoituksilla apua ahdinkoon,"Nurmijärven Lepsämän koululla toiminut iltapäiväkerho menetti kaikki tarvikkeensa viikonloppuisessa tulipalossa, jota epäillään tuhopoltoksi.",https://img.ilcdn.fi/5q5vpTAGN0JFqvVdaaicKIT3bq8=/510x318/top/img-s3.ilcdn.fi/be5f08cccccccec62961b68efa3d90f00443234b873934e6bb3082f58e9ad2d2.jpg,3DE99586145040798AA55FB6490B49E7
2019-10-28T11:23:49.000Z,"Koiranulkoiluttaja todisti murhaa liikenneympyrässä Helsingissä - verinen valo välkkyi: ""Lopeta mä kuolen""",Sekava mies murhasi uuden kaverinsa Pohjois-Haagassa maaliskuussa.,https://img.ilcdn.fi/BfJOIe3y0sRuOuzcNsuPlNgPI1c=/510x318/top/img-s3.ilcdn.fi/2fbe942aeca411c610ffbde4f621c4d8f5a1789e0f1369372d74e99e13ed3fdc.jpg,408532C2E5E540A0BFFDC4A843EC559D
2019-10-28T11:30:07.000Z,Janni Hussi julkaisi suloisen yhteiskuvan aurinkolomalta Joel Harkimon kanssa: ”Parasta on seikkailla just sun kanssa”,Pari lomaili Italian auringon alla aiemmin tässä kuussa.,https://img.ilcdn.fi/xFA7vl34qr529g51HiZbutKmuN4=/510x318/top/img-s3.ilcdn.fi/ddb52f001aaad23e7fafb3aa76ac4b8a53e9d025bb5851eb4ef76a14bbae6337.jpg,F331B45305054716BD1B1535C3A9AA20
2019-10-28T11:30:28.000Z,Lewis Hamiltonin menestyksen taustalla yllättävä ratkaisija – tuntematon mies ratkoo voittoja täysin tutkan alla,F1-taktiikkavelhot nousivat ratkaisurooliin Meksikossa.,https://img.ilcdn.fi/7P5Pyz-W-nFOHo0lv3GVCdoP6EA=/510x318/top/img-s3.ilcdn.fi/ea8e1e2b23ec1affb6c4a4a824d83a3dd962e43b483e8926d994c910a964c620.jpg,F3BAB7A4A62B4D4C91AF0DEE9ED6AC9A
2019-10-28T11:33:27.000Z,Oikaisu: Tšernobylin onnettomuudella ei todettuja terveyshaittoja Suomessa,Tšernobylin terveysvaikutuksia Suomessa ei ole näytetty toteen.,NULL,217B5AD01E224AC18DBD8A1933EA8BB3
2019-10-28T11:36:31.000Z,Tallinkin uusi laiva sai nimen: MySTAR,Helsinki-Tallinna reitille rakennettava uuden laivan nimi valittiin yli 3 000 ehdotuksen joukosta.,https://img.ilcdn.fi/5rbvzxxSb7L7qfYTeFYe3VVSEwA=/510x318/top/img-s3.ilcdn.fi/510ba68c81efc531adc3b50881f2563f6c6c7086e705f5c54bb16360d9b60ff3.jpg,EFAFD297D0D54795870494F2082F75A0
2019-10-28T12:10:32.000Z,Isä ja poika kuolivat Inarin perhetragediassa: Poliisi ei epäile ulkopuolisia,Poliisi kertoo lisätietoja Ivalon vieressä tapahtuneesta perhetragediasta.,https://img.ilcdn.fi/IBE8fVcG7MJNyj15xeUtSeYB1pQ=/510x318/top/img-s3.ilcdn.fi/1eeba39ab96579657a150dffafa0fe38f5e27c490e7f7f2fc0c6e84c96f40a22.jpg,F8E3D31A4AC847F7B6BF7B5178A19531
2019-10-28T12:12:09.000Z,Isä pakotti Ott-pojan auton rattiin – rallin maailmanmestari kasvoi kovassa kurissa: ”Kadun sitä”,"Ott Tänak tarttui pienenä poikana kilpa-auton rattiin, koska isä pakotti. Sunnuntaina hän toteutti suuren unelmansa ja voitti rallin maailmanmestaruuden.",https://img.ilcdn.fi/03CnaDSc-e5D9bekJQCKV8ZI_Mw=/0x90:3000x1966/510x318/top/img-s3.ilcdn.fi/0c22443489d1df1516ebab9f8da83345d95e6d6f5ef45ec74fb3e89ee963a7fc.jpg,E86CFF587DBF4386A37AD7128AF1A9A6
2019-10-28T12:19:17.000Z,Oikeus oli suopea Turun haamukatsastajalle – olemattomilla tarkistuksilla tavoiteltiinkin työnantajan parasta,Käräjäoikeus on tuominnut keski-ikäisen katsastusmiehen virkavelvollisuuden rikkomisesta ja rekisterimerkintärikoksesta.,https://img.ilcdn.fi/cfu5MZQ9A5TKy4Ap2WnXMJkvy5M=/510x318/top/img-s3.ilcdn.fi/a1cc47abbd7a9142aa80ffdb8858c64083064b469e6452fde0538f69aef7007e.jpg,857DAAAEB4514E20BEDB1AE5A1DBF1DB
2019-10-28T12:22:19.000Z,"Onko hän Isisin uusi johtaja? Tällainen on Abdullah Qardash, joka radikalisoitui ollessaan USA:n vankina",Vallanvaihto tapahtui todennäköisesti jo elokuussa.,https://img.ilcdn.fi/g6inxLZtLAWEARByPaVqHk-7QBE=/510x318/top/img-s3.ilcdn.fi/7fed1c1042ad7751ca199c53edc4adbec2fe68ccd9d953da74133b8f41e9df6c.jpg,49D91E7871A042DB96548664E4123149
2019-10-28T12:24:38.000Z,Kylie Jenner puki alle kaksivuotiaan tyttärensä omaan seksikkääseen gaala-asuunsa Halloween-juhlissa ,Stormi Websterin Halloween-asu toisti hänen äitinsä gaalaeleganssia.,https://img.ilcdn.fi/0QwRiLdtEBaMxlFhekAyQPV-5R8=/510x318/top/img-s3.ilcdn.fi/84bfc972f2fa3cc3f3cdd4d38fc5f001aa55bd686a5b9c61c4731db64a86164f.jpg,CAF151BF22EB4972B7E0C44398D1D44C
2019-10-28T12:45:02.000Z,Nämä koristelut hurmasivat lakufestareilla – katso kuvat upeista finalistikakuista!,Lakritsi- ja Salmiakkifestivaaleilla palkittiin taitavia kakunkoristelijoita.,https://img.ilcdn.fi/3yZ4i5veofj9fVq4lwFWOgt5NUM=/510x318/top/img-s3.ilcdn.fi/60731d6d287a7a862f2d23a3cb2b4508fa7f2ec7535f187728869484b847b030.jpg,D66FF901B3E1414B90BAB49E7AB42CD0
2019-10-28T12:52:42.000Z,Vauva heräsi koomasta USA:ssa - ensikuvat sulattaa sydämen,Vanhemmat keräävät rahaa pelastaakseen lapsensa hengen.,https://img.ilcdn.fi/5b_7dExTITawwGS4zoRV5MsnsVY=/510x318/top/img-s3.ilcdn.fi/db8d2390f2998f4189e81c6c4c22c7f69882b2501f7bba4069d70552a4112f72.jpg,591A29129BC3464FA42F649A803EAE5F
2019-10-28T13:01:36.000Z,HOK-Elannon lahjusjupakan kaikki syytteet hylätty – käräjäoikeuden tuomiossa raamatulliset mittasuhteet,Käräjäoikeus käytti tuomion laatimisessa yli 30 000 asiakirjaa.,https://img.ilcdn.fi/ckofTyO1Bz37xdJYEnlc_4BuEFc=/510x318/top/img-s3.ilcdn.fi/6ef88eea47a35e4ea5910c861fa9366ec923dfe0cd26f5c5b7e5ec1c0fc6341b.jpg,E415AD4969EC4E028456DFEEAC2B00E6
2019-10-28T13:06:44.000Z,Seksillä BB-talossa kohauttanut Jukka vieraana suorassa lähetyksessä - miltä näyttää tulevaisuus Eeviksen kanssa?,Sunnuntaina BB-talosta pudonnut Jukka astelee Iltalehden BB-studion vieraaksi.,https://img.ilcdn.fi/vtCy4aZtUGQ8Z9PZh8W_ueU9Dqk=/510x318/top/img-s3.ilcdn.fi/364ab1bc181b55f362fc56832d5970992e735e7854d6126befd2a1f02f68a409.jpg,113ACD4C77F14D47ABC31D0AD0496417
2019-10-28T13:24:34.000Z,Keskustan Kulmunilla on kova paikka Kelan pääjohtajavalinnassa: demarien vai porvarien leirissä?,"Keskustan uudella puheenjohtajalla Katri Kulmunilla on tiukan pohdinnan paikka, kumman kelkkaan keskusta hyppää. ",https://img.ilcdn.fi/ddNo4RSlYNIpPY86W3DH0kvcxlE=/510x318/top/img-s3.ilcdn.fi/90dd4d73107382f43734d0fb8050a3276b112f0eb8061304c582887af6ddc183.jpg,7D423E82586341F5847EC298EDB6E61A
2019-10-28T13:25:20.000Z,Tekijästä ei mitään tietoa – riehuuko Nurmijärvellä sarjapyromaani? Tutkinnanjohtaja: Ei voi poissulkea,Nurmijärvellä on palanut kaksi koulua kahdessa päivässä. Paloja epäillään tahallaan sytytetyiksi. Epäiltyjä ei ole.,https://img.ilcdn.fi/mHSHhxIWxf0n18H_QtqXoVScq2I=/510x318/top/img-s3.ilcdn.fi/50c2fa685f1c7e05f3916a0c0d26817bffdc0a40d1d202e16bf5102bf5f54c62.jpg,F15C7ED6780C4C37A4A7D531A81A6BCC
