paivamaara,otsikko,tiivistelma,kuva,id
2019-09-24T04:50:56.000Z,"Älä suutele, älä ryyppää, äläkä etenkään käytä napapaitaa – yleisurheilun MM-kisat pidetään kireissä tunnelmissa: ”Mennään hyvin erilaisiin kisoihin, mitä koskaan aiemmin”","Yleisurheiluväkeä odottaa järkytys Dohassa, sillä Qatarin laki ja säännöt ovat eurooppalaisittain kovin erikoisia.",https://img.ilcdn.fi/2S8ZlBv4W8tTEqVlJ-MjBfjkQc8=/510x318/top/img-s3.ilcdn.fi/cad790ac69b9da056612646e450f6b58d1a4d1a04139665713fd2a628d8be02b.jpg,CC91CEAEC82C4370A9F21D539229CC77
2019-09-24T05:00:04.000Z,"Kaupunki vakuuttelee hyvää tahtoa ja uusia tiloja Elmulle Nosturin tilalle – ja listaa useita selityksiä, miksi niitä ei ole löytynyt","Iltalehti kysyi Helsingin kaupungin kulttuuripalvelupäälliköltä Veikko Kunnakselta, miksi Elävän musiikin yhdsitys Elmu ry:lle ei ole löytynyt uusia tiloja, vaikka Nosturin toiminta loppuu jo vuodenvaihteessa.",https://img.ilcdn.fi/sOEb00n3bMVxMDSqJjFPSy4FSrI=/510x318/top/img-s3.ilcdn.fi/2a0828e6ea089531b5718cd3f092bd5b576820a62025bb81b13962f90f155541.jpg,2FFEED32EA0B4DA1A3241769FA6AB70F
2019-09-24T05:22:10.000Z,Meghan ja Harry sulattavat sydämiä Etelä-Afrikassa: halailevat lämpimästi fanejaan,Herttuapari ehti jo ensimmäisenä Afrikka-päivänään tavata paljon paikallisia.,https://img.ilcdn.fi/cHZ7YRLNbdx_yJ6aix0xpeQpUdg=/510x318/top/img-s3.ilcdn.fi/ff46ccede8c2075a8d91f39a0af2da90e3597acc717d5859e3025cb8f66e4249.jpg,CC73C9A29F50413F8BE0ABD813022681
2019-09-24T05:30:49.000Z,"Vaarallinen ja impulsiivinen tappaja hovioikeudessa, todistaja oli tulla salin ovesta läpi - ""Mulla on hermot kireällä""","Timi Oikarinen syyllistyi uuteen henkirikokseen pian sen jälkeen, kun oli päässyt edellisestä ehdonalaiseen.",https://img.ilcdn.fi/3mSwpP7dRVobtYjLHjBxtUE4aXo=/510x318/top/img-s3.ilcdn.fi/d186a0b3603c85ab103dddbe3dc6a68bdd4cff59adbedc8254c744a6f443fe8a.jpg,84B481CACD134B4C82F7E32BC33B4BA7
2019-09-24T05:31:18.000Z,Seikkailija,22 vuotta sitten Timo Polari menetti Grönlannin-vaelluksella kaksi ystävää ja kävi itsekin lähellä kuolemaa. Seikkailunhalua se ei hänestä poistanut.,https://img.ilcdn.fi/oq2k7YyiljFJinJP2VoG66XRzGs=/510x318/top/img-s3.ilcdn.fi/d122028149698ab5f9e66a38dc9d17effa415399901e35269ee5f5d1ac592b5b.jpg,5D27EAD7B4A14A078A9246FD4BC253E3
2019-09-24T05:42:38.000Z,"Ari sai reilun hyvityksen, kun vaihtoi veneensä matkailuautoon – ”Turun saaristo alkoi olla nähty”","Kun lapsia ei enää saanut houkuteltua lähtemään veneelle, alkoi Ari Nurminen selvittää, voisiko hän kirjaimellisesti vaihtaa sen matkailuautoon.",https://img.ilcdn.fi/Jumkt1nBSNJF_siPdpdPW0Mv3_8=/510x318/top/img-s3.ilcdn.fi/52a86196e8fb0e7b7cd7ab3a0d6cf75cabfbec0c6f06b7a318f5d4ac02f83ae5.jpg,6FF2E84912FD458EB7341656DFF2E7A2
2019-09-24T05:51:17.000Z,Suomalaisilta kerättiin ennätysmäärä veroeuroja - katso kattava listaus tai ,"Suomalaiset maksoivat viime vuonna ennätysmäärän veroja ja veroluonteisia maksuja, vaikka veroaste laskikin.",https://img.ilcdn.fi/LL3S02NFfwjbyev0k7iX0m_EVXU=/510x318/top/img-s3.ilcdn.fi/fca89b02b02d8f72bae340eb721c046058daf0a920e3708c92bf9d530e0a7fd4.png,B8E0BB57AFCB45079B613E1D174A950E
2019-09-24T05:58:10.000Z,IL seuraa suorana: Tässä on uusi Roosa nauha ,Tämän vuoden Roosa nauhan on suunnitellut näyttelijä Seela Sella.,https://img.ilcdn.fi/g6QvptbgGLg7JyC_yDsYOb0oA3Q=/510x318/top/img-s3.ilcdn.fi/426d4001166610fd9232c185d41945963ca4b64bd813165dfcf0e0eadd2af1c3.jpg,6FD5B4DDA80C4A22B4EF3E42376AC5E4
2019-09-24T06:00:00.000Z,Uusi Toyota Camry tarjoaa kuljettajalle parhaat japanilaiset herkut - mutta vasta takapenkille istuminen loksauttaa leuat kunnolla auki,Toyota Camry edustaa japanilaismerkin vaurainta päätä ja tarjoilee runsaasti luksusautojen ominaisuuksia. Jos pitää Toyotasta ylipäätään ja Camryssä monet parhaat Toyota-ominaisuudet on paketoitu yhteen.,https://img.ilcdn.fi/Pg_QERaEKW3wfJjm3wqWTCiOjSM=/510x318/top/img-s3.ilcdn.fi/b667c31fceefc26ac9d44ee61fec5e03878c0b82cd2b780f0d8526eab043a860.jpg,D9C7F9C8E84042F9B73EFCC72E374E67
2019-09-24T06:04:29.000Z,"Antti Holma irrottelee räävittömässä radio Sodomassa – aiheet löytyivät googlettamalla: ”Poliitikkojen mokat, poliitikkojen sekoilut...”",Podcasteissa vilahtaa uudella kaudella lukuisia julkisuudesta tuttuja henkilöitä. ,https://img.ilcdn.fi/7-3Lc0X24-fsU2116wgBDUT_j5c=/510x318/top/img-s3.ilcdn.fi/754706aa551015438c905e6addb8a9d04d70bea6c72e35999d2c5923de8d681e.jpg,EC433218B98143D29B1BC08CA5C2B343
2019-09-24T06:07:07.000Z,Kiistelty F1-uudistus jakaa mielipiteet kahtia – Jyrki Järvilehdolla selkeä näkemys viime viikot puhuttaneeseen lippuasiaan: ”Nyt on hyssytelty useampi vuosi” ,"Mustavalkoinen lippu, varoitus, otettiin F1-sarjassa uudelleen käyttöön elo–syyskuun vaihteessa Belgiassa.",https://img.ilcdn.fi/5BRL3_uG0C8Ds7t3AV_qKO2eJYY=/0x0:3000x1876/510x318/top/img-s3.ilcdn.fi/df0dc98b0ea83aa7341160e89e4788320b8a8d28ceba5506c7443a05be30b8a6.jpg,17757883EE174DC59C13EEB4CD9FFA6E
2019-09-24T06:19:43.000Z,"Minnan marjasmoothie tarjoillaan omenasta - ”Enää ei tarvitse nuolla kupin pohjaa, kun voi syödä koko kupin”",Perinteisen marjasmoothien voi tarjoilla myös syötävästä kupista.,https://img.ilcdn.fi/MvulMDiHCuL_5z-LXTmgiCRuA-Q=/510x318/top/img-s3.ilcdn.fi/00a8e616bea554a560047fa7405e1d38b37dc368edf91d198b5353db846e63b0.jpg,676DD694331846E1B2E616B03F62FE40
2019-09-24T06:22:30.000Z,Siilinjärven Eurojackpot-kaupan kauppiaat vaihtuvat - nykyinen kauppiaspari ”ottaa aikalisän”,Siilinjärvellä voitettiin ennätysmäinen 92 miljoonan potti.,https://img.ilcdn.fi/XYHxfpFHDoyYGqBDa29xf1SC10s=/510x318/top/img-s3.ilcdn.fi/f8014377a38676486dd6f165a6d9996dd6623e2b3f24fcbf44f2b9886d675d7c.jpg,BE5C197B5F2A4F3193606D003535F79A
2019-09-24T06:28:01.000Z,"Nämä ovat aggressiivisimmat koirarodut - Isot rodut viihtyvät otsikoissa, mutta totuus voi yllättää","Pienet seurakoirarodut ovat kahden laajan tutkimuksen mukaan aggressiivisimpien koirarotujen kärkeä, mutta isot rodut saavat aikaan vakavimmat ja jopa kuolemaan johtavat vammat, kerrotaan suomalaisen tutkijan uutuuskirjassa.",https://img.ilcdn.fi/75Z1kXGpwT6Yw4fLeVF81BHMHv8=/510x318/top/img-s3.ilcdn.fi/8e6859acb0c5ecc507ce1426abe4bf1d81cab863a6176b7f1b651109565c19be.jpg,19F7C5D094A447E4846F4BB012A4EA32
2019-09-24T06:38:43.000Z,Tyrmätty nyrkkeilijä kuoli - traagisen kohtalon taustalta paljastui huijaus: ilmoitti Facebookissa olevansa elossa,Bulgarin Isus Velichkovin luultiin kuolleen kehässä saamiinsa vammoihin. ,https://img.ilcdn.fi/Y_-QWbZyKLjkOIAL4Y01GkTOGF4=/510x318/top/img-s3.ilcdn.fi/a7a502df2676ab46c091c9d89240d1b2ede1b1cfe0b8ef02b6d33a02c3f32c37.jpg,2FFB96AE1A864BEC96B14E1F179890E5
2019-09-24T06:42:44.000Z,IL seuraa Jessikka Aron uutuuskirjan julkistusta – Luvassa paljastuksia Venäjän vaikuttamisoperaatioista,Kirjassa kerrotaan Suomessa ja muissa länsimaissa viime vuosina toteutetuista Kremlin masinoimista operaatioista.,https://img.ilcdn.fi/hLXiP_oErUXYLhQrZS6t2DscU6E=/510x318/top/img-s3.ilcdn.fi/0ebb0295a69acd70de2784100f2327a35706eb56f2a600ffee428db23c85c4f0.jpg,7046CF9A291545DCB4FEACC1AA64E5AC
2019-09-24T06:44:20.000Z,Ensimmäinen virallinen pari Love Island Suomessa: ”Ollaan menty rakastumaan”,"Olisitko uskonut, että tämä pari saa ensimmäisensä tunteensa ilmoille?",https://img.ilcdn.fi/oZVAEvqW724hUvKNWxAp4hVsJGw=/510x318/top/img-s3.ilcdn.fi/b3190a041d08d53f621addce936a40e49e87578aa3fff06a7ac74810b9a4ea63.jpg,0A8D1C3388BE465384DDD7B61C469B33
2019-09-24T06:58:02.000Z,Vastuullisuutta korostaneen suomalaisen Balmuirin tuotteita tehty surkeissa oloissa Intiassa - kertoo nyt lopettavansa ostot työpajasta,"Keväällä uutisoitiin, että Balmuirin intialaisen alihankkijan tehtaan työoloissa on puutteita. Nyt luksusbrändi kertoo ryhtiliikkeestään.",https://img.ilcdn.fi/QBoANESiKVrGe6OOdZ3dsGnA9po=/510x318/top/img-s3.ilcdn.fi/829cfdac8963aab8850a16992a09d9253714812f49091105133d0afc45320900.jpg,15C3763FC3554664A9920B59B1DA1074
2019-09-24T07:00:42.000Z,Tässäkö syksyn hauskin leffa? Antti Luusuanniemi ja Aku Hirviniemi tähdittävät kotimaista komediaelokuvaa – katso traileri!,Täydellinen joulu saa ensi-iltansa elokuvateattereissa 25.10.2019.,https://img.ilcdn.fi/0xmiFE6HUZVyCEuPZl1_iCbdInA=/510x318/top/img-s3.ilcdn.fi/527b2926ff97dcec0cfb76b9bbd913cdb92c6bfd4b9bcd11b86933daa598cdba.jpg,1D55DE07F73B4EFAB29D90A4FE2180BC
2019-09-24T07:01:04.000Z,Ruuan hinta nousee – rajuimmin kallistuvat tänä vuonna lihatuotteet,Pellervon taloustutkimuksen ennusteen mukaan ruuan hinta nousee Suomessa tänä ja ensi vuonna. ,https://img.ilcdn.fi/W7_7cXrxxwC4AQlh2HvQM7N805Y=/510x318/top/img-s3.ilcdn.fi/67bcdce262ec2e3282e17213a15d067563c859ff20c626202983f4fd1639e212.jpg,51E4AD0BA1C448E094FF5E0DCCA09A17
2019-09-24T07:04:04.000Z,Ilkka-Yhtymässä alkavat yt-neuvottelut - Ilkka ja Pohjalainen yhdistyvät,"Ilkka-Yhtymä suunnittelee kahden päivälehden, Ilkan ja Pohjalaisen, muuttamista yhdeksi mediabrändiksi.",https://img.ilcdn.fi/QljWYb_OscroClz0Hl2So_H47Ow=/510x318/top/img-s3.ilcdn.fi/4b2f8110e6297c6d1eeb5a071d83a4c7810b3e69874fc7027a2e88814c6bfdce.jpg,B91373FE57E849F388CBECC8FE2AF16F
2019-09-24T07:10:31.000Z,"STT: Neste maksoi vuosien ajan palkkaa johtajalle, joka ei ollut enää töissä – Tilille kilisi yli 600 000 euroa",Johtaja kertoo ottaneensa rahat vastaan vilpittömässä mielessä yhtiön kanssa tehtyjen sopimusten mukaisesti. Asiasta uutisoi STT.,https://img.ilcdn.fi/E5NlH1-C0LmHs4q9VgFRzOVL3jM=/510x318/top/img-s3.ilcdn.fi/84f143e61bf29f970ff395e2ea3ba63dca6cf7a5978123bad135b93d1531bb87.jpg,90FD942A7B0F41C58A794338AF71FFB5
2019-09-24T07:23:01.000Z,"Vau, mitä naisia! Miss Suomi -finalistit poseeraavat aistikkaissa bikinikuvissa – voittaja kruunataan lauantaina",Miss Suomi -finaali lähestyy. Tuoreissa valokuvissa missit esittelevät uikkarimuotia.,https://img.ilcdn.fi/R8JvHxl5Yh54oq2Yw_mGfZVwIXQ=/510x318/top/img-s3.ilcdn.fi/26775400c3baadb2518cd7367e8b18689331cca7aa3e92b24c8151a42f4b0421.jpg,E646AFDA4ACE47F583A88D06DA30A18E
2019-09-24T07:25:30.000Z,Reikä aavikossa - epätodellinen näky maailman kuumimmassa kolkassa, Paikka löytyy Etiopiassa sijaitsevalta Danakilin suola-aavikolta.,https://img.ilcdn.fi/ekwMV7KuBZ12CJngFLEHs2SDTN0=/510x318/top/img-s3.ilcdn.fi/a4a7e2a22ce655d9e004da02d24df365b5f4b32e610c2c614f54fb3aabe3df63.png,FCE5472704AE4DB896DB60202822DCD6
2019-09-24T07:32:19.000Z,SaiPalta todella kova värväys! ”Niiralan Maltsev” tekee vierailun SM-liigaan,Tuomas Kiiskinen palaa SM-liigaan. ,https://img.ilcdn.fi/vD81jLh_sdydAvOCX0Q5_QR9c48=/510x318/top/img-s3.ilcdn.fi/6e422a3891b0ac5a21fadf366f31a63a3f4f64bffb8c8892f3d8e258b816a047.jpg,E475A1C683074258882E6ED76B8FA0DA
2019-09-24T07:33:13.000Z,Seuraa suoraa lähetystä eduskunnasta: Li Andersson kertoo tulevaisuuden suunnitelmistaan,NULL,https://img.ilcdn.fi/4HssyNqwHpf6j9DZzlMyta5puQA=/510x318/top/img-s3.ilcdn.fi/cf0c521e643efdea7d65124dde1dc8f20c258ce2be75e5ec78a7c6f9799d2aff.png,121955B463F74551AAB6EDC6CAD810D3
2019-09-24T07:36:44.000Z,Sviittejä ja lasipyramideja - talveksi luvassa taas uutta revontulimajoitusta,Pohjois-Suomeen nousee koko ajan elämyksellistä majoitusta. Tässä tämän talvikauden uutuuksia.,https://img.ilcdn.fi/djUSNmSxayVDaYcXLpgPiNrMxBQ=/510x318/top/img-s3.ilcdn.fi/c961304bb04e8d77df40ffe32eb310a18c481d4fe61047826d483869628aaf58.jpg,DA14AD6701954C72838D5A1DD1A3C756
2019-09-24T07:46:50.000Z,"Mies kiipesi tavarajunan katolle ja sai sähköiskun – Vaatteet syttyivät tuleen, juoksi pelastajia karkuun",Erikoinen välikohtaus tapahtui Lahdessa ratapihalla myöhään maanantai-iltana.,https://img.ilcdn.fi/XmSxsfBFA4M-b0on99MgVmkX2dc=/510x318/top/img-s3.ilcdn.fi/4d52c986ddc7fadcaf1ca8fb8162dc95aff43bee6e341a03ff10c218548e3698.jpg,872093BD2A46459F88149C2F76E90F10
2019-09-24T07:59:00.000Z,"Demi Moorelta shokkipaljastus: Oma äiti myi 15-vuotiaan tyttärensä rahasta seksiin kohtalokkain seurauksin – ""Hän laittoi minut tarjolle""",Demi Moorelta ilmestyy tänään elämäkertakirja. ,https://img.ilcdn.fi/NY0nhOPbFaU4MyCYS-dpGSj8G0g=/510x318/top/img-s3.ilcdn.fi/c32471760f37df098f61d9a89a733091cffc81d2a67cf05a53fe85f779f094ea.jpg,9E25A61CFFF643CF87349B8826071813
2019-09-24T08:04:20.000Z,Media: Trump jäädytti sotilasavun Ukrainalle ennen väitettyä painostuspuhelua Zelenskyille ,Yhdysvaltain presidentti määräsi keskeyttämään sotilasavun Ukrainalle ennen puheluaan Ukrainan uudelle presidentille.,https://img.ilcdn.fi/zz8duloSs8HXBvT5ff-hVcrz_IY=/510x318/top/img-s3.ilcdn.fi/82fe6e345f28c37b9270635502bd520317042a764f10fb796c45c64885c33e48.jpg,95F0F30AB72C4E0D8E9659F860BCF7E9
2019-09-24T08:09:01.000Z,Kutsu sinulle! Tule ystäviesi kanssa malliksi Vero Modan ja Tyyli.comin muotikuviin,Pääsette kokeilemaan ensi kauden juhlamuotia jo ennen kuin se on saatu kauppoihin.,https://img.ilcdn.fi/b49jux18buAMPFxlxODasp9bNxA=/510x318/top/img-s3.ilcdn.fi/bb5ac1ba69012a3ac183e918744ca8a5902f0e2c002cfba6b338853ed9990496.jpg,33F455003FB047A19B33797F7E96EA81
2019-09-24T08:09:04.000Z,Tunnissa viidenkympin tili nettona - Perhe voisi tienata ulkomaanmatkan marjastuksella,Valtaosan myyntimarjoista keräävät ulkomaalaiset. Suomalaisten saaminen marjametsään on vaikeaa.,https://img.ilcdn.fi/xDyjR3bffFEK6OYu-ISjU7Aym5s=/510x318/top/img-s3.ilcdn.fi/9d16940b269575d18286d80dd1785374a70cd0c7ba0fb0bcd74de63fc0e0f839.jpg,F01741BB77BB45A8A258C52A324A461D
2019-09-24T08:11:29.000Z,Skandaalivideo paljastaa juoksijat piikittämässä – Keniassa asuva suomalaisvalmentaja dopingkohusta: ”Aika selkeästi yhdestä lähteestä”,"– Kyllähän Keniassa on ollut ongelma jo pitkään ja kiinnijäämisiä on tullut, Keniassa asuva kestävyysjuoksuvalmentaja Simo Wannas toteaa.",https://img.ilcdn.fi/NRM0HEKz6fBY3ePsrFH6-vdtklE=/510x318/top/img-s3.ilcdn.fi/6094f50040b084052a7839395a75fc7f87ed103300d86aea3028f0b8da6e2b75.jpg,A5C65E87F915417080139ED08B3F7ABD
2019-09-24T08:20:30.000Z,Romanimies ei saanut palvelua huoltoasemalla: videoi kuohuttavan tilanteen – Välikohtaus johti myyjän syrjintäsyytteeseen,Syyttäjän mukaan huoltoaseman myyjä on esitutkinnassa kiistänyt menetelleensä lainvastaisesti. ,https://img.ilcdn.fi/I0RHRm0_ciWHDPdQBhiJmPNrEIk=/510x318/top/img-s3.ilcdn.fi/5bafa9d8a0ac15f2373942695b3919209b9ec2b75beee4b3b1d00d807f888de7.jpg,DB3FC0B068554C7ABE6926CA4E202F83
2019-09-24T08:27:46.000Z,Tuntematon mies löi bussia odottanutta espoolaismiestä kasvoihin teräaseella – uhrille vakava vamma,Lyönti aiheutti espoolaisuhrille vakavan silmävamman.,https://img.ilcdn.fi/AL42c3Rf-JWUV3fE5Oglo98r9ps=/510x318/top/img-s3.ilcdn.fi/b51c787e74754920359f85a7ed1f4f50e3e0cb2b4e91ca99ebe671bebd1621ac.jpg,09A8C573A19A4764954A7313EC4DD7FA
2019-09-24T08:30:44.000Z,"Rintasyövästä toipuva Sari Essayah, 52: Rintasyövän seulontaohjelmaa laajennettava – ”Ei ollut mitään oireita”","KD:n puheenjohtaja, kansanedustaja Sari Essayah koki henkilökohtaisesti, miten tärkeitä rintasyöpäseulonnat ovat.",https://img.ilcdn.fi/Kw82DZBWGqkutuBMuNfw2VtbBG4=/510x318/top/img-s3.ilcdn.fi/ca19e59552adc7577d46b393fbe521752e691d235c9f4877552a789d9f3206a5.jpg,06BA314C9DDD4D0ABD53100C1E74993C
2019-09-24T08:34:29.000Z,Löytääkö Jesse Puljujärvi sihtinsä Hakametsässä? Kotijoukkue on lähtee SM-liigan huippuotteluun suosikkina ,Tiistain huipputapaus on Liigan toistaiseksi tappiottomien kärkijoukkueiden Tapparan ja Kärppien kohtaaminen Tampereella.,https://img.ilcdn.fi/dGkU5wtVfgtdpJCmzqV0iJk7egc=/510x318/top/img-s3.ilcdn.fi/850ee0229bb707312d5c63dccc8382a66e2b2b09eac243b4a3052db53252e9ad.jpg,1473B10AAA0641DCB37B465BBFA0FBA0
2019-09-24T08:38:22.000Z,Tässä ovat uudet Temptation Island Suomi -pariskunnat – mukana yksi avoimessa suhteessa oleva pari,Temptation Island Suomi starttaa pian uusin jaksoin. Ohjelmaa juontaa tuttuun tapaan Sami Kuronen.,https://img.ilcdn.fi/NmYFAcbpbgnNVnvEkwR-88W7p7k=/510x318/top/img-s3.ilcdn.fi/cf6e5c459c259080696b904e8627406207fa99e8bf1db995975736ce18df4688.jpg,7E52CD1755BD498A95B0DAE85420754D
2019-09-24T09:08:46.000Z,"Putinin trollit -kirjan kirjoittanut Jessika Aro avasi tiedotustilaisuuden kylmäävillä sanoilla - ""Pelkään henkeni edestä julkaistessani tämän kirjan""",Toimittaja Jessikka Aron teos Putinin trollit - Tositarinoita Venäjän infosodan rintamilta julkaistiin tiistaina. ,https://img.ilcdn.fi/gZ3v60vfYbQfMKorJG34oKG6aNU=/510x318/top/img-s3.ilcdn.fi/b62234a4f549387a75f03456184259a02b3c3834da574a5acba50a1213f9f14b.png,766C0CDF58534D7285534198D5BD355C
2019-09-24T09:11:29.000Z,"Arvostettu NHL-toimittaja: Patrik Laineen tilanne elää kulisseissa, esittää kaksi mahdollista ratkaisua - ”Seurat ovat uteliaita” ",Aleksander Barkov puhui Patrik Laineesta Sportsnetin haastattelussa. ,https://img.ilcdn.fi/R3Lz_e1C-RfTPt04yYpdLuvM-TQ=/510x318/top/img-s3.ilcdn.fi/3b0a5e854c95ce9f8f8b6a9592e77be8f6e08f4cad1d3d5552262a0d474912a7.jpg,E6B9AFFCFEFC4A14A1074EC5BCC517ED
2019-09-24T09:20:52.000Z,Yleinen silmävaiva voi pilata täysin Kaisa Mäkäräisen kisan: yksinkertaista itsehoitorutiinia ei saa koskaan unohtaa,Silmien terveys on tärkeää jokaiselle ihmiselle. ,https://img.ilcdn.fi/xAvAKr8bzBxit7FcE3Yke975Wio=/510x318/top/img-s3.ilcdn.fi/0e6c3352e03b645368efa90a9c559f61a37e05bdcafbf805f71d597a414a2885.jpg,CC0D29E5CED6464EA6FC14791DB1A8F9
2019-09-24T09:21:33.000Z,EU-kokous aiheuttaa jälleen isoja ruuhkia – vältä näitä reittejä Helsingissä,EU:n maatalousministerien kokous tukkii tiistaina iltapäivällä liikennettä Helsingin sisäänajoväylillä ja Kehä I:llä.,https://img.ilcdn.fi/6PAwtQp7shP7ox1Zm1f6Pt3cE5Q=/510x318/top/img-s3.ilcdn.fi/381319075f041c455e6d9df71aace545c8289caba2ee3769135f0c419ceb73b6.jpg,A25F5F1861754EBEA01D281D96CB787D
2019-09-24T09:23:09.000Z,Mystinen rikosilmoitus: 10-vuotias pyöräilijä jäi suojatiellä auton alle Espoossa – poliisi kaipaa lisätietoja,10-vuotias polkupyörällä Espoon Henttaalla liikkunut tyttö kaatui suojatiellä henkilöauton osuttua häneen.,https://img.ilcdn.fi/KOLWE0CTFxYRHMCJXeVhoiy5LDA=/510x318/top/img-s3.ilcdn.fi/8a4a0bbfeaa86b561c579a4bd60dee9e90cf1f13fa29e6270c21ca50bf5931c4.jpg,F661C3AC32F842A898575BEF9DE38BA4
2019-09-24T09:44:18.000Z,Britannian korkein oikeus päätti: Boris Johnsonin määräämä parlamentin jäädytys oli laiton,Jäädytystä ovat puineet ennen korkeinta oikeutta jo kaksi oikeusistuinta.,https://img.ilcdn.fi/m5rMlpRz4uKPjsnAisw8Is1675E=/510x318/top/img-s3.ilcdn.fi/eecfe8e1261adbdb4eb76062d40abcbe42fafc701d55f3fe7b018cd524c4e011.jpg,F6198D7DB5774B9C8FAD464B01604D0B
2019-09-24T09:49:16.000Z,Candice Swanepoel kuin keiju! Huippumallin iltapuku on superimarteleva,Victoria’s Secret -mallit juhlivat Milanon muotiviikolla. Näistä ei iltapuvut parane.,https://img.ilcdn.fi/TfB1gDRFmBJjXdiKz3o06iwTLgk=/510x318/top/img-s3.ilcdn.fi/8f28a3d730fa42a2c01500cab45ea86ff7ad9672f52e389d18126b35f9571d49.jpg,0CCB8F8947A94256A12FC3A553967A00
2019-09-24T09:53:46.000Z,Utelias maitovalas ui tervehtimään melojaa – nappasi kameran lainaan,Valas oli uinut melojan perässä aivan rantaan saakka.,https://img.ilcdn.fi/RenBeQXFdGWVa3CCbPougFx8T6o=/510x318/top/img-s3.ilcdn.fi/8f00f4eb9fd801faedbcb811723d931dba449a4c67e266372a9cd5177ea0637c.jpg,5643AD2489464379ABD748994506E1F8
2019-09-24T10:01:10.000Z,Big Brother: Ilman seksikumppania jäänyt Jukka avautui: ”Siihen on syynsä miksi mut on valittu ” ,Jukka etsii paikkaansa Big Brother - talossa.,https://img.ilcdn.fi/PKxZvRI5O7zQW1VeVLbK_tmQWXk=/510x318/top/img-s3.ilcdn.fi/d42aa232055433c2f7758d79af58e8d8e3448e56ae8db44a57200e90d2f56abd.jpg,4004AE1925B34893A37C05E98E2BC5A8
2019-09-24T10:11:37.000Z,Diktaattori Francon jäänteet siirretään pois Kaatuneiden laaksosta - Espanjan korkein oikeus päätti pitkän riidan,Hallitus ja hirmujohtajan jälkeläiset ovat tapelleet jäänteiden siirtämisestä yli vuoden.,https://img.ilcdn.fi/o3Nfimu_zJ_w28MWNeku844c1XA=/510x318/top/img-s3.ilcdn.fi/54a6fa5d0ae61f1261149a0d24fb8b7988f6ac4052c73a4c2ebb49a921258932.jpg,218494B785244298B7A8F0233F62DD5B
2019-09-24T10:15:08.000Z,Yleisurheilun entinen huippunimi löytyi kuolleena kotoaan USA:ssa - maailmanmestarilta koskettava viesti: ”Me menetimme todellisen ikonin”,Jarred Rome löydettiin kuolleena kotoaan Washingtonissa. ,https://img.ilcdn.fi/xiLj31I4hiZOLXqmtUKZloYxBDE=/510x318/top/img-s3.ilcdn.fi/a266e850af736342ab76c809ff3dacb8dab192bc48ca065afe24d4ad42fc0447.jpg,52E7F73A3A0B424CA0F6DD493A7C13EB
2019-09-24T10:16:54.000Z,Kärppien tähti Jussi Jokinen pitkään pelikieltoon – myös Tapparan hyökkääjä sai sanktion,Liigan kurinpitodelegaatio on määrännyt Kärppien Jussi Jokiselle kahdeksan ottelun pelikiellon lauantain JYP–Kärpät-ottelussa tapahtuneesta päähän kohdistuneesta taklauksesta.,https://img.ilcdn.fi/hPu2ppgfgGoACeOPn3HIRhxVz58=/510x318/top/img-s3.ilcdn.fi/a8808d5daf902a3976b1073782cb12c9c51bff5e7289687763eb117616572a81.jpg,4060952DD1AF4204AE15A51A574D44CE
2019-09-24T10:20:14.000Z,Samsung ohjeistaa käyttäjiään varovaisuuteen yli 2000 euron uutuuspuhelimen kanssa,Samsung kertoo videoilla Galaxy Foldin hoito-ohjeita.,https://img.ilcdn.fi/zIK-BxXj20AiCJG_7Mh3r8F-7ng=/510x318/top/img-s3.ilcdn.fi/4164801bb76e16fc3a4afb3f8f3100e00aa5c1eea7512220e06eb077c4f34a53.jpg,CBAD8142744C439591FA6CE0AB31B82F
2019-09-24T10:36:44.000Z,Seksuaalirikoksista syytetyn Epsteinin Pariisin-asunto tutkittiin,Poliisit tutkivat myös Karin Models -mallitoimiston Pariisissa.,https://img.ilcdn.fi/I7zpMCLJ9jXYUHLBHuRoKPGfKmc=/510x318/top/img-s3.ilcdn.fi/da8c561239be3a79eb3cc4feba877400458b51e076ac55f6e274cc8b51177c02.jpg,DFDB45345EA94F44BD05187D18E95ACF
2019-09-24T10:41:36.000Z,Kauhuleffaikoni Sid Haig joutui rajuun onnettomuuteen ja kuoli,Kauhuleffojen genressä maineeseen noussut Sid Haig kuoli 80-vuotiaana. ,https://img.ilcdn.fi/d7LyEZzx6F8kptltmWZO7zq5Kl8=/510x318/top/img-s3.ilcdn.fi/4fb3cdd28c86a1ff3830c6e203f6f22b95b4697bc569dc8615234d63241b1470.jpg,AE71B2D55985430ABF127D53EDB4C340
2019-09-24T11:12:07.000Z,Tämä riemu tarttuu – Dallasin eläintarhan Gorilla otti ilon irti kylvystään ,Eläintarhan gorilla Zola pisti läiskeeksi ja lätinäksi.,https://img.ilcdn.fi/yvC93wAVVE9TfPrYP8Es7xau1ZE=/510x318/top/img-s3.ilcdn.fi/88ff9b92d333be1da0f6779b3f606ee4a78e99e75c497e293687b44d60f6c1ba.jpg,082286CC4D4947F79D69EBB6B85BAB5D
2019-09-24T11:12:17.000Z,Suomalaiskehonrakentajalta mahtava suoritus huippukisassa – Arnold Schwarzenegger huomioi upealla tavalla! ,Mika Sihvonen nappasi loistavan sijoituksen Arnold Classic Europessa.,https://img.ilcdn.fi/pqvuAzhUNaYm7CLKvHHbloMFSGU=/510x318/top/img-s3.ilcdn.fi/91a512be4d9a7ee8a7338924febc7dedfc4f032af40943644b99ba1053c8bf9c.jpg,B011A0E0840A45ACA6215274EB498F13
2019-09-24T11:12:50.000Z,Viiden tonnin Passatia piti korjata 3500 eurolla - myyjän mukaan ”auto oli myyty vikoineen”,"Mies osti 12 vuotta vanhan Volkswagen Passatin, joka osoittautui kaupan teon jälkeen paljon odotettua pahemmaksi vikapommiksi. Myyjän mukaan oli sovitusti myyty ”vikoineen päivineen”.",https://img.ilcdn.fi/iXD4ccKCYQQne4WDizzEDnWA6sI=/510x318/top/img-s3.ilcdn.fi/fb335b536bee62fee623a479790b0484715d289d103d2c7ff70d050247800469.jpg,1F3E09D417274C8D9605789CD6D3635E
2019-09-24T11:25:25.000Z,"Greta Thunberg joutui aikuisten pilkan kohteeksi USA:ssa, myös Trump oli mukana - Fox Newsissa ruotsalaistyttöä haukuttiin mielisairaaksi",Ruotsalainen ilmastoaktivisti Greta Thunberg joutui pitkin maanantaipäivää Yhdysvalloissa aikuisten pilkan kohteeksi.,https://img.ilcdn.fi/TybfwPaw0sclKzv2SyTOrDnnw-g=/510x318/top/img-s3.ilcdn.fi/3790723cc170e07e01322ee2bcf9948c4dc50a99186a5eb4331d3b4ed25efae3.jpg,2545B9EDFB74431FACDADAA5B05CC423
2019-09-24T11:41:59.000Z,Poliisi voimaton pääkaupunkiseutua piinaavan kaaharin edessä: kortiton kuski kolaroi ja ajoi lähes 30 kertaa ylinopeutta kahdessa kuukaudessa,Poliisin liikenneturvallisuuskeskuksen johtajan mukaan kuskin toiminnan keskeyttäminen pakkokeinoin ei ole mahdollista.,https://img.ilcdn.fi/WX6cUso7qWuAdI5klKfqycwCch8=/510x318/top/img-s3.ilcdn.fi/cc7a92f5861d0fa6d86a2461a0ded07b272e27f542e7ffd452ead818605725e3.jpg,9F0BA255A6274C2FAD05A2915A6FFE92
2019-09-24T11:47:34.000Z,Alexander Stubbin rahakas pankkipesti sai yllättävän käänteen – Ruotsi pyysi jatkamaan tehtävässä,Alexander Stubb (kok) istuu Euroopan investointipankin (EIP) hallituksessa Ruotsin mandaatilla.,https://img.ilcdn.fi/UZ3vldk_N86CL0Gl_LUjdg_mJ10=/510x318/top/img-s3.ilcdn.fi/61838122ca051d739b7de65c0e3ef00d7f8e07e8648cc2dc0e8c3028c79ad339.jpg,900A08B2124F45709865AD9E9FC14E17
2019-09-24T11:53:51.000Z,Miksi Nelonen pimittää Big Brotherin äänestysprosentteja? Katsojat hämmennyksissä ,"Big Brotherista pudotaan viikoittain, mutta katsojat ovat autuaan tietämättömiä millaisella ääniosuudella.",https://img.ilcdn.fi/cSf7j7wpiLSpRFVMX5ZXJ8tPPqg=/510x318/top/img-s3.ilcdn.fi/c2276ab2696cf4797670a818a1e07ca933bf7b9e15cda04c34014b62ac2aab75.jpg,BD42EC91D47944A595A0A1D14A80E01D
2019-09-24T11:58:45.000Z,Seuraavat Patrikit NHL:ään? Tapparasta ponnistavat hyökkääjät ovat toisen polven huippukiekkoilijoita: ”Isän merkitys on ollut suuri”,Patrik Virta ja Patrik Puistola kulkevat isänsä jalanjälkiä kiekkomaailman huippua kohden.,https://img.ilcdn.fi/WlbsgA1LYzJT9v5JchHBMF_MjoQ=/510x318/top/img-s3.ilcdn.fi/f3cd395e4e12d5762ccd5a3ca84ec75136399fc7ae4cfba0cd0736f89f9552f7.jpg,F43F04D2B2DC439EBD068C0CE1240B9E
2019-09-24T12:16:39.000Z,Pelaajayhdistys kritisoi voimakkaasti SM-liigapomon lausuntoja Jussi Jokisesta: ”Loukkaa selkeästi pelaajan oikeusturvaa”,Pelaajayhdistys antaa tiukkaa palautetta Liigan kilpailutoimenjohtaja Arto I. Järvelän julkisuuteen antamista lausunnoista.,https://img.ilcdn.fi/f-opU0Uk8teEFUqP2DZETuildb0=/510x318/top/img-s3.ilcdn.fi/118f76bf6da09ad7035c20931c3781a45db358eb5ad12866ea85a3251b8da08e.jpg,0AD2A4D6E0084EF5BC2A440B9666E11D
