paivamaara,otsikko,tiivistelma,kuva,id
2022-10-12T19:42:48.000Z,Pekka Virta synkkänä liigajumbo SaiPan ahdingossa: ”Nyt on myös muita vähän isompia asioita”,Liigajumbo SaiPa kärsi Liigassa kuudennen tappion putkeen hävittyään Lahdessa maalein 1–4.,https://img.ilcdn.fi/TigQDlbOGK_7ri14obUSQ-Ma6F0=/510x318/top/img-s3.ilcdn.fi/6e83ed1fd720a97de3c279cb28a7d986cb4045e087afa42f5fb77213c92bb26e.jpg,87259B55BEA64BBAAEB4B68FB806A222
2022-10-12T19:54:42.000Z,"Ukrainan sota, päivä 231: Kreml uskoo, että torstaina Turkin kanssa keskustellaan rauhasta",Tähän artikkeliin on koottu keskiviikon tärkeimmät käänteet Ukrainan sotaan liittyen.,https://img.ilcdn.fi/_ioKICWnjzGHh7eAV3_aXW472Yc=/510x318/top/img-s3.ilcdn.fi/fe8e39746b6e70956a1eac5b2388e9d7bf340c146aa3b468901deffbec76ad0d.jpg,0F80F61836004B98A75A1C3642B797D3
2022-10-12T19:59:30.000Z,Kaksi naista uhrattiin ja keitettiin Intiassa,Naiset uhrattiin rituaalimenoin rikastumisen toivossa. ,https://img.ilcdn.fi/ToaO6piEctYhzOgvUtekSyAU7d4=/510x318/top/img-s3.ilcdn.fi/900158cfde8539d72e3f16ce061ac24b390ae922e2b8e78ef1b91a471b03f78d.jpg,E7FEB8D57B59435AB6631B7C78EC9BF1
2022-10-12T21:00:11.000Z,Uutuuskirja: Tällä ehdolla Paavo Väyrynen kannatti Suomen liittymistä Natoon 1992,Ex-pääministeri Esko Aho: ”Poliittiset käänteet ovat usein erikoisia.”,https://img.ilcdn.fi/7QlHchm4DphhZVTXCv8qB_hOiuw=/510x318/top/img-s3.ilcdn.fi/5c73ad0a8c742f94084a24577a986e7ed5a849371551af3269b110f652ad0ecf.jpg,4C06E8FB2D0247B9AC61EAC912114D69
2022-10-12T21:11:42.000Z,Barcelona ja Inter ilakoivat kuuden maalin illan,Barcelona oli lähellä putoamista jo neljännellä lohkokierroksella.,https://img.ilcdn.fi/oqhlwcHgpMdPQHxs75E8rLu6aCY=/510x318/top/img-s3.ilcdn.fi/f1d6e0ac3240a51d600c8dde1081d7beac27dd5f5af0b47f4133b1e75d7e53dc.jpg,329DB1397516482EB8098FDB53EA2B82
2022-10-12T22:17:51.000Z,22-vuotias rotkoon pudonnut nainen löytyi turhauttavien etsintöjen päätteeksi,Kadonneen naisen ruumis löydettiin yli kahden kuukauden valtavien etsintöjen jälkeen Kaliforniassa.,https://img.ilcdn.fi/_S9YaEf9cUNSyMUprB9BO53VAs4=/510x318/top/img-s3.ilcdn.fi/ef4e6aefbbf5d239665979762f591ee66523cdf35dca53a5a2cdc18ca3d2f55f.jpg,3910007C8C3041138756C1566D43DCD4
2022-10-12T23:01:39.000Z,Horoskooppi,NULL,https://img.ilcdn.fi/ZJX2nPQHLedeTO4nOGca4bZ5URo=/510x318/top/img-s3.ilcdn.fi/0e855f41645f17dbb2436f21bf69f40ac48d1971a147578985e2c64c1fb985d3.jpg,C5E3B087CDAF404F80D225A2B3F5CC55
2022-10-13T00:15:31.000Z,Elon Musk aikoo viedä miljardöörin Kuuhun,"Elon Muskin perustama SpaceX-yritys kertoo, että miljardööri Dennis Tito on varannut yritykseltä matkan Kuun ympäri.",https://img.ilcdn.fi/ctvK3iDmeLvxaaq1lCxz2s6ndYs=/510x318/top/img-s3.ilcdn.fi/eb99f21ddbfeb752b215a63917a5138f429cfde7585bfc6b374a1f745e9fc0b6.jpg,6A7D35D065E740E989F915B6F49D2A52
2022-10-13T00:55:15.000Z,Torstaiaamuna kannattaa varautua liukkaaseen ajokeliin,Yöllä lämpötila voi koko maassa painua pakkasen puolelle. Torstaina länteen ja pohjoiseen leviää vähitellen sateita.,https://img.ilcdn.fi/1LJEpkrnMuyhgwC2g__1GtR-BoE=/510x318/top/img-s3.ilcdn.fi/842474c168044e430bb706984ff702e22588cc89512237c393f76118631b03c1.jpg,45BCD24B80ED4F9D9E2F628D16251887
2022-10-13T02:00:05.000Z,Melissa Caddickin mysteeri hämmästyttää: Ratsia naisen kotiin johti katoamistemppuun – lopulta merestä löytyi jalka ,The Vanishing Act -sarja pureutuu australialaisen Melissa Caddickin erikoislaatuiseen tarinaan.,https://img.ilcdn.fi/-Wqj-WawQgDjMb8zSpkaRx2wdEY=/510x318/top/img-s3.ilcdn.fi/270fb519231b07b84140bba8782049c897ece91a800fb4858f514abb15aa4fb1.jpg,2EE80297A2A2409E92A28C6071CA9B40
2022-10-13T02:30:10.000Z,"Marianne kehitti itselleen työn, jota voi tehdä missä vain – bisneksestä tulikin menestys ja tänä syksynä perhe muutti Portugalin auringon alle","Marianne Lehikoinen perusti yrityksen, koska halusi työn, jota voi tehdä missä päin maailmaa vain. Tänä syksynä perhe myi omaisuutensa Suomessa ja muutti Portugalin auringon alle.",https://img.ilcdn.fi/HDNp0S2Wp5Xp04HybvYgffAU9wE=/510x318/top/img-s3.ilcdn.fi/0db69ec335bee7b41de164b449f55f5f252e0e258d92aeee20cb6b0e617ba4e3.jpg,4B44D94BD2A6491FAD5B6665DA5B9D84
2022-10-13T02:45:08.000Z,Patrik Laineen ilo loppui lyhyeen – täräytti avausmaalin ja loukkaantui heti,Laine ei palannut otteluun ylävartalovamman vuoksi.,https://img.ilcdn.fi/brAbfx5OPKZXogbgKgzxvvqLyvU=/510x318/top/img-s3.ilcdn.fi/656b270a00a894c8624240a48ecbe875cf08a5b685fc089e1c4774deb5bf09ad.jpg,B2809031B5294FBEBC80123E61D8A7A8
2022-10-13T03:00:00.000Z,Minkä F1-tiimin tallipäällikkö Otmar Szafnauer on? Pelaa 10 kysymystä!,Iltalehden perinteinen urheiluvisa on myös verkossa. Montako tiedät?,https://img.ilcdn.fi/H-UYQ60zmTz6fCyv8jAVDDmq6PU=/510x318/top/img-s3.ilcdn.fi/616cb315b709f6ab2322709d901c613ce20b1e887875677e59381be629d170be.jpg,C298A9E36A3D401BB41F33D8EA8E946D
2022-10-13T03:00:00.000Z,Huolettavatko autokauppahuijarit? Näillä asioilla pohjustat onnistunutta ostosta,Lähiaikoina on uutisoitu tuontiautoihin liittyvistä epärehellisyyksistä.,https://img.ilcdn.fi/7d9yjlWoSLmJr9rJdV42IsJaH8Y=/510x318/top/img-s3.ilcdn.fi/883a76930b475c011e8ff9603db65e9ad96b8edfa0050b63d46992057e72250c.jpg,FB77A4CA8973433A9EE020D12873165C
2022-10-13T03:00:23.000Z,Nopeasti sileäksi,"Vaatehöyrystin on kätevä apuri, joka pidentää vaatteen pesuvälejä ja käyttöikää. Vaatehöyrystin puolustaa paikkaansa erityisesti vaatteen pikasilittäjänä. Testasimme viisi laitetta, joista paras erottui selvästi muista.",https://img.ilcdn.fi/_z-D0jlE-UiqL2mEbvELs3uHC6Y=/510x318/top/img-s3.ilcdn.fi/3c2511bc7f6e7cfb3e3cac12262e4f48eeca2444e924c9a4d8b6553c74c351e9.jpg,87F1A1CDE5F646F18C51EDDC5CEB610D
2022-10-13T03:00:44.000Z,Näin Wolt-läheteille maksetaan – muutos raivostutti ruokakuskit,"Wolt muutti palkkiomallia, ja ruokalähetit hirmustuivat Tampereella. Iltalehti selvitti, mitä läheteille maksetaan ja mikä muuttui.",https://img.ilcdn.fi/waGtOnQtfTzojytiIcnGWzPRhVY=/510x318/top/img-s3.ilcdn.fi/0a0807f813030012a5320f3494895103e3caf031c2367ddc674863ab6b82d12f.jpg,731847CF30AB44D9A84E10058A390CBA
2022-10-13T03:30:00.000Z,Rautatableteista vatsavaivoja? Kokeile tätä modernia vaihtoehtoa,"Väsymys painaa ja olo on uupunut? Rauta on välttämätön hivenaine, jonka puutteesta voi seurata väsymystä ja voimattomuutta. Rauta- ja ferritiiniarvojen korjaaminen perinteisin keinoin on usein haastavaa, mutta näin se onnistuu helposti ja vatsavaivattomasti.",https://img.ilcdn.fi/Qx3qLMvXZkDaVLscR74VwIFahCw=/510x318/top/img-s3.ilcdn.fi/a37b2de84501c85ca57ffc9d0ed3f3cb6fdec702337456e84e300838ed2134eb.jpg,3869FB05D4F84310B30DB232C96FFD1A
2022-10-13T03:30:50.000Z,Pepe Willberg teki yli 50-vuotisen uran ennen ensimmäistä kultalevyään – yksi palkinto harmittaa erityisesti,"Pepe Willberg kertoo elämäkerrassaan, että tuli palkituksi väärin vuoden 2014 Emma-gaalassa.",https://img.ilcdn.fi/YVr0fGiVBTntWClEfMTym-zkllQ=/510x318/top/img-s3.ilcdn.fi/74bd57cfb810283918f4b2a67181635fd216f6ec0dc97de7589d92d9276cd559.jpg,D4AACB7E9F494CF1AD81E7682238780B
2022-10-13T03:32:00.000Z,Hiihtoon raju uudistus – Iivo Niskanen vastustaa: ”Tietyt asiat ovat pyhiä”,Niukka enemmistö Suomen hiihtomaajoukkueesta kannattaa naisille ja miehille yhtä pitkiä kilpailumatkoja.,https://img.ilcdn.fi/MbJil9GR8OBwxk6IVzDA_bYKGn0=/510x318/top/img-s3.ilcdn.fi/167e5bfda3a5f3d8eeecc0097b2fbebefe065880a86a77235e8bfb26f54b2290.jpg,44B10A00BCF5401AB6F31AB341A47071
2022-10-13T03:32:36.000Z,Eläkejärjestelmän tilanne löi asiantuntijan ällikällä: ”Maailman kahdeksas ihme on koron korko”,Eläketurvakeskuksen ennusteen mukaan eläkejärjestelmän tulevaisuus on aiempaa vahvemmin kiinni sijoitusten tuotosta. Vaikutukset tuntuvat kaikkien kukkarossa.,https://img.ilcdn.fi/pahYb5t9PQxPxC-miILczcfugas=/510x318/top/img-s3.ilcdn.fi/63a927e1e9e50d72520f3faaa8e22ead28c45b44f92e60eb965c4b51863b19e9.jpg,9A3CB43B64E54A93A08F69EF37C6A638
2022-10-13T03:45:00.000Z,Uusi tapa tuottaa terästä voi vähentää Suomen hiilidioksidipäästöjä saman verran kuin yksityisautoilusta luopuminen,Elämä ilman terästä on mahdoton ajatus. Samalla sen tuotanto aiheuttaa seitsemän prosenttia koko maailman hiilidioksidipäästöistä. Siksi Vattenfall on kehittänyt yhdessä SSAB:n ja LKAB:n kanssa menetelmän tuottaa terästä fossiilivapaasti.,https://img.ilcdn.fi/1QshVHc_gZ76YHf7HgkKOw4CWBE=/510x318/top/img-s3.ilcdn.fi/fee68b3ca2d94299a9f81b9b81b40b8deab9b378576e090aaff992cbd89b12ca.jpg,5C1CC200F39342719950D77DAFE5F2AE
2022-10-13T04:00:00.000Z,Bloggaaja Natalia Salmelan tehokas arki onnistuu kolmen laitteen kombolla – palaverit hoituvat jopa leikkipuistosta,"Helsinkiläisen yrittäjä ja bloggaaja Natalia Salmelan perheen kaikki menot jaetaan yhteiseen kalenteriin. Hän osallistuu palavereihin leikkipuistossa, ja kirjan luonnostelu hoituu kotisohvalta. Tehokas arki onnistuu älykellon, kalenterin ja kuulokkeiden yhdistelmällä.",https://img.ilcdn.fi/6-5zdCvePN_kdlzSo5NgFsxVHUI=/510x318/top/img-s3.ilcdn.fi/c144e1b523fbfd378da7602c180792faf72071b0c62d79a5dfcf0efd77810b4d.jpg,AC92EE6B445C4FDD95102D7547FD808E
2022-10-13T04:03:19.000Z,Prinsessa Madeleine julkaisi tuoreita kuvia tyttäristään – yhdennäköisyyttä suvun naisiin,Varsinkin Adriennea verrataan kuningatar Silviaan.,https://img.ilcdn.fi/_YZuY3Ta9oGyoVXtWvjpi4E37dI=/510x318/top/img-s3.ilcdn.fi/bcb81a83c2bd56ba9ad95f72331f78220552929f0591f8beeb40808cd4ddda94.jpg,6EA0DDBF1B2E4F77A057128522A1AEDD
2022-10-13T04:03:49.000Z,Artturi Lehkonen jahtaa hattutemppua! Coloradon suomalaiset mahtivireessä  ,Colorado Avalanche esitteli mestaruusviirin kotiyleisölleen.  ,https://img.ilcdn.fi/uToylIYc2ODnJ-qq835or-WMYKo=/510x318/top/img-s3.ilcdn.fi/745fa96806203016eccab6849f2c546d7a412a73d1efb73ef8a2c0cff864040f.jpg,C23C403E19A54BCE9CC1EEC9AEBC0E91
2022-10-13T04:05:04.000Z,"Putinin ovela peli tuottaa nyt tulosta kulissien takana – ""Kremlin tornit"" iskevät toisiaan vastaan","Putinin lähipiiri on kaventunut ja presidentti on entistäkin itsevaltaisempi. Häntä ei syrjäytetä ilman silovikkeja eli voimamiehiä, arvioi tutkija Jussi Lassila.",https://img.ilcdn.fi/YqoKgTD1t9V8t-TTrmAnP5NcEr0=/510x318/top/img-s3.ilcdn.fi/9d63b3c8674791b2655b97f03f577ae9ab6131bf15895de352a2539378b14e28.jpg,94E92E0514754469A076634EFE25953F
2022-10-13T04:15:00.000Z,"Testaa, oletko aamu- vai iltavirkku! Näin se vaikuttaa uneen ja terveyteen","Omaa kronotyyppiä ei välttämättä pysty muuttamaan, mutta tietyillä toimenpiteillä voi panostaa siihen, että saa tarpeeksi unta.",https://img.ilcdn.fi/VjsaUtAy9N1bBjX2cKh8WEkCQR8=/510x318/top/img-s3.ilcdn.fi/0134e1a1f5217d8eaa6396c5086c9456692092182f6fb06cff9b49d55c52487a.png,D38A44887BA841EE99FC30EDD2F4337C
2022-10-13T04:28:49.000Z,Khloé Kardashianin kasvoista poistettiin kasvain,Tosi-tv-tähti Khloé Kardashianin kasvoista poistettiin kasvain.,https://img.ilcdn.fi/5Gjgui0xan1H7dfVO7NgeXqLM2E=/510x318/top/img-s3.ilcdn.fi/35a28aacc2d8f7c7e86c6aa9a88abd07a2fd5ccfef347b6181dee28e272d8d5d.png,7DEA31D9D2F64982870BBC056911727E
2022-10-13T04:31:08.000Z,Kirja: Esko Aho vastaa Sberbank-kritiikkiin – ”Ei ollut mikään Putinin pankki”,"Esko Aho (kesk): ”Olen vakuuttunut siitä, että pyrkimys integraatioon kannatti, vaikka se epäonnistui.”",https://img.ilcdn.fi/DBnpoZuAuB5yW4-qhXsmU00mUkc=/510x318/top/img-s3.ilcdn.fi/d255106f91a14f8589a25e7633c7229daa1c9edab5773283de66b7fe2365e6d3.jpg,D96DD3371A6548958620F313560CBB69
2022-10-13T04:36:06.000Z,Salaliittoteoreetikko valehteli kuolleista lapsista – joutuu maksamaan lähes miljardin sakot,"Jones väitti, että vuoden 2012 Sandy Hookin kouluampuminen oli lavastettu jotta aselakeja kiristettäisiin.",https://img.ilcdn.fi/5_p2r1YiZeXuw5GWKeoLcH35sxU=/510x318/top/img-s3.ilcdn.fi/dae7e1672c813ebb39af7608e217f28d061cfb88e314284e0f679d53ac196815.jpg,C8D22F095FB74CF7B622C4AD03646CA3
2022-10-13T04:40:12.000Z,Karhut vilkuttivat herkkujen toivossa – hupaisa tilanne tallentui videolle,"Karhut olivat oppineet, että morjenstamalla ne saavat enemmän herkkuja. ",https://img.ilcdn.fi/mqb8RK8chwDmeaSPku_5iaKsw1E=/510x318/top/img-s3.ilcdn.fi/13c5d3e01ac2695038f0f9c8a6951a71d0a1748504d9acce0375b4741135b08b.jpg,77DE69B8565845788A290D8642F0DDAA
2022-10-13T05:00:18.000Z,Miten toimii digitaalinen rekisterikilpi? Ovat jo käytössä USA:ssa,Kilpeä voi hallita puhelimella ja sen alalaitaan saa kirjoitettua oman viestin.,https://img.ilcdn.fi/FDtd_2jYUR0klExQAGRz7SyXyxU=/26x0:2025x1248/510x318/top/img-s3.ilcdn.fi/1da5d1ffa3e28d5c3937c0477be30071db191362ca0b1a52ffde745caf1cd156.jpg,DC0933B1D5954822BABCAFB7D65F8E78
2022-10-13T05:17:02.000Z,Brad Lambert sai NHL-sopimuksen,Winnipoeg Jets vakuuttui luisteluvoimaisen hyökkääjän taidoista. ,https://img.ilcdn.fi/6ZHDlHSDhPtHgyLC6IvnraGmH1I=/510x318/top/img-s3.ilcdn.fi/23a021e97b249ae47d547a2f69d7bd3ade58822b5cb838234d2077042220937f.jpg,33862F1BA935449A88F871E589E51F0A
2022-10-13T05:19:05.000Z,Entinen Salkkarit-tähti Venla Savikuja: Vauva syntyi!,Venla Savikujan esikoinen on syntynyt.,https://img.ilcdn.fi/aQffbnOlBl05pZirOOtqfF9hc3o=/510x318/top/img-s3.ilcdn.fi/1f5d9206105b2fe9ef737d311bfe4512a4f997f902caf2a8f9abd723a30fea4b.jpg,0E634EA91A0743D19F674A47B91EBEC6
2022-10-13T05:30:31.000Z,"Kuka hitto haluaa herkän James Bondin? Bondin pitää olla tunnekylmä tappaja, joka ampuu miehiä ja kaataa naisia","Emme me mene katsomaan Bondeja ikääntyvän vakoojan kyynelten takia: useimmat miehet haluavat olla kuin Bond, naiset hypätä sänkyyn hänen kanssaan, kirjoittaa Iltalehden kolumnisti Sanna Ukkola.",https://img.ilcdn.fi/PZsMGVK9CwAd1US6zl4aAvmuLJ8=/510x318/top/img-s3.ilcdn.fi/57f1962180b43ff6f5033b352e8a05fd46473c0c671fe8066650ebd5c39584a5.jpg,6DAAF36E7BC34D348782E7833B7F210B
2022-10-13T05:49:24.000Z,Tältä näyttää Polestarin huikea sähköinen konsepti-roadster – IL pääsi tutustumaan ensimmäisten joukossa,Sähköautobrändi Polestar esitteli hiljaisuudessa myös avoautokonseptinsa. ,https://img.ilcdn.fi/3hZAgUf90MSaNwRwRhcRHRncWv8=/510x318/top/img-s3.ilcdn.fi/a3b482a68b240e4e4a6573445bb0b735716256738e3f378452339fc23a054c7d.jpg,BB8225869415448795EB6AB890681C47
2022-10-13T05:49:28.000Z,Tästäkö Venäjä todella suuttui? Krimin sillan alittava laivareitti voitaisiin räjäyttää tukkoon,Krimin sillan ali kulkeva laivareitti on varsin kapea ja tukkeutuisi jo yhden rahtilaivan strategisella upottamisella.,https://img.ilcdn.fi/srSP1oq5bF8Ya7ot3N8avaLi3do=/510x318/top/img-s3.ilcdn.fi/cc8516c36a7657b15b0cf22cd0782c65b44e9a8faa784a587c45fe69df9ec344.jpg,130A5ED9B9C5474683A05E61F5094945
2022-10-13T05:52:27.000Z,Katsojat tyrmistyivät: Vakiokasvo jättää The Voice -ohjelman 23 kauden jälkeen,Blake Shelton jättää The Voice -sarjan jenkkiversion.,https://img.ilcdn.fi/DOJbU6Fphv39nXXpfX6vk_G-IBU=/510x318/top/img-s3.ilcdn.fi/25b48f3cfb563155cd03d330f2b0a946d68abc72ba87a954952f36ea8b45fed1.jpg,920CB3D4F9E74354A81E42FF2A2BAD0E
2022-10-13T06:01:24.000Z,Huippumalli haussa -osallistuja saa nuhteita valokuvaajalta: ”Antoiko joku sulle luvan tulla pois?”,Marie saa nuhteita Huippumalli haussa -sarjan illan jaksossa.,https://img.ilcdn.fi/3oDqfHp0ZB_Pc56wXp9TWWVE8V8=/510x318/top/img-s3.ilcdn.fi/ec65c2a4c50ff0ea376a7a9445e16808c3e5085b4a3e7b4704a57652a493f619.png,92263849421849C085CE0226506309ED
2022-10-13T06:03:09.000Z,Kysely: Yli puolet muuttanut arkeaan taloustilanteen takia,"Tulokset kertovat, että tilanne aiheuttaa huolta erityisesti naisille ja lapsiperheille.",https://img.ilcdn.fi/bGGV5Ht-0ChuJlJdaMR5xD8p0Jk=/510x318/top/img-s3.ilcdn.fi/d3d934d2c98f6508059ec8f42df492acebc39ea7e8549be64457bf7f36026319.jpg,AFF78754FFFD4D4CA13F46563CB61EBA
2022-10-13T06:11:57.000Z,Pommiuhka Milan Jaffin oikeudenkäyntiin – Vantaan käräjäoikeudessa poikkeustilanne,Käräjäoikeuteen kohdistuu vakava uhka Vantaalla.,https://img.ilcdn.fi/tz5ucQiViiyUzBAQwfq6cppiS60=/510x318/top/img-s3.ilcdn.fi/a0e46442befa9607f0d911dd2dd6ea578e30f26df2d6d88257c614babcd8be94.jpg,F46DFB96C95C44F9A5B0386A6ADB9E74
2022-10-13T06:13:39.000Z,Paras keino lyhentää flunssaa - voi myös ehkäistä tautia,Sinkkiasetaatti on lähes ainoa keino lyhentää tavallisen flunssan kestoa.,https://img.ilcdn.fi/kyopEKUuMXBb2yDz0MPnCv1L_Ww=/510x318/top/img-s3.ilcdn.fi/a351e6a63613e774da322e9b03f433d9efa92127e21e1b018c9b25d62d779d62.jpg,FA739314396A47BFBE5A384FD853E2BC
2022-10-13T06:17:23.000Z,Vanhempi nainen ei halunnut poistua kauppakeskuksesta: istui tuulikaappiin ja yritti potkia poliiseja,"Nainen jäi kauppakeskuksen tuulikappiin istumaan, eikä suostunut poistumaan.",https://img.ilcdn.fi/63LFMIc7BP7-JVlpK2ZhOVcDUok=/510x318/top/img-s3.ilcdn.fi/f1e28d76feede138c413aaa7cc481cff0a61d99585ca54bd0f8ba86c3b8f1496.jpg,D4501080601D49E6AE282FB0DBD0467B
2022-10-13T06:30:18.000Z,Tähtiurheilijan kuolema järkytti USA:ssa –  seuran viestintäpäällikkö sai nyt 22 vuotta vankeutta,Tyler Skaggs kuoli traagisesti kolme vuotta sitten vain 27-vuotiaana.,https://img.ilcdn.fi/gHosX6PAYLxdhfn6kE6iL_4y18w=/510x318/top/img-s3.ilcdn.fi/6236dadbd8b847810aea5faba45349acb11739d709d11e69242ef962f69e5db1.jpg,A5AEBBD24E86418E93DD444E5DAB14E0
2022-10-13T06:30:36.000Z,90 päivää morsiamena -pari kriisissä perhehaaveidensa vuoksi – miehellä erikoinen keino saada vaimonsa rauhoittumaan ,"Shaeeda ja Bilal eivät ole yhtä mieltä siitä, aikovatko he yrittää yhteistä lasta. ",https://img.ilcdn.fi/OBuKbIRd7MblCSO5o9EWJ44lMVU=/510x318/top/img-s3.ilcdn.fi/1907c1658ed9c6e24cd31b4dbeaeccbec9c82760f6703d2338a4b37a9049fdb0.jpg,8294B6BA6E5646D984548DF49280BA76
2022-10-13T06:38:31.000Z,Junaratojen raideleveydet säilynevät jatkossakin Suomessa samoina: eduskunta tukee hallituksen kantaa,Eduskunnan suuri valiokunta haluaa säilyttää Suomen kansallisen harkintavallan raideleveydestä päättämisessä.,https://img.ilcdn.fi/a-D0sF7jS8yMhWfUbpkAoH91jYc=/510x318/top/img-s3.ilcdn.fi/18dcdf62eae01c6109c52d7b12405cb191bb9475d995f983a15b51185e2814f4.jpg,75F11C81467442B2BBA5F7E5159DB476
2022-10-13T07:03:37.000Z,Ulosottomies toimitti häätöä – vuokralainen iski saman tien nyrkillä,Vuokralaisen ovelle tullut ulosottomies pahoinpideltiin Helsingin Kalliossa.,https://img.ilcdn.fi/CXTv3dWvrMkrhQH1sN7MxdNEFMw=/510x318/top/img-s3.ilcdn.fi/8b4858e1f8a2db2bf512b54ce70789fe6886455ff6ed6cbe5f65eaf0bbd4a84d.jpg,498DBA9A320D4C358DC0A216D9A3DDA4
2022-10-13T07:24:55.000Z,EU-jäsenyys maksoi viime vuonna suomalaiselle 175 euroa ,"Suomen saamat tulot EU:lta kasvoivat viime vuonna 43 miljoonaa euroa, mutta tulot kasvoivat menoja vähemmän.",https://img.ilcdn.fi/FRwgimvlaRp2FR8gVVJ6v4YKhFw=/510x318/top/img-s3.ilcdn.fi/e9b1ed97d689ba62398d49097eee7468f7bc293e4597b274035dcd6ccc948730.jpg,668588EDCFD64FF88DED80E3A2DC55C3
2022-10-13T07:31:08.000Z,"""Suomen syöjä” kertoi Venäjän hyökkäyksestä joulukuussa – ei noteerattu ",Ex-pääministeri Esko Aho (kesk) nostaa uutuuskirjassaan esiin Vladimir Žirinovskin joulukuisen puheen: ”Kello neljältä aamulla 22. helmikuuta tulette tuntemaan uuden politiikkamme”.,https://img.ilcdn.fi/P7CA6XsywGU6tpa-kghrJTfr7Bs=/510x318/top/img-s3.ilcdn.fi/1f18a7766b571836966eaf6c11387bca60b63f2071fdfe4af6e9924c116a8608.jpg,E5726FC11F0E4CB7AB585AEF2BEB22A2
2022-10-13T07:34:50.000Z,Merenrantahuvilan jättimäiset ikkunat aiheuttavat huolta: ”Olisiko tätäkin pitänyt enemmän pohtia”,"Lattiasta kattoon ulottuvat ikkunat, lasiseinät ovat nykyisin suosittuja, mutta yhtä asiaa niiden valitsemisen aikana ei punnita. Grand Designs Suomi -ohjelmassa tämä ongelma tulee esiin.",https://img.ilcdn.fi/V1KcDRzvY8DF4GcQi1lcTQ5_Wso=/510x318/top/img-s3.ilcdn.fi/16c6fc5bbbc95bb2db11b1ed6c75c624042fedcca7fe3bd9b1b6c9891fa2369a.jpg,0FCFC66154EC44EBAFBAB4BD9F04A56D
2022-10-13T07:46:52.000Z,Poliisitilanne käynnissä Norjan toiseksi suurimmalla kaasukentällä,"Norjalaisella Ormen Langen kaasukentällä on käynnissä poliisitilanne, kertoo norjalaismedia VG.",null,706194260B2848A495FB4C4105147D9F
2022-10-13T07:51:08.000Z,Raportti: Viharikosepäilyt kasvaneet selkeästi – kunnianloukkaus nyt pahoinpitelyä yleisempi,Esimerkiksi seksuaaliseen suuntautumiseen ja sukupuoleen liittyviä ilmoituksia kirjattiin 85 prosenttia edellisvuotta enemmän.,https://img.ilcdn.fi/csMGx6Fazbdg9gtmkG1vip1ky-c=/510x318/top/img-s3.ilcdn.fi/19af25cc43448bb70272c8a7d802c9a134fbd6d907ac8f4122ff77db41a62867.jpg,BC418DBC798D4808AC0BEC7F623EDE92
2022-10-13T07:53:21.000Z,Arman Alizad teki itselleen tatuoinnin – epäonnistui huvittavalla tavalla,Arman Alizad tekee itselleen tatuoinnin Arman ja viidenkympin kriisi -ohjelmassa.,https://img.ilcdn.fi/fNThopZ_rSorj3d70KARIUOHtbE=/510x318/top/img-s3.ilcdn.fi/2afd77176bb77ac4a06ff2068dcee891c271740edde62de94398e0229e74c658.jpg,89BAB2F6422F46289AE445971B20AD91
2022-10-13T07:55:18.000Z,Nyt se varmistui: metrolla pääsee joulukuussa Espoon Kivenlahteen,Länsimetron jatke lisää metrokartalle viisi asemaa.,https://img.ilcdn.fi/eABy_PJH0qM3BsUlTnez8ASm1j4=/510x318/top/img-s3.ilcdn.fi/8a170addc6509f1123eb65a0d8888a21746d40c3b24988783e58a4c980fd1723.jpg,3B325532B92A4967976654B42DED8B55
2022-10-13T08:00:14.000Z,Uusi tapa valmistaa parsakaali on helppo ja älyttömän hyvä,"Parsakaali on lihaisa, herkullinen vihannes, joka taipuu myös pihveiksi. ",https://img.ilcdn.fi/zB1ftmWscpcCsQQ2FngXiA0vNNk=/0x758:2143x2097/510x318/top/img-s3.ilcdn.fi/799156d0b875b0677dd8950d621d59c1872834948ec0ecfa4283756d96e22540.jpg,6B938327A242426D9090C017C4EB44FD
2022-10-13T08:04:11.000Z,Ambulanssikuskin vastaus tyrmistyttää Venäjällä – vetosi työajan loppumiseen,Ufalaisjoukkue joutui soittamaan hätänumeroon. ,https://img.ilcdn.fi/NjSZe1U_Ba_xA7Lgqab0FX3x3WM=/510x318/top/img-s3.ilcdn.fi/246bf1ece8cfc594ac9bc1b6ea01bb3c3f91227b6fe8574a0e2e8b06e4f2a784.jpg,B56B71862BA94D839A3CBB2E47372689
2022-10-13T08:17:26.000Z,Toyota pyytää anteeksi massiivista tietovuotoa – lähes 300 000 autoilijan tiedot olivat vuosia nähtävissä,Toyotan palveluita käyttäneiden sähköpostiosoitteita ja asiakasnumeroita on ollut julkisesti saatavilla. Tietovuoto ei koske Eurooppaa.,https://img.ilcdn.fi/eKTCqE8vAnc4fcpid5UDA0FrdhQ=/510x318/top/img-s3.ilcdn.fi/1dac94209e215a67cb77bbca2235cc94d050b516fdda016a3b3bdd729ae8b592.jpg,D3AA0AA519524A0A8AD92E407B4AE137
2022-10-13T08:23:55.000Z,Supertähtien suut loksahtivat auki – 220-senttinen nuorukainen häikäisee sulavaliikkeisyydellään ,Koripalloon odotetaan uutta supertähteä Ranskasta. ,https://img.ilcdn.fi/8ixdJ9rIhtwWuueubMmnSsRVRFw=/510x318/top/img-s3.ilcdn.fi/b6ded4d79a5bf194e4f5f39903b409fae4a2997ff3f80bed01504a19c0dbff47.jpg,5C1D831A81964A26BE2D88284343E891
2022-10-13T08:32:32.000Z,Lidl vetää takaisin manteleita: saattavat sisältää metallia,"Takaisinveto koskee eriä, joiden parasta ennen -päiväys on 2.5.2023 ja 3.5.2023.",https://img.ilcdn.fi/PfYRedAN2Yy4gEesBtjI7vOJjck=/510x318/top/img-s3.ilcdn.fi/e1cd04b46112686b449f79754b9053aec8f60f0a8ef0663dbd0bfc5f4c872af1.jpg,260E9681DE004FE08411EC7339B5A447
2022-10-13T08:40:39.000Z,Karttakuva näyttää: Näin suurella alueella EU-komissio vaatii Suomea hoitamaan luontoa,"Komission tavoite on, että EU-alueella parannetaan heikennetyn luonnon tilaa esimerkiksi metsissä ja suoalueilla. Tavoitteiden laajuus ja hinta kuohuttavat Suomessa.",https://img.ilcdn.fi/8ClScWUFwQTEKcB54pb3Zbdxtoc=/510x318/top/img-s3.ilcdn.fi/75788d738972d299fd4f830bba40fa0ca35cb16089e97cb0b40d6e69369e18b5.jpg,F7C7D4F1B62943648C17ED493762DDE5
2022-10-13T08:42:30.000Z,Thelma ja Louise -tähti Geena Davisia nöyryytettiin huippuelokuvan kulisseissa – esittää hurjia väitteitä suosikkikoomikosta,"Näyttelijä Geena Davis joutui kohtamaan jo uransa alkuvaiheissa häirintää. Tähti paljastaa muistelmassaan, kuinka koomikko Bill Murray käyttäytyi epäasiallisesti häntä kohtaan.",https://img.ilcdn.fi/E3cpCxec2r9MGeHNfc00KRNN5tQ=/510x318/top/img-s3.ilcdn.fi/f15340aa130b529cb556893bf76a15d810c5ccb309fa5c58027eba0bd33ee9f4.jpg,21C14A022CC14C5EBDC92B8AB39255E7
2022-10-13T09:02:24.000Z,Hierontaa K-18-leimalla,"Suomessa toimii jopa satoja thaihierontapaikkoja. Iltalehti kävi niistä yhdessä. Toimittaja yllättyi siitä, miten härskiä ja suoraa palvelu oli. Kokenut rikosylikomisario kertoo surullisen syyn sille, miksi yhteiskunta antaa ilmiön rehottaa vuodesta toiseen.",https://img.ilcdn.fi/lfYnOt9CBqsEOVEoUX1fXvIgqBc=/510x318/top/img-s3.ilcdn.fi/15ef3d983b2eddff9dda38517d2736a8cf76156f15fce0346c1900a7b32b3d20.jpg,FDDC10DFE3154CD28B944156B249B28F
2022-10-13T09:03:24.000Z,Yhdysvaltalaisnainen paljasti huumeidenkäytön karut seuraukset – menetti kaikki hampaansa,Faith Hill taisteli kuusi vuotta huumeriippuvuutensa kanssa ja oli vieroitushoidossa teini-iästä lähtien.,https://img.ilcdn.fi/Y5dFcLXCvOql9PkwWucZDGDNFCg=/510x318/top/img-s3.ilcdn.fi/fbf57b38b0248933d29c49eadeee0e0a22f452fc050e1e8c8430b7d3b26374e2.jpg,94C49BDF12AD417397AFFB6743A3E2DC
2022-10-13T09:05:46.000Z,Sarjakaunistuja on myöntänyt kaikki petoksensa – ja jatkanut aina,Pirkanmaalla liikkuva petoksilla kaunistuja on kuluttanut käräjäoikeuden penkkiä.,https://img.ilcdn.fi/oO-FjfgPpJEc45BLkuR42gMvpwc=/510x318/top/img-s3.ilcdn.fi/5852ebdccfb26c6348b2fae69054d81746fc2a72affb3c18df4308c81391afd9.jpg,CF63DD2D3CE347459F27C7D77D64BE87
2022-10-13T09:06:40.000Z,"Kuvat paljastavat: Venäjän pommikoneiden määrä lisääntyi Suomen lähellä – Pekka Toveri kertoo, mistä on kyse","Pekka Toverin mukaan koneiden lisääminen voi olla toisaalta Venäjän pullistelua, mutta liittyä myös sotaharjoituksiin. ",https://img.ilcdn.fi/B8vBeRjvp_s0jL7LywPULV2S2RY=/510x318/top/img-s3.ilcdn.fi/c06556ef98b6fd0920a94147225647dfb6ebaf7f2a35b287a00010c78255e18d.jpg,D7D148C422BE45BA8A5A70FD021CE8DD
