paivamaara,otsikko,tiivistelma,kuva,id
2020-02-10T01:25:14.000Z,Koronavirus vaatinut jo 900 kuolonuhria Kiinassa – 40 000 tartunnan raja rikkoontui,Koronavirukseen menehtyi sunnuntaina enemmän ihmisiä kuin minään aiempana yksittäisenä päivänä.,https://img.ilcdn.fi/gNYGqOx0IzyhBdJAuX4L8U9rahw=/0x64:3000x1940/510x318/top/img-s3.ilcdn.fi/6e33b3f8b50cb3bc46b68334865972a9c743e0b552bdb588ad50ab355ed1eccb.jpg,6166786552CF460297128AE3849AB1EF
2020-02-10T01:54:44.000Z,Tässä ovat Oscar-gaalan upeimmat asut: Metallinhohtoa ja rohkeita halkioita,Iltalehti kokoaa yhteen Oscar-gaalan upeimmat asut.,https://img.ilcdn.fi/WVL7NQGJQXIGhAa9plOeuFVM0bY=/510x318/top/img-s3.ilcdn.fi/49293d2987b03384c1231bd6f93535993acecbd4bc9b5529ea541aa787ab714c.jpg,CCBE3B25B7024B58B3965BF7A8D9EC63
2020-02-10T02:20:32.000Z,Oliko tässä Oscar-gaalan erikoisin hetki? Tom Hanks punnersi punaisella matolla,Kahdesti Oscar-palkinnolla palkittu Tom Hanks yllätti Hollywood-väen punaisella matolla. ,https://img.ilcdn.fi/-wNdi6qoDEH7OCpyU-ILfXGqlco=/510x318/top/img-s3.ilcdn.fi/999edde1fb564c95d9c06ea455213e108f6ae8960ad2980031625527833c4b0d.jpg,662D18140D814E6287D1CB14ACBB4F92
2020-02-10T02:23:41.000Z,Palkintojenjakajat yrittivät naurattaa yleisöä Oscar-gaalassa – Billie Eilishin jäätävä reaktio päätyi televisioon,Laulaja Billie Eilish ei onnistunut peittelemään hämmennystään Oscar-gaalan yleisössä. ,https://img.ilcdn.fi/cIezI39SG4HaMQMqDnczTTMf1bc=/510x318/top/img-s3.ilcdn.fi/530c167134627e81820ed5cca4ab3c254fad26f775d1d992f68abf1f20c06e1e.jpg,5D6781833C2041FAABFFD042EFE3F0CD
2020-02-10T02:53:44.000Z,Patrik Laine jatkoi ahnetta tehoiluaan - Winnipegiltä upea kiri voittoon,Winnipeg Jets kohtasi Chicago Blackhawksin.,https://img.ilcdn.fi/Vce9Qdg_qUa15Bs7siOUVAEFmY0=/510x318/top/img-s3.ilcdn.fi/e472eb94710fbeebada4aef983362700c052a4bbd757560d3c43827610a06bdd.jpg,29821E5B549E4E99912229D4CCDF09D0
2020-02-10T03:00:30.000Z,Puolue vahvistaa vihdoin: Buttigieg voitti Iowan esivaalin – saa niukasti Sandersia enemmän valitsijamiehiä,Demokraattipuolueen presidenttiehdokkaaksi pyrkivä Pete Buttigieg on saanut niukan enemmistön valitsijamiehistä Iowan esivaaleissa.,https://img.ilcdn.fi/dpGtlZTifujBGHG_iQONZBTjxVs=/0x109:3000x1985/510x318/top/img-s3.ilcdn.fi/049f1c5922c01bbf9b6ec3a5c13e35afbc6cb15e7f3af446f483ffeb0ac78063.jpg,D929821457374C93A4B0592F14ACD437
2020-02-10T03:01:28.000Z,MOT: Kiinalaiset maksoivat useita kansanedustaja Mika Niikon matkoja – yhteydet tiedettyä laajemmat,Mika Niikko kieltää MOT:lle minkään valtion maksaneen hänen matkojaan. Hän myös kieltäytyy kertomasta Kiinan-matkojensa määrää tai rahoittajaa.,https://img.ilcdn.fi/ZulXy3jJOVQfZkbyOaXUz_196WY=/510x318/top/img-s3.ilcdn.fi/da73c011541ab95117dd0c509e762aed24b40a3ccdd7c1c1eb45fdc28ccb6cbe.jpg,18FF9C0F77EE45FFA1D7641CA1DB4044
2020-02-10T03:17:23.000Z,Eminem asteli Oscar-lavalle ja yllätti kaikki – yleisö taputti esitykselle seisaaltaan,"Oscar-gaalassa koettiin yllättävä hetki, kun rap-artisti Eminem asteli lavalle.",https://img.ilcdn.fi/gYjbgJcbYNtPv_2F_unApbxgT14=/510x318/top/img-s3.ilcdn.fi/9aefee220666c62ddfc771cd3655a4756f2df5844c15bc45826615cdbe3d2dfe.jpg,FB350EF681A84CB6B40E623401E327A9
2020-02-10T03:32:06.000Z,Näissä ammateissa naisten tuntipalkka on suurempi kuin miesten - katso yllättävä lista ja eurot,"Yksityisen sektorin tuntipalkkaisen säännöllisen työajan tuntiansio on keskimäärin 16,3 euroa.",https://img.ilcdn.fi/XEoIm4PFDkyOU3aF0N6zkOYrCN0=/510x318/top/img-s3.ilcdn.fi/401111cdffc75c5c5200dd208be05dc4d380f820a15096c77edab414f60210e4.png,92CEAC8AF22A485C943AC09B43D62696
2020-02-10T03:46:20.000Z,"Charlize Theronin, 44, Oscar-asu hipoo täydellisyyttä – näyttävä halkio täydentää tyylin",Charlize Theronin asuvalinta Oscar-gaalassa oli yksi illan upeimpia.,https://img.ilcdn.fi/iQMhLkEVuBPS6Hxsfh1r5WayN7A=/510x318/top/img-s3.ilcdn.fi/5b2c55be9546ba62c7cd21a5aefd276706161af9e54f4b7ea01fb32745afe045.jpg,2ED24121DBAE496DB9DEC54F33160C05
2020-02-10T03:55:00.000Z,Millä numerolla Super Bowlin MVP:ksi valittu Patrick Mahomes pelaa?,Iltalehden perinteinen urheiluvisa on myös verkossa. Montako tiedät?,https://img.ilcdn.fi/a3WsToaQ7XN3e1vrtj-WbwK7Xfo=/510x318/top/img-s3.ilcdn.fi/b3309cc9c3b70466b16236e3c46f6eb8e3190814b2d7c086f4af91f3ae605234.jpg,795C08F6F7BB40F4A2C622F24E8DA7A9
2020-02-10T04:10:33.000Z,"”Anna kakkua, anna sakkoa!” Kuusi minuuttia Kajaanissa tekivät Harri Aholasta kuuluisan valmentajan – paljastaa vihdoin avautumisen taustat: ”Saahan videosta vähän hönön kuvan”","Harri Ahola arvelee, että hänen valmennusuransa muistetaan vain ""kuudesta minuutista Kajaanissa"".",https://img.ilcdn.fi/7jntOilnwS8pgengK9lE0GiqhUM=/510x318/top/img-s3.ilcdn.fi/f90e55470c2b1dba0c274ae9816484e411dda49db2e6ce2de6daadd93203357d.jpg,E31FEE7564CD40759A23B432FD008855
2020-02-10T04:20:12.000Z,Yksinkertaista ja nopeaa: Näin Tuure Boelius hoitaa ihoaan,Nuori artisti paljasti ihonhoitovinkkinsä punaisella matolla lauantaina.,https://img.ilcdn.fi/mBmvkkUhYU7pbSdHifzSVMjyBBM=/510x318/top/img-s3.ilcdn.fi/ddcd4f323bce32f9f9fc77570d28dd2fe6d4d54cad1f4a83c742a14863fa31b3.jpg,4F46CC9B699D4DA395E420017F41C389
2020-02-10T04:28:02.000Z,Parasite voitti parhaan elokuvan palkinnon – tässä ovat kaikki Oscar-voittajat,Oscar-gaala keräsi jälleen Hollywoodin ykkösnimet saman katon alle. Tästä jutusta löydät kaikki gaalayön voittajat. ,https://img.ilcdn.fi/R4Zhfj8kHot-vaZb1AhdpwaCVwg=/510x318/top/img-s3.ilcdn.fi/3714fc2000fb7e829753e6814a48248755d1ed53b46c08254de8de99daeb7400.jpg,B8CD024A571F4092AB77444EE547420B
2020-02-10T04:41:30.000Z,"Joaquin Phoenix sai Oscarin Joker-roolistaan – piti liikuttavan puheen, jossa oli vahva viesti: Muisti traagisesti kuollutta veljeään",Näyttelijä Joaquin Phoenix nappasi parhaan miespääosan Oscarin roolillaan elokuvassa Joker. ,https://img.ilcdn.fi/lJlPtDP80Jseu9njYadJgB41q5o=/510x318/top/img-s3.ilcdn.fi/7976eeb64194d21c84454fc496e352daf900a40091edd68e0fd7f985fdeffe2c.jpg,347E60942533462286063BF760934A7A
2020-02-10T04:42:33.000Z,Eva Wahlströmin äiti esitti tyttärelleen toiveen: ”Se tuntui aika raa’alta” – riittääkö vahvuus uran lopettamiseen?,Eva Wahlström menetti MM-vyönsä lauantaina Sheffieldissa. Ottelu saattaa jäädä hienon uran viimeiseksi.,https://img.ilcdn.fi/nntJBg21zOYJZ2lA4iKLnubgQbg=/510x318/top/img-s3.ilcdn.fi/ce7b2e31fa84874677b01b072eb8c428f44886ec1f81d68329ce5e962c9f9923.jpg,BFA25707C0F1468B859897E2EA3DD68C
2020-02-10T05:00:00.000Z,"Tässä 5 faktaa, jotka sinunkin täytyy tietää kulutusluotoista ja pikavipeistä",Käytä 2 minuuttia fiksusti ja lue kattava opas kulutusluotoista täältä – voit muuttaa lopullisesti omaa rahankäyttöäsi!,https://img.ilcdn.fi/7Skz-uQc-cUXRCTXBWd8Ars5nOs=/510x318/top/img-s3.ilcdn.fi/be3a270f614653bf4e135cb82fb7bb41a853caef62508b18b936b01f05aa1553.jpg,235C597CC0E24DC9A181354A58EA5757
2020-02-10T05:00:00.000Z,"Niesmann+Bischoff tähtää täydellisyyteen - Tässä matkailuautossa on kaikki, mitä nautiskelija tarvitsee","Käsityönä valmistetussa Flair 920EK:ssa on panostettu laadukkaisiin materiaaleihin ja innovatiivisiin ratkaisuihin, eikä ylellisyydessäkään ole säästelty.",https://img.ilcdn.fi/gvf2PjZV7Jp2vbMfRipO2MnTxIc=/510x318/top/img-s3.ilcdn.fi/9d3056708659d7b6c41359b3eb33094691143f7731116fef6b6b764e6d859cbc.jpg,6E6D5C632C9A441BBC927AADB40CCF25
2020-02-10T05:03:06.000Z,Näin Isis toimii suljetuissa someryhmissä Ruotsissa,Ryhmissä Isis asetetaan uhrin rooliin. ,https://img.ilcdn.fi/HYHyBaGM60fLvD0Ty0eHJX-eFCQ=/510x318/top/img-s3.ilcdn.fi/a0853359600ebf60a242bd7e682b699e25c0fee362cf3592196bedda4660f72a.jpg,C8270454159F4CE99371E4B5B0098A1C
2020-02-10T05:03:17.000Z,"Mitä Oscar-gaalassa tapahtui? Tässä kaikki, mitä sinun tulee tietää yön käänteistä","Jos haluat päästä kärryille Oscar-yön tärkeimmistä tapahtumista, lue tämä juttu. ",https://img.ilcdn.fi/FeXR-h2FaKiwXQlpBW5FqsmMKVU=/510x318/top/img-s3.ilcdn.fi/e79baa91a83ba9ad95ecdf4a7939997c8d96169a321ab6db53987a0f2ab173c1.jpg,9E09341061974A76B95730020164210B
2020-02-10T05:04:30.000Z,Edelleen sinkku,"Juontaja ja media-alan yrittäjä Jonna Joutsen, 28, ei sovi sinkkustereotypioihin ja puhuu rohkeasti vaikeasta aiheesta.",https://img.ilcdn.fi/JXliORmV1YzNIiav2yJe3bUBDSc=/510x318/top/img-s3.ilcdn.fi/ea99937a18346642759783845467b24a1d081f5541d3f41babc44f8442f4e767.jpg,FBA4BB0219FE4E40825114D0BBA0DC3A
2020-02-10T05:10:34.000Z,Karmea vekki otsaan – miten tällaisen päätällin jälkeen saa jatkaa peliä? ”Hän ei pelännyt mitään”,"Coventry Cityn Callum O’Hare sai kovan tällin päähänsä, mutta jatkoi silti peliä.",https://img.ilcdn.fi/f29ndmllsVs9qBWmWmm2q2wFMpA=/510x318/top/img-s3.ilcdn.fi/c45fc623c33b0679da794d6791a30b85a3e8cb621b103737f585713e92657123.jpg,73D378158BED4029A7FF81C7F5159553
2020-02-10T05:34:20.000Z,"Veitset, lusikat ja haarukat: missä järjestyksessä ruokailuvälineet ovat? Tässä helppo muistisääntö","Ruokailuvälineiden järjestys säilytyslokerossa herättää helposti keskustelun siitä, mikä on oikeajärjestys.",https://img.ilcdn.fi/bmnSHBeqEyxQwdDUExdb5qHq0iY=/510x318/top/img-s3.ilcdn.fi/e26a38f0af8cbaeab3761822ec29501e213c26095dd96dfc459e452401d24403.jpg,996082FF668942DA83CB5E65D36CC1B4
2020-02-10T05:35:23.000Z,Unelmahäät-ohjelmassa sulhanen järjesti kaikkien aikojen kosinnan: ”Osti koko kaupan tyhjäksi ruusuista”,Joensuussa asuvat Riina ja Aleksi avioituvat Unelmahäät-ohjelman seuraavassa jaksossa.,https://img.ilcdn.fi/qQ4iGHGl6leb06vzEvHAoIEB6s0=/0x385:2002x1636/510x318/top/img-s3.ilcdn.fi/7e5b0606a974e0fe875960edcb1c61eccf0e74762aedb2181644215dde2b7392.jpg,FA98563BE27D4837888C9A7D6AEABBF3
2020-02-10T05:35:43.000Z,Pilkkasi aasialaista miestä ja naureskeli koronavirukselle – itsensä nolannut jalkapallomiljonääri pyysi käytöstään anteeksi,Dele Alli jakoi Snapchatissa hämmentävän videon.,https://img.ilcdn.fi/k5y68N_qNQjEWCou1W560Eev0hE=/0x390:3000x2266/510x318/top/img-s3.ilcdn.fi/f819097edf07ef3580a61d0267b87dd1e215017e1534f16fbb09ead170194e30.jpg,8E8A04E5D43B4C6EAA6A8DE7D7371BF8
2020-02-10T05:46:56.000Z,Huomasitko? Leonardo DiCaprio toi 22-vuotiaan mallirakkaansa Oscar-gaalaan,"DiCaprio esitteli mallirakkaansa kollegoilleen, vaikka ei poseerannutkaan tämän kanssa yhteiskuvissa punaisella matolla.",https://img.ilcdn.fi/BGZrjZ4kZ-TkYwWhjoNmM63FFQQ=/510x318/top/img-s3.ilcdn.fi/45619148c96b52f1c69be6abd7313e13ce1301deb4ede69ebc5158e2c57fda9f.jpg,432FF903004143FCB15BF2F1C3F8246F
2020-02-10T05:59:32.000Z,Näin asuntojen arvon romahdukseen voitaisiin vaikuttaa – esillä jopa romutuspalkkio,Aluetutkijan mukaan todennäköisimmät keinot liittyvät verotukseen ja lainojen takauksiin.,https://img.ilcdn.fi/fa-lJ2njHtKntHv6hoWZjhakVZA=/510x318/top/img-s3.ilcdn.fi/573c4ddad71e24d1fc796fcf65cd4575817be99ce33dcb19f8eec3d5b97a8a15.png,BD288BBC152147BCB7171693825CA547
2020-02-10T06:18:23.000Z,Kurikka mainittu! BBC ihastelee ikäihmisten ilmaista kuntosalia pohjalaiskaupungissa,"Yli 65-vuotiaat saavat palveluseteleitä, joilla pääsevät maksutta kuntosalille.",https://img.ilcdn.fi/g4Ga2mQez7-D6ZFNMgRHaTOLpzA=/510x318/top/img-s3.ilcdn.fi/28edeec57b95526a37b34b51d748337f0ff8dfa9896df2599637c7eeb6de3fa0.jpg,5C2056870E9343658EE3B7F71ED9D359
2020-02-10T06:22:07.000Z,"Jari-Matti Latvala kertoo uudesta työstään: ""Sanoin, että olen ehdottomasti kiinnostunut""",Jari-Matti Latvala on siirtynyt täyspäiväiseksi yrittäjäksi.,https://img.ilcdn.fi/8ZOBhEQcFekNfd2rnCoBn0qu5cs=/510x318/top/img-s3.ilcdn.fi/9aebfa59d9867ce8c5ff066a413a5ec045068a1761a894ac38bbf1378b456451.jpg,ACCD009192784855B50FB4998B79C3D1
2020-02-10T06:31:50.000Z,Suomessa rakennuksilla työskentelevä virolaisnainen organisoi massiivisia huume-eriä Virosta Suomeen – jo toinen tapaus lyhyen ajan sisään,"Virolaisnainen ei ollut itse toimittanut huumeita Suomeen, mutta oli organisoinut tuonnin.",https://img.ilcdn.fi/mcaiwVuATzxvS5GmmyLD1DQviMk=/510x318/top/img-s3.ilcdn.fi/5e43182ad9d95a7f40e22315f10a709e6a1b78574271f58717c581dd324e6cc5.jpg,F7924445EF724D79AFBEF9806C73644B
2020-02-10T06:33:21.000Z,Sotaveteraani Tauno Tikkanen on kuollut,"Tunnettu sotaveteraani Tauno Tikkanen, 103, on kuollut sunnuntaina.",https://img.ilcdn.fi/BM7L3x9dayBXk7JHRv0L3cnSVZM=/510x318/top/img-s3.ilcdn.fi/e67fdad90b768238d829933ee9d8806dda802bb8fe49ceb0108d96a32c955101.jpg,DDAEE840F9354B0AB4BA77D3DC6F2320
2020-02-10T06:36:34.000Z,Myrskytuuli riepotteli matkustajakonetta Englannissa – lentäjältä upea laskeutuminen,Ciara-myrsky moukaroi Britanniaa sunnuntaina.,https://img.ilcdn.fi/UbQYMongyEOwDIdvd9EKvGbUrBg=/510x318/top/img-s3.ilcdn.fi/3979d5cf7e3049cdc942d9560a2730ed9b1b2ab6655422270f5b05f7005b8dfc.jpg,F640BC8676164D748FFDA0854C284544
2020-02-10T06:40:06.000Z,Minttu Kaulanen julkaisi pysäyttävän kuvan muodonmuutoksestaan – laihtunut hurjasti: ”Huikea muutos”,"Kyläkauppias Sampo Kaulasen puoliso Michele ”Minttu” Murphy-Kaulanen julkaisi kuvaparin, joka paljastaa, että hän on hoikistunut 1,5 vuodessa hurjasti.",https://img.ilcdn.fi/ESbsT3VD7veY7bOvCAQ17XU8sTE=/510x318/top/img-s3.ilcdn.fi/cc0299528304dde9874c6079892fe4e14a56fcb77113b4df593197be654b4332.jpg,2B70E3EE69514FEF843EEB520CC3261E
2020-02-10T06:41:30.000Z,"IL-Studio: Nähtiinkö viime yönä kaikkien aikojen Oscar-gaala? ”Tämä oli historiallinen ilta, maanjäristys”","Iltalehden Oscar-gaalastudio ruoti tuoreeltaan, mitä elokuva-akatemian 92. gaalasta jäi käteen.",https://img.ilcdn.fi/pRQZsWJcajuwe9f4gtLeRIKdNJc=/510x318/top/img-s3.ilcdn.fi/ae1c1c6e78f62db8db991e158e725560bdeb6fc4f83a6a56c4b3fa1f5acebf3e.jpg,59EF89867CF64BC8AD504895E973C801
2020-02-10T07:03:51.000Z,Huumevyyhdin käsittely jatkui: Sofia Belórf kiirehti pois oikeudesta – kommentoi jaksamistaan Iltalehdelle,Huumevyyhdin syytetyt ovat vastanneet tänään syytteisiin.,https://img.ilcdn.fi/GNYt-BRf_i0asz5kjKX4HgLgc00=/510x318/top/img-s3.ilcdn.fi/c0766c2aacd73b3f0dc3f380317b479f0e6b6edb9b0dbd489506a4796af87f5e.jpg,51A9715A137340409CB1822650B3797A
2020-02-10T07:09:17.000Z,Mikael Forssell jakoi videon hulvattomasta hyökkäyksestä – ”Ehkä vuosisadan maali”,PSG:n ja Lyonin välisessä ottelussa nähtiin läjä maaleja.,https://img.ilcdn.fi/ixsXov8XEexGuC3p6Ugxi9wS0e0=/0x68:1516x1016/510x318/top/img-s3.ilcdn.fi/3b99f9f596e6292c39aff9f943860ee487b4b60a080f931f468f5d9d065227c4.jpg,2D7F507735A149CFA7ED47D1168912CB
2020-02-10T07:24:42.000Z,"Rahan pyytämistä ruokaan, elämää ilman omaa pankkitiliä... Tunnistatko taloudellisen väkivallan? ","Luottotietojen menettämistä, pakottamista läheisen riippuvuuden rahoittamiseen, elämistä ilman omaa tiliä ja pankkikorttia… Taloudellinen väkivalta on yllättävän yleistä, ja se aiheuttaa samankaltaista häpeää ja syyllisyyttä kuin muukin väkivalta.",https://img.ilcdn.fi/Ht7zIWXNMA-pPfOqScfrQONAq-I=/510x318/top/img-s3.ilcdn.fi/8662a39a099ef91089495aaa61a3efc332c9f04bd85650f65965a0c2da17e616.jpeg,7975092DA02B45BD9796709881F6A224
2020-02-10T07:36:27.000Z,Jari-Matti Latvala ei tunne katkeruutta – ”Kalle Rovanperä on seuraava suomalainen maailmanmestari”,"Jari-Matti Latvala ei tunne katkeruutta Kalle Rovanperää kohtaan, vaikka 19-vuotias superlupaus työnsikin hänet Toyota-tallista työttömäksi. ",https://img.ilcdn.fi/LL5JRR77UTX6_f6mEa4RnDhy07I=/510x318/top/img-s3.ilcdn.fi/9a0e4afe0532df8b53ffdb62b1d59b2bd672b70790cf60b8f8059bb5c640b2e8.jpg,83294E213BBE4A75A31D80E88E5AFC64
2020-02-10T07:45:37.000Z,Dimka-kissan paleltuneet tassut amputoitiin – katso kuvat eläinlääkärien upeasta ratkaisusta!,Siperiassa vammautunut kissa on jo tottunut keinotekoisiin tassuihinsa.,https://img.ilcdn.fi/oxq5gxgDVog3VjLS8EzWzzG9Frw=/510x318/top/img-s3.ilcdn.fi/5edb82d9d3dc5af677404ef153aee0d10f98b4bbf64da259c2ffb92eab8f72e9.jpg,28A89F2DF072484A8ED5EFB98CE8ECFE
2020-02-10T08:02:32.000Z,Suora lähetys käynnissä:  Ministeri Harakka ja virkamiehet listaavat taksiuudistuksen ongelmia ,Ministeri lupaili ongelmiin ”nopeaa korjaussarjaa”.,https://img.ilcdn.fi/QllPutQGNX9WLaRvP6zru7Xe9hQ=/510x318/top/img-s3.ilcdn.fi/2d1f6bf02f5c22dc73c6e444145b581c8ccce0e749d7d70974e7fd90cb5a870c.jpg,149EE3AF1B344E8DAFBE20493E6FF762
2020-02-10T08:03:11.000Z,Kriitikko tuhosi 20 000 dollarin arvoisen teoksen taidenäyttelyssä Meksikossa ,Teos ei ollut kriitikon mieleen.,https://img.ilcdn.fi/ejRSco5_91sjws7aCG6d5vC29rw=/510x318/top/img-s3.ilcdn.fi/b00f0e25de61f17cc3d892f1a11ddc437a9a1e82201da27228779493e23cf475.jpg,B5B5DA2FDF5A46B696AA2A178D4AB584
2020-02-10T08:09:40.000Z,”Rangaistuksen pitää olla kovempi kuin Therese Johaugilla” – ruotsalaistähdelle vaaditaan pitkää pannaa dopingkärystä,Expressen-lehden Tomas Pettersson vaatii dopingista kärähtäneelle Jenny Franssonille kovaa rangaistusta.,https://img.ilcdn.fi/naDlldTPhWm59Q2Wr1qh4ezzjk8=/0x104:3000x1979/510x318/top/img-s3.ilcdn.fi/5abf80fcebc982f53e1e099f8fd990748a02cf1a2ff8a6573072d4ae57b15348.jpg,044CAA612F254D5F8878EF49AEFDE53D
2020-02-10T08:10:38.000Z,Suosittu brittijuontaja tuli kaapista – 27 vuotta naimisissa vaimonsa kanssa: ”Olen hyväksynyt homouteni”,"Brittijuontaja toivoo löytävänsä nyt rauhan itsensä kanssa, kun on julkistanut asian.",https://img.ilcdn.fi/eIssGUBVxRNL2uRiIaw_jFVK6m0=/510x318/top/img-s3.ilcdn.fi/209b3c85d2380700040b726a4a6dce96a5e26b028e22bd44962919d942e6dd96.jpg,1D5AA7F2FFB64078A2E122660EFA74C7
2020-02-10T08:28:30.000Z,Android-puhelimeesi saatetaan pystyä tunkeutumaan Bluetoothin avulla – päivitä laite heti tai sulje yhteys jos sinulla on tällainen puhelin,Haavoittuvuuden avulla voidaan varastaa käyttäjän tietoja.,https://img.ilcdn.fi/fm9T2MroGdP-ATzzaFCrMQSwJLM=/510x318/top/img-s3.ilcdn.fi/dfabc1074d416773abb50874c59928a40d01d4d9c7da1146c9fd589cb58ecfe1.jpg,986C400A6C2E43989CCBD50495B4383A
2020-02-10T08:35:34.000Z,Silja Symphonyn outo mutkittelu merellä hämmensi – laivayhtiö selittää: ”Siellä ei ole matkustajia ollenkaan”,Tallink Siljan viestintäjohtajan mukaan alus on matkalla telakalle.,https://img.ilcdn.fi/Gm2osuLni_VruPIUFShq40OlSgA=/510x318/top/img-s3.ilcdn.fi/2b948115f71d2e7642d05b3e5d10ef46891da5611dc5988f853bc902130b1070.jpg,1ACE254E430B409EBE47065200C9B004
2020-02-10T08:39:31.000Z,Jättitutkimus: Syöpään liittyvät merkit voivat näkyä jo vuosikymmeniä ennen sairauden toteamista,"Syöpä voisi antaa merkkejä jopa kymmeniä vuosia ennen kuin se diagnosoidaan, selviää suurtutkimuksesta. Sen mukaan tulevaisuudessa syöpä voitaisiin saada kiinni paljon aiemmin.",https://img.ilcdn.fi/93-wtTbMKhSfz4K7Xj-oS6WDsUY=/510x318/top/img-s3.ilcdn.fi/a00838ff76078eab8ea61d2101c6e390c9a52bd24f8567f8f81c9f9d930a75f0.jpg,EE6E0B9443B74E99B09B6C01B23A392C
2020-02-10T08:53:20.000Z,Paino putosi yhtäkkiä yli kymmenen kiloa – karu tauti yllätti ruotsalaisen NHL-kiekkoilijan,Calle Järnkrokin vuosi alkoi ikävissä merkeissä.,https://img.ilcdn.fi/9yCsJP7qOdJ_HWhHF9CQ5_q7gB0=/0x64:3000x1940/510x318/top/img-s3.ilcdn.fi/3f24166cc146545000f1dee7dfa4a18dc948bf917ae2e20ad3b78ec94fe65781.jpg,82E30FF568F24AAFA724D11C3B9B41BD
2020-02-10T09:00:02.000Z,Vain pari vuotta vanhan Koivusaaren metroaseman lattiassa halkeamia - suljetaan lähes koko kesäksi,Reilut kaksi vuotta käytössä olleen metroaseman laiturista on löydetty halkeamia.,https://img.ilcdn.fi/B6R6BfGgZ6MWvA-a7a0ZmJUj5jQ=/510x318/top/img-s3.ilcdn.fi/ef814694d721b51890771cc6971f5ebcb51feb26455b38fe0b2866784c1785ce.jpg,AACB3E50EB304C1AAD1F1C82C84EF4D2
2020-02-10T09:11:32.000Z,"Metsäpalot, tulvat ja aavikoituminen uhkaavat tulevaisuuden Eurooppa - pohjoisen talvet jatkossa vetisiä","Isoja alueita Ranskasta, Portugalista ja Espanjasta aavikoituu, jos ilmaston lämpenemistä ei saada pian aisoihin.",https://img.ilcdn.fi/uoxEJa4n8DXZm1Z3I3XF-V0V4WQ=/510x318/top/img-s3.ilcdn.fi/55e95918e2ded357ff85ca333a22c4a3775e53c6c838109dc2d4732d549a47bc.jpg,F76C6C0FFE3A42C9A6ABD1292D769EBE
2020-02-10T09:21:51.000Z,"Stam1nan Antti Hyyrynen kirjoitti kirjan ympäristökatastrofista, mutta ei paasaa: ""Ajan autoa ja harrastan lentomatkailua""",Kirjoista tehdään monesti elokuvia. Metalliyhtye Stam1nan laulajakitaristi Antti Hyyrynen kirjoitti musiikkialbumista Viimeinen Atlantis kirjan Viimeinen Atlantis.,https://img.ilcdn.fi/29LegE2MKpxCuYN4Vw8sXP-8mcY=/510x318/top/img-s3.ilcdn.fi/a4f3832efed21f733eb33e1367a2a8e3a5577cda888ca53b49c6ffd8973f705b.jpg,EEA3227892AC4A1082CA8483D72362E5
2020-02-10T09:33:22.000Z,Mieheni on nalkuttava ämmä,"Kotitöillä on suora vaikutus parisuhteeseen ja seksielämään, kirjoittaa seksuaaliterapeutti Marja Kihlström.",https://img.ilcdn.fi/cEiUZNkx915zlzPG3Hw77OyUtBw=/510x318/top/img-s3.ilcdn.fi/fea3e2a9a768d607b84586e74e57dfa7b6e710ae5610194127a6653c930a982a.jpg,1743B7FB079F4D3D8D54CD477FFD93CA
2020-02-10T09:36:54.000Z,"Päivän ravivihje: Toto65, Kaustinen ja Kouvola",Magic Mondayn Toto65-kohteet järjestetään vuorotellen Kaustisella ja Kouvolassa.,NULL,84EDC71AB72E49ED971AD294F8B26825
2020-02-10T09:43:06.000Z,Jenna unohti koirasta poimimansa punkit kuukausiksi lasipurkkiin – lopputuloksena kammottava punkkiyllätys: katso kuvat ja video,Jenna Talvitielle punkit ovat tulleet tutuiksi Vaasan saaristossa.,https://img.ilcdn.fi/QGdlDqPJ-i6YMwcWvhm3z8e6F80=/510x318/top/img-s3.ilcdn.fi/934b13ede8e7829ea9e00c9411f930704268645f1aa542d6b680124de22c546c.jpg,E39AE112FB8A48A095430AFF7568CA03
2020-02-10T09:45:13.000Z,F-35 -hävittäjät nyt testissä - matka Suomeen viivästyi päiviä myrskyn takia,Kaksi F-35 hävittäjää saapui eilen iltahämärässä Pirkkalan tukikohtaan ja kaksi muuta saapuvat vielä tänään.,https://img.ilcdn.fi/PQgTi9biwagIsBHi6X_csPaC0Po=/510x318/top/img-s3.ilcdn.fi/c15d69bae84e1aa8e30909175ab9119f2962b68bb5a551faa3cbcd6a7cd0987b.jpg,558DC167227645FFBBF4F0B06FED267D
2020-02-10T09:51:34.000Z,Onko Iivo Niskasen paras hiihto jo nähty? Toni Roponen tuo esiin suomalaishiihtäjän taktiset virheet,Iltalehden asiantuntija Toni Roponen ruotii Iivo Niskasen tilannetta.,https://img.ilcdn.fi/7bKNjP1_hNXxegOFyTcZeK0H0hg=/510x318/top/img-s3.ilcdn.fi/4ff59d6e1e68a341695b6fdeea3a3ff17da3bcf40c53334f8e1a26d994cb93fc.jpg,71523612E6244114A3CE544A73A3BC21
2020-02-10T10:03:28.000Z,Merkelin seuraajaksi kaavailtu AKK luopuu - CDU tarvitsee nyt uuden liittokansleriehdokkaan,Annegret Kramp-Karrenbauer eli AKK jättää myös CDU:n puheenjohtajuuden kesällä.,https://img.ilcdn.fi/KeWZhA1Pni0c0Npus0INqFmpU90=/510x318/top/img-s3.ilcdn.fi/0b47abf4f57b732feba8bb10b87fdc6f7791dc3d84935088e7ebcd4a61bad6f5.jpg,6F3D84406CA7480CA910B71767C5A1DB
2020-02-10T10:12:34.000Z,Poliisioperaatio ammattioppilaitoksessa Tampereella: Uhkaava henkilö otettu kiinni,Hälytys paikalle annettiin kello 11.22.,https://img.ilcdn.fi/-21XqpRBqVC_W4oj3KNAKkGmN1c=/510x318/top/img-s3.ilcdn.fi/1ab8ac93e2dd4e159b59e6b5de0c4e5a42ae91e9fc1273a34617f85a0de43abe.jpg,9E2BADF159EB45259CE6704C98F93C4A
2020-02-10T10:20:02.000Z,Kuntien päästöt listattiin ensimmäistä kertaa – Tutkija: kuntia ei kannata rankata ”hyviin” ja ”huonoihin”  ,Asiantuntija: Päästöt vähentyneet koko maassa.,https://img.ilcdn.fi/MO9CGs3EyDBYI2uywwAm51Aee2c=/510x318/top/img-s3.ilcdn.fi/ae073e3b1011e7d2166945e7f493e4a808a0284a825de944444f680223e51af0.jpg,FBF6FEB8103545D595F3328BBC16BCA7
2020-02-10T10:21:59.000Z,"Supo tutkii kohta taustasi, jos kuljetat ammatiksesi tavaraa lentokentälle ",Sanna Marinin (sd) hallituksen lakiesitys toisi 9 500 uutta työntekijää suojelupoliisin turvaselvitysten piiriin.,https://img.ilcdn.fi/nt0xcXtR4lgRgTBB7yqKdVxuEs0=/510x318/top/img-s3.ilcdn.fi/a922f8f46b6952e0f28ae2430615372d3ecb962d0abe9688ac49606d4fb0a1f6.jpeg,95E431BE3B994FFB8B7760C16F3E426B
2020-02-10T10:22:02.000Z,Uutta tietoa Pamela Andersonin erosta – pika-avioliitto päättyi tekstiviestillä ,Pamela Anderson jätettiin kahdentoista päivän jälkeen tekstiviestillä. ,https://img.ilcdn.fi/S0RgGDZtXfrUiLj1eIJp1Zy6qBw=/0x545:2001x1796/510x318/top/img-s3.ilcdn.fi/4b483ccd1e8e4d8a9b15f43c4cf0ae22ff47963a2f485aed1ebb9d1207f56587.jpg,6878B81412DB488EAF5E04CC04BE0F0D
2020-02-10T10:22:03.000Z,Kanuunakisa luvassa? Kalle Rovanperä myhäilee toiveikkaana Ruotsin MM-rallin alla: ”Sen pitäisi olla paljon helpompi minulle”,"Kalle Rovanperä toivoo, että Ruotsin MM-ralli pystyttäisiin ajamaan lumella.",https://img.ilcdn.fi/35xwxCMun2Qpd2cSNIPWlFiyL20=/0x64:3000x1940/510x318/top/img-s3.ilcdn.fi/4b0d6f4bcabb62eb970bb45fd861d527834b0034f6554ebf61ca651e9ef7cc50.jpg,5C93028319584346B6F569D01D0225C1
2020-02-10T10:40:04.000Z,Onko tässä kaikkien aikojen epämukavin iltapuku? Kylie Jennerin gaalatyyli kääntää päät,"Meikkimogulina tunnettu Kylie Jenner kertoo, kannattaako kauneuden puolesta kärsiä.",https://img.ilcdn.fi/yVzsgzOadQXVCzp7wphvqMYJDKw=/510x318/top/img-s3.ilcdn.fi/ea169581b1b958d383642d1a5746f014afcada03bce97a6822a7c532a7e7ec0c.jpg,9233ECEC32F146588BE7A73BE7EBE0F4
2020-02-10T10:44:21.000Z,Työntekijät saivat harrastaa työajalla 3 tuntia – Tulos: sairauspoissaolot vähenivät selvästi,Smartumin työntekijät ovat käyttäneet esimerkiksi ulkoiluun ja kuntosaleihin.,https://img.ilcdn.fi/d-o0nsxNhPSzBiF5EnOE8ZuHB98=/510x318/top/img-s3.ilcdn.fi/892b4e8a5844c0c5e12896e484ff54f1c1a5b478a08422887148d658e1c30eb9.png,B278AD9F87E34C2B8163AA5D0F43C5CD
2020-02-10T10:52:55.000Z,Herkullinen paljastus Ferrarin uudesta F1-autosta: Kunnianosoitus vanhalle mestarille – italialaistalli yrittää peitellä suorituskykyään,Ferrari paljastaa uuden F1-autonsa tiistaina Reggio Emilian kaupunginteatterissa.,https://img.ilcdn.fi/2fUCHExpBmpKSuiqcZmLdtXAnWE=/510x318/top/img-s3.ilcdn.fi/cd01f80d0cd4eeb4b4d2d7fd63e5008f6079700b4bdb17e2ff2497000bd61b36.jpg,0282BCD89FFF4EA693152832AB349C5D
